[32m[I 2022-05-08 18:50:05,556][0m Trial 175 finished with value: 0.5 and parameters: {'loss': 'coxph', 'learning_rate': 1.3141804366723847e-06, 'n_estimators': 754, 'criterion': 'friedman_mse', 'min_samples_split': 9, 'min_samples_leaf': 1, 'min_weight_fraction_leaf': 0.3202856422802015, 'min_impurity_decrease': 0.19671190334369376, 'max_features': 0.8907124491201863, 'subsample': 0.6121602505238818, 'dropout_rate': 0.9340435029888855, 'ccp_alpha': 0.5559577385547645}. Best is trial 130 with value: 0.7466373356025244.[0m
[32m[I 2022-05-08 19:19:00,029][0m Trial 176 finished with value: 0.7393764757476943 and parameters: {'loss': 'coxph', 'learning_rate': 2.1874439472881596e-06, 'n_estimators': 913, 'criterion': 'friedman_mse', 'min_samples_split': 9, 'min_samples_leaf': 1, 'min_weight_fraction_leaf': 0.29860344318987075, 'min_impurity_decrease': 0.2664790486396966, 'max_features': 0.9335245696285703, 'subsample': 0.5775821915090377, 'dropout_rate': 0.9441208699967049, 'ccp_alpha': 0.2770584922659547}. Best is trial 130 with value: 0.7466373356025244.[0m
[32m[I 2022-05-08 19:47:36,403][0m Trial 177 finished with value: 0.7393764757476943 and parameters: {'loss': 'coxph', 'learning_rate': 2.050194934916067e-06, 'n_estimators': 913, 'criterion': 'friedman_mse', 'min_samples_split': 9, 'min_samples_leaf': 1, 'min_weight_fraction_leaf': 0.33224189415942856, 'min_impurity_decrease': 0.257682712250979, 'max_features': 0.9496797207501649, 'subsample': 0.5772416197917525, 'dropout_rate': 0.9591833359406752, 'ccp_alpha': 0.286054228295043}. Best is trial 130 with value: 0.7466373356025244.[0m
[32m[I 2022-05-08 20:16:05,602][0m Trial 178 finished with value: 0.5 and parameters: {'loss': 'coxph', 'learning_rate': 2.205271938641551e-06, 'n_estimators': 903, 'criterion': 'friedman_mse', 'min_samples_split': 9, 'min_samples_leaf': 1, 'min_weight_fraction_leaf': 0.2953931185598823, 'min_impurity_decrease': 0.2593110464050028, 'max_features': 0.9629514462820987, 'subsample': 0.5665431556023135, 'dropout_rate': 0.953045464750859, 'ccp_alpha': 0.38067166038131234}. Best is trial 130 with value: 0.7466373356025244.[0m
[32m[I 2022-05-08 20:44:08,218][0m Trial 179 finished with value: 0.5 and parameters: {'loss': 'coxph', 'learning_rate': 1.570644397402533e-06, 'n_estimators': 900, 'criterion': 'friedman_mse', 'min_samples_split': 9, 'min_samples_leaf': 1, 'min_weight_fraction_leaf': 0.2806742216132424, 'min_impurity_decrease': 0.21194932516617182, 'max_features': 0.9375324870112599, 'subsample': 0.6424508270383724, 'dropout_rate': 0.9520102340527736, 'ccp_alpha': 0.7458658080762898}. Best is trial 130 with value: 0.7466373356025244.[0m
/media/san2_ssd/data/Workdir/survival/venv/lib/python3.8/site-packages/sksurv/ensemble/boosting.py:955: RuntimeWarning: divide by zero encountered in log
  time = numpy.log(time)
/media/san2_ssd/data/Workdir/survival/venv/lib/python3.8/site-packages/sksurv/ensemble/boosting.py:955: RuntimeWarning: divide by zero encountered in log
  time = numpy.log(time)
/media/san2_ssd/data/Workdir/survival/venv/lib/python3.8/site-packages/sksurv/ensemble/boosting.py:955: RuntimeWarning: divide by zero encountered in log
  time = numpy.log(time)
/media/san2_ssd/data/Workdir/survival/venv/lib/python3.8/site-packages/sksurv/ensemble/boosting.py:955: RuntimeWarning: divide by zero encountered in log
  time = numpy.log(time)
/media/san2_ssd/data/Workdir/survival/venv/lib/python3.8/site-packages/sksurv/ensemble/boosting.py:955: RuntimeWarning: divide by zero encountered in log
  time = numpy.log(time)
[32m[I 2022-05-08 20:44:08,268][0m Trial 180 finished with value: -1.0 and parameters: {'loss': 'squared', 'learning_rate': 2.210753590950299e-06, 'n_estimators': 912, 'criterion': 'friedman_mse', 'min_samples_split': 9, 'min_samples_leaf': 1, 'min_weight_fraction_leaf': 0.33842795320607677, 'min_impurity_decrease': 0.24174313494792435, 'max_features': 0.8397120015311427, 'subsample': 0.587319865236503, 'dropout_rate': 0.9199711922630291, 'ccp_alpha': 0.49201169003845824}. Best is trial 130 with value: 0.7466373356025244.[0m
[32m[I 2022-05-08 21:08:39,476][0m Trial 181 finished with value: 0.7390316331016178 and parameters: {'loss': 'coxph', 'learning_rate': 1.453532080774325e-06, 'n_estimators': 781, 'criterion': 'friedman_mse', 'min_samples_split': 9, 'min_samples_leaf': 1, 'min_weight_fraction_leaf': 0.3108816682363398, 'min_impurity_decrease': 0.33360871433176864, 'max_features': 0.8738600626500039, 'subsample': 0.5842402441487659, 'dropout_rate': 0.9487350705102296, 'ccp_alpha': 0.28415219382576706}. Best is trial 130 with value: 0.7466373356025244.[0m
[32m[I 2022-05-08 21:34:03,608][0m Trial 182 finished with value: 0.7393764757476943 and parameters: {'loss': 'coxph', 'learning_rate': 3.836543227129603e-06, 'n_estimators': 792, 'criterion': 'friedman_mse', 'min_samples_split': 9, 'min_samples_leaf': 1, 'min_weight_fraction_leaf': 0.3088603126626245, 'min_impurity_decrease': 0.27172625087186586, 'max_features': 0.9128743914881693, 'subsample': 0.5150683777653593, 'dropout_rate': 0.9587204413391485, 'ccp_alpha': 0.2894290061222162}. Best is trial 130 with value: 0.7466373356025244.[0m
[32m[I 2022-05-08 22:03:11,829][0m Trial 183 finished with value: 0.7393764757476943 and parameters: {'loss': 'coxph', 'learning_rate': 4.066454533374627e-06, 'n_estimators': 901, 'criterion': 'friedman_mse', 'min_samples_split': 9, 'min_samples_leaf': 1, 'min_weight_fraction_leaf': 0.3029194411307904, 'min_impurity_decrease': 0.2696171526748961, 'max_features': 0.9116373326341463, 'subsample': 0.4997864929085342, 'dropout_rate': 0.9593406738720414, 'ccp_alpha': 0.2941522475666141}. Best is trial 130 with value: 0.7466373356025244.[0m
[32m[I 2022-05-08 22:33:03,575][0m Trial 184 finished with value: 0.5 and parameters: {'loss': 'coxph', 'learning_rate': 2.3913339291850013e-06, 'n_estimators': 923, 'criterion': 'friedman_mse', 'min_samples_split': 9, 'min_samples_leaf': 1, 'min_weight_fraction_leaf': 0.3084181270694758, 'min_impurity_decrease': 0.2858199080642267, 'max_features': 0.9197715852938393, 'subsample': 0.49415297255665447, 'dropout_rate': 0.9616255887886308, 'ccp_alpha': 0.41566982516397055}. Best is trial 130 with value: 0.7466373356025244.[0m
[32m[I 2022-05-08 23:02:11,009][0m Trial 185 finished with value: 0.7393764757476943 and parameters: {'loss': 'coxph', 'learning_rate': 4.0994864370004135e-06, 'n_estimators': 896, 'criterion': 'friedman_mse', 'min_samples_split': 9, 'min_samples_leaf': 1, 'min_weight_fraction_leaf': 0.2956350330806954, 'min_impurity_decrease': 0.18439713907875532, 'max_features': 0.8686077101021825, 'subsample': 0.5001626478102267, 'dropout_rate': 0.9426067223753097, 'ccp_alpha': 0.33183030309293887}. Best is trial 130 with value: 0.7466373356025244.[0m
[32m[I 2022-05-08 23:29:50,603][0m Trial 186 finished with value: 0.5 and parameters: {'loss': 'coxph', 'learning_rate': 4.21199578013715e-06, 'n_estimators': 855, 'criterion': 'friedman_mse', 'min_samples_split': 9, 'min_samples_leaf': 1, 'min_weight_fraction_leaf': 0.3303301635344971, 'min_impurity_decrease': 0.2402072374515432, 'max_features': 0.9600273716377236, 'subsample': 0.4780714760827748, 'dropout_rate': 0.9728254002490058, 'ccp_alpha': 0.5221632982858332}. Best is trial 130 with value: 0.7466373356025244.[0m
[32m[I 2022-05-08 23:58:13,724][0m Trial 187 finished with value: 0.7407440164060434 and parameters: {'loss': 'coxph', 'learning_rate': 3.6852391881988297e-06, 'n_estimators': 891, 'criterion': 'friedman_mse', 'min_samples_split': 9, 'min_samples_leaf': 2, 'min_weight_fraction_leaf': 0.3500863941179827, 'min_impurity_decrease': 0.2745678404281032, 'max_features': 0.9320390508135763, 'subsample': 0.519831633711572, 'dropout_rate': 0.9664406620806422, 'ccp_alpha': 0.10845242499806529}. Best is trial 130 with value: 0.7466373356025244.[0m
[32m[I 2022-05-09 00:29:21,358][0m Trial 188 finished with value: 0.5 and parameters: {'loss': 'coxph', 'learning_rate': 6.453389782588244e-06, 'n_estimators': 944, 'criterion': 'friedman_mse', 'min_samples_split': 9, 'min_samples_leaf': 2, 'min_weight_fraction_leaf': 0.34803067920361863, 'min_impurity_decrease': 0.1792646731455209, 'max_features': 0.9381384308421555, 'subsample': 0.45652549579058066, 'dropout_rate': 0.9573774750540353, 'ccp_alpha': 0.3891542383304801}. Best is trial 130 with value: 0.7466373356025244.[0m
[32m[I 2022-05-09 00:58:44,681][0m Trial 189 finished with value: 0.7393764757476943 and parameters: {'loss': 'coxph', 'learning_rate': 4.4561371026954264e-06, 'n_estimators': 890, 'criterion': 'friedman_mse', 'min_samples_split': 9, 'min_samples_leaf': 1, 'min_weight_fraction_leaf': 0.2904301907448593, 'min_impurity_decrease': 0.2709611796248496, 'max_features': 0.8743189209617893, 'subsample': 0.5010898094045569, 'dropout_rate': 0.905312233452358, 'ccp_alpha': 0.3049109597194722}. Best is trial 130 with value: 0.7466373356025244.[0m
[32m[I 2022-05-09 01:26:43,995][0m Trial 190 finished with value: 0.7579334685336429 and parameters: {'loss': 'coxph', 'learning_rate': 3.6061893842125497e-06, 'n_estimators': 879, 'criterion': 'friedman_mse', 'min_samples_split': 8, 'min_samples_leaf': 2, 'min_weight_fraction_leaf': 0.263903061084109, 'min_impurity_decrease': 0.2348020442105206, 'max_features': 0.9826595782452437, 'subsample': 0.524210705522908, 'dropout_rate': 0.9724964086603685, 'ccp_alpha': 0.13833481023082794}. Best is trial 190 with value: 0.7579334685336429.[0m
[32m[I 2022-05-09 01:55:04,581][0m Trial 191 finished with value: 0.753319165662828 and parameters: {'loss': 'coxph', 'learning_rate': 3.7987591964158828e-06, 'n_estimators': 902, 'criterion': 'friedman_mse', 'min_samples_split': 8, 'min_samples_leaf': 2, 'min_weight_fraction_leaf': 0.26642687249715563, 'min_impurity_decrease': 0.22267474928915457, 'max_features': 0.977897304419819, 'subsample': 0.561454227300489, 'dropout_rate': 0.9729169707556989, 'ccp_alpha': 0.1094374067594499}. Best is trial 190 with value: 0.7579334685336429.[0m
[32m[I 2022-05-09 02:24:44,950][0m Trial 192 finished with value: 0.7393764757476943 and parameters: {'loss': 'coxph', 'learning_rate': 3.771652099151896e-06, 'n_estimators': 896, 'criterion': 'friedman_mse', 'min_samples_split': 8, 'min_samples_leaf': 2, 'min_weight_fraction_leaf': 0.2725636063374061, 'min_impurity_decrease': 0.22689963684739123, 'max_features': 0.9863496643875459, 'subsample': 0.5109730371742126, 'dropout_rate': 0.8932383520477621, 'ccp_alpha': 0.11163946366182478}. Best is trial 190 with value: 0.7579334685336429.[0m
[32m[I 2022-05-09 02:53:30,641][0m Trial 193 finished with value: 0.7721311423051299 and parameters: {'loss': 'coxph', 'learning_rate': 3.851241432119619e-06, 'n_estimators': 897, 'criterion': 'friedman_mse', 'min_samples_split': 8, 'min_samples_leaf': 2, 'min_weight_fraction_leaf': 0.264278982719281, 'min_impurity_decrease': 0.22433848140575635, 'max_features': 0.9757646197057035, 'subsample': 0.5057810369062482, 'dropout_rate': 0.9766111568649625, 'ccp_alpha': 0.07332446626068752}. Best is trial 193 with value: 0.7721311423051299.[0m
[32m[I 2022-05-09 03:22:08,427][0m Trial 194 finished with value: 0.762740376853448 and parameters: {'loss': 'coxph', 'learning_rate': 3.910103067361829e-06, 'n_estimators': 886, 'criterion': 'friedman_mse', 'min_samples_split': 8, 'min_samples_leaf': 2, 'min_weight_fraction_leaf': 0.2631103329922989, 'min_impurity_decrease': 0.22211543912378545, 'max_features': 0.9852184197873383, 'subsample': 0.501738915584781, 'dropout_rate': 0.9624938578126072, 'ccp_alpha': 0.10296098984845255}. Best is trial 193 with value: 0.7721311423051299.[0m
[32m[I 2022-05-09 03:52:05,031][0m Trial 195 finished with value: 0.7579313541152016 and parameters: {'loss': 'coxph', 'learning_rate': 3.977097563167699e-06, 'n_estimators': 936, 'criterion': 'friedman_mse', 'min_samples_split': 8, 'min_samples_leaf': 2, 'min_weight_fraction_leaf': 0.26462882543320687, 'min_impurity_decrease': 0.2172257961686439, 'max_features': 0.9856621070917047, 'subsample': 0.5211439518678213, 'dropout_rate': 0.9672601555098003, 'ccp_alpha': 0.11489419939681106}. Best is trial 193 with value: 0.7721311423051299.[0m
[32m[I 2022-05-09 04:21:57,114][0m Trial 196 finished with value: 0.7579334685336429 and parameters: {'loss': 'coxph', 'learning_rate': 3.7498085467886584e-06, 'n_estimators': 931, 'criterion': 'friedman_mse', 'min_samples_split': 8, 'min_samples_leaf': 2, 'min_weight_fraction_leaf': 0.2628615363509575, 'min_impurity_decrease': 0.22458029469589622, 'max_features': 0.983403270806428, 'subsample': 0.5095839152644028, 'dropout_rate': 0.9709989663541584, 'ccp_alpha': 0.1100044983040359}. Best is trial 193 with value: 0.7721311423051299.[0m
[32m[I 2022-05-09 04:51:49,015][0m Trial 197 finished with value: 0.7579313541152016 and parameters: {'loss': 'coxph', 'learning_rate': 5.242728287590763e-06, 'n_estimators': 932, 'criterion': 'friedman_mse', 'min_samples_split': 8, 'min_samples_leaf': 2, 'min_weight_fraction_leaf': 0.26438276445088815, 'min_impurity_decrease': 0.22268725921721166, 'max_features': 0.9974130799429782, 'subsample': 0.5146199796592721, 'dropout_rate': 0.969511048641954, 'ccp_alpha': 0.11684445601126767}. Best is trial 193 with value: 0.7721311423051299.[0m
[32m[I 2022-05-09 05:21:24,457][0m Trial 198 finished with value: 0.757726300422577 and parameters: {'loss': 'coxph', 'learning_rate': 5.551533599998394e-06, 'n_estimators': 930, 'criterion': 'friedman_mse', 'min_samples_split': 8, 'min_samples_leaf': 2, 'min_weight_fraction_leaf': 0.2657078026600233, 'min_impurity_decrease': 0.22154801858492737, 'max_features': 0.9987727205168105, 'subsample': 0.5256297237919298, 'dropout_rate': 0.9741025940307508, 'ccp_alpha': 0.09986084157034379}. Best is trial 193 with value: 0.7721311423051299.[0m
[32m[I 2022-05-09 05:51:10,626][0m Trial 199 finished with value: 0.7533243308156464 and parameters: {'loss': 'coxph', 'learning_rate': 5.4719953414664435e-06, 'n_estimators': 939, 'criterion': 'friedman_mse', 'min_samples_split': 8, 'min_samples_leaf': 2, 'min_weight_fraction_leaf': 0.26690669745614126, 'min_impurity_decrease': 0.2211574276232327, 'max_features': 0.9906507632202443, 'subsample': 0.5363748254727535, 'dropout_rate': 0.9740782473948063, 'ccp_alpha': 0.10680336879792535}. Best is trial 193 with value: 0.7721311423051299.[0m
[32m[I 2022-05-09 06:21:25,079][0m Trial 200 finished with value: 0.7582923882470329 and parameters: {'loss': 'coxph', 'learning_rate': 5.645899291991498e-06, 'n_estimators': 949, 'criterion': 'friedman_mse', 'min_samples_split': 8, 'min_samples_leaf': 2, 'min_weight_fraction_leaf': 0.2646547748113866, 'min_impurity_decrease': 0.21772265149298187, 'max_features': 0.9984950580417435, 'subsample': 0.5224463464290733, 'dropout_rate': 0.9759128142420307, 'ccp_alpha': 0.09847700499527169}. Best is trial 193 with value: 0.7721311423051299.[0m
[32m[I 2022-05-09 06:51:27,818][0m Trial 201 finished with value: 0.7627549359959679 and parameters: {'loss': 'coxph', 'learning_rate': 6.747027377333121e-06, 'n_estimators': 945, 'criterion': 'friedman_mse', 'min_samples_split': 8, 'min_samples_leaf': 2, 'min_weight_fraction_leaf': 0.258507104790073, 'min_impurity_decrease': 0.16456675319234887, 'max_features': 0.9980058987338561, 'subsample': 0.5288234357649932, 'dropout_rate': 0.9741306029274726, 'ccp_alpha': 0.10655775193741107}. Best is trial 193 with value: 0.7721311423051299.[0m
[32m[I 2022-05-09 07:21:44,534][0m Trial 202 finished with value: 0.762740376853448 and parameters: {'loss': 'coxph', 'learning_rate': 6.419145470051815e-06, 'n_estimators': 949, 'criterion': 'friedman_mse', 'min_samples_split': 8, 'min_samples_leaf': 2, 'min_weight_fraction_leaf': 0.2617810910851505, 'min_impurity_decrease': 0.16277782975812505, 'max_features': 0.9990998573754588, 'subsample': 0.5230016011692674, 'dropout_rate': 0.9713974512269704, 'ccp_alpha': 0.09670867905584904}. Best is trial 193 with value: 0.7721311423051299.[0m
[32m[I 2022-05-09 07:51:56,758][0m Trial 203 finished with value: 0.7537078427355789 and parameters: {'loss': 'coxph', 'learning_rate': 6.410561135861835e-06, 'n_estimators': 948, 'criterion': 'friedman_mse', 'min_samples_split': 8, 'min_samples_leaf': 2, 'min_weight_fraction_leaf': 0.26547374523792944, 'min_impurity_decrease': 0.15791738574636915, 'max_features': 0.9950373680913993, 'subsample': 0.5220529749959452, 'dropout_rate': 0.9769493483697602, 'ccp_alpha': 0.10120266343686468}. Best is trial 193 with value: 0.7721311423051299.[0m
[32m[I 2022-05-09 08:22:13,728][0m Trial 204 finished with value: 0.7582923882470329 and parameters: {'loss': 'coxph', 'learning_rate': 7.150741574917228e-06, 'n_estimators': 952, 'criterion': 'friedman_mse', 'min_samples_split': 8, 'min_samples_leaf': 2, 'min_weight_fraction_leaf': 0.2628952089036532, 'min_impurity_decrease': 0.15749035982389137, 'max_features': 0.999912281814102, 'subsample': 0.5264053085261904, 'dropout_rate': 0.974704320218122, 'ccp_alpha': 0.09677568304939044}. Best is trial 193 with value: 0.7721311423051299.[0m
[32m[I 2022-05-09 08:53:38,983][0m Trial 205 finished with value: 0.7627497708431493 and parameters: {'loss': 'coxph', 'learning_rate': 5.653786068004371e-06, 'n_estimators': 994, 'criterion': 'friedman_mse', 'min_samples_split': 8, 'min_samples_leaf': 2, 'min_weight_fraction_leaf': 0.2616599286398999, 'min_impurity_decrease': 0.15932779365188585, 'max_features': 0.9986058526314415, 'subsample': 0.5372861537588772, 'dropout_rate': 0.9804364088924208, 'ccp_alpha': 0.09995401022801688}. Best is trial 193 with value: 0.7721311423051299.[0m
[32m[I 2022-05-09 09:25:27,763][0m Trial 206 finished with value: 0.7627528215775266 and parameters: {'loss': 'coxph', 'learning_rate': 6.742375073099589e-06, 'n_estimators': 1000, 'criterion': 'friedman_mse', 'min_samples_split': 8, 'min_samples_leaf': 2, 'min_weight_fraction_leaf': 0.2616644711713467, 'min_impurity_decrease': 0.16433807007313242, 'max_features': 0.9994895899689654, 'subsample': 0.5292392889121471, 'dropout_rate': 0.9742970346676575, 'ccp_alpha': 0.10225078007878098}. Best is trial 193 with value: 0.7721311423051299.[0m
[32m[I 2022-05-09 09:55:48,892][0m Trial 207 finished with value: 0.7627476564247079 and parameters: {'loss': 'coxph', 'learning_rate': 6.999212531363351e-06, 'n_estimators': 953, 'criterion': 'friedman_mse', 'min_samples_split': 8, 'min_samples_leaf': 2, 'min_weight_fraction_leaf': 0.26112558939957536, 'min_impurity_decrease': 0.1318710469643452, 'max_features': 0.9969851809738349, 'subsample': 0.5243190906474574, 'dropout_rate': 0.9744006624456911, 'ccp_alpha': 0.09956924732995576}. Best is trial 193 with value: 0.7721311423051299.[0m
[32m[I 2022-05-09 10:26:19,206][0m Trial 208 finished with value: 0.7582923882470329 and parameters: {'loss': 'coxph', 'learning_rate': 7.183576586581332e-06, 'n_estimators': 957, 'criterion': 'friedman_mse', 'min_samples_split': 8, 'min_samples_leaf': 2, 'min_weight_fraction_leaf': 0.2638641657131913, 'min_impurity_decrease': 0.15528575993759247, 'max_features': 0.9992431709985639, 'subsample': 0.5270673855455738, 'dropout_rate': 0.9713665251555247, 'ccp_alpha': 0.09548718049506623}. Best is trial 193 with value: 0.7721311423051299.[0m
[32m[I 2022-05-09 10:56:46,882][0m Trial 209 finished with value: 0.7624484871348595 and parameters: {'loss': 'coxph', 'learning_rate': 6.783321740578978e-06, 'n_estimators': 960, 'criterion': 'friedman_mse', 'min_samples_split': 8, 'min_samples_leaf': 2, 'min_weight_fraction_leaf': 0.2623035940370213, 'min_impurity_decrease': 0.12616043049848663, 'max_features': 0.9972849671847713, 'subsample': 0.5325802432073263, 'dropout_rate': 0.9761828703809302, 'ccp_alpha': 0.09237096988436162}. Best is trial 193 with value: 0.7721311423051299.[0m
[32m[I 2022-05-09 11:28:24,407][0m Trial 210 finished with value: 0.7579386336864615 and parameters: {'loss': 'coxph', 'learning_rate': 7.501812981108148e-06, 'n_estimators': 996, 'criterion': 'friedman_mse', 'min_samples_split': 8, 'min_samples_leaf': 2, 'min_weight_fraction_leaf': 0.26335701969429426, 'min_impurity_decrease': 0.12494009736544748, 'max_features': 0.9986902451726092, 'subsample': 0.5353074709434769, 'dropout_rate': 0.9733835027617013, 'ccp_alpha': 0.10348295779629305}. Best is trial 193 with value: 0.7721311423051299.[0m
[32m[I 2022-05-09 11:59:53,303][0m Trial 211 finished with value: 0.7627549359959679 and parameters: {'loss': 'coxph', 'learning_rate': 7.013457372867904e-06, 'n_estimators': 994, 'criterion': 'friedman_mse', 'min_samples_split': 8, 'min_samples_leaf': 2, 'min_weight_fraction_leaf': 0.2604845399467028, 'min_impurity_decrease': 0.13008088731355996, 'max_features': 0.9978130707382804, 'subsample': 0.5395861682717855, 'dropout_rate': 0.9769174057752966, 'ccp_alpha': 0.09443848703936333}. Best is trial 193 with value: 0.7721311423051299.[0m
[32m[I 2022-05-09 12:31:31,053][0m Trial 212 finished with value: 0.7627549359959679 and parameters: {'loss': 'coxph', 'learning_rate': 7.367738643921639e-06, 'n_estimators': 997, 'criterion': 'friedman_mse', 'min_samples_split': 8, 'min_samples_leaf': 2, 'min_weight_fraction_leaf': 0.26005004240466756, 'min_impurity_decrease': 0.13356706007745223, 'max_features': 0.9990920427701466, 'subsample': 0.533688471806873, 'dropout_rate': 0.9782210303615269, 'ccp_alpha': 0.10181864704535751}. Best is trial 193 with value: 0.7721311423051299.[0m
