[32m[I 2022-05-08 04:06:03,619][0m Trial 137 finished with value: 0.5 and parameters: {'loss': 'coxph', 'learning_rate': 6.000386361334289e-06, 'n_estimators': 759, 'criterion': 'friedman_mse', 'min_samples_split': 9, 'min_samples_leaf': 1, 'min_weight_fraction_leaf': 0.3991439138781899, 'min_impurity_decrease': 0.4641553371106305, 'max_features': 0.6749667512430152, 'subsample': 0.7025240077796313, 'dropout_rate': 0.9443004351986531, 'ccp_alpha': 0.5998904912314271}. Best is trial 130 with value: 0.7466373356025244.[0m
[32m[I 2022-05-08 04:28:39,833][0m Trial 138 finished with value: 0.7333085653829052 and parameters: {'loss': 'coxph', 'learning_rate': 3.5406650742437502e-06, 'n_estimators': 731, 'criterion': 'friedman_mse', 'min_samples_split': 9, 'min_samples_leaf': 1, 'min_weight_fraction_leaf': 0.37716936066804696, 'min_impurity_decrease': 0.4277782595339654, 'max_features': 0.6483327488721048, 'subsample': 0.7594748316431693, 'dropout_rate': 0.9774768512939007, 'ccp_alpha': 0.29649938010160154}. Best is trial 130 with value: 0.7466373356025244.[0m
[32m[I 2022-05-08 04:51:33,520][0m Trial 139 finished with value: 0.7333035877992838 and parameters: {'loss': 'coxph', 'learning_rate': 2.8348078316693823e-06, 'n_estimators': 746, 'criterion': 'friedman_mse', 'min_samples_split': 9, 'min_samples_leaf': 1, 'min_weight_fraction_leaf': 0.3793572464053192, 'min_impurity_decrease': 0.5089170824548935, 'max_features': 0.6491903234380263, 'subsample': 0.7311878764121609, 'dropout_rate': 0.9797847360542332, 'ccp_alpha': 0.18807265294947964}. Best is trial 130 with value: 0.7466373356025244.[0m
[32m[I 2022-05-08 05:14:24,051][0m Trial 140 finished with value: 0.5894476872922862 and parameters: {'loss': 'coxph', 'learning_rate': 1.6155978578738928e-06, 'n_estimators': 740, 'criterion': 'friedman_mse', 'min_samples_split': 9, 'min_samples_leaf': 1, 'min_weight_fraction_leaf': 0.3850146621985904, 'min_impurity_decrease': 0.43994708561684576, 'max_features': 0.6499860995198026, 'subsample': 0.6710438398769318, 'dropout_rate': 0.940376629206955, 'ccp_alpha': 0.3201688283740072}. Best is trial 130 with value: 0.7466373356025244.[0m
[32m[I 2022-05-08 05:36:10,559][0m Trial 141 finished with value: 0.7376501332769761 and parameters: {'loss': 'coxph', 'learning_rate': 2.690358506560137e-06, 'n_estimators': 709, 'criterion': 'friedman_mse', 'min_samples_split': 9, 'min_samples_leaf': 1, 'min_weight_fraction_leaf': 0.36901920818846706, 'min_impurity_decrease': 0.5059523841392036, 'max_features': 0.6286694979284556, 'subsample': 0.7247956455370073, 'dropout_rate': 0.9735781346092426, 'ccp_alpha': 0.16407433288010126}. Best is trial 130 with value: 0.7466373356025244.[0m
[32m[I 2022-05-08 06:01:22,307][0m Trial 142 finished with value: 0.733691186900463 and parameters: {'loss': 'coxph', 'learning_rate': 2.4117733193430583e-06, 'n_estimators': 816, 'criterion': 'friedman_mse', 'min_samples_split': 9, 'min_samples_leaf': 1, 'min_weight_fraction_leaf': 0.37688949821935763, 'min_impurity_decrease': 0.48434349017803446, 'max_features': 0.6522511305015909, 'subsample': 0.7290654686805468, 'dropout_rate': 0.969215277928395, 'ccp_alpha': 0.16737710061650982}. Best is trial 130 with value: 0.7466373356025244.[0m
[32m[I 2022-05-08 06:23:33,827][0m Trial 143 finished with value: 0.7366567744275033 and parameters: {'loss': 'coxph', 'learning_rate': 2.465894843629451e-06, 'n_estimators': 718, 'criterion': 'friedman_mse', 'min_samples_split': 9, 'min_samples_leaf': 1, 'min_weight_fraction_leaf': 0.37030151721164256, 'min_impurity_decrease': 0.3682765562756495, 'max_features': 0.6552199063195212, 'subsample': 0.7333725716925683, 'dropout_rate': 0.9639372180937692, 'ccp_alpha': 0.18838435630462413}. Best is trial 130 with value: 0.7466373356025244.[0m
[32m[I 2022-05-08 06:45:37,076][0m Trial 144 finished with value: 0.5 and parameters: {'loss': 'coxph', 'learning_rate': 1.0514002348025508e-06, 'n_estimators': 716, 'criterion': 'friedman_mse', 'min_samples_split': 9, 'min_samples_leaf': 1, 'min_weight_fraction_leaf': 0.37389241095633285, 'min_impurity_decrease': 0.5105610961814641, 'max_features': 0.6575973360637068, 'subsample': 0.7273418493279901, 'dropout_rate': 0.9660397560767812, 'ccp_alpha': 0.45760635582905584}. Best is trial 130 with value: 0.7466373356025244.[0m
[32m[I 2022-05-08 07:10:32,922][0m Trial 145 finished with value: 0.7399226446835783 and parameters: {'loss': 'coxph', 'learning_rate': 1.934800319293232e-06, 'n_estimators': 822, 'criterion': 'friedman_mse', 'min_samples_split': 9, 'min_samples_leaf': 1, 'min_weight_fraction_leaf': 0.349506160067524, 'min_impurity_decrease': 0.474947130893255, 'max_features': 0.6123510579811408, 'subsample': 0.6853972608656772, 'dropout_rate': 0.9907626128123221, 'ccp_alpha': 0.1722796344128312}. Best is trial 130 with value: 0.7466373356025244.[0m
[32m[I 2022-05-08 07:32:53,160][0m Trial 146 finished with value: 0.7400316018615252 and parameters: {'loss': 'coxph', 'learning_rate': 1.938416247314165e-06, 'n_estimators': 738, 'criterion': 'friedman_mse', 'min_samples_split': 9, 'min_samples_leaf': 1, 'min_weight_fraction_leaf': 0.35304889918594545, 'min_impurity_decrease': 0.47431591360155073, 'max_features': 0.6189006075785355, 'subsample': 0.6807287166638755, 'dropout_rate': 0.9911207786494037, 'ccp_alpha': 0.1788158082913598}. Best is trial 130 with value: 0.7466373356025244.[0m
[32m[I 2022-05-08 07:55:07,845][0m Trial 147 finished with value: 0.5 and parameters: {'loss': 'coxph', 'learning_rate': 2.0300975788752253e-06, 'n_estimators': 735, 'criterion': 'friedman_mse', 'min_samples_split': 9, 'min_samples_leaf': 1, 'min_weight_fraction_leaf': 0.33601985525321293, 'min_impurity_decrease': 0.4752627186955087, 'max_features': 0.6118665223370894, 'subsample': 0.6874283340311755, 'dropout_rate': 0.9910103876656552, 'ccp_alpha': 0.6509844034394663}. Best is trial 130 with value: 0.7466373356025244.[0m
[32m[I 2022-05-08 08:19:36,095][0m Trial 148 finished with value: 0.740009980306781 and parameters: {'loss': 'coxph', 'learning_rate': 2.4786846226257282e-06, 'n_estimators': 826, 'criterion': 'friedman_mse', 'min_samples_split': 9, 'min_samples_leaf': 1, 'min_weight_fraction_leaf': 0.3573474174424308, 'min_impurity_decrease': 0.3548494395941279, 'max_features': 0.5543418501288293, 'subsample': 0.7501686008492924, 'dropout_rate': 0.9998766980621917, 'ccp_alpha': 0.1933566337773496}. Best is trial 130 with value: 0.7466373356025244.[0m
[32m[I 2022-05-08 08:39:13,419][0m Trial 149 finished with value: 0.5 and parameters: {'loss': 'coxph', 'learning_rate': 4.39365564293789e-06, 'n_estimators': 655, 'criterion': 'friedman_mse', 'min_samples_split': 9, 'min_samples_leaf': 1, 'min_weight_fraction_leaf': 0.35230508892682516, 'min_impurity_decrease': 0.4577506593893642, 'max_features': 0.5603795248972379, 'subsample': 0.7230479354684369, 'dropout_rate': 0.9973063762540928, 'ccp_alpha': 0.3713942483160278}. Best is trial 130 with value: 0.7466373356025244.[0m
/media/san2_ssd/data/Workdir/survival/venv/lib/python3.8/site-packages/sksurv/ensemble/boosting.py:955: RuntimeWarning: divide by zero encountered in log
  time = numpy.log(time)
/media/san2_ssd/data/Workdir/survival/venv/lib/python3.8/site-packages/sksurv/ensemble/boosting.py:955: RuntimeWarning: divide by zero encountered in log
  time = numpy.log(time)
/media/san2_ssd/data/Workdir/survival/venv/lib/python3.8/site-packages/sksurv/ensemble/boosting.py:955: RuntimeWarning: divide by zero encountered in log
  time = numpy.log(time)
/media/san2_ssd/data/Workdir/survival/venv/lib/python3.8/site-packages/sksurv/ensemble/boosting.py:955: RuntimeWarning: divide by zero encountered in log
  time = numpy.log(time)
/media/san2_ssd/data/Workdir/survival/venv/lib/python3.8/site-packages/sksurv/ensemble/boosting.py:955: RuntimeWarning: divide by zero encountered in log
  time = numpy.log(time)
[32m[I 2022-05-08 08:39:13,467][0m Trial 150 finished with value: -1.0 and parameters: {'loss': 'squared', 'learning_rate': 2.513492140162396e-06, 'n_estimators': 596, 'criterion': 'friedman_mse', 'min_samples_split': 9, 'min_samples_leaf': 1, 'min_weight_fraction_leaf': 0.3634054341135837, 'min_impurity_decrease': 0.3823209553894934, 'max_features': 0.6109436862372086, 'subsample': 0.7476788387442972, 'dropout_rate': 0.9792204047193083, 'ccp_alpha': 0.48188547592982645}. Best is trial 130 with value: 0.7466373356025244.[0m
[32m[I 2022-05-08 09:03:52,083][0m Trial 151 finished with value: 0.7371081812316556 and parameters: {'loss': 'coxph', 'learning_rate': 1.8816899102771519e-06, 'n_estimators': 834, 'criterion': 'friedman_mse', 'min_samples_split': 9, 'min_samples_leaf': 1, 'min_weight_fraction_leaf': 0.37107504742398467, 'min_impurity_decrease': 0.36403912919286174, 'max_features': 0.7122790629491746, 'subsample': 0.6730398310538008, 'dropout_rate': 0.9994548776957368, 'ccp_alpha': 0.17275770974311838}. Best is trial 130 with value: 0.7466373356025244.[0m
[32m[I 2022-05-08 09:29:02,815][0m Trial 152 finished with value: 0.7333035877992838 and parameters: {'loss': 'coxph', 'learning_rate': 1.7168745834660422e-06, 'n_estimators': 820, 'criterion': 'friedman_mse', 'min_samples_split': 9, 'min_samples_leaf': 1, 'min_weight_fraction_leaf': 0.3789546441128882, 'min_impurity_decrease': 0.36103520286976754, 'max_features': 0.717407651307774, 'subsample': 0.628596641614789, 'dropout_rate': 0.9753782730787582, 'ccp_alpha': 0.16173430980884376}. Best is trial 130 with value: 0.7466373356025244.[0m
[32m[I 2022-05-08 09:53:22,365][0m Trial 153 finished with value: 0.7365680202772743 and parameters: {'loss': 'coxph', 'learning_rate': 1.8500358608524645e-06, 'n_estimators': 825, 'criterion': 'friedman_mse', 'min_samples_split': 9, 'min_samples_leaf': 1, 'min_weight_fraction_leaf': 0.3724068211237681, 'min_impurity_decrease': 0.31045762661813625, 'max_features': 0.714178266809408, 'subsample': 0.6468468429614221, 'dropout_rate': 0.9996430898650075, 'ccp_alpha': 0.19730643309079454}. Best is trial 130 with value: 0.7466373356025244.[0m
[32m[I 2022-05-08 10:18:28,078][0m Trial 154 finished with value: 0.7358032250909123 and parameters: {'loss': 'coxph', 'learning_rate': 1.7299649397743534e-06, 'n_estimators': 829, 'criterion': 'friedman_mse', 'min_samples_split': 9, 'min_samples_leaf': 1, 'min_weight_fraction_leaf': 0.37512178876205826, 'min_impurity_decrease': 0.3568939704470119, 'max_features': 0.7146763688229409, 'subsample': 0.6251798658070798, 'dropout_rate': 0.9945732281431355, 'ccp_alpha': 0.18383406867112131}. Best is trial 130 with value: 0.7466373356025244.[0m
[32m[I 2022-05-08 10:43:17,470][0m Trial 155 finished with value: 0.7365680202772743 and parameters: {'loss': 'coxph', 'learning_rate': 1.753172988682392e-06, 'n_estimators': 830, 'criterion': 'friedman_mse', 'min_samples_split': 9, 'min_samples_leaf': 1, 'min_weight_fraction_leaf': 0.3725572608157796, 'min_impurity_decrease': 0.30923532291588607, 'max_features': 0.7678344644203576, 'subsample': 0.6297001331515011, 'dropout_rate': 0.9983043885562469, 'ccp_alpha': 0.1842579665679852}. Best is trial 130 with value: 0.7466373356025244.[0m
[32m[I 2022-05-08 11:06:11,692][0m Trial 156 finished with value: 0.7374600160940215 and parameters: {'loss': 'coxph', 'learning_rate': 1.2665741307993425e-06, 'n_estimators': 763, 'criterion': 'friedman_mse', 'min_samples_split': 9, 'min_samples_leaf': 1, 'min_weight_fraction_leaf': 0.36902625023999885, 'min_impurity_decrease': 0.30144028084190105, 'max_features': 0.7703620887886397, 'subsample': 0.6546745587568573, 'dropout_rate': 0.9967366112112347, 'ccp_alpha': 0.20287633295643362}. Best is trial 130 with value: 0.7466373356025244.[0m
[32m[I 2022-05-08 11:29:24,831][0m Trial 157 finished with value: 0.5 and parameters: {'loss': 'coxph', 'learning_rate': 1.2479163265690068e-06, 'n_estimators': 765, 'criterion': 'friedman_mse', 'min_samples_split': 9, 'min_samples_leaf': 1, 'min_weight_fraction_leaf': 0.3469068344933458, 'min_impurity_decrease': 0.31548377127349114, 'max_features': 0.77489579736575, 'subsample': 0.6053496745558659, 'dropout_rate': 0.9939587498084856, 'ccp_alpha': 0.3545613451259607}. Best is trial 130 with value: 0.7466373356025244.[0m
[32m[I 2022-05-08 11:54:07,209][0m Trial 158 finished with value: 0.7390316331016178 and parameters: {'loss': 'coxph', 'learning_rate': 1.907354587352087e-06, 'n_estimators': 828, 'criterion': 'friedman_mse', 'min_samples_split': 9, 'min_samples_leaf': 1, 'min_weight_fraction_leaf': 0.33341469239250143, 'min_impurity_decrease': 0.2877342841457859, 'max_features': 0.7448696213201034, 'subsample': 0.6638873220372354, 'dropout_rate': 0.9983610730125079, 'ccp_alpha': 0.18994495842525713}. Best is trial 130 with value: 0.7466373356025244.[0m
[32m[I 2022-05-08 12:18:49,165][0m Trial 159 finished with value: 0.7390316331016178 and parameters: {'loss': 'coxph', 'learning_rate': 1.9474197805989696e-06, 'n_estimators': 815, 'criterion': 'friedman_mse', 'min_samples_split': 9, 'min_samples_leaf': 1, 'min_weight_fraction_leaf': 0.33494505938660446, 'min_impurity_decrease': 0.30861346702635867, 'max_features': 0.7559503546518547, 'subsample': 0.6613438699312953, 'dropout_rate': 0.9923112355259717, 'ccp_alpha': 0.17256368273311318}. Best is trial 130 with value: 0.7466373356025244.[0m
[32m[I 2022-05-08 12:43:47,963][0m Trial 160 finished with value: 0.5 and parameters: {'loss': 'coxph', 'learning_rate': 1.8878678951908635e-06, 'n_estimators': 838, 'criterion': 'friedman_mse', 'min_samples_split': 9, 'min_samples_leaf': 1, 'min_weight_fraction_leaf': 0.3366389517231414, 'min_impurity_decrease': 0.31462288900241664, 'max_features': 0.756315600180722, 'subsample': 0.6585816253415747, 'dropout_rate': 0.9984411242686771, 'ccp_alpha': 0.5049452573093112}. Best is trial 130 with value: 0.7466373356025244.[0m
[32m[I 2022-05-08 13:09:13,058][0m Trial 161 finished with value: 0.7388818701887743 and parameters: {'loss': 'coxph', 'learning_rate': 1.034777654801924e-06, 'n_estimators': 816, 'criterion': 'friedman_mse', 'min_samples_split': 9, 'min_samples_leaf': 1, 'min_weight_fraction_leaf': 0.3674047485221125, 'min_impurity_decrease': 0.3122773551991093, 'max_features': 0.7672060402865157, 'subsample': 0.6764356925336619, 'dropout_rate': 0.9322284204855692, 'ccp_alpha': 0.17076629580180336}. Best is trial 130 with value: 0.7466373356025244.[0m
[32m[I 2022-05-08 13:33:08,536][0m Trial 162 finished with value: 0.7405403250364874 and parameters: {'loss': 'coxph', 'learning_rate': 1.1083801363134869e-06, 'n_estimators': 798, 'criterion': 'friedman_mse', 'min_samples_split': 9, 'min_samples_leaf': 1, 'min_weight_fraction_leaf': 0.3588325312427902, 'min_impurity_decrease': 0.2951814016501174, 'max_features': 0.8402469022379415, 'subsample': 0.6391518198239138, 'dropout_rate': 0.997694629728501, 'ccp_alpha': 0.17668893652519108}. Best is trial 130 with value: 0.7466373356025244.[0m
[32m[I 2022-05-08 14:00:21,814][0m Trial 163 finished with value: 0.5 and parameters: {'loss': 'coxph', 'learning_rate': 1.0306260324181108e-06, 'n_estimators': 927, 'criterion': 'friedman_mse', 'min_samples_split': 9, 'min_samples_leaf': 1, 'min_weight_fraction_leaf': 0.3602173845510095, 'min_impurity_decrease': 0.2966380706535478, 'max_features': 0.84170904031446, 'subsample': 0.6705240687895614, 'dropout_rate': 0.999992128358586, 'ccp_alpha': 0.403068845909214}. Best is trial 130 with value: 0.7466373356025244.[0m
[32m[I 2022-05-08 14:24:22,472][0m Trial 164 finished with value: 0.7390316331016178 and parameters: {'loss': 'coxph', 'learning_rate': 1.339465998603512e-06, 'n_estimators': 771, 'criterion': 'friedman_mse', 'min_samples_split': 9, 'min_samples_leaf': 1, 'min_weight_fraction_leaf': 0.3283239343371341, 'min_impurity_decrease': 0.31936771246019435, 'max_features': 0.7747176777195517, 'subsample': 0.6452811057437364, 'dropout_rate': 0.9323697264419124, 'ccp_alpha': 0.2389982256687454}. Best is trial 130 with value: 0.7466373356025244.[0m
[32m[I 2022-05-08 14:48:58,467][0m Trial 165 finished with value: 0.7390316331016178 and parameters: {'loss': 'coxph', 'learning_rate': 1.2963088137126254e-06, 'n_estimators': 790, 'criterion': 'friedman_mse', 'min_samples_split': 9, 'min_samples_leaf': 1, 'min_weight_fraction_leaf': 0.3313778908903018, 'min_impurity_decrease': 0.33240867847955635, 'max_features': 0.8252319265978425, 'subsample': 0.6483919956995837, 'dropout_rate': 0.9344224574903555, 'ccp_alpha': 0.26968598958099094}. Best is trial 130 with value: 0.7466373356025244.[0m
[32m[I 2022-05-08 15:12:41,218][0m Trial 166 finished with value: 0.7390316331016178 and parameters: {'loss': 'coxph', 'learning_rate': 1.2651624355814652e-06, 'n_estimators': 760, 'criterion': 'friedman_mse', 'min_samples_split': 9, 'min_samples_leaf': 1, 'min_weight_fraction_leaf': 0.3252185798288793, 'min_impurity_decrease': 0.3341496022476439, 'max_features': 0.8702649091504067, 'subsample': 0.6929659905332448, 'dropout_rate': 0.9344772898661379, 'ccp_alpha': 0.27584225056732947}. Best is trial 130 with value: 0.7466373356025244.[0m
[32m[I 2022-05-08 15:37:00,251][0m Trial 167 finished with value: 0.7390316331016178 and parameters: {'loss': 'coxph', 'learning_rate': 1.3860395250503227e-06, 'n_estimators': 777, 'criterion': 'friedman_mse', 'min_samples_split': 9, 'min_samples_leaf': 1, 'min_weight_fraction_leaf': 0.3247293296737712, 'min_impurity_decrease': 0.2590421984281032, 'max_features': 0.8872670669278914, 'subsample': 0.6974511579201477, 'dropout_rate': 0.9325114076039076, 'ccp_alpha': 0.31459694387005643}. Best is trial 130 with value: 0.7466373356025244.[0m
[32m[I 2022-05-08 16:00:50,605][0m Trial 168 finished with value: 0.7390316331016178 and parameters: {'loss': 'coxph', 'learning_rate': 1.2489171857157649e-06, 'n_estimators': 756, 'criterion': 'friedman_mse', 'min_samples_split': 9, 'min_samples_leaf': 1, 'min_weight_fraction_leaf': 0.3239868105694075, 'min_impurity_decrease': 0.26939118168476806, 'max_features': 0.8716269069125159, 'subsample': 0.5843928140591895, 'dropout_rate': 0.931508602652527, 'ccp_alpha': 0.30507121028251305}. Best is trial 130 with value: 0.7466373356025244.[0m
[32m[I 2022-05-08 16:25:17,512][0m Trial 169 finished with value: 0.690229472747799 and parameters: {'loss': 'coxph', 'learning_rate': 1.001762803256382e-06, 'n_estimators': 777, 'criterion': 'friedman_mse', 'min_samples_split': 9, 'min_samples_leaf': 1, 'min_weight_fraction_leaf': 0.30637246275091273, 'min_impurity_decrease': 0.3352652601279025, 'max_features': 0.8980437049372878, 'subsample': 0.5901451344100279, 'dropout_rate': 0.9312598917201601, 'ccp_alpha': 0.34247002302946744}. Best is trial 130 with value: 0.7466373356025244.[0m
[32m[I 2022-05-08 16:46:32,760][0m Trial 170 finished with value: 0.5 and parameters: {'loss': 'coxph', 'learning_rate': 1.4102873014400887e-06, 'n_estimators': 684, 'criterion': 'friedman_mse', 'min_samples_split': 9, 'min_samples_leaf': 1, 'min_weight_fraction_leaf': 0.3289876325289693, 'min_impurity_decrease': 0.2553257600491981, 'max_features': 0.8610917852125897, 'subsample': 0.6991780860231565, 'dropout_rate': 0.9322018871815044, 'ccp_alpha': 0.6250289904027757}. Best is trial 130 with value: 0.7466373356025244.[0m
[32m[I 2022-05-08 17:10:49,749][0m Trial 171 finished with value: 0.7390316331016178 and parameters: {'loss': 'coxph', 'learning_rate': 1.2559758925132216e-06, 'n_estimators': 776, 'criterion': 'friedman_mse', 'min_samples_split': 9, 'min_samples_leaf': 1, 'min_weight_fraction_leaf': 0.31362816040099106, 'min_impurity_decrease': 0.28100243387310586, 'max_features': 0.8227189288075903, 'subsample': 0.6846004084755439, 'dropout_rate': 0.9332293533887261, 'ccp_alpha': 0.2983077472017409}. Best is trial 130 with value: 0.7466373356025244.[0m
[32m[I 2022-05-08 17:35:39,507][0m Trial 172 finished with value: 0.5 and parameters: {'loss': 'coxph', 'learning_rate': 1.2692990489661745e-06, 'n_estimators': 795, 'criterion': 'friedman_mse', 'min_samples_split': 9, 'min_samples_leaf': 1, 'min_weight_fraction_leaf': 0.31610590904201885, 'min_impurity_decrease': 0.27901960011386967, 'max_features': 0.8346071719108383, 'subsample': 0.686491261520232, 'dropout_rate': 0.9328683880704056, 'ccp_alpha': 0.4332890637548282}. Best is trial 130 with value: 0.7466373356025244.[0m
[32m[I 2022-05-08 17:57:55,147][0m Trial 173 finished with value: 0.7391608129958782 and parameters: {'loss': 'coxph', 'learning_rate': 2.302254876447077e-06, 'n_estimators': 712, 'criterion': 'friedman_mse', 'min_samples_split': 9, 'min_samples_leaf': 1, 'min_weight_fraction_leaf': 0.32883295899509357, 'min_impurity_decrease': 0.265161781501943, 'max_features': 0.8797340507267786, 'subsample': 0.6047160281637985, 'dropout_rate': 0.9347262580063619, 'ccp_alpha': 0.30602298508706066}. Best is trial 130 with value: 0.7466373356025244.[0m
[32m[I 2022-05-08 18:26:31,372][0m Trial 174 finished with value: 0.7390316331016178 and parameters: {'loss': 'coxph', 'learning_rate': 1.3259136232412422e-06, 'n_estimators': 905, 'criterion': 'friedman_mse', 'min_samples_split': 9, 'min_samples_leaf': 1, 'min_weight_fraction_leaf': 0.29564532957023515, 'min_impurity_decrease': 0.20404820845014576, 'max_features': 0.9020448076210388, 'subsample': 0.601812863981913, 'dropout_rate': 0.9356471288259014, 'ccp_alpha': 0.2882671293216283}. Best is trial 130 with value: 0.7466373356025244.[0m
