[32m[I 2022-04-23 21:02:53,336][0m Trial 563 finished with value: 0.8172772773428957 and parameters: {'n_hidden': 1024, 'mixture_components': 5, 'use_sparse_layer': False, 'use_batchnorm': False, 'use_dropout': False, 'mlp_size_1': 6, 'mlp_size_2': 1, 'mlp_size_3': 0, 'kernel': 'Normal', 'loss_name': 'AlternativeNLLLoss'}. Best is trial 477 with value: 0.9281730871914304.[0m
[32m[I 2022-04-23 21:08:20,911][0m Trial 564 finished with value: 0.9251861291985168 and parameters: {'n_hidden': 512, 'mixture_components': 6, 'use_sparse_layer': False, 'use_batchnorm': False, 'use_dropout': False, 'mlp_size_1': 6, 'mlp_size_2': 0, 'mlp_size_3': 0, 'kernel': 'Normal', 'loss_name': 'AlternativeNLLLoss'}. Best is trial 477 with value: 0.9281730871914304.[0m
[32m[I 2022-04-23 21:13:36,145][0m Trial 565 finished with value: 0.9277782905040215 and parameters: {'n_hidden': 1024, 'mixture_components': 5, 'use_sparse_layer': False, 'use_batchnorm': False, 'use_dropout': False, 'mlp_size_1': 6, 'mlp_size_2': 1, 'mlp_size_3': 0, 'kernel': 'Normal', 'loss_name': 'CensoredNLLLoss'}. Best is trial 477 with value: 0.9281730871914304.[0m
[32m[I 2022-04-23 21:19:23,702][0m Trial 566 finished with value: 0.9267216173252711 and parameters: {'n_hidden': 1024, 'mixture_components': 6, 'use_sparse_layer': False, 'use_batchnorm': False, 'use_dropout': False, 'mlp_size_1': 6, 'mlp_size_2': 1, 'mlp_size_3': 0, 'kernel': 'Normal', 'loss_name': 'CensoredNLLLoss'}. Best is trial 477 with value: 0.9281730871914304.[0m
[32m[I 2022-04-23 21:26:58,019][0m Trial 567 finished with value: 0.92440212441965 and parameters: {'n_hidden': 32, 'mixture_components': 5, 'use_sparse_layer': False, 'use_batchnorm': False, 'use_dropout': False, 'mlp_size_1': 2, 'mlp_size_2': 0, 'mlp_size_3': 0, 'kernel': 'Normal', 'loss_name': 'CensoredNLLLoss'}. Best is trial 477 with value: 0.9281730871914304.[0m
[32m[I 2022-04-23 21:32:30,292][0m Trial 568 finished with value: 0.9269371051106633 and parameters: {'n_hidden': 1024, 'mixture_components': 6, 'use_sparse_layer': False, 'use_batchnorm': False, 'use_dropout': False, 'mlp_size_1': 6, 'mlp_size_2': 1, 'mlp_size_3': 0, 'kernel': 'Normal', 'loss_name': 'CensoredNLLLoss'}. Best is trial 477 with value: 0.9281730871914304.[0m
[32m[I 2022-04-23 21:37:52,363][0m Trial 569 finished with value: 0.9272479692766911 and parameters: {'n_hidden': 1024, 'mixture_components': 5, 'use_sparse_layer': False, 'use_batchnorm': False, 'use_dropout': False, 'mlp_size_1': 6, 'mlp_size_2': 1, 'mlp_size_3': 0, 'kernel': 'Normal', 'loss_name': 'CensoredNLLLoss'}. Best is trial 477 with value: 0.9281730871914304.[0m
[32m[I 2022-04-23 21:42:48,461][0m Trial 570 finished with value: 0.9269540137107206 and parameters: {'n_hidden': 1024, 'mixture_components': 5, 'use_sparse_layer': False, 'use_batchnorm': False, 'use_dropout': False, 'mlp_size_1': 6, 'mlp_size_2': 1, 'mlp_size_3': 0, 'kernel': 'Normal', 'loss_name': 'CensoredNLLLoss'}. Best is trial 477 with value: 0.9281730871914304.[0m
[32m[I 2022-04-23 21:47:28,722][0m Trial 571 finished with value: 0.9251107319801651 and parameters: {'n_hidden': 128, 'mixture_components': 5, 'use_sparse_layer': False, 'use_batchnorm': False, 'use_dropout': False, 'mlp_size_1': 4, 'mlp_size_2': 0, 'mlp_size_3': 0, 'kernel': 'Logistic', 'loss_name': 'CensoredNLLLoss'}. Best is trial 477 with value: 0.9281730871914304.[0m
[32m[I 2022-04-23 21:52:50,830][0m Trial 572 finished with value: 0.9262692192586052 and parameters: {'n_hidden': 1024, 'mixture_components': 5, 'use_sparse_layer': False, 'use_batchnorm': False, 'use_dropout': False, 'mlp_size_1': 6, 'mlp_size_2': 1, 'mlp_size_3': 0, 'kernel': 'Normal', 'loss_name': 'CensoredNLLLoss'}. Best is trial 477 with value: 0.9281730871914304.[0m
[32m[I 2022-04-23 21:58:00,882][0m Trial 573 finished with value: 0.9261980743582507 and parameters: {'n_hidden': 1024, 'mixture_components': 5, 'use_sparse_layer': False, 'use_batchnorm': False, 'use_dropout': False, 'mlp_size_1': 5, 'mlp_size_2': 2, 'mlp_size_3': 0, 'kernel': 'Normal', 'loss_name': 'CensoredNLLLoss'}. Best is trial 477 with value: 0.9281730871914304.[0m
[32m[I 2022-04-23 22:03:10,351][0m Trial 574 finished with value: 0.9260194050810002 and parameters: {'n_hidden': 1024, 'mixture_components': 5, 'use_sparse_layer': False, 'use_batchnorm': False, 'use_dropout': False, 'mlp_size_1': 6, 'mlp_size_2': 1, 'mlp_size_3': 0, 'kernel': 'Normal', 'loss_name': 'CensoredNLLLoss'}. Best is trial 477 with value: 0.9281730871914304.[0m
[32m[I 2022-04-23 22:08:35,939][0m Trial 575 finished with value: 0.9275364982796901 and parameters: {'n_hidden': 1024, 'mixture_components': 5, 'use_sparse_layer': False, 'use_batchnorm': False, 'use_dropout': False, 'mlp_size_1': 6, 'mlp_size_2': 1, 'mlp_size_3': 0, 'kernel': 'Normal', 'loss_name': 'CensoredNLLLoss'}. Best is trial 477 with value: 0.9281730871914304.[0m
[32m[I 2022-04-23 22:14:05,651][0m Trial 576 finished with value: 0.9260631688246 and parameters: {'n_hidden': 1024, 'mixture_components': 5, 'use_sparse_layer': False, 'use_batchnorm': False, 'use_dropout': False, 'mlp_size_1': 6, 'mlp_size_2': 1, 'mlp_size_3': 0, 'kernel': 'Normal', 'loss_name': 'CensoredNLLLoss'}. Best is trial 477 with value: 0.9281730871914304.[0m
[32m[I 2022-04-23 22:18:19,453][0m Trial 577 finished with value: 0.7167404698029093 and parameters: {'n_hidden': 1024, 'mixture_components': 3, 'use_sparse_layer': False, 'use_batchnorm': False, 'use_dropout': False, 'mlp_size_1': 6, 'mlp_size_2': 1, 'mlp_size_3': 0, 'kernel': 'Normal', 'loss_name': 'CensoredNLLLoss'}. Best is trial 477 with value: 0.9281730871914304.[0m
[32m[I 2022-04-23 22:22:00,238][0m Trial 578 finished with value: 0.516918970644366 and parameters: {'n_hidden': 64, 'mixture_components': 5, 'use_sparse_layer': False, 'use_batchnorm': False, 'use_dropout': True, 'dropout': 0.19759161106145262, 'mlp_size_1': 3, 'mlp_size_2': 0, 'mlp_size_3': 0, 'kernel': 'Normal', 'loss_name': 'CensoredNLLLoss'}. Best is trial 477 with value: 0.9281730871914304.[0m
[32m[I 2022-04-23 22:30:35,779][0m Trial 579 finished with value: 0.7207954058093042 and parameters: {'n_hidden': 1024, 'mixture_components': 5, 'use_sparse_layer': False, 'use_batchnorm': True, 'use_dropout': False, 'mlp_size_1': 6, 'mlp_size_2': 1, 'mlp_size_3': 0, 'kernel': 'Normal', 'loss_name': 'CensoredNLLLoss'}. Best is trial 477 with value: 0.9281730871914304.[0m
[32m[I 2022-04-23 22:35:46,245][0m Trial 580 finished with value: 0.9265252129095225 and parameters: {'n_hidden': 1024, 'mixture_components': 5, 'use_sparse_layer': False, 'use_batchnorm': False, 'use_dropout': False, 'mlp_size_1': 6, 'mlp_size_2': 1, 'mlp_size_3': 0, 'kernel': 'Normal', 'loss_name': 'CensoredNLLLoss'}. Best is trial 477 with value: 0.9281730871914304.[0m
[32m[I 2022-04-23 22:39:35,541][0m Trial 581 finished with value: 0.9246370051725297 and parameters: {'n_hidden': 256, 'mixture_components': 5, 'use_sparse_layer': False, 'use_batchnorm': False, 'use_dropout': False, 'mlp_size_1': 5, 'mlp_size_2': 0, 'mlp_size_3': 0, 'kernel': 'LogLogistic', 'loss_name': 'CensoredNLLLoss'}. Best is trial 477 with value: 0.9281730871914304.[0m
[32m[I 2022-04-23 22:45:11,149][0m Trial 582 finished with value: 0.9267427012278503 and parameters: {'n_hidden': 1024, 'mixture_components': 4, 'use_sparse_layer': True, 'use_sparse_loss': True, 'lmbd': 6.169395584466394e-05, 'use_batchnorm': False, 'use_dropout': False, 'mlp_size_1': 6, 'mlp_size_2': 1, 'mlp_size_3': 0, 'kernel': 'Normal', 'loss_name': 'CensoredNLLLoss'}. Best is trial 477 with value: 0.9281730871914304.[0m
[32m[I 2022-04-23 22:50:01,827][0m Trial 583 finished with value: 0.8204068912122926 and parameters: {'n_hidden': 1024, 'mixture_components': 5, 'use_sparse_layer': False, 'use_batchnorm': False, 'use_dropout': False, 'mlp_size_1': 6, 'mlp_size_2': 1, 'mlp_size_3': 0, 'kernel': 'Normal', 'loss_name': 'CensoredNLLLoss'}. Best is trial 477 with value: 0.9281730871914304.[0m
[32m[I 2022-04-23 22:53:14,348][0m Trial 584 finished with value: -0.5 and parameters: {'n_hidden': 2048, 'mixture_components': 5, 'use_sparse_layer': False, 'use_batchnorm': False, 'use_dropout': False, 'mlp_size_1': 5, 'mlp_size_2': 3, 'mlp_size_3': 0, 'kernel': 'Exponential', 'loss_name': 'CensoredNLLLoss'}. Best is trial 477 with value: 0.9281730871914304.[0m
[32m[I 2022-04-23 22:58:20,587][0m Trial 585 finished with value: 0.8248217643110601 and parameters: {'n_hidden': 1024, 'mixture_components': 2, 'use_sparse_layer': False, 'use_batchnorm': False, 'use_dropout': False, 'mlp_size_1': 6, 'mlp_size_2': 1, 'mlp_size_3': 0, 'kernel': 'Normal', 'loss_name': 'CensoredNLLLoss'}. Best is trial 477 with value: 0.9281730871914304.[0m
[32m[I 2022-04-23 23:03:54,875][0m Trial 586 finished with value: 0.9268273673578286 and parameters: {'n_hidden': 1024, 'mixture_components': 5, 'use_sparse_layer': False, 'use_batchnorm': False, 'use_dropout': False, 'mlp_size_1': 6, 'mlp_size_2': 1, 'mlp_size_3': 0, 'kernel': 'Normal', 'loss_name': 'CensoredNLLLoss'}. Best is trial 477 with value: 0.9281730871914304.[0m
[32m[I 2022-04-23 23:09:19,635][0m Trial 587 finished with value: 0.9267484484885928 and parameters: {'n_hidden': 1024, 'mixture_components': 5, 'use_sparse_layer': False, 'use_batchnorm': False, 'use_dropout': False, 'mlp_size_1': 6, 'mlp_size_2': 1, 'mlp_size_3': 0, 'kernel': 'Normal', 'loss_name': 'CensoredNLLLoss'}. Best is trial 477 with value: 0.9281730871914304.[0m
[32m[I 2022-04-23 23:13:58,719][0m Trial 588 finished with value: 0.9189693778877462 and parameters: {'n_hidden': 1024, 'mixture_components': 4, 'use_sparse_layer': False, 'use_batchnorm': False, 'use_dropout': False, 'mlp_size_1': 6, 'mlp_size_2': 1, 'mlp_size_3': 0, 'kernel': 'Normal', 'loss_name': 'CensoredNLLLoss'}. Best is trial 477 with value: 0.9281730871914304.[0m
[32m[I 2022-04-23 23:19:33,494][0m Trial 589 finished with value: 0.9270128801281519 and parameters: {'n_hidden': 1024, 'mixture_components': 5, 'use_sparse_layer': False, 'use_batchnorm': False, 'use_dropout': False, 'mlp_size_1': 6, 'mlp_size_2': 1, 'mlp_size_3': 0, 'kernel': 'Normal', 'loss_name': 'CensoredNLLLoss'}. Best is trial 477 with value: 0.9281730871914304.[0m
[32m[I 2022-04-23 23:25:34,748][0m Trial 590 finished with value: 0.9269651231029457 and parameters: {'n_hidden': 1024, 'mixture_components': 5, 'use_sparse_layer': False, 'use_batchnorm': False, 'use_dropout': False, 'mlp_size_1': 6, 'mlp_size_2': 1, 'mlp_size_3': 0, 'kernel': 'Normal', 'loss_name': 'CensoredNLLLoss'}. Best is trial 477 with value: 0.9281730871914304.[0m
[32m[I 2022-04-23 23:30:40,293][0m Trial 591 finished with value: 0.9262660295687251 and parameters: {'n_hidden': 1024, 'mixture_components': 7, 'use_sparse_layer': False, 'use_batchnorm': False, 'use_dropout': False, 'mlp_size_1': 6, 'mlp_size_2': 1, 'mlp_size_3': 0, 'kernel': 'Normal', 'loss_name': 'CensoredNLLLoss'}. Best is trial 477 with value: 0.9281730871914304.[0m
[32m[I 2022-04-23 23:35:46,164][0m Trial 592 finished with value: 0.9238871701160563 and parameters: {'n_hidden': 1024, 'mixture_components': 3, 'use_sparse_layer': False, 'use_batchnorm': False, 'use_dropout': False, 'mlp_size_1': 1, 'mlp_size_2': 4, 'mlp_size_3': 1, 'kernel': 'Normal', 'loss_name': 'CensoredNLLLoss'}. Best is trial 477 with value: 0.9281730871914304.[0m
[32m[I 2022-04-23 23:41:02,376][0m Trial 593 finished with value: 0.9262433987940575 and parameters: {'n_hidden': 1024, 'mixture_components': 5, 'use_sparse_layer': False, 'use_batchnorm': False, 'use_dropout': False, 'mlp_size_1': 6, 'mlp_size_2': 1, 'mlp_size_3': 0, 'kernel': 'Normal', 'loss_name': 'CensoredNLLLoss'}. Best is trial 477 with value: 0.9281730871914304.[0m
[32m[I 2022-04-23 23:45:31,868][0m Trial 594 finished with value: 0.9204320348728062 and parameters: {'n_hidden': 512, 'mixture_components': 5, 'use_sparse_layer': False, 'use_batchnorm': False, 'use_dropout': False, 'mlp_size_1': 6, 'mlp_size_2': 0, 'mlp_size_3': 0, 'kernel': 'Normal', 'loss_name': 'CensoredNLLLoss'}. Best is trial 477 with value: 0.9281730871914304.[0m
[32m[I 2022-04-23 23:50:37,560][0m Trial 595 finished with value: 0.926567726945947 and parameters: {'n_hidden': 1024, 'mixture_components': 4, 'use_sparse_layer': False, 'use_batchnorm': False, 'use_dropout': False, 'mlp_size_1': 6, 'mlp_size_2': 1, 'mlp_size_3': 0, 'kernel': 'Normal', 'loss_name': 'CensoredNLLLoss'}. Best is trial 477 with value: 0.9281730871914304.[0m
[32m[I 2022-04-23 23:57:57,189][0m Trial 596 finished with value: 0.9228692891492789 and parameters: {'n_hidden': 32, 'mixture_components': 6, 'use_sparse_layer': False, 'use_batchnorm': False, 'use_dropout': False, 'mlp_size_1': 2, 'mlp_size_2': 0, 'mlp_size_3': 0, 'kernel': 'Normal', 'loss_name': 'CensoredNLLLoss'}. Best is trial 477 with value: 0.9281730871914304.[0m
[32m[I 2022-04-24 00:02:11,228][0m Trial 597 finished with value: 0.42116904011769246 and parameters: {'n_hidden': 1024, 'mixture_components': 7, 'use_sparse_layer': False, 'use_batchnorm': False, 'use_dropout': True, 'dropout': 0.34088369108423533, 'mlp_size_1': 6, 'mlp_size_2': 1, 'mlp_size_3': 0, 'kernel': 'Logistic', 'loss_name': 'CensoredNLLLoss'}. Best is trial 477 with value: 0.9281730871914304.[0m
[32m[I 2022-04-24 00:10:32,060][0m Trial 598 finished with value: 0.9197720049220754 and parameters: {'n_hidden': 1024, 'mixture_components': 5, 'use_sparse_layer': False, 'use_batchnorm': True, 'use_dropout': False, 'mlp_size_1': 6, 'mlp_size_2': 1, 'mlp_size_3': 0, 'kernel': 'Normal', 'loss_name': 'CensoredNLLLoss'}. Best is trial 477 with value: 0.9281730871914304.[0m
[32m[I 2022-04-24 00:15:40,465][0m Trial 599 finished with value: 0.8212381056121124 and parameters: {'n_hidden': 1024, 'mixture_components': 6, 'use_sparse_layer': False, 'use_batchnorm': False, 'use_dropout': False, 'mlp_size_1': 6, 'mlp_size_2': 1, 'mlp_size_3': 0, 'kernel': 'Normal', 'loss_name': 'CensoredNLLLoss'}. Best is trial 477 with value: 0.9281730871914304.[0m
[32m[I 2022-04-24 00:20:57,644][0m Trial 600 finished with value: 0.8176241588729809 and parameters: {'n_hidden': 128, 'mixture_components': 6, 'use_sparse_layer': True, 'use_sparse_loss': False, 'use_batchnorm': False, 'use_dropout': False, 'mlp_size_1': 4, 'mlp_size_2': 0, 'mlp_size_3': 0, 'kernel': 'Normal', 'loss_name': 'CensoredNLLLoss'}. Best is trial 477 with value: 0.9281730871914304.[0m
[32m[I 2022-04-24 00:24:32,087][0m Trial 601 finished with value: 0.9182939793323353 and parameters: {'n_hidden': 1024, 'mixture_components': 5, 'use_sparse_layer': False, 'use_batchnorm': False, 'use_dropout': False, 'mlp_size_1': 6, 'mlp_size_2': 1, 'mlp_size_3': 0, 'kernel': 'Normal', 'loss_name': 'NLLLoss'}. Best is trial 477 with value: 0.9281730871914304.[0m
[32m[I 2022-04-24 00:29:24,984][0m Trial 602 finished with value: 0.925947003017478 and parameters: {'n_hidden': 1024, 'mixture_components': 4, 'use_sparse_layer': False, 'use_batchnorm': False, 'use_dropout': False, 'mlp_size_1': 6, 'mlp_size_2': 1, 'mlp_size_3': 0, 'kernel': 'Normal', 'loss_name': 'CensoredNLLLoss'}. Best is trial 477 with value: 0.9281730871914304.[0m
[32m[I 2022-04-24 00:34:25,019][0m Trial 603 finished with value: 0.9276162786222392 and parameters: {'n_hidden': 1024, 'mixture_components': 5, 'use_sparse_layer': False, 'use_batchnorm': False, 'use_dropout': False, 'mlp_size_1': 6, 'mlp_size_2': 1, 'mlp_size_3': 0, 'kernel': 'Normal', 'loss_name': 'CensoredNLLLoss'}. Best is trial 477 with value: 0.9281730871914304.[0m
[32m[I 2022-04-24 00:39:23,685][0m Trial 604 finished with value: 0.9263865657254826 and parameters: {'n_hidden': 1024, 'mixture_components': 5, 'use_sparse_layer': False, 'use_batchnorm': False, 'use_dropout': False, 'mlp_size_1': 6, 'mlp_size_2': 1, 'mlp_size_3': 0, 'kernel': 'Normal', 'loss_name': 'CensoredNLLLoss'}. Best is trial 477 with value: 0.9281730871914304.[0m
[32m[I 2022-04-24 00:45:01,674][0m Trial 605 finished with value: 0.926420888786471 and parameters: {'n_hidden': 1024, 'mixture_components': 5, 'use_sparse_layer': False, 'use_batchnorm': False, 'use_dropout': False, 'mlp_size_1': 6, 'mlp_size_2': 1, 'mlp_size_3': 0, 'kernel': 'Normal', 'loss_name': 'CensoredNLLLoss'}. Best is trial 477 with value: 0.9281730871914304.[0m
[32m[I 2022-04-24 00:50:36,014][0m Trial 606 finished with value: 0.9240418393820719 and parameters: {'n_hidden': 64, 'mixture_components': 5, 'use_sparse_layer': False, 'use_batchnorm': False, 'use_dropout': False, 'mlp_size_1': 3, 'mlp_size_2': 0, 'mlp_size_3': 0, 'kernel': 'LogLogistic', 'loss_name': 'CensoredNLLLoss'}. Best is trial 477 with value: 0.9281730871914304.[0m
[32m[I 2022-04-24 00:54:49,294][0m Trial 607 finished with value: 0.9190939747327459 and parameters: {'n_hidden': 1024, 'mixture_components': 5, 'use_sparse_layer': False, 'use_batchnorm': False, 'use_dropout': False, 'mlp_size_1': 6, 'mlp_size_2': 1, 'mlp_size_3': 0, 'kernel': 'Normal', 'loss_name': 'NLLLoss'}. Best is trial 477 with value: 0.9281730871914304.[0m
[32m[I 2022-04-24 00:57:13,559][0m Trial 608 finished with value: -0.5 and parameters: {'n_hidden': 1024, 'mixture_components': 5, 'use_sparse_layer': False, 'use_batchnorm': False, 'use_dropout': False, 'mlp_size_1': 6, 'mlp_size_2': 1, 'mlp_size_3': 0, 'kernel': 'Exponential', 'loss_name': 'CensoredNLLLoss'}. Best is trial 477 with value: 0.9281730871914304.[0m
[32m[I 2022-04-24 01:01:49,022][0m Trial 609 finished with value: 0.9157634610557194 and parameters: {'n_hidden': 1024, 'mixture_components': 5, 'use_sparse_layer': False, 'use_batchnorm': False, 'use_dropout': False, 'mlp_size_1': 6, 'mlp_size_2': 1, 'mlp_size_3': 0, 'kernel': 'Normal', 'loss_name': 'CensoredNLLLoss'}. Best is trial 477 with value: 0.9281730871914304.[0m
[32m[I 2022-04-24 01:07:12,103][0m Trial 610 finished with value: 0.9268032571947934 and parameters: {'n_hidden': 1024, 'mixture_components': 5, 'use_sparse_layer': False, 'use_batchnorm': False, 'use_dropout': False, 'mlp_size_1': 6, 'mlp_size_2': 1, 'mlp_size_3': 0, 'kernel': 'Normal', 'loss_name': 'CensoredNLLLoss'}. Best is trial 477 with value: 0.9281730871914304.[0m
[32m[I 2022-04-24 01:12:00,596][0m Trial 611 finished with value: 0.9244424353044925 and parameters: {'n_hidden': 256, 'mixture_components': 5, 'use_sparse_layer': False, 'use_batchnorm': False, 'use_dropout': False, 'mlp_size_1': 5, 'mlp_size_2': 0, 'mlp_size_3': 0, 'kernel': 'Normal', 'loss_name': 'AlternativeNLLLoss'}. Best is trial 477 with value: 0.9281730871914304.[0m
[32m[I 2022-04-24 01:18:15,338][0m Trial 612 finished with value: 0.9265119211055488 and parameters: {'n_hidden': 2048, 'mixture_components': 6, 'use_sparse_layer': False, 'use_batchnorm': False, 'use_dropout': False, 'mlp_size_1': 5, 'mlp_size_2': 2, 'mlp_size_3': 1, 'kernel': 'Normal', 'loss_name': 'AlternativeNLLLoss'}. Best is trial 477 with value: 0.9281730871914304.[0m
[32m[I 2022-04-24 01:23:32,011][0m Trial 613 finished with value: 0.9260843899008517 and parameters: {'n_hidden': 1024, 'mixture_components': 5, 'use_sparse_layer': False, 'use_batchnorm': False, 'use_dropout': False, 'mlp_size_1': 6, 'mlp_size_2': 1, 'mlp_size_3': 0, 'kernel': 'Normal', 'loss_name': 'AlternativeNLLLoss'}. Best is trial 477 with value: 0.9281730871914304.[0m
[32m[I 2022-04-24 01:28:58,044][0m Trial 614 finished with value: 0.9265170348973741 and parameters: {'n_hidden': 1024, 'mixture_components': 6, 'use_sparse_layer': False, 'use_batchnorm': False, 'use_dropout': False, 'mlp_size_1': 6, 'mlp_size_2': 1, 'mlp_size_3': 0, 'kernel': 'Normal', 'loss_name': 'CensoredNLLLoss'}. Best is trial 477 with value: 0.9281730871914304.[0m
[32m[I 2022-04-24 01:33:43,271][0m Trial 615 finished with value: 0.9241608970407181 and parameters: {'n_hidden': 1024, 'mixture_components': 5, 'use_sparse_layer': False, 'use_batchnorm': False, 'use_dropout': False, 'mlp_size_1': 6, 'mlp_size_2': 1, 'mlp_size_3': 0, 'kernel': 'Normal', 'loss_name': 'AlternativeNLLLoss'}. Best is trial 477 with value: 0.9281730871914304.[0m
[32m[I 2022-04-24 01:37:54,898][0m Trial 616 finished with value: 0.4099871872644524 and parameters: {'n_hidden': 1024, 'mixture_components': 6, 'use_sparse_layer': False, 'use_batchnorm': False, 'use_dropout': True, 'dropout': 0.665171644812328, 'mlp_size_1': 6, 'mlp_size_2': 1, 'mlp_size_3': 0, 'kernel': 'Normal', 'loss_name': 'AlternativeNLLLoss'}. Best is trial 477 with value: 0.9281730871914304.[0m
[32m[I 2022-04-24 01:46:11,565][0m Trial 617 finished with value: 0.41086479692937594 and parameters: {'n_hidden': 1024, 'mixture_components': 5, 'use_sparse_layer': False, 'use_batchnorm': True, 'use_dropout': False, 'mlp_size_1': 6, 'mlp_size_2': 1, 'mlp_size_3': 0, 'kernel': 'Normal', 'loss_name': 'CensoredNLLLoss'}. Best is trial 477 with value: 0.9281730871914304.[0m
[32m[I 2022-04-24 01:52:03,099][0m Trial 618 finished with value: 0.9267633091310961 and parameters: {'n_hidden': 1024, 'mixture_components': 5, 'use_sparse_layer': False, 'use_batchnorm': False, 'use_dropout': False, 'mlp_size_1': 6, 'mlp_size_2': 1, 'mlp_size_3': 0, 'kernel': 'Normal', 'loss_name': 'AlternativeNLLLoss'}. Best is trial 477 with value: 0.9281730871914304.[0m
[32m[I 2022-04-24 01:57:08,777][0m Trial 619 finished with value: 0.9262730535042498 and parameters: {'n_hidden': 1024, 'mixture_components': 6, 'use_sparse_layer': True, 'use_sparse_loss': False, 'use_batchnorm': False, 'use_dropout': False, 'mlp_size_1': 6, 'mlp_size_2': 1, 'mlp_size_3': 0, 'kernel': 'Normal', 'loss_name': 'AlternativeNLLLoss'}. Best is trial 477 with value: 0.9281730871914304.[0m
