[32m[I 2022-04-26 08:53:49,653][0m Trial 278 finished with value: 0.8516231964317112 and parameters: {'n_hidden': 512, 'mixture_components': 5, 'use_sparse_layer': True, 'use_sparse_loss': True, 'lmbd': 2.4010460542189012e-06, 'use_batchnorm': False, 'use_dropout': False, 'mlp_size_1': 6, 'mlp_size_2': 0, 'mlp_size_3': 0, 'kernel': 'Normal', 'loss_name': 'AlternativeNLLLoss'}. Best is trial 205 with value: 0.8548990439632759.[0m
[32m[I 2022-04-26 08:59:47,951][0m Trial 279 finished with value: 0.8511966784391423 and parameters: {'n_hidden': 2048, 'mixture_components': 3, 'use_sparse_layer': True, 'use_sparse_loss': True, 'lmbd': 3.5210322902380157e-06, 'use_batchnorm': False, 'use_dropout': False, 'mlp_size_1': 7, 'mlp_size_2': 1, 'mlp_size_3': 0, 'kernel': 'Normal', 'loss_name': 'AlternativeNLLLoss'}. Best is trial 205 with value: 0.8548990439632759.[0m
[32m[I 2022-04-26 09:05:25,060][0m Trial 280 finished with value: 0.8505025160761285 and parameters: {'n_hidden': 2048, 'mixture_components': 5, 'use_sparse_layer': True, 'use_sparse_loss': True, 'lmbd': 4.418122645382964e-06, 'use_batchnorm': False, 'use_dropout': False, 'mlp_size_1': 7, 'mlp_size_2': 1, 'mlp_size_3': 0, 'kernel': 'Normal', 'loss_name': 'AlternativeNLLLoss'}. Best is trial 205 with value: 0.8548990439632759.[0m
[32m[I 2022-04-26 09:16:41,248][0m Trial 281 finished with value: 0.8463406118792435 and parameters: {'n_hidden': 2048, 'mixture_components': 4, 'use_sparse_layer': True, 'use_sparse_loss': True, 'lmbd': 0.0006226469905000538, 'use_batchnorm': True, 'use_dropout': False, 'mlp_size_1': 7, 'mlp_size_2': 1, 'mlp_size_3': 0, 'kernel': 'Normal', 'loss_name': 'AlternativeNLLLoss'}. Best is trial 205 with value: 0.8548990439632759.[0m
[32m[I 2022-04-26 09:22:46,672][0m Trial 282 finished with value: 0.8551919812799864 and parameters: {'n_hidden': 2048, 'mixture_components': 5, 'use_sparse_layer': True, 'use_sparse_loss': True, 'lmbd': 3.0550058809302003e-06, 'use_batchnorm': False, 'use_dropout': False, 'mlp_size_1': 7, 'mlp_size_2': 1, 'mlp_size_3': 0, 'kernel': 'Normal', 'loss_name': 'AlternativeNLLLoss'}. Best is trial 282 with value: 0.8551919812799864.[0m
[32m[I 2022-04-26 09:28:35,048][0m Trial 283 finished with value: 0.8515728154030215 and parameters: {'n_hidden': 2048, 'mixture_components': 5, 'use_sparse_layer': True, 'use_sparse_loss': True, 'lmbd': 3.0773252012783215e-06, 'use_batchnorm': False, 'use_dropout': False, 'mlp_size_1': 7, 'mlp_size_2': 1, 'mlp_size_3': 0, 'kernel': 'Normal', 'loss_name': 'AlternativeNLLLoss'}. Best is trial 282 with value: 0.8551919812799864.[0m
[32m[I 2022-04-26 09:33:48,805][0m Trial 284 finished with value: 0.8240678778968652 and parameters: {'n_hidden': 2048, 'mixture_components': 5, 'use_sparse_layer': True, 'use_sparse_loss': True, 'lmbd': 2.1025583329994447e-06, 'use_batchnorm': False, 'use_dropout': False, 'mlp_size_1': 7, 'mlp_size_2': 1, 'mlp_size_3': 0, 'kernel': 'Normal', 'loss_name': 'NLLLoss'}. Best is trial 282 with value: 0.8551919812799864.[0m
[32m[I 2022-04-26 09:39:32,954][0m Trial 285 finished with value: 0.8460626565120632 and parameters: {'n_hidden': 2048, 'mixture_components': 5, 'use_sparse_layer': True, 'use_sparse_loss': True, 'lmbd': 2.853981807140205e-06, 'use_batchnorm': False, 'use_dropout': True, 'dropout': 0.5296230360198144, 'mlp_size_1': 7, 'mlp_size_2': 1, 'mlp_size_3': 0, 'kernel': 'Normal', 'loss_name': 'AlternativeNLLLoss'}. Best is trial 282 with value: 0.8551919812799864.[0m
[32m[I 2022-04-26 09:45:46,239][0m Trial 286 finished with value: 0.8514772117700973 and parameters: {'n_hidden': 2048, 'mixture_components': 5, 'use_sparse_layer': True, 'use_sparse_loss': True, 'lmbd': 4.68472697803285e-06, 'use_batchnorm': False, 'use_dropout': False, 'mlp_size_1': 8, 'mlp_size_2': 0, 'mlp_size_3': 0, 'kernel': 'Normal', 'loss_name': 'AlternativeNLLLoss'}. Best is trial 282 with value: 0.8551919812799864.[0m
[32m[I 2022-04-26 09:51:32,598][0m Trial 287 finished with value: 0.8522567250523776 and parameters: {'n_hidden': 2048, 'mixture_components': 5, 'use_sparse_layer': True, 'use_sparse_loss': True, 'lmbd': 1.7149960470309686e-06, 'use_batchnorm': False, 'use_dropout': False, 'mlp_size_1': 7, 'mlp_size_2': 1, 'mlp_size_3': 0, 'kernel': 'Normal', 'loss_name': 'AlternativeNLLLoss'}. Best is trial 282 with value: 0.8551919812799864.[0m
[32m[I 2022-04-26 09:57:02,120][0m Trial 288 finished with value: 0.8531505313027796 and parameters: {'n_hidden': 2048, 'mixture_components': 3, 'use_sparse_layer': True, 'use_sparse_loss': True, 'lmbd': 6.206418528967107e-06, 'use_batchnorm': False, 'use_dropout': False, 'mlp_size_1': 6, 'mlp_size_2': 1, 'mlp_size_3': 1, 'kernel': 'Normal', 'loss_name': 'AlternativeNLLLoss'}. Best is trial 282 with value: 0.8551919812799864.[0m
[32m[I 2022-04-26 10:01:37,745][0m Trial 289 finished with value: 0.843200925000658 and parameters: {'n_hidden': 256, 'mixture_components': 6, 'use_sparse_layer': True, 'use_sparse_loss': True, 'lmbd': 7.801867671065454e-06, 'use_batchnorm': False, 'use_dropout': False, 'mlp_size_1': 5, 'mlp_size_2': 0, 'mlp_size_3': 0, 'kernel': 'Normal', 'loss_name': 'AlternativeNLLLoss'}. Best is trial 282 with value: 0.8551919812799864.[0m
[32m[I 2022-04-26 10:07:37,516][0m Trial 290 finished with value: 0.854057550989946 and parameters: {'n_hidden': 2048, 'mixture_components': 5, 'use_sparse_layer': True, 'use_sparse_loss': True, 'lmbd': 3.869567592391687e-06, 'use_batchnorm': False, 'use_dropout': False, 'mlp_size_1': 7, 'mlp_size_2': 1, 'mlp_size_3': 0, 'kernel': 'Normal', 'loss_name': 'AlternativeNLLLoss'}. Best is trial 282 with value: 0.8551919812799864.[0m
[32m[I 2022-04-26 10:15:10,443][0m Trial 291 finished with value: 0.8502825420039647 and parameters: {'n_hidden': 32, 'mixture_components': 5, 'use_sparse_layer': True, 'use_sparse_loss': True, 'lmbd': 4.0280589733967136e-06, 'use_batchnorm': False, 'use_dropout': False, 'mlp_size_1': 2, 'mlp_size_2': 0, 'mlp_size_3': 0, 'kernel': 'Normal', 'loss_name': 'AlternativeNLLLoss'}. Best is trial 282 with value: 0.8551919812799864.[0m
[32m[I 2022-04-26 10:21:39,728][0m Trial 292 finished with value: 0.8538891278117564 and parameters: {'n_hidden': 2048, 'mixture_components': 5, 'use_sparse_layer': True, 'use_sparse_loss': True, 'lmbd': 0.0886351360725346, 'use_batchnorm': False, 'use_dropout': False, 'mlp_size_1': 7, 'mlp_size_2': 1, 'mlp_size_3': 0, 'kernel': 'Normal', 'loss_name': 'AlternativeNLLLoss'}. Best is trial 282 with value: 0.8551919812799864.[0m
[32m[I 2022-04-26 10:27:40,493][0m Trial 293 finished with value: 0.842307456877986 and parameters: {'n_hidden': 2048, 'mixture_components': 5, 'use_sparse_layer': True, 'use_sparse_loss': True, 'lmbd': 0.07014116790466783, 'use_batchnorm': False, 'use_dropout': False, 'mlp_size_1': 7, 'mlp_size_2': 1, 'mlp_size_3': 0, 'kernel': 'Normal', 'loss_name': 'AlternativeNLLLoss'}. Best is trial 282 with value: 0.8551919812799864.[0m
[32m[I 2022-04-26 10:32:34,823][0m Trial 294 finished with value: 0.8541796978365941 and parameters: {'n_hidden': 512, 'mixture_components': 5, 'use_sparse_layer': True, 'use_sparse_loss': True, 'lmbd': 3.3724527101833433e-06, 'use_batchnorm': False, 'use_dropout': False, 'mlp_size_1': 6, 'mlp_size_2': 0, 'mlp_size_3': 0, 'kernel': 'Normal', 'loss_name': 'AlternativeNLLLoss'}. Best is trial 282 with value: 0.8551919812799864.[0m
[32m[I 2022-04-26 10:37:29,715][0m Trial 295 finished with value: 0.8486202294090933 and parameters: {'n_hidden': 512, 'mixture_components': 5, 'use_sparse_layer': True, 'use_sparse_loss': True, 'lmbd': 0.0035566058771425153, 'use_batchnorm': False, 'use_dropout': False, 'mlp_size_1': 6, 'mlp_size_2': 0, 'mlp_size_3': 0, 'kernel': 'Normal', 'loss_name': 'AlternativeNLLLoss'}. Best is trial 282 with value: 0.8551919812799864.[0m
[32m[I 2022-04-26 10:43:10,766][0m Trial 296 finished with value: 0.850253688398162 and parameters: {'n_hidden': 512, 'mixture_components': 5, 'use_sparse_layer': True, 'use_sparse_loss': True, 'lmbd': 2.9899589064434196e-06, 'use_batchnorm': False, 'use_dropout': False, 'mlp_size_1': 6, 'mlp_size_2': 0, 'mlp_size_3': 0, 'kernel': 'Normal', 'loss_name': 'AlternativeNLLLoss'}. Best is trial 282 with value: 0.8551919812799864.[0m
[32m[I 2022-04-26 10:46:39,908][0m Trial 297 finished with value: 0.8393504453705012 and parameters: {'n_hidden': 512, 'mixture_components': 5, 'use_sparse_layer': True, 'use_sparse_loss': False, 'use_batchnorm': False, 'use_dropout': True, 'dropout': 0.29505650041478493, 'mlp_size_1': 6, 'mlp_size_2': 0, 'mlp_size_3': 0, 'kernel': 'Normal', 'loss_name': 'AlternativeNLLLoss'}. Best is trial 282 with value: 0.8551919812799864.[0m
[32m[I 2022-04-26 10:50:20,949][0m Trial 298 finished with value: 0.8468295669908429 and parameters: {'n_hidden': 512, 'mixture_components': 5, 'use_sparse_layer': True, 'use_sparse_loss': True, 'lmbd': 2.4907016215825473e-06, 'use_batchnorm': False, 'use_dropout': False, 'mlp_size_1': 6, 'mlp_size_2': 0, 'mlp_size_3': 0, 'kernel': 'Normal', 'loss_name': 'AlternativeNLLLoss'}. Best is trial 282 with value: 0.8551919812799864.[0m
[32m[I 2022-04-26 10:55:04,981][0m Trial 299 finished with value: 0.8503392368507526 and parameters: {'n_hidden': 512, 'mixture_components': 5, 'use_sparse_layer': True, 'use_sparse_loss': True, 'lmbd': 3.7152729278028635e-06, 'use_batchnorm': False, 'use_dropout': False, 'mlp_size_1': 6, 'mlp_size_2': 0, 'mlp_size_3': 0, 'kernel': 'Normal', 'loss_name': 'AlternativeNLLLoss'}. Best is trial 282 with value: 0.8551919812799864.[0m
[32m[I 2022-04-26 11:00:17,947][0m Trial 300 finished with value: 0.8505006637536967 and parameters: {'n_hidden': 128, 'mixture_components': 5, 'use_sparse_layer': True, 'use_sparse_loss': True, 'lmbd': 0.020770203079707977, 'use_batchnorm': False, 'use_dropout': False, 'mlp_size_1': 4, 'mlp_size_2': 0, 'mlp_size_3': 0, 'kernel': 'Normal', 'loss_name': 'AlternativeNLLLoss'}. Best is trial 282 with value: 0.8551919812799864.[0m
[32m[I 2022-04-26 11:05:06,431][0m Trial 301 finished with value: 0.8318370801723823 and parameters: {'n_hidden': 512, 'mixture_components': 6, 'use_sparse_layer': True, 'use_sparse_loss': True, 'lmbd': 2.30519123272073e-06, 'use_batchnorm': False, 'use_dropout': False, 'mlp_size_1': 6, 'mlp_size_2': 0, 'mlp_size_3': 0, 'kernel': 'Normal', 'loss_name': 'AlternativeNLLLoss'}. Best is trial 282 with value: 0.8551919812799864.[0m
[32m[I 2022-04-26 11:11:46,287][0m Trial 302 finished with value: 0.852070024747837 and parameters: {'n_hidden': 2048, 'mixture_components': 3, 'use_sparse_layer': True, 'use_sparse_loss': True, 'lmbd': 1.6765200643416568e-06, 'use_batchnorm': False, 'use_dropout': False, 'mlp_size_1': 7, 'mlp_size_2': 1, 'mlp_size_3': 0, 'kernel': 'Normal', 'loss_name': 'AlternativeNLLLoss'}. Best is trial 282 with value: 0.8551919812799864.[0m
[32m[I 2022-04-26 11:25:04,503][0m Trial 303 finished with value: 0.8439768157320398 and parameters: {'n_hidden': 2048, 'mixture_components': 5, 'use_sparse_layer': True, 'use_sparse_loss': True, 'lmbd': 1.0398962991966989e-05, 'use_batchnorm': True, 'use_dropout': False, 'mlp_size_1': 7, 'mlp_size_2': 1, 'mlp_size_3': 0, 'kernel': 'Normal', 'loss_name': 'AlternativeNLLLoss'}. Best is trial 282 with value: 0.8551919812799864.[0m
[32m[I 2022-04-26 11:28:09,631][0m Trial 304 finished with value: -1.0 and parameters: {'n_hidden': 2048, 'mixture_components': 3, 'use_sparse_layer': True, 'use_sparse_loss': True, 'lmbd': 0.00016411526404170866, 'use_batchnorm': False, 'use_dropout': False, 'mlp_size_1': 7, 'mlp_size_2': 1, 'mlp_size_3': 0, 'kernel': 'Exponential', 'loss_name': 'AlternativeNLLLoss'}. Best is trial 282 with value: 0.8551919812799864.[0m
[32m[I 2022-04-26 11:33:03,585][0m Trial 305 finished with value: 0.8312266039390515 and parameters: {'n_hidden': 1024, 'mixture_components': 5, 'use_sparse_layer': True, 'use_sparse_loss': True, 'lmbd': 5.0126245251591516e-06, 'use_batchnorm': False, 'use_dropout': False, 'mlp_size_1': 7, 'mlp_size_2': 0, 'mlp_size_3': 0, 'kernel': 'Normal', 'loss_name': 'AlternativeNLLLoss'}. Best is trial 282 with value: 0.8551919812799864.[0m
[32m[I 2022-04-26 11:38:55,186][0m Trial 306 finished with value: 0.8488640796825242 and parameters: {'n_hidden': 2048, 'mixture_components': 6, 'use_sparse_layer': True, 'use_sparse_loss': True, 'lmbd': 3.089424577691042e-06, 'use_batchnorm': False, 'use_dropout': False, 'mlp_size_1': 7, 'mlp_size_2': 1, 'mlp_size_3': 0, 'kernel': 'Normal', 'loss_name': 'AlternativeNLLLoss'}. Best is trial 282 with value: 0.8551919812799864.[0m
[32m[I 2022-04-26 11:45:47,708][0m Trial 307 finished with value: 0.8534908695267616 and parameters: {'n_hidden': 2048, 'mixture_components': 5, 'use_sparse_layer': True, 'use_sparse_loss': True, 'lmbd': 0.0002930667066059136, 'use_batchnorm': False, 'use_dropout': False, 'mlp_size_1': 7, 'mlp_size_2': 1, 'mlp_size_3': 0, 'kernel': 'Normal', 'loss_name': 'AlternativeNLLLoss'}. Best is trial 282 with value: 0.8551919812799864.[0m
[32m[I 2022-04-26 11:52:26,702][0m Trial 308 finished with value: 0.8508731833995645 and parameters: {'n_hidden': 2048, 'mixture_components': 3, 'use_sparse_layer': True, 'use_sparse_loss': True, 'lmbd': 0.001866904861838296, 'use_batchnorm': False, 'use_dropout': False, 'mlp_size_1': 8, 'mlp_size_2': 0, 'mlp_size_3': 0, 'kernel': 'Normal', 'loss_name': 'AlternativeNLLLoss'}. Best is trial 282 with value: 0.8551919812799864.[0m
[32m[I 2022-04-26 11:57:20,570][0m Trial 309 finished with value: 0.8394935855772652 and parameters: {'n_hidden': 2048, 'mixture_components': 5, 'use_sparse_layer': True, 'use_sparse_loss': True, 'lmbd': 9.379996548170005e-06, 'use_batchnorm': False, 'use_dropout': True, 'dropout': 0.2252516363692844, 'mlp_size_1': 7, 'mlp_size_2': 1, 'mlp_size_3': 0, 'kernel': 'Normal', 'loss_name': 'NLLLoss'}. Best is trial 282 with value: 0.8551919812799864.[0m
[32m[I 2022-04-26 12:02:41,589][0m Trial 310 finished with value: 0.8522331664946874 and parameters: {'n_hidden': 2048, 'mixture_components': 5, 'use_sparse_layer': True, 'use_sparse_loss': True, 'lmbd': 0.007111835729638296, 'use_batchnorm': False, 'use_dropout': False, 'mlp_size_1': 7, 'mlp_size_2': 1, 'mlp_size_3': 0, 'kernel': 'Normal', 'loss_name': 'AlternativeNLLLoss'}. Best is trial 282 with value: 0.8551919812799864.[0m
[32m[I 2022-04-26 12:08:49,120][0m Trial 311 finished with value: 0.8524573610762426 and parameters: {'n_hidden': 2048, 'mixture_components': 5, 'use_sparse_layer': True, 'use_sparse_loss': True, 'lmbd': 1.7312618168683013e-05, 'use_batchnorm': False, 'use_dropout': False, 'mlp_size_1': 7, 'mlp_size_2': 1, 'mlp_size_3': 0, 'kernel': 'Normal', 'loss_name': 'AlternativeNLLLoss'}. Best is trial 282 with value: 0.8551919812799864.[0m
[32m[I 2022-04-26 12:12:43,550][0m Trial 312 finished with value: 0.8326121361869772 and parameters: {'n_hidden': 512, 'mixture_components': 3, 'use_sparse_layer': True, 'use_sparse_loss': True, 'lmbd': 0.00012698601132757215, 'use_batchnorm': False, 'use_dropout': False, 'mlp_size_1': 6, 'mlp_size_2': 0, 'mlp_size_3': 0, 'kernel': 'Normal', 'loss_name': 'AlternativeNLLLoss'}. Best is trial 282 with value: 0.8551919812799864.[0m
[32m[I 2022-04-26 12:18:09,944][0m Trial 313 finished with value: 0.8489154194368942 and parameters: {'n_hidden': 2048, 'mixture_components': 6, 'use_sparse_layer': True, 'use_sparse_loss': True, 'lmbd': 5.594715524591842e-06, 'use_batchnorm': False, 'use_dropout': False, 'mlp_size_1': 7, 'mlp_size_2': 1, 'mlp_size_3': 0, 'kernel': 'Normal', 'loss_name': 'AlternativeNLLLoss'}. Best is trial 282 with value: 0.8551919812799864.[0m
[32m[I 2022-04-26 12:23:44,235][0m Trial 314 finished with value: 0.8509646367717506 and parameters: {'n_hidden': 2048, 'mixture_components': 3, 'use_sparse_layer': True, 'use_sparse_loss': True, 'lmbd': 0.001274035949890079, 'use_batchnorm': False, 'use_dropout': False, 'mlp_size_1': 7, 'mlp_size_2': 1, 'mlp_size_3': 0, 'kernel': 'Normal', 'loss_name': 'AlternativeNLLLoss'}. Best is trial 282 with value: 0.8551919812799864.[0m
[32m[I 2022-04-26 12:29:35,666][0m Trial 315 finished with value: 0.8534454803808078 and parameters: {'n_hidden': 2048, 'mixture_components': 5, 'use_sparse_layer': True, 'use_sparse_loss': False, 'use_batchnorm': False, 'use_dropout': False, 'mlp_size_1': 7, 'mlp_size_2': 1, 'mlp_size_3': 0, 'kernel': 'Normal', 'loss_name': 'AlternativeNLLLoss'}. Best is trial 282 with value: 0.8551919812799864.[0m
[32m[I 2022-04-26 12:34:57,021][0m Trial 316 finished with value: 0.8420626588228084 and parameters: {'n_hidden': 2048, 'mixture_components': 5, 'use_sparse_layer': True, 'use_sparse_loss': True, 'lmbd': 9.146894949039859e-05, 'use_batchnorm': False, 'use_dropout': False, 'mlp_size_1': 7, 'mlp_size_2': 1, 'mlp_size_3': 0, 'kernel': 'Normal', 'loss_name': 'AlternativeNLLLoss'}. Best is trial 282 with value: 0.8551919812799864.[0m
[32m[I 2022-04-26 12:41:26,617][0m Trial 317 finished with value: 0.847156544310043 and parameters: {'n_hidden': 64, 'mixture_components': 5, 'use_sparse_layer': True, 'use_sparse_loss': True, 'lmbd': 1.338021470511808e-05, 'use_batchnorm': False, 'use_dropout': False, 'mlp_size_1': 3, 'mlp_size_2': 0, 'mlp_size_3': 0, 'kernel': 'Normal', 'loss_name': 'AlternativeNLLLoss'}. Best is trial 282 with value: 0.8551919812799864.[0m
[32m[I 2022-04-26 12:46:35,422][0m Trial 318 finished with value: 0.6882061918415068 and parameters: {'n_hidden': 2048, 'mixture_components': 3, 'use_sparse_layer': True, 'use_sparse_loss': True, 'lmbd': 3.899100228856728e-06, 'use_batchnorm': False, 'use_dropout': False, 'mlp_size_1': 8, 'mlp_size_2': 0, 'mlp_size_3': 0, 'kernel': 'Normal', 'loss_name': 'AlternativeNLLLoss'}. Best is trial 282 with value: 0.8551919812799864.[0m
[32m[I 2022-04-26 12:51:46,196][0m Trial 319 finished with value: 0.47828948992344616 and parameters: {'n_hidden': 2048, 'mixture_components': 6, 'use_sparse_layer': True, 'use_sparse_loss': True, 'lmbd': 8.637889096770628e-06, 'use_batchnorm': False, 'use_dropout': False, 'mlp_size_1': 5, 'mlp_size_2': 1, 'mlp_size_3': 2, 'kernel': 'Normal', 'loss_name': 'AlternativeNLLLoss'}. Best is trial 282 with value: 0.8551919812799864.[0m
[32m[I 2022-04-26 12:55:33,699][0m Trial 320 finished with value: 0.8453176470339736 and parameters: {'n_hidden': 256, 'mixture_components': 3, 'use_sparse_layer': True, 'use_sparse_loss': True, 'lmbd': 1.4011622825161692e-06, 'use_batchnorm': False, 'use_dropout': True, 'dropout': 0.11423369351730428, 'mlp_size_1': 5, 'mlp_size_2': 0, 'mlp_size_3': 0, 'kernel': 'Normal', 'loss_name': 'AlternativeNLLLoss'}. Best is trial 282 with value: 0.8551919812799864.[0m
[32m[I 2022-04-26 13:00:48,588][0m Trial 321 finished with value: 0.834164394299193 and parameters: {'n_hidden': 2048, 'mixture_components': 5, 'use_sparse_layer': True, 'use_sparse_loss': True, 'lmbd': 6.721075643858252e-06, 'use_batchnorm': False, 'use_dropout': False, 'mlp_size_1': 0, 'mlp_size_2': 2, 'mlp_size_3': 5, 'kernel': 'Normal', 'loss_name': 'AlternativeNLLLoss'}. Best is trial 282 with value: 0.8551919812799864.[0m
[32m[I 2022-04-26 13:05:47,536][0m Trial 322 finished with value: 0.8410485796897976 and parameters: {'n_hidden': 2048, 'mixture_components': 5, 'use_sparse_layer': True, 'use_sparse_loss': True, 'lmbd': 2.499984615685719e-06, 'use_batchnorm': False, 'use_dropout': False, 'mlp_size_1': 7, 'mlp_size_2': 1, 'mlp_size_3': 0, 'kernel': 'Normal', 'loss_name': 'AlternativeNLLLoss'}. Best is trial 282 with value: 0.8551919812799864.[0m
[32m[I 2022-04-26 13:08:41,715][0m Trial 323 finished with value: -1.0 and parameters: {'n_hidden': 2048, 'mixture_components': 3, 'use_sparse_layer': True, 'use_sparse_loss': True, 'lmbd': 3.3140731989599604e-06, 'use_batchnorm': False, 'use_dropout': False, 'mlp_size_1': 7, 'mlp_size_2': 1, 'mlp_size_3': 0, 'kernel': 'Exponential', 'loss_name': 'AlternativeNLLLoss'}. Best is trial 282 with value: 0.8551919812799864.[0m
[32m[I 2022-04-26 13:14:28,775][0m Trial 324 finished with value: 0.853242189571928 and parameters: {'n_hidden': 2048, 'mixture_components': 5, 'use_sparse_layer': True, 'use_sparse_loss': True, 'lmbd': 4.565417775871724e-06, 'use_batchnorm': False, 'use_dropout': False, 'mlp_size_1': 7, 'mlp_size_2': 1, 'mlp_size_3': 0, 'kernel': 'Normal', 'loss_name': 'AlternativeNLLLoss'}. Best is trial 282 with value: 0.8551919812799864.[0m
[32m[I 2022-04-26 13:21:32,739][0m Trial 325 finished with value: 0.8333249986240071 and parameters: {'n_hidden': 32, 'mixture_components': 5, 'use_sparse_layer': True, 'use_sparse_loss': True, 'lmbd': 1.0799187936545652e-05, 'use_batchnorm': False, 'use_dropout': False, 'mlp_size_1': 2, 'mlp_size_2': 0, 'mlp_size_3': 0, 'kernel': 'Normal', 'loss_name': 'AlternativeNLLLoss'}. Best is trial 282 with value: 0.8551919812799864.[0m
[32m[I 2022-04-26 13:25:58,261][0m Trial 326 finished with value: 0.8442893794923988 and parameters: {'n_hidden': 512, 'mixture_components': 3, 'use_sparse_layer': True, 'use_sparse_loss': True, 'lmbd': 0.00021660594458813948, 'use_batchnorm': False, 'use_dropout': False, 'mlp_size_1': 6, 'mlp_size_2': 0, 'mlp_size_3': 0, 'kernel': 'Normal', 'loss_name': 'AlternativeNLLLoss'}. Best is trial 282 with value: 0.8551919812799864.[0m
[32m[I 2022-04-26 13:39:16,643][0m Trial 327 finished with value: 0.8440554387082692 and parameters: {'n_hidden': 2048, 'mixture_components': 6, 'use_sparse_layer': True, 'use_sparse_loss': True, 'lmbd': 6.975752587131864e-06, 'use_batchnorm': True, 'use_dropout': False, 'mlp_size_1': 7, 'mlp_size_2': 1, 'mlp_size_3': 0, 'kernel': 'Normal', 'loss_name': 'AlternativeNLLLoss'}. Best is trial 282 with value: 0.8551919812799864.[0m
