[32m[I 2022-04-14 03:22:43,248][0m Trial 762 finished with value: 0.8781988837082764 and parameters: {'loss': 'coxph', 'learning_rate': 0.0011600238947003906, 'n_estimators': 487, 'criterion': 'friedman_mse', 'min_samples_split': 4, 'min_samples_leaf': 1, 'min_weight_fraction_leaf': 0.04876581028239871, 'min_impurity_decrease': 0.3138482480885286, 'max_features': 0.9670991222231806, 'subsample': 0.7369368195339058, 'dropout_rate': 0.31044369312351805, 'ccp_alpha': 0.005691763434755616}. Best is trial 627 with value: 0.8808013426064705.[0m
[32m[I 2022-04-14 03:22:46,846][0m Trial 763 finished with value: 0.8525048636423126 and parameters: {'loss': 'coxph', 'learning_rate': 0.0010232546495408973, 'n_estimators': 152, 'criterion': 'friedman_mse', 'min_samples_split': 4, 'min_samples_leaf': 1, 'min_weight_fraction_leaf': 0.07513820223587903, 'min_impurity_decrease': 0.33865567778422845, 'max_features': 0.9239895781171535, 'subsample': 0.750891527796108, 'dropout_rate': 0.29031510421977386, 'ccp_alpha': 0.1741102576218206}. Best is trial 627 with value: 0.8808013426064705.[0m
[32m[I 2022-04-14 03:22:51,204][0m Trial 764 finished with value: 0.8774849721553512 and parameters: {'loss': 'coxph', 'learning_rate': 0.004109739495150356, 'n_estimators': 137, 'criterion': 'friedman_mse', 'min_samples_split': 4, 'min_samples_leaf': 2, 'min_weight_fraction_leaf': 0.05666265807377917, 'min_impurity_decrease': 0.2737579770390307, 'max_features': 0.9535428977619471, 'subsample': 0.6920614564921858, 'dropout_rate': 0.3098217826094117, 'ccp_alpha': 0.0021500949572167876}. Best is trial 627 with value: 0.8808013426064705.[0m
[32m[I 2022-04-14 03:22:55,129][0m Trial 765 finished with value: 0.7789216738774805 and parameters: {'loss': 'coxph', 'learning_rate': 0.004512787654556049, 'n_estimators': 131, 'criterion': 'friedman_mse', 'min_samples_split': 4, 'min_samples_leaf': 2, 'min_weight_fraction_leaf': 0.08580774321694332, 'min_impurity_decrease': 0.2312013854452482, 'max_features': 0.905222529059359, 'subsample': 0.6647759263206883, 'dropout_rate': 0.3155044703490697, 'ccp_alpha': 0.32865538157501334}. Best is trial 627 with value: 0.8808013426064705.[0m
[32m[I 2022-04-14 03:22:59,355][0m Trial 766 finished with value: 0.8662841777984033 and parameters: {'loss': 'coxph', 'learning_rate': 0.0011836020480540386, 'n_estimators': 138, 'criterion': 'friedman_mse', 'min_samples_split': 4, 'min_samples_leaf': 2, 'min_weight_fraction_leaf': 0.07251861900170813, 'min_impurity_decrease': 0.2680467608165674, 'max_features': 0.944699170571102, 'subsample': 0.6813493377362838, 'dropout_rate': 0.2761474910063211, 'ccp_alpha': 0.09760075123906126}. Best is trial 627 with value: 0.8808013426064705.[0m
[32m[I 2022-04-14 03:23:40,936][0m Trial 767 finished with value: 0.861614086040665 and parameters: {'loss': 'coxph', 'learning_rate': 0.0010094136895895003, 'n_estimators': 486, 'criterion': 'friedman_mse', 'min_samples_split': 4, 'min_samples_leaf': 2, 'min_weight_fraction_leaf': 0.06116656242934761, 'min_impurity_decrease': 0.2522748437078819, 'max_features': 0.9236825434198573, 'subsample': 0.6921277189381854, 'dropout_rate': 0.31435314332017567, 'ccp_alpha': 0.16826731545711113}. Best is trial 627 with value: 0.8808013426064705.[0m
[32m[I 2022-04-14 03:24:08,508][0m Trial 768 finished with value: 0.8719678059560689 and parameters: {'loss': 'coxph', 'learning_rate': 0.006695490780073148, 'n_estimators': 399, 'criterion': 'friedman_mse', 'min_samples_split': 4, 'min_samples_leaf': 2, 'min_weight_fraction_leaf': 0.056904464251798785, 'min_impurity_decrease': 0.2265934012645201, 'max_features': 0.955810437146792, 'subsample': 0.6504930330695144, 'dropout_rate': 0.29840880644072043, 'ccp_alpha': 0.0020011979161872304}. Best is trial 627 with value: 0.8808013426064705.[0m
[32m[I 2022-04-14 03:24:10,936][0m Trial 769 finished with value: 0.833987403070503 and parameters: {'loss': 'coxph', 'learning_rate': 0.003872566681321081, 'n_estimators': 119, 'criterion': 'friedman_mse', 'min_samples_split': 4, 'min_samples_leaf': 2, 'min_weight_fraction_leaf': 0.06702930357130743, 'min_impurity_decrease': 0.24492344543762265, 'max_features': 0.9041958141919938, 'subsample': 0.6769221130130735, 'dropout_rate': 0.3274709169420981, 'ccp_alpha': 0.24720379268669998}. Best is trial 627 with value: 0.8808013426064705.[0m
[32m[I 2022-04-14 03:24:13,305][0m Trial 770 finished with value: 0.8637051799859539 and parameters: {'loss': 'coxph', 'learning_rate': 0.005195967901795333, 'n_estimators': 136, 'criterion': 'friedman_mse', 'min_samples_split': 4, 'min_samples_leaf': 2, 'min_weight_fraction_leaf': 0.05227581533719966, 'min_impurity_decrease': 0.27178790263740316, 'max_features': 0.9343403641742783, 'subsample': 0.6933896685834215, 'dropout_rate': 0.6470475433064679, 'ccp_alpha': 0.10911377342164039}. Best is trial 627 with value: 0.8808013426064705.[0m
[32m[I 2022-04-14 03:24:16,564][0m Trial 771 finished with value: 0.8704700408657715 and parameters: {'loss': 'coxph', 'learning_rate': 0.0012846810563081116, 'n_estimators': 143, 'criterion': 'friedman_mse', 'min_samples_split': 4, 'min_samples_leaf': 2, 'min_weight_fraction_leaf': 0.08597830228861095, 'min_impurity_decrease': 0.37119549108046385, 'max_features': 0.9596093760735546, 'subsample': 0.7065541011945186, 'dropout_rate': 0.2767451595681545, 'ccp_alpha': 0.0946179567713598}. Best is trial 627 with value: 0.8808013426064705.[0m
[32m[I 2022-04-14 03:24:19,162][0m Trial 772 finished with value: 0.7208261717299823 and parameters: {'loss': 'coxph', 'learning_rate': 0.002422843578238931, 'n_estimators': 123, 'criterion': 'friedman_mse', 'min_samples_split': 4, 'min_samples_leaf': 2, 'min_weight_fraction_leaf': 0.44933204719474246, 'min_impurity_decrease': 0.8313550303283976, 'max_features': 0.8972076470331573, 'subsample': 0.703563542706219, 'dropout_rate': 0.26731274537123717, 'ccp_alpha': 0.23306230844197726}. Best is trial 627 with value: 0.8808013426064705.[0m
[32m[I 2022-04-14 03:24:21,935][0m Trial 773 finished with value: -0.36701869904596496 and parameters: {'loss': 'squared', 'learning_rate': 0.0015026273696778336, 'n_estimators': 130, 'criterion': 'friedman_mse', 'min_samples_split': 4, 'min_samples_leaf': 2, 'min_weight_fraction_leaf': 0.05955136805092335, 'min_impurity_decrease': 0.18136308795724454, 'max_features': 0.9354220067030389, 'subsample': 0.7164939431229994, 'dropout_rate': 0.30871716840125546, 'ccp_alpha': 0.08676964166451005}. Best is trial 627 with value: 0.8808013426064705.[0m
[32m[I 2022-04-14 03:24:52,368][0m Trial 774 finished with value: 0.855698265678354 and parameters: {'loss': 'coxph', 'learning_rate': 0.002032456176470834, 'n_estimators': 442, 'criterion': 'friedman_mse', 'min_samples_split': 3, 'min_samples_leaf': 2, 'min_weight_fraction_leaf': 0.24340252144094643, 'min_impurity_decrease': 0.2759747578520526, 'max_features': 0.9167538779805846, 'subsample': 0.6641273787075981, 'dropout_rate': 0.2925558472198009, 'ccp_alpha': 0.08920570480624974}. Best is trial 627 with value: 0.8808013426064705.[0m
[32m[I 2022-04-14 03:24:55,521][0m Trial 775 finished with value: 0.65 and parameters: {'loss': 'coxph', 'learning_rate': 0.0011024211570666274, 'n_estimators': 136, 'criterion': 'friedman_mse', 'min_samples_split': 4, 'min_samples_leaf': 2, 'min_weight_fraction_leaf': 0.02437424948587991, 'min_impurity_decrease': 0.3974192546296377, 'max_features': 0.9549808996873806, 'subsample': 0.7235853818192128, 'dropout_rate': 0.4204988222358835, 'ccp_alpha': 0.6804775185017815}. Best is trial 627 with value: 0.8808013426064705.[0m
[32m[I 2022-04-14 03:24:59,194][0m Trial 776 finished with value: 0.65 and parameters: {'loss': 'coxph', 'learning_rate': 0.0029636602412199237, 'n_estimators': 142, 'criterion': 'absolute_error', 'min_samples_split': 4, 'min_samples_leaf': 2, 'min_weight_fraction_leaf': 0.03629425830741058, 'min_impurity_decrease': 0.2853398594607597, 'max_features': 0.8958303857163227, 'subsample': 0.6882357863516788, 'dropout_rate': 0.30298362744053636, 'ccp_alpha': 2.84975644794041}. Best is trial 627 with value: 0.8808013426064705.[0m
[32m[I 2022-04-14 03:25:03,683][0m Trial 777 finished with value: 0.8589814080937593 and parameters: {'loss': 'coxph', 'learning_rate': 0.0008698546309417216, 'n_estimators': 126, 'criterion': 'friedman_mse', 'min_samples_split': 3, 'min_samples_leaf': 10, 'min_weight_fraction_leaf': 0.05153988933919725, 'min_impurity_decrease': 0.25925340694113236, 'max_features': 0.9315781111034038, 'subsample': 0.7027877105256017, 'dropout_rate': 0.32566348162718306, 'ccp_alpha': 0.0032021206062170585}. Best is trial 627 with value: 0.8808013426064705.[0m
[32m[I 2022-04-14 03:25:06,794][0m Trial 778 finished with value: 0.8516569750435646 and parameters: {'loss': 'coxph', 'learning_rate': 0.005979076885934695, 'n_estimators': 144, 'criterion': 'friedman_mse', 'min_samples_split': 10, 'min_samples_leaf': 2, 'min_weight_fraction_leaf': 0.06933928998085007, 'min_impurity_decrease': 0.196365125006676, 'max_features': 0.9616495643978179, 'subsample': 0.734539085385395, 'dropout_rate': 0.4384763401754862, 'ccp_alpha': 0.1763120817871077}. Best is trial 627 with value: 0.8808013426064705.[0m
[32m[I 2022-04-14 03:25:11,215][0m Trial 779 finished with value: 0.6524506958451449 and parameters: {'loss': 'coxph', 'learning_rate': 0.0042317909754362795, 'n_estimators': 147, 'criterion': 'friedman_mse', 'min_samples_split': 4, 'min_samples_leaf': 2, 'min_weight_fraction_leaf': 0.011133137155844392, 'min_impurity_decrease': 0.3541336272722736, 'max_features': 0.9469208479160485, 'subsample': 0.7256603351349001, 'dropout_rate': 0.27535411445692254, 'ccp_alpha': 0.3439397741672525}. Best is trial 627 with value: 0.8808013426064705.[0m
[32m[I 2022-04-14 03:25:42,788][0m Trial 780 finished with value: 0.8580250414992007 and parameters: {'loss': 'coxph', 'learning_rate': 0.015436934982676752, 'n_estimators': 469, 'criterion': 'friedman_mse', 'min_samples_split': 4, 'min_samples_leaf': 1, 'min_weight_fraction_leaf': 0.03116662843683216, 'min_impurity_decrease': 0.3227216403672776, 'max_features': 0.08496939406557674, 'subsample': 0.8020122389328619, 'dropout_rate': 0.4350582708971769, 'ccp_alpha': 0.0019724293641792835}. Best is trial 627 with value: 0.8808013426064705.[0m
[32m[I 2022-04-14 03:25:45,474][0m Trial 781 finished with value: 0.875096618391451 and parameters: {'loss': 'coxph', 'learning_rate': 0.0014126017270191507, 'n_estimators': 135, 'criterion': 'friedman_mse', 'min_samples_split': 4, 'min_samples_leaf': 2, 'min_weight_fraction_leaf': 0.04627152004118079, 'min_impurity_decrease': 0.39126494642020654, 'max_features': 0.9255051908976989, 'subsample': 0.6827898594748666, 'dropout_rate': 0.40153975894506777, 'ccp_alpha': 0.0013896261512209875}. Best is trial 627 with value: 0.8808013426064705.[0m
[32m[I 2022-04-14 03:25:47,969][0m Trial 782 finished with value: 0.8570309352207719 and parameters: {'loss': 'coxph', 'learning_rate': 0.009832792671953807, 'n_estimators': 136, 'criterion': 'friedman_mse', 'min_samples_split': 3, 'min_samples_leaf': 1, 'min_weight_fraction_leaf': 0.07769673409695732, 'min_impurity_decrease': 0.29224913406207953, 'max_features': 0.998830151277128, 'subsample': 0.743379088028732, 'dropout_rate': 0.43021710072328434, 'ccp_alpha': 0.17042741317667917}. Best is trial 627 with value: 0.8808013426064705.[0m
[32m[I 2022-04-14 03:26:25,695][0m Trial 783 finished with value: 0.8445739285147754 and parameters: {'loss': 'coxph', 'learning_rate': 0.002025809921463166, 'n_estimators': 520, 'criterion': 'friedman_mse', 'min_samples_split': 4, 'min_samples_leaf': 1, 'min_weight_fraction_leaf': 0.02065974151684903, 'min_impurity_decrease': 0.3623442623178629, 'max_features': 0.913852700272484, 'subsample': 0.13985522599627287, 'dropout_rate': 0.4035397505847862, 'ccp_alpha': 0.093101399379006}. Best is trial 627 with value: 0.8808013426064705.[0m
[32m[I 2022-04-14 03:26:28,526][0m Trial 784 finished with value: 0.65 and parameters: {'loss': 'coxph', 'learning_rate': 0.0027376226969721565, 'n_estimators': 122, 'criterion': 'squared_error', 'min_samples_split': 4, 'min_samples_leaf': 2, 'min_weight_fraction_leaf': 0.37970947794130977, 'min_impurity_decrease': 0.33522133884551497, 'max_features': 0.9477430628757095, 'subsample': 0.6491355242259224, 'dropout_rate': 0.3190592996249066, 'ccp_alpha': 4.275942517119318}. Best is trial 627 with value: 0.8808013426064705.[0m
[32m[I 2022-04-14 03:26:31,267][0m Trial 785 finished with value: 0.65 and parameters: {'loss': 'coxph', 'learning_rate': 0.003227032867083692, 'n_estimators': 155, 'criterion': 'friedman_mse', 'min_samples_split': 3, 'min_samples_leaf': 1, 'min_weight_fraction_leaf': 0.001191051589846788, 'min_impurity_decrease': 0.24189605209494155, 'max_features': 0.5658585946231, 'subsample': 0.7119085938156503, 'dropout_rate': 0.6330234216840406, 'ccp_alpha': 3.614935484512545}. Best is trial 627 with value: 0.8808013426064705.[0m
[32m[I 2022-04-14 03:26:36,360][0m Trial 786 finished with value: 0.65 and parameters: {'loss': 'coxph', 'learning_rate': 0.001834271021412436, 'n_estimators': 128, 'criterion': 'friedman_mse', 'min_samples_split': 4, 'min_samples_leaf': 1, 'min_weight_fraction_leaf': 0.039316922900061384, 'min_impurity_decrease': 0.25922096093344343, 'max_features': 0.9690280508583042, 'subsample': 0.7818035040264222, 'dropout_rate': 0.3027036092950157, 'ccp_alpha': 0.8224385564257776}. Best is trial 627 with value: 0.8808013426064705.[0m
[32m[I 2022-04-14 03:26:38,561][0m Trial 787 finished with value: 0.8538208044466508 and parameters: {'loss': 'coxph', 'learning_rate': 0.0011963473959696247, 'n_estimators': 150, 'criterion': 'friedman_mse', 'min_samples_split': 4, 'min_samples_leaf': 1, 'min_weight_fraction_leaf': 0.06311762554049724, 'min_impurity_decrease': 0.21967448030782183, 'max_features': 0.8915522035769817, 'subsample': 0.7490741252270336, 'dropout_rate': 0.7000094878189455, 'ccp_alpha': 0.21703151435009305}. Best is trial 627 with value: 0.8808013426064705.[0m
[32m[I 2022-04-14 03:26:51,046][0m Trial 788 finished with value: 0.8748689822204969 and parameters: {'loss': 'coxph', 'learning_rate': 0.00248351557953283, 'n_estimators': 286, 'criterion': 'friedman_mse', 'min_samples_split': 3, 'min_samples_leaf': 2, 'min_weight_fraction_leaf': 0.05195164386953041, 'min_impurity_decrease': 0.4004345765882209, 'max_features': 0.9659084886866939, 'subsample': 0.7719310677014445, 'dropout_rate': 0.33782472194630697, 'ccp_alpha': 0.08735535442747636}. Best is trial 627 with value: 0.8808013426064705.[0m
[32m[I 2022-04-14 03:26:52,825][0m Trial 789 finished with value: 0.8331807507070483 and parameters: {'loss': 'coxph', 'learning_rate': 0.0015005982379591542, 'n_estimators': 141, 'criterion': 'friedman_mse', 'min_samples_split': 4, 'min_samples_leaf': 1, 'min_weight_fraction_leaf': 0.027081211213649876, 'min_impurity_decrease': 0.3136451536325276, 'max_features': 0.9097339540436247, 'subsample': 0.6957545155054881, 'dropout_rate': 0.6721811915063709, 'ccp_alpha': 0.2714658760800045}. Best is trial 627 with value: 0.8808013426064705.[0m
[32m[I 2022-04-14 03:26:55,805][0m Trial 790 finished with value: 0.8512998212732908 and parameters: {'loss': 'coxph', 'learning_rate': 0.004080062387212422, 'n_estimators': 132, 'criterion': 'friedman_mse', 'min_samples_split': 4, 'min_samples_leaf': 2, 'min_weight_fraction_leaf': 0.015057359316044945, 'min_impurity_decrease': 0.28691294650495547, 'max_features': 0.9373758536486347, 'subsample': 0.800708361101176, 'dropout_rate': 0.37303152781916077, 'ccp_alpha': 0.1626466843081591}. Best is trial 627 with value: 0.8808013426064705.[0m
[32m[I 2022-04-14 03:27:13,474][0m Trial 791 finished with value: 0.8710749595101873 and parameters: {'loss': 'coxph', 'learning_rate': 0.0009593880298073803, 'n_estimators': 335, 'criterion': 'friedman_mse', 'min_samples_split': 3, 'min_samples_leaf': 1, 'min_weight_fraction_leaf': 0.03943733216784897, 'min_impurity_decrease': 0.37984510556040174, 'max_features': 0.984952438053243, 'subsample': 0.7286164724084185, 'dropout_rate': 0.4337946718507005, 'ccp_alpha': 0.08985076142496234}. Best is trial 627 with value: 0.8808013426064705.[0m
[32m[I 2022-04-14 03:27:36,564][0m Trial 792 finished with value: -0.3676120185288895 and parameters: {'loss': 'squared', 'learning_rate': 0.002082732375226563, 'n_estimators': 420, 'criterion': 'friedman_mse', 'min_samples_split': 4, 'min_samples_leaf': 2, 'min_weight_fraction_leaf': 0.05464310465210849, 'min_impurity_decrease': 0.34652449530245927, 'max_features': 0.9800087542183551, 'subsample': 0.7591653493497964, 'dropout_rate': 0.3915236425457306, 'ccp_alpha': 0.005672524933243683}. Best is trial 627 with value: 0.8808013426064705.[0m
[32m[I 2022-04-14 03:27:43,301][0m Trial 793 finished with value: 0.65 and parameters: {'loss': 'coxph', 'learning_rate': 0.002753619783417985, 'n_estimators': 181, 'criterion': 'friedman_mse', 'min_samples_split': 4, 'min_samples_leaf': 1, 'min_weight_fraction_leaf': 0.03081719892990153, 'min_impurity_decrease': 0.3639210796569398, 'max_features': 0.8919529612970056, 'subsample': 0.7142692232800397, 'dropout_rate': 0.28529331133526764, 'ccp_alpha': 0.43077515499907293}. Best is trial 627 with value: 0.8808013426064705.[0m
[32m[I 2022-04-14 03:28:26,590][0m Trial 794 finished with value: 0.8570506253634557 and parameters: {'loss': 'coxph', 'learning_rate': 0.007874339513039057, 'n_estimators': 550, 'criterion': 'friedman_mse', 'min_samples_split': 3, 'min_samples_leaf': 9, 'min_weight_fraction_leaf': 0.04401440044907521, 'min_impurity_decrease': 0.29905030123827303, 'max_features': 0.9537828964398263, 'subsample': 0.6752136572350969, 'dropout_rate': 0.4188046171330435, 'ccp_alpha': 0.0029011009996084015}. Best is trial 627 with value: 0.8808013426064705.[0m
[32m[I 2022-04-14 03:28:28,609][0m Trial 795 finished with value: 0.8466281577825949 and parameters: {'loss': 'coxph', 'learning_rate': 0.0017467327289565522, 'n_estimators': 128, 'criterion': 'friedman_mse', 'min_samples_split': 4, 'min_samples_leaf': 2, 'min_weight_fraction_leaf': 0.06742321138366435, 'min_impurity_decrease': 0.2705505135358521, 'max_features': 0.9996201368803503, 'subsample': 0.7782436466707013, 'dropout_rate': 0.601211268399321, 'ccp_alpha': 0.17417172448204984}. Best is trial 627 with value: 0.8808013426064705.[0m
[32m[I 2022-04-14 03:28:31,842][0m Trial 796 finished with value: 0.8658152721741128 and parameters: {'loss': 'coxph', 'learning_rate': 0.0035143353199434337, 'n_estimators': 114, 'criterion': 'friedman_mse', 'min_samples_split': 5, 'min_samples_leaf': 1, 'min_weight_fraction_leaf': 0.021094496678459404, 'min_impurity_decrease': 0.31941363002810924, 'max_features': 0.9334502624824219, 'subsample': 0.7394146960229124, 'dropout_rate': 0.3466575575559143, 'ccp_alpha': 0.09311911908546444}. Best is trial 627 with value: 0.8808013426064705.[0m
[32m[I 2022-04-14 03:28:38,742][0m Trial 797 finished with value: 0.660872981146427 and parameters: {'loss': 'coxph', 'learning_rate': 0.005010256712260331, 'n_estimators': 197, 'criterion': 'friedman_mse', 'min_samples_split': 9, 'min_samples_leaf': 1, 'min_weight_fraction_leaf': 0.08153732946842615, 'min_impurity_decrease': 0.24159275976925992, 'max_features': 0.4444591373069847, 'subsample': 0.789727691266526, 'dropout_rate': 0.38921635791395925, 'ccp_alpha': 0.2812241462408735}. Best is trial 627 with value: 0.8808013426064705.[0m
[32m[I 2022-04-14 03:28:44,392][0m Trial 798 finished with value: 0.8732962087119576 and parameters: {'loss': 'coxph', 'learning_rate': 0.0012355183627996936, 'n_estimators': 190, 'criterion': 'friedman_mse', 'min_samples_split': 4, 'min_samples_leaf': 1, 'min_weight_fraction_leaf': 0.049996474466101615, 'min_impurity_decrease': 0.40245145497835055, 'max_features': 0.9649564748824425, 'subsample': 0.7541389850371313, 'dropout_rate': 0.3298676781081109, 'ccp_alpha': 0.09305932995661947}. Best is trial 627 with value: 0.8808013426064705.[0m
[32m[I 2022-04-14 03:28:51,470][0m Trial 799 finished with value: 0.65 and parameters: {'loss': 'coxph', 'learning_rate': 0.002238041036577487, 'n_estimators': 237, 'criterion': 'absolute_error', 'min_samples_split': 3, 'min_samples_leaf': 2, 'min_weight_fraction_leaf': 0.034150303197879976, 'min_impurity_decrease': 0.2913019847948921, 'max_features': 0.29709152818704065, 'subsample': 0.7010603798323208, 'dropout_rate': 0.4395454699055767, 'ccp_alpha': 0.005648552903594482}. Best is trial 627 with value: 0.8808013426064705.[0m
[32m[I 2022-04-14 03:28:54,690][0m Trial 800 finished with value: 0.8742759548144734 and parameters: {'loss': 'coxph', 'learning_rate': 0.001510364279348647, 'n_estimators': 156, 'criterion': 'friedman_mse', 'min_samples_split': 4, 'min_samples_leaf': 1, 'min_weight_fraction_leaf': 0.05648340361597802, 'min_impurity_decrease': 0.33283102235574596, 'max_features': 0.9117175333347671, 'subsample': 0.7273621514201735, 'dropout_rate': 0.41297669798583353, 'ccp_alpha': 0.003033829871663394}. Best is trial 627 with value: 0.8808013426064705.[0m
[32m[I 2022-04-14 03:29:03,778][0m Trial 801 finished with value: 0.8475223043483119 and parameters: {'loss': 'coxph', 'learning_rate': 0.0008293550049014885, 'n_estimators': 259, 'criterion': 'friedman_mse', 'min_samples_split': 4, 'min_samples_leaf': 1, 'min_weight_fraction_leaf': 0.013878128046122238, 'min_impurity_decrease': 0.3763815858040677, 'max_features': 0.9995037766868421, 'subsample': 0.8003441891146477, 'dropout_rate': 0.3685824314955719, 'ccp_alpha': 0.1893905733073758}. Best is trial 627 with value: 0.8808013426064705.[0m
