[32m[I 2022-04-14 13:36:02,762][0m Trial 363 finished with value: 0.7403408355140821 and parameters: {'loss': 'coxph', 'learning_rate': 0.0013721433967670063, 'n_estimators': 893, 'criterion': 'friedman_mse', 'min_samples_split': 9, 'min_samples_leaf': 1, 'min_weight_fraction_leaf': 0.09572317444212737, 'min_impurity_decrease': 0.06291550914165574, 'max_features': 0.9693638337023488, 'subsample': 0.7624628944098527, 'dropout_rate': 0.23405869853105965, 'ccp_alpha': 0.08778752593135505}. Best is trial 296 with value: 0.7450864268862003.[0m
[32m[I 2022-04-14 13:37:39,838][0m Trial 364 finished with value: 0.7114568084095435 and parameters: {'loss': 'coxph', 'learning_rate': 0.000983107506448718, 'n_estimators': 885, 'criterion': 'friedman_mse', 'min_samples_split': 9, 'min_samples_leaf': 1, 'min_weight_fraction_leaf': 0.09974711426656832, 'min_impurity_decrease': 0.05873767009847105, 'max_features': 0.924539963116701, 'subsample': 0.7585248569438859, 'dropout_rate': 0.25475005760547614, 'ccp_alpha': 0.16730144231023714}. Best is trial 296 with value: 0.7450864268862003.[0m
[32m[I 2022-04-14 13:39:08,999][0m Trial 365 finished with value: 0.7434822944343351 and parameters: {'loss': 'coxph', 'learning_rate': 0.0013433025300183088, 'n_estimators': 830, 'criterion': 'friedman_mse', 'min_samples_split': 9, 'min_samples_leaf': 1, 'min_weight_fraction_leaf': 0.09542739461496438, 'min_impurity_decrease': 0.07413875576911264, 'max_features': 0.968820605671344, 'subsample': 0.7759710246269639, 'dropout_rate': 0.23919524024033512, 'ccp_alpha': 0.08552251381204355}. Best is trial 296 with value: 0.7450864268862003.[0m
[32m[I 2022-04-14 13:40:43,928][0m Trial 366 finished with value: 0.26432599700296466 and parameters: {'loss': 'squared', 'learning_rate': 0.001296743895681173, 'n_estimators': 845, 'criterion': 'friedman_mse', 'min_samples_split': 9, 'min_samples_leaf': 1, 'min_weight_fraction_leaf': 0.09657856131247079, 'min_impurity_decrease': 0.0699676430314269, 'max_features': 0.9635314804883366, 'subsample': 0.7831264742926737, 'dropout_rate': 0.23991200289947284, 'ccp_alpha': 0.0031068505466790436}. Best is trial 296 with value: 0.7450864268862003.[0m
[32m[I 2022-04-14 13:42:27,281][0m Trial 367 finished with value: 0.5527348098291107 and parameters: {'loss': 'coxph', 'learning_rate': 0.0008961336871144048, 'n_estimators': 902, 'criterion': 'friedman_mse', 'min_samples_split': 10, 'min_samples_leaf': 1, 'min_weight_fraction_leaf': 0.0937909802559952, 'min_impurity_decrease': 0.05331824732466972, 'max_features': 0.9847480121456241, 'subsample': 0.8011795549630787, 'dropout_rate': 0.2436674475636502, 'ccp_alpha': 0.2833729467094136}. Best is trial 296 with value: 0.7450864268862003.[0m
[32m[I 2022-04-14 13:43:55,373][0m Trial 368 finished with value: 0.7427910028560998 and parameters: {'loss': 'coxph', 'learning_rate': 0.0013080673349042187, 'n_estimators': 855, 'criterion': 'friedman_mse', 'min_samples_split': 9, 'min_samples_leaf': 1, 'min_weight_fraction_leaf': 0.09389688857213621, 'min_impurity_decrease': 0.07984387073416797, 'max_features': 0.9829150375871902, 'subsample': 0.7583789313280483, 'dropout_rate': 0.272197516981797, 'ccp_alpha': 0.08694466996229454}. Best is trial 296 with value: 0.7450864268862003.[0m
[32m[I 2022-04-14 13:45:33,187][0m Trial 369 finished with value: 0.7128949400632172 and parameters: {'loss': 'coxph', 'learning_rate': 0.0011601609752974794, 'n_estimators': 910, 'criterion': 'friedman_mse', 'min_samples_split': 9, 'min_samples_leaf': 1, 'min_weight_fraction_leaf': 0.0953452743857352, 'min_impurity_decrease': 0.07559983025604217, 'max_features': 0.9612047624733981, 'subsample': 0.7708946743819081, 'dropout_rate': 0.2733788209817284, 'ccp_alpha': 0.1857701242202142}. Best is trial 296 with value: 0.7450864268862003.[0m
[32m[I 2022-04-14 13:46:58,652][0m Trial 370 finished with value: 0.743857911062754 and parameters: {'loss': 'coxph', 'learning_rate': 0.0013377438419224401, 'n_estimators': 834, 'criterion': 'friedman_mse', 'min_samples_split': 9, 'min_samples_leaf': 1, 'min_weight_fraction_leaf': 0.09133381650243527, 'min_impurity_decrease': 0.05879590066834653, 'max_features': 0.9701424852174136, 'subsample': 0.7371219307772123, 'dropout_rate': 0.26715313777335553, 'ccp_alpha': 0.08380398648986147}. Best is trial 296 with value: 0.7450864268862003.[0m
[32m[I 2022-04-14 13:48:16,664][0m Trial 371 finished with value: 0.6645776030672617 and parameters: {'loss': 'coxph', 'learning_rate': 0.001409544586675393, 'n_estimators': 790, 'criterion': 'friedman_mse', 'min_samples_split': 9, 'min_samples_leaf': 1, 'min_weight_fraction_leaf': 0.09264758343624942, 'min_impurity_decrease': 0.05630550218366605, 'max_features': 0.9945838206451009, 'subsample': 0.7428296969503002, 'dropout_rate': 0.2616416421577016, 'ccp_alpha': 0.25912111740474886}. Best is trial 296 with value: 0.7450864268862003.[0m
[32m[I 2022-04-14 13:49:44,551][0m Trial 372 finished with value: 0.746139292449983 and parameters: {'loss': 'coxph', 'learning_rate': 0.0014166943794320889, 'n_estimators': 823, 'criterion': 'friedman_mse', 'min_samples_split': 9, 'min_samples_leaf': 1, 'min_weight_fraction_leaf': 0.1006887058530829, 'min_impurity_decrease': 0.056572826056215955, 'max_features': 0.9694250694420548, 'subsample': 0.8075987915511744, 'dropout_rate': 0.24430796126257256, 'ccp_alpha': 0.00101528610203043}. Best is trial 372 with value: 0.746139292449983.[0m
[32m[I 2022-04-14 13:51:10,400][0m Trial 373 finished with value: 0.7214396942811854 and parameters: {'loss': 'coxph', 'learning_rate': 0.0013318914263263668, 'n_estimators': 826, 'criterion': 'friedman_mse', 'min_samples_split': 9, 'min_samples_leaf': 1, 'min_weight_fraction_leaf': 0.1023641839955985, 'min_impurity_decrease': 0.07365300122995831, 'max_features': 0.9693961927291582, 'subsample': 0.8040337193551943, 'dropout_rate': 0.27769171629742767, 'ccp_alpha': 0.16368327064227656}. Best is trial 372 with value: 0.746139292449983.[0m
[32m[I 2022-04-14 13:53:07,272][0m Trial 374 finished with value: 0.7548896802964876 and parameters: {'loss': 'coxph', 'learning_rate': 0.0015859523653224585, 'n_estimators': 931, 'criterion': 'friedman_mse', 'min_samples_split': 9, 'min_samples_leaf': 1, 'min_weight_fraction_leaf': 0.09230934118676648, 'min_impurity_decrease': 0.055658466458127415, 'max_features': 0.9659689076316648, 'subsample': 0.839995906087831, 'dropout_rate': 0.26349963123929604, 'ccp_alpha': 0.00407063922405795}. Best is trial 374 with value: 0.7548896802964876.[0m
[32m[I 2022-04-14 13:53:21,558][0m Trial 375 finished with value: 0.7522586954257678 and parameters: {'loss': 'coxph', 'learning_rate': 0.0013922145077478875, 'n_estimators': 308, 'criterion': 'friedman_mse', 'min_samples_split': 9, 'min_samples_leaf': 1, 'min_weight_fraction_leaf': 0.09063326387694419, 'min_impurity_decrease': 0.05338359881830977, 'max_features': 0.9790654403742093, 'subsample': 0.8528422583665508, 'dropout_rate': 0.24092806753469886, 'ccp_alpha': 0.005727626350527792}. Best is trial 374 with value: 0.7548896802964876.[0m
[32m[I 2022-04-14 13:53:40,021][0m Trial 376 finished with value: 0.7489931970297923 and parameters: {'loss': 'coxph', 'learning_rate': 0.0015191094473467862, 'n_estimators': 356, 'criterion': 'friedman_mse', 'min_samples_split': 9, 'min_samples_leaf': 1, 'min_weight_fraction_leaf': 0.09163248933501901, 'min_impurity_decrease': 0.04988232444424115, 'max_features': 0.9992433510551826, 'subsample': 0.8426373490464817, 'dropout_rate': 0.2557314589588225, 'ccp_alpha': 0.0011591877342060491}. Best is trial 374 with value: 0.7548896802964876.[0m
[32m[I 2022-04-14 13:53:52,933][0m Trial 377 finished with value: 0.752225445254736 and parameters: {'loss': 'coxph', 'learning_rate': 0.0015670123793169117, 'n_estimators': 293, 'criterion': 'friedman_mse', 'min_samples_split': 9, 'min_samples_leaf': 1, 'min_weight_fraction_leaf': 0.09067167294558544, 'min_impurity_decrease': 0.03457282588861113, 'max_features': 0.9978778611269701, 'subsample': 0.843837228239884, 'dropout_rate': 0.25592413793841895, 'ccp_alpha': 0.0011139582703503484}. Best is trial 374 with value: 0.7548896802964876.[0m
[32m[I 2022-04-14 13:54:02,448][0m Trial 378 finished with value: 0.7499699979830392 and parameters: {'loss': 'coxph', 'learning_rate': 0.0015969431326722254, 'n_estimators': 305, 'criterion': 'friedman_mse', 'min_samples_split': 9, 'min_samples_leaf': 1, 'min_weight_fraction_leaf': 0.08706813784832189, 'min_impurity_decrease': 0.03596294217350592, 'max_features': 0.9838748505768461, 'subsample': 0.8465044913081956, 'dropout_rate': 0.484949782062103, 'ccp_alpha': 0.013774751983899321}. Best is trial 374 with value: 0.7548896802964876.[0m
[32m[I 2022-04-14 13:54:11,031][0m Trial 379 finished with value: 0.7476629964597139 and parameters: {'loss': 'coxph', 'learning_rate': 0.0016246781081360505, 'n_estimators': 303, 'criterion': 'friedman_mse', 'min_samples_split': 9, 'min_samples_leaf': 1, 'min_weight_fraction_leaf': 0.08335260401424112, 'min_impurity_decrease': 0.03270431824279871, 'max_features': 0.999225999858403, 'subsample': 0.8482802231453281, 'dropout_rate': 0.5112032957549221, 'ccp_alpha': 0.014121665294038865}. Best is trial 374 with value: 0.7548896802964876.[0m
[32m[I 2022-04-14 13:54:23,266][0m Trial 380 finished with value: 0.7445827126839841 and parameters: {'loss': 'coxph', 'learning_rate': 0.0016820511360569634, 'n_estimators': 308, 'criterion': 'friedman_mse', 'min_samples_split': 9, 'min_samples_leaf': 1, 'min_weight_fraction_leaf': 0.08672795320019483, 'min_impurity_decrease': 0.02258893480017836, 'max_features': 0.9877810501074494, 'subsample': 0.8449399546557084, 'dropout_rate': 0.2618652763684771, 'ccp_alpha': 0.02385979530449417}. Best is trial 374 with value: 0.7548896802964876.[0m
[32m[I 2022-04-14 13:54:36,308][0m Trial 381 finished with value: 0.7512483090416944 and parameters: {'loss': 'coxph', 'learning_rate': 0.001658358265965554, 'n_estimators': 307, 'criterion': 'friedman_mse', 'min_samples_split': 9, 'min_samples_leaf': 1, 'min_weight_fraction_leaf': 0.08623205611546472, 'min_impurity_decrease': 0.019536718508075618, 'max_features': 0.9952823625391481, 'subsample': 0.8433045803116574, 'dropout_rate': 0.2628731537619551, 'ccp_alpha': 0.014329245402779165}. Best is trial 374 with value: 0.7548896802964876.[0m
[32m[I 2022-04-14 13:54:46,604][0m Trial 382 finished with value: 0.7516429931343134 and parameters: {'loss': 'coxph', 'learning_rate': 0.0017854708626251841, 'n_estimators': 308, 'criterion': 'friedman_mse', 'min_samples_split': 9, 'min_samples_leaf': 1, 'min_weight_fraction_leaf': 0.09036730754558159, 'min_impurity_decrease': 0.021173617761483167, 'max_features': 0.9967980951994558, 'subsample': 0.8492546885994748, 'dropout_rate': 0.45292508305096907, 'ccp_alpha': 0.00753099933642893}. Best is trial 374 with value: 0.7548896802964876.[0m
[32m[I 2022-04-14 13:54:55,804][0m Trial 383 finished with value: 0.6677303594599188 and parameters: {'loss': 'coxph', 'learning_rate': 0.001692440156092125, 'n_estimators': 307, 'criterion': 'friedman_mse', 'min_samples_split': 9, 'min_samples_leaf': 1, 'min_weight_fraction_leaf': 0.24018687978788564, 'min_impurity_decrease': 0.003879683875807359, 'max_features': 0.9946410503936154, 'subsample': 0.8394076957004649, 'dropout_rate': 0.4869142969775059, 'ccp_alpha': 0.0028601302063874265}. Best is trial 374 with value: 0.7548896802964876.[0m
[32m[I 2022-04-14 13:55:04,549][0m Trial 384 finished with value: 0.7341468010852635 and parameters: {'loss': 'coxph', 'learning_rate': 0.001794571765292985, 'n_estimators': 286, 'criterion': 'friedman_mse', 'min_samples_split': 9, 'min_samples_leaf': 1, 'min_weight_fraction_leaf': 0.08636237675514624, 'min_impurity_decrease': 0.019591815263551006, 'max_features': 0.9993025100100296, 'subsample': 0.898366223968558, 'dropout_rate': 0.46408388502192244, 'ccp_alpha': 0.01738454317822037}. Best is trial 374 with value: 0.7548896802964876.[0m
[32m[I 2022-04-14 13:55:15,260][0m Trial 385 finished with value: 0.7468388778105642 and parameters: {'loss': 'coxph', 'learning_rate': 0.0022942978751781503, 'n_estimators': 315, 'criterion': 'friedman_mse', 'min_samples_split': 9, 'min_samples_leaf': 1, 'min_weight_fraction_leaf': 0.08907718897676488, 'min_impurity_decrease': 0.02259922403443679, 'max_features': 0.9863314508518625, 'subsample': 0.8460346471754943, 'dropout_rate': 0.5311291900736516, 'ccp_alpha': 0.0034759482131973243}. Best is trial 374 with value: 0.7548896802964876.[0m
[32m[I 2022-04-14 13:55:26,097][0m Trial 386 finished with value: 0.7472957661273377 and parameters: {'loss': 'coxph', 'learning_rate': 0.0016646568555044473, 'n_estimators': 324, 'criterion': 'friedman_mse', 'min_samples_split': 9, 'min_samples_leaf': 1, 'min_weight_fraction_leaf': 0.08606923297377082, 'min_impurity_decrease': 0.014075130000394436, 'max_features': 0.9802625511071769, 'subsample': 0.8572001836685812, 'dropout_rate': 0.5162983115744767, 'ccp_alpha': 0.003479129974859012}. Best is trial 374 with value: 0.7548896802964876.[0m
[32m[I 2022-04-14 13:55:36,079][0m Trial 387 finished with value: 0.6900926406252363 and parameters: {'loss': 'coxph', 'learning_rate': 0.0021843849826159783, 'n_estimators': 326, 'criterion': 'friedman_mse', 'min_samples_split': 9, 'min_samples_leaf': 1, 'min_weight_fraction_leaf': 0.07516676074919353, 'min_impurity_decrease': 0.007749057756404505, 'max_features': 0.9838060074108746, 'subsample': 0.8572668277436194, 'dropout_rate': 0.5302329582823592, 'ccp_alpha': 0.18603997251927573}. Best is trial 374 with value: 0.7548896802964876.[0m
[32m[I 2022-04-14 13:55:44,918][0m Trial 388 finished with value: 0.2543899760879233 and parameters: {'loss': 'squared', 'learning_rate': 0.0028081021722521364, 'n_estimators': 300, 'criterion': 'friedman_mse', 'min_samples_split': 9, 'min_samples_leaf': 1, 'min_weight_fraction_leaf': 0.08465594054584144, 'min_impurity_decrease': 0.017447072715296795, 'max_features': 0.9816882575120605, 'subsample': 0.8893467162706679, 'dropout_rate': 0.5099090468442197, 'ccp_alpha': 0.014551301691310959}. Best is trial 374 with value: 0.7548896802964876.[0m
[32m[I 2022-04-14 13:55:55,557][0m Trial 389 finished with value: 0.744285131488846 and parameters: {'loss': 'coxph', 'learning_rate': 0.001572600660359921, 'n_estimators': 314, 'criterion': 'friedman_mse', 'min_samples_split': 9, 'min_samples_leaf': 1, 'min_weight_fraction_leaf': 0.08436102295228246, 'min_impurity_decrease': 0.021176289401584347, 'max_features': 0.9989376534132696, 'subsample': 0.8373762477259495, 'dropout_rate': 0.5032247514755178, 'ccp_alpha': 0.012342028702776384}. Best is trial 374 with value: 0.7548896802964876.[0m
[32m[I 2022-04-14 13:56:03,185][0m Trial 390 finished with value: 0.6918733831131366 and parameters: {'loss': 'coxph', 'learning_rate': 0.0016062728056307817, 'n_estimators': 274, 'criterion': 'friedman_mse', 'min_samples_split': 9, 'min_samples_leaf': 1, 'min_weight_fraction_leaf': 0.08672146156357924, 'min_impurity_decrease': 0.022218525076281484, 'max_features': 0.9973034931325946, 'subsample': 0.8398748011294104, 'dropout_rate': 0.50362733366114, 'ccp_alpha': 0.16285272551854124}. Best is trial 374 with value: 0.7548896802964876.[0m
[32m[I 2022-04-14 13:56:17,256][0m Trial 391 finished with value: 0.7535967933305951 and parameters: {'loss': 'coxph', 'learning_rate': 0.002501140962547227, 'n_estimators': 342, 'criterion': 'friedman_mse', 'min_samples_split': 9, 'min_samples_leaf': 1, 'min_weight_fraction_leaf': 0.07697754613865024, 'min_impurity_decrease': 0.023194928229240092, 'max_features': 0.9757249381938535, 'subsample': 0.8341663797991343, 'dropout_rate': 0.4726526094614615, 'ccp_alpha': 0.002709577704718141}. Best is trial 374 with value: 0.7548896802964876.[0m
[32m[I 2022-04-14 13:56:28,778][0m Trial 392 finished with value: 0.6903034027510592 and parameters: {'loss': 'coxph', 'learning_rate': 0.002602406825671659, 'n_estimators': 339, 'criterion': 'friedman_mse', 'min_samples_split': 9, 'min_samples_leaf': 1, 'min_weight_fraction_leaf': 0.07518776856625438, 'min_impurity_decrease': 0.019466968155576567, 'max_features': 0.9709285295960612, 'subsample': 0.8360541070258736, 'dropout_rate': 0.5581089529855312, 'ccp_alpha': 0.17824759719750827}. Best is trial 374 with value: 0.7548896802964876.[0m
[32m[I 2022-04-14 13:56:40,894][0m Trial 393 finished with value: 0.7349317694417368 and parameters: {'loss': 'coxph', 'learning_rate': 0.0022270761758813873, 'n_estimators': 323, 'criterion': 'friedman_mse', 'min_samples_split': 9, 'min_samples_leaf': 1, 'min_weight_fraction_leaf': 0.07497298612595293, 'min_impurity_decrease': 0.001303752483504332, 'max_features': 0.9759130521114411, 'subsample': 0.8876761416118785, 'dropout_rate': 0.46194123091251604, 'ccp_alpha': 0.00637369836791842}. Best is trial 374 with value: 0.7548896802964876.[0m
[32m[I 2022-04-14 13:56:53,606][0m Trial 394 finished with value: 0.7466800638358833 and parameters: {'loss': 'coxph', 'learning_rate': 0.002940714968016509, 'n_estimators': 354, 'criterion': 'friedman_mse', 'min_samples_split': 9, 'min_samples_leaf': 1, 'min_weight_fraction_leaf': 0.08539979180786854, 'min_impurity_decrease': 0.02928666867446396, 'max_features': 0.9526293083094302, 'subsample': 0.8571959981593226, 'dropout_rate': 0.5219269452133217, 'ccp_alpha': 0.001353548480135065}. Best is trial 374 with value: 0.7548896802964876.[0m
[32m[I 2022-04-14 13:57:05,782][0m Trial 395 finished with value: 0.7427173388409867 and parameters: {'loss': 'coxph', 'learning_rate': 0.0031748585562812637, 'n_estimators': 359, 'criterion': 'friedman_mse', 'min_samples_split': 9, 'min_samples_leaf': 1, 'min_weight_fraction_leaf': 0.08494639032640987, 'min_impurity_decrease': 0.0280541844548641, 'max_features': 0.9971785486585865, 'subsample': 0.8604762079025341, 'dropout_rate': 0.5340080671730442, 'ccp_alpha': 0.08164806870142087}. Best is trial 374 with value: 0.7548896802964876.[0m
[32m[I 2022-04-14 13:57:16,190][0m Trial 396 finished with value: 0.7561160925059711 and parameters: {'loss': 'coxph', 'learning_rate': 0.0028267293948390773, 'n_estimators': 313, 'criterion': 'friedman_mse', 'min_samples_split': 9, 'min_samples_leaf': 1, 'min_weight_fraction_leaf': 0.07254064803190903, 'min_impurity_decrease': 0.030570125347672193, 'max_features': 0.9522729959353881, 'subsample': 0.8482207162948905, 'dropout_rate': 0.4356184392181681, 'ccp_alpha': 0.002866632782171065}. Best is trial 396 with value: 0.7561160925059711.[0m
[32m[I 2022-04-14 13:57:28,244][0m Trial 397 finished with value: 0.7109485334957064 and parameters: {'loss': 'coxph', 'learning_rate': 0.0029272176733341594, 'n_estimators': 312, 'criterion': 'friedman_mse', 'min_samples_split': 9, 'min_samples_leaf': 1, 'min_weight_fraction_leaf': 0.06994741175690808, 'min_impurity_decrease': 0.030050068957844227, 'max_features': 0.9548683483033905, 'subsample': 0.825066567141331, 'dropout_rate': 0.433730160704491, 'ccp_alpha': 0.16488121877672304}. Best is trial 396 with value: 0.7561160925059711.[0m
[32m[I 2022-04-14 13:57:37,607][0m Trial 398 finished with value: 0.7244682201836283 and parameters: {'loss': 'coxph', 'learning_rate': 0.0027247534691727613, 'n_estimators': 294, 'criterion': 'friedman_mse', 'min_samples_split': 9, 'min_samples_leaf': 10, 'min_weight_fraction_leaf': 0.0770518348459944, 'min_impurity_decrease': 0.00275269142496376, 'max_features': 0.9757190621778352, 'subsample': 0.9109837835937792, 'dropout_rate': 0.4912172575946321, 'ccp_alpha': 0.08202186395438486}. Best is trial 396 with value: 0.7561160925059711.[0m
[32m[I 2022-04-14 13:57:48,851][0m Trial 399 finished with value: 0.5 and parameters: {'loss': 'coxph', 'learning_rate': 0.002427538702490422, 'n_estimators': 343, 'criterion': 'friedman_mse', 'min_samples_split': 9, 'min_samples_leaf': 1, 'min_weight_fraction_leaf': 0.08408530210193368, 'min_impurity_decrease': 0.022369514294020787, 'max_features': 0.9486073908326735, 'subsample': 0.8446141038672694, 'dropout_rate': 0.5140735346116793, 'ccp_alpha': 4.995334439405202}. Best is trial 396 with value: 0.7561160925059711.[0m
[32m[I 2022-04-14 13:57:59,113][0m Trial 400 finished with value: 0.7302891724039091 and parameters: {'loss': 'coxph', 'learning_rate': 0.0032280284970495786, 'n_estimators': 316, 'criterion': 'friedman_mse', 'min_samples_split': 9, 'min_samples_leaf': 1, 'min_weight_fraction_leaf': 0.06741100469300831, 'min_impurity_decrease': 0.032235653767537086, 'max_features': 0.9982937653531941, 'subsample': 0.8782150905397023, 'dropout_rate': 0.44545333982423163, 'ccp_alpha': 0.0011908293717136347}. Best is trial 396 with value: 0.7561160925059711.[0m
[32m[I 2022-04-14 13:58:07,525][0m Trial 401 finished with value: 0.6203561347087382 and parameters: {'loss': 'coxph', 'learning_rate': 0.001972987411267623, 'n_estimators': 293, 'criterion': 'friedman_mse', 'min_samples_split': 9, 'min_samples_leaf': 1, 'min_weight_fraction_leaf': 0.07515013457136986, 'min_impurity_decrease': 0.03581626182377715, 'max_features': 0.9724755882148971, 'subsample': 0.8512201580100187, 'dropout_rate': 0.46664401844117526, 'ccp_alpha': 0.22541698939226062}. Best is trial 396 with value: 0.7561160925059711.[0m
[32m[I 2022-04-14 13:58:16,842][0m Trial 402 finished with value: 0.7270422752735991 and parameters: {'loss': 'coxph', 'learning_rate': 0.0016486685920958667, 'n_estimators': 330, 'criterion': 'friedman_mse', 'min_samples_split': 10, 'min_samples_leaf': 1, 'min_weight_fraction_leaf': 0.08209942079631347, 'min_impurity_decrease': 0.018688173650569462, 'max_features': 0.96022247343024, 'subsample': 0.8185752350706408, 'dropout_rate': 0.5479814460631489, 'ccp_alpha': 0.14596555346306234}. Best is trial 396 with value: 0.7561160925059711.[0m
