[32m[I 2022-04-13 11:45:39,806][0m Trial 385 finished with value: 0.640273960732414 and parameters: {'splitter': 'best', 'min_samples_split': 0.3403894950166866, 'min_samples_leaf': 0.012384479847854159, 'min_weight_fraction_leaf': 0.06222595819353359, 'max_features': 0.4999524433715442}. Best is trial 163 with value: 0.7137418010284807.[0m
[32m[I 2022-04-13 11:45:39,880][0m Trial 386 finished with value: 0.7137418010284807 and parameters: {'splitter': 'best', 'min_samples_split': 0.3254701419493168, 'min_samples_leaf': 0.027787114669128175, 'min_weight_fraction_leaf': 0.12090194355435346, 'max_features': 0.5684348334309859}. Best is trial 163 with value: 0.7137418010284807.[0m
[32m[I 2022-04-13 11:45:39,925][0m Trial 387 finished with value: 0.4364514609854459 and parameters: {'splitter': 'best', 'min_samples_split': 0.3281848667433707, 'min_samples_leaf': 0.4573854595243937, 'min_weight_fraction_leaf': 0.10755297170282645, 'max_features': 0.5351850015643724}. Best is trial 163 with value: 0.7137418010284807.[0m
[32m[I 2022-04-13 11:45:40,034][0m Trial 388 finished with value: 0.7137418010284807 and parameters: {'splitter': 'best', 'min_samples_split': 0.3207072654470472, 'min_samples_leaf': 0.015897852879979614, 'min_weight_fraction_leaf': 0.06668905353617088, 'max_features': 0.506099130283058}. Best is trial 163 with value: 0.7137418010284807.[0m
[32m[I 2022-04-13 11:45:40,123][0m Trial 389 finished with value: 0.6920012331415456 and parameters: {'splitter': 'best', 'min_samples_split': 0.2987641150654921, 'min_samples_leaf': 0.030377099633812337, 'min_weight_fraction_leaf': 0.12142231008089857, 'max_features': 0.5719080726153286}. Best is trial 163 with value: 0.7137418010284807.[0m
[32m[I 2022-04-13 11:45:40,258][0m Trial 390 finished with value: 0.6989673695016856 and parameters: {'splitter': 'best', 'min_samples_split': 0.38507309457525407, 'min_samples_leaf': 0.029164991871737937, 'min_weight_fraction_leaf': 0.11699556719439291, 'max_features': 0.5735277662904816}. Best is trial 163 with value: 0.7137418010284807.[0m
[32m[I 2022-04-13 11:45:40,344][0m Trial 391 finished with value: 0.7060546398003493 and parameters: {'splitter': 'random', 'min_samples_split': 0.34451336453202963, 'min_samples_leaf': 0.011870045665674057, 'min_weight_fraction_leaf': 0.08622638879667278, 'max_features': 0.535684524740205}. Best is trial 163 with value: 0.7137418010284807.[0m
[32m[I 2022-04-13 11:45:40,448][0m Trial 392 finished with value: 0.7030519614506526 and parameters: {'splitter': 'best', 'min_samples_split': 0.31194043175152764, 'min_samples_leaf': 0.002450543174541157, 'min_weight_fraction_leaf': 0.10404392454035474, 'max_features': 0.5500769376718201}. Best is trial 163 with value: 0.7137418010284807.[0m
[32m[I 2022-04-13 11:45:40,538][0m Trial 393 finished with value: 0.6989673695016856 and parameters: {'splitter': 'best', 'min_samples_split': 0.3340283350587591, 'min_samples_leaf': 0.010375119897701079, 'min_weight_fraction_leaf': 0.09472187331392692, 'max_features': 0.5137433195041539}. Best is trial 163 with value: 0.7137418010284807.[0m
[32m[I 2022-04-13 11:45:40,641][0m Trial 394 finished with value: 0.7137418010284807 and parameters: {'splitter': 'best', 'min_samples_split': 0.32599237893109206, 'min_samples_leaf': 0.018430011366245346, 'min_weight_fraction_leaf': 0.10848051222237888, 'max_features': 0.5212099731351449}. Best is trial 163 with value: 0.7137418010284807.[0m
[32m[I 2022-04-13 11:45:40,740][0m Trial 395 finished with value: 0.6989673695016856 and parameters: {'splitter': 'best', 'min_samples_split': 0.33338242489540865, 'min_samples_leaf': 0.01975511273458578, 'min_weight_fraction_leaf': 0.09505870156558154, 'max_features': 0.5576429243718779}. Best is trial 163 with value: 0.7137418010284807.[0m
[32m[I 2022-04-13 11:45:40,827][0m Trial 396 finished with value: 0.7137418010284807 and parameters: {'splitter': 'best', 'min_samples_split': 0.32789987702420603, 'min_samples_leaf': 0.03133154620683373, 'min_weight_fraction_leaf': 0.11166648028954272, 'max_features': 0.537151869090914}. Best is trial 163 with value: 0.7137418010284807.[0m
[32m[I 2022-04-13 11:45:40,928][0m Trial 397 finished with value: 0.6989673695016856 and parameters: {'splitter': 'best', 'min_samples_split': 0.34275671285533604, 'min_samples_leaf': 0.034142670955990315, 'min_weight_fraction_leaf': 0.08335574731227974, 'max_features': 0.5516661796557011}. Best is trial 163 with value: 0.7137418010284807.[0m
[32m[I 2022-04-13 11:45:41,005][0m Trial 398 finished with value: 0.6287616581020609 and parameters: {'splitter': 'best', 'min_samples_split': 0.3053307759566346, 'min_samples_leaf': 0.017281845930597936, 'min_weight_fraction_leaf': 0.07882655526175059, 'max_features': 0.4737363484539349}. Best is trial 163 with value: 0.7137418010284807.[0m
[32m[I 2022-04-13 11:45:41,095][0m Trial 399 finished with value: 0.6393814860932593 and parameters: {'splitter': 'best', 'min_samples_split': 0.35162621851861553, 'min_samples_leaf': 0.02723672365370578, 'min_weight_fraction_leaf': 0.055346871873398776, 'max_features': 0.43431457394408857}. Best is trial 163 with value: 0.7137418010284807.[0m
[32m[I 2022-04-13 11:45:41,163][0m Trial 400 finished with value: 0.6513176944526099 and parameters: {'splitter': 'best', 'min_samples_split': 0.3182944474254046, 'min_samples_leaf': 0.0025095600426630173, 'min_weight_fraction_leaf': 0.08566829515307808, 'max_features': 0.48994229747436}. Best is trial 163 with value: 0.7137418010284807.[0m
[32m[I 2022-04-13 11:45:41,266][0m Trial 401 finished with value: 0.6833838438234541 and parameters: {'splitter': 'best', 'min_samples_split': 0.3275443247656783, 'min_samples_leaf': 0.022373334053878785, 'min_weight_fraction_leaf': 0.04680870722345729, 'max_features': 0.8576538000615856}. Best is trial 163 with value: 0.7137418010284807.[0m
[32m[I 2022-04-13 11:45:41,364][0m Trial 402 finished with value: 0.7137418010284807 and parameters: {'splitter': 'best', 'min_samples_split': 0.3285256921170211, 'min_samples_leaf': 0.018213047848421718, 'min_weight_fraction_leaf': 0.11816963730879879, 'max_features': 0.5452331856697011}. Best is trial 163 with value: 0.7137418010284807.[0m
[32m[I 2022-04-13 11:45:41,501][0m Trial 403 finished with value: 0.5185990088583023 and parameters: {'splitter': 'best', 'min_samples_split': 0.29313067575924334, 'min_samples_leaf': 0.018328218467487806, 'min_weight_fraction_leaf': 0.09240055005498737, 'max_features': 0.0027648980552753555}. Best is trial 163 with value: 0.7137418010284807.[0m
[32m[I 2022-04-13 11:45:41,741][0m Trial 404 finished with value: 0.6451734333797478 and parameters: {'splitter': 'best', 'min_samples_split': 0.3383014624831858, 'min_samples_leaf': 0.1768133756923328, 'min_weight_fraction_leaf': 0.06567381994393073, 'max_features': 0.40533288748267415}. Best is trial 163 with value: 0.7137418010284807.[0m
[32m[I 2022-04-13 11:45:41,891][0m Trial 405 finished with value: 0.6853507734439263 and parameters: {'splitter': 'best', 'min_samples_split': 0.32662703404588544, 'min_samples_leaf': 0.03266673645558249, 'min_weight_fraction_leaf': 0.042103415634369694, 'max_features': 0.5812669037255357}. Best is trial 163 with value: 0.7137418010284807.[0m
[32m[I 2022-04-13 11:45:42,050][0m Trial 406 finished with value: 0.7030519614506526 and parameters: {'splitter': 'best', 'min_samples_split': 0.3126761017482659, 'min_samples_leaf': 0.009422823014662872, 'min_weight_fraction_leaf': 0.09647006933322196, 'max_features': 0.5263725382566341}. Best is trial 163 with value: 0.7137418010284807.[0m
[32m[I 2022-04-13 11:45:42,117][0m Trial 407 finished with value: 0.6475774294953407 and parameters: {'splitter': 'best', 'min_samples_split': 0.3048553083961513, 'min_samples_leaf': 0.3369504075372057, 'min_weight_fraction_leaf': 0.1095004386866187, 'max_features': 0.5580188835196032}. Best is trial 163 with value: 0.7137418010284807.[0m
[32m[I 2022-04-13 11:45:42,174][0m Trial 408 finished with value: 0.631953446187902 and parameters: {'splitter': 'best', 'min_samples_split': 0.32147610979883173, 'min_samples_leaf': 0.0015043667745269782, 'min_weight_fraction_leaf': 0.07443450913926891, 'max_features': 0.4618492290557048}. Best is trial 163 with value: 0.7137418010284807.[0m
[32m[I 2022-04-13 11:45:42,258][0m Trial 409 finished with value: 0.631953446187902 and parameters: {'splitter': 'best', 'min_samples_split': 0.31976470259926, 'min_samples_leaf': 0.016250512648295568, 'min_weight_fraction_leaf': 0.06678670288075887, 'max_features': 0.4994404255479612}. Best is trial 163 with value: 0.7137418010284807.[0m
[32m[I 2022-04-13 11:45:42,326][0m Trial 410 finished with value: 0.6989673695016856 and parameters: {'splitter': 'best', 'min_samples_split': 0.35528831442452335, 'min_samples_leaf': 0.010746842305298527, 'min_weight_fraction_leaf': 0.08012435584610712, 'max_features': 0.502721529792176}. Best is trial 163 with value: 0.7137418010284807.[0m
[32m[I 2022-04-13 11:45:42,391][0m Trial 411 finished with value: 0.7093409976331404 and parameters: {'splitter': 'random', 'min_samples_split': 0.34576509867155175, 'min_samples_leaf': 0.025047059932909718, 'min_weight_fraction_leaf': 0.10502601509508455, 'max_features': 0.5533273143688647}. Best is trial 163 with value: 0.7137418010284807.[0m
[32m[I 2022-04-13 11:45:42,461][0m Trial 412 finished with value: 0.7044783206942828 and parameters: {'splitter': 'best', 'min_samples_split': 0.3098926768029984, 'min_samples_leaf': 0.0012128266531309813, 'min_weight_fraction_leaf': 0.10650708612378885, 'max_features': 0.5801103480429487}. Best is trial 163 with value: 0.7137418010284807.[0m
[32m[I 2022-04-13 11:45:42,530][0m Trial 413 finished with value: 0.684611897101941 and parameters: {'splitter': 'best', 'min_samples_split': 0.2776747674285383, 'min_samples_leaf': 0.0024503878139364352, 'min_weight_fraction_leaf': 0.09988173469134182, 'max_features': 0.5176676715857322}. Best is trial 163 with value: 0.7137418010284807.[0m
[32m[I 2022-04-13 11:45:42,635][0m Trial 414 finished with value: 0.6989673695016856 and parameters: {'splitter': 'best', 'min_samples_split': 0.33554435956981415, 'min_samples_leaf': 0.01323889548104918, 'min_weight_fraction_leaf': 0.09418479193406949, 'max_features': 0.5088465861526275}. Best is trial 163 with value: 0.7137418010284807.[0m
[32m[I 2022-04-13 11:45:42,732][0m Trial 415 finished with value: 0.631953446187902 and parameters: {'splitter': 'best', 'min_samples_split': 0.32484934366022944, 'min_samples_leaf': 0.014994823076821548, 'min_weight_fraction_leaf': 0.0769933112080645, 'max_features': 0.47704178527708596}. Best is trial 163 with value: 0.7137418010284807.[0m
[32m[I 2022-04-13 11:45:42,833][0m Trial 416 finished with value: 0.6989673695016856 and parameters: {'splitter': 'best', 'min_samples_split': 0.3344618083345034, 'min_samples_leaf': 0.029784374835374675, 'min_weight_fraction_leaf': 0.12217076034296391, 'max_features': 0.5284429273292784}. Best is trial 163 with value: 0.7137418010284807.[0m
[32m[I 2022-04-13 11:45:42,945][0m Trial 417 finished with value: 0.6920012331415456 and parameters: {'splitter': 'best', 'min_samples_split': 0.29945259513387523, 'min_samples_leaf': 0.034898139423476186, 'min_weight_fraction_leaf': 0.1212199426058846, 'max_features': 0.5133706732022936}. Best is trial 163 with value: 0.7137418010284807.[0m
[32m[I 2022-04-13 11:45:43,023][0m Trial 418 finished with value: 0.6436563808635396 and parameters: {'splitter': 'best', 'min_samples_split': 0.3472505979507893, 'min_samples_leaf': 0.024004930055498447, 'min_weight_fraction_leaf': 0.08937755083276343, 'max_features': 0.48583349208290416}. Best is trial 163 with value: 0.7137418010284807.[0m
[32m[I 2022-04-13 11:45:43,083][0m Trial 419 finished with value: 0.6853507734439263 and parameters: {'splitter': 'best', 'min_samples_split': 0.32613618153901613, 'min_samples_leaf': 0.03512692037866027, 'min_weight_fraction_leaf': 0.03725940356944156, 'max_features': 0.5758579296041085}. Best is trial 163 with value: 0.7137418010284807.[0m
[32m[I 2022-04-13 11:45:43,148][0m Trial 420 finished with value: 0.7044783206942828 and parameters: {'splitter': 'best', 'min_samples_split': 0.3107157698683349, 'min_samples_leaf': 0.0012793199301160078, 'min_weight_fraction_leaf': 0.11045735178908839, 'max_features': 0.5409533547273071}. Best is trial 163 with value: 0.7137418010284807.[0m
[32m[I 2022-04-13 11:45:43,221][0m Trial 421 finished with value: 0.6840271035508334 and parameters: {'splitter': 'best', 'min_samples_split': 0.2535441480440695, 'min_samples_leaf': 0.02054160363625807, 'min_weight_fraction_leaf': 0.11909575783193274, 'max_features': 0.9518569417219446}. Best is trial 163 with value: 0.7137418010284807.[0m
[32m[I 2022-04-13 11:45:43,301][0m Trial 422 finished with value: 0.7137418010284807 and parameters: {'splitter': 'best', 'min_samples_split': 0.31662550377343524, 'min_samples_leaf': 0.02692101692899669, 'min_weight_fraction_leaf': 0.06456330985264942, 'max_features': 0.5737384473759998}. Best is trial 163 with value: 0.7137418010284807.[0m
[32m[I 2022-04-13 11:45:43,363][0m Trial 423 finished with value: 0.4364514609854459 and parameters: {'splitter': 'best', 'min_samples_split': 0.29370015292265483, 'min_samples_leaf': 0.011173537681349661, 'min_weight_fraction_leaf': 0.4517506057911742, 'max_features': 0.5298182740086078}. Best is trial 163 with value: 0.7137418010284807.[0m
[32m[I 2022-04-13 11:45:43,398][0m Trial 424 finished with value: 0.7030519614506526 and parameters: {'splitter': 'best', 'min_samples_split': 0.30474182764953656, 'min_samples_leaf': 0.0024601864394935015, 'min_weight_fraction_leaf': 0.10163418563844834, 'max_features': 0.5131550147507705}. Best is trial 163 with value: 0.7137418010284807.[0m
[32m[I 2022-04-13 11:45:43,459][0m Trial 425 finished with value: 0.7030519614506526 and parameters: {'splitter': 'best', 'min_samples_split': 0.3136656568361859, 'min_samples_leaf': 0.009254610041174567, 'min_weight_fraction_leaf': 0.10374713555038993, 'max_features': 0.5195598489134323}. Best is trial 163 with value: 0.7137418010284807.[0m
[32m[I 2022-04-13 11:45:43,530][0m Trial 426 finished with value: 0.6513176944526099 and parameters: {'splitter': 'best', 'min_samples_split': 0.3175909686522021, 'min_samples_leaf': 0.007763348670104394, 'min_weight_fraction_leaf': 0.08905740443685829, 'max_features': 0.48497124477563164}. Best is trial 163 with value: 0.7137418010284807.[0m
[32m[I 2022-04-13 11:45:43,590][0m Trial 427 finished with value: 0.6989673695016856 and parameters: {'splitter': 'best', 'min_samples_split': 0.3299302044970363, 'min_samples_leaf': 0.038340452319394897, 'min_weight_fraction_leaf': 0.12480155574393059, 'max_features': 0.5655475592519992}. Best is trial 163 with value: 0.7137418010284807.[0m
[32m[I 2022-04-13 11:45:43,650][0m Trial 428 finished with value: 0.6913414209855142 and parameters: {'splitter': 'best', 'min_samples_split': 0.33706252089350247, 'min_samples_leaf': 0.021980636268344927, 'min_weight_fraction_leaf': 0.11356661050688988, 'max_features': 0.34467272502577495}. Best is trial 163 with value: 0.7137418010284807.[0m
[32m[I 2022-04-13 11:45:43,701][0m Trial 429 finished with value: 0.631953446187902 and parameters: {'splitter': 'best', 'min_samples_split': 0.3239074525292956, 'min_samples_leaf': 0.01741815206774199, 'min_weight_fraction_leaf': 0.07373702396126094, 'max_features': 0.4988195866277082}. Best is trial 163 with value: 0.7137418010284807.[0m
[32m[I 2022-04-13 11:45:43,753][0m Trial 430 finished with value: 0.5260470827216045 and parameters: {'splitter': 'random', 'min_samples_split': 0.33653152121018276, 'min_samples_leaf': 0.01812490441036603, 'min_weight_fraction_leaf': 0.11163776018136956, 'max_features': 0.4526602052561602}. Best is trial 163 with value: 0.7137418010284807.[0m
[32m[I 2022-04-13 11:45:43,807][0m Trial 431 finished with value: 0.684611897101941 and parameters: {'splitter': 'best', 'min_samples_split': 0.28643356858719854, 'min_samples_leaf': 0.001168212298673906, 'min_weight_fraction_leaf': 0.10244484807660093, 'max_features': 0.5217130400847577}. Best is trial 163 with value: 0.7137418010284807.[0m
[32m[I 2022-04-13 11:45:43,888][0m Trial 432 finished with value: 0.6778130748182665 and parameters: {'splitter': 'best', 'min_samples_split': 0.30218255918591086, 'min_samples_leaf': 0.029734112482559145, 'min_weight_fraction_leaf': 0.21914805944079993, 'max_features': 0.540967862990456}. Best is trial 163 with value: 0.7137418010284807.[0m
[32m[I 2022-04-13 11:45:43,971][0m Trial 433 finished with value: 0.7137418010284807 and parameters: {'splitter': 'best', 'min_samples_split': 0.3190213748859394, 'min_samples_leaf': 0.011438746937600464, 'min_weight_fraction_leaf': 0.07150399602757246, 'max_features': 0.5005848482653771}. Best is trial 163 with value: 0.7137418010284807.[0m
[32m[I 2022-04-13 11:45:44,061][0m Trial 434 finished with value: 0.6073904321939592 and parameters: {'splitter': 'best', 'min_samples_split': 0.3430036208348893, 'min_samples_leaf': 0.011505688378104131, 'min_weight_fraction_leaf': 0.11376771985160353, 'max_features': 0.1642151943344991}. Best is trial 163 with value: 0.7137418010284807.[0m
[32m[I 2022-04-13 11:45:44,175][0m Trial 435 finished with value: 0.6776000718234848 and parameters: {'splitter': 'best', 'min_samples_split': 0.4991635067613397, 'min_samples_leaf': 0.02796273352748986, 'min_weight_fraction_leaf': 0.09333799824644536, 'max_features': 0.5541176021845295}. Best is trial 163 with value: 0.7137418010284807.[0m
[32m[I 2022-04-13 11:45:44,240][0m Trial 436 finished with value: 0.640273960732414 and parameters: {'splitter': 'best', 'min_samples_split': 0.3261445692469266, 'min_samples_leaf': 0.01565769341446837, 'min_weight_fraction_leaf': 0.05751669420975179, 'max_features': 0.45259536843291537}. Best is trial 163 with value: 0.7137418010284807.[0m
[32m[I 2022-04-13 11:45:44,287][0m Trial 437 finished with value: 0.6989673695016856 and parameters: {'splitter': 'best', 'min_samples_split': 0.331808442028332, 'min_samples_leaf': 0.038999620576798635, 'min_weight_fraction_leaf': 0.12168618569571606, 'max_features': 0.5801475667198479}. Best is trial 163 with value: 0.7137418010284807.[0m
[32m[I 2022-04-13 11:45:44,363][0m Trial 438 finished with value: 0.6393814860932593 and parameters: {'splitter': 'best', 'min_samples_split': 0.3559613252128624, 'min_samples_leaf': 0.029846542262620075, 'min_weight_fraction_leaf': 0.0640024414731244, 'max_features': 0.46656762970570576}. Best is trial 163 with value: 0.7137418010284807.[0m
[32m[I 2022-04-13 11:45:44,418][0m Trial 439 finished with value: 0.7044783206942828 and parameters: {'splitter': 'best', 'min_samples_split': 0.30607905238693367, 'min_samples_leaf': 0.04139487308080693, 'min_weight_fraction_leaf': 0.12340202547277881, 'max_features': 0.5525726234006878}. Best is trial 163 with value: 0.7137418010284807.[0m
[32m[I 2022-04-13 11:45:44,488][0m Trial 440 finished with value: 0.7030519614506526 and parameters: {'splitter': 'best', 'min_samples_split': 0.3119312146219728, 'min_samples_leaf': 0.009959213057105402, 'min_weight_fraction_leaf': 0.08407656584836755, 'max_features': 0.5436860135338593}. Best is trial 163 with value: 0.7137418010284807.[0m
[32m[I 2022-04-13 11:45:44,561][0m Trial 441 finished with value: 0.7137418010284807 and parameters: {'splitter': 'best', 'min_samples_split': 0.3281997722447417, 'min_samples_leaf': 0.03581360974855675, 'min_weight_fraction_leaf': 0.12375335168641433, 'max_features': 0.578408736976449}. Best is trial 163 with value: 0.7137418010284807.[0m
[32m[I 2022-04-13 11:45:44,656][0m Trial 442 finished with value: 0.7137418010284807 and parameters: {'splitter': 'best', 'min_samples_split': 0.32868080614410616, 'min_samples_leaf': 0.040703566628290486, 'min_weight_fraction_leaf': 0.1235618805643689, 'max_features': 0.5885201110406094}. Best is trial 163 with value: 0.7137418010284807.[0m
[32m[I 2022-04-13 11:45:44,747][0m Trial 443 finished with value: 0.6475774294953407 and parameters: {'splitter': 'best', 'min_samples_split': 0.2987722829776603, 'min_samples_leaf': 0.020645425081119835, 'min_weight_fraction_leaf': 0.3431972885909661, 'max_features': 0.562129457774845}. Best is trial 163 with value: 0.7137418010284807.[0m
[32m[I 2022-04-13 11:45:44,856][0m Trial 444 finished with value: 0.6436563808635396 and parameters: {'splitter': 'best', 'min_samples_split': 0.3469638503454449, 'min_samples_leaf': 0.009857191175874093, 'min_weight_fraction_leaf': 0.08354701867469048, 'max_features': 0.49979816379168557}. Best is trial 163 with value: 0.7137418010284807.[0m
[32m[I 2022-04-13 11:45:44,959][0m Trial 445 finished with value: 0.6989673695016856 and parameters: {'splitter': 'best', 'min_samples_split': 0.3394056207117462, 'min_samples_leaf': 0.022239594626427387, 'min_weight_fraction_leaf': 0.11587590045316713, 'max_features': 0.5315591419789748}. Best is trial 163 with value: 0.7137418010284807.[0m
[32m[I 2022-04-13 11:45:45,100][0m Trial 446 finished with value: 0.7137418010284807 and parameters: {'splitter': 'best', 'min_samples_split': 0.3203678273804785, 'min_samples_leaf': 0.0015524641889914704, 'min_weight_fraction_leaf': 0.09773778409435156, 'max_features': 0.5240074187622376}. Best is trial 163 with value: 0.7137418010284807.[0m
[32m[I 2022-04-13 11:45:45,232][0m Trial 447 finished with value: 0.640273960732414 and parameters: {'splitter': 'best', 'min_samples_split': 0.3209275871696551, 'min_samples_leaf': 0.01686997803424155, 'min_weight_fraction_leaf': 0.05487802583929996, 'max_features': 0.47534432514026786}. Best is trial 163 with value: 0.7137418010284807.[0m
