[32m[I 2022-04-16 09:44:49,350][0m Trial 264 finished with value: 0.8632552220780454 and parameters: {'n_hidden': 64, 'mixture_components': 2, 'use_sparse_layer': False, 'use_batchnorm': True, 'use_dropout': True, 'dropout': 0.26496437823016106, 'mlp_size_1': 0, 'mlp_size_2': 2, 'mlp_size_3': 0, 'kernel': 'Logistic', 'loss_name': 'NLLLoss'}. Best is trial 173 with value: 0.8721374613820508.[0m
[32m[I 2022-04-16 09:50:30,631][0m Trial 265 finished with value: 0.8680527292976091 and parameters: {'n_hidden': 64, 'mixture_components': 2, 'use_sparse_layer': False, 'use_batchnorm': True, 'use_dropout': True, 'dropout': 0.6478101207360037, 'mlp_size_1': 0, 'mlp_size_2': 2, 'mlp_size_3': 0, 'kernel': 'Exponential', 'loss_name': 'NLLLoss'}. Best is trial 173 with value: 0.8721374613820508.[0m
[32m[I 2022-04-16 09:55:43,247][0m Trial 266 finished with value: 0.8664376216059869 and parameters: {'n_hidden': 64, 'mixture_components': 2, 'use_sparse_layer': False, 'use_batchnorm': True, 'use_dropout': True, 'dropout': 0.6702256738977423, 'mlp_size_1': 0, 'mlp_size_2': 2, 'mlp_size_3': 0, 'kernel': 'Exponential', 'loss_name': 'NLLLoss'}. Best is trial 173 with value: 0.8721374613820508.[0m
[32m[I 2022-04-16 10:00:50,117][0m Trial 267 finished with value: 0.866419359884485 and parameters: {'n_hidden': 64, 'mixture_components': 3, 'use_sparse_layer': False, 'use_batchnorm': True, 'use_dropout': True, 'dropout': 0.6514485544005317, 'mlp_size_1': 0, 'mlp_size_2': 2, 'mlp_size_3': 0, 'kernel': 'Exponential', 'loss_name': 'NLLLoss'}. Best is trial 173 with value: 0.8721374613820508.[0m
[32m[I 2022-04-16 10:04:12,697][0m Trial 268 finished with value: 0.8625442061032859 and parameters: {'n_hidden': 64, 'mixture_components': 2, 'use_sparse_layer': False, 'use_batchnorm': True, 'use_dropout': True, 'dropout': 0.06254353842916921, 'mlp_size_1': 0, 'mlp_size_2': 2, 'mlp_size_3': 0, 'kernel': 'Exponential', 'loss_name': 'NLLLoss'}. Best is trial 173 with value: 0.8721374613820508.[0m
[32m[I 2022-04-16 10:05:09,821][0m Trial 269 finished with value: -0.02203032445795681 and parameters: {'n_hidden': 64, 'mixture_components': 2, 'use_sparse_layer': False, 'use_batchnorm': True, 'use_dropout': True, 'dropout': 0.6997519308114365, 'mlp_size_1': 0, 'mlp_size_2': 2, 'mlp_size_3': 0, 'kernel': 'Gumbel', 'loss_name': 'NLLLoss'}. Best is trial 173 with value: 0.8721374613820508.[0m
[32m[I 2022-04-16 10:10:34,377][0m Trial 270 finished with value: 0.8646274289020364 and parameters: {'n_hidden': 64, 'mixture_components': 2, 'use_sparse_layer': False, 'use_batchnorm': True, 'use_dropout': True, 'dropout': 0.5676476995923928, 'mlp_size_1': 0, 'mlp_size_2': 2, 'mlp_size_3': 0, 'kernel': 'Exponential', 'loss_name': 'NLLLoss'}. Best is trial 173 with value: 0.8721374613820508.[0m
[32m[I 2022-04-16 10:15:05,085][0m Trial 271 finished with value: 0.8647041514571164 and parameters: {'n_hidden': 64, 'mixture_components': 2, 'use_sparse_layer': False, 'use_batchnorm': True, 'use_dropout': True, 'dropout': 0.6792240843161756, 'mlp_size_1': 0, 'mlp_size_2': 2, 'mlp_size_3': 0, 'kernel': 'Exponential', 'loss_name': 'NLLLoss'}. Best is trial 173 with value: 0.8721374613820508.[0m
[32m[I 2022-04-16 10:18:37,814][0m Trial 272 finished with value: 0.8113959006252017 and parameters: {'n_hidden': 256, 'mixture_components': 2, 'use_sparse_layer': False, 'use_batchnorm': False, 'use_dropout': True, 'dropout': 0.5933662992087375, 'mlp_size_1': 0, 'mlp_size_2': 2, 'mlp_size_3': 0, 'kernel': 'Exponential', 'loss_name': 'AlternativeNLLLoss'}. Best is trial 173 with value: 0.8721374613820508.[0m
[32m[I 2022-04-16 10:23:52,015][0m Trial 273 finished with value: 0.8690154385801886 and parameters: {'n_hidden': 64, 'mixture_components': 8, 'use_sparse_layer': False, 'use_batchnorm': True, 'use_dropout': True, 'dropout': 0.644088034469396, 'mlp_size_1': 0, 'mlp_size_2': 2, 'mlp_size_3': 0, 'kernel': 'Exponential', 'loss_name': 'NLLLoss'}. Best is trial 173 with value: 0.8721374613820508.[0m
[32m[I 2022-04-16 10:29:10,153][0m Trial 274 finished with value: 0.8683136363203279 and parameters: {'n_hidden': 64, 'mixture_components': 8, 'use_sparse_layer': False, 'use_batchnorm': True, 'use_dropout': True, 'dropout': 0.647054291786446, 'mlp_size_1': 0, 'mlp_size_2': 2, 'mlp_size_3': 0, 'kernel': 'Exponential', 'loss_name': 'NLLLoss'}. Best is trial 173 with value: 0.8721374613820508.[0m
[32m[I 2022-04-16 10:33:18,705][0m Trial 275 finished with value: 0.859165894811324 and parameters: {'n_hidden': 2048, 'mixture_components': 8, 'use_sparse_layer': False, 'use_batchnorm': True, 'use_dropout': True, 'dropout': 0.7723982387539206, 'mlp_size_1': 1, 'mlp_size_2': 3, 'mlp_size_3': 0, 'kernel': 'Exponential', 'loss_name': 'NLLLoss'}. Best is trial 173 with value: 0.8721374613820508.[0m
[32m[I 2022-04-16 10:38:22,855][0m Trial 276 finished with value: 0.8727082992323222 and parameters: {'n_hidden': 64, 'mixture_components': 7, 'use_sparse_layer': False, 'use_batchnorm': True, 'use_dropout': True, 'dropout': 0.638139935859662, 'mlp_size_1': 0, 'mlp_size_2': 2, 'mlp_size_3': 0, 'kernel': 'Exponential', 'loss_name': 'NLLLoss'}. Best is trial 276 with value: 0.8727082992323222.[0m
[32m[I 2022-04-16 10:43:28,242][0m Trial 277 finished with value: 0.8597419638809388 and parameters: {'n_hidden': 64, 'mixture_components': 8, 'use_sparse_layer': False, 'use_batchnorm': True, 'use_dropout': True, 'dropout': 0.6199766065849259, 'mlp_size_1': 0, 'mlp_size_2': 2, 'mlp_size_3': 0, 'kernel': 'Exponential', 'loss_name': 'NLLLoss'}. Best is trial 276 with value: 0.8727082992323222.[0m
[32m[I 2022-04-16 10:48:43,929][0m Trial 278 finished with value: 0.8633260982119602 and parameters: {'n_hidden': 64, 'mixture_components': 8, 'use_sparse_layer': False, 'use_batchnorm': True, 'use_dropout': True, 'dropout': 0.6661417214712039, 'mlp_size_1': 0, 'mlp_size_2': 2, 'mlp_size_3': 0, 'kernel': 'Exponential', 'loss_name': 'NLLLoss'}. Best is trial 276 with value: 0.8727082992323222.[0m
[32m[I 2022-04-16 10:54:55,779][0m Trial 279 finished with value: 0.8621831787688319 and parameters: {'n_hidden': 64, 'mixture_components': 7, 'use_sparse_layer': False, 'use_batchnorm': True, 'use_dropout': True, 'dropout': 0.6370905782657633, 'mlp_size_1': 0, 'mlp_size_2': 2, 'mlp_size_3': 0, 'kernel': 'Exponential', 'loss_name': 'NLLLoss'}. Best is trial 276 with value: 0.8727082992323222.[0m
[32m[I 2022-04-16 10:58:21,909][0m Trial 280 finished with value: 0.8466960127695314 and parameters: {'n_hidden': 512, 'mixture_components': 8, 'use_sparse_layer': False, 'use_batchnorm': True, 'use_dropout': True, 'dropout': 0.7135810656556392, 'mlp_size_1': 0, 'mlp_size_2': 2, 'mlp_size_3': 0, 'kernel': 'LogLogistic', 'loss_name': 'NLLLoss'}. Best is trial 276 with value: 0.8727082992323222.[0m
[32m[I 2022-04-16 11:03:09,423][0m Trial 281 finished with value: 0.8629729433571633 and parameters: {'n_hidden': 64, 'mixture_components': 8, 'use_sparse_layer': False, 'use_batchnorm': True, 'use_dropout': True, 'dropout': 0.4505878443046521, 'mlp_size_1': 0, 'mlp_size_2': 2, 'mlp_size_3': 0, 'kernel': 'Exponential', 'loss_name': 'NLLLoss'}. Best is trial 276 with value: 0.8727082992323222.[0m
[32m[I 2022-04-16 11:09:10,515][0m Trial 282 finished with value: 0.8601941156155218 and parameters: {'n_hidden': 64, 'mixture_components': 9, 'use_sparse_layer': False, 'use_batchnorm': True, 'use_dropout': True, 'dropout': 0.686019087419259, 'mlp_size_1': 0, 'mlp_size_2': 2, 'mlp_size_3': 0, 'kernel': 'Exponential', 'loss_name': 'NLLLoss'}. Best is trial 276 with value: 0.8727082992323222.[0m
[32m[I 2022-04-16 11:14:08,235][0m Trial 283 finished with value: 0.8346460834611011 and parameters: {'n_hidden': 64, 'mixture_components': 8, 'use_sparse_layer': False, 'use_batchnorm': True, 'use_dropout': True, 'dropout': 0.608249311977143, 'mlp_size_1': 0, 'mlp_size_2': 2, 'mlp_size_3': 0, 'kernel': 'Normal', 'loss_name': 'NLLLoss'}. Best is trial 276 with value: 0.8727082992323222.[0m
[32m[I 2022-04-16 11:19:21,029][0m Trial 284 finished with value: 0.8690290489027733 and parameters: {'n_hidden': 64, 'mixture_components': 3, 'use_sparse_layer': False, 'use_batchnorm': True, 'use_dropout': True, 'dropout': 0.6564825812507906, 'mlp_size_1': 0, 'mlp_size_2': 2, 'mlp_size_3': 0, 'kernel': 'Exponential', 'loss_name': 'NLLLoss'}. Best is trial 276 with value: 0.8727082992323222.[0m
[32m[I 2022-04-16 11:23:02,170][0m Trial 285 finished with value: 0.8508221441869275 and parameters: {'n_hidden': 1024, 'mixture_components': 9, 'use_sparse_layer': False, 'use_batchnorm': True, 'use_dropout': True, 'dropout': 0.6619553065101792, 'mlp_size_1': 1, 'mlp_size_2': 2, 'mlp_size_3': 3, 'kernel': 'Exponential', 'loss_name': 'NLLLoss'}. Best is trial 276 with value: 0.8727082992323222.[0m
[32m[I 2022-04-16 11:28:15,520][0m Trial 286 finished with value: 0.8690741141884883 and parameters: {'n_hidden': 64, 'mixture_components': 7, 'use_sparse_layer': False, 'use_batchnorm': True, 'use_dropout': True, 'dropout': 0.691693617851598, 'mlp_size_1': 0, 'mlp_size_2': 2, 'mlp_size_3': 0, 'kernel': 'Exponential', 'loss_name': 'NLLLoss'}. Best is trial 276 with value: 0.8727082992323222.[0m
[32m[I 2022-04-16 11:34:47,258][0m Trial 287 finished with value: 0.852584384082131 and parameters: {'n_hidden': 64, 'mixture_components': 7, 'use_sparse_layer': False, 'use_batchnorm': True, 'use_dropout': True, 'dropout': 0.7319833481109226, 'mlp_size_1': 0, 'mlp_size_2': 2, 'mlp_size_3': 0, 'kernel': 'Weibull', 'loss_name': 'NLLLoss'}. Best is trial 276 with value: 0.8727082992323222.[0m
[32m[I 2022-04-16 11:39:49,544][0m Trial 288 finished with value: 0.862994163072349 and parameters: {'n_hidden': 64, 'mixture_components': 7, 'use_sparse_layer': False, 'use_batchnorm': True, 'use_dropout': True, 'dropout': 0.6926199400405638, 'mlp_size_1': 0, 'mlp_size_2': 2, 'mlp_size_3': 0, 'kernel': 'Exponential', 'loss_name': 'NLLLoss'}. Best is trial 276 with value: 0.8727082992323222.[0m
[32m[I 2022-04-16 11:45:29,429][0m Trial 289 finished with value: 0.8557431138291018 and parameters: {'n_hidden': 64, 'mixture_components': 6, 'use_sparse_layer': False, 'use_batchnorm': True, 'use_dropout': True, 'dropout': 0.708548387907041, 'mlp_size_1': 0, 'mlp_size_2': 2, 'mlp_size_3': 0, 'kernel': 'Gamma', 'loss_name': 'NLLLoss'}. Best is trial 276 with value: 0.8727082992323222.[0m
[32m[I 2022-04-16 11:50:12,137][0m Trial 290 finished with value: 0.8667104154403301 and parameters: {'n_hidden': 64, 'mixture_components': 9, 'use_sparse_layer': False, 'use_batchnorm': True, 'use_dropout': True, 'dropout': 0.6750807123657206, 'mlp_size_1': 0, 'mlp_size_2': 2, 'mlp_size_3': 0, 'kernel': 'Exponential', 'loss_name': 'NLLLoss'}. Best is trial 276 with value: 0.8727082992323222.[0m
[32m[I 2022-04-16 11:56:26,295][0m Trial 291 finished with value: 0.8612979755672672 and parameters: {'n_hidden': 64, 'mixture_components': 8, 'use_sparse_layer': False, 'use_batchnorm': True, 'use_dropout': True, 'dropout': 0.6484815823726784, 'mlp_size_1': 0, 'mlp_size_2': 2, 'mlp_size_3': 0, 'kernel': 'Exponential', 'loss_name': 'AlternativeNLLLoss'}. Best is trial 276 with value: 0.8727082992323222.[0m
[32m[I 2022-04-16 11:58:31,888][0m Trial 292 finished with value: 0.7267881935169678 and parameters: {'n_hidden': 64, 'mixture_components': 7, 'use_sparse_layer': False, 'use_batchnorm': False, 'use_dropout': True, 'dropout': 0.6673326032321245, 'mlp_size_1': 0, 'mlp_size_2': 2, 'mlp_size_3': 0, 'kernel': 'LogNormal', 'loss_name': 'NLLLoss'}. Best is trial 276 with value: 0.8727082992323222.[0m
[32m[I 2022-04-16 12:03:29,153][0m Trial 293 finished with value: 0.8663788462512712 and parameters: {'n_hidden': 64, 'mixture_components': 4, 'use_sparse_layer': False, 'use_batchnorm': True, 'use_dropout': True, 'dropout': 0.6944017105235454, 'mlp_size_1': 0, 'mlp_size_2': 2, 'mlp_size_3': 0, 'kernel': 'Exponential', 'loss_name': 'NLLLoss'}. Best is trial 276 with value: 0.8727082992323222.[0m
[32m[I 2022-04-16 12:08:58,678][0m Trial 294 finished with value: 0.8692801275562155 and parameters: {'n_hidden': 64, 'mixture_components': 8, 'use_sparse_layer': False, 'use_batchnorm': True, 'use_dropout': True, 'dropout': 0.6299206184898198, 'mlp_size_1': 0, 'mlp_size_2': 2, 'mlp_size_3': 0, 'kernel': 'Exponential', 'loss_name': 'NLLLoss'}. Best is trial 276 with value: 0.8727082992323222.[0m
[32m[I 2022-04-16 12:14:14,039][0m Trial 295 finished with value: 0.8677172184386664 and parameters: {'n_hidden': 64, 'mixture_components': 7, 'use_sparse_layer': False, 'use_batchnorm': True, 'use_dropout': True, 'dropout': 0.6363501972396496, 'mlp_size_1': 0, 'mlp_size_2': 2, 'mlp_size_3': 0, 'kernel': 'Exponential', 'loss_name': 'NLLLoss'}. Best is trial 276 with value: 0.8727082992323222.[0m
[32m[I 2022-04-16 12:19:25,428][0m Trial 296 finished with value: 0.8499721872581472 and parameters: {'n_hidden': 64, 'mixture_components': 8, 'use_sparse_layer': False, 'use_batchnorm': True, 'use_dropout': True, 'dropout': 0.637169122659162, 'mlp_size_1': 0, 'mlp_size_2': 2, 'mlp_size_3': 0, 'kernel': 'Logistic', 'loss_name': 'NLLLoss'}. Best is trial 276 with value: 0.8727082992323222.[0m
[32m[I 2022-04-16 12:24:40,330][0m Trial 297 finished with value: 0.859435832975301 and parameters: {'n_hidden': 64, 'mixture_components': 8, 'use_sparse_layer': False, 'use_batchnorm': True, 'use_dropout': True, 'dropout': 0.6526928241472288, 'mlp_size_1': 0, 'mlp_size_2': 2, 'mlp_size_3': 0, 'kernel': 'Exponential', 'loss_name': 'NLLLoss'}. Best is trial 276 with value: 0.8727082992323222.[0m
[32m[I 2022-04-16 12:29:38,711][0m Trial 298 finished with value: 0.8665456354634413 and parameters: {'n_hidden': 64, 'mixture_components': 8, 'use_sparse_layer': False, 'use_batchnorm': True, 'use_dropout': True, 'dropout': 0.5056413065842443, 'mlp_size_1': 0, 'mlp_size_2': 2, 'mlp_size_3': 0, 'kernel': 'Exponential', 'loss_name': 'NLLLoss'}. Best is trial 276 with value: 0.8727082992323222.[0m
[32m[I 2022-04-16 12:34:00,679][0m Trial 299 finished with value: 0.8630247011893472 and parameters: {'n_hidden': 256, 'mixture_components': 8, 'use_sparse_layer': False, 'use_batchnorm': True, 'use_dropout': True, 'dropout': 0.6310370436994188, 'mlp_size_1': 0, 'mlp_size_2': 2, 'mlp_size_3': 0, 'kernel': 'Exponential', 'loss_name': 'NLLLoss'}. Best is trial 276 with value: 0.8727082992323222.[0m
[32m[I 2022-04-16 12:39:03,392][0m Trial 300 finished with value: 0.8699932368087266 and parameters: {'n_hidden': 64, 'mixture_components': 8, 'use_sparse_layer': False, 'use_batchnorm': True, 'use_dropout': True, 'dropout': 0.6605793182468004, 'mlp_size_1': 0, 'mlp_size_2': 2, 'mlp_size_3': 0, 'kernel': 'Exponential', 'loss_name': 'NLLLoss'}. Best is trial 276 with value: 0.8727082992323222.[0m
[32m[I 2022-04-16 12:40:08,186][0m Trial 301 finished with value: -0.5 and parameters: {'n_hidden': 64, 'mixture_components': 8, 'use_sparse_layer': False, 'use_batchnorm': True, 'use_dropout': True, 'dropout': 0.6196869509322619, 'mlp_size_1': 0, 'mlp_size_2': 2, 'mlp_size_3': 0, 'kernel': 'Gumbel', 'loss_name': 'NLLLoss'}. Best is trial 276 with value: 0.8727082992323222.[0m
[32m[I 2022-04-16 12:43:42,295][0m Trial 302 finished with value: 0.8523856384735042 and parameters: {'n_hidden': 2048, 'mixture_components': 8, 'use_sparse_layer': False, 'use_batchnorm': True, 'use_dropout': True, 'dropout': 0.6591799936871064, 'mlp_size_1': 1, 'mlp_size_2': 5, 'mlp_size_3': 0, 'kernel': 'Exponential', 'loss_name': 'NLLLoss'}. Best is trial 276 with value: 0.8727082992323222.[0m
[32m[I 2022-04-16 12:48:46,396][0m Trial 303 finished with value: 0.8678775957717653 and parameters: {'n_hidden': 64, 'mixture_components': 8, 'use_sparse_layer': False, 'use_batchnorm': True, 'use_dropout': True, 'dropout': 0.5826887615680528, 'mlp_size_1': 0, 'mlp_size_2': 2, 'mlp_size_3': 0, 'kernel': 'Exponential', 'loss_name': 'NLLLoss'}. Best is trial 276 with value: 0.8727082992323222.[0m
[32m[I 2022-04-16 12:53:57,647][0m Trial 304 finished with value: 0.8643173576985014 and parameters: {'n_hidden': 64, 'mixture_components': 8, 'use_sparse_layer': False, 'use_batchnorm': True, 'use_dropout': True, 'dropout': 0.6398933699156828, 'mlp_size_1': 0, 'mlp_size_2': 2, 'mlp_size_3': 0, 'kernel': 'Exponential', 'loss_name': 'NLLLoss'}. Best is trial 276 with value: 0.8727082992323222.[0m
[32m[I 2022-04-16 12:59:03,479][0m Trial 305 finished with value: 0.8682567922447569 and parameters: {'n_hidden': 64, 'mixture_components': 8, 'use_sparse_layer': False, 'use_batchnorm': True, 'use_dropout': True, 'dropout': 0.6186278398959022, 'mlp_size_1': 0, 'mlp_size_2': 2, 'mlp_size_3': 0, 'kernel': 'Exponential', 'loss_name': 'NLLLoss'}. Best is trial 276 with value: 0.8727082992323222.[0m
[32m[I 2022-04-16 13:03:36,686][0m Trial 306 finished with value: 0.8611417234092004 and parameters: {'n_hidden': 64, 'mixture_components': 8, 'use_sparse_layer': False, 'use_batchnorm': True, 'use_dropout': True, 'dropout': 0.6102443246439885, 'mlp_size_1': 0, 'mlp_size_2': 2, 'mlp_size_3': 0, 'kernel': 'Exponential', 'loss_name': 'NLLLoss'}. Best is trial 276 with value: 0.8727082992323222.[0m
[32m[I 2022-04-16 13:07:45,711][0m Trial 307 finished with value: 0.8349955868508676 and parameters: {'n_hidden': 64, 'mixture_components': 8, 'use_sparse_layer': False, 'use_batchnorm': True, 'use_dropout': True, 'dropout': 0.5618890700491153, 'mlp_size_1': 0, 'mlp_size_2': 2, 'mlp_size_3': 0, 'kernel': 'LogLogistic', 'loss_name': 'NLLLoss'}. Best is trial 276 with value: 0.8727082992323222.[0m
[32m[I 2022-04-16 13:11:15,064][0m Trial 308 finished with value: 0.8460810117043133 and parameters: {'n_hidden': 1024, 'mixture_components': 7, 'use_sparse_layer': False, 'use_batchnorm': True, 'use_dropout': True, 'dropout': 0.4839971391008866, 'mlp_size_1': 1, 'mlp_size_2': 2, 'mlp_size_3': 0, 'kernel': 'Exponential', 'loss_name': 'NLLLoss'}. Best is trial 276 with value: 0.8727082992323222.[0m
[32m[I 2022-04-16 13:14:15,472][0m Trial 309 finished with value: 0.8408965414627829 and parameters: {'n_hidden': 512, 'mixture_components': 8, 'use_sparse_layer': False, 'use_batchnorm': True, 'use_dropout': True, 'dropout': 0.596395810556646, 'mlp_size_1': 3, 'mlp_size_2': 2, 'mlp_size_3': 0, 'kernel': 'Exponential', 'loss_name': 'NLLLoss'}. Best is trial 276 with value: 0.8727082992323222.[0m
[32m[I 2022-04-16 13:19:32,952][0m Trial 310 finished with value: 0.8619032610603019 and parameters: {'n_hidden': 64, 'mixture_components': 8, 'use_sparse_layer': False, 'use_batchnorm': True, 'use_dropout': True, 'dropout': 0.6264249502703291, 'mlp_size_1': 0, 'mlp_size_2': 2, 'mlp_size_3': 0, 'kernel': 'Exponential', 'loss_name': 'NLLLoss'}. Best is trial 276 with value: 0.8727082992323222.[0m
[32m[I 2022-04-16 13:20:48,405][0m Trial 311 finished with value: 0.6371763247146729 and parameters: {'n_hidden': 64, 'mixture_components': 9, 'use_sparse_layer': False, 'use_batchnorm': False, 'use_dropout': True, 'dropout': 0.6609420514204433, 'mlp_size_1': 0, 'mlp_size_2': 2, 'mlp_size_3': 0, 'kernel': 'Exponential', 'loss_name': 'NLLLoss'}. Best is trial 276 with value: 0.8727082992323222.[0m
[32m[I 2022-04-16 13:27:52,410][0m Trial 312 finished with value: 0.8742192832944633 and parameters: {'n_hidden': 64, 'mixture_components': 7, 'use_sparse_layer': False, 'use_batchnorm': True, 'use_dropout': True, 'dropout': 0.7221246396547074, 'mlp_size_1': 0, 'mlp_size_2': 2, 'mlp_size_3': 0, 'kernel': 'Exponential', 'loss_name': 'NLLLoss'}. Best is trial 312 with value: 0.8742192832944633.[0m
[32m[I 2022-04-16 13:33:35,068][0m Trial 313 finished with value: 0.8656738998258593 and parameters: {'n_hidden': 64, 'mixture_components': 7, 'use_sparse_layer': False, 'use_batchnorm': True, 'use_dropout': True, 'dropout': 0.7496883704017289, 'mlp_size_1': 0, 'mlp_size_2': 2, 'mlp_size_3': 0, 'kernel': 'Exponential', 'loss_name': 'NLLLoss'}. Best is trial 312 with value: 0.8742192832944633.[0m
[32m[I 2022-04-16 13:38:25,709][0m Trial 314 finished with value: 0.8261955505766123 and parameters: {'n_hidden': 64, 'mixture_components': 7, 'use_sparse_layer': False, 'use_batchnorm': True, 'use_dropout': True, 'dropout': 0.7234190020743976, 'mlp_size_1': 0, 'mlp_size_2': 2, 'mlp_size_3': 0, 'kernel': 'Normal', 'loss_name': 'NLLLoss'}. Best is trial 312 with value: 0.8742192832944633.[0m
[32m[I 2022-04-16 13:44:37,758][0m Trial 315 finished with value: 0.8626600001095566 and parameters: {'n_hidden': 64, 'mixture_components': 7, 'use_sparse_layer': False, 'use_batchnorm': True, 'use_dropout': True, 'dropout': 0.713570399473026, 'mlp_size_1': 0, 'mlp_size_2': 2, 'mlp_size_3': 0, 'kernel': 'Exponential', 'loss_name': 'AlternativeNLLLoss'}. Best is trial 312 with value: 0.8742192832944633.[0m
[32m[I 2022-04-16 13:50:11,144][0m Trial 316 finished with value: 0.8677730369594631 and parameters: {'n_hidden': 64, 'mixture_components': 7, 'use_sparse_layer': False, 'use_batchnorm': True, 'use_dropout': True, 'dropout': 0.6955999276969362, 'mlp_size_1': 0, 'mlp_size_2': 2, 'mlp_size_3': 0, 'kernel': 'Exponential', 'loss_name': 'NLLLoss'}. Best is trial 312 with value: 0.8742192832944633.[0m
[32m[I 2022-04-16 13:55:08,830][0m Trial 317 finished with value: 0.8649532518871865 and parameters: {'n_hidden': 64, 'mixture_components': 6, 'use_sparse_layer': False, 'use_batchnorm': True, 'use_dropout': True, 'dropout': 0.5889915810934143, 'mlp_size_1': 0, 'mlp_size_2': 2, 'mlp_size_3': 0, 'kernel': 'Weibull', 'loss_name': 'NLLLoss'}. Best is trial 312 with value: 0.8742192832944633.[0m
