[32m[I 2022-04-14 03:10:10,323][0m Trial 642 finished with value: 0.65 and parameters: {'loss': 'coxph', 'learning_rate': 0.003477038292010553, 'n_estimators': 134, 'criterion': 'absolute_error', 'min_samples_split': 5, 'min_samples_leaf': 1, 'min_weight_fraction_leaf': 0.03441374915904074, 'min_impurity_decrease': 0.2780867634236441, 'max_features': 0.9701317713455138, 'subsample': 0.7234236639894056, 'dropout_rate': 0.3102926033023981, 'ccp_alpha': 1.1384999307057884}. Best is trial 627 with value: 0.8808013426064705.[0m
[32m[I 2022-04-14 03:10:12,902][0m Trial 643 finished with value: 0.8703349668376085 and parameters: {'loss': 'coxph', 'learning_rate': 0.006274878797299448, 'n_estimators': 140, 'criterion': 'friedman_mse', 'min_samples_split': 4, 'min_samples_leaf': 1, 'min_weight_fraction_leaf': 0.06444772202837674, 'min_impurity_decrease': 0.30336746012900845, 'max_features': 0.9514621960966895, 'subsample': 0.7480486609373826, 'dropout_rate': 0.34852507223352297, 'ccp_alpha': 0.09174339613913855}. Best is trial 627 with value: 0.8808013426064705.[0m
[32m[I 2022-04-14 03:10:15,300][0m Trial 644 finished with value: 0.8669002489518067 and parameters: {'loss': 'coxph', 'learning_rate': 0.003588303653915797, 'n_estimators': 127, 'criterion': 'friedman_mse', 'min_samples_split': 4, 'min_samples_leaf': 1, 'min_weight_fraction_leaf': 0.05552061730069784, 'min_impurity_decrease': 0.32177973518660924, 'max_features': 0.9770854254404738, 'subsample': 0.7135285253454959, 'dropout_rate': 0.34780934130774094, 'ccp_alpha': 0.09530451367183194}. Best is trial 627 with value: 0.8808013426064705.[0m
[32m[I 2022-04-14 03:10:18,603][0m Trial 645 finished with value: 0.65 and parameters: {'loss': 'coxph', 'learning_rate': 0.002937396316850746, 'n_estimators': 135, 'criterion': 'friedman_mse', 'min_samples_split': 4, 'min_samples_leaf': 1, 'min_weight_fraction_leaf': 0.040143719964435366, 'min_impurity_decrease': 0.2707829428910493, 'max_features': 0.9986396996606279, 'subsample': 0.7360309721869737, 'dropout_rate': 0.3718856088439682, 'ccp_alpha': 4.793803533056151}. Best is trial 627 with value: 0.8808013426064705.[0m
[32m[I 2022-04-14 03:10:22,250][0m Trial 646 finished with value: 0.65 and parameters: {'loss': 'coxph', 'learning_rate': 0.004692091348408411, 'n_estimators': 119, 'criterion': 'friedman_mse', 'min_samples_split': 4, 'min_samples_leaf': 1, 'min_weight_fraction_leaf': 0.028819416499083015, 'min_impurity_decrease': 0.29201968739731704, 'max_features': 0.9467205906893424, 'subsample': 0.690968748408257, 'dropout_rate': 0.31487951811928033, 'ccp_alpha': 3.7633863298947148}. Best is trial 627 with value: 0.8808013426064705.[0m
[32m[I 2022-04-14 03:10:25,916][0m Trial 647 finished with value: 0.8732152367341064 and parameters: {'loss': 'coxph', 'learning_rate': 0.008695490055157837, 'n_estimators': 157, 'criterion': 'friedman_mse', 'min_samples_split': 4, 'min_samples_leaf': 1, 'min_weight_fraction_leaf': 0.07112342592877774, 'min_impurity_decrease': 0.3219034930587802, 'max_features': 0.973617719759511, 'subsample': 0.7607133683662413, 'dropout_rate': 0.333378055875685, 'ccp_alpha': 0.0014638900404275014}. Best is trial 627 with value: 0.8808013426064705.[0m
[32m[I 2022-04-14 03:10:29,051][0m Trial 648 finished with value: 0.8498303852527253 and parameters: {'loss': 'coxph', 'learning_rate': 0.0024152699723974332, 'n_estimators': 143, 'criterion': 'friedman_mse', 'min_samples_split': 4, 'min_samples_leaf': 1, 'min_weight_fraction_leaf': 0.04906761433440654, 'min_impurity_decrease': 0.31361555994471285, 'max_features': 0.9979130556224498, 'subsample': 0.7629751170153334, 'dropout_rate': 0.3615002653094863, 'ccp_alpha': 0.18572457155840835}. Best is trial 627 with value: 0.8808013426064705.[0m
[32m[I 2022-04-14 03:10:32,729][0m Trial 649 finished with value: 0.65 and parameters: {'loss': 'coxph', 'learning_rate': 0.002905302853988686, 'n_estimators': 150, 'criterion': 'friedman_mse', 'min_samples_split': 4, 'min_samples_leaf': 1, 'min_weight_fraction_leaf': 0.03705699264573213, 'min_impurity_decrease': 0.2856204213401695, 'max_features': 0.9495804845891991, 'subsample': 0.7279491342243263, 'dropout_rate': 0.38969219971115343, 'ccp_alpha': 2.1283062757000404}. Best is trial 627 with value: 0.8808013426064705.[0m
[32m[I 2022-04-14 03:10:35,967][0m Trial 650 finished with value: 0.6524506958451449 and parameters: {'loss': 'coxph', 'learning_rate': 0.002194016227609251, 'n_estimators': 145, 'criterion': 'squared_error', 'min_samples_split': 4, 'min_samples_leaf': 1, 'min_weight_fraction_leaf': 0.04339812773701107, 'min_impurity_decrease': 0.3652424027883274, 'max_features': 0.9985190948251594, 'subsample': 0.7494765294010178, 'dropout_rate': 0.35466430048762726, 'ccp_alpha': 0.26278920478916346}. Best is trial 627 with value: 0.8808013426064705.[0m
[32m[I 2022-04-14 03:10:39,664][0m Trial 651 finished with value: 0.8670440215197754 and parameters: {'loss': 'coxph', 'learning_rate': 0.003553415032649334, 'n_estimators': 131, 'criterion': 'friedman_mse', 'min_samples_split': 5, 'min_samples_leaf': 1, 'min_weight_fraction_leaf': 0.05985255158489626, 'min_impurity_decrease': 0.3273615037410429, 'max_features': 0.9652314038926683, 'subsample': 0.7058293884674101, 'dropout_rate': 0.315927364554481, 'ccp_alpha': 0.10153518243143138}. Best is trial 627 with value: 0.8808013426064705.[0m
[32m[I 2022-04-14 03:10:45,234][0m Trial 652 finished with value: 0.8689478073262643 and parameters: {'loss': 'coxph', 'learning_rate': 0.0020957196065201, 'n_estimators': 187, 'criterion': 'friedman_mse', 'min_samples_split': 4, 'min_samples_leaf': 1, 'min_weight_fraction_leaf': 0.028098441962878876, 'min_impurity_decrease': 0.3422085887738168, 'max_features': 0.943257378360645, 'subsample': 0.5408388998156659, 'dropout_rate': 0.3761199857587353, 'ccp_alpha': 0.0017410220814211355}. Best is trial 627 with value: 0.8808013426064705.[0m
[32m[I 2022-04-14 03:10:48,580][0m Trial 653 finished with value: 0.65 and parameters: {'loss': 'coxph', 'learning_rate': 0.00011132008894648939, 'n_estimators': 155, 'criterion': 'friedman_mse', 'min_samples_split': 4, 'min_samples_leaf': 1, 'min_weight_fraction_leaf': 0.06784890687341079, 'min_impurity_decrease': 0.36319627083563427, 'max_features': 0.9375873258588242, 'subsample': 0.7763972578253513, 'dropout_rate': 0.38821963041552426, 'ccp_alpha': 0.42335132007898313}. Best is trial 627 with value: 0.8808013426064705.[0m
[32m[I 2022-04-14 03:10:52,436][0m Trial 654 finished with value: 0.8570483459047606 and parameters: {'loss': 'coxph', 'learning_rate': 0.002948791196860961, 'n_estimators': 164, 'criterion': 'friedman_mse', 'min_samples_split': 4, 'min_samples_leaf': 1, 'min_weight_fraction_leaf': 0.05163165243806507, 'min_impurity_decrease': 0.3072856868974865, 'max_features': 0.9645662792891345, 'subsample': 0.7391783463190884, 'dropout_rate': 0.34484021412041255, 'ccp_alpha': 0.16527062979802679}. Best is trial 627 with value: 0.8808013426064705.[0m
[32m[I 2022-04-14 03:10:55,704][0m Trial 655 finished with value: 0.6580440744419354 and parameters: {'loss': 'coxph', 'learning_rate': 0.0023151938437043634, 'n_estimators': 124, 'criterion': 'friedman_mse', 'min_samples_split': 4, 'min_samples_leaf': 1, 'min_weight_fraction_leaf': 0.02881205618574087, 'min_impurity_decrease': 0.28420814448376325, 'max_features': 0.9361884442886421, 'subsample': 0.7864395187564092, 'dropout_rate': 0.30052796004340515, 'ccp_alpha': 0.3179264648858598}. Best is trial 627 with value: 0.8808013426064705.[0m
[32m[I 2022-04-14 03:10:58,166][0m Trial 656 finished with value: 0.8681597616939477 and parameters: {'loss': 'coxph', 'learning_rate': 0.00448844530163916, 'n_estimators': 133, 'criterion': 'friedman_mse', 'min_samples_split': 4, 'min_samples_leaf': 1, 'min_weight_fraction_leaf': 0.07756090790040962, 'min_impurity_decrease': 0.350074448501573, 'max_features': 0.9721325947970034, 'subsample': 0.76192498279703, 'dropout_rate': 0.3352563974554414, 'ccp_alpha': 0.1193403014012345}. Best is trial 627 with value: 0.8808013426064705.[0m
[32m[I 2022-04-14 03:11:01,862][0m Trial 657 finished with value: -0.37022997279194536 and parameters: {'loss': 'squared', 'learning_rate': 0.021397909773481175, 'n_estimators': 144, 'criterion': 'friedman_mse', 'min_samples_split': 4, 'min_samples_leaf': 1, 'min_weight_fraction_leaf': 0.03991905585025423, 'min_impurity_decrease': 0.3774871096012422, 'max_features': 0.9567888587350972, 'subsample': 0.7254044156339393, 'dropout_rate': 0.3939371792253529, 'ccp_alpha': 0.09119498123049692}. Best is trial 627 with value: 0.8808013426064705.[0m
[32m[I 2022-04-14 03:11:06,100][0m Trial 658 finished with value: 0.849194255994503 and parameters: {'loss': 'coxph', 'learning_rate': 0.0018673076018995607, 'n_estimators': 176, 'criterion': 'friedman_mse', 'min_samples_split': 4, 'min_samples_leaf': 1, 'min_weight_fraction_leaf': 0.05167157070855431, 'min_impurity_decrease': 0.33334871277807343, 'max_features': 0.9340847108747513, 'subsample': 0.791498012732712, 'dropout_rate': 0.36505337951268, 'ccp_alpha': 0.20396986585493615}. Best is trial 627 with value: 0.8808013426064705.[0m
[32m[I 2022-04-14 03:11:08,952][0m Trial 659 finished with value: 0.8696639686603114 and parameters: {'loss': 'coxph', 'learning_rate': 0.002811551976600969, 'n_estimators': 191, 'criterion': 'friedman_mse', 'min_samples_split': 4, 'min_samples_leaf': 1, 'min_weight_fraction_leaf': 0.032283884267011925, 'min_impurity_decrease': 0.3098890987470704, 'max_features': 0.9715836912581811, 'subsample': 0.7674130518841737, 'dropout_rate': 0.6735987666561848, 'ccp_alpha': 0.08845059550746863}. Best is trial 627 with value: 0.8808013426064705.[0m
[32m[I 2022-04-14 03:11:15,990][0m Trial 660 finished with value: 0.8776445398654547 and parameters: {'loss': 'coxph', 'learning_rate': 0.0020971353495764012, 'n_estimators': 204, 'criterion': 'friedman_mse', 'min_samples_split': 8, 'min_samples_leaf': 1, 'min_weight_fraction_leaf': 0.04248266266006601, 'min_impurity_decrease': 0.2670341751021215, 'max_features': 0.9533228227750321, 'subsample': 0.698513101956922, 'dropout_rate': 0.35478332157752607, 'ccp_alpha': 0.0015120622158510716}. Best is trial 627 with value: 0.8808013426064705.[0m
[32m[I 2022-04-14 03:11:22,664][0m Trial 661 finished with value: 0.8767707456153587 and parameters: {'loss': 'coxph', 'learning_rate': 0.0021286318658795787, 'n_estimators': 214, 'criterion': 'friedman_mse', 'min_samples_split': 5, 'min_samples_leaf': 1, 'min_weight_fraction_leaf': 0.027983282081546837, 'min_impurity_decrease': 0.265693270290028, 'max_features': 0.9784332090663987, 'subsample': 0.6878854022408787, 'dropout_rate': 0.3527048334555596, 'ccp_alpha': 0.0027630059747122127}. Best is trial 627 with value: 0.8808013426064705.[0m
[32m[I 2022-04-14 03:11:28,193][0m Trial 662 finished with value: 0.873702808911762 and parameters: {'loss': 'coxph', 'learning_rate': 0.0017111764143271837, 'n_estimators': 205, 'criterion': 'friedman_mse', 'min_samples_split': 6, 'min_samples_leaf': 1, 'min_weight_fraction_leaf': 0.024131720747098906, 'min_impurity_decrease': 0.26835453893176686, 'max_features': 0.9865242259329734, 'subsample': 0.6943855616498309, 'dropout_rate': 0.3742206910725397, 'ccp_alpha': 0.0010488169231813982}. Best is trial 627 with value: 0.8808013426064705.[0m
[32m[I 2022-04-14 03:11:34,512][0m Trial 663 finished with value: 0.8554702363643691 and parameters: {'loss': 'coxph', 'learning_rate': 0.0022967323070740057, 'n_estimators': 205, 'criterion': 'friedman_mse', 'min_samples_split': 7, 'min_samples_leaf': 1, 'min_weight_fraction_leaf': 0.03273243277647951, 'min_impurity_decrease': 0.26222261041019784, 'max_features': 0.9795586760762809, 'subsample': 0.6825856395451891, 'dropout_rate': 0.3493420838358137, 'ccp_alpha': 0.2316881865957357}. Best is trial 627 with value: 0.8808013426064705.[0m
[32m[I 2022-04-14 03:11:41,973][0m Trial 664 finished with value: 0.8685307870272648 and parameters: {'loss': 'coxph', 'learning_rate': 0.0019983390924915127, 'n_estimators': 215, 'criterion': 'friedman_mse', 'min_samples_split': 5, 'min_samples_leaf': 1, 'min_weight_fraction_leaf': 0.024359502077870097, 'min_impurity_decrease': 0.2906667389590689, 'max_features': 0.9974413235973291, 'subsample': 0.7112949413007366, 'dropout_rate': 0.3474672508821438, 'ccp_alpha': 0.09949120836757665}. Best is trial 627 with value: 0.8808013426064705.[0m
[32m[I 2022-04-14 03:11:49,535][0m Trial 665 finished with value: 0.8610273599868243 and parameters: {'loss': 'coxph', 'learning_rate': 0.0015843904921718525, 'n_estimators': 197, 'criterion': 'friedman_mse', 'min_samples_split': 9, 'min_samples_leaf': 1, 'min_weight_fraction_leaf': 0.03622544287193291, 'min_impurity_decrease': 0.25330769261224806, 'max_features': 0.9983185158826083, 'subsample': 0.6969518394304797, 'dropout_rate': 0.3731205469975839, 'ccp_alpha': 0.165082925994314}. Best is trial 627 with value: 0.8808013426064705.[0m
[32m[I 2022-04-14 03:11:55,572][0m Trial 666 finished with value: 0.65 and parameters: {'loss': 'coxph', 'learning_rate': 0.0020508444077420762, 'n_estimators': 205, 'criterion': 'friedman_mse', 'min_samples_split': 9, 'min_samples_leaf': 1, 'min_weight_fraction_leaf': 0.023310632128156712, 'min_impurity_decrease': 0.2817077791881964, 'max_features': 0.9593351164496265, 'subsample': 0.6856951485613335, 'dropout_rate': 0.38836972297916494, 'ccp_alpha': 1.4169073338606235}. Best is trial 627 with value: 0.8808013426064705.[0m
[32m[I 2022-04-14 03:12:03,250][0m Trial 667 finished with value: 0.65 and parameters: {'loss': 'coxph', 'learning_rate': 0.002459999403500008, 'n_estimators': 222, 'criterion': 'absolute_error', 'min_samples_split': 8, 'min_samples_leaf': 1, 'min_weight_fraction_leaf': 0.0395870351073412, 'min_impurity_decrease': 0.2690423876357872, 'max_features': 0.9549830584493191, 'subsample': 0.714258785693109, 'dropout_rate': 0.32931430332848766, 'ccp_alpha': 0.3200705507693683}. Best is trial 627 with value: 0.8808013426064705.[0m
[32m[I 2022-04-14 03:12:09,922][0m Trial 668 finished with value: 0.8760865377649558 and parameters: {'loss': 'coxph', 'learning_rate': 0.0015916829891930075, 'n_estimators': 214, 'criterion': 'friedman_mse', 'min_samples_split': 6, 'min_samples_leaf': 1, 'min_weight_fraction_leaf': 0.04237856613956054, 'min_impurity_decrease': 0.3119539087361936, 'max_features': 0.9753646567404224, 'subsample': 0.7341553954521888, 'dropout_rate': 0.35754868582624555, 'ccp_alpha': 0.0034009464379607794}. Best is trial 627 with value: 0.8808013426064705.[0m
[32m[I 2022-04-14 03:12:19,213][0m Trial 669 finished with value: 0.8605687022278043 and parameters: {'loss': 'coxph', 'learning_rate': 0.0034318433833340762, 'n_estimators': 224, 'criterion': 'friedman_mse', 'min_samples_split': 6, 'min_samples_leaf': 1, 'min_weight_fraction_leaf': 0.030112422993831583, 'min_impurity_decrease': 0.3005808677550814, 'max_features': 0.9775423328314272, 'subsample': 0.72833808930472, 'dropout_rate': 0.34716480667283905, 'ccp_alpha': 0.163935625773676}. Best is trial 627 with value: 0.8808013426064705.[0m
[32m[I 2022-04-14 03:12:28,288][0m Trial 670 finished with value: 0.8758589199682676 and parameters: {'loss': 'coxph', 'learning_rate': 0.001702330315462798, 'n_estimators': 216, 'criterion': 'friedman_mse', 'min_samples_split': 6, 'min_samples_leaf': 1, 'min_weight_fraction_leaf': 0.023029368325392964, 'min_impurity_decrease': 0.31648391805425335, 'max_features': 0.9809889126712138, 'subsample': 0.7125314122177479, 'dropout_rate': 0.3689043911218911, 'ccp_alpha': 0.002405539890031615}. Best is trial 627 with value: 0.8808013426064705.[0m
[32m[I 2022-04-14 03:12:37,453][0m Trial 671 finished with value: 0.8717129098415259 and parameters: {'loss': 'coxph', 'learning_rate': 0.0025619259531833656, 'n_estimators': 238, 'criterion': 'friedman_mse', 'min_samples_split': 6, 'min_samples_leaf': 1, 'min_weight_fraction_leaf': 0.019126707785680753, 'min_impurity_decrease': 0.3201748021100941, 'max_features': 0.9789784927637974, 'subsample': 0.6651388089724618, 'dropout_rate': 0.35169563736594195, 'ccp_alpha': 0.002522471406834288}. Best is trial 627 with value: 0.8808013426064705.[0m
[32m[I 2022-04-14 03:12:44,744][0m Trial 672 finished with value: 0.8509976008615683 and parameters: {'loss': 'coxph', 'learning_rate': 0.001980219891286048, 'n_estimators': 216, 'criterion': 'squared_error', 'min_samples_split': 6, 'min_samples_leaf': 1, 'min_weight_fraction_leaf': 0.023221945365861578, 'min_impurity_decrease': 0.3117758841933416, 'max_features': 0.9817960017344428, 'subsample': 0.45327065195629584, 'dropout_rate': 0.3714199200653304, 'ccp_alpha': 0.25295584312168534}. Best is trial 627 with value: 0.8808013426064705.[0m
[32m[I 2022-04-14 03:12:54,940][0m Trial 673 finished with value: 0.8689975375408541 and parameters: {'loss': 'coxph', 'learning_rate': 0.003169892063661208, 'n_estimators': 236, 'criterion': 'friedman_mse', 'min_samples_split': 6, 'min_samples_leaf': 1, 'min_weight_fraction_leaf': 0.0315173884957444, 'min_impurity_decrease': 0.2963626598662517, 'max_features': 0.9979420088035883, 'subsample': 0.7005158099997821, 'dropout_rate': 0.36191794061204163, 'ccp_alpha': 0.09421241264854364}. Best is trial 627 with value: 0.8808013426064705.[0m
[32m[I 2022-04-14 03:13:02,311][0m Trial 674 finished with value: 0.8593722572924459 and parameters: {'loss': 'coxph', 'learning_rate': 0.0018887018773463742, 'n_estimators': 215, 'criterion': 'friedman_mse', 'min_samples_split': 7, 'min_samples_leaf': 1, 'min_weight_fraction_leaf': 0.012046228760541103, 'min_impurity_decrease': 0.3296731046487608, 'max_features': 0.9987358888030629, 'subsample': 0.6819379915995595, 'dropout_rate': 0.32628489134053545, 'ccp_alpha': 0.19153122955794813}. Best is trial 627 with value: 0.8808013426064705.[0m
[32m[I 2022-04-14 03:13:09,522][0m Trial 675 finished with value: 0.8663797497046943 and parameters: {'loss': 'coxph', 'learning_rate': 0.00255770516813476, 'n_estimators': 207, 'criterion': 'friedman_mse', 'min_samples_split': 6, 'min_samples_leaf': 1, 'min_weight_fraction_leaf': 0.023340228284355946, 'min_impurity_decrease': 0.2901925300462286, 'max_features': 0.9700638290195706, 'subsample': 0.7117740251867293, 'dropout_rate': 0.38212255091736724, 'ccp_alpha': 0.09497529575905386}. Best is trial 627 with value: 0.8808013426064705.[0m
[32m[I 2022-04-14 03:13:18,150][0m Trial 676 finished with value: 0.65 and parameters: {'loss': 'coxph', 'learning_rate': 0.0016075604524243517, 'n_estimators': 231, 'criterion': 'friedman_mse', 'min_samples_split': 8, 'min_samples_leaf': 1, 'min_weight_fraction_leaf': 0.03912341014197888, 'min_impurity_decrease': 0.33597590730847704, 'max_features': 0.967538552523711, 'subsample': 0.727990538624109, 'dropout_rate': 0.32972769954980397, 'ccp_alpha': 1.272285247444328}. Best is trial 627 with value: 0.8808013426064705.[0m
[32m[I 2022-04-14 03:13:20,469][0m Trial 677 finished with value: 0.8663843270124232 and parameters: {'loss': 'coxph', 'learning_rate': 0.0038062619702995447, 'n_estimators': 227, 'criterion': 'friedman_mse', 'min_samples_split': 7, 'min_samples_leaf': 1, 'min_weight_fraction_leaf': 0.02025101193921264, 'min_impurity_decrease': 0.3160638879026901, 'max_features': 0.956678958926617, 'subsample': 0.7093815951181759, 'dropout_rate': 0.929638573695508, 'ccp_alpha': 0.09016640227260518}. Best is trial 627 with value: 0.8808013426064705.[0m
[32m[I 2022-04-14 03:13:29,241][0m Trial 678 finished with value: -0.3629984419398026 and parameters: {'loss': 'squared', 'learning_rate': 0.0022698192583386363, 'n_estimators': 246, 'criterion': 'friedman_mse', 'min_samples_split': 6, 'min_samples_leaf': 1, 'min_weight_fraction_leaf': 0.032971263867729625, 'min_impurity_decrease': 0.27524211081875816, 'max_features': 0.9985960898352411, 'subsample': 0.6858081209942436, 'dropout_rate': 0.3606213931456135, 'ccp_alpha': 0.005455272032440778}. Best is trial 627 with value: 0.8808013426064705.[0m
[32m[I 2022-04-14 03:13:37,212][0m Trial 679 finished with value: 0.7104759328282697 and parameters: {'loss': 'coxph', 'learning_rate': 0.003164904845400821, 'n_estimators': 212, 'criterion': 'friedman_mse', 'min_samples_split': 6, 'min_samples_leaf': 1, 'min_weight_fraction_leaf': 0.042763925334667496, 'min_impurity_decrease': 0.24633990145782916, 'max_features': 0.9771064332063538, 'subsample': 0.7374149033704912, 'dropout_rate': 0.3918007253570172, 'ccp_alpha': 0.256574328594027}. Best is trial 627 with value: 0.8808013426064705.[0m
[32m[I 2022-04-14 03:13:43,675][0m Trial 680 finished with value: 0.8555325298248301 and parameters: {'loss': 'coxph', 'learning_rate': 0.005704759647744516, 'n_estimators': 198, 'criterion': 'friedman_mse', 'min_samples_split': 6, 'min_samples_leaf': 1, 'min_weight_fraction_leaf': 0.017127225943777424, 'min_impurity_decrease': 0.302193754270362, 'max_features': 0.9484208728552012, 'subsample': 0.7163887654177746, 'dropout_rate': 0.3406376279232041, 'ccp_alpha': 0.17681682832782603}. Best is trial 627 with value: 0.8808013426064705.[0m
[32m[I 2022-04-14 03:13:52,502][0m Trial 681 finished with value: 0.6524506958451449 and parameters: {'loss': 'coxph', 'learning_rate': 0.0018190799857141378, 'n_estimators': 211, 'criterion': 'friedman_mse', 'min_samples_split': 6, 'min_samples_leaf': 1, 'min_weight_fraction_leaf': 0.029350915862919554, 'min_impurity_decrease': 0.35076930100558934, 'max_features': 0.9591837467086561, 'subsample': 0.7387589020072023, 'dropout_rate': 0.3044299054958695, 'ccp_alpha': 0.37260828456916356}. Best is trial 627 with value: 0.8808013426064705.[0m
