[32m[I 2022-04-13 11:45:14,416][0m Trial 535 finished with value: 0.8643129825609158 and parameters: {'alpha': 2.223201165642319, 'ties': 'breslow'}. Best is trial 99 with value: 0.8654869897806009.[0m
[32m[I 2022-04-13 11:45:14,638][0m Trial 536 finished with value: 0.8639833328806962 and parameters: {'alpha': 2.5294006660382595, 'ties': 'breslow'}. Best is trial 99 with value: 0.8654869897806009.[0m
[32m[I 2022-04-13 11:45:14,982][0m Trial 537 finished with value: 0.8654085943201592 and parameters: {'alpha': 2.0490635875910574, 'ties': 'efron'}. Best is trial 99 with value: 0.8654869897806009.[0m
[32m[I 2022-04-13 11:45:15,165][0m Trial 538 finished with value: 0.8648486321634327 and parameters: {'alpha': 2.3485001236492646, 'ties': 'breslow'}. Best is trial 99 with value: 0.8654869897806009.[0m
[32m[I 2022-04-13 11:45:15,349][0m Trial 539 finished with value: 0.8643129825609158 and parameters: {'alpha': 2.2725942471901535, 'ties': 'efron'}. Best is trial 99 with value: 0.8654869897806009.[0m
[32m[I 2022-04-13 11:45:15,624][0m Trial 540 finished with value: 0.8647702367029909 and parameters: {'alpha': 2.0970704364915758, 'ties': 'efron'}. Best is trial 99 with value: 0.8654869897806009.[0m
[32m[I 2022-04-13 11:45:16,138][0m Trial 541 finished with value: 0.8648486321634327 and parameters: {'alpha': 2.4505500017693826, 'ties': 'breslow'}. Best is trial 99 with value: 0.8654869897806009.[0m
[32m[I 2022-04-13 11:45:16,579][0m Trial 542 finished with value: 0.862248565592125 and parameters: {'alpha': 2.700968135588616, 'ties': 'breslow'}. Best is trial 99 with value: 0.8654869897806009.[0m
[32m[I 2022-04-13 11:45:16,685][0m Trial 543 finished with value: 0.8654869897806009 and parameters: {'alpha': 2.3341100248279396, 'ties': 'breslow'}. Best is trial 99 with value: 0.8654869897806009.[0m
[32m[I 2022-04-13 11:45:16,812][0m Trial 544 finished with value: 0.8643129825609158 and parameters: {'alpha': 2.200524353504446, 'ties': 'efron'}. Best is trial 99 with value: 0.8654869897806009.[0m
[32m[I 2022-04-13 11:45:16,912][0m Trial 545 finished with value: 0.8648218682663185 and parameters: {'alpha': 2.1450840893770735, 'ties': 'efron'}. Best is trial 99 with value: 0.8654869897806009.[0m
[32m[I 2022-04-13 11:45:17,078][0m Trial 546 finished with value: 0.8639833328806962 and parameters: {'alpha': 2.597673778276977, 'ties': 'breslow'}. Best is trial 99 with value: 0.8654869897806009.[0m
[32m[I 2022-04-13 11:45:17,268][0m Trial 547 finished with value: 0.8643129825609158 and parameters: {'alpha': 2.233052100797958, 'ties': 'efron'}. Best is trial 99 with value: 0.8654869897806009.[0m
[32m[I 2022-04-13 11:45:17,512][0m Trial 548 finished with value: 0.8643129825609158 and parameters: {'alpha': 2.276076740506054, 'ties': 'efron'}. Best is trial 99 with value: 0.8654869897806009.[0m
[32m[I 2022-04-13 11:45:17,692][0m Trial 549 finished with value: 0.8648486321634327 and parameters: {'alpha': 2.4545339740262175, 'ties': 'efron'}. Best is trial 99 with value: 0.8654869897806009.[0m
[32m[I 2022-04-13 11:45:17,951][0m Trial 550 finished with value: 0.8648486321634327 and parameters: {'alpha': 2.4137243288286117, 'ties': 'breslow'}. Best is trial 99 with value: 0.8654869897806009.[0m
[32m[I 2022-04-13 11:45:18,213][0m Trial 551 finished with value: 0.8648486321634327 and parameters: {'alpha': 2.374571404703841, 'ties': 'breslow'}. Best is trial 99 with value: 0.8654869897806009.[0m
[32m[I 2022-04-13 11:45:18,460][0m Trial 552 finished with value: 0.8643129825609158 and parameters: {'alpha': 2.2825395891409035, 'ties': 'breslow'}. Best is trial 99 with value: 0.8654869897806009.[0m
[32m[I 2022-04-13 11:45:18,744][0m Trial 553 finished with value: 0.8639833328806962 and parameters: {'alpha': 2.5395726596462236, 'ties': 'breslow'}. Best is trial 99 with value: 0.8654869897806009.[0m
[32m[I 2022-04-13 11:45:18,931][0m Trial 554 finished with value: 0.8654869897806009 and parameters: {'alpha': 2.344465730879465, 'ties': 'breslow'}. Best is trial 99 with value: 0.8654869897806009.[0m
[32m[I 2022-04-13 11:45:19,291][0m Trial 555 finished with value: 0.8654085943201592 and parameters: {'alpha': 2.0362756048765656, 'ties': 'efron'}. Best is trial 99 with value: 0.8654869897806009.[0m
[32m[I 2022-04-13 11:45:19,730][0m Trial 556 finished with value: 0.8648218682663185 and parameters: {'alpha': 2.128958363525132, 'ties': 'efron'}. Best is trial 99 with value: 0.8654869897806009.[0m
[32m[I 2022-04-13 11:45:19,993][0m Trial 557 finished with value: 0.8643129825609158 and parameters: {'alpha': 2.2252010070031827, 'ties': 'efron'}. Best is trial 99 with value: 0.8654869897806009.[0m
[32m[I 2022-04-13 11:45:20,188][0m Trial 558 finished with value: 0.8648218682663185 and parameters: {'alpha': 2.174228353005449, 'ties': 'efron'}. Best is trial 99 with value: 0.8654869897806009.[0m
[32m[I 2022-04-13 11:45:20,345][0m Trial 559 finished with value: 0.8654869897806009 and parameters: {'alpha': 2.3380254220040224, 'ties': 'breslow'}. Best is trial 99 with value: 0.8654869897806009.[0m
[32m[I 2022-04-13 11:45:20,514][0m Trial 560 finished with value: 0.8648486321634327 and parameters: {'alpha': 2.432645093392275, 'ties': 'breslow'}. Best is trial 99 with value: 0.8654869897806009.[0m
[32m[I 2022-04-13 11:45:20,675][0m Trial 561 finished with value: 0.8647702367029909 and parameters: {'alpha': 2.1025254781144795, 'ties': 'efron'}. Best is trial 99 with value: 0.8654869897806009.[0m
[32m[I 2022-04-13 11:45:20,837][0m Trial 562 finished with value: 0.8648486321634327 and parameters: {'alpha': 2.5017810614557576, 'ties': 'breslow'}. Best is trial 99 with value: 0.8654869897806009.[0m
[32m[I 2022-04-13 11:45:21,343][0m Trial 563 finished with value: 0.8633478820480818 and parameters: {'alpha': 1.922875859679368, 'ties': 'efron'}. Best is trial 99 with value: 0.8654869897806009.[0m
[32m[I 2022-04-13 11:45:21,951][0m Trial 564 finished with value: 0.8643129825609158 and parameters: {'alpha': 2.290802523890838, 'ties': 'breslow'}. Best is trial 99 with value: 0.8654869897806009.[0m
[32m[I 2022-04-13 11:45:22,531][0m Trial 565 finished with value: 0.8648486321634327 and parameters: {'alpha': 2.408771808213928, 'ties': 'breslow'}. Best is trial 99 with value: 0.8654869897806009.[0m
[32m[I 2022-04-13 11:45:23,042][0m Trial 566 finished with value: 0.8643129825609158 and parameters: {'alpha': 2.214155838123595, 'ties': 'efron'}. Best is trial 99 with value: 0.8654869897806009.[0m
[32m[I 2022-04-13 11:45:23,531][0m Trial 567 finished with value: 0.8654085943201592 and parameters: {'alpha': 1.9944008446377268, 'ties': 'efron'}. Best is trial 99 with value: 0.8654869897806009.[0m
[32m[I 2022-04-13 11:45:23,971][0m Trial 568 finished with value: 0.8648486321634327 and parameters: {'alpha': 2.3667640214687844, 'ties': 'breslow'}. Best is trial 99 with value: 0.8654869897806009.[0m
[32m[I 2022-04-13 11:45:24,278][0m Trial 569 finished with value: 0.8643129825609158 and parameters: {'alpha': 2.235956835476929, 'ties': 'efron'}. Best is trial 99 with value: 0.8654869897806009.[0m
[32m[I 2022-04-13 11:45:24,536][0m Trial 570 finished with value: 0.8643129825609158 and parameters: {'alpha': 2.2798121020580866, 'ties': 'efron'}. Best is trial 99 with value: 0.8654869897806009.[0m
[32m[I 2022-04-13 11:45:24,937][0m Trial 571 finished with value: 0.8641835106491502 and parameters: {'alpha': 2.1182951387282167, 'ties': 'efron'}. Best is trial 99 with value: 0.8654869897806009.[0m
[32m[I 2022-04-13 11:45:25,247][0m Trial 572 finished with value: 0.8654869897806009 and parameters: {'alpha': 2.3102342266434293, 'ties': 'breslow'}. Best is trial 99 with value: 0.8654869897806009.[0m
[32m[I 2022-04-13 11:45:25,532][0m Trial 573 finished with value: 0.8639833328806962 and parameters: {'alpha': 2.5937549033285694, 'ties': 'breslow'}. Best is trial 99 with value: 0.8654869897806009.[0m
[32m[I 2022-04-13 11:45:25,680][0m Trial 574 finished with value: 0.8648218682663185 and parameters: {'alpha': 2.1555142382642654, 'ties': 'efron'}. Best is trial 99 with value: 0.8654869897806009.[0m
[32m[I 2022-04-13 11:45:25,948][0m Trial 575 finished with value: 0.8648486321634327 and parameters: {'alpha': 2.47279215396721, 'ties': 'efron'}. Best is trial 99 with value: 0.8654869897806009.[0m
[32m[I 2022-04-13 11:45:26,095][0m Trial 576 finished with value: 0.8648486321634327 and parameters: {'alpha': 2.337591786090948, 'ties': 'efron'}. Best is trial 99 with value: 0.8654869897806009.[0m
[32m[I 2022-04-13 11:45:26,473][0m Trial 577 finished with value: 0.8648486321634327 and parameters: {'alpha': 2.506223853801058, 'ties': 'breslow'}. Best is trial 99 with value: 0.8654869897806009.[0m
[32m[I 2022-04-13 11:45:26,909][0m Trial 578 finished with value: 0.8648486321634327 and parameters: {'alpha': 2.409573922833024, 'ties': 'breslow'}. Best is trial 99 with value: 0.8654869897806009.[0m
[32m[I 2022-04-13 11:45:27,190][0m Trial 579 finished with value: 0.8648486321634327 and parameters: {'alpha': 2.461109477492249, 'ties': 'breslow'}. Best is trial 99 with value: 0.8654869897806009.[0m
[32m[I 2022-04-13 11:45:27,661][0m Trial 580 finished with value: 0.858245496179121 and parameters: {'alpha': 4.502952023360955, 'ties': 'breslow'}. Best is trial 99 with value: 0.8654869897806009.[0m
[32m[I 2022-04-13 11:45:27,948][0m Trial 581 finished with value: 0.8654869897806009 and parameters: {'alpha': 2.3278362912311343, 'ties': 'breslow'}. Best is trial 99 with value: 0.8654869897806009.[0m
[32m[I 2022-04-13 11:45:28,242][0m Trial 582 finished with value: 0.8643129825609158 and parameters: {'alpha': 2.227630583131921, 'ties': 'efron'}. Best is trial 99 with value: 0.8654869897806009.[0m
[32m[I 2022-04-13 11:45:28,519][0m Trial 583 finished with value: 0.8654085943201592 and parameters: {'alpha': 1.9958640898997826, 'ties': 'efron'}. Best is trial 99 with value: 0.8654869897806009.[0m
[32m[I 2022-04-13 11:45:29,053][0m Trial 584 finished with value: 0.862248565592125 and parameters: {'alpha': 2.6867295818109524, 'ties': 'breslow'}. Best is trial 99 with value: 0.8654869897806009.[0m
[32m[I 2022-04-13 11:45:29,461][0m Trial 585 finished with value: 0.8639833328806962 and parameters: {'alpha': 2.533451855239769, 'ties': 'breslow'}. Best is trial 99 with value: 0.8654869897806009.[0m
[32m[I 2022-04-13 11:45:29,720][0m Trial 586 finished with value: 0.8648486321634327 and parameters: {'alpha': 2.3820819625482694, 'ties': 'breslow'}. Best is trial 99 with value: 0.8654869897806009.[0m
[32m[I 2022-04-13 11:45:30,003][0m Trial 587 finished with value: 0.8641835106491502 and parameters: {'alpha': 2.1250590624395156, 'ties': 'efron'}. Best is trial 99 with value: 0.8654869897806009.[0m
[32m[I 2022-04-13 11:45:30,100][0m Trial 588 finished with value: 0.8636746249437476 and parameters: {'alpha': 2.206143589844041, 'ties': 'breslow'}. Best is trial 99 with value: 0.8654869897806009.[0m
[32m[I 2022-04-13 11:45:30,258][0m Trial 589 finished with value: 0.8654869897806009 and parameters: {'alpha': 2.3250202793705594, 'ties': 'breslow'}. Best is trial 99 with value: 0.8654869897806009.[0m
[32m[I 2022-04-13 11:45:30,504][0m Trial 590 finished with value: 0.8654085943201592 and parameters: {'alpha': 2.0859515853781074, 'ties': 'efron'}. Best is trial 99 with value: 0.8654869897806009.[0m
[32m[I 2022-04-13 11:45:30,788][0m Trial 591 finished with value: 0.8648486321634327 and parameters: {'alpha': 2.4336825141496035, 'ties': 'breslow'}. Best is trial 99 with value: 0.8654869897806009.[0m
[32m[I 2022-04-13 11:45:31,033][0m Trial 592 finished with value: 0.8643129825609158 and parameters: {'alpha': 2.2477816029094284, 'ties': 'breslow'}. Best is trial 99 with value: 0.8654869897806009.[0m
[32m[I 2022-04-13 11:45:31,201][0m Trial 593 finished with value: 0.8639833328806962 and parameters: {'alpha': 2.6089426988395075, 'ties': 'breslow'}. Best is trial 99 with value: 0.8654869897806009.[0m
[32m[I 2022-04-13 11:45:31,495][0m Trial 594 finished with value: 0.8643129825609158 and parameters: {'alpha': 2.2693470203496426, 'ties': 'breslow'}. Best is trial 99 with value: 0.8654869897806009.[0m
[32m[I 2022-04-13 11:45:31,821][0m Trial 595 finished with value: 0.8648218682663185 and parameters: {'alpha': 2.1549978148801245, 'ties': 'efron'}. Best is trial 99 with value: 0.8654869897806009.[0m
[32m[I 2022-04-13 11:45:32,164][0m Trial 596 finished with value: 0.8648486321634327 and parameters: {'alpha': 2.4219492277278136, 'ties': 'breslow'}. Best is trial 99 with value: 0.8654869897806009.[0m
[32m[I 2022-04-13 11:45:32,505][0m Trial 597 finished with value: 0.8648486321634327 and parameters: {'alpha': 2.358286311021376, 'ties': 'breslow'}. Best is trial 99 with value: 0.8654869897806009.[0m
[32m[I 2022-04-13 11:45:33,015][0m Trial 598 finished with value: 0.8643129825609158 and parameters: {'alpha': 2.1931410461273564, 'ties': 'efron'}. Best is trial 99 with value: 0.8654869897806009.[0m
[32m[I 2022-04-13 11:45:33,333][0m Trial 599 finished with value: 0.8654085943201592 and parameters: {'alpha': 2.06029963419052, 'ties': 'efron'}. Best is trial 99 with value: 0.8654869897806009.[0m
[32m[I 2022-04-13 11:45:33,754][0m Trial 600 finished with value: 0.8639636135458373 and parameters: {'alpha': 1.79709302410846, 'ties': 'efron'}. Best is trial 99 with value: 0.8654869897806009.[0m
[32m[I 2022-04-13 11:45:34,098][0m Trial 601 finished with value: 0.8654869897806009 and parameters: {'alpha': 2.3421967407949507, 'ties': 'breslow'}. Best is trial 99 with value: 0.8654869897806009.[0m
[32m[I 2022-04-13 11:45:34,491][0m Trial 602 finished with value: 0.8639833328806962 and parameters: {'alpha': 2.5267769812312406, 'ties': 'breslow'}. Best is trial 99 with value: 0.8654869897806009.[0m
[32m[I 2022-04-13 11:45:34,996][0m Trial 603 finished with value: 0.8648486321634327 and parameters: {'alpha': 2.49472118649819, 'ties': 'breslow'}. Best is trial 99 with value: 0.8654869897806009.[0m
[32m[I 2022-04-13 11:45:35,420][0m Trial 604 finished with value: 0.8654869897806009 and parameters: {'alpha': 2.3170631165131637, 'ties': 'breslow'}. Best is trial 99 with value: 0.8654869897806009.[0m
[32m[I 2022-04-13 11:45:35,805][0m Trial 605 finished with value: 0.8654869897806009 and parameters: {'alpha': 2.2815471830274716, 'ties': 'efron'}. Best is trial 99 with value: 0.8654869897806009.[0m
[32m[I 2022-04-13 11:45:36,352][0m Trial 606 finished with value: 0.8643129825609158 and parameters: {'alpha': 2.2378830166678756, 'ties': 'efron'}. Best is trial 99 with value: 0.8654869897806009.[0m
[32m[I 2022-04-13 11:45:36,766][0m Trial 607 finished with value: 0.8641835106491502 and parameters: {'alpha': 2.1673110994920193, 'ties': 'breslow'}. Best is trial 99 with value: 0.8654869897806009.[0m
[32m[I 2022-04-13 11:45:37,179][0m Trial 608 finished with value: 0.8648486321634327 and parameters: {'alpha': 2.415715456889518, 'ties': 'breslow'}. Best is trial 99 with value: 0.8654869897806009.[0m
[32m[I 2022-04-13 11:45:37,584][0m Trial 609 finished with value: 0.8654869897806009 and parameters: {'alpha': 2.307571397982811, 'ties': 'efron'}. Best is trial 99 with value: 0.8654869897806009.[0m
[32m[I 2022-04-13 11:45:38,222][0m Trial 610 finished with value: 0.8654085943201592 and parameters: {'alpha': 2.0009364635577382, 'ties': 'efron'}. Best is trial 99 with value: 0.8654869897806009.[0m
[32m[I 2022-04-13 11:45:38,584][0m Trial 611 finished with value: 0.8643129825609158 and parameters: {'alpha': 2.249222129268079, 'ties': 'breslow'}. Best is trial 99 with value: 0.8654869897806009.[0m
[32m[I 2022-04-13 11:45:38,933][0m Trial 612 finished with value: 0.8639833328806962 and parameters: {'alpha': 2.579096469733737, 'ties': 'breslow'}. Best is trial 99 with value: 0.8654869897806009.[0m
[32m[I 2022-04-13 11:45:39,285][0m Trial 613 finished with value: 0.8648486321634327 and parameters: {'alpha': 2.385301049380262, 'ties': 'breslow'}. Best is trial 99 with value: 0.8654869897806009.[0m
[32m[I 2022-04-13 11:45:39,528][0m Trial 614 finished with value: 0.8648486321634327 and parameters: {'alpha': 2.466987257202863, 'ties': 'breslow'}. Best is trial 99 with value: 0.8654869897806009.[0m
[32m[I 2022-04-13 11:45:39,964][0m Trial 615 finished with value: 0.8654085943201592 and parameters: {'alpha': 2.084132153901156, 'ties': 'efron'}. Best is trial 99 with value: 0.8654869897806009.[0m
[32m[I 2022-04-13 11:45:40,258][0m Trial 616 finished with value: 0.8628877211214527 and parameters: {'alpha': 2.7328775329141988, 'ties': 'breslow'}. Best is trial 99 with value: 0.8654869897806009.[0m
[32m[I 2022-04-13 11:45:40,599][0m Trial 617 finished with value: 0.8648218682663185 and parameters: {'alpha': 2.17158189305259, 'ties': 'efron'}. Best is trial 99 with value: 0.8654869897806009.[0m
[32m[I 2022-04-13 11:45:40,928][0m Trial 618 finished with value: 0.8619731191345444 and parameters: {'alpha': 1.0460350531705274, 'ties': 'breslow'}. Best is trial 99 with value: 0.8654869897806009.[0m
[32m[I 2022-04-13 11:45:41,110][0m Trial 619 finished with value: 0.8643129825609158 and parameters: {'alpha': 2.273655168416351, 'ties': 'efron'}. Best is trial 99 with value: 0.8654869897806009.[0m
[32m[I 2022-04-13 11:45:41,490][0m Trial 620 finished with value: 0.8648486321634327 and parameters: {'alpha': 2.4346132849532824, 'ties': 'breslow'}. Best is trial 99 with value: 0.8654869897806009.[0m
[32m[I 2022-04-13 11:45:41,710][0m Trial 621 finished with value: 0.8648218682663185 and parameters: {'alpha': 2.1721238380614833, 'ties': 'efron'}. Best is trial 99 with value: 0.8654869897806009.[0m
[32m[I 2022-04-13 11:45:41,964][0m Trial 622 finished with value: 0.8639833328806962 and parameters: {'alpha': 2.6209310828141468, 'ties': 'breslow'}. Best is trial 99 with value: 0.8654869897806009.[0m
[32m[I 2022-04-13 11:45:42,150][0m Trial 623 finished with value: 0.8648486321634327 and parameters: {'alpha': 2.4030835758656752, 'ties': 'breslow'}. Best is trial 99 with value: 0.8654869897806009.[0m
[32m[I 2022-04-13 11:45:42,330][0m Trial 624 finished with value: 0.8654869897806009 and parameters: {'alpha': 2.314424091278306, 'ties': 'breslow'}. Best is trial 99 with value: 0.8654869897806009.[0m
[32m[I 2022-04-13 11:45:42,587][0m Trial 625 finished with value: 0.8643129825609158 and parameters: {'alpha': 2.2117704361697, 'ties': 'efron'}. Best is trial 99 with value: 0.8654869897806009.[0m
[32m[I 2022-04-13 11:45:42,790][0m Trial 626 finished with value: 0.8648486321634327 and parameters: {'alpha': 2.370448153150624, 'ties': 'breslow'}. Best is trial 99 with value: 0.8654869897806009.[0m
[32m[I 2022-04-13 11:45:43,026][0m Trial 627 finished with value: 0.8641835106491502 and parameters: {'alpha': 2.114354498199833, 'ties': 'efron'}. Best is trial 99 with value: 0.8654869897806009.[0m
[32m[I 2022-04-13 11:45:43,249][0m Trial 628 finished with value: 0.8647928920287047 and parameters: {'alpha': 1.9685114423391608, 'ties': 'efron'}. Best is trial 99 with value: 0.8654869897806009.[0m
[32m[I 2022-04-13 11:45:43,479][0m Trial 629 finished with value: 0.8643129825609158 and parameters: {'alpha': 2.236260028165238, 'ties': 'efron'}. Best is trial 99 with value: 0.8654869897806009.[0m
[32m[I 2022-04-13 11:45:43,865][0m Trial 630 finished with value: 0.8648486321634327 and parameters: {'alpha': 2.4969711115936453, 'ties': 'breslow'}. Best is trial 99 with value: 0.8654869897806009.[0m
[32m[I 2022-04-13 11:45:44,298][0m Trial 631 finished with value: 0.8654869897806009 and parameters: {'alpha': 2.300188579554441, 'ties': 'efron'}. Best is trial 99 with value: 0.8654869897806009.[0m
[32m[I 2022-04-13 11:45:44,717][0m Trial 632 finished with value: 0.8647702367029909 and parameters: {'alpha': 2.098229535327859, 'ties': 'efron'}. Best is trial 99 with value: 0.8654869897806009.[0m
[32m[I 2022-04-13 11:45:45,199][0m Trial 633 finished with value: 0.8654869897806009 and parameters: {'alpha': 2.3438736136112204, 'ties': 'breslow'}. Best is trial 99 with value: 0.8654869897806009.[0m
[32m[I 2022-04-13 11:45:45,771][0m Trial 634 finished with value: 0.8648486321634327 and parameters: {'alpha': 2.5179196886275466, 'ties': 'breslow'}. Best is trial 99 with value: 0.8654869897806009.[0m
[32m[I 2022-04-13 11:45:46,352][0m Trial 635 finished with value: 0.8648486321634327 and parameters: {'alpha': 2.347674095376766, 'ties': 'efron'}. Best is trial 99 with value: 0.8654869897806009.[0m
[32m[I 2022-04-13 11:45:46,775][0m Trial 636 finished with value: 0.8643129825609158 and parameters: {'alpha': 2.2055878382273386, 'ties': 'efron'}. Best is trial 99 with value: 0.8654869897806009.[0m
[32m[I 2022-04-13 11:45:46,986][0m Trial 637 finished with value: 0.8648486321634327 and parameters: {'alpha': 2.453222746208323, 'ties': 'breslow'}. Best is trial 99 with value: 0.8654869897806009.[0m
[32m[I 2022-04-13 11:45:47,147][0m Trial 638 finished with value: 0.8654869897806009 and parameters: {'alpha': 2.3324146159331063, 'ties': 'breslow'}. Best is trial 99 with value: 0.8654869897806009.[0m
[32m[I 2022-04-13 11:45:47,453][0m Trial 639 finished with value: 0.8648486321634327 and parameters: {'alpha': 2.5088787635822998, 'ties': 'breslow'}. Best is trial 99 with value: 0.8654869897806009.[0m
[32m[I 2022-04-13 11:45:47,631][0m Trial 640 finished with value: 0.8654869897806009 and parameters: {'alpha': 2.3120805828836826, 'ties': 'efron'}. Best is trial 99 with value: 0.8654869897806009.[0m
[32m[I 2022-04-13 11:45:47,875][0m Trial 641 finished with value: 0.8643129825609158 and parameters: {'alpha': 2.244192874597992, 'ties': 'efron'}. Best is trial 99 with value: 0.8654869897806009.[0m
