[32m[I 2022-04-15 14:27:01,299][0m Trial 50 finished with value: 0.7490296145512487 and parameters: {'n_hidden': 32, 'mixture_components': 9, 'use_sparse_layer': False, 'use_batchnorm': True, 'use_dropout': False, 'mlp_size_1': 0, 'mlp_size_2': 2, 'mlp_size_3': 0, 'kernel': 'LogNormal', 'loss_name': 'AlternativeNLLLoss'}. Best is trial 42 with value: 0.860422919988593.[0m
[32m[I 2022-04-15 14:32:21,190][0m Trial 51 finished with value: 0.8526408695485174 and parameters: {'n_hidden': 32, 'mixture_components': 5, 'use_sparse_layer': True, 'use_sparse_loss': True, 'lmbd': 0.0003010915073304139, 'use_batchnorm': True, 'use_dropout': False, 'mlp_size_1': 0, 'mlp_size_2': 2, 'mlp_size_3': 0, 'kernel': 'Exponential', 'loss_name': 'CensoredNLLLoss'}. Best is trial 42 with value: 0.860422919988593.[0m
[32m[I 2022-04-15 14:38:03,159][0m Trial 52 finished with value: 0.8524968973405217 and parameters: {'n_hidden': 32, 'mixture_components': 6, 'use_sparse_layer': True, 'use_sparse_loss': True, 'lmbd': 6.3268852386175314e-06, 'use_batchnorm': True, 'use_dropout': False, 'mlp_size_1': 0, 'mlp_size_2': 2, 'mlp_size_3': 0, 'kernel': 'Exponential', 'loss_name': 'CensoredNLLLoss'}. Best is trial 42 with value: 0.860422919988593.[0m
[32m[I 2022-04-15 14:42:36,467][0m Trial 53 finished with value: 0.8532608826681318 and parameters: {'n_hidden': 32, 'mixture_components': 4, 'use_sparse_layer': True, 'use_sparse_loss': True, 'lmbd': 3.166269252748761e-05, 'use_batchnorm': True, 'use_dropout': False, 'mlp_size_1': 0, 'mlp_size_2': 2, 'mlp_size_3': 0, 'kernel': 'Exponential', 'loss_name': 'CensoredNLLLoss'}. Best is trial 42 with value: 0.860422919988593.[0m
[32m[I 2022-04-15 14:48:40,785][0m Trial 54 finished with value: 0.8569784059227707 and parameters: {'n_hidden': 32, 'mixture_components': 5, 'use_sparse_layer': True, 'use_sparse_loss': True, 'lmbd': 0.0005933474839985963, 'use_batchnorm': True, 'use_dropout': False, 'mlp_size_1': 0, 'mlp_size_2': 2, 'mlp_size_3': 0, 'kernel': 'Exponential', 'loss_name': 'CensoredNLLLoss'}. Best is trial 42 with value: 0.860422919988593.[0m
[32m[I 2022-04-15 14:53:38,367][0m Trial 55 finished with value: 0.8535794864990613 and parameters: {'n_hidden': 32, 'mixture_components': 5, 'use_sparse_layer': True, 'use_sparse_loss': True, 'lmbd': 0.0006980111090170977, 'use_batchnorm': True, 'use_dropout': False, 'mlp_size_1': 0, 'mlp_size_2': 2, 'mlp_size_3': 0, 'kernel': 'Exponential', 'loss_name': 'CensoredNLLLoss'}. Best is trial 42 with value: 0.860422919988593.[0m
[32m[I 2022-04-15 14:57:31,302][0m Trial 56 finished with value: 0.8470338606767147 and parameters: {'n_hidden': 32, 'mixture_components': 6, 'use_sparse_layer': True, 'use_sparse_loss': True, 'lmbd': 0.00015329957508904921, 'use_batchnorm': True, 'use_dropout': False, 'mlp_size_1': 0, 'mlp_size_2': 2, 'mlp_size_3': 0, 'kernel': 'Logistic', 'loss_name': 'CensoredNLLLoss'}. Best is trial 42 with value: 0.860422919988593.[0m
[32m[I 2022-04-15 14:58:56,279][0m Trial 57 finished with value: 0.33055672744359876 and parameters: {'n_hidden': 256, 'mixture_components': 5, 'use_sparse_layer': True, 'use_sparse_loss': True, 'lmbd': 0.00046660935937948927, 'use_batchnorm': True, 'use_dropout': False, 'mlp_size_1': 1, 'mlp_size_2': 3, 'mlp_size_3': 0, 'kernel': 'Gumbel', 'loss_name': 'CensoredNLLLoss'}. Best is trial 42 with value: 0.860422919988593.[0m
[32m[I 2022-04-15 15:04:08,220][0m Trial 58 finished with value: 0.8028855326610937 and parameters: {'n_hidden': 32, 'mixture_components': 4, 'use_sparse_layer': True, 'use_sparse_loss': True, 'lmbd': 0.00145849570295083, 'use_batchnorm': False, 'use_dropout': False, 'mlp_size_1': 0, 'mlp_size_2': 2, 'mlp_size_3': 0, 'kernel': 'Exponential', 'loss_name': 'CensoredNLLLoss'}. Best is trial 42 with value: 0.860422919988593.[0m
[32m[I 2022-04-15 15:09:03,042][0m Trial 59 finished with value: 0.719932198407595 and parameters: {'n_hidden': 2048, 'mixture_components': 3, 'use_sparse_layer': True, 'use_sparse_loss': True, 'lmbd': 6.159709380214217e-05, 'use_batchnorm': True, 'use_dropout': False, 'mlp_size_1': 2, 'mlp_size_2': 1, 'mlp_size_3': 4, 'kernel': 'LogLogistic', 'loss_name': 'CensoredNLLLoss'}. Best is trial 42 with value: 0.860422919988593.[0m
[32m[I 2022-04-15 15:10:09,640][0m Trial 60 finished with value: -0.5 and parameters: {'n_hidden': 32, 'mixture_components': 7, 'use_sparse_layer': True, 'use_sparse_loss': True, 'lmbd': 0.0937285602397347, 'use_batchnorm': True, 'use_dropout': True, 'dropout': 0.9978614419789376, 'mlp_size_1': 0, 'mlp_size_2': 2, 'mlp_size_3': 0, 'kernel': 'Exponential', 'loss_name': 'CensoredNLLLoss'}. Best is trial 42 with value: 0.860422919988593.[0m
[32m[I 2022-04-15 15:16:20,100][0m Trial 61 finished with value: 0.8573466766416832 and parameters: {'n_hidden': 32, 'mixture_components': 5, 'use_sparse_layer': True, 'use_sparse_loss': True, 'lmbd': 0.005549521425161807, 'use_batchnorm': True, 'use_dropout': False, 'mlp_size_1': 0, 'mlp_size_2': 2, 'mlp_size_3': 0, 'kernel': 'Exponential', 'loss_name': 'CensoredNLLLoss'}. Best is trial 42 with value: 0.860422919988593.[0m
[32m[I 2022-04-15 15:21:58,888][0m Trial 62 finished with value: 0.8574724768560266 and parameters: {'n_hidden': 32, 'mixture_components': 5, 'use_sparse_layer': True, 'use_sparse_loss': True, 'lmbd': 0.004684360645245936, 'use_batchnorm': True, 'use_dropout': False, 'mlp_size_1': 0, 'mlp_size_2': 2, 'mlp_size_3': 0, 'kernel': 'Exponential', 'loss_name': 'CensoredNLLLoss'}. Best is trial 42 with value: 0.860422919988593.[0m
[32m[I 2022-04-15 15:27:24,432][0m Trial 63 finished with value: 0.8621305883972067 and parameters: {'n_hidden': 32, 'mixture_components': 5, 'use_sparse_layer': True, 'use_sparse_loss': True, 'lmbd': 0.004744920593161766, 'use_batchnorm': True, 'use_dropout': False, 'mlp_size_1': 0, 'mlp_size_2': 2, 'mlp_size_3': 0, 'kernel': 'Exponential', 'loss_name': 'CensoredNLLLoss'}. Best is trial 63 with value: 0.8621305883972067.[0m
[32m[I 2022-04-15 15:34:12,927][0m Trial 64 finished with value: 0.8498118928146041 and parameters: {'n_hidden': 32, 'mixture_components': 5, 'use_sparse_layer': True, 'use_sparse_loss': True, 'lmbd': 0.004728278862080966, 'use_batchnorm': True, 'use_dropout': False, 'mlp_size_1': 0, 'mlp_size_2': 2, 'mlp_size_3': 0, 'kernel': 'Exponential', 'loss_name': 'CensoredNLLLoss'}. Best is trial 63 with value: 0.8621305883972067.[0m
[32m[I 2022-04-15 15:37:45,480][0m Trial 65 finished with value: 0.8090226058225862 and parameters: {'n_hidden': 1024, 'mixture_components': 5, 'use_sparse_layer': True, 'use_sparse_loss': True, 'lmbd': 0.006270615216209962, 'use_batchnorm': True, 'use_dropout': False, 'mlp_size_1': 1, 'mlp_size_2': 3, 'mlp_size_3': 2, 'kernel': 'Exponential', 'loss_name': 'CensoredNLLLoss'}. Best is trial 63 with value: 0.8621305883972067.[0m
[32m[I 2022-04-15 15:42:30,191][0m Trial 66 finished with value: 0.8475888801088788 and parameters: {'n_hidden': 64, 'mixture_components': 5, 'use_sparse_layer': True, 'use_sparse_loss': True, 'lmbd': 0.020347088623892073, 'use_batchnorm': True, 'use_dropout': False, 'mlp_size_1': 0, 'mlp_size_2': 1, 'mlp_size_3': 1, 'kernel': 'Exponential', 'loss_name': 'NLLLoss'}. Best is trial 63 with value: 0.8621305883972067.[0m
[32m[I 2022-04-15 15:46:08,157][0m Trial 67 finished with value: 0.8212265767357495 and parameters: {'n_hidden': 512, 'mixture_components': 6, 'use_sparse_layer': True, 'use_sparse_loss': True, 'lmbd': 0.002352122023195675, 'use_batchnorm': True, 'use_dropout': False, 'mlp_size_1': 1, 'mlp_size_2': 1, 'mlp_size_3': 1, 'kernel': 'Normal', 'loss_name': 'CensoredNLLLoss'}. Best is trial 63 with value: 0.8621305883972067.[0m
[32m[I 2022-04-15 15:51:11,724][0m Trial 68 finished with value: 0.8527534466596591 and parameters: {'n_hidden': 32, 'mixture_components': 4, 'use_sparse_layer': False, 'use_batchnorm': True, 'use_dropout': False, 'mlp_size_1': 0, 'mlp_size_2': 2, 'mlp_size_3': 0, 'kernel': 'Exponential', 'loss_name': 'CensoredNLLLoss'}. Best is trial 63 with value: 0.8621305883972067.[0m
[32m[I 2022-04-15 15:55:54,724][0m Trial 69 finished with value: 0.8493789711692002 and parameters: {'n_hidden': 32, 'mixture_components': 6, 'use_sparse_layer': True, 'use_sparse_loss': True, 'lmbd': 0.001372096345172305, 'use_batchnorm': True, 'use_dropout': False, 'mlp_size_1': 0, 'mlp_size_2': 2, 'mlp_size_3': 0, 'kernel': 'Gamma', 'loss_name': 'AlternativeNLLLoss'}. Best is trial 63 with value: 0.8621305883972067.[0m
[32m[I 2022-04-15 15:59:15,190][0m Trial 70 finished with value: 0.8171473371643214 and parameters: {'n_hidden': 128, 'mixture_components': 5, 'use_sparse_layer': True, 'use_sparse_loss': True, 'lmbd': 0.0032093988731446885, 'use_batchnorm': False, 'use_dropout': False, 'mlp_size_1': 1, 'mlp_size_2': 2, 'mlp_size_3': 0, 'kernel': 'LogNormal', 'loss_name': 'CensoredNLLLoss'}. Best is trial 63 with value: 0.8621305883972067.[0m
[32m[I 2022-04-15 16:04:25,936][0m Trial 71 finished with value: 0.8492364241817123 and parameters: {'n_hidden': 32, 'mixture_components': 4, 'use_sparse_layer': True, 'use_sparse_loss': True, 'lmbd': 0.00041049907910405717, 'use_batchnorm': True, 'use_dropout': False, 'mlp_size_1': 0, 'mlp_size_2': 2, 'mlp_size_3': 0, 'kernel': 'Exponential', 'loss_name': 'CensoredNLLLoss'}. Best is trial 63 with value: 0.8621305883972067.[0m
[32m[I 2022-04-15 16:11:03,033][0m Trial 72 finished with value: 0.8574053664220097 and parameters: {'n_hidden': 32, 'mixture_components': 4, 'use_sparse_layer': True, 'use_sparse_loss': True, 'lmbd': 0.00022119320833289337, 'use_batchnorm': True, 'use_dropout': False, 'mlp_size_1': 0, 'mlp_size_2': 2, 'mlp_size_3': 0, 'kernel': 'Exponential', 'loss_name': 'CensoredNLLLoss'}. Best is trial 63 with value: 0.8621305883972067.[0m
[32m[I 2022-04-15 16:16:31,560][0m Trial 73 finished with value: 0.8575087209561939 and parameters: {'n_hidden': 32, 'mixture_components': 1, 'use_sparse_layer': True, 'use_sparse_loss': True, 'lmbd': 0.00026563002314378934, 'use_batchnorm': True, 'use_dropout': False, 'mlp_size_1': 0, 'mlp_size_2': 2, 'mlp_size_3': 0, 'kernel': 'Exponential', 'loss_name': 'CensoredNLLLoss'}. Best is trial 63 with value: 0.8621305883972067.[0m
[32m[I 2022-04-15 16:23:00,923][0m Trial 74 finished with value: 0.8542714735283121 and parameters: {'n_hidden': 32, 'mixture_components': 1, 'use_sparse_layer': True, 'use_sparse_loss': True, 'lmbd': 0.00015533698456688, 'use_batchnorm': True, 'use_dropout': False, 'mlp_size_1': 0, 'mlp_size_2': 2, 'mlp_size_3': 0, 'kernel': 'Exponential', 'loss_name': 'CensoredNLLLoss'}. Best is trial 63 with value: 0.8621305883972067.[0m
[32m[I 2022-04-15 16:26:00,477][0m Trial 75 finished with value: 0.8355280929317827 and parameters: {'n_hidden': 32, 'mixture_components': 3, 'use_sparse_layer': True, 'use_sparse_loss': False, 'use_batchnorm': True, 'use_dropout': False, 'mlp_size_1': 0, 'mlp_size_2': 2, 'mlp_size_3': 0, 'kernel': 'Logistic', 'loss_name': 'CensoredNLLLoss'}. Best is trial 63 with value: 0.8621305883972067.[0m
[32m[I 2022-04-15 16:33:08,608][0m Trial 76 finished with value: 0.8584083316626717 and parameters: {'n_hidden': 32, 'mixture_components': 1, 'use_sparse_layer': True, 'use_sparse_loss': True, 'lmbd': 5.737114529840545e-05, 'use_batchnorm': True, 'use_dropout': True, 'dropout': 0.6748749147704984, 'mlp_size_1': 0, 'mlp_size_2': 2, 'mlp_size_3': 0, 'kernel': 'Exponential', 'loss_name': 'CensoredNLLLoss'}. Best is trial 63 with value: 0.8621305883972067.[0m
[32m[I 2022-04-15 16:34:16,538][0m Trial 77 finished with value: -0.5 and parameters: {'n_hidden': 256, 'mixture_components': 1, 'use_sparse_layer': True, 'use_sparse_loss': True, 'lmbd': 4.665526385876186e-05, 'use_batchnorm': True, 'use_dropout': True, 'dropout': 0.7463807580904316, 'mlp_size_1': 1, 'mlp_size_2': 3, 'mlp_size_3': 0, 'kernel': 'Gumbel', 'loss_name': 'CensoredNLLLoss'}. Best is trial 63 with value: 0.8621305883972067.[0m
[32m[I 2022-04-15 16:40:32,987][0m Trial 78 finished with value: 0.8622238927151848 and parameters: {'n_hidden': 32, 'mixture_components': 1, 'use_sparse_layer': True, 'use_sparse_loss': True, 'lmbd': 2.073570631438624e-05, 'use_batchnorm': True, 'use_dropout': True, 'dropout': 0.6095813248120776, 'mlp_size_1': 0, 'mlp_size_2': 2, 'mlp_size_3': 0, 'kernel': 'Exponential', 'loss_name': 'NLLLoss'}. Best is trial 78 with value: 0.8622238927151848.[0m
[32m[I 2022-04-15 16:46:48,475][0m Trial 79 finished with value: 0.8636944536907984 and parameters: {'n_hidden': 32, 'mixture_components': 1, 'use_sparse_layer': False, 'use_batchnorm': True, 'use_dropout': True, 'dropout': 0.6264973588061966, 'mlp_size_1': 0, 'mlp_size_2': 2, 'mlp_size_3': 0, 'kernel': 'Exponential', 'loss_name': 'NLLLoss'}. Best is trial 79 with value: 0.8636944536907984.[0m
[32m[I 2022-04-15 16:53:02,009][0m Trial 80 finished with value: 0.5602934874735105 and parameters: {'n_hidden': 2048, 'mixture_components': 1, 'use_sparse_layer': False, 'use_batchnorm': True, 'use_dropout': True, 'dropout': 0.5825807050276414, 'mlp_size_1': 5, 'mlp_size_2': 2, 'mlp_size_3': 0, 'kernel': 'LogLogistic', 'loss_name': 'NLLLoss'}. Best is trial 79 with value: 0.8636944536907984.[0m
[32m[I 2022-04-15 16:59:10,684][0m Trial 81 finished with value: 0.8668117652490833 and parameters: {'n_hidden': 32, 'mixture_components': 2, 'use_sparse_layer': False, 'use_batchnorm': True, 'use_dropout': True, 'dropout': 0.6620670091031962, 'mlp_size_1': 0, 'mlp_size_2': 2, 'mlp_size_3': 0, 'kernel': 'Exponential', 'loss_name': 'NLLLoss'}. Best is trial 81 with value: 0.8668117652490833.[0m
[32m[I 2022-04-15 17:05:12,528][0m Trial 82 finished with value: 0.8656332660942354 and parameters: {'n_hidden': 32, 'mixture_components': 2, 'use_sparse_layer': False, 'use_batchnorm': True, 'use_dropout': True, 'dropout': 0.6748503785010795, 'mlp_size_1': 0, 'mlp_size_2': 2, 'mlp_size_3': 0, 'kernel': 'Exponential', 'loss_name': 'NLLLoss'}. Best is trial 81 with value: 0.8668117652490833.[0m
[32m[I 2022-04-15 17:11:11,965][0m Trial 83 finished with value: 0.8673780679145244 and parameters: {'n_hidden': 32, 'mixture_components': 2, 'use_sparse_layer': False, 'use_batchnorm': True, 'use_dropout': True, 'dropout': 0.6228050517548605, 'mlp_size_1': 0, 'mlp_size_2': 2, 'mlp_size_3': 0, 'kernel': 'Exponential', 'loss_name': 'NLLLoss'}. Best is trial 83 with value: 0.8673780679145244.[0m
[32m[I 2022-04-15 17:17:34,839][0m Trial 84 finished with value: 0.8569773271267899 and parameters: {'n_hidden': 32, 'mixture_components': 2, 'use_sparse_layer': False, 'use_batchnorm': True, 'use_dropout': True, 'dropout': 0.63710645086245, 'mlp_size_1': 0, 'mlp_size_2': 2, 'mlp_size_3': 0, 'kernel': 'Exponential', 'loss_name': 'NLLLoss'}. Best is trial 83 with value: 0.8673780679145244.[0m
[32m[I 2022-04-15 17:21:30,029][0m Trial 85 finished with value: 0.8270918950690765 and parameters: {'n_hidden': 512, 'mixture_components': 2, 'use_sparse_layer': False, 'use_batchnorm': True, 'use_dropout': True, 'dropout': 0.4625543809728722, 'mlp_size_1': 4, 'mlp_size_2': 2, 'mlp_size_3': 0, 'kernel': 'Exponential', 'loss_name': 'NLLLoss'}. Best is trial 83 with value: 0.8673780679145244.[0m
[32m[I 2022-04-15 17:27:44,051][0m Trial 86 finished with value: 0.8684701330397244 and parameters: {'n_hidden': 32, 'mixture_components': 2, 'use_sparse_layer': False, 'use_batchnorm': True, 'use_dropout': True, 'dropout': 0.4816139866697033, 'mlp_size_1': 0, 'mlp_size_2': 2, 'mlp_size_3': 0, 'kernel': 'Exponential', 'loss_name': 'NLLLoss'}. Best is trial 86 with value: 0.8684701330397244.[0m
[32m[I 2022-04-15 17:31:11,232][0m Trial 87 finished with value: 0.8524794109401105 and parameters: {'n_hidden': 1024, 'mixture_components': 2, 'use_sparse_layer': False, 'use_batchnorm': True, 'use_dropout': True, 'dropout': 0.49933338571207697, 'mlp_size_1': 1, 'mlp_size_2': 4, 'mlp_size_3': 2, 'kernel': 'Exponential', 'loss_name': 'NLLLoss'}. Best is trial 86 with value: 0.8684701330397244.[0m
[32m[I 2022-04-15 17:34:05,955][0m Trial 88 finished with value: 0.773233846711868 and parameters: {'n_hidden': 32, 'mixture_components': 2, 'use_sparse_layer': False, 'use_batchnorm': False, 'use_dropout': True, 'dropout': 0.6696774296502707, 'mlp_size_1': 0, 'mlp_size_2': 2, 'mlp_size_3': 0, 'kernel': 'Exponential', 'loss_name': 'NLLLoss'}. Best is trial 86 with value: 0.8684701330397244.[0m
[32m[I 2022-04-15 17:38:03,161][0m Trial 89 finished with value: 0.8543153199901583 and parameters: {'n_hidden': 64, 'mixture_components': 2, 'use_sparse_layer': False, 'use_batchnorm': True, 'use_dropout': True, 'dropout': 0.4395960599422739, 'mlp_size_1': 0, 'mlp_size_2': 2, 'mlp_size_3': 0, 'kernel': 'Normal', 'loss_name': 'NLLLoss'}. Best is trial 86 with value: 0.8684701330397244.[0m
[32m[I 2022-04-15 17:43:14,320][0m Trial 90 finished with value: 0.8616933517696299 and parameters: {'n_hidden': 128, 'mixture_components': 1, 'use_sparse_layer': False, 'use_batchnorm': True, 'use_dropout': True, 'dropout': 0.5751304357305663, 'mlp_size_1': 0, 'mlp_size_2': 1, 'mlp_size_3': 1, 'kernel': 'Exponential', 'loss_name': 'NLLLoss'}. Best is trial 86 with value: 0.8684701330397244.[0m
[32m[I 2022-04-15 17:47:42,417][0m Trial 91 finished with value: 0.863444232316227 and parameters: {'n_hidden': 128, 'mixture_components': 1, 'use_sparse_layer': False, 'use_batchnorm': True, 'use_dropout': True, 'dropout': 0.5659641035610747, 'mlp_size_1': 0, 'mlp_size_2': 0, 'mlp_size_3': 1, 'kernel': 'Exponential', 'loss_name': 'NLLLoss'}. Best is trial 86 with value: 0.8684701330397244.[0m
[32m[I 2022-04-15 17:51:13,693][0m Trial 92 finished with value: 0.8588719679230655 and parameters: {'n_hidden': 128, 'mixture_components': 1, 'use_sparse_layer': False, 'use_batchnorm': True, 'use_dropout': True, 'dropout': 0.5601168684792528, 'mlp_size_1': 0, 'mlp_size_2': 0, 'mlp_size_3': 1, 'kernel': 'Exponential', 'loss_name': 'NLLLoss'}. Best is trial 86 with value: 0.8684701330397244.[0m
[32m[I 2022-04-15 17:55:42,420][0m Trial 93 finished with value: 0.857010191336052 and parameters: {'n_hidden': 128, 'mixture_components': 1, 'use_sparse_layer': False, 'use_batchnorm': True, 'use_dropout': True, 'dropout': 0.6134601917082759, 'mlp_size_1': 0, 'mlp_size_2': 0, 'mlp_size_3': 1, 'kernel': 'Exponential', 'loss_name': 'NLLLoss'}. Best is trial 86 with value: 0.8684701330397244.[0m
[32m[I 2022-04-15 18:02:34,584][0m Trial 94 finished with value: 0.8657963774566537 and parameters: {'n_hidden': 128, 'mixture_components': 1, 'use_sparse_layer': False, 'use_batchnorm': True, 'use_dropout': True, 'dropout': 0.7190753915660304, 'mlp_size_1': 0, 'mlp_size_2': 1, 'mlp_size_3': 2, 'kernel': 'Exponential', 'loss_name': 'NLLLoss'}. Best is trial 86 with value: 0.8684701330397244.[0m
[32m[I 2022-04-15 18:09:21,639][0m Trial 95 finished with value: 0.8521716636132783 and parameters: {'n_hidden': 128, 'mixture_components': 1, 'use_sparse_layer': False, 'use_batchnorm': True, 'use_dropout': True, 'dropout': 0.7014957962161733, 'mlp_size_1': 0, 'mlp_size_2': 1, 'mlp_size_3': 2, 'kernel': 'Exponential', 'loss_name': 'NLLLoss'}. Best is trial 86 with value: 0.8684701330397244.[0m
[32m[I 2022-04-15 18:15:22,170][0m Trial 96 finished with value: 0.5095503734985674 and parameters: {'n_hidden': 128, 'mixture_components': 1, 'use_sparse_layer': False, 'use_batchnorm': True, 'use_dropout': True, 'dropout': 0.6214176006710769, 'mlp_size_1': 0, 'mlp_size_2': 0, 'mlp_size_3': 3, 'kernel': 'Weibull', 'loss_name': 'NLLLoss'}. Best is trial 86 with value: 0.8684701330397244.[0m
[32m[I 2022-04-15 18:18:41,957][0m Trial 97 finished with value: 0.6964098493295297 and parameters: {'n_hidden': 128, 'mixture_components': 2, 'use_sparse_layer': False, 'use_batchnorm': True, 'use_dropout': True, 'dropout': 0.7950214338444113, 'mlp_size_1': 0, 'mlp_size_2': 0, 'mlp_size_3': 3, 'kernel': 'Gamma', 'loss_name': 'NLLLoss'}. Best is trial 86 with value: 0.8684701330397244.[0m
[32m[I 2022-04-15 18:23:49,560][0m Trial 98 finished with value: 0.8658129619484699 and parameters: {'n_hidden': 128, 'mixture_components': 1, 'use_sparse_layer': False, 'use_batchnorm': True, 'use_dropout': True, 'dropout': 0.5664750984376606, 'mlp_size_1': 0, 'mlp_size_2': 1, 'mlp_size_3': 1, 'kernel': 'Exponential', 'loss_name': 'NLLLoss'}. Best is trial 86 with value: 0.8684701330397244.[0m
[32m[I 2022-04-15 18:29:46,797][0m Trial 99 finished with value: 0.8218000660676449 and parameters: {'n_hidden': 128, 'mixture_components': 2, 'use_sparse_layer': False, 'use_batchnorm': True, 'use_dropout': True, 'dropout': 0.6700104058935725, 'mlp_size_1': 0, 'mlp_size_2': 1, 'mlp_size_3': 2, 'kernel': 'LogNormal', 'loss_name': 'NLLLoss'}. Best is trial 86 with value: 0.8684701330397244.[0m
[32m[I 2022-04-15 18:34:54,184][0m Trial 100 finished with value: 0.7076115332753933 and parameters: {'n_hidden': 128, 'mixture_components': 2, 'use_sparse_layer': False, 'use_batchnorm': True, 'use_dropout': True, 'dropout': 0.5217317391257215, 'mlp_size_1': 0, 'mlp_size_2': 1, 'mlp_size_3': 2, 'kernel': 'Logistic', 'loss_name': 'NLLLoss'}. Best is trial 86 with value: 0.8684701330397244.[0m
[32m[I 2022-04-15 18:39:28,298][0m Trial 101 finished with value: 0.8617002588726527 and parameters: {'n_hidden': 128, 'mixture_components': 1, 'use_sparse_layer': False, 'use_batchnorm': True, 'use_dropout': True, 'dropout': 0.5670413585292889, 'mlp_size_1': 0, 'mlp_size_2': 1, 'mlp_size_3': 1, 'kernel': 'Exponential', 'loss_name': 'NLLLoss'}. Best is trial 86 with value: 0.8684701330397244.[0m
