[32m[I 2022-04-13 11:46:12,329][0m Trial 763 finished with value: 0.6815535256784726 and parameters: {'splitter': 'best', 'min_samples_split': 0.3689278672484806, 'min_samples_leaf': 0.034905470006000985, 'min_weight_fraction_leaf': 0.13951843515006118, 'max_features': 0.5766812272316939}. Best is trial 163 with value: 0.7137418010284807.[0m
[32m[I 2022-04-13 11:46:12,484][0m Trial 764 finished with value: 0.695563433079365 and parameters: {'splitter': 'best', 'min_samples_split': 0.30184343100769406, 'min_samples_leaf': 0.0022821823710026078, 'min_weight_fraction_leaf': 0.08548702576285523, 'max_features': 0.5018492244573909}. Best is trial 163 with value: 0.7137418010284807.[0m
[32m[I 2022-04-13 11:46:12,630][0m Trial 765 finished with value: 0.6864424314024875 and parameters: {'splitter': 'best', 'min_samples_split': 0.33901523292524033, 'min_samples_leaf': 0.02784638914879345, 'min_weight_fraction_leaf': 0.07376016557674998, 'max_features': 0.9792866034778449}. Best is trial 163 with value: 0.7137418010284807.[0m
[32m[I 2022-04-13 11:46:12,939][0m Trial 766 finished with value: 0.7137418010284807 and parameters: {'splitter': 'best', 'min_samples_split': 0.3255491095618394, 'min_samples_leaf': 0.022482258517844703, 'min_weight_fraction_leaf': 0.06749023627722849, 'max_features': 0.564602054509205}. Best is trial 163 with value: 0.7137418010284807.[0m
[32m[I 2022-04-13 11:46:13,189][0m Trial 767 finished with value: 0.6955563537988494 and parameters: {'splitter': 'best', 'min_samples_split': 0.34935138787916903, 'min_samples_leaf': 0.04390882770047645, 'min_weight_fraction_leaf': 0.04986208311579371, 'max_features': 0.6520186697687115}. Best is trial 163 with value: 0.7137418010284807.[0m
[32m[I 2022-04-13 11:46:13,402][0m Trial 768 finished with value: 0.7044783206942828 and parameters: {'splitter': 'best', 'min_samples_split': 0.309096295215126, 'min_samples_leaf': 0.020025585069304783, 'min_weight_fraction_leaf': 0.11082678069831207, 'max_features': 0.5581805477925385}. Best is trial 163 with value: 0.7137418010284807.[0m
[32m[I 2022-04-13 11:46:13,546][0m Trial 769 finished with value: 0.7044783206942828 and parameters: {'splitter': 'best', 'min_samples_split': 0.307654291504707, 'min_samples_leaf': 0.015136689384233267, 'min_weight_fraction_leaf': 0.12228686995053192, 'max_features': 0.544772805695721}. Best is trial 163 with value: 0.7137418010284807.[0m
[32m[I 2022-04-13 11:46:13,675][0m Trial 770 finished with value: 0.6614588045394705 and parameters: {'splitter': 'best', 'min_samples_split': 0.26347411090071354, 'min_samples_leaf': 0.01742857523047539, 'min_weight_fraction_leaf': 0.13207783533565035, 'max_features': 0.32038737848768883}. Best is trial 163 with value: 0.7137418010284807.[0m
[32m[I 2022-04-13 11:46:13,825][0m Trial 771 finished with value: 0.6815535256784726 and parameters: {'splitter': 'best', 'min_samples_split': 0.3451466607082958, 'min_samples_leaf': 0.03627880054427057, 'min_weight_fraction_leaf': 0.13998485699874907, 'max_features': 0.5840446439927575}. Best is trial 163 with value: 0.7137418010284807.[0m
[32m[I 2022-04-13 11:46:14,086][0m Trial 772 finished with value: 0.6989673695016856 and parameters: {'splitter': 'best', 'min_samples_split': 0.33395037019501295, 'min_samples_leaf': 0.05179069614009182, 'min_weight_fraction_leaf': 0.11634055279104795, 'max_features': 0.5931778449851014}. Best is trial 163 with value: 0.7137418010284807.[0m
[32m[I 2022-04-13 11:46:14,252][0m Trial 773 finished with value: 0.6822883380153592 and parameters: {'splitter': 'best', 'min_samples_split': 0.3292979692615304, 'min_samples_leaf': 0.11673526445895627, 'min_weight_fraction_leaf': 0.06969977464462225, 'max_features': 0.6280508623942618}. Best is trial 163 with value: 0.7137418010284807.[0m
[32m[I 2022-04-13 11:46:14,406][0m Trial 774 finished with value: 0.6809325111928844 and parameters: {'splitter': 'best', 'min_samples_split': 0.32205594671124127, 'min_samples_leaf': 0.18332203359108556, 'min_weight_fraction_leaf': 0.07139886673282934, 'max_features': 0.5324682538427244}. Best is trial 163 with value: 0.7137418010284807.[0m
[32m[I 2022-04-13 11:46:14,582][0m Trial 775 finished with value: 0.7148354967239336 and parameters: {'splitter': 'random', 'min_samples_split': 0.27961798598517307, 'min_samples_leaf': 0.008463050678079165, 'min_weight_fraction_leaf': 0.09705335944157337, 'max_features': 0.5144791660353787}. Best is trial 775 with value: 0.7148354967239336.[0m
[32m[I 2022-04-13 11:46:14,815][0m Trial 776 finished with value: 0.5379483572225983 and parameters: {'splitter': 'random', 'min_samples_split': 0.2528555138002818, 'min_samples_leaf': 0.01153658859138908, 'min_weight_fraction_leaf': 0.09555861266534212, 'max_features': 0.47182185352725536}. Best is trial 775 with value: 0.7148354967239336.[0m
[32m[I 2022-04-13 11:46:14,958][0m Trial 777 finished with value: 0.6410556153651473 and parameters: {'splitter': 'best', 'min_samples_split': 0.26798025808720094, 'min_samples_leaf': 0.009346591253027578, 'min_weight_fraction_leaf': 0.09467626008694591, 'max_features': 0.452873073370761}. Best is trial 775 with value: 0.7148354967239336.[0m
[32m[I 2022-04-13 11:46:15,120][0m Trial 778 finished with value: 0.5578935584244221 and parameters: {'splitter': 'random', 'min_samples_split': 0.2813472254296874, 'min_samples_leaf': 0.001796203082575778, 'min_weight_fraction_leaf': 0.08675150633656169, 'max_features': 0.4875757012676137}. Best is trial 775 with value: 0.7148354967239336.[0m
[32m[I 2022-04-13 11:46:15,243][0m Trial 779 finished with value: 0.7064170915736968 and parameters: {'splitter': 'random', 'min_samples_split': 0.2898533368398056, 'min_samples_leaf': 0.02610020319047584, 'min_weight_fraction_leaf': 0.09243008643727407, 'max_features': 0.5216448794242866}. Best is trial 775 with value: 0.7148354967239336.[0m
[32m[I 2022-04-13 11:46:15,397][0m Trial 780 finished with value: 0.7081958131125079 and parameters: {'splitter': 'random', 'min_samples_split': 0.29461953061694346, 'min_samples_leaf': 0.0021687977023172123, 'min_weight_fraction_leaf': 0.10565264862239566, 'max_features': 0.518173337435579}. Best is trial 775 with value: 0.7148354967239336.[0m
[32m[I 2022-04-13 11:46:15,499][0m Trial 781 finished with value: 0.7093409976331404 and parameters: {'splitter': 'random', 'min_samples_split': 0.3626732746969667, 'min_samples_leaf': 0.07900385797917456, 'min_weight_fraction_leaf': 0.1291325157986396, 'max_features': 0.5610242939213815}. Best is trial 775 with value: 0.7148354967239336.[0m
[32m[I 2022-04-13 11:46:15,538][0m Trial 782 finished with value: 0.7093409976331404 and parameters: {'splitter': 'random', 'min_samples_split': 0.3364954713520882, 'min_samples_leaf': 0.046366640416555846, 'min_weight_fraction_leaf': 0.11877214901202485, 'max_features': 0.5477843760010789}. Best is trial 775 with value: 0.7148354967239336.[0m
[32m[I 2022-04-13 11:46:15,591][0m Trial 783 finished with value: 0.5121008313364271 and parameters: {'splitter': 'random', 'min_samples_split': 0.34252645263620857, 'min_samples_leaf': 0.025496268115159575, 'min_weight_fraction_leaf': 0.12084518343262073, 'max_features': 0.496930464557793}. Best is trial 775 with value: 0.7148354967239336.[0m
[32m[I 2022-04-13 11:46:15,754][0m Trial 784 finished with value: 0.5456859629454271 and parameters: {'splitter': 'random', 'min_samples_split': 0.34971717451531104, 'min_samples_leaf': 0.03108331551655226, 'min_weight_fraction_leaf': 0.04549413406319448, 'max_features': 0.4917887922277526}. Best is trial 775 with value: 0.7148354967239336.[0m
[32m[I 2022-04-13 11:46:15,898][0m Trial 785 finished with value: 0.437616372588949 and parameters: {'splitter': 'random', 'min_samples_split': 0.2779690313581262, 'min_samples_leaf': 0.33308898914738205, 'min_weight_fraction_leaf': 0.1059896474836813, 'max_features': 0.6186463195801014}. Best is trial 775 with value: 0.7148354967239336.[0m
[32m[I 2022-04-13 11:46:16,052][0m Trial 786 finished with value: 0.7050048229388263 and parameters: {'splitter': 'random', 'min_samples_split': 0.31378291597206054, 'min_samples_leaf': 0.05952786691048437, 'min_weight_fraction_leaf': 0.12318340220890422, 'max_features': 0.6041054198364231}. Best is trial 775 with value: 0.7148354967239336.[0m
[32m[I 2022-04-13 11:46:16,286][0m Trial 787 finished with value: 0.7093409976331404 and parameters: {'splitter': 'random', 'min_samples_split': 0.33019216053293254, 'min_samples_leaf': 0.0518363741966916, 'min_weight_fraction_leaf': 0.1148074328661169, 'max_features': 0.5778790014939229}. Best is trial 775 with value: 0.7148354967239336.[0m
[32m[I 2022-04-13 11:46:16,509][0m Trial 788 finished with value: 0.7093409976331404 and parameters: {'splitter': 'random', 'min_samples_split': 0.35562866260563913, 'min_samples_leaf': 0.06316223375984095, 'min_weight_fraction_leaf': 0.12152253780324515, 'max_features': 0.5914583794076993}. Best is trial 775 with value: 0.7148354967239336.[0m
[32m[I 2022-04-13 11:46:16,710][0m Trial 789 finished with value: 0.5667367938977314 and parameters: {'splitter': 'random', 'min_samples_split': 0.33663985644217564, 'min_samples_leaf': 0.013942562564882178, 'min_weight_fraction_leaf': 0.0830384821949917, 'max_features': 0.4551832404805126}. Best is trial 775 with value: 0.7148354967239336.[0m
[32m[I 2022-04-13 11:46:16,960][0m Trial 790 finished with value: 0.6424706559420337 and parameters: {'splitter': 'random', 'min_samples_split': 0.2474199808228708, 'min_samples_leaf': 0.018828671016989325, 'min_weight_fraction_leaf': 0.09831881798487285, 'max_features': 0.8424245159401134}. Best is trial 775 with value: 0.7148354967239336.[0m
[32m[I 2022-04-13 11:46:17,181][0m Trial 791 finished with value: 0.709098309953227 and parameters: {'splitter': 'random', 'min_samples_split': 0.3217554933395988, 'min_samples_leaf': 0.027035948860407978, 'min_weight_fraction_leaf': 0.07252677001046681, 'max_features': 0.5050485481833835}. Best is trial 775 with value: 0.7148354967239336.[0m
[32m[I 2022-04-13 11:46:17,454][0m Trial 792 finished with value: 0.5734021449421329 and parameters: {'splitter': 'random', 'min_samples_split': 0.3028066130304832, 'min_samples_leaf': 0.0017214669850403094, 'min_weight_fraction_leaf': 0.09012734691564687, 'max_features': 0.48188391816689186}. Best is trial 775 with value: 0.7148354967239336.[0m
[32m[I 2022-04-13 11:46:17,769][0m Trial 793 finished with value: 0.6727701215232552 and parameters: {'splitter': 'best', 'min_samples_split': 0.3315364366390679, 'min_samples_leaf': 0.0379628741864298, 'min_weight_fraction_leaf': 0.1525311459404426, 'max_features': 0.5724217570370672}. Best is trial 775 with value: 0.7148354967239336.[0m
[32m[I 2022-04-13 11:46:17,997][0m Trial 794 finished with value: 0.7137418010284807 and parameters: {'splitter': 'best', 'min_samples_split': 0.32494848752019534, 'min_samples_leaf': 0.02691573363901009, 'min_weight_fraction_leaf': 0.06092525735508872, 'max_features': 0.5390307111609781}. Best is trial 775 with value: 0.7148354967239336.[0m
[32m[I 2022-04-13 11:46:18,166][0m Trial 795 finished with value: 0.6920012331415456 and parameters: {'splitter': 'best', 'min_samples_split': 0.2993582770921237, 'min_samples_leaf': 0.0016062196340635001, 'min_weight_fraction_leaf': 0.10281486466050654, 'max_features': 0.5163473700810497}. Best is trial 775 with value: 0.7148354967239336.[0m
[32m[I 2022-04-13 11:46:18,226][0m Trial 796 finished with value: 0.7137418010284807 and parameters: {'splitter': 'best', 'min_samples_split': 0.3211926217762474, 'min_samples_leaf': 0.010809428426444122, 'min_weight_fraction_leaf': 0.09581483134020717, 'max_features': 0.5237664785731106}. Best is trial 775 with value: 0.7148354967239336.[0m
[32m[I 2022-04-13 11:46:18,330][0m Trial 797 finished with value: 0.6313956127109936 and parameters: {'splitter': 'best', 'min_samples_split': 0.33993246612300587, 'min_samples_leaf': 0.031795599255502585, 'min_weight_fraction_leaf': 0.13527131227913555, 'max_features': 0.4692118337893568}. Best is trial 775 with value: 0.7148354967239336.[0m
[32m[I 2022-04-13 11:46:18,432][0m Trial 798 finished with value: 0.6811141527737352 and parameters: {'splitter': 'best', 'min_samples_split': 0.31070299053736944, 'min_samples_leaf': 0.02026567776433564, 'min_weight_fraction_leaf': 0.051851024927338826, 'max_features': 0.5563460174154481}. Best is trial 775 with value: 0.7148354967239336.[0m
[32m[I 2022-04-13 11:46:18,509][0m Trial 799 finished with value: 0.6751900786136191 and parameters: {'splitter': 'best', 'min_samples_split': 0.3154033231023724, 'min_samples_leaf': 0.14722335175121837, 'min_weight_fraction_leaf': 0.08529074925894317, 'max_features': 0.5375094115984097}. Best is trial 775 with value: 0.7148354967239336.[0m
[32m[I 2022-04-13 11:46:18,641][0m Trial 800 finished with value: 0.7030519614506526 and parameters: {'splitter': 'best', 'min_samples_split': 0.3113225654566163, 'min_samples_leaf': 0.017685264676731913, 'min_weight_fraction_leaf': 0.08413262986103937, 'max_features': 0.538591966097026}. Best is trial 775 with value: 0.7148354967239336.[0m
[32m[I 2022-04-13 11:46:18,727][0m Trial 801 finished with value: 0.631953446187902 and parameters: {'splitter': 'best', 'min_samples_split': 0.31921949400220656, 'min_samples_leaf': 0.022700945120476743, 'min_weight_fraction_leaf': 0.0784806505375833, 'max_features': 0.49782582214988613}. Best is trial 775 with value: 0.7148354967239336.[0m
[32m[I 2022-04-13 11:46:18,807][0m Trial 802 finished with value: 0.589064156645618 and parameters: {'splitter': 'best', 'min_samples_split': 0.3039163276274427, 'min_samples_leaf': 0.01015854630286734, 'min_weight_fraction_leaf': 0.41528902889205127, 'max_features': 0.5146454298947271}. Best is trial 775 with value: 0.7148354967239336.[0m
[32m[I 2022-04-13 11:46:18,860][0m Trial 803 finished with value: 0.7030519614506526 and parameters: {'splitter': 'best', 'min_samples_split': 0.3058664807782406, 'min_samples_leaf': 0.0024952183132783017, 'min_weight_fraction_leaf': 0.0961138560527327, 'max_features': 0.5160195759761156}. Best is trial 775 with value: 0.7148354967239336.[0m
[32m[I 2022-04-13 11:46:18,899][0m Trial 804 finished with value: 0.7030923165237667 and parameters: {'splitter': 'random', 'min_samples_split': 0.23242788658706678, 'min_samples_leaf': 0.008843248780627078, 'min_weight_fraction_leaf': 0.10596043434312898, 'max_features': 0.5541295376555481}. Best is trial 775 with value: 0.7148354967239336.[0m
[32m[I 2022-04-13 11:46:18,984][0m Trial 805 finished with value: 0.640273960732414 and parameters: {'splitter': 'best', 'min_samples_split': 0.3327650783922015, 'min_samples_leaf': 0.0323343486945409, 'min_weight_fraction_leaf': 0.06348645700015702, 'max_features': 0.4961889968777112}. Best is trial 775 with value: 0.7148354967239336.[0m
[32m[I 2022-04-13 11:46:19,038][0m Trial 806 finished with value: 0.6920012331415456 and parameters: {'splitter': 'best', 'min_samples_split': 0.29651196212311004, 'min_samples_leaf': 0.009976495450264617, 'min_weight_fraction_leaf': 0.10967429991804543, 'max_features': 0.5501198011775728}. Best is trial 775 with value: 0.7148354967239336.[0m
[32m[I 2022-04-13 11:46:19,082][0m Trial 807 finished with value: 0.7137418010284807 and parameters: {'splitter': 'best', 'min_samples_split': 0.3248234203956935, 'min_samples_leaf': 0.010179316896512112, 'min_weight_fraction_leaf': 0.09217520771537943, 'max_features': 0.5170459545332584}. Best is trial 775 with value: 0.7148354967239336.[0m
[32m[I 2022-04-13 11:46:19,126][0m Trial 808 finished with value: 0.6313956127109936 and parameters: {'splitter': 'best', 'min_samples_split': 0.3423260631014122, 'min_samples_leaf': 0.03370127373029951, 'min_weight_fraction_leaf': 0.14446091663623717, 'max_features': 0.43313656177991744}. Best is trial 775 with value: 0.7148354967239336.[0m
[32m[I 2022-04-13 11:46:19,215][0m Trial 809 finished with value: 0.6825777553156765 and parameters: {'splitter': 'best', 'min_samples_split': 0.3271143432690934, 'min_samples_leaf': 0.02077455462364601, 'min_weight_fraction_leaf': 0.0914101121817275, 'max_features': 0.6319680304216936}. Best is trial 775 with value: 0.7148354967239336.[0m
[32m[I 2022-04-13 11:46:19,298][0m Trial 810 finished with value: 0.7137418010284807 and parameters: {'splitter': 'best', 'min_samples_split': 0.3183891832201496, 'min_samples_leaf': 0.020834944802596445, 'min_weight_fraction_leaf': 0.08002154924894925, 'max_features': 0.5251442183853654}. Best is trial 775 with value: 0.7148354967239336.[0m
[32m[I 2022-04-13 11:46:19,346][0m Trial 811 finished with value: 0.7030519614506526 and parameters: {'splitter': 'best', 'min_samples_split': 0.3141816042106662, 'min_samples_leaf': 0.028588838829404436, 'min_weight_fraction_leaf': 0.07415010739565774, 'max_features': 0.5325329521422469}. Best is trial 775 with value: 0.7148354967239336.[0m
[32m[I 2022-04-13 11:46:19,394][0m Trial 812 finished with value: 0.695563433079365 and parameters: {'splitter': 'best', 'min_samples_split': 0.2919134413081376, 'min_samples_leaf': 0.011874288005780907, 'min_weight_fraction_leaf': 0.08030127819779699, 'max_features': 0.5031064087278129}. Best is trial 775 with value: 0.7148354967239336.[0m
[32m[I 2022-04-13 11:46:19,480][0m Trial 813 finished with value: 0.7030519614506526 and parameters: {'splitter': 'best', 'min_samples_split': 0.31175094697942585, 'min_samples_leaf': 0.04218491276324399, 'min_weight_fraction_leaf': 0.06623557831360462, 'max_features': 0.5451190685313265}. Best is trial 775 with value: 0.7148354967239336.[0m
[32m[I 2022-04-13 11:46:19,790][0m Trial 814 finished with value: 0.6356612618118771 and parameters: {'splitter': 'best', 'min_samples_split': 0.32399503685424746, 'min_samples_leaf': 0.3866480503759865, 'min_weight_fraction_leaf': 0.09539971665924334, 'max_features': 0.5672342404528428}. Best is trial 775 with value: 0.7148354967239336.[0m
[32m[I 2022-04-13 11:46:19,935][0m Trial 815 finished with value: 0.6881740970397604 and parameters: {'splitter': 'best', 'min_samples_split': 0.26522209538981584, 'min_samples_leaf': 0.026516197170295214, 'min_weight_fraction_leaf': 0.08158884351183307, 'max_features': 0.552365906754876}. Best is trial 775 with value: 0.7148354967239336.[0m
[32m[I 2022-04-13 11:46:20,071][0m Trial 816 finished with value: 0.7029215914224277 and parameters: {'splitter': 'best', 'min_samples_split': 0.20140068494996788, 'min_samples_leaf': 0.03785955983264179, 'min_weight_fraction_leaf': 0.11097214735562612, 'max_features': 0.6010774454929484}. Best is trial 775 with value: 0.7148354967239336.[0m
[32m[I 2022-04-13 11:46:20,222][0m Trial 817 finished with value: 0.7148354967239336 and parameters: {'splitter': 'random', 'min_samples_split': 0.2815562013258907, 'min_samples_leaf': 0.011883837538889453, 'min_weight_fraction_leaf': 0.10489470504061714, 'max_features': 0.5917276695453135}. Best is trial 775 with value: 0.7148354967239336.[0m
[32m[I 2022-04-13 11:46:20,390][0m Trial 818 finished with value: 0.6407886163385511 and parameters: {'splitter': 'random', 'min_samples_split': 0.27852746473925505, 'min_samples_leaf': 0.03281575224775571, 'min_weight_fraction_leaf': 0.21660839642143387, 'max_features': 0.620629349133281}. Best is trial 775 with value: 0.7148354967239336.[0m
[32m[I 2022-04-13 11:46:20,485][0m Trial 819 finished with value: 0.7205250605114317 and parameters: {'splitter': 'random', 'min_samples_split': 0.26969799342025624, 'min_samples_leaf': 0.03400433689700358, 'min_weight_fraction_leaf': 0.04699760321144737, 'max_features': 0.6061175836251546}. Best is trial 819 with value: 0.7205250605114317.[0m
[32m[I 2022-04-13 11:46:20,569][0m Trial 820 finished with value: 0.6579152234471052 and parameters: {'splitter': 'best', 'min_samples_split': 0.25160357156194224, 'min_samples_leaf': 0.010827955522777571, 'min_weight_fraction_leaf': 0.03308289022680085, 'max_features': 0.6352574752362804}. Best is trial 819 with value: 0.7205250605114317.[0m
[32m[I 2022-04-13 11:46:20,628][0m Trial 821 finished with value: 0.7075743489608037 and parameters: {'splitter': 'random', 'min_samples_split': 0.28206806739273427, 'min_samples_leaf': 0.008587710680708658, 'min_weight_fraction_leaf': 0.009545645191538513, 'max_features': 0.5079419478177272}. Best is trial 819 with value: 0.7205250605114317.[0m
[32m[I 2022-04-13 11:46:20,711][0m Trial 822 finished with value: 0.7077378843113455 and parameters: {'splitter': 'random', 'min_samples_split': 0.2734159457327647, 'min_samples_leaf': 0.052443568532769616, 'min_weight_fraction_leaf': 0.11880560800634037, 'max_features': 0.6012146755180977}. Best is trial 819 with value: 0.7205250605114317.[0m
[32m[I 2022-04-13 11:46:20,882][0m Trial 823 finished with value: 0.6321106989473192 and parameters: {'splitter': 'random', 'min_samples_split': 0.25277869086949223, 'min_samples_leaf': 0.019473094764582012, 'min_weight_fraction_leaf': 0.043707686407628246, 'max_features': 0.64715681452728}. Best is trial 819 with value: 0.7205250605114317.[0m
[32m[I 2022-04-13 11:46:20,953][0m Trial 824 finished with value: 0.7111234113512894 and parameters: {'splitter': 'random', 'min_samples_split': 0.26345284775310784, 'min_samples_leaf': 0.027290270059167218, 'min_weight_fraction_leaf': 0.03736975762598888, 'max_features': 0.5637994810950594}. Best is trial 819 with value: 0.7205250605114317.[0m
[32m[I 2022-04-13 11:46:20,992][0m Trial 825 finished with value: 0.7148354967239336 and parameters: {'splitter': 'random', 'min_samples_split': 0.2802064244462159, 'min_samples_leaf': 0.012781981343972022, 'min_weight_fraction_leaf': 0.10106926302953256, 'max_features': 0.6054801749906742}. Best is trial 819 with value: 0.7205250605114317.[0m
