[32m[I 2022-04-14 14:03:38,745][0m Trial 443 finished with value: 0.589036269581529 and parameters: {'loss': 'coxph', 'learning_rate': 0.0037007266695499703, 'n_estimators': 249, 'criterion': 'absolute_error', 'min_samples_split': 3, 'min_samples_leaf': 1, 'min_weight_fraction_leaf': 0.08839937953444067, 'min_impurity_decrease': 0.0013396492149975962, 'max_features': 0.9461651728577573, 'subsample': 0.8240512770967564, 'dropout_rate': 0.5758964833457714, 'ccp_alpha': 0.177670894216092}. Best is trial 396 with value: 0.7561160925059711.[0m
[32m[I 2022-04-14 14:03:47,464][0m Trial 444 finished with value: 0.7375755242291353 and parameters: {'loss': 'coxph', 'learning_rate': 6.347597068781753e-05, 'n_estimators': 310, 'criterion': 'friedman_mse', 'min_samples_split': 9, 'min_samples_leaf': 1, 'min_weight_fraction_leaf': 0.06399001643244132, 'min_impurity_decrease': 0.04079713714029512, 'max_features': 0.9835822191511363, 'subsample': 0.8042828673743182, 'dropout_rate': 0.5197997992297462, 'ccp_alpha': 0.09731688906860624}. Best is trial 396 with value: 0.7561160925059711.[0m
[32m[I 2022-04-14 14:04:04,108][0m Trial 445 finished with value: 0.7477617340342813 and parameters: {'loss': 'coxph', 'learning_rate': 1.1413086586701729e-05, 'n_estimators': 393, 'criterion': 'friedman_mse', 'min_samples_split': 3, 'min_samples_leaf': 2, 'min_weight_fraction_leaf': 0.09472049453250315, 'min_impurity_decrease': 0.022743708705523027, 'max_features': 0.9450748308987094, 'subsample': 0.8593118757233832, 'dropout_rate': 0.4283656085766031, 'ccp_alpha': 0.0024693947795462468}. Best is trial 396 with value: 0.7561160925059711.[0m
[32m[I 2022-04-14 14:04:16,917][0m Trial 446 finished with value: 0.5519678897979211 and parameters: {'loss': 'coxph', 'learning_rate': 0.005393845879096734, 'n_estimators': 345, 'criterion': 'friedman_mse', 'min_samples_split': 3, 'min_samples_leaf': 2, 'min_weight_fraction_leaf': 0.09452250805053694, 'min_impurity_decrease': 0.04502339790458713, 'max_features': 0.9432980819523507, 'subsample': 0.8665220719055858, 'dropout_rate': 0.42952265342496354, 'ccp_alpha': 0.25529242798491797}. Best is trial 396 with value: 0.7561160925059711.[0m
[32m[I 2022-04-14 14:04:25,541][0m Trial 447 finished with value: 0.7464078867720245 and parameters: {'loss': 'coxph', 'learning_rate': 6.156320142145796e-06, 'n_estimators': 280, 'criterion': 'friedman_mse', 'min_samples_split': 2, 'min_samples_leaf': 2, 'min_weight_fraction_leaf': 0.07427906485690744, 'min_impurity_decrease': 0.02623722969631854, 'max_features': 0.9618238108768137, 'subsample': 0.8242951534258772, 'dropout_rate': 0.41119345161600884, 'ccp_alpha': 0.0019874834761916226}. Best is trial 396 with value: 0.7561160925059711.[0m
[32m[I 2022-04-14 14:04:41,746][0m Trial 448 finished with value: 0.7423211062481464 and parameters: {'loss': 'coxph', 'learning_rate': 6.424372931272521e-06, 'n_estimators': 404, 'criterion': 'friedman_mse', 'min_samples_split': 2, 'min_samples_leaf': 2, 'min_weight_fraction_leaf': 0.06843053966479598, 'min_impurity_decrease': 0.001225092684725754, 'max_features': 0.956855393771298, 'subsample': 0.8281170252325334, 'dropout_rate': 0.4459566345827935, 'ccp_alpha': 0.11277082390115924}. Best is trial 396 with value: 0.7561160925059711.[0m
[32m[I 2022-04-14 14:04:50,081][0m Trial 449 finished with value: 0.5 and parameters: {'loss': 'coxph', 'learning_rate': 7.365016720397203e-06, 'n_estimators': 280, 'criterion': 'friedman_mse', 'min_samples_split': 3, 'min_samples_leaf': 2, 'min_weight_fraction_leaf': 0.07709517808429138, 'min_impurity_decrease': 0.03116084157117132, 'max_features': 0.9663262920043748, 'subsample': 0.8571309658900277, 'dropout_rate': 0.406175894449974, 'ccp_alpha': 3.5817244609326675}. Best is trial 396 with value: 0.7561160925059711.[0m
[32m[I 2022-04-14 14:04:58,050][0m Trial 450 finished with value: 0.2534607634692777 and parameters: {'loss': 'squared', 'learning_rate': 0.0029411434804543467, 'n_estimators': 267, 'criterion': 'friedman_mse', 'min_samples_split': 3, 'min_samples_leaf': 2, 'min_weight_fraction_leaf': 0.05419182522419502, 'min_impurity_decrease': 0.020131841854421337, 'max_features': 0.9992010694628624, 'subsample': 0.7935170842064122, 'dropout_rate': 0.40958106896797136, 'ccp_alpha': 0.00614777016655623}. Best is trial 396 with value: 0.7561160925059711.[0m
[32m[I 2022-04-14 14:05:11,558][0m Trial 451 finished with value: 0.6834721836112492 and parameters: {'loss': 'coxph', 'learning_rate': 0.010540019657713387, 'n_estimators': 360, 'criterion': 'friedman_mse', 'min_samples_split': 9, 'min_samples_leaf': 2, 'min_weight_fraction_leaf': 0.07426425349212003, 'min_impurity_decrease': 0.04973711519955654, 'max_features': 0.9392435650028451, 'subsample': 0.9023559876596803, 'dropout_rate': 0.4660715126201644, 'ccp_alpha': 0.1759193643462168}. Best is trial 396 with value: 0.7561160925059711.[0m
[32m[I 2022-04-14 14:05:19,814][0m Trial 452 finished with value: 0.7333531904741033 and parameters: {'loss': 'coxph', 'learning_rate': 9.732504724023331e-06, 'n_estimators': 293, 'criterion': 'friedman_mse', 'min_samples_split': 2, 'min_samples_leaf': 2, 'min_weight_fraction_leaf': 0.09072387482526578, 'min_impurity_decrease': 0.001207134854379694, 'max_features': 0.9776471875486692, 'subsample': 0.9335059057816507, 'dropout_rate': 0.4895612608480024, 'ccp_alpha': 0.09084167031277082}. Best is trial 396 with value: 0.7561160925059711.[0m
[32m[I 2022-04-14 14:05:31,674][0m Trial 453 finished with value: 0.734168260101606 and parameters: {'loss': 'coxph', 'learning_rate': 3.042895606003507e-06, 'n_estimators': 330, 'criterion': 'friedman_mse', 'min_samples_split': 9, 'min_samples_leaf': 2, 'min_weight_fraction_leaf': 0.06252464206366168, 'min_impurity_decrease': 0.024575227803179583, 'max_features': 0.9581459029551924, 'subsample': 0.8800280069037781, 'dropout_rate': 0.43344457309222634, 'ccp_alpha': 0.10114463467440575}. Best is trial 396 with value: 0.7561160925059711.[0m
[32m[I 2022-04-14 14:05:42,970][0m Trial 454 finished with value: 0.7543226800945801 and parameters: {'loss': 'coxph', 'learning_rate': 2.4158185228345254e-05, 'n_estimators': 389, 'criterion': 'friedman_mse', 'min_samples_split': 2, 'min_samples_leaf': 1, 'min_weight_fraction_leaf': 0.08163189625309163, 'min_impurity_decrease': 0.04947905225325409, 'max_features': 0.9815310957199804, 'subsample': 0.8138831000994102, 'dropout_rate': 0.6318547700575063, 'ccp_alpha': 0.004299148944321164}. Best is trial 396 with value: 0.7561160925059711.[0m
[32m[I 2022-04-14 14:05:53,118][0m Trial 455 finished with value: 0.5 and parameters: {'loss': 'coxph', 'learning_rate': 1.3748503882575382e-05, 'n_estimators': 384, 'criterion': 'friedman_mse', 'min_samples_split': 2, 'min_samples_leaf': 1, 'min_weight_fraction_leaf': 0.07569841151797771, 'min_impurity_decrease': 0.04836362115949022, 'max_features': 0.9448819238504184, 'subsample': 0.8159014862646818, 'dropout_rate': 0.6565225264670879, 'ccp_alpha': 0.8952253697139309}. Best is trial 396 with value: 0.7561160925059711.[0m
[32m[I 2022-04-14 14:06:03,684][0m Trial 456 finished with value: 0.5 and parameters: {'loss': 'coxph', 'learning_rate': 9.952994430245537e-06, 'n_estimators': 375, 'criterion': 'friedman_mse', 'min_samples_split': 2, 'min_samples_leaf': 1, 'min_weight_fraction_leaf': 0.048192007473824655, 'min_impurity_decrease': 0.04827519172274779, 'max_features': 0.9803256606340429, 'subsample': 0.8483103839367426, 'dropout_rate': 0.6116539216016456, 'ccp_alpha': 2.002134043306267}. Best is trial 396 with value: 0.7561160925059711.[0m
[32m[I 2022-04-14 14:06:16,804][0m Trial 457 finished with value: 0.746677744763515 and parameters: {'loss': 'coxph', 'learning_rate': 2.5852038500969793e-05, 'n_estimators': 341, 'criterion': 'friedman_mse', 'min_samples_split': 2, 'min_samples_leaf': 2, 'min_weight_fraction_leaf': 0.08195666140163449, 'min_impurity_decrease': 0.020603562207237875, 'max_features': 0.9993607946866574, 'subsample': 0.7952628665434918, 'dropout_rate': 0.3875126807976169, 'ccp_alpha': 0.0015196647895830248}. Best is trial 396 with value: 0.7561160925059711.[0m
[32m[I 2022-04-14 14:06:29,706][0m Trial 458 finished with value: 0.6385600055325357 and parameters: {'loss': 'coxph', 'learning_rate': 1.931794349256919e-05, 'n_estimators': 343, 'criterion': 'friedman_mse', 'min_samples_split': 2, 'min_samples_leaf': 2, 'min_weight_fraction_leaf': 0.31094195213574427, 'min_impurity_decrease': 0.02486287086856707, 'max_features': 0.4282141280190926, 'subsample': 0.7957972603995532, 'dropout_rate': 0.3975499810952911, 'ccp_alpha': 0.2037308968708687}. Best is trial 396 with value: 0.7561160925059711.[0m
[32m[I 2022-04-14 14:06:37,423][0m Trial 459 finished with value: 0.5 and parameters: {'loss': 'coxph', 'learning_rate': 3.0211290223149298e-05, 'n_estimators': 318, 'criterion': 'friedman_mse', 'min_samples_split': 2, 'min_samples_leaf': 2, 'min_weight_fraction_leaf': 0.06824510993509952, 'min_impurity_decrease': 0.047653130682055206, 'max_features': 0.9629553400141964, 'subsample': 0.8646251642294663, 'dropout_rate': 0.6328296366570032, 'ccp_alpha': 0.33839945887952205}. Best is trial 396 with value: 0.7561160925059711.[0m
[32m[I 2022-04-14 14:06:51,106][0m Trial 460 finished with value: 0.7454097836946619 and parameters: {'loss': 'coxph', 'learning_rate': 1.858172244415213e-05, 'n_estimators': 356, 'criterion': 'friedman_mse', 'min_samples_split': 2, 'min_samples_leaf': 2, 'min_weight_fraction_leaf': 0.094640828384424, 'min_impurity_decrease': 0.020010934431987988, 'max_features': 0.9625917346557964, 'subsample': 0.8163545132363047, 'dropout_rate': 0.3820989277754773, 'ccp_alpha': 0.10002913144475446}. Best is trial 396 with value: 0.7561160925059711.[0m
[32m[I 2022-04-14 14:07:02,861][0m Trial 461 finished with value: 0.7026312149673618 and parameters: {'loss': 'coxph', 'learning_rate': 4.4382165538760355e-05, 'n_estimators': 333, 'criterion': 'friedman_mse', 'min_samples_split': 2, 'min_samples_leaf': 2, 'min_weight_fraction_leaf': 0.07818981838688885, 'min_impurity_decrease': 0.04907922585029997, 'max_features': 0.2226896286656096, 'subsample': 0.8445512926238203, 'dropout_rate': 0.41771415147191504, 'ccp_alpha': 0.0029036967631953852}. Best is trial 396 with value: 0.7561160925059711.[0m
[32m[I 2022-04-14 14:07:19,011][0m Trial 462 finished with value: 0.5 and parameters: {'loss': 'coxph', 'learning_rate': 3.956914796704487e-06, 'n_estimators': 400, 'criterion': 'absolute_error', 'min_samples_split': 2, 'min_samples_leaf': 2, 'min_weight_fraction_leaf': 0.06265235534413509, 'min_impurity_decrease': 0.03158381230297641, 'max_features': 0.9390755703959346, 'subsample': 0.7962551709016529, 'dropout_rate': 0.4536944077196183, 'ccp_alpha': 0.2154086011871549}. Best is trial 396 with value: 0.7561160925059711.[0m
[32m[I 2022-04-14 14:07:24,902][0m Trial 463 finished with value: 0.7475986683106737 and parameters: {'loss': 'coxph', 'learning_rate': 0.00011352403890423195, 'n_estimators': 301, 'criterion': 'friedman_mse', 'min_samples_split': 2, 'min_samples_leaf': 2, 'min_weight_fraction_leaf': 0.09610628091508584, 'min_impurity_decrease': 0.022466625636577746, 'max_features': 0.9980601257091908, 'subsample': 0.878302580468161, 'dropout_rate': 0.7054013188671222, 'ccp_alpha': 0.004639280684459356}. Best is trial 396 with value: 0.7561160925059711.[0m
[32m[I 2022-04-14 14:07:34,815][0m Trial 464 finished with value: 0.6952759333248004 and parameters: {'loss': 'coxph', 'learning_rate': 0.0027331126512869204, 'n_estimators': 300, 'criterion': 'friedman_mse', 'min_samples_split': 2, 'min_samples_leaf': 2, 'min_weight_fraction_leaf': 0.08106599903619194, 'min_impurity_decrease': 0.019449945205318477, 'max_features': 0.997269523266704, 'subsample': 0.8918482227048916, 'dropout_rate': 0.4766770196588001, 'ccp_alpha': 0.14280811320396414}. Best is trial 396 with value: 0.7561160925059711.[0m
[32m[I 2022-04-14 14:07:41,391][0m Trial 465 finished with value: 0.7464942492891671 and parameters: {'loss': 'coxph', 'learning_rate': 5.351369504210377e-06, 'n_estimators': 321, 'criterion': 'friedman_mse', 'min_samples_split': 2, 'min_samples_leaf': 2, 'min_weight_fraction_leaf': 0.09332740880770425, 'min_impurity_decrease': 0.0019277508642143323, 'max_features': 0.9988121761308869, 'subsample': 0.8705311164966487, 'dropout_rate': 0.7278017041652599, 'ccp_alpha': 0.0038622505570563054}. Best is trial 396 with value: 0.7561160925059711.[0m
[32m[I 2022-04-14 14:07:47,119][0m Trial 466 finished with value: 0.5217459622928541 and parameters: {'loss': 'coxph', 'learning_rate': 2.8779622469465e-05, 'n_estimators': 320, 'criterion': 'friedman_mse', 'min_samples_split': 2, 'min_samples_leaf': 2, 'min_weight_fraction_leaf': 0.09465220216147084, 'min_impurity_decrease': 0.0016449372516100045, 'max_features': 0.9978031676845845, 'subsample': 0.882055217178516, 'dropout_rate': 0.7581589953866039, 'ccp_alpha': 0.25635980977050826}. Best is trial 396 with value: 0.7561160925059711.[0m
[32m[I 2022-04-14 14:07:57,753][0m Trial 467 finished with value: 0.7075525666187066 and parameters: {'loss': 'coxph', 'learning_rate': 9.228391249019922e-05, 'n_estimators': 328, 'criterion': 'friedman_mse', 'min_samples_split': 2, 'min_samples_leaf': 3, 'min_weight_fraction_leaf': 0.09246754551798725, 'min_impurity_decrease': 0.7967051241017443, 'max_features': 0.9996796577055653, 'subsample': 0.9296941622577379, 'dropout_rate': 0.5013631522989122, 'ccp_alpha': 0.10823796788445852}. Best is trial 396 with value: 0.7561160925059711.[0m
[32m[I 2022-04-14 14:08:03,931][0m Trial 468 finished with value: 0.6809187531425763 and parameters: {'loss': 'coxph', 'learning_rate': 2.5527639031927676e-05, 'n_estimators': 310, 'criterion': 'friedman_mse', 'min_samples_split': 2, 'min_samples_leaf': 2, 'min_weight_fraction_leaf': 0.09870952819324445, 'min_impurity_decrease': 0.0196483841748324, 'max_features': 0.9807327228869714, 'subsample': 0.8633368258454799, 'dropout_rate': 0.7024459446125192, 'ccp_alpha': 0.17640080102435854}. Best is trial 396 with value: 0.7561160925059711.[0m
[32m[I 2022-04-14 14:08:11,576][0m Trial 469 finished with value: 0.2472594313367206 and parameters: {'loss': 'squared', 'learning_rate': 3.81326465082393e-05, 'n_estimators': 369, 'criterion': 'friedman_mse', 'min_samples_split': 2, 'min_samples_leaf': 2, 'min_weight_fraction_leaf': 0.08491366702956375, 'min_impurity_decrease': 0.38436308521982654, 'max_features': 0.9999607773476679, 'subsample': 0.874557959743546, 'dropout_rate': 0.7520173457480533, 'ccp_alpha': 0.09464360219922524}. Best is trial 396 with value: 0.7561160925059711.[0m
[32m[I 2022-04-14 14:08:22,127][0m Trial 470 finished with value: 0.7464181688469256 and parameters: {'loss': 'coxph', 'learning_rate': 1.0475129115407096e-05, 'n_estimators': 346, 'criterion': 'friedman_mse', 'min_samples_split': 2, 'min_samples_leaf': 2, 'min_weight_fraction_leaf': 0.10047502709431734, 'min_impurity_decrease': 0.03750422294250969, 'max_features': 0.9816663059640083, 'subsample': 0.8531524973155272, 'dropout_rate': 0.5374975345551622, 'ccp_alpha': 0.0010341858004702662}. Best is trial 396 with value: 0.7561160925059711.[0m
[32m[I 2022-04-14 14:08:30,089][0m Trial 471 finished with value: 0.5217459622928541 and parameters: {'loss': 'coxph', 'learning_rate': 1.346546628929541e-05, 'n_estimators': 296, 'criterion': 'friedman_mse', 'min_samples_split': 2, 'min_samples_leaf': 2, 'min_weight_fraction_leaf': 0.09054290482086776, 'min_impurity_decrease': 0.7028387758606384, 'max_features': 0.9786567912201813, 'subsample': 0.8888810605498099, 'dropout_rate': 0.5065442236971408, 'ccp_alpha': 0.26192663520490483}. Best is trial 396 with value: 0.7561160925059711.[0m
[32m[I 2022-04-14 14:08:34,946][0m Trial 472 finished with value: 0.7435343240646477 and parameters: {'loss': 'coxph', 'learning_rate': 1.539162340602304e-05, 'n_estimators': 319, 'criterion': 'friedman_mse', 'min_samples_split': 2, 'min_samples_leaf': 2, 'min_weight_fraction_leaf': 0.08072355534671823, 'min_impurity_decrease': 0.015125842660854986, 'max_features': 0.9452816138127125, 'subsample': 0.8433219283036096, 'dropout_rate': 0.8135173266986233, 'ccp_alpha': 0.10631726376619065}. Best is trial 396 with value: 0.7561160925059711.[0m
[32m[I 2022-04-14 14:08:36,137][0m Trial 473 finished with value: 0.5 and parameters: {'loss': 'coxph', 'learning_rate': 1.912534945399938e-06, 'n_estimators': 123, 'criterion': 'friedman_mse', 'min_samples_split': 2, 'min_samples_leaf': 2, 'min_weight_fraction_leaf': 0.06878983805513156, 'min_impurity_decrease': 0.0012976896521569095, 'max_features': 0.9781708951099187, 'subsample': 0.9073432628808055, 'dropout_rate': 0.7213372935468322, 'ccp_alpha': 0.3601412672941551}. Best is trial 396 with value: 0.7561160925059711.[0m
[32m[I 2022-04-14 14:08:42,340][0m Trial 474 finished with value: 0.6834721836112492 and parameters: {'loss': 'coxph', 'learning_rate': 3.808433234568934e-05, 'n_estimators': 338, 'criterion': 'friedman_mse', 'min_samples_split': 9, 'min_samples_leaf': 2, 'min_weight_fraction_leaf': 0.08844044691249227, 'min_impurity_decrease': 0.03773435449266477, 'max_features': 0.9606610123660433, 'subsample': 0.8754205286821198, 'dropout_rate': 0.7766516733082874, 'ccp_alpha': 0.18378050972291277}. Best is trial 396 with value: 0.7561160925059711.[0m
[32m[I 2022-04-14 14:08:48,885][0m Trial 475 finished with value: 0.7452348750498791 and parameters: {'loss': 'coxph', 'learning_rate': 0.00013268460231944217, 'n_estimators': 302, 'criterion': 'friedman_mse', 'min_samples_split': 2, 'min_samples_leaf': 2, 'min_weight_fraction_leaf': 0.056929554378763576, 'min_impurity_decrease': 0.00127931330255621, 'max_features': 0.9833262604905555, 'subsample': 0.860215950670913, 'dropout_rate': 0.6778105695858168, 'ccp_alpha': 0.09703667996255032}. Best is trial 396 with value: 0.7561160925059711.[0m
[32m[I 2022-04-14 14:08:57,280][0m Trial 476 finished with value: 0.5 and parameters: {'loss': 'coxph', 'learning_rate': 5.734585439435038e-05, 'n_estimators': 355, 'criterion': 'friedman_mse', 'min_samples_split': 2, 'min_samples_leaf': 1, 'min_weight_fraction_leaf': 0.10284036330379753, 'min_impurity_decrease': 0.05224154769850385, 'max_features': 0.9374744679563839, 'subsample': 0.002719277266475306, 'dropout_rate': 0.6912278078802245, 'ccp_alpha': 0.08363199405221484}. Best is trial 396 with value: 0.7561160925059711.[0m
[32m[I 2022-04-14 14:09:07,244][0m Trial 477 finished with value: 0.5 and parameters: {'loss': 'coxph', 'learning_rate': 7.85627916290001e-06, 'n_estimators': 315, 'criterion': 'friedman_mse', 'min_samples_split': 2, 'min_samples_leaf': 7, 'min_weight_fraction_leaf': 0.08022628276800889, 'min_impurity_decrease': 0.02287452590234351, 'max_features': 0.9992578101340431, 'subsample': 0.9555765622129075, 'dropout_rate': 0.47088482403431153, 'ccp_alpha': 1.7125048408657952}. Best is trial 396 with value: 0.7561160925059711.[0m
[32m[I 2022-04-14 14:09:17,375][0m Trial 478 finished with value: 0.6893296715710848 and parameters: {'loss': 'coxph', 'learning_rate': 7.182779092631556e-05, 'n_estimators': 330, 'criterion': 'friedman_mse', 'min_samples_split': 2, 'min_samples_leaf': 3, 'min_weight_fraction_leaf': 0.0958991985714092, 'min_impurity_decrease': 0.03539104752732654, 'max_features': 0.9648715389171444, 'subsample': 0.8300661463605405, 'dropout_rate': 0.5463248726077382, 'ccp_alpha': 0.19443733685582262}. Best is trial 396 with value: 0.7561160925059711.[0m
[32m[I 2022-04-14 14:09:22,646][0m Trial 479 finished with value: 0.7251037851097731 and parameters: {'loss': 'coxph', 'learning_rate': 4.852829405200566e-06, 'n_estimators': 298, 'criterion': 'friedman_mse', 'min_samples_split': 2, 'min_samples_leaf': 1, 'min_weight_fraction_leaf': 0.07097946737977229, 'min_impurity_decrease': 0.051550616301136463, 'max_features': 0.5143098231869636, 'subsample': 0.8453611032242756, 'dropout_rate': 0.7408046594619435, 'ccp_alpha': 0.009256546340213301}. Best is trial 396 with value: 0.7561160925059711.[0m
[32m[I 2022-04-14 14:09:32,897][0m Trial 480 finished with value: 0.7563614380513435 and parameters: {'loss': 'coxph', 'learning_rate': 2.275004974993839e-05, 'n_estimators': 390, 'criterion': 'friedman_mse', 'min_samples_split': 3, 'min_samples_leaf': 1, 'min_weight_fraction_leaf': 0.09014188297293138, 'min_impurity_decrease': 0.02007605450622056, 'max_features': 0.9792789013820823, 'subsample': 0.8185056658264112, 'dropout_rate': 0.7089912592108544, 'ccp_alpha': 0.006305548296295589}. Best is trial 480 with value: 0.7563614380513435.[0m
[32m[I 2022-04-14 14:09:43,085][0m Trial 481 finished with value: 0.7080270504657602 and parameters: {'loss': 'coxph', 'learning_rate': 2.2323465892070887e-05, 'n_estimators': 377, 'criterion': 'friedman_mse', 'min_samples_split': 3, 'min_samples_leaf': 1, 'min_weight_fraction_leaf': 0.07928180447267576, 'min_impurity_decrease': 0.028105906264007274, 'max_features': 0.9544641703668302, 'subsample': 0.8156813204382142, 'dropout_rate': 0.6640610967602446, 'ccp_alpha': 0.164397817407808}. Best is trial 480 with value: 0.7563614380513435.[0m
[32m[I 2022-04-14 14:09:57,142][0m Trial 482 finished with value: 0.7397097981054961 and parameters: {'loss': 'coxph', 'learning_rate': 1.995211500316485e-05, 'n_estimators': 444, 'criterion': 'friedman_mse', 'min_samples_split': 4, 'min_samples_leaf': 1, 'min_weight_fraction_leaf': 0.061996881028748785, 'min_impurity_decrease': 0.052297223991812795, 'max_features': 0.9764617595520771, 'subsample': 0.7931002356992705, 'dropout_rate': 0.6346363080434406, 'ccp_alpha': 0.09967696634846715}. Best is trial 480 with value: 0.7563614380513435.[0m
