[32m[I 2022-04-14 15:20:42,418][0m Trial 843 finished with value: 0.5 and parameters: {'loss': 'coxph', 'learning_rate': 0.010977194771740096, 'n_estimators': 409, 'criterion': 'friedman_mse', 'min_samples_split': 2, 'min_samples_leaf': 2, 'min_weight_fraction_leaf': 0.058450406669233, 'min_impurity_decrease': 0.3764089091825314, 'max_features': 0.8568120176036236, 'subsample': 0.8053060840395349, 'dropout_rate': 0.3529474034280541, 'ccp_alpha': 3.354061541912692}. Best is trial 677 with value: 0.7600100187343619.[0m
[32m[I 2022-04-14 15:20:58,616][0m Trial 844 finished with value: 0.6564221650641082 and parameters: {'loss': 'coxph', 'learning_rate': 0.013100091323091303, 'n_estimators': 376, 'criterion': 'friedman_mse', 'min_samples_split': 2, 'min_samples_leaf': 2, 'min_weight_fraction_leaf': 0.047311088502213584, 'min_impurity_decrease': 0.4245359787572654, 'max_features': 0.902937778063798, 'subsample': 0.786524205142354, 'dropout_rate': 0.3714891020043127, 'ccp_alpha': 0.25687391633281553}. Best is trial 677 with value: 0.7600100187343619.[0m
[32m[I 2022-04-14 15:21:14,062][0m Trial 845 finished with value: 0.750319024677798 and parameters: {'loss': 'coxph', 'learning_rate': 0.00571006082435025, 'n_estimators': 357, 'criterion': 'friedman_mse', 'min_samples_split': 2, 'min_samples_leaf': 2, 'min_weight_fraction_leaf': 0.05975471499552088, 'min_impurity_decrease': 0.39090886646064443, 'max_features': 0.9153796147226165, 'subsample': 0.7670600021928774, 'dropout_rate': 0.3397033058020623, 'ccp_alpha': 0.0019140738764639247}. Best is trial 677 with value: 0.7600100187343619.[0m
[32m[I 2022-04-14 15:21:30,386][0m Trial 846 finished with value: 0.7433376603927215 and parameters: {'loss': 'coxph', 'learning_rate': 0.0072910914232971955, 'n_estimators': 368, 'criterion': 'friedman_mse', 'min_samples_split': 2, 'min_samples_leaf': 2, 'min_weight_fraction_leaf': 0.03972260382582263, 'min_impurity_decrease': 0.4166378874908279, 'max_features': 0.8754775777082006, 'subsample': 0.8031135892147593, 'dropout_rate': 0.40130232151694045, 'ccp_alpha': 0.0015777994826364139}. Best is trial 677 with value: 0.7600100187343619.[0m
[32m[I 2022-04-14 15:21:35,414][0m Trial 847 finished with value: 0.5 and parameters: {'loss': 'coxph', 'learning_rate': 0.009111653535631361, 'n_estimators': 195, 'criterion': 'absolute_error', 'min_samples_split': 2, 'min_samples_leaf': 2, 'min_weight_fraction_leaf': 0.06887169917330727, 'min_impurity_decrease': 0.3701862357070582, 'max_features': 0.9260566955631969, 'subsample': 0.8201197461656398, 'dropout_rate': 0.38941864517229385, 'ccp_alpha': 0.16566757654966613}. Best is trial 677 with value: 0.7600100187343619.[0m
[32m[I 2022-04-14 15:21:54,894][0m Trial 848 finished with value: 0.7362469445237286 and parameters: {'loss': 'coxph', 'learning_rate': 0.012475588447316518, 'n_estimators': 394, 'criterion': 'friedman_mse', 'min_samples_split': 2, 'min_samples_leaf': 2, 'min_weight_fraction_leaf': 0.051025347634517534, 'min_impurity_decrease': 0.4333758938856992, 'max_features': 0.26975619273840523, 'subsample': 0.73751225711793, 'dropout_rate': 0.32324145758236844, 'ccp_alpha': 0.0018837699816098884}. Best is trial 677 with value: 0.7600100187343619.[0m
[32m[I 2022-04-14 15:22:09,159][0m Trial 849 finished with value: 0.7452966079360761 and parameters: {'loss': 'coxph', 'learning_rate': 0.08805413752383802, 'n_estimators': 356, 'criterion': 'friedman_mse', 'min_samples_split': 5, 'min_samples_leaf': 2, 'min_weight_fraction_leaf': 0.06439155482869269, 'min_impurity_decrease': 0.39450471870958, 'max_features': 0.9017358329565064, 'subsample': 0.7784192830838346, 'dropout_rate': 0.39275675704590324, 'ccp_alpha': 0.10166240204469047}. Best is trial 677 with value: 0.7600100187343619.[0m
[32m[I 2022-04-14 15:22:25,365][0m Trial 850 finished with value: 0.673664311117699 and parameters: {'loss': 'coxph', 'learning_rate': 0.00667343851458002, 'n_estimators': 382, 'criterion': 'friedman_mse', 'min_samples_split': 2, 'min_samples_leaf': 2, 'min_weight_fraction_leaf': 0.0378813545972153, 'min_impurity_decrease': 0.4355621774795155, 'max_features': 0.9323419663889602, 'subsample': 0.7625533779884199, 'dropout_rate': 0.38033183771175305, 'ccp_alpha': 0.23524402692951366}. Best is trial 677 with value: 0.7600100187343619.[0m
[32m[I 2022-04-14 15:22:41,639][0m Trial 851 finished with value: 0.7485505410575319 and parameters: {'loss': 'coxph', 'learning_rate': 0.004846911058331086, 'n_estimators': 358, 'criterion': 'friedman_mse', 'min_samples_split': 2, 'min_samples_leaf': 2, 'min_weight_fraction_leaf': 0.05458938398224631, 'min_impurity_decrease': 0.4045140899708754, 'max_features': 0.9131655819419041, 'subsample': 0.8031538603495071, 'dropout_rate': 0.36755489630007926, 'ccp_alpha': 0.0951075259676734}. Best is trial 677 with value: 0.7600100187343619.[0m
[32m[I 2022-04-14 15:22:55,072][0m Trial 852 finished with value: 0.7109855121856835 and parameters: {'loss': 'coxph', 'learning_rate': 0.007015267753682561, 'n_estimators': 346, 'criterion': 'friedman_mse', 'min_samples_split': 2, 'min_samples_leaf': 2, 'min_weight_fraction_leaf': 0.06617453879335987, 'min_impurity_decrease': 0.4120349373217076, 'max_features': 0.88757843209498, 'subsample': 0.8253186831794393, 'dropout_rate': 0.39083737156753406, 'ccp_alpha': 0.17278770170559893}. Best is trial 677 with value: 0.7600100187343619.[0m
[32m[I 2022-04-14 15:23:14,193][0m Trial 853 finished with value: 0.7591991815917931 and parameters: {'loss': 'coxph', 'learning_rate': 0.004071858178429574, 'n_estimators': 419, 'criterion': 'friedman_mse', 'min_samples_split': 2, 'min_samples_leaf': 2, 'min_weight_fraction_leaf': 0.04661721045840496, 'min_impurity_decrease': 0.3784070401967681, 'max_features': 0.9443024247128609, 'subsample': 0.7070091592607278, 'dropout_rate': 0.4081421453406874, 'ccp_alpha': 0.0010952676157324258}. Best is trial 677 with value: 0.7600100187343619.[0m
[32m[I 2022-04-14 15:23:31,865][0m Trial 854 finished with value: 0.6773123687998178 and parameters: {'loss': 'coxph', 'learning_rate': 0.0034335049176258013, 'n_estimators': 405, 'criterion': 'friedman_mse', 'min_samples_split': 2, 'min_samples_leaf': 2, 'min_weight_fraction_leaf': 0.04761343126402947, 'min_impurity_decrease': 0.42650695805310057, 'max_features': 0.9463181366057473, 'subsample': 0.10228457398885088, 'dropout_rate': 0.4069982246751799, 'ccp_alpha': 0.3293172500480278}. Best is trial 677 with value: 0.7600100187343619.[0m
[32m[I 2022-04-14 15:23:53,046][0m Trial 855 finished with value: 0.7411244700501978 and parameters: {'loss': 'coxph', 'learning_rate': 0.003812559105694222, 'n_estimators': 444, 'criterion': 'friedman_mse', 'min_samples_split': 2, 'min_samples_leaf': 2, 'min_weight_fraction_leaf': 0.05891872273708007, 'min_impurity_decrease': 0.38707116029721617, 'max_features': 0.9483499424531501, 'subsample': 0.7003335281985158, 'dropout_rate': 0.40853504945975827, 'ccp_alpha': 0.09474149770799274}. Best is trial 677 with value: 0.7600100187343619.[0m
[32m[I 2022-04-14 15:24:12,311][0m Trial 856 finished with value: 0.2963275065003633 and parameters: {'loss': 'squared', 'learning_rate': 0.005091115397375911, 'n_estimators': 416, 'criterion': 'friedman_mse', 'min_samples_split': 2, 'min_samples_leaf': 2, 'min_weight_fraction_leaf': 0.244776415707428, 'min_impurity_decrease': 0.3795373769230394, 'max_features': 0.973460656877247, 'subsample': 0.7878523854419184, 'dropout_rate': 0.41595481676343904, 'ccp_alpha': 0.16735087065276585}. Best is trial 677 with value: 0.7600100187343619.[0m
[32m[I 2022-04-14 15:24:31,278][0m Trial 857 finished with value: 0.7392413526926734 and parameters: {'loss': 'coxph', 'learning_rate': 0.0042702810221805386, 'n_estimators': 419, 'criterion': 'friedman_mse', 'min_samples_split': 2, 'min_samples_leaf': 2, 'min_weight_fraction_leaf': 0.06954013214984126, 'min_impurity_decrease': 0.44287831954885526, 'max_features': 0.9414697283978872, 'subsample': 0.7496124208612848, 'dropout_rate': 0.4003995222517351, 'ccp_alpha': 0.09531090193872484}. Best is trial 677 with value: 0.7600100187343619.[0m
[32m[I 2022-04-14 15:24:44,228][0m Trial 858 finished with value: 0.6718837682844396 and parameters: {'loss': 'coxph', 'learning_rate': 0.0035018867728095816, 'n_estimators': 449, 'criterion': 'friedman_mse', 'min_samples_split': 2, 'min_samples_leaf': 2, 'min_weight_fraction_leaf': 0.052788899422714, 'min_impurity_decrease': 0.40342381515517856, 'max_features': 0.9580879621415669, 'subsample': 0.7091957590791806, 'dropout_rate': 0.7268214696641048, 'ccp_alpha': 0.26469193827195214}. Best is trial 677 with value: 0.7600100187343619.[0m
[32m[I 2022-04-14 15:25:00,775][0m Trial 859 finished with value: 0.6753551988448893 and parameters: {'loss': 'coxph', 'learning_rate': 0.00556122528823085, 'n_estimators': 392, 'criterion': 'friedman_mse', 'min_samples_split': 2, 'min_samples_leaf': 2, 'min_weight_fraction_leaf': 0.336295304845211, 'min_impurity_decrease': 0.3790329542833301, 'max_features': 0.9300543646654319, 'subsample': 0.8197402211495963, 'dropout_rate': 0.42123621913657217, 'ccp_alpha': 0.0033368033838768628}. Best is trial 677 with value: 0.7600100187343619.[0m
[32m[I 2022-04-14 15:25:19,242][0m Trial 860 finished with value: 0.7435511987907251 and parameters: {'loss': 'coxph', 'learning_rate': 0.004084153914025448, 'n_estimators': 419, 'criterion': 'friedman_mse', 'min_samples_split': 2, 'min_samples_leaf': 2, 'min_weight_fraction_leaf': 0.044156041137956084, 'min_impurity_decrease': 0.41150490419403574, 'max_features': 0.978544147140736, 'subsample': 0.7900584597881247, 'dropout_rate': 0.4399544097028313, 'ccp_alpha': 0.09562270027871271}. Best is trial 677 with value: 0.7600100187343619.[0m
[32m[I 2022-04-14 15:25:35,837][0m Trial 861 finished with value: 0.7430082809953741 and parameters: {'loss': 'coxph', 'learning_rate': 0.005383448697192912, 'n_estimators': 389, 'criterion': 'friedman_mse', 'min_samples_split': 2, 'min_samples_leaf': 2, 'min_weight_fraction_leaf': 0.06150205491819448, 'min_impurity_decrease': 0.4489140812059483, 'max_features': 0.9580405587783873, 'subsample': 0.8352499461356339, 'dropout_rate': 0.4230722909563871, 'ccp_alpha': 0.0012910810822777388}. Best is trial 677 with value: 0.7600100187343619.[0m
[32m[I 2022-04-14 15:25:41,229][0m Trial 862 finished with value: 0.7096403551926693 and parameters: {'loss': 'coxph', 'learning_rate': 0.0032013236750733235, 'n_estimators': 461, 'criterion': 'friedman_mse', 'min_samples_split': 2, 'min_samples_leaf': 2, 'min_weight_fraction_leaf': 0.06750461749291795, 'min_impurity_decrease': 0.42829789020033693, 'max_features': 0.9320674137207134, 'subsample': 0.7637577612276751, 'dropout_rate': 0.9537008938645848, 'ccp_alpha': 0.18759541751038264}. Best is trial 677 with value: 0.7600100187343619.[0m
[32m[I 2022-04-14 15:25:56,457][0m Trial 863 finished with value: 0.7453574914654872 and parameters: {'loss': 'coxph', 'learning_rate': 0.060307479612367806, 'n_estimators': 372, 'criterion': 'friedman_mse', 'min_samples_split': 2, 'min_samples_leaf': 2, 'min_weight_fraction_leaf': 0.04064072635876547, 'min_impurity_decrease': 0.3860439977301432, 'max_features': 0.9745305592192166, 'subsample': 0.8096420099867635, 'dropout_rate': 0.39648357976920706, 'ccp_alpha': 0.10404367888841363}. Best is trial 677 with value: 0.7600100187343619.[0m
[32m[I 2022-04-14 15:26:11,263][0m Trial 864 finished with value: 0.5 and parameters: {'loss': 'coxph', 'learning_rate': 0.004452191894221021, 'n_estimators': 382, 'criterion': 'friedman_mse', 'min_samples_split': 2, 'min_samples_leaf': 2, 'min_weight_fraction_leaf': 0.05826790757227687, 'min_impurity_decrease': 0.6069777434907533, 'max_features': 0.9508983204109818, 'subsample': 0.7732564586249079, 'dropout_rate': 0.4506556459053026, 'ccp_alpha': 0.38434524414230214}. Best is trial 677 with value: 0.7600100187343619.[0m
[32m[I 2022-04-14 15:26:27,434][0m Trial 865 finished with value: 0.6670438541037118 and parameters: {'loss': 'coxph', 'learning_rate': 0.005946061728865655, 'n_estimators': 403, 'criterion': 'friedman_mse', 'min_samples_split': 2, 'min_samples_leaf': 2, 'min_weight_fraction_leaf': 0.0724794962964562, 'min_impurity_decrease': 0.4075612121433634, 'max_features': 0.9793226952972115, 'subsample': 0.7399386057586339, 'dropout_rate': 0.4672593202906661, 'ccp_alpha': 0.2507503689891902}. Best is trial 677 with value: 0.7600100187343619.[0m
[32m[I 2022-04-14 15:26:40,685][0m Trial 866 finished with value: 0.7504026887156341 and parameters: {'loss': 'coxph', 'learning_rate': 0.007068036566949085, 'n_estimators': 342, 'criterion': 'friedman_mse', 'min_samples_split': 4, 'min_samples_leaf': 2, 'min_weight_fraction_leaf': 0.0481019817246897, 'min_impurity_decrease': 0.7140570807879328, 'max_features': 0.9165495046849625, 'subsample': 0.7981278744478135, 'dropout_rate': 0.4293836879426352, 'ccp_alpha': 0.0025041722401793077}. Best is trial 677 with value: 0.7600100187343619.[0m
[32m[I 2022-04-14 15:26:57,956][0m Trial 867 finished with value: 0.7195240997286995 and parameters: {'loss': 'coxph', 'learning_rate': 0.003903699474795349, 'n_estimators': 372, 'criterion': 'friedman_mse', 'min_samples_split': 2, 'min_samples_leaf': 2, 'min_weight_fraction_leaf': 0.03397168887980252, 'min_impurity_decrease': 0.44232995757794336, 'max_features': 0.9381863882728215, 'subsample': 0.8313987154303172, 'dropout_rate': 0.4064948034195638, 'ccp_alpha': 0.1545959887227314}. Best is trial 677 with value: 0.7600100187343619.[0m
[32m[I 2022-04-14 15:27:13,880][0m Trial 868 finished with value: 0.5 and parameters: {'loss': 'coxph', 'learning_rate': 0.00313574213251817, 'n_estimators': 493, 'criterion': 'absolute_error', 'min_samples_split': 2, 'min_samples_leaf': 2, 'min_weight_fraction_leaf': 0.05299453787811705, 'min_impurity_decrease': 0.3651461136344764, 'max_features': 0.9513985045740376, 'subsample': 0.6794008074213757, 'dropout_rate': 0.7495342212531969, 'ccp_alpha': 0.07853413915073182}. Best is trial 677 with value: 0.7600100187343619.[0m
[32m[I 2022-04-14 15:27:33,242][0m Trial 869 finished with value: 0.7178792153021556 and parameters: {'loss': 'coxph', 'learning_rate': 0.008769783921867362, 'n_estimators': 435, 'criterion': 'friedman_mse', 'min_samples_split': 2, 'min_samples_leaf': 2, 'min_weight_fraction_leaf': 0.062142781018612786, 'min_impurity_decrease': 0.430434162669827, 'max_features': 0.9664082708596082, 'subsample': 0.7165324760816104, 'dropout_rate': 0.44805145767922183, 'ccp_alpha': 0.18442344896643723}. Best is trial 677 with value: 0.7600100187343619.[0m
[32m[I 2022-04-14 15:27:44,529][0m Trial 870 finished with value: 0.7436645353727266 and parameters: {'loss': 'coxph', 'learning_rate': 0.004907176872687944, 'n_estimators': 347, 'criterion': 'friedman_mse', 'min_samples_split': 2, 'min_samples_leaf': 2, 'min_weight_fraction_leaf': 0.07254403034262802, 'min_impurity_decrease': 0.45815290525660424, 'max_features': 0.9174778078821071, 'subsample': 0.8428182480560513, 'dropout_rate': 0.5110769703714111, 'ccp_alpha': 0.09115300621350633}. Best is trial 677 with value: 0.7600100187343619.[0m
[32m[I 2022-04-14 15:27:55,139][0m Trial 871 finished with value: 0.5 and parameters: {'loss': 'coxph', 'learning_rate': 0.0061849765441788895, 'n_estimators': 329, 'criterion': 'friedman_mse', 'min_samples_split': 2, 'min_samples_leaf': 2, 'min_weight_fraction_leaf': 0.03962434920922296, 'min_impurity_decrease': 0.39217468866689376, 'max_features': 0.980436649255371, 'subsample': 0.8126359061031581, 'dropout_rate': 0.47360537467182573, 'ccp_alpha': 1.6705991231860278}. Best is trial 677 with value: 0.7600100187343619.[0m
[32m[I 2022-04-14 15:28:11,080][0m Trial 872 finished with value: 0.751257911869803 and parameters: {'loss': 'coxph', 'learning_rate': 0.007609939440191015, 'n_estimators': 375, 'criterion': 'friedman_mse', 'min_samples_split': 2, 'min_samples_leaf': 2, 'min_weight_fraction_leaf': 0.05032670238837028, 'min_impurity_decrease': 0.41224275661965626, 'max_features': 0.9327382678855859, 'subsample': 0.7852518124793625, 'dropout_rate': 0.391514155992489, 'ccp_alpha': 0.0024179971661312926}. Best is trial 677 with value: 0.7600100187343619.[0m
[32m[I 2022-04-14 15:28:29,128][0m Trial 873 finished with value: 0.6241328416423209 and parameters: {'loss': 'coxph', 'learning_rate': 4.1843173500709995e-06, 'n_estimators': 401, 'criterion': 'friedman_mse', 'min_samples_split': 2, 'min_samples_leaf': 2, 'min_weight_fraction_leaf': 0.06558530804406008, 'min_impurity_decrease': 0.459958395832996, 'max_features': 0.9562406905103484, 'subsample': 0.7530879570658202, 'dropout_rate': 0.42259381508303073, 'ccp_alpha': 0.27659748047047933}. Best is trial 677 with value: 0.7600100187343619.[0m
[32m[I 2022-04-14 15:28:39,781][0m Trial 874 finished with value: 0.25223492533943487 and parameters: {'loss': 'squared', 'learning_rate': 0.004337601357304025, 'n_estimators': 329, 'criterion': 'friedman_mse', 'min_samples_split': 2, 'min_samples_leaf': 2, 'min_weight_fraction_leaf': 0.07255931852365796, 'min_impurity_decrease': 0.6507423946766331, 'max_features': 0.9156104863215123, 'subsample': 0.8567875557094409, 'dropout_rate': 0.49208132699272805, 'ccp_alpha': 0.09649310429521066}. Best is trial 677 with value: 0.7600100187343619.[0m
[32m[I 2022-04-14 15:29:13,068][0m Trial 875 finished with value: 0.7110203335536609 and parameters: {'loss': 'coxph', 'learning_rate': 0.003123807311414798, 'n_estimators': 546, 'criterion': 'friedman_mse', 'min_samples_split': 2, 'min_samples_leaf': 2, 'min_weight_fraction_leaf': 0.0420284954172262, 'min_impurity_decrease': 0.6272539479274073, 'max_features': 0.9804126354456453, 'subsample': 0.8173000509287074, 'dropout_rate': 0.43914044793743556, 'ccp_alpha': 0.18626125058472745}. Best is trial 677 with value: 0.7600100187343619.[0m
[32m[I 2022-04-14 15:29:20,058][0m Trial 876 finished with value: 0.7504799096091734 and parameters: {'loss': 'coxph', 'learning_rate': 0.00548015294619657, 'n_estimators': 212, 'criterion': 'friedman_mse', 'min_samples_split': 2, 'min_samples_leaf': 2, 'min_weight_fraction_leaf': 0.05652944303197288, 'min_impurity_decrease': 0.37176313582667936, 'max_features': 0.941203344175289, 'subsample': 0.7738457438783825, 'dropout_rate': 0.3798912081535229, 'ccp_alpha': 0.08398131424533688}. Best is trial 677 with value: 0.7600100187343619.[0m
[32m[I 2022-04-14 15:29:33,720][0m Trial 877 finished with value: 0.6850216014709729 and parameters: {'loss': 'coxph', 'learning_rate': 0.008396142603132498, 'n_estimators': 351, 'criterion': 'friedman_mse', 'min_samples_split': 2, 'min_samples_leaf': 2, 'min_weight_fraction_leaf': 0.07597517913462468, 'min_impurity_decrease': 0.41700678420137477, 'max_features': 0.961615877029464, 'subsample': 0.8758188734833406, 'dropout_rate': 0.4632339209881715, 'ccp_alpha': 0.17146532977048443}. Best is trial 677 with value: 0.7600100187343619.[0m
[32m[I 2022-04-14 15:29:36,975][0m Trial 878 finished with value: 0.7513793817372394 and parameters: {'loss': 'coxph', 'learning_rate': 0.0041092639172432095, 'n_estimators': 166, 'criterion': 'friedman_mse', 'min_samples_split': 2, 'min_samples_leaf': 2, 'min_weight_fraction_leaf': 0.03497413857738808, 'min_impurity_decrease': 0.8574051079342369, 'max_features': 0.9025438792481492, 'subsample': 0.8370886103833397, 'dropout_rate': 0.4106326233166538, 'ccp_alpha': 0.002384347651401586}. Best is trial 677 with value: 0.7600100187343619.[0m
[32m[I 2022-04-14 15:29:52,355][0m Trial 879 finished with value: 0.5049013916902899 and parameters: {'loss': 'coxph', 'learning_rate': 0.0730098476409447, 'n_estimators': 382, 'criterion': 'friedman_mse', 'min_samples_split': 2, 'min_samples_leaf': 2, 'min_weight_fraction_leaf': 0.04841351983943639, 'min_impurity_decrease': 0.44092852194053306, 'max_features': 0.3663581032077894, 'subsample': 0.7328858877854528, 'dropout_rate': 0.4308948446728967, 'ccp_alpha': 0.32512723675669947}. Best is trial 677 with value: 0.7600100187343619.[0m
[32m[I 2022-04-14 15:30:03,531][0m Trial 880 finished with value: 0.722879847497923 and parameters: {'loss': 'coxph', 'learning_rate': 0.047791117737627266, 'n_estimators': 325, 'criterion': 'friedman_mse', 'min_samples_split': 2, 'min_samples_leaf': 2, 'min_weight_fraction_leaf': 0.22425231685020858, 'min_impurity_decrease': 0.39895170775915056, 'max_features': 0.9262654569180526, 'subsample': 0.7988518083158989, 'dropout_rate': 0.4504193624121388, 'ccp_alpha': 0.08154283655942919}. Best is trial 677 with value: 0.7600100187343619.[0m
[32m[I 2022-04-14 15:30:19,187][0m Trial 881 finished with value: 0.5328286035390352 and parameters: {'loss': 'coxph', 'learning_rate': 0.006068824421910164, 'n_estimators': 362, 'criterion': 'friedman_mse', 'min_samples_split': 5, 'min_samples_leaf': 2, 'min_weight_fraction_leaf': 0.06029079547137797, 'min_impurity_decrease': 0.47186395066285597, 'max_features': 0.9815631656368717, 'subsample': 0.9026776309405491, 'dropout_rate': 0.3992998996907977, 'ccp_alpha': 0.23861744884181207}. Best is trial 677 with value: 0.7600100187343619.[0m
[32m[I 2022-04-14 15:30:31,608][0m Trial 882 finished with value: 0.5 and parameters: {'loss': 'coxph', 'learning_rate': 0.008802177076242234, 'n_estimators': 422, 'criterion': 'friedman_mse', 'min_samples_split': 2, 'min_samples_leaf': 2, 'min_weight_fraction_leaf': 0.07374448479674689, 'min_impurity_decrease': 0.423769441642992, 'max_features': 0.9535754471720945, 'subsample': 0.758539802166364, 'dropout_rate': 0.7145894106690537, 'ccp_alpha': 0.48756670614384023}. Best is trial 677 with value: 0.7600100187343619.[0m
