[32m[I 2022-04-13 11:44:58,313][0m Trial 881 finished with value: 0.7203943081692755 and parameters: {'splitter': 'random', 'min_samples_split': 0.2651195401039032, 'min_samples_leaf': 0.030742413194597286, 'min_weight_fraction_leaf': 0.23814456766663983, 'max_features': 0.5742854552710972}. Best is trial 156 with value: 0.860262530255716.[0m
[32m[I 2022-04-13 11:44:58,517][0m Trial 882 finished with value: 0.855608859465337 and parameters: {'splitter': 'random', 'min_samples_split': 0.25401827904217483, 'min_samples_leaf': 0.04753230210206309, 'min_weight_fraction_leaf': 0.07558629892348456, 'max_features': 0.6007450909680601}. Best is trial 156 with value: 0.860262530255716.[0m
[32m[I 2022-04-13 11:44:58,741][0m Trial 883 finished with value: 0.7999200547726107 and parameters: {'splitter': 'random', 'min_samples_split': 0.29861005293801324, 'min_samples_leaf': 0.0013061336490401846, 'min_weight_fraction_leaf': 0.04826060643952262, 'max_features': 0.4882266222398782}. Best is trial 156 with value: 0.860262530255716.[0m
[32m[I 2022-04-13 11:44:58,955][0m Trial 884 finished with value: 0.860262530255716 and parameters: {'splitter': 'random', 'min_samples_split': 0.2643615989337196, 'min_samples_leaf': 0.03289836988766594, 'min_weight_fraction_leaf': 0.05683385288238024, 'max_features': 0.5847706005569303}. Best is trial 156 with value: 0.860262530255716.[0m
[32m[I 2022-04-13 11:44:59,197][0m Trial 885 finished with value: 0.860262530255716 and parameters: {'splitter': 'random', 'min_samples_split': 0.27409097918852154, 'min_samples_leaf': 0.031221199304593432, 'min_weight_fraction_leaf': 0.055890814741919995, 'max_features': 0.5779511046162842}. Best is trial 156 with value: 0.860262530255716.[0m
[32m[I 2022-04-13 11:44:59,413][0m Trial 886 finished with value: 0.8538689421556729 and parameters: {'splitter': 'random', 'min_samples_split': 0.24711550857319997, 'min_samples_leaf': 0.11971424542595925, 'min_weight_fraction_leaf': 0.034307918032822085, 'max_features': 0.5243183235685441}. Best is trial 156 with value: 0.860262530255716.[0m
[32m[I 2022-04-13 11:44:59,602][0m Trial 887 finished with value: 0.8540625504336059 and parameters: {'splitter': 'random', 'min_samples_split': 0.27253226588693696, 'min_samples_leaf': 0.026128892676758955, 'min_weight_fraction_leaf': 0.0027933120485134216, 'max_features': 0.5275222468855674}. Best is trial 156 with value: 0.860262530255716.[0m
[32m[I 2022-04-13 11:44:59,735][0m Trial 888 finished with value: 0.8100552370527392 and parameters: {'splitter': 'random', 'min_samples_split': 0.2853079226561022, 'min_samples_leaf': 0.04141696490697371, 'min_weight_fraction_leaf': 0.06102318317570972, 'max_features': 0.6605138436906577}. Best is trial 156 with value: 0.860262530255716.[0m
[32m[I 2022-04-13 11:44:59,885][0m Trial 889 finished with value: 0.8272976824097471 and parameters: {'splitter': 'best', 'min_samples_split': 0.28712107649998875, 'min_samples_leaf': 0.0013312301744746527, 'min_weight_fraction_leaf': 0.07698254979910436, 'max_features': 0.6445321686860891}. Best is trial 156 with value: 0.860262530255716.[0m
[32m[I 2022-04-13 11:44:59,965][0m Trial 890 finished with value: 0.860262530255716 and parameters: {'splitter': 'random', 'min_samples_split': 0.26550114098525646, 'min_samples_leaf': 0.0536211117039565, 'min_weight_fraction_leaf': 0.0624540604786756, 'max_features': 0.5912582559669194}. Best is trial 156 with value: 0.860262530255716.[0m
[32m[I 2022-04-13 11:45:00,040][0m Trial 891 finished with value: 0.855608859465337 and parameters: {'splitter': 'random', 'min_samples_split': 0.2550184985654666, 'min_samples_leaf': 0.010651540409328123, 'min_weight_fraction_leaf': 0.04789609458948814, 'max_features': 0.5534020984690833}. Best is trial 156 with value: 0.860262530255716.[0m
[32m[I 2022-04-13 11:45:00,108][0m Trial 892 finished with value: 0.860262530255716 and parameters: {'splitter': 'random', 'min_samples_split': 0.2668090612430003, 'min_samples_leaf': 0.06959408986285388, 'min_weight_fraction_leaf': 0.07626612407366645, 'max_features': 0.6169782799056156}. Best is trial 156 with value: 0.860262530255716.[0m
[32m[I 2022-04-13 11:45:00,173][0m Trial 893 finished with value: 0.8544192216908126 and parameters: {'splitter': 'random', 'min_samples_split': 0.2414092333587594, 'min_samples_leaf': 0.022230429280570375, 'min_weight_fraction_leaf': 0.027101524420879507, 'max_features': 0.5159820297646307}. Best is trial 156 with value: 0.860262530255716.[0m
[32m[I 2022-04-13 11:45:00,388][0m Trial 894 finished with value: 0.855608859465337 and parameters: {'splitter': 'random', 'min_samples_split': 0.2572644615727789, 'min_samples_leaf': 0.0592446163116819, 'min_weight_fraction_leaf': 9.557022364609785e-05, 'max_features': 0.5952112084404539}. Best is trial 156 with value: 0.860262530255716.[0m
[32m[I 2022-04-13 11:45:00,548][0m Trial 895 finished with value: 0.8537871744804019 and parameters: {'splitter': 'random', 'min_samples_split': 0.2813419817640903, 'min_samples_leaf': 0.0012295184415685337, 'min_weight_fraction_leaf': 0.06389296251478731, 'max_features': 0.5665683281559777}. Best is trial 156 with value: 0.860262530255716.[0m
[32m[I 2022-04-13 11:45:00,707][0m Trial 896 finished with value: 0.6334936025301521 and parameters: {'splitter': 'random', 'min_samples_split': 0.2633881182248315, 'min_samples_leaf': 0.011346136980990677, 'min_weight_fraction_leaf': 0.2944667400408851, 'max_features': 0.5277589075522678}. Best is trial 156 with value: 0.860262530255716.[0m
[32m[I 2022-04-13 11:45:00,866][0m Trial 897 finished with value: 0.8544192216908126 and parameters: {'splitter': 'random', 'min_samples_split': 0.2464491084801264, 'min_samples_leaf': 0.022022755446020816, 'min_weight_fraction_leaf': 0.037604923265133754, 'max_features': 0.5477112318921155}. Best is trial 156 with value: 0.860262530255716.[0m
[32m[I 2022-04-13 11:45:00,995][0m Trial 898 finished with value: 0.8537871744804019 and parameters: {'splitter': 'random', 'min_samples_split': 0.27986248409685743, 'min_samples_leaf': 0.011204399753973575, 'min_weight_fraction_leaf': 0.09003666658668164, 'max_features': 0.5850742942679559}. Best is trial 156 with value: 0.860262530255716.[0m
[32m[I 2022-04-13 11:45:01,124][0m Trial 899 finished with value: 0.8495779719052834 and parameters: {'splitter': 'random', 'min_samples_split': 0.29742922383985454, 'min_samples_leaf': 0.048090830880560355, 'min_weight_fraction_leaf': 0.038876312624304424, 'max_features': 0.5801219624389051}. Best is trial 156 with value: 0.860262530255716.[0m
[32m[I 2022-04-13 11:45:01,286][0m Trial 900 finished with value: 0.7080959450186034 and parameters: {'splitter': 'random', 'min_samples_split': 0.07288934957688151, 'min_samples_leaf': 0.06221415896999762, 'min_weight_fraction_leaf': 0.4629134096830192, 'max_features': 0.6299587429686726}. Best is trial 156 with value: 0.860262530255716.[0m
[32m[I 2022-04-13 11:45:01,403][0m Trial 901 finished with value: 0.6332669867606551 and parameters: {'splitter': 'random', 'min_samples_split': 0.26297510966151966, 'min_samples_leaf': 0.3150660901755785, 'min_weight_fraction_leaf': 0.021714411729029614, 'max_features': 0.4491230159652173}. Best is trial 156 with value: 0.860262530255716.[0m
[32m[I 2022-04-13 11:45:01,523][0m Trial 902 finished with value: 0.7426175290362615 and parameters: {'splitter': 'random', 'min_samples_split': 0.4622289421423802, 'min_samples_leaf': 0.012528705861799503, 'min_weight_fraction_leaf': 0.08418665830862712, 'max_features': 0.59119530515803}. Best is trial 156 with value: 0.860262530255716.[0m
[32m[I 2022-04-13 11:45:01,623][0m Trial 903 finished with value: 0.7929413262536216 and parameters: {'splitter': 'random', 'min_samples_split': 0.25338614372266155, 'min_samples_leaf': 0.0362742530801722, 'min_weight_fraction_leaf': 0.0440937648776529, 'max_features': 0.35655097640919403}. Best is trial 156 with value: 0.860262530255716.[0m
[32m[I 2022-04-13 11:45:01,714][0m Trial 904 finished with value: 0.8540625504336059 and parameters: {'splitter': 'random', 'min_samples_split': 0.2698058108228056, 'min_samples_leaf': 0.0015826939248708427, 'min_weight_fraction_leaf': 0.01148744836795556, 'max_features': 0.5212579295067172}. Best is trial 156 with value: 0.860262530255716.[0m
[32m[I 2022-04-13 11:45:01,808][0m Trial 905 finished with value: 0.8536735077998788 and parameters: {'splitter': 'random', 'min_samples_split': 0.2742730653884069, 'min_samples_leaf': 0.0019372350711444435, 'min_weight_fraction_leaf': 0.08319242079805775, 'max_features': 0.5664018653973494}. Best is trial 156 with value: 0.860262530255716.[0m
[32m[I 2022-04-13 11:45:01,954][0m Trial 906 finished with value: 0.860262530255716 and parameters: {'splitter': 'random', 'min_samples_split': 0.2728650963563303, 'min_samples_leaf': 0.03509069811224646, 'min_weight_fraction_leaf': 0.05834127575524824, 'max_features': 0.5706888746158164}. Best is trial 156 with value: 0.860262530255716.[0m
[32m[I 2022-04-13 11:45:02,123][0m Trial 907 finished with value: 0.8470183879815781 and parameters: {'splitter': 'best', 'min_samples_split': 0.29079151769504596, 'min_samples_leaf': 0.03171732085482571, 'min_weight_fraction_leaf': 0.05551283592784662, 'max_features': 0.5605606264254454}. Best is trial 156 with value: 0.860262530255716.[0m
[32m[I 2022-04-13 11:45:02,264][0m Trial 908 finished with value: 0.860262530255716 and parameters: {'splitter': 'random', 'min_samples_split': 0.26496817033798237, 'min_samples_leaf': 0.07493108334982489, 'min_weight_fraction_leaf': 0.04770576863697389, 'max_features': 0.5416923892792559}. Best is trial 156 with value: 0.860262530255716.[0m
[32m[I 2022-04-13 11:45:02,412][0m Trial 909 finished with value: 0.8255882966785919 and parameters: {'splitter': 'random', 'min_samples_split': 0.22830339903039576, 'min_samples_leaf': 0.024604922290578847, 'min_weight_fraction_leaf': 0.0696888011152959, 'max_features': 0.6268475219844429}. Best is trial 156 with value: 0.860262530255716.[0m
[32m[I 2022-04-13 11:45:02,560][0m Trial 910 finished with value: 0.8515949699867061 and parameters: {'splitter': 'random', 'min_samples_split': 0.30589238640724764, 'min_samples_leaf': 0.008432210241103955, 'min_weight_fraction_leaf': 0.06211680651085157, 'max_features': 0.6116420885418393}. Best is trial 156 with value: 0.860262530255716.[0m
[32m[I 2022-04-13 11:45:02,711][0m Trial 911 finished with value: 0.7999200547726107 and parameters: {'splitter': 'random', 'min_samples_split': 0.2890113572010165, 'min_samples_leaf': 0.061191767119643144, 'min_weight_fraction_leaf': 0.04987700411589871, 'max_features': 0.4965296240061048}. Best is trial 156 with value: 0.860262530255716.[0m
[32m[I 2022-04-13 11:45:02,849][0m Trial 912 finished with value: 0.8539147974034123 and parameters: {'splitter': 'random', 'min_samples_split': 0.27344498371254483, 'min_samples_leaf': 0.04451847197078048, 'min_weight_fraction_leaf': 0.02139734288228434, 'max_features': 0.9276426439413025}. Best is trial 156 with value: 0.860262530255716.[0m
[32m[I 2022-04-13 11:45:02,908][0m Trial 913 finished with value: 0.855608859465337 and parameters: {'splitter': 'random', 'min_samples_split': 0.2546335890836639, 'min_samples_leaf': 0.050704273778386884, 'min_weight_fraction_leaf': 0.04997103681051004, 'max_features': 0.5726744605785169}. Best is trial 156 with value: 0.860262530255716.[0m
[32m[I 2022-04-13 11:45:03,018][0m Trial 914 finished with value: 0.8100552370527392 and parameters: {'splitter': 'random', 'min_samples_split': 0.2821804223593143, 'min_samples_leaf': 0.06234955722402716, 'min_weight_fraction_leaf': 0.06222147507081542, 'max_features': 0.648422387230402}. Best is trial 156 with value: 0.860262530255716.[0m
[32m[I 2022-04-13 11:45:03,075][0m Trial 915 finished with value: 0.855608859465337 and parameters: {'splitter': 'random', 'min_samples_split': 0.2592294171873923, 'min_samples_leaf': 0.015872817236644892, 'min_weight_fraction_leaf': 0.03467147042198163, 'max_features': 0.5314391795523324}. Best is trial 156 with value: 0.860262530255716.[0m
[32m[I 2022-04-13 11:45:03,167][0m Trial 916 finished with value: 0.633883214711366 and parameters: {'splitter': 'random', 'min_samples_split': 0.29858347859624895, 'min_samples_leaf': 0.48467240034543857, 'min_weight_fraction_leaf': 0.04619012096379679, 'max_features': 0.5934736349228857}. Best is trial 156 with value: 0.860262530255716.[0m
[32m[I 2022-04-13 11:45:03,235][0m Trial 917 finished with value: 0.8501522850093632 and parameters: {'splitter': 'random', 'min_samples_split': 0.2434406119214959, 'min_samples_leaf': 0.002103234148524657, 'min_weight_fraction_leaf': 0.09642873701771598, 'max_features': 0.5702834634292798}. Best is trial 156 with value: 0.860262530255716.[0m
[32m[I 2022-04-13 11:45:03,311][0m Trial 918 finished with value: 0.8537871744804019 and parameters: {'splitter': 'random', 'min_samples_split': 0.2802575935473759, 'min_samples_leaf': 0.011620827108222848, 'min_weight_fraction_leaf': 0.07566283170194915, 'max_features': 0.5605436630307252}. Best is trial 156 with value: 0.860262530255716.[0m
[32m[I 2022-04-13 11:45:03,416][0m Trial 919 finished with value: 0.8490198370094999 and parameters: {'splitter': 'random', 'min_samples_split': 0.25490808608996235, 'min_samples_leaf': 0.03654271941994053, 'min_weight_fraction_leaf': 0.0819850737794572, 'max_features': 0.5703554731645202}. Best is trial 156 with value: 0.860262530255716.[0m
[32m[I 2022-04-13 11:45:03,510][0m Trial 920 finished with value: 0.8204132025252238 and parameters: {'splitter': 'random', 'min_samples_split': 0.2628249706388946, 'min_samples_leaf': 0.024576745058065917, 'min_weight_fraction_leaf': 0.027853506449221705, 'max_features': 0.4273239141769151}. Best is trial 156 with value: 0.860262530255716.[0m
[32m[I 2022-04-13 11:45:03,577][0m Trial 921 finished with value: 0.860262530255716 and parameters: {'splitter': 'random', 'min_samples_split': 0.26677681563207706, 'min_samples_leaf': 0.052637500267055486, 'min_weight_fraction_leaf': 0.04206895668841895, 'max_features': 0.5332463960240509}. Best is trial 156 with value: 0.860262530255716.[0m
[32m[I 2022-04-13 11:45:03,675][0m Trial 922 finished with value: 0.7865929809567938 and parameters: {'splitter': 'random', 'min_samples_split': 0.2855411647004604, 'min_samples_leaf': 0.04056016050382866, 'min_weight_fraction_leaf': 0.06772791121418921, 'max_features': 0.478349818597862}. Best is trial 156 with value: 0.860262530255716.[0m
[32m[I 2022-04-13 11:45:03,804][0m Trial 923 finished with value: 0.8536735077998788 and parameters: {'splitter': 'random', 'min_samples_split': 0.2682703045419728, 'min_samples_leaf': 0.0845812784720543, 'min_weight_fraction_leaf': 0.05125348967034593, 'max_features': 0.5486359761401309}. Best is trial 156 with value: 0.860262530255716.[0m
[32m[I 2022-04-13 11:45:03,967][0m Trial 924 finished with value: 0.8530273199001748 and parameters: {'splitter': 'random', 'min_samples_split': 0.39592707330151666, 'min_samples_leaf': 0.04019280149353496, 'min_weight_fraction_leaf': 0.07304054099036647, 'max_features': 0.5542264203042989}. Best is trial 156 with value: 0.860262530255716.[0m
[32m[I 2022-04-13 11:45:04,060][0m Trial 925 finished with value: 0.7999200547726107 and parameters: {'splitter': 'random', 'min_samples_split': 0.27908979647674514, 'min_samples_leaf': 0.04534190612971863, 'min_weight_fraction_leaf': 0.03836697904365582, 'max_features': 0.47067648607349855}. Best is trial 156 with value: 0.860262530255716.[0m
[32m[I 2022-04-13 11:45:04,115][0m Trial 926 finished with value: 0.8393809361313925 and parameters: {'splitter': 'best', 'min_samples_split': 0.25520323488058017, 'min_samples_leaf': 0.016414280805310405, 'min_weight_fraction_leaf': 0.04468446687593995, 'max_features': 0.5372141384583766}. Best is trial 156 with value: 0.860262530255716.[0m
[32m[I 2022-04-13 11:45:04,166][0m Trial 927 finished with value: 0.8537871744804019 and parameters: {'splitter': 'random', 'min_samples_split': 0.2770884865814714, 'min_samples_leaf': 0.011157206088247678, 'min_weight_fraction_leaf': 0.03445604692589472, 'max_features': 0.5345874243046572}. Best is trial 156 with value: 0.860262530255716.[0m
[32m[I 2022-04-13 11:45:04,216][0m Trial 928 finished with value: 0.860262530255716 and parameters: {'splitter': 'random', 'min_samples_split': 0.2730989116209639, 'min_samples_leaf': 0.04176474302518334, 'min_weight_fraction_leaf': 0.05759410478049745, 'max_features': 0.5549571505385109}. Best is trial 156 with value: 0.860262530255716.[0m
[32m[I 2022-04-13 11:45:04,267][0m Trial 929 finished with value: 0.7865929809567938 and parameters: {'splitter': 'random', 'min_samples_split': 0.28988991012709486, 'min_samples_leaf': 0.05744738052482008, 'min_weight_fraction_leaf': 0.0688663591326241, 'max_features': 0.4546331152008797}. Best is trial 156 with value: 0.860262530255716.[0m
[32m[I 2022-04-13 11:45:04,324][0m Trial 930 finished with value: 0.7426175290362615 and parameters: {'splitter': 'random', 'min_samples_split': 0.29786074322549777, 'min_samples_leaf': 0.021363942487490167, 'min_weight_fraction_leaf': 0.18941481178288838, 'max_features': 0.500085195284049}. Best is trial 156 with value: 0.860262530255716.[0m
[32m[I 2022-04-13 11:45:04,376][0m Trial 931 finished with value: 0.8243144312662244 and parameters: {'splitter': 'random', 'min_samples_split': 0.24975212960531762, 'min_samples_leaf': 0.01715412100750548, 'min_weight_fraction_leaf': 0.0608593219875746, 'max_features': 0.6799339319337417}. Best is trial 156 with value: 0.860262530255716.[0m
[32m[I 2022-04-13 11:45:04,426][0m Trial 932 finished with value: 0.8541689983710665 and parameters: {'splitter': 'random', 'min_samples_split': 0.2412188299428338, 'min_samples_leaf': 0.008785045722466498, 'min_weight_fraction_leaf': 0.04258451786747936, 'max_features': 0.5217378560650247}. Best is trial 156 with value: 0.860262530255716.[0m
[32m[I 2022-04-13 11:45:04,478][0m Trial 933 finished with value: 0.8541689983710665 and parameters: {'splitter': 'random', 'min_samples_split': 0.247122652686705, 'min_samples_leaf': 0.0021180281490341107, 'min_weight_fraction_leaf': 0.07011554739764571, 'max_features': 0.5305990970007364}. Best is trial 156 with value: 0.860262530255716.[0m
[32m[I 2022-04-13 11:45:04,532][0m Trial 934 finished with value: 0.8190093423410939 and parameters: {'splitter': 'random', 'min_samples_split': 0.2613686320985982, 'min_samples_leaf': 0.01437460884332997, 'min_weight_fraction_leaf': 0.0828267583718911, 'max_features': 0.6282205699136848}. Best is trial 156 with value: 0.860262530255716.[0m
[32m[I 2022-04-13 11:45:04,583][0m Trial 935 finished with value: 0.860262530255716 and parameters: {'splitter': 'random', 'min_samples_split': 0.275514644285338, 'min_samples_leaf': 0.029805379905921338, 'min_weight_fraction_leaf': 0.07558758319381352, 'max_features': 0.6125005355953165}. Best is trial 156 with value: 0.860262530255716.[0m
[32m[I 2022-04-13 11:45:04,637][0m Trial 936 finished with value: 0.8490198370094999 and parameters: {'splitter': 'random', 'min_samples_split': 0.2620456589939858, 'min_samples_leaf': 0.00975544406226202, 'min_weight_fraction_leaf': 0.08833118488383647, 'max_features': 0.5520584461042731}. Best is trial 156 with value: 0.860262530255716.[0m
[32m[I 2022-04-13 11:45:04,688][0m Trial 937 finished with value: 0.8569159849035302 and parameters: {'splitter': 'random', 'min_samples_split': 0.27052497272291626, 'min_samples_leaf': 0.0075282549786256075, 'min_weight_fraction_leaf': 0.11652114724327231, 'max_features': 0.5925038602765407}. Best is trial 156 with value: 0.860262530255716.[0m
[32m[I 2022-04-13 11:45:04,739][0m Trial 938 finished with value: 0.8528897659343441 and parameters: {'splitter': 'random', 'min_samples_split': 0.3088416835491263, 'min_samples_leaf': 0.09829470704912667, 'min_weight_fraction_leaf': 0.06526208975057751, 'max_features': 0.5999471759411013}. Best is trial 156 with value: 0.860262530255716.[0m
[32m[I 2022-04-13 11:45:04,789][0m Trial 939 finished with value: 0.8537871744804019 and parameters: {'splitter': 'random', 'min_samples_split': 0.2871633380904087, 'min_samples_leaf': 0.0484224937646271, 'min_weight_fraction_leaf': 0.05738444543382361, 'max_features': 0.6156243756066131}. Best is trial 156 with value: 0.860262530255716.[0m
[32m[I 2022-04-13 11:45:04,838][0m Trial 940 finished with value: 0.8541689983710665 and parameters: {'splitter': 'random', 'min_samples_split': 0.23526513368593271, 'min_samples_leaf': 0.07112897409516192, 'min_weight_fraction_leaf': 0.0611189921824162, 'max_features': 0.5049558314890951}. Best is trial 156 with value: 0.860262530255716.[0m
[32m[I 2022-04-13 11:45:04,888][0m Trial 941 finished with value: 0.860262530255716 and parameters: {'splitter': 'random', 'min_samples_split': 0.2712220407973024, 'min_samples_leaf': 0.026516307850326406, 'min_weight_fraction_leaf': 0.0730126997764547, 'max_features': 0.5525195560755267}. Best is trial 156 with value: 0.860262530255716.[0m
[32m[I 2022-04-13 11:45:04,938][0m Trial 942 finished with value: 0.860262530255716 and parameters: {'splitter': 'random', 'min_samples_split': 0.26499024970062357, 'min_samples_leaf': 0.03216677316778127, 'min_weight_fraction_leaf': 0.0666436863684176, 'max_features': 0.5106126647426491}. Best is trial 156 with value: 0.860262530255716.[0m
[32m[I 2022-04-13 11:45:04,988][0m Trial 943 finished with value: 0.6177441950575457 and parameters: {'splitter': 'random', 'min_samples_split': 0.2858074602546491, 'min_samples_leaf': 0.4592180982855927, 'min_weight_fraction_leaf': 0.05347822357229956, 'max_features': 0.5360406591125542}. Best is trial 156 with value: 0.860262530255716.[0m
