[32m[I 2022-04-15 18:44:48,934][0m Trial 102 finished with value: 0.8561473154876748 and parameters: {'n_hidden': 128, 'mixture_components': 1, 'use_sparse_layer': False, 'use_batchnorm': True, 'use_dropout': True, 'dropout': 0.61288485379945, 'mlp_size_1': 0, 'mlp_size_2': 1, 'mlp_size_3': 1, 'kernel': 'Exponential', 'loss_name': 'NLLLoss'}. Best is trial 86 with value: 0.8684701330397244.[0m
[32m[I 2022-04-15 18:49:15,555][0m Trial 103 finished with value: 0.8601142150242284 and parameters: {'n_hidden': 128, 'mixture_components': 1, 'use_sparse_layer': False, 'use_batchnorm': True, 'use_dropout': True, 'dropout': 0.5414790678706007, 'mlp_size_1': 0, 'mlp_size_2': 0, 'mlp_size_3': 1, 'kernel': 'Exponential', 'loss_name': 'NLLLoss'}. Best is trial 86 with value: 0.8684701330397244.[0m
[32m[I 2022-04-15 18:55:03,547][0m Trial 104 finished with value: 0.8539481042037949 and parameters: {'n_hidden': 128, 'mixture_components': 1, 'use_sparse_layer': False, 'use_batchnorm': True, 'use_dropout': True, 'dropout': 0.7286862123382809, 'mlp_size_1': 0, 'mlp_size_2': 1, 'mlp_size_3': 1, 'kernel': 'Exponential', 'loss_name': 'NLLLoss'}. Best is trial 86 with value: 0.8684701330397244.[0m
[32m[I 2022-04-15 18:59:38,774][0m Trial 105 finished with value: 0.8514588099955216 and parameters: {'n_hidden': 128, 'mixture_components': 2, 'use_sparse_layer': False, 'use_batchnorm': True, 'use_dropout': True, 'dropout': 0.4242163425020238, 'mlp_size_1': 0, 'mlp_size_2': 1, 'mlp_size_3': 1, 'kernel': 'Exponential', 'loss_name': 'NLLLoss'}. Best is trial 86 with value: 0.8684701330397244.[0m
[32m[I 2022-04-15 19:07:31,955][0m Trial 106 finished with value: 0.8595394815819446 and parameters: {'n_hidden': 128, 'mixture_components': 1, 'use_sparse_layer': False, 'use_batchnorm': True, 'use_dropout': True, 'dropout': 0.8039029576128249, 'mlp_size_1': 0, 'mlp_size_2': 1, 'mlp_size_3': 1, 'kernel': 'Exponential', 'loss_name': 'NLLLoss'}. Best is trial 86 with value: 0.8684701330397244.[0m
[32m[I 2022-04-15 19:08:38,400][0m Trial 107 finished with value: 0.5648473762342978 and parameters: {'n_hidden': 128, 'mixture_components': 2, 'use_sparse_layer': False, 'use_batchnorm': False, 'use_dropout': True, 'dropout': 0.6379966361708953, 'mlp_size_1': 0, 'mlp_size_2': 1, 'mlp_size_3': 2, 'kernel': 'Gumbel', 'loss_name': 'NLLLoss'}. Best is trial 86 with value: 0.8684701330397244.[0m
[32m[I 2022-04-15 19:11:44,951][0m Trial 108 finished with value: 0.8475167960530487 and parameters: {'n_hidden': 256, 'mixture_components': 3, 'use_sparse_layer': False, 'use_batchnorm': True, 'use_dropout': True, 'dropout': 0.548025965134132, 'mlp_size_1': 1, 'mlp_size_2': 0, 'mlp_size_3': 1, 'kernel': 'Exponential', 'loss_name': 'NLLLoss'}. Best is trial 86 with value: 0.8684701330397244.[0m
[32m[I 2022-04-15 19:18:12,616][0m Trial 109 finished with value: 0.741264173986569 and parameters: {'n_hidden': 128, 'mixture_components': 1, 'use_sparse_layer': False, 'use_batchnorm': True, 'use_dropout': True, 'dropout': 0.8818859051494049, 'mlp_size_1': 0, 'mlp_size_2': 1, 'mlp_size_3': 1, 'kernel': 'Exponential', 'loss_name': 'NLLLoss'}. Best is trial 86 with value: 0.8684701330397244.[0m
[32m[I 2022-04-15 19:21:44,121][0m Trial 110 finished with value: 0.7482190279659796 and parameters: {'n_hidden': 2048, 'mixture_components': 2, 'use_sparse_layer': False, 'use_batchnorm': True, 'use_dropout': True, 'dropout': 0.4770625980381208, 'mlp_size_1': 1, 'mlp_size_2': 3, 'mlp_size_3': 3, 'kernel': 'Exponential', 'loss_name': 'NLLLoss'}. Best is trial 86 with value: 0.8684701330397244.[0m
[32m[I 2022-04-15 19:26:40,772][0m Trial 111 finished with value: 0.8616541065963697 and parameters: {'n_hidden': 128, 'mixture_components': 1, 'use_sparse_layer': False, 'use_batchnorm': True, 'use_dropout': True, 'dropout': 0.5784562195431318, 'mlp_size_1': 0, 'mlp_size_2': 1, 'mlp_size_3': 1, 'kernel': 'Exponential', 'loss_name': 'NLLLoss'}. Best is trial 86 with value: 0.8684701330397244.[0m
[32m[I 2022-04-15 19:31:55,765][0m Trial 112 finished with value: 0.8642270334291974 and parameters: {'n_hidden': 128, 'mixture_components': 1, 'use_sparse_layer': False, 'use_batchnorm': True, 'use_dropout': True, 'dropout': 0.579468001083267, 'mlp_size_1': 0, 'mlp_size_2': 1, 'mlp_size_3': 1, 'kernel': 'Exponential', 'loss_name': 'NLLLoss'}. Best is trial 86 with value: 0.8684701330397244.[0m
[32m[I 2022-04-15 19:36:48,358][0m Trial 113 finished with value: 0.8635947413453525 and parameters: {'n_hidden': 128, 'mixture_components': 1, 'use_sparse_layer': False, 'use_batchnorm': True, 'use_dropout': True, 'dropout': 0.6554625021161439, 'mlp_size_1': 0, 'mlp_size_2': 1, 'mlp_size_3': 1, 'kernel': 'Exponential', 'loss_name': 'NLLLoss'}. Best is trial 86 with value: 0.8684701330397244.[0m
[32m[I 2022-04-15 19:42:10,013][0m Trial 114 finished with value: 0.8556945382612021 and parameters: {'n_hidden': 128, 'mixture_components': 3, 'use_sparse_layer': False, 'use_batchnorm': True, 'use_dropout': True, 'dropout': 0.68884188846254, 'mlp_size_1': 0, 'mlp_size_2': 1, 'mlp_size_3': 1, 'kernel': 'Exponential', 'loss_name': 'NLLLoss'}. Best is trial 86 with value: 0.8684701330397244.[0m
[32m[I 2022-04-15 19:47:25,324][0m Trial 115 finished with value: 0.6394190388818596 and parameters: {'n_hidden': 512, 'mixture_components': 2, 'use_sparse_layer': False, 'use_batchnorm': True, 'use_dropout': True, 'dropout': 0.6455140941570756, 'mlp_size_1': 1, 'mlp_size_2': 0, 'mlp_size_3': 1, 'kernel': 'LogLogistic', 'loss_name': 'NLLLoss'}. Best is trial 86 with value: 0.8684701330397244.[0m
[32m[I 2022-04-15 19:53:53,401][0m Trial 116 finished with value: 0.7005723597254625 and parameters: {'n_hidden': 32, 'mixture_components': 1, 'use_sparse_layer': False, 'use_batchnorm': True, 'use_dropout': True, 'dropout': 0.7039265248638705, 'mlp_size_1': 0, 'mlp_size_2': 1, 'mlp_size_3': 1, 'kernel': 'Exponential', 'loss_name': 'NLLLoss'}. Best is trial 86 with value: 0.8684701330397244.[0m
[32m[I 2022-04-15 19:57:59,590][0m Trial 117 finished with value: 0.824848817073692 and parameters: {'n_hidden': 1024, 'mixture_components': 10, 'use_sparse_layer': False, 'use_batchnorm': True, 'use_dropout': True, 'dropout': 0.38579441695052885, 'mlp_size_1': 1, 'mlp_size_2': 3, 'mlp_size_3': 2, 'kernel': 'Exponential', 'loss_name': 'NLLLoss'}. Best is trial 86 with value: 0.8684701330397244.[0m
[32m[I 2022-04-15 20:03:20,119][0m Trial 118 finished with value: 0.8598834463046916 and parameters: {'n_hidden': 64, 'mixture_components': 1, 'use_sparse_layer': False, 'use_batchnorm': True, 'use_dropout': True, 'dropout': 0.7606433184943415, 'mlp_size_1': 0, 'mlp_size_2': 2, 'mlp_size_3': 0, 'kernel': 'Exponential', 'loss_name': 'NLLLoss'}. Best is trial 86 with value: 0.8684701330397244.[0m
[32m[I 2022-04-15 20:08:41,133][0m Trial 119 finished with value: 0.6081331299188586 and parameters: {'n_hidden': 32, 'mixture_components': 1, 'use_sparse_layer': False, 'use_batchnorm': True, 'use_dropout': True, 'dropout': 0.622739595071213, 'mlp_size_1': 0, 'mlp_size_2': 2, 'mlp_size_3': 0, 'kernel': 'Normal', 'loss_name': 'NLLLoss'}. Best is trial 86 with value: 0.8684701330397244.[0m
[32m[I 2022-04-15 20:14:39,097][0m Trial 120 finished with value: 0.8593539986544002 and parameters: {'n_hidden': 128, 'mixture_components': 2, 'use_sparse_layer': False, 'use_batchnorm': True, 'use_dropout': True, 'dropout': 0.5993839161281922, 'mlp_size_1': 0, 'mlp_size_2': 1, 'mlp_size_3': 1, 'kernel': 'Exponential', 'loss_name': 'NLLLoss'}. Best is trial 86 with value: 0.8684701330397244.[0m
[32m[I 2022-04-15 20:20:49,699][0m Trial 121 finished with value: 0.8564403842507394 and parameters: {'n_hidden': 128, 'mixture_components': 1, 'use_sparse_layer': False, 'use_batchnorm': True, 'use_dropout': True, 'dropout': 0.5256463411162419, 'mlp_size_1': 0, 'mlp_size_2': 1, 'mlp_size_3': 1, 'kernel': 'Exponential', 'loss_name': 'NLLLoss'}. Best is trial 86 with value: 0.8684701330397244.[0m
[32m[I 2022-04-15 20:26:21,641][0m Trial 122 finished with value: 0.8603895937973103 and parameters: {'n_hidden': 128, 'mixture_components': 1, 'use_sparse_layer': False, 'use_batchnorm': True, 'use_dropout': True, 'dropout': 0.6668417289476494, 'mlp_size_1': 0, 'mlp_size_2': 1, 'mlp_size_3': 1, 'kernel': 'Exponential', 'loss_name': 'NLLLoss'}. Best is trial 86 with value: 0.8684701330397244.[0m
[32m[I 2022-04-15 20:31:48,439][0m Trial 123 finished with value: 0.8635028645511011 and parameters: {'n_hidden': 128, 'mixture_components': 1, 'use_sparse_layer': False, 'use_batchnorm': True, 'use_dropout': True, 'dropout': 0.5008174507806127, 'mlp_size_1': 0, 'mlp_size_2': 1, 'mlp_size_3': 1, 'kernel': 'Exponential', 'loss_name': 'NLLLoss'}. Best is trial 86 with value: 0.8684701330397244.[0m
[32m[I 2022-04-15 20:38:16,061][0m Trial 124 finished with value: 0.8482447895117327 and parameters: {'n_hidden': 128, 'mixture_components': 2, 'use_sparse_layer': False, 'use_batchnorm': True, 'use_dropout': True, 'dropout': 0.4980479783146967, 'mlp_size_1': 0, 'mlp_size_2': 1, 'mlp_size_3': 1, 'kernel': 'Weibull', 'loss_name': 'NLLLoss'}. Best is trial 86 with value: 0.8684701330397244.[0m
[32m[I 2022-04-15 20:45:16,691][0m Trial 125 finished with value: 0.7576018463909283 and parameters: {'n_hidden': 32, 'mixture_components': 1, 'use_sparse_layer': False, 'use_batchnorm': True, 'use_dropout': True, 'dropout': 0.5881772263775524, 'mlp_size_1': 0, 'mlp_size_2': 1, 'mlp_size_3': 1, 'kernel': 'Exponential', 'loss_name': 'NLLLoss'}. Best is trial 86 with value: 0.8684701330397244.[0m
[32m[I 2022-04-15 20:51:29,696][0m Trial 126 finished with value: 0.8674114796657093 and parameters: {'n_hidden': 32, 'mixture_components': 1, 'use_sparse_layer': False, 'use_batchnorm': True, 'use_dropout': True, 'dropout': 0.6585770952607294, 'mlp_size_1': 0, 'mlp_size_2': 1, 'mlp_size_3': 0, 'kernel': 'Exponential', 'loss_name': 'NLLLoss'}. Best is trial 86 with value: 0.8684701330397244.[0m
[32m[I 2022-04-15 20:53:55,572][0m Trial 127 finished with value: 0.8237091462295499 and parameters: {'n_hidden': 128, 'mixture_components': 1, 'use_sparse_layer': False, 'use_batchnorm': False, 'use_dropout': True, 'dropout': 0.6489395074966271, 'mlp_size_1': 0, 'mlp_size_2': 1, 'mlp_size_3': 1, 'kernel': 'Gamma', 'loss_name': 'NLLLoss'}. Best is trial 86 with value: 0.8684701330397244.[0m
[32m[I 2022-04-15 20:59:57,440][0m Trial 128 finished with value: 0.8573844816895703 and parameters: {'n_hidden': 32, 'mixture_components': 2, 'use_sparse_layer': False, 'use_batchnorm': True, 'use_dropout': True, 'dropout': 0.682829022871243, 'mlp_size_1': 0, 'mlp_size_2': 1, 'mlp_size_3': 0, 'kernel': 'Exponential', 'loss_name': 'NLLLoss'}. Best is trial 86 with value: 0.8684701330397244.[0m
[32m[I 2022-04-15 21:05:06,111][0m Trial 129 finished with value: 0.7794054200364968 and parameters: {'n_hidden': 32, 'mixture_components': 1, 'use_sparse_layer': False, 'use_batchnorm': True, 'use_dropout': True, 'dropout': 0.7102678995764081, 'mlp_size_1': 0, 'mlp_size_2': 1, 'mlp_size_3': 0, 'kernel': 'LogNormal', 'loss_name': 'AlternativeNLLLoss'}. Best is trial 86 with value: 0.8684701330397244.[0m
[32m[I 2022-04-15 21:11:29,260][0m Trial 130 finished with value: 0.8664810857040269 and parameters: {'n_hidden': 128, 'mixture_components': 1, 'use_sparse_layer': False, 'use_batchnorm': True, 'use_dropout': True, 'dropout': 0.6107330415663779, 'mlp_size_1': 0, 'mlp_size_2': 1, 'mlp_size_3': 2, 'kernel': 'Exponential', 'loss_name': 'NLLLoss'}. Best is trial 86 with value: 0.8684701330397244.[0m
[32m[I 2022-04-15 21:17:07,421][0m Trial 131 finished with value: 0.7487642378289152 and parameters: {'n_hidden': 128, 'mixture_components': 1, 'use_sparse_layer': False, 'use_batchnorm': True, 'use_dropout': True, 'dropout': 0.6054009283862951, 'mlp_size_1': 0, 'mlp_size_2': 1, 'mlp_size_3': 2, 'kernel': 'Exponential', 'loss_name': 'NLLLoss'}. Best is trial 86 with value: 0.8684701330397244.[0m
[32m[I 2022-04-15 21:23:41,517][0m Trial 132 finished with value: 0.8584043766608037 and parameters: {'n_hidden': 128, 'mixture_components': 1, 'use_sparse_layer': False, 'use_batchnorm': True, 'use_dropout': True, 'dropout': 0.6411421546573828, 'mlp_size_1': 0, 'mlp_size_2': 1, 'mlp_size_3': 2, 'kernel': 'Exponential', 'loss_name': 'NLLLoss'}. Best is trial 86 with value: 0.8684701330397244.[0m
[32m[I 2022-04-15 21:29:38,974][0m Trial 133 finished with value: 0.8574295409191285 and parameters: {'n_hidden': 128, 'mixture_components': 1, 'use_sparse_layer': False, 'use_batchnorm': True, 'use_dropout': True, 'dropout': 0.5546126783849809, 'mlp_size_1': 0, 'mlp_size_2': 1, 'mlp_size_3': 2, 'kernel': 'Exponential', 'loss_name': 'NLLLoss'}. Best is trial 86 with value: 0.8684701330397244.[0m
[32m[I 2022-04-15 21:36:08,379][0m Trial 134 finished with value: 0.8557192819427945 and parameters: {'n_hidden': 128, 'mixture_components': 1, 'use_sparse_layer': False, 'use_batchnorm': True, 'use_dropout': True, 'dropout': 0.7602008889734098, 'mlp_size_1': 0, 'mlp_size_2': 1, 'mlp_size_3': 2, 'kernel': 'Exponential', 'loss_name': 'NLLLoss'}. Best is trial 86 with value: 0.8684701330397244.[0m
[32m[I 2022-04-15 21:43:16,220][0m Trial 135 finished with value: 0.6261660559529935 and parameters: {'n_hidden': 32, 'mixture_components': 2, 'use_sparse_layer': False, 'use_batchnorm': True, 'use_dropout': True, 'dropout': 0.5981145685714564, 'mlp_size_1': 0, 'mlp_size_2': 1, 'mlp_size_3': 1, 'kernel': 'Logistic', 'loss_name': 'NLLLoss'}. Best is trial 86 with value: 0.8684701330397244.[0m
[32m[I 2022-04-15 21:47:35,790][0m Trial 136 finished with value: 0.8488907325710325 and parameters: {'n_hidden': 256, 'mixture_components': 1, 'use_sparse_layer': False, 'use_batchnorm': True, 'use_dropout': True, 'dropout': 0.6589748894122697, 'mlp_size_1': 0, 'mlp_size_2': 0, 'mlp_size_3': 4, 'kernel': 'Exponential', 'loss_name': 'NLLLoss'}. Best is trial 86 with value: 0.8684701330397244.[0m
[32m[I 2022-04-15 21:52:08,336][0m Trial 137 finished with value: 0.8473012617737691 and parameters: {'n_hidden': 128, 'mixture_components': 2, 'use_sparse_layer': False, 'use_batchnorm': True, 'use_dropout': True, 'dropout': 0.485558723225923, 'mlp_size_1': 0, 'mlp_size_2': 1, 'mlp_size_3': 2, 'kernel': 'Exponential', 'loss_name': 'NLLLoss'}. Best is trial 86 with value: 0.8684701330397244.[0m
[32m[I 2022-04-15 21:56:13,413][0m Trial 138 finished with value: 0.8200244198790958 and parameters: {'n_hidden': 32, 'mixture_components': 1, 'use_sparse_layer': False, 'use_batchnorm': True, 'use_dropout': True, 'dropout': 0.1271340419413033, 'mlp_size_1': 0, 'mlp_size_2': 1, 'mlp_size_3': 1, 'kernel': 'Gumbel', 'loss_name': 'NLLLoss'}. Best is trial 86 with value: 0.8684701330397244.[0m
[32m[I 2022-04-15 22:00:18,073][0m Trial 139 finished with value: 0.52653386883878 and parameters: {'n_hidden': 2048, 'mixture_components': 1, 'use_sparse_layer': False, 'use_batchnorm': True, 'use_dropout': True, 'dropout': 0.522308857915379, 'mlp_size_1': 6, 'mlp_size_2': 1, 'mlp_size_3': 1, 'kernel': 'Exponential', 'loss_name': 'NLLLoss'}. Best is trial 86 with value: 0.8684701330397244.[0m
[32m[I 2022-04-15 22:06:13,162][0m Trial 140 finished with value: 0.8605239177701813 and parameters: {'n_hidden': 128, 'mixture_components': 2, 'use_sparse_layer': False, 'use_batchnorm': True, 'use_dropout': True, 'dropout': 0.4433476704567343, 'mlp_size_1': 0, 'mlp_size_2': 2, 'mlp_size_3': 1, 'kernel': 'Exponential', 'loss_name': 'NLLLoss'}. Best is trial 86 with value: 0.8684701330397244.[0m
[32m[I 2022-04-15 22:12:59,214][0m Trial 141 finished with value: 0.860927139005289 and parameters: {'n_hidden': 32, 'mixture_components': 1, 'use_sparse_layer': False, 'use_batchnorm': True, 'use_dropout': True, 'dropout': 0.7269455444217424, 'mlp_size_1': 0, 'mlp_size_2': 2, 'mlp_size_3': 0, 'kernel': 'Exponential', 'loss_name': 'NLLLoss'}. Best is trial 86 with value: 0.8684701330397244.[0m
[32m[I 2022-04-15 22:18:50,691][0m Trial 142 finished with value: 0.8696661610719094 and parameters: {'n_hidden': 32, 'mixture_components': 1, 'use_sparse_layer': False, 'use_batchnorm': True, 'use_dropout': True, 'dropout': 0.6225649844816045, 'mlp_size_1': 0, 'mlp_size_2': 2, 'mlp_size_3': 0, 'kernel': 'Exponential', 'loss_name': 'NLLLoss'}. Best is trial 142 with value: 0.8696661610719094.[0m
[32m[I 2022-04-15 22:24:49,784][0m Trial 143 finished with value: 0.866828251780646 and parameters: {'n_hidden': 32, 'mixture_components': 1, 'use_sparse_layer': False, 'use_batchnorm': True, 'use_dropout': True, 'dropout': 0.6241458178240167, 'mlp_size_1': 0, 'mlp_size_2': 2, 'mlp_size_3': 0, 'kernel': 'Exponential', 'loss_name': 'NLLLoss'}. Best is trial 142 with value: 0.8696661610719094.[0m
[32m[I 2022-04-15 22:30:44,299][0m Trial 144 finished with value: 0.8669991746883046 and parameters: {'n_hidden': 32, 'mixture_components': 1, 'use_sparse_layer': False, 'use_batchnorm': True, 'use_dropout': True, 'dropout': 0.6299159053395735, 'mlp_size_1': 0, 'mlp_size_2': 1, 'mlp_size_3': 0, 'kernel': 'Exponential', 'loss_name': 'NLLLoss'}. Best is trial 142 with value: 0.8696661610719094.[0m
[32m[I 2022-04-15 22:36:54,250][0m Trial 145 finished with value: 0.858390491496227 and parameters: {'n_hidden': 32, 'mixture_components': 3, 'use_sparse_layer': False, 'use_batchnorm': True, 'use_dropout': True, 'dropout': 0.6230610758899557, 'mlp_size_1': 0, 'mlp_size_2': 1, 'mlp_size_3': 0, 'kernel': 'Exponential', 'loss_name': 'NLLLoss'}. Best is trial 142 with value: 0.8696661610719094.[0m
[32m[I 2022-04-15 22:39:50,722][0m Trial 146 finished with value: 0.6135763556328431 and parameters: {'n_hidden': 32, 'mixture_components': 1, 'use_sparse_layer': False, 'use_batchnorm': True, 'use_dropout': True, 'dropout': 0.6567657470842723, 'mlp_size_1': 0, 'mlp_size_2': 1, 'mlp_size_3': 0, 'kernel': 'LogLogistic', 'loss_name': 'NLLLoss'}. Best is trial 142 with value: 0.8696661610719094.[0m
[32m[I 2022-04-15 22:46:02,114][0m Trial 147 finished with value: 0.8673981472865266 and parameters: {'n_hidden': 32, 'mixture_components': 2, 'use_sparse_layer': False, 'use_batchnorm': True, 'use_dropout': True, 'dropout': 0.6810775492191371, 'mlp_size_1': 0, 'mlp_size_2': 1, 'mlp_size_3': 0, 'kernel': 'Exponential', 'loss_name': 'NLLLoss'}. Best is trial 142 with value: 0.8696661610719094.[0m
[32m[I 2022-04-15 22:53:31,888][0m Trial 148 finished with value: 0.8592874527596944 and parameters: {'n_hidden': 32, 'mixture_components': 2, 'use_sparse_layer': False, 'use_batchnorm': True, 'use_dropout': True, 'dropout': 0.6851444549248805, 'mlp_size_1': 0, 'mlp_size_2': 1, 'mlp_size_3': 0, 'kernel': 'Exponential', 'loss_name': 'AlternativeNLLLoss'}. Best is trial 142 with value: 0.8696661610719094.[0m
[32m[I 2022-04-15 22:56:47,750][0m Trial 149 finished with value: 0.7975749276509442 and parameters: {'n_hidden': 32, 'mixture_components': 2, 'use_sparse_layer': False, 'use_batchnorm': False, 'use_dropout': True, 'dropout': 0.6273053483803771, 'mlp_size_1': 0, 'mlp_size_2': 1, 'mlp_size_3': 0, 'kernel': 'Exponential', 'loss_name': 'NLLLoss'}. Best is trial 142 with value: 0.8696661610719094.[0m
[32m[I 2022-04-15 23:02:39,565][0m Trial 150 finished with value: 0.8604601147077655 and parameters: {'n_hidden': 32, 'mixture_components': 2, 'use_sparse_layer': False, 'use_batchnorm': True, 'use_dropout': True, 'dropout': 0.7152018720437969, 'mlp_size_1': 0, 'mlp_size_2': 1, 'mlp_size_3': 0, 'kernel': 'Exponential', 'loss_name': 'NLLLoss'}. Best is trial 142 with value: 0.8696661610719094.[0m
[32m[I 2022-04-15 23:08:51,883][0m Trial 151 finished with value: 0.8583546484200213 and parameters: {'n_hidden': 32, 'mixture_components': 1, 'use_sparse_layer': False, 'use_batchnorm': True, 'use_dropout': True, 'dropout': 0.6707796403639107, 'mlp_size_1': 0, 'mlp_size_2': 1, 'mlp_size_3': 0, 'kernel': 'Exponential', 'loss_name': 'NLLLoss'}. Best is trial 142 with value: 0.8696661610719094.[0m
[32m[I 2022-04-15 23:15:05,656][0m Trial 152 finished with value: 0.8660250226766179 and parameters: {'n_hidden': 32, 'mixture_components': 1, 'use_sparse_layer': False, 'use_batchnorm': True, 'use_dropout': True, 'dropout': 0.6372624500992318, 'mlp_size_1': 0, 'mlp_size_2': 1, 'mlp_size_3': 0, 'kernel': 'Exponential', 'loss_name': 'NLLLoss'}. Best is trial 142 with value: 0.8696661610719094.[0m
[32m[I 2022-04-15 23:22:12,979][0m Trial 153 finished with value: 0.8591211711949853 and parameters: {'n_hidden': 32, 'mixture_components': 1, 'use_sparse_layer': False, 'use_batchnorm': True, 'use_dropout': True, 'dropout': 0.5821738841935918, 'mlp_size_1': 0, 'mlp_size_2': 1, 'mlp_size_3': 0, 'kernel': 'Exponential', 'loss_name': 'NLLLoss'}. Best is trial 142 with value: 0.8696661610719094.[0m
[32m[I 2022-04-15 23:28:39,630][0m Trial 154 finished with value: 0.8612588104733886 and parameters: {'n_hidden': 32, 'mixture_components': 1, 'use_sparse_layer': False, 'use_batchnorm': True, 'use_dropout': True, 'dropout': 0.6409535015193121, 'mlp_size_1': 0, 'mlp_size_2': 2, 'mlp_size_3': 0, 'kernel': 'Exponential', 'loss_name': 'NLLLoss'}. Best is trial 142 with value: 0.8696661610719094.[0m
[32m[I 2022-04-15 23:34:54,686][0m Trial 155 finished with value: 0.8720634217556679 and parameters: {'n_hidden': 32, 'mixture_components': 3, 'use_sparse_layer': False, 'use_batchnorm': True, 'use_dropout': True, 'dropout': 0.6959581845711177, 'mlp_size_1': 0, 'mlp_size_2': 2, 'mlp_size_3': 0, 'kernel': 'Exponential', 'loss_name': 'NLLLoss'}. Best is trial 155 with value: 0.8720634217556679.[0m
