[32m[I 2022-04-19 06:58:45,060][0m Trial 259 finished with value: 0.705918554248381 and parameters: {'n_hidden': 2048, 'mixture_components': 1, 'use_sparse_layer': True, 'use_sparse_loss': False, 'use_batchnorm': False, 'use_dropout': True, 'dropout': 0.3326978686759087, 'mlp_size_1': 7, 'mlp_size_2': 0, 'mlp_size_3': 0, 'kernel': 'Exponential', 'loss_name': 'NLLLoss'}. Best is trial 237 with value: 0.7341952549033148.[0m
[32m[I 2022-04-19 07:00:25,112][0m Trial 260 finished with value: 0.7182013066993811 and parameters: {'n_hidden': 2048, 'mixture_components': 1, 'use_sparse_layer': True, 'use_sparse_loss': False, 'use_batchnorm': False, 'use_dropout': True, 'dropout': 0.2715577569684599, 'mlp_size_1': 7, 'mlp_size_2': 0, 'mlp_size_3': 0, 'kernel': 'Exponential', 'loss_name': 'NLLLoss'}. Best is trial 237 with value: 0.7341952549033148.[0m
[32m[I 2022-04-19 07:01:45,781][0m Trial 261 finished with value: 0.7136082185946243 and parameters: {'n_hidden': 512, 'mixture_components': 1, 'use_sparse_layer': True, 'use_sparse_loss': True, 'lmbd': 0.00042580664883537836, 'use_batchnorm': False, 'use_dropout': True, 'dropout': 0.32963035451775596, 'mlp_size_1': 6, 'mlp_size_2': 0, 'mlp_size_3': 0, 'kernel': 'Exponential', 'loss_name': 'NLLLoss'}. Best is trial 237 with value: 0.7341952549033148.[0m
[32m[I 2022-04-19 07:03:09,214][0m Trial 262 finished with value: 0.6390927786071583 and parameters: {'n_hidden': 512, 'mixture_components': 1, 'use_sparse_layer': True, 'use_sparse_loss': False, 'use_batchnorm': False, 'use_dropout': True, 'dropout': 0.27966501799603005, 'mlp_size_1': 6, 'mlp_size_2': 0, 'mlp_size_3': 0, 'kernel': 'Exponential', 'loss_name': 'NLLLoss'}. Best is trial 237 with value: 0.7341952549033148.[0m
[32m[I 2022-04-19 07:04:35,343][0m Trial 263 finished with value: 0.7176529200040747 and parameters: {'n_hidden': 256, 'mixture_components': 1, 'use_sparse_layer': True, 'use_sparse_loss': False, 'use_batchnorm': False, 'use_dropout': True, 'dropout': 0.2490021059676304, 'mlp_size_1': 5, 'mlp_size_2': 0, 'mlp_size_3': 0, 'kernel': 'Exponential', 'loss_name': 'NLLLoss'}. Best is trial 237 with value: 0.7341952549033148.[0m
[32m[I 2022-04-19 07:05:58,181][0m Trial 264 finished with value: 0.6606583607496833 and parameters: {'n_hidden': 512, 'mixture_components': 1, 'use_sparse_layer': True, 'use_sparse_loss': False, 'use_batchnorm': False, 'use_dropout': True, 'dropout': 0.23447959061872567, 'mlp_size_1': 6, 'mlp_size_2': 0, 'mlp_size_3': 0, 'kernel': 'Exponential', 'loss_name': 'NLLLoss'}. Best is trial 237 with value: 0.7341952549033148.[0m
[32m[I 2022-04-19 07:07:31,916][0m Trial 265 finished with value: 0.6917822935971302 and parameters: {'n_hidden': 256, 'mixture_components': 1, 'use_sparse_layer': True, 'use_sparse_loss': False, 'use_batchnorm': False, 'use_dropout': True, 'dropout': 0.29514910504943576, 'mlp_size_1': 5, 'mlp_size_2': 0, 'mlp_size_3': 0, 'kernel': 'Exponential', 'loss_name': 'NLLLoss'}. Best is trial 237 with value: 0.7341952549033148.[0m
[32m[I 2022-04-19 07:08:53,582][0m Trial 266 finished with value: 0.662307143038189 and parameters: {'n_hidden': 256, 'mixture_components': 1, 'use_sparse_layer': True, 'use_sparse_loss': True, 'lmbd': 0.0004408067833494806, 'use_batchnorm': False, 'use_dropout': True, 'dropout': 0.2680069312126437, 'mlp_size_1': 5, 'mlp_size_2': 0, 'mlp_size_3': 0, 'kernel': 'Exponential', 'loss_name': 'NLLLoss'}. Best is trial 237 with value: 0.7341952549033148.[0m
[32m[I 2022-04-19 07:10:24,749][0m Trial 267 finished with value: 0.6665464962914168 and parameters: {'n_hidden': 256, 'mixture_components': 1, 'use_sparse_layer': True, 'use_sparse_loss': False, 'use_batchnorm': False, 'use_dropout': True, 'dropout': 0.3666517145933541, 'mlp_size_1': 5, 'mlp_size_2': 0, 'mlp_size_3': 0, 'kernel': 'Exponential', 'loss_name': 'NLLLoss'}. Best is trial 237 with value: 0.7341952549033148.[0m
[32m[I 2022-04-19 07:11:44,285][0m Trial 268 finished with value: 0.6855476923997997 and parameters: {'n_hidden': 512, 'mixture_components': 1, 'use_sparse_layer': True, 'use_sparse_loss': False, 'use_batchnorm': False, 'use_dropout': True, 'dropout': 0.33257028518251863, 'mlp_size_1': 6, 'mlp_size_2': 0, 'mlp_size_3': 0, 'kernel': 'Exponential', 'loss_name': 'NLLLoss'}. Best is trial 237 with value: 0.7341952549033148.[0m
[32m[I 2022-04-19 07:13:05,182][0m Trial 269 finished with value: 0.669393942359198 and parameters: {'n_hidden': 512, 'mixture_components': 1, 'use_sparse_layer': True, 'use_sparse_loss': False, 'use_batchnorm': False, 'use_dropout': True, 'dropout': 0.35367808093073594, 'mlp_size_1': 6, 'mlp_size_2': 0, 'mlp_size_3': 0, 'kernel': 'Exponential', 'loss_name': 'NLLLoss'}. Best is trial 237 with value: 0.7341952549033148.[0m
[32m[I 2022-04-19 07:14:43,309][0m Trial 270 finished with value: 0.6822167634503739 and parameters: {'n_hidden': 256, 'mixture_components': 1, 'use_sparse_layer': True, 'use_sparse_loss': False, 'use_batchnorm': False, 'use_dropout': True, 'dropout': 0.25016672520167804, 'mlp_size_1': 5, 'mlp_size_2': 0, 'mlp_size_3': 0, 'kernel': 'Exponential', 'loss_name': 'NLLLoss'}. Best is trial 237 with value: 0.7341952549033148.[0m
[32m[I 2022-04-19 07:16:14,206][0m Trial 271 finished with value: 0.6947090439818144 and parameters: {'n_hidden': 512, 'mixture_components': 1, 'use_sparse_layer': True, 'use_sparse_loss': False, 'use_batchnorm': False, 'use_dropout': True, 'dropout': 0.3859153923606951, 'mlp_size_1': 6, 'mlp_size_2': 0, 'mlp_size_3': 0, 'kernel': 'Exponential', 'loss_name': 'NLLLoss'}. Best is trial 237 with value: 0.7341952549033148.[0m
[32m[I 2022-04-19 07:18:01,124][0m Trial 272 finished with value: 0.6572431956922044 and parameters: {'n_hidden': 256, 'mixture_components': 1, 'use_sparse_layer': True, 'use_sparse_loss': False, 'use_batchnorm': False, 'use_dropout': True, 'dropout': 0.30852169598549234, 'mlp_size_1': 5, 'mlp_size_2': 0, 'mlp_size_3': 0, 'kernel': 'Exponential', 'loss_name': 'NLLLoss'}. Best is trial 237 with value: 0.7341952549033148.[0m
[32m[I 2022-04-19 07:20:30,405][0m Trial 273 finished with value: 0.6670040537853995 and parameters: {'n_hidden': 64, 'mixture_components': 1, 'use_sparse_layer': True, 'use_sparse_loss': False, 'use_batchnorm': False, 'use_dropout': True, 'dropout': 0.3982717628912345, 'mlp_size_1': 3, 'mlp_size_2': 0, 'mlp_size_3': 0, 'kernel': 'Exponential', 'loss_name': 'NLLLoss'}. Best is trial 237 with value: 0.7341952549033148.[0m
[32m[I 2022-04-19 07:22:25,766][0m Trial 274 finished with value: 0.6664279384404903 and parameters: {'n_hidden': 2048, 'mixture_components': 1, 'use_sparse_layer': True, 'use_sparse_loss': False, 'use_batchnorm': False, 'use_dropout': True, 'dropout': 0.3779735776708789, 'mlp_size_1': 7, 'mlp_size_2': 0, 'mlp_size_3': 1, 'kernel': 'Exponential', 'loss_name': 'NLLLoss'}. Best is trial 237 with value: 0.7341952549033148.[0m
[32m[I 2022-04-19 07:24:12,820][0m Trial 275 finished with value: 0.6929597196975855 and parameters: {'n_hidden': 2048, 'mixture_components': 1, 'use_sparse_layer': True, 'use_sparse_loss': False, 'use_batchnorm': False, 'use_dropout': True, 'dropout': 0.3968638689131799, 'mlp_size_1': 7, 'mlp_size_2': 0, 'mlp_size_3': 0, 'kernel': 'Exponential', 'loss_name': 'NLLLoss'}. Best is trial 237 with value: 0.7341952549033148.[0m
[32m[I 2022-04-19 07:25:48,104][0m Trial 276 finished with value: 0.6794017576633108 and parameters: {'n_hidden': 2048, 'mixture_components': 1, 'use_sparse_layer': True, 'use_sparse_loss': True, 'lmbd': 0.000322921886705394, 'use_batchnorm': False, 'use_dropout': True, 'dropout': 0.4413251819129126, 'mlp_size_1': 7, 'mlp_size_2': 0, 'mlp_size_3': 0, 'kernel': 'Exponential', 'loss_name': 'NLLLoss'}. Best is trial 237 with value: 0.7341952549033148.[0m
[32m[I 2022-04-19 07:27:09,291][0m Trial 277 finished with value: 0.691486809550966 and parameters: {'n_hidden': 2048, 'mixture_components': 1, 'use_sparse_layer': True, 'use_sparse_loss': False, 'use_batchnorm': False, 'use_dropout': True, 'dropout': 0.34364593246771147, 'mlp_size_1': 7, 'mlp_size_2': 0, 'mlp_size_3': 0, 'kernel': 'Exponential', 'loss_name': 'NLLLoss'}. Best is trial 237 with value: 0.7341952549033148.[0m
[32m[I 2022-04-19 07:28:45,105][0m Trial 278 finished with value: 0.7213386441793344 and parameters: {'n_hidden': 2048, 'mixture_components': 1, 'use_sparse_layer': True, 'use_sparse_loss': True, 'lmbd': 0.000410944997975223, 'use_batchnorm': False, 'use_dropout': True, 'dropout': 0.31233258272480047, 'mlp_size_1': 7, 'mlp_size_2': 0, 'mlp_size_3': 0, 'kernel': 'Exponential', 'loss_name': 'NLLLoss'}. Best is trial 237 with value: 0.7341952549033148.[0m
[32m[I 2022-04-19 07:30:23,417][0m Trial 279 finished with value: 0.7028063909131191 and parameters: {'n_hidden': 2048, 'mixture_components': 1, 'use_sparse_layer': True, 'use_sparse_loss': True, 'lmbd': 0.0004162088908389181, 'use_batchnorm': False, 'use_dropout': True, 'dropout': 0.30827173914298717, 'mlp_size_1': 7, 'mlp_size_2': 0, 'mlp_size_3': 0, 'kernel': 'Exponential', 'loss_name': 'NLLLoss'}. Best is trial 237 with value: 0.7341952549033148.[0m
[32m[I 2022-04-19 07:31:53,989][0m Trial 280 finished with value: 0.6913742971483766 and parameters: {'n_hidden': 2048, 'mixture_components': 1, 'use_sparse_layer': True, 'use_sparse_loss': True, 'lmbd': 0.0002713362653467181, 'use_batchnorm': False, 'use_dropout': True, 'dropout': 0.3180700261177856, 'mlp_size_1': 7, 'mlp_size_2': 0, 'mlp_size_3': 0, 'kernel': 'Exponential', 'loss_name': 'NLLLoss'}. Best is trial 237 with value: 0.7341952549033148.[0m
[32m[I 2022-04-19 07:33:40,103][0m Trial 281 finished with value: 0.7196166812026581 and parameters: {'n_hidden': 2048, 'mixture_components': 1, 'use_sparse_layer': True, 'use_sparse_loss': True, 'lmbd': 0.00033036877120073033, 'use_batchnorm': False, 'use_dropout': True, 'dropout': 0.3293323401032933, 'mlp_size_1': 7, 'mlp_size_2': 0, 'mlp_size_3': 0, 'kernel': 'Exponential', 'loss_name': 'NLLLoss'}. Best is trial 237 with value: 0.7341952549033148.[0m
[32m[I 2022-04-19 07:35:11,438][0m Trial 282 finished with value: 0.6965972128685807 and parameters: {'n_hidden': 2048, 'mixture_components': 1, 'use_sparse_layer': True, 'use_sparse_loss': True, 'lmbd': 0.0003586551185749712, 'use_batchnorm': False, 'use_dropout': True, 'dropout': 0.2610296227238209, 'mlp_size_1': 7, 'mlp_size_2': 0, 'mlp_size_3': 0, 'kernel': 'Exponential', 'loss_name': 'NLLLoss'}. Best is trial 237 with value: 0.7341952549033148.[0m
[32m[I 2022-04-19 07:37:07,621][0m Trial 283 finished with value: 0.7209036905572898 and parameters: {'n_hidden': 2048, 'mixture_components': 1, 'use_sparse_layer': True, 'use_sparse_loss': True, 'lmbd': 0.0005286334514398786, 'use_batchnorm': False, 'use_dropout': True, 'dropout': 0.28025934847846085, 'mlp_size_1': 7, 'mlp_size_2': 0, 'mlp_size_3': 0, 'kernel': 'Exponential', 'loss_name': 'NLLLoss'}. Best is trial 237 with value: 0.7341952549033148.[0m
[32m[I 2022-04-19 07:38:42,585][0m Trial 284 finished with value: 0.714164631590895 and parameters: {'n_hidden': 2048, 'mixture_components': 1, 'use_sparse_layer': True, 'use_sparse_loss': True, 'lmbd': 0.0005575106765784571, 'use_batchnorm': False, 'use_dropout': True, 'dropout': 0.2911809090256205, 'mlp_size_1': 7, 'mlp_size_2': 0, 'mlp_size_3': 0, 'kernel': 'Exponential', 'loss_name': 'NLLLoss'}. Best is trial 237 with value: 0.7341952549033148.[0m
[32m[I 2022-04-19 07:40:14,548][0m Trial 285 finished with value: 0.7099181097869931 and parameters: {'n_hidden': 2048, 'mixture_components': 1, 'use_sparse_layer': True, 'use_sparse_loss': True, 'lmbd': 0.0005383866687576366, 'use_batchnorm': False, 'use_dropout': True, 'dropout': 0.220197542163236, 'mlp_size_1': 7, 'mlp_size_2': 0, 'mlp_size_3': 0, 'kernel': 'Exponential', 'loss_name': 'NLLLoss'}. Best is trial 237 with value: 0.7341952549033148.[0m
[32m[I 2022-04-19 07:41:42,542][0m Trial 286 finished with value: 0.7145615081706462 and parameters: {'n_hidden': 2048, 'mixture_components': 1, 'use_sparse_layer': True, 'use_sparse_loss': True, 'lmbd': 0.00043884283383207847, 'use_batchnorm': False, 'use_dropout': True, 'dropout': 0.20696802073701293, 'mlp_size_1': 7, 'mlp_size_2': 0, 'mlp_size_3': 0, 'kernel': 'Exponential', 'loss_name': 'NLLLoss'}. Best is trial 237 with value: 0.7341952549033148.[0m
[32m[I 2022-04-19 07:43:21,797][0m Trial 287 finished with value: 0.6918421774899258 and parameters: {'n_hidden': 2048, 'mixture_components': 1, 'use_sparse_layer': True, 'use_sparse_loss': False, 'use_batchnorm': False, 'use_dropout': True, 'dropout': 0.21493917314320193, 'mlp_size_1': 7, 'mlp_size_2': 0, 'mlp_size_3': 0, 'kernel': 'Exponential', 'loss_name': 'NLLLoss'}. Best is trial 237 with value: 0.7341952549033148.[0m
[32m[I 2022-04-19 07:45:00,336][0m Trial 288 finished with value: 0.7178783153697128 and parameters: {'n_hidden': 512, 'mixture_components': 1, 'use_sparse_layer': True, 'use_sparse_loss': True, 'lmbd': 0.0006047357978397151, 'use_batchnorm': False, 'use_dropout': True, 'dropout': 0.22372155053720041, 'mlp_size_1': 6, 'mlp_size_2': 0, 'mlp_size_3': 0, 'kernel': 'Exponential', 'loss_name': 'NLLLoss'}. Best is trial 237 with value: 0.7341952549033148.[0m
[32m[I 2022-04-19 07:46:25,437][0m Trial 289 finished with value: 0.6659805387952656 and parameters: {'n_hidden': 512, 'mixture_components': 1, 'use_sparse_layer': True, 'use_sparse_loss': True, 'lmbd': 0.0009860500097894798, 'use_batchnorm': False, 'use_dropout': True, 'dropout': 0.2344467337647443, 'mlp_size_1': 6, 'mlp_size_2': 0, 'mlp_size_3': 0, 'kernel': 'Exponential', 'loss_name': 'NLLLoss'}. Best is trial 237 with value: 0.7341952549033148.[0m
[32m[I 2022-04-19 07:47:47,656][0m Trial 290 finished with value: 0.6743743727288372 and parameters: {'n_hidden': 512, 'mixture_components': 1, 'use_sparse_layer': True, 'use_sparse_loss': True, 'lmbd': 0.0007464365867939284, 'use_batchnorm': False, 'use_dropout': True, 'dropout': 0.2866986640527435, 'mlp_size_1': 6, 'mlp_size_2': 0, 'mlp_size_3': 0, 'kernel': 'Exponential', 'loss_name': 'NLLLoss'}. Best is trial 237 with value: 0.7341952549033148.[0m
[32m[I 2022-04-19 07:49:12,886][0m Trial 291 finished with value: 0.6995706356035676 and parameters: {'n_hidden': 512, 'mixture_components': 1, 'use_sparse_layer': True, 'use_sparse_loss': True, 'lmbd': 0.0006026039798279675, 'use_batchnorm': False, 'use_dropout': True, 'dropout': 0.2583960911967086, 'mlp_size_1': 6, 'mlp_size_2': 0, 'mlp_size_3': 0, 'kernel': 'Exponential', 'loss_name': 'NLLLoss'}. Best is trial 237 with value: 0.7341952549033148.[0m
[32m[I 2022-04-19 07:50:46,313][0m Trial 292 finished with value: 0.6725573932666153 and parameters: {'n_hidden': 512, 'mixture_components': 1, 'use_sparse_layer': True, 'use_sparse_loss': True, 'lmbd': 0.00047081893078279385, 'use_batchnorm': False, 'use_dropout': True, 'dropout': 0.2768666961192803, 'mlp_size_1': 6, 'mlp_size_2': 0, 'mlp_size_3': 0, 'kernel': 'Exponential', 'loss_name': 'NLLLoss'}. Best is trial 237 with value: 0.7341952549033148.[0m
[32m[I 2022-04-19 07:52:05,652][0m Trial 293 finished with value: 0.6766545642993194 and parameters: {'n_hidden': 512, 'mixture_components': 1, 'use_sparse_layer': True, 'use_sparse_loss': True, 'lmbd': 0.0004989079663694646, 'use_batchnorm': False, 'use_dropout': True, 'dropout': 0.2982809811226441, 'mlp_size_1': 6, 'mlp_size_2': 0, 'mlp_size_3': 0, 'kernel': 'Exponential', 'loss_name': 'NLLLoss'}. Best is trial 237 with value: 0.7341952549033148.[0m
[32m[I 2022-04-19 07:53:24,786][0m Trial 294 finished with value: 0.67972873454762 and parameters: {'n_hidden': 256, 'mixture_components': 1, 'use_sparse_layer': True, 'use_sparse_loss': True, 'lmbd': 0.0008535348212861624, 'use_batchnorm': False, 'use_dropout': True, 'dropout': 0.19833449157554303, 'mlp_size_1': 5, 'mlp_size_2': 0, 'mlp_size_3': 0, 'kernel': 'Exponential', 'loss_name': 'NLLLoss'}. Best is trial 237 with value: 0.7341952549033148.[0m
[32m[I 2022-04-19 07:55:03,610][0m Trial 295 finished with value: 0.7155010980537069 and parameters: {'n_hidden': 2048, 'mixture_components': 1, 'use_sparse_layer': True, 'use_sparse_loss': True, 'lmbd': 0.0006000815852961798, 'use_batchnorm': False, 'use_dropout': True, 'dropout': 0.1751263909208087, 'mlp_size_1': 7, 'mlp_size_2': 0, 'mlp_size_3': 0, 'kernel': 'Exponential', 'loss_name': 'NLLLoss'}. Best is trial 237 with value: 0.7341952549033148.[0m
[32m[I 2022-04-19 07:56:43,671][0m Trial 296 finished with value: 0.6951329541462961 and parameters: {'n_hidden': 2048, 'mixture_components': 1, 'use_sparse_layer': True, 'use_sparse_loss': True, 'lmbd': 0.0011915414138546057, 'use_batchnorm': False, 'use_dropout': True, 'dropout': 0.163414257222236, 'mlp_size_1': 7, 'mlp_size_2': 0, 'mlp_size_3': 0, 'kernel': 'Exponential', 'loss_name': 'NLLLoss'}. Best is trial 237 with value: 0.7341952549033148.[0m
[32m[I 2022-04-19 07:58:24,236][0m Trial 297 finished with value: 0.6935254787757087 and parameters: {'n_hidden': 2048, 'mixture_components': 1, 'use_sparse_layer': True, 'use_sparse_loss': False, 'use_batchnorm': False, 'use_dropout': True, 'dropout': 0.13243729312244518, 'mlp_size_1': 7, 'mlp_size_2': 0, 'mlp_size_3': 0, 'kernel': 'Exponential', 'loss_name': 'NLLLoss'}. Best is trial 237 with value: 0.7341952549033148.[0m
[32m[I 2022-04-19 08:00:30,570][0m Trial 298 finished with value: 0.6893312410221373 and parameters: {'n_hidden': 64, 'mixture_components': 1, 'use_sparse_layer': True, 'use_sparse_loss': True, 'lmbd': 0.0006182692465967779, 'use_batchnorm': False, 'use_dropout': True, 'dropout': 0.3361313833746655, 'mlp_size_1': 3, 'mlp_size_2': 0, 'mlp_size_3': 0, 'kernel': 'Exponential', 'loss_name': 'NLLLoss'}. Best is trial 237 with value: 0.7341952549033148.[0m
[32m[I 2022-04-19 08:02:07,670][0m Trial 299 finished with value: 0.7066188904847717 and parameters: {'n_hidden': 2048, 'mixture_components': 1, 'use_sparse_layer': True, 'use_sparse_loss': True, 'lmbd': 0.0003426679553403129, 'use_batchnorm': False, 'use_dropout': True, 'dropout': 0.18613185265536847, 'mlp_size_1': 7, 'mlp_size_2': 0, 'mlp_size_3': 0, 'kernel': 'Exponential', 'loss_name': 'NLLLoss'}. Best is trial 237 with value: 0.7341952549033148.[0m
[32m[I 2022-04-19 08:04:06,802][0m Trial 300 finished with value: 0.7050708128441283 and parameters: {'n_hidden': 2048, 'mixture_components': 1, 'use_sparse_layer': True, 'use_sparse_loss': True, 'lmbd': 0.00042736636510963837, 'use_batchnorm': False, 'use_dropout': True, 'dropout': 0.3217697899500442, 'mlp_size_1': 7, 'mlp_size_2': 0, 'mlp_size_3': 1, 'kernel': 'Exponential', 'loss_name': 'NLLLoss'}. Best is trial 237 with value: 0.7341952549033148.[0m
[32m[I 2022-04-19 08:05:38,578][0m Trial 301 finished with value: 0.7051532239582319 and parameters: {'n_hidden': 512, 'mixture_components': 1, 'use_sparse_layer': True, 'use_sparse_loss': True, 'lmbd': 0.0002728846484101587, 'use_batchnorm': False, 'use_dropout': True, 'dropout': 0.2998042355664416, 'mlp_size_1': 6, 'mlp_size_2': 0, 'mlp_size_3': 0, 'kernel': 'Exponential', 'loss_name': 'NLLLoss'}. Best is trial 237 with value: 0.7341952549033148.[0m
[32m[I 2022-04-19 08:07:22,325][0m Trial 302 finished with value: 0.6946824807120897 and parameters: {'n_hidden': 2048, 'mixture_components': 1, 'use_sparse_layer': True, 'use_sparse_loss': True, 'lmbd': 0.0006205160632685092, 'use_batchnorm': False, 'use_dropout': True, 'dropout': 0.23088945696077573, 'mlp_size_1': 7, 'mlp_size_2': 0, 'mlp_size_3': 0, 'kernel': 'Exponential', 'loss_name': 'NLLLoss'}. Best is trial 237 with value: 0.7341952549033148.[0m
[32m[I 2022-04-19 08:08:56,002][0m Trial 303 finished with value: 0.7123736858129706 and parameters: {'n_hidden': 2048, 'mixture_components': 1, 'use_sparse_layer': True, 'use_sparse_loss': True, 'lmbd': 0.0003176514734058666, 'use_batchnorm': False, 'use_dropout': True, 'dropout': 0.26623630284926203, 'mlp_size_1': 7, 'mlp_size_2': 0, 'mlp_size_3': 0, 'kernel': 'Exponential', 'loss_name': 'NLLLoss'}. Best is trial 237 with value: 0.7341952549033148.[0m
[32m[I 2022-04-19 08:10:31,795][0m Trial 304 finished with value: 0.7045103818434046 and parameters: {'n_hidden': 2048, 'mixture_components': 1, 'use_sparse_layer': True, 'use_sparse_loss': True, 'lmbd': 0.00035289602343755615, 'use_batchnorm': False, 'use_dropout': True, 'dropout': 0.27349979989163653, 'mlp_size_1': 7, 'mlp_size_2': 0, 'mlp_size_3': 0, 'kernel': 'Exponential', 'loss_name': 'NLLLoss'}. Best is trial 237 with value: 0.7341952549033148.[0m
[32m[I 2022-04-19 08:12:08,701][0m Trial 305 finished with value: 0.7078518806414953 and parameters: {'n_hidden': 2048, 'mixture_components': 1, 'use_sparse_layer': True, 'use_sparse_loss': False, 'use_batchnorm': False, 'use_dropout': True, 'dropout': 0.2600390266209238, 'mlp_size_1': 7, 'mlp_size_2': 0, 'mlp_size_3': 0, 'kernel': 'Exponential', 'loss_name': 'NLLLoss'}. Best is trial 237 with value: 0.7341952549033148.[0m
[32m[I 2022-04-19 08:13:44,400][0m Trial 306 finished with value: 0.7015482644244103 and parameters: {'n_hidden': 2048, 'mixture_components': 1, 'use_sparse_layer': True, 'use_sparse_loss': True, 'lmbd': 0.00011570708637250512, 'use_batchnorm': False, 'use_dropout': True, 'dropout': 0.14655286362646835, 'mlp_size_1': 7, 'mlp_size_2': 0, 'mlp_size_3': 0, 'kernel': 'Exponential', 'loss_name': 'NLLLoss'}. Best is trial 237 with value: 0.7341952549033148.[0m
[32m[I 2022-04-19 08:15:14,376][0m Trial 307 finished with value: 0.6721051294595999 and parameters: {'n_hidden': 256, 'mixture_components': 1, 'use_sparse_layer': True, 'use_sparse_loss': True, 'lmbd': 0.0005232096743735442, 'use_batchnorm': False, 'use_dropout': True, 'dropout': 0.24904701512107694, 'mlp_size_1': 5, 'mlp_size_2': 0, 'mlp_size_3': 0, 'kernel': 'Exponential', 'loss_name': 'NLLLoss'}. Best is trial 237 with value: 0.7341952549033148.[0m
