[32m[I 2022-04-14 15:09:39,614][0m Trial 803 finished with value: 0.5860009215352866 and parameters: {'loss': 'coxph', 'learning_rate': 0.0072857232022818675, 'n_estimators': 225, 'criterion': 'friedman_mse', 'min_samples_split': 2, 'min_samples_leaf': 3, 'min_weight_fraction_leaf': 0.44788837662166403, 'min_impurity_decrease': 0.5915742575342032, 'max_features': 0.9072742618467657, 'subsample': 0.8012217133191987, 'dropout_rate': 0.4488769452761435, 'ccp_alpha': 0.0020367131152361105}. Best is trial 677 with value: 0.7600100187343619.[0m
[32m[I 2022-04-14 15:09:52,843][0m Trial 804 finished with value: 0.5 and parameters: {'loss': 'coxph', 'learning_rate': 0.023464616407063092, 'n_estimators': 335, 'criterion': 'absolute_error', 'min_samples_split': 2, 'min_samples_leaf': 3, 'min_weight_fraction_leaf': 0.04080833872780022, 'min_impurity_decrease': 0.5065349164752561, 'max_features': 0.9394615788034861, 'subsample': 0.723512093717498, 'dropout_rate': 0.34356823374168516, 'ccp_alpha': 0.0030256709689387112}. Best is trial 677 with value: 0.7600100187343619.[0m
[32m[I 2022-04-14 15:10:06,658][0m Trial 805 finished with value: 0.7196958862245172 and parameters: {'loss': 'coxph', 'learning_rate': 0.0067677805384446345, 'n_estimators': 351, 'criterion': 'friedman_mse', 'min_samples_split': 2, 'min_samples_leaf': 3, 'min_weight_fraction_leaf': 0.013896645096306576, 'min_impurity_decrease': 0.5664424774425557, 'max_features': 0.09220336572540994, 'subsample': 0.6824176703374967, 'dropout_rate': 0.39088033021348456, 'ccp_alpha': 0.0017883878043885044}. Best is trial 677 with value: 0.7600100187343619.[0m
[32m[I 2022-04-14 15:10:21,914][0m Trial 806 finished with value: 0.5 and parameters: {'loss': 'coxph', 'learning_rate': 0.06367391911648927, 'n_estimators': 366, 'criterion': 'friedman_mse', 'min_samples_split': 2, 'min_samples_leaf': 2, 'min_weight_fraction_leaf': 0.31322965505511724, 'min_impurity_decrease': 0.37179817172080976, 'max_features': 0.8677570648405812, 'subsample': 0.7856720277521008, 'dropout_rate': 0.42818595728628067, 'ccp_alpha': 0.526446366942638}. Best is trial 677 with value: 0.7600100187343619.[0m
[32m[I 2022-04-14 15:10:33,487][0m Trial 807 finished with value: 0.6976424345272905 and parameters: {'loss': 'coxph', 'learning_rate': 0.009830413845426308, 'n_estimators': 334, 'criterion': 'friedman_mse', 'min_samples_split': 2, 'min_samples_leaf': 5, 'min_weight_fraction_leaf': 0.0630653792079688, 'min_impurity_decrease': 0.3346251717793915, 'max_features': 0.9163613268356813, 'subsample': 0.7526222443670018, 'dropout_rate': 0.45767623888777215, 'ccp_alpha': 0.18113852085910426}. Best is trial 677 with value: 0.7600100187343619.[0m
[32m[I 2022-04-14 15:10:47,077][0m Trial 808 finished with value: 0.5751934904348118 and parameters: {'loss': 'coxph', 'learning_rate': 0.013538611196189654, 'n_estimators': 351, 'criterion': 'friedman_mse', 'min_samples_split': 2, 'min_samples_leaf': 4, 'min_weight_fraction_leaf': 0.031500896151214416, 'min_impurity_decrease': 0.43200697691483414, 'max_features': 0.0036560703840325393, 'subsample': 0.8091186999191575, 'dropout_rate': 0.4123298761603422, 'ccp_alpha': 0.2522455442741399}. Best is trial 677 with value: 0.7600100187343619.[0m
[32m[I 2022-04-14 15:11:02,048][0m Trial 809 finished with value: 0.5 and parameters: {'loss': 'coxph', 'learning_rate': 0.006329504065156349, 'n_estimators': 380, 'criterion': 'friedman_mse', 'min_samples_split': 2, 'min_samples_leaf': 2, 'min_weight_fraction_leaf': 0.044567548745651366, 'min_impurity_decrease': 0.6719056755801205, 'max_features': 0.8889803611783561, 'subsample': 0.7712813728541463, 'dropout_rate': 0.49798611644157476, 'ccp_alpha': 0.9536313306689561}. Best is trial 677 with value: 0.7600100187343619.[0m
[32m[I 2022-04-14 15:11:19,287][0m Trial 810 finished with value: 0.7142121216395021 and parameters: {'loss': 'coxph', 'learning_rate': 0.010230375417652919, 'n_estimators': 400, 'criterion': 'friedman_mse', 'min_samples_split': 2, 'min_samples_leaf': 3, 'min_weight_fraction_leaf': 0.05326956829362975, 'min_impurity_decrease': 0.40145603292462745, 'max_features': 0.9503622827883864, 'subsample': 0.8191740542559182, 'dropout_rate': 0.4758177947978745, 'ccp_alpha': 0.17997197567615567}. Best is trial 677 with value: 0.7600100187343619.[0m
[32m[I 2022-04-14 15:11:33,554][0m Trial 811 finished with value: 0.7296668319179236 and parameters: {'loss': 'coxph', 'learning_rate': 0.005170148139290208, 'n_estimators': 334, 'criterion': 'friedman_mse', 'min_samples_split': 2, 'min_samples_leaf': 2, 'min_weight_fraction_leaf': 0.06203799513290001, 'min_impurity_decrease': 0.6501197930814231, 'max_features': 0.6139840294463852, 'subsample': 0.7513134153197787, 'dropout_rate': 0.38492998115301025, 'ccp_alpha': 0.09690163663457546}. Best is trial 677 with value: 0.7600100187343619.[0m
[32m[I 2022-04-14 15:11:50,777][0m Trial 812 finished with value: 0.5 and parameters: {'loss': 'coxph', 'learning_rate': 0.048851879257547554, 'n_estimators': 358, 'criterion': 'friedman_mse', 'min_samples_split': 2, 'min_samples_leaf': 3, 'min_weight_fraction_leaf': 0.012197618207335162, 'min_impurity_decrease': 0.35181762322762766, 'max_features': 0.9270754209207407, 'subsample': 0.7953823157196193, 'dropout_rate': 0.36070709308316284, 'ccp_alpha': 0.3524720966217489}. Best is trial 677 with value: 0.7600100187343619.[0m
[32m[I 2022-04-14 15:12:02,346][0m Trial 813 finished with value: 0.7317137314948441 and parameters: {'loss': 'coxph', 'learning_rate': 0.004175748249152776, 'n_estimators': 322, 'criterion': 'friedman_mse', 'min_samples_split': 2, 'min_samples_leaf': 2, 'min_weight_fraction_leaf': 0.030185427363570234, 'min_impurity_decrease': 0.49291251228452615, 'max_features': 0.9440838022839305, 'subsample': 0.7275272228887834, 'dropout_rate': 0.4364046965039865, 'ccp_alpha': 0.09505471792910732}. Best is trial 677 with value: 0.7600100187343619.[0m
[32m[I 2022-04-14 15:12:20,914][0m Trial 814 finished with value: 0.7406613767800116 and parameters: {'loss': 'coxph', 'learning_rate': 0.007751636956973898, 'n_estimators': 414, 'criterion': 'friedman_mse', 'min_samples_split': 5, 'min_samples_leaf': 1, 'min_weight_fraction_leaf': 0.051228942307574084, 'min_impurity_decrease': 0.32020410015222023, 'max_features': 0.9602942392408278, 'subsample': 0.8180109551148468, 'dropout_rate': 0.46325843046337634, 'ccp_alpha': 0.0027948384170426374}. Best is trial 677 with value: 0.7600100187343619.[0m
[32m[I 2022-04-14 15:12:35,612][0m Trial 815 finished with value: 0.7020129164927413 and parameters: {'loss': 'coxph', 'learning_rate': 0.020842817179832995, 'n_estimators': 372, 'criterion': 'friedman_mse', 'min_samples_split': 2, 'min_samples_leaf': 3, 'min_weight_fraction_leaf': 0.06588424209400072, 'min_impurity_decrease': 0.5558902487635562, 'max_features': 0.8978084128893544, 'subsample': 0.7761518395972877, 'dropout_rate': 0.4067420307132958, 'ccp_alpha': 0.17268787985862477}. Best is trial 677 with value: 0.7600100187343619.[0m
[32m[I 2022-04-14 15:12:48,984][0m Trial 816 finished with value: 0.24966815311096804 and parameters: {'loss': 'squared', 'learning_rate': 0.006218215957252299, 'n_estimators': 337, 'criterion': 'friedman_mse', 'min_samples_split': 2, 'min_samples_leaf': 1, 'min_weight_fraction_leaf': 0.03847593454077858, 'min_impurity_decrease': 0.41906377855673926, 'max_features': 0.9229897870307834, 'subsample': 0.8195058709181716, 'dropout_rate': 0.43719974053082844, 'ccp_alpha': 0.09842211058300362}. Best is trial 677 with value: 0.7600100187343619.[0m
[32m[I 2022-04-14 15:12:52,411][0m Trial 817 finished with value: 0.7457572931037812 and parameters: {'loss': 'coxph', 'learning_rate': 0.010078804566301398, 'n_estimators': 180, 'criterion': 'friedman_mse', 'min_samples_split': 2, 'min_samples_leaf': 1, 'min_weight_fraction_leaf': 0.02440649914744422, 'min_impurity_decrease': 0.3933995248168999, 'max_features': 0.9618071189748599, 'subsample': 0.7126708610378927, 'dropout_rate': 0.5221517972647981, 'ccp_alpha': 0.001638307728834001}. Best is trial 677 with value: 0.7600100187343619.[0m
[32m[I 2022-04-14 15:13:03,434][0m Trial 818 finished with value: 0.5869379133297332 and parameters: {'loss': 'coxph', 'learning_rate': 0.004434062588019371, 'n_estimators': 321, 'criterion': 'friedman_mse', 'min_samples_split': 2, 'min_samples_leaf': 2, 'min_weight_fraction_leaf': 0.066817513897928, 'min_impurity_decrease': 0.36440461166992755, 'max_features': 0.8685402755743598, 'subsample': 0.7907761851977841, 'dropout_rate': 0.41873628822561504, 'ccp_alpha': 0.2654806028635268}. Best is trial 677 with value: 0.7600100187343619.[0m
[32m[I 2022-04-14 15:13:15,890][0m Trial 819 finished with value: 0.7099211871380279 and parameters: {'loss': 'coxph', 'learning_rate': 0.005933548420967196, 'n_estimators': 346, 'criterion': 'friedman_mse', 'min_samples_split': 2, 'min_samples_leaf': 1, 'min_weight_fraction_leaf': 0.04982114665545202, 'min_impurity_decrease': 0.1995065383508154, 'max_features': 0.9440040538857867, 'subsample': 0.7441234204814244, 'dropout_rate': 0.4525471693317415, 'ccp_alpha': 0.18799792346739727}. Best is trial 677 with value: 0.7600100187343619.[0m
[32m[I 2022-04-14 15:13:22,152][0m Trial 820 finished with value: 0.5 and parameters: {'loss': 'coxph', 'learning_rate': 0.00806947643863847, 'n_estimators': 242, 'criterion': 'friedman_mse', 'min_samples_split': 2, 'min_samples_leaf': 4, 'min_weight_fraction_leaf': 0.05959517572089735, 'min_impurity_decrease': 0.6847245343047507, 'max_features': 0.9699290884730531, 'subsample': 0.6971624068252982, 'dropout_rate': 0.484244769561171, 'ccp_alpha': 2.1090481813420716}. Best is trial 677 with value: 0.7600100187343619.[0m
[32m[I 2022-04-14 15:13:49,518][0m Trial 821 finished with value: 0.7443136466107498 and parameters: {'loss': 'coxph', 'learning_rate': 8.076134964710635e-05, 'n_estimators': 483, 'criterion': 'friedman_mse', 'min_samples_split': 2, 'min_samples_leaf': 1, 'min_weight_fraction_leaf': 0.0015697035614674684, 'min_impurity_decrease': 0.30754706662295667, 'max_features': 0.9159303112867742, 'subsample': 0.8301288203345071, 'dropout_rate': 0.3855184167081474, 'ccp_alpha': 0.0014342144693564494}. Best is trial 677 with value: 0.7600100187343619.[0m
[32m[I 2022-04-14 15:14:05,988][0m Trial 822 finished with value: 0.7128908362541921 and parameters: {'loss': 'coxph', 'learning_rate': 0.015025071543551432, 'n_estimators': 388, 'criterion': 'friedman_mse', 'min_samples_split': 2, 'min_samples_leaf': 1, 'min_weight_fraction_leaf': 0.038881592230481404, 'min_impurity_decrease': 0.43132046136805346, 'max_features': 0.9327335588557993, 'subsample': 0.3187613909596346, 'dropout_rate': 0.4330814019504259, 'ccp_alpha': 0.09931409734053241}. Best is trial 677 with value: 0.7600100187343619.[0m
[32m[I 2022-04-14 15:14:19,147][0m Trial 823 finished with value: 0.7044578225987618 and parameters: {'loss': 'coxph', 'learning_rate': 0.02880370826426958, 'n_estimators': 362, 'criterion': 'friedman_mse', 'min_samples_split': 2, 'min_samples_leaf': 3, 'min_weight_fraction_leaf': 0.024291273851991896, 'min_impurity_decrease': 0.4801869389435455, 'max_features': 0.9653046936469142, 'subsample': 0.7587079092691078, 'dropout_rate': 0.4620267398943182, 'ccp_alpha': 0.17281353539817884}. Best is trial 677 with value: 0.7600100187343619.[0m
[32m[I 2022-04-14 15:14:32,286][0m Trial 824 finished with value: 0.7342410922823819 and parameters: {'loss': 'coxph', 'learning_rate': 0.003426826267579428, 'n_estimators': 349, 'criterion': 'friedman_mse', 'min_samples_split': 2, 'min_samples_leaf': 1, 'min_weight_fraction_leaf': 0.06590629617274162, 'min_impurity_decrease': 0.7402116113085917, 'max_features': 0.9462879060052568, 'subsample': 0.9192799235003329, 'dropout_rate': 0.41163082014691854, 'ccp_alpha': 0.090238687846768}. Best is trial 677 with value: 0.7600100187343619.[0m
[32m[I 2022-04-14 15:14:51,547][0m Trial 825 finished with value: 0.5160881488838708 and parameters: {'loss': 'coxph', 'learning_rate': 0.00022484775427765807, 'n_estimators': 438, 'criterion': 'friedman_mse', 'min_samples_split': 2, 'min_samples_leaf': 1, 'min_weight_fraction_leaf': 0.046359568771826634, 'min_impurity_decrease': 0.5290006915974829, 'max_features': 0.8936051296238957, 'subsample': 0.8606796111302315, 'dropout_rate': 0.42587486323444773, 'ccp_alpha': 0.31281570837504685}. Best is trial 677 with value: 0.7600100187343619.[0m
[32m[I 2022-04-14 15:14:56,297][0m Trial 826 finished with value: 0.5 and parameters: {'loss': 'coxph', 'learning_rate': 0.0052444053611938645, 'n_estimators': 219, 'criterion': 'absolute_error', 'min_samples_split': 2, 'min_samples_leaf': 2, 'min_weight_fraction_leaf': 0.2924536055768156, 'min_impurity_decrease': 0.7761886030361542, 'max_features': 0.9671354922782747, 'subsample': 0.8023963838365724, 'dropout_rate': 0.5010005580883702, 'ccp_alpha': 4.849567334655733}. Best is trial 677 with value: 0.7600100187343619.[0m
[32m[I 2022-04-14 15:15:06,815][0m Trial 827 finished with value: 0.7422016925172166 and parameters: {'loss': 'coxph', 'learning_rate': 0.008371717822412677, 'n_estimators': 322, 'criterion': 'friedman_mse', 'min_samples_split': 2, 'min_samples_leaf': 1, 'min_weight_fraction_leaf': 0.012790910291586275, 'min_impurity_decrease': 0.4482702118736449, 'max_features': 0.9174526790175574, 'subsample': 0.7797271688727663, 'dropout_rate': 0.4526266344600098, 'ccp_alpha': 0.10052725053819705}. Best is trial 677 with value: 0.7600100187343619.[0m
[32m[I 2022-04-14 15:15:22,341][0m Trial 828 finished with value: 0.7434731721142465 and parameters: {'loss': 'coxph', 'learning_rate': 2.9259355285984143e-06, 'n_estimators': 369, 'criterion': 'friedman_mse', 'min_samples_split': 2, 'min_samples_leaf': 1, 'min_weight_fraction_leaf': 0.0335208713635741, 'min_impurity_decrease': 0.3432585932136558, 'max_features': 0.937804488311317, 'subsample': 0.8348207491086264, 'dropout_rate': 0.3633007808328277, 'ccp_alpha': 0.0027112543042633005}. Best is trial 677 with value: 0.7600100187343619.[0m
[32m[I 2022-04-14 15:15:34,501][0m Trial 829 finished with value: 0.6890284711618395 and parameters: {'loss': 'coxph', 'learning_rate': 0.012594649519934156, 'n_estimators': 335, 'criterion': 'friedman_mse', 'min_samples_split': 2, 'min_samples_leaf': 1, 'min_weight_fraction_leaf': 0.0562558371690111, 'min_impurity_decrease': 0.25819937701656304, 'max_features': 0.9680018736075197, 'subsample': 0.7331507916516522, 'dropout_rate': 0.3921321585062241, 'ccp_alpha': 0.2387128292476275}. Best is trial 677 with value: 0.7600100187343619.[0m
[32m[I 2022-04-14 15:15:49,000][0m Trial 830 finished with value: 0.7443413384824135 and parameters: {'loss': 'coxph', 'learning_rate': 0.004399658397298569, 'n_estimators': 389, 'criterion': 'friedman_mse', 'min_samples_split': 2, 'min_samples_leaf': 1, 'min_weight_fraction_leaf': 0.07119001844040121, 'min_impurity_decrease': 0.5056691160642861, 'max_features': 0.9023150594389864, 'subsample': 0.8073841100140065, 'dropout_rate': 0.47923082196853745, 'ccp_alpha': 0.09923899487109783}. Best is trial 677 with value: 0.7600100187343619.[0m
[32m[I 2022-04-14 15:16:17,780][0m Trial 831 finished with value: 0.6901547502481095 and parameters: {'loss': 'coxph', 'learning_rate': 0.03804584128918681, 'n_estimators': 523, 'criterion': 'friedman_mse', 'min_samples_split': 2, 'min_samples_leaf': 1, 'min_weight_fraction_leaf': 0.020123978262550583, 'min_impurity_decrease': 0.3817321609219402, 'max_features': 0.9523145994681046, 'subsample': 0.8743723649265027, 'dropout_rate': 0.43298394364574655, 'ccp_alpha': 0.17493326992696548}. Best is trial 677 with value: 0.7600100187343619.[0m
[32m[I 2022-04-14 15:16:59,542][0m Trial 832 finished with value: 0.5 and parameters: {'loss': 'coxph', 'learning_rate': 0.017970101456415453, 'n_estimators': 689, 'criterion': 'friedman_mse', 'min_samples_split': 2, 'min_samples_leaf': 3, 'min_weight_fraction_leaf': 0.048333749548017745, 'min_impurity_decrease': 0.4707397148410666, 'max_features': 0.8719917276419324, 'subsample': 0.8522626180939045, 'dropout_rate': 0.5434078724429489, 'ccp_alpha': 0.43855023117844877}. Best is trial 677 with value: 0.7600100187343619.[0m
[32m[I 2022-04-14 15:17:13,208][0m Trial 833 finished with value: 0.7576090030241109 and parameters: {'loss': 'coxph', 'learning_rate': 0.006387729560162403, 'n_estimators': 346, 'criterion': 'friedman_mse', 'min_samples_split': 2, 'min_samples_leaf': 2, 'min_weight_fraction_leaf': 0.03761635896831439, 'min_impurity_decrease': 0.41572326929454445, 'max_features': 0.9275079778698175, 'subsample': 0.7626589003126366, 'dropout_rate': 0.40343145641970246, 'ccp_alpha': 0.002424806548272452}. Best is trial 677 with value: 0.7600100187343619.[0m
[32m[I 2022-04-14 15:17:28,554][0m Trial 834 finished with value: 0.7348568513948888 and parameters: {'loss': 'coxph', 'learning_rate': 0.007241898172160278, 'n_estimators': 367, 'criterion': 'friedman_mse', 'min_samples_split': 2, 'min_samples_leaf': 2, 'min_weight_fraction_leaf': 0.03433891776513267, 'min_impurity_decrease': 0.41395229754193735, 'max_features': 0.8888323953193044, 'subsample': 0.7608067294555498, 'dropout_rate': 0.3744281373184387, 'ccp_alpha': 0.0948752387072575}. Best is trial 677 with value: 0.7600100187343619.[0m
[32m[I 2022-04-14 15:17:43,015][0m Trial 835 finished with value: 0.7551452248909916 and parameters: {'loss': 'coxph', 'learning_rate': 0.009504033771039633, 'n_estimators': 352, 'criterion': 'friedman_mse', 'min_samples_split': 2, 'min_samples_leaf': 2, 'min_weight_fraction_leaf': 0.030861229893400108, 'min_impurity_decrease': 0.40770550859471927, 'max_features': 0.9007611427711992, 'subsample': 0.7377275087129317, 'dropout_rate': 0.40237083031835025, 'ccp_alpha': 0.0032941292909129446}. Best is trial 677 with value: 0.7600100187343619.[0m
[32m[I 2022-04-14 15:18:02,199][0m Trial 836 finished with value: 0.2780424404524176 and parameters: {'loss': 'squared', 'learning_rate': 0.010220134379286035, 'n_estimators': 408, 'criterion': 'friedman_mse', 'min_samples_split': 2, 'min_samples_leaf': 2, 'min_weight_fraction_leaf': 0.04149595217503012, 'min_impurity_decrease': 0.39467505167471933, 'max_features': 0.8698023646726504, 'subsample': 0.7623689247860345, 'dropout_rate': 0.40715564978260865, 'ccp_alpha': 0.2507362827934581}. Best is trial 677 with value: 0.7600100187343619.[0m
[32m[I 2022-04-14 15:18:51,372][0m Trial 837 finished with value: 0.7220547199736489 and parameters: {'loss': 'coxph', 'learning_rate': 0.010498254269312949, 'n_estimators': 644, 'criterion': 'friedman_mse', 'min_samples_split': 2, 'min_samples_leaf': 2, 'min_weight_fraction_leaf': 0.03462551240645274, 'min_impurity_decrease': 0.41576959005233083, 'max_features': 0.8824876661618514, 'subsample': 0.7491972340156545, 'dropout_rate': 0.33869685651713227, 'ccp_alpha': 0.16555746280807493}. Best is trial 677 with value: 0.7600100187343619.[0m
[32m[I 2022-04-14 15:19:08,485][0m Trial 838 finished with value: 0.7531321035977567 and parameters: {'loss': 'coxph', 'learning_rate': 0.013076667270022813, 'n_estimators': 379, 'criterion': 'friedman_mse', 'min_samples_split': 2, 'min_samples_leaf': 2, 'min_weight_fraction_leaf': 0.04657178825008671, 'min_impurity_decrease': 0.40825495524992617, 'max_features': 0.9007135571367928, 'subsample': 0.7752726179156159, 'dropout_rate': 0.3655252143504217, 'ccp_alpha': 0.004635605471745186}. Best is trial 677 with value: 0.7600100187343619.[0m
[32m[I 2022-04-14 15:19:25,786][0m Trial 839 finished with value: 0.735126833837738 and parameters: {'loss': 'coxph', 'learning_rate': 0.008151650109740435, 'n_estimators': 389, 'criterion': 'friedman_mse', 'min_samples_split': 2, 'min_samples_leaf': 2, 'min_weight_fraction_leaf': 0.04741010149013998, 'min_impurity_decrease': 0.4060886264085047, 'max_features': 0.85968318061539, 'subsample': 0.7859098987763097, 'dropout_rate': 0.3611510430035684, 'ccp_alpha': 0.08861570395445799}. Best is trial 677 with value: 0.7600100187343619.[0m
[32m[I 2022-04-14 15:19:44,343][0m Trial 840 finished with value: 0.5 and parameters: {'loss': 'coxph', 'learning_rate': 0.010317765640987365, 'n_estimators': 398, 'criterion': 'friedman_mse', 'min_samples_split': 2, 'min_samples_leaf': 2, 'min_weight_fraction_leaf': 0.05299078453220188, 'min_impurity_decrease': 0.4008725184259512, 'max_features': 0.40836249923179035, 'subsample': 0.7765326876882762, 'dropout_rate': 0.34884108684782755, 'ccp_alpha': 0.3531237254145907}. Best is trial 677 with value: 0.7600100187343619.[0m
[32m[I 2022-04-14 15:20:00,625][0m Trial 841 finished with value: 0.7016026434695624 and parameters: {'loss': 'coxph', 'learning_rate': 0.008964445351557375, 'n_estimators': 378, 'criterion': 'friedman_mse', 'min_samples_split': 2, 'min_samples_leaf': 2, 'min_weight_fraction_leaf': 0.056070812603696396, 'min_impurity_decrease': 0.4227474456038228, 'max_features': 0.8967009502151649, 'subsample': 0.7932472406447753, 'dropout_rate': 0.36726962506023525, 'ccp_alpha': 0.16850160638209744}. Best is trial 677 with value: 0.7600100187343619.[0m
[32m[I 2022-04-14 15:20:22,518][0m Trial 842 finished with value: 0.7461071078437965 and parameters: {'loss': 'coxph', 'learning_rate': 0.007125872379992237, 'n_estimators': 429, 'criterion': 'friedman_mse', 'min_samples_split': 2, 'min_samples_leaf': 2, 'min_weight_fraction_leaf': 0.04353525084939721, 'min_impurity_decrease': 0.3967146124345219, 'max_features': 0.8862958162255887, 'subsample': 0.7739196026117457, 'dropout_rate': 0.3820656934137643, 'ccp_alpha': 0.09967281392748352}. Best is trial 677 with value: 0.7600100187343619.[0m
