[32m[I 2022-04-13 11:45:49,097][0m Trial 511 finished with value: 0.6705763419171312 and parameters: {'splitter': 'best', 'min_samples_split': 0.3510407294942174, 'min_samples_leaf': 0.03748408625389643, 'min_weight_fraction_leaf': 0.034895884888262244, 'max_features': 0.568127099637678}. Best is trial 163 with value: 0.7137418010284807.[0m
[32m[I 2022-04-13 11:45:49,184][0m Trial 512 finished with value: 0.6989673695016856 and parameters: {'splitter': 'best', 'min_samples_split': 0.3291235277292956, 'min_samples_leaf': 0.03886631209955266, 'min_weight_fraction_leaf': 0.12594277111085772, 'max_features': 0.5975451673611412}. Best is trial 163 with value: 0.7137418010284807.[0m
[32m[I 2022-04-13 11:45:49,239][0m Trial 513 finished with value: 0.7137418010284807 and parameters: {'splitter': 'best', 'min_samples_split': 0.3275427116287954, 'min_samples_leaf': 0.05406532272806077, 'min_weight_fraction_leaf': 0.1238274130252309, 'max_features': 0.575380177233641}. Best is trial 163 with value: 0.7137418010284807.[0m
[32m[I 2022-04-13 11:45:49,312][0m Trial 514 finished with value: 0.6989673695016856 and parameters: {'splitter': 'best', 'min_samples_split': 0.345629093989103, 'min_samples_leaf': 0.05709601351448371, 'min_weight_fraction_leaf': 0.03962304171429765, 'max_features': 0.6136748443566435}. Best is trial 163 with value: 0.7137418010284807.[0m
[32m[I 2022-04-13 11:45:49,387][0m Trial 515 finished with value: 0.7044783206942828 and parameters: {'splitter': 'best', 'min_samples_split': 0.3135627569485844, 'min_samples_leaf': 0.021731795794771976, 'min_weight_fraction_leaf': 0.11010088726545643, 'max_features': 0.5533367504388744}. Best is trial 163 with value: 0.7137418010284807.[0m
[32m[I 2022-04-13 11:45:49,495][0m Trial 516 finished with value: 0.7044783206942828 and parameters: {'splitter': 'best', 'min_samples_split': 0.30593871437031767, 'min_samples_leaf': 0.01990098969385191, 'min_weight_fraction_leaf': 0.11059481063242002, 'max_features': 0.5505463017510086}. Best is trial 163 with value: 0.7137418010284807.[0m
[32m[I 2022-04-13 11:45:49,645][0m Trial 517 finished with value: 0.6441041064354234 and parameters: {'splitter': 'best', 'min_samples_split': 0.3258668319422277, 'min_samples_leaf': 0.02781427509359407, 'min_weight_fraction_leaf': 0.046431013165502404, 'max_features': 0.4971871372088051}. Best is trial 163 with value: 0.7137418010284807.[0m
[32m[I 2022-04-13 11:45:49,750][0m Trial 518 finished with value: 0.631953446187902 and parameters: {'splitter': 'best', 'min_samples_split': 0.32191527642691414, 'min_samples_leaf': 0.014955701232306457, 'min_weight_fraction_leaf': 0.06771594410670992, 'max_features': 0.4754375964109136}. Best is trial 163 with value: 0.7137418010284807.[0m
[32m[I 2022-04-13 11:45:49,854][0m Trial 519 finished with value: 0.7137418010284807 and parameters: {'splitter': 'best', 'min_samples_split': 0.31693948733780253, 'min_samples_leaf': 0.01086749314104792, 'min_weight_fraction_leaf': 0.10044097203973838, 'max_features': 0.5310402207103992}. Best is trial 163 with value: 0.7137418010284807.[0m
[32m[I 2022-04-13 11:45:49,959][0m Trial 520 finished with value: 0.6751900786136191 and parameters: {'splitter': 'best', 'min_samples_split': 0.28674801879522677, 'min_samples_leaf': 0.15610763901938396, 'min_weight_fraction_leaf': 0.11090219823202702, 'max_features': 0.5702147228772043}. Best is trial 163 with value: 0.7137418010284807.[0m
[32m[I 2022-04-13 11:45:50,064][0m Trial 521 finished with value: 0.694086407378037 and parameters: {'splitter': 'best', 'min_samples_split': 0.29808319696704805, 'min_samples_leaf': 0.19184214544764508, 'min_weight_fraction_leaf': 0.09512328111069611, 'max_features': 0.5317716690575655}. Best is trial 163 with value: 0.7137418010284807.[0m
[32m[I 2022-04-13 11:45:50,189][0m Trial 522 finished with value: 0.7044783206942828 and parameters: {'splitter': 'best', 'min_samples_split': 0.31251391628862374, 'min_samples_leaf': 0.008347769397525783, 'min_weight_fraction_leaf': 0.11647210052391094, 'max_features': 0.5459765291747697}. Best is trial 163 with value: 0.7137418010284807.[0m
[32m[I 2022-04-13 11:45:50,291][0m Trial 523 finished with value: 0.6989673695016856 and parameters: {'splitter': 'best', 'min_samples_split': 0.33695929870152713, 'min_samples_leaf': 0.03623276766227364, 'min_weight_fraction_leaf': 0.12660553884537123, 'max_features': 0.5966859701317329}. Best is trial 163 with value: 0.7137418010284807.[0m
[32m[I 2022-04-13 11:45:50,387][0m Trial 524 finished with value: 0.6989673695016856 and parameters: {'splitter': 'best', 'min_samples_split': 0.3341405197018964, 'min_samples_leaf': 0.02990821332914939, 'min_weight_fraction_leaf': 0.11250443757007458, 'max_features': 0.5668418304025277}. Best is trial 163 with value: 0.7137418010284807.[0m
[32m[I 2022-04-13 11:45:50,467][0m Trial 525 finished with value: 0.6920012331415456 and parameters: {'splitter': 'best', 'min_samples_split': 0.2968274067976062, 'min_samples_leaf': 0.00987682110440725, 'min_weight_fraction_leaf': 0.09706637271373966, 'max_features': 0.5482574900362363}. Best is trial 163 with value: 0.7137418010284807.[0m
[32m[I 2022-04-13 11:45:50,542][0m Trial 526 finished with value: 0.616985624191478 and parameters: {'splitter': 'best', 'min_samples_split': 0.27370570683376455, 'min_samples_leaf': 0.001095818615013084, 'min_weight_fraction_leaf': 0.07877206274473636, 'max_features': 0.44689945906451356}. Best is trial 163 with value: 0.7137418010284807.[0m
[32m[I 2022-04-13 11:45:50,613][0m Trial 527 finished with value: 0.7137418010284807 and parameters: {'splitter': 'best', 'min_samples_split': 0.3264586435376341, 'min_samples_leaf': 0.041804954182225386, 'min_weight_fraction_leaf': 0.05605750392644187, 'max_features': 0.5807424490235605}. Best is trial 163 with value: 0.7137418010284807.[0m
[32m[I 2022-04-13 11:45:50,679][0m Trial 528 finished with value: 0.6273366771348405 and parameters: {'splitter': 'random', 'min_samples_split': 0.34807622849584025, 'min_samples_leaf': 0.04478856515574855, 'min_weight_fraction_leaf': 0.06393581681241768, 'max_features': 0.6291958053756469}. Best is trial 163 with value: 0.7137418010284807.[0m
[32m[I 2022-04-13 11:45:50,773][0m Trial 529 finished with value: 0.6989673695016856 and parameters: {'splitter': 'best', 'min_samples_split': 0.3366757652114292, 'min_samples_leaf': 0.03275105301643549, 'min_weight_fraction_leaf': 0.11823266655938777, 'max_features': 0.562832297172096}. Best is trial 163 with value: 0.7137418010284807.[0m
[32m[I 2022-04-13 11:45:50,854][0m Trial 530 finished with value: 0.6853507734439263 and parameters: {'splitter': 'best', 'min_samples_split': 0.3212118716107111, 'min_samples_leaf': 0.02608399333909041, 'min_weight_fraction_leaf': 0.05017152991108685, 'max_features': 0.5340510708033925}. Best is trial 163 with value: 0.7137418010284807.[0m
[32m[I 2022-04-13 11:45:50,934][0m Trial 531 finished with value: 0.7030519614506526 and parameters: {'splitter': 'best', 'min_samples_split': 0.3127744149921083, 'min_samples_leaf': 0.019298885345401702, 'min_weight_fraction_leaf': 0.07621614176775478, 'max_features': 0.6008829252424335}. Best is trial 163 with value: 0.7137418010284807.[0m
[32m[I 2022-04-13 11:45:50,996][0m Trial 532 finished with value: 0.6356612618118771 and parameters: {'splitter': 'best', 'min_samples_split': 0.34107639102048803, 'min_samples_leaf': 0.02521305041886946, 'min_weight_fraction_leaf': 0.38230463536469783, 'max_features': 0.5648436361451411}. Best is trial 163 with value: 0.7137418010284807.[0m
[32m[I 2022-04-13 11:45:51,104][0m Trial 533 finished with value: 0.7030519614506526 and parameters: {'splitter': 'best', 'min_samples_split': 0.3080236445042218, 'min_samples_leaf': 0.0032452518756008303, 'min_weight_fraction_leaf': 0.10313252197589486, 'max_features': 0.5175465442547391}. Best is trial 163 with value: 0.7137418010284807.[0m
[32m[I 2022-04-13 11:45:51,221][0m Trial 534 finished with value: 0.7137418010284807 and parameters: {'splitter': 'best', 'min_samples_split': 0.3275291877176584, 'min_samples_leaf': 0.024495846199791848, 'min_weight_fraction_leaf': 0.11536523752599466, 'max_features': 0.5553150142351589}. Best is trial 163 with value: 0.7137418010284807.[0m
[32m[I 2022-04-13 11:45:51,321][0m Trial 535 finished with value: 0.6920012331415456 and parameters: {'splitter': 'best', 'min_samples_split': 0.299874610767409, 'min_samples_leaf': 0.0016949976196070117, 'min_weight_fraction_leaf': 0.1031120123646479, 'max_features': 0.5133720306197537}. Best is trial 163 with value: 0.7137418010284807.[0m
[32m[I 2022-04-13 11:45:51,411][0m Trial 536 finished with value: 0.6353838276695598 and parameters: {'splitter': 'best', 'min_samples_split': 0.35479150726304215, 'min_samples_leaf': 0.035670801047413596, 'min_weight_fraction_leaf': 0.12658370061928573, 'max_features': 0.4943663020276752}. Best is trial 163 with value: 0.7137418010284807.[0m
[32m[I 2022-04-13 11:45:51,604][0m Trial 537 finished with value: 0.6494336255137935 and parameters: {'splitter': 'best', 'min_samples_split': 0.31485470405803206, 'min_samples_leaf': 0.36539611590242954, 'min_weight_fraction_leaf': 0.10014299637963624, 'max_features': 0.5300530418414783}. Best is trial 163 with value: 0.7137418010284807.[0m
[32m[I 2022-04-13 11:45:51,697][0m Trial 538 finished with value: 0.7044783206942828 and parameters: {'splitter': 'best', 'min_samples_split': 0.30612186397828317, 'min_samples_leaf': 0.011062881717832646, 'min_weight_fraction_leaf': 0.1066652234701089, 'max_features': 0.5461765281940759}. Best is trial 163 with value: 0.7137418010284807.[0m
[32m[I 2022-04-13 11:45:51,795][0m Trial 539 finished with value: 0.6150737283379903 and parameters: {'splitter': 'best', 'min_samples_split': 0.36919046613840883, 'min_samples_leaf': 0.2686223961485332, 'min_weight_fraction_leaf': 0.0921050454184019, 'max_features': 0.512624091991717}. Best is trial 163 with value: 0.7137418010284807.[0m
[32m[I 2022-04-13 11:45:51,862][0m Trial 540 finished with value: 0.6989673695016856 and parameters: {'splitter': 'best', 'min_samples_split': 0.32971791597015265, 'min_samples_leaf': 0.03240536130734624, 'min_weight_fraction_leaf': 0.06611240290541802, 'max_features': 0.5783458287549302}. Best is trial 163 with value: 0.7137418010284807.[0m
[32m[I 2022-04-13 11:45:51,908][0m Trial 541 finished with value: 0.6513176944526099 and parameters: {'splitter': 'best', 'min_samples_split': 0.31637140028703253, 'min_samples_leaf': 0.01072114900705429, 'min_weight_fraction_leaf': 0.08825610437997095, 'max_features': 0.48426020452439567}. Best is trial 163 with value: 0.7137418010284807.[0m
[32m[I 2022-04-13 11:45:51,950][0m Trial 542 finished with value: 0.7137418010284807 and parameters: {'splitter': 'best', 'min_samples_split': 0.31854979723333166, 'min_samples_leaf': 0.0014243530701554112, 'min_weight_fraction_leaf': 0.09392562928692615, 'max_features': 0.5292454113808807}. Best is trial 163 with value: 0.7137418010284807.[0m
[32m[I 2022-04-13 11:45:51,992][0m Trial 543 finished with value: 0.7064170915736968 and parameters: {'splitter': 'random', 'min_samples_split': 0.30018990532849904, 'min_samples_leaf': 0.0014548375150838832, 'min_weight_fraction_leaf': 0.10281494266743765, 'max_features': 0.5101356428156458}. Best is trial 163 with value: 0.7137418010284807.[0m
[32m[I 2022-04-13 11:45:52,118][0m Trial 544 finished with value: 0.695563433079365 and parameters: {'splitter': 'best', 'min_samples_split': 0.2914242182909958, 'min_samples_leaf': 0.007551891939680545, 'min_weight_fraction_leaf': 0.09074829078344711, 'max_features': 0.5204607666331187}. Best is trial 163 with value: 0.7137418010284807.[0m
[32m[I 2022-04-13 11:45:52,197][0m Trial 545 finished with value: 0.6989673695016856 and parameters: {'splitter': 'best', 'min_samples_split': 0.3348214442458688, 'min_samples_leaf': 0.01791173495806004, 'min_weight_fraction_leaf': 0.11751157745039889, 'max_features': 0.5986120512236063}. Best is trial 163 with value: 0.7137418010284807.[0m
[32m[I 2022-04-13 11:45:52,406][0m Trial 546 finished with value: 0.6513176944526099 and parameters: {'splitter': 'best', 'min_samples_split': 0.3166004489125258, 'min_samples_leaf': 0.008585943960576877, 'min_weight_fraction_leaf': 0.08247614063856164, 'max_features': 0.47900202206743303}. Best is trial 163 with value: 0.7137418010284807.[0m
[32m[I 2022-04-13 11:45:52,671][0m Trial 547 finished with value: 0.631953446187902 and parameters: {'splitter': 'best', 'min_samples_split': 0.32244781130440126, 'min_samples_leaf': 0.017348342279030187, 'min_weight_fraction_leaf': 0.0770939073361836, 'max_features': 0.45769851337093853}. Best is trial 163 with value: 0.7137418010284807.[0m
[32m[I 2022-04-13 11:45:52,804][0m Trial 548 finished with value: 0.7044783206942828 and parameters: {'splitter': 'best', 'min_samples_split': 0.30635304631937715, 'min_samples_leaf': 0.0099730939102091, 'min_weight_fraction_leaf': 0.10704653319041998, 'max_features': 0.5493589927383098}. Best is trial 163 with value: 0.7137418010284807.[0m
[32m[I 2022-04-13 11:45:52,906][0m Trial 549 finished with value: 0.6989673695016856 and parameters: {'splitter': 'best', 'min_samples_split': 0.34178307676039393, 'min_samples_leaf': 0.017651884379349995, 'min_weight_fraction_leaf': 0.08824285308315119, 'max_features': 0.5061341762713477}. Best is trial 163 with value: 0.7137418010284807.[0m
[32m[I 2022-04-13 11:45:52,965][0m Trial 550 finished with value: 0.631953446187902 and parameters: {'splitter': 'best', 'min_samples_split': 0.3256701090144522, 'min_samples_leaf': 0.010214763315829153, 'min_weight_fraction_leaf': 0.07034011917251212, 'max_features': 0.4907726080488929}. Best is trial 163 with value: 0.7137418010284807.[0m
[32m[I 2022-04-13 11:45:53,004][0m Trial 551 finished with value: 0.7044783206942828 and parameters: {'splitter': 'best', 'min_samples_split': 0.3062531620710251, 'min_samples_leaf': 0.0013630704505357004, 'min_weight_fraction_leaf': 0.1060808951114592, 'max_features': 0.5174035208494766}. Best is trial 163 with value: 0.7137418010284807.[0m
[32m[I 2022-04-13 11:45:53,040][0m Trial 552 finished with value: 0.6440317768217898 and parameters: {'splitter': 'best', 'min_samples_split': 0.3390417449148547, 'min_samples_leaf': 0.0178214973913787, 'min_weight_fraction_leaf': 0.09617873024025143, 'max_features': 0.4968334194422269}. Best is trial 163 with value: 0.7137418010284807.[0m
[32m[I 2022-04-13 11:45:53,075][0m Trial 553 finished with value: 0.6989673695016856 and parameters: {'splitter': 'best', 'min_samples_split': 0.33115609738976165, 'min_samples_leaf': 0.0480256106343252, 'min_weight_fraction_leaf': 0.11826858427771628, 'max_features': 0.5644326249164775}. Best is trial 163 with value: 0.7137418010284807.[0m
[32m[I 2022-04-13 11:45:53,108][0m Trial 554 finished with value: 0.6989673695016856 and parameters: {'splitter': 'best', 'min_samples_split': 0.35447388827288856, 'min_samples_leaf': 0.031044628937192252, 'min_weight_fraction_leaf': 0.07504065794615408, 'max_features': 0.5328621667620088}. Best is trial 163 with value: 0.7137418010284807.[0m
[32m[I 2022-04-13 11:45:53,168][0m Trial 555 finished with value: 0.6513176944526099 and parameters: {'splitter': 'best', 'min_samples_split': 0.32179484753715726, 'min_samples_leaf': 0.0017895504305868992, 'min_weight_fraction_leaf': 0.07980469954660036, 'max_features': 0.4581413589826339}. Best is trial 163 with value: 0.7137418010284807.[0m
[32m[I 2022-04-13 11:45:53,253][0m Trial 556 finished with value: 0.684611897101941 and parameters: {'splitter': 'best', 'min_samples_split': 0.2849843729349983, 'min_samples_leaf': 0.0094728631174083, 'min_weight_fraction_leaf': 0.10127546419102307, 'max_features': 0.5445987404962537}. Best is trial 163 with value: 0.7137418010284807.[0m
[32m[I 2022-04-13 11:45:53,371][0m Trial 557 finished with value: 0.6815535256784726 and parameters: {'splitter': 'best', 'min_samples_split': 0.3475109008689703, 'min_samples_leaf': 0.04875422888034906, 'min_weight_fraction_leaf': 0.13235329393563436, 'max_features': 0.5921879830376338}. Best is trial 163 with value: 0.7137418010284807.[0m
[32m[I 2022-04-13 11:45:53,430][0m Trial 558 finished with value: 0.6989673695016856 and parameters: {'splitter': 'best', 'min_samples_split': 0.330569968184463, 'min_samples_leaf': 0.04124258662018557, 'min_weight_fraction_leaf': 0.12899032704786095, 'max_features': 0.6168874177204176}. Best is trial 163 with value: 0.7137418010284807.[0m
[32m[I 2022-04-13 11:45:53,483][0m Trial 559 finished with value: 0.6989673695016856 and parameters: {'splitter': 'best', 'min_samples_split': 0.33208790386840065, 'min_samples_leaf': 0.028940595769443515, 'min_weight_fraction_leaf': 0.0716117554330906, 'max_features': 0.575708979908197}. Best is trial 163 with value: 0.7137418010284807.[0m
[32m[I 2022-04-13 11:45:53,598][0m Trial 560 finished with value: 0.6513176944526099 and parameters: {'splitter': 'best', 'min_samples_split': 0.32423168647600076, 'min_samples_leaf': 0.016770601482769997, 'min_weight_fraction_leaf': 0.08667411858465385, 'max_features': 0.4739299688923256}. Best is trial 163 with value: 0.7137418010284807.[0m
[32m[I 2022-04-13 11:45:53,698][0m Trial 561 finished with value: 0.7030519614506526 and parameters: {'splitter': 'best', 'min_samples_split': 0.31111302148348285, 'min_samples_leaf': 0.010454406978123804, 'min_weight_fraction_leaf': 0.10071522605120528, 'max_features': 0.5551108680909346}. Best is trial 163 with value: 0.7137418010284807.[0m
[32m[I 2022-04-13 11:45:53,779][0m Trial 562 finished with value: 0.6989673695016856 and parameters: {'splitter': 'best', 'min_samples_split': 0.3438375330054832, 'min_samples_leaf': 0.03191179667157464, 'min_weight_fraction_leaf': 0.11663742625342678, 'max_features': 0.5606280426090092}. Best is trial 163 with value: 0.7137418010284807.[0m
[32m[I 2022-04-13 11:45:53,881][0m Trial 563 finished with value: 0.7030519614506526 and parameters: {'splitter': 'best', 'min_samples_split': 0.3101060533652833, 'min_samples_leaf': 0.008045322206899193, 'min_weight_fraction_leaf': 0.08297582748923024, 'max_features': 0.534924466311463}. Best is trial 163 with value: 0.7137418010284807.[0m
[32m[I 2022-04-13 11:45:53,974][0m Trial 564 finished with value: 0.7137418010284807 and parameters: {'splitter': 'best', 'min_samples_split': 0.319433818146716, 'min_samples_leaf': 0.016181465835784385, 'min_weight_fraction_leaf': 0.09497049230204048, 'max_features': 0.5273368296082214}. Best is trial 163 with value: 0.7137418010284807.[0m
[32m[I 2022-04-13 11:45:54,051][0m Trial 565 finished with value: 0.6920012331415456 and parameters: {'splitter': 'best', 'min_samples_split': 0.29332517729861907, 'min_samples_leaf': 0.002268258469986445, 'min_weight_fraction_leaf': 0.09599099088357917, 'max_features': 0.5114731780328078}. Best is trial 163 with value: 0.7137418010284807.[0m
[32m[I 2022-04-13 11:45:54,125][0m Trial 566 finished with value: 0.6989673695016856 and parameters: {'splitter': 'best', 'min_samples_split': 0.33608246350242776, 'min_samples_leaf': 0.026839994441459826, 'min_weight_fraction_leaf': 0.12263785535351704, 'max_features': 0.5818773838742354}. Best is trial 163 with value: 0.7137418010284807.[0m
[32m[I 2022-04-13 11:45:54,181][0m Trial 567 finished with value: 0.6891528673684901 and parameters: {'splitter': 'random', 'min_samples_split': 0.32845237591823173, 'min_samples_leaf': 0.16595669867254587, 'min_weight_fraction_leaf': 0.054753739958881116, 'max_features': 0.5310512720474648}. Best is trial 163 with value: 0.7137418010284807.[0m
[32m[I 2022-04-13 11:45:54,257][0m Trial 568 finished with value: 0.6989673695016856 and parameters: {'splitter': 'best', 'min_samples_split': 0.3621100053439168, 'min_samples_leaf': 0.03569691335168329, 'min_weight_fraction_leaf': 0.05605901697225685, 'max_features': 0.5884077174563915}. Best is trial 163 with value: 0.7137418010284807.[0m
[32m[I 2022-04-13 11:45:54,323][0m Trial 569 finished with value: 0.7137418010284807 and parameters: {'splitter': 'best', 'min_samples_split': 0.3221252851453279, 'min_samples_leaf': 0.019289988398862645, 'min_weight_fraction_leaf': 0.07671815444981848, 'max_features': 0.5312530870790519}. Best is trial 163 with value: 0.7137418010284807.[0m
[32m[I 2022-04-13 11:45:54,384][0m Trial 570 finished with value: 0.7030519614506526 and parameters: {'splitter': 'best', 'min_samples_split': 0.30478870521802004, 'min_samples_leaf': 0.002410942810219277, 'min_weight_fraction_leaf': 0.09235593048741078, 'max_features': 0.5094031224932893}. Best is trial 163 with value: 0.7137418010284807.[0m
[32m[I 2022-04-13 11:45:54,437][0m Trial 571 finished with value: 0.6989673695016856 and parameters: {'splitter': 'best', 'min_samples_split': 0.34978402526249447, 'min_samples_leaf': 0.027968666780873466, 'min_weight_fraction_leaf': 0.11675175694689663, 'max_features': 0.5491282221475707}. Best is trial 163 with value: 0.7137418010284807.[0m
[32m[I 2022-04-13 11:45:54,475][0m Trial 572 finished with value: 0.6356612618118771 and parameters: {'splitter': 'best', 'min_samples_split': 0.3317134353023886, 'min_samples_leaf': 0.3897163648264099, 'min_weight_fraction_leaf': 0.08173907954820239, 'max_features': 0.4934729623499338}. Best is trial 163 with value: 0.7137418010284807.[0m
[32m[I 2022-04-13 11:45:54,532][0m Trial 573 finished with value: 0.6705763419171312 and parameters: {'splitter': 'best', 'min_samples_split': 0.3418298389960654, 'min_samples_leaf': 0.025359509320661975, 'min_weight_fraction_leaf': 0.03998320222742282, 'max_features': 0.5637896948718025}. Best is trial 163 with value: 0.7137418010284807.[0m
