[32m[I 2022-04-16 04:57:16,771][0m Trial 210 finished with value: 0.862163066436586 and parameters: {'n_hidden': 64, 'mixture_components': 2, 'use_sparse_layer': False, 'use_batchnorm': True, 'use_dropout': True, 'dropout': 0.5445520404819741, 'mlp_size_1': 0, 'mlp_size_2': 2, 'mlp_size_3': 0, 'kernel': 'Gamma', 'loss_name': 'NLLLoss'}. Best is trial 173 with value: 0.8721374613820508.[0m
[32m[I 2022-04-16 05:03:27,982][0m Trial 211 finished with value: 0.8586510488778532 and parameters: {'n_hidden': 64, 'mixture_components': 2, 'use_sparse_layer': False, 'use_batchnorm': True, 'use_dropout': True, 'dropout': 0.5782255219535856, 'mlp_size_1': 0, 'mlp_size_2': 2, 'mlp_size_3': 0, 'kernel': 'Exponential', 'loss_name': 'NLLLoss'}. Best is trial 173 with value: 0.8721374613820508.[0m
[32m[I 2022-04-16 05:09:06,668][0m Trial 212 finished with value: 0.8670535864349276 and parameters: {'n_hidden': 64, 'mixture_components': 2, 'use_sparse_layer': False, 'use_batchnorm': True, 'use_dropout': True, 'dropout': 0.6378011938830023, 'mlp_size_1': 0, 'mlp_size_2': 2, 'mlp_size_3': 0, 'kernel': 'Exponential', 'loss_name': 'NLLLoss'}. Best is trial 173 with value: 0.8721374613820508.[0m
[32m[I 2022-04-16 05:17:03,212][0m Trial 213 finished with value: 0.8681005924447145 and parameters: {'n_hidden': 64, 'mixture_components': 2, 'use_sparse_layer': False, 'use_batchnorm': True, 'use_dropout': True, 'dropout': 0.6391241844568222, 'mlp_size_1': 0, 'mlp_size_2': 2, 'mlp_size_3': 0, 'kernel': 'Exponential', 'loss_name': 'NLLLoss'}. Best is trial 173 with value: 0.8721374613820508.[0m
[32m[I 2022-04-16 05:23:00,977][0m Trial 214 finished with value: 0.8636167034427398 and parameters: {'n_hidden': 64, 'mixture_components': 2, 'use_sparse_layer': False, 'use_batchnorm': True, 'use_dropout': True, 'dropout': 0.6515136562321271, 'mlp_size_1': 0, 'mlp_size_2': 2, 'mlp_size_3': 0, 'kernel': 'Exponential', 'loss_name': 'NLLLoss'}. Best is trial 173 with value: 0.8721374613820508.[0m
[32m[I 2022-04-16 05:28:20,591][0m Trial 215 finished with value: 0.8539306892404532 and parameters: {'n_hidden': 64, 'mixture_components': 2, 'use_sparse_layer': False, 'use_batchnorm': True, 'use_dropout': True, 'dropout': 0.6415717794941616, 'mlp_size_1': 0, 'mlp_size_2': 2, 'mlp_size_3': 0, 'kernel': 'Exponential', 'loss_name': 'NLLLoss'}. Best is trial 173 with value: 0.8721374613820508.[0m
[32m[I 2022-04-16 05:31:55,343][0m Trial 216 finished with value: 0.8329207184760019 and parameters: {'n_hidden': 64, 'mixture_components': 3, 'use_sparse_layer': False, 'use_batchnorm': True, 'use_dropout': True, 'dropout': 0.6691269512065923, 'mlp_size_1': 0, 'mlp_size_2': 2, 'mlp_size_3': 0, 'kernel': 'LogNormal', 'loss_name': 'NLLLoss'}. Best is trial 173 with value: 0.8721374613820508.[0m
[32m[I 2022-04-16 05:34:53,013][0m Trial 217 finished with value: 0.796772230905724 and parameters: {'n_hidden': 64, 'mixture_components': 2, 'use_sparse_layer': False, 'use_batchnorm': False, 'use_dropout': True, 'dropout': 0.6325720421574607, 'mlp_size_1': 0, 'mlp_size_2': 2, 'mlp_size_3': 0, 'kernel': 'Exponential', 'loss_name': 'NLLLoss'}. Best is trial 173 with value: 0.8721374613820508.[0m
[32m[I 2022-04-16 05:40:03,293][0m Trial 218 finished with value: 0.8670497019069124 and parameters: {'n_hidden': 64, 'mixture_components': 2, 'use_sparse_layer': False, 'use_batchnorm': True, 'use_dropout': True, 'dropout': 0.6041770436343807, 'mlp_size_1': 0, 'mlp_size_2': 2, 'mlp_size_3': 0, 'kernel': 'Exponential', 'loss_name': 'NLLLoss'}. Best is trial 173 with value: 0.8721374613820508.[0m
[32m[I 2022-04-16 05:45:54,591][0m Trial 219 finished with value: 0.8554666252776488 and parameters: {'n_hidden': 64, 'mixture_components': 2, 'use_sparse_layer': False, 'use_batchnorm': True, 'use_dropout': True, 'dropout': 0.6040967990678054, 'mlp_size_1': 0, 'mlp_size_2': 2, 'mlp_size_3': 0, 'kernel': 'Logistic', 'loss_name': 'NLLLoss'}. Best is trial 173 with value: 0.8721374613820508.[0m
[32m[I 2022-04-16 05:52:51,693][0m Trial 220 finished with value: 0.8683241573189292 and parameters: {'n_hidden': 64, 'mixture_components': 2, 'use_sparse_layer': False, 'use_batchnorm': True, 'use_dropout': True, 'dropout': 0.6574848330818219, 'mlp_size_1': 0, 'mlp_size_2': 2, 'mlp_size_3': 0, 'kernel': 'Exponential', 'loss_name': 'NLLLoss'}. Best is trial 173 with value: 0.8721374613820508.[0m
[32m[I 2022-04-16 05:59:05,880][0m Trial 221 finished with value: 0.8677444898909575 and parameters: {'n_hidden': 64, 'mixture_components': 2, 'use_sparse_layer': False, 'use_batchnorm': True, 'use_dropout': True, 'dropout': 0.6525477485819918, 'mlp_size_1': 0, 'mlp_size_2': 2, 'mlp_size_3': 0, 'kernel': 'Exponential', 'loss_name': 'NLLLoss'}. Best is trial 173 with value: 0.8721374613820508.[0m
[32m[I 2022-04-16 06:05:24,267][0m Trial 222 finished with value: 0.8642218533198089 and parameters: {'n_hidden': 64, 'mixture_components': 2, 'use_sparse_layer': False, 'use_batchnorm': True, 'use_dropout': True, 'dropout': 0.6584577504426288, 'mlp_size_1': 0, 'mlp_size_2': 2, 'mlp_size_3': 0, 'kernel': 'Exponential', 'loss_name': 'NLLLoss'}. Best is trial 173 with value: 0.8721374613820508.[0m
[32m[I 2022-04-16 06:12:30,947][0m Trial 223 finished with value: 0.8674764360921197 and parameters: {'n_hidden': 64, 'mixture_components': 2, 'use_sparse_layer': False, 'use_batchnorm': True, 'use_dropout': True, 'dropout': 0.6880450221694991, 'mlp_size_1': 0, 'mlp_size_2': 2, 'mlp_size_3': 0, 'kernel': 'Exponential', 'loss_name': 'NLLLoss'}. Best is trial 173 with value: 0.8721374613820508.[0m
[32m[I 2022-04-16 06:18:28,296][0m Trial 224 finished with value: 0.8666187418336542 and parameters: {'n_hidden': 64, 'mixture_components': 2, 'use_sparse_layer': False, 'use_batchnorm': True, 'use_dropout': True, 'dropout': 0.687258075809895, 'mlp_size_1': 0, 'mlp_size_2': 2, 'mlp_size_3': 0, 'kernel': 'Exponential', 'loss_name': 'NLLLoss'}. Best is trial 173 with value: 0.8721374613820508.[0m
[32m[I 2022-04-16 06:24:19,857][0m Trial 225 finished with value: 0.8679844997662652 and parameters: {'n_hidden': 64, 'mixture_components': 2, 'use_sparse_layer': False, 'use_batchnorm': True, 'use_dropout': True, 'dropout': 0.6795494825319837, 'mlp_size_1': 0, 'mlp_size_2': 2, 'mlp_size_3': 0, 'kernel': 'Exponential', 'loss_name': 'NLLLoss'}. Best is trial 173 with value: 0.8721374613820508.[0m
[32m[I 2022-04-16 06:30:24,336][0m Trial 226 finished with value: 0.8680187971305735 and parameters: {'n_hidden': 64, 'mixture_components': 2, 'use_sparse_layer': False, 'use_batchnorm': True, 'use_dropout': True, 'dropout': 0.6796794431304409, 'mlp_size_1': 0, 'mlp_size_2': 2, 'mlp_size_3': 0, 'kernel': 'Exponential', 'loss_name': 'NLLLoss'}. Best is trial 173 with value: 0.8721374613820508.[0m
[32m[I 2022-04-16 06:36:16,030][0m Trial 227 finished with value: 0.871468878001426 and parameters: {'n_hidden': 64, 'mixture_components': 2, 'use_sparse_layer': False, 'use_batchnorm': True, 'use_dropout': True, 'dropout': 0.7043897399858519, 'mlp_size_1': 0, 'mlp_size_2': 2, 'mlp_size_3': 0, 'kernel': 'Exponential', 'loss_name': 'NLLLoss'}. Best is trial 173 with value: 0.8721374613820508.[0m
[32m[I 2022-04-16 06:37:14,995][0m Trial 228 finished with value: -0.5 and parameters: {'n_hidden': 64, 'mixture_components': 2, 'use_sparse_layer': False, 'use_batchnorm': True, 'use_dropout': True, 'dropout': 0.6977566313779368, 'mlp_size_1': 0, 'mlp_size_2': 2, 'mlp_size_3': 0, 'kernel': 'Gumbel', 'loss_name': 'NLLLoss'}. Best is trial 173 with value: 0.8721374613820508.[0m
[32m[I 2022-04-16 06:43:04,946][0m Trial 229 finished with value: 0.8640398227634183 and parameters: {'n_hidden': 64, 'mixture_components': 2, 'use_sparse_layer': False, 'use_batchnorm': True, 'use_dropout': True, 'dropout': 0.7136745803895522, 'mlp_size_1': 0, 'mlp_size_2': 2, 'mlp_size_3': 0, 'kernel': 'Exponential', 'loss_name': 'NLLLoss'}. Best is trial 173 with value: 0.8721374613820508.[0m
[32m[I 2022-04-16 06:48:38,846][0m Trial 230 finished with value: 0.86470128555973 and parameters: {'n_hidden': 64, 'mixture_components': 9, 'use_sparse_layer': False, 'use_batchnorm': True, 'use_dropout': True, 'dropout': 0.6828883450605205, 'mlp_size_1': 0, 'mlp_size_2': 2, 'mlp_size_3': 0, 'kernel': 'Exponential', 'loss_name': 'NLLLoss'}. Best is trial 173 with value: 0.8721374613820508.[0m
[32m[I 2022-04-16 06:54:49,515][0m Trial 231 finished with value: 0.8660730061085198 and parameters: {'n_hidden': 64, 'mixture_components': 2, 'use_sparse_layer': False, 'use_batchnorm': True, 'use_dropout': True, 'dropout': 0.7479233748149285, 'mlp_size_1': 0, 'mlp_size_2': 2, 'mlp_size_3': 0, 'kernel': 'Exponential', 'loss_name': 'NLLLoss'}. Best is trial 173 with value: 0.8721374613820508.[0m
[32m[I 2022-04-16 07:00:25,346][0m Trial 232 finished with value: 0.8636618110113329 and parameters: {'n_hidden': 64, 'mixture_components': 2, 'use_sparse_layer': False, 'use_batchnorm': True, 'use_dropout': True, 'dropout': 0.7339784595182051, 'mlp_size_1': 0, 'mlp_size_2': 2, 'mlp_size_3': 0, 'kernel': 'Exponential', 'loss_name': 'NLLLoss'}. Best is trial 173 with value: 0.8721374613820508.[0m
[32m[I 2022-04-16 07:06:19,084][0m Trial 233 finished with value: 0.8637679606430279 and parameters: {'n_hidden': 64, 'mixture_components': 2, 'use_sparse_layer': False, 'use_batchnorm': True, 'use_dropout': True, 'dropout': 0.670261621880996, 'mlp_size_1': 0, 'mlp_size_2': 2, 'mlp_size_3': 0, 'kernel': 'Exponential', 'loss_name': 'NLLLoss'}. Best is trial 173 with value: 0.8721374613820508.[0m
[32m[I 2022-04-16 07:13:08,322][0m Trial 234 finished with value: 0.8658844959479726 and parameters: {'n_hidden': 64, 'mixture_components': 2, 'use_sparse_layer': False, 'use_batchnorm': True, 'use_dropout': True, 'dropout': 0.6981510506027636, 'mlp_size_1': 0, 'mlp_size_2': 2, 'mlp_size_3': 0, 'kernel': 'Exponential', 'loss_name': 'NLLLoss'}. Best is trial 173 with value: 0.8721374613820508.[0m
[32m[I 2022-04-16 07:18:41,498][0m Trial 235 finished with value: 0.8601566291262926 and parameters: {'n_hidden': 64, 'mixture_components': 2, 'use_sparse_layer': False, 'use_batchnorm': True, 'use_dropout': True, 'dropout': 0.656482512544076, 'mlp_size_1': 0, 'mlp_size_2': 2, 'mlp_size_3': 0, 'kernel': 'Exponential', 'loss_name': 'NLLLoss'}. Best is trial 173 with value: 0.8721374613820508.[0m
[32m[I 2022-04-16 07:24:01,186][0m Trial 236 finished with value: 0.8657580405556313 and parameters: {'n_hidden': 64, 'mixture_components': 2, 'use_sparse_layer': False, 'use_batchnorm': True, 'use_dropout': True, 'dropout': 0.6803887083320304, 'mlp_size_1': 0, 'mlp_size_2': 2, 'mlp_size_3': 0, 'kernel': 'Exponential', 'loss_name': 'NLLLoss'}. Best is trial 173 with value: 0.8721374613820508.[0m
[32m[I 2022-04-16 07:26:53,518][0m Trial 237 finished with value: 0.8481783819568729 and parameters: {'n_hidden': 256, 'mixture_components': 2, 'use_sparse_layer': False, 'use_batchnorm': True, 'use_dropout': True, 'dropout': 0.6550651195356181, 'mlp_size_1': 2, 'mlp_size_2': 2, 'mlp_size_3': 0, 'kernel': 'Exponential', 'loss_name': 'NLLLoss'}. Best is trial 173 with value: 0.8721374613820508.[0m
[32m[I 2022-04-16 07:33:05,779][0m Trial 238 finished with value: 0.8721212566279298 and parameters: {'n_hidden': 64, 'mixture_components': 2, 'use_sparse_layer': False, 'use_batchnorm': True, 'use_dropout': True, 'dropout': 0.6734235816117712, 'mlp_size_1': 0, 'mlp_size_2': 2, 'mlp_size_3': 0, 'kernel': 'Exponential', 'loss_name': 'NLLLoss'}. Best is trial 173 with value: 0.8721374613820508.[0m
[32m[I 2022-04-16 07:38:39,293][0m Trial 239 finished with value: 0.8654800393031394 and parameters: {'n_hidden': 64, 'mixture_components': 2, 'use_sparse_layer': False, 'use_batchnorm': True, 'use_dropout': True, 'dropout': 0.7091815407383903, 'mlp_size_1': 0, 'mlp_size_2': 2, 'mlp_size_3': 0, 'kernel': 'Exponential', 'loss_name': 'NLLLoss'}. Best is trial 173 with value: 0.8721374613820508.[0m
[32m[I 2022-04-16 07:43:34,055][0m Trial 240 finished with value: 0.8597357972059093 and parameters: {'n_hidden': 64, 'mixture_components': 2, 'use_sparse_layer': False, 'use_batchnorm': True, 'use_dropout': True, 'dropout': 0.6815883982178168, 'mlp_size_1': 0, 'mlp_size_2': 2, 'mlp_size_3': 0, 'kernel': 'LogLogistic', 'loss_name': 'NLLLoss'}. Best is trial 173 with value: 0.8721374613820508.[0m
[32m[I 2022-04-16 07:48:42,454][0m Trial 241 finished with value: 0.8685020428687871 and parameters: {'n_hidden': 64, 'mixture_components': 2, 'use_sparse_layer': False, 'use_batchnorm': True, 'use_dropout': True, 'dropout': 0.6646764914197004, 'mlp_size_1': 0, 'mlp_size_2': 2, 'mlp_size_3': 0, 'kernel': 'Exponential', 'loss_name': 'NLLLoss'}. Best is trial 173 with value: 0.8721374613820508.[0m
[32m[I 2022-04-16 07:54:40,488][0m Trial 242 finished with value: 0.8673465038960673 and parameters: {'n_hidden': 64, 'mixture_components': 2, 'use_sparse_layer': False, 'use_batchnorm': True, 'use_dropout': True, 'dropout': 0.6637204518526891, 'mlp_size_1': 0, 'mlp_size_2': 2, 'mlp_size_3': 0, 'kernel': 'Exponential', 'loss_name': 'NLLLoss'}. Best is trial 173 with value: 0.8721374613820508.[0m
[32m[I 2022-04-16 08:01:39,308][0m Trial 243 finished with value: 0.8678039282568701 and parameters: {'n_hidden': 64, 'mixture_components': 2, 'use_sparse_layer': False, 'use_batchnorm': True, 'use_dropout': True, 'dropout': 0.6447206272453904, 'mlp_size_1': 0, 'mlp_size_2': 2, 'mlp_size_3': 0, 'kernel': 'Exponential', 'loss_name': 'NLLLoss'}. Best is trial 173 with value: 0.8721374613820508.[0m
[32m[I 2022-04-16 08:07:20,436][0m Trial 244 finished with value: 0.8619432570217758 and parameters: {'n_hidden': 64, 'mixture_components': 2, 'use_sparse_layer': False, 'use_batchnorm': True, 'use_dropout': True, 'dropout': 0.6466219712980321, 'mlp_size_1': 0, 'mlp_size_2': 2, 'mlp_size_3': 0, 'kernel': 'Exponential', 'loss_name': 'NLLLoss'}. Best is trial 173 with value: 0.8721374613820508.[0m
[32m[I 2022-04-16 08:12:52,508][0m Trial 245 finished with value: 0.8600971825130994 and parameters: {'n_hidden': 64, 'mixture_components': 2, 'use_sparse_layer': False, 'use_batchnorm': True, 'use_dropout': True, 'dropout': 0.6175663991140781, 'mlp_size_1': 0, 'mlp_size_2': 2, 'mlp_size_3': 0, 'kernel': 'Exponential', 'loss_name': 'NLLLoss'}. Best is trial 173 with value: 0.8721374613820508.[0m
[32m[I 2022-04-16 08:19:02,314][0m Trial 246 finished with value: 0.862599839119199 and parameters: {'n_hidden': 64, 'mixture_components': 2, 'use_sparse_layer': False, 'use_batchnorm': True, 'use_dropout': True, 'dropout': 0.8993485623321429, 'mlp_size_1': 0, 'mlp_size_2': 2, 'mlp_size_3': 0, 'kernel': 'Exponential', 'loss_name': 'NLLLoss'}. Best is trial 173 with value: 0.8721374613820508.[0m
[32m[I 2022-04-16 08:24:17,010][0m Trial 247 finished with value: 0.8689165005767843 and parameters: {'n_hidden': 64, 'mixture_components': 2, 'use_sparse_layer': False, 'use_batchnorm': True, 'use_dropout': True, 'dropout': 0.6595462636878288, 'mlp_size_1': 0, 'mlp_size_2': 2, 'mlp_size_3': 0, 'kernel': 'Exponential', 'loss_name': 'NLLLoss'}. Best is trial 173 with value: 0.8721374613820508.[0m
[32m[I 2022-04-16 08:29:12,902][0m Trial 248 finished with value: 0.8585379571994552 and parameters: {'n_hidden': 64, 'mixture_components': 2, 'use_sparse_layer': False, 'use_batchnorm': True, 'use_dropout': True, 'dropout': 0.6465029963628971, 'mlp_size_1': 0, 'mlp_size_2': 2, 'mlp_size_3': 0, 'kernel': 'Exponential', 'loss_name': 'NLLLoss'}. Best is trial 173 with value: 0.8721374613820508.[0m
[32m[I 2022-04-16 08:34:27,459][0m Trial 249 finished with value: 0.8609414837044295 and parameters: {'n_hidden': 64, 'mixture_components': 2, 'use_sparse_layer': False, 'use_batchnorm': True, 'use_dropout': True, 'dropout': 0.6997393726529613, 'mlp_size_1': 0, 'mlp_size_2': 2, 'mlp_size_3': 0, 'kernel': 'Exponential', 'loss_name': 'NLLLoss'}. Best is trial 173 with value: 0.8721374613820508.[0m
[32m[I 2022-04-16 08:39:43,583][0m Trial 250 finished with value: 0.8601439075336138 and parameters: {'n_hidden': 64, 'mixture_components': 2, 'use_sparse_layer': False, 'use_batchnorm': True, 'use_dropout': True, 'dropout': 0.6265647970863213, 'mlp_size_1': 0, 'mlp_size_2': 2, 'mlp_size_3': 0, 'kernel': 'Normal', 'loss_name': 'NLLLoss'}. Best is trial 173 with value: 0.8721374613820508.[0m
[32m[I 2022-04-16 08:45:22,431][0m Trial 251 finished with value: 0.869250783857939 and parameters: {'n_hidden': 64, 'mixture_components': 2, 'use_sparse_layer': False, 'use_batchnorm': True, 'use_dropout': True, 'dropout': 0.6678175515860093, 'mlp_size_1': 0, 'mlp_size_2': 2, 'mlp_size_3': 0, 'kernel': 'Exponential', 'loss_name': 'NLLLoss'}. Best is trial 173 with value: 0.8721374613820508.[0m
[32m[I 2022-04-16 08:47:58,366][0m Trial 252 finished with value: 0.6647825120795916 and parameters: {'n_hidden': 64, 'mixture_components': 2, 'use_sparse_layer': False, 'use_batchnorm': False, 'use_dropout': True, 'dropout': 0.6653320557613632, 'mlp_size_1': 0, 'mlp_size_2': 2, 'mlp_size_3': 0, 'kernel': 'Exponential', 'loss_name': 'AlternativeNLLLoss'}. Best is trial 173 with value: 0.8721374613820508.[0m
[32m[I 2022-04-16 08:54:33,851][0m Trial 253 finished with value: 0.8665800500363912 and parameters: {'n_hidden': 64, 'mixture_components': 2, 'use_sparse_layer': False, 'use_batchnorm': True, 'use_dropout': True, 'dropout': 0.6061506935098644, 'mlp_size_1': 0, 'mlp_size_2': 2, 'mlp_size_3': 0, 'kernel': 'Exponential', 'loss_name': 'NLLLoss'}. Best is trial 173 with value: 0.8721374613820508.[0m
[32m[I 2022-04-16 08:59:29,351][0m Trial 254 finished with value: 0.830669795510428 and parameters: {'n_hidden': 2048, 'mixture_components': 2, 'use_sparse_layer': False, 'use_batchnorm': True, 'use_dropout': True, 'dropout': 0.6365532993677051, 'mlp_size_1': 4, 'mlp_size_2': 2, 'mlp_size_3': 0, 'kernel': 'Exponential', 'loss_name': 'NLLLoss'}. Best is trial 173 with value: 0.8721374613820508.[0m
[32m[I 2022-04-16 09:04:05,273][0m Trial 255 finished with value: 0.849112320441316 and parameters: {'n_hidden': 64, 'mixture_components': 2, 'use_sparse_layer': False, 'use_batchnorm': True, 'use_dropout': True, 'dropout': 0.5770678643771171, 'mlp_size_1': 0, 'mlp_size_2': 2, 'mlp_size_3': 0, 'kernel': 'Weibull', 'loss_name': 'NLLLoss'}. Best is trial 173 with value: 0.8721374613820508.[0m
[32m[I 2022-04-16 09:08:48,657][0m Trial 256 finished with value: 0.8594975929662168 and parameters: {'n_hidden': 64, 'mixture_components': 2, 'use_sparse_layer': False, 'use_batchnorm': True, 'use_dropout': True, 'dropout': 0.40522913171136105, 'mlp_size_1': 0, 'mlp_size_2': 2, 'mlp_size_3': 0, 'kernel': 'Exponential', 'loss_name': 'NLLLoss'}. Best is trial 173 with value: 0.8721374613820508.[0m
[32m[I 2022-04-16 09:14:10,276][0m Trial 257 finished with value: 0.8524713991919597 and parameters: {'n_hidden': 64, 'mixture_components': 2, 'use_sparse_layer': False, 'use_batchnorm': True, 'use_dropout': True, 'dropout': 0.6242953260657959, 'mlp_size_1': 0, 'mlp_size_2': 2, 'mlp_size_3': 0, 'kernel': 'Gamma', 'loss_name': 'NLLLoss'}. Best is trial 173 with value: 0.8721374613820508.[0m
[32m[I 2022-04-16 09:19:26,698][0m Trial 258 finished with value: 0.8652715863407426 and parameters: {'n_hidden': 64, 'mixture_components': 2, 'use_sparse_layer': False, 'use_batchnorm': True, 'use_dropout': True, 'dropout': 0.6683724597912665, 'mlp_size_1': 0, 'mlp_size_2': 2, 'mlp_size_3': 0, 'kernel': 'Exponential', 'loss_name': 'NLLLoss'}. Best is trial 173 with value: 0.8721374613820508.[0m
[32m[I 2022-04-16 09:22:30,289][0m Trial 259 finished with value: 0.860092938522779 and parameters: {'n_hidden': 1024, 'mixture_components': 2, 'use_sparse_layer': False, 'use_batchnorm': True, 'use_dropout': True, 'dropout': 0.6451182947919034, 'mlp_size_1': 1, 'mlp_size_2': 4, 'mlp_size_3': 0, 'kernel': 'Exponential', 'loss_name': 'NLLLoss'}. Best is trial 173 with value: 0.8721374613820508.[0m
[32m[I 2022-04-16 09:28:06,818][0m Trial 260 finished with value: 0.8670834512587069 and parameters: {'n_hidden': 64, 'mixture_components': 3, 'use_sparse_layer': False, 'use_batchnorm': True, 'use_dropout': True, 'dropout': 0.7248987804689594, 'mlp_size_1': 0, 'mlp_size_2': 2, 'mlp_size_3': 0, 'kernel': 'Exponential', 'loss_name': 'NLLLoss'}. Best is trial 173 with value: 0.8721374613820508.[0m
[32m[I 2022-04-16 09:32:10,565][0m Trial 261 finished with value: 0.8174308639337233 and parameters: {'n_hidden': 64, 'mixture_components': 2, 'use_sparse_layer': False, 'use_batchnorm': True, 'use_dropout': True, 'dropout': 0.6008694769519866, 'mlp_size_1': 0, 'mlp_size_2': 2, 'mlp_size_3': 0, 'kernel': 'LogNormal', 'loss_name': 'NLLLoss'}. Best is trial 173 with value: 0.8721374613820508.[0m
[32m[I 2022-04-16 09:36:05,423][0m Trial 262 finished with value: 0.8642969131203945 and parameters: {'n_hidden': 512, 'mixture_components': 2, 'use_sparse_layer': False, 'use_batchnorm': True, 'use_dropout': True, 'dropout': 0.6207680480785133, 'mlp_size_1': 0, 'mlp_size_2': 2, 'mlp_size_3': 0, 'kernel': 'Exponential', 'loss_name': 'NLLLoss'}. Best is trial 173 with value: 0.8721374613820508.[0m
[32m[I 2022-04-16 09:41:23,077][0m Trial 263 finished with value: 0.8622951264385004 and parameters: {'n_hidden': 64, 'mixture_components': 2, 'use_sparse_layer': False, 'use_batchnorm': True, 'use_dropout': True, 'dropout': 0.4719601566359992, 'mlp_size_1': 0, 'mlp_size_2': 2, 'mlp_size_3': 0, 'kernel': 'Exponential', 'loss_name': 'NLLLoss'}. Best is trial 173 with value: 0.8721374613820508.[0m
