[32m[I 2022-04-13 11:45:45,424][0m Trial 448 finished with value: 0.6811141527737352 and parameters: {'splitter': 'best', 'min_samples_split': 0.3090167575156765, 'min_samples_leaf': 0.026353010086601437, 'min_weight_fraction_leaf': 0.04709695341120658, 'max_features': 0.582401640888973}. Best is trial 163 with value: 0.7137418010284807.[0m
[32m[I 2022-04-13 11:45:45,553][0m Trial 449 finished with value: 0.631953446187902 and parameters: {'splitter': 'best', 'min_samples_split': 0.3186557183511012, 'min_samples_leaf': 0.0013248166681653344, 'min_weight_fraction_leaf': 0.071446917548613, 'max_features': 0.4821873850921276}. Best is trial 163 with value: 0.7137418010284807.[0m
[32m[I 2022-04-13 11:45:45,668][0m Trial 450 finished with value: 0.46653397352131 and parameters: {'splitter': 'random', 'min_samples_split': 0.37752676669869495, 'min_samples_leaf': 0.30346994755392764, 'min_weight_fraction_leaf': 0.11040127555100547, 'max_features': 0.5371324748198866}. Best is trial 163 with value: 0.7137418010284807.[0m
[32m[I 2022-04-13 11:45:45,747][0m Trial 451 finished with value: 0.6989673695016856 and parameters: {'splitter': 'best', 'min_samples_split': 0.3314583747249076, 'min_samples_leaf': 0.022285546140171583, 'min_weight_fraction_leaf': 0.0749990193600604, 'max_features': 0.5470495822863435}. Best is trial 163 with value: 0.7137418010284807.[0m
[32m[I 2022-04-13 11:45:45,805][0m Trial 452 finished with value: 0.6301180979801357 and parameters: {'splitter': 'best', 'min_samples_split': 0.3425092356851431, 'min_samples_leaf': 0.030189774456257305, 'min_weight_fraction_leaf': 0.3128283566080795, 'max_features': 0.4953198701953939}. Best is trial 163 with value: 0.7137418010284807.[0m
[32m[I 2022-04-13 11:45:45,883][0m Trial 453 finished with value: 0.6150737283379903 and parameters: {'splitter': 'best', 'min_samples_split': 0.31114202392425777, 'min_samples_leaf': 0.018303682188937048, 'min_weight_fraction_leaf': 0.26686032875691534, 'max_features': 0.543350296408383}. Best is trial 163 with value: 0.7137418010284807.[0m
[32m[I 2022-04-13 11:45:45,985][0m Trial 454 finished with value: 0.6920012331415456 and parameters: {'splitter': 'best', 'min_samples_split': 0.29686837341186495, 'min_samples_leaf': 0.008552651738827275, 'min_weight_fraction_leaf': 0.10252428537389667, 'max_features': 0.5142973237074578}. Best is trial 163 with value: 0.7137418010284807.[0m
[32m[I 2022-04-13 11:45:46,048][0m Trial 455 finished with value: 0.6989673695016856 and parameters: {'splitter': 'best', 'min_samples_split': 0.3300428951336664, 'min_samples_leaf': 0.01996419839628122, 'min_weight_fraction_leaf': 0.07725319551296676, 'max_features': 0.5607816035804923}. Best is trial 163 with value: 0.7137418010284807.[0m
[32m[I 2022-04-13 11:45:46,120][0m Trial 456 finished with value: 0.7137418010284807 and parameters: {'splitter': 'best', 'min_samples_split': 0.317619005736101, 'min_samples_leaf': 0.001107188416726493, 'min_weight_fraction_leaf': 0.09647639959593572, 'max_features': 0.5277694084930399}. Best is trial 163 with value: 0.7137418010284807.[0m
[32m[I 2022-04-13 11:45:46,197][0m Trial 457 finished with value: 0.7030519614506526 and parameters: {'splitter': 'best', 'min_samples_split': 0.3070139291008145, 'min_samples_leaf': 0.007335163950597118, 'min_weight_fraction_leaf': 0.08912449390423628, 'max_features': 0.5160510654961311}. Best is trial 163 with value: 0.7137418010284807.[0m
[32m[I 2022-04-13 11:45:46,275][0m Trial 458 finished with value: 0.684611897101941 and parameters: {'splitter': 'best', 'min_samples_split': 0.2894663253428434, 'min_samples_leaf': 0.013140464872821823, 'min_weight_fraction_leaf': 0.09302050537067208, 'max_features': 0.5564066481940032}. Best is trial 163 with value: 0.7137418010284807.[0m
[32m[I 2022-04-13 11:45:46,356][0m Trial 459 finished with value: 0.6705763419171312 and parameters: {'splitter': 'best', 'min_samples_split': 0.35683279720397815, 'min_samples_leaf': 0.03290648726118356, 'min_weight_fraction_leaf': 0.052602232971923124, 'max_features': 0.5411014775578644}. Best is trial 163 with value: 0.7137418010284807.[0m
[32m[I 2022-04-13 11:45:46,439][0m Trial 460 finished with value: 0.6778130748182665 and parameters: {'splitter': 'best', 'min_samples_split': 0.3170999897779285, 'min_samples_leaf': 0.2184794282497929, 'min_weight_fraction_leaf': 0.09967126837715319, 'max_features': 0.5624406537505643}. Best is trial 163 with value: 0.7137418010284807.[0m
[32m[I 2022-04-13 11:45:46,525][0m Trial 461 finished with value: 0.6989673695016856 and parameters: {'splitter': 'best', 'min_samples_split': 0.3357432316331533, 'min_samples_leaf': 0.01917854754663035, 'min_weight_fraction_leaf': 0.06391805214799645, 'max_features': 0.5049327332118764}. Best is trial 163 with value: 0.7137418010284807.[0m
[32m[I 2022-04-13 11:45:46,606][0m Trial 462 finished with value: 0.7137418010284807 and parameters: {'splitter': 'best', 'min_samples_split': 0.32755007940139075, 'min_samples_leaf': 0.044339166723268014, 'min_weight_fraction_leaf': 0.12403807900249089, 'max_features': 0.5717476471932635}. Best is trial 163 with value: 0.7137418010284807.[0m
[32m[I 2022-04-13 11:45:46,682][0m Trial 463 finished with value: 0.6920012331415456 and parameters: {'splitter': 'best', 'min_samples_split': 0.3007605460875719, 'min_samples_leaf': 0.0013951858688243928, 'min_weight_fraction_leaf': 0.11010340092868541, 'max_features': 0.5954461785691377}. Best is trial 163 with value: 0.7137418010284807.[0m
[32m[I 2022-04-13 11:45:46,734][0m Trial 464 finished with value: 0.7137418010284807 and parameters: {'splitter': 'best', 'min_samples_split': 0.32247758806370913, 'min_samples_leaf': 0.010964391298969898, 'min_weight_fraction_leaf': 0.10182435971033074, 'max_features': 0.529754300952733}. Best is trial 163 with value: 0.7137418010284807.[0m
[32m[I 2022-04-13 11:45:46,822][0m Trial 465 finished with value: 0.7044783206942828 and parameters: {'splitter': 'best', 'min_samples_split': 0.3115644618894671, 'min_samples_leaf': 0.0015931433493634548, 'min_weight_fraction_leaf': 0.1055461246916728, 'max_features': 0.5525021778672549}. Best is trial 163 with value: 0.7137418010284807.[0m
[32m[I 2022-04-13 11:45:46,900][0m Trial 466 finished with value: 0.7031899399734122 and parameters: {'splitter': 'random', 'min_samples_split': 0.3110719502686332, 'min_samples_leaf': 0.0010072678830180758, 'min_weight_fraction_leaf': 0.08562550222460406, 'max_features': 0.5227164480384844}. Best is trial 163 with value: 0.7137418010284807.[0m
[32m[I 2022-04-13 11:45:46,995][0m Trial 467 finished with value: 0.6256260873762296 and parameters: {'splitter': 'best', 'min_samples_split': 0.3439201906328399, 'min_samples_leaf': 0.02695421368841764, 'min_weight_fraction_leaf': 0.027415281720679016, 'max_features': 0.49305626955118054}. Best is trial 163 with value: 0.7137418010284807.[0m
[32m[I 2022-04-13 11:45:47,099][0m Trial 468 finished with value: 0.6353838276695598 and parameters: {'splitter': 'best', 'min_samples_split': 0.3350500692141111, 'min_samples_leaf': 0.011365965527530547, 'min_weight_fraction_leaf': 0.12363971897977201, 'max_features': 0.49813152844924896}. Best is trial 163 with value: 0.7137418010284807.[0m
[32m[I 2022-04-13 11:45:47,166][0m Trial 469 finished with value: 0.6989673695016856 and parameters: {'splitter': 'best', 'min_samples_split': 0.3501499826179245, 'min_samples_leaf': 0.0403528668960761, 'min_weight_fraction_leaf': 0.1223433554771846, 'max_features': 0.5972406095357787}. Best is trial 163 with value: 0.7137418010284807.[0m
[32m[I 2022-04-13 11:45:47,247][0m Trial 470 finished with value: 0.6511505741801622 and parameters: {'splitter': 'best', 'min_samples_split': 0.33093473315275973, 'min_samples_leaf': 0.031303518812967675, 'min_weight_fraction_leaf': 0.2311351196672477, 'max_features': 0.5738872976695446}. Best is trial 163 with value: 0.7137418010284807.[0m
[32m[I 2022-04-13 11:45:47,286][0m Trial 471 finished with value: 0.6293891486067912 and parameters: {'splitter': 'best', 'min_samples_split': 0.2921546749131491, 'min_samples_leaf': 0.0011172687155842033, 'min_weight_fraction_leaf': 0.07661969558535228, 'max_features': 0.47784905236301667}. Best is trial 163 with value: 0.7137418010284807.[0m
[32m[I 2022-04-13 11:45:47,320][0m Trial 472 finished with value: 0.7137418010284807 and parameters: {'splitter': 'best', 'min_samples_split': 0.32375370730124553, 'min_samples_leaf': 0.012857151568696892, 'min_weight_fraction_leaf': 0.06939548461005168, 'max_features': 0.5941352517646337}. Best is trial 163 with value: 0.7137418010284807.[0m
[32m[I 2022-04-13 11:45:47,352][0m Trial 473 finished with value: 0.7030519614506526 and parameters: {'splitter': 'best', 'min_samples_split': 0.3038392130732014, 'min_samples_leaf': 0.010171509595286279, 'min_weight_fraction_leaf': 0.08935844879305922, 'max_features': 0.5936264590744321}. Best is trial 163 with value: 0.7137418010284807.[0m
[32m[I 2022-04-13 11:45:47,384][0m Trial 474 finished with value: 0.7137418010284807 and parameters: {'splitter': 'best', 'min_samples_split': 0.3183383040843742, 'min_samples_leaf': 0.013258628961408439, 'min_weight_fraction_leaf': 0.08017232105813282, 'max_features': 0.5327116364949348}. Best is trial 163 with value: 0.7137418010284807.[0m
[32m[I 2022-04-13 11:45:47,417][0m Trial 475 finished with value: 0.6989673695016856 and parameters: {'splitter': 'best', 'min_samples_split': 0.4168857441763516, 'min_samples_leaf': 0.013046938246268604, 'min_weight_fraction_leaf': 0.09665238821402701, 'max_features': 0.5269380224750432}. Best is trial 163 with value: 0.7137418010284807.[0m
[32m[I 2022-04-13 11:45:47,485][0m Trial 476 finished with value: 0.6989673695016856 and parameters: {'splitter': 'best', 'min_samples_split': 0.33777177408009657, 'min_samples_leaf': 0.025763627907442344, 'min_weight_fraction_leaf': 0.11275327859557648, 'max_features': 0.5579061203642727}. Best is trial 163 with value: 0.7137418010284807.[0m
[32m[I 2022-04-13 11:45:47,565][0m Trial 477 finished with value: 0.6705763419171312 and parameters: {'splitter': 'best', 'min_samples_split': 0.329693194459308, 'min_samples_leaf': 0.043187556090312225, 'min_weight_fraction_leaf': 0.050672255593343374, 'max_features': 0.5824588832047404}. Best is trial 163 with value: 0.7137418010284807.[0m
[32m[I 2022-04-13 11:45:47,648][0m Trial 478 finished with value: 0.6513176944526099 and parameters: {'splitter': 'best', 'min_samples_split': 0.3258851792974432, 'min_samples_leaf': 0.02174416878675391, 'min_weight_fraction_leaf': 0.08611901530989612, 'max_features': 0.46185633956376704}. Best is trial 163 with value: 0.7137418010284807.[0m
[32m[I 2022-04-13 11:45:47,680][0m Trial 479 finished with value: 0.6327929922187122 and parameters: {'splitter': 'best', 'min_samples_split': 0.31921009088930746, 'min_samples_leaf': 0.24333554479977573, 'min_weight_fraction_leaf': 0.0667166199625847, 'max_features': 0.575709892401723}. Best is trial 163 with value: 0.7137418010284807.[0m
[32m[I 2022-04-13 11:45:47,713][0m Trial 480 finished with value: 0.6989673695016856 and parameters: {'splitter': 'best', 'min_samples_split': 0.3608763805542226, 'min_samples_leaf': 0.0369776303904187, 'min_weight_fraction_leaf': 0.1272097693187162, 'max_features': 0.6085651806906075}. Best is trial 163 with value: 0.7137418010284807.[0m
[32m[I 2022-04-13 11:45:47,746][0m Trial 481 finished with value: 0.6881740970397604 and parameters: {'splitter': 'best', 'min_samples_split': 0.28017594004243657, 'min_samples_leaf': 0.01028351074297234, 'min_weight_fraction_leaf': 0.08389612321511526, 'max_features': 0.5061712297574794}. Best is trial 163 with value: 0.7137418010284807.[0m
[32m[I 2022-04-13 11:45:47,779][0m Trial 482 finished with value: 0.640273960732414 and parameters: {'splitter': 'best', 'min_samples_split': 0.31077471156404773, 'min_samples_leaf': 0.00125664995166231, 'min_weight_fraction_leaf': 0.057025399064204896, 'max_features': 0.4902902213419361}. Best is trial 163 with value: 0.7137418010284807.[0m
[32m[I 2022-04-13 11:45:47,812][0m Trial 483 finished with value: 0.7044783206942828 and parameters: {'splitter': 'best', 'min_samples_split': 0.3026419441338058, 'min_samples_leaf': 0.04890197712382124, 'min_weight_fraction_leaf': 0.127010733300311, 'max_features': 0.5832939972801822}. Best is trial 163 with value: 0.7137418010284807.[0m
[32m[I 2022-04-13 11:45:47,845][0m Trial 484 finished with value: 0.6920012331415456 and parameters: {'splitter': 'best', 'min_samples_split': 0.2969368276244289, 'min_samples_leaf': 0.001805195888637442, 'min_weight_fraction_leaf': 0.09646475206218363, 'max_features': 0.5200943986184172}. Best is trial 163 with value: 0.7137418010284807.[0m
[32m[I 2022-04-13 11:45:47,877][0m Trial 485 finished with value: 0.6989673695016856 and parameters: {'splitter': 'best', 'min_samples_split': 0.35079185140638913, 'min_samples_leaf': 0.028941007142449182, 'min_weight_fraction_leaf': 0.11755175558133088, 'max_features': 0.5495670279828939}. Best is trial 163 with value: 0.7137418010284807.[0m
[32m[I 2022-04-13 11:45:47,910][0m Trial 486 finished with value: 0.6989673695016856 and parameters: {'splitter': 'best', 'min_samples_split': 0.34134071731504106, 'min_samples_leaf': 0.027985580952767722, 'min_weight_fraction_leaf': 0.11133500947063554, 'max_features': 0.5406186348486954}. Best is trial 163 with value: 0.7137418010284807.[0m
[32m[I 2022-04-13 11:45:47,944][0m Trial 487 finished with value: 0.7044783206942828 and parameters: {'splitter': 'best', 'min_samples_split': 0.3129175710608269, 'min_samples_leaf': 0.020157423051849397, 'min_weight_fraction_leaf': 0.11346183606984298, 'max_features': 0.5332082827713888}. Best is trial 163 with value: 0.7137418010284807.[0m
[32m[I 2022-04-13 11:45:47,984][0m Trial 488 finished with value: 0.5382664128304093 and parameters: {'splitter': 'random', 'min_samples_split': 0.3125884831333964, 'min_samples_leaf': 0.01685629088059163, 'min_weight_fraction_leaf': 0.09383197423343817, 'max_features': 0.4993364705140721}. Best is trial 163 with value: 0.7137418010284807.[0m
[32m[I 2022-04-13 11:45:48,027][0m Trial 489 finished with value: 0.640273960732414 and parameters: {'splitter': 'best', 'min_samples_split': 0.3241285034596494, 'min_samples_leaf': 0.013700029724199323, 'min_weight_fraction_leaf': 0.06335093226348118, 'max_features': 0.4728901286769637}. Best is trial 163 with value: 0.7137418010284807.[0m
[32m[I 2022-04-13 11:45:48,077][0m Trial 490 finished with value: 0.6989673695016856 and parameters: {'splitter': 'best', 'min_samples_split': 0.3356268720068049, 'min_samples_leaf': 0.009894780606832932, 'min_weight_fraction_leaf': 0.10159655817967055, 'max_features': 0.5277798289440975}. Best is trial 163 with value: 0.7137418010284807.[0m
[32m[I 2022-04-13 11:45:48,120][0m Trial 491 finished with value: 0.6440317768217898 and parameters: {'splitter': 'best', 'min_samples_split': 0.34499272196150316, 'min_samples_leaf': 0.001574564347270006, 'min_weight_fraction_leaf': 0.09522710383441996, 'max_features': 0.4235757658582655}. Best is trial 163 with value: 0.7137418010284807.[0m
[32m[I 2022-04-13 11:45:48,185][0m Trial 492 finished with value: 0.7044783206942828 and parameters: {'splitter': 'best', 'min_samples_split': 0.3146442686651566, 'min_samples_leaf': 0.04790347835903418, 'min_weight_fraction_leaf': 0.12668490136155014, 'max_features': 0.6080381702430668}. Best is trial 163 with value: 0.7137418010284807.[0m
[32m[I 2022-04-13 11:45:48,278][0m Trial 493 finished with value: 0.7137418010284807 and parameters: {'splitter': 'best', 'min_samples_split': 0.3234948365516488, 'min_samples_leaf': 0.016813505196925163, 'min_weight_fraction_leaf': 0.10325414229923364, 'max_features': 0.5509071491623498}. Best is trial 163 with value: 0.7137418010284807.[0m
[32m[I 2022-04-13 11:45:48,370][0m Trial 494 finished with value: 0.6989673695016856 and parameters: {'splitter': 'best', 'min_samples_split': 0.33434869518350036, 'min_samples_leaf': 0.023257960360981995, 'min_weight_fraction_leaf': 0.08193006778941644, 'max_features': 0.5086531739046213}. Best is trial 163 with value: 0.7137418010284807.[0m
[32m[I 2022-04-13 11:45:48,448][0m Trial 495 finished with value: 0.7030519614506526 and parameters: {'splitter': 'best', 'min_samples_split': 0.3028088832984896, 'min_samples_leaf': 0.01855104972721525, 'min_weight_fraction_leaf': 0.06185569149051411, 'max_features': 0.5514037548088971}. Best is trial 163 with value: 0.7137418010284807.[0m
[32m[I 2022-04-13 11:45:48,524][0m Trial 496 finished with value: 0.6405572646788725 and parameters: {'splitter': 'best', 'min_samples_split': 0.33231243556547563, 'min_samples_leaf': 0.028355847433719956, 'min_weight_fraction_leaf': 0.10775715036795569, 'max_features': 0.48405975404143703}. Best is trial 163 with value: 0.7137418010284807.[0m
[32m[I 2022-04-13 11:45:48,564][0m Trial 497 finished with value: 0.6199327926179983 and parameters: {'splitter': 'best', 'min_samples_split': 0.3210366344865864, 'min_samples_leaf': 0.40409639024215643, 'min_weight_fraction_leaf': 0.06568468883082178, 'max_features': 0.37583794913986757}. Best is trial 163 with value: 0.7137418010284807.[0m
[32m[I 2022-04-13 11:45:48,608][0m Trial 498 finished with value: 0.7030519614506526 and parameters: {'splitter': 'best', 'min_samples_split': 0.30707283939260954, 'min_samples_leaf': 0.009869232761561717, 'min_weight_fraction_leaf': 0.08122633917852462, 'max_features': 0.5106674035957567}. Best is trial 163 with value: 0.7137418010284807.[0m
[32m[I 2022-04-13 11:45:48,643][0m Trial 499 finished with value: 0.695563433079365 and parameters: {'splitter': 'best', 'min_samples_split': 0.29131276179469545, 'min_samples_leaf': 0.0012163909574178684, 'min_weight_fraction_leaf': 0.08913034187484127, 'max_features': 0.5142015128286005}. Best is trial 163 with value: 0.7137418010284807.[0m
[32m[I 2022-04-13 11:45:48,676][0m Trial 500 finished with value: 0.6843470376003471 and parameters: {'splitter': 'best', 'min_samples_split': 0.462298797866573, 'min_samples_leaf': 0.04156086623377063, 'min_weight_fraction_leaf': 0.07256876409932629, 'max_features': 0.5344170019415556}. Best is trial 163 with value: 0.7137418010284807.[0m
[32m[I 2022-04-13 11:45:48,709][0m Trial 501 finished with value: 0.6206514959469341 and parameters: {'splitter': 'best', 'min_samples_split': 0.23814893872021678, 'min_samples_leaf': 0.02621084430291828, 'min_weight_fraction_leaf': 0.07702159790375011, 'max_features': 0.44744760108526427}. Best is trial 163 with value: 0.7137418010284807.[0m
[32m[I 2022-04-13 11:45:48,743][0m Trial 502 finished with value: 0.7137418010284807 and parameters: {'splitter': 'best', 'min_samples_split': 0.3259222786206238, 'min_samples_leaf': 0.01719718218037455, 'min_weight_fraction_leaf': 0.07532826020027157, 'max_features': 0.5301831670176035}. Best is trial 163 with value: 0.7137418010284807.[0m
[32m[I 2022-04-13 11:45:48,777][0m Trial 503 finished with value: 0.670047379301425 and parameters: {'splitter': 'best', 'min_samples_split': 0.3424488364431376, 'min_samples_leaf': 0.015435061883528984, 'min_weight_fraction_leaf': 0.08935684421286136, 'max_features': 0.7518707670895881}. Best is trial 163 with value: 0.7137418010284807.[0m
[32m[I 2022-04-13 11:45:48,810][0m Trial 504 finished with value: 0.631953446187902 and parameters: {'splitter': 'best', 'min_samples_split': 0.31737559865775616, 'min_samples_leaf': 0.011350728581742266, 'min_weight_fraction_leaf': 0.06933916295204147, 'max_features': 0.46933559538702607}. Best is trial 163 with value: 0.7137418010284807.[0m
[32m[I 2022-04-13 11:45:48,843][0m Trial 505 finished with value: 0.6436563808635396 and parameters: {'splitter': 'best', 'min_samples_split': 0.330117175227269, 'min_samples_leaf': 0.008953410736524774, 'min_weight_fraction_leaf': 0.08763049116920754, 'max_features': 0.49924741571680614}. Best is trial 163 with value: 0.7137418010284807.[0m
[32m[I 2022-04-13 11:45:48,875][0m Trial 506 finished with value: 0.6989673695016856 and parameters: {'splitter': 'best', 'min_samples_split': 0.39704104977837806, 'min_samples_leaf': 0.035554730934680784, 'min_weight_fraction_leaf': 0.08305592787306992, 'max_features': 0.5695193650438287}. Best is trial 163 with value: 0.7137418010284807.[0m
[32m[I 2022-04-13 11:45:48,907][0m Trial 507 finished with value: 0.7093409976331404 and parameters: {'splitter': 'random', 'min_samples_split': 0.3375610772343263, 'min_samples_leaf': 0.047153049184568814, 'min_weight_fraction_leaf': 0.1221000092824039, 'max_features': 0.5837695206173263}. Best is trial 163 with value: 0.7137418010284807.[0m
[32m[I 2022-04-13 11:45:48,942][0m Trial 508 finished with value: 0.7044783206942828 and parameters: {'splitter': 'best', 'min_samples_split': 0.3046672243531453, 'min_samples_leaf': 0.0015464493757459032, 'min_weight_fraction_leaf': 0.1072934319280011, 'max_features': 0.5150813615718567}. Best is trial 163 with value: 0.7137418010284807.[0m
[32m[I 2022-04-13 11:45:48,976][0m Trial 509 finished with value: 0.6393814860932593 and parameters: {'splitter': 'best', 'min_samples_split': 0.36203116367454535, 'min_samples_leaf': 0.024439853495113635, 'min_weight_fraction_leaf': 0.05776234974811273, 'max_features': 0.4923624835113439}. Best is trial 163 with value: 0.7137418010284807.[0m
[32m[I 2022-04-13 11:45:49,019][0m Trial 510 finished with value: 0.7137418010284807 and parameters: {'splitter': 'best', 'min_samples_split': 0.3194822365237656, 'min_samples_leaf': 0.011084364143774025, 'min_weight_fraction_leaf': 0.09721108575857824, 'max_features': 0.5357986638190667}. Best is trial 163 with value: 0.7137418010284807.[0m
