[32m[I 2022-04-13 11:46:00,262][0m Trial 637 finished with value: 0.6920012331415456 and parameters: {'splitter': 'best', 'min_samples_split': 0.30075251494833594, 'min_samples_leaf': 0.002646885134128722, 'min_weight_fraction_leaf': 0.10478838040087417, 'max_features': 0.5104880982463993}. Best is trial 163 with value: 0.7137418010284807.[0m
[32m[I 2022-04-13 11:46:00,341][0m Trial 638 finished with value: 0.6989673695016856 and parameters: {'splitter': 'best', 'min_samples_split': 0.32914478367609384, 'min_samples_leaf': 0.04060481595414649, 'min_weight_fraction_leaf': 0.08155458758570666, 'max_features': 0.5713083867480252}. Best is trial 163 with value: 0.7137418010284807.[0m
[32m[I 2022-04-13 11:46:00,451][0m Trial 639 finished with value: 0.6705763419171312 and parameters: {'splitter': 'best', 'min_samples_split': 0.343806089497967, 'min_samples_leaf': 0.021488773963683875, 'min_weight_fraction_leaf': 0.00017965933233621278, 'max_features': 0.5354265600185727}. Best is trial 163 with value: 0.7137418010284807.[0m
[32m[I 2022-04-13 11:46:00,553][0m Trial 640 finished with value: 0.6513176944526099 and parameters: {'splitter': 'best', 'min_samples_split': 0.3191350336315411, 'min_samples_leaf': 0.014582802507398388, 'min_weight_fraction_leaf': 0.08792739588268361, 'max_features': 0.48936881248728875}. Best is trial 163 with value: 0.7137418010284807.[0m
[32m[I 2022-04-13 11:46:00,660][0m Trial 641 finished with value: 0.7137418010284807 and parameters: {'splitter': 'best', 'min_samples_split': 0.31757945348055516, 'min_samples_leaf': 0.018447111305178968, 'min_weight_fraction_leaf': 0.09424917398820928, 'max_features': 0.5282826088516962}. Best is trial 163 with value: 0.7137418010284807.[0m
[32m[I 2022-04-13 11:46:00,756][0m Trial 642 finished with value: 0.6989673695016856 and parameters: {'splitter': 'best', 'min_samples_split': 0.36234826733314296, 'min_samples_leaf': 0.0346777742963273, 'min_weight_fraction_leaf': 0.061974589351765384, 'max_features': 0.594297208323912}. Best is trial 163 with value: 0.7137418010284807.[0m
[32m[I 2022-04-13 11:46:00,848][0m Trial 643 finished with value: 0.6327929922187122 and parameters: {'splitter': 'best', 'min_samples_split': 0.30852413871245943, 'min_samples_leaf': 0.017120896949001957, 'min_weight_fraction_leaf': 0.23877522913022436, 'max_features': 0.500093263731318}. Best is trial 163 with value: 0.7137418010284807.[0m
[32m[I 2022-04-13 11:46:00,933][0m Trial 644 finished with value: 0.7137418010284807 and parameters: {'splitter': 'best', 'min_samples_split': 0.3239008743514322, 'min_samples_leaf': 0.011576278224804122, 'min_weight_fraction_leaf': 0.07285458575352954, 'max_features': 0.5246510871009613}. Best is trial 163 with value: 0.7137418010284807.[0m
[32m[I 2022-04-13 11:46:01,052][0m Trial 645 finished with value: 0.7075743489608037 and parameters: {'splitter': 'random', 'min_samples_split': 0.2783119661863037, 'min_samples_leaf': 0.013562623776750875, 'min_weight_fraction_leaf': 0.09185983822122974, 'max_features': 0.5221189918781131}. Best is trial 163 with value: 0.7137418010284807.[0m
[32m[I 2022-04-13 11:46:01,219][0m Trial 646 finished with value: 0.695563433079365 and parameters: {'splitter': 'best', 'min_samples_split': 0.29405970436365964, 'min_samples_leaf': 0.011350337017936295, 'min_weight_fraction_leaf': 0.08749794658288905, 'max_features': 0.5373262626387963}. Best is trial 163 with value: 0.7137418010284807.[0m
[32m[I 2022-04-13 11:46:01,366][0m Trial 647 finished with value: 0.43238661979902976 and parameters: {'splitter': 'best', 'min_samples_split': 0.31364255630966953, 'min_samples_leaf': 0.4942955685418535, 'min_weight_fraction_leaf': 0.10774150614424854, 'max_features': 0.47563543384081347}. Best is trial 163 with value: 0.7137418010284807.[0m
[32m[I 2022-04-13 11:46:01,476][0m Trial 648 finished with value: 0.6705763419171312 and parameters: {'splitter': 'best', 'min_samples_split': 0.34131218673166297, 'min_samples_leaf': 0.03264705929063866, 'min_weight_fraction_leaf': 0.04681534882096982, 'max_features': 0.589936737879222}. Best is trial 163 with value: 0.7137418010284807.[0m
[32m[I 2022-04-13 11:46:01,590][0m Trial 649 finished with value: 0.7044783206942828 and parameters: {'splitter': 'best', 'min_samples_split': 0.3043311420601597, 'min_samples_leaf': 0.0016694011227226108, 'min_weight_fraction_leaf': 0.10944696108864659, 'max_features': 0.5551770337238892}. Best is trial 163 with value: 0.7137418010284807.[0m
[32m[I 2022-04-13 11:46:01,703][0m Trial 650 finished with value: 0.6405572646788725 and parameters: {'splitter': 'best', 'min_samples_split': 0.3372926082459517, 'min_samples_leaf': 0.018409673305232917, 'min_weight_fraction_leaf': 0.11426343009628213, 'max_features': 0.48046535063877605}. Best is trial 163 with value: 0.7137418010284807.[0m
[32m[I 2022-04-13 11:46:01,820][0m Trial 651 finished with value: 0.6989673695016856 and parameters: {'splitter': 'best', 'min_samples_split': 0.3313562852059821, 'min_samples_leaf': 0.04187195091882808, 'min_weight_fraction_leaf': 0.07001507682046043, 'max_features': 0.5641244901140652}. Best is trial 163 with value: 0.7137418010284807.[0m
[32m[I 2022-04-13 11:46:01,988][0m Trial 652 finished with value: 0.6073904321939592 and parameters: {'splitter': 'best', 'min_samples_split': 0.32682865789154425, 'min_samples_leaf': 0.0364155356724693, 'min_weight_fraction_leaf': 0.11756942765496466, 'max_features': 0.22482254223087123}. Best is trial 163 with value: 0.7137418010284807.[0m
[32m[I 2022-04-13 11:46:02,134][0m Trial 653 finished with value: 0.670047379301425 and parameters: {'splitter': 'best', 'min_samples_split': 0.35136198340352254, 'min_samples_leaf': 0.029651905315812792, 'min_weight_fraction_leaf': 0.06525343067476051, 'max_features': 0.7876328975287079}. Best is trial 163 with value: 0.7137418010284807.[0m
[32m[I 2022-04-13 11:46:02,303][0m Trial 654 finished with value: 0.7030519614506526 and parameters: {'splitter': 'best', 'min_samples_split': 0.315354926149585, 'min_samples_leaf': 0.051922594720960724, 'min_weight_fraction_leaf': 0.08109053950328644, 'max_features': 0.5471034793143128}. Best is trial 163 with value: 0.7137418010284807.[0m
[32m[I 2022-04-13 11:46:02,429][0m Trial 655 finished with value: 0.6989673695016856 and parameters: {'splitter': 'best', 'min_samples_split': 0.33957661654570165, 'min_samples_leaf': 0.05083777418600844, 'min_weight_fraction_leaf': 0.12889605102060225, 'max_features': 0.5997978027812366}. Best is trial 163 with value: 0.7137418010284807.[0m
[32m[I 2022-04-13 11:46:02,539][0m Trial 656 finished with value: 0.7137418010284807 and parameters: {'splitter': 'best', 'min_samples_split': 0.32843886114423637, 'min_samples_leaf': 0.021801170618171564, 'min_weight_fraction_leaf': 0.11456775206375427, 'max_features': 0.5530734560227614}. Best is trial 163 with value: 0.7137418010284807.[0m
[32m[I 2022-04-13 11:46:02,639][0m Trial 657 finished with value: 0.6460578825638428 and parameters: {'splitter': 'best', 'min_samples_split': 0.3337651548387668, 'min_samples_leaf': 0.2872707119047751, 'min_weight_fraction_leaf': 0.13292723765198383, 'max_features': 0.6130172504593973}. Best is trial 163 with value: 0.7137418010284807.[0m
[32m[I 2022-04-13 11:46:02,759][0m Trial 658 finished with value: 0.6776000718234848 and parameters: {'splitter': 'best', 'min_samples_split': 0.4760972133999816, 'min_samples_leaf': 0.02045636368485155, 'min_weight_fraction_leaf': 0.11730042072544997, 'max_features': 0.5623451407833986}. Best is trial 163 with value: 0.7137418010284807.[0m
[32m[I 2022-04-13 11:46:02,876][0m Trial 659 finished with value: 0.7030519614506526 and parameters: {'splitter': 'best', 'min_samples_split': 0.3113568299597071, 'min_samples_leaf': 0.0012209897347197067, 'min_weight_fraction_leaf': 0.07820918754689102, 'max_features': 0.5045311337749369}. Best is trial 163 with value: 0.7137418010284807.[0m
[32m[I 2022-04-13 11:46:02,966][0m Trial 660 finished with value: 0.5121008313364271 and parameters: {'splitter': 'random', 'min_samples_split': 0.34722399882827276, 'min_samples_leaf': 0.027737884181434275, 'min_weight_fraction_leaf': 0.11425392805187526, 'max_features': 0.49739148916520715}. Best is trial 163 with value: 0.7137418010284807.[0m
[32m[I 2022-04-13 11:46:03,020][0m Trial 661 finished with value: 0.7137418010284807 and parameters: {'splitter': 'best', 'min_samples_split': 0.32268237348729983, 'min_samples_leaf': 0.027900204744833842, 'min_weight_fraction_leaf': 0.09299554289642213, 'max_features': 0.540566579379596}. Best is trial 163 with value: 0.7137418010284807.[0m
[32m[I 2022-04-13 11:46:03,101][0m Trial 662 finished with value: 0.7010504149318483 and parameters: {'splitter': 'best', 'min_samples_split': 0.2247327162857273, 'min_samples_leaf': 0.012496853434609217, 'min_weight_fraction_leaf': 0.08832237108248878, 'max_features': 0.511784905550351}. Best is trial 163 with value: 0.7137418010284807.[0m
[32m[I 2022-04-13 11:46:03,172][0m Trial 663 finished with value: 0.7030519614506526 and parameters: {'splitter': 'best', 'min_samples_split': 0.3105965640781277, 'min_samples_leaf': 0.009969961656047046, 'min_weight_fraction_leaf': 0.10501878163515205, 'max_features': 0.5802240319949208}. Best is trial 163 with value: 0.7137418010284807.[0m
[32m[I 2022-04-13 11:46:03,244][0m Trial 664 finished with value: 0.6989673695016856 and parameters: {'splitter': 'best', 'min_samples_split': 0.3336545237833341, 'min_samples_leaf': 0.04714337840971107, 'min_weight_fraction_leaf': 0.1243021098902439, 'max_features': 0.5979517730218217}. Best is trial 163 with value: 0.7137418010284807.[0m
[32m[I 2022-04-13 11:46:03,320][0m Trial 665 finished with value: 0.6513176944526099 and parameters: {'splitter': 'best', 'min_samples_split': 0.32142618420581814, 'min_samples_leaf': 0.012325308361075555, 'min_weight_fraction_leaf': 0.08227879645939326, 'max_features': 0.44440572882514967}. Best is trial 163 with value: 0.7137418010284807.[0m
[32m[I 2022-04-13 11:46:03,394][0m Trial 666 finished with value: 0.7137418010284807 and parameters: {'splitter': 'best', 'min_samples_split': 0.32534732350447504, 'min_samples_leaf': 0.0017404831095502549, 'min_weight_fraction_leaf': 0.09629864456490607, 'max_features': 0.5168371911193482}. Best is trial 163 with value: 0.7137418010284807.[0m
[32m[I 2022-04-13 11:46:03,498][0m Trial 667 finished with value: 0.6920012331415456 and parameters: {'splitter': 'best', 'min_samples_split': 0.30078835320074643, 'min_samples_leaf': 0.011050644889228774, 'min_weight_fraction_leaf': 0.09885995089602807, 'max_features': 0.5137781617974264}. Best is trial 163 with value: 0.7137418010284807.[0m
[32m[I 2022-04-13 11:46:03,596][0m Trial 668 finished with value: 0.6989673695016856 and parameters: {'splitter': 'best', 'min_samples_split': 0.36006370038038665, 'min_samples_leaf': 0.041381719446456786, 'min_weight_fraction_leaf': 0.05287024722176838, 'max_features': 0.584648167835616}. Best is trial 163 with value: 0.7137418010284807.[0m
[32m[I 2022-04-13 11:46:03,665][0m Trial 669 finished with value: 0.6989673695016856 and parameters: {'splitter': 'best', 'min_samples_split': 0.3332369783136658, 'min_samples_leaf': 0.027596978178658554, 'min_weight_fraction_leaf': 0.059070039952918124, 'max_features': 0.5542819543392443}. Best is trial 163 with value: 0.7137418010284807.[0m
[32m[I 2022-04-13 11:46:03,741][0m Trial 670 finished with value: 0.6968327756066064 and parameters: {'splitter': 'best', 'min_samples_split': 0.4060389227750011, 'min_samples_leaf': 0.03376911154483187, 'min_weight_fraction_leaf': 0.07575187661626652, 'max_features': 0.6306386669654436}. Best is trial 163 with value: 0.7137418010284807.[0m
[32m[I 2022-04-13 11:46:03,824][0m Trial 671 finished with value: 0.6989673695016856 and parameters: {'splitter': 'best', 'min_samples_split': 0.3409289659546742, 'min_samples_leaf': 0.0615379185760658, 'min_weight_fraction_leaf': 0.07283715848042371, 'max_features': 0.606257401378404}. Best is trial 163 with value: 0.7137418010284807.[0m
[32m[I 2022-04-13 11:46:03,895][0m Trial 672 finished with value: 0.6920012331415456 and parameters: {'splitter': 'best', 'min_samples_split': 0.29640814030323936, 'min_samples_leaf': 0.0011232838082202838, 'min_weight_fraction_leaf': 0.10357935515690053, 'max_features': 0.5631889317918255}. Best is trial 163 with value: 0.7137418010284807.[0m
[32m[I 2022-04-13 11:46:04,002][0m Trial 673 finished with value: 0.7137418010284807 and parameters: {'splitter': 'best', 'min_samples_split': 0.32711633463564366, 'min_samples_leaf': 0.045838168496299514, 'min_weight_fraction_leaf': 0.06450666564807092, 'max_features': 0.5788644964601878}. Best is trial 163 with value: 0.7137418010284807.[0m
[32m[I 2022-04-13 11:46:04,143][0m Trial 674 finished with value: 0.6989673695016856 and parameters: {'splitter': 'best', 'min_samples_split': 0.342230583264095, 'min_samples_leaf': 0.04324134530609249, 'min_weight_fraction_leaf': 0.1217497129039339, 'max_features': 0.6078473810073537}. Best is trial 163 with value: 0.7137418010284807.[0m
[32m[I 2022-04-13 11:46:04,303][0m Trial 675 finished with value: 0.6853507734439263 and parameters: {'splitter': 'best', 'min_samples_split': 0.32221286396168863, 'min_samples_leaf': 0.024992296196013158, 'min_weight_fraction_leaf': 0.03765731159800817, 'max_features': 0.5654016630594497}. Best is trial 163 with value: 0.7137418010284807.[0m
[32m[I 2022-04-13 11:46:04,469][0m Trial 676 finished with value: 0.6494336255137935 and parameters: {'splitter': 'best', 'min_samples_split': 0.3050244646255882, 'min_samples_leaf': 0.001177766339696566, 'min_weight_fraction_leaf': 0.35794484161325224, 'max_features': 0.5398535389342193}. Best is trial 163 with value: 0.7137418010284807.[0m
[32m[I 2022-04-13 11:46:04,586][0m Trial 677 finished with value: 0.6440317768217898 and parameters: {'splitter': 'best', 'min_samples_split': 0.31322986971457234, 'min_samples_leaf': 0.018394261866163563, 'min_weight_fraction_leaf': 0.09560572896847755, 'max_features': 0.4737249547164694}. Best is trial 163 with value: 0.7137418010284807.[0m
[32m[I 2022-04-13 11:46:04,622][0m Trial 678 finished with value: 0.6440317768217898 and parameters: {'splitter': 'best', 'min_samples_split': 0.32019964842725973, 'min_samples_leaf': 0.016892712811978676, 'min_weight_fraction_leaf': 0.09901187515432144, 'max_features': 0.4654265298545604}. Best is trial 163 with value: 0.7137418010284807.[0m
[32m[I 2022-04-13 11:46:04,657][0m Trial 679 finished with value: 0.6481259063667688 and parameters: {'splitter': 'best', 'min_samples_split': 0.3084594126951918, 'min_samples_leaf': 0.01765670916565071, 'min_weight_fraction_leaf': 0.0827124104097376, 'max_features': 0.48893152838447546}. Best is trial 163 with value: 0.7137418010284807.[0m
[32m[I 2022-04-13 11:46:04,693][0m Trial 680 finished with value: 0.6989673695016856 and parameters: {'splitter': 'best', 'min_samples_split': 0.3323189839336133, 'min_samples_leaf': 0.038571885357423286, 'min_weight_fraction_leaf': 0.06372809922336095, 'max_features': 0.5756655563167338}. Best is trial 163 with value: 0.7137418010284807.[0m
[32m[I 2022-04-13 11:46:04,729][0m Trial 681 finished with value: 0.6973165319603714 and parameters: {'splitter': 'best', 'min_samples_split': 0.3507828519688607, 'min_samples_leaf': 0.031041207489032094, 'min_weight_fraction_leaf': 0.06729156594791173, 'max_features': 0.28049145703272804}. Best is trial 163 with value: 0.7137418010284807.[0m
[32m[I 2022-04-13 11:46:04,770][0m Trial 682 finished with value: 0.566520610869186 and parameters: {'splitter': 'random', 'min_samples_split': 0.32911233165538123, 'min_samples_leaf': 0.030457703608418187, 'min_weight_fraction_leaf': 0.06844961516099268, 'max_features': 0.4232972546533861}. Best is trial 163 with value: 0.7137418010284807.[0m
[32m[I 2022-04-13 11:46:04,831][0m Trial 683 finished with value: 0.7137418010284807 and parameters: {'splitter': 'best', 'min_samples_split': 0.3167487534643421, 'min_samples_leaf': 0.023379876138466087, 'min_weight_fraction_leaf': 0.07599550921525791, 'max_features': 0.5422532929799484}. Best is trial 163 with value: 0.7137418010284807.[0m
[32m[I 2022-04-13 11:46:04,890][0m Trial 684 finished with value: 0.6989673695016856 and parameters: {'splitter': 'best', 'min_samples_split': 0.3398054131815583, 'min_samples_leaf': 0.035132368404220335, 'min_weight_fraction_leaf': 0.06302002687922098, 'max_features': 0.5315918995565073}. Best is trial 163 with value: 0.7137418010284807.[0m
[32m[I 2022-04-13 11:46:04,953][0m Trial 685 finished with value: 0.6853507734439263 and parameters: {'splitter': 'best', 'min_samples_split': 0.3255545339334304, 'min_samples_leaf': 0.02559541610334771, 'min_weight_fraction_leaf': 0.046026721326281786, 'max_features': 0.5262582324540067}. Best is trial 163 with value: 0.7137418010284807.[0m
[32m[I 2022-04-13 11:46:05,008][0m Trial 686 finished with value: 0.7044783206942828 and parameters: {'splitter': 'best', 'min_samples_split': 0.3140671541562562, 'min_samples_leaf': 0.042498215822878306, 'min_weight_fraction_leaf': 0.110449615342326, 'max_features': 0.5697385179438722}. Best is trial 163 with value: 0.7137418010284807.[0m
[32m[I 2022-04-13 11:46:05,045][0m Trial 687 finished with value: 0.631953446187902 and parameters: {'splitter': 'best', 'min_samples_split': 0.32093180816513267, 'min_samples_leaf': 0.030496381412571612, 'min_weight_fraction_leaf': 0.07139929340201623, 'max_features': 0.49598724257737553}. Best is trial 163 with value: 0.7137418010284807.[0m
[32m[I 2022-04-13 11:46:05,120][0m Trial 688 finished with value: 0.6989673695016856 and parameters: {'splitter': 'best', 'min_samples_split': 0.38320288766919053, 'min_samples_leaf': 0.036453140259057604, 'min_weight_fraction_leaf': 0.054451865073877934, 'max_features': 0.5031472240431635}. Best is trial 163 with value: 0.7137418010284807.[0m
[32m[I 2022-04-13 11:46:05,206][0m Trial 689 finished with value: 0.6920012331415456 and parameters: {'splitter': 'best', 'min_samples_split': 0.2919813803241992, 'min_samples_leaf': 0.041222579402273446, 'min_weight_fraction_leaf': 0.10508641601234582, 'max_features': 0.5923930616515212}. Best is trial 163 with value: 0.7137418010284807.[0m
[32m[I 2022-04-13 11:46:05,280][0m Trial 690 finished with value: 0.695563433079365 and parameters: {'splitter': 'best', 'min_samples_split': 0.29629406167423183, 'min_samples_leaf': 0.008533918400428669, 'min_weight_fraction_leaf': 0.08339192776073165, 'max_features': 0.542025747939815}. Best is trial 163 with value: 0.7137418010284807.[0m
[32m[I 2022-04-13 11:46:05,371][0m Trial 691 finished with value: 0.7030519614506526 and parameters: {'splitter': 'best', 'min_samples_split': 0.3149124392245222, 'min_samples_leaf': 0.022043101091430376, 'min_weight_fraction_leaf': 0.07857436208155394, 'max_features': 0.5384539507977193}. Best is trial 163 with value: 0.7137418010284807.[0m
[32m[I 2022-04-13 11:46:05,434][0m Trial 692 finished with value: 0.6431621494219514 and parameters: {'splitter': 'best', 'min_samples_split': 0.3440285125300693, 'min_samples_leaf': 0.20668762378405772, 'min_weight_fraction_leaf': 0.12140242061801047, 'max_features': 0.46161490331005395}. Best is trial 163 with value: 0.7137418010284807.[0m
[32m[I 2022-04-13 11:46:05,519][0m Trial 693 finished with value: 0.7044783206942828 and parameters: {'splitter': 'best', 'min_samples_split': 0.3065461439958976, 'min_samples_leaf': 0.010734877820016763, 'min_weight_fraction_leaf': 0.1065844682137446, 'max_features': 0.5580263499430125}. Best is trial 163 with value: 0.7137418010284807.[0m
[32m[I 2022-04-13 11:46:05,587][0m Trial 694 finished with value: 0.695717049718467 and parameters: {'splitter': 'best', 'min_samples_split': 0.3690926976489275, 'min_samples_leaf': 0.019469526199058534, 'min_weight_fraction_leaf': 0.11745194643188886, 'max_features': 0.9163586469819738}. Best is trial 163 with value: 0.7137418010284807.[0m
[32m[I 2022-04-13 11:46:05,665][0m Trial 695 finished with value: 0.6989673695016856 and parameters: {'splitter': 'best', 'min_samples_split': 0.332723575782686, 'min_samples_leaf': 0.02388878006927677, 'min_weight_fraction_leaf': 0.07734005414024306, 'max_features': 0.5509903033671815}. Best is trial 163 with value: 0.7137418010284807.[0m
[32m[I 2022-04-13 11:46:05,748][0m Trial 696 finished with value: 0.7137418010284807 and parameters: {'splitter': 'best', 'min_samples_split': 0.32021352660245417, 'min_samples_leaf': 0.020869925284437083, 'min_weight_fraction_leaf': 0.08030453442381136, 'max_features': 0.5290921406086332}. Best is trial 163 with value: 0.7137418010284807.[0m
[32m[I 2022-04-13 11:46:05,830][0m Trial 697 finished with value: 0.7094949191282665 and parameters: {'splitter': 'random', 'min_samples_split': 0.27236357317209803, 'min_samples_leaf': 0.010984907029198564, 'min_weight_fraction_leaf': 0.09375417687908144, 'max_features': 0.5163046501671907}. Best is trial 163 with value: 0.7137418010284807.[0m
[32m[I 2022-04-13 11:46:05,908][0m Trial 698 finished with value: 0.7030519614506526 and parameters: {'splitter': 'best', 'min_samples_split': 0.30300625300961115, 'min_samples_leaf': 0.0016712018611335921, 'min_weight_fraction_leaf': 0.09578601862723274, 'max_features': 0.5185610626039343}. Best is trial 163 with value: 0.7137418010284807.[0m
[32m[I 2022-04-13 11:46:05,973][0m Trial 699 finished with value: 0.7044783206942828 and parameters: {'splitter': 'best', 'min_samples_split': 0.3097542776178569, 'min_samples_leaf': 0.017939864369520095, 'min_weight_fraction_leaf': 0.10742342270315279, 'max_features': 0.5797207387696722}. Best is trial 163 with value: 0.7137418010284807.[0m
