[32m[I 2022-04-14 13:58:26,535][0m Trial 403 finished with value: 0.6758885873760987 and parameters: {'loss': 'coxph', 'learning_rate': 0.002417989038402196, 'n_estimators': 310, 'criterion': 'friedman_mse', 'min_samples_split': 9, 'min_samples_leaf': 1, 'min_weight_fraction_leaf': 0.3794323497982096, 'min_impurity_decrease': 0.0375538738378207, 'max_features': 0.9801507457317701, 'subsample': 0.8543851731884804, 'dropout_rate': 0.4823218982491586, 'ccp_alpha': 0.08453464233449505}. Best is trial 396 with value: 0.7561160925059711.[0m
[32m[I 2022-04-14 13:58:42,250][0m Trial 404 finished with value: 0.7252656606253163 and parameters: {'loss': 'coxph', 'learning_rate': 0.001983740396030538, 'n_estimators': 378, 'criterion': 'friedman_mse', 'min_samples_split': 9, 'min_samples_leaf': 1, 'min_weight_fraction_leaf': 0.06482383707259537, 'min_impurity_decrease': 0.012796922781932077, 'max_features': 0.9526234304757658, 'subsample': 0.9139002673730543, 'dropout_rate': 0.4205965419963159, 'ccp_alpha': 0.01204312403062675}. Best is trial 396 with value: 0.7561160925059711.[0m
[32m[I 2022-04-14 13:58:48,880][0m Trial 405 finished with value: 0.7455459371909915 and parameters: {'loss': 'coxph', 'learning_rate': 0.001554960770737367, 'n_estimators': 280, 'criterion': 'friedman_mse', 'min_samples_split': 9, 'min_samples_leaf': 1, 'min_weight_fraction_leaf': 0.08692200668008812, 'min_impurity_decrease': 0.035536387970264406, 'max_features': 0.9798036049167229, 'subsample': 0.8317291210199736, 'dropout_rate': 0.5805808125605508, 'ccp_alpha': 0.0025239529961265236}. Best is trial 396 with value: 0.7561160925059711.[0m
[32m[I 2022-04-14 13:58:55,938][0m Trial 406 finished with value: 0.7477846580711157 and parameters: {'loss': 'coxph', 'learning_rate': 0.0027167185282349683, 'n_estimators': 280, 'criterion': 'friedman_mse', 'min_samples_split': 9, 'min_samples_leaf': 1, 'min_weight_fraction_leaf': 0.08800629620849872, 'min_impurity_decrease': 0.006075056922818317, 'max_features': 0.9959019871616982, 'subsample': 0.8284578490737835, 'dropout_rate': 0.5704230535581932, 'ccp_alpha': 0.0038402613619855}. Best is trial 396 with value: 0.7561160925059711.[0m
[32m[I 2022-04-14 13:59:02,508][0m Trial 407 finished with value: 0.7483066058236797 and parameters: {'loss': 'coxph', 'learning_rate': 0.0037268988106281833, 'n_estimators': 281, 'criterion': 'friedman_mse', 'min_samples_split': 9, 'min_samples_leaf': 1, 'min_weight_fraction_leaf': 0.0874128046551388, 'min_impurity_decrease': 0.0035573983009690897, 'max_features': 0.9934093506079628, 'subsample': 0.827296750822486, 'dropout_rate': 0.6083724783847738, 'ccp_alpha': 0.005794468162284622}. Best is trial 396 with value: 0.7561160925059711.[0m
[32m[I 2022-04-14 13:59:09,038][0m Trial 408 finished with value: 0.7457212348328924 and parameters: {'loss': 'coxph', 'learning_rate': 0.0050421335954431755, 'n_estimators': 280, 'criterion': 'friedman_mse', 'min_samples_split': 9, 'min_samples_leaf': 1, 'min_weight_fraction_leaf': 0.08445472252876655, 'min_impurity_decrease': 0.0058126321543552, 'max_features': 0.9961746687241954, 'subsample': 0.8328100169872503, 'dropout_rate': 0.5833890088467927, 'ccp_alpha': 0.007106488761040876}. Best is trial 396 with value: 0.7561160925059711.[0m
[32m[I 2022-04-14 13:59:15,597][0m Trial 409 finished with value: 0.7498791884051246 and parameters: {'loss': 'coxph', 'learning_rate': 0.003354921597869182, 'n_estimators': 285, 'criterion': 'friedman_mse', 'min_samples_split': 9, 'min_samples_leaf': 1, 'min_weight_fraction_leaf': 0.07508948196628157, 'min_impurity_decrease': 0.001536448523397689, 'max_features': 0.999759534813808, 'subsample': 0.8288754932242512, 'dropout_rate': 0.6056731317804334, 'ccp_alpha': 0.0027587168921544194}. Best is trial 396 with value: 0.7561160925059711.[0m
[32m[I 2022-04-14 13:59:21,329][0m Trial 410 finished with value: 0.2566994798800366 and parameters: {'loss': 'squared', 'learning_rate': 0.005842110378550273, 'n_estimators': 260, 'criterion': 'friedman_mse', 'min_samples_split': 9, 'min_samples_leaf': 1, 'min_weight_fraction_leaf': 0.0731754688939187, 'min_impurity_decrease': 0.005154306879969782, 'max_features': 0.9978641332960917, 'subsample': 0.833136410895139, 'dropout_rate': 0.5787657339013995, 'ccp_alpha': 0.012777021125711514}. Best is trial 396 with value: 0.7561160925059711.[0m
[32m[I 2022-04-14 13:59:27,278][0m Trial 411 finished with value: 0.734068447874139 and parameters: {'loss': 'coxph', 'learning_rate': 0.004453987760547559, 'n_estimators': 276, 'criterion': 'friedman_mse', 'min_samples_split': 9, 'min_samples_leaf': 1, 'min_weight_fraction_leaf': 0.06648735577918209, 'min_impurity_decrease': 0.00487787870969603, 'max_features': 0.9997464818350994, 'subsample': 0.8695918612497612, 'dropout_rate': 0.6238738769844829, 'ccp_alpha': 0.005211190234264202}. Best is trial 396 with value: 0.7561160925059711.[0m
[32m[I 2022-04-14 13:59:34,357][0m Trial 412 finished with value: 0.735811007355422 and parameters: {'loss': 'coxph', 'learning_rate': 0.004957541458888875, 'n_estimators': 285, 'criterion': 'friedman_mse', 'min_samples_split': 9, 'min_samples_leaf': 8, 'min_weight_fraction_leaf': 0.07791073179385344, 'min_impurity_decrease': 0.007130405790822449, 'max_features': 0.9998939208184948, 'subsample': 0.8177562781562198, 'dropout_rate': 0.5997733159688572, 'ccp_alpha': 0.004904128991366805}. Best is trial 396 with value: 0.7561160925059711.[0m
[32m[I 2022-04-14 13:59:42,552][0m Trial 413 finished with value: 0.7287540503381615 and parameters: {'loss': 'coxph', 'learning_rate': 0.0040939452156631695, 'n_estimators': 300, 'criterion': 'friedman_mse', 'min_samples_split': 10, 'min_samples_leaf': 1, 'min_weight_fraction_leaf': 0.08291038711372901, 'min_impurity_decrease': 0.022246237637658744, 'max_features': 0.9828426713204225, 'subsample': 0.9922998813679191, 'dropout_rate': 0.5752853050552162, 'ccp_alpha': 0.0017732120678837064}. Best is trial 396 with value: 0.7561160925059711.[0m
[32m[I 2022-04-14 13:59:48,534][0m Trial 414 finished with value: 0.7497816130749502 and parameters: {'loss': 'coxph', 'learning_rate': 0.003474872596231847, 'n_estimators': 271, 'criterion': 'friedman_mse', 'min_samples_split': 9, 'min_samples_leaf': 1, 'min_weight_fraction_leaf': 0.08849687660208762, 'min_impurity_decrease': 0.002250847347950378, 'max_features': 0.9809299977272411, 'subsample': 0.8475225253075139, 'dropout_rate': 0.600597741565228, 'ccp_alpha': 0.0017960249665179423}. Best is trial 396 with value: 0.7561160925059711.[0m
[32m[I 2022-04-14 13:59:55,342][0m Trial 415 finished with value: 0.6996238492261317 and parameters: {'loss': 'coxph', 'learning_rate': 0.0035864667977688783, 'n_estimators': 281, 'criterion': 'friedman_mse', 'min_samples_split': 9, 'min_samples_leaf': 1, 'min_weight_fraction_leaf': 0.06119567664355444, 'min_impurity_decrease': 0.015106256827761302, 'max_features': 0.9803937798992367, 'subsample': 0.8483254705436377, 'dropout_rate': 0.6012772867612202, 'ccp_alpha': 0.17011516178967037}. Best is trial 396 with value: 0.7561160925059711.[0m
[32m[I 2022-04-14 14:00:01,142][0m Trial 416 finished with value: 0.5 and parameters: {'loss': 'coxph', 'learning_rate': 0.0061011271439108256, 'n_estimators': 251, 'criterion': 'friedman_mse', 'min_samples_split': 9, 'min_samples_leaf': 1, 'min_weight_fraction_leaf': 0.0742991891309781, 'min_impurity_decrease': 0.0019252436642336935, 'max_features': 0.9514838526053684, 'subsample': 0.8717651681056217, 'dropout_rate': 0.5394556289812212, 'ccp_alpha': 1.3788463447226822}. Best is trial 396 with value: 0.7561160925059711.[0m
[32m[I 2022-04-14 14:00:08,545][0m Trial 417 finished with value: 0.6834721836112492 and parameters: {'loss': 'coxph', 'learning_rate': 0.003313580154325985, 'n_estimators': 304, 'criterion': 'friedman_mse', 'min_samples_split': 9, 'min_samples_leaf': 1, 'min_weight_fraction_leaf': 0.08759085984147684, 'min_impurity_decrease': 0.002421604028889715, 'max_features': 0.9796219870620413, 'subsample': 0.8312302143322032, 'dropout_rate': 0.6473270209202409, 'ccp_alpha': 0.18000227085511156}. Best is trial 396 with value: 0.7561160925059711.[0m
[32m[I 2022-04-14 14:00:15,129][0m Trial 418 finished with value: 0.7472569999313212 and parameters: {'loss': 'coxph', 'learning_rate': 0.004636505194162128, 'n_estimators': 269, 'criterion': 'friedman_mse', 'min_samples_split': 9, 'min_samples_leaf': 1, 'min_weight_fraction_leaf': 0.08757390181121051, 'min_impurity_decrease': 0.029865961410058612, 'max_features': 0.9526815875022195, 'subsample': 0.8135527121705319, 'dropout_rate': 0.5901451914669573, 'ccp_alpha': 0.008901264268738093}. Best is trial 396 with value: 0.7561160925059711.[0m
[32m[I 2022-04-14 14:00:21,116][0m Trial 419 finished with value: 0.7424081285665487 and parameters: {'loss': 'coxph', 'learning_rate': 0.005841200536455701, 'n_estimators': 268, 'criterion': 'friedman_mse', 'min_samples_split': 9, 'min_samples_leaf': 1, 'min_weight_fraction_leaf': 0.08735258174756397, 'min_impurity_decrease': 0.029410100936569254, 'max_features': 0.9567390688581783, 'subsample': 0.8132822657252782, 'dropout_rate': 0.6057097427265647, 'ccp_alpha': 0.014062606083446514}. Best is trial 396 with value: 0.7561160925059711.[0m
[32m[I 2022-04-14 14:00:28,197][0m Trial 420 finished with value: 0.7413100742731303 and parameters: {'loss': 'coxph', 'learning_rate': 0.004399500710236626, 'n_estimators': 273, 'criterion': 'friedman_mse', 'min_samples_split': 9, 'min_samples_leaf': 1, 'min_weight_fraction_leaf': 0.07130160058318757, 'min_impurity_decrease': 0.030571195847745404, 'max_features': 0.9775812855778139, 'subsample': 0.8557375464902688, 'dropout_rate': 0.5886801325386517, 'ccp_alpha': 0.006521661894798815}. Best is trial 396 with value: 0.7561160925059711.[0m
[32m[I 2022-04-14 14:00:33,853][0m Trial 421 finished with value: 0.7418877986429517 and parameters: {'loss': 'coxph', 'learning_rate': 0.004865613408988291, 'n_estimators': 241, 'criterion': 'friedman_mse', 'min_samples_split': 9, 'min_samples_leaf': 1, 'min_weight_fraction_leaf': 0.08800374490085122, 'min_impurity_decrease': 0.03276695124461089, 'max_features': 0.999265667014286, 'subsample': 0.8367551580830115, 'dropout_rate': 0.5620687614985265, 'ccp_alpha': 0.0014690530529879575}. Best is trial 396 with value: 0.7561160925059711.[0m
[32m[I 2022-04-14 14:00:44,648][0m Trial 422 finished with value: 0.7406245218014011 and parameters: {'loss': 'coxph', 'learning_rate': 0.0038946541954985926, 'n_estimators': 354, 'criterion': 'friedman_mse', 'min_samples_split': 9, 'min_samples_leaf': 1, 'min_weight_fraction_leaf': 0.0777467970096355, 'min_impurity_decrease': 0.003728433862644466, 'max_features': 0.9530854870411452, 'subsample': 0.8797228806778815, 'dropout_rate': 0.6283521849885515, 'ccp_alpha': 0.007225095718601455}. Best is trial 396 with value: 0.7561160925059711.[0m
[32m[I 2022-04-14 14:00:53,015][0m Trial 423 finished with value: 0.7151036734954621 and parameters: {'loss': 'coxph', 'learning_rate': 0.003467313441037446, 'n_estimators': 290, 'criterion': 'friedman_mse', 'min_samples_split': 9, 'min_samples_leaf': 1, 'min_weight_fraction_leaf': 0.06426921374210934, 'min_impurity_decrease': 0.029208549128678606, 'max_features': 0.9748530399514013, 'subsample': 0.8091454272409221, 'dropout_rate': 0.5215315007080022, 'ccp_alpha': 0.15492956497469623}. Best is trial 396 with value: 0.7561160925059711.[0m
[32m[I 2022-04-14 14:01:02,060][0m Trial 424 finished with value: 0.7528560177301674 and parameters: {'loss': 'coxph', 'learning_rate': 0.0073049395458662705, 'n_estimators': 327, 'criterion': 'friedman_mse', 'min_samples_split': 9, 'min_samples_leaf': 1, 'min_weight_fraction_leaf': 0.08770668541631876, 'min_impurity_decrease': 0.03767625619370636, 'max_features': 0.9999658431907974, 'subsample': 0.8534875942309229, 'dropout_rate': 0.5877912633830968, 'ccp_alpha': 0.001164985886702231}. Best is trial 396 with value: 0.7561160925059711.[0m
[32m[I 2022-04-14 14:01:10,561][0m Trial 425 finished with value: 0.6985577269943093 and parameters: {'loss': 'coxph', 'learning_rate': 0.007480154324713698, 'n_estimators': 320, 'criterion': 'friedman_mse', 'min_samples_split': 9, 'min_samples_leaf': 1, 'min_weight_fraction_leaf': 0.08113252959917244, 'min_impurity_decrease': 0.0016001533484265272, 'max_features': 0.9976977366872719, 'subsample': 0.8531605905222789, 'dropout_rate': 0.5829575649647832, 'ccp_alpha': 0.1594946248384446}. Best is trial 396 with value: 0.7561160925059711.[0m
[32m[I 2022-04-14 14:01:19,625][0m Trial 426 finished with value: 0.5217459622928541 and parameters: {'loss': 'coxph', 'learning_rate': 0.007454558274456623, 'n_estimators': 326, 'criterion': 'friedman_mse', 'min_samples_split': 10, 'min_samples_leaf': 1, 'min_weight_fraction_leaf': 0.09026382691673782, 'min_impurity_decrease': 0.024197616393648976, 'max_features': 0.9683531411033861, 'subsample': 0.8973062874980802, 'dropout_rate': 0.5516609256719545, 'ccp_alpha': 0.2498261484043609}. Best is trial 396 with value: 0.7561160925059711.[0m
[32m[I 2022-04-14 14:01:26,861][0m Trial 427 finished with value: 0.6584734656446332 and parameters: {'loss': 'coxph', 'learning_rate': 0.009481510909692032, 'n_estimators': 305, 'criterion': 'friedman_mse', 'min_samples_split': 9, 'min_samples_leaf': 1, 'min_weight_fraction_leaf': 0.26793271647466466, 'min_impurity_decrease': 0.03864683460051332, 'max_features': 0.945881684104926, 'subsample': 0.8289911032005821, 'dropout_rate': 0.613229182727914, 'ccp_alpha': 0.001664275345483814}. Best is trial 396 with value: 0.7561160925059711.[0m
[32m[I 2022-04-14 14:01:36,288][0m Trial 428 finished with value: 0.7389744754981754 and parameters: {'loss': 'coxph', 'learning_rate': 0.004779611034568318, 'n_estimators': 334, 'criterion': 'friedman_mse', 'min_samples_split': 9, 'min_samples_leaf': 1, 'min_weight_fraction_leaf': 0.06873563104487235, 'min_impurity_decrease': 0.020014299200645867, 'max_features': 0.9993795353178513, 'subsample': 0.8673356488431653, 'dropout_rate': 0.5705111030464807, 'ccp_alpha': 0.0016904363125079397}. Best is trial 396 with value: 0.7561160925059711.[0m
[32m[I 2022-04-14 14:01:43,837][0m Trial 429 finished with value: 0.24327918884318472 and parameters: {'loss': 'squared', 'learning_rate': 0.0061240059651949, 'n_estimators': 282, 'criterion': 'friedman_mse', 'min_samples_split': 9, 'min_samples_leaf': 1, 'min_weight_fraction_leaf': 0.0542544748308525, 'min_impurity_decrease': 0.03490958218789158, 'max_features': 0.9779847779926594, 'subsample': 0.8492278098626926, 'dropout_rate': 0.5000690257737992, 'ccp_alpha': 0.13067172353860976}. Best is trial 396 with value: 0.7561160925059711.[0m
[32m[I 2022-04-14 14:01:48,956][0m Trial 430 finished with value: 0.7189970264935567 and parameters: {'loss': 'coxph', 'learning_rate': 0.003242984004508164, 'n_estimators': 265, 'criterion': 'friedman_mse', 'min_samples_split': 9, 'min_samples_leaf': 1, 'min_weight_fraction_leaf': 0.07607257027909073, 'min_impurity_decrease': 0.0011664269605301397, 'max_features': 0.9563942199119605, 'subsample': 0.8068840405474503, 'dropout_rate': 0.6711957925813833, 'ccp_alpha': 0.15542539299084612}. Best is trial 396 with value: 0.7561160925059711.[0m
[32m[I 2022-04-14 14:01:57,132][0m Trial 431 finished with value: 0.7198706504879825 and parameters: {'loss': 'coxph', 'learning_rate': 0.008906437261506304, 'n_estimators': 295, 'criterion': 'friedman_mse', 'min_samples_split': 9, 'min_samples_leaf': 1, 'min_weight_fraction_leaf': 0.08531888710737992, 'min_impurity_decrease': 0.0414859502224879, 'max_features': 0.9816613683412334, 'subsample': 0.8291560087332192, 'dropout_rate': 0.5323930965985735, 'ccp_alpha': 0.12476014877885792}. Best is trial 396 with value: 0.7561160925059711.[0m
[32m[I 2022-04-14 14:02:01,540][0m Trial 432 finished with value: 0.5217459622928541 and parameters: {'loss': 'coxph', 'learning_rate': 0.004060256519910197, 'n_estimators': 228, 'criterion': 'friedman_mse', 'min_samples_split': 9, 'min_samples_leaf': 1, 'min_weight_fraction_leaf': 0.08969469630648486, 'min_impurity_decrease': 0.016718853745725733, 'max_features': 0.999441094078471, 'subsample': 0.8773976515470455, 'dropout_rate': 0.5890710265075766, 'ccp_alpha': 0.24805501940082036}. Best is trial 396 with value: 0.7561160925059711.[0m
[32m[I 2022-04-14 14:02:11,402][0m Trial 433 finished with value: 0.7533700831324172 and parameters: {'loss': 'coxph', 'learning_rate': 0.003045418101206048, 'n_estimators': 311, 'criterion': 'friedman_mse', 'min_samples_split': 2, 'min_samples_leaf': 1, 'min_weight_fraction_leaf': 0.06143787776701546, 'min_impurity_decrease': 0.0430302700520433, 'max_features': 0.9637388864270494, 'subsample': 0.8447183542887187, 'dropout_rate': 0.48070176990398106, 'ccp_alpha': 0.10296290798480696}. Best is trial 396 with value: 0.7561160925059711.[0m
[32m[I 2022-04-14 14:02:21,273][0m Trial 434 finished with value: 0.5 and parameters: {'loss': 'coxph', 'learning_rate': 0.003339155823656639, 'n_estimators': 366, 'criterion': 'friedman_mse', 'min_samples_split': 2, 'min_samples_leaf': 1, 'min_weight_fraction_leaf': 0.05364477331044584, 'min_impurity_decrease': 0.03584867597779058, 'max_features': 0.9461536194063718, 'subsample': 0.9153841134539689, 'dropout_rate': 0.6445376640180644, 'ccp_alpha': 3.970875190121471}. Best is trial 396 with value: 0.7561160925059711.[0m
[32m[I 2022-04-14 14:02:34,005][0m Trial 435 finished with value: 0.5160881488838708 and parameters: {'loss': 'coxph', 'learning_rate': 0.0044857171271583205, 'n_estimators': 348, 'criterion': 'friedman_mse', 'min_samples_split': 9, 'min_samples_leaf': 1, 'min_weight_fraction_leaf': 0.05955837079844205, 'min_impurity_decrease': 0.04143484255438703, 'max_features': 0.9655164376519976, 'subsample': 0.8632255130467827, 'dropout_rate': 0.47508807046452395, 'ccp_alpha': 0.32510267250304103}. Best is trial 396 with value: 0.7561160925059711.[0m
[32m[I 2022-04-14 14:02:42,747][0m Trial 436 finished with value: 0.5 and parameters: {'loss': 'coxph', 'learning_rate': 0.00579046341731693, 'n_estimators': 286, 'criterion': 'friedman_mse', 'min_samples_split': 10, 'min_samples_leaf': 1, 'min_weight_fraction_leaf': 0.0710903100516681, 'min_impurity_decrease': 0.0460986809771674, 'max_features': 0.9689140201215879, 'subsample': 0.8049839865118217, 'dropout_rate': 0.45393942686837646, 'ccp_alpha': 3.232017558045159}. Best is trial 396 with value: 0.7561160925059711.[0m
[32m[I 2022-04-14 14:02:50,641][0m Trial 437 finished with value: 0.667147787011961 and parameters: {'loss': 'coxph', 'learning_rate': 0.002828340026524281, 'n_estimators': 317, 'criterion': 'friedman_mse', 'min_samples_split': 9, 'min_samples_leaf': 1, 'min_weight_fraction_leaf': 0.06267402622351996, 'min_impurity_decrease': 0.018324528634517175, 'max_features': 0.946095874028882, 'subsample': 0.8406609342676494, 'dropout_rate': 0.6186313147881461, 'ccp_alpha': 0.21224471948011034}. Best is trial 396 with value: 0.7561160925059711.[0m
[32m[I 2022-04-14 14:02:58,495][0m Trial 438 finished with value: 0.7162147467210837 and parameters: {'loss': 'coxph', 'learning_rate': 0.0030283004948626104, 'n_estimators': 302, 'criterion': 'friedman_mse', 'min_samples_split': 9, 'min_samples_leaf': 1, 'min_weight_fraction_leaf': 0.07695291836711224, 'min_impurity_decrease': 0.002411223160965167, 'max_features': 0.9801243085727156, 'subsample': 0.8926719893550548, 'dropout_rate': 0.5628208302648824, 'ccp_alpha': 0.11653018013954591}. Best is trial 396 with value: 0.7561160925059711.[0m
[32m[I 2022-04-14 14:03:05,569][0m Trial 439 finished with value: 0.7255443882911148 and parameters: {'loss': 'coxph', 'learning_rate': 0.004824284048955553, 'n_estimators': 274, 'criterion': 'friedman_mse', 'min_samples_split': 9, 'min_samples_leaf': 1, 'min_weight_fraction_leaf': 0.09354122976433141, 'min_impurity_decrease': 0.044472971890867935, 'max_features': 0.9674227582916195, 'subsample': 0.8192758340091358, 'dropout_rate': 0.5195395002173382, 'ccp_alpha': 0.11460596605818568}. Best is trial 396 with value: 0.7561160925059711.[0m
[32m[I 2022-04-14 14:03:11,744][0m Trial 440 finished with value: 0.7248174570883823 and parameters: {'loss': 'coxph', 'learning_rate': 0.0071630615937523425, 'n_estimators': 260, 'criterion': 'friedman_mse', 'min_samples_split': 9, 'min_samples_leaf': 1, 'min_weight_fraction_leaf': 0.07184816075017288, 'min_impurity_decrease': 0.019199919189014106, 'max_features': 0.4797250703606773, 'subsample': 0.8579332483249097, 'dropout_rate': 0.598627755701706, 'ccp_alpha': 0.002013757629120026}. Best is trial 396 with value: 0.7561160925059711.[0m
[32m[I 2022-04-14 14:03:23,780][0m Trial 441 finished with value: 0.5328286035390352 and parameters: {'loss': 'coxph', 'learning_rate': 0.003773279619064662, 'n_estimators': 334, 'criterion': 'friedman_mse', 'min_samples_split': 9, 'min_samples_leaf': 1, 'min_weight_fraction_leaf': 0.0806777456273547, 'min_impurity_decrease': 0.0426182281825523, 'max_features': 0.9831635261987183, 'subsample': 0.8455918617842632, 'dropout_rate': 0.48249597524846355, 'ccp_alpha': 0.26631299915348866}. Best is trial 396 with value: 0.7561160925059711.[0m
[32m[I 2022-04-14 14:03:32,508][0m Trial 442 finished with value: 0.7075129534426648 and parameters: {'loss': 'coxph', 'learning_rate': 0.0027980162144582463, 'n_estimators': 292, 'criterion': 'friedman_mse', 'min_samples_split': 9, 'min_samples_leaf': 1, 'min_weight_fraction_leaf': 0.2053207965982699, 'min_impurity_decrease': 0.02165153118475252, 'max_features': 0.9636432414663003, 'subsample': 0.8801906352800072, 'dropout_rate': 0.5483616159951631, 'ccp_alpha': 0.11497009849056224}. Best is trial 396 with value: 0.7561160925059711.[0m
