[32m[I 2022-04-13 11:45:21,590][0m Trial 133 finished with value: 0.589064156645618 and parameters: {'splitter': 'best', 'min_samples_split': 0.12233591910717613, 'min_samples_leaf': 0.41773500876888103, 'min_weight_fraction_leaf': 0.09550936955162509, 'max_features': 0.6059687982838505}. Best is trial 92 with value: 0.7131405564108027.[0m
[32m[I 2022-04-13 11:45:21,671][0m Trial 134 finished with value: 0.6727435362500194 and parameters: {'splitter': 'best', 'min_samples_split': 0.09474002208875922, 'min_samples_leaf': 0.0704250637975837, 'min_weight_fraction_leaf': 0.006346257579014124, 'max_features': 0.4414441585468466}. Best is trial 92 with value: 0.7131405564108027.[0m
[32m[I 2022-04-13 11:45:21,751][0m Trial 135 finished with value: 0.6598807086240592 and parameters: {'splitter': 'random', 'min_samples_split': 0.1845712753660348, 'min_samples_leaf': 0.05118654746670842, 'min_weight_fraction_leaf': 0.023070062672255837, 'max_features': 0.545076904856683}. Best is trial 92 with value: 0.7131405564108027.[0m
[32m[I 2022-04-13 11:45:21,828][0m Trial 136 finished with value: 0.7085639671915396 and parameters: {'splitter': 'best', 'min_samples_split': 0.14171683276722236, 'min_samples_leaf': 0.007891361228500045, 'min_weight_fraction_leaf': 0.093064213966607, 'max_features': 0.5100070342047682}. Best is trial 92 with value: 0.7131405564108027.[0m
[32m[I 2022-04-13 11:45:21,907][0m Trial 137 finished with value: 0.6563799111996633 and parameters: {'splitter': 'best', 'min_samples_split': 0.1403102551998476, 'min_samples_leaf': 0.002680382913874055, 'min_weight_fraction_leaf': 0.06843477467572284, 'max_features': 0.48790236279860083}. Best is trial 92 with value: 0.7131405564108027.[0m
[32m[I 2022-04-13 11:45:21,999][0m Trial 138 finished with value: 0.7085639671915396 and parameters: {'splitter': 'best', 'min_samples_split': 0.13034760910961002, 'min_samples_leaf': 0.020221341392730782, 'min_weight_fraction_leaf': 0.09437858554928216, 'max_features': 0.5136297993319215}. Best is trial 92 with value: 0.7131405564108027.[0m
[32m[I 2022-04-13 11:45:22,080][0m Trial 139 finished with value: 0.6727701215232552 and parameters: {'splitter': 'best', 'min_samples_split': 0.12916670102607228, 'min_samples_leaf': 0.016226694090520723, 'min_weight_fraction_leaf': 0.16927731984329658, 'max_features': 0.5083449904011264}. Best is trial 92 with value: 0.7131405564108027.[0m
[32m[I 2022-04-13 11:45:22,174][0m Trial 140 finished with value: 0.6523342916589774 and parameters: {'splitter': 'best', 'min_samples_split': 0.10987505083749152, 'min_samples_leaf': 0.0076669721360277145, 'min_weight_fraction_leaf': 0.09416821729149882, 'max_features': 0.4667008181567217}. Best is trial 92 with value: 0.7131405564108027.[0m
[32m[I 2022-04-13 11:45:22,266][0m Trial 141 finished with value: 0.6777553843145072 and parameters: {'splitter': 'best', 'min_samples_split': 0.14962696087037966, 'min_samples_leaf': 0.032544047280290284, 'min_weight_fraction_leaf': 0.082415826527269, 'max_features': 0.5203689446713635}. Best is trial 92 with value: 0.7131405564108027.[0m
[32m[I 2022-04-13 11:45:22,367][0m Trial 142 finished with value: 0.6891921741320086 and parameters: {'splitter': 'best', 'min_samples_split': 0.15820906865280743, 'min_samples_leaf': 0.02410866702695561, 'min_weight_fraction_leaf': 0.12481252841952004, 'max_features': 0.5921580828100821}. Best is trial 92 with value: 0.7131405564108027.[0m
[32m[I 2022-04-13 11:45:22,429][0m Trial 143 finished with value: 0.7085639671915396 and parameters: {'splitter': 'best', 'min_samples_split': 0.1392843124387294, 'min_samples_leaf': 0.04249751691510368, 'min_weight_fraction_leaf': 0.09689691480106137, 'max_features': 0.5404933866741046}. Best is trial 92 with value: 0.7131405564108027.[0m
[32m[I 2022-04-13 11:45:22,520][0m Trial 144 finished with value: 0.7085639671915396 and parameters: {'splitter': 'best', 'min_samples_split': 0.12109377436904553, 'min_samples_leaf': 0.038133899614364836, 'min_weight_fraction_leaf': 0.09688220717996425, 'max_features': 0.537863803066428}. Best is trial 92 with value: 0.7131405564108027.[0m
[32m[I 2022-04-13 11:45:22,605][0m Trial 145 finished with value: 0.6302853010584785 and parameters: {'splitter': 'best', 'min_samples_split': 0.08966594219869581, 'min_samples_leaf': 0.01591900807410971, 'min_weight_fraction_leaf': 0.15625698651931827, 'max_features': 0.491244452214331}. Best is trial 92 with value: 0.7131405564108027.[0m
[32m[I 2022-04-13 11:45:22,724][0m Trial 146 finished with value: 0.6915258512335974 and parameters: {'splitter': 'best', 'min_samples_split': 0.11653484012178, 'min_samples_leaf': 0.03673910893827221, 'min_weight_fraction_leaf': 0.11644355077062969, 'max_features': 0.9142678278815333}. Best is trial 92 with value: 0.7131405564108027.[0m
[32m[I 2022-04-13 11:45:22,939][0m Trial 147 finished with value: 0.7131405564108027 and parameters: {'splitter': 'best', 'min_samples_split': 0.12742260183546722, 'min_samples_leaf': 0.04639004260681313, 'min_weight_fraction_leaf': 0.14234102434460483, 'max_features': 0.5413165069291161}. Best is trial 92 with value: 0.7131405564108027.[0m
[32m[I 2022-04-13 11:45:23,092][0m Trial 148 finished with value: 0.7131405564108027 and parameters: {'splitter': 'best', 'min_samples_split': 0.10159659997654248, 'min_samples_leaf': 0.05704665140599748, 'min_weight_fraction_leaf': 0.13752484960358738, 'max_features': 0.5112923431064262}. Best is trial 92 with value: 0.7131405564108027.[0m
[32m[I 2022-04-13 11:45:23,180][0m Trial 149 finished with value: 0.626076017631543 and parameters: {'splitter': 'best', 'min_samples_split': 0.09464286126902949, 'min_samples_leaf': 0.06086442083392592, 'min_weight_fraction_leaf': 0.1372756292611449, 'max_features': 0.45497854434772333}. Best is trial 92 with value: 0.7131405564108027.[0m
[32m[I 2022-04-13 11:45:23,280][0m Trial 150 finished with value: 0.6832725645429367 and parameters: {'splitter': 'best', 'min_samples_split': 0.10708651243815917, 'min_samples_leaf': 0.04735880784712339, 'min_weight_fraction_leaf': 0.14608151625152052, 'max_features': 0.5331719753350135}. Best is trial 92 with value: 0.7131405564108027.[0m
[32m[I 2022-04-13 11:45:23,397][0m Trial 151 finished with value: 0.7131405564108027 and parameters: {'splitter': 'best', 'min_samples_split': 0.13823600024786625, 'min_samples_leaf': 0.025503840050019704, 'min_weight_fraction_leaf': 0.13280099743064777, 'max_features': 0.5172976694940257}. Best is trial 92 with value: 0.7131405564108027.[0m
[32m[I 2022-04-13 11:45:23,451][0m Trial 152 finished with value: 0.6751900786136191 and parameters: {'splitter': 'best', 'min_samples_split': 0.12407420883526626, 'min_samples_leaf': 0.02082262051998268, 'min_weight_fraction_leaf': 0.1551804200209655, 'max_features': 0.5553011374104272}. Best is trial 92 with value: 0.7131405564108027.[0m
[32m[I 2022-04-13 11:45:23,478][0m Trial 153 finished with value: 0.7131405564108027 and parameters: {'splitter': 'best', 'min_samples_split': 0.1012031027915898, 'min_samples_leaf': 0.03997254000182847, 'min_weight_fraction_leaf': 0.13670904865588374, 'max_features': 0.5479414792313506}. Best is trial 92 with value: 0.7131405564108027.[0m
[32m[I 2022-04-13 11:45:23,505][0m Trial 154 finished with value: 0.6891921741320086 and parameters: {'splitter': 'best', 'min_samples_split': 0.10556978813111464, 'min_samples_leaf': 0.04129944864139127, 'min_weight_fraction_leaf': 0.1300675639137062, 'max_features': 0.5750630569722577}. Best is trial 92 with value: 0.7131405564108027.[0m
[32m[I 2022-04-13 11:45:23,533][0m Trial 155 finished with value: 0.6727701215232552 and parameters: {'splitter': 'best', 'min_samples_split': 0.08221846766504227, 'min_samples_leaf': 0.0028603374274664035, 'min_weight_fraction_leaf': 0.16401798425042177, 'max_features': 0.505902338317402}. Best is trial 92 with value: 0.7131405564108027.[0m
[32m[I 2022-04-13 11:45:23,570][0m Trial 156 finished with value: 0.6265972550908505 and parameters: {'splitter': 'best', 'min_samples_split': 0.1324796431587069, 'min_samples_leaf': 0.01666146505063171, 'min_weight_fraction_leaf': 0.1422557022899621, 'max_features': 0.48291319872923555}. Best is trial 92 with value: 0.7131405564108027.[0m
[32m[I 2022-04-13 11:45:23,601][0m Trial 157 finished with value: 0.6809325111928844 and parameters: {'splitter': 'best', 'min_samples_split': 0.1167503182957015, 'min_samples_leaf': 0.029829019694837786, 'min_weight_fraction_leaf': 0.1809454126007045, 'max_features': 0.5270034701879901}. Best is trial 92 with value: 0.7131405564108027.[0m
[32m[I 2022-04-13 11:45:23,628][0m Trial 158 finished with value: 0.7131405564108027 and parameters: {'splitter': 'best', 'min_samples_split': 0.10051888796886879, 'min_samples_leaf': 0.024928372725106167, 'min_weight_fraction_leaf': 0.13414289788806338, 'max_features': 0.5028169513840884}. Best is trial 92 with value: 0.7131405564108027.[0m
[32m[I 2022-04-13 11:45:23,655][0m Trial 159 finished with value: 0.6832725645429367 and parameters: {'splitter': 'best', 'min_samples_split': 0.10023046256657661, 'min_samples_leaf': 0.056482116138135134, 'min_weight_fraction_leaf': 0.14941174427783596, 'max_features': 0.5550092803436553}. Best is trial 92 with value: 0.7131405564108027.[0m
[32m[I 2022-04-13 11:45:23,681][0m Trial 160 finished with value: 0.5399790707385923 and parameters: {'splitter': 'best', 'min_samples_split': 0.07914174730230875, 'min_samples_leaf': 0.03854430151111455, 'min_weight_fraction_leaf': 0.4284106076070977, 'max_features': 0.46151127057318597}. Best is trial 92 with value: 0.7131405564108027.[0m
[32m[I 2022-04-13 11:45:23,708][0m Trial 161 finished with value: 0.7131405564108027 and parameters: {'splitter': 'best', 'min_samples_split': 0.1480603516929425, 'min_samples_leaf': 0.04251757438949597, 'min_weight_fraction_leaf': 0.13267317961446626, 'max_features': 0.5424228417996027}. Best is trial 92 with value: 0.7131405564108027.[0m
[32m[I 2022-04-13 11:45:23,735][0m Trial 162 finished with value: 0.7131405564108027 and parameters: {'splitter': 'best', 'min_samples_split': 0.15523073518477426, 'min_samples_leaf': 0.06777280787821219, 'min_weight_fraction_leaf': 0.13248215360602653, 'max_features': 0.5967715044879015}. Best is trial 92 with value: 0.7131405564108027.[0m
[32m[I 2022-04-13 11:45:23,763][0m Trial 163 finished with value: 0.7137418010284807 and parameters: {'splitter': 'best', 'min_samples_split': 0.31774223096146553, 'min_samples_leaf': 0.07140780949651353, 'min_weight_fraction_leaf': 0.12967006277907112, 'max_features': 0.5754319167620131}. Best is trial 163 with value: 0.7137418010284807.[0m
[32m[I 2022-04-13 11:45:23,791][0m Trial 164 finished with value: 0.6815535256784726 and parameters: {'splitter': 'best', 'min_samples_split': 0.3504169385300603, 'min_samples_leaf': 0.04891460008095937, 'min_weight_fraction_leaf': 0.1333815756543117, 'max_features': 0.5945356209324015}. Best is trial 163 with value: 0.7137418010284807.[0m
[32m[I 2022-04-13 11:45:23,817][0m Trial 165 finished with value: 0.6815535256784726 and parameters: {'splitter': 'best', 'min_samples_split': 0.4249150594560405, 'min_samples_leaf': 0.0690890067454671, 'min_weight_fraction_leaf': 0.140290350067799, 'max_features': 0.5671723090978897}. Best is trial 163 with value: 0.7137418010284807.[0m
[32m[I 2022-04-13 11:45:23,845][0m Trial 166 finished with value: 0.6727701215232552 and parameters: {'splitter': 'best', 'min_samples_split': 0.1530520372475977, 'min_samples_leaf': 0.09074235907171392, 'min_weight_fraction_leaf': 0.16565290717692327, 'max_features': 0.6145894189595685}. Best is trial 163 with value: 0.7137418010284807.[0m
[32m[I 2022-04-13 11:45:23,873][0m Trial 167 finished with value: 0.6891921741320086 and parameters: {'splitter': 'best', 'min_samples_split': 0.14399273117306657, 'min_samples_leaf': 0.009016403818015984, 'min_weight_fraction_leaf': 0.12647065238288854, 'max_features': 0.5095387421957389}. Best is trial 163 with value: 0.7137418010284807.[0m
[32m[I 2022-04-13 11:45:23,905][0m Trial 168 finished with value: 0.6751900786136191 and parameters: {'splitter': 'best', 'min_samples_split': 0.3064725016701528, 'min_samples_leaf': 0.08572745702985742, 'min_weight_fraction_leaf': 0.15213684915246306, 'max_features': 0.5882929279540765}. Best is trial 163 with value: 0.7137418010284807.[0m
[32m[I 2022-04-13 11:45:23,937][0m Trial 169 finished with value: 0.6891921741320086 and parameters: {'splitter': 'best', 'min_samples_split': 0.06681707624812436, 'min_samples_leaf': 0.03332534501782129, 'min_weight_fraction_leaf': 0.1201549982156486, 'max_features': 0.5538939311998575}. Best is trial 163 with value: 0.7137418010284807.[0m
[32m[I 2022-04-13 11:45:23,973][0m Trial 170 finished with value: 0.6094810001517091 and parameters: {'splitter': 'best', 'min_samples_split': 0.38983004789904235, 'min_samples_leaf': 0.0018038962214888586, 'min_weight_fraction_leaf': 0.13118122136920984, 'max_features': 0.1373738928392787}. Best is trial 163 with value: 0.7137418010284807.[0m
[32m[I 2022-04-13 11:45:24,013][0m Trial 171 finished with value: 0.7131405564108027 and parameters: {'splitter': 'best', 'min_samples_split': 0.120474358940769, 'min_samples_leaf': 0.023282553029477505, 'min_weight_fraction_leaf': 0.1431734484497739, 'max_features': 0.5396414348875621}. Best is trial 163 with value: 0.7137418010284807.[0m
[32m[I 2022-04-13 11:45:24,040][0m Trial 172 finished with value: 0.7131405564108027 and parameters: {'splitter': 'best', 'min_samples_split': 0.10122326934580572, 'min_samples_leaf': 0.025769742829705372, 'min_weight_fraction_leaf': 0.14244930803916342, 'max_features': 0.5773256888726935}. Best is trial 163 with value: 0.7137418010284807.[0m
[32m[I 2022-04-13 11:45:24,066][0m Trial 173 finished with value: 0.7131405564108027 and parameters: {'splitter': 'best', 'min_samples_split': 0.09148386601459335, 'min_samples_leaf': 0.027011337586180274, 'min_weight_fraction_leaf': 0.14165085318474743, 'max_features': 0.566154220560295}. Best is trial 163 with value: 0.7137418010284807.[0m
[32m[I 2022-04-13 11:45:24,092][0m Trial 174 finished with value: 0.6832725645429367 and parameters: {'splitter': 'best', 'min_samples_split': 0.08948026281764372, 'min_samples_leaf': 0.011941206933958849, 'min_weight_fraction_leaf': 0.14590452540083032, 'max_features': 0.5741965774531365}. Best is trial 163 with value: 0.7137418010284807.[0m
[32m[I 2022-04-13 11:45:24,118][0m Trial 175 finished with value: 0.6727701215232552 and parameters: {'splitter': 'best', 'min_samples_split': 0.09909687243805704, 'min_samples_leaf': 0.019994204048305125, 'min_weight_fraction_leaf': 0.1600415411820726, 'max_features': 0.562512590060396}. Best is trial 163 with value: 0.7137418010284807.[0m
[32m[I 2022-04-13 11:45:24,146][0m Trial 176 finished with value: 0.6646045222178076 and parameters: {'splitter': 'best', 'min_samples_split': 0.08760711525392817, 'min_samples_leaf': 0.027214767506944782, 'min_weight_fraction_leaf': 0.17436022104378424, 'max_features': 0.6350019636114527}. Best is trial 163 with value: 0.7137418010284807.[0m
[32m[I 2022-04-13 11:45:24,186][0m Trial 177 finished with value: 0.7131405564108027 and parameters: {'splitter': 'best', 'min_samples_split': 0.1103603427099189, 'min_samples_leaf': 0.06303564269161051, 'min_weight_fraction_leaf': 0.13869567446932166, 'max_features': 0.6100673420565581}. Best is trial 163 with value: 0.7137418010284807.[0m
[32m[I 2022-04-13 11:45:24,238][0m Trial 178 finished with value: 0.7131405564108027 and parameters: {'splitter': 'best', 'min_samples_split': 0.11058654611337962, 'min_samples_leaf': 0.058401514423589526, 'min_weight_fraction_leaf': 0.13836238230996606, 'max_features': 0.5911995320653687}. Best is trial 163 with value: 0.7137418010284807.[0m
[32m[I 2022-04-13 11:45:24,276][0m Trial 179 finished with value: 0.694086407378037 and parameters: {'splitter': 'best', 'min_samples_split': 0.10845200809096071, 'min_samples_leaf': 0.06561282625424023, 'min_weight_fraction_leaf': 0.19303261716899817, 'max_features': 0.5987071499536549}. Best is trial 163 with value: 0.7137418010284807.[0m
[32m[I 2022-04-13 11:45:24,314][0m Trial 180 finished with value: 0.7131405564108027 and parameters: {'splitter': 'best', 'min_samples_split': 0.10006407540384177, 'min_samples_leaf': 0.05981057871595177, 'min_weight_fraction_leaf': 0.13811439302407666, 'max_features': 0.6190893273063949}. Best is trial 163 with value: 0.7137418010284807.[0m
[32m[I 2022-04-13 11:45:24,351][0m Trial 181 finished with value: 0.6914642841588751 and parameters: {'splitter': 'best', 'min_samples_split': 0.09859057248679096, 'min_samples_leaf': 0.05649308912358341, 'min_weight_fraction_leaf': 0.1395485128031562, 'max_features': 0.6563163357777289}. Best is trial 163 with value: 0.7137418010284807.[0m
[32m[I 2022-04-13 11:45:24,422][0m Trial 182 finished with value: 0.6778130748182665 and parameters: {'splitter': 'best', 'min_samples_split': 0.10756487277041045, 'min_samples_leaf': 0.07530032079293221, 'min_weight_fraction_leaf': 0.21848476074057066, 'max_features': 0.6140956225717266}. Best is trial 163 with value: 0.7137418010284807.[0m
[32m[I 2022-04-13 11:45:24,469][0m Trial 183 finished with value: 0.6751900786136191 and parameters: {'splitter': 'best', 'min_samples_split': 0.07575619255410182, 'min_samples_leaf': 0.062401995899538314, 'min_weight_fraction_leaf': 0.15209201422668941, 'max_features': 0.5806936071633256}. Best is trial 163 with value: 0.7137418010284807.[0m
[32m[I 2022-04-13 11:45:24,502][0m Trial 184 finished with value: 0.7131405564108027 and parameters: {'splitter': 'best', 'min_samples_split': 0.08408855725290468, 'min_samples_leaf': 0.04493854555260843, 'min_weight_fraction_leaf': 0.13486470815271526, 'max_features': 0.6247052258580728}. Best is trial 163 with value: 0.7137418010284807.[0m
[32m[I 2022-04-13 11:45:24,555][0m Trial 185 finished with value: 0.6914642841588751 and parameters: {'splitter': 'best', 'min_samples_split': 0.0848782643466392, 'min_samples_leaf': 0.04352913347085976, 'min_weight_fraction_leaf': 0.13511481040064918, 'max_features': 0.6637932681727443}. Best is trial 163 with value: 0.7137418010284807.[0m
[32m[I 2022-04-13 11:45:24,598][0m Trial 186 finished with value: 0.6545185965974921 and parameters: {'splitter': 'best', 'min_samples_split': 0.09484425368198911, 'min_samples_leaf': 0.05289113497926421, 'min_weight_fraction_leaf': 0.12003062327130021, 'max_features': 0.6308774640240277}. Best is trial 163 with value: 0.7137418010284807.[0m
[32m[I 2022-04-13 11:45:24,645][0m Trial 187 finished with value: 0.7131405564108027 and parameters: {'splitter': 'best', 'min_samples_split': 0.0711065385292677, 'min_samples_leaf': 0.03412486912345557, 'min_weight_fraction_leaf': 0.14106434449080216, 'max_features': 0.5920533840785561}. Best is trial 163 with value: 0.7137418010284807.[0m
[32m[I 2022-04-13 11:45:24,690][0m Trial 188 finished with value: 0.6545185965974921 and parameters: {'splitter': 'best', 'min_samples_split': 0.06319521304130374, 'min_samples_leaf': 0.06119270153097507, 'min_weight_fraction_leaf': 0.12892135194545698, 'max_features': 0.6486708225386681}. Best is trial 163 with value: 0.7137418010284807.[0m
[32m[I 2022-04-13 11:45:24,733][0m Trial 189 finished with value: 0.7131405564108027 and parameters: {'splitter': 'best', 'min_samples_split': 0.0546737792270745, 'min_samples_leaf': 0.03604313139738094, 'min_weight_fraction_leaf': 0.1446574197269727, 'max_features': 0.5984188432947615}. Best is trial 163 with value: 0.7137418010284807.[0m
[32m[I 2022-04-13 11:45:24,772][0m Trial 190 finished with value: 0.6727701215232552 and parameters: {'splitter': 'best', 'min_samples_split': 0.05846930403906828, 'min_samples_leaf': 0.0755661582484618, 'min_weight_fraction_leaf': 0.15980771536536442, 'max_features': 0.6228864163211724}. Best is trial 163 with value: 0.7137418010284807.[0m
[32m[I 2022-04-13 11:45:24,819][0m Trial 191 finished with value: 0.6832725645429367 and parameters: {'splitter': 'best', 'min_samples_split': 0.07439400139036421, 'min_samples_leaf': 0.03126566324096168, 'min_weight_fraction_leaf': 0.14801232169807021, 'max_features': 0.6032749042468832}. Best is trial 163 with value: 0.7137418010284807.[0m
[32m[I 2022-04-13 11:45:24,854][0m Trial 192 finished with value: 0.7131405564108027 and parameters: {'splitter': 'best', 'min_samples_split': 0.11894271101386407, 'min_samples_leaf': 0.04656685369397859, 'min_weight_fraction_leaf': 0.13459216957750667, 'max_features': 0.5731356204351381}. Best is trial 163 with value: 0.7137418010284807.[0m
[32m[I 2022-04-13 11:45:24,898][0m Trial 193 finished with value: 0.6891921741320086 and parameters: {'splitter': 'best', 'min_samples_split': 0.11590671040939479, 'min_samples_leaf': 0.042889342066011873, 'min_weight_fraction_leaf': 0.12463367768462025, 'max_features': 0.5739008906626871}. Best is trial 163 with value: 0.7137418010284807.[0m
[32m[I 2022-04-13 11:45:24,938][0m Trial 194 finished with value: 0.7131405564108027 and parameters: {'splitter': 'best', 'min_samples_split': 0.051808438899573234, 'min_samples_leaf': 0.03430669232727486, 'min_weight_fraction_leaf': 0.14423541874407708, 'max_features': 0.5903884224416559}. Best is trial 163 with value: 0.7137418010284807.[0m
[32m[I 2022-04-13 11:45:24,984][0m Trial 195 finished with value: 0.7029215914224277 and parameters: {'splitter': 'best', 'min_samples_split': 0.030496215671491717, 'min_samples_leaf': 0.053783925062973026, 'min_weight_fraction_leaf': 0.11386980187622373, 'max_features': 0.5497679623938257}. Best is trial 163 with value: 0.7137418010284807.[0m
