[32m[I 2022-04-14 10:47:22,509][0m Trial 283 finished with value: 0.7287971729245737 and parameters: {'loss': 'coxph', 'learning_rate': 0.0022622242635588013, 'n_estimators': 1000, 'criterion': 'squared_error', 'min_samples_split': 7, 'min_samples_leaf': 1, 'min_weight_fraction_leaf': 0.08013267557184323, 'min_impurity_decrease': 0.0326823176494322, 'max_features': 0.8594110407998229, 'subsample': 0.5573119528838656, 'dropout_rate': 0.18317774648969187, 'ccp_alpha': 0.2400718577017162}. Best is trial 229 with value: 0.7437241350191778.[0m
[32m[I 2022-04-14 10:49:46,884][0m Trial 284 finished with value: 0.28284806302894017 and parameters: {'loss': 'squared', 'learning_rate': 0.0029885757957417527, 'n_estimators': 896, 'criterion': 'squared_error', 'min_samples_split': 7, 'min_samples_leaf': 1, 'min_weight_fraction_leaf': 0.018241101731606226, 'min_impurity_decrease': 0.06342608855223512, 'max_features': 0.8825330536425783, 'subsample': 0.5286506275148323, 'dropout_rate': 0.15177276004753976, 'ccp_alpha': 0.08005556984850719}. Best is trial 229 with value: 0.7437241350191778.[0m
[32m[I 2022-04-14 10:51:55,907][0m Trial 285 finished with value: 0.7188561193595274 and parameters: {'loss': 'coxph', 'learning_rate': 0.0012873806171459134, 'n_estimators': 825, 'criterion': 'squared_error', 'min_samples_split': 7, 'min_samples_leaf': 1, 'min_weight_fraction_leaf': 0.06767507585857552, 'min_impurity_decrease': 0.10627004167596057, 'max_features': 0.7943197832426893, 'subsample': 0.489121196772323, 'dropout_rate': 0.12695137149426716, 'ccp_alpha': 0.17704895837992335}. Best is trial 229 with value: 0.7437241350191778.[0m
[32m[I 2022-04-14 10:54:14,172][0m Trial 286 finished with value: 0.7426565174786511 and parameters: {'loss': 'coxph', 'learning_rate': 0.0017264909987011932, 'n_estimators': 929, 'criterion': 'squared_error', 'min_samples_split': 7, 'min_samples_leaf': 1, 'min_weight_fraction_leaf': 0.11697887448270877, 'min_impurity_decrease': 0.07530973180956752, 'max_features': 0.8165149008848845, 'subsample': 0.5817815807772536, 'dropout_rate': 0.24230272579113155, 'ccp_alpha': 0.001019283293391432}. Best is trial 229 with value: 0.7437241350191778.[0m
[32m[I 2022-04-14 10:56:36,114][0m Trial 287 finished with value: 0.7366026846739345 and parameters: {'loss': 'coxph', 'learning_rate': 0.0014950173510558924, 'n_estimators': 940, 'criterion': 'squared_error', 'min_samples_split': 7, 'min_samples_leaf': 1, 'min_weight_fraction_leaf': 0.11803871539722552, 'min_impurity_decrease': 0.08090381343480475, 'max_features': 0.8051922413640582, 'subsample': 0.5080523185451232, 'dropout_rate': 0.24783886498818192, 'ccp_alpha': 0.0014008239749052215}. Best is trial 229 with value: 0.7437241350191778.[0m
[32m[I 2022-04-14 10:59:13,935][0m Trial 288 finished with value: 0.7296528201496966 and parameters: {'loss': 'coxph', 'learning_rate': 0.001746231550845693, 'n_estimators': 941, 'criterion': 'squared_error', 'min_samples_split': 7, 'min_samples_leaf': 1, 'min_weight_fraction_leaf': 0.12351245275340443, 'min_impurity_decrease': 0.08076478239461786, 'max_features': 0.8152418423480269, 'subsample': 0.37509598445035963, 'dropout_rate': 0.2004664953856147, 'ccp_alpha': 0.008122936205522431}. Best is trial 229 with value: 0.7437241350191778.[0m
[32m[I 2022-04-14 11:01:38,566][0m Trial 289 finished with value: 0.7408805728872083 and parameters: {'loss': 'coxph', 'learning_rate': 0.0014140302849551178, 'n_estimators': 929, 'criterion': 'squared_error', 'min_samples_split': 7, 'min_samples_leaf': 1, 'min_weight_fraction_leaf': 0.11582059812932342, 'min_impurity_decrease': 0.07274654868698842, 'max_features': 0.8182883864730861, 'subsample': 0.5466298919745828, 'dropout_rate': 0.2602249832424997, 'ccp_alpha': 0.008542222202325622}. Best is trial 229 with value: 0.7437241350191778.[0m
[32m[I 2022-04-14 11:04:13,983][0m Trial 290 finished with value: 0.7440561890334568 and parameters: {'loss': 'coxph', 'learning_rate': 0.0014138068715250243, 'n_estimators': 949, 'criterion': 'squared_error', 'min_samples_split': 7, 'min_samples_leaf': 1, 'min_weight_fraction_leaf': 0.11950395351797487, 'min_impurity_decrease': 0.08583207007034023, 'max_features': 0.8076314441202151, 'subsample': 0.594693085902859, 'dropout_rate': 0.2541118359367701, 'ccp_alpha': 0.0063449999436713065}. Best is trial 290 with value: 0.7440561890334568.[0m
[32m[I 2022-04-14 11:06:47,595][0m Trial 291 finished with value: 0.7381882984115598 and parameters: {'loss': 'coxph', 'learning_rate': 0.001452931688558865, 'n_estimators': 964, 'criterion': 'squared_error', 'min_samples_split': 8, 'min_samples_leaf': 1, 'min_weight_fraction_leaf': 0.1323948000029899, 'min_impurity_decrease': 0.09641644503863026, 'max_features': 0.8164849466323757, 'subsample': 0.616079286775477, 'dropout_rate': 0.23671492438386943, 'ccp_alpha': 0.008358018106239287}. Best is trial 290 with value: 0.7440561890334568.[0m
[32m[I 2022-04-14 11:09:17,439][0m Trial 292 finished with value: 0.5 and parameters: {'loss': 'coxph', 'learning_rate': 0.001555238239315873, 'n_estimators': 974, 'criterion': 'squared_error', 'min_samples_split': 8, 'min_samples_leaf': 1, 'min_weight_fraction_leaf': 0.1318435377777608, 'min_impurity_decrease': 0.10320357481442027, 'max_features': 0.8160918621251109, 'subsample': 0.580780238452424, 'dropout_rate': 0.2554306679622345, 'ccp_alpha': 4.1943058975198655}. Best is trial 290 with value: 0.7440561890334568.[0m
[32m[I 2022-04-14 11:11:42,866][0m Trial 293 finished with value: 0.7389831045782558 and parameters: {'loss': 'coxph', 'learning_rate': 0.002142091630179052, 'n_estimators': 957, 'criterion': 'squared_error', 'min_samples_split': 9, 'min_samples_leaf': 1, 'min_weight_fraction_leaf': 0.12025247713499082, 'min_impurity_decrease': 0.12414281535969615, 'max_features': 0.8009948875750528, 'subsample': 0.6390134393234347, 'dropout_rate': 0.25187542169582133, 'ccp_alpha': 0.012368156920399978}. Best is trial 290 with value: 0.7440561890334568.[0m
[32m[I 2022-04-14 11:14:20,757][0m Trial 294 finished with value: 0.732995909427581 and parameters: {'loss': 'coxph', 'learning_rate': 0.0018982695848248252, 'n_estimators': 993, 'criterion': 'squared_error', 'min_samples_split': 8, 'min_samples_leaf': 1, 'min_weight_fraction_leaf': 0.14049685815063362, 'min_impurity_decrease': 0.13227046393611927, 'max_features': 0.8242295241053467, 'subsample': 0.6106027203372876, 'dropout_rate': 0.2638776148828068, 'ccp_alpha': 0.003456910115915701}. Best is trial 290 with value: 0.7440561890334568.[0m
[32m[I 2022-04-14 11:16:52,018][0m Trial 295 finished with value: 0.7428325039113722 and parameters: {'loss': 'coxph', 'learning_rate': 0.0014171085367722064, 'n_estimators': 933, 'criterion': 'friedman_mse', 'min_samples_split': 8, 'min_samples_leaf': 1, 'min_weight_fraction_leaf': 0.12305170359548885, 'min_impurity_decrease': 0.12348341638957788, 'max_features': 0.7978658473529756, 'subsample': 0.637366482106073, 'dropout_rate': 0.2518004506970736, 'ccp_alpha': 0.09395499165602586}. Best is trial 290 with value: 0.7440561890334568.[0m
[32m[I 2022-04-14 11:19:41,522][0m Trial 296 finished with value: 0.7450864268862003 and parameters: {'loss': 'coxph', 'learning_rate': 0.0013848572949710844, 'n_estimators': 947, 'criterion': 'friedman_mse', 'min_samples_split': 8, 'min_samples_leaf': 1, 'min_weight_fraction_leaf': 0.1269168158138526, 'min_impurity_decrease': 0.11741519120361638, 'max_features': 0.803730116834898, 'subsample': 0.6557306329601842, 'dropout_rate': 0.24772445782447802, 'ccp_alpha': 0.09282544760146752}. Best is trial 296 with value: 0.7450864268862003.[0m
[32m[I 2022-04-14 11:22:35,393][0m Trial 297 finished with value: 0.7222894314728059 and parameters: {'loss': 'coxph', 'learning_rate': 0.0014311432743589819, 'n_estimators': 998, 'criterion': 'friedman_mse', 'min_samples_split': 8, 'min_samples_leaf': 1, 'min_weight_fraction_leaf': 0.1300421453322847, 'min_impurity_decrease': 0.11973246513631255, 'max_features': 0.797661090340713, 'subsample': 0.6454511990121923, 'dropout_rate': 0.247448725688279, 'ccp_alpha': 0.16308972006444733}. Best is trial 296 with value: 0.7450864268862003.[0m
[32m[I 2022-04-14 11:25:00,054][0m Trial 298 finished with value: 0.7336910137477715 and parameters: {'loss': 'coxph', 'learning_rate': 0.0014281173198123984, 'n_estimators': 936, 'criterion': 'friedman_mse', 'min_samples_split': 8, 'min_samples_leaf': 1, 'min_weight_fraction_leaf': 0.15060356562801586, 'min_impurity_decrease': 0.1409631428098967, 'max_features': 0.8030641870651278, 'subsample': 0.6740737854941281, 'dropout_rate': 0.2503163323625221, 'ccp_alpha': 0.00293001368043074}. Best is trial 296 with value: 0.7450864268862003.[0m
[32m[I 2022-04-14 11:27:32,709][0m Trial 299 finished with value: 0.7380534560902442 and parameters: {'loss': 'coxph', 'learning_rate': 0.0020127350993413267, 'n_estimators': 958, 'criterion': 'friedman_mse', 'min_samples_split': 9, 'min_samples_leaf': 1, 'min_weight_fraction_leaf': 0.12508255424744974, 'min_impurity_decrease': 0.12198661962605212, 'max_features': 0.8388380126214059, 'subsample': 0.6415912506747217, 'dropout_rate': 0.269659300832527, 'ccp_alpha': 0.10894462461559479}. Best is trial 296 with value: 0.7450864268862003.[0m
[32m[I 2022-04-14 11:30:06,717][0m Trial 300 finished with value: 0.5 and parameters: {'loss': 'coxph', 'learning_rate': 0.0017213099188158308, 'n_estimators': 963, 'criterion': 'friedman_mse', 'min_samples_split': 9, 'min_samples_leaf': 1, 'min_weight_fraction_leaf': 0.13621393199873993, 'min_impurity_decrease': 0.13052863723518449, 'max_features': 0.8379409696611531, 'subsample': 0.6657681722851, 'dropout_rate': 0.26944724427771993, 'ccp_alpha': 2.1206285785797143}. Best is trial 296 with value: 0.7450864268862003.[0m
[32m[I 2022-04-14 11:32:40,062][0m Trial 301 finished with value: 0.711321474129248 and parameters: {'loss': 'coxph', 'learning_rate': 0.0012191523162001486, 'n_estimators': 959, 'criterion': 'friedman_mse', 'min_samples_split': 9, 'min_samples_leaf': 1, 'min_weight_fraction_leaf': 0.1227376058401329, 'min_impurity_decrease': 0.11329582367734378, 'max_features': 0.7986170114488519, 'subsample': 0.699211167940328, 'dropout_rate': 0.2663412726386849, 'ccp_alpha': 0.18024736982215764}. Best is trial 296 with value: 0.7450864268862003.[0m
[32m[I 2022-04-14 11:35:23,582][0m Trial 302 finished with value: 0.5049013916902899 and parameters: {'loss': 'coxph', 'learning_rate': 0.0020096823854979413, 'n_estimators': 999, 'criterion': 'friedman_mse', 'min_samples_split': 9, 'min_samples_leaf': 1, 'min_weight_fraction_leaf': 0.11967184322214378, 'min_impurity_decrease': 0.1498656820857753, 'max_features': 0.059172354085021805, 'subsample': 0.6407421942047665, 'dropout_rate': 0.24472580620944656, 'ccp_alpha': 0.4068386054844829}. Best is trial 296 with value: 0.7450864268862003.[0m
[32m[I 2022-04-14 11:37:44,171][0m Trial 303 finished with value: 0.7332662354536311 and parameters: {'loss': 'coxph', 'learning_rate': 0.0013400215851603503, 'n_estimators': 928, 'criterion': 'friedman_mse', 'min_samples_split': 8, 'min_samples_leaf': 1, 'min_weight_fraction_leaf': 0.1304176430689895, 'min_impurity_decrease': 0.11786975696168807, 'max_features': 0.8384641376141444, 'subsample': 0.6253284382700712, 'dropout_rate': 0.27067153738245714, 'ccp_alpha': 0.10940636254506272}. Best is trial 296 with value: 0.7450864268862003.[0m
[32m[I 2022-04-14 11:40:14,856][0m Trial 304 finished with value: 0.6942035758859411 and parameters: {'loss': 'coxph', 'learning_rate': 0.0021143387348754573, 'n_estimators': 932, 'criterion': 'friedman_mse', 'min_samples_split': 9, 'min_samples_leaf': 2, 'min_weight_fraction_leaf': 0.13953843539939412, 'min_impurity_decrease': 0.10703836069080397, 'max_features': 0.80140045546833, 'subsample': 0.6271825132336396, 'dropout_rate': 0.25222564347316034, 'ccp_alpha': 0.2847601243945449}. Best is trial 296 with value: 0.7450864268862003.[0m
[32m[I 2022-04-14 11:42:48,480][0m Trial 305 finished with value: 0.26989337032274313 and parameters: {'loss': 'squared', 'learning_rate': 0.0015296677543377658, 'n_estimators': 963, 'criterion': 'friedman_mse', 'min_samples_split': 9, 'min_samples_leaf': 1, 'min_weight_fraction_leaf': 0.11801120581785887, 'min_impurity_decrease': 0.13743493916601596, 'max_features': 0.8514953501988163, 'subsample': 0.6489101289484202, 'dropout_rate': 0.2895203975233741, 'ccp_alpha': 0.09963111442920608}. Best is trial 296 with value: 0.7450864268862003.[0m
[32m[I 2022-04-14 11:44:59,040][0m Trial 306 finished with value: 0.6997234056788632 and parameters: {'loss': 'coxph', 'learning_rate': 0.0011860049638350693, 'n_estimators': 915, 'criterion': 'friedman_mse', 'min_samples_split': 10, 'min_samples_leaf': 1, 'min_weight_fraction_leaf': 0.1257375932808117, 'min_impurity_decrease': 0.09026796745387582, 'max_features': 0.8286967236966897, 'subsample': 0.6862483261747326, 'dropout_rate': 0.23624840831626714, 'ccp_alpha': 0.1852357167614631}. Best is trial 296 with value: 0.7450864268862003.[0m
[32m[I 2022-04-14 11:48:00,637][0m Trial 307 finished with value: 0.7322662408130123 and parameters: {'loss': 'coxph', 'learning_rate': 0.002143947039347793, 'n_estimators': 1000, 'criterion': 'friedman_mse', 'min_samples_split': 9, 'min_samples_leaf': 1, 'min_weight_fraction_leaf': 0.1509179278259827, 'min_impurity_decrease': 0.16534064442750124, 'max_features': 0.793061975420878, 'subsample': 0.6067498527609847, 'dropout_rate': 0.24218589526367243, 'ccp_alpha': 0.003937509403588654}. Best is trial 296 with value: 0.7450864268862003.[0m
[32m[I 2022-04-14 11:49:58,368][0m Trial 308 finished with value: 0.7103290906660961 and parameters: {'loss': 'coxph', 'learning_rate': 0.0017454631923881998, 'n_estimators': 863, 'criterion': 'friedman_mse', 'min_samples_split': 9, 'min_samples_leaf': 1, 'min_weight_fraction_leaf': 0.11550673751442189, 'min_impurity_decrease': 0.5164283305145341, 'max_features': 0.8245591440362227, 'subsample': 0.615111732355575, 'dropout_rate': 0.2819671580710638, 'ccp_alpha': 0.26676291553829656}. Best is trial 296 with value: 0.7450864268862003.[0m
[32m[I 2022-04-14 11:52:30,171][0m Trial 309 finished with value: 0.7403063736431956 and parameters: {'loss': 'coxph', 'learning_rate': 0.001178837868831892, 'n_estimators': 920, 'criterion': 'friedman_mse', 'min_samples_split': 9, 'min_samples_leaf': 1, 'min_weight_fraction_leaf': 0.11874360063205316, 'min_impurity_decrease': 0.10187520208354531, 'max_features': 0.8572703727947621, 'subsample': 0.6600099721774614, 'dropout_rate': 0.23432684277558058, 'ccp_alpha': 0.09269797268151073}. Best is trial 296 with value: 0.7450864268862003.[0m
[32m[I 2022-04-14 11:54:48,588][0m Trial 310 finished with value: 0.743991934389622 and parameters: {'loss': 'coxph', 'learning_rate': 0.0011525634741120796, 'n_estimators': 918, 'criterion': 'friedman_mse', 'min_samples_split': 9, 'min_samples_leaf': 1, 'min_weight_fraction_leaf': 0.12928469472458456, 'min_impurity_decrease': 0.10149168786818959, 'max_features': 0.8648269039189618, 'subsample': 0.6529183981046291, 'dropout_rate': 0.30213281097413625, 'ccp_alpha': 0.08854809120779658}. Best is trial 296 with value: 0.7450864268862003.[0m
[32m[I 2022-04-14 11:56:57,234][0m Trial 311 finished with value: 0.7205347973080688 and parameters: {'loss': 'coxph', 'learning_rate': 0.0010794792417364372, 'n_estimators': 889, 'criterion': 'friedman_mse', 'min_samples_split': 10, 'min_samples_leaf': 1, 'min_weight_fraction_leaf': 0.13701700355605742, 'min_impurity_decrease': 0.10693344961342541, 'max_features': 0.895074445769853, 'subsample': 0.6628446808190364, 'dropout_rate': 0.3090165457480001, 'ccp_alpha': 0.17416777622516097}. Best is trial 296 with value: 0.7450864268862003.[0m
[32m[I 2022-04-14 11:59:18,144][0m Trial 312 finished with value: 0.7436701586511262 and parameters: {'loss': 'coxph', 'learning_rate': 0.0012050845833044635, 'n_estimators': 914, 'criterion': 'friedman_mse', 'min_samples_split': 9, 'min_samples_leaf': 1, 'min_weight_fraction_leaf': 0.12780661577811409, 'min_impurity_decrease': 0.12443748324615919, 'max_features': 0.920890825002953, 'subsample': 0.719151153600551, 'dropout_rate': 0.27363869811089436, 'ccp_alpha': 0.08436899361965113}. Best is trial 296 with value: 0.7450864268862003.[0m
[32m[I 2022-04-14 12:01:37,005][0m Trial 313 finished with value: 0.5839219931122972 and parameters: {'loss': 'coxph', 'learning_rate': 0.0011554608118293525, 'n_estimators': 922, 'criterion': 'friedman_mse', 'min_samples_split': 9, 'min_samples_leaf': 1, 'min_weight_fraction_leaf': 0.1455676649852461, 'min_impurity_decrease': 0.12537555928638744, 'max_features': 0.9560068137168278, 'subsample': 0.6388917059566347, 'dropout_rate': 0.31498632513557656, 'ccp_alpha': 0.331632604058521}. Best is trial 296 with value: 0.7450864268862003.[0m
[32m[I 2022-04-14 12:04:05,623][0m Trial 314 finished with value: 0.7363723778442571 and parameters: {'loss': 'coxph', 'learning_rate': 0.0016221557320367163, 'n_estimators': 965, 'criterion': 'friedman_mse', 'min_samples_split': 9, 'min_samples_leaf': 1, 'min_weight_fraction_leaf': 0.1240432419463442, 'min_impurity_decrease': 0.10046739473482992, 'max_features': 0.9143167786958979, 'subsample': 0.6896362485853131, 'dropout_rate': 0.33642299680584803, 'ccp_alpha': 0.11168061208436361}. Best is trial 296 with value: 0.7450864268862003.[0m
[32m[I 2022-04-14 12:05:58,161][0m Trial 315 finished with value: 0.6977173099028136 and parameters: {'loss': 'coxph', 'learning_rate': 0.001248024448695495, 'n_estimators': 848, 'criterion': 'friedman_mse', 'min_samples_split': 9, 'min_samples_leaf': 1, 'min_weight_fraction_leaf': 0.13015974686731271, 'min_impurity_decrease': 0.14141963433602617, 'max_features': 0.9276729089241221, 'subsample': 0.7273572035738265, 'dropout_rate': 0.274518563102692, 'ccp_alpha': 0.24180659052890396}. Best is trial 296 with value: 0.7450864268862003.[0m
[32m[I 2022-04-14 12:08:05,756][0m Trial 316 finished with value: 0.7439647783736023 and parameters: {'loss': 'coxph', 'learning_rate': 0.0014160473157434309, 'n_estimators': 912, 'criterion': 'friedman_mse', 'min_samples_split': 9, 'min_samples_leaf': 1, 'min_weight_fraction_leaf': 0.11348173316789094, 'min_impurity_decrease': 0.11665797100203348, 'max_features': 0.8763665375559274, 'subsample': 0.7819386058716211, 'dropout_rate': 0.2879941674559609, 'ccp_alpha': 0.08987420349368826}. Best is trial 296 with value: 0.7450864268862003.[0m
[32m[I 2022-04-14 12:10:29,358][0m Trial 317 finished with value: 0.6984938401271238 and parameters: {'loss': 'coxph', 'learning_rate': 0.0018053564793212608, 'n_estimators': 916, 'criterion': 'friedman_mse', 'min_samples_split': 9, 'min_samples_leaf': 1, 'min_weight_fraction_leaf': 0.11444841341786594, 'min_impurity_decrease': 0.1220987255943464, 'max_features': 0.8802712179046944, 'subsample': 0.8190536885299111, 'dropout_rate': 0.2901936505553058, 'ccp_alpha': 0.17832231509264276}. Best is trial 296 with value: 0.7450864268862003.[0m
[32m[I 2022-04-14 12:12:26,577][0m Trial 318 finished with value: 0.5 and parameters: {'loss': 'coxph', 'learning_rate': 0.001335226017689831, 'n_estimators': 887, 'criterion': 'friedman_mse', 'min_samples_split': 9, 'min_samples_leaf': 1, 'min_weight_fraction_leaf': 0.15887216769802814, 'min_impurity_decrease': 0.09749956612138308, 'max_features': 0.9020401448281972, 'subsample': 0.7075876525299952, 'dropout_rate': 0.29742655719831856, 'ccp_alpha': 0.4121176813909131}. Best is trial 296 with value: 0.7450864268862003.[0m
[32m[I 2022-04-14 12:15:04,680][0m Trial 319 finished with value: 0.7272361590833998 and parameters: {'loss': 'coxph', 'learning_rate': 0.0023783552106120998, 'n_estimators': 964, 'criterion': 'friedman_mse', 'min_samples_split': 9, 'min_samples_leaf': 1, 'min_weight_fraction_leaf': 0.13699871851433948, 'min_impurity_decrease': 0.11802372347401466, 'max_features': 0.8651934800275859, 'subsample': 0.7492854935123542, 'dropout_rate': 0.2614326945278375, 'ccp_alpha': 0.10494593867980083}. Best is trial 296 with value: 0.7450864268862003.[0m
[32m[I 2022-04-14 12:17:52,359][0m Trial 320 finished with value: 0.6195315087274809 and parameters: {'loss': 'coxph', 'learning_rate': 0.001538833511373762, 'n_estimators': 1000, 'criterion': 'friedman_mse', 'min_samples_split': 9, 'min_samples_leaf': 1, 'min_weight_fraction_leaf': 0.12785778381184265, 'min_impurity_decrease': 0.09097186056605486, 'max_features': 0.8537829045530481, 'subsample': 0.8016656303224972, 'dropout_rate': 0.2706305624123994, 'ccp_alpha': 0.26721357841354865}. Best is trial 296 with value: 0.7450864268862003.[0m
[32m[I 2022-04-14 12:19:49,852][0m Trial 321 finished with value: 0.7395248255360564 and parameters: {'loss': 'coxph', 'learning_rate': 0.0019999217758200055, 'n_estimators': 856, 'criterion': 'friedman_mse', 'min_samples_split': 9, 'min_samples_leaf': 1, 'min_weight_fraction_leaf': 0.11398160253560433, 'min_impurity_decrease': 0.10942790055477114, 'max_features': 0.9322360880320507, 'subsample': 0.7661414979793147, 'dropout_rate': 0.3283828492402412, 'ccp_alpha': 0.08896317745279651}. Best is trial 296 with value: 0.7450864268862003.[0m
[32m[I 2022-04-14 12:21:35,977][0m Trial 322 finished with value: 0.7016787227456364 and parameters: {'loss': 'coxph', 'learning_rate': 0.0011918467009990731, 'n_estimators': 838, 'criterion': 'friedman_mse', 'min_samples_split': 9, 'min_samples_leaf': 1, 'min_weight_fraction_leaf': 0.11530101550361467, 'min_impurity_decrease': 0.13658077821474546, 'max_features': 0.9491393302458766, 'subsample': 0.7375370717869015, 'dropout_rate': 0.35468177791927225, 'ccp_alpha': 0.1836184400434}. Best is trial 296 with value: 0.7450864268862003.[0m
