[32m[I 2022-04-13 20:42:20,474][0m Trial 282 finished with value: 0.8486045320629095 and parameters: {'loss': 'coxph', 'learning_rate': 0.0019462321553132954, 'n_estimators': 954, 'criterion': 'friedman_mse', 'min_samples_split': 3, 'min_samples_leaf': 5, 'min_weight_fraction_leaf': 0.06086915483092493, 'min_impurity_decrease': 0.3101774693909806, 'max_features': 0.9454400133595535, 'subsample': 0.6608171188333338, 'dropout_rate': 0.21076761101417038, 'ccp_alpha': 0.2805087176571299}. Best is trial 238 with value: 0.8755892337410869.[0m
[32m[I 2022-04-13 20:45:48,923][0m Trial 283 finished with value: 0.8672602432787103 and parameters: {'loss': 'coxph', 'learning_rate': 0.002455759974277832, 'n_estimators': 909, 'criterion': 'friedman_mse', 'min_samples_split': 3, 'min_samples_leaf': 5, 'min_weight_fraction_leaf': 0.09732935733147227, 'min_impurity_decrease': 0.37179353334318066, 'max_features': 0.9731963626571164, 'subsample': 0.6866993395769105, 'dropout_rate': 0.1772094227896349, 'ccp_alpha': 0.011953587209538447}. Best is trial 238 with value: 0.8755892337410869.[0m
[32m[I 2022-04-13 20:48:53,199][0m Trial 284 finished with value: 0.8620666095710849 and parameters: {'loss': 'coxph', 'learning_rate': 0.0027442663861749813, 'n_estimators': 931, 'criterion': 'friedman_mse', 'min_samples_split': 3, 'min_samples_leaf': 5, 'min_weight_fraction_leaf': 0.05793576918107785, 'min_impurity_decrease': 0.26653219831060915, 'max_features': 0.9117251468595687, 'subsample': 0.6470278434343252, 'dropout_rate': 0.24104476943424857, 'ccp_alpha': 0.18461159822062234}. Best is trial 238 with value: 0.8755892337410869.[0m
[32m[I 2022-04-13 20:52:44,517][0m Trial 285 finished with value: 0.874384577121962 and parameters: {'loss': 'coxph', 'learning_rate': 0.0018597383088192173, 'n_estimators': 976, 'criterion': 'friedman_mse', 'min_samples_split': 3, 'min_samples_leaf': 5, 'min_weight_fraction_leaf': 0.07967446224967978, 'min_impurity_decrease': 0.25825450528389043, 'max_features': 0.8759551518336121, 'subsample': 0.7163315709929601, 'dropout_rate': 0.2123186513363101, 'ccp_alpha': 0.011804914773458249}. Best is trial 238 with value: 0.8755892337410869.[0m
[32m[I 2022-04-13 20:56:14,986][0m Trial 286 finished with value: 0.8770172150546273 and parameters: {'loss': 'coxph', 'learning_rate': 0.0016988297604128514, 'n_estimators': 974, 'criterion': 'friedman_mse', 'min_samples_split': 3, 'min_samples_leaf': 5, 'min_weight_fraction_leaf': 0.07958557625395885, 'min_impurity_decrease': 0.2638670126855158, 'max_features': 0.8770542393591914, 'subsample': 0.7119327296964468, 'dropout_rate': 0.20615764084785995, 'ccp_alpha': 0.004742877436843558}. Best is trial 286 with value: 0.8770172150546273.[0m
[32m[I 2022-04-13 20:59:43,953][0m Trial 287 finished with value: 0.8558030359844029 and parameters: {'loss': 'coxph', 'learning_rate': 0.004207165536009566, 'n_estimators': 995, 'criterion': 'friedman_mse', 'min_samples_split': 3, 'min_samples_leaf': 5, 'min_weight_fraction_leaf': 0.07023527140679309, 'min_impurity_decrease': 0.2600219542133554, 'max_features': 0.8729184307222907, 'subsample': 0.7286864544764157, 'dropout_rate': 0.2708588602111517, 'ccp_alpha': 0.18320854241702994}. Best is trial 286 with value: 0.8770172150546273.[0m
[32m[I 2022-04-13 21:03:06,290][0m Trial 288 finished with value: 0.872571522453909 and parameters: {'loss': 'coxph', 'learning_rate': 0.003120446769420863, 'n_estimators': 893, 'criterion': 'friedman_mse', 'min_samples_split': 3, 'min_samples_leaf': 5, 'min_weight_fraction_leaf': 0.03902230391761939, 'min_impurity_decrease': 0.2260241503847929, 'max_features': 0.874317828061011, 'subsample': 0.7163204410350624, 'dropout_rate': 0.1784430024898742, 'ccp_alpha': 0.004889917268864921}. Best is trial 286 with value: 0.8770172150546273.[0m
[32m[I 2022-04-13 21:06:16,648][0m Trial 289 finished with value: 0.8676041077020195 and parameters: {'loss': 'coxph', 'learning_rate': 0.005730699366846205, 'n_estimators': 959, 'criterion': 'friedman_mse', 'min_samples_split': 3, 'min_samples_leaf': 5, 'min_weight_fraction_leaf': 0.050337530845916204, 'min_impurity_decrease': 0.3064668890879615, 'max_features': 0.8804158459114014, 'subsample': 0.7129038834773677, 'dropout_rate': 0.24253186291606105, 'ccp_alpha': 0.09876827532766903}. Best is trial 286 with value: 0.8770172150546273.[0m
[32m[I 2022-04-13 21:09:58,598][0m Trial 290 finished with value: 0.854569741895115 and parameters: {'loss': 'coxph', 'learning_rate': 0.003089226713518457, 'n_estimators': 999, 'criterion': 'friedman_mse', 'min_samples_split': 6, 'min_samples_leaf': 5, 'min_weight_fraction_leaf': 0.034764397389677355, 'min_impurity_decrease': 0.21957794622728766, 'max_features': 0.8817817356523258, 'subsample': 0.7240356932511072, 'dropout_rate': 0.20961839179266054, 'ccp_alpha': 0.19085777042909396}. Best is trial 286 with value: 0.8770172150546273.[0m
[32m[I 2022-04-13 21:12:49,143][0m Trial 291 finished with value: 0.8387378224438086 and parameters: {'loss': 'coxph', 'learning_rate': 0.004507431723397788, 'n_estimators': 870, 'criterion': 'friedman_mse', 'min_samples_split': 4, 'min_samples_leaf': 5, 'min_weight_fraction_leaf': 0.04308980939860481, 'min_impurity_decrease': 0.19638718612902636, 'max_features': 0.8720775736878364, 'subsample': 0.6997833051365653, 'dropout_rate': 0.2609261975917493, 'ccp_alpha': 0.26714998762404246}. Best is trial 286 with value: 0.8770172150546273.[0m
[32m[I 2022-04-13 21:15:43,339][0m Trial 292 finished with value: 0.6524506958451449 and parameters: {'loss': 'coxph', 'learning_rate': 0.002614986103963321, 'n_estimators': 904, 'criterion': 'friedman_mse', 'min_samples_split': 3, 'min_samples_leaf': 5, 'min_weight_fraction_leaf': 0.07852499688853884, 'min_impurity_decrease': 0.2874179904848963, 'max_features': 0.9208471988723491, 'subsample': 0.7226842335428912, 'dropout_rate': 0.1818858865038321, 'ccp_alpha': 0.38039402046349996}. Best is trial 286 with value: 0.8770172150546273.[0m
[32m[I 2022-04-13 21:18:37,285][0m Trial 293 finished with value: 0.8681856652151302 and parameters: {'loss': 'coxph', 'learning_rate': 0.003308504129615196, 'n_estimators': 914, 'criterion': 'friedman_mse', 'min_samples_split': 3, 'min_samples_leaf': 5, 'min_weight_fraction_leaf': 0.06217161330929222, 'min_impurity_decrease': 0.25834948278934927, 'max_features': 0.8971575891702754, 'subsample': 0.7005535600457634, 'dropout_rate': 0.22514183254292483, 'ccp_alpha': 0.10146305644280379}. Best is trial 286 with value: 0.8770172150546273.[0m
[32m[I 2022-04-13 21:21:53,549][0m Trial 294 finished with value: 0.65 and parameters: {'loss': 'coxph', 'learning_rate': 0.0022621175160380848, 'n_estimators': 960, 'criterion': 'friedman_mse', 'min_samples_split': 3, 'min_samples_leaf': 5, 'min_weight_fraction_leaf': 0.0764020916154398, 'min_impurity_decrease': 0.22758002755507994, 'max_features': 0.9238030796936558, 'subsample': 0.6923578002698779, 'dropout_rate': 0.20627483667066723, 'ccp_alpha': 1.7916600974423837}. Best is trial 286 with value: 0.8770172150546273.[0m
[32m[I 2022-04-13 21:24:17,826][0m Trial 295 finished with value: 0.8713880838161421 and parameters: {'loss': 'coxph', 'learning_rate': 0.001679935756950191, 'n_estimators': 857, 'criterion': 'friedman_mse', 'min_samples_split': 3, 'min_samples_leaf': 5, 'min_weight_fraction_leaf': 0.05281011725842707, 'min_impurity_decrease': 0.27572612911677213, 'max_features': 0.8970938324553762, 'subsample': 0.6313749785470905, 'dropout_rate': 0.2912489719173311, 'ccp_alpha': 0.004006058812896798}. Best is trial 286 with value: 0.8770172150546273.[0m
[32m[I 2022-04-13 21:26:43,223][0m Trial 296 finished with value: 0.864263800384734 and parameters: {'loss': 'coxph', 'learning_rate': 0.00410439266265421, 'n_estimators': 863, 'criterion': 'friedman_mse', 'min_samples_split': 3, 'min_samples_leaf': 5, 'min_weight_fraction_leaf': 0.08304365309857756, 'min_impurity_decrease': 0.2785353895899135, 'max_features': 0.8722768613796337, 'subsample': 0.628228520738399, 'dropout_rate': 0.29244690884598323, 'ccp_alpha': 0.0032332316325709327}. Best is trial 286 with value: 0.8770172150546273.[0m
[32m[I 2022-04-13 21:29:14,024][0m Trial 297 finished with value: 0.8569383827499536 and parameters: {'loss': 'coxph', 'learning_rate': 0.003002108644851626, 'n_estimators': 855, 'criterion': 'friedman_mse', 'min_samples_split': 3, 'min_samples_leaf': 4, 'min_weight_fraction_leaf': 0.06998635926540722, 'min_impurity_decrease': 0.2607510109997467, 'max_features': 0.8954957995106468, 'subsample': 0.7185114790097209, 'dropout_rate': 0.18067762300419893, 'ccp_alpha': 0.17804210539507376}. Best is trial 286 with value: 0.8770172150546273.[0m
[32m[I 2022-04-13 21:32:34,092][0m Trial 298 finished with value: 0.8695280629876827 and parameters: {'loss': 'coxph', 'learning_rate': 0.0016680402045681064, 'n_estimators': 999, 'criterion': 'friedman_mse', 'min_samples_split': 4, 'min_samples_leaf': 5, 'min_weight_fraction_leaf': 0.09379130913285066, 'min_impurity_decrease': 0.19699004087246164, 'max_features': 0.9077947092237477, 'subsample': 0.6177498871600547, 'dropout_rate': 0.33533143830439144, 'ccp_alpha': 0.10107774844304993}. Best is trial 286 with value: 0.8770172150546273.[0m
[32m[I 2022-04-13 21:35:31,062][0m Trial 299 finished with value: 0.8322791880397616 and parameters: {'loss': 'coxph', 'learning_rate': 0.0016720405473589644, 'n_estimators': 994, 'criterion': 'friedman_mse', 'min_samples_split': 5, 'min_samples_leaf': 5, 'min_weight_fraction_leaf': 0.09737944703916207, 'min_impurity_decrease': 0.19762582912119497, 'max_features': 0.9024842310921748, 'subsample': 0.6106021365411641, 'dropout_rate': 0.3461758432591174, 'ccp_alpha': 0.3137704762583155}. Best is trial 286 with value: 0.8770172150546273.[0m
[32m[I 2022-04-13 21:38:48,950][0m Trial 300 finished with value: 0.865052065767156 and parameters: {'loss': 'coxph', 'learning_rate': 0.0016471781234111977, 'n_estimators': 956, 'criterion': 'friedman_mse', 'min_samples_split': 4, 'min_samples_leaf': 5, 'min_weight_fraction_leaf': 0.06373017782819909, 'min_impurity_decrease': 0.1881290414719759, 'max_features': 0.8736027032911413, 'subsample': 0.7339080307600626, 'dropout_rate': 0.2826586579137387, 'ccp_alpha': 0.1162886482687663}. Best is trial 286 with value: 0.8770172150546273.[0m
[32m[I 2022-04-13 21:42:14,540][0m Trial 301 finished with value: -0.37114850137992805 and parameters: {'loss': 'squared', 'learning_rate': 0.002262470119344756, 'n_estimators': 1000, 'criterion': 'friedman_mse', 'min_samples_split': 4, 'min_samples_leaf': 5, 'min_weight_fraction_leaf': 0.07753164064964399, 'min_impurity_decrease': 0.21878651623414502, 'max_features': 0.9121450626108626, 'subsample': 0.7022117397646246, 'dropout_rate': 0.2975109989024407, 'ccp_alpha': 0.08734162926244232}. Best is trial 286 with value: 0.8770172150546273.[0m
[32m[I 2022-04-13 21:45:21,301][0m Trial 302 finished with value: 0.8601620607040881 and parameters: {'loss': 'coxph', 'learning_rate': 0.002372391062832254, 'n_estimators': 954, 'criterion': 'friedman_mse', 'min_samples_split': 5, 'min_samples_leaf': 5, 'min_weight_fraction_leaf': 0.09558019383984491, 'min_impurity_decrease': 0.26050216179746016, 'max_features': 0.8843412111700906, 'subsample': 0.6224411895382974, 'dropout_rate': 0.2638006887501331, 'ccp_alpha': 0.2202093667181984}. Best is trial 286 with value: 0.8770172150546273.[0m
[32m[I 2022-04-13 21:48:13,638][0m Trial 303 finished with value: 0.8701170176488869 and parameters: {'loss': 'coxph', 'learning_rate': 0.0016551472729752679, 'n_estimators': 902, 'criterion': 'friedman_mse', 'min_samples_split': 3, 'min_samples_leaf': 5, 'min_weight_fraction_leaf': 0.03768273008499979, 'min_impurity_decrease': 0.28351313314496357, 'max_features': 0.9005925350982235, 'subsample': 0.685604450686659, 'dropout_rate': 0.3261058929785277, 'ccp_alpha': 0.0846410693887648}. Best is trial 286 with value: 0.8770172150546273.[0m
[32m[I 2022-04-13 21:50:32,352][0m Trial 304 finished with value: 0.8704206126440205 and parameters: {'loss': 'coxph', 'learning_rate': 0.0018445187062109045, 'n_estimators': 855, 'criterion': 'friedman_mse', 'min_samples_split': 3, 'min_samples_leaf': 5, 'min_weight_fraction_leaf': 0.02476423604281907, 'min_impurity_decrease': 0.2970131060506326, 'max_features': 0.8906958877850794, 'subsample': 0.6896145930731556, 'dropout_rate': 0.29500087266098424, 'ccp_alpha': 0.0022949328966748095}. Best is trial 286 with value: 0.8770172150546273.[0m
[32m[I 2022-04-13 21:52:38,609][0m Trial 305 finished with value: 0.868179596551923 and parameters: {'loss': 'coxph', 'learning_rate': 0.0016777667390962426, 'n_estimators': 857, 'criterion': 'friedman_mse', 'min_samples_split': 3, 'min_samples_leaf': 5, 'min_weight_fraction_leaf': 0.015202074867921439, 'min_impurity_decrease': 0.3233272284756862, 'max_features': 0.8647119142918667, 'subsample': 0.6922098983553152, 'dropout_rate': 0.3103738570756001, 'ccp_alpha': 0.008027316414826301}. Best is trial 286 with value: 0.8770172150546273.[0m
[32m[I 2022-04-13 21:54:49,902][0m Trial 306 finished with value: 0.8773711455576405 and parameters: {'loss': 'coxph', 'learning_rate': 0.0015618744628490401, 'n_estimators': 884, 'criterion': 'friedman_mse', 'min_samples_split': 3, 'min_samples_leaf': 5, 'min_weight_fraction_leaf': 0.025874411679717574, 'min_impurity_decrease': 0.28623234877449316, 'max_features': 0.8898435686146453, 'subsample': 0.7132846436162475, 'dropout_rate': 0.30615287358550647, 'ccp_alpha': 0.0028849667584752298}. Best is trial 306 with value: 0.8773711455576405.[0m
[32m[I 2022-04-13 21:56:51,600][0m Trial 307 finished with value: 0.8540952942862775 and parameters: {'loss': 'coxph', 'learning_rate': 0.0015390056751426462, 'n_estimators': 875, 'criterion': 'friedman_mse', 'min_samples_split': 3, 'min_samples_leaf': 5, 'min_weight_fraction_leaf': 0.027561011453337326, 'min_impurity_decrease': 0.29163797373121575, 'max_features': 0.8875908239015741, 'subsample': 0.7180573894253705, 'dropout_rate': 0.36267705163050434, 'ccp_alpha': 0.19883457061407436}. Best is trial 306 with value: 0.8773711455576405.[0m
[32m[I 2022-04-13 21:59:27,138][0m Trial 308 finished with value: 0.8717592581063215 and parameters: {'loss': 'coxph', 'learning_rate': 0.0016672523916829928, 'n_estimators': 959, 'criterion': 'friedman_mse', 'min_samples_split': 3, 'min_samples_leaf': 5, 'min_weight_fraction_leaf': 0.03162261432955235, 'min_impurity_decrease': 0.28380718268311933, 'max_features': 0.8702892739850826, 'subsample': 0.7256055419487771, 'dropout_rate': 0.2973319216113555, 'ccp_alpha': 0.007298144326370538}. Best is trial 306 with value: 0.8773711455576405.[0m
[32m[I 2022-04-13 22:02:01,950][0m Trial 309 finished with value: 0.8125163108454153 and parameters: {'loss': 'coxph', 'learning_rate': 0.0015943652771406133, 'n_estimators': 961, 'criterion': 'friedman_mse', 'min_samples_split': 4, 'min_samples_leaf': 5, 'min_weight_fraction_leaf': 0.02594823263213633, 'min_impurity_decrease': 0.30339209624855645, 'max_features': 0.8667547553775987, 'subsample': 0.7338249015723176, 'dropout_rate': 0.3187154486164407, 'ccp_alpha': 0.2843768169151195}. Best is trial 306 with value: 0.8773711455576405.[0m
[32m[I 2022-04-13 22:04:27,461][0m Trial 310 finished with value: 0.8616887178202963 and parameters: {'loss': 'coxph', 'learning_rate': 0.001968734848757346, 'n_estimators': 963, 'criterion': 'friedman_mse', 'min_samples_split': 3, 'min_samples_leaf': 5, 'min_weight_fraction_leaf': 0.03667407682551699, 'min_impurity_decrease': 0.28086620342281665, 'max_features': 0.8905916237007994, 'subsample': 0.7149730634126311, 'dropout_rate': 0.34025383793538444, 'ccp_alpha': 0.17030651766225538}. Best is trial 306 with value: 0.8773711455576405.[0m
[32m[I 2022-04-13 22:06:34,851][0m Trial 311 finished with value: 0.8669175417406979 and parameters: {'loss': 'coxph', 'learning_rate': 0.00528713417890086, 'n_estimators': 892, 'criterion': 'friedman_mse', 'min_samples_split': 3, 'min_samples_leaf': 5, 'min_weight_fraction_leaf': 0.03462924761732455, 'min_impurity_decrease': 0.3399406185020817, 'max_features': 0.855171434332421, 'subsample': 0.7388914092028335, 'dropout_rate': 0.29620965819555045, 'ccp_alpha': 0.12024143060895383}. Best is trial 306 with value: 0.8773711455576405.[0m
[32m[I 2022-04-13 22:08:32,365][0m Trial 312 finished with value: 0.8735198001569117 and parameters: {'loss': 'coxph', 'learning_rate': 0.0016889632434534442, 'n_estimators': 849, 'criterion': 'friedman_mse', 'min_samples_split': 3, 'min_samples_leaf': 5, 'min_weight_fraction_leaf': 0.04252593115538025, 'min_impurity_decrease': 0.28695000605344884, 'max_features': 0.880404334058789, 'subsample': 0.7087816438103217, 'dropout_rate': 0.33646566434283637, 'ccp_alpha': 0.08616726240680121}. Best is trial 306 with value: 0.8773711455576405.[0m
[32m[I 2022-04-13 22:10:56,579][0m Trial 313 finished with value: 0.65 and parameters: {'loss': 'coxph', 'learning_rate': 0.0015079473041105893, 'n_estimators': 994, 'criterion': 'friedman_mse', 'min_samples_split': 3, 'min_samples_leaf': 5, 'min_weight_fraction_leaf': 0.016949628901171753, 'min_impurity_decrease': 0.3204767362644679, 'max_features': 0.8730394622713958, 'subsample': 0.7107682960345356, 'dropout_rate': 0.34115154665310365, 'ccp_alpha': 1.1812002963924275}. Best is trial 306 with value: 0.8773711455576405.[0m
[32m[I 2022-04-13 22:13:18,191][0m Trial 314 finished with value: 0.6524506958451449 and parameters: {'loss': 'coxph', 'learning_rate': 0.0036810987424167616, 'n_estimators': 937, 'criterion': 'friedman_mse', 'min_samples_split': 4, 'min_samples_leaf': 4, 'min_weight_fraction_leaf': 0.006679422501558972, 'min_impurity_decrease': 0.2797469711980906, 'max_features': 0.8942358880477786, 'subsample': 0.739974965336112, 'dropout_rate': 0.3325092226844969, 'ccp_alpha': 0.38125968325088844}. Best is trial 306 with value: 0.8773711455576405.[0m
[32m[I 2022-04-13 22:15:25,918][0m Trial 315 finished with value: 0.8569896989854788 and parameters: {'loss': 'coxph', 'learning_rate': 0.001540718863329262, 'n_estimators': 928, 'criterion': 'friedman_mse', 'min_samples_split': 3, 'min_samples_leaf': 5, 'min_weight_fraction_leaf': 0.038901863704008735, 'min_impurity_decrease': 0.29118133236680194, 'max_features': 0.8517770632779104, 'subsample': 0.6926851725326079, 'dropout_rate': 0.32421423570638414, 'ccp_alpha': 0.19959202589346978}. Best is trial 306 with value: 0.8773711455576405.[0m
[32m[I 2022-04-13 22:17:19,486][0m Trial 316 finished with value: 0.8729364046011033 and parameters: {'loss': 'coxph', 'learning_rate': 0.0016756044416764847, 'n_estimators': 846, 'criterion': 'friedman_mse', 'min_samples_split': 3, 'min_samples_leaf': 4, 'min_weight_fraction_leaf': 0.045292429679288676, 'min_impurity_decrease': 0.30396423734085776, 'max_features': 0.8808001099607643, 'subsample': 0.7207270655512137, 'dropout_rate': 0.2887478064309228, 'ccp_alpha': 0.09629878812844905}. Best is trial 306 with value: 0.8773711455576405.[0m
[32m[I 2022-04-13 22:19:54,634][0m Trial 317 finished with value: 0.8407029461861214 and parameters: {'loss': 'coxph', 'learning_rate': 0.0018488756697147722, 'n_estimators': 1000, 'criterion': 'friedman_mse', 'min_samples_split': 3, 'min_samples_leaf': 5, 'min_weight_fraction_leaf': 0.04396941408752101, 'min_impurity_decrease': 0.3063738235916124, 'max_features': 0.8803583779789567, 'subsample': 0.725461029066469, 'dropout_rate': 0.2853959388469224, 'ccp_alpha': 0.27427982403123446}. Best is trial 306 with value: 0.8773711455576405.[0m
[32m[I 2022-04-13 22:21:53,166][0m Trial 318 finished with value: 0.8650732901302222 and parameters: {'loss': 'coxph', 'learning_rate': 0.0014084132482196472, 'n_estimators': 862, 'criterion': 'friedman_mse', 'min_samples_split': 3, 'min_samples_leaf': 4, 'min_weight_fraction_leaf': 0.027497018413781864, 'min_impurity_decrease': 0.3629487153620565, 'max_features': 0.8713060933268072, 'subsample': 0.7107102042883989, 'dropout_rate': 0.30487211383227647, 'ccp_alpha': 0.11847505773404689}. Best is trial 306 with value: 0.8773711455576405.[0m
[32m[I 2022-04-13 22:24:18,497][0m Trial 319 finished with value: 0.868298360569363 and parameters: {'loss': 'coxph', 'learning_rate': 0.002765083731962631, 'n_estimators': 958, 'criterion': 'friedman_mse', 'min_samples_split': 3, 'min_samples_leaf': 4, 'min_weight_fraction_leaf': 0.03470993701904948, 'min_impurity_decrease': 0.2783098614443032, 'max_features': 0.840967460210293, 'subsample': 0.7384635548109226, 'dropout_rate': 0.2793103714747923, 'ccp_alpha': 0.10456878566526287}. Best is trial 306 with value: 0.8773711455576405.[0m
[32m[I 2022-04-13 22:26:09,777][0m Trial 320 finished with value: 0.8779201817156906 and parameters: {'loss': 'coxph', 'learning_rate': 0.0019130238046333957, 'n_estimators': 893, 'criterion': 'friedman_mse', 'min_samples_split': 3, 'min_samples_leaf': 4, 'min_weight_fraction_leaf': 0.04767422910041584, 'min_impurity_decrease': 0.30743728682684024, 'max_features': 0.8999018582485461, 'subsample': 0.7026997763337499, 'dropout_rate': 0.3833863947631397, 'ccp_alpha': 0.0013784571318409874}. Best is trial 320 with value: 0.8779201817156906.[0m
[32m[I 2022-04-13 22:28:01,974][0m Trial 321 finished with value: 0.8131946414691505 and parameters: {'loss': 'coxph', 'learning_rate': 0.006453038412507685, 'n_estimators': 889, 'criterion': 'friedman_mse', 'min_samples_split': 3, 'min_samples_leaf': 4, 'min_weight_fraction_leaf': 0.045408846094505954, 'min_impurity_decrease': 0.3292294498904083, 'max_features': 0.8945525809441401, 'subsample': 0.7082157448407064, 'dropout_rate': 0.356286088835098, 'ccp_alpha': 0.2896657534738734}. Best is trial 320 with value: 0.8779201817156906.[0m
