[32m[I 2022-04-14 03:33:07,756][0m Trial 842 finished with value: 0.6524506958451449 and parameters: {'loss': 'coxph', 'learning_rate': 0.0007456907432954268, 'n_estimators': 183, 'criterion': 'friedman_mse', 'min_samples_split': 4, 'min_samples_leaf': 1, 'min_weight_fraction_leaf': 0.06003936865247917, 'min_impurity_decrease': 0.27455792789342226, 'max_features': 0.911888809082085, 'subsample': 0.7224158112864395, 'dropout_rate': 0.6177291796112963, 'ccp_alpha': 0.33856764429922}. Best is trial 627 with value: 0.8808013426064705.[0m
[32m[I 2022-04-14 03:33:11,069][0m Trial 843 finished with value: 0.65 and parameters: {'loss': 'coxph', 'learning_rate': 0.0016176559159038371, 'n_estimators': 139, 'criterion': 'absolute_error', 'min_samples_split': 3, 'min_samples_leaf': 3, 'min_weight_fraction_leaf': 0.002050563156168965, 'min_impurity_decrease': 0.548820028108824, 'max_features': 0.88686474518304, 'subsample': 0.6971017734983902, 'dropout_rate': 0.42937288401465984, 'ccp_alpha': 0.0023937350570511495}. Best is trial 627 with value: 0.8808013426064705.[0m
[32m[I 2022-04-14 03:33:17,430][0m Trial 844 finished with value: 0.8735235507509905 and parameters: {'loss': 'coxph', 'learning_rate': 0.0029437270809474746, 'n_estimators': 191, 'criterion': 'friedman_mse', 'min_samples_split': 4, 'min_samples_leaf': 1, 'min_weight_fraction_leaf': 0.037207538282652164, 'min_impurity_decrease': 0.21253087029340834, 'max_features': 0.9459480962493448, 'subsample': 0.7682962236432506, 'dropout_rate': 0.34026971219847585, 'ccp_alpha': 0.001071641258435307}. Best is trial 627 with value: 0.8808013426064705.[0m
[32m[I 2022-04-14 03:33:19,217][0m Trial 845 finished with value: 0.8512998212732908 and parameters: {'loss': 'coxph', 'learning_rate': 0.0011669095654711606, 'n_estimators': 123, 'criterion': 'friedman_mse', 'min_samples_split': 5, 'min_samples_leaf': 2, 'min_weight_fraction_leaf': 0.05170754265653589, 'min_impurity_decrease': 0.3414994603410411, 'max_features': 0.9673564519483618, 'subsample': 0.797595387884883, 'dropout_rate': 0.445017027544887, 'ccp_alpha': 0.15731646108716757}. Best is trial 627 with value: 0.8808013426064705.[0m
[32m[I 2022-04-14 03:33:24,658][0m Trial 846 finished with value: 0.8579136451874969 and parameters: {'loss': 'coxph', 'learning_rate': 0.0020062884921137874, 'n_estimators': 203, 'criterion': 'friedman_mse', 'min_samples_split': 4, 'min_samples_leaf': 1, 'min_weight_fraction_leaf': 0.02518807869831882, 'min_impurity_decrease': 0.30973628615587895, 'max_features': 0.9808389320945926, 'subsample': 0.7426864480485855, 'dropout_rate': 0.3966996747428343, 'ccp_alpha': 0.16918996843330708}. Best is trial 627 with value: 0.8808013426064705.[0m
[32m[I 2022-04-14 03:33:27,790][0m Trial 847 finished with value: 0.8697791712667117 and parameters: {'loss': 'coxph', 'learning_rate': 0.00675020821354953, 'n_estimators': 162, 'criterion': 'friedman_mse', 'min_samples_split': 4, 'min_samples_leaf': 2, 'min_weight_fraction_leaf': 0.04380454900529629, 'min_impurity_decrease': 0.3590076851246721, 'max_features': 0.9218842688818442, 'subsample': 0.6788796935825694, 'dropout_rate': 0.4837092114644933, 'ccp_alpha': 0.08858268946305833}. Best is trial 627 with value: 0.8808013426064705.[0m
[32m[I 2022-04-14 03:33:30,947][0m Trial 848 finished with value: 0.8733458468856128 and parameters: {'loss': 'coxph', 'learning_rate': 0.05989129050288935, 'n_estimators': 148, 'criterion': 'friedman_mse', 'min_samples_split': 3, 'min_samples_leaf': 1, 'min_weight_fraction_leaf': 0.06592967029645633, 'min_impurity_decrease': 0.4133283674440861, 'max_features': 0.9454620019530743, 'subsample': 0.7159537127863163, 'dropout_rate': 0.31665558264698707, 'ccp_alpha': 0.0016905365538493061}. Best is trial 627 with value: 0.8808013426064705.[0m
[32m[I 2022-04-14 03:35:41,886][0m Trial 849 finished with value: 0.6664143017695177 and parameters: {'loss': 'coxph', 'learning_rate': 0.004188280032589416, 'n_estimators': 932, 'criterion': 'squared_error', 'min_samples_split': 4, 'min_samples_leaf': 5, 'min_weight_fraction_leaf': 0.09082626915224216, 'min_impurity_decrease': 0.2932870638412527, 'max_features': 0.8813365620307901, 'subsample': 0.7677750531223396, 'dropout_rate': 0.2711726373394021, 'ccp_alpha': 0.2597722792208386}. Best is trial 627 with value: 0.8808013426064705.[0m
[32m[I 2022-04-14 03:35:45,004][0m Trial 850 finished with value: -0.3685215091815034 and parameters: {'loss': 'squared', 'learning_rate': 0.0025356560890636695, 'n_estimators': 133, 'criterion': 'friedman_mse', 'min_samples_split': 4, 'min_samples_leaf': 3, 'min_weight_fraction_leaf': 0.030221055204337696, 'min_impurity_decrease': 0.3244036599663313, 'max_features': 0.9990236837840707, 'subsample': 0.7358579644817037, 'dropout_rate': 0.3691301482719551, 'ccp_alpha': 0.10511268494778275}. Best is trial 627 with value: 0.8808013426064705.[0m
[32m[I 2022-04-14 03:35:53,439][0m Trial 851 finished with value: 0.8442120758413182 and parameters: {'loss': 'coxph', 'learning_rate': 0.0013059302523508577, 'n_estimators': 245, 'criterion': 'friedman_mse', 'min_samples_split': 3, 'min_samples_leaf': 1, 'min_weight_fraction_leaf': 0.01764001017461398, 'min_impurity_decrease': 0.23317921472192868, 'max_features': 0.9610913971225405, 'subsample': 0.8183514455169998, 'dropout_rate': 0.4583087441485881, 'ccp_alpha': 0.177874068428817}. Best is trial 627 with value: 0.8808013426064705.[0m
[32m[I 2022-04-14 03:36:08,627][0m Trial 852 finished with value: 0.8699124356226395 and parameters: {'loss': 'coxph', 'learning_rate': 0.0034214065358159646, 'n_estimators': 321, 'criterion': 'friedman_mse', 'min_samples_split': 4, 'min_samples_leaf': 1, 'min_weight_fraction_leaf': 0.08059066928797984, 'min_impurity_decrease': 0.38571251902445564, 'max_features': 0.9024142191559823, 'subsample': 0.7913896716248521, 'dropout_rate': 0.42013752193300846, 'ccp_alpha': 0.10980764963632417}. Best is trial 627 with value: 0.8808013426064705.[0m
[32m[I 2022-04-14 03:36:12,866][0m Trial 853 finished with value: 0.8417360918056247 and parameters: {'loss': 'coxph', 'learning_rate': 0.0016281267392277256, 'n_estimators': 144, 'criterion': 'friedman_mse', 'min_samples_split': 5, 'min_samples_leaf': 2, 'min_weight_fraction_leaf': 0.05576667778904315, 'min_impurity_decrease': 0.27236334215593194, 'max_features': 0.9802270046979953, 'subsample': 0.7540736916876469, 'dropout_rate': 0.3445857980708072, 'ccp_alpha': 0.22488622255486113}. Best is trial 627 with value: 0.8808013426064705.[0m
[32m[I 2022-04-14 03:36:48,225][0m Trial 854 finished with value: 0.8685508160396462 and parameters: {'loss': 'coxph', 'learning_rate': 0.0022572627943615543, 'n_estimators': 504, 'criterion': 'friedman_mse', 'min_samples_split': 4, 'min_samples_leaf': 1, 'min_weight_fraction_leaf': 0.042768424432709985, 'min_impurity_decrease': 0.48062109770135947, 'max_features': 0.9357417030425857, 'subsample': 0.7014506302836719, 'dropout_rate': 0.385300873015257, 'ccp_alpha': 0.10284472436535315}. Best is trial 627 with value: 0.8808013426064705.[0m
[32m[I 2022-04-14 03:36:54,533][0m Trial 855 finished with value: 0.869357502807398 and parameters: {'loss': 'coxph', 'learning_rate': 0.0053179653157849486, 'n_estimators': 155, 'criterion': 'friedman_mse', 'min_samples_split': 3, 'min_samples_leaf': 5, 'min_weight_fraction_leaf': 0.03364055115128857, 'min_impurity_decrease': 0.42918590145237817, 'max_features': 0.961869440002621, 'subsample': 0.665469034033679, 'dropout_rate': 0.2997945482397191, 'ccp_alpha': 0.0042161455389126586}. Best is trial 627 with value: 0.8808013426064705.[0m
[32m[I 2022-04-14 03:37:03,235][0m Trial 856 finished with value: 0.8740381530701875 and parameters: {'loss': 'coxph', 'learning_rate': 0.0884069526119714, 'n_estimators': 225, 'criterion': 'friedman_mse', 'min_samples_split': 4, 'min_samples_leaf': 2, 'min_weight_fraction_leaf': 0.07103628303171874, 'min_impurity_decrease': 0.2566467631618242, 'max_features': 0.9103832767140047, 'subsample': 0.7780150842814696, 'dropout_rate': 0.35686627744975724, 'ccp_alpha': 0.0018113558385940028}. Best is trial 627 with value: 0.8808013426064705.[0m
[32m[I 2022-04-14 03:37:07,794][0m Trial 857 finished with value: 0.6688713647614948 and parameters: {'loss': 'coxph', 'learning_rate': 0.0009682945092376825, 'n_estimators': 169, 'criterion': 'friedman_mse', 'min_samples_split': 2, 'min_samples_leaf': 3, 'min_weight_fraction_leaf': 0.008272815097847296, 'min_impurity_decrease': 0.16736929111178872, 'max_features': 0.9288812075643514, 'subsample': 0.7257659607407964, 'dropout_rate': 0.40440700680707353, 'ccp_alpha': 0.3181681468085172}. Best is trial 627 with value: 0.8808013426064705.[0m
[32m[I 2022-04-14 03:37:12,251][0m Trial 858 finished with value: 0.65 and parameters: {'loss': 'coxph', 'learning_rate': 0.0030540981603262873, 'n_estimators': 179, 'criterion': 'friedman_mse', 'min_samples_split': 4, 'min_samples_leaf': 1, 'min_weight_fraction_leaf': 0.052555578329015404, 'min_impurity_decrease': 0.5822629197797238, 'max_features': 0.9845876964103177, 'subsample': 0.7525661249131227, 'dropout_rate': 0.4992794835820931, 'ccp_alpha': 3.2463103980084496}. Best is trial 627 with value: 0.8808013426064705.[0m
[32m[I 2022-04-14 03:37:27,751][0m Trial 859 finished with value: 0.8704602128008366 and parameters: {'loss': 'coxph', 'learning_rate': 0.0017822843191278527, 'n_estimators': 355, 'criterion': 'friedman_mse', 'min_samples_split': 3, 'min_samples_leaf': 1, 'min_weight_fraction_leaf': 0.02583910081560782, 'min_impurity_decrease': 0.3558859143479286, 'max_features': 0.8806489819530301, 'subsample': 0.8103375274444768, 'dropout_rate': 0.4380098185541313, 'ccp_alpha': 0.0960517272489968}. Best is trial 627 with value: 0.8808013426064705.[0m
[32m[I 2022-04-14 03:37:31,303][0m Trial 860 finished with value: 0.8559697615580939 and parameters: {'loss': 'coxph', 'learning_rate': 0.00217614137953657, 'n_estimators': 137, 'criterion': 'friedman_mse', 'min_samples_split': 10, 'min_samples_leaf': 2, 'min_weight_fraction_leaf': 0.04107588890104809, 'min_impurity_decrease': 0.31441914448883185, 'max_features': 0.9506791773185648, 'subsample': 0.706787889414137, 'dropout_rate': 0.3233794018579278, 'ccp_alpha': 0.19057369939349372}. Best is trial 627 with value: 0.8808013426064705.[0m
[32m[I 2022-04-14 03:37:37,548][0m Trial 861 finished with value: 0.8734643499924607 and parameters: {'loss': 'coxph', 'learning_rate': 0.0013375009748580872, 'n_estimators': 210, 'criterion': 'friedman_mse', 'min_samples_split': 5, 'min_samples_leaf': 1, 'min_weight_fraction_leaf': 0.06236557144298251, 'min_impurity_decrease': 0.29486798890868043, 'max_features': 0.9805614027662791, 'subsample': 0.7345898422931356, 'dropout_rate': 0.4646028064872488, 'ccp_alpha': 0.10475990851451503}. Best is trial 627 with value: 0.8808013426064705.[0m
[32m[I 2022-04-14 03:37:43,119][0m Trial 862 finished with value: 0.8742002925340756 and parameters: {'loss': 'coxph', 'learning_rate': 0.0008882835759957829, 'n_estimators': 193, 'criterion': 'friedman_mse', 'min_samples_split': 4, 'min_samples_leaf': 3, 'min_weight_fraction_leaf': 0.01625920045481272, 'min_impurity_decrease': 0.4047902091325426, 'max_features': 0.999717562184032, 'subsample': 0.7782416816343063, 'dropout_rate': 0.38165931646147533, 'ccp_alpha': 0.0011513560585246778}. Best is trial 627 with value: 0.8808013426064705.[0m
[32m[I 2022-04-14 03:37:48,890][0m Trial 863 finished with value: 0.6524506958451449 and parameters: {'loss': 'coxph', 'learning_rate': 0.004211709336852222, 'n_estimators': 186, 'criterion': 'friedman_mse', 'min_samples_split': 4, 'min_samples_leaf': 1, 'min_weight_fraction_leaf': 0.048590288528997154, 'min_impurity_decrease': 0.33143395111726387, 'max_features': 0.8967325351995338, 'subsample': 0.7583614079300954, 'dropout_rate': 0.33847591021048073, 'ccp_alpha': 0.38000825203423566}. Best is trial 627 with value: 0.8808013426064705.[0m
[32m[I 2022-04-14 03:37:52,445][0m Trial 864 finished with value: 0.65 and parameters: {'loss': 'coxph', 'learning_rate': 0.002825120950061292, 'n_estimators': 150, 'criterion': 'absolute_error', 'min_samples_split': 3, 'min_samples_leaf': 1, 'min_weight_fraction_leaf': 0.03444515746624171, 'min_impurity_decrease': 0.3704260770791502, 'max_features': 0.9278906377013778, 'subsample': 0.5264169852993364, 'dropout_rate': 0.4071277791669934, 'ccp_alpha': 0.23672367727202445}. Best is trial 627 with value: 0.8808013426064705.[0m
[32m[I 2022-04-14 03:37:55,933][0m Trial 865 finished with value: 0.8656327826050605 and parameters: {'loss': 'coxph', 'learning_rate': 0.0006793326329566021, 'n_estimators': 128, 'criterion': 'friedman_mse', 'min_samples_split': 4, 'min_samples_leaf': 2, 'min_weight_fraction_leaf': 0.024829036500542002, 'min_impurity_decrease': 0.24743380905865725, 'max_features': 0.9633823924854671, 'subsample': 0.6871768266311126, 'dropout_rate': 0.28430994898043543, 'ccp_alpha': 0.09627403663110111}. Best is trial 627 with value: 0.8808013426064705.[0m
[32m[I 2022-04-14 03:37:59,735][0m Trial 866 finished with value: 0.868432591245527 and parameters: {'loss': 'coxph', 'learning_rate': 0.0015989533935377614, 'n_estimators': 163, 'criterion': 'friedman_mse', 'min_samples_split': 4, 'min_samples_leaf': 5, 'min_weight_fraction_leaf': 0.08145625593437132, 'min_impurity_decrease': 0.2840364489982919, 'max_features': 0.6895034741605157, 'subsample': 0.7966620640361259, 'dropout_rate': 0.45018282646711677, 'ccp_alpha': 0.0023749901650340034}. Best is trial 627 with value: 0.8808013426064705.[0m
[32m[I 2022-04-14 03:40:02,885][0m Trial 867 finished with value: -0.3696839904322756 and parameters: {'loss': 'squared', 'learning_rate': 0.002393251836341616, 'n_estimators': 912, 'criterion': 'friedman_mse', 'min_samples_split': 3, 'min_samples_leaf': 3, 'min_weight_fraction_leaf': 0.0588462135718863, 'min_impurity_decrease': 0.5510045703534526, 'max_features': 0.9453376131958298, 'subsample': 0.7219497034281509, 'dropout_rate': 0.36434203525373404, 'ccp_alpha': 0.16941711013357247}. Best is trial 627 with value: 0.8808013426064705.[0m
[32m[I 2022-04-14 03:40:08,785][0m Trial 868 finished with value: 0.8657930456355499 and parameters: {'loss': 'coxph', 'learning_rate': 0.00115420928802876, 'n_estimators': 262, 'criterion': 'friedman_mse', 'min_samples_split': 4, 'min_samples_leaf': 2, 'min_weight_fraction_leaf': 0.04377127160840928, 'min_impurity_decrease': 0.3940869083887087, 'max_features': 0.40105133458798614, 'subsample': 0.4142627288248741, 'dropout_rate': 0.6363310391931725, 'ccp_alpha': 0.10499872009298342}. Best is trial 627 with value: 0.8808013426064705.[0m
[32m[I 2022-04-14 03:40:29,918][0m Trial 869 finished with value: 0.8254096409146143 and parameters: {'loss': 'coxph', 'learning_rate': 0.0019057290918860152, 'n_estimators': 395, 'criterion': 'friedman_mse', 'min_samples_split': 9, 'min_samples_leaf': 1, 'min_weight_fraction_leaf': 0.01265642255364239, 'min_impurity_decrease': 0.45380922265001594, 'max_features': 0.9134919786837453, 'subsample': 0.7698745086884681, 'dropout_rate': 0.4283720048127031, 'ccp_alpha': 0.2618067329299878}. Best is trial 627 with value: 0.8808013426064705.[0m
[32m[I 2022-04-14 03:40:33,865][0m Trial 870 finished with value: 0.8672194249233819 and parameters: {'loss': 'coxph', 'learning_rate': 0.003296713024801449, 'n_estimators': 171, 'criterion': 'friedman_mse', 'min_samples_split': 5, 'min_samples_leaf': 1, 'min_weight_fraction_leaf': 0.03454482263553585, 'min_impurity_decrease': 0.3426543380099253, 'max_features': 0.9993330334849321, 'subsample': 0.7345209110417643, 'dropout_rate': 0.4721051801104187, 'ccp_alpha': 0.09555608509018165}. Best is trial 627 with value: 0.8808013426064705.[0m
[32m[I 2022-04-14 03:40:36,333][0m Trial 871 finished with value: 0.855195052628232 and parameters: {'loss': 'coxph', 'learning_rate': 0.0014832070630015418, 'n_estimators': 136, 'criterion': 'squared_error', 'min_samples_split': 4, 'min_samples_leaf': 2, 'min_weight_fraction_leaf': 0.07115465383554762, 'min_impurity_decrease': 0.1972750193341669, 'max_features': 0.9684092039963468, 'subsample': 0.6496461964867267, 'dropout_rate': 0.30896150452973437, 'ccp_alpha': 0.16699231338759482}. Best is trial 627 with value: 0.8808013426064705.[0m
[32m[I 2022-04-14 03:40:42,360][0m Trial 872 finished with value: 0.8709746304841808 and parameters: {'loss': 'coxph', 'learning_rate': 0.002353423691228152, 'n_estimators': 199, 'criterion': 'friedman_mse', 'min_samples_split': 3, 'min_samples_leaf': 1, 'min_weight_fraction_leaf': 0.0010402005866868014, 'min_impurity_decrease': 0.3111887651743215, 'max_features': 0.8783432875337246, 'subsample': 0.701129134326253, 'dropout_rate': 0.38486616023372605, 'ccp_alpha': 0.08591922756355952}. Best is trial 627 with value: 0.8808013426064705.[0m
[32m[I 2022-04-14 03:40:44,627][0m Trial 873 finished with value: 0.8807959986696087 and parameters: {'loss': 'coxph', 'learning_rate': 0.0042475548303627835, 'n_estimators': 142, 'criterion': 'friedman_mse', 'min_samples_split': 4, 'min_samples_leaf': 3, 'min_weight_fraction_leaf': 0.0520372009484588, 'min_impurity_decrease': 0.2717261681987129, 'max_features': 0.9361208679105114, 'subsample': 0.7560737940793189, 'dropout_rate': 0.4958549049374552, 'ccp_alpha': 0.004435063286845801}. Best is trial 627 with value: 0.8808013426064705.[0m
[32m[I 2022-04-14 03:40:47,616][0m Trial 874 finished with value: 0.8355240263599011 and parameters: {'loss': 'coxph', 'learning_rate': 0.009341744882814392, 'n_estimators': 143, 'criterion': 'friedman_mse', 'min_samples_split': 4, 'min_samples_leaf': 3, 'min_weight_fraction_leaf': 0.06533658163481253, 'min_impurity_decrease': 0.2615848407701639, 'max_features': 0.9008871055148244, 'subsample': 0.7437177276827638, 'dropout_rate': 0.5047089844727073, 'ccp_alpha': 0.23081455531291117}. Best is trial 627 with value: 0.8808013426064705.[0m
[32m[I 2022-04-14 03:40:50,960][0m Trial 875 finished with value: 0.8698260766515856 and parameters: {'loss': 'coxph', 'learning_rate': 0.005913658495638475, 'n_estimators': 143, 'criterion': 'friedman_mse', 'min_samples_split': 4, 'min_samples_leaf': 3, 'min_weight_fraction_leaf': 0.05604645144597702, 'min_impurity_decrease': 0.24585645882137655, 'max_features': 0.9273343152446293, 'subsample': 0.7181977160530135, 'dropout_rate': 0.4654534383677399, 'ccp_alpha': 0.08579014663740972}. Best is trial 627 with value: 0.8808013426064705.[0m
[32m[I 2022-04-14 03:40:53,695][0m Trial 876 finished with value: 0.8724005075806401 and parameters: {'loss': 'coxph', 'learning_rate': 0.0048397354925146345, 'n_estimators': 130, 'criterion': 'friedman_mse', 'min_samples_split': 4, 'min_samples_leaf': 3, 'min_weight_fraction_leaf': 0.07748738942828479, 'min_impurity_decrease': 0.2232781100273533, 'max_features': 0.8748600465684746, 'subsample': 0.7431824922344863, 'dropout_rate': 0.5072308995120265, 'ccp_alpha': 0.004466359155385151}. Best is trial 627 with value: 0.8808013426064705.[0m
[32m[I 2022-04-14 03:40:56,538][0m Trial 877 finished with value: 0.8368259226670635 and parameters: {'loss': 'coxph', 'learning_rate': 0.004443530494458697, 'n_estimators': 138, 'criterion': 'friedman_mse', 'min_samples_split': 4, 'min_samples_leaf': 3, 'min_weight_fraction_leaf': 0.05137698629590811, 'min_impurity_decrease': 0.2687158186517804, 'max_features': 0.5258401110751543, 'subsample': 0.16478405302316879, 'dropout_rate': 0.49458237986125575, 'ccp_alpha': 0.20858422878081911}. Best is trial 627 with value: 0.8808013426064705.[0m
[32m[I 2022-04-14 03:40:58,348][0m Trial 878 finished with value: 0.65 and parameters: {'loss': 'coxph', 'learning_rate': 0.0037879518775664903, 'n_estimators': 119, 'criterion': 'friedman_mse', 'min_samples_split': 4, 'min_samples_leaf': 3, 'min_weight_fraction_leaf': 0.09591249648628915, 'min_impurity_decrease': 0.2804614183499202, 'max_features': 0.91016451917039, 'subsample': 0.6812100297769327, 'dropout_rate': 0.4815071337356398, 'ccp_alpha': 2.554194799232053}. Best is trial 627 with value: 0.8808013426064705.[0m
[32m[I 2022-04-14 03:41:01,320][0m Trial 879 finished with value: 0.6576302970240425 and parameters: {'loss': 'coxph', 'learning_rate': 0.008018705922533348, 'n_estimators': 148, 'criterion': 'friedman_mse', 'min_samples_split': 4, 'min_samples_leaf': 3, 'min_weight_fraction_leaf': 0.066820087244675, 'min_impurity_decrease': 0.23740515873307533, 'max_features': 0.9368383200413488, 'subsample': 0.7574725616819076, 'dropout_rate': 0.5098180680680304, 'ccp_alpha': 0.30461516723423604}. Best is trial 627 with value: 0.8808013426064705.[0m
[32m[I 2022-04-14 03:41:03,995][0m Trial 880 finished with value: 0.8717672192376582 and parameters: {'loss': 'coxph', 'learning_rate': 0.005104583929030696, 'n_estimators': 129, 'criterion': 'friedman_mse', 'min_samples_split': 4, 'min_samples_leaf': 3, 'min_weight_fraction_leaf': 0.05019947730503775, 'min_impurity_decrease': 0.2907011295506271, 'max_features': 0.896414866250777, 'subsample': 0.710843939262251, 'dropout_rate': 0.5003836102152096, 'ccp_alpha': 0.0020295815306851997}. Best is trial 627 with value: 0.8808013426064705.[0m
[32m[I 2022-04-14 03:41:06,473][0m Trial 881 finished with value: 0.8744587270843386 and parameters: {'loss': 'coxph', 'learning_rate': 0.0038276983786595976, 'n_estimators': 146, 'criterion': 'friedman_mse', 'min_samples_split': 4, 'min_samples_leaf': 3, 'min_weight_fraction_leaf': 0.060566263201589476, 'min_impurity_decrease': 0.2570730603316582, 'max_features': 0.8815763910392824, 'subsample': 0.7299481563387183, 'dropout_rate': 0.47657984332897874, 'ccp_alpha': 0.0015341059784000264}. Best is trial 627 with value: 0.8808013426064705.[0m
