[32m[I 2022-04-14 04:02:36,847][0m Trial 922 finished with value: 0.8722740319799556 and parameters: {'loss': 'coxph', 'learning_rate': 0.0014104455275359288, 'n_estimators': 140, 'criterion': 'friedman_mse', 'min_samples_split': 4, 'min_samples_leaf': 3, 'min_weight_fraction_leaf': 0.07998859492918406, 'min_impurity_decrease': 0.4017583993928162, 'max_features': 0.9286392089838424, 'subsample': 0.6330194535706998, 'dropout_rate': 0.4267683974332367, 'ccp_alpha': 0.08545278542303865}. Best is trial 627 with value: 0.8808013426064705.[0m
[32m[I 2022-04-14 04:02:39,666][0m Trial 923 finished with value: 0.8735547410358718 and parameters: {'loss': 'coxph', 'learning_rate': 0.000821804498516935, 'n_estimators': 144, 'criterion': 'friedman_mse', 'min_samples_split': 4, 'min_samples_leaf': 3, 'min_weight_fraction_leaf': 0.057540121586972436, 'min_impurity_decrease': 0.45053200050906167, 'max_features': 0.9193909700371177, 'subsample': 0.6572020549851856, 'dropout_rate': 0.3916573191499415, 'ccp_alpha': 0.001436955733628906}. Best is trial 627 with value: 0.8808013426064705.[0m
[32m[I 2022-04-14 04:02:42,426][0m Trial 924 finished with value: 0.8606115592972688 and parameters: {'loss': 'coxph', 'learning_rate': 0.002088302919100068, 'n_estimators': 150, 'criterion': 'friedman_mse', 'min_samples_split': 5, 'min_samples_leaf': 3, 'min_weight_fraction_leaf': 0.0703919627484634, 'min_impurity_decrease': 0.4350953956644586, 'max_features': 0.9451865120117431, 'subsample': 0.6812282954014589, 'dropout_rate': 0.4052063832474514, 'ccp_alpha': 0.18218143922274666}. Best is trial 627 with value: 0.8808013426064705.[0m
[32m[I 2022-04-14 04:02:44,832][0m Trial 925 finished with value: -0.25 and parameters: {'loss': 'squared', 'learning_rate': 0.0010735001505732715, 'n_estimators': 129, 'criterion': 'friedman_mse', 'min_samples_split': 4, 'min_samples_leaf': 3, 'min_weight_fraction_leaf': 0.0491880831718517, 'min_impurity_decrease': 0.4263252471508655, 'max_features': 0.9563088304935472, 'subsample': 0.6697610544274236, 'dropout_rate': 0.3615059432476836, 'ccp_alpha': 4.007407846025248}. Best is trial 627 with value: 0.8808013426064705.[0m
[32m[I 2022-04-14 04:02:47,612][0m Trial 926 finished with value: 0.8482134824414331 and parameters: {'loss': 'coxph', 'learning_rate': 0.002502892177629093, 'n_estimators': 139, 'criterion': 'friedman_mse', 'min_samples_split': 4, 'min_samples_leaf': 3, 'min_weight_fraction_leaf': 0.0636916387430021, 'min_impurity_decrease': 0.4093705876358887, 'max_features': 0.9274546483486438, 'subsample': 0.9750828993642706, 'dropout_rate': 0.5690334138234067, 'ccp_alpha': 0.0913780145142208}. Best is trial 627 with value: 0.8808013426064705.[0m
[32m[I 2022-04-14 04:02:50,427][0m Trial 927 finished with value: 0.8626770709751559 and parameters: {'loss': 'coxph', 'learning_rate': 0.001745321890652916, 'n_estimators': 145, 'criterion': 'friedman_mse', 'min_samples_split': 4, 'min_samples_leaf': 1, 'min_weight_fraction_leaf': 0.052853471995270844, 'min_impurity_decrease': 0.4076988217740661, 'max_features': 0.9654030909165446, 'subsample': 0.6910860443027234, 'dropout_rate': 0.38190897927435535, 'ccp_alpha': 0.15730748544703488}. Best is trial 627 with value: 0.8808013426064705.[0m
[32m[I 2022-04-14 04:02:54,548][0m Trial 928 finished with value: 0.7920866463292472 and parameters: {'loss': 'coxph', 'learning_rate': 0.004872440158869495, 'n_estimators': 154, 'criterion': 'friedman_mse', 'min_samples_split': 4, 'min_samples_leaf': 3, 'min_weight_fraction_leaf': 0.04551494459994178, 'min_impurity_decrease': 0.38344518222494095, 'max_features': 0.9138471367949921, 'subsample': 0.6722340364231278, 'dropout_rate': 0.42827283173384284, 'ccp_alpha': 0.3003536015701316}. Best is trial 627 with value: 0.8808013426064705.[0m
[32m[I 2022-04-14 04:02:58,745][0m Trial 929 finished with value: 0.8699884213035682 and parameters: {'loss': 'coxph', 'learning_rate': 0.003110824639777472, 'n_estimators': 141, 'criterion': 'friedman_mse', 'min_samples_split': 4, 'min_samples_leaf': 3, 'min_weight_fraction_leaf': 0.09767738039667631, 'min_impurity_decrease': 0.4303150018775533, 'max_features': 0.9421851021073444, 'subsample': 0.657228813447153, 'dropout_rate': 0.33782268996228887, 'ccp_alpha': 0.00407702964782767}. Best is trial 627 with value: 0.8808013426064705.[0m
[32m[I 2022-04-14 04:03:01,371][0m Trial 930 finished with value: 0.65 and parameters: {'loss': 'coxph', 'learning_rate': 0.0012581753899944884, 'n_estimators': 134, 'criterion': 'absolute_error', 'min_samples_split': 4, 'min_samples_leaf': 3, 'min_weight_fraction_leaf': 0.0670414192503183, 'min_impurity_decrease': 0.3909072523698715, 'max_features': 0.979585737212321, 'subsample': 0.6964485600313692, 'dropout_rate': 0.3065175850436838, 'ccp_alpha': 0.0930259645919256}. Best is trial 627 with value: 0.8808013426064705.[0m
[32m[I 2022-04-14 04:03:04,843][0m Trial 931 finished with value: 0.65 and parameters: {'loss': 'coxph', 'learning_rate': 0.002120751316854036, 'n_estimators': 157, 'criterion': 'friedman_mse', 'min_samples_split': 5, 'min_samples_leaf': 3, 'min_weight_fraction_leaf': 0.02741812012006583, 'min_impurity_decrease': 0.41825868009533057, 'max_features': 0.9068301686232804, 'subsample': 0.014023191594613016, 'dropout_rate': 0.355022449734961, 'ccp_alpha': 0.24000284166037697}. Best is trial 627 with value: 0.8808013426064705.[0m
[32m[I 2022-04-14 04:03:09,447][0m Trial 932 finished with value: 0.8767180918270663 and parameters: {'loss': 'coxph', 'learning_rate': 0.0015156671402705023, 'n_estimators': 134, 'criterion': 'friedman_mse', 'min_samples_split': 3, 'min_samples_leaf': 3, 'min_weight_fraction_leaf': 0.054975700248548774, 'min_impurity_decrease': 0.3672976222775669, 'max_features': 0.954388595532472, 'subsample': 0.7068747607766638, 'dropout_rate': 0.40799692013809186, 'ccp_alpha': 0.0018147182687036074}. Best is trial 627 with value: 0.8808013426064705.[0m
[32m[I 2022-04-14 04:03:11,540][0m Trial 933 finished with value: 0.8751904527594678 and parameters: {'loss': 'coxph', 'learning_rate': 0.0008980458518886436, 'n_estimators': 124, 'criterion': 'friedman_mse', 'min_samples_split': 3, 'min_samples_leaf': 3, 'min_weight_fraction_leaf': 0.04392301401781894, 'min_impurity_decrease': 0.34786321042958473, 'max_features': 0.9670640170899594, 'subsample': 0.681122519953317, 'dropout_rate': 0.4010372797082372, 'ccp_alpha': 0.0021424119829813342}. Best is trial 627 with value: 0.8808013426064705.[0m
[32m[I 2022-04-14 04:03:13,824][0m Trial 934 finished with value: 0.8654626237308072 and parameters: {'loss': 'coxph', 'learning_rate': 0.0012578942043741405, 'n_estimators': 129, 'criterion': 'friedman_mse', 'min_samples_split': 3, 'min_samples_leaf': 3, 'min_weight_fraction_leaf': 0.03549644975344146, 'min_impurity_decrease': 0.3616024739579948, 'max_features': 0.974894766213837, 'subsample': 0.642224473352805, 'dropout_rate': 0.38159914625457636, 'ccp_alpha': 0.17286545858801006}. Best is trial 627 with value: 0.8808013426064705.[0m
[32m[I 2022-04-14 04:03:16,674][0m Trial 935 finished with value: 0.8713330213258885 and parameters: {'loss': 'coxph', 'learning_rate': 0.0014205375526272943, 'n_estimators': 140, 'criterion': 'friedman_mse', 'min_samples_split': 3, 'min_samples_leaf': 3, 'min_weight_fraction_leaf': 0.05060503759384017, 'min_impurity_decrease': 0.3671056366554524, 'max_features': 0.9551051584992349, 'subsample': 0.6969144218172958, 'dropout_rate': 0.39387801640118747, 'ccp_alpha': 0.0880112041337012}. Best is trial 627 with value: 0.8808013426064705.[0m
[32m[I 2022-04-14 04:03:19,018][0m Trial 936 finished with value: 0.8560458191613642 and parameters: {'loss': 'coxph', 'learning_rate': 0.0011308076013349104, 'n_estimators': 133, 'criterion': 'friedman_mse', 'min_samples_split': 3, 'min_samples_leaf': 3, 'min_weight_fraction_leaf': 0.05526677872395284, 'min_impurity_decrease': 0.33389529958754105, 'max_features': 0.9989678472071393, 'subsample': 0.6735591881839369, 'dropout_rate': 0.3693609354244954, 'ccp_alpha': 0.17503574250409165}. Best is trial 627 with value: 0.8808013426064705.[0m
[32m[I 2022-04-14 04:03:22,106][0m Trial 937 finished with value: 0.8781477030047402 and parameters: {'loss': 'coxph', 'learning_rate': 0.0016009813536229803, 'n_estimators': 120, 'criterion': 'friedman_mse', 'min_samples_split': 2, 'min_samples_leaf': 3, 'min_weight_fraction_leaf': 0.03960453908336462, 'min_impurity_decrease': 0.3645405818351321, 'max_features': 0.9777162570776431, 'subsample': 0.6964091184760023, 'dropout_rate': 0.417845231194106, 'ccp_alpha': 0.003220778947625817}. Best is trial 627 with value: 0.8808013426064705.[0m
[32m[I 2022-04-14 04:03:24,724][0m Trial 938 finished with value: 0.6576302970240425 and parameters: {'loss': 'coxph', 'learning_rate': 0.0017901569742494146, 'n_estimators': 118, 'criterion': 'squared_error', 'min_samples_split': 3, 'min_samples_leaf': 3, 'min_weight_fraction_leaf': 0.045964096217751424, 'min_impurity_decrease': 0.37467959031922204, 'max_features': 0.9814735445539393, 'subsample': 0.685532959069662, 'dropout_rate': 0.411325231055445, 'ccp_alpha': 0.09168040024074348}. Best is trial 627 with value: 0.8808013426064705.[0m
[32m[I 2022-04-14 04:03:25,778][0m Trial 939 finished with value: 0.6524506958451449 and parameters: {'loss': 'coxph', 'learning_rate': 0.0016677268688597379, 'n_estimators': 105, 'criterion': 'friedman_mse', 'min_samples_split': 2, 'min_samples_leaf': 3, 'min_weight_fraction_leaf': 0.04134219474803382, 'min_impurity_decrease': 0.3544914344126608, 'max_features': 0.9671958852974393, 'subsample': 0.7005206266336853, 'dropout_rate': 0.8538480619246767, 'ccp_alpha': 0.38795132159265566}. Best is trial 627 with value: 0.8808013426064705.[0m
[32m[I 2022-04-14 04:03:27,560][0m Trial 940 finished with value: 0.8434370078828654 and parameters: {'loss': 'coxph', 'learning_rate': 0.0016554966025792768, 'n_estimators': 108, 'criterion': 'friedman_mse', 'min_samples_split': 3, 'min_samples_leaf': 3, 'min_weight_fraction_leaf': 0.052311411472906535, 'min_impurity_decrease': 0.38196430335086573, 'max_features': 0.9831668579706937, 'subsample': 0.6592080775886705, 'dropout_rate': 0.41510679351097907, 'ccp_alpha': 0.24929315334352295}. Best is trial 627 with value: 0.8808013426064705.[0m
[32m[I 2022-04-14 04:03:29,504][0m Trial 941 finished with value: 0.8659470541205568 and parameters: {'loss': 'coxph', 'learning_rate': 0.0015258438927584481, 'n_estimators': 118, 'criterion': 'friedman_mse', 'min_samples_split': 3, 'min_samples_leaf': 3, 'min_weight_fraction_leaf': 0.04131864763829253, 'min_impurity_decrease': 0.3571273125805533, 'max_features': 0.9996505244055501, 'subsample': 0.6942787902708114, 'dropout_rate': 0.4051097680307271, 'ccp_alpha': 0.09518820545847434}. Best is trial 627 with value: 0.8808013426064705.[0m
[32m[I 2022-04-14 04:03:32,097][0m Trial 942 finished with value: 0.8659752621024268 and parameters: {'loss': 'coxph', 'learning_rate': 0.0020683719512225684, 'n_estimators': 112, 'criterion': 'friedman_mse', 'min_samples_split': 2, 'min_samples_leaf': 3, 'min_weight_fraction_leaf': 0.054488914560961686, 'min_impurity_decrease': 0.3404978705625897, 'max_features': 0.9553770080361326, 'subsample': 0.6671830203357563, 'dropout_rate': 0.3865539125078456, 'ccp_alpha': 0.09565095500842405}. Best is trial 627 with value: 0.8808013426064705.[0m
[32m[I 2022-04-14 04:03:34,425][0m Trial 943 finished with value: 0.8593070236047924 and parameters: {'loss': 'coxph', 'learning_rate': 0.0013692490054192429, 'n_estimators': 122, 'criterion': 'friedman_mse', 'min_samples_split': 2, 'min_samples_leaf': 3, 'min_weight_fraction_leaf': 0.0378651628999457, 'min_impurity_decrease': 0.3649002078314575, 'max_features': 0.9831071388192374, 'subsample': 0.706948695879443, 'dropout_rate': 0.42833238949204633, 'ccp_alpha': 0.16687617349029774}. Best is trial 627 with value: 0.8808013426064705.[0m
[32m[I 2022-04-14 04:03:36,523][0m Trial 944 finished with value: -0.36761476934487913 and parameters: {'loss': 'squared', 'learning_rate': 0.0019429690300336421, 'n_estimators': 113, 'criterion': 'friedman_mse', 'min_samples_split': 2, 'min_samples_leaf': 3, 'min_weight_fraction_leaf': 0.05966068023819586, 'min_impurity_decrease': 0.37176004776269567, 'max_features': 0.9532281506815248, 'subsample': 0.6342425681369487, 'dropout_rate': 0.41949213789992673, 'ccp_alpha': 0.001305964045416886}. Best is trial 627 with value: 0.8808013426064705.[0m
[32m[I 2022-04-14 04:03:38,946][0m Trial 945 finished with value: 0.7885405433874638 and parameters: {'loss': 'coxph', 'learning_rate': 0.002383266205166432, 'n_estimators': 127, 'criterion': 'friedman_mse', 'min_samples_split': 2, 'min_samples_leaf': 3, 'min_weight_fraction_leaf': 0.03254496102245676, 'min_impurity_decrease': 0.3276744229333953, 'max_features': 0.968373811440642, 'subsample': 0.6799851886679379, 'dropout_rate': 0.3799266653527391, 'ccp_alpha': 0.3017567480381568}. Best is trial 627 with value: 0.8808013426064705.[0m
[32m[I 2022-04-14 04:03:42,039][0m Trial 946 finished with value: 0.8794330216608024 and parameters: {'loss': 'coxph', 'learning_rate': 1.310672262019003e-05, 'n_estimators': 124, 'criterion': 'friedman_mse', 'min_samples_split': 2, 'min_samples_leaf': 3, 'min_weight_fraction_leaf': 0.046687715940832916, 'min_impurity_decrease': 0.3833971189620875, 'max_features': 0.9426919589887345, 'subsample': 0.7094623725011057, 'dropout_rate': 0.4017515241513875, 'ccp_alpha': 0.004645527120210613}. Best is trial 627 with value: 0.8808013426064705.[0m
[32m[I 2022-04-14 04:03:44,887][0m Trial 947 finished with value: 0.8509825901004486 and parameters: {'loss': 'coxph', 'learning_rate': 5.581522984948136e-06, 'n_estimators': 117, 'criterion': 'friedman_mse', 'min_samples_split': 2, 'min_samples_leaf': 3, 'min_weight_fraction_leaf': 0.048218100674379316, 'min_impurity_decrease': 0.38936569489917566, 'max_features': 0.9421029122048715, 'subsample': 0.7090916182078418, 'dropout_rate': 0.4014563023969908, 'ccp_alpha': 0.19632158627205243}. Best is trial 627 with value: 0.8808013426064705.[0m
[32m[I 2022-04-14 04:03:46,415][0m Trial 948 finished with value: 0.8761046359718019 and parameters: {'loss': 'coxph', 'learning_rate': 6.992242070241699e-06, 'n_estimators': 119, 'criterion': 'friedman_mse', 'min_samples_split': 2, 'min_samples_leaf': 3, 'min_weight_fraction_leaf': 0.05980030241451574, 'min_impurity_decrease': 0.3853563285243129, 'max_features': 0.9442829032291437, 'subsample': 0.6901862529575162, 'dropout_rate': 0.9350546776772075, 'ccp_alpha': 0.004655663977475643}. Best is trial 627 with value: 0.8808013426064705.[0m
[32m[I 2022-04-14 04:03:47,816][0m Trial 949 finished with value: 0.8775427342466608 and parameters: {'loss': 'coxph', 'learning_rate': 0.002874690369986059, 'n_estimators': 123, 'criterion': 'friedman_mse', 'min_samples_split': 3, 'min_samples_leaf': 3, 'min_weight_fraction_leaf': 0.04909673339167782, 'min_impurity_decrease': 0.7608619969805167, 'max_features': 0.9588537017484469, 'subsample': 0.7123337559970357, 'dropout_rate': 0.8204218135361441, 'ccp_alpha': 0.0015944980950345538}. Best is trial 627 with value: 0.8808013426064705.[0m
[32m[I 2022-04-14 04:03:49,600][0m Trial 950 finished with value: 0.8693634543292077 and parameters: {'loss': 'coxph', 'learning_rate': 0.005004477558358115, 'n_estimators': 114, 'criterion': 'friedman_mse', 'min_samples_split': 2, 'min_samples_leaf': 3, 'min_weight_fraction_leaf': 0.05354034870919951, 'min_impurity_decrease': 0.8269627964749142, 'max_features': 0.9676706786106769, 'subsample': 0.6681181496709829, 'dropout_rate': 0.393876890920462, 'ccp_alpha': 0.09377587698296594}. Best is trial 627 with value: 0.8808013426064705.[0m
[32m[I 2022-04-14 04:03:52,369][0m Trial 951 finished with value: 0.65 and parameters: {'loss': 'coxph', 'learning_rate': 0.003371378103944834, 'n_estimators': 132, 'criterion': 'friedman_mse', 'min_samples_split': 2, 'min_samples_leaf': 3, 'min_weight_fraction_leaf': 0.0436648907415619, 'min_impurity_decrease': 0.9488124455491256, 'max_features': 0.9995842706993948, 'subsample': 0.5606237137653332, 'dropout_rate': 0.3794965779859847, 'ccp_alpha': 2.089471747103536}. Best is trial 627 with value: 0.8808013426064705.[0m
[32m[I 2022-04-14 04:03:53,154][0m Trial 952 finished with value: 0.8552391667979098 and parameters: {'loss': 'coxph', 'learning_rate': 2.318804737901184e-05, 'n_estimators': 119, 'criterion': 'friedman_mse', 'min_samples_split': 2, 'min_samples_leaf': 3, 'min_weight_fraction_leaf': 0.04635836284529346, 'min_impurity_decrease': 0.35025647020803874, 'max_features': 0.9788503739162302, 'subsample': 0.7126674762032664, 'dropout_rate': 0.9909500889568166, 'ccp_alpha': 0.1753165630434301}. Best is trial 627 with value: 0.8808013426064705.[0m
[32m[I 2022-04-14 04:03:55,746][0m Trial 953 finished with value: 0.8657667556853834 and parameters: {'loss': 'coxph', 'learning_rate': 1.127129459553445e-05, 'n_estimators': 120, 'criterion': 'friedman_mse', 'min_samples_split': 2, 'min_samples_leaf': 3, 'min_weight_fraction_leaf': 0.04201745216228121, 'min_impurity_decrease': 0.3465838453317102, 'max_features': 0.9617018929149616, 'subsample': 0.6872025823699403, 'dropout_rate': 0.7770601708249261, 'ccp_alpha': 0.09479765923010647}. Best is trial 627 with value: 0.8808013426064705.[0m
[32m[I 2022-04-14 04:03:57,688][0m Trial 954 finished with value: 0.65 and parameters: {'loss': 'coxph', 'learning_rate': 7.845561910923886e-05, 'n_estimators': 124, 'criterion': 'absolute_error', 'min_samples_split': 2, 'min_samples_leaf': 3, 'min_weight_fraction_leaf': 0.051381084568440975, 'min_impurity_decrease': 0.7660816939935633, 'max_features': 0.9800551788114762, 'subsample': 0.7059772361205692, 'dropout_rate': 0.8557376861805456, 'ccp_alpha': 0.25492214436424043}. Best is trial 627 with value: 0.8808013426064705.[0m
[32m[I 2022-04-14 04:03:59,997][0m Trial 955 finished with value: 0.8752196422426135 and parameters: {'loss': 'coxph', 'learning_rate': 0.00010451142625279927, 'n_estimators': 127, 'criterion': 'friedman_mse', 'min_samples_split': 2, 'min_samples_leaf': 3, 'min_weight_fraction_leaf': 0.03670375034272466, 'min_impurity_decrease': 0.37364744259148186, 'max_features': 0.9522843012292971, 'subsample': 0.6774102454246842, 'dropout_rate': 0.407869647319229, 'ccp_alpha': 0.0018951958329348423}. Best is trial 627 with value: 0.8808013426064705.[0m
[32m[I 2022-04-14 04:04:02,766][0m Trial 956 finished with value: 0.8557374167174006 and parameters: {'loss': 'coxph', 'learning_rate': 0.004265561209463783, 'n_estimators': 113, 'criterion': 'friedman_mse', 'min_samples_split': 2, 'min_samples_leaf': 3, 'min_weight_fraction_leaf': 0.05694893599110724, 'min_impurity_decrease': 0.780759070586564, 'max_features': 0.949308306715456, 'subsample': 0.6608527725793897, 'dropout_rate': 0.8166865967732827, 'ccp_alpha': 0.1575880702885854}. Best is trial 627 with value: 0.8808013426064705.[0m
[32m[I 2022-04-14 04:04:04,527][0m Trial 957 finished with value: 0.8719402942758526 and parameters: {'loss': 'coxph', 'learning_rate': 0.007077045912404221, 'n_estimators': 124, 'criterion': 'friedman_mse', 'min_samples_split': 2, 'min_samples_leaf': 3, 'min_weight_fraction_leaf': 0.04660160442502942, 'min_impurity_decrease': 0.321711063714643, 'max_features': 0.9687579721327555, 'subsample': 0.7062316756912214, 'dropout_rate': 0.8419093736173155, 'ccp_alpha': 0.09355284546358081}. Best is trial 627 with value: 0.8808013426064705.[0m
[32m[I 2022-04-14 04:04:05,379][0m Trial 958 finished with value: 0.65 and parameters: {'loss': 'coxph', 'learning_rate': 0.0030135259056320823, 'n_estimators': 122, 'criterion': 'friedman_mse', 'min_samples_split': 2, 'min_samples_leaf': 3, 'min_weight_fraction_leaf': 0.03513735371868029, 'min_impurity_decrease': 0.3590736683288857, 'max_features': 0.9848539744778126, 'subsample': 0.7140107808526863, 'dropout_rate': 0.8974764216936841, 'ccp_alpha': 1.4963179307708454}. Best is trial 627 with value: 0.8808013426064705.[0m
[32m[I 2022-04-14 04:04:08,368][0m Trial 959 finished with value: 0.8657803477965448 and parameters: {'loss': 'coxph', 'learning_rate': 0.0033134692984401874, 'n_estimators': 128, 'criterion': 'friedman_mse', 'min_samples_split': 2, 'min_samples_leaf': 3, 'min_weight_fraction_leaf': 0.05818288074807633, 'min_impurity_decrease': 0.7457141083296326, 'max_features': 0.936546798710162, 'subsample': 0.6850613871189114, 'dropout_rate': 0.35565630485903404, 'ccp_alpha': 0.09115114941566932}. Best is trial 627 with value: 0.8808013426064705.[0m
[32m[I 2022-04-14 04:04:10,006][0m Trial 960 finished with value: 0.6524506958451449 and parameters: {'loss': 'coxph', 'learning_rate': 4.511688677356859e-06, 'n_estimators': 111, 'criterion': 'friedman_mse', 'min_samples_split': 2, 'min_samples_leaf': 3, 'min_weight_fraction_leaf': 0.04421443627183012, 'min_impurity_decrease': 0.8424618436859107, 'max_features': 0.9632002148968128, 'subsample': 0.7181440340727412, 'dropout_rate': 0.36640344349710774, 'ccp_alpha': 0.3769140890576886}. Best is trial 627 with value: 0.8808013426064705.[0m
[32m[I 2022-04-14 04:04:10,722][0m Trial 961 finished with value: 0.65 and parameters: {'loss': 'coxph', 'learning_rate': 0.005517809596836799, 'n_estimators': 122, 'criterion': 'squared_error', 'min_samples_split': 2, 'min_samples_leaf': 3, 'min_weight_fraction_leaf': 0.035932079724747074, 'min_impurity_decrease': 0.8210077071691313, 'max_features': 0.9994500931799595, 'subsample': 0.6456018788635413, 'dropout_rate': 0.9402362076748315, 'ccp_alpha': 2.263482778531937}. Best is trial 627 with value: 0.8808013426064705.[0m
