[32m[I 2022-04-14 09:03:49,286][0m Trial 243 finished with value: 0.7305838072788257 and parameters: {'loss': 'coxph', 'learning_rate': 0.001988204436162068, 'n_estimators': 931, 'criterion': 'squared_error', 'min_samples_split': 7, 'min_samples_leaf': 1, 'min_weight_fraction_leaf': 0.11155439906049493, 'min_impurity_decrease': 0.08335629032865853, 'max_features': 0.833440298299778, 'subsample': 0.5331737155594162, 'dropout_rate': 0.1539100023306863, 'ccp_alpha': 0.10132643745961221}. Best is trial 229 with value: 0.7437241350191778.[0m
[32m[I 2022-04-14 09:06:31,778][0m Trial 244 finished with value: 0.7417887313343682 and parameters: {'loss': 'coxph', 'learning_rate': 0.002200243652319358, 'n_estimators': 995, 'criterion': 'squared_error', 'min_samples_split': 7, 'min_samples_leaf': 1, 'min_weight_fraction_leaf': 0.09961845626428725, 'min_impurity_decrease': 0.05284393758413868, 'max_features': 0.8708319630955554, 'subsample': 0.5217713686733662, 'dropout_rate': 0.17204658891172483, 'ccp_alpha': 0.002495349445202521}. Best is trial 229 with value: 0.7437241350191778.[0m
[32m[I 2022-04-14 09:09:16,010][0m Trial 245 finished with value: 0.35922938377005076 and parameters: {'loss': 'squared', 'learning_rate': 0.0018221265696330615, 'n_estimators': 993, 'criterion': 'squared_error', 'min_samples_split': 7, 'min_samples_leaf': 1, 'min_weight_fraction_leaf': 0.08911542829581573, 'min_impurity_decrease': 0.033951088679943515, 'max_features': 0.8690864184372061, 'subsample': 0.5279978929030477, 'dropout_rate': 0.2069500055066719, 'ccp_alpha': 1.2270548071907748}. Best is trial 229 with value: 0.7437241350191778.[0m
[32m[I 2022-04-14 09:11:45,365][0m Trial 246 finished with value: 0.7233500439019979 and parameters: {'loss': 'coxph', 'learning_rate': 0.003281781881441996, 'n_estimators': 894, 'criterion': 'squared_error', 'min_samples_split': 7, 'min_samples_leaf': 1, 'min_weight_fraction_leaf': 0.1174293107491792, 'min_impurity_decrease': 0.1054241691223166, 'max_features': 0.8909872219822055, 'subsample': 0.4980244984517031, 'dropout_rate': 0.14552521888087044, 'ccp_alpha': 0.19510541271614912}. Best is trial 229 with value: 0.7437241350191778.[0m
[32m[I 2022-04-14 09:14:19,900][0m Trial 247 finished with value: 0.7323873169047924 and parameters: {'loss': 'coxph', 'learning_rate': 0.0024456481021113076, 'n_estimators': 930, 'criterion': 'squared_error', 'min_samples_split': 7, 'min_samples_leaf': 1, 'min_weight_fraction_leaf': 0.09702022973981701, 'min_impurity_decrease': 0.07330250363919472, 'max_features': 0.851755763880342, 'subsample': 0.5316626655348562, 'dropout_rate': 0.18971801240074748, 'ccp_alpha': 0.0978013627872034}. Best is trial 229 with value: 0.7437241350191778.[0m
[32m[I 2022-04-14 09:16:47,561][0m Trial 248 finished with value: 0.72619449808266 and parameters: {'loss': 'coxph', 'learning_rate': 0.0017555869338462084, 'n_estimators': 881, 'criterion': 'squared_error', 'min_samples_split': 7, 'min_samples_leaf': 1, 'min_weight_fraction_leaf': 0.08450255488087409, 'min_impurity_decrease': 0.05433947871043632, 'max_features': 0.9250866584872751, 'subsample': 0.503461186962103, 'dropout_rate': 0.12363471627020879, 'ccp_alpha': 0.16658096161057134}. Best is trial 229 with value: 0.7437241350191778.[0m
[32m[I 2022-04-14 09:19:22,991][0m Trial 249 finished with value: 0.7391674316251141 and parameters: {'loss': 'coxph', 'learning_rate': 0.0020814668505296165, 'n_estimators': 943, 'criterion': 'squared_error', 'min_samples_split': 7, 'min_samples_leaf': 1, 'min_weight_fraction_leaf': 0.10723608258952907, 'min_impurity_decrease': 0.033843932191969135, 'max_features': 0.8517041064173229, 'subsample': 0.567532812986704, 'dropout_rate': 0.16194789148479638, 'ccp_alpha': 0.07257791414356358}. Best is trial 229 with value: 0.7437241350191778.[0m
[32m[I 2022-04-14 09:21:49,379][0m Trial 250 finished with value: 0.5373821613241749 and parameters: {'loss': 'coxph', 'learning_rate': 0.004213121633728863, 'n_estimators': 902, 'criterion': 'absolute_error', 'min_samples_split': 7, 'min_samples_leaf': 1, 'min_weight_fraction_leaf': 0.12741117258529808, 'min_impurity_decrease': 0.028012287445618414, 'max_features': 0.8879677729326421, 'subsample': 0.5863351875206455, 'dropout_rate': 0.1396777245239858, 'ccp_alpha': 0.22558598769072793}. Best is trial 229 with value: 0.7437241350191778.[0m
[32m[I 2022-04-14 09:24:47,777][0m Trial 251 finished with value: 0.733678520346465 and parameters: {'loss': 'coxph', 'learning_rate': 0.0016646981614185192, 'n_estimators': 994, 'criterion': 'squared_error', 'min_samples_split': 7, 'min_samples_leaf': 1, 'min_weight_fraction_leaf': 0.11222812391429497, 'min_impurity_decrease': 0.04271930739437789, 'max_features': 0.8745615597478625, 'subsample': 0.5597704888924498, 'dropout_rate': 0.17963806678895103, 'ccp_alpha': 0.0011202971471266643}. Best is trial 229 with value: 0.7437241350191778.[0m
[32m[I 2022-04-14 09:27:26,079][0m Trial 252 finished with value: 0.7313345243879017 and parameters: {'loss': 'coxph', 'learning_rate': 0.0019194812242256047, 'n_estimators': 930, 'criterion': 'squared_error', 'min_samples_split': 7, 'min_samples_leaf': 1, 'min_weight_fraction_leaf': 0.08602757452925584, 'min_impurity_decrease': 0.09288758858116258, 'max_features': 0.8384347604431158, 'subsample': 0.5277812961114074, 'dropout_rate': 0.15582659179824895, 'ccp_alpha': 0.1112842309945486}. Best is trial 229 with value: 0.7437241350191778.[0m
[32m[I 2022-04-14 09:29:41,421][0m Trial 253 finished with value: 0.7237414501891987 and parameters: {'loss': 'coxph', 'learning_rate': 0.0030620360773249058, 'n_estimators': 878, 'criterion': 'squared_error', 'min_samples_split': 7, 'min_samples_leaf': 1, 'min_weight_fraction_leaf': 0.11022362881098557, 'min_impurity_decrease': 0.02128089187730692, 'max_features': 0.8467946509225996, 'subsample': 0.4862966221858025, 'dropout_rate': 0.20182011231665298, 'ccp_alpha': 0.14929518386125015}. Best is trial 229 with value: 0.7437241350191778.[0m
[32m[I 2022-04-14 09:32:37,117][0m Trial 254 finished with value: 0.7131452316602722 and parameters: {'loss': 'coxph', 'learning_rate': 0.001684469018990611, 'n_estimators': 999, 'criterion': 'squared_error', 'min_samples_split': 7, 'min_samples_leaf': 1, 'min_weight_fraction_leaf': 0.13989037257900702, 'min_impurity_decrease': 0.11197142538097232, 'max_features': 0.9105103320153579, 'subsample': 0.5666182179448996, 'dropout_rate': 0.11621618813718892, 'ccp_alpha': 0.33801994724998363}. Best is trial 229 with value: 0.7437241350191778.[0m
[32m[I 2022-04-14 09:35:07,194][0m Trial 255 finished with value: 0.5 and parameters: {'loss': 'coxph', 'learning_rate': 0.0013861959135341348, 'n_estimators': 933, 'criterion': 'squared_error', 'min_samples_split': 7, 'min_samples_leaf': 1, 'min_weight_fraction_leaf': 0.1026861455327975, 'min_impurity_decrease': 0.9773745779264362, 'max_features': 0.8272038588058049, 'subsample': 0.4956232091552037, 'dropout_rate': 0.16758558475323282, 'ccp_alpha': 0.10804068922174644}. Best is trial 229 with value: 0.7437241350191778.[0m
[32m[I 2022-04-14 09:37:16,868][0m Trial 256 finished with value: 0.7016783309727468 and parameters: {'loss': 'coxph', 'learning_rate': 0.002258982154499018, 'n_estimators': 867, 'criterion': 'squared_error', 'min_samples_split': 7, 'min_samples_leaf': 1, 'min_weight_fraction_leaf': 0.29634294251280846, 'min_impurity_decrease': 0.07661750534967532, 'max_features': 0.8731015704363501, 'subsample': 0.5581509873979403, 'dropout_rate': 0.13383817846677298, 'ccp_alpha': 0.23102882252241924}. Best is trial 229 with value: 0.7437241350191778.[0m
[32m[I 2022-04-14 09:39:43,071][0m Trial 257 finished with value: 0.7342953944551622 and parameters: {'loss': 'coxph', 'learning_rate': 0.001609659148705715, 'n_estimators': 905, 'criterion': 'squared_error', 'min_samples_split': 7, 'min_samples_leaf': 1, 'min_weight_fraction_leaf': 0.09254438757322393, 'min_impurity_decrease': 0.04265116838282723, 'max_features': 0.8503614416486728, 'subsample': 0.5354750962598405, 'dropout_rate': 0.18870296564451108, 'ccp_alpha': 0.0012541985801590985}. Best is trial 229 with value: 0.7437241350191778.[0m
[32m[I 2022-04-14 09:42:23,039][0m Trial 258 finished with value: 0.7363332385028478 and parameters: {'loss': 'coxph', 'learning_rate': 0.0038881300114543657, 'n_estimators': 945, 'criterion': 'squared_error', 'min_samples_split': 7, 'min_samples_leaf': 1, 'min_weight_fraction_leaf': 0.08180502330833431, 'min_impurity_decrease': 0.018524664292143153, 'max_features': 0.8167028833586196, 'subsample': 0.5027946867197965, 'dropout_rate': 0.15421658248504594, 'ccp_alpha': 0.09629485072252315}. Best is trial 229 with value: 0.7437241350191778.[0m
[32m[I 2022-04-14 09:45:15,159][0m Trial 259 finished with value: 0.5 and parameters: {'loss': 'coxph', 'learning_rate': 0.00402716158865987, 'n_estimators': 952, 'criterion': 'squared_error', 'min_samples_split': 7, 'min_samples_leaf': 1, 'min_weight_fraction_leaf': 0.02488016579347706, 'min_impurity_decrease': 0.006166497112900765, 'max_features': 0.8978089118884259, 'subsample': 0.5085794276317581, 'dropout_rate': 0.15586676292224189, 'ccp_alpha': 2.799749644166237}. Best is trial 229 with value: 0.7437241350191778.[0m
[32m[I 2022-04-14 09:48:17,847][0m Trial 260 finished with value: 0.7196757863643766 and parameters: {'loss': 'coxph', 'learning_rate': 0.0030986214200614016, 'n_estimators': 999, 'criterion': 'squared_error', 'min_samples_split': 8, 'min_samples_leaf': 1, 'min_weight_fraction_leaf': 0.12069891068073307, 'min_impurity_decrease': 0.001757189395972858, 'max_features': 0.8130044286302522, 'subsample': 0.5274007326294805, 'dropout_rate': 0.2078737389064704, 'ccp_alpha': 0.23234885786373974}. Best is trial 229 with value: 0.7437241350191778.[0m
[32m[I 2022-04-14 09:50:35,939][0m Trial 261 finished with value: 0.6115039095839713 and parameters: {'loss': 'coxph', 'learning_rate': 0.0044562570123340035, 'n_estimators': 909, 'criterion': 'squared_error', 'min_samples_split': 7, 'min_samples_leaf': 1, 'min_weight_fraction_leaf': 0.08509548911209487, 'min_impurity_decrease': 0.43354561487485066, 'max_features': 0.8619851120557838, 'subsample': 0.5004541037024424, 'dropout_rate': 0.17586013462068611, 'ccp_alpha': 0.12157497702271214}. Best is trial 229 with value: 0.7437241350191778.[0m
[32m[I 2022-04-14 09:53:41,202][0m Trial 262 finished with value: 0.6977130328712925 and parameters: {'loss': 'coxph', 'learning_rate': 0.002073762663962437, 'n_estimators': 948, 'criterion': 'squared_error', 'min_samples_split': 7, 'min_samples_leaf': 1, 'min_weight_fraction_leaf': 0.09206046877321813, 'min_impurity_decrease': 0.02668178247110305, 'max_features': 0.8226505430704629, 'subsample': 0.5431544354934524, 'dropout_rate': 0.14371623848161783, 'ccp_alpha': 0.34367175738828815}. Best is trial 229 with value: 0.7437241350191778.[0m
[32m[I 2022-04-14 09:56:04,398][0m Trial 263 finished with value: 0.7351724671551584 and parameters: {'loss': 'coxph', 'learning_rate': 0.0033940118833036977, 'n_estimators': 878, 'criterion': 'squared_error', 'min_samples_split': 7, 'min_samples_leaf': 1, 'min_weight_fraction_leaf': 0.10741062311724227, 'min_impurity_decrease': 0.045957526661940376, 'max_features': 0.8451212824348894, 'subsample': 0.5687332131988531, 'dropout_rate': 0.18600828864458202, 'ccp_alpha': 0.08483950807330601}. Best is trial 229 with value: 0.7437241350191778.[0m
[32m[I 2022-04-14 09:58:27,660][0m Trial 264 finished with value: 0.36190816905281703 and parameters: {'loss': 'squared', 'learning_rate': 0.0028428721773343193, 'n_estimators': 880, 'criterion': 'squared_error', 'min_samples_split': 7, 'min_samples_leaf': 1, 'min_weight_fraction_leaf': 0.4199912565655391, 'min_impurity_decrease': 0.05639072170179098, 'max_features': 0.8417441888675552, 'subsample': 0.5676397172511645, 'dropout_rate': 0.22811716177821867, 'ccp_alpha': 0.0012383294278449537}. Best is trial 229 with value: 0.7437241350191778.[0m
[32m[I 2022-04-14 10:01:00,679][0m Trial 265 finished with value: 0.7324058369725182 and parameters: {'loss': 'coxph', 'learning_rate': 0.005431403215520652, 'n_estimators': 936, 'criterion': 'squared_error', 'min_samples_split': 7, 'min_samples_leaf': 1, 'min_weight_fraction_leaf': 0.13342955881511342, 'min_impurity_decrease': 0.03698013738856195, 'max_features': 0.870232417817666, 'subsample': 0.5817216963116101, 'dropout_rate': 0.20100754871154214, 'ccp_alpha': 0.18739118281702724}. Best is trial 229 with value: 0.7437241350191778.[0m
[32m[I 2022-04-14 10:03:18,030][0m Trial 266 finished with value: 0.5 and parameters: {'loss': 'coxph', 'learning_rate': 0.0034617900633429717, 'n_estimators': 873, 'criterion': 'squared_error', 'min_samples_split': 8, 'min_samples_leaf': 1, 'min_weight_fraction_leaf': 0.0959013852940859, 'min_impurity_decrease': 0.07109418292056909, 'max_features': 0.9410748112527743, 'subsample': 0.6043678865029696, 'dropout_rate': 0.18105716652674095, 'ccp_alpha': 4.7016174290862}. Best is trial 229 with value: 0.7437241350191778.[0m
[32m[I 2022-04-14 10:05:40,649][0m Trial 267 finished with value: 0.7364101705414622 and parameters: {'loss': 'coxph', 'learning_rate': 0.003771148087157537, 'n_estimators': 905, 'criterion': 'squared_error', 'min_samples_split': 7, 'min_samples_leaf': 1, 'min_weight_fraction_leaf': 0.07860236772595167, 'min_impurity_decrease': 0.047482141855742566, 'max_features': 0.8184659711851854, 'subsample': 0.5580195183998463, 'dropout_rate': 0.18827302923842193, 'ccp_alpha': 0.09001581729365273}. Best is trial 229 with value: 0.7437241350191778.[0m
[32m[I 2022-04-14 10:08:15,898][0m Trial 268 finished with value: 0.5 and parameters: {'loss': 'coxph', 'learning_rate': 0.0042292462689604345, 'n_estimators': 907, 'criterion': 'squared_error', 'min_samples_split': 7, 'min_samples_leaf': 1, 'min_weight_fraction_leaf': 0.06118669454114775, 'min_impurity_decrease': 0.09608681181392023, 'max_features': 0.8243362793811525, 'subsample': 0.5568024137408052, 'dropout_rate': 0.20617477276795362, 'ccp_alpha': 1.8599090568058154}. Best is trial 229 with value: 0.7437241350191778.[0m
[32m[I 2022-04-14 10:11:01,601][0m Trial 269 finished with value: 0.721342882133724 and parameters: {'loss': 'coxph', 'learning_rate': 0.003528486338045017, 'n_estimators': 960, 'criterion': 'squared_error', 'min_samples_split': 7, 'min_samples_leaf': 1, 'min_weight_fraction_leaf': 0.0776134361059958, 'min_impurity_decrease': 0.11887402615315065, 'max_features': 0.8488395574671943, 'subsample': 0.5355485074067312, 'dropout_rate': 0.18788977973881268, 'ccp_alpha': 0.23244031025518985}. Best is trial 229 with value: 0.7437241350191778.[0m
[32m[I 2022-04-14 10:13:35,778][0m Trial 270 finished with value: 0.7208927461587752 and parameters: {'loss': 'coxph', 'learning_rate': 0.0027154245975818813, 'n_estimators': 908, 'criterion': 'squared_error', 'min_samples_split': 7, 'min_samples_leaf': 1, 'min_weight_fraction_leaf': 0.038146402097379184, 'min_impurity_decrease': 0.025376348087387174, 'max_features': 0.8851827616780217, 'subsample': 0.5699363994891269, 'dropout_rate': 0.16771425375052815, 'ccp_alpha': 0.09601542286602319}. Best is trial 229 with value: 0.7437241350191778.[0m
[32m[I 2022-04-14 10:15:38,602][0m Trial 271 finished with value: 0.6774156268593092 and parameters: {'loss': 'coxph', 'learning_rate': 0.005409633291781229, 'n_estimators': 858, 'criterion': 'squared_error', 'min_samples_split': 7, 'min_samples_leaf': 9, 'min_weight_fraction_leaf': 0.08518995180286902, 'min_impurity_decrease': 0.06752015797888189, 'max_features': 0.8263501835090404, 'subsample': 0.554984345290135, 'dropout_rate': 0.22154190507092683, 'ccp_alpha': 0.30285775075825794}. Best is trial 229 with value: 0.7437241350191778.[0m
[32m[I 2022-04-14 10:18:20,613][0m Trial 272 finished with value: 0.7050432418764032 and parameters: {'loss': 'coxph', 'learning_rate': 0.0022763925629524077, 'n_estimators': 956, 'criterion': 'absolute_error', 'min_samples_split': 7, 'min_samples_leaf': 1, 'min_weight_fraction_leaf': 0.07989843550102564, 'min_impurity_decrease': 0.04644733958666092, 'max_features': 0.29596358263942557, 'subsample': 0.5273454616395381, 'dropout_rate': 0.23811520154015517, 'ccp_alpha': 0.1804715801224074}. Best is trial 229 with value: 0.7437241350191778.[0m
[32m[I 2022-04-14 10:20:45,092][0m Trial 273 finished with value: 0.694268280526851 and parameters: {'loss': 'coxph', 'learning_rate': 0.0036001359620926143, 'n_estimators': 894, 'criterion': 'squared_error', 'min_samples_split': 7, 'min_samples_leaf': 1, 'min_weight_fraction_leaf': 0.34483688029900744, 'min_impurity_decrease': 0.08323597420142816, 'max_features': 0.8586094845447223, 'subsample': 0.5160783789146232, 'dropout_rate': 0.1898180813649324, 'ccp_alpha': 0.09707995832122494}. Best is trial 229 with value: 0.7437241350191778.[0m
[32m[I 2022-04-14 10:23:49,580][0m Trial 274 finished with value: 0.5 and parameters: {'loss': 'coxph', 'learning_rate': 0.002919759502596762, 'n_estimators': 969, 'criterion': 'friedman_mse', 'min_samples_split': 7, 'min_samples_leaf': 1, 'min_weight_fraction_leaf': 0.06690810816718955, 'min_impurity_decrease': 0.05803470522535249, 'max_features': 0.8090723629856293, 'subsample': 0.5954291919634394, 'dropout_rate': 0.13242721853289652, 'ccp_alpha': 3.055554546809274}. Best is trial 229 with value: 0.7437241350191778.[0m
[32m[I 2022-04-14 10:26:30,947][0m Trial 275 finished with value: 0.6819515217654984 and parameters: {'loss': 'coxph', 'learning_rate': 0.0020055312351027702, 'n_estimators': 922, 'criterion': 'squared_error', 'min_samples_split': 8, 'min_samples_leaf': 1, 'min_weight_fraction_leaf': 0.09454162455415137, 'min_impurity_decrease': 0.024417080185366168, 'max_features': 0.8398233237636492, 'subsample': 0.5433526015142341, 'dropout_rate': 0.17338215019857303, 'ccp_alpha': 0.35925231333382346}. Best is trial 229 with value: 0.7437241350191778.[0m
[32m[I 2022-04-14 10:28:55,324][0m Trial 276 finished with value: 0.5 and parameters: {'loss': 'coxph', 'learning_rate': 0.0014995676960691806, 'n_estimators': 870, 'criterion': 'squared_error', 'min_samples_split': 7, 'min_samples_leaf': 1, 'min_weight_fraction_leaf': 0.08470269435714943, 'min_impurity_decrease': 0.10029916777260556, 'max_features': 0.88067485550095, 'subsample': 0.49282075404137604, 'dropout_rate': 0.20687060652607403, 'ccp_alpha': 3.655021886918644}. Best is trial 229 with value: 0.7437241350191778.[0m
[32m[I 2022-04-14 10:31:23,473][0m Trial 277 finished with value: 0.7319413949238782 and parameters: {'loss': 'coxph', 'learning_rate': 0.004737457885417694, 'n_estimators': 851, 'criterion': 'squared_error', 'min_samples_split': 7, 'min_samples_leaf': 1, 'min_weight_fraction_leaf': 0.04584310041619785, 'min_impurity_decrease': 0.07189990181978627, 'max_features': 0.8171000996765498, 'subsample': 0.5140165192519485, 'dropout_rate': 0.1623180397019707, 'ccp_alpha': 0.0013017984312303098}. Best is trial 229 with value: 0.7437241350191778.[0m
[32m[I 2022-04-14 10:34:21,559][0m Trial 278 finished with value: 0.5 and parameters: {'loss': 'coxph', 'learning_rate': 0.0019986514627710057, 'n_estimators': 942, 'criterion': 'squared_error', 'min_samples_split': 7, 'min_samples_leaf': 1, 'min_weight_fraction_leaf': 0.05614090692153487, 'min_impurity_decrease': 0.12055601973084575, 'max_features': 0.8626524896490673, 'subsample': 0.5714894170412033, 'dropout_rate': 0.1182456774049043, 'ccp_alpha': 2.3970255811410284}. Best is trial 229 with value: 0.7437241350191778.[0m
[32m[I 2022-04-14 10:37:26,716][0m Trial 279 finished with value: 0.728109194099803 and parameters: {'loss': 'coxph', 'learning_rate': 0.0027116602638318364, 'n_estimators': 1000, 'criterion': 'squared_error', 'min_samples_split': 7, 'min_samples_leaf': 1, 'min_weight_fraction_leaf': 0.0700127455106157, 'min_impurity_decrease': 0.04475321225733632, 'max_features': 0.8328534827903782, 'subsample': 0.5377852771433996, 'dropout_rate': 0.1928118590847743, 'ccp_alpha': 0.16490412523055664}. Best is trial 229 with value: 0.7437241350191778.[0m
[32m[I 2022-04-14 10:39:55,112][0m Trial 280 finished with value: 0.5 and parameters: {'loss': 'coxph', 'learning_rate': 0.0012715377200054523, 'n_estimators': 913, 'criterion': 'squared_error', 'min_samples_split': 7, 'min_samples_leaf': 1, 'min_weight_fraction_leaf': 0.09670622110494173, 'min_impurity_decrease': 0.37240313394328084, 'max_features': 0.9026764618633436, 'subsample': 0.872899272528258, 'dropout_rate': 0.1412014721047335, 'ccp_alpha': 0.09688525909452277}. Best is trial 229 with value: 0.7437241350191778.[0m
[32m[I 2022-04-14 10:41:59,942][0m Trial 281 finished with value: 0.5 and parameters: {'loss': 'coxph', 'learning_rate': 0.0016222149508556118, 'n_estimators': 858, 'criterion': 'squared_error', 'min_samples_split': 7, 'min_samples_leaf': 1, 'min_weight_fraction_leaf': 0.02828822064208309, 'min_impurity_decrease': 0.7591138645545765, 'max_features': 0.8092383808829441, 'subsample': 0.49524551609205475, 'dropout_rate': 0.16828067986979095, 'ccp_alpha': 0.2514291051728589}. Best is trial 229 with value: 0.7437241350191778.[0m
[32m[I 2022-04-14 10:44:32,706][0m Trial 282 finished with value: 0.7249996382231244 and parameters: {'loss': 'coxph', 'learning_rate': 0.003920895031783843, 'n_estimators': 958, 'criterion': 'squared_error', 'min_samples_split': 7, 'min_samples_leaf': 1, 'min_weight_fraction_leaf': 0.10372628084624735, 'min_impurity_decrease': 0.08879023440993082, 'max_features': 0.8403727137631049, 'subsample': 0.5181006899813355, 'dropout_rate': 0.21875269191064214, 'ccp_alpha': 0.10164385509916693}. Best is trial 229 with value: 0.7437241350191778.[0m
