[32m[I 2022-04-13 11:50:30,902][0m Trial 826 finished with value: 0.7296437365326369 and parameters: {'alpha': 2.1437948576691825, 'ties': 'efron'}. Best is trial 63 with value: 0.7309739795612015.[0m
[32m[I 2022-04-13 11:50:31,096][0m Trial 827 finished with value: 0.723532189469167 and parameters: {'alpha': 1.1977127004518986, 'ties': 'efron'}. Best is trial 63 with value: 0.7309739795612015.[0m
[32m[I 2022-04-13 11:50:31,448][0m Trial 828 finished with value: 0.729697264326865 and parameters: {'alpha': 2.331963173825654, 'ties': 'efron'}. Best is trial 63 with value: 0.7309739795612015.[0m
[32m[I 2022-04-13 11:50:31,803][0m Trial 829 finished with value: 0.7296437365326369 and parameters: {'alpha': 2.1807622953220513, 'ties': 'efron'}. Best is trial 63 with value: 0.7309739795612015.[0m
[32m[I 2022-04-13 11:50:32,181][0m Trial 830 finished with value: 0.729697264326865 and parameters: {'alpha': 2.4626031890983495, 'ties': 'efron'}. Best is trial 63 with value: 0.7309739795612015.[0m
[32m[I 2022-04-13 11:50:32,414][0m Trial 831 finished with value: 0.7286259651218314 and parameters: {'alpha': 2.231000261850489, 'ties': 'efron'}. Best is trial 63 with value: 0.7309739795612015.[0m
[32m[I 2022-04-13 11:50:32,665][0m Trial 832 finished with value: 0.729697264326865 and parameters: {'alpha': 2.336252213666424, 'ties': 'efron'}. Best is trial 63 with value: 0.7309739795612015.[0m
[32m[I 2022-04-13 11:50:32,772][0m Trial 833 finished with value: 0.7286259651218314 and parameters: {'alpha': 2.259973938135335, 'ties': 'efron'}. Best is trial 63 with value: 0.7309739795612015.[0m
[32m[I 2022-04-13 11:50:33,041][0m Trial 834 finished with value: 0.729697264326865 and parameters: {'alpha': 2.5177405483444475, 'ties': 'efron'}. Best is trial 63 with value: 0.7309739795612015.[0m
[32m[I 2022-04-13 11:50:33,233][0m Trial 835 finished with value: 0.7308171886403182 and parameters: {'alpha': 2.065163614236449, 'ties': 'efron'}. Best is trial 63 with value: 0.7309739795612015.[0m
[32m[I 2022-04-13 11:50:33,502][0m Trial 836 finished with value: 0.7309739795612015 and parameters: {'alpha': 2.282761470348411, 'ties': 'efron'}. Best is trial 63 with value: 0.7309739795612015.[0m
[32m[I 2022-04-13 11:50:33,638][0m Trial 837 finished with value: 0.729697264326865 and parameters: {'alpha': 2.44061510738567, 'ties': 'efron'}. Best is trial 63 with value: 0.7309739795612015.[0m
[32m[I 2022-04-13 11:50:33,859][0m Trial 838 finished with value: 0.7296437365326369 and parameters: {'alpha': 2.187438333381378, 'ties': 'efron'}. Best is trial 63 with value: 0.7309739795612015.[0m
[32m[I 2022-04-13 11:50:33,942][0m Trial 839 finished with value: 0.7283670212983004 and parameters: {'alpha': 2.1084449350072987, 'ties': 'breslow'}. Best is trial 63 with value: 0.7309739795612015.[0m
[32m[I 2022-04-13 11:50:34,035][0m Trial 840 finished with value: 0.729697264326865 and parameters: {'alpha': 2.3971622945365105, 'ties': 'efron'}. Best is trial 63 with value: 0.7309739795612015.[0m
[32m[I 2022-04-13 11:50:34,290][0m Trial 841 finished with value: 0.729697264326865 and parameters: {'alpha': 2.5703670692317564, 'ties': 'efron'}. Best is trial 63 with value: 0.7309739795612015.[0m
[32m[I 2022-04-13 11:50:34,475][0m Trial 842 finished with value: 0.729697264326865 and parameters: {'alpha': 2.3312174508422503, 'ties': 'efron'}. Best is trial 63 with value: 0.7309739795612015.[0m
[32m[I 2022-04-13 11:50:34,708][0m Trial 843 finished with value: 0.729697264326865 and parameters: {'alpha': 2.4816752565940976, 'ties': 'efron'}. Best is trial 63 with value: 0.7309739795612015.[0m
[32m[I 2022-04-13 11:50:34,831][0m Trial 844 finished with value: 0.7309739795612015 and parameters: {'alpha': 2.32447170547144, 'ties': 'efron'}. Best is trial 63 with value: 0.7309739795612015.[0m
[32m[I 2022-04-13 11:50:35,001][0m Trial 845 finished with value: 0.7286259651218314 and parameters: {'alpha': 2.251133297060157, 'ties': 'breslow'}. Best is trial 63 with value: 0.7309739795612015.[0m
[32m[I 2022-04-13 11:50:35,094][0m Trial 846 finished with value: 0.729697264326865 and parameters: {'alpha': 2.4047227635698456, 'ties': 'efron'}. Best is trial 63 with value: 0.7309739795612015.[0m
[32m[I 2022-04-13 11:50:35,180][0m Trial 847 finished with value: 0.729697264326865 and parameters: {'alpha': 2.327765490895864, 'ties': 'efron'}. Best is trial 63 with value: 0.7309739795612015.[0m
[32m[I 2022-04-13 11:50:35,276][0m Trial 848 finished with value: 0.7266957640961634 and parameters: {'alpha': 1.9051231451363295, 'ties': 'efron'}. Best is trial 63 with value: 0.7309739795612015.[0m
[32m[I 2022-04-13 11:50:35,510][0m Trial 849 finished with value: 0.7296437365326369 and parameters: {'alpha': 2.1621430387639817, 'ties': 'efron'}. Best is trial 63 with value: 0.7309739795612015.[0m
[32m[I 2022-04-13 11:50:35,597][0m Trial 850 finished with value: 0.729697264326865 and parameters: {'alpha': 2.4888233826710153, 'ties': 'efron'}. Best is trial 63 with value: 0.7309739795612015.[0m
[32m[I 2022-04-13 11:50:35,878][0m Trial 851 finished with value: 0.7283670212983004 and parameters: {'alpha': 2.1167018894734455, 'ties': 'breslow'}. Best is trial 63 with value: 0.7309739795612015.[0m
[32m[I 2022-04-13 11:50:36,102][0m Trial 852 finished with value: 0.7285238122191837 and parameters: {'alpha': 2.669284370642479, 'ties': 'efron'}. Best is trial 63 with value: 0.7309739795612015.[0m
[32m[I 2022-04-13 11:50:36,330][0m Trial 853 finished with value: 0.729697264326865 and parameters: {'alpha': 2.3799015905807863, 'ties': 'efron'}. Best is trial 63 with value: 0.7309739795612015.[0m
[32m[I 2022-04-13 11:50:36,419][0m Trial 854 finished with value: 0.7286259651218314 and parameters: {'alpha': 2.247802819834193, 'ties': 'efron'}. Best is trial 63 with value: 0.7309739795612015.[0m
[32m[I 2022-04-13 11:50:36,617][0m Trial 855 finished with value: 0.7308171886403182 and parameters: {'alpha': 2.046723579202529, 'ties': 'efron'}. Best is trial 63 with value: 0.7309739795612015.[0m
[32m[I 2022-04-13 11:50:36,714][0m Trial 856 finished with value: 0.7279666657613922 and parameters: {'alpha': 2.541625309982155, 'ties': 'breslow'}. Best is trial 63 with value: 0.7309739795612015.[0m
[32m[I 2022-04-13 11:50:36,801][0m Trial 857 finished with value: 0.7309739795612015 and parameters: {'alpha': 2.2858502224436235, 'ties': 'efron'}. Best is trial 63 with value: 0.7309739795612015.[0m
[32m[I 2022-04-13 11:50:37,007][0m Trial 858 finished with value: 0.7308171886403182 and parameters: {'alpha': 2.006762174730078, 'ties': 'efron'}. Best is trial 63 with value: 0.7309739795612015.[0m
[32m[I 2022-04-13 11:50:37,174][0m Trial 859 finished with value: 0.7286259651218314 and parameters: {'alpha': 2.200552783715872, 'ties': 'efron'}. Best is trial 63 with value: 0.7309739795612015.[0m
[32m[I 2022-04-13 11:50:37,441][0m Trial 860 finished with value: 0.729697264326865 and parameters: {'alpha': 2.4205077201869556, 'ties': 'efron'}. Best is trial 63 with value: 0.7309739795612015.[0m
[32m[I 2022-04-13 11:50:37,521][0m Trial 861 finished with value: 0.729697264326865 and parameters: {'alpha': 2.4263007324991537, 'ties': 'breslow'}. Best is trial 63 with value: 0.7309739795612015.[0m
[32m[I 2022-04-13 11:50:37,625][0m Trial 862 finished with value: 0.7279666657613922 and parameters: {'alpha': 2.591691399428088, 'ties': 'breslow'}. Best is trial 63 with value: 0.7309739795612015.[0m
[32m[I 2022-04-13 11:50:37,813][0m Trial 863 finished with value: 0.7286259651218314 and parameters: {'alpha': 2.242574414421586, 'ties': 'efron'}. Best is trial 63 with value: 0.7309739795612015.[0m
[32m[I 2022-04-13 11:50:37,959][0m Trial 864 finished with value: 0.7283670212983004 and parameters: {'alpha': 2.1244586902900857, 'ties': 'breslow'}. Best is trial 63 with value: 0.7309739795612015.[0m
[32m[I 2022-04-13 11:50:38,260][0m Trial 865 finished with value: 0.7286259651218314 and parameters: {'alpha': 2.2633272983008554, 'ties': 'efron'}. Best is trial 63 with value: 0.7309739795612015.[0m
[32m[I 2022-04-13 11:50:38,825][0m Trial 866 finished with value: 0.7308171886403182 and parameters: {'alpha': 2.062823839519876, 'ties': 'efron'}. Best is trial 63 with value: 0.7309739795612015.[0m
[32m[I 2022-04-13 11:50:39,275][0m Trial 867 finished with value: 0.7309739795612015 and parameters: {'alpha': 2.3159599664780166, 'ties': 'efron'}. Best is trial 63 with value: 0.7309739795612015.[0m
[32m[I 2022-04-13 11:50:39,439][0m Trial 868 finished with value: 0.7283670212983004 and parameters: {'alpha': 2.173380511864695, 'ties': 'breslow'}. Best is trial 63 with value: 0.7309739795612015.[0m
[32m[I 2022-04-13 11:50:39,874][0m Trial 869 finished with value: 0.729697264326865 and parameters: {'alpha': 2.391933304555229, 'ties': 'efron'}. Best is trial 63 with value: 0.7309739795612015.[0m
[32m[I 2022-04-13 11:50:40,117][0m Trial 870 finished with value: 0.729697264326865 and parameters: {'alpha': 2.51897223049762, 'ties': 'breslow'}. Best is trial 63 with value: 0.7309739795612015.[0m
[32m[I 2022-04-13 11:50:40,444][0m Trial 871 finished with value: 0.729697264326865 and parameters: {'alpha': 2.409946556339006, 'ties': 'efron'}. Best is trial 63 with value: 0.7309739795612015.[0m
[32m[I 2022-04-13 11:50:40,540][0m Trial 872 finished with value: 0.729697264326865 and parameters: {'alpha': 2.354698372630789, 'ties': 'efron'}. Best is trial 63 with value: 0.7309739795612015.[0m
[32m[I 2022-04-13 11:50:40,733][0m Trial 873 finished with value: 0.7308171886403182 and parameters: {'alpha': 1.9633777281584546, 'ties': 'breslow'}. Best is trial 63 with value: 0.7309739795612015.[0m
[32m[I 2022-04-13 11:50:41,116][0m Trial 874 finished with value: 0.7286259651218314 and parameters: {'alpha': 2.198001435882363, 'ties': 'efron'}. Best is trial 63 with value: 0.7309739795612015.[0m
[32m[I 2022-04-13 11:50:41,375][0m Trial 875 finished with value: 0.729697264326865 and parameters: {'alpha': 2.3278528780921137, 'ties': 'efron'}. Best is trial 63 with value: 0.7309739795612015.[0m
[32m[I 2022-04-13 11:50:41,711][0m Trial 876 finished with value: 0.7286259651218314 and parameters: {'alpha': 2.198865238405757, 'ties': 'efron'}. Best is trial 63 with value: 0.7309739795612015.[0m
[32m[I 2022-04-13 11:50:42,041][0m Trial 877 finished with value: 0.7246019901352241 and parameters: {'alpha': 2.789375004372767, 'ties': 'efron'}. Best is trial 63 with value: 0.7309739795612015.[0m
[32m[I 2022-04-13 11:50:42,242][0m Trial 878 finished with value: 0.7283670212983004 and parameters: {'alpha': 2.1153660873357536, 'ties': 'efron'}. Best is trial 63 with value: 0.7309739795612015.[0m
[32m[I 2022-04-13 11:50:42,490][0m Trial 879 finished with value: 0.7309739795612015 and parameters: {'alpha': 2.3229086261112046, 'ties': 'efron'}. Best is trial 63 with value: 0.7309739795612015.[0m
[32m[I 2022-04-13 11:50:42,826][0m Trial 880 finished with value: 0.729697264326865 and parameters: {'alpha': 2.453965536536007, 'ties': 'efron'}. Best is trial 63 with value: 0.7309739795612015.[0m
[32m[I 2022-04-13 11:50:43,158][0m Trial 881 finished with value: 0.729697264326865 and parameters: {'alpha': 2.5696245570442153, 'ties': 'efron'}. Best is trial 63 with value: 0.7309739795612015.[0m
[32m[I 2022-04-13 11:50:43,501][0m Trial 882 finished with value: 0.729697264326865 and parameters: {'alpha': 2.4938097693560235, 'ties': 'efron'}. Best is trial 63 with value: 0.7309739795612015.[0m
[32m[I 2022-04-13 11:50:43,852][0m Trial 883 finished with value: 0.7286259651218314 and parameters: {'alpha': 2.2765778506460688, 'ties': 'efron'}. Best is trial 63 with value: 0.7309739795612015.[0m
[32m[I 2022-04-13 11:50:44,167][0m Trial 884 finished with value: 0.729697264326865 and parameters: {'alpha': 2.381341654473016, 'ties': 'efron'}. Best is trial 63 with value: 0.7309739795612015.[0m
[32m[I 2022-04-13 11:50:44,494][0m Trial 885 finished with value: 0.7286259651218314 and parameters: {'alpha': 2.280207532721039, 'ties': 'efron'}. Best is trial 63 with value: 0.7309739795612015.[0m
[32m[I 2022-04-13 11:50:44,711][0m Trial 886 finished with value: 0.7286259651218314 and parameters: {'alpha': 2.20342457067128, 'ties': 'efron'}. Best is trial 63 with value: 0.7309739795612015.[0m
[32m[I 2022-04-13 11:50:44,935][0m Trial 887 finished with value: 0.7308171886403182 and parameters: {'alpha': 2.046039118650604, 'ties': 'efron'}. Best is trial 63 with value: 0.7309739795612015.[0m
[32m[I 2022-04-13 11:50:45,142][0m Trial 888 finished with value: 0.7296437365326369 and parameters: {'alpha': 2.16259071093533, 'ties': 'efron'}. Best is trial 63 with value: 0.7309739795612015.[0m
[32m[I 2022-04-13 11:50:45,336][0m Trial 889 finished with value: 0.7286259651218314 and parameters: {'alpha': 2.2351613691073844, 'ties': 'efron'}. Best is trial 63 with value: 0.7309739795612015.[0m
[32m[I 2022-04-13 11:50:45,535][0m Trial 890 finished with value: 0.729697264326865 and parameters: {'alpha': 2.419238098910723, 'ties': 'efron'}. Best is trial 63 with value: 0.7309739795612015.[0m
[32m[I 2022-04-13 11:50:45,652][0m Trial 891 finished with value: 0.729697264326865 and parameters: {'alpha': 2.58012400463496, 'ties': 'efron'}. Best is trial 63 with value: 0.7309739795612015.[0m
[32m[I 2022-04-13 11:50:45,998][0m Trial 892 finished with value: 0.7309739795612015 and parameters: {'alpha': 2.3155121091272846, 'ties': 'efron'}. Best is trial 63 with value: 0.7309739795612015.[0m
[32m[I 2022-04-13 11:50:46,345][0m Trial 893 finished with value: 0.729697264326865 and parameters: {'alpha': 2.484574825701176, 'ties': 'breslow'}. Best is trial 63 with value: 0.7309739795612015.[0m
[32m[I 2022-04-13 11:50:46,456][0m Trial 894 finished with value: 0.7266957640961634 and parameters: {'alpha': 1.9046983975876628, 'ties': 'efron'}. Best is trial 63 with value: 0.7309739795612015.[0m
[32m[I 2022-04-13 11:50:46,542][0m Trial 895 finished with value: 0.7295404734059817 and parameters: {'alpha': 2.1086724927056513, 'ties': 'efron'}. Best is trial 63 with value: 0.7309739795612015.[0m
[32m[I 2022-04-13 11:50:46,635][0m Trial 896 finished with value: 0.729697264326865 and parameters: {'alpha': 2.512465980850534, 'ties': 'efron'}. Best is trial 63 with value: 0.7309739795612015.[0m
[32m[I 2022-04-13 11:50:46,909][0m Trial 897 finished with value: 0.7286259651218314 and parameters: {'alpha': 2.197336047242709, 'ties': 'efron'}. Best is trial 63 with value: 0.7309739795612015.[0m
[32m[I 2022-04-13 11:50:47,076][0m Trial 898 finished with value: 0.7309739795612015 and parameters: {'alpha': 2.310448449618306, 'ties': 'breslow'}. Best is trial 63 with value: 0.7309739795612015.[0m
[32m[I 2022-04-13 11:50:47,342][0m Trial 899 finished with value: 0.729697264326865 and parameters: {'alpha': 2.3910811472351257, 'ties': 'efron'}. Best is trial 63 with value: 0.7309739795612015.[0m
[32m[I 2022-04-13 11:50:47,520][0m Trial 900 finished with value: 0.7286259651218314 and parameters: {'alpha': 2.241510098281382, 'ties': 'efron'}. Best is trial 63 with value: 0.7309739795612015.[0m
[32m[I 2022-04-13 11:50:47,618][0m Trial 901 finished with value: 0.7308171886403182 and parameters: {'alpha': 2.075186841687495, 'ties': 'efron'}. Best is trial 63 with value: 0.7309739795612015.[0m
[32m[I 2022-04-13 11:50:47,723][0m Trial 902 finished with value: 0.729697264326865 and parameters: {'alpha': 2.368079461883714, 'ties': 'efron'}. Best is trial 63 with value: 0.7309739795612015.[0m
[32m[I 2022-04-13 11:50:47,865][0m Trial 903 finished with value: 0.7309739795612015 and parameters: {'alpha': 2.2900081456229744, 'ties': 'efron'}. Best is trial 63 with value: 0.7309739795612015.[0m
[32m[I 2022-04-13 11:50:48,027][0m Trial 904 finished with value: 0.7308171886403182 and parameters: {'alpha': 1.979602438087548, 'ties': 'efron'}. Best is trial 63 with value: 0.7309739795612015.[0m
[32m[I 2022-04-13 11:50:48,134][0m Trial 905 finished with value: 0.729697264326865 and parameters: {'alpha': 2.401424930112218, 'ties': 'efron'}. Best is trial 63 with value: 0.7309739795612015.[0m
[32m[I 2022-04-13 11:50:48,254][0m Trial 906 finished with value: 0.7221482698646403 and parameters: {'alpha': 3.1582723380546076, 'ties': 'efron'}. Best is trial 63 with value: 0.7309739795612015.[0m
[32m[I 2022-04-13 11:50:48,397][0m Trial 907 finished with value: 0.729697264326865 and parameters: {'alpha': 2.3425440184961115, 'ties': 'efron'}. Best is trial 63 with value: 0.7309739795612015.[0m
[32m[I 2022-04-13 11:50:48,531][0m Trial 908 finished with value: 0.729697264326865 and parameters: {'alpha': 2.4829669182821377, 'ties': 'efron'}. Best is trial 63 with value: 0.7309739795612015.[0m
[32m[I 2022-04-13 11:50:48,618][0m Trial 909 finished with value: 0.729697264326865 and parameters: {'alpha': 2.3291354335584225, 'ties': 'efron'}. Best is trial 63 with value: 0.7309739795612015.[0m
[32m[I 2022-04-13 11:50:48,746][0m Trial 910 finished with value: 0.726793213653711 and parameters: {'alpha': 2.6850663257726692, 'ties': 'efron'}. Best is trial 63 with value: 0.7309739795612015.[0m
[32m[I 2022-04-13 11:50:48,907][0m Trial 911 finished with value: 0.7296437365326369 and parameters: {'alpha': 2.163379084794575, 'ties': 'efron'}. Best is trial 63 with value: 0.7309739795612015.[0m
[32m[I 2022-04-13 11:50:49,012][0m Trial 912 finished with value: 0.729697264326865 and parameters: {'alpha': 2.6136228896582883, 'ties': 'efron'}. Best is trial 63 with value: 0.7309739795612015.[0m
[32m[I 2022-04-13 11:50:49,099][0m Trial 913 finished with value: 0.729697264326865 and parameters: {'alpha': 2.4704179957124572, 'ties': 'efron'}. Best is trial 63 with value: 0.7309739795612015.[0m
[32m[I 2022-04-13 11:50:49,205][0m Trial 914 finished with value: 0.7286259651218314 and parameters: {'alpha': 2.2609735166987623, 'ties': 'efron'}. Best is trial 63 with value: 0.7309739795612015.[0m
[32m[I 2022-04-13 11:50:49,433][0m Trial 915 finished with value: 0.729697264326865 and parameters: {'alpha': 2.4060098541288, 'ties': 'efron'}. Best is trial 63 with value: 0.7309739795612015.[0m
[32m[I 2022-04-13 11:50:49,541][0m Trial 916 finished with value: 0.7291006791993557 and parameters: {'alpha': 1.7452991696069744, 'ties': 'efron'}. Best is trial 63 with value: 0.7309739795612015.[0m
[32m[I 2022-04-13 11:50:49,928][0m Trial 917 finished with value: 0.7296437365326369 and parameters: {'alpha': 2.1386473591968316, 'ties': 'efron'}. Best is trial 63 with value: 0.7309739795612015.[0m
[32m[I 2022-04-13 11:50:50,178][0m Trial 918 finished with value: 0.7308171886403182 and parameters: {'alpha': 2.0291600569365253, 'ties': 'efron'}. Best is trial 63 with value: 0.7309739795612015.[0m
[32m[I 2022-04-13 11:50:50,360][0m Trial 919 finished with value: 0.7286259651218314 and parameters: {'alpha': 2.261392021678876, 'ties': 'efron'}. Best is trial 63 with value: 0.7309739795612015.[0m
[32m[I 2022-04-13 11:50:50,719][0m Trial 920 finished with value: 0.7221309781200848 and parameters: {'alpha': 4.677732649057601, 'ties': 'efron'}. Best is trial 63 with value: 0.7309739795612015.[0m
[32m[I 2022-04-13 11:50:50,929][0m Trial 921 finished with value: 0.7286259651218314 and parameters: {'alpha': 2.296317796729215, 'ties': 'breslow'}. Best is trial 63 with value: 0.7309739795612015.[0m
[32m[I 2022-04-13 11:50:51,247][0m Trial 922 finished with value: 0.729697264326865 and parameters: {'alpha': 2.4322863667137016, 'ties': 'efron'}. Best is trial 63 with value: 0.7309739795612015.[0m
[32m[I 2022-04-13 11:50:51,492][0m Trial 923 finished with value: 0.7286259651218314 and parameters: {'alpha': 2.192784955968832, 'ties': 'efron'}. Best is trial 63 with value: 0.7309739795612015.[0m
[32m[I 2022-04-13 11:50:51,686][0m Trial 924 finished with value: 0.720974817756959 and parameters: {'alpha': 3.486050310548996, 'ties': 'efron'}. Best is trial 63 with value: 0.7309739795612015.[0m
[32m[I 2022-04-13 11:50:51,901][0m Trial 925 finished with value: 0.7220434109136662 and parameters: {'alpha': 2.956436469875583, 'ties': 'breslow'}. Best is trial 63 with value: 0.7309739795612015.[0m
[32m[I 2022-04-13 11:50:52,114][0m Trial 926 finished with value: 0.729697264326865 and parameters: {'alpha': 2.5502202540554206, 'ties': 'efron'}. Best is trial 63 with value: 0.7309739795612015.[0m
[32m[I 2022-04-13 11:50:52,326][0m Trial 927 finished with value: 0.7309739795612015 and parameters: {'alpha': 2.290956714672018, 'ties': 'efron'}. Best is trial 63 with value: 0.7309739795612015.[0m
[32m[I 2022-04-13 11:50:52,518][0m Trial 928 finished with value: 0.7309739795612015 and parameters: {'alpha': 2.301961657150978, 'ties': 'efron'}. Best is trial 63 with value: 0.7309739795612015.[0m
[32m[I 2022-04-13 11:50:52,760][0m Trial 929 finished with value: 0.7283670212983004 and parameters: {'alpha': 2.1251130905153715, 'ties': 'efron'}. Best is trial 63 with value: 0.7309739795612015.[0m
[32m[I 2022-04-13 11:50:53,014][0m Trial 930 finished with value: 0.7296437365326369 and parameters: {'alpha': 2.1279336208298827, 'ties': 'efron'}. Best is trial 63 with value: 0.7309739795612015.[0m
[32m[I 2022-04-13 11:50:53,258][0m Trial 931 finished with value: 0.729697264326865 and parameters: {'alpha': 2.3535669537458768, 'ties': 'breslow'}. Best is trial 63 with value: 0.7309739795612015.[0m
[32m[I 2022-04-13 11:50:53,444][0m Trial 932 finished with value: 0.729697264326865 and parameters: {'alpha': 2.4232041908836712, 'ties': 'efron'}. Best is trial 63 with value: 0.7309739795612015.[0m
[32m[I 2022-04-13 11:50:53,729][0m Trial 933 finished with value: 0.7286259651218314 and parameters: {'alpha': 2.2433788003801243, 'ties': 'efron'}. Best is trial 63 with value: 0.7309739795612015.[0m
