[32m[I 2022-04-14 03:00:35,152][0m Trial 562 finished with value: 0.8597620498643497 and parameters: {'loss': 'coxph', 'learning_rate': 0.001980704063696695, 'n_estimators': 906, 'criterion': 'friedman_mse', 'min_samples_split': 3, 'min_samples_leaf': 2, 'min_weight_fraction_leaf': 0.04759141825238776, 'min_impurity_decrease': 0.6599256121514864, 'max_features': 0.9321272144763048, 'subsample': 0.7885373092767869, 'dropout_rate': 0.42080266885342826, 'ccp_alpha': 0.16382410187154228}. Best is trial 379 with value: 0.878361797817203.[0m
[32m[I 2022-04-14 03:01:46,495][0m Trial 563 finished with value: 0.873627006261359 and parameters: {'loss': 'coxph', 'learning_rate': 1.2756054818467102e-06, 'n_estimators': 795, 'criterion': 'friedman_mse', 'min_samples_split': 4, 'min_samples_leaf': 5, 'min_weight_fraction_leaf': 0.037378794688518825, 'min_impurity_decrease': 0.6006892302678327, 'max_features': 0.852896604558983, 'subsample': 0.7224741901662546, 'dropout_rate': 0.47957890869516273, 'ccp_alpha': 0.09198631346918973}. Best is trial 379 with value: 0.878361797817203.[0m
[32m[I 2022-04-14 03:03:18,980][0m Trial 564 finished with value: 0.8497461387427767 and parameters: {'loss': 'coxph', 'learning_rate': 0.0005710419926834038, 'n_estimators': 861, 'criterion': 'friedman_mse', 'min_samples_split': 3, 'min_samples_leaf': 4, 'min_weight_fraction_leaf': 0.05368779138500955, 'min_impurity_decrease': 0.6439646692628441, 'max_features': 0.8991105409217671, 'subsample': 0.7617786446513569, 'dropout_rate': 0.39091924428816244, 'ccp_alpha': 0.22815060404042906}. Best is trial 379 with value: 0.878361797817203.[0m
[32m[I 2022-04-14 03:03:22,675][0m Trial 565 finished with value: 0.8560813126277731 and parameters: {'loss': 'coxph', 'learning_rate': 0.0006997014141808111, 'n_estimators': 179, 'criterion': 'friedman_mse', 'min_samples_split': 4, 'min_samples_leaf': 4, 'min_weight_fraction_leaf': 0.02714450624486192, 'min_impurity_decrease': 0.5554201357807931, 'max_features': 0.8744402461811167, 'subsample': 0.791080257281871, 'dropout_rate': 0.45289309234886693, 'ccp_alpha': 0.1727704193894711}. Best is trial 379 with value: 0.878361797817203.[0m
[32m[I 2022-04-14 03:04:30,225][0m Trial 566 finished with value: 0.8788372413254446 and parameters: {'loss': 'coxph', 'learning_rate': 0.002161445066129226, 'n_estimators': 735, 'criterion': 'friedman_mse', 'min_samples_split': 3, 'min_samples_leaf': 2, 'min_weight_fraction_leaf': 0.038711590655315466, 'min_impurity_decrease': 0.4011088467341109, 'max_features': 0.9158541685072772, 'subsample': 0.7470482966040346, 'dropout_rate': 0.4587228307824316, 'ccp_alpha': 0.0015791461688023515}. Best is trial 566 with value: 0.8788372413254446.[0m
[32m[I 2022-04-14 03:04:32,563][0m Trial 567 finished with value: 0.8750111855370772 and parameters: {'loss': 'coxph', 'learning_rate': 0.0019048838299427055, 'n_estimators': 100, 'criterion': 'friedman_mse', 'min_samples_split': 4, 'min_samples_leaf': 2, 'min_weight_fraction_leaf': 0.072846511767367, 'min_impurity_decrease': 0.4047228179628308, 'max_features': 0.9269673274686389, 'subsample': 0.7340688699365221, 'dropout_rate': 0.4773901734218985, 'ccp_alpha': 0.07698579162677038}. Best is trial 566 with value: 0.8788372413254446.[0m
[32m[I 2022-04-14 03:04:35,203][0m Trial 568 finished with value: 0.65 and parameters: {'loss': 'coxph', 'learning_rate': 0.002162062959290074, 'n_estimators': 152, 'criterion': 'friedman_mse', 'min_samples_split': 3, 'min_samples_leaf': 2, 'min_weight_fraction_leaf': 0.07087861375961874, 'min_impurity_decrease': 0.3665069538760793, 'max_features': 0.9713832558526583, 'subsample': 0.7208000964891237, 'dropout_rate': 0.4613730609283738, 'ccp_alpha': 1.5704616919327468}. Best is trial 566 with value: 0.8788372413254446.[0m
[32m[I 2022-04-14 03:04:43,676][0m Trial 569 finished with value: 0.8764658490209196 and parameters: {'loss': 'coxph', 'learning_rate': 0.002218163809511974, 'n_estimators': 244, 'criterion': 'friedman_mse', 'min_samples_split': 4, 'min_samples_leaf': 2, 'min_weight_fraction_leaf': 0.07812039448918735, 'min_impurity_decrease': 0.43299114299955754, 'max_features': 0.9345395366789211, 'subsample': 0.7353202024840597, 'dropout_rate': 0.4764394771050801, 'ccp_alpha': 0.0018463396706955675}. Best is trial 566 with value: 0.8788372413254446.[0m
[32m[I 2022-04-14 03:04:47,489][0m Trial 570 finished with value: 0.6843657885296233 and parameters: {'loss': 'coxph', 'learning_rate': 0.0021850045138517064, 'n_estimators': 172, 'criterion': 'friedman_mse', 'min_samples_split': 3, 'min_samples_leaf': 2, 'min_weight_fraction_leaf': 0.08414652913054456, 'min_impurity_decrease': 0.39526648526446756, 'max_features': 0.9597447205387603, 'subsample': 0.7312953247880004, 'dropout_rate': 0.4434065635699406, 'ccp_alpha': 0.2867052363717189}. Best is trial 566 with value: 0.8788372413254446.[0m
[32m[I 2022-04-14 03:04:48,881][0m Trial 571 finished with value: 0.8721765526302445 and parameters: {'loss': 'coxph', 'learning_rate': 0.0022408276389322096, 'n_estimators': 103, 'criterion': 'friedman_mse', 'min_samples_split': 4, 'min_samples_leaf': 2, 'min_weight_fraction_leaf': 0.07659938078555745, 'min_impurity_decrease': 0.4072651263615162, 'max_features': 0.9452085352262672, 'subsample': 0.7412587733273569, 'dropout_rate': 0.4662692521896687, 'ccp_alpha': 0.09514994719065767}. Best is trial 566 with value: 0.8788372413254446.[0m
[32m[I 2022-04-14 03:04:53,084][0m Trial 572 finished with value: 0.8657964738259482 and parameters: {'loss': 'coxph', 'learning_rate': 0.0017963776683951656, 'n_estimators': 196, 'criterion': 'friedman_mse', 'min_samples_split': 4, 'min_samples_leaf': 2, 'min_weight_fraction_leaf': 0.060035449611276576, 'min_impurity_decrease': 0.4117519727281871, 'max_features': 0.9428350086518548, 'subsample': 0.7127578939992253, 'dropout_rate': 0.4860575179490417, 'ccp_alpha': 0.09641456245162298}. Best is trial 566 with value: 0.8788372413254446.[0m
[32m[I 2022-04-14 03:04:55,957][0m Trial 573 finished with value: 0.65 and parameters: {'loss': 'coxph', 'learning_rate': 0.002205841868173565, 'n_estimators': 131, 'criterion': 'friedman_mse', 'min_samples_split': 3, 'min_samples_leaf': 2, 'min_weight_fraction_leaf': 0.07237933854852599, 'min_impurity_decrease': 0.5891984268169936, 'max_features': 0.9598672577846836, 'subsample': 0.7464329537721378, 'dropout_rate': 0.4393578958143437, 'ccp_alpha': 2.407410900698834}. Best is trial 566 with value: 0.8788372413254446.[0m
[32m[I 2022-04-14 03:04:57,273][0m Trial 574 finished with value: 0.8431462900149956 and parameters: {'loss': 'coxph', 'learning_rate': 0.001774483225462216, 'n_estimators': 100, 'criterion': 'friedman_mse', 'min_samples_split': 4, 'min_samples_leaf': 2, 'min_weight_fraction_leaf': 0.07186809433221249, 'min_impurity_decrease': 0.6186826693937246, 'max_features': 0.9171539250506181, 'subsample': 0.7223668132234055, 'dropout_rate': 0.48812121900901473, 'ccp_alpha': 0.19906385514983155}. Best is trial 566 with value: 0.8788372413254446.[0m
[32m[I 2022-04-14 03:05:14,104][0m Trial 575 finished with value: 0.65 and parameters: {'loss': 'coxph', 'learning_rate': 0.002475809760096156, 'n_estimators': 368, 'criterion': 'absolute_error', 'min_samples_split': 3, 'min_samples_leaf': 2, 'min_weight_fraction_leaf': 0.08076979294023612, 'min_impurity_decrease': 0.4057092519740508, 'max_features': 0.9320305400783435, 'subsample': 0.743544523714431, 'dropout_rate': 0.46159368698621445, 'ccp_alpha': 0.08294543470982438}. Best is trial 566 with value: 0.8788372413254446.[0m
[32m[I 2022-04-14 03:05:16,999][0m Trial 576 finished with value: 0.8599465536060726 and parameters: {'loss': 'coxph', 'learning_rate': 0.002373696598326574, 'n_estimators': 114, 'criterion': 'friedman_mse', 'min_samples_split': 5, 'min_samples_leaf': 2, 'min_weight_fraction_leaf': 0.06086856283397579, 'min_impurity_decrease': 0.5631815050706314, 'max_features': 0.9303213256628968, 'subsample': 0.4044474547216422, 'dropout_rate': 0.4302112229823424, 'ccp_alpha': 0.1764754422592491}. Best is trial 566 with value: 0.8788372413254446.[0m
[32m[I 2022-04-14 03:05:24,754][0m Trial 577 finished with value: 0.873967044985491 and parameters: {'loss': 'coxph', 'learning_rate': 0.001660623512165049, 'n_estimators': 241, 'criterion': 'friedman_mse', 'min_samples_split': 4, 'min_samples_leaf': 2, 'min_weight_fraction_leaf': 0.07892289008869298, 'min_impurity_decrease': 0.6760940533580296, 'max_features': 0.9208347418904341, 'subsample': 0.7307837569462902, 'dropout_rate': 0.4928603180935998, 'ccp_alpha': 0.0018880368468692837}. Best is trial 566 with value: 0.8788372413254446.[0m
[32m[I 2022-04-14 03:05:26,182][0m Trial 578 finished with value: -0.35106103754624096 and parameters: {'loss': 'squared', 'learning_rate': 0.0021744768926652658, 'n_estimators': 107, 'criterion': 'friedman_mse', 'min_samples_split': 10, 'min_samples_leaf': 2, 'min_weight_fraction_leaf': 0.08495819276497688, 'min_impurity_decrease': 0.37834915856557055, 'max_features': 0.9597773739290256, 'subsample': 0.7624902779990965, 'dropout_rate': 0.4700470663507403, 'ccp_alpha': 0.3427505578217114}. Best is trial 566 with value: 0.8788372413254446.[0m
[32m[I 2022-04-14 03:05:30,453][0m Trial 579 finished with value: 0.8757184857844151 and parameters: {'loss': 'coxph', 'learning_rate': 0.0015225511491880775, 'n_estimators': 184, 'criterion': 'friedman_mse', 'min_samples_split': 3, 'min_samples_leaf': 2, 'min_weight_fraction_leaf': 0.058175648307383, 'min_impurity_decrease': 0.41953836745387857, 'max_features': 0.9240567805778834, 'subsample': 0.7511384923705579, 'dropout_rate': 0.44966238949069665, 'ccp_alpha': 0.09154027278847857}. Best is trial 566 with value: 0.8788372413254446.[0m
[32m[I 2022-04-14 03:05:40,043][0m Trial 580 finished with value: 0.735088178037721 and parameters: {'loss': 'coxph', 'learning_rate': 0.0016102014860127052, 'n_estimators': 259, 'criterion': 'friedman_mse', 'min_samples_split': 6, 'min_samples_leaf': 2, 'min_weight_fraction_leaf': 0.05553395389895752, 'min_impurity_decrease': 0.42828985506983297, 'max_features': 0.946144958075268, 'subsample': 0.7535327968561368, 'dropout_rate': 0.4446104287689918, 'ccp_alpha': 0.25184233137090906}. Best is trial 566 with value: 0.8788372413254446.[0m
[32m[I 2022-04-14 03:05:46,468][0m Trial 581 finished with value: 0.65 and parameters: {'loss': 'coxph', 'learning_rate': 0.001449659866388783, 'n_estimators': 232, 'criterion': 'squared_error', 'min_samples_split': 4, 'min_samples_leaf': 2, 'min_weight_fraction_leaf': 0.06472485453329167, 'min_impurity_decrease': 0.39718935291634094, 'max_features': 0.9302774221974006, 'subsample': 0.7646462566015372, 'dropout_rate': 0.45590045566003645, 'ccp_alpha': 0.15712793178429346}. Best is trial 566 with value: 0.8788372413254446.[0m
[32m[I 2022-04-14 03:05:50,295][0m Trial 582 finished with value: 0.8701556415760618 and parameters: {'loss': 'coxph', 'learning_rate': 0.0014750252639195512, 'n_estimators': 161, 'criterion': 'friedman_mse', 'min_samples_split': 3, 'min_samples_leaf': 2, 'min_weight_fraction_leaf': 0.047255127725896934, 'min_impurity_decrease': 0.4165798759198069, 'max_features': 0.9563520684567853, 'subsample': 0.7418778665442106, 'dropout_rate': 0.4256662129131034, 'ccp_alpha': 0.09857914813870754}. Best is trial 566 with value: 0.8788372413254446.[0m
[32m[I 2022-04-14 03:05:54,968][0m Trial 583 finished with value: 0.8722975760721885 and parameters: {'loss': 'coxph', 'learning_rate': 0.0003291336246278616, 'n_estimators': 197, 'criterion': 'friedman_mse', 'min_samples_split': 4, 'min_samples_leaf': 2, 'min_weight_fraction_leaf': 0.058664856695022055, 'min_impurity_decrease': 0.43031577463757265, 'max_features': 0.987305005879151, 'subsample': 0.776138628285363, 'dropout_rate': 0.4693906201123695, 'ccp_alpha': 0.0925054565275158}. Best is trial 566 with value: 0.8788372413254446.[0m
[32m[I 2022-04-14 03:06:26,651][0m Trial 584 finished with value: 0.8589088245236415 and parameters: {'loss': 'coxph', 'learning_rate': 0.0019129909713247134, 'n_estimators': 515, 'criterion': 'friedman_mse', 'min_samples_split': 3, 'min_samples_leaf': 2, 'min_weight_fraction_leaf': 0.04474343953274525, 'min_impurity_decrease': 0.4395217640797581, 'max_features': 0.9186636622655535, 'subsample': 0.47918752706576345, 'dropout_rate': 0.49252974376995273, 'ccp_alpha': 0.26524460409109424}. Best is trial 566 with value: 0.8788372413254446.[0m
[32m[I 2022-04-14 03:06:30,651][0m Trial 585 finished with value: 0.8764153487118049 and parameters: {'loss': 'coxph', 'learning_rate': 0.0024929571358223122, 'n_estimators': 177, 'criterion': 'friedman_mse', 'min_samples_split': 4, 'min_samples_leaf': 2, 'min_weight_fraction_leaf': 0.06716048746364818, 'min_impurity_decrease': 0.40764584996996234, 'max_features': 0.9329450194639513, 'subsample': 0.757267927997319, 'dropout_rate': 0.4437487086675754, 'ccp_alpha': 0.004215661179745818}. Best is trial 566 with value: 0.8788372413254446.[0m
[32m[I 2022-04-14 03:06:34,084][0m Trial 586 finished with value: 0.8487451596603748 and parameters: {'loss': 'coxph', 'learning_rate': 0.0024243523870948838, 'n_estimators': 168, 'criterion': 'friedman_mse', 'min_samples_split': 4, 'min_samples_leaf': 2, 'min_weight_fraction_leaf': 0.067939343785109, 'min_impurity_decrease': 0.4073935889501123, 'max_features': 0.983004451005697, 'subsample': 0.7294244249995352, 'dropout_rate': 0.4116576982059888, 'ccp_alpha': 0.19579576522426834}. Best is trial 566 with value: 0.8788372413254446.[0m
[32m[I 2022-04-14 03:06:38,452][0m Trial 587 finished with value: 0.65 and parameters: {'loss': 'coxph', 'learning_rate': 0.0023777552018298814, 'n_estimators': 189, 'criterion': 'friedman_mse', 'min_samples_split': 3, 'min_samples_leaf': 2, 'min_weight_fraction_leaf': 0.06691729273703656, 'min_impurity_decrease': 0.37992937827144463, 'max_features': 0.9503664494788657, 'subsample': 0.7531213314047042, 'dropout_rate': 0.43365224572742755, 'ccp_alpha': 0.5041913858849356}. Best is trial 566 with value: 0.8788372413254446.[0m
[32m[I 2022-04-14 03:06:40,304][0m Trial 588 finished with value: 0.8497953037620288 and parameters: {'loss': 'coxph', 'learning_rate': 0.0027411385940074376, 'n_estimators': 120, 'criterion': 'friedman_mse', 'min_samples_split': 4, 'min_samples_leaf': 2, 'min_weight_fraction_leaf': 0.2665457227266115, 'min_impurity_decrease': 0.4171966246179296, 'max_features': 0.9320961697013761, 'subsample': 0.7572670055763315, 'dropout_rate': 0.4365073517826829, 'ccp_alpha': 0.0902913340553134}. Best is trial 566 with value: 0.8788372413254446.[0m
[32m[I 2022-04-14 03:06:43,942][0m Trial 589 finished with value: 0.8576202821605767 and parameters: {'loss': 'coxph', 'learning_rate': 0.0020160592655548565, 'n_estimators': 175, 'criterion': 'friedman_mse', 'min_samples_split': 3, 'min_samples_leaf': 2, 'min_weight_fraction_leaf': 0.05852113439881898, 'min_impurity_decrease': 0.3697785975990091, 'max_features': 0.9370775011782015, 'subsample': 0.7167020827107241, 'dropout_rate': 0.4494760452543769, 'ccp_alpha': 0.17097885721490763}. Best is trial 566 with value: 0.8788372413254446.[0m
[32m[I 2022-04-14 03:06:48,402][0m Trial 590 finished with value: 0.65 and parameters: {'loss': 'coxph', 'learning_rate': 0.00016131794370833675, 'n_estimators': 147, 'criterion': 'friedman_mse', 'min_samples_split': 4, 'min_samples_leaf': 2, 'min_weight_fraction_leaf': 0.07411885898238685, 'min_impurity_decrease': 0.434980681284072, 'max_features': 0.9127730438028201, 'subsample': 0.7774866444441715, 'dropout_rate': 0.4152370541858177, 'ccp_alpha': 0.3989767166751068}. Best is trial 566 with value: 0.8788372413254446.[0m
[32m[I 2022-04-14 03:06:50,890][0m Trial 591 finished with value: 0.8668810767614152 and parameters: {'loss': 'coxph', 'learning_rate': 0.001721380357110216, 'n_estimators': 166, 'criterion': 'friedman_mse', 'min_samples_split': 5, 'min_samples_leaf': 2, 'min_weight_fraction_leaf': 0.053501676702660664, 'min_impurity_decrease': 0.3902185379666424, 'max_features': 0.9658745256726565, 'subsample': 0.7355130510124638, 'dropout_rate': 0.7913806859408722, 'ccp_alpha': 0.09426162717728888}. Best is trial 566 with value: 0.8788372413254446.[0m
[32m[I 2022-04-14 03:06:55,364][0m Trial 592 finished with value: 0.8717314542546655 and parameters: {'loss': 'coxph', 'learning_rate': 0.002423857194620219, 'n_estimators': 205, 'criterion': 'friedman_mse', 'min_samples_split': 3, 'min_samples_leaf': 2, 'min_weight_fraction_leaf': 0.07143289066694017, 'min_impurity_decrease': 0.446137702474272, 'max_features': 0.9164916659423777, 'subsample': 0.7653493633326657, 'dropout_rate': 0.6233129145793762, 'ccp_alpha': 0.0016804699531857703}. Best is trial 566 with value: 0.8788372413254446.[0m
[32m[I 2022-04-14 03:06:59,588][0m Trial 593 finished with value: 0.6744126853845854 and parameters: {'loss': 'coxph', 'learning_rate': 0.0013298117218062215, 'n_estimators': 183, 'criterion': 'friedman_mse', 'min_samples_split': 4, 'min_samples_leaf': 2, 'min_weight_fraction_leaf': 0.06315080161037047, 'min_impurity_decrease': 0.4013091893933843, 'max_features': 0.936603365487823, 'subsample': 0.7370282179317728, 'dropout_rate': 0.48108559229254294, 'ccp_alpha': 0.2879690991877314}. Best is trial 566 with value: 0.8788372413254446.[0m
[32m[I 2022-04-14 03:07:04,173][0m Trial 594 finished with value: 0.861834012350279 and parameters: {'loss': 'coxph', 'learning_rate': 0.00145128368447606, 'n_estimators': 177, 'criterion': 'friedman_mse', 'min_samples_split': 4, 'min_samples_leaf': 2, 'min_weight_fraction_leaf': 0.050571904265672776, 'min_impurity_decrease': 0.41359828973253493, 'max_features': 0.9195490193617398, 'subsample': 0.7096967530288488, 'dropout_rate': 0.4516751106040021, 'ccp_alpha': 0.16522847385265713}. Best is trial 566 with value: 0.8788372413254446.[0m
[32m[I 2022-04-14 03:07:07,938][0m Trial 595 finished with value: 0.8762798843901081 and parameters: {'loss': 'coxph', 'learning_rate': 0.00173858219530787, 'n_estimators': 172, 'criterion': 'friedman_mse', 'min_samples_split': 3, 'min_samples_leaf': 2, 'min_weight_fraction_leaf': 0.040573256210983094, 'min_impurity_decrease': 0.36344899981456796, 'max_features': 0.9528102501421273, 'subsample': 0.7803149097886729, 'dropout_rate': 0.41915300575483344, 'ccp_alpha': 0.0038825681137641945}. Best is trial 566 with value: 0.8788372413254446.[0m
[32m[I 2022-04-14 03:07:10,181][0m Trial 596 finished with value: 0.65 and parameters: {'loss': 'coxph', 'learning_rate': 0.0018160712790359873, 'n_estimators': 125, 'criterion': 'absolute_error', 'min_samples_split': 4, 'min_samples_leaf': 2, 'min_weight_fraction_leaf': 0.05553350235915011, 'min_impurity_decrease': 0.374618364968497, 'max_features': 0.9701033540977207, 'subsample': 0.7484391730196158, 'dropout_rate': 0.42926571493064986, 'ccp_alpha': 0.0907867078498832}. Best is trial 566 with value: 0.8788372413254446.[0m
[32m[I 2022-04-14 03:07:14,007][0m Trial 597 finished with value: 0.8755113819898025 and parameters: {'loss': 'coxph', 'learning_rate': 0.0024429849025171314, 'n_estimators': 172, 'criterion': 'friedman_mse', 'min_samples_split': 3, 'min_samples_leaf': 2, 'min_weight_fraction_leaf': 0.04612033553399671, 'min_impurity_decrease': 0.34756499184301076, 'max_features': 0.9845424721245183, 'subsample': 0.7838070386357991, 'dropout_rate': 0.40851106041255447, 'ccp_alpha': 0.003974700882430599}. Best is trial 566 with value: 0.8788372413254446.[0m
[32m[I 2022-04-14 03:07:18,875][0m Trial 598 finished with value: 0.8512998212732908 and parameters: {'loss': 'coxph', 'learning_rate': 0.0027839613018204733, 'n_estimators': 188, 'criterion': 'friedman_mse', 'min_samples_split': 3, 'min_samples_leaf': 2, 'min_weight_fraction_leaf': 0.06848376168018676, 'min_impurity_decrease': 0.3369355266651547, 'max_features': 0.9789370123770647, 'subsample': 0.7752103141494876, 'dropout_rate': 0.4120511189418317, 'ccp_alpha': 0.16372689103655422}. Best is trial 566 with value: 0.8788372413254446.[0m
[32m[I 2022-04-14 03:07:22,965][0m Trial 599 finished with value: 0.8136846684784169 and parameters: {'loss': 'coxph', 'learning_rate': 0.002703494676347167, 'n_estimators': 172, 'criterion': 'friedman_mse', 'min_samples_split': 4, 'min_samples_leaf': 2, 'min_weight_fraction_leaf': 0.0420283617464104, 'min_impurity_decrease': 0.36812638475343584, 'max_features': 0.9683185478708277, 'subsample': 0.7947466403265543, 'dropout_rate': 0.4292544967897165, 'ccp_alpha': 0.23855692372256754}. Best is trial 566 with value: 0.8788372413254446.[0m
[32m[I 2022-04-14 03:07:27,086][0m Trial 600 finished with value: -0.3120644046578422 and parameters: {'loss': 'squared', 'learning_rate': 0.0023729726929445716, 'n_estimators': 175, 'criterion': 'friedman_mse', 'min_samples_split': 3, 'min_samples_leaf': 2, 'min_weight_fraction_leaf': 0.4354559146030278, 'min_impurity_decrease': 0.3386938558477046, 'max_features': 0.9557889345121785, 'subsample': 0.7896946472003948, 'dropout_rate': 0.44918280551801926, 'ccp_alpha': 0.09074271819455212}. Best is trial 566 with value: 0.8788372413254446.[0m
[32m[I 2022-04-14 03:07:30,460][0m Trial 601 finished with value: 0.8705304911688737 and parameters: {'loss': 'coxph', 'learning_rate': 0.0019981483486400313, 'n_estimators': 162, 'criterion': 'friedman_mse', 'min_samples_split': 4, 'min_samples_leaf': 2, 'min_weight_fraction_leaf': 0.08850468204995317, 'min_impurity_decrease': 0.3469263498029582, 'max_features': 0.9729985467373455, 'subsample': 0.7923328965334948, 'dropout_rate': 0.4104371188901612, 'ccp_alpha': 0.0944839444640116}. Best is trial 566 with value: 0.8788372413254446.[0m
