[32m[I 2022-04-19 05:34:06,429][0m Trial 211 finished with value: 0.6681565345103448 and parameters: {'n_hidden': 2048, 'mixture_components': 2, 'use_sparse_layer': True, 'use_sparse_loss': True, 'lmbd': 0.0006502428605544781, 'use_batchnorm': False, 'use_dropout': True, 'dropout': 0.5270031105128391, 'mlp_size_1': 7, 'mlp_size_2': 0, 'mlp_size_3': 0, 'kernel': 'Gamma', 'loss_name': 'NLLLoss'}. Best is trial 142 with value: 0.7103637692860825.[0m
[32m[I 2022-04-19 05:36:28,596][0m Trial 212 finished with value: 0.6971525328220588 and parameters: {'n_hidden': 2048, 'mixture_components': 2, 'use_sparse_layer': True, 'use_sparse_loss': True, 'lmbd': 0.0001639037680832625, 'use_batchnorm': False, 'use_dropout': True, 'dropout': 0.4893948587845519, 'mlp_size_1': 7, 'mlp_size_2': 0, 'mlp_size_3': 0, 'kernel': 'Gamma', 'loss_name': 'NLLLoss'}. Best is trial 142 with value: 0.7103637692860825.[0m
[32m[I 2022-04-19 05:38:55,387][0m Trial 213 finished with value: 0.6902208592151302 and parameters: {'n_hidden': 256, 'mixture_components': 2, 'use_sparse_layer': True, 'use_sparse_loss': True, 'lmbd': 0.000380190887400541, 'use_batchnorm': False, 'use_dropout': True, 'dropout': 0.4911003798642706, 'mlp_size_1': 5, 'mlp_size_2': 0, 'mlp_size_3': 0, 'kernel': 'Gamma', 'loss_name': 'NLLLoss'}. Best is trial 142 with value: 0.7103637692860825.[0m
[32m[I 2022-04-19 05:41:13,691][0m Trial 214 finished with value: 0.6978603525908075 and parameters: {'n_hidden': 2048, 'mixture_components': 1, 'use_sparse_layer': True, 'use_sparse_loss': True, 'lmbd': 0.00028983262267159453, 'use_batchnorm': False, 'use_dropout': True, 'dropout': 0.4631881361252108, 'mlp_size_1': 7, 'mlp_size_2': 1, 'mlp_size_3': 0, 'kernel': 'Gamma', 'loss_name': 'NLLLoss'}. Best is trial 142 with value: 0.7103637692860825.[0m
[32m[I 2022-04-19 05:43:19,645][0m Trial 215 finished with value: 0.6953049682985903 and parameters: {'n_hidden': 2048, 'mixture_components': 1, 'use_sparse_layer': True, 'use_sparse_loss': True, 'lmbd': 0.0002887710760762653, 'use_batchnorm': False, 'use_dropout': True, 'dropout': 0.4658456372301242, 'mlp_size_1': 7, 'mlp_size_2': 0, 'mlp_size_3': 0, 'kernel': 'Gamma', 'loss_name': 'NLLLoss'}. Best is trial 142 with value: 0.7103637692860825.[0m
[32m[I 2022-04-19 05:45:40,038][0m Trial 216 finished with value: 0.687553442919212 and parameters: {'n_hidden': 2048, 'mixture_components': 1, 'use_sparse_layer': True, 'use_sparse_loss': True, 'lmbd': 0.0003186734055009479, 'use_batchnorm': False, 'use_dropout': True, 'dropout': 0.4197897573169668, 'mlp_size_1': 7, 'mlp_size_2': 1, 'mlp_size_3': 0, 'kernel': 'Gamma', 'loss_name': 'NLLLoss'}. Best is trial 142 with value: 0.7103637692860825.[0m
[32m[I 2022-04-19 05:47:39,166][0m Trial 217 finished with value: 0.6457416608106399 and parameters: {'n_hidden': 2048, 'mixture_components': 1, 'use_sparse_layer': True, 'use_sparse_loss': True, 'lmbd': 0.00022857543697552547, 'use_batchnorm': False, 'use_dropout': True, 'dropout': 0.4596182129297305, 'mlp_size_1': 7, 'mlp_size_2': 0, 'mlp_size_3': 0, 'kernel': 'Gamma', 'loss_name': 'NLLLoss'}. Best is trial 142 with value: 0.7103637692860825.[0m
[32m[I 2022-04-19 05:49:32,787][0m Trial 218 finished with value: 0.7052394916496865 and parameters: {'n_hidden': 2048, 'mixture_components': 1, 'use_sparse_layer': True, 'use_sparse_loss': True, 'lmbd': 0.00018055742592933146, 'use_batchnorm': False, 'use_dropout': True, 'dropout': 0.4719732583514638, 'mlp_size_1': 7, 'mlp_size_2': 0, 'mlp_size_3': 0, 'kernel': 'Gamma', 'loss_name': 'NLLLoss'}. Best is trial 142 with value: 0.7103637692860825.[0m
[32m[I 2022-04-19 05:51:11,906][0m Trial 219 finished with value: 0.725115655197434 and parameters: {'n_hidden': 2048, 'mixture_components': 1, 'use_sparse_layer': True, 'use_sparse_loss': True, 'lmbd': 0.00018590729337024787, 'use_batchnorm': False, 'use_dropout': True, 'dropout': 0.45528220555609394, 'mlp_size_1': 7, 'mlp_size_2': 0, 'mlp_size_3': 0, 'kernel': 'Exponential', 'loss_name': 'NLLLoss'}. Best is trial 219 with value: 0.725115655197434.[0m
[32m[I 2022-04-19 05:52:47,725][0m Trial 220 finished with value: 0.696264842467831 and parameters: {'n_hidden': 2048, 'mixture_components': 1, 'use_sparse_layer': True, 'use_sparse_loss': True, 'lmbd': 0.00016787194891275308, 'use_batchnorm': False, 'use_dropout': True, 'dropout': 0.434452545667716, 'mlp_size_1': 7, 'mlp_size_2': 0, 'mlp_size_3': 0, 'kernel': 'Exponential', 'loss_name': 'NLLLoss'}. Best is trial 219 with value: 0.725115655197434.[0m
[32m[I 2022-04-19 05:54:26,615][0m Trial 221 finished with value: 0.714187470065588 and parameters: {'n_hidden': 2048, 'mixture_components': 1, 'use_sparse_layer': True, 'use_sparse_loss': True, 'lmbd': 0.000174743919764934, 'use_batchnorm': False, 'use_dropout': True, 'dropout': 0.4445729662542469, 'mlp_size_1': 7, 'mlp_size_2': 0, 'mlp_size_3': 0, 'kernel': 'Exponential', 'loss_name': 'NLLLoss'}. Best is trial 219 with value: 0.725115655197434.[0m
[32m[I 2022-04-19 05:56:16,301][0m Trial 222 finished with value: 0.717672778061557 and parameters: {'n_hidden': 2048, 'mixture_components': 1, 'use_sparse_layer': True, 'use_sparse_loss': True, 'lmbd': 0.00017607094954398122, 'use_batchnorm': False, 'use_dropout': True, 'dropout': 0.43728836331265086, 'mlp_size_1': 7, 'mlp_size_2': 0, 'mlp_size_3': 0, 'kernel': 'Exponential', 'loss_name': 'NLLLoss'}. Best is trial 219 with value: 0.725115655197434.[0m
[32m[I 2022-04-19 05:58:10,704][0m Trial 223 finished with value: 0.7079089291949802 and parameters: {'n_hidden': 2048, 'mixture_components': 1, 'use_sparse_layer': True, 'use_sparse_loss': True, 'lmbd': 0.00016862951070439062, 'use_batchnorm': False, 'use_dropout': True, 'dropout': 0.4074806039093838, 'mlp_size_1': 7, 'mlp_size_2': 0, 'mlp_size_3': 0, 'kernel': 'Exponential', 'loss_name': 'NLLLoss'}. Best is trial 219 with value: 0.725115655197434.[0m
[32m[I 2022-04-19 06:00:10,688][0m Trial 224 finished with value: 0.6991551236915315 and parameters: {'n_hidden': 2048, 'mixture_components': 1, 'use_sparse_layer': True, 'use_sparse_loss': True, 'lmbd': 0.00016838776758749014, 'use_batchnorm': False, 'use_dropout': True, 'dropout': 0.4106577537687823, 'mlp_size_1': 7, 'mlp_size_2': 0, 'mlp_size_3': 0, 'kernel': 'Exponential', 'loss_name': 'NLLLoss'}. Best is trial 219 with value: 0.725115655197434.[0m
[32m[I 2022-04-19 06:01:49,839][0m Trial 225 finished with value: 0.6955006501303542 and parameters: {'n_hidden': 2048, 'mixture_components': 1, 'use_sparse_layer': True, 'use_sparse_loss': True, 'lmbd': 0.000164627314429177, 'use_batchnorm': False, 'use_dropout': True, 'dropout': 0.4040751479830538, 'mlp_size_1': 7, 'mlp_size_2': 0, 'mlp_size_3': 0, 'kernel': 'Exponential', 'loss_name': 'NLLLoss'}. Best is trial 219 with value: 0.725115655197434.[0m
[32m[I 2022-04-19 06:03:29,618][0m Trial 226 finished with value: 0.6947880788398624 and parameters: {'n_hidden': 2048, 'mixture_components': 1, 'use_sparse_layer': True, 'use_sparse_loss': True, 'lmbd': 0.00015858336286307787, 'use_batchnorm': False, 'use_dropout': True, 'dropout': 0.36570065474154934, 'mlp_size_1': 7, 'mlp_size_2': 0, 'mlp_size_3': 0, 'kernel': 'Exponential', 'loss_name': 'NLLLoss'}. Best is trial 219 with value: 0.725115655197434.[0m
[32m[I 2022-04-19 06:05:16,348][0m Trial 227 finished with value: 0.7117217710553756 and parameters: {'n_hidden': 2048, 'mixture_components': 1, 'use_sparse_layer': True, 'use_sparse_loss': True, 'lmbd': 0.00017177984747005225, 'use_batchnorm': False, 'use_dropout': True, 'dropout': 0.41891171516629716, 'mlp_size_1': 7, 'mlp_size_2': 0, 'mlp_size_3': 0, 'kernel': 'Exponential', 'loss_name': 'NLLLoss'}. Best is trial 219 with value: 0.725115655197434.[0m
[32m[I 2022-04-19 06:06:56,633][0m Trial 228 finished with value: 0.7196111106812965 and parameters: {'n_hidden': 2048, 'mixture_components': 1, 'use_sparse_layer': True, 'use_sparse_loss': True, 'lmbd': 0.000178590579946237, 'use_batchnorm': False, 'use_dropout': True, 'dropout': 0.4125939412986208, 'mlp_size_1': 7, 'mlp_size_2': 0, 'mlp_size_3': 0, 'kernel': 'Exponential', 'loss_name': 'NLLLoss'}. Best is trial 219 with value: 0.725115655197434.[0m
[32m[I 2022-04-19 06:08:38,553][0m Trial 229 finished with value: 0.7224035373744495 and parameters: {'n_hidden': 2048, 'mixture_components': 1, 'use_sparse_layer': True, 'use_sparse_loss': True, 'lmbd': 0.00018529603198160676, 'use_batchnorm': False, 'use_dropout': True, 'dropout': 0.4147730174336075, 'mlp_size_1': 7, 'mlp_size_2': 0, 'mlp_size_3': 0, 'kernel': 'Exponential', 'loss_name': 'NLLLoss'}. Best is trial 219 with value: 0.725115655197434.[0m
[32m[I 2022-04-19 06:10:17,907][0m Trial 230 finished with value: 0.70080731200008 and parameters: {'n_hidden': 2048, 'mixture_components': 1, 'use_sparse_layer': True, 'use_sparse_loss': True, 'lmbd': 0.00017919534251669835, 'use_batchnorm': False, 'use_dropout': True, 'dropout': 0.41646732002754117, 'mlp_size_1': 7, 'mlp_size_2': 0, 'mlp_size_3': 0, 'kernel': 'Exponential', 'loss_name': 'NLLLoss'}. Best is trial 219 with value: 0.725115655197434.[0m
[32m[I 2022-04-19 06:11:51,690][0m Trial 231 finished with value: 0.6863257934630425 and parameters: {'n_hidden': 2048, 'mixture_components': 1, 'use_sparse_layer': True, 'use_sparse_loss': True, 'lmbd': 0.000183621648214208, 'use_batchnorm': False, 'use_dropout': True, 'dropout': 0.4043185740233456, 'mlp_size_1': 7, 'mlp_size_2': 0, 'mlp_size_3': 0, 'kernel': 'Exponential', 'loss_name': 'NLLLoss'}. Best is trial 219 with value: 0.725115655197434.[0m
[32m[I 2022-04-19 06:13:29,330][0m Trial 232 finished with value: 0.7032814399894572 and parameters: {'n_hidden': 2048, 'mixture_components': 1, 'use_sparse_layer': True, 'use_sparse_loss': True, 'lmbd': 0.00016657845328977422, 'use_batchnorm': False, 'use_dropout': True, 'dropout': 0.4255650912793414, 'mlp_size_1': 7, 'mlp_size_2': 0, 'mlp_size_3': 0, 'kernel': 'Exponential', 'loss_name': 'NLLLoss'}. Best is trial 219 with value: 0.725115655197434.[0m
[32m[I 2022-04-19 06:15:02,431][0m Trial 233 finished with value: 0.7096073123631566 and parameters: {'n_hidden': 2048, 'mixture_components': 1, 'use_sparse_layer': True, 'use_sparse_loss': True, 'lmbd': 0.0002141213289753677, 'use_batchnorm': False, 'use_dropout': True, 'dropout': 0.41823727631841945, 'mlp_size_1': 7, 'mlp_size_2': 0, 'mlp_size_3': 0, 'kernel': 'Exponential', 'loss_name': 'NLLLoss'}. Best is trial 219 with value: 0.725115655197434.[0m
[32m[I 2022-04-19 06:16:36,101][0m Trial 234 finished with value: 0.7090561170234848 and parameters: {'n_hidden': 2048, 'mixture_components': 1, 'use_sparse_layer': True, 'use_sparse_loss': True, 'lmbd': 0.00020300125479752682, 'use_batchnorm': False, 'use_dropout': True, 'dropout': 0.3834414797541485, 'mlp_size_1': 7, 'mlp_size_2': 0, 'mlp_size_3': 0, 'kernel': 'Exponential', 'loss_name': 'NLLLoss'}. Best is trial 219 with value: 0.725115655197434.[0m
[32m[I 2022-04-19 06:18:32,134][0m Trial 235 finished with value: 0.7240603978052348 and parameters: {'n_hidden': 2048, 'mixture_components': 1, 'use_sparse_layer': True, 'use_sparse_loss': True, 'lmbd': 0.00022910069192117372, 'use_batchnorm': False, 'use_dropout': True, 'dropout': 0.37895196164833345, 'mlp_size_1': 7, 'mlp_size_2': 0, 'mlp_size_3': 0, 'kernel': 'Exponential', 'loss_name': 'NLLLoss'}. Best is trial 219 with value: 0.725115655197434.[0m
[32m[I 2022-04-19 06:20:05,777][0m Trial 236 finished with value: 0.677985562165589 and parameters: {'n_hidden': 2048, 'mixture_components': 1, 'use_sparse_layer': True, 'use_sparse_loss': True, 'lmbd': 0.00021951295801857462, 'use_batchnorm': False, 'use_dropout': True, 'dropout': 0.37606325897791715, 'mlp_size_1': 7, 'mlp_size_2': 0, 'mlp_size_3': 0, 'kernel': 'Exponential', 'loss_name': 'NLLLoss'}. Best is trial 219 with value: 0.725115655197434.[0m
[32m[I 2022-04-19 06:22:07,495][0m Trial 237 finished with value: 0.7341952549033148 and parameters: {'n_hidden': 2048, 'mixture_components': 1, 'use_sparse_layer': True, 'use_sparse_loss': True, 'lmbd': 0.00023991016811776995, 'use_batchnorm': False, 'use_dropout': True, 'dropout': 0.4188529032859442, 'mlp_size_1': 7, 'mlp_size_2': 0, 'mlp_size_3': 0, 'kernel': 'Exponential', 'loss_name': 'NLLLoss'}. Best is trial 237 with value: 0.7341952549033148.[0m
[32m[I 2022-04-19 06:23:45,178][0m Trial 238 finished with value: 0.7027814395871131 and parameters: {'n_hidden': 2048, 'mixture_components': 1, 'use_sparse_layer': True, 'use_sparse_loss': True, 'lmbd': 0.00019863806450877024, 'use_batchnorm': False, 'use_dropout': True, 'dropout': 0.4152296484275498, 'mlp_size_1': 7, 'mlp_size_2': 0, 'mlp_size_3': 0, 'kernel': 'Exponential', 'loss_name': 'NLLLoss'}. Best is trial 237 with value: 0.7341952549033148.[0m
[32m[I 2022-04-19 06:25:23,046][0m Trial 239 finished with value: 0.7079911079596239 and parameters: {'n_hidden': 2048, 'mixture_components': 1, 'use_sparse_layer': True, 'use_sparse_loss': True, 'lmbd': 0.0002151266925752008, 'use_batchnorm': False, 'use_dropout': True, 'dropout': 0.41684975469826346, 'mlp_size_1': 7, 'mlp_size_2': 0, 'mlp_size_3': 0, 'kernel': 'Exponential', 'loss_name': 'NLLLoss'}. Best is trial 237 with value: 0.7341952549033148.[0m
[32m[I 2022-04-19 06:27:09,695][0m Trial 240 finished with value: 0.7198223415190472 and parameters: {'n_hidden': 2048, 'mixture_components': 1, 'use_sparse_layer': True, 'use_sparse_loss': True, 'lmbd': 0.00021545987594565473, 'use_batchnorm': False, 'use_dropout': True, 'dropout': 0.3819726274955643, 'mlp_size_1': 7, 'mlp_size_2': 0, 'mlp_size_3': 0, 'kernel': 'Exponential', 'loss_name': 'NLLLoss'}. Best is trial 237 with value: 0.7341952549033148.[0m
[32m[I 2022-04-19 06:28:42,607][0m Trial 241 finished with value: 0.7008218814127403 and parameters: {'n_hidden': 2048, 'mixture_components': 1, 'use_sparse_layer': True, 'use_sparse_loss': True, 'lmbd': 0.00021352420414689864, 'use_batchnorm': False, 'use_dropout': True, 'dropout': 0.38474208863199166, 'mlp_size_1': 7, 'mlp_size_2': 0, 'mlp_size_3': 0, 'kernel': 'Exponential', 'loss_name': 'NLLLoss'}. Best is trial 237 with value: 0.7341952549033148.[0m
[32m[I 2022-04-19 06:30:18,677][0m Trial 242 finished with value: 0.6694352981522069 and parameters: {'n_hidden': 2048, 'mixture_components': 1, 'use_sparse_layer': True, 'use_sparse_loss': True, 'lmbd': 0.00022693309133413493, 'use_batchnorm': False, 'use_dropout': True, 'dropout': 0.3794666910384294, 'mlp_size_1': 7, 'mlp_size_2': 0, 'mlp_size_3': 0, 'kernel': 'Exponential', 'loss_name': 'NLLLoss'}. Best is trial 237 with value: 0.7341952549033148.[0m
[32m[I 2022-04-19 06:31:56,070][0m Trial 243 finished with value: 0.7142784742991958 and parameters: {'n_hidden': 2048, 'mixture_components': 1, 'use_sparse_layer': True, 'use_sparse_loss': True, 'lmbd': 0.0002109017021028394, 'use_batchnorm': False, 'use_dropout': True, 'dropout': 0.3519690262578178, 'mlp_size_1': 7, 'mlp_size_2': 0, 'mlp_size_3': 0, 'kernel': 'Exponential', 'loss_name': 'NLLLoss'}. Best is trial 237 with value: 0.7341952549033148.[0m
[32m[I 2022-04-19 06:33:31,535][0m Trial 244 finished with value: 0.7015934833302274 and parameters: {'n_hidden': 2048, 'mixture_components': 1, 'use_sparse_layer': True, 'use_sparse_loss': True, 'lmbd': 0.00021028427519636663, 'use_batchnorm': False, 'use_dropout': True, 'dropout': 0.3616109266315453, 'mlp_size_1': 7, 'mlp_size_2': 0, 'mlp_size_3': 0, 'kernel': 'Exponential', 'loss_name': 'NLLLoss'}. Best is trial 237 with value: 0.7341952549033148.[0m
[32m[I 2022-04-19 06:35:08,764][0m Trial 245 finished with value: 0.6891981550607039 and parameters: {'n_hidden': 2048, 'mixture_components': 1, 'use_sparse_layer': True, 'use_sparse_loss': True, 'lmbd': 0.00027034946512194196, 'use_batchnorm': False, 'use_dropout': True, 'dropout': 0.34616338335349683, 'mlp_size_1': 7, 'mlp_size_2': 0, 'mlp_size_3': 0, 'kernel': 'Exponential', 'loss_name': 'NLLLoss'}. Best is trial 237 with value: 0.7341952549033148.[0m
[32m[I 2022-04-19 06:36:44,047][0m Trial 246 finished with value: 0.6917304486422067 and parameters: {'n_hidden': 2048, 'mixture_components': 1, 'use_sparse_layer': True, 'use_sparse_loss': True, 'lmbd': 0.00021306501538272593, 'use_batchnorm': False, 'use_dropout': True, 'dropout': 0.36219554003941323, 'mlp_size_1': 7, 'mlp_size_2': 0, 'mlp_size_3': 0, 'kernel': 'Exponential', 'loss_name': 'NLLLoss'}. Best is trial 237 with value: 0.7341952549033148.[0m
[32m[I 2022-04-19 06:38:17,984][0m Trial 247 finished with value: 0.6982072930072839 and parameters: {'n_hidden': 2048, 'mixture_components': 1, 'use_sparse_layer': True, 'use_sparse_loss': True, 'lmbd': 0.00020253483392280842, 'use_batchnorm': False, 'use_dropout': True, 'dropout': 0.3923268171271862, 'mlp_size_1': 7, 'mlp_size_2': 0, 'mlp_size_3': 0, 'kernel': 'Exponential', 'loss_name': 'NLLLoss'}. Best is trial 237 with value: 0.7341952549033148.[0m
[32m[I 2022-04-19 06:39:52,321][0m Trial 248 finished with value: 0.6913721776537973 and parameters: {'n_hidden': 2048, 'mixture_components': 1, 'use_sparse_layer': True, 'use_sparse_loss': True, 'lmbd': 0.00023495558657735515, 'use_batchnorm': False, 'use_dropout': True, 'dropout': 0.41683463562389633, 'mlp_size_1': 7, 'mlp_size_2': 0, 'mlp_size_3': 0, 'kernel': 'Exponential', 'loss_name': 'NLLLoss'}. Best is trial 237 with value: 0.7341952549033148.[0m
[32m[I 2022-04-19 06:41:40,174][0m Trial 249 finished with value: 0.7263291136510227 and parameters: {'n_hidden': 2048, 'mixture_components': 1, 'use_sparse_layer': True, 'use_sparse_loss': True, 'lmbd': 0.0003345300503536712, 'use_batchnorm': False, 'use_dropout': True, 'dropout': 0.42266018653631193, 'mlp_size_1': 7, 'mlp_size_2': 0, 'mlp_size_3': 0, 'kernel': 'Exponential', 'loss_name': 'NLLLoss'}. Best is trial 237 with value: 0.7341952549033148.[0m
[32m[I 2022-04-19 06:43:36,311][0m Trial 250 finished with value: 0.6960143376238765 and parameters: {'n_hidden': 2048, 'mixture_components': 1, 'use_sparse_layer': True, 'use_sparse_loss': True, 'lmbd': 0.00019477315924839794, 'use_batchnorm': False, 'use_dropout': True, 'dropout': 0.4205302719100078, 'mlp_size_1': 7, 'mlp_size_2': 0, 'mlp_size_3': 0, 'kernel': 'Exponential', 'loss_name': 'NLLLoss'}. Best is trial 237 with value: 0.7341952549033148.[0m
[32m[I 2022-04-19 06:45:20,187][0m Trial 251 finished with value: 0.7197719423551459 and parameters: {'n_hidden': 2048, 'mixture_components': 1, 'use_sparse_layer': True, 'use_sparse_loss': True, 'lmbd': 0.00013848404368056556, 'use_batchnorm': False, 'use_dropout': True, 'dropout': 0.3349681513056416, 'mlp_size_1': 7, 'mlp_size_2': 0, 'mlp_size_3': 0, 'kernel': 'Exponential', 'loss_name': 'NLLLoss'}. Best is trial 237 with value: 0.7341952549033148.[0m
[32m[I 2022-04-19 06:46:58,621][0m Trial 252 finished with value: 0.6917969391360359 and parameters: {'n_hidden': 2048, 'mixture_components': 1, 'use_sparse_layer': True, 'use_sparse_loss': True, 'lmbd': 0.0001369808416373372, 'use_batchnorm': False, 'use_dropout': True, 'dropout': 0.34011016828878077, 'mlp_size_1': 7, 'mlp_size_2': 0, 'mlp_size_3': 0, 'kernel': 'Exponential', 'loss_name': 'NLLLoss'}. Best is trial 237 with value: 0.7341952549033148.[0m
[32m[I 2022-04-19 06:48:45,968][0m Trial 253 finished with value: 0.7111383107837614 and parameters: {'n_hidden': 2048, 'mixture_components': 1, 'use_sparse_layer': True, 'use_sparse_loss': True, 'lmbd': 0.00025038581040958264, 'use_batchnorm': False, 'use_dropout': True, 'dropout': 0.38355241580726285, 'mlp_size_1': 7, 'mlp_size_2': 0, 'mlp_size_3': 0, 'kernel': 'Exponential', 'loss_name': 'NLLLoss'}. Best is trial 237 with value: 0.7341952549033148.[0m
[32m[I 2022-04-19 06:50:30,244][0m Trial 254 finished with value: 0.7164494434927775 and parameters: {'n_hidden': 2048, 'mixture_components': 1, 'use_sparse_layer': True, 'use_sparse_loss': True, 'lmbd': 0.0003072126157111268, 'use_batchnorm': False, 'use_dropout': True, 'dropout': 0.3198685275344439, 'mlp_size_1': 7, 'mlp_size_2': 0, 'mlp_size_3': 0, 'kernel': 'Exponential', 'loss_name': 'NLLLoss'}. Best is trial 237 with value: 0.7341952549033148.[0m
[32m[I 2022-04-19 06:52:09,580][0m Trial 255 finished with value: 0.6944681202927327 and parameters: {'n_hidden': 2048, 'mixture_components': 1, 'use_sparse_layer': True, 'use_sparse_loss': True, 'lmbd': 0.0002963108811303118, 'use_batchnorm': False, 'use_dropout': True, 'dropout': 0.29538972073050734, 'mlp_size_1': 7, 'mlp_size_2': 0, 'mlp_size_3': 0, 'kernel': 'Exponential', 'loss_name': 'NLLLoss'}. Best is trial 237 with value: 0.7341952549033148.[0m
[32m[I 2022-04-19 06:53:49,423][0m Trial 256 finished with value: 0.7027291330278921 and parameters: {'n_hidden': 2048, 'mixture_components': 1, 'use_sparse_layer': True, 'use_sparse_loss': True, 'lmbd': 0.0003619270791143955, 'use_batchnorm': False, 'use_dropout': True, 'dropout': 0.43658916819842747, 'mlp_size_1': 7, 'mlp_size_2': 0, 'mlp_size_3': 0, 'kernel': 'Exponential', 'loss_name': 'NLLLoss'}. Best is trial 237 with value: 0.7341952549033148.[0m
[32m[I 2022-04-19 06:55:28,543][0m Trial 257 finished with value: 0.7156754674393695 and parameters: {'n_hidden': 2048, 'mixture_components': 1, 'use_sparse_layer': True, 'use_sparse_loss': False, 'use_batchnorm': False, 'use_dropout': True, 'dropout': 0.3265634355348739, 'mlp_size_1': 7, 'mlp_size_2': 0, 'mlp_size_3': 0, 'kernel': 'Exponential', 'loss_name': 'NLLLoss'}. Best is trial 237 with value: 0.7341952549033148.[0m
[32m[I 2022-04-19 06:57:01,718][0m Trial 258 finished with value: 0.6725706083365843 and parameters: {'n_hidden': 2048, 'mixture_components': 1, 'use_sparse_layer': True, 'use_sparse_loss': False, 'use_batchnorm': False, 'use_dropout': True, 'dropout': 0.3213958625884449, 'mlp_size_1': 7, 'mlp_size_2': 0, 'mlp_size_3': 0, 'kernel': 'Exponential', 'loss_name': 'NLLLoss'}. Best is trial 237 with value: 0.7341952549033148.[0m
