[32m[I 2022-04-14 14:15:47,519][0m Trial 523 finished with value: 0.6967752072620966 and parameters: {'loss': 'coxph', 'learning_rate': 8.59396539589753e-06, 'n_estimators': 284, 'criterion': 'friedman_mse', 'min_samples_split': 3, 'min_samples_leaf': 1, 'min_weight_fraction_leaf': 0.059617278438647586, 'min_impurity_decrease': 0.04263138139621532, 'max_features': 0.9631258225455379, 'subsample': 0.8211790445281026, 'dropout_rate': 0.400494829092442, 'ccp_alpha': 0.17996128850155924}. Best is trial 480 with value: 0.7563614380513435.[0m
[32m[I 2022-04-14 14:16:01,124][0m Trial 524 finished with value: 0.7493210324981512 and parameters: {'loss': 'coxph', 'learning_rate': 3.573008375780514e-06, 'n_estimators': 369, 'criterion': 'friedman_mse', 'min_samples_split': 3, 'min_samples_leaf': 1, 'min_weight_fraction_leaf': 0.1016813977924837, 'min_impurity_decrease': 0.05934340146689498, 'max_features': 0.9988376154776782, 'subsample': 0.8443411505906514, 'dropout_rate': 0.4380138639632874, 'ccp_alpha': 0.09079523936337597}. Best is trial 480 with value: 0.7563614380513435.[0m
[32m[I 2022-04-14 14:16:14,867][0m Trial 525 finished with value: 0.6580354697910175 and parameters: {'loss': 'coxph', 'learning_rate': 2.609861101753988e-06, 'n_estimators': 367, 'criterion': 'friedman_mse', 'min_samples_split': 3, 'min_samples_leaf': 1, 'min_weight_fraction_leaf': 0.08416807485449039, 'min_impurity_decrease': 0.0621734358342288, 'max_features': 0.9655772309816906, 'subsample': 0.7892148139071955, 'dropout_rate': 0.45366533941473297, 'ccp_alpha': 0.257621195457708}. Best is trial 480 with value: 0.7563614380513435.[0m
[32m[I 2022-04-14 14:16:30,571][0m Trial 526 finished with value: 0.5 and parameters: {'loss': 'coxph', 'learning_rate': 6.83855999807283e-06, 'n_estimators': 384, 'criterion': 'friedman_mse', 'min_samples_split': 3, 'min_samples_leaf': 1, 'min_weight_fraction_leaf': 0.07235873344988589, 'min_impurity_decrease': 0.06530670825602336, 'max_features': 0.5591691772456817, 'subsample': 0.8414161768876814, 'dropout_rate': 0.40568249015029045, 'ccp_alpha': 0.45150155170473444}. Best is trial 480 with value: 0.7563614380513435.[0m
[32m[I 2022-04-14 14:16:43,405][0m Trial 527 finished with value: 0.3044286045226615 and parameters: {'loss': 'squared', 'learning_rate': 3.302698549413948e-06, 'n_estimators': 346, 'criterion': 'absolute_error', 'min_samples_split': 3, 'min_samples_leaf': 1, 'min_weight_fraction_leaf': 0.10391687352495768, 'min_impurity_decrease': 0.045679398726594087, 'max_features': 0.9447781387971196, 'subsample': 0.8148320737254651, 'dropout_rate': 0.43108001854576933, 'ccp_alpha': 0.1791411880702051}. Best is trial 480 with value: 0.7563614380513435.[0m
[32m[I 2022-04-14 14:17:01,037][0m Trial 528 finished with value: 0.5 and parameters: {'loss': 'coxph', 'learning_rate': 1.1972919932033949e-05, 'n_estimators': 419, 'criterion': 'friedman_mse', 'min_samples_split': 3, 'min_samples_leaf': 1, 'min_weight_fraction_leaf': 0.22193279924456794, 'min_impurity_decrease': 0.06718495620680165, 'max_features': 0.9206217840450086, 'subsample': 0.8574877695102128, 'dropout_rate': 0.4646620435452754, 'ccp_alpha': 0.39759490096192596}. Best is trial 480 with value: 0.7563614380513435.[0m
[32m[I 2022-04-14 14:17:05,925][0m Trial 529 finished with value: 0.5 and parameters: {'loss': 'coxph', 'learning_rate': 3.3449250071481005e-06, 'n_estimators': 199, 'criterion': 'friedman_mse', 'min_samples_split': 3, 'min_samples_leaf': 1, 'min_weight_fraction_leaf': 0.0877865979160533, 'min_impurity_decrease': 0.04001820463125939, 'max_features': 0.9814716147880399, 'subsample': 0.8340082998068001, 'dropout_rate': 0.4411370384071893, 'ccp_alpha': 4.295275208795866}. Best is trial 480 with value: 0.7563614380513435.[0m
[32m[I 2022-04-14 14:17:20,473][0m Trial 530 finished with value: 0.7506722461213361 and parameters: {'loss': 'coxph', 'learning_rate': 1.3751114112842017e-05, 'n_estimators': 361, 'criterion': 'friedman_mse', 'min_samples_split': 3, 'min_samples_leaf': 1, 'min_weight_fraction_leaf': 0.055797049209220136, 'min_impurity_decrease': 0.035868424697940195, 'max_features': 0.999110551504921, 'subsample': 0.8022969903364224, 'dropout_rate': 0.41709769034767796, 'ccp_alpha': 0.09945298557542503}. Best is trial 480 with value: 0.7563614380513435.[0m
[32m[I 2022-04-14 14:17:35,108][0m Trial 531 finished with value: 0.5160881488838708 and parameters: {'loss': 'coxph', 'learning_rate': 1.2056115809004162e-05, 'n_estimators': 362, 'criterion': 'friedman_mse', 'min_samples_split': 3, 'min_samples_leaf': 1, 'min_weight_fraction_leaf': 0.04481284043173987, 'min_impurity_decrease': 0.05596968866597178, 'max_features': 0.9635631229876493, 'subsample': 0.7891887464638483, 'dropout_rate': 0.3756666338592671, 'ccp_alpha': 0.32868796644245063}. Best is trial 480 with value: 0.7563614380513435.[0m
[32m[I 2022-04-14 14:17:50,114][0m Trial 532 finished with value: 0.705562852411834 and parameters: {'loss': 'coxph', 'learning_rate': 1.0529418307582525e-06, 'n_estimators': 369, 'criterion': 'friedman_mse', 'min_samples_split': 3, 'min_samples_leaf': 1, 'min_weight_fraction_leaf': 0.0414882760688318, 'min_impurity_decrease': 0.34176367590580004, 'max_features': 0.9809349724715264, 'subsample': 0.811548911187167, 'dropout_rate': 0.4145921779681296, 'ccp_alpha': 0.1589423533765256}. Best is trial 480 with value: 0.7563614380513435.[0m
[32m[I 2022-04-14 14:18:07,925][0m Trial 533 finished with value: 0.7462556745481418 and parameters: {'loss': 'coxph', 'learning_rate': 4.465223117005117e-06, 'n_estimators': 409, 'criterion': 'friedman_mse', 'min_samples_split': 3, 'min_samples_leaf': 1, 'min_weight_fraction_leaf': 0.03329922929945506, 'min_impurity_decrease': 0.039769546193201784, 'max_features': 0.9447132209071393, 'subsample': 0.8216006962147026, 'dropout_rate': 0.3952814174740646, 'ccp_alpha': 0.09279714805343456}. Best is trial 480 with value: 0.7563614380513435.[0m
[32m[I 2022-04-14 14:18:29,630][0m Trial 534 finished with value: 0.6728576587542443 and parameters: {'loss': 'coxph', 'learning_rate': 3.866010501216286e-06, 'n_estimators': 460, 'criterion': 'friedman_mse', 'min_samples_split': 3, 'min_samples_leaf': 1, 'min_weight_fraction_leaf': 0.05099620717586347, 'min_impurity_decrease': 0.020068006988527592, 'max_features': 0.9682841437939547, 'subsample': 0.7984688386753857, 'dropout_rate': 0.4286751294421063, 'ccp_alpha': 0.246686953290422}. Best is trial 480 with value: 0.7563614380513435.[0m
[32m[I 2022-04-14 14:18:46,891][0m Trial 535 finished with value: 0.7418660301340093 and parameters: {'loss': 'coxph', 'learning_rate': 5.592341086040822e-06, 'n_estimators': 389, 'criterion': 'friedman_mse', 'min_samples_split': 3, 'min_samples_leaf': 1, 'min_weight_fraction_leaf': 0.058786327503126526, 'min_impurity_decrease': 0.06620603144044332, 'max_features': 0.984328839391974, 'subsample': 0.8328006372353762, 'dropout_rate': 0.44584979562550636, 'ccp_alpha': 0.09598500451813001}. Best is trial 480 with value: 0.7563614380513435.[0m
[32m[I 2022-04-14 14:19:00,308][0m Trial 536 finished with value: 0.6886053323883858 and parameters: {'loss': 'coxph', 'learning_rate': 0.02002785412076127, 'n_estimators': 349, 'criterion': 'friedman_mse', 'min_samples_split': 3, 'min_samples_leaf': 1, 'min_weight_fraction_leaf': 0.06606916378011878, 'min_impurity_decrease': 0.03708458286503432, 'max_features': 0.955185847299795, 'subsample': 0.8643625198416479, 'dropout_rate': 0.4553326636360127, 'ccp_alpha': 0.1851884870732532}. Best is trial 480 with value: 0.7563614380513435.[0m
[32m[I 2022-04-14 14:19:15,068][0m Trial 537 finished with value: 0.6910905171021204 and parameters: {'loss': 'coxph', 'learning_rate': 2.229482332328277e-06, 'n_estimators': 377, 'criterion': 'friedman_mse', 'min_samples_split': 3, 'min_samples_leaf': 1, 'min_weight_fraction_leaf': 0.05433807745959911, 'min_impurity_decrease': 0.022455718885648047, 'max_features': 0.927940460048554, 'subsample': 0.16988163236445397, 'dropout_rate': 0.4699924311362586, 'ccp_alpha': 0.09521855459413968}. Best is trial 480 with value: 0.7563614380513435.[0m
[32m[I 2022-04-14 14:19:28,012][0m Trial 538 finished with value: 0.5217459622928541 and parameters: {'loss': 'coxph', 'learning_rate': 8.717224101751565e-06, 'n_estimators': 341, 'criterion': 'friedman_mse', 'min_samples_split': 3, 'min_samples_leaf': 1, 'min_weight_fraction_leaf': 0.07068433994820424, 'min_impurity_decrease': 0.055385885442098555, 'max_features': 0.9826805754016538, 'subsample': 0.8455258223859968, 'dropout_rate': 0.4269878241085219, 'ccp_alpha': 0.2838507264925436}. Best is trial 480 with value: 0.7563614380513435.[0m
[32m[I 2022-04-14 14:19:39,408][0m Trial 539 finished with value: 0.7405555022087366 and parameters: {'loss': 'coxph', 'learning_rate': 1.478508724832346e-05, 'n_estimators': 337, 'criterion': 'friedman_mse', 'min_samples_split': 3, 'min_samples_leaf': 1, 'min_weight_fraction_leaf': 0.09544249290849963, 'min_impurity_decrease': 0.0156630859140573, 'max_features': 0.9994304371754196, 'subsample': 0.8067591360669499, 'dropout_rate': 0.4766241653140789, 'ccp_alpha': 0.10016864592527953}. Best is trial 480 with value: 0.7563614380513435.[0m
[32m[I 2022-04-14 14:19:43,876][0m Trial 540 finished with value: 0.7566929380169813 and parameters: {'loss': 'coxph', 'learning_rate': 1.013667235913893e-05, 'n_estimators': 186, 'criterion': 'friedman_mse', 'min_samples_split': 3, 'min_samples_leaf': 1, 'min_weight_fraction_leaf': 0.07855130468942313, 'min_impurity_decrease': 0.07209660388522035, 'max_features': 0.9628893154441477, 'subsample': 0.8646064276472044, 'dropout_rate': 0.4111198547268434, 'ccp_alpha': 0.0029342971363225797}. Best is trial 540 with value: 0.7566929380169813.[0m
[32m[I 2022-04-14 14:19:48,728][0m Trial 541 finished with value: 0.5 and parameters: {'loss': 'coxph', 'learning_rate': 0.027169093636300018, 'n_estimators': 193, 'criterion': 'friedman_mse', 'min_samples_split': 4, 'min_samples_leaf': 1, 'min_weight_fraction_leaf': 0.06050486410690989, 'min_impurity_decrease': 0.07467014602269943, 'max_features': 0.9643979127951642, 'subsample': 0.8918872645112005, 'dropout_rate': 0.39069985575316285, 'ccp_alpha': 1.567602715906924}. Best is trial 540 with value: 0.7566929380169813.[0m
[32m[I 2022-04-14 14:19:52,803][0m Trial 542 finished with value: 0.7463695806404714 and parameters: {'loss': 'coxph', 'learning_rate': 1.017346991751311e-05, 'n_estimators': 278, 'criterion': 'friedman_mse', 'min_samples_split': 3, 'min_samples_leaf': 1, 'min_weight_fraction_leaf': 0.07501831109517829, 'min_impurity_decrease': 0.06743801515821651, 'max_features': 0.9825358473988357, 'subsample': 0.778388437472304, 'dropout_rate': 0.8478978535200307, 'ccp_alpha': 0.0031456157125933485}. Best is trial 540 with value: 0.7566929380169813.[0m
[32m[I 2022-04-14 14:20:01,499][0m Trial 543 finished with value: 0.5 and parameters: {'loss': 'coxph', 'learning_rate': 1.7229770800149003e-06, 'n_estimators': 315, 'criterion': 'friedman_mse', 'min_samples_split': 3, 'min_samples_leaf': 1, 'min_weight_fraction_leaf': 0.18568109710278397, 'min_impurity_decrease': 0.0480026323840816, 'max_features': 0.9983909038739718, 'subsample': 0.8262022135317215, 'dropout_rate': 0.6266577826077107, 'ccp_alpha': 0.803686374658232}. Best is trial 540 with value: 0.7566929380169813.[0m
[32m[I 2022-04-14 14:20:09,232][0m Trial 544 finished with value: 0.6834721836112492 and parameters: {'loss': 'coxph', 'learning_rate': 1.4264773605232924e-05, 'n_estimators': 266, 'criterion': 'friedman_mse', 'min_samples_split': 3, 'min_samples_leaf': 1, 'min_weight_fraction_leaf': 0.045227739651741525, 'min_impurity_decrease': 0.07203138651829631, 'max_features': 0.9660181777770136, 'subsample': 0.8695223013601371, 'dropout_rate': 0.41491806536504594, 'ccp_alpha': 0.1893960460496048}. Best is trial 540 with value: 0.7566929380169813.[0m
[32m[I 2022-04-14 14:20:12,903][0m Trial 545 finished with value: 0.7131994608140839 and parameters: {'loss': 'coxph', 'learning_rate': 7.739302056835607e-06, 'n_estimators': 179, 'criterion': 'friedman_mse', 'min_samples_split': 3, 'min_samples_leaf': 1, 'min_weight_fraction_leaf': 0.06751067454061091, 'min_impurity_decrease': 0.04951741569964357, 'max_features': 0.13121558396220762, 'subsample': 0.8424808742115983, 'dropout_rate': 0.4547205655087943, 'ccp_alpha': 0.09247942093534664}. Best is trial 540 with value: 0.7566929380169813.[0m
[32m[I 2022-04-14 14:20:15,879][0m Trial 546 finished with value: 0.2965233784618738 and parameters: {'loss': 'squared', 'learning_rate': 6.686521185286183e-06, 'n_estimators': 164, 'criterion': 'friedman_mse', 'min_samples_split': 4, 'min_samples_leaf': 1, 'min_weight_fraction_leaf': 0.07895905399403262, 'min_impurity_decrease': 0.03775056157856993, 'max_features': 0.9989570255603573, 'subsample': 0.8033415829520818, 'dropout_rate': 0.479682944546727, 'ccp_alpha': 0.3743594426048417}. Best is trial 540 with value: 0.7566929380169813.[0m
[32m[I 2022-04-14 14:20:29,081][0m Trial 547 finished with value: 0.5 and parameters: {'loss': 'coxph', 'learning_rate': 2.0586304044948837e-05, 'n_estimators': 328, 'criterion': 'friedman_mse', 'min_samples_split': 3, 'min_samples_leaf': 1, 'min_weight_fraction_leaf': 0.05241563227108957, 'min_impurity_decrease': 0.06755545905066865, 'max_features': 0.9683092542872728, 'subsample': 0.8272030009346113, 'dropout_rate': 0.40547710051625885, 'ccp_alpha': 1.8651979472878868}. Best is trial 540 with value: 0.7566929380169813.[0m
[32m[I 2022-04-14 14:20:31,757][0m Trial 548 finished with value: 0.5 and parameters: {'loss': 'coxph', 'learning_rate': 1.2728944586632535e-05, 'n_estimators': 138, 'criterion': 'absolute_error', 'min_samples_split': 3, 'min_samples_leaf': 1, 'min_weight_fraction_leaf': 0.06658995535678514, 'min_impurity_decrease': 0.017834764261403256, 'max_features': 0.9511760005881789, 'subsample': 0.8982868556469212, 'dropout_rate': 0.36366418213026563, 'ccp_alpha': 0.23175276451766688}. Best is trial 540 with value: 0.7566929380169813.[0m
[32m[I 2022-04-14 14:20:41,417][0m Trial 549 finished with value: 0.7493303260797008 and parameters: {'loss': 'coxph', 'learning_rate': 1.5842733044899692e-05, 'n_estimators': 288, 'criterion': 'friedman_mse', 'min_samples_split': 4, 'min_samples_leaf': 7, 'min_weight_fraction_leaf': 0.08012610047221327, 'min_impurity_decrease': 0.041133894690914406, 'max_features': 0.9998818150176558, 'subsample': 0.8697029104872099, 'dropout_rate': 0.44868430900454503, 'ccp_alpha': 0.0015815263331502535}. Best is trial 540 with value: 0.7566929380169813.[0m
[32m[I 2022-04-14 14:20:51,034][0m Trial 550 finished with value: 0.5 and parameters: {'loss': 'coxph', 'learning_rate': 1.666568427665918e-05, 'n_estimators': 294, 'criterion': 'friedman_mse', 'min_samples_split': 3, 'min_samples_leaf': 7, 'min_weight_fraction_leaf': 0.07861811311914321, 'min_impurity_decrease': 0.05496738173781336, 'max_features': 0.9783910115856046, 'subsample': 0.873093584962051, 'dropout_rate': 0.43534007590502566, 'ccp_alpha': 2.593618957491672}. Best is trial 540 with value: 0.7566929380169813.[0m
[32m[I 2022-04-14 14:20:54,330][0m Trial 551 finished with value: 0.7399515343377713 and parameters: {'loss': 'coxph', 'learning_rate': 2.5962843386099487e-05, 'n_estimators': 235, 'criterion': 'friedman_mse', 'min_samples_split': 4, 'min_samples_leaf': 1, 'min_weight_fraction_leaf': 0.05917647826662539, 'min_impurity_decrease': 0.07315146813802947, 'max_features': 0.931730923059408, 'subsample': 0.8545878406910685, 'dropout_rate': 0.7944688890978888, 'ccp_alpha': 0.0026205401812831068}. Best is trial 540 with value: 0.7566929380169813.[0m
[32m[I 2022-04-14 14:20:58,082][0m Trial 552 finished with value: 0.6834721836112492 and parameters: {'loss': 'coxph', 'learning_rate': 1.6901375738464884e-05, 'n_estimators': 169, 'criterion': 'friedman_mse', 'min_samples_split': 3, 'min_samples_leaf': 6, 'min_weight_fraction_leaf': 0.07178175982299008, 'min_impurity_decrease': 0.6637149002178275, 'max_features': 0.9995011534773199, 'subsample': 0.8827498090152845, 'dropout_rate': 0.4526998187427301, 'ccp_alpha': 0.16642614277807408}. Best is trial 540 with value: 0.7566929380169813.[0m
[32m[I 2022-04-14 14:21:07,838][0m Trial 553 finished with value: 0.7085691239266312 and parameters: {'loss': 'coxph', 'learning_rate': 1.0943928750675467e-05, 'n_estimators': 312, 'criterion': 'friedman_mse', 'min_samples_split': 3, 'min_samples_leaf': 10, 'min_weight_fraction_leaf': 0.08096143679841403, 'min_impurity_decrease': 0.04197917232129947, 'max_features': 0.9657916182957577, 'subsample': 0.9051049992599836, 'dropout_rate': 0.4879819652857111, 'ccp_alpha': 0.10852651517917446}. Best is trial 540 with value: 0.7566929380169813.[0m
[32m[I 2022-04-14 14:21:14,583][0m Trial 554 finished with value: 0.7272686695942456 and parameters: {'loss': 'coxph', 'learning_rate': 2.0871314057296334e-05, 'n_estimators': 253, 'criterion': 'friedman_mse', 'min_samples_split': 4, 'min_samples_leaf': 1, 'min_weight_fraction_leaf': 0.06387784179882668, 'min_impurity_decrease': 0.038456339290780864, 'max_features': 0.9786188007806096, 'subsample': 0.9465785602910832, 'dropout_rate': 0.4407058121348723, 'ccp_alpha': 0.09950693189031655}. Best is trial 540 with value: 0.7566929380169813.[0m
[32m[I 2022-04-14 14:21:28,334][0m Trial 555 finished with value: 0.5328286035390352 and parameters: {'loss': 'coxph', 'learning_rate': 9.085921199834691e-06, 'n_estimators': 354, 'criterion': 'friedman_mse', 'min_samples_split': 3, 'min_samples_leaf': 9, 'min_weight_fraction_leaf': 0.08822494243166148, 'min_impurity_decrease': 0.4441582004807675, 'max_features': 0.9448275045175434, 'subsample': 0.8476671123056491, 'dropout_rate': 0.41410047405803757, 'ccp_alpha': 0.2652620535540711}. Best is trial 540 with value: 0.7566929380169813.[0m
[32m[I 2022-04-14 14:21:39,553][0m Trial 556 finished with value: 0.7377352344777682 and parameters: {'loss': 'coxph', 'learning_rate': 1.3693545849385995e-05, 'n_estimators': 334, 'criterion': 'friedman_mse', 'min_samples_split': 3, 'min_samples_leaf': 7, 'min_weight_fraction_leaf': 0.10451461662686035, 'min_impurity_decrease': 0.0593746487384173, 'max_features': 0.9803763746773873, 'subsample': 0.8685961513341003, 'dropout_rate': 0.4782898802108478, 'ccp_alpha': 0.10003062907280326}. Best is trial 540 with value: 0.7566929380169813.[0m
[32m[I 2022-04-14 14:21:49,143][0m Trial 557 finished with value: 0.6934951908369003 and parameters: {'loss': 'coxph', 'learning_rate': 5.501135734840063e-06, 'n_estimators': 291, 'criterion': 'friedman_mse', 'min_samples_split': 4, 'min_samples_leaf': 1, 'min_weight_fraction_leaf': 0.07229441144104151, 'min_impurity_decrease': 0.07680890560780518, 'max_features': 0.9170906121819533, 'subsample': 0.8425728320750416, 'dropout_rate': 0.3897445060300268, 'ccp_alpha': 0.18220268818867885}. Best is trial 540 with value: 0.7566929380169813.[0m
[32m[I 2022-04-14 14:21:51,760][0m Trial 558 finished with value: 0.7432467031914236 and parameters: {'loss': 'coxph', 'learning_rate': 2.6486745519925223e-05, 'n_estimators': 153, 'criterion': 'friedman_mse', 'min_samples_split': 3, 'min_samples_leaf': 8, 'min_weight_fraction_leaf': 0.03604074403754953, 'min_impurity_decrease': 0.032275521873870866, 'max_features': 0.9552383766449061, 'subsample': 0.8153118662350964, 'dropout_rate': 0.45807768723974884, 'ccp_alpha': 0.08912815325737208}. Best is trial 540 with value: 0.7566929380169813.[0m
[32m[I 2022-04-14 14:22:04,118][0m Trial 559 finished with value: 0.7394319707069743 and parameters: {'loss': 'coxph', 'learning_rate': 1.7625587528447027e-05, 'n_estimators': 312, 'criterion': 'friedman_mse', 'min_samples_split': 3, 'min_samples_leaf': 1, 'min_weight_fraction_leaf': 0.05484984475549115, 'min_impurity_decrease': 0.05415272357135768, 'max_features': 0.9669259201543562, 'subsample': 0.8625925945927191, 'dropout_rate': 0.422339158168741, 'ccp_alpha': 0.006095982881412361}. Best is trial 540 with value: 0.7566929380169813.[0m
[32m[I 2022-04-14 14:22:20,606][0m Trial 560 finished with value: 0.6961170155287855 and parameters: {'loss': 'coxph', 'learning_rate': 1.5218799159834265e-05, 'n_estimators': 371, 'criterion': 'friedman_mse', 'min_samples_split': 3, 'min_samples_leaf': 5, 'min_weight_fraction_leaf': 0.07557171469639558, 'min_impurity_decrease': 0.8432192527379816, 'max_features': 0.9985295933439703, 'subsample': 0.7878329191468036, 'dropout_rate': 0.4594791427976097, 'ccp_alpha': 0.1996141455082051}. Best is trial 540 with value: 0.7566929380169813.[0m
[32m[I 2022-04-14 14:22:33,186][0m Trial 561 finished with value: 0.7350042258444032 and parameters: {'loss': 'coxph', 'learning_rate': 4.097797686772309e-06, 'n_estimators': 324, 'criterion': 'friedman_mse', 'min_samples_split': 4, 'min_samples_leaf': 1, 'min_weight_fraction_leaf': 0.08872549877006237, 'min_impurity_decrease': 0.033956943928011636, 'max_features': 0.9998899006297617, 'subsample': 0.8819503218805784, 'dropout_rate': 0.43953256234198046, 'ccp_alpha': 0.0010309701394672138}. Best is trial 540 with value: 0.7566929380169813.[0m
[32m[I 2022-04-14 14:22:41,933][0m Trial 562 finished with value: 0.5152605940480851 and parameters: {'loss': 'coxph', 'learning_rate': 9.086570415355487e-06, 'n_estimators': 275, 'criterion': 'friedman_mse', 'min_samples_split': 3, 'min_samples_leaf': 6, 'min_weight_fraction_leaf': 0.08198155163295662, 'min_impurity_decrease': 0.07397306463857967, 'max_features': 0.9450383830389042, 'subsample': 0.8430127935680826, 'dropout_rate': 0.49177537859769205, 'ccp_alpha': 0.2915455591315761}. Best is trial 540 with value: 0.7566929380169813.[0m
