[32m[I 2022-04-13 11:44:42,002][0m Trial 756 finished with value: 0.8574177483619669 and parameters: {'splitter': 'random', 'min_samples_split': 0.28910043232657834, 'min_samples_leaf': 0.00923444333841333, 'min_weight_fraction_leaf': 0.09661177481110145, 'max_features': 0.5555673742907645}. Best is trial 156 with value: 0.860262530255716.[0m
[32m[I 2022-04-13 11:44:42,066][0m Trial 757 finished with value: 0.8541689983710665 and parameters: {'splitter': 'random', 'min_samples_split': 0.2496545853684324, 'min_samples_leaf': 0.017349705707861256, 'min_weight_fraction_leaf': 0.05615900624065563, 'max_features': 0.5484981152809849}. Best is trial 156 with value: 0.860262530255716.[0m
[32m[I 2022-04-13 11:44:42,110][0m Trial 758 finished with value: 0.8495779719052834 and parameters: {'splitter': 'random', 'min_samples_split': 0.2897563467541493, 'min_samples_leaf': 0.06383139989926173, 'min_weight_fraction_leaf': 0.069416566956777, 'max_features': 0.577051272566645}. Best is trial 156 with value: 0.860262530255716.[0m
[32m[I 2022-04-13 11:44:42,154][0m Trial 759 finished with value: 0.7999200547726107 and parameters: {'splitter': 'random', 'min_samples_split': 0.2810379257031743, 'min_samples_leaf': 0.05216689122520209, 'min_weight_fraction_leaf': 0.011308260799261657, 'max_features': 0.4722916543429309}. Best is trial 156 with value: 0.860262530255716.[0m
[32m[I 2022-04-13 11:44:42,201][0m Trial 760 finished with value: 0.8544192216908126 and parameters: {'splitter': 'random', 'min_samples_split': 0.2483710805097026, 'min_samples_leaf': 0.030782467742642032, 'min_weight_fraction_leaf': 0.03461560131726697, 'max_features': 0.5307268768657072}. Best is trial 156 with value: 0.860262530255716.[0m
[32m[I 2022-04-13 11:44:42,246][0m Trial 761 finished with value: 0.6295416277238879 and parameters: {'splitter': 'random', 'min_samples_split': 0.2967221446819764, 'min_samples_leaf': 0.04262248695713028, 'min_weight_fraction_leaf': 0.3257586912512955, 'max_features': 0.6255877699072913}. Best is trial 156 with value: 0.860262530255716.[0m
[32m[I 2022-04-13 11:44:42,302][0m Trial 762 finished with value: 0.8537871744804019 and parameters: {'splitter': 'random', 'min_samples_split': 0.28184391337607406, 'min_samples_leaf': 0.0418289692215319, 'min_weight_fraction_leaf': 0.05210769180123776, 'max_features': 0.5661363592668137}. Best is trial 156 with value: 0.860262530255716.[0m
[32m[I 2022-04-13 11:44:42,348][0m Trial 763 finished with value: 0.8497697773353806 and parameters: {'splitter': 'random', 'min_samples_split': 0.25656267918214926, 'min_samples_leaf': 0.13681418826240516, 'min_weight_fraction_leaf': 0.11058912953677208, 'max_features': 0.5957498001111569}. Best is trial 156 with value: 0.860262530255716.[0m
[32m[I 2022-04-13 11:44:42,394][0m Trial 764 finished with value: 0.8537871744804019 and parameters: {'splitter': 'random', 'min_samples_split': 0.2785839830248366, 'min_samples_leaf': 0.050092967642771255, 'min_weight_fraction_leaf': 0.07096985367684805, 'max_features': 0.5858537114881357}. Best is trial 156 with value: 0.860262530255716.[0m
[32m[I 2022-04-13 11:44:42,439][0m Trial 765 finished with value: 0.8490198370094999 and parameters: {'splitter': 'random', 'min_samples_split': 0.2612033680863134, 'min_samples_leaf': 0.017436983368450534, 'min_weight_fraction_leaf': 0.0883201057195912, 'max_features': 0.6104846099779971}. Best is trial 156 with value: 0.860262530255716.[0m
[32m[I 2022-04-13 11:44:42,484][0m Trial 766 finished with value: 0.6342736484317071 and parameters: {'splitter': 'random', 'min_samples_split': 0.267403355177236, 'min_samples_leaf': 0.22824991730538105, 'min_weight_fraction_leaf': 0.019807080900200884, 'max_features': 0.4980601586494217}. Best is trial 156 with value: 0.860262530255716.[0m
[32m[I 2022-04-13 11:44:42,627][0m Trial 767 finished with value: 0.8497697773353806 and parameters: {'splitter': 'random', 'min_samples_split': 0.2622286686669743, 'min_samples_leaf': 0.0678379659613246, 'min_weight_fraction_leaf': 0.13344611646497753, 'max_features': 0.5800126429613417}. Best is trial 156 with value: 0.860262530255716.[0m
[32m[I 2022-04-13 11:44:42,717][0m Trial 768 finished with value: 0.860262530255716 and parameters: {'splitter': 'random', 'min_samples_split': 0.26873324273639143, 'min_samples_leaf': 0.02449389195387265, 'min_weight_fraction_leaf': 0.059086228862353735, 'max_features': 0.621697575130774}. Best is trial 156 with value: 0.860262530255716.[0m
[32m[I 2022-04-13 11:44:42,810][0m Trial 769 finished with value: 0.8537871744804019 and parameters: {'splitter': 'random', 'min_samples_split': 0.2875021666018547, 'min_samples_leaf': 0.04141923364860908, 'min_weight_fraction_leaf': 0.06317114835565815, 'max_features': 0.5684468532777373}. Best is trial 156 with value: 0.860262530255716.[0m
[32m[I 2022-04-13 11:44:42,905][0m Trial 770 finished with value: 0.8555617056756446 and parameters: {'splitter': 'random', 'min_samples_split': 0.2747782843019688, 'min_samples_leaf': 0.028542428454240314, 'min_weight_fraction_leaf': 0.03078546535347216, 'max_features': 0.5867283179002579}. Best is trial 156 with value: 0.860262530255716.[0m
[32m[I 2022-04-13 11:44:43,024][0m Trial 771 finished with value: 0.7999200547726107 and parameters: {'splitter': 'random', 'min_samples_split': 0.3034170852296903, 'min_samples_leaf': 0.056303097700031314, 'min_weight_fraction_leaf': 0.06313228931748117, 'max_features': 0.46230775062916846}. Best is trial 156 with value: 0.860262530255716.[0m
[32m[I 2022-04-13 11:44:43,094][0m Trial 772 finished with value: 0.860262530255716 and parameters: {'splitter': 'random', 'min_samples_split': 0.273676606948994, 'min_samples_leaf': 0.05422951908875119, 'min_weight_fraction_leaf': 0.060563733122664526, 'max_features': 0.6183139965565141}. Best is trial 156 with value: 0.860262530255716.[0m
[32m[I 2022-04-13 11:44:43,168][0m Trial 773 finished with value: 0.8243144312662244 and parameters: {'splitter': 'random', 'min_samples_split': 0.23644914211923215, 'min_samples_leaf': 0.02642133965456698, 'min_weight_fraction_leaf': 0.04404507519386469, 'max_features': 0.6450248742171664}. Best is trial 156 with value: 0.860262530255716.[0m
[32m[I 2022-04-13 11:44:43,237][0m Trial 774 finished with value: 0.8485701042310142 and parameters: {'splitter': 'best', 'min_samples_split': 0.26532498392664766, 'min_samples_leaf': 0.0334621270352499, 'min_weight_fraction_leaf': 0.07605686470715177, 'max_features': 0.5365519954437682}. Best is trial 156 with value: 0.860262530255716.[0m
[32m[I 2022-04-13 11:44:43,303][0m Trial 775 finished with value: 0.8495779719052834 and parameters: {'splitter': 'random', 'min_samples_split': 0.2982155841106988, 'min_samples_leaf': 0.006232322015223004, 'min_weight_fraction_leaf': 0.05009456334867696, 'max_features': 0.5455385526575857}. Best is trial 156 with value: 0.860262530255716.[0m
[32m[I 2022-04-13 11:44:43,376][0m Trial 776 finished with value: 0.8537871744804019 and parameters: {'splitter': 'random', 'min_samples_split': 0.2847130169047854, 'min_samples_leaf': 0.0214347668363793, 'min_weight_fraction_leaf': 0.050036741901499315, 'max_features': 0.575088001031114}. Best is trial 156 with value: 0.860262530255716.[0m
[32m[I 2022-04-13 11:44:43,446][0m Trial 777 finished with value: 0.8204132025252238 and parameters: {'splitter': 'random', 'min_samples_split': 0.24932929713397098, 'min_samples_leaf': 0.017441775522381762, 'min_weight_fraction_leaf': 0.03714166161104634, 'max_features': 0.49995431733167034}. Best is trial 156 with value: 0.860262530255716.[0m
[32m[I 2022-04-13 11:44:43,511][0m Trial 778 finished with value: 0.8495779719052834 and parameters: {'splitter': 'random', 'min_samples_split': 0.28957039402922574, 'min_samples_leaf': 0.03421676059449852, 'min_weight_fraction_leaf': 0.054764792672449755, 'max_features': 0.5396308462447085}. Best is trial 156 with value: 0.860262530255716.[0m
[32m[I 2022-04-13 11:44:43,580][0m Trial 779 finished with value: 0.7999200547726107 and parameters: {'splitter': 'random', 'min_samples_split': 0.2794630800403552, 'min_samples_leaf': 0.03952197775337819, 'min_weight_fraction_leaf': 0.01786280643990779, 'max_features': 0.4816827698335346}. Best is trial 156 with value: 0.860262530255716.[0m
[32m[I 2022-04-13 11:44:43,651][0m Trial 780 finished with value: 0.8130158757335355 and parameters: {'splitter': 'random', 'min_samples_split': 0.27754800109584415, 'min_samples_leaf': 0.01848598795127749, 'min_weight_fraction_leaf': 0.027487866379206694, 'max_features': 0.49565357661123177}. Best is trial 156 with value: 0.860262530255716.[0m
[32m[I 2022-04-13 11:44:43,717][0m Trial 781 finished with value: 0.8490198370094999 and parameters: {'splitter': 'random', 'min_samples_split': 0.25494327774538, 'min_samples_leaf': 0.08131847558650734, 'min_weight_fraction_leaf': 0.08241245407936633, 'max_features': 0.5614149530925697}. Best is trial 156 with value: 0.860262530255716.[0m
[32m[I 2022-04-13 11:44:43,783][0m Trial 782 finished with value: 0.8541689983710665 and parameters: {'splitter': 'random', 'min_samples_split': 0.23887649062466437, 'min_samples_leaf': 0.01698648335615424, 'min_weight_fraction_leaf': 0.04643518537907605, 'max_features': 0.5505592189111088}. Best is trial 156 with value: 0.860262530255716.[0m
[32m[I 2022-04-13 11:44:43,921][0m Trial 783 finished with value: 0.8150092292628249 and parameters: {'splitter': 'random', 'min_samples_split': 0.26927815873393973, 'min_samples_leaf': 0.15304321257092252, 'min_weight_fraction_leaf': 0.05044324800912789, 'max_features': 0.6416230040027701}. Best is trial 156 with value: 0.860262530255716.[0m
[32m[I 2022-04-13 11:44:44,107][0m Trial 784 finished with value: 0.8169418604210963 and parameters: {'splitter': 'random', 'min_samples_split': 0.25383889661965525, 'min_samples_leaf': 0.04659490417407476, 'min_weight_fraction_leaf': 0.07249347332743325, 'max_features': 0.6489464775487832}. Best is trial 156 with value: 0.860262530255716.[0m
[32m[I 2022-04-13 11:44:44,281][0m Trial 785 finished with value: 0.8169418604210963 and parameters: {'splitter': 'random', 'min_samples_split': 0.2657002674629463, 'min_samples_leaf': 0.07297616249817651, 'min_weight_fraction_leaf': 0.07639424824520054, 'max_features': 0.6338696722093653}. Best is trial 156 with value: 0.860262530255716.[0m
[32m[I 2022-04-13 11:44:44,433][0m Trial 786 finished with value: 0.855608859465337 and parameters: {'splitter': 'random', 'min_samples_split': 0.262253235565702, 'min_samples_leaf': 0.03414427474405008, 'min_weight_fraction_leaf': 0.03709751614736417, 'max_features': 0.513022419164097}. Best is trial 156 with value: 0.860262530255716.[0m
[32m[I 2022-04-13 11:44:44,659][0m Trial 787 finished with value: 0.8495779719052834 and parameters: {'splitter': 'random', 'min_samples_split': 0.29451527616684287, 'min_samples_leaf': 0.008020930023980587, 'min_weight_fraction_leaf': 0.054638147145923285, 'max_features': 0.5784247407979602}. Best is trial 156 with value: 0.860262530255716.[0m
[32m[I 2022-04-13 11:44:44,792][0m Trial 788 finished with value: 0.8216008577791938 and parameters: {'splitter': 'random', 'min_samples_split': 0.25217931982208264, 'min_samples_leaf': 0.02159637398447032, 'min_weight_fraction_leaf': 0.04061007159146679, 'max_features': 0.8424886498270445}. Best is trial 156 with value: 0.860262530255716.[0m
[32m[I 2022-04-13 11:44:44,920][0m Trial 789 finished with value: 0.860262530255716 and parameters: {'splitter': 'random', 'min_samples_split': 0.2692927220516269, 'min_samples_leaf': 0.046459194079656076, 'min_weight_fraction_leaf': 0.04269267518686981, 'max_features': 0.604148704630805}. Best is trial 156 with value: 0.860262530255716.[0m
[32m[I 2022-04-13 11:44:45,153][0m Trial 790 finished with value: 0.7426175290362615 and parameters: {'splitter': 'random', 'min_samples_split': 0.2818577880654102, 'min_samples_leaf': 0.19119992413784123, 'min_weight_fraction_leaf': 0.042053317089211895, 'max_features': 0.5694676187761073}. Best is trial 156 with value: 0.860262530255716.[0m
[32m[I 2022-04-13 11:44:45,230][0m Trial 791 finished with value: 0.674703194905135 and parameters: {'splitter': 'random', 'min_samples_split': 0.24283015542846192, 'min_samples_leaf': 0.026059556209013512, 'min_weight_fraction_leaf': 0.22302805863886047, 'max_features': 0.9782790589130952}. Best is trial 156 with value: 0.860262530255716.[0m
[32m[I 2022-04-13 11:44:45,405][0m Trial 792 finished with value: 0.7203943081692755 and parameters: {'splitter': 'random', 'min_samples_split': 0.22684845738807016, 'min_samples_leaf': 0.2425917475766059, 'min_weight_fraction_leaf': 0.03381768428389412, 'max_features': 0.5061744030101526}. Best is trial 156 with value: 0.860262530255716.[0m
[32m[I 2022-04-13 11:44:45,639][0m Trial 793 finished with value: 0.8544192216908126 and parameters: {'splitter': 'random', 'min_samples_split': 0.24553692125862203, 'min_samples_leaf': 0.02158052063646955, 'min_weight_fraction_leaf': 0.02327496546237549, 'max_features': 0.5329785790249802}. Best is trial 156 with value: 0.860262530255716.[0m
[32m[I 2022-04-13 11:44:45,838][0m Trial 794 finished with value: 0.8485701042310142 and parameters: {'splitter': 'best', 'min_samples_split': 0.2748216838070155, 'min_samples_leaf': 0.03202481700656565, 'min_weight_fraction_leaf': 0.05909921752554737, 'max_features': 0.578906885145178}. Best is trial 156 with value: 0.860262530255716.[0m
[32m[I 2022-04-13 11:44:46,046][0m Trial 795 finished with value: 0.860262530255716 and parameters: {'splitter': 'random', 'min_samples_split': 0.2672439823979449, 'min_samples_leaf': 0.05089940301623119, 'min_weight_fraction_leaf': 0.05698214186316196, 'max_features': 0.5937272417325908}. Best is trial 156 with value: 0.860262530255716.[0m
[32m[I 2022-04-13 11:44:46,191][0m Trial 796 finished with value: 0.8515949699867061 and parameters: {'splitter': 'random', 'min_samples_split': 0.3081623960060167, 'min_samples_leaf': 0.018148845519344682, 'min_weight_fraction_leaf': 0.054915982004883374, 'max_features': 0.5489006792076726}. Best is trial 156 with value: 0.860262530255716.[0m
[32m[I 2022-04-13 11:44:46,399][0m Trial 797 finished with value: 0.8536735077998788 and parameters: {'splitter': 'random', 'min_samples_split': 0.2674778223881517, 'min_samples_leaf': 0.06396538069639304, 'min_weight_fraction_leaf': 0.08410638091425059, 'max_features': 0.6107472967805053}. Best is trial 156 with value: 0.860262530255716.[0m
[32m[I 2022-04-13 11:44:46,565][0m Trial 798 finished with value: 0.8169418604210963 and parameters: {'splitter': 'random', 'min_samples_split': 0.25502156277828414, 'min_samples_leaf': 0.06544970982028608, 'min_weight_fraction_leaf': 0.07265495763058549, 'max_features': 0.6273501021884741}. Best is trial 156 with value: 0.860262530255716.[0m
[32m[I 2022-04-13 11:44:46,747][0m Trial 799 finished with value: 0.855608859465337 and parameters: {'splitter': 'random', 'min_samples_split': 0.25789439670445524, 'min_samples_leaf': 0.008203993881826578, 'min_weight_fraction_leaf': 0.0682595907997715, 'max_features': 0.5172165827915972}. Best is trial 156 with value: 0.860262530255716.[0m
[32m[I 2022-04-13 11:44:47,014][0m Trial 800 finished with value: 0.8204132025252238 and parameters: {'splitter': 'random', 'min_samples_split': 0.2598792525844583, 'min_samples_leaf': 0.03436965625727138, 'min_weight_fraction_leaf': 0.031396649987725324, 'max_features': 0.4728629194083692}. Best is trial 156 with value: 0.860262530255716.[0m
[32m[I 2022-04-13 11:44:47,202][0m Trial 801 finished with value: 0.860262530255716 and parameters: {'splitter': 'random', 'min_samples_split': 0.27475286889097655, 'min_samples_leaf': 0.051472864324149166, 'min_weight_fraction_leaf': 0.013744135124402972, 'max_features': 0.5469211708307748}. Best is trial 156 with value: 0.860262530255716.[0m
[32m[I 2022-04-13 11:44:47,342][0m Trial 802 finished with value: 0.8537871744804019 and parameters: {'splitter': 'random', 'min_samples_split': 0.28658545150787806, 'min_samples_leaf': 0.0026540384750433762, 'min_weight_fraction_leaf': 0.060875056078012246, 'max_features': 0.5883489546849509}. Best is trial 156 with value: 0.860262530255716.[0m
[32m[I 2022-04-13 11:44:47,549][0m Trial 803 finished with value: 0.855608859465337 and parameters: {'splitter': 'random', 'min_samples_split': 0.2623948514673174, 'min_samples_leaf': 0.0499917256710677, 'min_weight_fraction_leaf': 0.07629403492391572, 'max_features': 0.6148829035454922}. Best is trial 156 with value: 0.860262530255716.[0m
[32m[I 2022-04-13 11:44:47,652][0m Trial 804 finished with value: 0.8495779719052834 and parameters: {'splitter': 'random', 'min_samples_split': 0.29033343082288304, 'min_samples_leaf': 0.026480684333608957, 'min_weight_fraction_leaf': 0.04420825403875772, 'max_features': 0.5283326575697751}. Best is trial 156 with value: 0.860262530255716.[0m
[32m[I 2022-04-13 11:44:47,764][0m Trial 805 finished with value: 0.8100552370527392 and parameters: {'splitter': 'random', 'min_samples_split': 0.27847475501441893, 'min_samples_leaf': 0.05705162955709879, 'min_weight_fraction_leaf': 0.05518363406406444, 'max_features': 0.6297634634935866}. Best is trial 156 with value: 0.860262530255716.[0m
[32m[I 2022-04-13 11:44:47,858][0m Trial 806 finished with value: 0.8495779719052834 and parameters: {'splitter': 'random', 'min_samples_split': 0.2937424057260579, 'min_samples_leaf': 0.0012780075751112133, 'min_weight_fraction_leaf': 0.05688976252505627, 'max_features': 0.5536241072294633}. Best is trial 156 with value: 0.860262530255716.[0m
[32m[I 2022-04-13 11:44:47,932][0m Trial 807 finished with value: 0.8544192216908126 and parameters: {'splitter': 'random', 'min_samples_split': 0.24866882297394313, 'min_samples_leaf': 0.011415613183153678, 'min_weight_fraction_leaf': 0.028322282946570024, 'max_features': 0.5210316214889975}. Best is trial 156 with value: 0.860262530255716.[0m
[32m[I 2022-04-13 11:44:48,076][0m Trial 808 finished with value: 0.7753860823605387 and parameters: {'splitter': 'random', 'min_samples_split': 0.28445320726893336, 'min_samples_leaf': 0.04421241736719211, 'min_weight_fraction_leaf': 0.06619546401165802, 'max_features': 0.02419877752476296}. Best is trial 156 with value: 0.860262530255716.[0m
[32m[I 2022-04-13 11:44:48,228][0m Trial 809 finished with value: 0.8515949699867061 and parameters: {'splitter': 'random', 'min_samples_split': 0.31358211187633744, 'min_samples_leaf': 0.033943557064255704, 'min_weight_fraction_leaf': 0.05979957996883078, 'max_features': 0.5385805561206501}. Best is trial 156 with value: 0.860262530255716.[0m
[32m[I 2022-04-13 11:44:48,371][0m Trial 810 finished with value: 0.8530273199001748 and parameters: {'splitter': 'random', 'min_samples_split': 0.33933362447667764, 'min_samples_leaf': 0.0015326241477712377, 'min_weight_fraction_leaf': 0.03777385000946447, 'max_features': 0.5098229645260877}. Best is trial 156 with value: 0.860262530255716.[0m
[32m[I 2022-04-13 11:44:48,559][0m Trial 811 finished with value: 0.8160553494736597 and parameters: {'splitter': 'random', 'min_samples_split': 0.2682450748131384, 'min_samples_leaf': 0.039120675938641755, 'min_weight_fraction_leaf': 0.04977663659478688, 'max_features': 0.6879930553909267}. Best is trial 156 with value: 0.860262530255716.[0m
[32m[I 2022-04-13 11:44:48,729][0m Trial 812 finished with value: 0.8160553494736597 and parameters: {'splitter': 'random', 'min_samples_split': 0.2744274206732116, 'min_samples_leaf': 0.04057841190492889, 'min_weight_fraction_leaf': 0.05134176343497052, 'max_features': 0.6719273010144395}. Best is trial 156 with value: 0.860262530255716.[0m
[32m[I 2022-04-13 11:44:48,833][0m Trial 813 finished with value: 0.8217963860521786 and parameters: {'splitter': 'best', 'min_samples_split': 0.2674483008197903, 'min_samples_leaf': 0.02055880033896044, 'min_weight_fraction_leaf': 0.03848950166013046, 'max_features': 0.4956857040691661}. Best is trial 156 with value: 0.860262530255716.[0m
[32m[I 2022-04-13 11:44:48,939][0m Trial 814 finished with value: 0.7929413262536216 and parameters: {'splitter': 'random', 'min_samples_split': 0.2717723761882597, 'min_samples_leaf': 0.027967174299246025, 'min_weight_fraction_leaf': 0.04299495658087683, 'max_features': 0.3066054374098618}. Best is trial 156 with value: 0.860262530255716.[0m
[32m[I 2022-04-13 11:44:49,069][0m Trial 815 finished with value: 0.8100552370527392 and parameters: {'splitter': 'random', 'min_samples_split': 0.2830736058356902, 'min_samples_leaf': 0.03183329566166222, 'min_weight_fraction_leaf': 0.05661621760304324, 'max_features': 0.6423333294773467}. Best is trial 156 with value: 0.860262530255716.[0m
[32m[I 2022-04-13 11:44:49,150][0m Trial 816 finished with value: 0.8456538157200004 and parameters: {'splitter': 'random', 'min_samples_split': 0.20700259338536164, 'min_samples_leaf': 0.028069336020054604, 'min_weight_fraction_leaf': 0.06388202364337252, 'max_features': 0.6226630802842291}. Best is trial 156 with value: 0.860262530255716.[0m
[32m[I 2022-04-13 11:44:49,228][0m Trial 817 finished with value: 0.8507321463909226 and parameters: {'splitter': 'random', 'min_samples_split': 0.25292231498555734, 'min_samples_leaf': 0.01095872985240225, 'min_weight_fraction_leaf': 0.0976768617545207, 'max_features': 0.5966440551766733}. Best is trial 156 with value: 0.860262530255716.[0m
[32m[I 2022-04-13 11:44:49,460][0m Trial 818 finished with value: 0.6188081862944745 and parameters: {'splitter': 'random', 'min_samples_split': 0.27782289100758467, 'min_samples_leaf': 0.42219472999595525, 'min_weight_fraction_leaf': 0.06759735356325325, 'max_features': 0.6058715093927317}. Best is trial 156 with value: 0.860262530255716.[0m
