[32m[I 2022-04-17 07:22:17,332][0m Trial 534 finished with value: 0.8476610612988218 and parameters: {'n_hidden': 32, 'mixture_components': 4, 'use_sparse_layer': False, 'use_batchnorm': True, 'use_dropout': True, 'dropout': 0.5178771562776019, 'mlp_size_1': 0, 'mlp_size_2': 2, 'mlp_size_3': 0, 'kernel': 'Normal', 'loss_name': 'NLLLoss'}. Best is trial 367 with value: 0.8756446640888914.[0m
[32m[I 2022-04-17 07:27:22,146][0m Trial 535 finished with value: 0.8642518236007761 and parameters: {'n_hidden': 64, 'mixture_components': 7, 'use_sparse_layer': False, 'use_batchnorm': True, 'use_dropout': True, 'dropout': 0.564765775849482, 'mlp_size_1': 0, 'mlp_size_2': 2, 'mlp_size_3': 0, 'kernel': 'Exponential', 'loss_name': 'NLLLoss'}. Best is trial 367 with value: 0.8756446640888914.[0m
[32m[I 2022-04-17 07:31:44,800][0m Trial 536 finished with value: 0.8587647381015913 and parameters: {'n_hidden': 512, 'mixture_components': 5, 'use_sparse_layer': False, 'use_batchnorm': True, 'use_dropout': True, 'dropout': 0.7755644735628826, 'mlp_size_1': 0, 'mlp_size_2': 3, 'mlp_size_3': 0, 'kernel': 'Exponential', 'loss_name': 'NLLLoss'}. Best is trial 367 with value: 0.8756446640888914.[0m
[32m[I 2022-04-17 07:35:15,119][0m Trial 537 finished with value: 0.8500706176027082 and parameters: {'n_hidden': 1024, 'mixture_components': 5, 'use_sparse_layer': False, 'use_batchnorm': True, 'use_dropout': True, 'dropout': 0.6253003801619199, 'mlp_size_1': 5, 'mlp_size_2': 2, 'mlp_size_3': 0, 'kernel': 'Exponential', 'loss_name': 'NLLLoss'}. Best is trial 367 with value: 0.8756446640888914.[0m
[32m[I 2022-04-17 07:40:10,185][0m Trial 538 finished with value: 0.8565421138823079 and parameters: {'n_hidden': 128, 'mixture_components': 6, 'use_sparse_layer': False, 'use_batchnorm': True, 'use_dropout': True, 'dropout': 0.8496288452021151, 'mlp_size_1': 0, 'mlp_size_2': 2, 'mlp_size_3': 0, 'kernel': 'Weibull', 'loss_name': 'NLLLoss'}. Best is trial 367 with value: 0.8756446640888914.[0m
[32m[I 2022-04-17 07:45:00,972][0m Trial 539 finished with value: 0.8709646410001213 and parameters: {'n_hidden': 64, 'mixture_components': 4, 'use_sparse_layer': False, 'use_batchnorm': True, 'use_dropout': True, 'dropout': 0.6717098771347549, 'mlp_size_1': 0, 'mlp_size_2': 2, 'mlp_size_3': 0, 'kernel': 'Exponential', 'loss_name': 'NLLLoss'}. Best is trial 367 with value: 0.8756446640888914.[0m
[32m[I 2022-04-17 07:51:13,510][0m Trial 540 finished with value: 0.859148879113171 and parameters: {'n_hidden': 64, 'mixture_components': 4, 'use_sparse_layer': False, 'use_batchnorm': True, 'use_dropout': True, 'dropout': 0.6662055845916711, 'mlp_size_1': 0, 'mlp_size_2': 2, 'mlp_size_3': 0, 'kernel': 'Exponential', 'loss_name': 'AlternativeNLLLoss'}. Best is trial 367 with value: 0.8756446640888914.[0m
[32m[I 2022-04-17 07:56:04,745][0m Trial 541 finished with value: 0.8696267281710887 and parameters: {'n_hidden': 64, 'mixture_components': 4, 'use_sparse_layer': False, 'use_batchnorm': True, 'use_dropout': True, 'dropout': 0.675547108978868, 'mlp_size_1': 0, 'mlp_size_2': 2, 'mlp_size_3': 0, 'kernel': 'Exponential', 'loss_name': 'NLLLoss'}. Best is trial 367 with value: 0.8756446640888914.[0m
[32m[I 2022-04-17 08:00:28,861][0m Trial 542 finished with value: 0.8602327577104154 and parameters: {'n_hidden': 64, 'mixture_components': 4, 'use_sparse_layer': False, 'use_batchnorm': True, 'use_dropout': True, 'dropout': 0.6915333557757071, 'mlp_size_1': 0, 'mlp_size_2': 2, 'mlp_size_3': 0, 'kernel': 'Gamma', 'loss_name': 'NLLLoss'}. Best is trial 367 with value: 0.8756446640888914.[0m
[32m[I 2022-04-17 08:05:39,232][0m Trial 543 finished with value: 0.8658970540961395 and parameters: {'n_hidden': 64, 'mixture_components': 4, 'use_sparse_layer': False, 'use_batchnorm': True, 'use_dropout': True, 'dropout': 0.6555388925069492, 'mlp_size_1': 0, 'mlp_size_2': 2, 'mlp_size_3': 0, 'kernel': 'Exponential', 'loss_name': 'NLLLoss'}. Best is trial 367 with value: 0.8756446640888914.[0m
[32m[I 2022-04-17 08:10:29,200][0m Trial 544 finished with value: 0.845272028972676 and parameters: {'n_hidden': 64, 'mixture_components': 4, 'use_sparse_layer': False, 'use_batchnorm': True, 'use_dropout': True, 'dropout': 0.6248111682585351, 'mlp_size_1': 0, 'mlp_size_2': 2, 'mlp_size_3': 0, 'kernel': 'LogNormal', 'loss_name': 'NLLLoss'}. Best is trial 367 with value: 0.8756446640888914.[0m
[32m[I 2022-04-17 08:16:31,976][0m Trial 545 finished with value: 0.8673668375862729 and parameters: {'n_hidden': 32, 'mixture_components': 4, 'use_sparse_layer': False, 'use_batchnorm': True, 'use_dropout': True, 'dropout': 0.6889862748911428, 'mlp_size_1': 0, 'mlp_size_2': 2, 'mlp_size_3': 0, 'kernel': 'Exponential', 'loss_name': 'NLLLoss'}. Best is trial 367 with value: 0.8756446640888914.[0m
[32m[I 2022-04-17 08:21:39,202][0m Trial 546 finished with value: 0.86872565916796 and parameters: {'n_hidden': 64, 'mixture_components': 4, 'use_sparse_layer': False, 'use_batchnorm': True, 'use_dropout': True, 'dropout': 0.6628373339633299, 'mlp_size_1': 0, 'mlp_size_2': 2, 'mlp_size_3': 0, 'kernel': 'Exponential', 'loss_name': 'NLLLoss'}. Best is trial 367 with value: 0.8756446640888914.[0m
[32m[I 2022-04-17 08:26:42,374][0m Trial 547 finished with value: 0.8725008451267225 and parameters: {'n_hidden': 64, 'mixture_components': 4, 'use_sparse_layer': False, 'use_batchnorm': True, 'use_dropout': True, 'dropout': 0.7013729456990796, 'mlp_size_1': 0, 'mlp_size_2': 2, 'mlp_size_3': 0, 'kernel': 'Exponential', 'loss_name': 'NLLLoss'}. Best is trial 367 with value: 0.8756446640888914.[0m
[32m[I 2022-04-17 08:31:25,238][0m Trial 548 finished with value: 0.8531382878551106 and parameters: {'n_hidden': 64, 'mixture_components': 4, 'use_sparse_layer': False, 'use_batchnorm': True, 'use_dropout': True, 'dropout': 0.7036318698712275, 'mlp_size_1': 0, 'mlp_size_2': 2, 'mlp_size_3': 0, 'kernel': 'Logistic', 'loss_name': 'NLLLoss'}. Best is trial 367 with value: 0.8756446640888914.[0m
[32m[I 2022-04-17 08:32:42,583][0m Trial 549 finished with value: 0.6581700104407638 and parameters: {'n_hidden': 256, 'mixture_components': 4, 'use_sparse_layer': False, 'use_batchnorm': False, 'use_dropout': True, 'dropout': 0.7275179669496669, 'mlp_size_1': 0, 'mlp_size_2': 2, 'mlp_size_3': 0, 'kernel': 'Exponential', 'loss_name': 'NLLLoss'}. Best is trial 367 with value: 0.8756446640888914.[0m
[32m[I 2022-04-17 08:38:22,122][0m Trial 550 finished with value: 0.8686982495414919 and parameters: {'n_hidden': 64, 'mixture_components': 4, 'use_sparse_layer': False, 'use_batchnorm': True, 'use_dropout': True, 'dropout': 0.6955990711447168, 'mlp_size_1': 0, 'mlp_size_2': 2, 'mlp_size_3': 0, 'kernel': 'Exponential', 'loss_name': 'NLLLoss'}. Best is trial 367 with value: 0.8756446640888914.[0m
[32m[I 2022-04-17 08:43:32,412][0m Trial 551 finished with value: 0.8626186452292128 and parameters: {'n_hidden': 64, 'mixture_components': 4, 'use_sparse_layer': False, 'use_batchnorm': True, 'use_dropout': True, 'dropout': 0.7134640648487915, 'mlp_size_1': 0, 'mlp_size_2': 2, 'mlp_size_3': 0, 'kernel': 'Exponential', 'loss_name': 'NLLLoss'}. Best is trial 367 with value: 0.8756446640888914.[0m
[32m[I 2022-04-17 08:46:05,637][0m Trial 552 finished with value: 0.8542979066647132 and parameters: {'n_hidden': 64, 'mixture_components': 4, 'use_sparse_layer': False, 'use_batchnorm': True, 'use_dropout': False, 'mlp_size_1': 0, 'mlp_size_2': 2, 'mlp_size_3': 0, 'kernel': 'Gumbel', 'loss_name': 'NLLLoss'}. Best is trial 367 with value: 0.8756446640888914.[0m
[32m[I 2022-04-17 08:51:53,116][0m Trial 553 finished with value: 0.8683801180454127 and parameters: {'n_hidden': 64, 'mixture_components': 4, 'use_sparse_layer': False, 'use_batchnorm': True, 'use_dropout': True, 'dropout': 0.6903420690126657, 'mlp_size_1': 0, 'mlp_size_2': 2, 'mlp_size_3': 0, 'kernel': 'Exponential', 'loss_name': 'NLLLoss'}. Best is trial 367 with value: 0.8756446640888914.[0m
[32m[I 2022-04-17 08:57:21,290][0m Trial 554 finished with value: 0.8682355887417608 and parameters: {'n_hidden': 64, 'mixture_components': 5, 'use_sparse_layer': False, 'use_batchnorm': True, 'use_dropout': True, 'dropout': 0.671520014680819, 'mlp_size_1': 0, 'mlp_size_2': 2, 'mlp_size_3': 0, 'kernel': 'Exponential', 'loss_name': 'NLLLoss'}. Best is trial 367 with value: 0.8756446640888914.[0m
[32m[I 2022-04-17 09:02:50,141][0m Trial 555 finished with value: 0.840917687785357 and parameters: {'n_hidden': 32, 'mixture_components': 5, 'use_sparse_layer': False, 'use_batchnorm': True, 'use_dropout': True, 'dropout': 0.8924059368829202, 'mlp_size_1': 0, 'mlp_size_2': 2, 'mlp_size_3': 0, 'kernel': 'Exponential', 'loss_name': 'NLLLoss'}. Best is trial 367 with value: 0.8756446640888914.[0m
[32m[I 2022-04-17 09:09:01,970][0m Trial 556 finished with value: 0.8651845762630677 and parameters: {'n_hidden': 64, 'mixture_components': 4, 'use_sparse_layer': False, 'use_batchnorm': True, 'use_dropout': True, 'dropout': 0.7248638779289219, 'mlp_size_1': 0, 'mlp_size_2': 2, 'mlp_size_3': 0, 'kernel': 'Exponential', 'loss_name': 'CensoredNLLLoss'}. Best is trial 367 with value: 0.8756446640888914.[0m
[32m[I 2022-04-17 09:14:27,874][0m Trial 557 finished with value: 0.8730899602112349 and parameters: {'n_hidden': 64, 'mixture_components': 4, 'use_sparse_layer': False, 'use_batchnorm': True, 'use_dropout': True, 'dropout': 0.6821583681499589, 'mlp_size_1': 0, 'mlp_size_2': 2, 'mlp_size_3': 0, 'kernel': 'Exponential', 'loss_name': 'NLLLoss'}. Best is trial 367 with value: 0.8756446640888914.[0m
[32m[I 2022-04-17 09:19:20,470][0m Trial 558 finished with value: 0.8509633176260486 and parameters: {'n_hidden': 2048, 'mixture_components': 4, 'use_sparse_layer': False, 'use_batchnorm': True, 'use_dropout': True, 'dropout': 0.6487117967541975, 'mlp_size_1': 1, 'mlp_size_2': 3, 'mlp_size_3': 4, 'kernel': 'Exponential', 'loss_name': 'NLLLoss'}. Best is trial 367 with value: 0.8756446640888914.[0m
[32m[I 2022-04-17 09:23:05,289][0m Trial 559 finished with value: 0.8569478701972667 and parameters: {'n_hidden': 64, 'mixture_components': 4, 'use_sparse_layer': False, 'use_batchnorm': True, 'use_dropout': True, 'dropout': 0.23259138553386438, 'mlp_size_1': 0, 'mlp_size_2': 2, 'mlp_size_3': 0, 'kernel': 'LogLogistic', 'loss_name': 'NLLLoss'}. Best is trial 367 with value: 0.8756446640888914.[0m
[32m[I 2022-04-17 09:29:20,591][0m Trial 560 finished with value: 0.8714057365633969 and parameters: {'n_hidden': 64, 'mixture_components': 4, 'use_sparse_layer': False, 'use_batchnorm': True, 'use_dropout': True, 'dropout': 0.6791970353900155, 'mlp_size_1': 0, 'mlp_size_2': 2, 'mlp_size_3': 0, 'kernel': 'Exponential', 'loss_name': 'NLLLoss'}. Best is trial 367 with value: 0.8756446640888914.[0m
[32m[I 2022-04-17 09:35:15,501][0m Trial 561 finished with value: 0.8677539019047389 and parameters: {'n_hidden': 64, 'mixture_components': 4, 'use_sparse_layer': False, 'use_batchnorm': True, 'use_dropout': True, 'dropout': 0.7385016828989255, 'mlp_size_1': 0, 'mlp_size_2': 2, 'mlp_size_3': 0, 'kernel': 'Exponential', 'loss_name': 'NLLLoss'}. Best is trial 367 with value: 0.8756446640888914.[0m
[32m[I 2022-04-17 09:41:34,292][0m Trial 562 finished with value: 0.8676290690201611 and parameters: {'n_hidden': 64, 'mixture_components': 4, 'use_sparse_layer': False, 'use_batchnorm': True, 'use_dropout': True, 'dropout': 0.7091615980228462, 'mlp_size_1': 0, 'mlp_size_2': 2, 'mlp_size_3': 0, 'kernel': 'Exponential', 'loss_name': 'NLLLoss'}. Best is trial 367 with value: 0.8756446640888914.[0m
[32m[I 2022-04-17 09:46:58,832][0m Trial 563 finished with value: 0.8681071242371076 and parameters: {'n_hidden': 64, 'mixture_components': 4, 'use_sparse_layer': False, 'use_batchnorm': True, 'use_dropout': True, 'dropout': 0.6810349889532181, 'mlp_size_1': 0, 'mlp_size_2': 2, 'mlp_size_3': 0, 'kernel': 'Exponential', 'loss_name': 'NLLLoss'}. Best is trial 367 with value: 0.8756446640888914.[0m
[32m[I 2022-04-17 09:53:17,475][0m Trial 564 finished with value: 0.8577255353903492 and parameters: {'n_hidden': 128, 'mixture_components': 4, 'use_sparse_layer': False, 'use_batchnorm': True, 'use_dropout': True, 'dropout': 0.6552127050897103, 'mlp_size_1': 0, 'mlp_size_2': 2, 'mlp_size_3': 0, 'kernel': 'Exponential', 'loss_name': 'AlternativeNLLLoss'}. Best is trial 367 with value: 0.8756446640888914.[0m
[32m[I 2022-04-17 09:57:38,194][0m Trial 565 finished with value: 0.8630529743944815 and parameters: {'n_hidden': 256, 'mixture_components': 4, 'use_sparse_layer': False, 'use_batchnorm': True, 'use_dropout': True, 'dropout': 0.7609403678602118, 'mlp_size_1': 0, 'mlp_size_2': 2, 'mlp_size_3': 0, 'kernel': 'Exponential', 'loss_name': 'NLLLoss'}. Best is trial 367 with value: 0.8756446640888914.[0m
[32m[I 2022-04-17 10:02:31,367][0m Trial 566 finished with value: 0.8589961426877284 and parameters: {'n_hidden': 512, 'mixture_components': 4, 'use_sparse_layer': False, 'use_batchnorm': True, 'use_dropout': True, 'dropout': 0.7085526680711793, 'mlp_size_1': 0, 'mlp_size_2': 2, 'mlp_size_3': 3, 'kernel': 'Exponential', 'loss_name': 'NLLLoss'}. Best is trial 367 with value: 0.8756446640888914.[0m
[32m[I 2022-04-17 10:08:23,123][0m Trial 567 finished with value: 0.8654188358113124 and parameters: {'n_hidden': 64, 'mixture_components': 4, 'use_sparse_layer': False, 'use_batchnorm': True, 'use_dropout': True, 'dropout': 0.68315568932346, 'mlp_size_1': 0, 'mlp_size_2': 2, 'mlp_size_3': 0, 'kernel': 'Exponential', 'loss_name': 'NLLLoss'}. Best is trial 367 with value: 0.8756446640888914.[0m
[32m[I 2022-04-17 10:15:42,424][0m Trial 568 finished with value: 0.8421678381427646 and parameters: {'n_hidden': 32, 'mixture_components': 4, 'use_sparse_layer': False, 'use_batchnorm': True, 'use_dropout': True, 'dropout': 0.7333563389365083, 'mlp_size_1': 0, 'mlp_size_2': 2, 'mlp_size_3': 0, 'kernel': 'Weibull', 'loss_name': 'NLLLoss'}. Best is trial 367 with value: 0.8756446640888914.[0m
[32m[I 2022-04-17 10:20:32,442][0m Trial 569 finished with value: 0.8391839378310163 and parameters: {'n_hidden': 1024, 'mixture_components': 4, 'use_sparse_layer': False, 'use_batchnorm': True, 'use_dropout': True, 'dropout': 0.640620096261917, 'mlp_size_1': 1, 'mlp_size_2': 6, 'mlp_size_3': 0, 'kernel': 'Normal', 'loss_name': 'NLLLoss'}. Best is trial 367 with value: 0.8756446640888914.[0m
[32m[I 2022-04-17 10:22:15,532][0m Trial 570 finished with value: 0.6572272888654853 and parameters: {'n_hidden': 64, 'mixture_components': 4, 'use_sparse_layer': False, 'use_batchnorm': False, 'use_dropout': True, 'dropout': 0.6691209210435904, 'mlp_size_1': 0, 'mlp_size_2': 2, 'mlp_size_3': 0, 'kernel': 'Exponential', 'loss_name': 'NLLLoss'}. Best is trial 367 with value: 0.8756446640888914.[0m
[32m[I 2022-04-17 10:28:16,147][0m Trial 571 finished with value: 0.8653606784421288 and parameters: {'n_hidden': 64, 'mixture_components': 4, 'use_sparse_layer': False, 'use_batchnorm': True, 'use_dropout': True, 'dropout': 0.7552546635620092, 'mlp_size_1': 0, 'mlp_size_2': 2, 'mlp_size_3': 0, 'kernel': 'Exponential', 'loss_name': 'NLLLoss'}. Best is trial 367 with value: 0.8756446640888914.[0m
[32m[I 2022-04-17 10:33:59,808][0m Trial 572 finished with value: 0.8690970959976486 and parameters: {'n_hidden': 64, 'mixture_components': 4, 'use_sparse_layer': False, 'use_batchnorm': True, 'use_dropout': True, 'dropout': 0.7015365352853004, 'mlp_size_1': 0, 'mlp_size_2': 2, 'mlp_size_3': 0, 'kernel': 'Exponential', 'loss_name': 'NLLLoss'}. Best is trial 367 with value: 0.8756446640888914.[0m
[32m[I 2022-04-17 10:38:46,683][0m Trial 573 finished with value: 0.851851484938989 and parameters: {'n_hidden': 64, 'mixture_components': 4, 'use_sparse_layer': False, 'use_batchnorm': True, 'use_dropout': True, 'dropout': 0.5444324676969235, 'mlp_size_1': 0, 'mlp_size_2': 2, 'mlp_size_3': 0, 'kernel': 'Gamma', 'loss_name': 'NLLLoss'}. Best is trial 367 with value: 0.8756446640888914.[0m
[32m[I 2022-04-17 10:42:33,093][0m Trial 574 finished with value: 0.8421225463108047 and parameters: {'n_hidden': 64, 'mixture_components': 4, 'use_sparse_layer': False, 'use_batchnorm': True, 'use_dropout': False, 'mlp_size_1': 0, 'mlp_size_2': 2, 'mlp_size_3': 0, 'kernel': 'Exponential', 'loss_name': 'NLLLoss'}. Best is trial 367 with value: 0.8756446640888914.[0m
[32m[I 2022-04-17 10:48:33,673][0m Trial 575 finished with value: 0.8642163864590163 and parameters: {'n_hidden': 64, 'mixture_components': 4, 'use_sparse_layer': False, 'use_batchnorm': True, 'use_dropout': True, 'dropout': 0.7191665291149855, 'mlp_size_1': 0, 'mlp_size_2': 2, 'mlp_size_3': 0, 'kernel': 'Exponential', 'loss_name': 'NLLLoss'}. Best is trial 367 with value: 0.8756446640888914.[0m
[32m[I 2022-04-17 10:52:03,304][0m Trial 576 finished with value: 0.8304601638078157 and parameters: {'n_hidden': 64, 'mixture_components': 4, 'use_sparse_layer': False, 'use_batchnorm': True, 'use_dropout': True, 'dropout': 0.6386145703530371, 'mlp_size_1': 0, 'mlp_size_2': 2, 'mlp_size_3': 0, 'kernel': 'LogNormal', 'loss_name': 'NLLLoss'}. Best is trial 367 with value: 0.8756446640888914.[0m
[32m[I 2022-04-17 10:57:38,854][0m Trial 577 finished with value: 0.8665632514140409 and parameters: {'n_hidden': 32, 'mixture_components': 4, 'use_sparse_layer': False, 'use_batchnorm': True, 'use_dropout': True, 'dropout': 0.6599078701572929, 'mlp_size_1': 0, 'mlp_size_2': 2, 'mlp_size_3': 0, 'kernel': 'Exponential', 'loss_name': 'NLLLoss'}. Best is trial 367 with value: 0.8756446640888914.[0m
[32m[I 2022-04-17 11:02:50,539][0m Trial 578 finished with value: 0.8662956125633077 and parameters: {'n_hidden': 64, 'mixture_components': 2, 'use_sparse_layer': False, 'use_batchnorm': True, 'use_dropout': True, 'dropout': 0.6880758127959163, 'mlp_size_1': 0, 'mlp_size_2': 2, 'mlp_size_3': 0, 'kernel': 'Exponential', 'loss_name': 'NLLLoss'}. Best is trial 367 with value: 0.8756446640888914.[0m
[32m[I 2022-04-17 11:08:59,340][0m Trial 579 finished with value: 0.8664484026430527 and parameters: {'n_hidden': 64, 'mixture_components': 4, 'use_sparse_layer': False, 'use_batchnorm': True, 'use_dropout': True, 'dropout': 0.745119069648051, 'mlp_size_1': 0, 'mlp_size_2': 2, 'mlp_size_3': 0, 'kernel': 'Exponential', 'loss_name': 'CensoredNLLLoss'}. Best is trial 367 with value: 0.8756446640888914.[0m
[32m[I 2022-04-17 11:14:37,668][0m Trial 580 finished with value: 0.8239851164263939 and parameters: {'n_hidden': 64, 'mixture_components': 4, 'use_sparse_layer': False, 'use_batchnorm': True, 'use_dropout': True, 'dropout': 0.7262537763643476, 'mlp_size_1': 0, 'mlp_size_2': 2, 'mlp_size_3': 0, 'kernel': 'Logistic', 'loss_name': 'NLLLoss'}. Best is trial 367 with value: 0.8756446640888914.[0m
[32m[I 2022-04-17 11:18:32,016][0m Trial 581 finished with value: 0.45819532987427314 and parameters: {'n_hidden': 64, 'mixture_components': 4, 'use_sparse_layer': False, 'use_batchnorm': True, 'use_dropout': True, 'dropout': 0.9250458272499158, 'mlp_size_1': 0, 'mlp_size_2': 2, 'mlp_size_3': 0, 'kernel': 'Exponential', 'loss_name': 'NLLLoss'}. Best is trial 367 with value: 0.8756446640888914.[0m
[32m[I 2022-04-17 11:22:14,415][0m Trial 582 finished with value: 0.8556665739332565 and parameters: {'n_hidden': 256, 'mixture_components': 2, 'use_sparse_layer': False, 'use_batchnorm': True, 'use_dropout': True, 'dropout': 0.48492212911259724, 'mlp_size_1': 0, 'mlp_size_2': 2, 'mlp_size_3': 0, 'kernel': 'Exponential', 'loss_name': 'NLLLoss'}. Best is trial 367 with value: 0.8756446640888914.[0m
[32m[I 2022-04-17 11:23:06,288][0m Trial 583 finished with value: -0.5 and parameters: {'n_hidden': 64, 'mixture_components': 2, 'use_sparse_layer': False, 'use_batchnorm': True, 'use_dropout': True, 'dropout': 0.8791463258737227, 'mlp_size_1': 0, 'mlp_size_2': 2, 'mlp_size_3': 0, 'kernel': 'Gumbel', 'loss_name': 'NLLLoss'}. Best is trial 367 with value: 0.8756446640888914.[0m
[32m[I 2022-04-17 11:28:30,697][0m Trial 584 finished with value: 0.8588962292559918 and parameters: {'n_hidden': 64, 'mixture_components': 4, 'use_sparse_layer': False, 'use_batchnorm': True, 'use_dropout': True, 'dropout': 0.8136734886841168, 'mlp_size_1': 0, 'mlp_size_2': 2, 'mlp_size_3': 0, 'kernel': 'Exponential', 'loss_name': 'NLLLoss'}. Best is trial 367 with value: 0.8756446640888914.[0m
[32m[I 2022-04-17 11:35:08,818][0m Trial 585 finished with value: 0.8616020292032018 and parameters: {'n_hidden': 64, 'mixture_components': 4, 'use_sparse_layer': False, 'use_batchnorm': True, 'use_dropout': True, 'dropout': 0.7724564067452092, 'mlp_size_1': 0, 'mlp_size_2': 2, 'mlp_size_3': 0, 'kernel': 'Exponential', 'loss_name': 'AlternativeNLLLoss'}. Best is trial 367 with value: 0.8756446640888914.[0m
[32m[I 2022-04-17 11:40:58,539][0m Trial 586 finished with value: 0.8667784929361242 and parameters: {'n_hidden': 32, 'mixture_components': 2, 'use_sparse_layer': False, 'use_batchnorm': True, 'use_dropout': True, 'dropout': 0.5858344435092028, 'mlp_size_1': 0, 'mlp_size_2': 2, 'mlp_size_3': 0, 'kernel': 'Exponential', 'loss_name': 'NLLLoss'}. Best is trial 367 with value: 0.8756446640888914.[0m
[32m[I 2022-04-17 11:42:27,008][0m Trial 587 finished with value: 0.6538805888378405 and parameters: {'n_hidden': 64, 'mixture_components': 7, 'use_sparse_layer': False, 'use_batchnorm': False, 'use_dropout': True, 'dropout': 0.6752053664395113, 'mlp_size_1': 0, 'mlp_size_2': 2, 'mlp_size_3': 0, 'kernel': 'Exponential', 'loss_name': 'NLLLoss'}. Best is trial 367 with value: 0.8756446640888914.[0m
