[32m[I 2022-04-14 04:04:12,600][0m Trial 962 finished with value: 0.8329448762722584 and parameters: {'loss': 'coxph', 'learning_rate': 0.0037728489575743194, 'n_estimators': 118, 'criterion': 'friedman_mse', 'min_samples_split': 2, 'min_samples_leaf': 3, 'min_weight_fraction_leaf': 0.05183022891813483, 'min_impurity_decrease': 0.9841869029643459, 'max_features': 0.9449442522583466, 'subsample': 0.6938050832393721, 'dropout_rate': 0.8264439975932074, 'ccp_alpha': 0.25623553375054486}. Best is trial 627 with value: 0.8808013426064705.[0m
[32m[I 2022-04-14 04:04:13,908][0m Trial 963 finished with value: 0.8754207150627238 and parameters: {'loss': 'coxph', 'learning_rate': 6.417740201442665e-05, 'n_estimators': 125, 'criterion': 'friedman_mse', 'min_samples_split': 2, 'min_samples_leaf': 3, 'min_weight_fraction_leaf': 0.0587005655746549, 'min_impurity_decrease': 0.33565334835142796, 'max_features': 0.9781155862366425, 'subsample': 0.720220987238953, 'dropout_rate': 0.8727978877643727, 'ccp_alpha': 0.0014840164057945131}. Best is trial 627 with value: 0.8808013426064705.[0m
[32m[I 2022-04-14 04:04:17,859][0m Trial 964 finished with value: 0.65 and parameters: {'loss': 'coxph', 'learning_rate': 1.3435314486671426e-05, 'n_estimators': 130, 'criterion': 'friedman_mse', 'min_samples_split': 2, 'min_samples_leaf': 3, 'min_weight_fraction_leaf': 0.04286988093332723, 'min_impurity_decrease': 0.7871946411570565, 'max_features': 0.9607317414207545, 'subsample': 0.6913955201889148, 'dropout_rate': 0.41172558233552664, 'ccp_alpha': 1.1090539253587837}. Best is trial 627 with value: 0.8808013426064705.[0m
[32m[I 2022-04-14 04:04:21,233][0m Trial 965 finished with value: -0.3607629246377452 and parameters: {'loss': 'squared', 'learning_rate': 0.0027242867472397417, 'n_estimators': 126, 'criterion': 'friedman_mse', 'min_samples_split': 2, 'min_samples_leaf': 9, 'min_weight_fraction_leaf': 0.031083881758733906, 'min_impurity_decrease': 0.752976800675892, 'max_features': 0.9306498357289397, 'subsample': 0.6496612727068295, 'dropout_rate': 0.3829896745857703, 'ccp_alpha': 0.16863306550914983}. Best is trial 627 with value: 0.8808013426064705.[0m
[32m[I 2022-04-14 04:04:22,599][0m Trial 966 finished with value: 0.8691439857867167 and parameters: {'loss': 'coxph', 'learning_rate': 0.0025751918262017456, 'n_estimators': 135, 'criterion': 'friedman_mse', 'min_samples_split': 2, 'min_samples_leaf': 1, 'min_weight_fraction_leaf': 0.06276557418861484, 'min_impurity_decrease': 0.8146366175371093, 'max_features': 0.9842482742836534, 'subsample': 0.71670687116077, 'dropout_rate': 0.7861440352961531, 'ccp_alpha': 0.09075951102929172}. Best is trial 627 with value: 0.8808013426064705.[0m
[32m[I 2022-04-14 04:04:25,721][0m Trial 967 finished with value: 0.8712303243769309 and parameters: {'loss': 'coxph', 'learning_rate': 0.0018544475959015652, 'n_estimators': 132, 'criterion': 'friedman_mse', 'min_samples_split': 2, 'min_samples_leaf': 5, 'min_weight_fraction_leaf': 0.04869404667027563, 'min_impurity_decrease': 0.806506226835886, 'max_features': 0.9519292017097043, 'subsample': 0.6780029280807952, 'dropout_rate': 0.4253932611998785, 'ccp_alpha': 0.0026374086893146288}. Best is trial 627 with value: 0.8808013426064705.[0m
[32m[I 2022-04-14 04:04:28,437][0m Trial 968 finished with value: 0.8593070236047924 and parameters: {'loss': 'coxph', 'learning_rate': 0.004398968327612209, 'n_estimators': 117, 'criterion': 'friedman_mse', 'min_samples_split': 3, 'min_samples_leaf': 3, 'min_weight_fraction_leaf': 0.03665107457470701, 'min_impurity_decrease': 0.9363193213096854, 'max_features': 0.9339458448410664, 'subsample': 0.7046801998874351, 'dropout_rate': 0.39349103347937925, 'ccp_alpha': 0.1704401073030205}. Best is trial 627 with value: 0.8808013426064705.[0m
[32m[I 2022-04-14 04:04:31,250][0m Trial 969 finished with value: 0.7885405433874638 and parameters: {'loss': 'coxph', 'learning_rate': 0.002279979460980816, 'n_estimators': 126, 'criterion': 'friedman_mse', 'min_samples_split': 2, 'min_samples_leaf': 1, 'min_weight_fraction_leaf': 0.05015287411505843, 'min_impurity_decrease': 0.30253223468427404, 'max_features': 0.9833862641575578, 'subsample': 0.6667846531943995, 'dropout_rate': 0.3456696007758601, 'ccp_alpha': 0.2962138897283829}. Best is trial 627 with value: 0.8808013426064705.[0m
[32m[I 2022-04-14 04:04:35,350][0m Trial 970 finished with value: 0.8722917901009968 and parameters: {'loss': 'coxph', 'learning_rate': 0.0031035236382882083, 'n_estimators': 134, 'criterion': 'friedman_mse', 'min_samples_split': 3, 'min_samples_leaf': 1, 'min_weight_fraction_leaf': 0.06263293892531704, 'min_impurity_decrease': 0.872370021228769, 'max_features': 0.9629052481644207, 'subsample': 0.7236031507208452, 'dropout_rate': 0.37771302054527955, 'ccp_alpha': 0.001700888372135581}. Best is trial 627 with value: 0.8808013426064705.[0m
[32m[I 2022-04-14 04:04:37,135][0m Trial 971 finished with value: 0.859328171685789 and parameters: {'loss': 'coxph', 'learning_rate': 3.6891963411205556e-06, 'n_estimators': 137, 'criterion': 'friedman_mse', 'min_samples_split': 3, 'min_samples_leaf': 3, 'min_weight_fraction_leaf': 0.031923373921561214, 'min_impurity_decrease': 0.3787384672946677, 'max_features': 0.17706364522056295, 'subsample': 0.7023296131445655, 'dropout_rate': 0.8080715371352207, 'ccp_alpha': 0.001525315923928812}. Best is trial 627 with value: 0.8808013426064705.[0m
[32m[I 2022-04-14 04:04:38,845][0m Trial 972 finished with value: 0.65 and parameters: {'loss': 'coxph', 'learning_rate': 0.0017619134967050386, 'n_estimators': 111, 'criterion': 'friedman_mse', 'min_samples_split': 2, 'min_samples_leaf': 1, 'min_weight_fraction_leaf': 0.04510623010567648, 'min_impurity_decrease': 0.3483330107330369, 'max_features': 0.9281011993801205, 'subsample': 0.620372057471207, 'dropout_rate': 0.33213878630175786, 'ccp_alpha': 0.4836073490666889}. Best is trial 627 with value: 0.8808013426064705.[0m
[32m[I 2022-04-14 04:04:40,024][0m Trial 973 finished with value: 0.8576350719586012 and parameters: {'loss': 'coxph', 'learning_rate': 0.0037410146999017147, 'n_estimators': 129, 'criterion': 'friedman_mse', 'min_samples_split': 3, 'min_samples_leaf': 3, 'min_weight_fraction_leaf': 0.03925828806194393, 'min_impurity_decrease': 0.31389638578209555, 'max_features': 0.9661403749187745, 'subsample': 0.7197268159831308, 'dropout_rate': 0.762187158442799, 'ccp_alpha': 0.15891929193619397}. Best is trial 627 with value: 0.8808013426064705.[0m
[32m[I 2022-04-14 04:04:42,206][0m Trial 974 finished with value: 0.8670765771633715 and parameters: {'loss': 'coxph', 'learning_rate': 0.0025930453434933674, 'n_estimators': 122, 'criterion': 'friedman_mse', 'min_samples_split': 3, 'min_samples_leaf': 5, 'min_weight_fraction_leaf': 0.05441538249078044, 'min_impurity_decrease': 0.7220938966510559, 'max_features': 0.9458512293873812, 'subsample': 0.684031974002919, 'dropout_rate': 0.4175012077164617, 'ccp_alpha': 0.10102475844936985}. Best is trial 627 with value: 0.8808013426064705.[0m
[32m[I 2022-04-14 04:04:44,654][0m Trial 975 finished with value: 0.8715087128299815 and parameters: {'loss': 'coxph', 'learning_rate': 0.00642834798957253, 'n_estimators': 116, 'criterion': 'friedman_mse', 'min_samples_split': 2, 'min_samples_leaf': 1, 'min_weight_fraction_leaf': 0.02891814727427435, 'min_impurity_decrease': 0.29553351273028855, 'max_features': 0.9848975242976972, 'subsample': 0.7271452028779427, 'dropout_rate': 0.36200462160251606, 'ccp_alpha': 0.08564197363107483}. Best is trial 627 with value: 0.8808013426064705.[0m
[32m[I 2022-04-14 04:04:46,973][0m Trial 976 finished with value: 0.65 and parameters: {'loss': 'coxph', 'learning_rate': 0.0021027413019281483, 'n_estimators': 133, 'criterion': 'absolute_error', 'min_samples_split': 3, 'min_samples_leaf': 3, 'min_weight_fraction_leaf': 0.06396970434819987, 'min_impurity_decrease': 0.3291323329528329, 'max_features': 0.9239508000661951, 'subsample': 0.694785771317634, 'dropout_rate': 0.3881221054240833, 'ccp_alpha': 0.22907752868861525}. Best is trial 627 with value: 0.8808013426064705.[0m
[32m[I 2022-04-14 04:04:50,604][0m Trial 977 finished with value: 0.8714507755464208 and parameters: {'loss': 'coxph', 'learning_rate': 0.0015073203544732107, 'n_estimators': 145, 'criterion': 'friedman_mse', 'min_samples_split': 3, 'min_samples_leaf': 1, 'min_weight_fraction_leaf': 0.04160785943388087, 'min_impurity_decrease': 0.3641341692423061, 'max_features': 0.9621990422659034, 'subsample': 0.661507283269042, 'dropout_rate': 0.32094116620570373, 'ccp_alpha': 0.09460274467462074}. Best is trial 627 with value: 0.8808013426064705.[0m
[32m[I 2022-04-14 04:04:53,482][0m Trial 978 finished with value: 0.65 and parameters: {'loss': 'coxph', 'learning_rate': 0.004492967758110972, 'n_estimators': 137, 'criterion': 'friedman_mse', 'min_samples_split': 3, 'min_samples_leaf': 1, 'min_weight_fraction_leaf': 0.12244195367148517, 'min_impurity_decrease': 0.3958898639500903, 'max_features': 0.9837200450907441, 'subsample': 0.7279531072692033, 'dropout_rate': 0.43106646068431403, 'ccp_alpha': 3.141869980291918}. Best is trial 627 with value: 0.8808013426064705.[0m
[32m[I 2022-04-14 04:04:56,568][0m Trial 979 finished with value: 0.8559697615580939 and parameters: {'loss': 'coxph', 'learning_rate': 0.0029435344007697397, 'n_estimators': 127, 'criterion': 'friedman_mse', 'min_samples_split': 2, 'min_samples_leaf': 1, 'min_weight_fraction_leaf': 0.05651573646199271, 'min_impurity_decrease': 0.28673366826519864, 'max_features': 0.9405393252823377, 'subsample': 0.7062198971447364, 'dropout_rate': 0.28369008885975855, 'ccp_alpha': 0.18510051777358405}. Best is trial 627 with value: 0.8808013426064705.[0m
[32m[I 2022-04-14 04:04:58,149][0m Trial 980 finished with value: 0.8774516443928968 and parameters: {'loss': 'coxph', 'learning_rate': 3.896550077905976e-05, 'n_estimators': 141, 'criterion': 'friedman_mse', 'min_samples_split': 3, 'min_samples_leaf': 3, 'min_weight_fraction_leaf': 0.027874846772221643, 'min_impurity_decrease': 0.25886598690832874, 'max_features': 0.9674072554458256, 'subsample': 0.6779763900421707, 'dropout_rate': 0.8964962890814128, 'ccp_alpha': 0.0014376990503761969}. Best is trial 627 with value: 0.8808013426064705.[0m
[32m[I 2022-04-14 04:04:59,130][0m Trial 981 finished with value: 0.864270818102667 and parameters: {'loss': 'coxph', 'learning_rate': 1.73550426175083e-05, 'n_estimators': 107, 'criterion': 'friedman_mse', 'min_samples_split': 3, 'min_samples_leaf': 3, 'min_weight_fraction_leaf': 0.027127900028536323, 'min_impurity_decrease': 0.21421289420097317, 'max_features': 0.9811320673294264, 'subsample': 0.6344301352745483, 'dropout_rate': 0.9272319557221996, 'ccp_alpha': 0.09416038612841901}. Best is trial 627 with value: 0.8808013426064705.[0m
[32m[I 2022-04-14 04:05:00,548][0m Trial 982 finished with value: 0.8776922549143723 and parameters: {'loss': 'coxph', 'learning_rate': 2.862249224259885e-05, 'n_estimators': 122, 'criterion': 'friedman_mse', 'min_samples_split': 3, 'min_samples_leaf': 3, 'min_weight_fraction_leaf': 0.02697600575252886, 'min_impurity_decrease': 0.25473684417154213, 'max_features': 0.9682571986163118, 'subsample': 0.6591027352125411, 'dropout_rate': 0.88976003581631, 'ccp_alpha': 0.0013418827541777294}. Best is trial 627 with value: 0.8808013426064705.[0m
[32m[I 2022-04-14 04:05:02,045][0m Trial 983 finished with value: -0.30139552703615824 and parameters: {'loss': 'squared', 'learning_rate': 4.2417126430977786e-05, 'n_estimators': 125, 'criterion': 'squared_error', 'min_samples_split': 3, 'min_samples_leaf': 3, 'min_weight_fraction_leaf': 0.02408711746981986, 'min_impurity_decrease': 0.23625701801791757, 'max_features': 0.9962044916382731, 'subsample': 0.6460980174768581, 'dropout_rate': 0.8931940385745627, 'ccp_alpha': 1.2392535376837022}. Best is trial 627 with value: 0.8808013426064705.[0m
[32m[I 2022-04-14 04:05:02,978][0m Trial 984 finished with value: 0.8434370078828654 and parameters: {'loss': 'coxph', 'learning_rate': 1.9333607139805437e-05, 'n_estimators': 113, 'criterion': 'friedman_mse', 'min_samples_split': 3, 'min_samples_leaf': 3, 'min_weight_fraction_leaf': 0.024463008105089584, 'min_impurity_decrease': 0.24944445125248993, 'max_features': 0.9993924684691221, 'subsample': 0.6667835595157511, 'dropout_rate': 0.9034521095589773, 'ccp_alpha': 0.24836504735705794}. Best is trial 627 with value: 0.8808013426064705.[0m
[32m[I 2022-04-14 04:05:03,728][0m Trial 985 finished with value: 0.6576302970240425 and parameters: {'loss': 'coxph', 'learning_rate': 1.530906990830126e-05, 'n_estimators': 119, 'criterion': 'friedman_mse', 'min_samples_split': 3, 'min_samples_leaf': 3, 'min_weight_fraction_leaf': 0.028775089478096448, 'min_impurity_decrease': 0.9082294302643377, 'max_features': 0.9709214450446607, 'subsample': 0.6249610078309479, 'dropout_rate': 0.9489466234330535, 'ccp_alpha': 0.38413846657192907}. Best is trial 627 with value: 0.8808013426064705.[0m
[32m[I 2022-04-14 04:05:04,511][0m Trial 986 finished with value: 0.8597886641932323 and parameters: {'loss': 'coxph', 'learning_rate': 4.649947835391354e-05, 'n_estimators': 117, 'criterion': 'friedman_mse', 'min_samples_split': 3, 'min_samples_leaf': 3, 'min_weight_fraction_leaf': 0.028728620140943743, 'min_impurity_decrease': 0.22664335876140002, 'max_features': 0.9998164842394887, 'subsample': 0.665871536416999, 'dropout_rate': 0.8959800847353893, 'ccp_alpha': 0.16758626861024306}. Best is trial 627 with value: 0.8808013426064705.[0m
[32m[I 2022-04-14 04:05:05,211][0m Trial 987 finished with value: 0.8661111932251006 and parameters: {'loss': 'coxph', 'learning_rate': 3.1388879934702425e-05, 'n_estimators': 114, 'criterion': 'friedman_mse', 'min_samples_split': 3, 'min_samples_leaf': 3, 'min_weight_fraction_leaf': 0.01896240381851798, 'min_impurity_decrease': 0.1847872248848334, 'max_features': 0.970840234405868, 'subsample': 0.6549133358589309, 'dropout_rate': 0.9849503239204497, 'ccp_alpha': 0.1083666801709024}. Best is trial 627 with value: 0.8808013426064705.[0m
[32m[I 2022-04-14 04:05:06,191][0m Trial 988 finished with value: 0.65 and parameters: {'loss': 'coxph', 'learning_rate': 2.345693815370836e-05, 'n_estimators': 121, 'criterion': 'friedman_mse', 'min_samples_split': 3, 'min_samples_leaf': 3, 'min_weight_fraction_leaf': 0.03310071476552662, 'min_impurity_decrease': 0.27168784007236024, 'max_features': 0.9998289399573194, 'subsample': 0.6879874100558263, 'dropout_rate': 0.8573797916104837, 'ccp_alpha': 1.874704581878891}. Best is trial 627 with value: 0.8808013426064705.[0m
[32m[I 2022-04-14 04:05:09,753][0m Trial 989 finished with value: 0.8727211274382203 and parameters: {'loss': 'coxph', 'learning_rate': 2.593053447546119e-05, 'n_estimators': 122, 'criterion': 'friedman_mse', 'min_samples_split': 3, 'min_samples_leaf': 3, 'min_weight_fraction_leaf': 0.025239871704458395, 'min_impurity_decrease': 0.25135046612373974, 'max_features': 0.9650425734160039, 'subsample': 0.7308549743989547, 'dropout_rate': 0.34808874530032824, 'ccp_alpha': 0.08204537630929909}. Best is trial 627 with value: 0.8808013426064705.[0m
[32m[I 2022-04-14 04:05:11,486][0m Trial 990 finished with value: 0.775678989755096 and parameters: {'loss': 'coxph', 'learning_rate': 3.5124648460691845e-05, 'n_estimators': 127, 'criterion': 'friedman_mse', 'min_samples_split': 3, 'min_samples_leaf': 3, 'min_weight_fraction_leaf': 0.03532742604439282, 'min_impurity_decrease': 0.21668742478979863, 'max_features': 0.9807935627910033, 'subsample': 0.6809767804865651, 'dropout_rate': 0.816923346591922, 'ccp_alpha': 0.31705474198742944}. Best is trial 627 with value: 0.8808013426064705.[0m
[32m[I 2022-04-14 04:05:13,010][0m Trial 991 finished with value: 0.8576350719586012 and parameters: {'loss': 'coxph', 'learning_rate': 6.961754364205289e-05, 'n_estimators': 116, 'criterion': 'friedman_mse', 'min_samples_split': 3, 'min_samples_leaf': 3, 'min_weight_fraction_leaf': 0.02353464504451728, 'min_impurity_decrease': 0.2673946101845433, 'max_features': 0.9616553916821802, 'subsample': 0.7007813434202704, 'dropout_rate': 0.8718370398560231, 'ccp_alpha': 0.17547249917804478}. Best is trial 627 with value: 0.8808013426064705.[0m
[32m[I 2022-04-14 04:05:15,499][0m Trial 992 finished with value: 0.8656337897924251 and parameters: {'loss': 'coxph', 'learning_rate': 5.151049874205342e-05, 'n_estimators': 122, 'criterion': 'friedman_mse', 'min_samples_split': 3, 'min_samples_leaf': 3, 'min_weight_fraction_leaf': 0.03691936807743894, 'min_impurity_decrease': 0.24986592640839445, 'max_features': 0.7268362500585168, 'subsample': 0.5831450129378427, 'dropout_rate': 0.32046975987136617, 'ccp_alpha': 0.08676175460430792}. Best is trial 627 with value: 0.8808013426064705.[0m
[32m[I 2022-04-14 04:05:16,429][0m Trial 993 finished with value: 0.8286264471725378 and parameters: {'loss': 'coxph', 'learning_rate': 4.532687146720633e-05, 'n_estimators': 133, 'criterion': 'friedman_mse', 'min_samples_split': 3, 'min_samples_leaf': 3, 'min_weight_fraction_leaf': 0.01919928564233495, 'min_impurity_decrease': 0.2713939242020927, 'max_features': 0.952863321802194, 'subsample': 0.7238274963003541, 'dropout_rate': 0.9101314574333422, 'ccp_alpha': 0.24823854609226378}. Best is trial 627 with value: 0.8808013426064705.[0m
[32m[I 2022-04-14 04:05:17,166][0m Trial 994 finished with value: 0.8693288776378557 and parameters: {'loss': 'coxph', 'learning_rate': 2.310719609520457e-05, 'n_estimators': 110, 'criterion': 'friedman_mse', 'min_samples_split': 3, 'min_samples_leaf': 3, 'min_weight_fraction_leaf': 0.032863409873291886, 'min_impurity_decrease': 0.23107065107994817, 'max_features': 0.9760174010489868, 'subsample': 0.6458435218007563, 'dropout_rate': 0.901028528859485, 'ccp_alpha': 0.08863615982917915}. Best is trial 627 with value: 0.8808013426064705.[0m
[32m[I 2022-04-14 04:05:20,711][0m Trial 995 finished with value: 0.876538295879137 and parameters: {'loss': 'coxph', 'learning_rate': 8.65789867146075e-06, 'n_estimators': 131, 'criterion': 'friedman_mse', 'min_samples_split': 3, 'min_samples_leaf': 3, 'min_weight_fraction_leaf': 0.03762642824989127, 'min_impurity_decrease': 0.24914053146300413, 'max_features': 0.9827462768666384, 'subsample': 0.7022255027193934, 'dropout_rate': 0.2976117936050878, 'ccp_alpha': 0.003584669057087709}. Best is trial 627 with value: 0.8808013426064705.[0m
[32m[I 2022-04-14 04:05:21,617][0m Trial 996 finished with value: 0.854569741895115 and parameters: {'loss': 'coxph', 'learning_rate': 5.841362931786807e-06, 'n_estimators': 124, 'criterion': 'friedman_mse', 'min_samples_split': 3, 'min_samples_leaf': 5, 'min_weight_fraction_leaf': 0.02467354462099715, 'min_impurity_decrease': 0.27053299538897496, 'max_features': 0.9533502366185125, 'subsample': 0.7350966660314185, 'dropout_rate': 0.9111401880154855, 'ccp_alpha': 0.16590400596086083}. Best is trial 627 with value: 0.8808013426064705.[0m
[32m[I 2022-04-14 04:05:22,905][0m Trial 997 finished with value: 0.8662666951016131 and parameters: {'loss': 'coxph', 'learning_rate': 9.673566816975873e-06, 'n_estimators': 129, 'criterion': 'friedman_mse', 'min_samples_split': 3, 'min_samples_leaf': 3, 'min_weight_fraction_leaf': 0.04028713934381874, 'min_impurity_decrease': 0.2841621938586066, 'max_features': 0.9708946677013505, 'subsample': 0.671128852774838, 'dropout_rate': 0.895453916495532, 'ccp_alpha': 0.10382088182899385}. Best is trial 627 with value: 0.8808013426064705.[0m
[32m[I 2022-04-14 04:05:24,301][0m Trial 998 finished with value: 0.65 and parameters: {'loss': 'coxph', 'learning_rate': 1.5026399122215124e-05, 'n_estimators': 117, 'criterion': 'absolute_error', 'min_samples_split': 3, 'min_samples_leaf': 3, 'min_weight_fraction_leaf': 0.029897150913320354, 'min_impurity_decrease': 0.21623711239873677, 'max_features': 0.953505795229021, 'subsample': 0.7189350889360405, 'dropout_rate': 0.832928358066521, 'ccp_alpha': 0.001367353948190517}. Best is trial 627 with value: 0.8808013426064705.[0m
[32m[I 2022-04-14 04:05:25,180][0m Trial 999 finished with value: 0.8389109363044056 and parameters: {'loss': 'coxph', 'learning_rate': 1.7075097232926936e-05, 'n_estimators': 107, 'criterion': 'friedman_mse', 'min_samples_split': 3, 'min_samples_leaf': 3, 'min_weight_fraction_leaf': 0.019376927375868484, 'min_impurity_decrease': 0.2605264965143424, 'max_features': 0.9800354201796377, 'subsample': 0.6879242300495353, 'dropout_rate': 0.8874909165620067, 'ccp_alpha': 0.24428855116062176}. Best is trial 627 with value: 0.8808013426064705.[0m
[32m[I 2022-04-14 04:05:25,191][0m A new study created in memory with name: no-name-aa1beed5-07a5-4f3e-9428-87bf10d20ee9[0m
[32m[I 2022-04-14 04:05:28,196][0m Trial 0 finished with value: 0.5 and parameters: {'loss': 'coxph', 'learning_rate': 0.00024771853268344105, 'n_estimators': 323, 'criterion': 'squared_error', 'min_samples_split': 10, 'min_samples_leaf': 1, 'min_weight_fraction_leaf': 0.2584026121388817, 'min_impurity_decrease': 0.0023166790403866553, 'max_features': 0.4567174810982827, 'subsample': 0.9351760888566376, 'dropout_rate': 0.9879016757832444, 'ccp_alpha': 0.9146532001718265}. Best is trial 0 with value: 0.5.[0m
[32m[I 2022-04-14 04:05:36,333][0m Trial 1 finished with value: 0.5 and parameters: {'loss': 'coxph', 'learning_rate': 1.2806047797547212e-05, 'n_estimators': 358, 'criterion': 'friedman_mse', 'min_samples_split': 2, 'min_samples_leaf': 4, 'min_weight_fraction_leaf': 0.08038577006628968, 'min_impurity_decrease': 0.08744091772798875, 'max_features': 0.5339611045803114, 'subsample': 0.18106463167739853, 'dropout_rate': 0.8128071494542142, 'ccp_alpha': 2.2982527814211102}. Best is trial 0 with value: 0.5.[0m
