[32m[I 2022-04-13 11:45:25,023][0m Trial 196 finished with value: 0.7131405564108027 and parameters: {'splitter': 'best', 'min_samples_split': 0.08440989899983051, 'min_samples_leaf': 0.04307537283587062, 'min_weight_fraction_leaf': 0.1370483250580236, 'max_features': 0.5763785468001286}. Best is trial 163 with value: 0.7137418010284807.[0m
[32m[I 2022-04-13 11:45:25,074][0m Trial 197 finished with value: 0.6751900786136191 and parameters: {'splitter': 'best', 'min_samples_split': 0.05384500172809993, 'min_samples_leaf': 0.026548178853613495, 'min_weight_fraction_leaf': 0.15481151392842613, 'max_features': 0.5804293343279833}. Best is trial 163 with value: 0.7137418010284807.[0m
[32m[I 2022-04-13 11:45:25,109][0m Trial 198 finished with value: 0.6781188968084007 and parameters: {'splitter': 'best', 'min_samples_split': 0.06888333653395885, 'min_samples_leaf': 0.04568778677422457, 'min_weight_fraction_leaf': 0.16996423768531668, 'max_features': 0.6777996822479467}. Best is trial 163 with value: 0.7137418010284807.[0m
[32m[I 2022-04-13 11:45:25,148][0m Trial 199 finished with value: 0.6914642841588751 and parameters: {'splitter': 'best', 'min_samples_split': 0.10386873507635375, 'min_samples_leaf': 0.03338254191743413, 'min_weight_fraction_leaf': 0.1334798115246335, 'max_features': 0.6359021110000631}. Best is trial 163 with value: 0.7137418010284807.[0m
[32m[I 2022-04-13 11:45:25,190][0m Trial 200 finished with value: 0.7131405564108027 and parameters: {'splitter': 'best', 'min_samples_split': 0.045809898606174196, 'min_samples_leaf': 0.036391666514908105, 'min_weight_fraction_leaf': 0.14409618293586687, 'max_features': 0.5937135675884817}. Best is trial 163 with value: 0.7137418010284807.[0m
[32m[I 2022-04-13 11:45:25,234][0m Trial 201 finished with value: 0.6832725645429367 and parameters: {'splitter': 'best', 'min_samples_split': 0.044186150239055706, 'min_samples_leaf': 0.06446166396983326, 'min_weight_fraction_leaf': 0.14589266541879653, 'max_features': 0.6082636261556712}. Best is trial 163 with value: 0.7137418010284807.[0m
[32m[I 2022-04-13 11:45:25,283][0m Trial 202 finished with value: 0.6891921741320086 and parameters: {'splitter': 'best', 'min_samples_split': 0.09561528502221214, 'min_samples_leaf': 0.022747033266985423, 'min_weight_fraction_leaf': 0.11966458325578312, 'max_features': 0.567587681399893}. Best is trial 163 with value: 0.7137418010284807.[0m
[32m[I 2022-04-13 11:45:25,318][0m Trial 203 finished with value: 0.6891921741320086 and parameters: {'splitter': 'best', 'min_samples_split': 0.11498077644160723, 'min_samples_leaf': 0.041602461399692765, 'min_weight_fraction_leaf': 0.12800334240070343, 'max_features': 0.5525047825004676}. Best is trial 163 with value: 0.7137418010284807.[0m
[32m[I 2022-04-13 11:45:25,350][0m Trial 204 finished with value: 0.6751900786136191 and parameters: {'splitter': 'best', 'min_samples_split': 0.035885589851126505, 'min_samples_leaf': 0.05160749774026634, 'min_weight_fraction_leaf': 0.1572900065880241, 'max_features': 0.5833007583060885}. Best is trial 163 with value: 0.7137418010284807.[0m
[32m[I 2022-04-13 11:45:25,395][0m Trial 205 finished with value: 0.7131405564108027 and parameters: {'splitter': 'best', 'min_samples_split': 0.08273693117417252, 'min_samples_leaf': 0.07029913021188638, 'min_weight_fraction_leaf': 0.14184297194991433, 'max_features': 0.6231400907500322}. Best is trial 163 with value: 0.7137418010284807.[0m
[32m[I 2022-04-13 11:45:25,439][0m Trial 206 finished with value: 0.7029215914224277 and parameters: {'splitter': 'best', 'min_samples_split': 0.06552662163857371, 'min_samples_leaf': 0.05977884866116653, 'min_weight_fraction_leaf': 0.11382684806805721, 'max_features': 0.6048444132250581}. Best is trial 163 with value: 0.7137418010284807.[0m
[32m[I 2022-04-13 11:45:25,477][0m Trial 207 finished with value: 0.6706932697334469 and parameters: {'splitter': 'best', 'min_samples_split': 0.051238197637234736, 'min_samples_leaf': 0.07922193376232159, 'min_weight_fraction_leaf': 0.1491122700765366, 'max_features': 0.6268528735204807}. Best is trial 163 with value: 0.7137418010284807.[0m
[32m[I 2022-04-13 11:45:25,522][0m Trial 208 finished with value: 0.7131405564108027 and parameters: {'splitter': 'best', 'min_samples_split': 0.11234597715653946, 'min_samples_leaf': 0.05030283465682017, 'min_weight_fraction_leaf': 0.13313486912564712, 'max_features': 0.5550733679444403}. Best is trial 163 with value: 0.7137418010284807.[0m
[32m[I 2022-04-13 11:45:25,569][0m Trial 209 finished with value: 0.6891921741320086 and parameters: {'splitter': 'best', 'min_samples_split': 0.10158308509790169, 'min_samples_leaf': 0.05092413657970128, 'min_weight_fraction_leaf': 0.12438520741041252, 'max_features': 0.5538576669342345}. Best is trial 163 with value: 0.7137418010284807.[0m
[32m[I 2022-04-13 11:45:25,598][0m Trial 210 finished with value: 0.6914642841588751 and parameters: {'splitter': 'best', 'min_samples_split': 0.08070713271720412, 'min_samples_leaf': 0.03567151897145182, 'min_weight_fraction_leaf': 0.13946771197156738, 'max_features': 0.6408855319813154}. Best is trial 163 with value: 0.7137418010284807.[0m
[32m[I 2022-04-13 11:45:25,672][0m Trial 211 finished with value: 0.6832725645429367 and parameters: {'splitter': 'best', 'min_samples_split': 0.057949311480690754, 'min_samples_leaf': 0.029622290799200233, 'min_weight_fraction_leaf': 0.1466403723614867, 'max_features': 0.5869835571359245}. Best is trial 163 with value: 0.7137418010284807.[0m
[32m[I 2022-04-13 11:45:25,760][0m Trial 212 finished with value: 0.7131405564108027 and parameters: {'splitter': 'best', 'min_samples_split': 0.012046944272302358, 'min_samples_leaf': 0.0551636230018635, 'min_weight_fraction_leaf': 0.1341517263203598, 'max_features': 0.6012101355535916}. Best is trial 163 with value: 0.7137418010284807.[0m
[32m[I 2022-04-13 11:45:25,892][0m Trial 213 finished with value: 0.7131405564108027 and parameters: {'splitter': 'best', 'min_samples_split': 0.09291511681041212, 'min_samples_leaf': 0.058784525958765, 'min_weight_fraction_leaf': 0.13599580443065068, 'max_features': 0.6150795428709671}. Best is trial 163 with value: 0.7137418010284807.[0m
[32m[I 2022-04-13 11:45:25,972][0m Trial 214 finished with value: 0.6727701215232552 and parameters: {'splitter': 'best', 'min_samples_split': 0.007446602680377971, 'min_samples_leaf': 0.06642649171542397, 'min_weight_fraction_leaf': 0.16582175184693068, 'max_features': 0.6137336218644147}. Best is trial 163 with value: 0.7137418010284807.[0m
[32m[I 2022-04-13 11:45:26,067][0m Trial 215 finished with value: 0.7131405564108027 and parameters: {'splitter': 'best', 'min_samples_split': 0.04202785450018628, 'min_samples_leaf': 0.03936887055111463, 'min_weight_fraction_leaf': 0.14460063755800232, 'max_features': 0.5958848028185271}. Best is trial 163 with value: 0.7137418010284807.[0m
[32m[I 2022-04-13 11:45:26,113][0m Trial 216 finished with value: 0.6891921741320086 and parameters: {'splitter': 'best', 'min_samples_split': 0.11982079710111256, 'min_samples_leaf': 0.022983847912293114, 'min_weight_fraction_leaf': 0.1227574383823373, 'max_features': 0.5312785713132407}. Best is trial 163 with value: 0.7137418010284807.[0m
[32m[I 2022-04-13 11:45:26,202][0m Trial 217 finished with value: 0.6751900786136191 and parameters: {'splitter': 'best', 'min_samples_split': 0.07976787687069527, 'min_samples_leaf': 0.019107150044425696, 'min_weight_fraction_leaf': 0.15770999462196078, 'max_features': 0.5701894055766368}. Best is trial 163 with value: 0.7137418010284807.[0m
[32m[I 2022-04-13 11:45:26,257][0m Trial 218 finished with value: 0.6832725645429367 and parameters: {'splitter': 'best', 'min_samples_split': 0.03531209394538121, 'min_samples_leaf': 0.03619818796542706, 'min_weight_fraction_leaf': 0.1478192309230247, 'max_features': 0.5957458991325738}. Best is trial 163 with value: 0.7137418010284807.[0m
[32m[I 2022-04-13 11:45:26,355][0m Trial 219 finished with value: 0.7131405564108027 and parameters: {'splitter': 'best', 'min_samples_split': 0.07490797434800293, 'min_samples_leaf': 0.03071761258377713, 'min_weight_fraction_leaf': 0.1426872100734356, 'max_features': 0.5934899223002141}. Best is trial 163 with value: 0.7137418010284807.[0m
[32m[I 2022-04-13 11:45:26,424][0m Trial 220 finished with value: 0.6610317386342024 and parameters: {'splitter': 'best', 'min_samples_split': 0.124121135824922, 'min_samples_leaf': 0.32557111381541337, 'min_weight_fraction_leaf': 0.11169783926470553, 'max_features': 0.5396130725244648}. Best is trial 163 with value: 0.7137418010284807.[0m
[32m[I 2022-04-13 11:45:26,505][0m Trial 221 finished with value: 0.6832725645429367 and parameters: {'splitter': 'best', 'min_samples_split': 0.08443603630205695, 'min_samples_leaf': 0.043760051811391365, 'min_weight_fraction_leaf': 0.14598716180705015, 'max_features': 0.573942273679354}. Best is trial 163 with value: 0.7137418010284807.[0m
[32m[I 2022-04-13 11:45:26,583][0m Trial 222 finished with value: 0.6914642841588751 and parameters: {'splitter': 'best', 'min_samples_split': 0.08923141242755692, 'min_samples_leaf': 0.059227416367039376, 'min_weight_fraction_leaf': 0.13991618888609078, 'max_features': 0.646937162161707}. Best is trial 163 with value: 0.7137418010284807.[0m
[32m[I 2022-04-13 11:45:26,663][0m Trial 223 finished with value: 0.6751900786136191 and parameters: {'splitter': 'best', 'min_samples_split': 0.07034463410461193, 'min_samples_leaf': 0.037614600179506394, 'min_weight_fraction_leaf': 0.1560720395110976, 'max_features': 0.5894953638937941}. Best is trial 163 with value: 0.7137418010284807.[0m
[32m[I 2022-04-13 11:45:26,690][0m Trial 224 finished with value: 0.6460578825638428 and parameters: {'splitter': 'best', 'min_samples_split': 0.10788255469276432, 'min_samples_leaf': 0.045417870508629866, 'min_weight_fraction_leaf': 0.28109764448789043, 'max_features': 0.520324421814258}. Best is trial 163 with value: 0.7137418010284807.[0m
[32m[I 2022-04-13 11:45:26,769][0m Trial 225 finished with value: 0.6891921741320086 and parameters: {'splitter': 'best', 'min_samples_split': 0.01660015701718699, 'min_samples_leaf': 0.07229596567839253, 'min_weight_fraction_leaf': 0.12790037796026937, 'max_features': 0.6221468245686926}. Best is trial 163 with value: 0.7137418010284807.[0m
[32m[I 2022-04-13 11:45:26,834][0m Trial 226 finished with value: 0.6891921741320086 and parameters: {'splitter': 'best', 'min_samples_split': 0.10570745221400638, 'min_samples_leaf': 0.02566790950835684, 'min_weight_fraction_leaf': 0.12328086077938284, 'max_features': 0.5439281163500775}. Best is trial 163 with value: 0.7137418010284807.[0m
[32m[I 2022-04-13 11:45:26,862][0m Trial 227 finished with value: 0.6815535256784726 and parameters: {'splitter': 'best', 'min_samples_split': 0.3396952556800455, 'min_samples_leaf': 0.013348533032248797, 'min_weight_fraction_leaf': 0.13707528226811352, 'max_features': 0.5711602887081215}. Best is trial 163 with value: 0.7137418010284807.[0m
[32m[I 2022-04-13 11:45:26,890][0m Trial 228 finished with value: 0.7044783206942828 and parameters: {'splitter': 'best', 'min_samples_split': 0.3044760953343672, 'min_samples_leaf': 0.03565672447170463, 'min_weight_fraction_leaf': 0.1290407390512856, 'max_features': 0.5637206094964318}. Best is trial 163 with value: 0.7137418010284807.[0m
[32m[I 2022-04-13 11:45:26,961][0m Trial 229 finished with value: 0.6727701215232552 and parameters: {'splitter': 'best', 'min_samples_split': 0.06198803228801742, 'min_samples_leaf': 0.043329783798501366, 'min_weight_fraction_leaf': 0.16674497487732884, 'max_features': 0.502641600898341}. Best is trial 163 with value: 0.7137418010284807.[0m
[32m[I 2022-04-13 11:45:27,037][0m Trial 230 finished with value: 0.6891921741320086 and parameters: {'splitter': 'best', 'min_samples_split': 0.08909076371532135, 'min_samples_leaf': 0.04892806086287631, 'min_weight_fraction_leaf': 0.13125658215109834, 'max_features': 0.6210755370882766}. Best is trial 163 with value: 0.7137418010284807.[0m
[32m[I 2022-04-13 11:45:27,065][0m Trial 231 finished with value: 0.7131405564108027 and parameters: {'splitter': 'best', 'min_samples_split': 0.09870989926333126, 'min_samples_leaf': 0.035951188820761974, 'min_weight_fraction_leaf': 0.13980888296079128, 'max_features': 0.5811013652733716}. Best is trial 163 with value: 0.7137418010284807.[0m
[32m[I 2022-04-13 11:45:27,092][0m Trial 232 finished with value: 0.7131405564108027 and parameters: {'splitter': 'best', 'min_samples_split': 0.09942521525436976, 'min_samples_leaf': 0.029095090316336423, 'min_weight_fraction_leaf': 0.1393429249900243, 'max_features': 0.5861541085299552}. Best is trial 163 with value: 0.7137418010284807.[0m
[32m[I 2022-04-13 11:45:27,169][0m Trial 233 finished with value: 0.6751900786136191 and parameters: {'splitter': 'best', 'min_samples_split': 0.09414877517300672, 'min_samples_leaf': 0.03022344657550169, 'min_weight_fraction_leaf': 0.15430971467546445, 'max_features': 0.5941082375840959}. Best is trial 163 with value: 0.7137418010284807.[0m
[32m[I 2022-04-13 11:45:27,247][0m Trial 234 finished with value: 0.6914642841588751 and parameters: {'splitter': 'best', 'min_samples_split': 0.0515277979841442, 'min_samples_leaf': 0.07404011912035742, 'min_weight_fraction_leaf': 0.14296596290422314, 'max_features': 0.6322188725549384}. Best is trial 163 with value: 0.7137418010284807.[0m
[32m[I 2022-04-13 11:45:27,301][0m Trial 235 finished with value: 0.6511505741801622 and parameters: {'splitter': 'best', 'min_samples_split': 0.10267066398866893, 'min_samples_leaf': 0.23466609687538426, 'min_weight_fraction_leaf': 0.11615477527706097, 'max_features': 0.5205289170995081}. Best is trial 163 with value: 0.7137418010284807.[0m
[32m[I 2022-04-13 11:45:27,388][0m Trial 236 finished with value: 0.7131405564108027 and parameters: {'splitter': 'best', 'min_samples_split': 0.022922244165837175, 'min_samples_leaf': 0.060108448899611484, 'min_weight_fraction_leaf': 0.13492955197598253, 'max_features': 0.5986884700596599}. Best is trial 163 with value: 0.7137418010284807.[0m
[32m[I 2022-04-13 11:45:27,426][0m Trial 237 finished with value: 0.6891921741320086 and parameters: {'splitter': 'best', 'min_samples_split': 0.12601017900352943, 'min_samples_leaf': 0.05926633622235197, 'min_weight_fraction_leaf': 0.13151420147582335, 'max_features': 0.5470405002483525}. Best is trial 163 with value: 0.7137418010284807.[0m
[32m[I 2022-04-13 11:45:27,486][0m Trial 238 finished with value: 0.6751900786136191 and parameters: {'splitter': 'best', 'min_samples_split': 0.11641497587944753, 'min_samples_leaf': 0.04753654553767486, 'min_weight_fraction_leaf': 0.1522366472464519, 'max_features': 0.5650875367739382}. Best is trial 163 with value: 0.7137418010284807.[0m
[32m[I 2022-04-13 11:45:27,564][0m Trial 239 finished with value: 0.646198624362591 and parameters: {'splitter': 'best', 'min_samples_split': 0.1132628700681755, 'min_samples_leaf': 0.05525265712822925, 'min_weight_fraction_leaf': 0.11991690179399916, 'max_features': 0.4874521653024433}. Best is trial 163 with value: 0.7137418010284807.[0m
[32m[I 2022-04-13 11:45:27,592][0m Trial 240 finished with value: 0.6832725645429367 and parameters: {'splitter': 'best', 'min_samples_split': 0.044159663989628194, 'min_samples_leaf': 0.08335341277774412, 'min_weight_fraction_leaf': 0.14624163029510368, 'max_features': 0.6098370234556975}. Best is trial 163 with value: 0.7137418010284807.[0m
[32m[I 2022-04-13 11:45:27,675][0m Trial 241 finished with value: 0.7131405564108027 and parameters: {'splitter': 'best', 'min_samples_split': 0.026529307150014766, 'min_samples_leaf': 0.036753019742023676, 'min_weight_fraction_leaf': 0.13187009027169008, 'max_features': 0.5998684483585264}. Best is trial 163 with value: 0.7137418010284807.[0m
[32m[I 2022-04-13 11:45:27,758][0m Trial 242 finished with value: 0.6914642841588751 and parameters: {'splitter': 'best', 'min_samples_split': 0.08368234576528748, 'min_samples_leaf': 0.06928901823676947, 'min_weight_fraction_leaf': 0.13205507054921242, 'max_features': 0.6479482688644368}. Best is trial 163 with value: 0.7137418010284807.[0m
[32m[I 2022-04-13 11:45:27,843][0m Trial 243 finished with value: 0.6891921741320086 and parameters: {'splitter': 'best', 'min_samples_split': 0.003559608935002746, 'min_samples_leaf': 0.02107625407399863, 'min_weight_fraction_leaf': 0.12438677473968326, 'max_features': 0.5349552713040444}. Best is trial 163 with value: 0.7137418010284807.[0m
[32m[I 2022-04-13 11:45:27,958][0m Trial 244 finished with value: 0.7131405564108027 and parameters: {'splitter': 'best', 'min_samples_split': 0.07823131388879831, 'min_samples_leaf': 0.04671332227261218, 'min_weight_fraction_leaf': 0.1408109083323937, 'max_features': 0.6175453050066191}. Best is trial 163 with value: 0.7137418010284807.[0m
[32m[I 2022-04-13 11:45:28,048][0m Trial 245 finished with value: 0.6727701215232552 and parameters: {'splitter': 'best', 'min_samples_split': 0.07287276233903169, 'min_samples_leaf': 0.044203114018498635, 'min_weight_fraction_leaf': 0.16004364737447418, 'max_features': 0.5636446833786511}. Best is trial 163 with value: 0.7137418010284807.[0m
[32m[I 2022-04-13 11:45:28,142][0m Trial 246 finished with value: 0.7029215914224277 and parameters: {'splitter': 'best', 'min_samples_split': 0.014401102567382725, 'min_samples_leaf': 0.030301610072385396, 'min_weight_fraction_leaf': 0.1078759147350146, 'max_features': 0.6130338100530295}. Best is trial 163 with value: 0.7137418010284807.[0m
[32m[I 2022-04-13 11:45:28,236][0m Trial 247 finished with value: 0.6914642841588751 and parameters: {'splitter': 'best', 'min_samples_split': 0.022789175206091156, 'min_samples_leaf': 0.021982310946924398, 'min_weight_fraction_leaf': 0.1368408763804874, 'max_features': 0.6648842943259843}. Best is trial 163 with value: 0.7137418010284807.[0m
[32m[I 2022-04-13 11:45:28,304][0m Trial 248 finished with value: 0.6832725645429367 and parameters: {'splitter': 'best', 'min_samples_split': 0.05973355288432512, 'min_samples_leaf': 0.03675793519114685, 'min_weight_fraction_leaf': 0.14539450680911598, 'max_features': 0.588724535235891}. Best is trial 163 with value: 0.7137418010284807.[0m
[32m[I 2022-04-13 11:45:28,343][0m Trial 249 finished with value: 0.6545185965974921 and parameters: {'splitter': 'best', 'min_samples_split': 0.041793617742984075, 'min_samples_leaf': 0.05308219433339176, 'min_weight_fraction_leaf': 0.12878845456263333, 'max_features': 0.6360683009066282}. Best is trial 163 with value: 0.7137418010284807.[0m
[32m[I 2022-04-13 11:45:28,373][0m Trial 250 finished with value: 0.6832725645429367 and parameters: {'splitter': 'best', 'min_samples_split': 0.08030933301223603, 'min_samples_leaf': 0.05242555689812822, 'min_weight_fraction_leaf': 0.1509449071649847, 'max_features': 0.5877169009212141}. Best is trial 163 with value: 0.7137418010284807.[0m
[32m[I 2022-04-13 11:45:28,401][0m Trial 251 finished with value: 0.7029215914224277 and parameters: {'splitter': 'best', 'min_samples_split': 0.07182272784477708, 'min_samples_leaf': 0.06785026486692194, 'min_weight_fraction_leaf': 0.11736196012334062, 'max_features': 0.6031456362473906}. Best is trial 163 with value: 0.7137418010284807.[0m
[32m[I 2022-04-13 11:45:28,432][0m Trial 252 finished with value: 0.7131405564108027 and parameters: {'splitter': 'best', 'min_samples_split': 0.26699835968143987, 'min_samples_leaf': 0.013066642120872917, 'min_weight_fraction_leaf': 0.1344152747927209, 'max_features': 0.5477976219617018}. Best is trial 163 with value: 0.7137418010284807.[0m
[32m[I 2022-04-13 11:45:28,463][0m Trial 253 finished with value: 0.7137418010284807 and parameters: {'splitter': 'best', 'min_samples_split': 0.32610214672806864, 'min_samples_leaf': 0.013335528663612255, 'min_weight_fraction_leaf': 0.12871576221393155, 'max_features': 0.5514614310862105}. Best is trial 163 with value: 0.7137418010284807.[0m
[32m[I 2022-04-13 11:45:28,492][0m Trial 254 finished with value: 0.6891921741320086 and parameters: {'splitter': 'best', 'min_samples_split': 0.13337485320653172, 'min_samples_leaf': 0.012895296917291845, 'min_weight_fraction_leaf': 0.12209856715433606, 'max_features': 0.5464058044340049}. Best is trial 163 with value: 0.7137418010284807.[0m
[32m[I 2022-04-13 11:45:28,521][0m Trial 255 finished with value: 0.6727701215232552 and parameters: {'splitter': 'best', 'min_samples_split': 0.3280513828254203, 'min_samples_leaf': 0.009013734609315819, 'min_weight_fraction_leaf': 0.14675369984136177, 'max_features': 0.6226728509926078}. Best is trial 163 with value: 0.7137418010284807.[0m
[32m[I 2022-04-13 11:45:28,577][0m Trial 256 finished with value: 0.6727701215232552 and parameters: {'splitter': 'best', 'min_samples_split': 0.02791624391957539, 'min_samples_leaf': 0.06083889462156014, 'min_weight_fraction_leaf': 0.1585103774188044, 'max_features': 0.6024052437622568}. Best is trial 163 with value: 0.7137418010284807.[0m
[32m[I 2022-04-13 11:45:28,606][0m Trial 257 finished with value: 0.7044783206942828 and parameters: {'splitter': 'best', 'min_samples_split': 0.3038191417285653, 'min_samples_leaf': 0.03589230339168363, 'min_weight_fraction_leaf': 0.11041793412413525, 'max_features': 0.5821272355421483}. Best is trial 163 with value: 0.7137418010284807.[0m
[32m[I 2022-04-13 11:45:28,662][0m Trial 258 finished with value: 0.6865730374003304 and parameters: {'splitter': 'best', 'min_samples_split': 0.28142119858524456, 'min_samples_leaf': 0.01556335076176703, 'min_weight_fraction_leaf': 0.1301711034552843, 'max_features': 0.5597821493317434}. Best is trial 163 with value: 0.7137418010284807.[0m
