[32m[I 2022-04-13 11:45:17,771][0m Trial 70 finished with value: 0.7022120919517791 and parameters: {'splitter': 'best', 'min_samples_split': 0.14559321326719601, 'min_samples_leaf': 0.08566024142999976, 'min_weight_fraction_leaf': 0.10455904583176784, 'max_features': 0.6042699788986866}. Best is trial 52 with value: 0.7102488705631708.[0m
[32m[I 2022-04-13 11:45:17,853][0m Trial 71 finished with value: 0.7029215914224277 and parameters: {'splitter': 'best', 'min_samples_split': 0.14986778006931908, 'min_samples_leaf': 0.08467716114679825, 'min_weight_fraction_leaf': 0.10766659282455028, 'max_features': 0.6070090270727133}. Best is trial 52 with value: 0.7102488705631708.[0m
[32m[I 2022-04-13 11:45:17,920][0m Trial 72 finished with value: 0.694086407378037 and parameters: {'splitter': 'best', 'min_samples_split': 0.12006980841686771, 'min_samples_leaf': 0.0018314086074234879, 'min_weight_fraction_leaf': 0.18603036341259355, 'max_features': 0.5116962325486345}. Best is trial 52 with value: 0.7102488705631708.[0m
[32m[I 2022-04-13 11:45:18,087][0m Trial 73 finished with value: 0.6891921741320086 and parameters: {'splitter': 'best', 'min_samples_split': 0.16926232752457793, 'min_samples_leaf': 0.061657530157719916, 'min_weight_fraction_leaf': 0.1228331659229822, 'max_features': 0.5693566242086063}. Best is trial 52 with value: 0.7102488705631708.[0m
[32m[I 2022-04-13 11:45:18,175][0m Trial 74 finished with value: 0.6487907369070997 and parameters: {'splitter': 'best', 'min_samples_split': 0.19542639016879582, 'min_samples_leaf': 0.036902958891900595, 'min_weight_fraction_leaf': 0.09021601116543405, 'max_features': 0.6788583130027399}. Best is trial 52 with value: 0.7102488705631708.[0m
[32m[I 2022-04-13 11:45:18,298][0m Trial 75 finished with value: 0.6891921741320086 and parameters: {'splitter': 'best', 'min_samples_split': 0.14789441502162895, 'min_samples_leaf': 0.12487606109617688, 'min_weight_fraction_leaf': 0.10975441783127257, 'max_features': 0.526457536802592}. Best is trial 52 with value: 0.7102488705631708.[0m
[32m[I 2022-04-13 11:45:18,358][0m Trial 76 finished with value: 0.4667260506642073 and parameters: {'splitter': 'random', 'min_samples_split': 0.0032615556647640834, 'min_samples_leaf': 0.1030935979658345, 'min_weight_fraction_leaf': 0.13868363519703308, 'max_features': 0.46376619757374177}. Best is trial 52 with value: 0.7102488705631708.[0m
[32m[I 2022-04-13 11:45:18,406][0m Trial 77 finished with value: 0.6957088154521375 and parameters: {'splitter': 'best', 'min_samples_split': 0.03801049336662571, 'min_samples_leaf': 0.0747655098301492, 'min_weight_fraction_leaf': 0.06723281859414632, 'max_features': 0.6257505213021051}. Best is trial 52 with value: 0.7102488705631708.[0m
[32m[I 2022-04-13 11:45:18,499][0m Trial 78 finished with value: 0.6300184585256496 and parameters: {'splitter': 'random', 'min_samples_split': 0.21683845170337404, 'min_samples_leaf': 0.08960884277279303, 'min_weight_fraction_leaf': 0.15464485748484832, 'max_features': 0.7116545552530407}. Best is trial 52 with value: 0.7102488705631708.[0m
[32m[I 2022-04-13 11:45:18,564][0m Trial 79 finished with value: 0.6553558002087415 and parameters: {'splitter': 'best', 'min_samples_split': 0.17529043650721413, 'min_samples_leaf': 0.022883859017783, 'min_weight_fraction_leaf': 0.0890990902477729, 'max_features': 0.42197539567638487}. Best is trial 52 with value: 0.7102488705631708.[0m
[32m[I 2022-04-13 11:45:18,633][0m Trial 80 finished with value: 0.6995395546707612 and parameters: {'splitter': 'random', 'min_samples_split': 0.08811732829110556, 'min_samples_leaf': 0.1373661366713677, 'min_weight_fraction_leaf': 0.04490962925620903, 'max_features': 0.5555086746232542}. Best is trial 52 with value: 0.7102488705631708.[0m
[32m[I 2022-04-13 11:45:18,709][0m Trial 81 finished with value: 0.7022120919517791 and parameters: {'splitter': 'best', 'min_samples_split': 0.15388689219609547, 'min_samples_leaf': 0.07996288739886614, 'min_weight_fraction_leaf': 0.10197193923635883, 'max_features': 0.6074250816432791}. Best is trial 52 with value: 0.7102488705631708.[0m
[32m[I 2022-04-13 11:45:18,776][0m Trial 82 finished with value: 0.6891921741320086 and parameters: {'splitter': 'best', 'min_samples_split': 0.11541403927977092, 'min_samples_leaf': 0.06165956664692545, 'min_weight_fraction_leaf': 0.1279727948016651, 'max_features': 0.5971902779802322}. Best is trial 52 with value: 0.7102488705631708.[0m
[32m[I 2022-04-13 11:45:18,853][0m Trial 83 finished with value: 0.6698092846019142 and parameters: {'splitter': 'best', 'min_samples_split': 0.14203831340804993, 'min_samples_leaf': 0.11343386640809842, 'min_weight_fraction_leaf': 0.07740116975101544, 'max_features': 0.6482951739433961}. Best is trial 52 with value: 0.7102488705631708.[0m
[32m[I 2022-04-13 11:45:18,931][0m Trial 84 finished with value: 0.6461234076985904 and parameters: {'splitter': 'best', 'min_samples_split': 0.15879277758851643, 'min_samples_leaf': 0.07743636347108697, 'min_weight_fraction_leaf': 0.11085932586278718, 'max_features': 0.4962609404611516}. Best is trial 52 with value: 0.7102488705631708.[0m
[32m[I 2022-04-13 11:45:18,970][0m Trial 85 finished with value: 0.6511505741801622 and parameters: {'splitter': 'best', 'min_samples_split': 0.4103624033531129, 'min_samples_leaf': 0.16421131793329102, 'min_weight_fraction_leaf': 0.2289729003062701, 'max_features': 0.5401785465694335}. Best is trial 52 with value: 0.7102488705631708.[0m
[32m[I 2022-04-13 11:45:19,015][0m Trial 86 finished with value: 0.6809325111928844 and parameters: {'splitter': 'best', 'min_samples_split': 0.1874494624857899, 'min_samples_leaf': 0.09278357061672537, 'min_weight_fraction_leaf': 0.1799544222367519, 'max_features': 0.5894061730709648}. Best is trial 52 with value: 0.7102488705631708.[0m
[32m[I 2022-04-13 11:45:19,070][0m Trial 87 finished with value: 0.6590154246497999 and parameters: {'splitter': 'best', 'min_samples_split': 0.23639522123507914, 'min_samples_leaf': 0.04164140717589561, 'min_weight_fraction_leaf': 0.05783418872125134, 'max_features': 0.6675683341289292}. Best is trial 52 with value: 0.7102488705631708.[0m
[32m[I 2022-04-13 11:45:19,096][0m Trial 88 finished with value: 0.6756258056123825 and parameters: {'splitter': 'random', 'min_samples_split': 0.20688525352253131, 'min_samples_leaf': 0.016282191187584553, 'min_weight_fraction_leaf': 0.0839693226998218, 'max_features': 0.5639419751110365}. Best is trial 52 with value: 0.7102488705631708.[0m
[32m[I 2022-04-13 11:45:19,127][0m Trial 89 finished with value: 0.6583665273701206 and parameters: {'splitter': 'best', 'min_samples_split': 0.04777412447601606, 'min_samples_leaf': 0.21521438288851213, 'min_weight_fraction_leaf': 0.012442751218371649, 'max_features': 0.6274608169871656}. Best is trial 52 with value: 0.7102488705631708.[0m
[32m[I 2022-04-13 11:45:19,182][0m Trial 90 finished with value: 0.6781188968084007 and parameters: {'splitter': 'best', 'min_samples_split': 0.15628328259161564, 'min_samples_leaf': 0.05966892258498904, 'min_weight_fraction_leaf': 0.1628507530919413, 'max_features': 0.7117108509588123}. Best is trial 52 with value: 0.7102488705631708.[0m
[32m[I 2022-04-13 11:45:19,230][0m Trial 91 finished with value: 0.7022120919517791 and parameters: {'splitter': 'best', 'min_samples_split': 0.1292468774348405, 'min_samples_leaf': 0.08179813506153731, 'min_weight_fraction_leaf': 0.10225543016938077, 'max_features': 0.60952488399708}. Best is trial 52 with value: 0.7102488705631708.[0m
[32m[I 2022-04-13 11:45:19,266][0m Trial 92 finished with value: 0.7131405564108027 and parameters: {'splitter': 'best', 'min_samples_split': 0.13243442673348765, 'min_samples_leaf': 0.10854183570281067, 'min_weight_fraction_leaf': 0.13610770541408077, 'max_features': 0.5217675610825863}. Best is trial 92 with value: 0.7131405564108027.[0m
[32m[I 2022-04-13 11:45:19,321][0m Trial 93 finished with value: 0.7131405564108027 and parameters: {'splitter': 'best', 'min_samples_split': 0.09322509365549853, 'min_samples_leaf': 0.11086025293321641, 'min_weight_fraction_leaf': 0.1370950300743713, 'max_features': 0.5201385584933517}. Best is trial 92 with value: 0.7131405564108027.[0m
[32m[I 2022-04-13 11:45:19,367][0m Trial 94 finished with value: 0.6891921741320086 and parameters: {'splitter': 'best', 'min_samples_split': 0.09295308557832382, 'min_samples_leaf': 0.1096052041653284, 'min_weight_fraction_leaf': 0.1252093640374195, 'max_features': 0.5255821906985162}. Best is trial 92 with value: 0.7131405564108027.[0m
[32m[I 2022-04-13 11:45:19,412][0m Trial 95 finished with value: 0.6418695587507137 and parameters: {'splitter': 'best', 'min_samples_split': 0.07172439061794232, 'min_samples_leaf': 0.1856808569945269, 'min_weight_fraction_leaf': 0.1472006709836111, 'max_features': 0.45791874549184186}. Best is trial 92 with value: 0.7131405564108027.[0m
[32m[I 2022-04-13 11:45:19,465][0m Trial 96 finished with value: 0.6779120275351271 and parameters: {'splitter': 'best', 'min_samples_split': 0.021328565640303443, 'min_samples_leaf': 0.1433825364190775, 'min_weight_fraction_leaf': 0.20337616384447466, 'max_features': 0.5093980504001934}. Best is trial 92 with value: 0.7131405564108027.[0m
[32m[I 2022-04-13 11:45:19,492][0m Trial 97 finished with value: 0.4667260506642073 and parameters: {'splitter': 'random', 'min_samples_split': 0.11014261926244975, 'min_samples_leaf': 0.11693770042144688, 'min_weight_fraction_leaf': 0.14023827304350173, 'max_features': 0.47423483406586264}. Best is trial 92 with value: 0.7131405564108027.[0m
[32m[I 2022-04-13 11:45:19,536][0m Trial 98 finished with value: 0.6891921741320086 and parameters: {'splitter': 'best', 'min_samples_split': 0.12044776479057102, 'min_samples_leaf': 0.1252284415346024, 'min_weight_fraction_leaf': 0.11845102128746463, 'max_features': 0.5773467240600232}. Best is trial 92 with value: 0.7131405564108027.[0m
[32m[I 2022-04-13 11:45:19,584][0m Trial 99 finished with value: 0.7022120919517791 and parameters: {'splitter': 'best', 'min_samples_split': 0.05133979168579922, 'min_samples_leaf': 0.10267562678395191, 'min_weight_fraction_leaf': 0.06774439027708631, 'max_features': 0.5045195182553022}. Best is trial 92 with value: 0.7131405564108027.[0m
[32m[I 2022-04-13 11:45:19,632][0m Trial 100 finished with value: 0.701088972530485 and parameters: {'splitter': 'random', 'min_samples_split': 0.16963467662286805, 'min_samples_leaf': 0.15525613026639604, 'min_weight_fraction_leaf': 0.03226107581699475, 'max_features': 0.5405592561255245}. Best is trial 92 with value: 0.7131405564108027.[0m
[32m[I 2022-04-13 11:45:19,681][0m Trial 101 finished with value: 0.7022120919517791 and parameters: {'splitter': 'best', 'min_samples_split': 0.1381070603261907, 'min_samples_leaf': 0.07223738539208123, 'min_weight_fraction_leaf': 0.09955440796445635, 'max_features': 0.5582757967246073}. Best is trial 92 with value: 0.7131405564108027.[0m
[32m[I 2022-04-13 11:45:19,734][0m Trial 102 finished with value: 0.7131405564108027 and parameters: {'splitter': 'best', 'min_samples_split': 0.13566481630299157, 'min_samples_leaf': 0.050807297535578194, 'min_weight_fraction_leaf': 0.13564951252470064, 'max_features': 0.5590944309464376}. Best is trial 92 with value: 0.7131405564108027.[0m
[32m[I 2022-04-13 11:45:19,788][0m Trial 103 finished with value: 0.6727701215232552 and parameters: {'splitter': 'best', 'min_samples_split': 0.09889868679516953, 'min_samples_leaf': 0.09681294343730404, 'min_weight_fraction_leaf': 0.15999683718066124, 'max_features': 0.5806979071099155}. Best is trial 92 with value: 0.7131405564108027.[0m
[32m[I 2022-04-13 11:45:19,839][0m Trial 104 finished with value: 0.6265972550908505 and parameters: {'splitter': 'best', 'min_samples_split': 0.17842922408813805, 'min_samples_leaf': 0.05097331148629242, 'min_weight_fraction_leaf': 0.1383808150029675, 'max_features': 0.48613476605377615}. Best is trial 92 with value: 0.7131405564108027.[0m
[32m[I 2022-04-13 11:45:19,893][0m Trial 105 finished with value: 0.626076017631543 and parameters: {'splitter': 'best', 'min_samples_split': 0.12308371046101829, 'min_samples_leaf': 0.014536049213900514, 'min_weight_fraction_leaf': 0.13305167168194243, 'max_features': 0.44768712851841447}. Best is trial 92 with value: 0.7131405564108027.[0m
[32m[I 2022-04-13 11:45:19,942][0m Trial 106 finished with value: 0.6777553843145072 and parameters: {'splitter': 'best', 'min_samples_split': 0.0796419241796281, 'min_samples_leaf': 0.037844232998620095, 'min_weight_fraction_leaf': 0.08471397226254122, 'max_features': 0.5196008107017871}. Best is trial 92 with value: 0.7131405564108027.[0m
[32m[I 2022-04-13 11:45:19,997][0m Trial 107 finished with value: 0.7029215914224277 and parameters: {'splitter': 'best', 'min_samples_split': 0.16346680635630445, 'min_samples_leaf': 0.02869443339755584, 'min_weight_fraction_leaf': 0.11687687794094874, 'max_features': 0.5405439008111517}. Best is trial 92 with value: 0.7131405564108027.[0m
[32m[I 2022-04-13 11:45:20,050][0m Trial 108 finished with value: 0.6646045222178076 and parameters: {'splitter': 'best', 'min_samples_split': 0.26272978586133194, 'min_samples_leaf': 0.1327892395753201, 'min_weight_fraction_leaf': 0.1744855556026256, 'max_features': 0.6410734779726948}. Best is trial 92 with value: 0.7131405564108027.[0m
[32m[I 2022-04-13 11:45:20,081][0m Trial 109 finished with value: 0.6366316413031219 and parameters: {'splitter': 'random', 'min_samples_split': 0.0697600916794413, 'min_samples_leaf': 0.023472454182478415, 'min_weight_fraction_leaf': 0.25759144952450114, 'max_features': 0.5442802899232768}. Best is trial 92 with value: 0.7131405564108027.[0m
[32m[I 2022-04-13 11:45:20,124][0m Trial 110 finished with value: 0.6510996085939318 and parameters: {'splitter': 'best', 'min_samples_split': 0.20008481968566963, 'min_samples_leaf': 0.033110180187149466, 'min_weight_fraction_leaf': 0.11296718940622677, 'max_features': 0.4972497867173031}. Best is trial 92 with value: 0.7131405564108027.[0m
[32m[I 2022-04-13 11:45:20,182][0m Trial 111 finished with value: 0.6891921741320086 and parameters: {'splitter': 'best', 'min_samples_split': 0.1646962870444855, 'min_samples_leaf': 0.0014427265186892357, 'min_weight_fraction_leaf': 0.11994986593371337, 'max_features': 0.5639883346516702}. Best is trial 92 with value: 0.7131405564108027.[0m
[32m[I 2022-04-13 11:45:20,236][0m Trial 112 finished with value: 0.7085639671915396 and parameters: {'splitter': 'best', 'min_samples_split': 0.13394403896174764, 'min_samples_leaf': 0.06928652967571847, 'min_weight_fraction_leaf': 0.0969382554555432, 'max_features': 0.5284602222967353}. Best is trial 92 with value: 0.7131405564108027.[0m
[32m[I 2022-04-13 11:45:20,310][0m Trial 113 finished with value: 0.7085639671915396 and parameters: {'splitter': 'best', 'min_samples_split': 0.13193926745316575, 'min_samples_leaf': 0.047228010628955854, 'min_weight_fraction_leaf': 0.09321535272034176, 'max_features': 0.5284725444621364}. Best is trial 92 with value: 0.7131405564108027.[0m
[32m[I 2022-04-13 11:45:20,366][0m Trial 114 finished with value: 0.7085639671915396 and parameters: {'splitter': 'best', 'min_samples_split': 0.14723059188412885, 'min_samples_leaf': 0.04973672847556176, 'min_weight_fraction_leaf': 0.0968272508983505, 'max_features': 0.5312966833458257}. Best is trial 92 with value: 0.7131405564108027.[0m
[32m[I 2022-04-13 11:45:20,400][0m Trial 115 finished with value: 0.6523342916589774 and parameters: {'splitter': 'best', 'min_samples_split': 0.13051597754638725, 'min_samples_leaf': 0.04822793085723928, 'min_weight_fraction_leaf': 0.09260108971578389, 'max_features': 0.41846626778033524}. Best is trial 92 with value: 0.7131405564108027.[0m
[32m[I 2022-04-13 11:45:20,435][0m Trial 116 finished with value: 0.6727435362500194 and parameters: {'splitter': 'best', 'min_samples_split': 0.10547543968383137, 'min_samples_leaf': 0.06819613019227012, 'min_weight_fraction_leaf': 0.041367832492287385, 'max_features': 0.4670132131921969}. Best is trial 92 with value: 0.7131405564108027.[0m
[32m[I 2022-04-13 11:45:20,502][0m Trial 117 finished with value: 0.7131405564108027 and parameters: {'splitter': 'best', 'min_samples_split': 0.14609935563130044, 'min_samples_leaf': 0.027258327545306788, 'min_weight_fraction_leaf': 0.13179688854989763, 'max_features': 0.5443773973932023}. Best is trial 92 with value: 0.7131405564108027.[0m
[32m[I 2022-04-13 11:45:20,556][0m Trial 118 finished with value: 0.6832725645429367 and parameters: {'splitter': 'best', 'min_samples_split': 0.14683266588308513, 'min_samples_leaf': 0.012961964634425182, 'min_weight_fraction_leaf': 0.14757067406495547, 'max_features': 0.5842265337743634}. Best is trial 92 with value: 0.7131405564108027.[0m
[32m[I 2022-04-13 11:45:20,592][0m Trial 119 finished with value: 0.626076017631543 and parameters: {'splitter': 'best', 'min_samples_split': 0.18780606942896072, 'min_samples_leaf': 0.05013324863267919, 'min_weight_fraction_leaf': 0.13369897568758662, 'max_features': 0.4923328743604632}. Best is trial 92 with value: 0.7131405564108027.[0m
[32m[I 2022-04-13 11:45:20,645][0m Trial 120 finished with value: 0.685235058072523 and parameters: {'splitter': 'random', 'min_samples_split': 0.16434135319190962, 'min_samples_leaf': 0.026957434301544736, 'min_weight_fraction_leaf': 0.19741741600028245, 'max_features': 0.5298260737573681}. Best is trial 92 with value: 0.7131405564108027.[0m
[32m[I 2022-04-13 11:45:20,698][0m Trial 121 finished with value: 0.691311450270035 and parameters: {'splitter': 'best', 'min_samples_split': 0.11530596739742976, 'min_samples_leaf': 0.0584148355434987, 'min_weight_fraction_leaf': 0.0757284851452536, 'max_features': 0.5575145285472076}. Best is trial 92 with value: 0.7131405564108027.[0m
[32m[I 2022-04-13 11:45:20,756][0m Trial 122 finished with value: 0.6829898751218166 and parameters: {'splitter': 'best', 'min_samples_split': 0.13836098543555794, 'min_samples_leaf': 0.04291416794406029, 'min_weight_fraction_leaf': 0.062094246820468726, 'max_features': 0.5183200841237107}. Best is trial 92 with value: 0.7131405564108027.[0m
[32m[I 2022-04-13 11:45:20,805][0m Trial 123 finished with value: 0.7085639671915396 and parameters: {'splitter': 'best', 'min_samples_split': 0.13337150970115938, 'min_samples_leaf': 0.08897122863048243, 'min_weight_fraction_leaf': 0.09477283783682433, 'max_features': 0.6109535510042352}. Best is trial 92 with value: 0.7131405564108027.[0m
[32m[I 2022-04-13 11:45:20,872][0m Trial 124 finished with value: 0.7085639671915396 and parameters: {'splitter': 'best', 'min_samples_split': 0.17421905391698325, 'min_samples_leaf': 0.028766251737799568, 'min_weight_fraction_leaf': 0.09509479012703309, 'max_features': 0.5423452257875424}. Best is trial 92 with value: 0.7131405564108027.[0m
[32m[I 2022-04-13 11:45:20,951][0m Trial 125 finished with value: 0.7022120919517791 and parameters: {'splitter': 'best', 'min_samples_split': 0.17451203436203194, 'min_samples_leaf': 0.011805923449635151, 'min_weight_fraction_leaf': 0.1016044086813441, 'max_features': 0.5809575833934094}. Best is trial 92 with value: 0.7131405564108027.[0m
[32m[I 2022-04-13 11:45:21,039][0m Trial 126 finished with value: 0.6552720156262308 and parameters: {'splitter': 'best', 'min_samples_split': 0.22935167863498496, 'min_samples_leaf': 0.06581976937408136, 'min_weight_fraction_leaf': 0.08756347891270802, 'max_features': 0.6286328965122204}. Best is trial 92 with value: 0.7131405564108027.[0m
[32m[I 2022-04-13 11:45:21,129][0m Trial 127 finished with value: 0.6891921741320086 and parameters: {'splitter': 'best', 'min_samples_split': 0.13485899433464757, 'min_samples_leaf': 0.040055591161359164, 'min_weight_fraction_leaf': 0.1259992616012072, 'max_features': 0.5495900127159814}. Best is trial 92 with value: 0.7131405564108027.[0m
[32m[I 2022-04-13 11:45:21,206][0m Trial 128 finished with value: 0.7085639671915396 and parameters: {'splitter': 'best', 'min_samples_split': 0.12470759424095794, 'min_samples_leaf': 0.05498062738631802, 'min_weight_fraction_leaf': 0.09371107202268977, 'max_features': 0.503830167902977}. Best is trial 92 with value: 0.7131405564108027.[0m
[32m[I 2022-04-13 11:45:21,274][0m Trial 129 finished with value: 0.6475774294953407 and parameters: {'splitter': 'best', 'min_samples_split': 0.1273757711405293, 'min_samples_leaf': 0.02358469662411353, 'min_weight_fraction_leaf': 0.33401297339179103, 'max_features': 0.47723602314832747}. Best is trial 92 with value: 0.7131405564108027.[0m
[32m[I 2022-04-13 11:45:21,351][0m Trial 130 finished with value: 0.6150737283379903 and parameters: {'splitter': 'best', 'min_samples_split': 0.14627132032783519, 'min_samples_leaf': 0.27451936118925796, 'min_weight_fraction_leaf': 0.05017162916857342, 'max_features': 0.5025656831707443}. Best is trial 92 with value: 0.7131405564108027.[0m
[32m[I 2022-04-13 11:45:21,437][0m Trial 131 finished with value: 0.7029215914224277 and parameters: {'splitter': 'best', 'min_samples_split': 0.15770319263535812, 'min_samples_leaf': 0.05785050198248552, 'min_weight_fraction_leaf': 0.11003348924473316, 'max_features': 0.5289218249138052}. Best is trial 92 with value: 0.7131405564108027.[0m
[32m[I 2022-04-13 11:45:21,500][0m Trial 132 finished with value: 0.6777553843145072 and parameters: {'splitter': 'best', 'min_samples_split': 0.1105160606892439, 'min_samples_leaf': 0.0320510165033453, 'min_weight_fraction_leaf': 0.08009218412507146, 'max_features': 0.5682790878998343}. Best is trial 92 with value: 0.7131405564108027.[0m
