[32m[I 2022-04-13 11:45:54,644][0m Trial 574 finished with value: 0.7044783206942828 and parameters: {'splitter': 'best', 'min_samples_split': 0.3134265953946191, 'min_samples_leaf': 0.014505978391346529, 'min_weight_fraction_leaf': 0.11042985593988862, 'max_features': 0.59246687847199}. Best is trial 163 with value: 0.7137418010284807.[0m
[32m[I 2022-04-13 11:45:54,691][0m Trial 575 finished with value: 0.6513176944526099 and parameters: {'splitter': 'best', 'min_samples_split': 0.3214009979736437, 'min_samples_leaf': 0.01783814405979206, 'min_weight_fraction_leaf': 0.08117387857186337, 'max_features': 0.4956576910120475}. Best is trial 163 with value: 0.7137418010284807.[0m
[32m[I 2022-04-13 11:45:54,761][0m Trial 576 finished with value: 0.7137418010284807 and parameters: {'splitter': 'best', 'min_samples_split': 0.3287761143028042, 'min_samples_leaf': 0.02419561449045486, 'min_weight_fraction_leaf': 0.0692581775897797, 'max_features': 0.5739698953702236}. Best is trial 163 with value: 0.7137418010284807.[0m
[32m[I 2022-04-13 11:45:54,831][0m Trial 577 finished with value: 0.6920012331415456 and parameters: {'splitter': 'best', 'min_samples_split': 0.29826410602700026, 'min_samples_leaf': 0.0014024742153054617, 'min_weight_fraction_leaf': 0.10231065743612099, 'max_features': 0.5196876757007303}. Best is trial 163 with value: 0.7137418010284807.[0m
[32m[I 2022-04-13 11:45:54,881][0m Trial 578 finished with value: 0.6989673695016856 and parameters: {'splitter': 'best', 'min_samples_split': 0.33412971864580177, 'min_samples_leaf': 0.03696920904290456, 'min_weight_fraction_leaf': 0.06071707852816079, 'max_features': 0.6145953649487238}. Best is trial 163 with value: 0.7137418010284807.[0m
[32m[I 2022-04-13 11:45:54,955][0m Trial 579 finished with value: 0.6779120275351271 and parameters: {'splitter': 'best', 'min_samples_split': 0.3222371194076625, 'min_samples_leaf': 0.019561329397068256, 'min_weight_fraction_leaf': 0.20781097058941014, 'max_features': 0.535444788195314}. Best is trial 163 with value: 0.7137418010284807.[0m
[32m[I 2022-04-13 11:45:55,002][0m Trial 580 finished with value: 0.6834007793021425 and parameters: {'splitter': 'best', 'min_samples_split': 0.33731065496152035, 'min_samples_leaf': 0.05266618474708423, 'min_weight_fraction_leaf': 0.01879744897619145, 'max_features': 0.6321732688073736}. Best is trial 163 with value: 0.7137418010284807.[0m
[32m[I 2022-04-13 11:45:55,085][0m Trial 581 finished with value: 0.4364514609854459 and parameters: {'splitter': 'best', 'min_samples_split': 0.31217936811962643, 'min_samples_leaf': 0.449065816681379, 'min_weight_fraction_leaf': 0.11537659480293147, 'max_features': 0.5657084633080863}. Best is trial 163 with value: 0.7137418010284807.[0m
[32m[I 2022-04-13 11:45:55,221][0m Trial 582 finished with value: 0.6920012331415456 and parameters: {'splitter': 'best', 'min_samples_split': 0.29863355579777423, 'min_samples_leaf': 0.0013415344133403252, 'min_weight_fraction_leaf': 0.09388411570490791, 'max_features': 0.5141802537626786}. Best is trial 163 with value: 0.7137418010284807.[0m
[32m[I 2022-04-13 11:45:55,321][0m Trial 583 finished with value: 0.7044783206942828 and parameters: {'splitter': 'best', 'min_samples_split': 0.3145259897416447, 'min_samples_leaf': 0.021869292478843727, 'min_weight_fraction_leaf': 0.11444689215764933, 'max_features': 0.5398229971691385}. Best is trial 163 with value: 0.7137418010284807.[0m
[32m[I 2022-04-13 11:45:55,431][0m Trial 584 finished with value: 0.5399790707385923 and parameters: {'splitter': 'best', 'min_samples_split': 0.30931889548972524, 'min_samples_leaf': 0.001272407260948963, 'min_weight_fraction_leaf': 0.4336317918236535, 'max_features': 0.5345959319086097}. Best is trial 163 with value: 0.7137418010284807.[0m
[32m[I 2022-04-13 11:45:55,559][0m Trial 585 finished with value: 0.46698720506030406 and parameters: {'splitter': 'random', 'min_samples_split': 0.3050021088611785, 'min_samples_leaf': 0.009543990389801308, 'min_weight_fraction_leaf': 0.29236446919123216, 'max_features': 0.5121890538187842}. Best is trial 163 with value: 0.7137418010284807.[0m
[32m[I 2022-04-13 11:45:55,671][0m Trial 586 finished with value: 0.684611897101941 and parameters: {'splitter': 'best', 'min_samples_split': 0.286347680895669, 'min_samples_leaf': 0.009485636633189276, 'min_weight_fraction_leaf': 0.10091105096585466, 'max_features': 0.5109355750104042}. Best is trial 163 with value: 0.7137418010284807.[0m
[32m[I 2022-04-13 11:45:55,757][0m Trial 587 finished with value: 0.6989673695016856 and parameters: {'splitter': 'best', 'min_samples_split': 0.3499994787057884, 'min_samples_leaf': 0.03789800921797256, 'min_weight_fraction_leaf': 0.059151427126786484, 'max_features': 0.5806342316275825}. Best is trial 163 with value: 0.7137418010284807.[0m
[32m[I 2022-04-13 11:45:55,858][0m Trial 588 finished with value: 0.7137418010284807 and parameters: {'splitter': 'best', 'min_samples_split': 0.3252932829394262, 'min_samples_leaf': 0.02083785355118947, 'min_weight_fraction_leaf': 0.08803500827559986, 'max_features': 0.5407241825081583}. Best is trial 163 with value: 0.7137418010284807.[0m
[32m[I 2022-04-13 11:45:55,924][0m Trial 589 finished with value: 0.6440317768217898 and parameters: {'splitter': 'best', 'min_samples_split': 0.31418718529574235, 'min_samples_leaf': 0.008768344739923111, 'min_weight_fraction_leaf': 0.10290380265654733, 'max_features': 0.47676518763474585}. Best is trial 163 with value: 0.7137418010284807.[0m
[32m[I 2022-04-13 11:45:56,003][0m Trial 590 finished with value: 0.6418695587507137 and parameters: {'splitter': 'best', 'min_samples_split': 0.32646221439812173, 'min_samples_leaf': 0.026815288162524344, 'min_weight_fraction_leaf': 0.19592591848075697, 'max_features': 0.49093200233480233}. Best is trial 163 with value: 0.7137418010284807.[0m
[32m[I 2022-04-13 11:45:56,064][0m Trial 591 finished with value: 0.6989673695016856 and parameters: {'splitter': 'best', 'min_samples_split': 0.3413814529199672, 'min_samples_leaf': 0.03926201681890443, 'min_weight_fraction_leaf': 0.12718133662543601, 'max_features': 0.572608285997446}. Best is trial 163 with value: 0.7137418010284807.[0m
[32m[I 2022-04-13 11:45:56,128][0m Trial 592 finished with value: 0.6989673695016856 and parameters: {'splitter': 'best', 'min_samples_split': 0.3304456212924564, 'min_samples_leaf': 0.02314701411330839, 'min_weight_fraction_leaf': 0.06746999631689173, 'max_features': 0.6103416044427562}. Best is trial 163 with value: 0.7137418010284807.[0m
[32m[I 2022-04-13 11:45:56,196][0m Trial 593 finished with value: 0.7137418010284807 and parameters: {'splitter': 'best', 'min_samples_split': 0.31670470161013486, 'min_samples_leaf': 0.010818339907523436, 'min_weight_fraction_leaf': 0.08483968161002214, 'max_features': 0.5443552143952326}. Best is trial 163 with value: 0.7137418010284807.[0m
[32m[I 2022-04-13 11:45:56,247][0m Trial 594 finished with value: 0.6920012331415456 and parameters: {'splitter': 'best', 'min_samples_split': 0.29632951021349047, 'min_samples_leaf': 0.001218206916421336, 'min_weight_fraction_leaf': 0.09214716313223956, 'max_features': 0.5083681851474467}. Best is trial 163 with value: 0.7137418010284807.[0m
[32m[I 2022-04-13 11:45:56,323][0m Trial 595 finished with value: 0.6441041064354234 and parameters: {'splitter': 'best', 'min_samples_split': 0.33641257184313983, 'min_samples_leaf': 0.032550921285843366, 'min_weight_fraction_leaf': 0.051253290436686486, 'max_features': 0.43569672826044004}. Best is trial 163 with value: 0.7137418010284807.[0m
[32m[I 2022-04-13 11:45:56,416][0m Trial 596 finished with value: 0.6353838276695598 and parameters: {'splitter': 'best', 'min_samples_split': 0.3261802387369692, 'min_samples_leaf': 0.1273398690612121, 'min_weight_fraction_leaf': 0.0745837923271147, 'max_features': 0.47691067051672764}. Best is trial 163 with value: 0.7137418010284807.[0m
[32m[I 2022-04-13 11:45:56,506][0m Trial 597 finished with value: 0.7137418010284807 and parameters: {'splitter': 'best', 'min_samples_split': 0.31789680484191857, 'min_samples_leaf': 0.02194749141465557, 'min_weight_fraction_leaf': 0.09615154771529058, 'max_features': 0.532412248627212}. Best is trial 163 with value: 0.7137418010284807.[0m
[32m[I 2022-04-13 11:45:56,565][0m Trial 598 finished with value: 0.6989673695016856 and parameters: {'splitter': 'best', 'min_samples_split': 0.3437588950440001, 'min_samples_leaf': 0.0317520894402583, 'min_weight_fraction_leaf': 0.06431796523687083, 'max_features': 0.5995239548394938}. Best is trial 163 with value: 0.7137418010284807.[0m
[32m[I 2022-04-13 11:45:56,642][0m Trial 599 finished with value: 0.6891921741320086 and parameters: {'splitter': 'best', 'min_samples_split': 0.2113722275335617, 'min_samples_leaf': 0.04554733537945695, 'min_weight_fraction_leaf': 0.12060080301246878, 'max_features': 0.5787040933187511}. Best is trial 163 with value: 0.7137418010284807.[0m
[32m[I 2022-04-13 11:45:56,695][0m Trial 600 finished with value: 0.6989673695016856 and parameters: {'splitter': 'best', 'min_samples_split': 0.37355214463817943, 'min_samples_leaf': 0.021017881849077123, 'min_weight_fraction_leaf': 0.1110376109982125, 'max_features': 0.5485930166990117}. Best is trial 163 with value: 0.7137418010284807.[0m
[32m[I 2022-04-13 11:45:56,755][0m Trial 601 finished with value: 0.6513176944526099 and parameters: {'splitter': 'best', 'min_samples_split': 0.31847351660281753, 'min_samples_leaf': 0.013998335658290395, 'min_weight_fraction_leaf': 0.08960574522967919, 'max_features': 0.45944134089616634}. Best is trial 163 with value: 0.7137418010284807.[0m
[32m[I 2022-04-13 11:45:56,833][0m Trial 602 finished with value: 0.6441041064354234 and parameters: {'splitter': 'best', 'min_samples_split': 0.3260864029581076, 'min_samples_leaf': 0.01603048907442304, 'min_weight_fraction_leaf': 0.0517231662748732, 'max_features': 0.46796906051151654}. Best is trial 163 with value: 0.7137418010284807.[0m
[32m[I 2022-04-13 11:45:56,882][0m Trial 603 finished with value: 0.6989673695016856 and parameters: {'splitter': 'best', 'min_samples_split': 0.3313944001687033, 'min_samples_leaf': 0.04317134545696009, 'min_weight_fraction_leaf': 0.12807662714325674, 'max_features': 0.5855852685102472}. Best is trial 163 with value: 0.7137418010284807.[0m
[32m[I 2022-04-13 11:45:56,962][0m Trial 604 finished with value: 0.5731859619135877 and parameters: {'splitter': 'random', 'min_samples_split': 0.3106298585090435, 'min_samples_leaf': 0.013104418719810608, 'min_weight_fraction_leaf': 0.0752868776618335, 'max_features': 0.49800340212760863}. Best is trial 163 with value: 0.7137418010284807.[0m
[32m[I 2022-04-13 11:45:57,039][0m Trial 605 finished with value: 0.6920012331415456 and parameters: {'splitter': 'best', 'min_samples_split': 0.29716184460280853, 'min_samples_leaf': 0.0013685041892723925, 'min_weight_fraction_leaf': 0.1032473196126273, 'max_features': 0.5202761654426126}. Best is trial 163 with value: 0.7137418010284807.[0m
[32m[I 2022-04-13 11:45:57,113][0m Trial 606 finished with value: 0.6955563537988494 and parameters: {'splitter': 'best', 'min_samples_split': 0.34632291272846183, 'min_samples_leaf': 0.03176764423623815, 'min_weight_fraction_leaf': 0.04572120087886773, 'max_features': 0.6428261158545499}. Best is trial 163 with value: 0.7137418010284807.[0m
[32m[I 2022-04-13 11:45:57,182][0m Trial 607 finished with value: 0.6475774294953407 and parameters: {'splitter': 'best', 'min_samples_split': 0.3587565025805478, 'min_samples_leaf': 0.34975405568732254, 'min_weight_fraction_leaf': 0.06986101842985233, 'max_features': 0.6115001516688583}. Best is trial 163 with value: 0.7137418010284807.[0m
[32m[I 2022-04-13 11:45:57,276][0m Trial 608 finished with value: 0.5230807590341191 and parameters: {'splitter': 'best', 'min_samples_split': 0.30604976848270216, 'min_samples_leaf': 0.01385097416883138, 'min_weight_fraction_leaf': 0.07892268269654013, 'max_features': 0.03988939233004257}. Best is trial 163 with value: 0.7137418010284807.[0m
[32m[I 2022-04-13 11:45:57,382][0m Trial 609 finished with value: 0.631953446187902 and parameters: {'splitter': 'best', 'min_samples_split': 0.31669723052674464, 'min_samples_leaf': 0.014251829493928073, 'min_weight_fraction_leaf': 0.07345594259630045, 'max_features': 0.4909375484285022}. Best is trial 163 with value: 0.7137418010284807.[0m
[32m[I 2022-04-13 11:45:57,447][0m Trial 610 finished with value: 0.6989673695016856 and parameters: {'splitter': 'best', 'min_samples_split': 0.33772177783392243, 'min_samples_leaf': 0.03127859309651981, 'min_weight_fraction_leaf': 0.05444695993280052, 'max_features': 0.5735795687151469}. Best is trial 163 with value: 0.7137418010284807.[0m
[32m[I 2022-04-13 11:45:57,520][0m Trial 611 finished with value: 0.6610317386342024 and parameters: {'splitter': 'best', 'min_samples_split': 0.32207873871716075, 'min_samples_leaf': 0.010541070377519784, 'min_weight_fraction_leaf': 0.3209604148286839, 'max_features': 0.5275456565656167}. Best is trial 163 with value: 0.7137418010284807.[0m
[32m[I 2022-04-13 11:45:57,581][0m Trial 612 finished with value: 0.7131405564108027 and parameters: {'splitter': 'best', 'min_samples_split': 0.2865387930650639, 'min_samples_leaf': 0.1402647134522637, 'min_weight_fraction_leaf': 0.09886712401320488, 'max_features': 0.5268677327126101}. Best is trial 163 with value: 0.7137418010284807.[0m
[32m[I 2022-04-13 11:45:57,653][0m Trial 613 finished with value: 0.6989673695016856 and parameters: {'splitter': 'best', 'min_samples_split': 0.33058591808003535, 'min_samples_leaf': 0.0213735486359353, 'min_weight_fraction_leaf': 0.11276215606406777, 'max_features': 0.5414026824562199}. Best is trial 163 with value: 0.7137418010284807.[0m
[32m[I 2022-04-13 11:45:57,716][0m Trial 614 finished with value: 0.7044783206942828 and parameters: {'splitter': 'best', 'min_samples_split': 0.3076307358166706, 'min_samples_leaf': 0.025285114878055626, 'min_weight_fraction_leaf': 0.11984712661980988, 'max_features': 0.5600029955823433}. Best is trial 163 with value: 0.7137418010284807.[0m
[32m[I 2022-04-13 11:45:57,816][0m Trial 615 finished with value: 0.695563433079365 and parameters: {'splitter': 'best', 'min_samples_split': 0.2997938375510101, 'min_samples_leaf': 0.0013805891904587536, 'min_weight_fraction_leaf': 0.08788449234233305, 'max_features': 0.5517283892454775}. Best is trial 163 with value: 0.7137418010284807.[0m
[32m[I 2022-04-13 11:45:57,963][0m Trial 616 finished with value: 0.6822883380153592 and parameters: {'splitter': 'best', 'min_samples_split': 0.3403251564104402, 'min_samples_leaf': 0.050734706298605624, 'min_weight_fraction_leaf': 0.09608911908446163, 'max_features': 0.7057776696109388}. Best is trial 163 with value: 0.7137418010284807.[0m
[32m[I 2022-04-13 11:45:58,224][0m Trial 617 finished with value: 0.7137418010284807 and parameters: {'splitter': 'best', 'min_samples_split': 0.32689650812919074, 'min_samples_leaf': 0.012778857582855326, 'min_weight_fraction_leaf': 0.10889511535592795, 'max_features': 0.5273648523275621}. Best is trial 163 with value: 0.7137418010284807.[0m
[32m[I 2022-04-13 11:45:58,318][0m Trial 618 finished with value: 0.6853507734439263 and parameters: {'splitter': 'best', 'min_samples_split': 0.31673999544138803, 'min_samples_leaf': 0.012661372698130993, 'min_weight_fraction_leaf': 0.0314710571269467, 'max_features': 0.5031356889466648}. Best is trial 163 with value: 0.7137418010284807.[0m
[32m[I 2022-04-13 11:45:58,380][0m Trial 619 finished with value: 0.6873202442568208 and parameters: {'splitter': 'best', 'min_samples_split': 0.3074903465896069, 'min_samples_leaf': 0.05115766888653864, 'min_weight_fraction_leaf': 0.13318782036479088, 'max_features': 0.5885523016482683}. Best is trial 163 with value: 0.7137418010284807.[0m
[32m[I 2022-04-13 11:45:58,458][0m Trial 620 finished with value: 0.6989673695016856 and parameters: {'splitter': 'best', 'min_samples_split': 0.3514048173624511, 'min_samples_leaf': 0.0415822677269283, 'min_weight_fraction_leaf': 0.13130983897165452, 'max_features': 0.6068425820012548}. Best is trial 163 with value: 0.7137418010284807.[0m
[32m[I 2022-04-13 11:45:58,587][0m Trial 621 finished with value: 0.6989673695016856 and parameters: {'splitter': 'best', 'min_samples_split': 0.334638966108059, 'min_samples_leaf': 0.022552729418917863, 'min_weight_fraction_leaf': 0.09677123331559748, 'max_features': 0.5453436019867762}. Best is trial 163 with value: 0.7137418010284807.[0m
[32m[I 2022-04-13 11:45:58,742][0m Trial 622 finished with value: 0.6513176944526099 and parameters: {'splitter': 'best', 'min_samples_split': 0.3249400556791827, 'min_samples_leaf': 0.021339722697182584, 'min_weight_fraction_leaf': 0.0848872432280699, 'max_features': 0.4993706730929449}. Best is trial 163 with value: 0.7137418010284807.[0m
[32m[I 2022-04-13 11:45:58,815][0m Trial 623 finished with value: 0.6407886163385511 and parameters: {'splitter': 'random', 'min_samples_split': 0.30391751540411316, 'min_samples_leaf': 0.2301810333986185, 'min_weight_fraction_leaf': 0.08992313299520395, 'max_features': 0.5456131271485959}. Best is trial 163 with value: 0.7137418010284807.[0m
[32m[I 2022-04-13 11:45:58,880][0m Trial 624 finished with value: 0.6959088038791192 and parameters: {'splitter': 'best', 'min_samples_split': 0.2592464629836736, 'min_samples_leaf': 0.034805326613308714, 'min_weight_fraction_leaf': 0.06408683429628927, 'max_features': 0.5801166057749281}. Best is trial 163 with value: 0.7137418010284807.[0m
[32m[I 2022-04-13 11:45:58,940][0m Trial 625 finished with value: 0.6327929922187122 and parameters: {'splitter': 'best', 'min_samples_split': 0.31131913999761857, 'min_samples_leaf': 0.06284006399792733, 'min_weight_fraction_leaf': 0.2569597751708024, 'max_features': 0.5628017879850409}. Best is trial 163 with value: 0.7137418010284807.[0m
[32m[I 2022-04-13 11:45:59,020][0m Trial 626 finished with value: 0.6989673695016856 and parameters: {'splitter': 'best', 'min_samples_split': 0.3538521628727852, 'min_samples_leaf': 0.032329833765454084, 'min_weight_fraction_leaf': 0.06079074021101897, 'max_features': 0.5654973891589437}. Best is trial 163 with value: 0.7137418010284807.[0m
[32m[I 2022-04-13 11:45:59,153][0m Trial 627 finished with value: 0.7137418010284807 and parameters: {'splitter': 'best', 'min_samples_split': 0.3198366509620032, 'min_samples_leaf': 0.03181210984035303, 'min_weight_fraction_leaf': 0.06910625585043535, 'max_features': 0.5677149500217697}. Best is trial 163 with value: 0.7137418010284807.[0m
[32m[I 2022-04-13 11:45:59,265][0m Trial 628 finished with value: 0.6881740970397604 and parameters: {'splitter': 'best', 'min_samples_split': 0.28765838184598924, 'min_samples_leaf': 0.007946079079063213, 'min_weight_fraction_leaf': 0.08675592893458824, 'max_features': 0.5129557549686597}. Best is trial 163 with value: 0.7137418010284807.[0m
[32m[I 2022-04-13 11:45:59,360][0m Trial 629 finished with value: 0.6989673695016856 and parameters: {'splitter': 'best', 'min_samples_split': 0.34062470674875134, 'min_samples_leaf': 0.05454388961517866, 'min_weight_fraction_leaf': 0.12379213203367956, 'max_features': 0.5911437939757921}. Best is trial 163 with value: 0.7137418010284807.[0m
[32m[I 2022-04-13 11:45:59,450][0m Trial 630 finished with value: 0.6610317386342024 and parameters: {'splitter': 'best', 'min_samples_split': 0.3334866976563597, 'min_samples_leaf': 0.3196432891104812, 'min_weight_fraction_leaf': 0.08478506535856557, 'max_features': 0.5481942140375305}. Best is trial 163 with value: 0.7137418010284807.[0m
[32m[I 2022-04-13 11:45:59,674][0m Trial 631 finished with value: 0.5399790707385923 and parameters: {'splitter': 'best', 'min_samples_split': 0.3227703786683789, 'min_samples_leaf': 0.42862465974465513, 'min_weight_fraction_leaf': 0.07362540912254034, 'max_features': 0.4799966621541251}. Best is trial 163 with value: 0.7137418010284807.[0m
[32m[I 2022-04-13 11:45:59,788][0m Trial 632 finished with value: 0.6705763419171312 and parameters: {'splitter': 'best', 'min_samples_split': 0.33235817222446634, 'min_samples_leaf': 0.043521557614610504, 'min_weight_fraction_leaf': 0.04253182151524601, 'max_features': 0.6206484190212581}. Best is trial 163 with value: 0.7137418010284807.[0m
[32m[I 2022-04-13 11:45:59,882][0m Trial 633 finished with value: 0.4113731167222882 and parameters: {'splitter': 'best', 'min_samples_split': 0.34843349022941617, 'min_samples_leaf': 0.020815628435648298, 'min_weight_fraction_leaf': 0.47528374350817426, 'max_features': 0.5339624994580034}. Best is trial 163 with value: 0.7137418010284807.[0m
[32m[I 2022-04-13 11:46:00,007][0m Trial 634 finished with value: 0.5162756586107915 and parameters: {'splitter': 'best', 'min_samples_split': 0.31680217695695084, 'min_samples_leaf': 0.026094414445702915, 'min_weight_fraction_leaf': 0.056893104845047685, 'max_features': 0.10103130609119837}. Best is trial 163 with value: 0.7137418010284807.[0m
[32m[I 2022-04-13 11:46:00,092][0m Trial 635 finished with value: 0.6941150711903805 and parameters: {'splitter': 'best', 'min_samples_split': 0.44072700221166844, 'min_samples_leaf': 0.05757707831797119, 'min_weight_fraction_leaf': 0.02721481269846819, 'max_features': 0.6387712512067275}. Best is trial 163 with value: 0.7137418010284807.[0m
[32m[I 2022-04-13 11:46:00,177][0m Trial 636 finished with value: 0.7137418010284807 and parameters: {'splitter': 'best', 'min_samples_split': 0.3263959309515976, 'min_samples_leaf': 0.02450845476576379, 'min_weight_fraction_leaf': 0.09830101100977355, 'max_features': 0.5757100361867347}. Best is trial 163 with value: 0.7137418010284807.[0m
