No protocol specified
[32m[I 2022-04-13 11:43:47,834][0m A new study created in memory with name: no-name-6e99fa38-5156-4a5b-b2dc-82f529c7e49b[0m
[32m[I 2022-04-13 11:43:47,864][0m Trial 0 finished with value: 0.6295416277238879 and parameters: {'splitter': 'random', 'min_samples_split': 0.37283900908962486, 'min_samples_leaf': 0.07892209175800335, 'min_weight_fraction_leaf': 0.31632615851648316, 'max_features': 0.8139954911487777}. Best is trial 0 with value: 0.6295416277238879.[0m
[32m[I 2022-04-13 11:43:47,885][0m Trial 1 finished with value: 0.8509196259844106 and parameters: {'splitter': 'best', 'min_samples_split': 0.48197954179561564, 'min_samples_leaf': 0.06923834359805414, 'min_weight_fraction_leaf': 0.16836219853969292, 'max_features': 0.6596588876717079}. Best is trial 1 with value: 0.8509196259844106.[0m
[32m[I 2022-04-13 11:43:47,905][0m Trial 2 finished with value: 0.6392573074134148 and parameters: {'splitter': 'best', 'min_samples_split': 0.42758398748158616, 'min_samples_leaf': 0.18490417424936179, 'min_weight_fraction_leaf': 0.1347614739175037, 'max_features': 0.22325851243186723}. Best is trial 1 with value: 0.8509196259844106.[0m
[32m[I 2022-04-13 11:43:47,924][0m Trial 3 finished with value: 0.7258877836215014 and parameters: {'splitter': 'best', 'min_samples_split': 0.318551835212508, 'min_samples_leaf': 0.2850426838436942, 'min_weight_fraction_leaf': 0.1926503985578133, 'max_features': 0.32605573801401355}. Best is trial 1 with value: 0.8509196259844106.[0m
[32m[I 2022-04-13 11:43:47,945][0m Trial 4 finished with value: 0.77756927813589 and parameters: {'splitter': 'random', 'min_samples_split': 0.14023379855638696, 'min_samples_leaf': 0.2190271193861133, 'min_weight_fraction_leaf': 0.22401354521148026, 'max_features': 0.6853448757817101}. Best is trial 1 with value: 0.8509196259844106.[0m
[32m[I 2022-04-13 11:43:47,964][0m Trial 5 finished with value: 0.624804939385115 and parameters: {'splitter': 'best', 'min_samples_split': 0.2252277880006843, 'min_samples_leaf': 0.467378423623383, 'min_weight_fraction_leaf': 0.25462019857880835, 'max_features': 0.16922953290285547}. Best is trial 1 with value: 0.8509196259844106.[0m
[32m[I 2022-04-13 11:43:47,983][0m Trial 6 finished with value: 0.6188081862944745 and parameters: {'splitter': 'random', 'min_samples_split': 0.4695565395052791, 'min_samples_leaf': 0.2512466475386153, 'min_weight_fraction_leaf': 0.2699063084023139, 'max_features': 0.09385845354431754}. Best is trial 1 with value: 0.8509196259844106.[0m
[32m[I 2022-04-13 11:43:48,005][0m Trial 7 finished with value: 0.8460006165707726 and parameters: {'splitter': 'best', 'min_samples_split': 0.29268966688510123, 'min_samples_leaf': 0.03098482583836345, 'min_weight_fraction_leaf': 0.10739019814574613, 'max_features': 0.5903088109108765}. Best is trial 1 with value: 0.8509196259844106.[0m
[32m[I 2022-04-13 11:43:48,043][0m Trial 8 finished with value: 0.6188081862944745 and parameters: {'splitter': 'random', 'min_samples_split': 0.18674514899785574, 'min_samples_leaf': 0.4449307893562752, 'min_weight_fraction_leaf': 0.33401919559561827, 'max_features': 0.23416974716433958}. Best is trial 1 with value: 0.8509196259844106.[0m
[32m[I 2022-04-13 11:43:48,076][0m Trial 9 finished with value: 0.618225730492723 and parameters: {'splitter': 'best', 'min_samples_split': 0.3196793522850161, 'min_samples_leaf': 0.06356496415787766, 'min_weight_fraction_leaf': 0.4415345860478648, 'max_features': 0.6468029915667626}. Best is trial 1 with value: 0.8509196259844106.[0m
[32m[I 2022-04-13 11:43:48,148][0m Trial 10 finished with value: 0.8477736381158495 and parameters: {'splitter': 'best', 'min_samples_split': 0.03458342344080312, 'min_samples_leaf': 0.14016946744204034, 'min_weight_fraction_leaf': 0.008208650522113808, 'max_features': 0.9537343391608037}. Best is trial 1 with value: 0.8509196259844106.[0m
[32m[I 2022-04-13 11:43:48,234][0m Trial 11 finished with value: 0.841673588919512 and parameters: {'splitter': 'best', 'min_samples_split': 0.010482663242307285, 'min_samples_leaf': 0.15096672511930845, 'min_weight_fraction_leaf': 0.007994707578490412, 'max_features': 0.9775523143957232}. Best is trial 1 with value: 0.8509196259844106.[0m
[32m[I 2022-04-13 11:43:48,312][0m Trial 12 finished with value: 0.8457629256167987 and parameters: {'splitter': 'best', 'min_samples_split': 0.006306328892049351, 'min_samples_leaf': 0.10953945508456245, 'min_weight_fraction_leaf': 0.0009131762122062403, 'max_features': 0.992312510700418}. Best is trial 1 with value: 0.8509196259844106.[0m
[32m[I 2022-04-13 11:43:48,382][0m Trial 13 finished with value: 0.7226971816189763 and parameters: {'splitter': 'best', 'min_samples_split': 0.09365179231341847, 'min_samples_leaf': 0.32452465476674536, 'min_weight_fraction_leaf': 0.08742731242250652, 'max_features': 0.4740907568647314}. Best is trial 1 with value: 0.8509196259844106.[0m
[32m[I 2022-04-13 11:43:48,453][0m Trial 14 finished with value: 0.7196449493602967 and parameters: {'splitter': 'best', 'min_samples_split': 0.49555519412838567, 'min_samples_leaf': 0.14653092583072283, 'min_weight_fraction_leaf': 0.049558983941422746, 'max_features': 0.8449814889300066}. Best is trial 1 with value: 0.8509196259844106.[0m
[32m[I 2022-04-13 11:43:48,523][0m Trial 15 finished with value: 0.7151426505292393 and parameters: {'splitter': 'best', 'min_samples_split': 0.0983410190392133, 'min_samples_leaf': 0.047210930860020345, 'min_weight_fraction_leaf': 0.16980101776144868, 'max_features': 0.4345165932528441}. Best is trial 1 with value: 0.8509196259844106.[0m
[32m[I 2022-04-13 11:43:48,584][0m Trial 16 finished with value: 0.705686558361144 and parameters: {'splitter': 'best', 'min_samples_split': 0.3746798630620702, 'min_samples_leaf': 0.012761505817303509, 'min_weight_fraction_leaf': 0.4836789288955342, 'max_features': 0.8202268223194518}. Best is trial 1 with value: 0.8509196259844106.[0m
[32m[I 2022-04-13 11:43:48,631][0m Trial 17 finished with value: 0.7178306309059386 and parameters: {'splitter': 'best', 'min_samples_split': 0.24841653575338446, 'min_samples_leaf': 0.38390537941351766, 'min_weight_fraction_leaf': 0.07185025606711305, 'max_features': 0.7294683587572847}. Best is trial 1 with value: 0.8509196259844106.[0m
[32m[I 2022-04-13 11:43:48,708][0m Trial 18 finished with value: 0.6188081862944745 and parameters: {'splitter': 'random', 'min_samples_split': 0.06612197339176712, 'min_samples_leaf': 0.12268057707243074, 'min_weight_fraction_leaf': 0.39621405763672823, 'max_features': 0.5451033761897364}. Best is trial 1 with value: 0.8509196259844106.[0m
[32m[I 2022-04-13 11:43:48,793][0m Trial 19 finished with value: 0.818253273417173 and parameters: {'splitter': 'best', 'min_samples_split': 0.17794357018030682, 'min_samples_leaf': 0.17325261511295448, 'min_weight_fraction_leaf': 0.13305946223143011, 'max_features': 0.8985714443487028}. Best is trial 1 with value: 0.8509196259844106.[0m
[32m[I 2022-04-13 11:43:48,849][0m Trial 20 finished with value: 0.735936327980956 and parameters: {'splitter': 'best', 'min_samples_split': 0.40469065124559733, 'min_samples_leaf': 0.09261167149427972, 'min_weight_fraction_leaf': 0.04275571915495616, 'max_features': 0.7587589024346792}. Best is trial 1 with value: 0.8509196259844106.[0m
[32m[I 2022-04-13 11:43:48,934][0m Trial 21 finished with value: 0.8432865187001652 and parameters: {'splitter': 'best', 'min_samples_split': 0.2643162262328344, 'min_samples_leaf': 0.007498505438428765, 'min_weight_fraction_leaf': 0.11183978447722079, 'max_features': 0.6077792041517233}. Best is trial 1 with value: 0.8509196259844106.[0m
[32m[I 2022-04-13 11:43:48,998][0m Trial 22 finished with value: 0.7151426505292393 and parameters: {'splitter': 'best', 'min_samples_split': 0.32752624365927113, 'min_samples_leaf': 0.048035280863854, 'min_weight_fraction_leaf': 0.16134320257011955, 'max_features': 0.38395353605894}. Best is trial 1 with value: 0.8509196259844106.[0m
[32m[I 2022-04-13 11:43:49,063][0m Trial 23 finished with value: 0.7421735188001736 and parameters: {'splitter': 'best', 'min_samples_split': 0.4547022990258949, 'min_samples_leaf': 0.0030358439686590244, 'min_weight_fraction_leaf': 0.10767355022104602, 'max_features': 0.5278824328387886}. Best is trial 1 with value: 0.8509196259844106.[0m
[32m[I 2022-04-13 11:43:49,145][0m Trial 24 finished with value: 0.8389560137675636 and parameters: {'splitter': 'best', 'min_samples_split': 0.2647043003240732, 'min_samples_leaf': 0.20071577301783863, 'min_weight_fraction_leaf': 0.20960772362897256, 'max_features': 0.5932809378140337}. Best is trial 1 with value: 0.8509196259844106.[0m
[32m[I 2022-04-13 11:43:49,222][0m Trial 25 finished with value: 0.8477736381158495 and parameters: {'splitter': 'best', 'min_samples_split': 0.1608559566957613, 'min_samples_leaf': 0.13228448623413894, 'min_weight_fraction_leaf': 0.04543272020864424, 'max_features': 0.8971296349204568}. Best is trial 1 with value: 0.8509196259844106.[0m
[32m[I 2022-04-13 11:43:49,269][0m Trial 26 finished with value: 0.674703194905135 and parameters: {'splitter': 'random', 'min_samples_split': 0.14077612932483016, 'min_samples_leaf': 0.23304291256126566, 'min_weight_fraction_leaf': 0.04799053496859934, 'max_features': 0.9114083589048447}. Best is trial 1 with value: 0.8509196259844106.[0m
[32m[I 2022-04-13 11:43:49,310][0m Trial 27 finished with value: 0.8477736381158495 and parameters: {'splitter': 'best', 'min_samples_split': 0.0476844951455061, 'min_samples_leaf': 0.13632308972800564, 'min_weight_fraction_leaf': 0.017469732146137673, 'max_features': 0.8908549104336536}. Best is trial 1 with value: 0.8509196259844106.[0m
[32m[I 2022-04-13 11:43:49,345][0m Trial 28 finished with value: 0.718279347003369 and parameters: {'splitter': 'best', 'min_samples_split': 0.1381707172808911, 'min_samples_leaf': 0.09202930005442563, 'min_weight_fraction_leaf': 0.0723622461285899, 'max_features': 0.7318364607889796}. Best is trial 1 with value: 0.8509196259844106.[0m
[32m[I 2022-04-13 11:43:49,376][0m Trial 29 finished with value: 0.7680424646970951 and parameters: {'splitter': 'random', 'min_samples_split': 0.2108947275278149, 'min_samples_leaf': 0.2680673027142664, 'min_weight_fraction_leaf': 0.15114513606112318, 'max_features': 0.8200194344059458}. Best is trial 1 with value: 0.8509196259844106.[0m
[32m[I 2022-04-13 11:43:49,409][0m Trial 30 finished with value: 0.7162052217550288 and parameters: {'splitter': 'best', 'min_samples_split': 0.06309141831853529, 'min_samples_leaf': 0.07637969923595475, 'min_weight_fraction_leaf': 0.2986929550994115, 'max_features': 0.8877511363424807}. Best is trial 1 with value: 0.8509196259844106.[0m
[32m[I 2022-04-13 11:43:49,459][0m Trial 31 finished with value: 0.8477736381158495 and parameters: {'splitter': 'best', 'min_samples_split': 0.03069293640083018, 'min_samples_leaf': 0.13520846728659486, 'min_weight_fraction_leaf': 0.022441362736837934, 'max_features': 0.9437492215507437}. Best is trial 1 with value: 0.8509196259844106.[0m
[32m[I 2022-04-13 11:43:49,492][0m Trial 32 finished with value: 0.7306616938819448 and parameters: {'splitter': 'best', 'min_samples_split': 0.04959807299912981, 'min_samples_leaf': 0.17751871459197052, 'min_weight_fraction_leaf': 0.030792110747858027, 'max_features': 0.7527809005552142}. Best is trial 1 with value: 0.8509196259844106.[0m
[32m[I 2022-04-13 11:43:49,526][0m Trial 33 finished with value: 0.7272392355714593 and parameters: {'splitter': 'best', 'min_samples_split': 0.1088917864594255, 'min_samples_leaf': 0.16363198247719019, 'min_weight_fraction_leaf': 0.0013510122338540103, 'max_features': 0.8627659442297634}. Best is trial 1 with value: 0.8509196259844106.[0m
[32m[I 2022-04-13 11:43:49,565][0m Trial 34 finished with value: 0.8457629256167987 and parameters: {'splitter': 'best', 'min_samples_split': 0.02653620759489142, 'min_samples_leaf': 0.11385471337850271, 'min_weight_fraction_leaf': 0.07075190417419834, 'max_features': 0.9511816587071464}. Best is trial 1 with value: 0.8509196259844106.[0m
[32m[I 2022-04-13 11:43:49,597][0m Trial 35 finished with value: 0.72014235861385 and parameters: {'splitter': 'best', 'min_samples_split': 0.1667726529286958, 'min_samples_leaf': 0.30356334127637463, 'min_weight_fraction_leaf': 0.04573178786328684, 'max_features': 0.6790486614996939}. Best is trial 1 with value: 0.8509196259844106.[0m
[32m[I 2022-04-13 11:43:49,670][0m Trial 36 finished with value: 0.7095506207890075 and parameters: {'splitter': 'best', 'min_samples_split': 0.1188557382311171, 'min_samples_leaf': 0.20767493065573545, 'min_weight_fraction_leaf': 0.19533630730509977, 'max_features': 0.7957080624384665}. Best is trial 1 with value: 0.8509196259844106.[0m
[32m[I 2022-04-13 11:43:49,717][0m Trial 37 finished with value: 0.8500366726029795 and parameters: {'splitter': 'random', 'min_samples_split': 0.08020786470584096, 'min_samples_leaf': 0.06912409686204274, 'min_weight_fraction_leaf': 0.09312641948786722, 'max_features': 0.9238875021665085}. Best is trial 1 with value: 0.8509196259844106.[0m
[32m[I 2022-04-13 11:43:49,764][0m Trial 38 finished with value: 0.8183355915775186 and parameters: {'splitter': 'random', 'min_samples_split': 0.08327937704386587, 'min_samples_leaf': 0.07333341579280431, 'min_weight_fraction_leaf': 0.12709965585452007, 'max_features': 0.6985057791144077}. Best is trial 1 with value: 0.8509196259844106.[0m
[32m[I 2022-04-13 11:43:49,807][0m Trial 39 finished with value: 0.6188081862944745 and parameters: {'splitter': 'random', 'min_samples_split': 0.04174915400078233, 'min_samples_leaf': 0.04065864919684893, 'min_weight_fraction_leaf': 0.23114843859323095, 'max_features': 0.044230678037848525}. Best is trial 1 with value: 0.8509196259844106.[0m
[32m[I 2022-04-13 11:43:49,852][0m Trial 40 finished with value: 0.8110640384931793 and parameters: {'splitter': 'random', 'min_samples_split': 0.20536510148239095, 'min_samples_leaf': 0.1025425092513031, 'min_weight_fraction_leaf': 0.168739926048654, 'max_features': 0.7915631285993447}. Best is trial 1 with value: 0.8509196259844106.[0m
[32m[I 2022-04-13 11:43:49,898][0m Trial 41 finished with value: 0.8036121252688888 and parameters: {'splitter': 'random', 'min_samples_split': 0.035532558563083634, 'min_samples_leaf': 0.13576281987661476, 'min_weight_fraction_leaf': 0.08922355386525252, 'max_features': 0.9492463641252388}. Best is trial 1 with value: 0.8509196259844106.[0m
[32m[I 2022-04-13 11:43:49,944][0m Trial 42 finished with value: 0.8395419491295499 and parameters: {'splitter': 'random', 'min_samples_split': 0.15063674147700476, 'min_samples_leaf': 0.06732969423359238, 'min_weight_fraction_leaf': 0.0381155485668634, 'max_features': 0.9249997383437933}. Best is trial 1 with value: 0.8509196259844106.[0m
[32m[I 2022-04-13 11:43:49,989][0m Trial 43 finished with value: 0.6877449274642142 and parameters: {'splitter': 'random', 'min_samples_split': 0.07085309878861867, 'min_samples_leaf': 0.18878194930333086, 'min_weight_fraction_leaf': 0.02272553432540606, 'max_features': 0.9948660782219709}. Best is trial 1 with value: 0.8509196259844106.[0m
[32m[I 2022-04-13 11:43:50,035][0m Trial 44 finished with value: 0.7144908958755287 and parameters: {'splitter': 'best', 'min_samples_split': 0.013458545795156124, 'min_samples_leaf': 0.23852307361424752, 'min_weight_fraction_leaf': 0.09307449098873187, 'max_features': 0.9496888446195557}. Best is trial 1 with value: 0.8509196259844106.[0m
[32m[I 2022-04-13 11:43:50,085][0m Trial 45 finished with value: 0.8373195752487034 and parameters: {'splitter': 'best', 'min_samples_split': 0.12249644923313444, 'min_samples_leaf': 0.13972142311206967, 'min_weight_fraction_leaf': 0.06793956009178811, 'max_features': 0.8591206244313968}. Best is trial 1 with value: 0.8509196259844106.[0m
[32m[I 2022-04-13 11:43:50,149][0m Trial 46 finished with value: 0.8477736381158495 and parameters: {'splitter': 'best', 'min_samples_split': 0.08562992656292845, 'min_samples_leaf': 0.09594033345198132, 'min_weight_fraction_leaf': 0.13641747307117635, 'max_features': 0.906431845732577}. Best is trial 1 with value: 0.8509196259844106.[0m
[32m[I 2022-04-13 11:43:50,194][0m Trial 47 finished with value: 0.6188081862944745 and parameters: {'splitter': 'random', 'min_samples_split': 0.08434838639999546, 'min_samples_leaf': 0.030475276530352174, 'min_weight_fraction_leaf': 0.1401802901887705, 'max_features': 0.2112842596957013}. Best is trial 1 with value: 0.8509196259844106.[0m
[32m[I 2022-04-13 11:43:50,243][0m Trial 48 finished with value: 0.737119427033453 and parameters: {'splitter': 'best', 'min_samples_split': 0.34316824318426287, 'min_samples_leaf': 0.12345601859130528, 'min_weight_fraction_leaf': 0.019193026314106666, 'max_features': 0.860908255872439}. Best is trial 1 with value: 0.8509196259844106.[0m
[32m[I 2022-04-13 11:43:50,289][0m Trial 49 finished with value: 0.7432140177779105 and parameters: {'splitter': 'best', 'min_samples_split': 0.15907866367891868, 'min_samples_leaf': 0.08916037166256055, 'min_weight_fraction_leaf': 0.1844799901955576, 'max_features': 0.3300056649419559}. Best is trial 1 with value: 0.8509196259844106.[0m
[32m[I 2022-04-13 11:43:50,338][0m Trial 50 finished with value: 0.7118313332737978 and parameters: {'splitter': 'best', 'min_samples_split': 0.10405716247324807, 'min_samples_leaf': 0.06076263243066926, 'min_weight_fraction_leaf': 0.27720130565996615, 'max_features': 0.9952865412304028}. Best is trial 1 with value: 0.8509196259844106.[0m
[32m[I 2022-04-13 11:43:50,388][0m Trial 51 finished with value: 0.8420135517754167 and parameters: {'splitter': 'best', 'min_samples_split': 0.0013645824136375856, 'min_samples_leaf': 0.13030304205337706, 'min_weight_fraction_leaf': 0.022005170746445455, 'max_features': 0.9493982208376748}. Best is trial 1 with value: 0.8509196259844106.[0m
[32m[I 2022-04-13 11:43:50,437][0m Trial 52 finished with value: 0.7360888031804411 and parameters: {'splitter': 'best', 'min_samples_split': 0.05844322919056982, 'min_samples_leaf': 0.15924732506987, 'min_weight_fraction_leaf': 0.11013032206627622, 'max_features': 0.9080520809184677}. Best is trial 1 with value: 0.8509196259844106.[0m
[32m[I 2022-04-13 11:43:50,485][0m Trial 53 finished with value: 0.8386043480797054 and parameters: {'splitter': 'best', 'min_samples_split': 0.0259347971785453, 'min_samples_leaf': 0.11260715153579576, 'min_weight_fraction_leaf': 0.060989830640456044, 'max_features': 0.7780034574999635}. Best is trial 1 with value: 0.8509196259844106.[0m
[32m[I 2022-04-13 11:43:50,533][0m Trial 54 finished with value: 0.837948185988223 and parameters: {'splitter': 'best', 'min_samples_split': 0.08048744962385601, 'min_samples_leaf': 0.05577784010794463, 'min_weight_fraction_leaf': 0.0900055411005429, 'max_features': 0.8328379467950556}. Best is trial 1 with value: 0.8509196259844106.[0m
/media/san2_ssd/data/Workdir/survival/utils.py:305: RuntimeWarning: invalid value encountered in true_divide
  pdfs = np.gradient(1-survs,axis=1)/norms
[32m[I 2022-04-13 11:43:50,571][0m Trial 55 finished with value: 0.8377435602478205 and parameters: {'splitter': 'best', 'min_samples_split': 0.04662434182046551, 'min_samples_leaf': 0.03207071240885838, 'min_weight_fraction_leaf': 0.00794240946743199, 'max_features': 0.9640087968184602}. Best is trial 1 with value: 0.8509196259844106.[0m
[32m[I 2022-04-13 11:43:50,608][0m Trial 56 finished with value: 0.7478585248592335 and parameters: {'splitter': 'best', 'min_samples_split': 0.40584418255540583, 'min_samples_leaf': 0.09934834189912119, 'min_weight_fraction_leaf': 0.12416842994125116, 'max_features': 0.8955564619639378}. Best is trial 1 with value: 0.8509196259844106.[0m
[32m[I 2022-04-13 11:43:50,643][0m Trial 57 finished with value: 0.839154295204057 and parameters: {'splitter': 'best', 'min_samples_split': 0.2908622538205651, 'min_samples_leaf': 0.143521742500212, 'min_weight_fraction_leaf': 0.05599083696004809, 'max_features': 0.6480064675742927}. Best is trial 1 with value: 0.8509196259844106.[0m
[32m[I 2022-04-13 11:43:50,675][0m Trial 58 finished with value: 0.6295416277238879 and parameters: {'splitter': 'random', 'min_samples_split': 0.49471375160819836, 'min_samples_leaf': 0.3581541496814681, 'min_weight_fraction_leaf': 0.3669875980336803, 'max_features': 0.8701282020883339}. Best is trial 1 with value: 0.8509196259844106.[0m
[32m[I 2022-04-13 11:43:50,710][0m Trial 59 finished with value: 0.7235076191397947 and parameters: {'splitter': 'best', 'min_samples_split': 0.1289249084175096, 'min_samples_leaf': 0.02066329723003482, 'min_weight_fraction_leaf': 0.22843322252983733, 'max_features': 0.924566645870828}. Best is trial 1 with value: 0.8509196259844106.[0m
[32m[I 2022-04-13 11:43:50,744][0m Trial 60 finished with value: 0.8373195752487034 and parameters: {'splitter': 'best', 'min_samples_split': 0.18886770335877978, 'min_samples_leaf': 0.08550483394581629, 'min_weight_fraction_leaf': 0.14282541207968025, 'max_features': 0.8228815134611778}. Best is trial 1 with value: 0.8509196259844106.[0m
[32m[I 2022-04-13 11:43:50,778][0m Trial 61 finished with value: 0.841673588919512 and parameters: {'splitter': 'best', 'min_samples_split': 0.016097135656431574, 'min_samples_leaf': 0.15691018482094407, 'min_weight_fraction_leaf': 0.032070855945894955, 'max_features': 0.9259589017991205}. Best is trial 1 with value: 0.8509196259844106.[0m
[32m[I 2022-04-13 11:43:50,825][0m Trial 62 finished with value: 0.7126933834326028 and parameters: {'splitter': 'best', 'min_samples_split': 0.09270095708940766, 'min_samples_leaf': 0.4922826311847573, 'min_weight_fraction_leaf': 0.08538822442292524, 'max_features': 0.9990123518026056}. Best is trial 1 with value: 0.8509196259844106.[0m
