[32m[I 2022-04-14 14:10:12,829][0m Trial 483 finished with value: 0.5 and parameters: {'loss': 'coxph', 'learning_rate': 2.308114782571518e-05, 'n_estimators': 413, 'criterion': 'absolute_error', 'min_samples_split': 3, 'min_samples_leaf': 1, 'min_weight_fraction_leaf': 0.08620005967132442, 'min_impurity_decrease': 0.02361691491887729, 'max_features': 0.9436986749466256, 'subsample': 0.8370640069219609, 'dropout_rate': 0.5247196110455927, 'ccp_alpha': 0.2966396227089577}. Best is trial 480 with value: 0.7563614380513435.[0m
[32m[I 2022-04-14 14:10:25,287][0m Trial 484 finished with value: 0.5 and parameters: {'loss': 'coxph', 'learning_rate': 3.540761278190318e-05, 'n_estimators': 397, 'criterion': 'friedman_mse', 'min_samples_split': 9, 'min_samples_leaf': 1, 'min_weight_fraction_leaf': 0.070545711237706, 'min_impurity_decrease': 0.05182491606188219, 'max_features': 0.9758460795697316, 'subsample': 0.812683086349351, 'dropout_rate': 0.6078583021447785, 'ccp_alpha': 4.6397605552928765}. Best is trial 480 with value: 0.7563614380513435.[0m
[32m[I 2022-04-14 14:10:29,827][0m Trial 485 finished with value: 0.7197765773323349 and parameters: {'loss': 'coxph', 'learning_rate': 1.1975680551366027e-05, 'n_estimators': 265, 'criterion': 'friedman_mse', 'min_samples_split': 4, 'min_samples_leaf': 1, 'min_weight_fraction_leaf': 0.10143077594336877, 'min_impurity_decrease': 0.03300946338599155, 'max_features': 0.9621351792439332, 'subsample': 0.855827252437715, 'dropout_rate': 0.7029500251799481, 'ccp_alpha': 0.11820132831381054}. Best is trial 480 with value: 0.7563614380513435.[0m
[32m[I 2022-04-14 14:10:45,365][0m Trial 486 finished with value: 0.7544039202194818 and parameters: {'loss': 'coxph', 'learning_rate': 1.6947196721145296e-05, 'n_estimators': 391, 'criterion': 'friedman_mse', 'min_samples_split': 3, 'min_samples_leaf': 1, 'min_weight_fraction_leaf': 0.0818519777960546, 'min_impurity_decrease': 0.019686162550413812, 'max_features': 0.9790438140686712, 'subsample': 0.8317003238802984, 'dropout_rate': 0.4404004892632041, 'ccp_alpha': 0.004644195056841019}. Best is trial 480 with value: 0.7563614380513435.[0m
[32m[I 2022-04-14 14:10:59,916][0m Trial 487 finished with value: 0.6409330855979356 and parameters: {'loss': 'coxph', 'learning_rate': 0.015270514724250436, 'n_estimators': 382, 'criterion': 'friedman_mse', 'min_samples_split': 4, 'min_samples_leaf': 1, 'min_weight_fraction_leaf': 0.08990145864644603, 'min_impurity_decrease': 0.051378579612064774, 'max_features': 0.9339031334556644, 'subsample': 0.8314115809710915, 'dropout_rate': 0.452837283324831, 'ccp_alpha': 0.2272901084566172}. Best is trial 480 with value: 0.7563614380513435.[0m
[32m[I 2022-04-14 14:11:14,574][0m Trial 488 finished with value: 0.25282582377855345 and parameters: {'loss': 'squared', 'learning_rate': 0.0037701255009392966, 'n_estimators': 393, 'criterion': 'friedman_mse', 'min_samples_split': 3, 'min_samples_leaf': 9, 'min_weight_fraction_leaf': 0.04825299953091197, 'min_impurity_decrease': 0.017753695059820933, 'max_features': 0.9777803766759194, 'subsample': 0.8939600660630718, 'dropout_rate': 0.48993162678408314, 'ccp_alpha': 0.10030114777568985}. Best is trial 480 with value: 0.7563614380513435.[0m
[32m[I 2022-04-14 14:11:29,939][0m Trial 489 finished with value: 0.6900926406252363 and parameters: {'loss': 'coxph', 'learning_rate': 0.00019420765072623004, 'n_estimators': 432, 'criterion': 'friedman_mse', 'min_samples_split': 3, 'min_samples_leaf': 1, 'min_weight_fraction_leaf': 0.10256103106007913, 'min_impurity_decrease': 0.03888468091482787, 'max_features': 0.9534310348832642, 'subsample': 0.8506942143736433, 'dropout_rate': 0.5616870481212785, 'ccp_alpha': 0.19524833358945717}. Best is trial 480 with value: 0.7563614380513435.[0m
[32m[I 2022-04-14 14:11:43,343][0m Trial 490 finished with value: 0.5 and parameters: {'loss': 'coxph', 'learning_rate': 9.438848137413923e-06, 'n_estimators': 419, 'criterion': 'friedman_mse', 'min_samples_split': 3, 'min_samples_leaf': 1, 'min_weight_fraction_leaf': 0.45756565264798166, 'min_impurity_decrease': 0.016307670776169018, 'max_features': 0.9807374428640708, 'subsample': 0.06777621993792904, 'dropout_rate': 0.5987197342121616, 'ccp_alpha': 0.08155720529091813}. Best is trial 480 with value: 0.7563614380513435.[0m
[32m[I 2022-04-14 14:11:51,948][0m Trial 491 finished with value: 0.7505990408656016 and parameters: {'loss': 'coxph', 'learning_rate': 1.681397644461874e-05, 'n_estimators': 288, 'criterion': 'friedman_mse', 'min_samples_split': 3, 'min_samples_leaf': 1, 'min_weight_fraction_leaf': 0.07882704153171202, 'min_impurity_decrease': 0.0021289780037741495, 'max_features': 0.9570149629489668, 'subsample': 0.869013103840828, 'dropout_rate': 0.44577538174935694, 'ccp_alpha': 0.0013107255852284681}. Best is trial 480 with value: 0.7563614380513435.[0m
[32m[I 2022-04-14 14:12:00,443][0m Trial 492 finished with value: 0.5328286035390352 and parameters: {'loss': 'coxph', 'learning_rate': 2.3314554053779124e-05, 'n_estimators': 289, 'criterion': 'friedman_mse', 'min_samples_split': 3, 'min_samples_leaf': 1, 'min_weight_fraction_leaf': 0.06033977382928995, 'min_impurity_decrease': 0.0010906549432532794, 'max_features': 0.9332070263288692, 'subsample': 0.8222621400021449, 'dropout_rate': 0.43491912255533793, 'ccp_alpha': 0.2789271827307211}. Best is trial 480 with value: 0.7563614380513435.[0m
[32m[I 2022-04-14 14:12:07,240][0m Trial 493 finished with value: 0.7305138515754941 and parameters: {'loss': 'coxph', 'learning_rate': 1.3860755298944037e-05, 'n_estimators': 251, 'criterion': 'friedman_mse', 'min_samples_split': 3, 'min_samples_leaf': 1, 'min_weight_fraction_leaf': 0.07384505183966307, 'min_impurity_decrease': 0.016838942850840227, 'max_features': 0.9664756477172088, 'subsample': 0.8736082863618858, 'dropout_rate': 0.44463931877156937, 'ccp_alpha': 0.006502229230704557}. Best is trial 480 with value: 0.7563614380513435.[0m
[32m[I 2022-04-14 14:12:14,629][0m Trial 494 finished with value: 0.7555793806846963 and parameters: {'loss': 'coxph', 'learning_rate': 1.4531743545115183e-05, 'n_estimators': 270, 'criterion': 'friedman_mse', 'min_samples_split': 3, 'min_samples_leaf': 1, 'min_weight_fraction_leaf': 0.0728844149375582, 'min_impurity_decrease': 0.05408715562629823, 'max_features': 0.9813189380432925, 'subsample': 0.8383979921061248, 'dropout_rate': 0.48135406626594446, 'ccp_alpha': 0.0016347099217717776}. Best is trial 480 with value: 0.7563614380513435.[0m
[32m[I 2022-04-14 14:12:20,250][0m Trial 495 finished with value: 0.5 and parameters: {'loss': 'coxph', 'learning_rate': 1.952201121506547e-05, 'n_estimators': 239, 'criterion': 'friedman_mse', 'min_samples_split': 3, 'min_samples_leaf': 1, 'min_weight_fraction_leaf': 0.052324935334285956, 'min_impurity_decrease': 0.055420027494424734, 'max_features': 0.96410372630601, 'subsample': 0.8170843978275499, 'dropout_rate': 0.4737885643172937, 'ccp_alpha': 0.37777439536149854}. Best is trial 480 with value: 0.7563614380513435.[0m
[32m[I 2022-04-14 14:12:27,506][0m Trial 496 finished with value: 0.6834721836112492 and parameters: {'loss': 'coxph', 'learning_rate': 1.1661068090126706e-05, 'n_estimators': 271, 'criterion': 'friedman_mse', 'min_samples_split': 3, 'min_samples_leaf': 1, 'min_weight_fraction_leaf': 0.06500123379405595, 'min_impurity_decrease': 0.9086047323060551, 'max_features': 0.9823145174129755, 'subsample': 0.9134499849157259, 'dropout_rate': 0.463864606789984, 'ccp_alpha': 0.16890515061579636}. Best is trial 480 with value: 0.7563614380513435.[0m
[32m[I 2022-04-14 14:12:36,105][0m Trial 497 finished with value: 0.5 and parameters: {'loss': 'coxph', 'learning_rate': 1.3654902736630315e-05, 'n_estimators': 288, 'criterion': 'friedman_mse', 'min_samples_split': 3, 'min_samples_leaf': 1, 'min_weight_fraction_leaf': 0.07230939214356968, 'min_impurity_decrease': 0.05413738550925671, 'max_features': 0.9998898280034961, 'subsample': 0.8360160226927055, 'dropout_rate': 0.4271677814220567, 'ccp_alpha': 0.5410878887720627}. Best is trial 480 with value: 0.7563614380513435.[0m
[32m[I 2022-04-14 14:12:41,239][0m Trial 498 finished with value: 0.7261024057507879 and parameters: {'loss': 'coxph', 'learning_rate': 1.804045184235988e-05, 'n_estimators': 260, 'criterion': 'friedman_mse', 'min_samples_split': 3, 'min_samples_leaf': 1, 'min_weight_fraction_leaf': 0.07832749107660844, 'min_impurity_decrease': 0.03909196216050156, 'max_features': 0.945852751152255, 'subsample': 0.8859089078503942, 'dropout_rate': 0.631600263599893, 'ccp_alpha': 0.10987801543635464}. Best is trial 480 with value: 0.7563614380513435.[0m
[32m[I 2022-04-14 14:12:48,519][0m Trial 499 finished with value: 0.733476108253466 and parameters: {'loss': 'coxph', 'learning_rate': 1.7766761870122243e-05, 'n_estimators': 268, 'criterion': 'friedman_mse', 'min_samples_split': 3, 'min_samples_leaf': 1, 'min_weight_fraction_leaf': 0.06626836610485845, 'min_impurity_decrease': 0.0021387427589744535, 'max_features': 0.9666063607066245, 'subsample': 0.8642654126564262, 'dropout_rate': 0.46025180462754806, 'ccp_alpha': 0.001158230857262352}. Best is trial 480 with value: 0.7563614380513435.[0m
[32m[I 2022-04-14 14:12:57,598][0m Trial 500 finished with value: 0.5 and parameters: {'loss': 'coxph', 'learning_rate': 1.6120469506105497e-05, 'n_estimators': 288, 'criterion': 'friedman_mse', 'min_samples_split': 3, 'min_samples_leaf': 1, 'min_weight_fraction_leaf': 0.07999266515393304, 'min_impurity_decrease': 0.31349456353621724, 'max_features': 0.9344985977152866, 'subsample': 0.8377266280183805, 'dropout_rate': 0.4444652372976616, 'ccp_alpha': 1.3092329782883854}. Best is trial 480 with value: 0.7563614380513435.[0m
[32m[I 2022-04-14 14:13:06,435][0m Trial 501 finished with value: 0.7110203335536609 and parameters: {'loss': 'coxph', 'learning_rate': 1.4280025568379982e-05, 'n_estimators': 302, 'criterion': 'friedman_mse', 'min_samples_split': 3, 'min_samples_leaf': 1, 'min_weight_fraction_leaf': 0.054428735840706115, 'min_impurity_decrease': 0.03864724577392495, 'max_features': 0.9817055550723316, 'subsample': 0.8041731897940367, 'dropout_rate': 0.494957796188693, 'ccp_alpha': 0.16660318588552264}. Best is trial 480 with value: 0.7563614380513435.[0m
[32m[I 2022-04-14 14:13:14,519][0m Trial 502 finished with value: 0.5361431468744341 and parameters: {'loss': 'coxph', 'learning_rate': 3.087696006050415e-05, 'n_estimators': 287, 'criterion': 'friedman_mse', 'min_samples_split': 3, 'min_samples_leaf': 1, 'min_weight_fraction_leaf': 0.09368963884522201, 'min_impurity_decrease': 0.0574712034178873, 'max_features': 0.9590510571382491, 'subsample': 0.20943067888923905, 'dropout_rate': 0.48482076536989677, 'ccp_alpha': 1.010999866378174}. Best is trial 480 with value: 0.7563614380513435.[0m
[32m[I 2022-04-14 14:13:19,911][0m Trial 503 finished with value: 0.7398776106992088 and parameters: {'loss': 'coxph', 'learning_rate': 1.2363776669813725e-05, 'n_estimators': 259, 'criterion': 'friedman_mse', 'min_samples_split': 3, 'min_samples_leaf': 1, 'min_weight_fraction_leaf': 0.07042997982473559, 'min_impurity_decrease': 0.0018941921824989286, 'max_features': 0.9989076336367049, 'subsample': 0.8659414375124931, 'dropout_rate': 0.6165621129943227, 'ccp_alpha': 0.10129597163923205}. Best is trial 480 with value: 0.7563614380513435.[0m
[32m[I 2022-04-14 14:13:25,377][0m Trial 504 finished with value: 0.5328286035390352 and parameters: {'loss': 'coxph', 'learning_rate': 1.7638110242177972e-05, 'n_estimators': 273, 'criterion': 'friedman_mse', 'min_samples_split': 3, 'min_samples_leaf': 1, 'min_weight_fraction_leaf': 0.08026654369984808, 'min_impurity_decrease': 0.0355280989878909, 'max_features': 0.9780652479576838, 'subsample': 0.8273463268238733, 'dropout_rate': 0.6525229501865704, 'ccp_alpha': 0.2786305192886793}. Best is trial 480 with value: 0.7563614380513435.[0m
[32m[I 2022-04-14 14:13:28,877][0m Trial 505 finished with value: 0.5 and parameters: {'loss': 'coxph', 'learning_rate': 0.00010944520550197836, 'n_estimators': 301, 'criterion': 'absolute_error', 'min_samples_split': 3, 'min_samples_leaf': 1, 'min_weight_fraction_leaf': 0.10160730515760696, 'min_impurity_decrease': 0.5553295172350328, 'max_features': 0.32946058376533804, 'subsample': 0.8471474352354774, 'dropout_rate': 0.882078642645494, 'ccp_alpha': 0.0028335333953343703}. Best is trial 480 with value: 0.7563614380513435.[0m
[32m[I 2022-04-14 14:13:37,056][0m Trial 506 finished with value: 0.7343177088473907 and parameters: {'loss': 'coxph', 'learning_rate': 1.6599224772730862e-05, 'n_estimators': 279, 'criterion': 'friedman_mse', 'min_samples_split': 3, 'min_samples_leaf': 1, 'min_weight_fraction_leaf': 0.09141927168425366, 'min_impurity_decrease': 0.06203083906883314, 'max_features': 0.9490556539902427, 'subsample': 0.8980403696566905, 'dropout_rate': 0.4274162025068552, 'ccp_alpha': 0.09841218544894761}. Best is trial 480 with value: 0.7563614380513435.[0m
[32m[I 2022-04-14 14:13:42,676][0m Trial 507 finished with value: 0.25597611951497773 and parameters: {'loss': 'squared', 'learning_rate': 1.1076565223148363e-05, 'n_estimators': 299, 'criterion': 'friedman_mse', 'min_samples_split': 3, 'min_samples_leaf': 1, 'min_weight_fraction_leaf': 0.061353059441857344, 'min_impurity_decrease': 0.01947735251287441, 'max_features': 0.980099633679166, 'subsample': 0.7907175777349951, 'dropout_rate': 0.7126957584137718, 'ccp_alpha': 0.19040238478256333}. Best is trial 480 with value: 0.7563614380513435.[0m
[32m[I 2022-04-14 14:13:48,701][0m Trial 508 finished with value: 0.7493638849339059 and parameters: {'loss': 'coxph', 'learning_rate': 8.437655740801498e-06, 'n_estimators': 239, 'criterion': 'friedman_mse', 'min_samples_split': 3, 'min_samples_leaf': 1, 'min_weight_fraction_leaf': 0.07992515037974027, 'min_impurity_decrease': 0.0374317900464838, 'max_features': 0.9302967375058943, 'subsample': 0.8125732166835322, 'dropout_rate': 0.4487906876023075, 'ccp_alpha': 0.0010505395032224312}. Best is trial 480 with value: 0.7563614380513435.[0m
[32m[I 2022-04-14 14:13:54,397][0m Trial 509 finished with value: 0.7224131632697368 and parameters: {'loss': 'coxph', 'learning_rate': 1.0362863093170545e-05, 'n_estimators': 237, 'criterion': 'friedman_mse', 'min_samples_split': 3, 'min_samples_leaf': 1, 'min_weight_fraction_leaf': 0.07363314340407286, 'min_impurity_decrease': 0.05851731238383579, 'max_features': 0.9994741150344068, 'subsample': 0.8770645691724542, 'dropout_rate': 0.46223095143733256, 'ccp_alpha': 0.09854518521297541}. Best is trial 480 with value: 0.7563614380513435.[0m
[32m[I 2022-04-14 14:13:59,612][0m Trial 510 finished with value: 0.5798330495460544 and parameters: {'loss': 'coxph', 'learning_rate': 9.615019194181213e-06, 'n_estimators': 225, 'criterion': 'friedman_mse', 'min_samples_split': 3, 'min_samples_leaf': 1, 'min_weight_fraction_leaf': 0.05976374794996378, 'min_impurity_decrease': 0.0010468346494691104, 'max_features': 0.9261575103790797, 'subsample': 0.8547883907584912, 'dropout_rate': 0.439502713239808, 'ccp_alpha': 0.2299717643192979}. Best is trial 480 with value: 0.7563614380513435.[0m
[32m[I 2022-04-14 14:14:08,929][0m Trial 511 finished with value: 0.5 and parameters: {'loss': 'coxph', 'learning_rate': 8.47941181990406e-06, 'n_estimators': 310, 'criterion': 'friedman_mse', 'min_samples_split': 3, 'min_samples_leaf': 1, 'min_weight_fraction_leaf': 0.08046878294717788, 'min_impurity_decrease': 0.042541169985919454, 'max_features': 0.9724984133230633, 'subsample': 0.830305690213616, 'dropout_rate': 0.4773948547469026, 'ccp_alpha': 2.920235728683099}. Best is trial 480 with value: 0.7563614380513435.[0m
[32m[I 2022-04-14 14:14:21,959][0m Trial 512 finished with value: 0.7449272211801699 and parameters: {'loss': 'coxph', 'learning_rate': 7.78003679545267e-06, 'n_estimators': 362, 'criterion': 'friedman_mse', 'min_samples_split': 3, 'min_samples_leaf': 1, 'min_weight_fraction_leaf': 0.06897632297498879, 'min_impurity_decrease': 0.02164005067116822, 'max_features': 0.963089996413335, 'subsample': 0.810374634646912, 'dropout_rate': 0.4464105758693895, 'ccp_alpha': 0.10405658089516187}. Best is trial 480 with value: 0.7563614380513435.[0m
[32m[I 2022-04-14 14:14:26,557][0m Trial 513 finished with value: 0.5 and parameters: {'loss': 'coxph', 'learning_rate': 3.0041029154695537e-05, 'n_estimators': 217, 'criterion': 'friedman_mse', 'min_samples_split': 3, 'min_samples_leaf': 1, 'min_weight_fraction_leaf': 0.04795708134254221, 'min_impurity_decrease': 0.039155331812242566, 'max_features': 0.9784578889914176, 'subsample': 0.8450858874700322, 'dropout_rate': 0.497721245661224, 'ccp_alpha': 0.33217956245494135}. Best is trial 480 with value: 0.7563614380513435.[0m
[32m[I 2022-04-14 14:14:37,244][0m Trial 514 finished with value: 0.7388092425917243 and parameters: {'loss': 'coxph', 'learning_rate': 1.492073872755286e-05, 'n_estimators': 320, 'criterion': 'friedman_mse', 'min_samples_split': 3, 'min_samples_leaf': 1, 'min_weight_fraction_leaf': 0.10224771469263794, 'min_impurity_decrease': 0.025590132131557596, 'max_features': 0.9270333442076255, 'subsample': 0.876571761563099, 'dropout_rate': 0.4153512770003126, 'ccp_alpha': 0.09752895537685581}. Best is trial 480 with value: 0.7563614380513435.[0m
[32m[I 2022-04-14 14:14:41,630][0m Trial 515 finished with value: 0.6850216014709729 and parameters: {'loss': 'coxph', 'learning_rate': 1.8754082348491413e-05, 'n_estimators': 207, 'criterion': 'friedman_mse', 'min_samples_split': 4, 'min_samples_leaf': 1, 'min_weight_fraction_leaf': 0.08770899808025451, 'min_impurity_decrease': 0.06149490563182629, 'max_features': 0.9495359835726612, 'subsample': 0.7850506727072498, 'dropout_rate': 0.45875389779679093, 'ccp_alpha': 0.20458002455967683}. Best is trial 480 with value: 0.7563614380513435.[0m
[32m[I 2022-04-14 14:14:43,908][0m Trial 516 finished with value: 0.7471414516490122 and parameters: {'loss': 'coxph', 'learning_rate': 1.5789857117747173e-05, 'n_estimators': 308, 'criterion': 'friedman_mse', 'min_samples_split': 3, 'min_samples_leaf': 1, 'min_weight_fraction_leaf': 0.07789786220426279, 'min_impurity_decrease': 0.042657690895315965, 'max_features': 0.9827527777015548, 'subsample': 0.8260277363021243, 'dropout_rate': 0.9789727231752877, 'ccp_alpha': 0.006546986976992038}. Best is trial 480 with value: 0.7563614380513435.[0m
[32m[I 2022-04-14 14:14:49,423][0m Trial 517 finished with value: 0.5 and parameters: {'loss': 'coxph', 'learning_rate': 1.1729556472474514e-05, 'n_estimators': 289, 'criterion': 'friedman_mse', 'min_samples_split': 10, 'min_samples_leaf': 1, 'min_weight_fraction_leaf': 0.09520055971821809, 'min_impurity_decrease': 0.0013799953754066922, 'max_features': 0.983493380047757, 'subsample': 0.8577955922732846, 'dropout_rate': 0.686860409416475, 'ccp_alpha': 2.3753695961632144}. Best is trial 480 with value: 0.7563614380513435.[0m
[32m[I 2022-04-14 14:14:59,694][0m Trial 518 finished with value: 0.6868747338229131 and parameters: {'loss': 'coxph', 'learning_rate': 2.2140217565011967e-05, 'n_estimators': 329, 'criterion': 'friedman_mse', 'min_samples_split': 4, 'min_samples_leaf': 1, 'min_weight_fraction_leaf': 0.06741974441061876, 'min_impurity_decrease': 0.5892497015492733, 'max_features': 0.9577709249941125, 'subsample': 0.8878041114594405, 'dropout_rate': 0.47695598965064906, 'ccp_alpha': 0.17349712258998998}. Best is trial 480 with value: 0.7563614380513435.[0m
[32m[I 2022-04-14 14:15:13,598][0m Trial 519 finished with value: 0.695162239068293 and parameters: {'loss': 'coxph', 'learning_rate': 2.3266471144762053e-05, 'n_estimators': 393, 'criterion': 'friedman_mse', 'min_samples_split': 3, 'min_samples_leaf': 1, 'min_weight_fraction_leaf': 0.2872621855721983, 'min_impurity_decrease': 0.01758547393543527, 'max_features': 0.9997455962140962, 'subsample': 0.9211612602067946, 'dropout_rate': 0.4951314341496704, 'ccp_alpha': 0.09256073975426964}. Best is trial 480 with value: 0.7563614380513435.[0m
[32m[I 2022-04-14 14:15:23,365][0m Trial 520 finished with value: 0.74983922260343 and parameters: {'loss': 'coxph', 'learning_rate': 7.042639650376761e-06, 'n_estimators': 308, 'criterion': 'friedman_mse', 'min_samples_split': 3, 'min_samples_leaf': 1, 'min_weight_fraction_leaf': 0.08302628519917231, 'min_impurity_decrease': 0.059803909697936, 'max_features': 0.9654339566802267, 'subsample': 0.8437341571667342, 'dropout_rate': 0.4438323095287282, 'ccp_alpha': 0.0034686243603427014}. Best is trial 480 with value: 0.7563614380513435.[0m
[32m[I 2022-04-14 14:15:29,787][0m Trial 521 finished with value: 0.5 and parameters: {'loss': 'coxph', 'learning_rate': 5.832026178823583e-06, 'n_estimators': 249, 'criterion': 'friedman_mse', 'min_samples_split': 3, 'min_samples_leaf': 1, 'min_weight_fraction_leaf': 0.40310310480152445, 'min_impurity_decrease': 0.06325803118968157, 'max_features': 0.9416429526113306, 'subsample': 0.8072063416400318, 'dropout_rate': 0.42329203783053176, 'ccp_alpha': 0.2814946761051447}. Best is trial 480 with value: 0.7563614380513435.[0m
[32m[I 2022-04-14 14:15:38,924][0m Trial 522 finished with value: 0.7347075319769681 and parameters: {'loss': 'coxph', 'learning_rate': 7.64675548478905e-06, 'n_estimators': 299, 'criterion': 'friedman_mse', 'min_samples_split': 3, 'min_samples_leaf': 1, 'min_weight_fraction_leaf': 0.0777411004174491, 'min_impurity_decrease': 0.06090350207289367, 'max_features': 0.9308286938322726, 'subsample': 0.8362269794526008, 'dropout_rate': 0.4395125032216128, 'ccp_alpha': 0.09321479630172352}. Best is trial 480 with value: 0.7563614380513435.[0m
