[32m[I 2022-04-14 02:24:46,992][0m Trial 522 finished with value: 0.8530460955167889 and parameters: {'loss': 'coxph', 'learning_rate': 0.001246967425626409, 'n_estimators': 736, 'criterion': 'friedman_mse', 'min_samples_split': 4, 'min_samples_leaf': 5, 'min_weight_fraction_leaf': 0.0011772118397927354, 'min_impurity_decrease': 0.6834550419804696, 'max_features': 0.9146903896061694, 'subsample': 0.8409873564057866, 'dropout_rate': 0.5217214167004308, 'ccp_alpha': 0.19234130641605832}. Best is trial 379 with value: 0.878361797817203.[0m
[32m[I 2022-04-14 02:25:45,795][0m Trial 523 finished with value: 0.8615201038468381 and parameters: {'loss': 'coxph', 'learning_rate': 0.001587835326187511, 'n_estimators': 682, 'criterion': 'friedman_mse', 'min_samples_split': 4, 'min_samples_leaf': 5, 'min_weight_fraction_leaf': 0.03931527581412787, 'min_impurity_decrease': 0.6137836907324348, 'max_features': 0.2663077029262171, 'subsample': 0.8265422036096476, 'dropout_rate': 0.4844046050954861, 'ccp_alpha': 0.10209448912474116}. Best is trial 379 with value: 0.878361797817203.[0m
[32m[I 2022-04-14 02:26:54,690][0m Trial 524 finished with value: 0.8677977098789998 and parameters: {'loss': 'coxph', 'learning_rate': 0.0009708052893212378, 'n_estimators': 744, 'criterion': 'friedman_mse', 'min_samples_split': 4, 'min_samples_leaf': 5, 'min_weight_fraction_leaf': 0.06955900331887434, 'min_impurity_decrease': 0.595292717463389, 'max_features': 0.9006026148821601, 'subsample': 0.8546970444892086, 'dropout_rate': 0.5384010289853174, 'ccp_alpha': 0.09601761367603172}. Best is trial 379 with value: 0.878361797817203.[0m
[32m[I 2022-04-14 02:26:58,237][0m Trial 525 finished with value: 0.8771285708302162 and parameters: {'loss': 'coxph', 'learning_rate': 0.0012210322784680745, 'n_estimators': 164, 'criterion': 'friedman_mse', 'min_samples_split': 4, 'min_samples_leaf': 5, 'min_weight_fraction_leaf': 0.02616101361610358, 'min_impurity_decrease': 0.5972515250634073, 'max_features': 0.8846755424759117, 'subsample': 0.7980328683871151, 'dropout_rate': 0.6689845989172624, 'ccp_alpha': 0.002138790862076936}. Best is trial 379 with value: 0.878361797817203.[0m
[32m[I 2022-04-14 02:27:01,171][0m Trial 526 finished with value: 0.8495007670598518 and parameters: {'loss': 'coxph', 'learning_rate': 0.0012005823606282846, 'n_estimators': 165, 'criterion': 'friedman_mse', 'min_samples_split': 4, 'min_samples_leaf': 5, 'min_weight_fraction_leaf': 0.010989641672154389, 'min_impurity_decrease': 0.6017028422941819, 'max_features': 0.916719599787826, 'subsample': 0.8074435314619329, 'dropout_rate': 0.6340089408361488, 'ccp_alpha': 0.18695692818097487}. Best is trial 379 with value: 0.878361797817203.[0m
[32m[I 2022-04-14 02:28:04,421][0m Trial 527 finished with value: 0.65 and parameters: {'loss': 'coxph', 'learning_rate': 0.0008740142706336372, 'n_estimators': 713, 'criterion': 'friedman_mse', 'min_samples_split': 4, 'min_samples_leaf': 5, 'min_weight_fraction_leaf': 0.024011055432630837, 'min_impurity_decrease': 0.6331384531930847, 'max_features': 0.8950086730996502, 'subsample': 0.8290236043069744, 'dropout_rate': 0.5059960672471205, 'ccp_alpha': 0.33130234665439423}. Best is trial 379 with value: 0.878361797817203.[0m
[32m[I 2022-04-14 02:28:06,866][0m Trial 528 finished with value: 0.8691930130165991 and parameters: {'loss': 'coxph', 'learning_rate': 0.001502308533090405, 'n_estimators': 139, 'criterion': 'friedman_mse', 'min_samples_split': 4, 'min_samples_leaf': 5, 'min_weight_fraction_leaf': 0.05517095826736126, 'min_impurity_decrease': 0.5760254868977333, 'max_features': 0.8819809710750064, 'subsample': 0.7982573221539588, 'dropout_rate': 0.7487046913226224, 'ccp_alpha': 0.09079015648343146}. Best is trial 379 with value: 0.878361797817203.[0m
[32m[I 2022-04-14 02:28:55,646][0m Trial 529 finished with value: 0.6580440744419354 and parameters: {'loss': 'coxph', 'learning_rate': 0.0007119646309766795, 'n_estimators': 680, 'criterion': 'friedman_mse', 'min_samples_split': 5, 'min_samples_leaf': 5, 'min_weight_fraction_leaf': 0.041453696185467834, 'min_impurity_decrease': 0.5967513176749414, 'max_features': 0.9133459634812956, 'subsample': 0.9625007000474346, 'dropout_rate': 0.533117402066458, 'ccp_alpha': 0.2407759771393442}. Best is trial 379 with value: 0.878361797817203.[0m
[32m[I 2022-04-14 02:29:40,903][0m Trial 530 finished with value: 0.65 and parameters: {'loss': 'coxph', 'learning_rate': 0.0010910672818414775, 'n_estimators': 762, 'criterion': 'absolute_error', 'min_samples_split': 4, 'min_samples_leaf': 5, 'min_weight_fraction_leaf': 0.01897213128928999, 'min_impurity_decrease': 0.6509091169106328, 'max_features': 0.873473482914192, 'subsample': 0.8495600748623068, 'dropout_rate': 0.6991656811638689, 'ccp_alpha': 0.0022111622485039496}. Best is trial 379 with value: 0.878361797817203.[0m
[32m[I 2022-04-14 02:29:59,981][0m Trial 531 finished with value: 0.8560272246418326 and parameters: {'loss': 'coxph', 'learning_rate': 0.0018043147694936556, 'n_estimators': 398, 'criterion': 'friedman_mse', 'min_samples_split': 4, 'min_samples_leaf': 5, 'min_weight_fraction_leaf': 0.02918258195108098, 'min_impurity_decrease': 0.6109508804143986, 'max_features': 0.5450768692337884, 'subsample': 0.8247174343017791, 'dropout_rate': 0.46947880266641, 'ccp_alpha': 0.16461232323996386}. Best is trial 379 with value: 0.878361797817203.[0m
[32m[I 2022-04-14 02:30:04,940][0m Trial 532 finished with value: 0.65 and parameters: {'loss': 'coxph', 'learning_rate': 0.001350522817116536, 'n_estimators': 194, 'criterion': 'friedman_mse', 'min_samples_split': 4, 'min_samples_leaf': 5, 'min_weight_fraction_leaf': 0.046979014970307376, 'min_impurity_decrease': 0.6206811695925046, 'max_features': 0.8984245741947319, 'subsample': 0.7943107510617816, 'dropout_rate': 0.49754506688906686, 'ccp_alpha': 0.6132910264536952}. Best is trial 379 with value: 0.878361797817203.[0m
[32m[I 2022-04-14 02:30:41,962][0m Trial 533 finished with value: 0.8705796746655127 and parameters: {'loss': 'coxph', 'learning_rate': 0.0009252251175076608, 'n_estimators': 729, 'criterion': 'friedman_mse', 'min_samples_split': 4, 'min_samples_leaf': 5, 'min_weight_fraction_leaf': 0.008598952996382268, 'min_impurity_decrease': 0.5672284628508875, 'max_features': 0.8791403534400142, 'subsample': 0.8172154986330575, 'dropout_rate': 0.734541524035384, 'ccp_alpha': 0.09077690051909183}. Best is trial 379 with value: 0.878361797817203.[0m
[32m[I 2022-04-14 02:31:43,269][0m Trial 534 finished with value: 0.8677927348999953 and parameters: {'loss': 'coxph', 'learning_rate': 0.001232265566354056, 'n_estimators': 776, 'criterion': 'friedman_mse', 'min_samples_split': 4, 'min_samples_leaf': 5, 'min_weight_fraction_leaf': 0.03599890510799822, 'min_impurity_decrease': 0.5865933194565702, 'max_features': 0.8557198335713503, 'subsample': 0.7878830358210329, 'dropout_rate': 0.6532120522837892, 'ccp_alpha': 0.0952018743167929}. Best is trial 379 with value: 0.878361797817203.[0m
[32m[I 2022-04-14 02:32:34,542][0m Trial 535 finished with value: 0.65 and parameters: {'loss': 'coxph', 'learning_rate': 0.0016071639753719527, 'n_estimators': 695, 'criterion': 'squared_error', 'min_samples_split': 4, 'min_samples_leaf': 5, 'min_weight_fraction_leaf': 0.02006296629074287, 'min_impurity_decrease': 0.45730648942309726, 'max_features': 0.9197364988662687, 'subsample': 0.8413468328726262, 'dropout_rate': 0.6781346832307552, 'ccp_alpha': 0.19066019954315958}. Best is trial 379 with value: 0.878361797817203.[0m
[32m[I 2022-04-14 02:34:04,931][0m Trial 536 finished with value: 0.8689307792405618 and parameters: {'loss': 'coxph', 'learning_rate': 0.0007542895829684089, 'n_estimators': 795, 'criterion': 'friedman_mse', 'min_samples_split': 4, 'min_samples_leaf': 5, 'min_weight_fraction_leaf': 0.06726103569410372, 'min_impurity_decrease': 0.6389994356400236, 'max_features': 0.8995587818201254, 'subsample': 0.867356034558718, 'dropout_rate': 0.4566340315190086, 'ccp_alpha': 0.007330238963347108}. Best is trial 379 with value: 0.878361797817203.[0m
[32m[I 2022-04-14 02:35:18,160][0m Trial 537 finished with value: 0.8318628598222514 and parameters: {'loss': 'coxph', 'learning_rate': 0.0010393471641077924, 'n_estimators': 748, 'criterion': 'friedman_mse', 'min_samples_split': 4, 'min_samples_leaf': 5, 'min_weight_fraction_leaf': 0.028964610158869013, 'min_impurity_decrease': 0.5592331612721988, 'max_features': 0.8708547514301593, 'subsample': 0.8084110328126376, 'dropout_rate': 0.5244786633908916, 'ccp_alpha': 0.2703180056997934}. Best is trial 379 with value: 0.878361797817203.[0m
[32m[I 2022-04-14 02:36:05,890][0m Trial 538 finished with value: 0.8741405829760464 and parameters: {'loss': 'coxph', 'learning_rate': 0.0019563893806080067, 'n_estimators': 719, 'criterion': 'friedman_mse', 'min_samples_split': 4, 'min_samples_leaf': 4, 'min_weight_fraction_leaf': 0.0545086625481917, 'min_impurity_decrease': 0.4356557700676248, 'max_features': 0.8839464396245026, 'subsample': 0.7764073547142414, 'dropout_rate': 0.6692263337737892, 'ccp_alpha': 0.09690857161264863}. Best is trial 379 with value: 0.878361797817203.[0m
[32m[I 2022-04-14 02:37:12,018][0m Trial 539 finished with value: 0.8546089674651167 and parameters: {'loss': 'coxph', 'learning_rate': 0.001371327384216346, 'n_estimators': 662, 'criterion': 'friedman_mse', 'min_samples_split': 4, 'min_samples_leaf': 5, 'min_weight_fraction_leaf': 0.010183901225610142, 'min_impurity_decrease': 0.4209064284530634, 'max_features': 0.8548419844333641, 'subsample': 0.8197923007195574, 'dropout_rate': 0.4812365420314452, 'ccp_alpha': 0.16744052043772184}. Best is trial 379 with value: 0.878361797817203.[0m
[32m[I 2022-04-14 02:37:14,240][0m Trial 540 finished with value: -0.3671956850285748 and parameters: {'loss': 'squared', 'learning_rate': 0.0008938507895436709, 'n_estimators': 132, 'criterion': 'friedman_mse', 'min_samples_split': 4, 'min_samples_leaf': 2, 'min_weight_fraction_leaf': 0.04103435616174272, 'min_impurity_decrease': 0.6223030138355322, 'max_features': 0.9209100667957966, 'subsample': 0.7996426395174581, 'dropout_rate': 0.5529200817214729, 'ccp_alpha': 0.0012850606739609252}. Best is trial 379 with value: 0.878361797817203.[0m
[32m[I 2022-04-14 02:38:49,526][0m Trial 541 finished with value: 0.8654991660950827 and parameters: {'loss': 'coxph', 'learning_rate': 0.0011433044373601888, 'n_estimators': 802, 'criterion': 'friedman_mse', 'min_samples_split': 4, 'min_samples_leaf': 3, 'min_weight_fraction_leaf': 0.01762177406525965, 'min_impurity_decrease': 0.44769934048474647, 'max_features': 0.05583702636036453, 'subsample': 0.7648132549695109, 'dropout_rate': 0.4665866343487421, 'ccp_alpha': 0.09542272160203127}. Best is trial 379 with value: 0.878361797817203.[0m
[32m[I 2022-04-14 02:39:42,097][0m Trial 542 finished with value: 0.65 and parameters: {'loss': 'coxph', 'learning_rate': 0.0007202346895210618, 'n_estimators': 766, 'criterion': 'friedman_mse', 'min_samples_split': 5, 'min_samples_leaf': 4, 'min_weight_fraction_leaf': 0.04735546360288974, 'min_impurity_decrease': 0.667164458925199, 'max_features': 0.8603858566268083, 'subsample': 0.8429281479378486, 'dropout_rate': 0.7165749122254315, 'ccp_alpha': 0.3631960904939283}. Best is trial 379 with value: 0.878361797817203.[0m
[32m[I 2022-04-14 02:41:12,147][0m Trial 543 finished with value: 0.8571928071879915 and parameters: {'loss': 'coxph', 'learning_rate': 0.001872993839513017, 'n_estimators': 805, 'criterion': 'friedman_mse', 'min_samples_split': 4, 'min_samples_leaf': 5, 'min_weight_fraction_leaf': 0.0318913158016115, 'min_impurity_decrease': 0.5845160371091775, 'max_features': 0.22663526538951217, 'subsample': 0.7869994782235139, 'dropout_rate': 0.5047999731821778, 'ccp_alpha': 0.005213619384307673}. Best is trial 379 with value: 0.878361797817203.[0m
[32m[I 2022-04-14 02:41:14,404][0m Trial 544 finished with value: 0.8442120758413182 and parameters: {'loss': 'coxph', 'learning_rate': 0.0006016846617803058, 'n_estimators': 115, 'criterion': 'friedman_mse', 'min_samples_split': 4, 'min_samples_leaf': 4, 'min_weight_fraction_leaf': 0.05810883717106986, 'min_impurity_decrease': 0.5971846885432842, 'max_features': 0.8948918290626255, 'subsample': 0.8283333492747019, 'dropout_rate': 0.44566123506751854, 'ccp_alpha': 0.1810287226303744}. Best is trial 379 with value: 0.878361797817203.[0m
[32m[I 2022-04-14 02:41:30,326][0m Trial 545 finished with value: 0.7765176425905184 and parameters: {'loss': 'coxph', 'learning_rate': 0.0014807945034480774, 'n_estimators': 325, 'criterion': 'friedman_mse', 'min_samples_split': 4, 'min_samples_leaf': 3, 'min_weight_fraction_leaf': 0.07213279794102771, 'min_impurity_decrease': 0.7923509797120698, 'max_features': 0.8779018777168702, 'subsample': 0.7985731897866556, 'dropout_rate': 0.4857320391227626, 'ccp_alpha': 0.26710525574789945}. Best is trial 379 with value: 0.878361797817203.[0m
[32m[I 2022-04-14 02:42:45,312][0m Trial 546 finished with value: 0.8611380579711003 and parameters: {'loss': 'coxph', 'learning_rate': 0.0010166985001461603, 'n_estimators': 740, 'criterion': 'friedman_mse', 'min_samples_split': 4, 'min_samples_leaf': 3, 'min_weight_fraction_leaf': 0.0010927686133625977, 'min_impurity_decrease': 0.6323172601741534, 'max_features': 0.15425299725152053, 'subsample': 0.8826608675366037, 'dropout_rate': 0.5217567786053767, 'ccp_alpha': 0.002390325707241385}. Best is trial 379 with value: 0.878361797817203.[0m
[32m[I 2022-04-14 02:44:03,074][0m Trial 547 finished with value: 0.8635457492399222 and parameters: {'loss': 'coxph', 'learning_rate': 0.0012237328876272332, 'n_estimators': 816, 'criterion': 'friedman_mse', 'min_samples_split': 4, 'min_samples_leaf': 4, 'min_weight_fraction_leaf': 0.022153566880539086, 'min_impurity_decrease': 0.47350184520069616, 'max_features': 0.8462465247432871, 'subsample': 0.7572310879206571, 'dropout_rate': 0.547458606421886, 'ccp_alpha': 0.11583226415598688}. Best is trial 379 with value: 0.878361797817203.[0m
[32m[I 2022-04-14 02:45:01,864][0m Trial 548 finished with value: 0.65 and parameters: {'loss': 'coxph', 'learning_rate': 0.002103400054355161, 'n_estimators': 684, 'criterion': 'friedman_mse', 'min_samples_split': 5, 'min_samples_leaf': 5, 'min_weight_fraction_leaf': 0.03628256223355577, 'min_impurity_decrease': 0.7239256391512954, 'max_features': 0.9079368306689445, 'subsample': 0.0390865515564226, 'dropout_rate': 0.45375899868667274, 'ccp_alpha': 0.0013144309898084178}. Best is trial 379 with value: 0.878361797817203.[0m
[32m[I 2022-04-14 02:45:06,043][0m Trial 549 finished with value: 0.8569315219735127 and parameters: {'loss': 'coxph', 'learning_rate': 0.0008290192047987786, 'n_estimators': 158, 'criterion': 'friedman_mse', 'min_samples_split': 4, 'min_samples_leaf': 2, 'min_weight_fraction_leaf': 0.010560561204135559, 'min_impurity_decrease': 0.5605421693708182, 'max_features': 0.4159461447968209, 'subsample': 0.8146407050535506, 'dropout_rate': 0.5058946137634359, 'ccp_alpha': 0.09692029629955962}. Best is trial 379 with value: 0.878361797817203.[0m
[32m[I 2022-04-14 02:47:03,840][0m Trial 550 finished with value: 0.65 and parameters: {'loss': 'coxph', 'learning_rate': 0.001532629569401218, 'n_estimators': 912, 'criterion': 'absolute_error', 'min_samples_split': 4, 'min_samples_leaf': 3, 'min_weight_fraction_leaf': 0.026066995708552847, 'min_impurity_decrease': 0.6566721919327512, 'max_features': 0.8586493593916941, 'subsample': 0.5098155070475758, 'dropout_rate': 0.47406043519198, 'ccp_alpha': 0.17294543141158164}. Best is trial 379 with value: 0.878361797817203.[0m
[32m[I 2022-04-14 02:47:05,640][0m Trial 551 finished with value: 0.65 and parameters: {'loss': 'coxph', 'learning_rate': 0.0009112344309084978, 'n_estimators': 108, 'criterion': 'friedman_mse', 'min_samples_split': 4, 'min_samples_leaf': 4, 'min_weight_fraction_leaf': 0.04963714293470684, 'min_impurity_decrease': 0.42455573796051604, 'max_features': 0.8781729866033429, 'subsample': 0.7779631305961165, 'dropout_rate': 0.49943722301958715, 'ccp_alpha': 2.6096664373829794}. Best is trial 379 with value: 0.878361797817203.[0m
[32m[I 2022-04-14 02:48:24,263][0m Trial 552 finished with value: 0.8654024693355782 and parameters: {'loss': 'coxph', 'learning_rate': 0.0017704079418495134, 'n_estimators': 766, 'criterion': 'friedman_mse', 'min_samples_split': 4, 'min_samples_leaf': 4, 'min_weight_fraction_leaf': 0.041451902489759926, 'min_impurity_decrease': 0.6947636656884661, 'max_features': 0.8406002617001511, 'subsample': 0.8588451847656142, 'dropout_rate': 0.5216055770890348, 'ccp_alpha': 0.08967834491331499}. Best is trial 379 with value: 0.878361797817203.[0m
[32m[I 2022-04-14 02:49:37,770][0m Trial 553 finished with value: 0.8458725375578166 and parameters: {'loss': 'coxph', 'learning_rate': 0.0011755825304699374, 'n_estimators': 709, 'criterion': 'friedman_mse', 'min_samples_split': 4, 'min_samples_leaf': 3, 'min_weight_fraction_leaf': 0.06200255583473693, 'min_impurity_decrease': 0.6033335483235821, 'max_features': 0.8934992711275846, 'subsample': 0.7542153213320463, 'dropout_rate': 0.43335947005583497, 'ccp_alpha': 0.2539225155627411}. Best is trial 379 with value: 0.878361797817203.[0m
[32m[I 2022-04-14 02:49:45,736][0m Trial 554 finished with value: 0.8535972382793231 and parameters: {'loss': 'coxph', 'learning_rate': 0.0007260052636668539, 'n_estimators': 214, 'criterion': 'friedman_mse', 'min_samples_split': 4, 'min_samples_leaf': 5, 'min_weight_fraction_leaf': 0.015699205545855827, 'min_impurity_decrease': 0.4151488523416687, 'max_features': 0.3413239244604761, 'subsample': 0.8352718388578749, 'dropout_rate': 0.47438958017915567, 'ccp_alpha': 0.09091695056778341}. Best is trial 379 with value: 0.878361797817203.[0m
[32m[I 2022-04-14 02:50:59,286][0m Trial 555 finished with value: 0.8501734862395318 and parameters: {'loss': 'coxph', 'learning_rate': 0.001391938187499972, 'n_estimators': 838, 'criterion': 'friedman_mse', 'min_samples_split': 4, 'min_samples_leaf': 3, 'min_weight_fraction_leaf': 0.028995187843504563, 'min_impurity_decrease': 0.4504911203712819, 'max_features': 0.8233779997173373, 'subsample': 0.8050320442140833, 'dropout_rate': 0.6644856310400555, 'ccp_alpha': 0.19162271934304762}. Best is trial 379 with value: 0.878361797817203.[0m
[32m[I 2022-04-14 02:52:28,564][0m Trial 556 finished with value: 0.8763798750942124 and parameters: {'loss': 'coxph', 'learning_rate': 0.0006022487118104242, 'n_estimators': 765, 'criterion': 'friedman_mse', 'min_samples_split': 4, 'min_samples_leaf': 2, 'min_weight_fraction_leaf': 0.03886873109898135, 'min_impurity_decrease': 0.5720670488597508, 'max_features': 0.8658200132804288, 'subsample': 0.7792838018195951, 'dropout_rate': 0.45397863578655057, 'ccp_alpha': 0.0011768196940651746}. Best is trial 379 with value: 0.878361797817203.[0m
[32m[I 2022-04-14 02:53:57,659][0m Trial 557 finished with value: 0.65 and parameters: {'loss': 'coxph', 'learning_rate': 0.00041753106668661804, 'n_estimators': 780, 'criterion': 'squared_error', 'min_samples_split': 4, 'min_samples_leaf': 2, 'min_weight_fraction_leaf': 0.051245741785051785, 'min_impurity_decrease': 0.6202334902793029, 'max_features': 0.9296316920889036, 'subsample': 0.7426595360579744, 'dropout_rate': 0.4422529168940759, 'ccp_alpha': 2.9916366444476266}. Best is trial 379 with value: 0.878361797817203.[0m
[32m[I 2022-04-14 02:55:18,074][0m Trial 558 finished with value: 0.6576302970240425 and parameters: {'loss': 'coxph', 'learning_rate': 0.0005460279704685413, 'n_estimators': 797, 'criterion': 'friedman_mse', 'min_samples_split': 5, 'min_samples_leaf': 2, 'min_weight_fraction_leaf': 0.04332573424074101, 'min_impurity_decrease': 0.5778288063257904, 'max_features': 0.8715713304091042, 'subsample': 0.7756468829834489, 'dropout_rate': 0.4543975880728568, 'ccp_alpha': 0.3225555322851191}. Best is trial 379 with value: 0.878361797817203.[0m
[32m[I 2022-04-14 02:56:49,567][0m Trial 559 finished with value: -0.3715974563297515 and parameters: {'loss': 'squared', 'learning_rate': 2.1900485051677565e-05, 'n_estimators': 759, 'criterion': 'friedman_mse', 'min_samples_split': 4, 'min_samples_leaf': 2, 'min_weight_fraction_leaf': 0.05970739825834642, 'min_impurity_decrease': 0.6001144739569054, 'max_features': 0.9043210560756181, 'subsample': 0.7453066863666038, 'dropout_rate': 0.4274541996882645, 'ccp_alpha': 0.0027305587955083655}. Best is trial 379 with value: 0.878361797817203.[0m
[32m[I 2022-04-14 02:57:03,176][0m Trial 560 finished with value: 0.8575180559659973 and parameters: {'loss': 'coxph', 'learning_rate': 0.0006150508253620857, 'n_estimators': 271, 'criterion': 'friedman_mse', 'min_samples_split': 4, 'min_samples_leaf': 2, 'min_weight_fraction_leaf': 0.03554874324931382, 'min_impurity_decrease': 0.5763282709492271, 'max_features': 0.8669287592793731, 'subsample': 0.3285105944279655, 'dropout_rate': 0.4675488081752757, 'ccp_alpha': 0.4289526088330373}. Best is trial 379 with value: 0.878361797817203.[0m
[32m[I 2022-04-14 02:58:36,075][0m Trial 561 finished with value: 0.8703441903227164 and parameters: {'loss': 'coxph', 'learning_rate': 0.0005118995520998614, 'n_estimators': 831, 'criterion': 'friedman_mse', 'min_samples_split': 4, 'min_samples_leaf': 2, 'min_weight_fraction_leaf': 0.06902010231914818, 'min_impurity_decrease': 0.6291352094665623, 'max_features': 0.8877171220376763, 'subsample': 0.7720550031531084, 'dropout_rate': 0.44864975987667294, 'ccp_alpha': 0.09588775375778223}. Best is trial 379 with value: 0.878361797817203.[0m
