[32m[I 2022-04-19 13:56:22,284][0m Trial 458 finished with value: 0.7297433221534357 and parameters: {'n_hidden': 32, 'mixture_components': 1, 'use_sparse_layer': True, 'use_sparse_loss': False, 'use_batchnorm': True, 'use_dropout': False, 'mlp_size_1': 0, 'mlp_size_2': 2, 'mlp_size_3': 0, 'kernel': 'Exponential', 'loss_name': 'NLLLoss'}. Best is trial 425 with value: 0.7401473255243529.[0m
[32m[I 2022-04-19 14:03:40,594][0m Trial 459 finished with value: 0.7328741581157111 and parameters: {'n_hidden': 32, 'mixture_components': 2, 'use_sparse_layer': True, 'use_sparse_loss': False, 'use_batchnorm': True, 'use_dropout': True, 'dropout': 0.35396944114307044, 'mlp_size_1': 0, 'mlp_size_2': 2, 'mlp_size_3': 0, 'kernel': 'Exponential', 'loss_name': 'NLLLoss'}. Best is trial 425 with value: 0.7401473255243529.[0m
[32m[I 2022-04-19 14:07:51,260][0m Trial 460 finished with value: 0.72713172711683 and parameters: {'n_hidden': 32, 'mixture_components': 2, 'use_sparse_layer': True, 'use_sparse_loss': False, 'use_batchnorm': True, 'use_dropout': False, 'mlp_size_1': 0, 'mlp_size_2': 2, 'mlp_size_3': 0, 'kernel': 'Exponential', 'loss_name': 'NLLLoss'}. Best is trial 425 with value: 0.7401473255243529.[0m
[32m[I 2022-04-19 14:12:50,468][0m Trial 461 finished with value: 0.725375672389353 and parameters: {'n_hidden': 32, 'mixture_components': 2, 'use_sparse_layer': True, 'use_sparse_loss': False, 'use_batchnorm': True, 'use_dropout': False, 'mlp_size_1': 0, 'mlp_size_2': 2, 'mlp_size_3': 0, 'kernel': 'Exponential', 'loss_name': 'NLLLoss'}. Best is trial 425 with value: 0.7401473255243529.[0m
[32m[I 2022-04-19 14:17:27,078][0m Trial 462 finished with value: 0.7417682648121767 and parameters: {'n_hidden': 32, 'mixture_components': 2, 'use_sparse_layer': True, 'use_sparse_loss': False, 'use_batchnorm': True, 'use_dropout': False, 'mlp_size_1': 0, 'mlp_size_2': 2, 'mlp_size_3': 0, 'kernel': 'Exponential', 'loss_name': 'NLLLoss'}. Best is trial 462 with value: 0.7417682648121767.[0m
[32m[I 2022-04-19 14:22:16,981][0m Trial 463 finished with value: 0.7219768052485824 and parameters: {'n_hidden': 32, 'mixture_components': 2, 'use_sparse_layer': True, 'use_sparse_loss': False, 'use_batchnorm': True, 'use_dropout': False, 'mlp_size_1': 0, 'mlp_size_2': 2, 'mlp_size_3': 0, 'kernel': 'Exponential', 'loss_name': 'NLLLoss'}. Best is trial 462 with value: 0.7417682648121767.[0m
[32m[I 2022-04-19 14:27:24,471][0m Trial 464 finished with value: 0.7048401132885578 and parameters: {'n_hidden': 32, 'mixture_components': 2, 'use_sparse_layer': True, 'use_sparse_loss': False, 'use_batchnorm': True, 'use_dropout': False, 'mlp_size_1': 0, 'mlp_size_2': 2, 'mlp_size_3': 0, 'kernel': 'Exponential', 'loss_name': 'NLLLoss'}. Best is trial 462 with value: 0.7417682648121767.[0m
[32m[I 2022-04-19 14:30:59,140][0m Trial 465 finished with value: 0.610209601648617 and parameters: {'n_hidden': 32, 'mixture_components': 2, 'use_sparse_layer': True, 'use_sparse_loss': False, 'use_batchnorm': False, 'use_dropout': False, 'mlp_size_1': 0, 'mlp_size_2': 2, 'mlp_size_3': 0, 'kernel': 'Exponential', 'loss_name': 'NLLLoss'}. Best is trial 462 with value: 0.7417682648121767.[0m
[32m[I 2022-04-19 14:35:43,798][0m Trial 466 finished with value: 0.7300076378252676 and parameters: {'n_hidden': 32, 'mixture_components': 2, 'use_sparse_layer': True, 'use_sparse_loss': False, 'use_batchnorm': True, 'use_dropout': False, 'mlp_size_1': 0, 'mlp_size_2': 2, 'mlp_size_3': 0, 'kernel': 'Exponential', 'loss_name': 'NLLLoss'}. Best is trial 462 with value: 0.7417682648121767.[0m
[32m[I 2022-04-19 14:41:14,429][0m Trial 467 finished with value: 0.7108533052988303 and parameters: {'n_hidden': 32, 'mixture_components': 2, 'use_sparse_layer': True, 'use_sparse_loss': False, 'use_batchnorm': True, 'use_dropout': False, 'mlp_size_1': 0, 'mlp_size_2': 2, 'mlp_size_3': 0, 'kernel': 'Exponential', 'loss_name': 'NLLLoss'}. Best is trial 462 with value: 0.7417682648121767.[0m
[32m[I 2022-04-19 14:46:51,213][0m Trial 468 finished with value: 0.7261028402239914 and parameters: {'n_hidden': 32, 'mixture_components': 2, 'use_sparse_layer': True, 'use_sparse_loss': False, 'use_batchnorm': True, 'use_dropout': False, 'mlp_size_1': 0, 'mlp_size_2': 2, 'mlp_size_3': 0, 'kernel': 'Exponential', 'loss_name': 'NLLLoss'}. Best is trial 462 with value: 0.7417682648121767.[0m
[32m[I 2022-04-19 14:52:34,838][0m Trial 469 finished with value: 0.7159883906792304 and parameters: {'n_hidden': 32, 'mixture_components': 2, 'use_sparse_layer': True, 'use_sparse_loss': False, 'use_batchnorm': True, 'use_dropout': False, 'mlp_size_1': 0, 'mlp_size_2': 2, 'mlp_size_3': 0, 'kernel': 'Exponential', 'loss_name': 'NLLLoss'}. Best is trial 462 with value: 0.7417682648121767.[0m
[32m[I 2022-04-19 14:56:14,116][0m Trial 470 finished with value: 0.6718596307607767 and parameters: {'n_hidden': 32, 'mixture_components': 2, 'use_sparse_layer': True, 'use_sparse_loss': False, 'use_batchnorm': True, 'use_dropout': False, 'mlp_size_1': 0, 'mlp_size_2': 2, 'mlp_size_3': 0, 'kernel': 'LogLogistic', 'loss_name': 'NLLLoss'}. Best is trial 462 with value: 0.7417682648121767.[0m
[32m[I 2022-04-19 15:01:41,410][0m Trial 471 finished with value: 0.7273090515811131 and parameters: {'n_hidden': 32, 'mixture_components': 2, 'use_sparse_layer': True, 'use_sparse_loss': False, 'use_batchnorm': True, 'use_dropout': False, 'mlp_size_1': 0, 'mlp_size_2': 2, 'mlp_size_3': 0, 'kernel': 'Exponential', 'loss_name': 'NLLLoss'}. Best is trial 462 with value: 0.7417682648121767.[0m
[32m[I 2022-04-19 15:07:55,231][0m Trial 472 finished with value: 0.708959553352957 and parameters: {'n_hidden': 32, 'mixture_components': 2, 'use_sparse_layer': True, 'use_sparse_loss': False, 'use_batchnorm': True, 'use_dropout': False, 'mlp_size_1': 0, 'mlp_size_2': 2, 'mlp_size_3': 0, 'kernel': 'Exponential', 'loss_name': 'NLLLoss'}. Best is trial 462 with value: 0.7417682648121767.[0m
[32m[I 2022-04-19 15:13:04,400][0m Trial 473 finished with value: 0.7290411690039609 and parameters: {'n_hidden': 32, 'mixture_components': 2, 'use_sparse_layer': True, 'use_sparse_loss': False, 'use_batchnorm': True, 'use_dropout': False, 'mlp_size_1': 0, 'mlp_size_2': 2, 'mlp_size_3': 0, 'kernel': 'Exponential', 'loss_name': 'NLLLoss'}. Best is trial 462 with value: 0.7417682648121767.[0m
[32m[I 2022-04-19 15:16:26,382][0m Trial 474 finished with value: 0.6512254995203965 and parameters: {'n_hidden': 32, 'mixture_components': 2, 'use_sparse_layer': True, 'use_sparse_loss': False, 'use_batchnorm': True, 'use_dropout': False, 'mlp_size_1': 0, 'mlp_size_2': 2, 'mlp_size_3': 0, 'kernel': 'Normal', 'loss_name': 'NLLLoss'}. Best is trial 462 with value: 0.7417682648121767.[0m
[32m[I 2022-04-19 15:21:13,345][0m Trial 475 finished with value: 0.7090800594830002 and parameters: {'n_hidden': 32, 'mixture_components': 2, 'use_sparse_layer': True, 'use_sparse_loss': False, 'use_batchnorm': True, 'use_dropout': False, 'mlp_size_1': 0, 'mlp_size_2': 2, 'mlp_size_3': 0, 'kernel': 'Exponential', 'loss_name': 'NLLLoss'}. Best is trial 462 with value: 0.7417682648121767.[0m
[32m[I 2022-04-19 15:26:18,722][0m Trial 476 finished with value: 0.7177131575877179 and parameters: {'n_hidden': 32, 'mixture_components': 2, 'use_sparse_layer': True, 'use_sparse_loss': False, 'use_batchnorm': True, 'use_dropout': False, 'mlp_size_1': 0, 'mlp_size_2': 2, 'mlp_size_3': 0, 'kernel': 'Exponential', 'loss_name': 'NLLLoss'}. Best is trial 462 with value: 0.7417682648121767.[0m
[32m[I 2022-04-19 15:31:17,151][0m Trial 477 finished with value: 0.7049275106800362 and parameters: {'n_hidden': 32, 'mixture_components': 2, 'use_sparse_layer': True, 'use_sparse_loss': False, 'use_batchnorm': True, 'use_dropout': False, 'mlp_size_1': 0, 'mlp_size_2': 2, 'mlp_size_3': 0, 'kernel': 'Exponential', 'loss_name': 'NLLLoss'}. Best is trial 462 with value: 0.7417682648121767.[0m
[32m[I 2022-04-19 15:36:28,301][0m Trial 478 finished with value: 0.7161652715959574 and parameters: {'n_hidden': 32, 'mixture_components': 2, 'use_sparse_layer': True, 'use_sparse_loss': False, 'use_batchnorm': True, 'use_dropout': False, 'mlp_size_1': 0, 'mlp_size_2': 2, 'mlp_size_3': 0, 'kernel': 'Exponential', 'loss_name': 'NLLLoss'}. Best is trial 462 with value: 0.7417682648121767.[0m
[32m[I 2022-04-19 15:39:13,989][0m Trial 479 finished with value: 0.6710146410476497 and parameters: {'n_hidden': 32, 'mixture_components': 2, 'use_sparse_layer': True, 'use_sparse_loss': False, 'use_batchnorm': True, 'use_dropout': False, 'mlp_size_1': 0, 'mlp_size_2': 2, 'mlp_size_3': 0, 'kernel': 'Gumbel', 'loss_name': 'NLLLoss'}. Best is trial 462 with value: 0.7417682648121767.[0m
[32m[I 2022-04-19 15:44:39,092][0m Trial 480 finished with value: 0.7197288482971491 and parameters: {'n_hidden': 32, 'mixture_components': 2, 'use_sparse_layer': True, 'use_sparse_loss': False, 'use_batchnorm': True, 'use_dropout': False, 'mlp_size_1': 0, 'mlp_size_2': 2, 'mlp_size_3': 0, 'kernel': 'Exponential', 'loss_name': 'NLLLoss'}. Best is trial 462 with value: 0.7417682648121767.[0m
[32m[I 2022-04-19 15:47:48,623][0m Trial 481 finished with value: 0.6926321026415396 and parameters: {'n_hidden': 32, 'mixture_components': 2, 'use_sparse_layer': True, 'use_sparse_loss': False, 'use_batchnorm': True, 'use_dropout': False, 'mlp_size_1': 0, 'mlp_size_2': 2, 'mlp_size_3': 0, 'kernel': 'Weibull', 'loss_name': 'NLLLoss'}. Best is trial 462 with value: 0.7417682648121767.[0m
[32m[I 2022-04-19 15:53:28,248][0m Trial 482 finished with value: 0.7183585008479011 and parameters: {'n_hidden': 32, 'mixture_components': 2, 'use_sparse_layer': True, 'use_sparse_loss': False, 'use_batchnorm': True, 'use_dropout': False, 'mlp_size_1': 0, 'mlp_size_2': 2, 'mlp_size_3': 0, 'kernel': 'Exponential', 'loss_name': 'AlternativeNLLLoss'}. Best is trial 462 with value: 0.7417682648121767.[0m
[32m[I 2022-04-19 15:58:59,616][0m Trial 483 finished with value: 0.7274692135104395 and parameters: {'n_hidden': 32, 'mixture_components': 2, 'use_sparse_layer': True, 'use_sparse_loss': False, 'use_batchnorm': True, 'use_dropout': False, 'mlp_size_1': 0, 'mlp_size_2': 2, 'mlp_size_3': 0, 'kernel': 'Exponential', 'loss_name': 'NLLLoss'}. Best is trial 462 with value: 0.7417682648121767.[0m
[32m[I 2022-04-19 16:02:50,743][0m Trial 484 finished with value: 0.6421392282712689 and parameters: {'n_hidden': 32, 'mixture_components': 2, 'use_sparse_layer': True, 'use_sparse_loss': False, 'use_batchnorm': True, 'use_dropout': False, 'mlp_size_1': 0, 'mlp_size_2': 2, 'mlp_size_3': 0, 'kernel': 'Logistic', 'loss_name': 'NLLLoss'}. Best is trial 462 with value: 0.7417682648121767.[0m
[32m[I 2022-04-19 16:07:27,361][0m Trial 485 finished with value: 0.7429058231722457 and parameters: {'n_hidden': 32, 'mixture_components': 2, 'use_sparse_layer': True, 'use_sparse_loss': False, 'use_batchnorm': True, 'use_dropout': False, 'mlp_size_1': 0, 'mlp_size_2': 2, 'mlp_size_3': 0, 'kernel': 'Exponential', 'loss_name': 'NLLLoss'}. Best is trial 485 with value: 0.7429058231722457.[0m
[32m[I 2022-04-19 16:13:30,315][0m Trial 486 finished with value: 0.6808939223011619 and parameters: {'n_hidden': 32, 'mixture_components': 2, 'use_sparse_layer': True, 'use_sparse_loss': False, 'use_batchnorm': True, 'use_dropout': False, 'mlp_size_1': 0, 'mlp_size_2': 2, 'mlp_size_3': 0, 'kernel': 'LogNormal', 'loss_name': 'NLLLoss'}. Best is trial 485 with value: 0.7429058231722457.[0m
[32m[I 2022-04-19 16:17:36,780][0m Trial 487 finished with value: 0.7302166283487909 and parameters: {'n_hidden': 32, 'mixture_components': 2, 'use_sparse_layer': True, 'use_sparse_loss': False, 'use_batchnorm': True, 'use_dropout': False, 'mlp_size_1': 0, 'mlp_size_2': 2, 'mlp_size_3': 0, 'kernel': 'Exponential', 'loss_name': 'NLLLoss'}. Best is trial 485 with value: 0.7429058231722457.[0m
[32m[I 2022-04-19 16:22:48,825][0m Trial 488 finished with value: 0.7335002539651203 and parameters: {'n_hidden': 32, 'mixture_components': 2, 'use_sparse_layer': True, 'use_sparse_loss': False, 'use_batchnorm': True, 'use_dropout': False, 'mlp_size_1': 0, 'mlp_size_2': 2, 'mlp_size_3': 0, 'kernel': 'Exponential', 'loss_name': 'NLLLoss'}. Best is trial 485 with value: 0.7429058231722457.[0m
[32m[I 2022-04-19 16:28:16,651][0m Trial 489 finished with value: 0.7220281363050937 and parameters: {'n_hidden': 32, 'mixture_components': 2, 'use_sparse_layer': True, 'use_sparse_loss': False, 'use_batchnorm': True, 'use_dropout': False, 'mlp_size_1': 0, 'mlp_size_2': 2, 'mlp_size_3': 0, 'kernel': 'Exponential', 'loss_name': 'NLLLoss'}. Best is trial 485 with value: 0.7429058231722457.[0m
[32m[I 2022-04-19 16:33:50,505][0m Trial 490 finished with value: 0.7175274502840636 and parameters: {'n_hidden': 32, 'mixture_components': 2, 'use_sparse_layer': True, 'use_sparse_loss': False, 'use_batchnorm': True, 'use_dropout': False, 'mlp_size_1': 0, 'mlp_size_2': 2, 'mlp_size_3': 0, 'kernel': 'Exponential', 'loss_name': 'NLLLoss'}. Best is trial 485 with value: 0.7429058231722457.[0m
[32m[I 2022-04-19 16:39:09,177][0m Trial 491 finished with value: 0.6906847797381221 and parameters: {'n_hidden': 32, 'mixture_components': 2, 'use_sparse_layer': True, 'use_sparse_loss': False, 'use_batchnorm': True, 'use_dropout': False, 'mlp_size_1': 0, 'mlp_size_2': 2, 'mlp_size_3': 0, 'kernel': 'Exponential', 'loss_name': 'NLLLoss'}. Best is trial 485 with value: 0.7429058231722457.[0m
[32m[I 2022-04-19 16:43:38,835][0m Trial 492 finished with value: 0.7244837598989131 and parameters: {'n_hidden': 32, 'mixture_components': 2, 'use_sparse_layer': True, 'use_sparse_loss': False, 'use_batchnorm': True, 'use_dropout': False, 'mlp_size_1': 0, 'mlp_size_2': 2, 'mlp_size_3': 0, 'kernel': 'Exponential', 'loss_name': 'NLLLoss'}. Best is trial 485 with value: 0.7429058231722457.[0m
[32m[I 2022-04-19 16:49:23,838][0m Trial 493 finished with value: 0.7186320177902222 and parameters: {'n_hidden': 32, 'mixture_components': 2, 'use_sparse_layer': True, 'use_sparse_loss': False, 'use_batchnorm': True, 'use_dropout': False, 'mlp_size_1': 0, 'mlp_size_2': 2, 'mlp_size_3': 0, 'kernel': 'Exponential', 'loss_name': 'NLLLoss'}. Best is trial 485 with value: 0.7429058231722457.[0m
[32m[I 2022-04-19 16:54:44,932][0m Trial 494 finished with value: 0.7268199757902004 and parameters: {'n_hidden': 32, 'mixture_components': 2, 'use_sparse_layer': True, 'use_sparse_loss': False, 'use_batchnorm': True, 'use_dropout': False, 'mlp_size_1': 0, 'mlp_size_2': 2, 'mlp_size_3': 0, 'kernel': 'Exponential', 'loss_name': 'NLLLoss'}. Best is trial 485 with value: 0.7429058231722457.[0m
[32m[I 2022-04-19 17:00:29,296][0m Trial 495 finished with value: 0.7167964407134605 and parameters: {'n_hidden': 32, 'mixture_components': 2, 'use_sparse_layer': True, 'use_sparse_loss': False, 'use_batchnorm': True, 'use_dropout': False, 'mlp_size_1': 0, 'mlp_size_2': 2, 'mlp_size_3': 0, 'kernel': 'Exponential', 'loss_name': 'NLLLoss'}. Best is trial 485 with value: 0.7429058231722457.[0m
[32m[I 2022-04-19 17:06:04,468][0m Trial 496 finished with value: 0.7178928327776335 and parameters: {'n_hidden': 32, 'mixture_components': 2, 'use_sparse_layer': True, 'use_sparse_loss': False, 'use_batchnorm': True, 'use_dropout': False, 'mlp_size_1': 0, 'mlp_size_2': 2, 'mlp_size_3': 0, 'kernel': 'Exponential', 'loss_name': 'NLLLoss'}. Best is trial 485 with value: 0.7429058231722457.[0m
[32m[I 2022-04-19 17:11:22,366][0m Trial 497 finished with value: 0.7246291094040153 and parameters: {'n_hidden': 32, 'mixture_components': 2, 'use_sparse_layer': True, 'use_sparse_loss': False, 'use_batchnorm': True, 'use_dropout': False, 'mlp_size_1': 0, 'mlp_size_2': 2, 'mlp_size_3': 0, 'kernel': 'Exponential', 'loss_name': 'NLLLoss'}. Best is trial 485 with value: 0.7429058231722457.[0m
[32m[I 2022-04-19 17:16:37,440][0m Trial 498 finished with value: 0.7383402245296894 and parameters: {'n_hidden': 32, 'mixture_components': 2, 'use_sparse_layer': True, 'use_sparse_loss': False, 'use_batchnorm': True, 'use_dropout': False, 'mlp_size_1': 0, 'mlp_size_2': 2, 'mlp_size_3': 0, 'kernel': 'Exponential', 'loss_name': 'NLLLoss'}. Best is trial 485 with value: 0.7429058231722457.[0m
[32m[I 2022-04-19 17:22:53,166][0m Trial 499 finished with value: 0.7203128983592522 and parameters: {'n_hidden': 32, 'mixture_components': 2, 'use_sparse_layer': True, 'use_sparse_loss': False, 'use_batchnorm': True, 'use_dropout': False, 'mlp_size_1': 0, 'mlp_size_2': 2, 'mlp_size_3': 0, 'kernel': 'Exponential', 'loss_name': 'NLLLoss'}. Best is trial 485 with value: 0.7429058231722457.[0m
[32m[I 2022-04-19 17:28:10,195][0m Trial 500 finished with value: 0.7077763865883837 and parameters: {'n_hidden': 32, 'mixture_components': 2, 'use_sparse_layer': True, 'use_sparse_loss': False, 'use_batchnorm': True, 'use_dropout': False, 'mlp_size_1': 0, 'mlp_size_2': 2, 'mlp_size_3': 0, 'kernel': 'Exponential', 'loss_name': 'NLLLoss'}. Best is trial 485 with value: 0.7429058231722457.[0m
[32m[I 2022-04-19 17:31:16,915][0m Trial 501 finished with value: 0.685922226655787 and parameters: {'n_hidden': 32, 'mixture_components': 2, 'use_sparse_layer': True, 'use_sparse_loss': False, 'use_batchnorm': True, 'use_dropout': False, 'mlp_size_1': 0, 'mlp_size_2': 2, 'mlp_size_3': 0, 'kernel': 'LogLogistic', 'loss_name': 'NLLLoss'}. Best is trial 485 with value: 0.7429058231722457.[0m
[32m[I 2022-04-19 17:35:50,970][0m Trial 502 finished with value: 0.7107804569516418 and parameters: {'n_hidden': 32, 'mixture_components': 2, 'use_sparse_layer': True, 'use_sparse_loss': False, 'use_batchnorm': True, 'use_dropout': False, 'mlp_size_1': 0, 'mlp_size_2': 2, 'mlp_size_3': 0, 'kernel': 'Exponential', 'loss_name': 'NLLLoss'}. Best is trial 485 with value: 0.7429058231722457.[0m
[32m[I 2022-04-19 17:41:54,993][0m Trial 503 finished with value: 0.7086194449935801 and parameters: {'n_hidden': 32, 'mixture_components': 2, 'use_sparse_layer': True, 'use_sparse_loss': False, 'use_batchnorm': True, 'use_dropout': False, 'mlp_size_1': 0, 'mlp_size_2': 2, 'mlp_size_3': 0, 'kernel': 'Exponential', 'loss_name': 'AlternativeNLLLoss'}. Best is trial 485 with value: 0.7429058231722457.[0m
[32m[I 2022-04-19 17:48:10,794][0m Trial 504 finished with value: 0.7200139927402269 and parameters: {'n_hidden': 32, 'mixture_components': 2, 'use_sparse_layer': True, 'use_sparse_loss': False, 'use_batchnorm': True, 'use_dropout': False, 'mlp_size_1': 0, 'mlp_size_2': 2, 'mlp_size_3': 0, 'kernel': 'Exponential', 'loss_name': 'NLLLoss'}. Best is trial 485 with value: 0.7429058231722457.[0m
[32m[I 2022-04-19 17:53:32,669][0m Trial 505 finished with value: 0.7112587998610387 and parameters: {'n_hidden': 32, 'mixture_components': 2, 'use_sparse_layer': True, 'use_sparse_loss': False, 'use_batchnorm': True, 'use_dropout': False, 'mlp_size_1': 0, 'mlp_size_2': 2, 'mlp_size_3': 0, 'kernel': 'Exponential', 'loss_name': 'NLLLoss'}. Best is trial 485 with value: 0.7429058231722457.[0m
[32m[I 2022-04-19 17:56:50,528][0m Trial 506 finished with value: 0.6676042679169715 and parameters: {'n_hidden': 32, 'mixture_components': 2, 'use_sparse_layer': True, 'use_sparse_loss': False, 'use_batchnorm': True, 'use_dropout': False, 'mlp_size_1': 0, 'mlp_size_2': 2, 'mlp_size_3': 0, 'kernel': 'Normal', 'loss_name': 'NLLLoss'}. Best is trial 485 with value: 0.7429058231722457.[0m
[32m[I 2022-04-19 18:03:03,751][0m Trial 507 finished with value: 0.7183871694845234 and parameters: {'n_hidden': 32, 'mixture_components': 2, 'use_sparse_layer': True, 'use_sparse_loss': False, 'use_batchnorm': True, 'use_dropout': False, 'mlp_size_1': 0, 'mlp_size_2': 2, 'mlp_size_3': 0, 'kernel': 'Exponential', 'loss_name': 'NLLLoss'}. Best is trial 485 with value: 0.7429058231722457.[0m
[32m[I 2022-04-19 18:08:15,594][0m Trial 508 finished with value: 0.7147042119619459 and parameters: {'n_hidden': 32, 'mixture_components': 2, 'use_sparse_layer': True, 'use_sparse_loss': False, 'use_batchnorm': True, 'use_dropout': False, 'mlp_size_1': 0, 'mlp_size_2': 2, 'mlp_size_3': 0, 'kernel': 'Exponential', 'loss_name': 'NLLLoss'}. Best is trial 485 with value: 0.7429058231722457.[0m
[32m[I 2022-04-19 18:11:57,316][0m Trial 509 finished with value: 0.7157331146089063 and parameters: {'n_hidden': 32, 'mixture_components': 2, 'use_sparse_layer': True, 'use_sparse_loss': False, 'use_batchnorm': True, 'use_dropout': False, 'mlp_size_1': 0, 'mlp_size_2': 2, 'mlp_size_3': 0, 'kernel': 'Gumbel', 'loss_name': 'NLLLoss'}. Best is trial 485 with value: 0.7429058231722457.[0m
[32m[I 2022-04-19 18:17:45,336][0m Trial 510 finished with value: 0.7269291029816165 and parameters: {'n_hidden': 32, 'mixture_components': 2, 'use_sparse_layer': True, 'use_sparse_loss': False, 'use_batchnorm': True, 'use_dropout': False, 'mlp_size_1': 0, 'mlp_size_2': 2, 'mlp_size_3': 0, 'kernel': 'Exponential', 'loss_name': 'NLLLoss'}. Best is trial 485 with value: 0.7429058231722457.[0m
[32m[I 2022-04-19 18:21:22,120][0m Trial 511 finished with value: 0.6935298139008892 and parameters: {'n_hidden': 32, 'mixture_components': 2, 'use_sparse_layer': True, 'use_sparse_loss': False, 'use_batchnorm': True, 'use_dropout': False, 'mlp_size_1': 0, 'mlp_size_2': 2, 'mlp_size_3': 0, 'kernel': 'Weibull', 'loss_name': 'NLLLoss'}. Best is trial 485 with value: 0.7429058231722457.[0m
[32m[I 2022-04-19 18:25:55,227][0m Trial 512 finished with value: 0.7234452190984844 and parameters: {'n_hidden': 32, 'mixture_components': 2, 'use_sparse_layer': True, 'use_sparse_loss': False, 'use_batchnorm': True, 'use_dropout': False, 'mlp_size_1': 0, 'mlp_size_2': 2, 'mlp_size_3': 0, 'kernel': 'Exponential', 'loss_name': 'NLLLoss'}. Best is trial 485 with value: 0.7429058231722457.[0m
