[32m[I 2022-04-13 11:47:42,453][0m Trial 70 finished with value: 0.7258803011938795 and parameters: {'alpha': 2.7175838163318566, 'ties': 'efron'}. Best is trial 63 with value: 0.7309739795612015.[0m
[32m[I 2022-04-13 11:47:42,547][0m Trial 71 finished with value: 0.7286259651218314 and parameters: {'alpha': 2.243989947147167, 'ties': 'efron'}. Best is trial 63 with value: 0.7309739795612015.[0m
[32m[I 2022-04-13 11:47:42,785][0m Trial 72 finished with value: 0.729697264326865 and parameters: {'alpha': 2.3349637778374115, 'ties': 'efron'}. Best is trial 63 with value: 0.7309739795612015.[0m
[32m[I 2022-04-13 11:47:42,884][0m Trial 73 finished with value: 0.7296437365326369 and parameters: {'alpha': 2.168756388948289, 'ties': 'efron'}. Best is trial 63 with value: 0.7309739795612015.[0m
[32m[I 2022-04-13 11:47:43,041][0m Trial 74 finished with value: 0.729697264326865 and parameters: {'alpha': 2.360401875498836, 'ties': 'efron'}. Best is trial 63 with value: 0.7309739795612015.[0m
[32m[I 2022-04-13 11:47:43,311][0m Trial 75 finished with value: 0.7233217219723216 and parameters: {'alpha': 2.9878390263180483, 'ties': 'efron'}. Best is trial 63 with value: 0.7309739795612015.[0m
[32m[I 2022-04-13 11:47:43,464][0m Trial 76 finished with value: 0.7291006791993557 and parameters: {'alpha': 1.7723882960628339, 'ties': 'efron'}. Best is trial 63 with value: 0.7309739795612015.[0m
[32m[I 2022-04-13 11:47:43,642][0m Trial 77 finished with value: 0.7220434109136662 and parameters: {'alpha': 2.8609615273601143, 'ties': 'efron'}. Best is trial 63 with value: 0.7309739795612015.[0m
[32m[I 2022-04-13 11:47:43,975][0m Trial 78 finished with value: 0.729697264326865 and parameters: {'alpha': 2.6123283304296288, 'ties': 'efron'}. Best is trial 63 with value: 0.7309739795612015.[0m
[32m[I 2022-04-13 11:47:44,067][0m Trial 79 finished with value: 0.72607759034919 and parameters: {'alpha': 1.5017596326044034, 'ties': 'efron'}. Best is trial 63 with value: 0.7309739795612015.[0m
[32m[I 2022-04-13 11:47:44,270][0m Trial 80 finished with value: 0.7266957640961634 and parameters: {'alpha': 1.9424542590910319, 'ties': 'efron'}. Best is trial 63 with value: 0.7309739795612015.[0m
[32m[I 2022-04-13 11:47:44,527][0m Trial 81 finished with value: 0.7295404734059817 and parameters: {'alpha': 2.1032038225165066, 'ties': 'efron'}. Best is trial 63 with value: 0.7309739795612015.[0m
[32m[I 2022-04-13 11:47:44,770][0m Trial 82 finished with value: 0.7285051458832521 and parameters: {'alpha': 1.670268691304121, 'ties': 'efron'}. Best is trial 63 with value: 0.7309739795612015.[0m
[32m[I 2022-04-13 11:47:45,110][0m Trial 83 finished with value: 0.7296437365326369 and parameters: {'alpha': 2.162653433603882, 'ties': 'efron'}. Best is trial 63 with value: 0.7309739795612015.[0m
[32m[I 2022-04-13 11:47:45,395][0m Trial 84 finished with value: 0.7286259651218314 and parameters: {'alpha': 2.2694311511335057, 'ties': 'efron'}. Best is trial 63 with value: 0.7309739795612015.[0m
[32m[I 2022-04-13 11:47:45,624][0m Trial 85 finished with value: 0.7308171886403182 and parameters: {'alpha': 2.075270744998099, 'ties': 'efron'}. Best is trial 63 with value: 0.7309739795612015.[0m
[32m[I 2022-04-13 11:47:45,862][0m Trial 86 finished with value: 0.7279724793304998 and parameters: {'alpha': 1.9454953727770588, 'ties': 'efron'}. Best is trial 63 with value: 0.7309739795612015.[0m
[32m[I 2022-04-13 11:47:46,127][0m Trial 87 finished with value: 0.7221482698646403 and parameters: {'alpha': 3.153589580311884, 'ties': 'efron'}. Best is trial 63 with value: 0.7309739795612015.[0m
[32m[I 2022-04-13 11:47:46,375][0m Trial 88 finished with value: 0.729697264326865 and parameters: {'alpha': 2.404276740867694, 'ties': 'efron'}. Best is trial 63 with value: 0.7309739795612015.[0m
[32m[I 2022-04-13 11:47:46,539][0m Trial 89 finished with value: 0.723532189469167 and parameters: {'alpha': 1.2426257198752348, 'ties': 'efron'}. Best is trial 63 with value: 0.7309739795612015.[0m
[32m[I 2022-04-13 11:47:46,826][0m Trial 90 finished with value: 0.7279666657613922 and parameters: {'alpha': 2.559923673809364, 'ties': 'breslow'}. Best is trial 63 with value: 0.7309739795612015.[0m
[32m[I 2022-04-13 11:47:47,000][0m Trial 91 finished with value: 0.7266489160330192 and parameters: {'alpha': 1.8267497039431715, 'ties': 'efron'}. Best is trial 63 with value: 0.7309739795612015.[0m
[32m[I 2022-04-13 11:47:47,247][0m Trial 92 finished with value: 0.7308171886403182 and parameters: {'alpha': 2.047642455201674, 'ties': 'efron'}. Best is trial 63 with value: 0.7309739795612015.[0m
[32m[I 2022-04-13 11:47:47,394][0m Trial 93 finished with value: 0.7283670212983004 and parameters: {'alpha': 2.1182658004110353, 'ties': 'efron'}. Best is trial 63 with value: 0.7309739795612015.[0m
[32m[I 2022-04-13 11:47:47,652][0m Trial 94 finished with value: 0.7308171886403182 and parameters: {'alpha': 2.012282519965076, 'ties': 'efron'}. Best is trial 63 with value: 0.7309739795612015.[0m
[32m[I 2022-04-13 11:47:47,841][0m Trial 95 finished with value: 0.7258331595711888 and parameters: {'alpha': 1.6297272886717198, 'ties': 'efron'}. Best is trial 63 with value: 0.7309739795612015.[0m
[32m[I 2022-04-13 11:47:48,066][0m Trial 96 finished with value: 0.72607759034919 and parameters: {'alpha': 1.489746908295388, 'ties': 'efron'}. Best is trial 63 with value: 0.7309739795612015.[0m
[32m[I 2022-04-13 11:47:48,262][0m Trial 97 finished with value: 0.7291006791993557 and parameters: {'alpha': 1.7583944357958137, 'ties': 'efron'}. Best is trial 63 with value: 0.7309739795612015.[0m
[32m[I 2022-04-13 11:47:48,424][0m Trial 98 finished with value: 0.7244971311842501 and parameters: {'alpha': 2.672672597662428, 'ties': 'breslow'}. Best is trial 63 with value: 0.7309739795612015.[0m
[32m[I 2022-04-13 11:47:48,509][0m Trial 99 finished with value: 0.7309739795612015 and parameters: {'alpha': 2.2819495452403142, 'ties': 'efron'}. Best is trial 63 with value: 0.7309739795612015.[0m
[32m[I 2022-04-13 11:47:48,755][0m Trial 100 finished with value: 0.729697264326865 and parameters: {'alpha': 2.338278800975163, 'ties': 'efron'}. Best is trial 63 with value: 0.7309739795612015.[0m
[32m[I 2022-04-13 11:47:49,152][0m Trial 101 finished with value: 0.7295857840574091 and parameters: {'alpha': 1.9744739989094946, 'ties': 'efron'}. Best is trial 63 with value: 0.7309739795612015.[0m
[32m[I 2022-04-13 11:47:49,397][0m Trial 102 finished with value: 0.7286259651218314 and parameters: {'alpha': 2.267404306084761, 'ties': 'efron'}. Best is trial 63 with value: 0.7309739795612015.[0m
[32m[I 2022-04-13 11:47:49,552][0m Trial 103 finished with value: 0.729697264326865 and parameters: {'alpha': 2.440445839846411, 'ties': 'efron'}. Best is trial 63 with value: 0.7309739795612015.[0m
[32m[I 2022-04-13 11:47:49,845][0m Trial 104 finished with value: 0.7266489160330192 and parameters: {'alpha': 1.8589563017359712, 'ties': 'efron'}. Best is trial 63 with value: 0.7309739795612015.[0m
[32m[I 2022-04-13 11:47:49,937][0m Trial 105 finished with value: 0.7296437365326369 and parameters: {'alpha': 2.184063103102579, 'ties': 'efron'}. Best is trial 63 with value: 0.7309739795612015.[0m
[32m[I 2022-04-13 11:47:50,215][0m Trial 106 finished with value: 0.729697264326865 and parameters: {'alpha': 2.5193381558406513, 'ties': 'breslow'}. Best is trial 63 with value: 0.7309739795612015.[0m
[32m[I 2022-04-13 11:47:50,308][0m Trial 107 finished with value: 0.7308171886403182 and parameters: {'alpha': 2.0759197359106074, 'ties': 'efron'}. Best is trial 63 with value: 0.7309739795612015.[0m
[32m[I 2022-04-13 11:47:50,617][0m Trial 108 finished with value: 0.7309739795612015 and parameters: {'alpha': 2.283322746532198, 'ties': 'efron'}. Best is trial 63 with value: 0.7309739795612015.[0m
[32m[I 2022-04-13 11:47:50,952][0m Trial 109 finished with value: 0.7309739795612015 and parameters: {'alpha': 2.3143533486232486, 'ties': 'efron'}. Best is trial 63 with value: 0.7309739795612015.[0m
[32m[I 2022-04-13 11:47:51,062][0m Trial 110 finished with value: 0.7286259651218314 and parameters: {'alpha': 2.2693343835479354, 'ties': 'efron'}. Best is trial 63 with value: 0.7309739795612015.[0m
[32m[I 2022-04-13 11:47:51,470][0m Trial 111 finished with value: 0.729697264326865 and parameters: {'alpha': 2.3518653053788707, 'ties': 'efron'}. Best is trial 63 with value: 0.7309739795612015.[0m
[32m[I 2022-04-13 11:47:51,702][0m Trial 112 finished with value: 0.7266957640961634 and parameters: {'alpha': 1.9021855431786643, 'ties': 'efron'}. Best is trial 63 with value: 0.7309739795612015.[0m
[32m[I 2022-04-13 11:47:51,918][0m Trial 113 finished with value: 0.7296437365326369 and parameters: {'alpha': 2.1601200183222846, 'ties': 'efron'}. Best is trial 63 with value: 0.7309739795612015.[0m
[32m[I 2022-04-13 11:47:52,160][0m Trial 114 finished with value: 0.7246019901352241 and parameters: {'alpha': 2.803228749670751, 'ties': 'efron'}. Best is trial 63 with value: 0.7309739795612015.[0m
[32m[I 2022-04-13 11:47:52,242][0m Trial 115 finished with value: 0.7308171886403182 and parameters: {'alpha': 2.020722231771302, 'ties': 'efron'}. Best is trial 63 with value: 0.7309739795612015.[0m
[32m[I 2022-04-13 11:47:52,376][0m Trial 116 finished with value: 0.729697264326865 and parameters: {'alpha': 2.506734238975735, 'ties': 'efron'}. Best is trial 63 with value: 0.7309739795612015.[0m
[32m[I 2022-04-13 11:47:52,603][0m Trial 117 finished with value: 0.7285238122191837 and parameters: {'alpha': 2.6642370030053253, 'ties': 'efron'}. Best is trial 63 with value: 0.7309739795612015.[0m
[32m[I 2022-04-13 11:47:52,919][0m Trial 118 finished with value: 0.729697264326865 and parameters: {'alpha': 2.4225494790353266, 'ties': 'efron'}. Best is trial 63 with value: 0.7309739795612015.[0m
[32m[I 2022-04-13 11:47:53,114][0m Trial 119 finished with value: 0.7286259651218314 and parameters: {'alpha': 2.2200015292137416, 'ties': 'breslow'}. Best is trial 63 with value: 0.7309739795612015.[0m
[32m[I 2022-04-13 11:47:53,470][0m Trial 120 finished with value: 0.7309739795612015 and parameters: {'alpha': 2.308213075371968, 'ties': 'efron'}. Best is trial 63 with value: 0.7309739795612015.[0m
[32m[I 2022-04-13 11:47:53,729][0m Trial 121 finished with value: 0.7286259651218314 and parameters: {'alpha': 2.277235748425486, 'ties': 'efron'}. Best is trial 63 with value: 0.7309739795612015.[0m
[32m[I 2022-04-13 11:47:54,063][0m Trial 122 finished with value: 0.7283670212983004 and parameters: {'alpha': 2.1171943526374193, 'ties': 'efron'}. Best is trial 63 with value: 0.7309739795612015.[0m
[32m[I 2022-04-13 11:47:54,395][0m Trial 123 finished with value: 0.7291006791993557 and parameters: {'alpha': 1.7388168171384315, 'ties': 'efron'}. Best is trial 63 with value: 0.7309739795612015.[0m
[32m[I 2022-04-13 11:47:54,580][0m Trial 124 finished with value: 0.729697264326865 and parameters: {'alpha': 2.390667475030439, 'ties': 'efron'}. Best is trial 63 with value: 0.7309739795612015.[0m
[32m[I 2022-04-13 11:47:54,755][0m Trial 125 finished with value: 0.7266957640961634 and parameters: {'alpha': 1.9209061476529872, 'ties': 'efron'}. Best is trial 63 with value: 0.7309739795612015.[0m
[32m[I 2022-04-13 11:47:55,115][0m Trial 126 finished with value: 0.729697264326865 and parameters: {'alpha': 2.552725078029485, 'ties': 'efron'}. Best is trial 63 with value: 0.7309739795612015.[0m
[32m[I 2022-04-13 11:47:55,316][0m Trial 127 finished with value: 0.7296437365326369 and parameters: {'alpha': 2.1812572826655474, 'ties': 'efron'}. Best is trial 63 with value: 0.7309739795612015.[0m
[32m[I 2022-04-13 11:47:55,399][0m Trial 128 finished with value: 0.7308171886403182 and parameters: {'alpha': 2.0262678626675013, 'ties': 'efron'}. Best is trial 63 with value: 0.7309739795612015.[0m
[32m[I 2022-04-13 11:47:55,560][0m Trial 129 finished with value: 0.7246019901352241 and parameters: {'alpha': 2.768724814601196, 'ties': 'efron'}. Best is trial 63 with value: 0.7309739795612015.[0m
[32m[I 2022-04-13 11:47:55,704][0m Trial 130 finished with value: 0.7266489160330192 and parameters: {'alpha': 1.8327792520511295, 'ties': 'efron'}. Best is trial 63 with value: 0.7309739795612015.[0m
[32m[I 2022-04-13 11:47:55,785][0m Trial 131 finished with value: 0.7308171886403182 and parameters: {'alpha': 2.0866105911215604, 'ties': 'efron'}. Best is trial 63 with value: 0.7309739795612015.[0m
[32m[I 2022-04-13 11:47:55,978][0m Trial 132 finished with value: 0.7308171886403182 and parameters: {'alpha': 1.9795808719672994, 'ties': 'efron'}. Best is trial 63 with value: 0.7309739795612015.[0m
[32m[I 2022-04-13 11:47:56,408][0m Trial 133 finished with value: 0.7309739795612015 and parameters: {'alpha': 2.316148378043946, 'ties': 'efron'}. Best is trial 63 with value: 0.7309739795612015.[0m
[32m[I 2022-04-13 11:47:56,721][0m Trial 134 finished with value: 0.7309739795612015 and parameters: {'alpha': 2.3112636691785786, 'ties': 'efron'}. Best is trial 63 with value: 0.7309739795612015.[0m
[32m[I 2022-04-13 11:47:56,914][0m Trial 135 finished with value: 0.7309739795612015 and parameters: {'alpha': 2.3257124128697093, 'ties': 'efron'}. Best is trial 63 with value: 0.7309739795612015.[0m
[32m[I 2022-04-13 11:47:57,101][0m Trial 136 finished with value: 0.729697264326865 and parameters: {'alpha': 2.341673172953126, 'ties': 'efron'}. Best is trial 63 with value: 0.7309739795612015.[0m
[32m[I 2022-04-13 11:47:57,634][0m Trial 137 finished with value: 0.729697264326865 and parameters: {'alpha': 2.517577390818345, 'ties': 'efron'}. Best is trial 63 with value: 0.7309739795612015.[0m
[32m[I 2022-04-13 11:47:58,086][0m Trial 138 finished with value: 0.729697264326865 and parameters: {'alpha': 2.4342650301009146, 'ties': 'efron'}. Best is trial 63 with value: 0.7309739795612015.[0m
[32m[I 2022-04-13 11:47:58,486][0m Trial 139 finished with value: 0.729697264326865 and parameters: {'alpha': 2.641385077218022, 'ties': 'efron'}. Best is trial 63 with value: 0.7309739795612015.[0m
[32m[I 2022-04-13 11:47:58,914][0m Trial 140 finished with value: 0.7286259651218314 and parameters: {'alpha': 2.2386476827375152, 'ties': 'efron'}. Best is trial 63 with value: 0.7309739795612015.[0m
[32m[I 2022-04-13 11:47:59,481][0m Trial 141 finished with value: 0.729697264326865 and parameters: {'alpha': 2.3326131989634353, 'ties': 'efron'}. Best is trial 63 with value: 0.7309739795612015.[0m
[32m[I 2022-04-13 11:47:59,796][0m Trial 142 finished with value: 0.7296437365326369 and parameters: {'alpha': 2.168478591665334, 'ties': 'efron'}. Best is trial 63 with value: 0.7309739795612015.[0m
[32m[I 2022-04-13 11:47:59,905][0m Trial 143 finished with value: 0.7286259651218314 and parameters: {'alpha': 2.2718539399236097, 'ties': 'efron'}. Best is trial 63 with value: 0.7309739795612015.[0m
[32m[I 2022-04-13 11:47:59,990][0m Trial 144 finished with value: 0.729697264326865 and parameters: {'alpha': 2.39152279586845, 'ties': 'efron'}. Best is trial 63 with value: 0.7309739795612015.[0m
[32m[I 2022-04-13 11:48:00,205][0m Trial 145 finished with value: 0.7308171886403182 and parameters: {'alpha': 2.010403281689363, 'ties': 'efron'}. Best is trial 63 with value: 0.7309739795612015.[0m
[32m[I 2022-04-13 11:48:00,287][0m Trial 146 finished with value: 0.729697264326865 and parameters: {'alpha': 2.4672983360627163, 'ties': 'efron'}. Best is trial 63 with value: 0.7309739795612015.[0m
[32m[I 2022-04-13 11:48:00,370][0m Trial 147 finished with value: 0.7296437365326369 and parameters: {'alpha': 2.1433074617864936, 'ties': 'efron'}. Best is trial 63 with value: 0.7309739795612015.[0m
[32m[I 2022-04-13 11:48:00,577][0m Trial 148 finished with value: 0.7309739795612015 and parameters: {'alpha': 2.300068498092103, 'ties': 'efron'}. Best is trial 63 with value: 0.7309739795612015.[0m
[32m[I 2022-04-13 11:48:00,851][0m Trial 149 finished with value: 0.729697264326865 and parameters: {'alpha': 2.6084741198714365, 'ties': 'efron'}. Best is trial 63 with value: 0.7309739795612015.[0m
[32m[I 2022-04-13 11:48:01,018][0m Trial 150 finished with value: 0.7309739795612015 and parameters: {'alpha': 2.3267137608127295, 'ties': 'efron'}. Best is trial 63 with value: 0.7309739795612015.[0m
[32m[I 2022-04-13 11:48:01,237][0m Trial 151 finished with value: 0.7309739795612015 and parameters: {'alpha': 2.303140996999046, 'ties': 'efron'}. Best is trial 63 with value: 0.7309739795612015.[0m
[32m[I 2022-04-13 11:48:01,454][0m Trial 152 finished with value: 0.729697264326865 and parameters: {'alpha': 2.5134191394652965, 'ties': 'efron'}. Best is trial 63 with value: 0.7309739795612015.[0m
[32m[I 2022-04-13 11:48:01,782][0m Trial 153 finished with value: 0.7309739795612015 and parameters: {'alpha': 2.3136015214112033, 'ties': 'efron'}. Best is trial 63 with value: 0.7309739795612015.[0m
[32m[I 2022-04-13 11:48:01,912][0m Trial 154 finished with value: 0.7309739795612015 and parameters: {'alpha': 2.3221680849937245, 'ties': 'efron'}. Best is trial 63 with value: 0.7309739795612015.[0m
[32m[I 2022-04-13 11:48:02,051][0m Trial 155 finished with value: 0.7309739795612015 and parameters: {'alpha': 2.3103529960566123, 'ties': 'efron'}. Best is trial 63 with value: 0.7309739795612015.[0m
[32m[I 2022-04-13 11:48:02,143][0m Trial 156 finished with value: 0.7309739795612015 and parameters: {'alpha': 2.3210922466971744, 'ties': 'efron'}. Best is trial 63 with value: 0.7309739795612015.[0m
[32m[I 2022-04-13 11:48:02,237][0m Trial 157 finished with value: 0.729697264326865 and parameters: {'alpha': 2.419928838216038, 'ties': 'efron'}. Best is trial 63 with value: 0.7309739795612015.[0m
[32m[I 2022-04-13 11:48:02,383][0m Trial 158 finished with value: 0.729697264326865 and parameters: {'alpha': 2.5825147813059726, 'ties': 'efron'}. Best is trial 63 with value: 0.7309739795612015.[0m
[32m[I 2022-04-13 11:48:02,485][0m Trial 159 finished with value: 0.7257754422429054 and parameters: {'alpha': 2.698969590216833, 'ties': 'efron'}. Best is trial 63 with value: 0.7309739795612015.[0m
[32m[I 2022-04-13 11:48:02,584][0m Trial 160 finished with value: 0.7220434109136662 and parameters: {'alpha': 2.8872647239841758, 'ties': 'efron'}. Best is trial 63 with value: 0.7309739795612015.[0m
[32m[I 2022-04-13 11:48:02,683][0m Trial 161 finished with value: 0.7309739795612015 and parameters: {'alpha': 2.3254675321380707, 'ties': 'efron'}. Best is trial 63 with value: 0.7309739795612015.[0m
[32m[I 2022-04-13 11:48:02,804][0m Trial 162 finished with value: 0.7286259651218314 and parameters: {'alpha': 2.263620041493457, 'ties': 'efron'}. Best is trial 63 with value: 0.7309739795612015.[0m
[32m[I 2022-04-13 11:48:02,899][0m Trial 163 finished with value: 0.729697264326865 and parameters: {'alpha': 2.4368136922613, 'ties': 'efron'}. Best is trial 63 with value: 0.7309739795612015.[0m
[32m[I 2022-04-13 11:48:02,994][0m Trial 164 finished with value: 0.729697264326865 and parameters: {'alpha': 2.3597637749661247, 'ties': 'efron'}. Best is trial 63 with value: 0.7309739795612015.[0m
[32m[I 2022-04-13 11:48:03,114][0m Trial 165 finished with value: 0.7286259651218314 and parameters: {'alpha': 2.223523629254417, 'ties': 'efron'}. Best is trial 63 with value: 0.7309739795612015.[0m
[32m[I 2022-04-13 11:48:03,202][0m Trial 166 finished with value: 0.729697264326865 and parameters: {'alpha': 2.502482130557841, 'ties': 'efron'}. Best is trial 63 with value: 0.7309739795612015.[0m
[32m[I 2022-04-13 11:48:03,297][0m Trial 167 finished with value: 0.7309739795612015 and parameters: {'alpha': 2.3140053828289804, 'ties': 'efron'}. Best is trial 63 with value: 0.7309739795612015.[0m
[32m[I 2022-04-13 11:48:03,397][0m Trial 168 finished with value: 0.7296437365326369 and parameters: {'alpha': 2.1781075801803915, 'ties': 'efron'}. Best is trial 63 with value: 0.7309739795612015.[0m
[32m[I 2022-04-13 11:48:03,525][0m Trial 169 finished with value: 0.729697264326865 and parameters: {'alpha': 2.356278999842515, 'ties': 'efron'}. Best is trial 63 with value: 0.7309739795612015.[0m
[32m[I 2022-04-13 11:48:03,617][0m Trial 170 finished with value: 0.729697264326865 and parameters: {'alpha': 2.450894819989039, 'ties': 'efron'}. Best is trial 63 with value: 0.7309739795612015.[0m
[32m[I 2022-04-13 11:48:03,731][0m Trial 171 finished with value: 0.7286259651218314 and parameters: {'alpha': 2.2784535954867766, 'ties': 'efron'}. Best is trial 63 with value: 0.7309739795612015.[0m
[32m[I 2022-04-13 11:48:03,821][0m Trial 172 finished with value: 0.729697264326865 and parameters: {'alpha': 2.3640484450686894, 'ties': 'efron'}. Best is trial 63 with value: 0.7309739795612015.[0m
[32m[I 2022-04-13 11:48:03,951][0m Trial 173 finished with value: 0.7286259651218314 and parameters: {'alpha': 2.249943669920002, 'ties': 'efron'}. Best is trial 63 with value: 0.7309739795612015.[0m
[32m[I 2022-04-13 11:48:04,059][0m Trial 174 finished with value: 0.729697264326865 and parameters: {'alpha': 2.5933789711129047, 'ties': 'efron'}. Best is trial 63 with value: 0.7309739795612015.[0m
[32m[I 2022-04-13 11:48:04,246][0m Trial 175 finished with value: 0.7296437365326369 and parameters: {'alpha': 2.150349315271858, 'ties': 'efron'}. Best is trial 63 with value: 0.7309739795612015.[0m
[32m[I 2022-04-13 11:48:04,342][0m Trial 176 finished with value: 0.729697264326865 and parameters: {'alpha': 2.478652356836119, 'ties': 'efron'}. Best is trial 63 with value: 0.7309739795612015.[0m
[32m[I 2022-04-13 11:48:04,444][0m Trial 177 finished with value: 0.7309739795612015 and parameters: {'alpha': 2.3148851565596624, 'ties': 'efron'}. Best is trial 63 with value: 0.7309739795612015.[0m
