[32m[I 2022-04-13 11:44:49,685][0m Trial 819 finished with value: 0.6905651483118933 and parameters: {'splitter': 'random', 'min_samples_split': 0.2931175356588839, 'min_samples_leaf': 0.26558375560561254, 'min_weight_fraction_leaf': 0.011353179033643399, 'max_features': 0.5732780944093638}. Best is trial 156 with value: 0.860262530255716.[0m
[32m[I 2022-04-13 11:44:49,807][0m Trial 820 finished with value: 0.855608859465337 and parameters: {'splitter': 'random', 'min_samples_split': 0.2620132681908953, 'min_samples_leaf': 0.06043485918754338, 'min_weight_fraction_leaf': 0.06902949646684067, 'max_features': 0.5978374795558405}. Best is trial 156 with value: 0.860262530255716.[0m
[32m[I 2022-04-13 11:44:49,902][0m Trial 821 finished with value: 0.8515949699867061 and parameters: {'splitter': 'random', 'min_samples_split': 0.30537107441440053, 'min_samples_leaf': 0.016659701472695475, 'min_weight_fraction_leaf': 0.04480537044814568, 'max_features': 0.5658670921815732}. Best is trial 156 with value: 0.860262530255716.[0m
[32m[I 2022-04-13 11:44:50,011][0m Trial 822 finished with value: 0.8537871744804019 and parameters: {'splitter': 'random', 'min_samples_split': 0.27949259738289794, 'min_samples_leaf': 0.03146355282221598, 'min_weight_fraction_leaf': 0.04633306903234781, 'max_features': 0.5856756099255382}. Best is trial 156 with value: 0.860262530255716.[0m
[32m[I 2022-04-13 11:44:50,083][0m Trial 823 finished with value: 0.6188081862944745 and parameters: {'splitter': 'random', 'min_samples_split': 0.27397915926949734, 'min_samples_leaf': 0.0017366795226280117, 'min_weight_fraction_leaf': 0.41948313540191906, 'max_features': 0.4858999713157097}. Best is trial 156 with value: 0.860262530255716.[0m
[32m[I 2022-04-13 11:44:50,139][0m Trial 824 finished with value: 0.8536735077998788 and parameters: {'splitter': 'random', 'min_samples_split': 0.2721111478199998, 'min_samples_leaf': 0.009981750166563046, 'min_weight_fraction_leaf': 0.08428180804814672, 'max_features': 0.5585103149655006}. Best is trial 156 with value: 0.860262530255716.[0m
[32m[I 2022-04-13 11:44:50,190][0m Trial 825 finished with value: 0.8541689983710665 and parameters: {'splitter': 'random', 'min_samples_split': 0.24712163772439827, 'min_samples_leaf': 0.0253872187096274, 'min_weight_fraction_leaf': 0.06152410214964843, 'max_features': 0.5343638318085417}. Best is trial 156 with value: 0.860262530255716.[0m
[32m[I 2022-04-13 11:44:50,238][0m Trial 826 finished with value: 0.6188081862944745 and parameters: {'splitter': 'random', 'min_samples_split': 0.2568189391282281, 'min_samples_leaf': 0.3846688366814276, 'min_weight_fraction_leaf': 0.08545691295222099, 'max_features': 0.44357895331871144}. Best is trial 156 with value: 0.860262530255716.[0m
[32m[I 2022-04-13 11:44:50,440][0m Trial 827 finished with value: 0.8169418604210963 and parameters: {'splitter': 'random', 'min_samples_split': 0.26651893796691484, 'min_samples_leaf': 0.0764890004406993, 'min_weight_fraction_leaf': 0.07445298347275277, 'max_features': 0.6450641536176854}. Best is trial 156 with value: 0.860262530255716.[0m
[32m[I 2022-04-13 11:44:50,669][0m Trial 828 finished with value: 0.8212353279710168 and parameters: {'splitter': 'random', 'min_samples_split': 0.2455761135461101, 'min_samples_leaf': 0.00301490784457697, 'min_weight_fraction_leaf': 0.10028713575800717, 'max_features': 0.814057513350129}. Best is trial 156 with value: 0.860262530255716.[0m
[32m[I 2022-04-13 11:44:50,876][0m Trial 829 finished with value: 0.855608859465337 and parameters: {'splitter': 'random', 'min_samples_split': 0.25854178529704613, 'min_samples_leaf': 0.021824091586351936, 'min_weight_fraction_leaf': 0.032919081683214946, 'max_features': 0.5203020593450562}. Best is trial 156 with value: 0.860262530255716.[0m
[32m[I 2022-04-13 11:44:51,098][0m Trial 830 finished with value: 0.8470183879815781 and parameters: {'splitter': 'best', 'min_samples_split': 0.2939524622199941, 'min_samples_leaf': 0.05789841016613555, 'min_weight_fraction_leaf': 0.0666825491629281, 'max_features': 0.5158368033191227}. Best is trial 156 with value: 0.860262530255716.[0m
[32m[I 2022-04-13 11:44:51,294][0m Trial 831 finished with value: 0.855608859465337 and parameters: {'splitter': 'random', 'min_samples_split': 0.2599007897896384, 'min_samples_leaf': 0.038417180065411616, 'min_weight_fraction_leaf': 0.07104203542962746, 'max_features': 0.5609184080711125}. Best is trial 156 with value: 0.860262530255716.[0m
/media/san2_ssd/data/Workdir/survival/utils.py:305: RuntimeWarning: invalid value encountered in true_divide
  pdfs = np.gradient(1-survs,axis=1)/norms
/media/san2_ssd/data/Workdir/survival/utils.py:305: RuntimeWarning: invalid value encountered in true_divide
  pdfs = np.gradient(1-survs,axis=1)/norms
[32m[I 2022-04-13 11:44:51,507][0m Trial 832 finished with value: 0.8198852557392972 and parameters: {'splitter': 'random', 'min_samples_split': 0.02702947524831803, 'min_samples_leaf': 0.013684591888154138, 'min_weight_fraction_leaf': 0.020719276361473696, 'max_features': 0.4952468698717468}. Best is trial 156 with value: 0.860262530255716.[0m
[32m[I 2022-04-13 11:44:51,724][0m Trial 833 finished with value: 0.860262530255716 and parameters: {'splitter': 'random', 'min_samples_split': 0.26581656391600755, 'min_samples_leaf': 0.026110491736540065, 'min_weight_fraction_leaf': 0.04123197962631837, 'max_features': 0.5110931320359158}. Best is trial 156 with value: 0.860262530255716.[0m
[32m[I 2022-04-13 11:44:51,947][0m Trial 834 finished with value: 0.8544192216908126 and parameters: {'splitter': 'random', 'min_samples_split': 0.23594238733954148, 'min_samples_leaf': 0.02711038192578815, 'min_weight_fraction_leaf': 0.026877400770153062, 'max_features': 0.5325921859504965}. Best is trial 156 with value: 0.860262530255716.[0m
[32m[I 2022-04-13 11:44:52,139][0m Trial 835 finished with value: 0.8537871744804019 and parameters: {'splitter': 'random', 'min_samples_split': 0.2863519169717461, 'min_samples_leaf': 0.05302147370592401, 'min_weight_fraction_leaf': 0.056770757973191796, 'max_features': 0.5437888291763884}. Best is trial 156 with value: 0.860262530255716.[0m
[32m[I 2022-04-13 11:44:52,327][0m Trial 836 finished with value: 0.8541689983710665 and parameters: {'splitter': 'random', 'min_samples_split': 0.24722215226617789, 'min_samples_leaf': 0.042559324237767655, 'min_weight_fraction_leaf': 0.047914605909884736, 'max_features': 0.5551214160670414}. Best is trial 156 with value: 0.860262530255716.[0m
[32m[I 2022-04-13 11:44:52,556][0m Trial 837 finished with value: 0.6188081862944745 and parameters: {'splitter': 'random', 'min_samples_split': 0.3702646563612164, 'min_samples_leaf': 0.36748322900975616, 'min_weight_fraction_leaf': 0.07854703735458521, 'max_features': 0.4850757401431675}. Best is trial 156 with value: 0.860262530255716.[0m
[32m[I 2022-04-13 11:44:52,607][0m Trial 838 finished with value: 0.860262530255716 and parameters: {'splitter': 'random', 'min_samples_split': 0.27354580294840547, 'min_samples_leaf': 0.016101205340647136, 'min_weight_fraction_leaf': 0.07710492191385349, 'max_features': 0.5291156845550311}. Best is trial 156 with value: 0.860262530255716.[0m
[32m[I 2022-04-13 11:44:52,654][0m Trial 839 finished with value: 0.6334936025301521 and parameters: {'splitter': 'random', 'min_samples_split': 0.2551551463066436, 'min_samples_leaf': 0.29429323279676745, 'min_weight_fraction_leaf': 0.08899314298080913, 'max_features': 0.5061360077983451}. Best is trial 156 with value: 0.860262530255716.[0m
[32m[I 2022-04-13 11:44:52,700][0m Trial 840 finished with value: 0.8130158757335355 and parameters: {'splitter': 'random', 'min_samples_split': 0.28495765689908564, 'min_samples_leaf': 0.03429641836126081, 'min_weight_fraction_leaf': 0.03118022577646451, 'max_features': 0.4656398530631789}. Best is trial 156 with value: 0.860262530255716.[0m
[32m[I 2022-04-13 11:44:52,746][0m Trial 841 finished with value: 0.860262530255716 and parameters: {'splitter': 'random', 'min_samples_split': 0.27202612163407514, 'min_samples_leaf': 0.015531557200090224, 'min_weight_fraction_leaf': 0.06403866902574558, 'max_features': 0.59841745101202}. Best is trial 156 with value: 0.860262530255716.[0m
[32m[I 2022-04-13 11:44:52,793][0m Trial 842 finished with value: 0.8495779719052834 and parameters: {'splitter': 'random', 'min_samples_split': 0.3012715286919371, 'min_samples_leaf': 0.04198187891085267, 'min_weight_fraction_leaf': 0.06508303079767505, 'max_features': 0.5224151386006456}. Best is trial 156 with value: 0.860262530255716.[0m
[32m[I 2022-04-13 11:44:52,839][0m Trial 843 finished with value: 0.8537871744804019 and parameters: {'splitter': 'random', 'min_samples_split': 0.2815299679932389, 'min_samples_leaf': 0.05200541801045491, 'min_weight_fraction_leaf': 0.053379170973435745, 'max_features': 0.5681050822846171}. Best is trial 156 with value: 0.860262530255716.[0m
[32m[I 2022-04-13 11:44:52,904][0m Trial 844 finished with value: 0.6188081862944745 and parameters: {'splitter': 'random', 'min_samples_split': 0.09528393671973709, 'min_samples_leaf': 0.02426314203559588, 'min_weight_fraction_leaf': 0.3802716209817944, 'max_features': 0.49157917118408534}. Best is trial 156 with value: 0.860262530255716.[0m
[32m[I 2022-04-13 11:44:52,979][0m Trial 845 finished with value: 0.8544192216908126 and parameters: {'splitter': 'random', 'min_samples_split': 0.23247015181913147, 'min_samples_leaf': 0.013073425324797034, 'min_weight_fraction_leaf': 0.015211962219029318, 'max_features': 0.5458372748133564}. Best is trial 156 with value: 0.860262530255716.[0m
[32m[I 2022-04-13 11:44:53,048][0m Trial 846 finished with value: 0.855608859465337 and parameters: {'splitter': 'random', 'min_samples_split': 0.25975497816210286, 'min_samples_leaf': 0.00979267851325654, 'min_weight_fraction_leaf': 0.03585886817616277, 'max_features': 0.5271507575097153}. Best is trial 156 with value: 0.860262530255716.[0m
[32m[I 2022-04-13 11:44:53,131][0m Trial 847 finished with value: 0.8495779719052834 and parameters: {'splitter': 'random', 'min_samples_split': 0.28982578595599773, 'min_samples_leaf': 0.04571724095475206, 'min_weight_fraction_leaf': 0.05426422931125963, 'max_features': 0.5746545919698872}. Best is trial 156 with value: 0.860262530255716.[0m
[32m[I 2022-04-13 11:44:53,184][0m Trial 848 finished with value: 0.8537871744804019 and parameters: {'splitter': 'random', 'min_samples_split': 0.2813767521555277, 'min_samples_leaf': 0.03725676912258842, 'min_weight_fraction_leaf': 0.06157071829065364, 'max_features': 0.5642446813202402}. Best is trial 156 with value: 0.860262530255716.[0m
[32m[I 2022-04-13 11:44:53,309][0m Trial 849 finished with value: 0.8547474595641333 and parameters: {'splitter': 'random', 'min_samples_split': 0.27344942364230845, 'min_samples_leaf': 0.10138602368346028, 'min_weight_fraction_leaf': 0.07053418858682442, 'max_features': 0.5821496807950335}. Best is trial 156 with value: 0.860262530255716.[0m
[32m[I 2022-04-13 11:44:53,413][0m Trial 850 finished with value: 0.860262530255716 and parameters: {'splitter': 'random', 'min_samples_split': 0.2664629175583209, 'min_samples_leaf': 0.06865559050574999, 'min_weight_fraction_leaf': 0.07423924112915932, 'max_features': 0.5816543794560647}. Best is trial 156 with value: 0.860262530255716.[0m
[32m[I 2022-04-13 11:44:53,476][0m Trial 851 finished with value: 0.8479544019395597 and parameters: {'splitter': 'best', 'min_samples_split': 0.25631594488005727, 'min_samples_leaf': 0.018989843251604605, 'min_weight_fraction_leaf': 0.056097494220524666, 'max_features': 0.5553989090992811}. Best is trial 156 with value: 0.860262530255716.[0m
[32m[I 2022-04-13 11:44:53,559][0m Trial 852 finished with value: 0.6188081862944745 and parameters: {'splitter': 'random', 'min_samples_split': 0.28152443829685625, 'min_samples_leaf': 0.34162951015564663, 'min_weight_fraction_leaf': 0.08502208975981615, 'max_features': 0.5096681178158263}. Best is trial 156 with value: 0.860262530255716.[0m
[32m[I 2022-04-13 11:44:53,634][0m Trial 853 finished with value: 0.8547474595641333 and parameters: {'splitter': 'random', 'min_samples_split': 0.26981268189472346, 'min_samples_leaf': 0.010874549645655845, 'min_weight_fraction_leaf': 0.09249094154323059, 'max_features': 0.6142566782348066}. Best is trial 156 with value: 0.860262530255716.[0m
[32m[I 2022-04-13 11:44:53,730][0m Trial 854 finished with value: 0.8049220950014153 and parameters: {'splitter': 'random', 'min_samples_split': 0.24412224433426868, 'min_samples_leaf': 0.20647610138879513, 'min_weight_fraction_leaf': 0.06131381859472271, 'max_features': 0.6576429480563606}. Best is trial 156 with value: 0.860262530255716.[0m
[32m[I 2022-04-13 11:44:53,798][0m Trial 855 finished with value: 0.855608859465337 and parameters: {'splitter': 'random', 'min_samples_split': 0.26259004566064326, 'min_samples_leaf': 0.05232951880101118, 'min_weight_fraction_leaf': 0.05002459705421992, 'max_features': 0.6011601509304381}. Best is trial 156 with value: 0.860262530255716.[0m
[32m[I 2022-04-13 11:44:53,933][0m Trial 856 finished with value: 0.8495779719052834 and parameters: {'splitter': 'random', 'min_samples_split': 0.29086758397471457, 'min_samples_leaf': 0.042931485259415786, 'min_weight_fraction_leaf': 0.06750445693829732, 'max_features': 0.6245008797288909}. Best is trial 156 with value: 0.860262530255716.[0m
[32m[I 2022-04-13 11:44:54,499][0m Trial 857 finished with value: 0.8495779719052834 and parameters: {'splitter': 'random', 'min_samples_split': 0.3001733385204612, 'min_samples_leaf': 0.017516889436862047, 'min_weight_fraction_leaf': 0.08227376219751022, 'max_features': 0.5886442743550756}. Best is trial 156 with value: 0.860262530255716.[0m
[32m[I 2022-04-13 11:44:54,630][0m Trial 858 finished with value: 0.8537871744804019 and parameters: {'splitter': 'random', 'min_samples_split': 0.279700577169132, 'min_samples_leaf': 0.0019453904902353675, 'min_weight_fraction_leaf': 0.08395620866270638, 'max_features': 0.6174741040363031}. Best is trial 156 with value: 0.860262530255716.[0m
[32m[I 2022-04-13 11:44:54,784][0m Trial 859 finished with value: 0.855608859465337 and parameters: {'splitter': 'random', 'min_samples_split': 0.25204288451829354, 'min_samples_leaf': 0.022053179832601813, 'min_weight_fraction_leaf': 0.0390355534647212, 'max_features': 0.5461356242524378}. Best is trial 156 with value: 0.860262530255716.[0m
[32m[I 2022-04-13 11:44:54,927][0m Trial 860 finished with value: 0.7835255757629475 and parameters: {'splitter': 'random', 'min_samples_split': 0.2611132145689557, 'min_samples_leaf': 0.02304716628178713, 'min_weight_fraction_leaf': 0.0429179814706761, 'max_features': 0.12780368244961188}. Best is trial 156 with value: 0.860262530255716.[0m
[32m[I 2022-04-13 11:44:55,147][0m Trial 861 finished with value: 0.8160553494736597 and parameters: {'splitter': 'random', 'min_samples_split': 0.27166527952494274, 'min_samples_leaf': 0.037914217013761166, 'min_weight_fraction_leaf': 0.046661184000859036, 'max_features': 0.6670493169007503}. Best is trial 156 with value: 0.860262530255716.[0m
[32m[I 2022-04-13 11:44:55,315][0m Trial 862 finished with value: 0.8495779719052834 and parameters: {'splitter': 'random', 'min_samples_split': 0.28992921923002046, 'min_samples_leaf': 0.06333390991833097, 'min_weight_fraction_leaf': 0.00510401602779529, 'max_features': 0.6153078630007321}. Best is trial 156 with value: 0.860262530255716.[0m
[32m[I 2022-04-13 11:44:55,461][0m Trial 863 finished with value: 0.8537871744804019 and parameters: {'splitter': 'random', 'min_samples_split': 0.2834250449193395, 'min_samples_leaf': 0.04549792289373847, 'min_weight_fraction_leaf': 0.059909891937978195, 'max_features': 0.559280575074422}. Best is trial 156 with value: 0.860262530255716.[0m
[32m[I 2022-04-13 11:44:55,600][0m Trial 864 finished with value: 0.860262530255716 and parameters: {'splitter': 'random', 'min_samples_split': 0.26433718025186803, 'min_samples_leaf': 0.029628914603423, 'min_weight_fraction_leaf': 0.047936888314410626, 'max_features': 0.520985323985839}. Best is trial 156 with value: 0.860262530255716.[0m
[32m[I 2022-04-13 11:44:55,749][0m Trial 865 finished with value: 0.8544192216908126 and parameters: {'splitter': 'random', 'min_samples_split': 0.24280283325196833, 'min_samples_leaf': 0.01874266426469248, 'min_weight_fraction_leaf': 0.02784137208335264, 'max_features': 0.5065519301004183}. Best is trial 156 with value: 0.860262530255716.[0m
[32m[I 2022-04-13 11:44:55,846][0m Trial 866 finished with value: 0.8529006717303197 and parameters: {'splitter': 'random', 'min_samples_split': 0.2513925250708594, 'min_samples_leaf': 0.01433363866311463, 'min_weight_fraction_leaf': 0.10681097300367168, 'max_features': 0.6026777817009555}. Best is trial 156 with value: 0.860262530255716.[0m
[32m[I 2022-04-13 11:44:55,944][0m Trial 867 finished with value: 0.7865929809567938 and parameters: {'splitter': 'random', 'min_samples_split': 0.2784467137290019, 'min_samples_leaf': 0.03680152097439104, 'min_weight_fraction_leaf': 0.06761152289897909, 'max_features': 0.4647244192977953}. Best is trial 156 with value: 0.860262530255716.[0m
[32m[I 2022-04-13 11:44:56,040][0m Trial 868 finished with value: 0.7753860823605387 and parameters: {'splitter': 'random', 'min_samples_split': 0.27228204524511895, 'min_samples_leaf': 0.05343383081673224, 'min_weight_fraction_leaf': 0.06944747076478493, 'max_features': 0.22623389151913753}. Best is trial 156 with value: 0.860262530255716.[0m
[32m[I 2022-04-13 11:44:56,283][0m Trial 869 finished with value: 0.7163964961093561 and parameters: {'splitter': 'best', 'min_samples_split': 0.29368167398784517, 'min_samples_leaf': 0.011718466763415633, 'min_weight_fraction_leaf': 0.2620631502262623, 'max_features': 0.5459677430661433}. Best is trial 156 with value: 0.860262530255716.[0m
[32m[I 2022-04-13 11:44:56,468][0m Trial 870 finished with value: 0.6689741786112992 and parameters: {'splitter': 'random', 'min_samples_split': 0.25819459640302467, 'min_samples_leaf': 0.029743961663449975, 'min_weight_fraction_leaf': 0.09615401985393449, 'max_features': 0.4824120056075592}. Best is trial 156 with value: 0.860262530255716.[0m
[32m[I 2022-04-13 11:44:56,573][0m Trial 871 finished with value: 0.855608859465337 and parameters: {'splitter': 'random', 'min_samples_split': 0.2595069562285375, 'min_samples_leaf': 0.018681652181895055, 'min_weight_fraction_leaf': 0.05452330960815213, 'max_features': 0.5407131781172815}. Best is trial 156 with value: 0.860262530255716.[0m
[32m[I 2022-04-13 11:44:56,860][0m Trial 872 finished with value: 0.8537871744804019 and parameters: {'splitter': 'random', 'min_samples_split': 0.27839404431892506, 'min_samples_leaf': 0.030154223789737696, 'min_weight_fraction_leaf': 0.04916204158528342, 'max_features': 0.5439405487359114}. Best is trial 156 with value: 0.860262530255716.[0m
[32m[I 2022-04-13 11:44:57,011][0m Trial 873 finished with value: 0.8541689983710665 and parameters: {'splitter': 'random', 'min_samples_split': 0.23970625269827675, 'min_samples_leaf': 0.02545302789072082, 'min_weight_fraction_leaf': 0.07342863043681655, 'max_features': 0.5168153018527906}. Best is trial 156 with value: 0.860262530255716.[0m
[32m[I 2022-04-13 11:44:57,114][0m Trial 874 finished with value: 0.8490198370094999 and parameters: {'splitter': 'random', 'min_samples_split': 0.2502497965625169, 'min_samples_leaf': 0.013446730304179002, 'min_weight_fraction_leaf': 0.07919730762944387, 'max_features': 0.5224321047945923}. Best is trial 156 with value: 0.860262530255716.[0m
[32m[I 2022-04-13 11:44:57,268][0m Trial 875 finished with value: 0.860262530255716 and parameters: {'splitter': 'random', 'min_samples_split': 0.2686174337791725, 'min_samples_leaf': 0.03550105119513464, 'min_weight_fraction_leaf': 0.053990350482769116, 'max_features': 0.5586121937674734}. Best is trial 156 with value: 0.860262530255716.[0m
[32m[I 2022-04-13 11:44:57,424][0m Trial 876 finished with value: 0.8515949699867061 and parameters: {'splitter': 'random', 'min_samples_split': 0.3149883311616654, 'min_samples_leaf': 0.06512934444318141, 'min_weight_fraction_leaf': 0.06811333667365754, 'max_features': 0.5653781250519727}. Best is trial 156 with value: 0.860262530255716.[0m
[32m[I 2022-04-13 11:44:57,577][0m Trial 877 finished with value: 0.8511422756105386 and parameters: {'splitter': 'random', 'min_samples_split': 0.23420994191104583, 'min_samples_leaf': 0.022267768685497596, 'min_weight_fraction_leaf': 0.09250013952791114, 'max_features': 0.5466228995660332}. Best is trial 156 with value: 0.860262530255716.[0m
[32m[I 2022-04-13 11:44:57,726][0m Trial 878 finished with value: 0.860262530255716 and parameters: {'splitter': 'random', 'min_samples_split': 0.27355481917326013, 'min_samples_leaf': 0.049187969225990655, 'min_weight_fraction_leaf': 0.052667482052303746, 'max_features': 0.5992351275549765}. Best is trial 156 with value: 0.860262530255716.[0m
[32m[I 2022-04-13 11:44:57,886][0m Trial 879 finished with value: 0.855608859465337 and parameters: {'splitter': 'random', 'min_samples_split': 0.2553216346155445, 'min_samples_leaf': 0.027599716191024068, 'min_weight_fraction_leaf': 0.02596638197067547, 'max_features': 0.5019325774411513}. Best is trial 156 with value: 0.860262530255716.[0m
[32m[I 2022-04-13 11:44:58,063][0m Trial 880 finished with value: 0.860262530255716 and parameters: {'splitter': 'random', 'min_samples_split': 0.2666014134161473, 'min_samples_leaf': 0.019263134440041057, 'min_weight_fraction_leaf': 0.03971160428389085, 'max_features': 0.5380688403668153}. Best is trial 156 with value: 0.860262530255716.[0m
