[32m[I 2022-04-14 14:41:44,364][0m Trial 683 finished with value: 0.6940737446278917 and parameters: {'loss': 'coxph', 'learning_rate': 1.6851498387691805e-05, 'n_estimators': 170, 'criterion': 'friedman_mse', 'min_samples_split': 2, 'min_samples_leaf': 2, 'min_weight_fraction_leaf': 0.08170485193279435, 'min_impurity_decrease': 0.24055680910397925, 'max_features': 0.9462768926458933, 'subsample': 0.8492023163626228, 'dropout_rate': 0.4262193312431413, 'ccp_alpha': 0.164582763748157}. Best is trial 677 with value: 0.7600100187343619.[0m
[32m[I 2022-04-14 14:41:47,136][0m Trial 684 finished with value: 0.5 and parameters: {'loss': 'coxph', 'learning_rate': 0.004315368025467924, 'n_estimators': 163, 'criterion': 'friedman_mse', 'min_samples_split': 2, 'min_samples_leaf': 1, 'min_weight_fraction_leaf': 0.07257199004540271, 'min_impurity_decrease': 0.4226642676925575, 'max_features': 0.9480443349577546, 'subsample': 0.9865429908736445, 'dropout_rate': 0.4848485549455251, 'ccp_alpha': 0.2572972793316887}. Best is trial 677 with value: 0.7600100187343619.[0m
[32m[I 2022-04-14 14:41:58,263][0m Trial 685 finished with value: 0.731306030094442 and parameters: {'loss': 'coxph', 'learning_rate': 0.0019440774704866785, 'n_estimators': 320, 'criterion': 'friedman_mse', 'min_samples_split': 2, 'min_samples_leaf': 1, 'min_weight_fraction_leaf': 0.21044904153347999, 'min_impurity_decrease': 0.2945800856400254, 'max_features': 0.9585838944398215, 'subsample': 0.8016151598915582, 'dropout_rate': 0.4579709833154502, 'ccp_alpha': 0.08106890311784187}. Best is trial 677 with value: 0.7600100187343619.[0m
[32m[I 2022-04-14 14:42:14,100][0m Trial 686 finished with value: 0.7362911850919529 and parameters: {'loss': 'coxph', 'learning_rate': 0.004046617394329869, 'n_estimators': 383, 'criterion': 'friedman_mse', 'min_samples_split': 2, 'min_samples_leaf': 1, 'min_weight_fraction_leaf': 0.10859774926916513, 'min_impurity_decrease': 0.48547821330178226, 'max_features': 0.9049941242409476, 'subsample': 0.8722009942977405, 'dropout_rate': 0.43522756316156136, 'ccp_alpha': 0.09460321201357333}. Best is trial 677 with value: 0.7600100187343619.[0m
[32m[I 2022-04-14 14:42:23,353][0m Trial 687 finished with value: 0.5766501234015389 and parameters: {'loss': 'coxph', 'learning_rate': 0.002997271665415739, 'n_estimators': 307, 'criterion': 'friedman_mse', 'min_samples_split': 2, 'min_samples_leaf': 1, 'min_weight_fraction_leaf': 0.08482919370350492, 'min_impurity_decrease': 0.5436791653719684, 'max_features': 0.9316305663046149, 'subsample': 0.8413439573034291, 'dropout_rate': 0.486590596130252, 'ccp_alpha': 0.24943385630078127}. Best is trial 677 with value: 0.7600100187343619.[0m
[32m[I 2022-04-14 14:42:30,885][0m Trial 688 finished with value: 0.5 and parameters: {'loss': 'coxph', 'learning_rate': 5.686622098913539e-05, 'n_estimators': 332, 'criterion': 'friedman_mse', 'min_samples_split': 2, 'min_samples_leaf': 1, 'min_weight_fraction_leaf': 0.04239441373653261, 'min_impurity_decrease': 0.6727632904605987, 'max_features': 0.9712125851320847, 'subsample': 0.8173844612686368, 'dropout_rate': 0.6906214355032014, 'ccp_alpha': 0.43778450768661614}. Best is trial 677 with value: 0.7600100187343619.[0m
[32m[I 2022-04-14 14:42:35,780][0m Trial 689 finished with value: 0.7091679906624468 and parameters: {'loss': 'coxph', 'learning_rate': 1.371510077222879e-05, 'n_estimators': 230, 'criterion': 'friedman_mse', 'min_samples_split': 2, 'min_samples_leaf': 1, 'min_weight_fraction_leaf': 0.05537433632815271, 'min_impurity_decrease': 0.3499469382113713, 'max_features': 0.9519330368293673, 'subsample': 0.7818896077597527, 'dropout_rate': 0.531130901031954, 'ccp_alpha': 0.16382365647071398}. Best is trial 677 with value: 0.7600100187343619.[0m
[32m[I 2022-04-14 14:42:40,864][0m Trial 690 finished with value: 0.7425110972571259 and parameters: {'loss': 'coxph', 'learning_rate': 2.1248266954456073e-05, 'n_estimators': 223, 'criterion': 'friedman_mse', 'min_samples_split': 2, 'min_samples_leaf': 2, 'min_weight_fraction_leaf': 0.09812131228868777, 'min_impurity_decrease': 0.08984993156144444, 'max_features': 0.9774508944060318, 'subsample': 0.8577623917029916, 'dropout_rate': 0.467080821865023, 'ccp_alpha': 0.09280393736879292}. Best is trial 677 with value: 0.7600100187343619.[0m
[32m[I 2022-04-14 14:42:55,110][0m Trial 691 finished with value: 0.7553360385127752 and parameters: {'loss': 'coxph', 'learning_rate': 0.006744595062529146, 'n_estimators': 351, 'criterion': 'friedman_mse', 'min_samples_split': 2, 'min_samples_leaf': 1, 'min_weight_fraction_leaf': 0.06925686647850894, 'min_impurity_decrease': 0.4480224263299602, 'max_features': 0.9335967036433986, 'subsample': 0.8339628070712656, 'dropout_rate': 0.42650904387971117, 'ccp_alpha': 0.00550124434034689}. Best is trial 677 with value: 0.7600100187343619.[0m
[32m[I 2022-04-14 14:43:10,522][0m Trial 692 finished with value: 0.7481994292084163 and parameters: {'loss': 'coxph', 'learning_rate': 0.006416007414034378, 'n_estimators': 372, 'criterion': 'friedman_mse', 'min_samples_split': 2, 'min_samples_leaf': 1, 'min_weight_fraction_leaf': 0.06384460208650619, 'min_impurity_decrease': 0.49828234985231834, 'max_features': 0.9037004775086974, 'subsample': 0.8155767434199422, 'dropout_rate': 0.4081879234213629, 'ccp_alpha': 0.0792540240007865}. Best is trial 677 with value: 0.7600100187343619.[0m
[32m[I 2022-04-14 14:43:15,169][0m Trial 693 finished with value: 0.5 and parameters: {'loss': 'coxph', 'learning_rate': 0.009342340180499592, 'n_estimators': 208, 'criterion': 'friedman_mse', 'min_samples_split': 2, 'min_samples_leaf': 1, 'min_weight_fraction_leaf': 0.42798980674985143, 'min_impurity_decrease': 0.43343769123375586, 'max_features': 0.9166927203631402, 'subsample': 0.7957264029920199, 'dropout_rate': 0.4194409634366152, 'ccp_alpha': 0.3109269908272747}. Best is trial 677 with value: 0.7600100187343619.[0m
[32m[I 2022-04-14 14:43:29,330][0m Trial 694 finished with value: 0.75257435378153 and parameters: {'loss': 'coxph', 'learning_rate': 0.006962881419406784, 'n_estimators': 359, 'criterion': 'friedman_mse', 'min_samples_split': 2, 'min_samples_leaf': 1, 'min_weight_fraction_leaf': 0.047714891063742146, 'min_impurity_decrease': 0.44120980240079366, 'max_features': 0.9314326850741502, 'subsample': 0.7637124176847774, 'dropout_rate': 0.439317259686611, 'ccp_alpha': 0.00755538879264881}. Best is trial 677 with value: 0.7600100187343619.[0m
[32m[I 2022-04-14 14:43:43,593][0m Trial 695 finished with value: 0.756421940125328 and parameters: {'loss': 'coxph', 'learning_rate': 0.0071630438404258695, 'n_estimators': 361, 'criterion': 'friedman_mse', 'min_samples_split': 2, 'min_samples_leaf': 1, 'min_weight_fraction_leaf': 0.03202336076049256, 'min_impurity_decrease': 0.4670677811306373, 'max_features': 0.9078952509388899, 'subsample': 0.744047424909259, 'dropout_rate': 0.44525787270468814, 'ccp_alpha': 0.0032898902423507716}. Best is trial 677 with value: 0.7600100187343619.[0m
[32m[I 2022-04-14 14:43:58,855][0m Trial 696 finished with value: 0.7513664976068928 and parameters: {'loss': 'coxph', 'learning_rate': 0.008403361960455975, 'n_estimators': 363, 'criterion': 'friedman_mse', 'min_samples_split': 2, 'min_samples_leaf': 1, 'min_weight_fraction_leaf': 0.021964981241419636, 'min_impurity_decrease': 0.4535033036768754, 'max_features': 0.9056469510306581, 'subsample': 0.7326796593900833, 'dropout_rate': 0.4339333756950585, 'ccp_alpha': 0.003546834318278945}. Best is trial 677 with value: 0.7600100187343619.[0m
[32m[I 2022-04-14 14:44:16,559][0m Trial 697 finished with value: 0.7514544711013831 and parameters: {'loss': 'coxph', 'learning_rate': 0.005363069548812346, 'n_estimators': 400, 'criterion': 'friedman_mse', 'min_samples_split': 2, 'min_samples_leaf': 1, 'min_weight_fraction_leaf': 0.011084573424596428, 'min_impurity_decrease': 0.4592578548166697, 'max_features': 0.9129164614008679, 'subsample': 0.7340562274935309, 'dropout_rate': 0.43252127163566584, 'ccp_alpha': 0.002798504754218949}. Best is trial 677 with value: 0.7600100187343619.[0m
[32m[I 2022-04-14 14:44:32,687][0m Trial 698 finished with value: 0.7182037741864058 and parameters: {'loss': 'coxph', 'learning_rate': 0.0076808368079036606, 'n_estimators': 395, 'criterion': 'friedman_mse', 'min_samples_split': 2, 'min_samples_leaf': 4, 'min_weight_fraction_leaf': 0.011284063675574869, 'min_impurity_decrease': 0.45592916306881226, 'max_features': 0.9038597214823649, 'subsample': 0.7401861874743927, 'dropout_rate': 0.4332038337142704, 'ccp_alpha': 0.15698504513596315}. Best is trial 677 with value: 0.7600100187343619.[0m
[32m[I 2022-04-14 14:44:52,384][0m Trial 699 finished with value: 0.5 and parameters: {'loss': 'coxph', 'learning_rate': 0.009515556339771735, 'n_estimators': 404, 'criterion': 'absolute_error', 'min_samples_split': 2, 'min_samples_leaf': 2, 'min_weight_fraction_leaf': 0.006332020027353485, 'min_impurity_decrease': 0.45897266949291216, 'max_features': 0.9056124793385291, 'subsample': 0.7384656248432441, 'dropout_rate': 0.42958915888268123, 'ccp_alpha': 0.006117336230237776}. Best is trial 677 with value: 0.7600100187343619.[0m
[32m[I 2022-04-14 14:45:08,039][0m Trial 700 finished with value: 0.7467491113174711 and parameters: {'loss': 'coxph', 'learning_rate': 0.009735995264430097, 'n_estimators': 385, 'criterion': 'friedman_mse', 'min_samples_split': 2, 'min_samples_leaf': 1, 'min_weight_fraction_leaf': 0.0102165998490617, 'min_impurity_decrease': 0.470659164113562, 'max_features': 0.8919856487790984, 'subsample': 0.7465722866893625, 'dropout_rate': 0.43849507843575186, 'ccp_alpha': 0.005298531517337735}. Best is trial 677 with value: 0.7600100187343619.[0m
[32m[I 2022-04-14 14:45:27,773][0m Trial 701 finished with value: 0.27291917918532377 and parameters: {'loss': 'squared', 'learning_rate': 0.007755681286679151, 'n_estimators': 412, 'criterion': 'friedman_mse', 'min_samples_split': 2, 'min_samples_leaf': 1, 'min_weight_fraction_leaf': 0.015771772423462185, 'min_impurity_decrease': 0.43043753573873966, 'max_features': 0.8969158157063734, 'subsample': 0.7291851115362497, 'dropout_rate': 0.40316807100220525, 'ccp_alpha': 0.004218774636726473}. Best is trial 677 with value: 0.7600100187343619.[0m
[32m[I 2022-04-14 14:45:42,532][0m Trial 702 finished with value: 0.723101484923103 and parameters: {'loss': 'coxph', 'learning_rate': 0.00576341394287148, 'n_estimators': 377, 'criterion': 'friedman_mse', 'min_samples_split': 2, 'min_samples_leaf': 1, 'min_weight_fraction_leaf': 0.0036737225966516004, 'min_impurity_decrease': 0.4624392926936806, 'max_features': 0.8986752527947719, 'subsample': 0.7093822580203484, 'dropout_rate': 0.4495140603755411, 'ccp_alpha': 0.16150689476567304}. Best is trial 677 with value: 0.7600100187343619.[0m
[32m[I 2022-04-14 14:45:55,644][0m Trial 703 finished with value: 0.7330625768177615 and parameters: {'loss': 'coxph', 'learning_rate': 0.007643029007494909, 'n_estimators': 350, 'criterion': 'friedman_mse', 'min_samples_split': 2, 'min_samples_leaf': 1, 'min_weight_fraction_leaf': 0.02397108938491661, 'min_impurity_decrease': 0.48558437792920084, 'max_features': 0.913525077643009, 'subsample': 0.7199990110131206, 'dropout_rate': 0.4184910733962089, 'ccp_alpha': 0.094824515432862}. Best is trial 677 with value: 0.7600100187343619.[0m
[32m[I 2022-04-14 14:46:13,764][0m Trial 704 finished with value: 0.5 and parameters: {'loss': 'coxph', 'learning_rate': 0.006947367412588388, 'n_estimators': 428, 'criterion': 'friedman_mse', 'min_samples_split': 2, 'min_samples_leaf': 1, 'min_weight_fraction_leaf': 0.032448282573142265, 'min_impurity_decrease': 0.45318500230951675, 'max_features': 0.8860067508408477, 'subsample': 0.7288234361719772, 'dropout_rate': 0.4538410045642552, 'ccp_alpha': 2.870884243109336}. Best is trial 677 with value: 0.7600100187343619.[0m
[32m[I 2022-04-14 14:46:19,176][0m Trial 705 finished with value: 0.6976424345272905 and parameters: {'loss': 'coxph', 'learning_rate': 0.006316747076046541, 'n_estimators': 213, 'criterion': 'friedman_mse', 'min_samples_split': 2, 'min_samples_leaf': 1, 'min_weight_fraction_leaf': 0.019925240962308195, 'min_impurity_decrease': 0.4386397730398654, 'max_features': 0.9145274389634951, 'subsample': 0.7612115753942671, 'dropout_rate': 0.38444991549688523, 'ccp_alpha': 0.18884621916969202}. Best is trial 677 with value: 0.7600100187343619.[0m
[32m[I 2022-04-14 14:46:34,738][0m Trial 706 finished with value: 0.7343622843312424 and parameters: {'loss': 'coxph', 'learning_rate': 0.01100412615862909, 'n_estimators': 366, 'criterion': 'friedman_mse', 'min_samples_split': 2, 'min_samples_leaf': 1, 'min_weight_fraction_leaf': 0.02182172401897749, 'min_impurity_decrease': 0.43479387058410274, 'max_features': 0.8970182047411872, 'subsample': 0.7389993172544314, 'dropout_rate': 0.43564774653958677, 'ccp_alpha': 0.08543652194695722}. Best is trial 677 with value: 0.7600100187343619.[0m
[32m[I 2022-04-14 14:46:51,137][0m Trial 707 finished with value: 0.7100462905722453 and parameters: {'loss': 'coxph', 'learning_rate': 0.006305780105962615, 'n_estimators': 401, 'criterion': 'friedman_mse', 'min_samples_split': 2, 'min_samples_leaf': 1, 'min_weight_fraction_leaf': 0.010867840139470876, 'min_impurity_decrease': 0.46824558422485035, 'max_features': 0.9320332462262056, 'subsample': 0.2430664535664775, 'dropout_rate': 0.4648233465311619, 'ccp_alpha': 0.0987846306551456}. Best is trial 677 with value: 0.7600100187343619.[0m
[32m[I 2022-04-14 14:47:05,324][0m Trial 708 finished with value: 0.7512561275614446 and parameters: {'loss': 'coxph', 'learning_rate': 0.00775369070610674, 'n_estimators': 353, 'criterion': 'friedman_mse', 'min_samples_split': 2, 'min_samples_leaf': 1, 'min_weight_fraction_leaf': 0.029841896815497513, 'min_impurity_decrease': 0.45248498524320346, 'max_features': 0.9206817394526294, 'subsample': 0.7257430027873875, 'dropout_rate': 0.4093057859087736, 'ccp_alpha': 0.005026237401322053}. Best is trial 677 with value: 0.7600100187343619.[0m
[32m[I 2022-04-14 14:47:18,591][0m Trial 709 finished with value: 0.7116517857035006 and parameters: {'loss': 'coxph', 'learning_rate': 0.008229295864754682, 'n_estimators': 350, 'criterion': 'friedman_mse', 'min_samples_split': 2, 'min_samples_leaf': 1, 'min_weight_fraction_leaf': 0.018911108310161198, 'min_impurity_decrease': 0.4400836491542486, 'max_features': 0.8898071760004396, 'subsample': 0.7189255222457238, 'dropout_rate': 0.4068222155274362, 'ccp_alpha': 0.20590701102261363}. Best is trial 677 with value: 0.7600100187343619.[0m
[32m[I 2022-04-14 14:47:33,462][0m Trial 710 finished with value: 0.7370039688998419 and parameters: {'loss': 'coxph', 'learning_rate': 0.008830597128814436, 'n_estimators': 348, 'criterion': 'friedman_mse', 'min_samples_split': 2, 'min_samples_leaf': 1, 'min_weight_fraction_leaf': 0.02591667595069385, 'min_impurity_decrease': 0.484718287959818, 'max_features': 0.9221442939689741, 'subsample': 0.754620121036773, 'dropout_rate': 0.36634384177956836, 'ccp_alpha': 0.094587928809379}. Best is trial 677 with value: 0.7600100187343619.[0m
[32m[I 2022-04-14 14:47:47,009][0m Trial 711 finished with value: 0.7541274534801861 and parameters: {'loss': 'coxph', 'learning_rate': 0.006896326206108658, 'n_estimators': 338, 'criterion': 'friedman_mse', 'min_samples_split': 2, 'min_samples_leaf': 2, 'min_weight_fraction_leaf': 0.024772838478769744, 'min_impurity_decrease': 0.3941184818138759, 'max_features': 0.9107202914205781, 'subsample': 0.7482263011865327, 'dropout_rate': 0.3872916583526797, 'ccp_alpha': 0.0025533259107338884}. Best is trial 677 with value: 0.7600100187343619.[0m
[32m[I 2022-04-14 14:48:02,410][0m Trial 712 finished with value: 0.6670438541037118 and parameters: {'loss': 'coxph', 'learning_rate': 0.010425705750743757, 'n_estimators': 356, 'criterion': 'friedman_mse', 'min_samples_split': 2, 'min_samples_leaf': 2, 'min_weight_fraction_leaf': 0.0044116091164311255, 'min_impurity_decrease': 0.39650363600447347, 'max_features': 0.9038061686773737, 'subsample': 0.7372663154905522, 'dropout_rate': 0.3809035097082375, 'ccp_alpha': 0.24851135853018455}. Best is trial 677 with value: 0.7600100187343619.[0m
[32m[I 2022-04-14 14:48:17,290][0m Trial 713 finished with value: 0.7197101288383299 and parameters: {'loss': 'coxph', 'learning_rate': 0.007228931066324729, 'n_estimators': 347, 'criterion': 'friedman_mse', 'min_samples_split': 2, 'min_samples_leaf': 2, 'min_weight_fraction_leaf': 0.02708478232818491, 'min_impurity_decrease': 0.37729362287037327, 'max_features': 0.890291014976251, 'subsample': 0.7147785491514133, 'dropout_rate': 0.38523670053484865, 'ccp_alpha': 0.1609200763088648}. Best is trial 677 with value: 0.7600100187343619.[0m
[32m[I 2022-04-14 14:48:22,203][0m Trial 714 finished with value: 0.7492435687295458 and parameters: {'loss': 'coxph', 'learning_rate': 0.006822562319430521, 'n_estimators': 202, 'criterion': 'friedman_mse', 'min_samples_split': 2, 'min_samples_leaf': 2, 'min_weight_fraction_leaf': 0.01775197266309438, 'min_impurity_decrease': 0.40861460595417953, 'max_features': 0.901091869686106, 'subsample': 0.7379195886856343, 'dropout_rate': 0.42414966009589244, 'ccp_alpha': 0.0036795478180479055}. Best is trial 677 with value: 0.7600100187343619.[0m
[32m[I 2022-04-14 14:48:37,931][0m Trial 715 finished with value: 0.735495209012057 and parameters: {'loss': 'coxph', 'learning_rate': 0.005860467266641951, 'n_estimators': 368, 'criterion': 'friedman_mse', 'min_samples_split': 2, 'min_samples_leaf': 2, 'min_weight_fraction_leaf': 0.015518173041983854, 'min_impurity_decrease': 0.4254144052522434, 'max_features': 0.9219425018893829, 'subsample': 0.7571943309935388, 'dropout_rate': 0.39906988947558186, 'ccp_alpha': 0.09114643906076754}. Best is trial 677 with value: 0.7600100187343619.[0m
[32m[I 2022-04-14 14:48:50,688][0m Trial 716 finished with value: 0.7333211807010678 and parameters: {'loss': 'coxph', 'learning_rate': 0.010948002735350385, 'n_estimators': 340, 'criterion': 'friedman_mse', 'min_samples_split': 2, 'min_samples_leaf': 2, 'min_weight_fraction_leaf': 0.0022029311062861413, 'min_impurity_decrease': 0.41900440759124924, 'max_features': 0.8825222336855749, 'subsample': 0.7237261737958077, 'dropout_rate': 0.4166268725797886, 'ccp_alpha': 0.09809971362877767}. Best is trial 677 with value: 0.7600100187343619.[0m
[32m[I 2022-04-14 14:49:04,606][0m Trial 717 finished with value: 0.7092549136202108 and parameters: {'loss': 'coxph', 'learning_rate': 0.005326884384078014, 'n_estimators': 360, 'criterion': 'friedman_mse', 'min_samples_split': 2, 'min_samples_leaf': 3, 'min_weight_fraction_leaf': 0.026430228175578538, 'min_impurity_decrease': 0.47255673142688465, 'max_features': 0.9186715044104661, 'subsample': 0.7469097219692246, 'dropout_rate': 0.40389687661023665, 'ccp_alpha': 0.21865267383939108}. Best is trial 677 with value: 0.7600100187343619.[0m
[32m[I 2022-04-14 14:49:17,546][0m Trial 718 finished with value: 0.7232281720813303 and parameters: {'loss': 'coxph', 'learning_rate': 0.008027349074633794, 'n_estimators': 339, 'criterion': 'friedman_mse', 'min_samples_split': 2, 'min_samples_leaf': 3, 'min_weight_fraction_leaf': 0.03373146583083676, 'min_impurity_decrease': 0.5056087590010669, 'max_features': 0.9177219752837996, 'subsample': 0.7027267418000925, 'dropout_rate': 0.35935572756560413, 'ccp_alpha': 0.16978894892188706}. Best is trial 677 with value: 0.7600100187343619.[0m
[32m[I 2022-04-14 14:49:22,187][0m Trial 719 finished with value: 0.7453279003106473 and parameters: {'loss': 'coxph', 'learning_rate': 0.0074100523557195114, 'n_estimators': 386, 'criterion': 'friedman_mse', 'min_samples_split': 2, 'min_samples_leaf': 3, 'min_weight_fraction_leaf': 0.030936462704836947, 'min_impurity_decrease': 0.4450662351303478, 'max_features': 0.9014033990332454, 'subsample': 0.7620547397308683, 'dropout_rate': 0.9219149750368663, 'ccp_alpha': 0.10552896341486087}. Best is trial 677 with value: 0.7600100187343619.[0m
[32m[I 2022-04-14 14:49:36,770][0m Trial 720 finished with value: 0.5 and parameters: {'loss': 'coxph', 'learning_rate': 0.008423823701817575, 'n_estimators': 372, 'criterion': 'absolute_error', 'min_samples_split': 2, 'min_samples_leaf': 2, 'min_weight_fraction_leaf': 0.03211770723919062, 'min_impurity_decrease': 0.3892971537128146, 'max_features': 0.923818034690651, 'subsample': 0.7600536917268206, 'dropout_rate': 0.43514128150141707, 'ccp_alpha': 1.1135248952135313}. Best is trial 677 with value: 0.7600100187343619.[0m
[32m[I 2022-04-14 14:49:49,411][0m Trial 721 finished with value: 0.7522874472844816 and parameters: {'loss': 'coxph', 'learning_rate': 0.005766332113896172, 'n_estimators': 339, 'criterion': 'friedman_mse', 'min_samples_split': 2, 'min_samples_leaf': 3, 'min_weight_fraction_leaf': 0.023522649156023923, 'min_impurity_decrease': 0.44861708518547216, 'max_features': 0.9277794467178294, 'subsample': 0.732231703860483, 'dropout_rate': 0.4193528558294047, 'ccp_alpha': 0.009921069138003988}. Best is trial 677 with value: 0.7600100187343619.[0m
[32m[I 2022-04-14 14:50:01,110][0m Trial 722 finished with value: 0.25381038329146677 and parameters: {'loss': 'squared', 'learning_rate': 0.006048558850578595, 'n_estimators': 333, 'criterion': 'friedman_mse', 'min_samples_split': 2, 'min_samples_leaf': 3, 'min_weight_fraction_leaf': 0.012997992080944676, 'min_impurity_decrease': 0.40978522930950134, 'max_features': 0.49550804184568803, 'subsample': 0.7507913189838974, 'dropout_rate': 0.45146305006488346, 'ccp_alpha': 0.006521264001981107}. Best is trial 677 with value: 0.7600100187343619.[0m
