[32m[I 2022-04-14 14:50:14,330][0m Trial 723 finished with value: 0.7486916892389803 and parameters: {'loss': 'coxph', 'learning_rate': 0.005096867107493725, 'n_estimators': 327, 'criterion': 'friedman_mse', 'min_samples_split': 2, 'min_samples_leaf': 4, 'min_weight_fraction_leaf': 0.0187930381911717, 'min_impurity_decrease': 0.43511862367079973, 'max_features': 0.8794292504461748, 'subsample': 0.7412939504898888, 'dropout_rate': 0.4304975022049205, 'ccp_alpha': 0.0010218539231497538}. Best is trial 677 with value: 0.7600100187343619.[0m
[32m[I 2022-04-14 14:50:26,344][0m Trial 724 finished with value: 0.5328286035390352 and parameters: {'loss': 'coxph', 'learning_rate': 0.005371604765364271, 'n_estimators': 338, 'criterion': 'friedman_mse', 'min_samples_split': 2, 'min_samples_leaf': 2, 'min_weight_fraction_leaf': 0.039040186977588875, 'min_impurity_decrease': 0.37103570359903904, 'max_features': 0.9331452758393959, 'subsample': 0.7763732091839031, 'dropout_rate': 0.44786232262279124, 'ccp_alpha': 0.2995502811933213}. Best is trial 677 with value: 0.7600100187343619.[0m
[32m[I 2022-04-14 14:50:40,039][0m Trial 725 finished with value: 0.7554143465402111 and parameters: {'loss': 'coxph', 'learning_rate': 0.005460183829301064, 'n_estimators': 350, 'criterion': 'friedman_mse', 'min_samples_split': 2, 'min_samples_leaf': 3, 'min_weight_fraction_leaf': 0.013198246812135366, 'min_impurity_decrease': 0.47973899342937876, 'max_features': 0.9015585925149282, 'subsample': 0.7234526346060958, 'dropout_rate': 0.41868554363198796, 'ccp_alpha': 0.001058186089683309}. Best is trial 677 with value: 0.7600100187343619.[0m
[32m[I 2022-04-14 14:50:52,164][0m Trial 726 finished with value: 0.5 and parameters: {'loss': 'coxph', 'learning_rate': 0.004604655246944826, 'n_estimators': 332, 'criterion': 'friedman_mse', 'min_samples_split': 2, 'min_samples_leaf': 3, 'min_weight_fraction_leaf': 0.007555511091650615, 'min_impurity_decrease': 0.52334107022798, 'max_features': 0.9349275068670252, 'subsample': 0.7027023695582856, 'dropout_rate': 0.3944693626062868, 'ccp_alpha': 1.7711674071294425}. Best is trial 677 with value: 0.7600100187343619.[0m
[32m[I 2022-04-14 14:51:05,418][0m Trial 727 finished with value: 0.7002823179272685 and parameters: {'loss': 'coxph', 'learning_rate': 0.0056465283594478565, 'n_estimators': 345, 'criterion': 'friedman_mse', 'min_samples_split': 2, 'min_samples_leaf': 3, 'min_weight_fraction_leaf': 0.013460931608172806, 'min_impurity_decrease': 0.42777885475420124, 'max_features': 0.9293604011715497, 'subsample': 0.7646448210590224, 'dropout_rate': 0.3851248559579799, 'ccp_alpha': 0.16886841019518836}. Best is trial 677 with value: 0.7600100187343619.[0m
[32m[I 2022-04-14 14:51:17,401][0m Trial 728 finished with value: 0.7397504366392529 and parameters: {'loss': 'coxph', 'learning_rate': 0.005094582314413015, 'n_estimators': 327, 'criterion': 'friedman_mse', 'min_samples_split': 2, 'min_samples_leaf': 3, 'min_weight_fraction_leaf': 0.0031165544682253167, 'min_impurity_decrease': 0.490701811733908, 'max_features': 0.8882405820903784, 'subsample': 0.7728571784690936, 'dropout_rate': 0.4096617097480045, 'ccp_alpha': 0.09743075748686691}. Best is trial 677 with value: 0.7600100187343619.[0m
[32m[I 2022-04-14 14:51:36,578][0m Trial 729 finished with value: 0.673664311117699 and parameters: {'loss': 'coxph', 'learning_rate': 0.006172749163991067, 'n_estimators': 427, 'criterion': 'friedman_mse', 'min_samples_split': 2, 'min_samples_leaf': 3, 'min_weight_fraction_leaf': 0.037987149983739324, 'min_impurity_decrease': 0.47654550622071706, 'max_features': 0.9103081364013385, 'subsample': 0.774290076649541, 'dropout_rate': 0.4217845781107968, 'ccp_alpha': 0.24739353234534378}. Best is trial 677 with value: 0.7600100187343619.[0m
[32m[I 2022-04-14 14:51:48,303][0m Trial 730 finished with value: 0.7402820125344115 and parameters: {'loss': 'coxph', 'learning_rate': 0.004976105195612761, 'n_estimators': 344, 'criterion': 'friedman_mse', 'min_samples_split': 2, 'min_samples_leaf': 3, 'min_weight_fraction_leaf': 0.020907407039889032, 'min_impurity_decrease': 0.4996524363416538, 'max_features': 0.933550285027494, 'subsample': 0.7189480174069693, 'dropout_rate': 0.4681285611113609, 'ccp_alpha': 0.0964626144619392}. Best is trial 677 with value: 0.7600100187343619.[0m
[32m[I 2022-04-14 14:51:58,941][0m Trial 731 finished with value: 0.7296713728048552 and parameters: {'loss': 'coxph', 'learning_rate': 0.006774841980532636, 'n_estimators': 320, 'criterion': 'friedman_mse', 'min_samples_split': 2, 'min_samples_leaf': 3, 'min_weight_fraction_leaf': 0.026985040119117818, 'min_impurity_decrease': 0.4733610970144907, 'max_features': 0.3021663301171914, 'subsample': 0.7538138996231296, 'dropout_rate': 0.4469985279912803, 'ccp_alpha': 0.0019431365207239312}. Best is trial 677 with value: 0.7600100187343619.[0m
[32m[I 2022-04-14 14:52:16,243][0m Trial 732 finished with value: 0.704683147173378 and parameters: {'loss': 'coxph', 'learning_rate': 0.004881236422854804, 'n_estimators': 390, 'criterion': 'friedman_mse', 'min_samples_split': 2, 'min_samples_leaf': 5, 'min_weight_fraction_leaf': 0.011767722322453204, 'min_impurity_decrease': 0.513113619185681, 'max_features': 0.9323832862919795, 'subsample': 0.7785370201897883, 'dropout_rate': 0.4189252666605369, 'ccp_alpha': 0.18238236834399865}. Best is trial 677 with value: 0.7600100187343619.[0m
[32m[I 2022-04-14 14:52:31,588][0m Trial 733 finished with value: 0.5263432352942662 and parameters: {'loss': 'coxph', 'learning_rate': 0.013229326215338717, 'n_estimators': 356, 'criterion': 'friedman_mse', 'min_samples_split': 2, 'min_samples_leaf': 3, 'min_weight_fraction_leaf': 0.03407464847110953, 'min_impurity_decrease': 0.3904872330908382, 'max_features': 0.9120749913831493, 'subsample': 0.7557631575213086, 'dropout_rate': 0.3888484621286913, 'ccp_alpha': 0.3177669190886105}. Best is trial 677 with value: 0.7600100187343619.[0m
[32m[I 2022-04-14 14:52:47,636][0m Trial 734 finished with value: 0.7499929606393396 and parameters: {'loss': 'coxph', 'learning_rate': 0.005909478361828047, 'n_estimators': 376, 'criterion': 'friedman_mse', 'min_samples_split': 2, 'min_samples_leaf': 2, 'min_weight_fraction_leaf': 0.039730563585948495, 'min_impurity_decrease': 0.41441204789751857, 'max_features': 0.891217543071744, 'subsample': 0.729766804629488, 'dropout_rate': 0.4548384239739004, 'ccp_alpha': 0.002109458776650459}. Best is trial 677 with value: 0.7600100187343619.[0m
[32m[I 2022-04-14 14:52:59,414][0m Trial 735 finished with value: 0.5 and parameters: {'loss': 'coxph', 'learning_rate': 0.01062478964163059, 'n_estimators': 344, 'criterion': 'friedman_mse', 'min_samples_split': 2, 'min_samples_leaf': 4, 'min_weight_fraction_leaf': 0.023765504130013854, 'min_impurity_decrease': 0.4615281546708725, 'max_features': 0.9295792474859752, 'subsample': 0.7839022505492196, 'dropout_rate': 0.47383989072607063, 'ccp_alpha': 1.2703807131431524}. Best is trial 677 with value: 0.7600100187343619.[0m
[32m[I 2022-04-14 14:53:05,173][0m Trial 736 finished with value: 0.7158568699710433 and parameters: {'loss': 'coxph', 'learning_rate': 0.008616788398128279, 'n_estimators': 215, 'criterion': 'friedman_mse', 'min_samples_split': 2, 'min_samples_leaf': 3, 'min_weight_fraction_leaf': 0.001422484719836652, 'min_impurity_decrease': 0.3643587030339381, 'max_features': 0.9388682868986247, 'subsample': 0.7490266140063774, 'dropout_rate': 0.3623722707584014, 'ccp_alpha': 0.15135891077589517}. Best is trial 677 with value: 0.7600100187343619.[0m
[32m[I 2022-04-14 14:53:29,407][0m Trial 737 finished with value: 0.7416277620125096 and parameters: {'loss': 'coxph', 'learning_rate': 0.003950578412535905, 'n_estimators': 460, 'criterion': 'friedman_mse', 'min_samples_split': 2, 'min_samples_leaf': 4, 'min_weight_fraction_leaf': 0.041191049569157916, 'min_impurity_decrease': 0.3324238586968947, 'max_features': 0.9080921868402295, 'subsample': 0.7137535569263833, 'dropout_rate': 0.43340553949066934, 'ccp_alpha': 0.09463814830108647}. Best is trial 677 with value: 0.7600100187343619.[0m
[32m[I 2022-04-14 14:53:42,455][0m Trial 738 finished with value: 0.6704768314273679 and parameters: {'loss': 'coxph', 'learning_rate': 0.006850947103183504, 'n_estimators': 327, 'criterion': 'friedman_mse', 'min_samples_split': 2, 'min_samples_leaf': 2, 'min_weight_fraction_leaf': 0.013658713310961974, 'min_impurity_decrease': 0.4833405287990771, 'max_features': 0.9416348957999907, 'subsample': 0.7825855089058724, 'dropout_rate': 0.40303332102923123, 'ccp_alpha': 0.24550444074848282}. Best is trial 677 with value: 0.7600100187343619.[0m
[32m[I 2022-04-14 14:54:00,523][0m Trial 739 finished with value: 0.74748695719178 and parameters: {'loss': 'coxph', 'learning_rate': 0.004452599802939066, 'n_estimators': 406, 'criterion': 'friedman_mse', 'min_samples_split': 2, 'min_samples_leaf': 4, 'min_weight_fraction_leaf': 0.031508038588543966, 'min_impurity_decrease': 0.4453951310524932, 'max_features': 0.8774587081302411, 'subsample': 0.7692830620071455, 'dropout_rate': 0.41944147981677976, 'ccp_alpha': 0.003193062429485022}. Best is trial 677 with value: 0.7600100187343619.[0m
[32m[I 2022-04-14 14:54:04,537][0m Trial 740 finished with value: 0.5 and parameters: {'loss': 'squared', 'learning_rate': 0.005494822699080356, 'n_estimators': 191, 'criterion': 'friedman_mse', 'min_samples_split': 2, 'min_samples_leaf': 2, 'min_weight_fraction_leaf': 0.04096474445950845, 'min_impurity_decrease': 0.39554224845944075, 'max_features': 0.93989429753939, 'subsample': 0.7872773464577679, 'dropout_rate': 0.4424596623682385, 'ccp_alpha': 4.596813992158852}. Best is trial 677 with value: 0.7600100187343619.[0m
[32m[I 2022-04-14 14:54:19,370][0m Trial 741 finished with value: 0.5 and parameters: {'loss': 'coxph', 'learning_rate': 0.0095561373696411, 'n_estimators': 363, 'criterion': 'absolute_error', 'min_samples_split': 2, 'min_samples_leaf': 2, 'min_weight_fraction_leaf': 0.01725743671179001, 'min_impurity_decrease': 0.46302076369998413, 'max_features': 0.17546187998648188, 'subsample': 0.7405682023818173, 'dropout_rate': 0.46303239735788504, 'ccp_alpha': 0.09968576493400114}. Best is trial 677 with value: 0.7600100187343619.[0m
[32m[I 2022-04-14 14:54:31,411][0m Trial 742 finished with value: 0.5217459622928541 and parameters: {'loss': 'coxph', 'learning_rate': 0.006699604655974765, 'n_estimators': 323, 'criterion': 'friedman_mse', 'min_samples_split': 2, 'min_samples_leaf': 4, 'min_weight_fraction_leaf': 0.02561410097516706, 'min_impurity_decrease': 0.4865413012749086, 'max_features': 0.9281160054021228, 'subsample': 0.7038778108487799, 'dropout_rate': 0.37619940303504706, 'ccp_alpha': 0.36300485796690746}. Best is trial 677 with value: 0.7600100187343619.[0m
[32m[I 2022-04-14 14:54:44,587][0m Trial 743 finished with value: 0.7141751429495249 and parameters: {'loss': 'coxph', 'learning_rate': 0.0055295133980890546, 'n_estimators': 341, 'criterion': 'friedman_mse', 'min_samples_split': 2, 'min_samples_leaf': 3, 'min_weight_fraction_leaf': 0.03970045250572902, 'min_impurity_decrease': 0.4213683858689804, 'max_features': 0.9124105855216224, 'subsample': 0.7854263402692435, 'dropout_rate': 0.42064553536238164, 'ccp_alpha': 0.1658954955552843}. Best is trial 677 with value: 0.7600100187343619.[0m
[32m[I 2022-04-14 14:55:00,387][0m Trial 744 finished with value: 0.7452091175459792 and parameters: {'loss': 'coxph', 'learning_rate': 0.004345844794692343, 'n_estimators': 378, 'criterion': 'friedman_mse', 'min_samples_split': 2, 'min_samples_leaf': 2, 'min_weight_fraction_leaf': 0.02289759015424634, 'min_impurity_decrease': 0.4546945609421612, 'max_features': 0.9476081134109847, 'subsample': 0.7958837160204395, 'dropout_rate': 0.4486206118931481, 'ccp_alpha': 0.0015889473889479557}. Best is trial 677 with value: 0.7600100187343619.[0m
[32m[I 2022-04-14 14:55:12,531][0m Trial 745 finished with value: 0.5 and parameters: {'loss': 'coxph', 'learning_rate': 0.0041426093274424675, 'n_estimators': 351, 'criterion': 'friedman_mse', 'min_samples_split': 2, 'min_samples_leaf': 2, 'min_weight_fraction_leaf': 0.04360642875555251, 'min_impurity_decrease': 0.3750735541767607, 'max_features': 0.9451699732511476, 'subsample': 0.761714454537082, 'dropout_rate': 0.493478493250093, 'ccp_alpha': 0.5951383931594201}. Best is trial 677 with value: 0.7600100187343619.[0m
[32m[I 2022-04-14 14:55:24,003][0m Trial 746 finished with value: 0.7470591074588783 and parameters: {'loss': 'coxph', 'learning_rate': 0.006722238381457269, 'n_estimators': 321, 'criterion': 'friedman_mse', 'min_samples_split': 2, 'min_samples_leaf': 5, 'min_weight_fraction_leaf': 0.010215309115770062, 'min_impurity_decrease': 0.4320893059963069, 'max_features': 0.8889244833278903, 'subsample': 0.7350082211554458, 'dropout_rate': 0.39970298942159055, 'ccp_alpha': 0.10156317396168091}. Best is trial 677 with value: 0.7600100187343619.[0m
[32m[I 2022-04-14 14:55:38,299][0m Trial 747 finished with value: 0.5 and parameters: {'loss': 'coxph', 'learning_rate': 0.008766607660551195, 'n_estimators': 365, 'criterion': 'friedman_mse', 'min_samples_split': 2, 'min_samples_leaf': 2, 'min_weight_fraction_leaf': 0.03211578640859903, 'min_impurity_decrease': 0.50604598880305, 'max_features': 0.9190440191754964, 'subsample': 0.8026345027904048, 'dropout_rate': 0.4722533724606513, 'ccp_alpha': 3.0727923397569263}. Best is trial 677 with value: 0.7600100187343619.[0m
[32m[I 2022-04-14 14:55:55,507][0m Trial 748 finished with value: 0.5 and parameters: {'loss': 'coxph', 'learning_rate': 0.012502306801407478, 'n_estimators': 390, 'criterion': 'friedman_mse', 'min_samples_split': 2, 'min_samples_leaf': 4, 'min_weight_fraction_leaf': 0.040018601252362576, 'min_impurity_decrease': 0.35214681598337716, 'max_features': 0.9443890312456296, 'subsample': 0.7741030394267542, 'dropout_rate': 0.43279980484462666, 'ccp_alpha': 3.7511188497808745}. Best is trial 677 with value: 0.7600100187343619.[0m
[32m[I 2022-04-14 14:56:07,901][0m Trial 749 finished with value: 0.5530352851810367 and parameters: {'loss': 'coxph', 'learning_rate': 0.0040214491372106516, 'n_estimators': 336, 'criterion': 'friedman_mse', 'min_samples_split': 2, 'min_samples_leaf': 2, 'min_weight_fraction_leaf': 0.04809505925976157, 'min_impurity_decrease': 0.4748642977889769, 'max_features': 0.9061550559626816, 'subsample': 0.815094882322708, 'dropout_rate': 0.45909842297977005, 'ccp_alpha': 0.258101438829446}. Best is trial 677 with value: 0.7600100187343619.[0m
[32m[I 2022-04-14 14:56:22,355][0m Trial 750 finished with value: 0.7438283931704532 and parameters: {'loss': 'coxph', 'learning_rate': 0.006788058156290592, 'n_estimators': 355, 'criterion': 'friedman_mse', 'min_samples_split': 2, 'min_samples_leaf': 2, 'min_weight_fraction_leaf': 0.012755187414969105, 'min_impurity_decrease': 0.4456198454698213, 'max_features': 0.9441589695795217, 'subsample': 0.8293223962708711, 'dropout_rate': 0.4149973195443252, 'ccp_alpha': 0.001688908160768709}. Best is trial 677 with value: 0.7600100187343619.[0m
[32m[I 2022-04-14 14:56:33,081][0m Trial 751 finished with value: 0.7182037741864058 and parameters: {'loss': 'coxph', 'learning_rate': 0.005166947364953929, 'n_estimators': 316, 'criterion': 'friedman_mse', 'min_samples_split': 2, 'min_samples_leaf': 1, 'min_weight_fraction_leaf': 0.04799819460940348, 'min_impurity_decrease': 0.4114343572262073, 'max_features': 0.9276928631898985, 'subsample': 0.7417284324548398, 'dropout_rate': 0.4809342500818696, 'ccp_alpha': 0.1656400692843027}. Best is trial 677 with value: 0.7600100187343619.[0m
[32m[I 2022-04-14 14:56:45,591][0m Trial 752 finished with value: 0.7418625138170631 and parameters: {'loss': 'coxph', 'learning_rate': 0.0048057618163738405, 'n_estimators': 328, 'criterion': 'friedman_mse', 'min_samples_split': 2, 'min_samples_leaf': 3, 'min_weight_fraction_leaf': 0.024344752151462066, 'min_impurity_decrease': 0.5319592881427817, 'max_features': 0.9510895102018238, 'subsample': 0.7971161188950422, 'dropout_rate': 0.3945141102354563, 'ccp_alpha': 0.09815658715524912}. Best is trial 677 with value: 0.7600100187343619.[0m
[32m[I 2022-04-14 14:57:03,753][0m Trial 753 finished with value: 0.7389228791426078 and parameters: {'loss': 'coxph', 'learning_rate': 0.01051284621015603, 'n_estimators': 417, 'criterion': 'friedman_mse', 'min_samples_split': 2, 'min_samples_leaf': 1, 'min_weight_fraction_leaf': 0.03374542562484533, 'min_impurity_decrease': 0.4884465949870771, 'max_features': 0.8878474053387386, 'subsample': 0.7686309961037032, 'dropout_rate': 0.4479601501716866, 'ccp_alpha': 0.09957807870386107}. Best is trial 677 with value: 0.7600100187343619.[0m
[32m[I 2022-04-14 14:57:06,791][0m Trial 754 finished with value: 0.6615215872333688 and parameters: {'loss': 'coxph', 'learning_rate': 0.00749252732706133, 'n_estimators': 159, 'criterion': 'friedman_mse', 'min_samples_split': 2, 'min_samples_leaf': 1, 'min_weight_fraction_leaf': 0.05023253191728465, 'min_impurity_decrease': 0.46273764156514163, 'max_features': 0.9225658290488373, 'subsample': 0.7161385987130683, 'dropout_rate': 0.42826761274519726, 'ccp_alpha': 0.24905972246399954}. Best is trial 677 with value: 0.7600100187343619.[0m
[32m[I 2022-04-14 14:57:24,850][0m Trial 755 finished with value: 0.7434716347025296 and parameters: {'loss': 'coxph', 'learning_rate': 0.0037071532914949305, 'n_estimators': 380, 'criterion': 'friedman_mse', 'min_samples_split': 2, 'min_samples_leaf': 2, 'min_weight_fraction_leaf': 0.02047876748988238, 'min_impurity_decrease': 0.4053202449854624, 'max_features': 0.9538986908230419, 'subsample': 0.8312302360882708, 'dropout_rate': 0.3567176743762631, 'ccp_alpha': 0.002600953558422355}. Best is trial 677 with value: 0.7600100187343619.[0m
[32m[I 2022-04-14 14:57:37,924][0m Trial 756 finished with value: 0.5 and parameters: {'loss': 'coxph', 'learning_rate': 0.005732811535078093, 'n_estimators': 339, 'criterion': 'friedman_mse', 'min_samples_split': 2, 'min_samples_leaf': 1, 'min_weight_fraction_leaf': 0.03486097052166591, 'min_impurity_decrease': 0.43351582386638277, 'max_features': 0.9065332944161539, 'subsample': 0.753974749591857, 'dropout_rate': 0.3406501968520113, 'ccp_alpha': 2.498286471737351}. Best is trial 677 with value: 0.7600100187343619.[0m
[32m[I 2022-04-14 14:57:50,543][0m Trial 757 finished with value: 0.6952257894023731 and parameters: {'loss': 'coxph', 'learning_rate': 0.07713601236885749, 'n_estimators': 368, 'criterion': 'friedman_mse', 'min_samples_split': 2, 'min_samples_leaf': 4, 'min_weight_fraction_leaf': 0.003289655699310154, 'min_impurity_decrease': 0.4652043638003661, 'max_features': 0.9519885065440189, 'subsample': 0.8838998010264906, 'dropout_rate': 0.5011676964093923, 'ccp_alpha': 0.17205653988765063}. Best is trial 677 with value: 0.7600100187343619.[0m
[32m[I 2022-04-14 14:58:14,541][0m Trial 758 finished with value: 0.7332912882129091 and parameters: {'loss': 'coxph', 'learning_rate': 0.0036023326138774217, 'n_estimators': 499, 'criterion': 'friedman_mse', 'min_samples_split': 2, 'min_samples_leaf': 1, 'min_weight_fraction_leaf': 0.041806972571393874, 'min_impurity_decrease': 0.5090640474925708, 'max_features': 0.9291169797576422, 'subsample': 0.8130916912240513, 'dropout_rate': 0.46027182835189406, 'ccp_alpha': 0.12675796128422043}. Best is trial 677 with value: 0.7600100187343619.[0m
[32m[I 2022-04-14 14:58:18,559][0m Trial 759 finished with value: 0.255547449135311 and parameters: {'loss': 'squared', 'learning_rate': 0.01793184499143399, 'n_estimators': 185, 'criterion': 'friedman_mse', 'min_samples_split': 2, 'min_samples_leaf': 3, 'min_weight_fraction_leaf': 0.001019205369063074, 'min_impurity_decrease': 0.3735273504398875, 'max_features': 0.9566766895455713, 'subsample': 0.8580790223309329, 'dropout_rate': 0.3782384912530746, 'ccp_alpha': 0.08789600412863458}. Best is trial 677 with value: 0.7600100187343619.[0m
[32m[I 2022-04-14 14:58:29,252][0m Trial 760 finished with value: 0.5 and parameters: {'loss': 'coxph', 'learning_rate': 0.03391651672069839, 'n_estimators': 316, 'criterion': 'friedman_mse', 'min_samples_split': 2, 'min_samples_leaf': 1, 'min_weight_fraction_leaf': 0.047702962340482366, 'min_impurity_decrease': 0.3422644319420354, 'max_features': 0.9179332202270473, 'subsample': 0.7993954207879893, 'dropout_rate': 0.4175682869425107, 'ccp_alpha': 0.43071501421541575}. Best is trial 677 with value: 0.7600100187343619.[0m
[32m[I 2022-04-14 14:58:43,360][0m Trial 761 finished with value: 0.7442053206137276 and parameters: {'loss': 'coxph', 'learning_rate': 0.008653132379097025, 'n_estimators': 349, 'criterion': 'friedman_mse', 'min_samples_split': 5, 'min_samples_leaf': 1, 'min_weight_fraction_leaf': 0.02685409426517018, 'min_impurity_decrease': 0.4899889577362602, 'max_features': 0.8753889187624714, 'subsample': 0.829329432093866, 'dropout_rate': 0.43886165247344955, 'ccp_alpha': 0.002280634151836645}. Best is trial 677 with value: 0.7600100187343619.[0m
[32m[I 2022-04-14 14:58:46,288][0m Trial 762 finished with value: 0.712943535725137 and parameters: {'loss': 'coxph', 'learning_rate': 0.051714544745773076, 'n_estimators': 149, 'criterion': 'friedman_mse', 'min_samples_split': 2, 'min_samples_leaf': 1, 'min_weight_fraction_leaf': 0.014199202997534006, 'min_impurity_decrease': 0.4421799256519645, 'max_features': 0.9593612642293621, 'subsample': 0.6871524169484329, 'dropout_rate': 0.3992240483453144, 'ccp_alpha': 0.23492350905550133}. Best is trial 677 with value: 0.7600100187343619.[0m
