[32m[I 2022-04-14 14:22:49,139][0m Trial 563 finished with value: 0.6985598474347825 and parameters: {'loss': 'coxph', 'learning_rate': 1.9795303572831314e-05, 'n_estimators': 310, 'criterion': 'friedman_mse', 'min_samples_split': 9, 'min_samples_leaf': 7, 'min_weight_fraction_leaf': 0.09667981163286407, 'min_impurity_decrease': 0.025940588010960653, 'max_features': 0.9749034783568031, 'subsample': 0.2688391381915127, 'dropout_rate': 0.6448322123234975, 'ccp_alpha': 0.15148070867773902}. Best is trial 540 with value: 0.7566929380169813.[0m
[32m[I 2022-04-14 14:22:58,179][0m Trial 564 finished with value: 0.7392889255705704 and parameters: {'loss': 'coxph', 'learning_rate': 1.238148293581801e-05, 'n_estimators': 292, 'criterion': 'friedman_mse', 'min_samples_split': 3, 'min_samples_leaf': 1, 'min_weight_fraction_leaf': 0.0629041079503466, 'min_impurity_decrease': 0.05042046681786193, 'max_features': 0.9795021277760081, 'subsample': 0.8285658669261208, 'dropout_rate': 0.46691588123151423, 'ccp_alpha': 0.0034167049430400727}. Best is trial 540 with value: 0.7566929380169813.[0m
[32m[I 2022-04-14 14:23:10,980][0m Trial 565 finished with value: 0.3010659943980223 and parameters: {'loss': 'squared', 'learning_rate': 7.4493315832585965e-06, 'n_estimators': 331, 'criterion': 'friedman_mse', 'min_samples_split': 9, 'min_samples_leaf': 8, 'min_weight_fraction_leaf': 0.1054029691635674, 'min_impurity_decrease': 0.015780020760528143, 'max_features': 0.9556322351656646, 'subsample': 0.8063963232303275, 'dropout_rate': 0.4112133759153889, 'ccp_alpha': 0.4616813808199181}. Best is trial 540 with value: 0.7566929380169813.[0m
[32m[I 2022-04-14 14:23:23,961][0m Trial 566 finished with value: 0.7196299857706775 and parameters: {'loss': 'coxph', 'learning_rate': 2.207099955746016e-05, 'n_estimators': 356, 'criterion': 'friedman_mse', 'min_samples_split': 10, 'min_samples_leaf': 5, 'min_weight_fraction_leaf': 0.08063662640462452, 'min_impurity_decrease': 0.002086812308796801, 'max_features': 0.9324236252493162, 'subsample': 0.9040614956904032, 'dropout_rate': 0.4443763892364653, 'ccp_alpha': 0.09800550817438308}. Best is trial 540 with value: 0.7566929380169813.[0m
[32m[I 2022-04-14 14:23:28,066][0m Trial 567 finished with value: 0.6518048258166799 and parameters: {'loss': 'coxph', 'learning_rate': 1.1193462609376732e-05, 'n_estimators': 189, 'criterion': 'friedman_mse', 'min_samples_split': 9, 'min_samples_leaf': 1, 'min_weight_fraction_leaf': 0.25515254231673046, 'min_impurity_decrease': 0.048273260373050936, 'max_features': 0.9803005673266025, 'subsample': 0.8595206566555431, 'dropout_rate': 0.473506161043798, 'ccp_alpha': 0.18288861223030678}. Best is trial 540 with value: 0.7566929380169813.[0m
[32m[I 2022-04-14 14:23:30,817][0m Trial 568 finished with value: 0.5 and parameters: {'loss': 'coxph', 'learning_rate': 9.105674304710779e-06, 'n_estimators': 146, 'criterion': 'friedman_mse', 'min_samples_split': 4, 'min_samples_leaf': 1, 'min_weight_fraction_leaf': 0.07000680253288666, 'min_impurity_decrease': 0.001587944976903591, 'max_features': 0.9634941761388346, 'subsample': 0.8411665304813342, 'dropout_rate': 0.5047239604853742, 'ccp_alpha': 0.3362116351989808}. Best is trial 540 with value: 0.7566929380169813.[0m
[32m[I 2022-04-14 14:23:37,766][0m Trial 569 finished with value: 0.7501587509028578 and parameters: {'loss': 'coxph', 'learning_rate': 3.473826401006577e-05, 'n_estimators': 302, 'criterion': 'friedman_mse', 'min_samples_split': 3, 'min_samples_leaf': 1, 'min_weight_fraction_leaf': 0.0949773973981353, 'min_impurity_decrease': 0.07622538898994063, 'max_features': 0.9839100264537759, 'subsample': 0.8133655261392876, 'dropout_rate': 0.6631624999325885, 'ccp_alpha': 0.08132644207346307}. Best is trial 540 with value: 0.7566929380169813.[0m
[32m[I 2022-04-14 14:23:44,278][0m Trial 570 finished with value: 0.5 and parameters: {'loss': 'coxph', 'learning_rate': 2.610718148624687e-05, 'n_estimators': 303, 'criterion': 'friedman_mse', 'min_samples_split': 3, 'min_samples_leaf': 7, 'min_weight_fraction_leaf': 0.0967410849440069, 'min_impurity_decrease': 0.08232138924844468, 'max_features': 0.9415321240103831, 'subsample': 0.7856401652984607, 'dropout_rate': 0.6623225963260447, 'ccp_alpha': 3.9242460262504806}. Best is trial 540 with value: 0.7566929380169813.[0m
[32m[I 2022-04-14 14:23:57,549][0m Trial 571 finished with value: 0.5530352851810367 and parameters: {'loss': 'coxph', 'learning_rate': 3.22245147744576e-05, 'n_estimators': 342, 'criterion': 'friedman_mse', 'min_samples_split': 3, 'min_samples_leaf': 6, 'min_weight_fraction_leaf': 0.10538478753698133, 'min_impurity_decrease': 0.07734795392797905, 'max_features': 0.9161640838979767, 'subsample': 0.8125956118222748, 'dropout_rate': 0.3744831443181592, 'ccp_alpha': 0.2552384847914952}. Best is trial 540 with value: 0.7566929380169813.[0m
[32m[I 2022-04-14 14:24:06,143][0m Trial 572 finished with value: 0.7449464372394918 and parameters: {'loss': 'coxph', 'learning_rate': 4.7026497793698264e-05, 'n_estimators': 317, 'criterion': 'friedman_mse', 'min_samples_split': 3, 'min_samples_leaf': 1, 'min_weight_fraction_leaf': 0.09213344724128159, 'min_impurity_decrease': 0.06595575868370589, 'max_features': 0.9617182217884928, 'subsample': 0.8729945647420995, 'dropout_rate': 0.6745957100286442, 'ccp_alpha': 0.09273415424332031}. Best is trial 540 with value: 0.7566929380169813.[0m
[32m[I 2022-04-14 14:24:17,060][0m Trial 573 finished with value: 0.7104500319062768 and parameters: {'loss': 'coxph', 'learning_rate': 3.649749259292876e-05, 'n_estimators': 295, 'criterion': 'absolute_error', 'min_samples_split': 3, 'min_samples_leaf': 1, 'min_weight_fraction_leaf': 0.05055976982236579, 'min_impurity_decrease': 0.0822742822167298, 'max_features': 0.981410947962877, 'subsample': 0.7984875892303303, 'dropout_rate': 0.42487368288538574, 'ccp_alpha': 0.001156071358129168}. Best is trial 540 with value: 0.7566929380169813.[0m
[32m[I 2022-04-14 14:24:26,768][0m Trial 574 finished with value: 0.7109485334957064 and parameters: {'loss': 'coxph', 'learning_rate': 1.5978182521966442e-05, 'n_estimators': 326, 'criterion': 'friedman_mse', 'min_samples_split': 3, 'min_samples_leaf': 1, 'min_weight_fraction_leaf': 0.07740498466451444, 'min_impurity_decrease': 0.053977715103947894, 'max_features': 0.952303869800255, 'subsample': 0.8511131720959204, 'dropout_rate': 0.6501915801335048, 'ccp_alpha': 0.1608630530822304}. Best is trial 540 with value: 0.7566929380169813.[0m
[32m[I 2022-04-14 14:24:37,377][0m Trial 575 finished with value: 0.5217459622928541 and parameters: {'loss': 'coxph', 'learning_rate': 2.5029062412144748e-05, 'n_estimators': 306, 'criterion': 'friedman_mse', 'min_samples_split': 3, 'min_samples_leaf': 1, 'min_weight_fraction_leaf': 0.08839400716353842, 'min_impurity_decrease': 0.06035393786488735, 'max_features': 0.9992269960437866, 'subsample': 0.889071586564202, 'dropout_rate': 0.4491758776687179, 'ccp_alpha': 0.25250745551107895}. Best is trial 540 with value: 0.7566929380169813.[0m
[32m[I 2022-04-14 14:24:39,537][0m Trial 576 finished with value: 0.7372246796479967 and parameters: {'loss': 'coxph', 'learning_rate': 2.001266879363603e-05, 'n_estimators': 125, 'criterion': 'friedman_mse', 'min_samples_split': 3, 'min_samples_leaf': 1, 'min_weight_fraction_leaf': 0.06963850281251988, 'min_impurity_decrease': 0.03717040939859999, 'max_features': 0.9792961944260277, 'subsample': 0.7762175688123841, 'dropout_rate': 0.47550282981744285, 'ccp_alpha': 0.10719378387470745}. Best is trial 540 with value: 0.7566929380169813.[0m
[32m[I 2022-04-14 14:24:49,065][0m Trial 577 finished with value: 0.5 and parameters: {'loss': 'coxph', 'learning_rate': 1.4968589223620727e-05, 'n_estimators': 371, 'criterion': 'friedman_mse', 'min_samples_split': 3, 'min_samples_leaf': 1, 'min_weight_fraction_leaf': 0.1051054304585694, 'min_impurity_decrease': 0.08211190876780806, 'max_features': 0.9350750110113576, 'subsample': 0.8248330180189236, 'dropout_rate': 0.6728747806373642, 'ccp_alpha': 0.38089992438095543}. Best is trial 540 with value: 0.7566929380169813.[0m
[32m[I 2022-04-14 14:25:02,202][0m Trial 578 finished with value: 0.7495658612515163 and parameters: {'loss': 'coxph', 'learning_rate': 0.01221355787051208, 'n_estimators': 349, 'criterion': 'friedman_mse', 'min_samples_split': 3, 'min_samples_leaf': 1, 'min_weight_fraction_leaf': 0.059391556861958864, 'min_impurity_decrease': 0.2694998625384189, 'max_features': 0.9649366061365087, 'subsample': 0.8642534506326262, 'dropout_rate': 0.3964576976770505, 'ccp_alpha': 0.09955614519285327}. Best is trial 540 with value: 0.7566929380169813.[0m
[32m[I 2022-04-14 14:25:15,006][0m Trial 579 finished with value: 0.5 and parameters: {'loss': 'coxph', 'learning_rate': 0.011692258509307586, 'n_estimators': 341, 'criterion': 'friedman_mse', 'min_samples_split': 3, 'min_samples_leaf': 1, 'min_weight_fraction_leaf': 0.04577737209214791, 'min_impurity_decrease': 0.2866778584572262, 'max_features': 0.9132355468139791, 'subsample': 0.9293762344122283, 'dropout_rate': 0.42857818363702993, 'ccp_alpha': 0.3174012184773219}. Best is trial 540 with value: 0.7566929380169813.[0m
[32m[I 2022-04-14 14:25:22,637][0m Trial 580 finished with value: 0.6727645310691895 and parameters: {'loss': 'coxph', 'learning_rate': 0.014452118074235796, 'n_estimators': 260, 'criterion': 'friedman_mse', 'min_samples_split': 3, 'min_samples_leaf': 1, 'min_weight_fraction_leaf': 0.036589382301506754, 'min_impurity_decrease': 0.03189329949326377, 'max_features': 0.9570371131804494, 'subsample': 0.8673255757180861, 'dropout_rate': 0.39800877570095683, 'ccp_alpha': 0.20533523452460445}. Best is trial 540 with value: 0.7566929380169813.[0m
[32m[I 2022-04-14 14:25:33,918][0m Trial 581 finished with value: 0.6834721836112492 and parameters: {'loss': 'coxph', 'learning_rate': 0.017954479725734027, 'n_estimators': 321, 'criterion': 'friedman_mse', 'min_samples_split': 3, 'min_samples_leaf': 8, 'min_weight_fraction_leaf': 0.05664484868499904, 'min_impurity_decrease': 0.2639841255826675, 'max_features': 0.9362746599103562, 'subsample': 0.9030679163360327, 'dropout_rate': 0.40707984287091603, 'ccp_alpha': 0.1563713312327097}. Best is trial 540 with value: 0.7566929380169813.[0m
[32m[I 2022-04-14 14:25:43,115][0m Trial 582 finished with value: 0.7416287890961526 and parameters: {'loss': 'coxph', 'learning_rate': 0.007921421920460284, 'n_estimators': 285, 'criterion': 'friedman_mse', 'min_samples_split': 3, 'min_samples_leaf': 1, 'min_weight_fraction_leaf': 0.05889270311850326, 'min_impurity_decrease': 0.02859220619214089, 'max_features': 0.9659614562746243, 'subsample': 0.8734592551314699, 'dropout_rate': 0.3945100499300183, 'ccp_alpha': 0.09637661009740159}. Best is trial 540 with value: 0.7566929380169813.[0m
[32m[I 2022-04-14 14:25:53,753][0m Trial 583 finished with value: 0.5 and parameters: {'loss': 'coxph', 'learning_rate': 0.024571365596505405, 'n_estimators': 307, 'criterion': 'friedman_mse', 'min_samples_split': 3, 'min_samples_leaf': 1, 'min_weight_fraction_leaf': 0.044815768764255436, 'min_impurity_decrease': 0.3904332031607605, 'max_features': 0.9671009938741256, 'subsample': 0.849951709705242, 'dropout_rate': 0.3834572064254854, 'ccp_alpha': 0.6803907773111666}. Best is trial 540 with value: 0.7566929380169813.[0m
[32m[I 2022-04-14 14:25:56,538][0m Trial 584 finished with value: 0.6312278749274823 and parameters: {'loss': 'coxph', 'learning_rate': 2.9041745474503412e-05, 'n_estimators': 156, 'criterion': 'friedman_mse', 'min_samples_split': 3, 'min_samples_leaf': 1, 'min_weight_fraction_leaf': 0.0629416330624434, 'min_impurity_decrease': 0.061123558265263014, 'max_features': 0.9462584020504712, 'subsample': 0.8157200410118278, 'dropout_rate': 0.44562017634694384, 'ccp_alpha': 0.237803538519006}. Best is trial 540 with value: 0.7566929380169813.[0m
[32m[I 2022-04-14 14:26:05,581][0m Trial 585 finished with value: 0.24984902224913216 and parameters: {'loss': 'squared', 'learning_rate': 0.010870765076916691, 'n_estimators': 291, 'criterion': 'friedman_mse', 'min_samples_split': 3, 'min_samples_leaf': 1, 'min_weight_fraction_leaf': 0.07303587746251759, 'min_impurity_decrease': 0.03780469478170944, 'max_features': 0.9820691589278422, 'subsample': 0.8890645011087133, 'dropout_rate': 0.42497870444336905, 'ccp_alpha': 0.08812428159693408}. Best is trial 540 with value: 0.7566929380169813.[0m
[32m[I 2022-04-14 14:26:06,973][0m Trial 586 finished with value: 0.6990895995664648 and parameters: {'loss': 'coxph', 'learning_rate': 0.013550152426111732, 'n_estimators': 106, 'criterion': 'friedman_mse', 'min_samples_split': 3, 'min_samples_leaf': 1, 'min_weight_fraction_leaf': 0.05586487662668515, 'min_impurity_decrease': 0.08318208928161126, 'max_features': 0.9275959273178142, 'subsample': 0.8346150799719665, 'dropout_rate': 0.45040778813581067, 'ccp_alpha': 0.16655960674045955}. Best is trial 540 with value: 0.7566929380169813.[0m
[32m[I 2022-04-14 14:26:23,081][0m Trial 587 finished with value: 0.5 and parameters: {'loss': 'coxph', 'learning_rate': 1.8571603058213327e-05, 'n_estimators': 403, 'criterion': 'friedman_mse', 'min_samples_split': 4, 'min_samples_leaf': 1, 'min_weight_fraction_leaf': 0.06745612233407618, 'min_impurity_decrease': 0.020213716546736468, 'max_features': 0.9662026497632594, 'subsample': 0.8633530965822666, 'dropout_rate': 0.4849097678400559, 'ccp_alpha': 0.34195721273210083}. Best is trial 540 with value: 0.7566929380169813.[0m
[32m[I 2022-04-14 14:26:31,446][0m Trial 588 finished with value: 0.7445432020300888 and parameters: {'loss': 'coxph', 'learning_rate': 1.3727157370556257e-05, 'n_estimators': 271, 'criterion': 'friedman_mse', 'min_samples_split': 3, 'min_samples_leaf': 1, 'min_weight_fraction_leaf': 0.08117677713869684, 'min_impurity_decrease': 0.051773012000579766, 'max_features': 0.9835014739430309, 'subsample': 0.8002509427174741, 'dropout_rate': 0.3571665452159076, 'ccp_alpha': 0.09296334015802363}. Best is trial 540 with value: 0.7566929380169813.[0m
[32m[I 2022-04-14 14:26:42,138][0m Trial 589 finished with value: 0.6327243657208268 and parameters: {'loss': 'coxph', 'learning_rate': 2.3798832533491766e-06, 'n_estimators': 333, 'criterion': 'friedman_mse', 'min_samples_split': 3, 'min_samples_leaf': 1, 'min_weight_fraction_leaf': 0.07561897950716068, 'min_impurity_decrease': 0.06544293022927322, 'max_features': 0.9492220037807169, 'subsample': 0.8272360311549918, 'dropout_rate': 0.4703641397484577, 'ccp_alpha': 0.22657450177213473}. Best is trial 540 with value: 0.7566929380169813.[0m
[32m[I 2022-04-14 14:26:52,406][0m Trial 590 finished with value: 0.7548590786855233 and parameters: {'loss': 'coxph', 'learning_rate': 5.834546245928906e-06, 'n_estimators': 311, 'criterion': 'friedman_mse', 'min_samples_split': 2, 'min_samples_leaf': 1, 'min_weight_fraction_leaf': 0.06080321711168424, 'min_impurity_decrease': 0.3560251281219369, 'max_features': 0.9805783392346568, 'subsample': 0.8549868614629499, 'dropout_rate': 0.41209906406191077, 'ccp_alpha': 0.09018037620824834}. Best is trial 540 with value: 0.7566929380169813.[0m
[32m[I 2022-04-14 14:27:00,928][0m Trial 591 finished with value: 0.5 and parameters: {'loss': 'coxph', 'learning_rate': 6.55699659475451e-06, 'n_estimators': 308, 'criterion': 'absolute_error', 'min_samples_split': 2, 'min_samples_leaf': 1, 'min_weight_fraction_leaf': 0.05356298801007102, 'min_impurity_decrease': 0.4017493038562873, 'max_features': 0.9238121664514309, 'subsample': 0.8863077413129475, 'dropout_rate': 0.631234703796092, 'ccp_alpha': 0.17206384125321844}. Best is trial 540 with value: 0.7566929380169813.[0m
[32m[I 2022-04-14 14:27:12,368][0m Trial 592 finished with value: 0.7081604984979357 and parameters: {'loss': 'coxph', 'learning_rate': 7.658106461556e-06, 'n_estimators': 317, 'criterion': 'friedman_mse', 'min_samples_split': 2, 'min_samples_leaf': 1, 'min_weight_fraction_leaf': 0.027346325223847865, 'min_impurity_decrease': 0.44486350787315243, 'max_features': 0.035695607929752626, 'subsample': 0.8622101411507712, 'dropout_rate': 0.3823659636738137, 'ccp_alpha': 0.003038107955749802}. Best is trial 540 with value: 0.7566929380169813.[0m
[32m[I 2022-04-14 14:27:21,677][0m Trial 593 finished with value: 0.5 and parameters: {'loss': 'coxph', 'learning_rate': 4.989755739404951e-06, 'n_estimators': 294, 'criterion': 'friedman_mse', 'min_samples_split': 2, 'min_samples_leaf': 1, 'min_weight_fraction_leaf': 0.042933088665604136, 'min_impurity_decrease': 0.49245563590819413, 'max_features': 0.9502196507527927, 'subsample': 0.9156638467227414, 'dropout_rate': 0.40894310797985883, 'ccp_alpha': 0.42538727928364367}. Best is trial 540 with value: 0.7566929380169813.[0m
[32m[I 2022-04-14 14:27:30,711][0m Trial 594 finished with value: 0.7434569114683482 and parameters: {'loss': 'coxph', 'learning_rate': 9.830234828152843e-06, 'n_estimators': 281, 'criterion': 'friedman_mse', 'min_samples_split': 2, 'min_samples_leaf': 1, 'min_weight_fraction_leaf': 0.052136478144163514, 'min_impurity_decrease': 0.2687652197894601, 'max_features': 0.9668881852155352, 'subsample': 0.8162215619161864, 'dropout_rate': 0.4095159753015142, 'ccp_alpha': 0.11943771080080925}. Best is trial 540 with value: 0.7566929380169813.[0m
[32m[I 2022-04-14 14:27:41,507][0m Trial 595 finished with value: 0.7417859112124043 and parameters: {'loss': 'coxph', 'learning_rate': 6.087904493234945e-06, 'n_estimators': 299, 'criterion': 'friedman_mse', 'min_samples_split': 2, 'min_samples_leaf': 8, 'min_weight_fraction_leaf': 0.06387007451657446, 'min_impurity_decrease': 0.30362628808314035, 'max_features': 0.9788879230485086, 'subsample': 0.854815614115544, 'dropout_rate': 0.3662378932040947, 'ccp_alpha': 0.001328162589352278}. Best is trial 540 with value: 0.7566929380169813.[0m
[32m[I 2022-04-14 14:27:44,861][0m Trial 596 finished with value: 0.5217459622928541 and parameters: {'loss': 'coxph', 'learning_rate': 5.316305080326025e-06, 'n_estimators': 175, 'criterion': 'friedman_mse', 'min_samples_split': 2, 'min_samples_leaf': 9, 'min_weight_fraction_leaf': 0.06678873049837988, 'min_impurity_decrease': 0.2450324888572749, 'max_features': 0.9378435345834187, 'subsample': 0.8803604426041437, 'dropout_rate': 0.42386777938990056, 'ccp_alpha': 0.2686705929856282}. Best is trial 540 with value: 0.7566929380169813.[0m
[32m[I 2022-04-14 14:27:54,723][0m Trial 597 finished with value: 0.7401253998748794 and parameters: {'loss': 'coxph', 'learning_rate': 6.388515992437557e-06, 'n_estimators': 320, 'criterion': 'friedman_mse', 'min_samples_split': 2, 'min_samples_leaf': 1, 'min_weight_fraction_leaf': 0.06085678609743923, 'min_impurity_decrease': 0.33854905966428633, 'max_features': 0.9641339214866755, 'subsample': 0.8383046935961906, 'dropout_rate': 0.5040177774438143, 'ccp_alpha': 0.09234692901765394}. Best is trial 540 with value: 0.7566929380169813.[0m
[32m[I 2022-04-14 14:28:04,818][0m Trial 598 finished with value: 0.7076416088933015 and parameters: {'loss': 'coxph', 'learning_rate': 1.149097697331559e-05, 'n_estimators': 307, 'criterion': 'friedman_mse', 'min_samples_split': 4, 'min_samples_leaf': 1, 'min_weight_fraction_leaf': 0.07209064088291532, 'min_impurity_decrease': 0.4907993031334952, 'max_features': 0.981154133163209, 'subsample': 0.8037797337918168, 'dropout_rate': 0.45750799229238553, 'ccp_alpha': 0.18228380619848938}. Best is trial 540 with value: 0.7566929380169813.[0m
[32m[I 2022-04-14 14:28:16,698][0m Trial 599 finished with value: 0.7546721349997211 and parameters: {'loss': 'coxph', 'learning_rate': 0.052401432741685766, 'n_estimators': 333, 'criterion': 'friedman_mse', 'min_samples_split': 2, 'min_samples_leaf': 1, 'min_weight_fraction_leaf': 0.047031330113697235, 'min_impurity_decrease': 0.6254943981898832, 'max_features': 0.9185623758369678, 'subsample': 0.7746913124280403, 'dropout_rate': 0.4277476878053152, 'ccp_alpha': 0.002503999432176261}. Best is trial 540 with value: 0.7566929380169813.[0m
[32m[I 2022-04-14 14:28:29,758][0m Trial 600 finished with value: 0.7420715409590811 and parameters: {'loss': 'coxph', 'learning_rate': 0.02134793221421305, 'n_estimators': 343, 'criterion': 'friedman_mse', 'min_samples_split': 2, 'min_samples_leaf': 1, 'min_weight_fraction_leaf': 0.031117389521410372, 'min_impurity_decrease': 0.6284835121582585, 'max_features': 0.9142238602738026, 'subsample': 0.8046233183590898, 'dropout_rate': 0.3903385114992735, 'ccp_alpha': 0.09666200745982498}. Best is trial 540 with value: 0.7566929380169813.[0m
[32m[I 2022-04-14 14:28:41,201][0m Trial 601 finished with value: 0.5226740215903585 and parameters: {'loss': 'coxph', 'learning_rate': 0.04720869568669937, 'n_estimators': 329, 'criterion': 'friedman_mse', 'min_samples_split': 2, 'min_samples_leaf': 1, 'min_weight_fraction_leaf': 0.32403989155417284, 'min_impurity_decrease': 0.3672378384965742, 'max_features': 0.9282928981807893, 'subsample': 0.7767745996706025, 'dropout_rate': 0.42258624859921, 'ccp_alpha': 0.293313807406819}. Best is trial 540 with value: 0.7566929380169813.[0m
[32m[I 2022-04-14 14:28:49,891][0m Trial 602 finished with value: 0.7530397396548089 and parameters: {'loss': 'coxph', 'learning_rate': 0.0341373546522226, 'n_estimators': 344, 'criterion': 'friedman_mse', 'min_samples_split': 2, 'min_samples_leaf': 1, 'min_weight_fraction_leaf': 0.03988742450853477, 'min_impurity_decrease': 0.674613578295493, 'max_features': 0.9111784276798003, 'subsample': 0.7762259624285809, 'dropout_rate': 0.6815419032803245, 'ccp_alpha': 0.0030653721702820482}. Best is trial 540 with value: 0.7566929380169813.[0m
