[32m[I 2022-04-13 11:44:13,539][0m Trial 441 finished with value: 0.8536735077998788 and parameters: {'splitter': 'random', 'min_samples_split': 0.27079966964979085, 'min_samples_leaf': 0.0029695257092496336, 'min_weight_fraction_leaf': 0.08421898653903888, 'max_features': 0.5713097953637046}. Best is trial 156 with value: 0.860262530255716.[0m
[32m[I 2022-04-13 11:44:13,579][0m Trial 442 finished with value: 0.8537871744804019 and parameters: {'splitter': 'random', 'min_samples_split': 0.28119140699428397, 'min_samples_leaf': 0.06883213101942293, 'min_weight_fraction_leaf': 0.047828491003964385, 'max_features': 0.5167710024158073}. Best is trial 156 with value: 0.860262530255716.[0m
[32m[I 2022-04-13 11:44:13,618][0m Trial 443 finished with value: 0.7865929809567938 and parameters: {'splitter': 'random', 'min_samples_split': 0.3037836546491831, 'min_samples_leaf': 0.05888997969705964, 'min_weight_fraction_leaf': 0.06787183408895471, 'max_features': 0.498804143604613}. Best is trial 156 with value: 0.860262530255716.[0m
[32m[I 2022-04-13 11:44:13,660][0m Trial 444 finished with value: 0.8540625504336059 and parameters: {'splitter': 'random', 'min_samples_split': 0.27390367450311126, 'min_samples_leaf': 0.0015307686621638392, 'min_weight_fraction_leaf': 0.019161977091095402, 'max_features': 0.5559643888841491}. Best is trial 156 with value: 0.860262530255716.[0m
[32m[I 2022-04-13 11:44:13,700][0m Trial 445 finished with value: 0.7865929809567938 and parameters: {'splitter': 'random', 'min_samples_split': 0.26347583588182083, 'min_samples_leaf': 0.047762452409140864, 'min_weight_fraction_leaf': 0.07572951457300706, 'max_features': 0.49951816137014177}. Best is trial 156 with value: 0.860262530255716.[0m
[32m[I 2022-04-13 11:44:13,773][0m Trial 446 finished with value: 0.7161933098995149 and parameters: {'splitter': 'random', 'min_samples_split': 0.24966468402783992, 'min_samples_leaf': 0.01568021178750467, 'min_weight_fraction_leaf': 0.499976212684654, 'max_features': 0.629664869691534}. Best is trial 156 with value: 0.860262530255716.[0m
[32m[I 2022-04-13 11:44:13,878][0m Trial 447 finished with value: 0.8495779719052834 and parameters: {'splitter': 'random', 'min_samples_split': 0.290665785666338, 'min_samples_leaf': 0.03955367651041289, 'min_weight_fraction_leaf': 0.057726735430987344, 'max_features': 0.5127290224113944}. Best is trial 156 with value: 0.860262530255716.[0m
[32m[I 2022-04-13 11:44:13,962][0m Trial 448 finished with value: 0.860262530255716 and parameters: {'splitter': 'random', 'min_samples_split': 0.2647652194660805, 'min_samples_leaf': 0.025950769997071195, 'min_weight_fraction_leaf': 0.04480465066911342, 'max_features': 0.5852915679826416}. Best is trial 156 with value: 0.860262530255716.[0m
[32m[I 2022-04-13 11:44:14,053][0m Trial 449 finished with value: 0.8544192216908126 and parameters: {'splitter': 'random', 'min_samples_split': 0.2471471100837349, 'min_samples_leaf': 0.017797308464356145, 'min_weight_fraction_leaf': 0.03031973576564775, 'max_features': 0.526144707725421}. Best is trial 156 with value: 0.860262530255716.[0m
[32m[I 2022-04-13 11:44:14,143][0m Trial 450 finished with value: 0.7279780050078963 and parameters: {'splitter': 'best', 'min_samples_split': 0.4568130221159735, 'min_samples_leaf': 0.03152496797664, 'min_weight_fraction_leaf': 0.0436837576838267, 'max_features': 0.5429717056065946}. Best is trial 156 with value: 0.860262530255716.[0m
[32m[I 2022-04-13 11:44:14,220][0m Trial 451 finished with value: 0.8490198370094999 and parameters: {'splitter': 'random', 'min_samples_split': 0.2563276663626039, 'min_samples_leaf': 0.011679211291325278, 'min_weight_fraction_leaf': 0.07946913033699593, 'max_features': 0.5173064780081926}. Best is trial 156 with value: 0.860262530255716.[0m
[32m[I 2022-04-13 11:44:14,289][0m Trial 452 finished with value: 0.6188081862944745 and parameters: {'splitter': 'random', 'min_samples_split': 0.26541931850144884, 'min_samples_leaf': 0.06981769913275043, 'min_weight_fraction_leaf': 0.3386393113851669, 'max_features': 0.5690465289605949}. Best is trial 156 with value: 0.860262530255716.[0m
[32m[I 2022-04-13 11:44:14,336][0m Trial 453 finished with value: 0.6188081862944745 and parameters: {'splitter': 'random', 'min_samples_split': 0.3165179156379314, 'min_samples_leaf': 0.3430534181812942, 'min_weight_fraction_leaf': 0.06523200758014085, 'max_features': 0.5717731507609647}. Best is trial 156 with value: 0.860262530255716.[0m
[32m[I 2022-04-13 11:44:14,411][0m Trial 454 finished with value: 0.7999200547726107 and parameters: {'splitter': 'random', 'min_samples_split': 0.2806974520209118, 'min_samples_leaf': 0.039407914627606566, 'min_weight_fraction_leaf': 0.06173050314601305, 'max_features': 0.47457374468094293}. Best is trial 156 with value: 0.860262530255716.[0m
[32m[I 2022-04-13 11:44:14,492][0m Trial 455 finished with value: 0.8495779719052834 and parameters: {'splitter': 'random', 'min_samples_split': 0.2979080299608201, 'min_samples_leaf': 0.009394278498914485, 'min_weight_fraction_leaf': 0.03443772330916102, 'max_features': 0.5977671845234588}. Best is trial 156 with value: 0.860262530255716.[0m
[32m[I 2022-04-13 11:44:14,563][0m Trial 456 finished with value: 0.8109417480001758 and parameters: {'splitter': 'random', 'min_samples_split': 0.2834826636683302, 'min_samples_leaf': 0.04833627023120514, 'min_weight_fraction_leaf': 0.06875833430757701, 'max_features': 0.6509574292369653}. Best is trial 156 with value: 0.860262530255716.[0m
[32m[I 2022-04-13 11:44:14,616][0m Trial 457 finished with value: 0.7203943081692755 and parameters: {'splitter': 'random', 'min_samples_split': 0.24193152363449502, 'min_samples_leaf': 0.2308085339857266, 'min_weight_fraction_leaf': 0.048252455313745744, 'max_features': 0.5433564225917397}. Best is trial 156 with value: 0.860262530255716.[0m
[32m[I 2022-04-13 11:44:14,674][0m Trial 458 finished with value: 0.8541689983710665 and parameters: {'splitter': 'random', 'min_samples_split': 0.226683992451064, 'min_samples_leaf': 0.024002144889012138, 'min_weight_fraction_leaf': 0.04700024948619893, 'max_features': 0.5948971970689254}. Best is trial 156 with value: 0.860262530255716.[0m
[32m[I 2022-04-13 11:44:14,751][0m Trial 459 finished with value: 0.860262530255716 and parameters: {'splitter': 'random', 'min_samples_split': 0.2761329189059844, 'min_samples_leaf': 0.034339560832308554, 'min_weight_fraction_leaf': 0.05900524713583128, 'max_features': 0.5755588796621897}. Best is trial 156 with value: 0.860262530255716.[0m
[32m[I 2022-04-13 11:44:14,826][0m Trial 460 finished with value: 0.855608859465337 and parameters: {'splitter': 'random', 'min_samples_split': 0.25698562090062016, 'min_samples_leaf': 0.02728392259476467, 'min_weight_fraction_leaf': 0.054114279048661396, 'max_features': 0.5915876995064768}. Best is trial 156 with value: 0.860262530255716.[0m
[32m[I 2022-04-13 11:44:14,906][0m Trial 461 finished with value: 0.7999200547726107 and parameters: {'splitter': 'random', 'min_samples_split': 0.29004971013482633, 'min_samples_leaf': 0.03839106730379925, 'min_weight_fraction_leaf': 0.06204665492463226, 'max_features': 0.4984061948431796}. Best is trial 156 with value: 0.860262530255716.[0m
[32m[I 2022-04-13 11:44:14,984][0m Trial 462 finished with value: 0.7426175290362615 and parameters: {'splitter': 'random', 'min_samples_split': 0.27658188972790965, 'min_samples_leaf': 0.19939959081533887, 'min_weight_fraction_leaf': 0.029729332984306914, 'max_features': 0.529683979476334}. Best is trial 156 with value: 0.860262530255716.[0m
[32m[I 2022-04-13 11:44:15,054][0m Trial 463 finished with value: 0.855608859465337 and parameters: {'splitter': 'random', 'min_samples_split': 0.25953763879468145, 'min_samples_leaf': 0.012841861609054933, 'min_weight_fraction_leaf': 0.03950608367999993, 'max_features': 0.5511747817738525}. Best is trial 156 with value: 0.860262530255716.[0m
[32m[I 2022-04-13 11:44:15,133][0m Trial 464 finished with value: 0.8555617056756446 and parameters: {'splitter': 'random', 'min_samples_split': 0.2665959555544722, 'min_samples_leaf': 0.0347225714300758, 'min_weight_fraction_leaf': 0.018449353320644506, 'max_features': 0.5639040615813348}. Best is trial 156 with value: 0.860262530255716.[0m
[32m[I 2022-04-13 11:44:15,202][0m Trial 465 finished with value: 0.7999200547726107 and parameters: {'splitter': 'random', 'min_samples_split': 0.2691649656820251, 'min_samples_leaf': 0.030113780105985172, 'min_weight_fraction_leaf': 0.04990548490474616, 'max_features': 0.4885954605468499}. Best is trial 156 with value: 0.860262530255716.[0m
[32m[I 2022-04-13 11:44:15,277][0m Trial 466 finished with value: 0.8537871744804019 and parameters: {'splitter': 'random', 'min_samples_split': 0.28367566364133273, 'min_samples_leaf': 0.010994622361206421, 'min_weight_fraction_leaf': 0.07347571719317392, 'max_features': 0.6200306725823422}. Best is trial 156 with value: 0.860262530255716.[0m
[32m[I 2022-04-13 11:44:15,346][0m Trial 467 finished with value: 0.8495779719052834 and parameters: {'splitter': 'random', 'min_samples_split': 0.2920582031163569, 'min_samples_leaf': 0.04465438338802793, 'min_weight_fraction_leaf': 0.06613019794670816, 'max_features': 0.5026507907942861}. Best is trial 156 with value: 0.860262530255716.[0m
[32m[I 2022-04-13 11:44:15,418][0m Trial 468 finished with value: 0.8440870485198803 and parameters: {'splitter': 'best', 'min_samples_split': 0.25244764015673193, 'min_samples_leaf': 0.016895043666885372, 'min_weight_fraction_leaf': 0.0908422027255654, 'max_features': 0.587886351947551}. Best is trial 156 with value: 0.860262530255716.[0m
[32m[I 2022-04-13 11:44:15,459][0m Trial 469 finished with value: 0.8555617056756446 and parameters: {'splitter': 'random', 'min_samples_split': 0.27155003442659803, 'min_samples_leaf': 0.003329965028725003, 'min_weight_fraction_leaf': 0.030335700648276512, 'max_features': 0.5190601855614765}. Best is trial 156 with value: 0.860262530255716.[0m
[32m[I 2022-04-13 11:44:15,526][0m Trial 470 finished with value: 0.8537871744804019 and parameters: {'splitter': 'random', 'min_samples_split': 0.27955817525819854, 'min_samples_leaf': 0.04718286326176482, 'min_weight_fraction_leaf': 0.07547755663168915, 'max_features': 0.511066860272502}. Best is trial 156 with value: 0.860262530255716.[0m
[32m[I 2022-04-13 11:44:15,583][0m Trial 471 finished with value: 0.678946779212211 and parameters: {'splitter': 'random', 'min_samples_split': 0.30220440074589755, 'min_samples_leaf': 0.016097284753313554, 'min_weight_fraction_leaf': 0.07988933917830801, 'max_features': 0.46450284901681915}. Best is trial 156 with value: 0.860262530255716.[0m
[32m[I 2022-04-13 11:44:15,652][0m Trial 472 finished with value: 0.855608859465337 and parameters: {'splitter': 'random', 'min_samples_split': 0.26167097202470324, 'min_samples_leaf': 0.03291903165394566, 'min_weight_fraction_leaf': 0.04276455438766199, 'max_features': 0.5265316776913491}. Best is trial 156 with value: 0.860262530255716.[0m
[32m[I 2022-04-13 11:44:15,716][0m Trial 473 finished with value: 0.718315820651561 and parameters: {'splitter': 'random', 'min_samples_split': 0.27377398236789613, 'min_samples_leaf': 0.012128864110403061, 'min_weight_fraction_leaf': 0.2630346961938936, 'max_features': 0.5329245089678145}. Best is trial 156 with value: 0.860262530255716.[0m
[32m[I 2022-04-13 11:44:15,779][0m Trial 474 finished with value: 0.8505561676607082 and parameters: {'splitter': 'random', 'min_samples_split': 0.24919390490774068, 'min_samples_leaf': 0.016667622892909503, 'min_weight_fraction_leaf': 0.10857930656384217, 'max_features': 0.55415965767503}. Best is trial 156 with value: 0.860262530255716.[0m
[32m[I 2022-04-13 11:44:15,837][0m Trial 475 finished with value: 0.8541689983710665 and parameters: {'splitter': 'random', 'min_samples_split': 0.2427606701658711, 'min_samples_leaf': 0.0602481187522413, 'min_weight_fraction_leaf': 0.053411507060148515, 'max_features': 0.5746801344140713}. Best is trial 156 with value: 0.860262530255716.[0m
[32m[I 2022-04-13 11:44:15,877][0m Trial 476 finished with value: 0.8537871744804019 and parameters: {'splitter': 'random', 'min_samples_split': 0.2862851019338039, 'min_samples_leaf': 0.034116178896642764, 'min_weight_fraction_leaf': 0.05697124170021669, 'max_features': 0.5420930264084298}. Best is trial 156 with value: 0.860262530255716.[0m
[32m[I 2022-04-13 11:44:15,916][0m Trial 477 finished with value: 0.8169418604210963 and parameters: {'splitter': 'random', 'min_samples_split': 0.2740633178638278, 'min_samples_leaf': 0.0757655271619236, 'min_weight_fraction_leaf': 0.07090525140178906, 'max_features': 0.6386235200412601}. Best is trial 156 with value: 0.860262530255716.[0m
[32m[I 2022-04-13 11:44:15,956][0m Trial 478 finished with value: 0.8130158757335355 and parameters: {'splitter': 'random', 'min_samples_split': 0.2756711891413379, 'min_samples_leaf': 0.0015765287114253082, 'min_weight_fraction_leaf': 0.03926277372986907, 'max_features': 0.4818900854465634}. Best is trial 156 with value: 0.860262530255716.[0m
[32m[I 2022-04-13 11:44:15,997][0m Trial 479 finished with value: 0.7917045353064339 and parameters: {'splitter': 'random', 'min_samples_split': 0.2681527745347339, 'min_samples_leaf': 0.025512324401241786, 'min_weight_fraction_leaf': 0.05248800187203531, 'max_features': 0.17126107650156702}. Best is trial 156 with value: 0.860262530255716.[0m
[32m[I 2022-04-13 11:44:16,037][0m Trial 480 finished with value: 0.8490198370094999 and parameters: {'splitter': 'random', 'min_samples_split': 0.2619464186777642, 'min_samples_leaf': 0.008109831866951906, 'min_weight_fraction_leaf': 0.07905811763168233, 'max_features': 0.5256531927391809}. Best is trial 156 with value: 0.860262530255716.[0m
[32m[I 2022-04-13 11:44:16,077][0m Trial 481 finished with value: 0.8490198370094999 and parameters: {'splitter': 'random', 'min_samples_split': 0.2532968968120799, 'min_samples_leaf': 0.019761563914787526, 'min_weight_fraction_leaf': 0.08928020248262006, 'max_features': 0.5626489292138017}. Best is trial 156 with value: 0.860262530255716.[0m
[32m[I 2022-04-13 11:44:16,117][0m Trial 482 finished with value: 0.8490198370094999 and parameters: {'splitter': 'random', 'min_samples_split': 0.2552516716127372, 'min_samples_leaf': 0.023367121860929634, 'min_weight_fraction_leaf': 0.08994822943602344, 'max_features': 0.563397719130707}. Best is trial 156 with value: 0.860262530255716.[0m
[32m[I 2022-04-13 11:44:16,157][0m Trial 483 finished with value: 0.8511422756105386 and parameters: {'splitter': 'random', 'min_samples_split': 0.23263826949233538, 'min_samples_leaf': 0.018572020490406443, 'min_weight_fraction_leaf': 0.09926496318504874, 'max_features': 0.561534538180128}. Best is trial 156 with value: 0.860262530255716.[0m
[32m[I 2022-04-13 11:44:16,197][0m Trial 484 finished with value: 0.8536735077998788 and parameters: {'splitter': 'random', 'min_samples_split': 0.264010444158475, 'min_samples_leaf': 0.020664559766026262, 'min_weight_fraction_leaf': 0.08208083783655787, 'max_features': 0.6082741994587639}. Best is trial 156 with value: 0.860262530255716.[0m
[32m[I 2022-04-13 11:44:16,237][0m Trial 485 finished with value: 0.8537871744804019 and parameters: {'splitter': 'random', 'min_samples_split': 0.28532548032670535, 'min_samples_leaf': 0.05124774687062422, 'min_weight_fraction_leaf': 0.0673706746689027, 'max_features': 0.6104383085230448}. Best is trial 156 with value: 0.860262530255716.[0m
[32m[I 2022-04-13 11:44:16,276][0m Trial 486 finished with value: 0.7999200547726107 and parameters: {'splitter': 'random', 'min_samples_split': 0.29697826385368553, 'min_samples_leaf': 0.042301104007090536, 'min_weight_fraction_leaf': 0.06023742055505157, 'max_features': 0.4965152426146137}. Best is trial 156 with value: 0.860262530255716.[0m
[32m[I 2022-04-13 11:44:16,316][0m Trial 487 finished with value: 0.8515949699867061 and parameters: {'splitter': 'random', 'min_samples_split': 0.3092337963981013, 'min_samples_leaf': 0.03395505367752614, 'min_weight_fraction_leaf': 0.042686064508872655, 'max_features': 0.5443960291074841}. Best is trial 156 with value: 0.860262530255716.[0m
[32m[I 2022-04-13 11:44:16,368][0m Trial 488 finished with value: 0.8479544019395597 and parameters: {'splitter': 'best', 'min_samples_split': 0.2629730360201204, 'min_samples_leaf': 0.06543065121354019, 'min_weight_fraction_leaf': 0.06813703892427525, 'max_features': 0.5116217009935985}. Best is trial 156 with value: 0.860262530255716.[0m
[32m[I 2022-04-13 11:44:16,439][0m Trial 489 finished with value: 0.8537871744804019 and parameters: {'splitter': 'random', 'min_samples_split': 0.28536281972040756, 'min_samples_leaf': 0.036030241923337786, 'min_weight_fraction_leaf': 0.047464024141684706, 'max_features': 0.5298232222339846}. Best is trial 156 with value: 0.860262530255716.[0m
[32m[I 2022-04-13 11:44:16,520][0m Trial 490 finished with value: 0.7999200547726107 and parameters: {'splitter': 'random', 'min_samples_split': 0.27828105507602, 'min_samples_leaf': 0.03757208444507315, 'min_weight_fraction_leaf': 0.058729992435168715, 'max_features': 0.4879063335750276}. Best is trial 156 with value: 0.860262530255716.[0m
[32m[I 2022-04-13 11:44:16,611][0m Trial 491 finished with value: 0.8544192216908126 and parameters: {'splitter': 'random', 'min_samples_split': 0.24806308140584676, 'min_samples_leaf': 0.025758396722052372, 'min_weight_fraction_leaf': 0.02833673481801906, 'max_features': 0.5424450571278846}. Best is trial 156 with value: 0.860262530255716.[0m
[32m[I 2022-04-13 11:44:16,684][0m Trial 492 finished with value: 0.8495779719052834 and parameters: {'splitter': 'random', 'min_samples_split': 0.29189882781599175, 'min_samples_leaf': 0.029582242834923077, 'min_weight_fraction_leaf': 0.052518301202867115, 'max_features': 0.5466780371322176}. Best is trial 156 with value: 0.860262530255716.[0m
[32m[I 2022-04-13 11:44:16,763][0m Trial 493 finished with value: 0.8547474595641333 and parameters: {'splitter': 'random', 'min_samples_split': 0.26678963270285655, 'min_samples_leaf': 0.0010646951459271463, 'min_weight_fraction_leaf': 0.09956066731843334, 'max_features': 0.5190879468377585}. Best is trial 156 with value: 0.860262530255716.[0m
[32m[I 2022-04-13 11:44:16,856][0m Trial 494 finished with value: 0.860262530255716 and parameters: {'splitter': 'random', 'min_samples_split': 0.27366262515290946, 'min_samples_leaf': 0.03999752447007452, 'min_weight_fraction_leaf': 0.0728958139759667, 'max_features': 0.5070174083339484}. Best is trial 156 with value: 0.860262530255716.[0m
[32m[I 2022-04-13 11:44:16,930][0m Trial 495 finished with value: 0.8484399756279405 and parameters: {'splitter': 'random', 'min_samples_split': 0.2429151281889229, 'min_samples_leaf': 0.018070899314049184, 'min_weight_fraction_leaf': 0.08713577538777528, 'max_features': 0.5855405009689847}. Best is trial 156 with value: 0.860262530255716.[0m
[32m[I 2022-04-13 11:44:17,020][0m Trial 496 finished with value: 0.8497697773353806 and parameters: {'splitter': 'random', 'min_samples_split': 0.25664747830316553, 'min_samples_leaf': 0.01092880284444868, 'min_weight_fraction_leaf': 0.14217693527422987, 'max_features': 0.5901821409351259}. Best is trial 156 with value: 0.860262530255716.[0m
[32m[I 2022-04-13 11:44:17,105][0m Trial 497 finished with value: 0.7856072505806138 and parameters: {'splitter': 'random', 'min_samples_split': 0.27930965202403774, 'min_samples_leaf': 0.05338198013799371, 'min_weight_fraction_leaf': 0.035583450585528115, 'max_features': 0.29646779998137107}. Best is trial 156 with value: 0.860262530255716.[0m
[32m[I 2022-04-13 11:44:17,190][0m Trial 498 finished with value: 0.8495779719052834 and parameters: {'splitter': 'random', 'min_samples_split': 0.2916093353858688, 'min_samples_leaf': 0.04478796670762339, 'min_weight_fraction_leaf': 0.07787364872927004, 'max_features': 0.5776001787300453}. Best is trial 156 with value: 0.860262530255716.[0m
[32m[I 2022-04-13 11:44:17,273][0m Trial 499 finished with value: 0.8511422756105386 and parameters: {'splitter': 'random', 'min_samples_split': 0.21660742079569575, 'min_samples_leaf': 0.009315422660598437, 'min_weight_fraction_leaf': 0.097073930359762, 'max_features': 0.6008379986873957}. Best is trial 156 with value: 0.860262530255716.[0m
[32m[I 2022-04-13 11:44:17,367][0m Trial 500 finished with value: 0.8490198370094999 and parameters: {'splitter': 'random', 'min_samples_split': 0.2616511425236725, 'min_samples_leaf': 0.0018710626053586032, 'min_weight_fraction_leaf': 0.08412146844150542, 'max_features': 0.5827342036296863}. Best is trial 156 with value: 0.860262530255716.[0m
[32m[I 2022-04-13 11:44:17,453][0m Trial 501 finished with value: 0.860262530255716 and parameters: {'splitter': 'random', 'min_samples_split': 0.26570387988897687, 'min_samples_leaf': 0.01654367788032613, 'min_weight_fraction_leaf': 0.0488503255730789, 'max_features': 0.5162635478777448}. Best is trial 156 with value: 0.860262530255716.[0m
[32m[I 2022-04-13 11:44:17,531][0m Trial 502 finished with value: 0.7639172235300087 and parameters: {'splitter': 'random', 'min_samples_split': 0.25374152032829866, 'min_samples_leaf': 0.03001598420536316, 'min_weight_fraction_leaf': 0.05914843804259845, 'max_features': 0.06109417577653531}. Best is trial 156 with value: 0.860262530255716.[0m
[32m[I 2022-04-13 11:44:17,595][0m Trial 503 finished with value: 0.7445764336842451 and parameters: {'splitter': 'random', 'min_samples_split': 0.2786777612729314, 'min_samples_leaf': 0.16036817031989403, 'min_weight_fraction_leaf': 0.047700312427467605, 'max_features': 0.5717682242153441}. Best is trial 156 with value: 0.860262530255716.[0m
