[32m[I 2022-04-13 17:02:44,104][0m Trial 202 finished with value: 0.8635401907425809 and parameters: {'loss': 'coxph', 'learning_rate': 0.0011581303634939427, 'n_estimators': 992, 'criterion': 'friedman_mse', 'min_samples_split': 3, 'min_samples_leaf': 6, 'min_weight_fraction_leaf': 0.11828041193622739, 'min_impurity_decrease': 0.1605722318221372, 'max_features': 0.9350022925074003, 'subsample': 0.6189483618284527, 'dropout_rate': 0.20559366892785053, 'ccp_alpha': 0.020333920163996967}. Best is trial 195 with value: 0.8677554679559382.[0m
[32m[I 2022-04-13 17:05:24,143][0m Trial 203 finished with value: 0.8617410174248119 and parameters: {'loss': 'coxph', 'learning_rate': 0.0014019708083211897, 'n_estimators': 851, 'criterion': 'friedman_mse', 'min_samples_split': 3, 'min_samples_leaf': 6, 'min_weight_fraction_leaf': 0.1520300054215125, 'min_impurity_decrease': 0.1442503515237887, 'max_features': 0.9938832031480068, 'subsample': 0.6598512534893783, 'dropout_rate': 0.1809029788169164, 'ccp_alpha': 0.010181937781959007}. Best is trial 195 with value: 0.8677554679559382.[0m
[32m[I 2022-04-13 17:08:21,883][0m Trial 204 finished with value: 0.8544181373516742 and parameters: {'loss': 'coxph', 'learning_rate': 0.0018160419967359115, 'n_estimators': 905, 'criterion': 'friedman_mse', 'min_samples_split': 3, 'min_samples_leaf': 6, 'min_weight_fraction_leaf': 0.14594871891041622, 'min_impurity_decrease': 0.12271750606422957, 'max_features': 0.994293695998006, 'subsample': 0.5885128536401206, 'dropout_rate': 0.16211336379222482, 'ccp_alpha': 0.24362239494424176}. Best is trial 195 with value: 0.8677554679559382.[0m
[32m[I 2022-04-13 17:11:10,002][0m Trial 205 finished with value: 0.8520775141747036 and parameters: {'loss': 'coxph', 'learning_rate': 0.0009983834660382144, 'n_estimators': 856, 'criterion': 'friedman_mse', 'min_samples_split': 3, 'min_samples_leaf': 6, 'min_weight_fraction_leaf': 0.13171426604651407, 'min_impurity_decrease': 0.10815273943946095, 'max_features': 0.9709762300646241, 'subsample': 0.6366587358850158, 'dropout_rate': 0.13079430883617887, 'ccp_alpha': 0.24471339563919275}. Best is trial 195 with value: 0.8677554679559382.[0m
[32m[I 2022-04-13 17:13:41,536][0m Trial 206 finished with value: 0.871061040295516 and parameters: {'loss': 'coxph', 'learning_rate': 0.0013144251031372853, 'n_estimators': 822, 'criterion': 'friedman_mse', 'min_samples_split': 3, 'min_samples_leaf': 6, 'min_weight_fraction_leaf': 0.09656235936115726, 'min_impurity_decrease': 0.09974079651349611, 'max_features': 0.9047643183623305, 'subsample': 0.6727441452526376, 'dropout_rate': 0.1485914429166503, 'ccp_alpha': 0.07934273812851658}. Best is trial 206 with value: 0.871061040295516.[0m
[32m[I 2022-04-13 17:16:23,119][0m Trial 207 finished with value: 0.866352526947964 and parameters: {'loss': 'coxph', 'learning_rate': 0.0012867661272696889, 'n_estimators': 833, 'criterion': 'friedman_mse', 'min_samples_split': 3, 'min_samples_leaf': 6, 'min_weight_fraction_leaf': 0.10407935403413887, 'min_impurity_decrease': 0.09408444191284865, 'max_features': 0.9559529591901272, 'subsample': 0.6704280561187853, 'dropout_rate': 0.14490874184006897, 'ccp_alpha': 0.004636763621429004}. Best is trial 206 with value: 0.871061040295516.[0m
[32m[I 2022-04-13 17:18:46,109][0m Trial 208 finished with value: 0.8669682292394187 and parameters: {'loss': 'coxph', 'learning_rate': 0.0019174372101392072, 'n_estimators': 821, 'criterion': 'friedman_mse', 'min_samples_split': 3, 'min_samples_leaf': 6, 'min_weight_fraction_leaf': 0.08890902860339606, 'min_impurity_decrease': 0.18280518948305158, 'max_features': 0.9540586139298783, 'subsample': 0.6710477069209326, 'dropout_rate': 0.16619121607069773, 'ccp_alpha': 0.0032631011830357437}. Best is trial 206 with value: 0.871061040295516.[0m
[32m[I 2022-04-13 17:21:48,358][0m Trial 209 finished with value: 0.867762166753922 and parameters: {'loss': 'coxph', 'learning_rate': 0.001952661277716343, 'n_estimators': 895, 'criterion': 'friedman_mse', 'min_samples_split': 3, 'min_samples_leaf': 6, 'min_weight_fraction_leaf': 0.0827462192840564, 'min_impurity_decrease': 0.17897088085094487, 'max_features': 0.9606892764963803, 'subsample': 0.6785481226030587, 'dropout_rate': 0.21626939093472947, 'ccp_alpha': 0.015116976502843965}. Best is trial 206 with value: 0.871061040295516.[0m
[32m[I 2022-04-13 17:24:15,818][0m Trial 210 finished with value: 0.8674109920682594 and parameters: {'loss': 'coxph', 'learning_rate': 0.0021589724165332505, 'n_estimators': 839, 'criterion': 'friedman_mse', 'min_samples_split': 3, 'min_samples_leaf': 6, 'min_weight_fraction_leaf': 0.09313651082724601, 'min_impurity_decrease': 0.11654976689027864, 'max_features': 0.9531581804985587, 'subsample': 0.6791975160741083, 'dropout_rate': 0.21035236859149734, 'ccp_alpha': 0.007889168332149421}. Best is trial 206 with value: 0.871061040295516.[0m
[32m[I 2022-04-13 17:26:39,641][0m Trial 211 finished with value: 0.8689973349126063 and parameters: {'loss': 'coxph', 'learning_rate': 0.0018201258388433881, 'n_estimators': 835, 'criterion': 'friedman_mse', 'min_samples_split': 3, 'min_samples_leaf': 6, 'min_weight_fraction_leaf': 0.10231712563807373, 'min_impurity_decrease': 0.18606685268173734, 'max_features': 0.9449379351806004, 'subsample': 0.6740177775959195, 'dropout_rate': 0.19316802927134544, 'ccp_alpha': 0.001362304100924281}. Best is trial 206 with value: 0.871061040295516.[0m
[32m[I 2022-04-13 17:28:52,090][0m Trial 212 finished with value: 0.8646473311619746 and parameters: {'loss': 'coxph', 'learning_rate': 0.002285609648548848, 'n_estimators': 835, 'criterion': 'friedman_mse', 'min_samples_split': 3, 'min_samples_leaf': 6, 'min_weight_fraction_leaf': 0.09624655602389826, 'min_impurity_decrease': 0.18283468340029846, 'max_features': 0.9596151527241401, 'subsample': 0.6441478105229919, 'dropout_rate': 0.23277693305142272, 'ccp_alpha': 0.0029070928182180055}. Best is trial 206 with value: 0.871061040295516.[0m
[32m[I 2022-04-13 17:31:42,997][0m Trial 213 finished with value: 0.8683508799192549 and parameters: {'loss': 'coxph', 'learning_rate': 0.0018829028028038485, 'n_estimators': 904, 'criterion': 'friedman_mse', 'min_samples_split': 3, 'min_samples_leaf': 6, 'min_weight_fraction_leaf': 0.1047351516584171, 'min_impurity_decrease': 0.2410015005774943, 'max_features': 0.9478614458260999, 'subsample': 0.6740643843352236, 'dropout_rate': 0.1694636660595709, 'ccp_alpha': 0.012070388515330611}. Best is trial 206 with value: 0.871061040295516.[0m
[32m[I 2022-04-13 17:33:56,981][0m Trial 214 finished with value: 0.8681615102083411 and parameters: {'loss': 'coxph', 'learning_rate': 0.0021747146112614277, 'n_estimators': 827, 'criterion': 'friedman_mse', 'min_samples_split': 3, 'min_samples_leaf': 6, 'min_weight_fraction_leaf': 0.08948008528769709, 'min_impurity_decrease': 0.24186879510855633, 'max_features': 0.9505313861681324, 'subsample': 0.6752979963759171, 'dropout_rate': 0.198057776468253, 'ccp_alpha': 0.008541474593083442}. Best is trial 206 with value: 0.871061040295516.[0m
[32m[I 2022-04-13 17:36:19,583][0m Trial 215 finished with value: 0.8689973349126063 and parameters: {'loss': 'coxph', 'learning_rate': 0.0023239811457886426, 'n_estimators': 833, 'criterion': 'friedman_mse', 'min_samples_split': 3, 'min_samples_leaf': 6, 'min_weight_fraction_leaf': 0.09308289974520696, 'min_impurity_decrease': 0.2508903397482636, 'max_features': 0.9487856704075549, 'subsample': 0.6753674680260123, 'dropout_rate': 0.22004082959252078, 'ccp_alpha': 0.0014983314006231895}. Best is trial 206 with value: 0.871061040295516.[0m
[32m[I 2022-04-13 17:38:40,863][0m Trial 216 finished with value: 0.8680511261497108 and parameters: {'loss': 'coxph', 'learning_rate': 0.002215941768451982, 'n_estimators': 844, 'criterion': 'friedman_mse', 'min_samples_split': 3, 'min_samples_leaf': 6, 'min_weight_fraction_leaf': 0.09634918777672107, 'min_impurity_decrease': 0.22662235848694937, 'max_features': 0.952029004022635, 'subsample': 0.6755737843641068, 'dropout_rate': 0.22323365500115122, 'ccp_alpha': 0.007415583398645745}. Best is trial 206 with value: 0.871061040295516.[0m
[32m[I 2022-04-13 17:41:29,582][0m Trial 217 finished with value: 0.8667709208116288 and parameters: {'loss': 'coxph', 'learning_rate': 0.002175193539597473, 'n_estimators': 889, 'criterion': 'friedman_mse', 'min_samples_split': 3, 'min_samples_leaf': 6, 'min_weight_fraction_leaf': 0.09358761015971576, 'min_impurity_decrease': 0.21971263429772023, 'max_features': 0.9471719412771166, 'subsample': 0.6791344315852715, 'dropout_rate': 0.21702075247494923, 'ccp_alpha': 0.025680396816683708}. Best is trial 206 with value: 0.871061040295516.[0m
[32m[I 2022-04-13 17:44:10,097][0m Trial 218 finished with value: 0.8689973349126063 and parameters: {'loss': 'coxph', 'learning_rate': 0.002182539780115899, 'n_estimators': 891, 'criterion': 'friedman_mse', 'min_samples_split': 3, 'min_samples_leaf': 6, 'min_weight_fraction_leaf': 0.09297225063547243, 'min_impurity_decrease': 0.21850978691249634, 'max_features': 0.9434143816210668, 'subsample': 0.6719369575690919, 'dropout_rate': 0.21117462791130778, 'ccp_alpha': 0.0024907297597691093}. Best is trial 206 with value: 0.871061040295516.[0m
[32m[I 2022-04-13 17:47:38,042][0m Trial 219 finished with value: 0.8676008592469125 and parameters: {'loss': 'coxph', 'learning_rate': 0.0023235161066125203, 'n_estimators': 902, 'criterion': 'friedman_mse', 'min_samples_split': 3, 'min_samples_leaf': 6, 'min_weight_fraction_leaf': 0.09498991896749077, 'min_impurity_decrease': 0.24319271824120114, 'max_features': 0.9456806455076037, 'subsample': 0.6702846302476007, 'dropout_rate': 0.2204622337636714, 'ccp_alpha': 0.0013082855081303288}. Best is trial 206 with value: 0.871061040295516.[0m
[32m[I 2022-04-13 17:51:33,425][0m Trial 220 finished with value: 0.8683488928077626 and parameters: {'loss': 'coxph', 'learning_rate': 0.0021582193428628252, 'n_estimators': 950, 'criterion': 'friedman_mse', 'min_samples_split': 3, 'min_samples_leaf': 6, 'min_weight_fraction_leaf': 0.09655964480277877, 'min_impurity_decrease': 0.24050212450483704, 'max_features': 0.9445338229163805, 'subsample': 0.6812011932293754, 'dropout_rate': 0.22229881060827333, 'ccp_alpha': 0.015044306004944972}. Best is trial 206 with value: 0.871061040295516.[0m
[32m[I 2022-04-13 17:54:24,914][0m Trial 221 finished with value: 0.869747853052688 and parameters: {'loss': 'coxph', 'learning_rate': 0.0022561642200416296, 'n_estimators': 946, 'criterion': 'friedman_mse', 'min_samples_split': 3, 'min_samples_leaf': 6, 'min_weight_fraction_leaf': 0.0932587403695806, 'min_impurity_decrease': 0.24257417400803813, 'max_features': 0.9425332463100576, 'subsample': 0.6778613874128255, 'dropout_rate': 0.22277510915819218, 'ccp_alpha': 0.0013757512795944237}. Best is trial 206 with value: 0.871061040295516.[0m
[32m[I 2022-04-13 17:57:27,646][0m Trial 222 finished with value: 0.8680511261497108 and parameters: {'loss': 'coxph', 'learning_rate': 0.0020385672799062963, 'n_estimators': 951, 'criterion': 'friedman_mse', 'min_samples_split': 3, 'min_samples_leaf': 6, 'min_weight_fraction_leaf': 0.09051558355153097, 'min_impurity_decrease': 0.22678628750834978, 'max_features': 0.9454868778421163, 'subsample': 0.6806150760864728, 'dropout_rate': 0.22008109762529046, 'ccp_alpha': 0.007603041862623361}. Best is trial 206 with value: 0.871061040295516.[0m
[32m[I 2022-04-13 18:00:32,577][0m Trial 223 finished with value: 0.8680511261497108 and parameters: {'loss': 'coxph', 'learning_rate': 0.002308866543276567, 'n_estimators': 938, 'criterion': 'friedman_mse', 'min_samples_split': 3, 'min_samples_leaf': 6, 'min_weight_fraction_leaf': 0.09043604229393144, 'min_impurity_decrease': 0.23633813972878212, 'max_features': 0.9360745003800239, 'subsample': 0.6789361845275035, 'dropout_rate': 0.2243450191547744, 'ccp_alpha': 0.00853934751827197}. Best is trial 206 with value: 0.871061040295516.[0m
[32m[I 2022-04-13 18:03:23,713][0m Trial 224 finished with value: 0.8529590571421576 and parameters: {'loss': 'coxph', 'learning_rate': 0.002255804603428784, 'n_estimators': 945, 'criterion': 'friedman_mse', 'min_samples_split': 3, 'min_samples_leaf': 6, 'min_weight_fraction_leaf': 0.09012867672010941, 'min_impurity_decrease': 0.22918783222074934, 'max_features': 0.9387374349233104, 'subsample': 0.6799848579515102, 'dropout_rate': 0.2306281705432986, 'ccp_alpha': 0.2164834885594815}. Best is trial 206 with value: 0.871061040295516.[0m
[32m[I 2022-04-13 18:06:19,734][0m Trial 225 finished with value: 0.8691094954355197 and parameters: {'loss': 'coxph', 'learning_rate': 0.002092927819914067, 'n_estimators': 954, 'criterion': 'friedman_mse', 'min_samples_split': 3, 'min_samples_leaf': 6, 'min_weight_fraction_leaf': 0.07802531326814327, 'min_impurity_decrease': 0.2547433535813321, 'max_features': 0.9161334139505957, 'subsample': 0.6743088406011958, 'dropout_rate': 0.2673471578624701, 'ccp_alpha': 0.005043595133633909}. Best is trial 206 with value: 0.871061040295516.[0m
[32m[I 2022-04-13 18:08:54,502][0m Trial 226 finished with value: 0.8689973349126063 and parameters: {'loss': 'coxph', 'learning_rate': 0.002243419632830213, 'n_estimators': 922, 'criterion': 'friedman_mse', 'min_samples_split': 3, 'min_samples_leaf': 6, 'min_weight_fraction_leaf': 0.08087709521351448, 'min_impurity_decrease': 0.25505327376681575, 'max_features': 0.9193368437136111, 'subsample': 0.681235029427916, 'dropout_rate': 0.2148526999082845, 'ccp_alpha': 0.0050784033324079315}. Best is trial 206 with value: 0.871061040295516.[0m
[32m[I 2022-04-13 18:11:49,046][0m Trial 227 finished with value: 0.867762166753922 and parameters: {'loss': 'coxph', 'learning_rate': 0.0019203715127904786, 'n_estimators': 956, 'criterion': 'friedman_mse', 'min_samples_split': 3, 'min_samples_leaf': 6, 'min_weight_fraction_leaf': 0.07997652873391978, 'min_impurity_decrease': 0.2528808752425532, 'max_features': 0.9166464784624015, 'subsample': 0.6783760769079575, 'dropout_rate': 0.2585681029157246, 'ccp_alpha': 0.016297606091786706}. Best is trial 206 with value: 0.871061040295516.[0m
[32m[I 2022-04-13 18:14:18,732][0m Trial 228 finished with value: 0.869747853052688 and parameters: {'loss': 'coxph', 'learning_rate': 0.0025505044830688656, 'n_estimators': 941, 'criterion': 'friedman_mse', 'min_samples_split': 3, 'min_samples_leaf': 6, 'min_weight_fraction_leaf': 0.0776894288671225, 'min_impurity_decrease': 0.2508584246240767, 'max_features': 0.9093540318890092, 'subsample': 0.6787488940359182, 'dropout_rate': 0.2624211256133509, 'ccp_alpha': 0.005191586838986389}. Best is trial 206 with value: 0.871061040295516.[0m
[32m[I 2022-04-13 18:16:52,745][0m Trial 229 finished with value: 0.8564358031572441 and parameters: {'loss': 'coxph', 'learning_rate': 0.0025765596377329237, 'n_estimators': 956, 'criterion': 'friedman_mse', 'min_samples_split': 3, 'min_samples_leaf': 6, 'min_weight_fraction_leaf': 0.07767941765257985, 'min_impurity_decrease': 0.2485659755949586, 'max_features': 0.9179085352263386, 'subsample': 0.6938653652653208, 'dropout_rate': 0.2734209800969005, 'ccp_alpha': 0.22679224479793844}. Best is trial 206 with value: 0.871061040295516.[0m
[32m[I 2022-04-13 18:19:28,020][0m Trial 230 finished with value: -0.36680499305852987 and parameters: {'loss': 'squared', 'learning_rate': 0.002292066386956939, 'n_estimators': 959, 'criterion': 'friedman_mse', 'min_samples_split': 3, 'min_samples_leaf': 6, 'min_weight_fraction_leaf': 0.07539317787034995, 'min_impurity_decrease': 0.28557910772032924, 'max_features': 0.9722138549339729, 'subsample': 0.6860988497184066, 'dropout_rate': 0.25461429929676654, 'ccp_alpha': 0.002084673079039032}. Best is trial 206 with value: 0.871061040295516.[0m
[32m[I 2022-04-13 18:22:11,690][0m Trial 231 finished with value: 0.8683488928077626 and parameters: {'loss': 'coxph', 'learning_rate': 0.0018685704973265506, 'n_estimators': 947, 'criterion': 'friedman_mse', 'min_samples_split': 3, 'min_samples_leaf': 6, 'min_weight_fraction_leaf': 0.08566030762640946, 'min_impurity_decrease': 0.27458485738771243, 'max_features': 0.9045622548990035, 'subsample': 0.6727872603000189, 'dropout_rate': 0.20052019516753056, 'ccp_alpha': 0.018550787021506303}. Best is trial 206 with value: 0.871061040295516.[0m
[32m[I 2022-04-13 18:24:44,156][0m Trial 232 finished with value: 0.860085310037624 and parameters: {'loss': 'coxph', 'learning_rate': 0.0017663868966107561, 'n_estimators': 914, 'criterion': 'friedman_mse', 'min_samples_split': 3, 'min_samples_leaf': 6, 'min_weight_fraction_leaf': 0.1046338767915374, 'min_impurity_decrease': 0.28491191131142024, 'max_features': 0.9095542848599036, 'subsample': 0.647941506932678, 'dropout_rate': 0.1981691200454882, 'ccp_alpha': 0.1982149666549342}. Best is trial 206 with value: 0.871061040295516.[0m
[32m[I 2022-04-13 18:28:09,266][0m Trial 233 finished with value: 0.8678665325708721 and parameters: {'loss': 'coxph', 'learning_rate': 0.0027058965491835616, 'n_estimators': 1000, 'criterion': 'friedman_mse', 'min_samples_split': 3, 'min_samples_leaf': 6, 'min_weight_fraction_leaf': 0.08186359173271832, 'min_impurity_decrease': 0.24931153675252055, 'max_features': 0.9350109317049377, 'subsample': 0.6783397270734767, 'dropout_rate': 0.22263413401452514, 'ccp_alpha': 0.029239862150073598}. Best is trial 206 with value: 0.871061040295516.[0m
[32m[I 2022-04-13 18:31:18,922][0m Trial 234 finished with value: 0.8696868801676271 and parameters: {'loss': 'coxph', 'learning_rate': 0.002789751953077342, 'n_estimators': 959, 'criterion': 'friedman_mse', 'min_samples_split': 3, 'min_samples_leaf': 6, 'min_weight_fraction_leaf': 0.07909837864122823, 'min_impurity_decrease': 0.25102938764186455, 'max_features': 0.9052860687721375, 'subsample': 0.7012199839804378, 'dropout_rate': 0.22506470242954338, 'ccp_alpha': 0.013125156147765178}. Best is trial 206 with value: 0.871061040295516.[0m
[32m[I 2022-04-13 18:34:51,133][0m Trial 235 finished with value: 0.8702275268641818 and parameters: {'loss': 'coxph', 'learning_rate': 0.0028507815368833673, 'n_estimators': 969, 'criterion': 'friedman_mse', 'min_samples_split': 3, 'min_samples_leaf': 6, 'min_weight_fraction_leaf': 0.08308698758484104, 'min_impurity_decrease': 0.26077506472140277, 'max_features': 0.9061610341136029, 'subsample': 0.7015752445072102, 'dropout_rate': 0.22380417507861058, 'ccp_alpha': 0.006571405324268092}. Best is trial 206 with value: 0.871061040295516.[0m
[32m[I 2022-04-13 18:38:29,558][0m Trial 236 finished with value: 0.8535457831959983 and parameters: {'loss': 'coxph', 'learning_rate': 0.0031049478488098083, 'n_estimators': 994, 'criterion': 'friedman_mse', 'min_samples_split': 3, 'min_samples_leaf': 6, 'min_weight_fraction_leaf': 0.0820967728567323, 'min_impurity_decrease': 0.24848369385822006, 'max_features': 0.9035371207543604, 'subsample': 0.6847124104370991, 'dropout_rate': 0.22936879032031826, 'ccp_alpha': 0.21016514132826186}. Best is trial 206 with value: 0.871061040295516.[0m
[32m[I 2022-04-13 18:41:44,330][0m Trial 237 finished with value: 0.8710442637153119 and parameters: {'loss': 'coxph', 'learning_rate': 0.002705867565975971, 'n_estimators': 950, 'criterion': 'friedman_mse', 'min_samples_split': 3, 'min_samples_leaf': 6, 'min_weight_fraction_leaf': 0.08012009299276351, 'min_impurity_decrease': 0.26184306600856866, 'max_features': 0.9200455264664571, 'subsample': 0.7023129199916506, 'dropout_rate': 0.2595847302255475, 'ccp_alpha': 0.0051280164761019625}. Best is trial 206 with value: 0.871061040295516.[0m
[32m[I 2022-04-13 18:44:51,947][0m Trial 238 finished with value: 0.8755892337410869 and parameters: {'loss': 'coxph', 'learning_rate': 0.002658596441629218, 'n_estimators': 940, 'criterion': 'friedman_mse', 'min_samples_split': 4, 'min_samples_leaf': 5, 'min_weight_fraction_leaf': 0.07955869361884396, 'min_impurity_decrease': 0.2682082568174902, 'max_features': 0.9212240594394436, 'subsample': 0.6980063693303842, 'dropout_rate': 0.2584807655165085, 'ccp_alpha': 0.004837315322120666}. Best is trial 238 with value: 0.8755892337410869.[0m
[32m[I 2022-04-13 18:48:07,818][0m Trial 239 finished with value: 0.8541858846391521 and parameters: {'loss': 'coxph', 'learning_rate': 0.0029751821105186687, 'n_estimators': 952, 'criterion': 'friedman_mse', 'min_samples_split': 4, 'min_samples_leaf': 5, 'min_weight_fraction_leaf': 0.062429444784474514, 'min_impurity_decrease': 0.27282573517258973, 'max_features': 0.9211206711045429, 'subsample': 0.7007436291781252, 'dropout_rate': 0.25851968454481034, 'ccp_alpha': 0.2081201606205043}. Best is trial 238 with value: 0.8755892337410869.[0m
[32m[I 2022-04-13 18:50:42,442][0m Trial 240 finished with value: 0.8570483459047606 and parameters: {'loss': 'coxph', 'learning_rate': 0.0027626247096322674, 'n_estimators': 963, 'criterion': 'friedman_mse', 'min_samples_split': 4, 'min_samples_leaf': 5, 'min_weight_fraction_leaf': 0.08135975334559467, 'min_impurity_decrease': 0.213095188664642, 'max_features': 0.9230122467893179, 'subsample': 0.6937961322070512, 'dropout_rate': 0.29249936033757507, 'ccp_alpha': 0.19643917497906563}. Best is trial 238 with value: 0.8755892337410869.[0m
[32m[I 2022-04-13 18:53:43,763][0m Trial 241 finished with value: 0.8707364125695845 and parameters: {'loss': 'coxph', 'learning_rate': 0.002503770628425923, 'n_estimators': 918, 'criterion': 'friedman_mse', 'min_samples_split': 3, 'min_samples_leaf': 6, 'min_weight_fraction_leaf': 0.09939498122823848, 'min_impurity_decrease': 0.30246738064974327, 'max_features': 0.9041047542930748, 'subsample': 0.7000425012521593, 'dropout_rate': 0.24630018289313604, 'ccp_alpha': 0.0018927213209905952}. Best is trial 238 with value: 0.8755892337410869.[0m
