[32m[I 2022-04-13 11:44:33,410][0m Trial 693 finished with value: 0.7865929809567938 and parameters: {'splitter': 'random', 'min_samples_split': 0.26586038901390874, 'min_samples_leaf': 0.0011034569414662809, 'min_weight_fraction_leaf': 0.07725258708579377, 'max_features': 0.49676321390055894}. Best is trial 156 with value: 0.860262530255716.[0m
[32m[I 2022-04-13 11:44:33,454][0m Trial 694 finished with value: 0.8529006717303197 and parameters: {'splitter': 'random', 'min_samples_split': 0.2566804580903037, 'min_samples_leaf': 0.07504199149161783, 'min_weight_fraction_leaf': 0.10780011631445682, 'max_features': 0.524724926900134}. Best is trial 156 with value: 0.860262530255716.[0m
[32m[I 2022-04-13 11:44:33,497][0m Trial 695 finished with value: 0.855608859465337 and parameters: {'splitter': 'random', 'min_samples_split': 0.2624499062792165, 'min_samples_leaf': 0.05456793899347068, 'min_weight_fraction_leaf': 0.05348977413937643, 'max_features': 0.5958131325670093}. Best is trial 156 with value: 0.860262530255716.[0m
[32m[I 2022-04-13 11:44:33,544][0m Trial 696 finished with value: 0.836856136006574 and parameters: {'splitter': 'best', 'min_samples_split': 0.2999902988315458, 'min_samples_leaf': 0.02793434703602174, 'min_weight_fraction_leaf': 0.037029819990012876, 'max_features': 0.5515659581603791}. Best is trial 156 with value: 0.860262530255716.[0m
[32m[I 2022-04-13 11:44:33,630][0m Trial 697 finished with value: 0.860262530255716 and parameters: {'splitter': 'random', 'min_samples_split': 0.2754220058819762, 'min_samples_leaf': 0.049731166213550324, 'min_weight_fraction_leaf': 0.05884506106351216, 'max_features': 0.6214130384205233}. Best is trial 156 with value: 0.860262530255716.[0m
[32m[I 2022-04-13 11:44:33,695][0m Trial 698 finished with value: 0.8255882966785919 and parameters: {'splitter': 'random', 'min_samples_split': 0.248582922905782, 'min_samples_leaf': 0.011746897514730088, 'min_weight_fraction_leaf': 0.07333965457510087, 'max_features': 0.7060967499498793}. Best is trial 156 with value: 0.860262530255716.[0m
[32m[I 2022-04-13 11:44:33,740][0m Trial 699 finished with value: 0.8495779719052834 and parameters: {'splitter': 'random', 'min_samples_split': 0.29022846204671005, 'min_samples_leaf': 0.04450832910404144, 'min_weight_fraction_leaf': 0.050980980342867264, 'max_features': 0.5688224130001742}. Best is trial 156 with value: 0.860262530255716.[0m
[32m[I 2022-04-13 11:44:33,785][0m Trial 700 finished with value: 0.8484399756279405 and parameters: {'splitter': 'random', 'min_samples_split': 0.23700842631944422, 'min_samples_leaf': 0.011669584327852808, 'min_weight_fraction_leaf': 0.0912774516255547, 'max_features': 0.5621748280509175}. Best is trial 156 with value: 0.860262530255716.[0m
[32m[I 2022-04-13 11:44:33,830][0m Trial 701 finished with value: 0.8432776267867528 and parameters: {'splitter': 'random', 'min_samples_split': 0.03839384153544298, 'min_samples_leaf': 0.07443085932483179, 'min_weight_fraction_leaf': 0.021244895611426586, 'max_features': 0.5173359269422078}. Best is trial 156 with value: 0.860262530255716.[0m
[32m[I 2022-04-13 11:44:33,874][0m Trial 702 finished with value: 0.8204132025252238 and parameters: {'splitter': 'random', 'min_samples_split': 0.25017990221335645, 'min_samples_leaf': 0.027603895247790187, 'min_weight_fraction_leaf': 0.012847333474185485, 'max_features': 0.46272376610029364}. Best is trial 156 with value: 0.860262530255716.[0m
[32m[I 2022-04-13 11:44:33,921][0m Trial 703 finished with value: 0.8541689983710665 and parameters: {'splitter': 'random', 'min_samples_split': 0.23122462693118045, 'min_samples_leaf': 0.0189432384345773, 'min_weight_fraction_leaf': 0.052654500592119693, 'max_features': 0.5469961673135664}. Best is trial 156 with value: 0.860262530255716.[0m
[32m[I 2022-04-13 11:44:33,967][0m Trial 704 finished with value: 0.7999200547726107 and parameters: {'splitter': 'random', 'min_samples_split': 0.3054769935720375, 'min_samples_leaf': 0.056912326948295844, 'min_weight_fraction_leaf': 0.064283957043238, 'max_features': 0.4819195310901031}. Best is trial 156 with value: 0.860262530255716.[0m
[32m[I 2022-04-13 11:44:34,076][0m Trial 705 finished with value: 0.7917045353064339 and parameters: {'splitter': 'random', 'min_samples_split': 0.2631593117694997, 'min_samples_leaf': 0.026402981135449748, 'min_weight_fraction_leaf': 0.02915167662808864, 'max_features': 0.1895408625628997}. Best is trial 156 with value: 0.860262530255716.[0m
[32m[I 2022-04-13 11:44:34,148][0m Trial 706 finished with value: 0.8537871744804019 and parameters: {'splitter': 'random', 'min_samples_split': 0.28330336739613815, 'min_samples_leaf': 0.037061364751179146, 'min_weight_fraction_leaf': 0.06409384811920169, 'max_features': 0.5109453476676894}. Best is trial 156 with value: 0.860262530255716.[0m
[32m[I 2022-04-13 11:44:34,241][0m Trial 707 finished with value: 0.8489013073488471 and parameters: {'splitter': 'random', 'min_samples_split': 0.41498918897694936, 'min_samples_leaf': 0.010397245183493171, 'min_weight_fraction_leaf': 0.07953864336155772, 'max_features': 0.5594194137488525}. Best is trial 156 with value: 0.860262530255716.[0m
[32m[I 2022-04-13 11:44:34,337][0m Trial 708 finished with value: 0.8537871744804019 and parameters: {'splitter': 'random', 'min_samples_split': 0.2786094425646944, 'min_samples_leaf': 0.047086398884550976, 'min_weight_fraction_leaf': 0.011132247807810285, 'max_features': 0.5830643870368979}. Best is trial 156 with value: 0.860262530255716.[0m
[32m[I 2022-04-13 11:44:34,423][0m Trial 709 finished with value: 0.8490198370094999 and parameters: {'splitter': 'random', 'min_samples_split': 0.25257619373120255, 'min_samples_leaf': 0.006245285186777792, 'min_weight_fraction_leaf': 0.08638600017781442, 'max_features': 0.5572272374187958}. Best is trial 156 with value: 0.860262530255716.[0m
[32m[I 2022-04-13 11:44:34,529][0m Trial 710 finished with value: 0.7426175290362615 and parameters: {'splitter': 'random', 'min_samples_split': 0.29266588076189887, 'min_samples_leaf': 0.03546967711707082, 'min_weight_fraction_leaf': 0.2020458704431634, 'max_features': 0.5421594103793573}. Best is trial 156 with value: 0.860262530255716.[0m
[32m[I 2022-04-13 11:44:34,636][0m Trial 711 finished with value: 0.8537871744804019 and parameters: {'splitter': 'random', 'min_samples_split': 0.28216386972509744, 'min_samples_leaf': 0.018462699820784988, 'min_weight_fraction_leaf': 0.05149248060863907, 'max_features': 0.5714747327129058}. Best is trial 156 with value: 0.860262530255716.[0m
[32m[I 2022-04-13 11:44:34,748][0m Trial 712 finished with value: 0.8537871744804019 and parameters: {'splitter': 'random', 'min_samples_split': 0.2837379570215677, 'min_samples_leaf': 0.012187315031490197, 'min_weight_fraction_leaf': 0.06915881894463431, 'max_features': 0.5809670998056581}. Best is trial 156 with value: 0.860262530255716.[0m
[32m[I 2022-04-13 11:44:34,858][0m Trial 713 finished with value: 0.7999200547726107 and parameters: {'splitter': 'random', 'min_samples_split': 0.2766621627045645, 'min_samples_leaf': 0.041828013073840487, 'min_weight_fraction_leaf': 0.04193920100715704, 'max_features': 0.48678459926009304}. Best is trial 156 with value: 0.860262530255716.[0m
[32m[I 2022-04-13 11:44:35,012][0m Trial 714 finished with value: 0.860262530255716 and parameters: {'splitter': 'random', 'min_samples_split': 0.2714849390590077, 'min_samples_leaf': 0.03692602143007856, 'min_weight_fraction_leaf': 0.05552847113340752, 'max_features': 0.5387005580103443}. Best is trial 156 with value: 0.860262530255716.[0m
[32m[I 2022-04-13 11:44:35,261][0m Trial 715 finished with value: 0.8516831856788973 and parameters: {'splitter': 'random', 'min_samples_split': 0.21736009260810452, 'min_samples_leaf': 0.0019634530984747878, 'min_weight_fraction_leaf': 0.07685532332910364, 'max_features': 0.5943303541956629}. Best is trial 156 with value: 0.860262530255716.[0m
[32m[I 2022-04-13 11:44:35,385][0m Trial 716 finished with value: 0.82429434737347 and parameters: {'splitter': 'random', 'min_samples_split': 0.260298358779099, 'min_samples_leaf': 0.028202617673660967, 'min_weight_fraction_leaf': 0.1184012851856022, 'max_features': 0.6663361863530181}. Best is trial 156 with value: 0.860262530255716.[0m
[32m[I 2022-04-13 11:44:35,529][0m Trial 717 finished with value: 0.7099663963089992 and parameters: {'splitter': 'best', 'min_samples_split': 0.3219110603750676, 'min_samples_leaf': 0.16950375267834772, 'min_weight_fraction_leaf': 0.3987255715194373, 'max_features': 0.418637450779965}. Best is trial 156 with value: 0.860262530255716.[0m
[32m[I 2022-04-13 11:44:35,642][0m Trial 718 finished with value: 0.8495779719052834 and parameters: {'splitter': 'random', 'min_samples_split': 0.2958867186042034, 'min_samples_leaf': 0.03701884910282935, 'min_weight_fraction_leaf': 0.06469242898684568, 'max_features': 0.5362306555513974}. Best is trial 156 with value: 0.860262530255716.[0m
[32m[I 2022-04-13 11:44:35,697][0m Trial 719 finished with value: 0.8544192216908126 and parameters: {'splitter': 'random', 'min_samples_split': 0.24273961733557772, 'min_samples_leaf': 0.0114202849582456, 'min_weight_fraction_leaf': 0.02733774456726874, 'max_features': 0.5032993309780148}. Best is trial 156 with value: 0.860262530255716.[0m
[32m[I 2022-04-13 11:44:35,834][0m Trial 720 finished with value: 0.7999200547726107 and parameters: {'splitter': 'random', 'min_samples_split': 0.2661186419519798, 'min_samples_leaf': 0.05581902880575487, 'min_weight_fraction_leaf': 0.0014955186982234941, 'max_features': 0.4901431892810296}. Best is trial 156 with value: 0.860262530255716.[0m
[32m[I 2022-04-13 11:44:35,976][0m Trial 721 finished with value: 0.8555617056756446 and parameters: {'splitter': 'random', 'min_samples_split': 0.27124310215865743, 'min_samples_leaf': 0.0017285139772608323, 'min_weight_fraction_leaf': 0.034761169851834854, 'max_features': 0.52508364853173}. Best is trial 156 with value: 0.860262530255716.[0m
[32m[I 2022-04-13 11:44:36,093][0m Trial 722 finished with value: 0.855608859465337 and parameters: {'splitter': 'random', 'min_samples_split': 0.25930042656800156, 'min_samples_leaf': 0.06618408679960627, 'min_weight_fraction_leaf': 0.07597817674869403, 'max_features': 0.5362416963667445}. Best is trial 156 with value: 0.860262530255716.[0m
[32m[I 2022-04-13 11:44:36,211][0m Trial 723 finished with value: 0.6221444797813724 and parameters: {'splitter': 'random', 'min_samples_split': 0.309493910120822, 'min_samples_leaf': 0.4597359042875745, 'min_weight_fraction_leaf': 0.04742446215247898, 'max_features': 0.8720282908188155}. Best is trial 156 with value: 0.860262530255716.[0m
[32m[I 2022-04-13 11:44:36,319][0m Trial 724 finished with value: 0.8235183799663535 and parameters: {'splitter': 'random', 'min_samples_split': 0.28406537371250123, 'min_samples_leaf': 0.043950829452948544, 'min_weight_fraction_leaf': 0.056794235456845185, 'max_features': 0.7926802902385683}. Best is trial 156 with value: 0.860262530255716.[0m
[32m[I 2022-04-13 11:44:36,480][0m Trial 725 finished with value: 0.8484399756279405 and parameters: {'splitter': 'random', 'min_samples_split': 0.24086528772080837, 'min_samples_leaf': 0.018204886325891352, 'min_weight_fraction_leaf': 0.09048552023155888, 'max_features': 0.6160269265500963}. Best is trial 156 with value: 0.860262530255716.[0m
[32m[I 2022-04-13 11:44:36,623][0m Trial 726 finished with value: 0.8541689983710665 and parameters: {'splitter': 'random', 'min_samples_split': 0.24738570001045768, 'min_samples_leaf': 0.025122523079106503, 'min_weight_fraction_leaf': 0.05043419670668947, 'max_features': 0.5381769219963253}. Best is trial 156 with value: 0.860262530255716.[0m
[32m[I 2022-04-13 11:44:36,727][0m Trial 727 finished with value: 0.8537871744804019 and parameters: {'splitter': 'random', 'min_samples_split': 0.2763604137473654, 'min_samples_leaf': 0.06788094073971314, 'min_weight_fraction_leaf': 0.07239762153559182, 'max_features': 0.6219209212101043}. Best is trial 156 with value: 0.860262530255716.[0m
[32m[I 2022-04-13 11:44:36,869][0m Trial 728 finished with value: 0.855608859465337 and parameters: {'splitter': 'random', 'min_samples_split': 0.25932582699957285, 'min_samples_leaf': 0.025031474765194784, 'min_weight_fraction_leaf': 0.03917063937092867, 'max_features': 0.5493697849519575}. Best is trial 156 with value: 0.860262530255716.[0m
[32m[I 2022-04-13 11:44:37,029][0m Trial 729 finished with value: 0.860262530255716 and parameters: {'splitter': 'random', 'min_samples_split': 0.27062024835535453, 'min_samples_leaf': 0.05212668473724849, 'min_weight_fraction_leaf': 0.06653765904187722, 'max_features': 0.570441234481609}. Best is trial 156 with value: 0.860262530255716.[0m
[32m[I 2022-04-13 11:44:37,201][0m Trial 730 finished with value: 0.8537871744804019 and parameters: {'splitter': 'random', 'min_samples_split': 0.2887663883331225, 'min_samples_leaf': 0.03460518154850552, 'min_weight_fraction_leaf': 0.02713076286565401, 'max_features': 0.5109092545671821}. Best is trial 156 with value: 0.860262530255716.[0m
[32m[I 2022-04-13 11:44:37,371][0m Trial 731 finished with value: 0.6334936025301521 and parameters: {'splitter': 'random', 'min_samples_split': 0.2726023882096161, 'min_samples_leaf': 0.01567985243251644, 'min_weight_fraction_leaf': 0.2784641444841145, 'max_features': 0.5090621578714902}. Best is trial 156 with value: 0.860262530255716.[0m
[32m[I 2022-04-13 11:44:37,495][0m Trial 732 finished with value: 0.8537871744804019 and parameters: {'splitter': 'random', 'min_samples_split': 0.28324931685213084, 'min_samples_leaf': 0.05826192882705038, 'min_weight_fraction_leaf': 0.06410181346562287, 'max_features': 0.577820270208336}. Best is trial 156 with value: 0.860262530255716.[0m
[32m[I 2022-04-13 11:44:37,697][0m Trial 733 finished with value: 0.8495779719052834 and parameters: {'splitter': 'random', 'min_samples_split': 0.30182879868624723, 'min_samples_leaf': 0.04357923872534726, 'min_weight_fraction_leaf': 0.06354500198277507, 'max_features': 0.5606185193480834}. Best is trial 156 with value: 0.860262530255716.[0m
[32m[I 2022-04-13 11:44:37,972][0m Trial 734 finished with value: 0.678946779212211 and parameters: {'splitter': 'random', 'min_samples_split': 0.26271955488765864, 'min_samples_leaf': 0.08595395249523906, 'min_weight_fraction_leaf': 0.05241654741385603, 'max_features': 0.4459568928812914}. Best is trial 156 with value: 0.860262530255716.[0m
[32m[I 2022-04-13 11:44:38,264][0m Trial 735 finished with value: 0.7999200547726107 and parameters: {'splitter': 'random', 'min_samples_split': 0.27470663546666535, 'min_samples_leaf': 0.050228610942347325, 'min_weight_fraction_leaf': 0.021745990048917717, 'max_features': 0.472983517184617}. Best is trial 156 with value: 0.860262530255716.[0m
[32m[I 2022-04-13 11:44:38,586][0m Trial 736 finished with value: 0.8204507256185722 and parameters: {'splitter': 'best', 'min_samples_split': 0.2940189747236345, 'min_samples_leaf': 0.05497664959410682, 'min_weight_fraction_leaf': 0.03644139544213151, 'max_features': 0.4977047238610978}. Best is trial 156 with value: 0.860262530255716.[0m
[32m[I 2022-04-13 11:44:38,832][0m Trial 737 finished with value: 0.6732977308424568 and parameters: {'splitter': 'random', 'min_samples_split': 0.2670498201598368, 'min_samples_leaf': 0.08782082988012782, 'min_weight_fraction_leaf': 0.10186738383518283, 'max_features': 0.4983632907985905}. Best is trial 156 with value: 0.860262530255716.[0m
[32m[I 2022-04-13 11:44:39,138][0m Trial 738 finished with value: 0.8169418604210963 and parameters: {'splitter': 'random', 'min_samples_split': 0.2528085208807035, 'min_samples_leaf': 0.07279471108889388, 'min_weight_fraction_leaf': 0.07042751471911936, 'max_features': 0.6472715802698955}. Best is trial 156 with value: 0.860262530255716.[0m
[32m[I 2022-04-13 11:44:39,446][0m Trial 739 finished with value: 0.8536735077998788 and parameters: {'splitter': 'random', 'min_samples_split': 0.273103661146537, 'min_samples_leaf': 0.009864530454977575, 'min_weight_fraction_leaf': 0.08129993612317854, 'max_features': 0.5939532774610417}. Best is trial 156 with value: 0.860262530255716.[0m
[32m[I 2022-04-13 11:44:39,737][0m Trial 740 finished with value: 0.8490198370094999 and parameters: {'splitter': 'random', 'min_samples_split': 0.2572215677793897, 'min_samples_leaf': 0.020532054471840783, 'min_weight_fraction_leaf': 0.0862205164770613, 'max_features': 0.5904874329373131}. Best is trial 156 with value: 0.860262530255716.[0m
[32m[I 2022-04-13 11:44:40,043][0m Trial 741 finished with value: 0.8537871744804019 and parameters: {'splitter': 'random', 'min_samples_split': 0.28300091052151644, 'min_samples_leaf': 0.037250670927056924, 'min_weight_fraction_leaf': 0.06150509791715224, 'max_features': 0.5961944162399628}. Best is trial 156 with value: 0.860262530255716.[0m
[32m[I 2022-04-13 11:44:40,319][0m Trial 742 finished with value: 0.8541689983710665 and parameters: {'splitter': 'random', 'min_samples_split': 0.24910479425297016, 'min_samples_leaf': 0.019344262559437837, 'min_weight_fraction_leaf': 0.03990771361269366, 'max_features': 0.5290459600024771}. Best is trial 156 with value: 0.860262530255716.[0m
[32m[I 2022-04-13 11:44:40,605][0m Trial 743 finished with value: 0.855608859465337 and parameters: {'splitter': 'random', 'min_samples_split': 0.2575099502412509, 'min_samples_leaf': 0.03157402816239698, 'min_weight_fraction_leaf': 0.07517482538198779, 'max_features': 0.6049951058338073}. Best is trial 156 with value: 0.860262530255716.[0m
[32m[I 2022-04-13 11:44:40,783][0m Trial 744 finished with value: 0.8333600815294894 and parameters: {'splitter': 'random', 'min_samples_split': 0.23983177681207038, 'min_samples_leaf': 0.009753906029231586, 'min_weight_fraction_leaf': 0.09432914011869031, 'max_features': 0.626109915861406}. Best is trial 156 with value: 0.860262530255716.[0m
[32m[I 2022-04-13 11:44:40,916][0m Trial 745 finished with value: 0.860262530255716 and parameters: {'splitter': 'random', 'min_samples_split': 0.26906794397717293, 'min_samples_leaf': 0.03815835452371634, 'min_weight_fraction_leaf': 0.0495705506705408, 'max_features': 0.551270020311705}. Best is trial 156 with value: 0.860262530255716.[0m
[32m[I 2022-04-13 11:44:40,967][0m Trial 746 finished with value: 0.860262530255716 and parameters: {'splitter': 'random', 'min_samples_split': 0.2649137082254846, 'min_samples_leaf': 0.02617096054784473, 'min_weight_fraction_leaf': 0.046408392726968395, 'max_features': 0.5199365431762691}. Best is trial 156 with value: 0.860262530255716.[0m
[32m[I 2022-04-13 11:44:41,065][0m Trial 747 finished with value: 0.8537871744804019 and parameters: {'splitter': 'random', 'min_samples_split': 0.28478012918276346, 'min_samples_leaf': 0.045184935000012465, 'min_weight_fraction_leaf': 0.06297397751189314, 'max_features': 0.5704089588169238}. Best is trial 156 with value: 0.860262530255716.[0m
[32m[I 2022-04-13 11:44:41,134][0m Trial 748 finished with value: 0.8541689983710665 and parameters: {'splitter': 'random', 'min_samples_split': 0.22550383554509554, 'min_samples_leaf': 0.06140947193556742, 'min_weight_fraction_leaf': 0.02732602251734388, 'max_features': 0.5105964991901215}. Best is trial 156 with value: 0.860262530255716.[0m
[32m[I 2022-04-13 11:44:41,312][0m Trial 749 finished with value: 0.8505444862652425 and parameters: {'splitter': 'random', 'min_samples_split': 0.2790944519840521, 'min_samples_leaf': 0.04603757918199301, 'min_weight_fraction_leaf': 0.15133328796709328, 'max_features': 0.6042762369163369}. Best is trial 156 with value: 0.860262530255716.[0m
[32m[I 2022-04-13 11:44:41,400][0m Trial 750 finished with value: 0.8130158757335355 and parameters: {'splitter': 'random', 'min_samples_split': 0.2774030721280292, 'min_samples_leaf': 0.02965672591830476, 'min_weight_fraction_leaf': 0.03945143071790694, 'max_features': 0.4425320920338081}. Best is trial 156 with value: 0.860262530255716.[0m
[32m[I 2022-04-13 11:44:41,500][0m Trial 751 finished with value: 0.7445764336842451 and parameters: {'splitter': 'random', 'min_samples_split': 0.2742376539947147, 'min_samples_leaf': 0.006800339746483411, 'min_weight_fraction_leaf': 0.17673413516985864, 'max_features': 0.5219513093223735}. Best is trial 156 with value: 0.860262530255716.[0m
[32m[I 2022-04-13 11:44:41,545][0m Trial 752 finished with value: 0.8495779719052834 and parameters: {'splitter': 'random', 'min_samples_split': 0.2964760464784645, 'min_samples_leaf': 0.0392968042387773, 'min_weight_fraction_leaf': 0.05918932303356417, 'max_features': 0.5530846526506352}. Best is trial 156 with value: 0.860262530255716.[0m
[32m[I 2022-04-13 11:44:41,589][0m Trial 753 finished with value: 0.7999200547726107 and parameters: {'splitter': 'random', 'min_samples_split': 0.2667188425707895, 'min_samples_leaf': 0.02261481355165452, 'min_weight_fraction_leaf': 0.044237717082458446, 'max_features': 0.4831711548099105}. Best is trial 156 with value: 0.860262530255716.[0m
[32m[I 2022-04-13 11:44:41,674][0m Trial 754 finished with value: 0.839996638422847 and parameters: {'splitter': 'best', 'min_samples_split': 0.27106054246887923, 'min_samples_leaf': 0.009610964694793384, 'min_weight_fraction_leaf': 0.04496639802129768, 'max_features': 0.5218384373895301}. Best is trial 156 with value: 0.860262530255716.[0m
[32m[I 2022-04-13 11:44:41,835][0m Trial 755 finished with value: 0.8490198370094999 and parameters: {'splitter': 'random', 'min_samples_split': 0.258976050776713, 'min_samples_leaf': 0.010190125249294829, 'min_weight_fraction_leaf': 0.08068292902102717, 'max_features': 0.5319680530491748}. Best is trial 156 with value: 0.860262530255716.[0m
