[32m[I 2022-04-13 11:46:20,209][0m Trial 749 finished with value: 0.8643129825609158 and parameters: {'alpha': 2.26728973000042, 'ties': 'breslow'}. Best is trial 99 with value: 0.8654869897806009.[0m
[32m[I 2022-04-13 11:46:20,622][0m Trial 750 finished with value: 0.8643129825609158 and parameters: {'alpha': 2.289320266071835, 'ties': 'breslow'}. Best is trial 99 with value: 0.8654869897806009.[0m
[32m[I 2022-04-13 11:46:21,043][0m Trial 751 finished with value: 0.8648218682663185 and parameters: {'alpha': 2.145140011267948, 'ties': 'efron'}. Best is trial 99 with value: 0.8654869897806009.[0m
[32m[I 2022-04-13 11:46:21,224][0m Trial 752 finished with value: 0.8648486321634327 and parameters: {'alpha': 2.4534316012301947, 'ties': 'breslow'}. Best is trial 99 with value: 0.8654869897806009.[0m
[32m[I 2022-04-13 11:46:21,403][0m Trial 753 finished with value: 0.8654869897806009 and parameters: {'alpha': 2.297738150978632, 'ties': 'breslow'}. Best is trial 99 with value: 0.8654869897806009.[0m
[32m[I 2022-04-13 11:46:21,749][0m Trial 754 finished with value: 0.8636746249437476 and parameters: {'alpha': 2.200655673755973, 'ties': 'breslow'}. Best is trial 99 with value: 0.8654869897806009.[0m
[32m[I 2022-04-13 11:46:22,006][0m Trial 755 finished with value: 0.8628877211214527 and parameters: {'alpha': 2.7439601766470534, 'ties': 'breslow'}. Best is trial 99 with value: 0.8654869897806009.[0m
[32m[I 2022-04-13 11:46:22,259][0m Trial 756 finished with value: 0.8641835106491502 and parameters: {'alpha': 2.115662283766901, 'ties': 'breslow'}. Best is trial 99 with value: 0.8654869897806009.[0m
[32m[I 2022-04-13 11:46:22,514][0m Trial 757 finished with value: 0.8648486321634327 and parameters: {'alpha': 2.4448943377124728, 'ties': 'breslow'}. Best is trial 99 with value: 0.8654869897806009.[0m
[32m[I 2022-04-13 11:46:22,897][0m Trial 758 finished with value: 0.8648486321634327 and parameters: {'alpha': 2.394223842786606, 'ties': 'breslow'}. Best is trial 99 with value: 0.8654869897806009.[0m
[32m[I 2022-04-13 11:46:23,117][0m Trial 759 finished with value: 0.8639833328806962 and parameters: {'alpha': 2.633658018962928, 'ties': 'breslow'}. Best is trial 99 with value: 0.8654869897806009.[0m
[32m[I 2022-04-13 11:46:23,674][0m Trial 760 finished with value: 0.8643129825609158 and parameters: {'alpha': 2.1983558343563634, 'ties': 'efron'}. Best is trial 99 with value: 0.8654869897806009.[0m
[32m[I 2022-04-13 11:46:24,352][0m Trial 761 finished with value: 0.8648486321634327 and parameters: {'alpha': 2.525493135293335, 'ties': 'breslow'}. Best is trial 99 with value: 0.8654869897806009.[0m
[32m[I 2022-04-13 11:46:24,894][0m Trial 762 finished with value: 0.8654085943201592 and parameters: {'alpha': 1.991608062623593, 'ties': 'breslow'}. Best is trial 99 with value: 0.8654869897806009.[0m
[32m[I 2022-04-13 11:46:25,100][0m Trial 763 finished with value: 0.8648486321634327 and parameters: {'alpha': 2.3584394719437927, 'ties': 'breslow'}. Best is trial 99 with value: 0.8654869897806009.[0m
[32m[I 2022-04-13 11:46:25,397][0m Trial 764 finished with value: 0.8643129825609158 and parameters: {'alpha': 2.2752001822228087, 'ties': 'breslow'}. Best is trial 99 with value: 0.8654869897806009.[0m
[32m[I 2022-04-13 11:46:25,737][0m Trial 765 finished with value: 0.8648486321634327 and parameters: {'alpha': 2.489215678487936, 'ties': 'breslow'}. Best is trial 99 with value: 0.8654869897806009.[0m
[32m[I 2022-04-13 11:46:26,036][0m Trial 766 finished with value: 0.8643129825609158 and parameters: {'alpha': 2.249783092418815, 'ties': 'breslow'}. Best is trial 99 with value: 0.8654869897806009.[0m
[32m[I 2022-04-13 11:46:26,406][0m Trial 767 finished with value: 0.8636923723562976 and parameters: {'alpha': 1.6623113591967216, 'ties': 'breslow'}. Best is trial 99 with value: 0.8654869897806009.[0m
[32m[I 2022-04-13 11:46:26,679][0m Trial 768 finished with value: 0.8648486321634327 and parameters: {'alpha': 2.4088841634929565, 'ties': 'breslow'}. Best is trial 99 with value: 0.8654869897806009.[0m
[32m[I 2022-04-13 11:46:27,029][0m Trial 769 finished with value: 0.8647702367029909 and parameters: {'alpha': 2.107329158849663, 'ties': 'efron'}. Best is trial 99 with value: 0.8654869897806009.[0m
[32m[I 2022-04-13 11:46:27,662][0m Trial 770 finished with value: 0.8639833328806962 and parameters: {'alpha': 2.5685563030556016, 'ties': 'breslow'}. Best is trial 99 with value: 0.8654869897806009.[0m
[32m[I 2022-04-13 11:46:28,213][0m Trial 771 finished with value: 0.8643129825609158 and parameters: {'alpha': 2.2376973607108823, 'ties': 'breslow'}. Best is trial 99 with value: 0.8654869897806009.[0m
[32m[I 2022-04-13 11:46:28,809][0m Trial 772 finished with value: 0.8648486321634327 and parameters: {'alpha': 2.35597471020798, 'ties': 'breslow'}. Best is trial 99 with value: 0.8654869897806009.[0m
[32m[I 2022-04-13 11:46:29,279][0m Trial 773 finished with value: 0.8587551797966831 and parameters: {'alpha': 4.693479612507533, 'ties': 'breslow'}. Best is trial 99 with value: 0.8654869897806009.[0m
[32m[I 2022-04-13 11:46:29,764][0m Trial 774 finished with value: 0.8648486321634327 and parameters: {'alpha': 2.432482081224629, 'ties': 'breslow'}. Best is trial 99 with value: 0.8654869897806009.[0m
[32m[I 2022-04-13 11:46:30,061][0m Trial 775 finished with value: 0.8648486321634327 and parameters: {'alpha': 2.3480727336144023, 'ties': 'breslow'}. Best is trial 99 with value: 0.8654869897806009.[0m
[32m[I 2022-04-13 11:46:30,156][0m Trial 776 finished with value: 0.8654869897806009 and parameters: {'alpha': 2.344848206681131, 'ties': 'breslow'}. Best is trial 99 with value: 0.8654869897806009.[0m
[32m[I 2022-04-13 11:46:30,248][0m Trial 777 finished with value: 0.8648486321634327 and parameters: {'alpha': 2.5253907565713205, 'ties': 'breslow'}. Best is trial 99 with value: 0.8654869897806009.[0m
[32m[I 2022-04-13 11:46:30,335][0m Trial 778 finished with value: 0.8654869897806009 and parameters: {'alpha': 2.312267299565346, 'ties': 'breslow'}. Best is trial 99 with value: 0.8654869897806009.[0m
[32m[I 2022-04-13 11:46:30,477][0m Trial 779 finished with value: 0.8636746249437476 and parameters: {'alpha': 2.187300135222358, 'ties': 'breslow'}. Best is trial 99 with value: 0.8654869897806009.[0m
[32m[I 2022-04-13 11:46:30,648][0m Trial 780 finished with value: 0.862248565592125 and parameters: {'alpha': 2.689862227110075, 'ties': 'breslow'}. Best is trial 99 with value: 0.8654869897806009.[0m
[32m[I 2022-04-13 11:46:30,868][0m Trial 781 finished with value: 0.8616608609861608 and parameters: {'alpha': 3.0265297503053064, 'ties': 'breslow'}. Best is trial 99 with value: 0.8654869897806009.[0m
[32m[I 2022-04-13 11:46:31,080][0m Trial 782 finished with value: 0.8648486321634327 and parameters: {'alpha': 2.439028986344019, 'ties': 'breslow'}. Best is trial 99 with value: 0.8654869897806009.[0m
[32m[I 2022-04-13 11:46:31,266][0m Trial 783 finished with value: 0.8643129825609158 and parameters: {'alpha': 2.2543810286291905, 'ties': 'breslow'}. Best is trial 99 with value: 0.8654869897806009.[0m
[32m[I 2022-04-13 11:46:31,499][0m Trial 784 finished with value: 0.8654085943201592 and parameters: {'alpha': 2.0427881187799923, 'ties': 'efron'}. Best is trial 99 with value: 0.8654869897806009.[0m
[32m[I 2022-04-13 11:46:31,987][0m Trial 785 finished with value: 0.8643129825609158 and parameters: {'alpha': 2.2644883908244036, 'ties': 'breslow'}. Best is trial 99 with value: 0.8654869897806009.[0m
[32m[I 2022-04-13 11:46:32,518][0m Trial 786 finished with value: 0.8641835106491502 and parameters: {'alpha': 2.1234450579174284, 'ties': 'efron'}. Best is trial 99 with value: 0.8654869897806009.[0m
[32m[I 2022-04-13 11:46:32,912][0m Trial 787 finished with value: 0.8641835106491502 and parameters: {'alpha': 2.173454126077145, 'ties': 'breslow'}. Best is trial 99 with value: 0.8654869897806009.[0m
[32m[I 2022-04-13 11:46:33,084][0m Trial 788 finished with value: 0.8654869897806009 and parameters: {'alpha': 2.3021409533189994, 'ties': 'breslow'}. Best is trial 99 with value: 0.8654869897806009.[0m
[32m[I 2022-04-13 11:46:33,463][0m Trial 789 finished with value: 0.8604874088784795 and parameters: {'alpha': 3.3088082808211707, 'ties': 'breslow'}. Best is trial 99 with value: 0.8654869897806009.[0m
[32m[I 2022-04-13 11:46:34,015][0m Trial 790 finished with value: 0.8633478820480818 and parameters: {'alpha': 1.9424087031634525, 'ties': 'efron'}. Best is trial 99 with value: 0.8654869897806009.[0m
[32m[I 2022-04-13 11:46:34,493][0m Trial 791 finished with value: 0.8648486321634327 and parameters: {'alpha': 2.4818218589476344, 'ties': 'breslow'}. Best is trial 99 with value: 0.8654869897806009.[0m
[32m[I 2022-04-13 11:46:34,860][0m Trial 792 finished with value: 0.8648486321634327 and parameters: {'alpha': 2.3837172638158406, 'ties': 'breslow'}. Best is trial 99 with value: 0.8654869897806009.[0m
[32m[I 2022-04-13 11:46:35,165][0m Trial 793 finished with value: 0.8654085943201592 and parameters: {'alpha': 2.0593070196840353, 'ties': 'efron'}. Best is trial 99 with value: 0.8654869897806009.[0m
[32m[I 2022-04-13 11:46:35,547][0m Trial 794 finished with value: 0.8639833328806962 and parameters: {'alpha': 2.550418146620617, 'ties': 'breslow'}. Best is trial 99 with value: 0.8654869897806009.[0m
[32m[I 2022-04-13 11:46:35,972][0m Trial 795 finished with value: 0.8641835106491502 and parameters: {'alpha': 2.159472671388565, 'ties': 'breslow'}. Best is trial 99 with value: 0.8654869897806009.[0m
[32m[I 2022-04-13 11:46:36,292][0m Trial 796 finished with value: 0.8643129825609158 and parameters: {'alpha': 2.277762598989654, 'ties': 'breslow'}. Best is trial 99 with value: 0.8654869897806009.[0m
[32m[I 2022-04-13 11:46:36,594][0m Trial 797 finished with value: 0.8639833328806962 and parameters: {'alpha': 2.615028011971756, 'ties': 'breslow'}. Best is trial 99 with value: 0.8654869897806009.[0m
[32m[I 2022-04-13 11:46:36,700][0m Trial 798 finished with value: 0.8648486321634327 and parameters: {'alpha': 2.4237409073288414, 'ties': 'breslow'}. Best is trial 99 with value: 0.8654869897806009.[0m
[32m[I 2022-04-13 11:46:36,909][0m Trial 799 finished with value: 0.8648486321634327 and parameters: {'alpha': 2.4954451266577586, 'ties': 'breslow'}. Best is trial 99 with value: 0.8654869897806009.[0m
[32m[I 2022-04-13 11:46:37,061][0m Trial 800 finished with value: 0.8648218682663185 and parameters: {'alpha': 2.1832293480011344, 'ties': 'efron'}. Best is trial 99 with value: 0.8654869897806009.[0m
[32m[I 2022-04-13 11:46:37,254][0m Trial 801 finished with value: 0.8643129825609158 and parameters: {'alpha': 2.2264248864819356, 'ties': 'breslow'}. Best is trial 99 with value: 0.8654869897806009.[0m
[32m[I 2022-04-13 11:46:37,461][0m Trial 802 finished with value: 0.8648486321634327 and parameters: {'alpha': 2.4012387944759443, 'ties': 'breslow'}. Best is trial 99 with value: 0.8654869897806009.[0m
[32m[I 2022-04-13 11:46:37,675][0m Trial 803 finished with value: 0.8648486321634327 and parameters: {'alpha': 2.3863594730349673, 'ties': 'breslow'}. Best is trial 99 with value: 0.8654869897806009.[0m
[32m[I 2022-04-13 11:46:37,901][0m Trial 804 finished with value: 0.8654869897806009 and parameters: {'alpha': 2.3468914419776055, 'ties': 'breslow'}. Best is trial 99 with value: 0.8654869897806009.[0m
[32m[I 2022-04-13 11:46:38,053][0m Trial 805 finished with value: 0.8648486321634327 and parameters: {'alpha': 2.457781629584753, 'ties': 'breslow'}. Best is trial 99 with value: 0.8654869897806009.[0m
[32m[I 2022-04-13 11:46:38,306][0m Trial 806 finished with value: 0.8647702367029909 and parameters: {'alpha': 2.096494509724077, 'ties': 'efron'}. Best is trial 99 with value: 0.8654869897806009.[0m
[32m[I 2022-04-13 11:46:38,434][0m Trial 807 finished with value: 0.8654869897806009 and parameters: {'alpha': 2.30204737091744, 'ties': 'breslow'}. Best is trial 99 with value: 0.8654869897806009.[0m
[32m[I 2022-04-13 11:46:38,729][0m Trial 808 finished with value: 0.8643129825609158 and parameters: {'alpha': 2.22242058557528, 'ties': 'efron'}. Best is trial 99 with value: 0.8654869897806009.[0m
[32m[I 2022-04-13 11:46:38,904][0m Trial 809 finished with value: 0.8643129825609158 and parameters: {'alpha': 2.2935420073539943, 'ties': 'breslow'}. Best is trial 99 with value: 0.8654869897806009.[0m
[32m[I 2022-04-13 11:46:39,078][0m Trial 810 finished with value: 0.8639833328806962 and parameters: {'alpha': 2.564963612416436, 'ties': 'breslow'}. Best is trial 99 with value: 0.8654869897806009.[0m
[32m[I 2022-04-13 11:46:39,309][0m Trial 811 finished with value: 0.8648486321634327 and parameters: {'alpha': 2.4390609967158046, 'ties': 'breslow'}. Best is trial 99 with value: 0.8654869897806009.[0m
[32m[I 2022-04-13 11:46:39,599][0m Trial 812 finished with value: 0.8643129825609158 and parameters: {'alpha': 2.270291532777289, 'ties': 'breslow'}. Best is trial 99 with value: 0.8654869897806009.[0m
[32m[I 2022-04-13 11:46:39,756][0m Trial 813 finished with value: 0.8641835106491502 and parameters: {'alpha': 2.1289218472060485, 'ties': 'breslow'}. Best is trial 99 with value: 0.8654869897806009.[0m
[32m[I 2022-04-13 11:46:40,049][0m Trial 814 finished with value: 0.8636746249437476 and parameters: {'alpha': 2.2072444721852027, 'ties': 'breslow'}. Best is trial 99 with value: 0.8654869897806009.[0m
[32m[I 2022-04-13 11:46:40,381][0m Trial 815 finished with value: 0.8654869897806009 and parameters: {'alpha': 2.3344206030975685, 'ties': 'breslow'}. Best is trial 99 with value: 0.8654869897806009.[0m
[32m[I 2022-04-13 11:46:40,614][0m Trial 816 finished with value: 0.862248565592125 and parameters: {'alpha': 2.680382394418911, 'ties': 'breslow'}. Best is trial 99 with value: 0.8654869897806009.[0m
[32m[I 2022-04-13 11:46:40,722][0m Trial 817 finished with value: 0.8648486321634327 and parameters: {'alpha': 2.340412824136767, 'ties': 'efron'}. Best is trial 99 with value: 0.8654869897806009.[0m
[32m[I 2022-04-13 11:46:40,894][0m Trial 818 finished with value: 0.8647928920287047 and parameters: {'alpha': 1.9768419435867257, 'ties': 'efron'}. Best is trial 99 with value: 0.8654869897806009.[0m
[32m[I 2022-04-13 11:46:41,097][0m Trial 819 finished with value: 0.8648486321634327 and parameters: {'alpha': 2.496194067112916, 'ties': 'efron'}. Best is trial 99 with value: 0.8654869897806009.[0m
[32m[I 2022-04-13 11:46:41,224][0m Trial 820 finished with value: 0.8643129825609158 and parameters: {'alpha': 2.2799893066888335, 'ties': 'breslow'}. Best is trial 99 with value: 0.8654869897806009.[0m
[32m[I 2022-04-13 11:46:41,487][0m Trial 821 finished with value: 0.8648486321634327 and parameters: {'alpha': 2.4228438295089334, 'ties': 'breslow'}. Best is trial 99 with value: 0.8654869897806009.[0m
[32m[I 2022-04-13 11:46:41,597][0m Trial 822 finished with value: 0.8648218682663185 and parameters: {'alpha': 2.1450430618316894, 'ties': 'efron'}. Best is trial 99 with value: 0.8654869897806009.[0m
[32m[I 2022-04-13 11:46:41,698][0m Trial 823 finished with value: 0.8654869897806009 and parameters: {'alpha': 2.3224258825658386, 'ties': 'breslow'}. Best is trial 99 with value: 0.8654869897806009.[0m
[32m[I 2022-04-13 11:46:41,819][0m Trial 824 finished with value: 0.8639833328806962 and parameters: {'alpha': 2.5601135943626874, 'ties': 'breslow'}. Best is trial 99 with value: 0.8654869897806009.[0m
[32m[I 2022-04-13 11:46:41,944][0m Trial 825 finished with value: 0.8648486321634327 and parameters: {'alpha': 2.4994472167189237, 'ties': 'breslow'}. Best is trial 99 with value: 0.8654869897806009.[0m
[32m[I 2022-04-13 11:46:42,129][0m Trial 826 finished with value: 0.8648486321634327 and parameters: {'alpha': 2.4210987274333364, 'ties': 'breslow'}. Best is trial 99 with value: 0.8654869897806009.[0m
[32m[I 2022-04-13 11:46:42,292][0m Trial 827 finished with value: 0.8654869897806009 and parameters: {'alpha': 2.3398723058890276, 'ties': 'breslow'}. Best is trial 99 with value: 0.8654869897806009.[0m
[32m[I 2022-04-13 11:46:42,461][0m Trial 828 finished with value: 0.8648486321634327 and parameters: {'alpha': 2.4028935070009263, 'ties': 'breslow'}. Best is trial 99 with value: 0.8654869897806009.[0m
[32m[I 2022-04-13 11:46:42,693][0m Trial 829 finished with value: 0.8639833328806962 and parameters: {'alpha': 2.6012806435774487, 'ties': 'breslow'}. Best is trial 99 with value: 0.8654869897806009.[0m
[32m[I 2022-04-13 11:46:42,990][0m Trial 830 finished with value: 0.8654085943201592 and parameters: {'alpha': 2.062038792035854, 'ties': 'breslow'}. Best is trial 99 with value: 0.8654869897806009.[0m
[32m[I 2022-04-13 11:46:43,368][0m Trial 831 finished with value: 0.8643129825609158 and parameters: {'alpha': 2.190452362398917, 'ties': 'efron'}. Best is trial 99 with value: 0.8654869897806009.[0m
[32m[I 2022-04-13 11:46:43,650][0m Trial 832 finished with value: 0.8643129825609158 and parameters: {'alpha': 2.2652133898751328, 'ties': 'breslow'}. Best is trial 99 with value: 0.8654869897806009.[0m
[32m[I 2022-04-13 11:46:44,005][0m Trial 833 finished with value: 0.8643129825609158 and parameters: {'alpha': 2.231734810092824, 'ties': 'breslow'}. Best is trial 99 with value: 0.8654869897806009.[0m
[32m[I 2022-04-13 11:46:44,222][0m Trial 834 finished with value: 0.8648486321634327 and parameters: {'alpha': 2.3851456445595103, 'ties': 'breslow'}. Best is trial 99 with value: 0.8654869897806009.[0m
[32m[I 2022-04-13 11:46:44,420][0m Trial 835 finished with value: 0.8610217054568331 and parameters: {'alpha': 2.9058531275444803, 'ties': 'breslow'}. Best is trial 99 with value: 0.8654869897806009.[0m
[32m[I 2022-04-13 11:46:44,618][0m Trial 836 finished with value: 0.86398623966525 and parameters: {'alpha': 1.8965129799924445, 'ties': 'breslow'}. Best is trial 99 with value: 0.8654869897806009.[0m
[32m[I 2022-04-13 11:46:44,891][0m Trial 837 finished with value: 0.8641835106491502 and parameters: {'alpha': 2.1120396673401696, 'ties': 'efron'}. Best is trial 99 with value: 0.8654869897806009.[0m
[32m[I 2022-04-13 11:46:45,024][0m Trial 838 finished with value: 0.8648486321634327 and parameters: {'alpha': 2.51548274416734, 'ties': 'breslow'}. Best is trial 99 with value: 0.8654869897806009.[0m
[32m[I 2022-04-13 11:46:45,113][0m Trial 839 finished with value: 0.8636746249437476 and parameters: {'alpha': 2.20005314304078, 'ties': 'breslow'}. Best is trial 99 with value: 0.8654869897806009.[0m
[32m[I 2022-04-13 11:46:45,204][0m Trial 840 finished with value: 0.8654869897806009 and parameters: {'alpha': 2.305151968136619, 'ties': 'breslow'}. Best is trial 99 with value: 0.8654869897806009.[0m
[32m[I 2022-04-13 11:46:45,314][0m Trial 841 finished with value: 0.8648486321634327 and parameters: {'alpha': 2.466710511135242, 'ties': 'breslow'}. Best is trial 99 with value: 0.8654869897806009.[0m
[32m[I 2022-04-13 11:46:45,465][0m Trial 842 finished with value: 0.8654869897806009 and parameters: {'alpha': 2.2997257111446774, 'ties': 'breslow'}. Best is trial 99 with value: 0.8654869897806009.[0m
[32m[I 2022-04-13 11:46:45,737][0m Trial 843 finished with value: 0.8628877211214527 and parameters: {'alpha': 2.7698307923371512, 'ties': 'breslow'}. Best is trial 99 with value: 0.8654869897806009.[0m
[32m[I 2022-04-13 11:46:45,839][0m Trial 844 finished with value: 0.8639833328806962 and parameters: {'alpha': 2.5899180240201445, 'ties': 'breslow'}. Best is trial 99 with value: 0.8654869897806009.[0m
[32m[I 2022-04-13 11:46:45,943][0m Trial 845 finished with value: 0.859339367643749 and parameters: {'alpha': 3.8130294872115336, 'ties': 'breslow'}. Best is trial 99 with value: 0.8654869897806009.[0m
[32m[I 2022-04-13 11:46:46,158][0m Trial 846 finished with value: 0.8648486321634327 and parameters: {'alpha': 2.4614747305206564, 'ties': 'breslow'}. Best is trial 99 with value: 0.8654869897806009.[0m
[32m[I 2022-04-13 11:46:46,300][0m Trial 847 finished with value: 0.8654869897806009 and parameters: {'alpha': 2.3218380524886357, 'ties': 'breslow'}. Best is trial 99 with value: 0.8654869897806009.[0m
[32m[I 2022-04-13 11:46:46,479][0m Trial 848 finished with value: 0.8636746249437476 and parameters: {'alpha': 2.180779165840301, 'ties': 'breslow'}. Best is trial 99 with value: 0.8654869897806009.[0m
[32m[I 2022-04-13 11:46:46,632][0m Trial 849 finished with value: 0.8654085943201592 and parameters: {'alpha': 2.060546043554109, 'ties': 'efron'}. Best is trial 99 with value: 0.8654869897806009.[0m
[32m[I 2022-04-13 11:46:46,806][0m Trial 850 finished with value: 0.8596957812210828 and parameters: {'alpha': 3.934908434192885, 'ties': 'efron'}. Best is trial 99 with value: 0.8654869897806009.[0m
[32m[I 2022-04-13 11:46:46,932][0m Trial 851 finished with value: 0.8643129825609158 and parameters: {'alpha': 2.2624391571367117, 'ties': 'breslow'}. Best is trial 99 with value: 0.8654869897806009.[0m
[32m[I 2022-04-13 11:46:47,094][0m Trial 852 finished with value: 0.8648486321634327 and parameters: {'alpha': 2.3883100152163776, 'ties': 'breslow'}. Best is trial 99 with value: 0.8654869897806009.[0m
[32m[I 2022-04-13 11:46:47,199][0m Trial 853 finished with value: 0.8648486321634327 and parameters: {'alpha': 2.380400243342814, 'ties': 'breslow'}. Best is trial 99 with value: 0.8654869897806009.[0m
[32m[I 2022-04-13 11:46:47,319][0m Trial 854 finished with value: 0.8641835106491502 and parameters: {'alpha': 2.1247812738410525, 'ties': 'efron'}. Best is trial 99 with value: 0.8654869897806009.[0m
[32m[I 2022-04-13 11:46:47,420][0m Trial 855 finished with value: 0.8648486321634327 and parameters: {'alpha': 2.4746919380821044, 'ties': 'breslow'}. Best is trial 99 with value: 0.8654869897806009.[0m
