[32m[I 2022-04-14 06:07:11,885][0m Trial 163 finished with value: 0.74089837306326 and parameters: {'loss': 'coxph', 'learning_rate': 0.0011471794690030585, 'n_estimators': 894, 'criterion': 'squared_error', 'min_samples_split': 7, 'min_samples_leaf': 1, 'min_weight_fraction_leaf': 0.08214741942055709, 'min_impurity_decrease': 0.05927694331917609, 'max_features': 0.7404839431832528, 'subsample': 0.38505731661233195, 'dropout_rate': 0.12172341347729101, 'ccp_alpha': 0.011423528592929805}. Best is trial 163 with value: 0.74089837306326.[0m
[32m[I 2022-04-14 06:10:02,767][0m Trial 164 finished with value: 0.7337191038216663 and parameters: {'loss': 'coxph', 'learning_rate': 0.0012982079847268185, 'n_estimators': 999, 'criterion': 'squared_error', 'min_samples_split': 7, 'min_samples_leaf': 1, 'min_weight_fraction_leaf': 0.08479987385762115, 'min_impurity_decrease': 0.05878257873020534, 'max_features': 0.7354852240124725, 'subsample': 0.3848745563472065, 'dropout_rate': 0.14158074492827696, 'ccp_alpha': 0.0011503880637212527}. Best is trial 163 with value: 0.74089837306326.[0m
[32m[I 2022-04-14 06:12:49,031][0m Trial 165 finished with value: 0.7293918701599119 and parameters: {'loss': 'coxph', 'learning_rate': 0.0012407566097321144, 'n_estimators': 984, 'criterion': 'squared_error', 'min_samples_split': 7, 'min_samples_leaf': 1, 'min_weight_fraction_leaf': 0.08833195877363129, 'min_impurity_decrease': 0.05465551807815677, 'max_features': 0.7232190459962555, 'subsample': 0.4187498447539504, 'dropout_rate': 0.15753145234511004, 'ccp_alpha': 0.010832390634700845}. Best is trial 163 with value: 0.74089837306326.[0m
[32m[I 2022-04-14 06:14:59,817][0m Trial 166 finished with value: 0.7329472423486602 and parameters: {'loss': 'coxph', 'learning_rate': 0.0010666149910328222, 'n_estimators': 872, 'criterion': 'squared_error', 'min_samples_split': 7, 'min_samples_leaf': 1, 'min_weight_fraction_leaf': 0.1002201360380538, 'min_impurity_decrease': 0.026468319301071422, 'max_features': 0.6849341574147423, 'subsample': 0.3777466413495885, 'dropout_rate': 0.13924826488815464, 'ccp_alpha': 0.001519943763743585}. Best is trial 163 with value: 0.74089837306326.[0m
[32m[I 2022-04-14 06:17:09,890][0m Trial 167 finished with value: 0.7222175238955462 and parameters: {'loss': 'coxph', 'learning_rate': 0.001101848208648278, 'n_estimators': 847, 'criterion': 'squared_error', 'min_samples_split': 7, 'min_samples_leaf': 1, 'min_weight_fraction_leaf': 0.09577013604062719, 'min_impurity_decrease': 0.023753057034595106, 'max_features': 0.17820009439878753, 'subsample': 0.3871381228896599, 'dropout_rate': 0.14385026744970103, 'ccp_alpha': 0.005323057497212971}. Best is trial 163 with value: 0.74089837306326.[0m
[32m[I 2022-04-14 06:19:40,436][0m Trial 168 finished with value: 0.7250526303641469 and parameters: {'loss': 'coxph', 'learning_rate': 0.0018543177375094696, 'n_estimators': 925, 'criterion': 'squared_error', 'min_samples_split': 7, 'min_samples_leaf': 1, 'min_weight_fraction_leaf': 0.04840902365895136, 'min_impurity_decrease': 0.06380088542569717, 'max_features': 0.7364609404869795, 'subsample': 0.33182556095607374, 'dropout_rate': 0.11265903166277094, 'ccp_alpha': 0.2847669562014543}. Best is trial 163 with value: 0.74089837306326.[0m
[32m[I 2022-04-14 06:21:48,669][0m Trial 169 finished with value: 0.35922938377005076 and parameters: {'loss': 'squared', 'learning_rate': 0.001382214130589336, 'n_estimators': 886, 'criterion': 'squared_error', 'min_samples_split': 7, 'min_samples_leaf': 1, 'min_weight_fraction_leaf': 0.10413629457798408, 'min_impurity_decrease': 0.031245909287081354, 'max_features': 0.6986661886983188, 'subsample': 0.3820123969732516, 'dropout_rate': 0.1924743392637646, 'ccp_alpha': 1.4735905935203097}. Best is trial 163 with value: 0.74089837306326.[0m
[32m[I 2022-04-14 06:24:19,675][0m Trial 170 finished with value: 0.7361726408609386 and parameters: {'loss': 'coxph', 'learning_rate': 0.0007224479971843204, 'n_estimators': 882, 'criterion': 'squared_error', 'min_samples_split': 7, 'min_samples_leaf': 1, 'min_weight_fraction_leaf': 0.05745468785563582, 'min_impurity_decrease': 0.04130147159146345, 'max_features': 0.7188046629328696, 'subsample': 0.3906323363923514, 'dropout_rate': 0.1279461504985509, 'ccp_alpha': 0.008786251812540807}. Best is trial 163 with value: 0.74089837306326.[0m
[32m[I 2022-04-14 06:26:41,915][0m Trial 171 finished with value: 0.7311460991175087 and parameters: {'loss': 'coxph', 'learning_rate': 0.0007431830269840138, 'n_estimators': 882, 'criterion': 'squared_error', 'min_samples_split': 7, 'min_samples_leaf': 1, 'min_weight_fraction_leaf': 0.05863385491378442, 'min_impurity_decrease': 0.04471201477742344, 'max_features': 0.7117697518581373, 'subsample': 0.3969152370123612, 'dropout_rate': 0.1251732975662589, 'ccp_alpha': 0.01159703310442163}. Best is trial 163 with value: 0.74089837306326.[0m
[32m[I 2022-04-14 06:28:33,112][0m Trial 172 finished with value: 0.7208651961502139 and parameters: {'loss': 'coxph', 'learning_rate': 0.0007415758567812371, 'n_estimators': 812, 'criterion': 'squared_error', 'min_samples_split': 7, 'min_samples_leaf': 1, 'min_weight_fraction_leaf': 0.08521748644574403, 'min_impurity_decrease': 0.018676819530935484, 'max_features': 0.7562448437075869, 'subsample': 0.3498558235655645, 'dropout_rate': 0.1702587281437676, 'ccp_alpha': 0.09811260962878827}. Best is trial 163 with value: 0.74089837306326.[0m
[32m[I 2022-04-14 06:31:53,850][0m Trial 173 finished with value: 0.7151200225522089 and parameters: {'loss': 'coxph', 'learning_rate': 0.001055266476717745, 'n_estimators': 1000, 'criterion': 'squared_error', 'min_samples_split': 7, 'min_samples_leaf': 1, 'min_weight_fraction_leaf': 0.06303854437437693, 'min_impurity_decrease': 0.06742051315120694, 'max_features': 0.7246611852521204, 'subsample': 0.406071521738825, 'dropout_rate': 0.1437740008890346, 'ccp_alpha': 0.1714336839484797}. Best is trial 163 with value: 0.74089837306326.[0m
[32m[I 2022-04-14 06:33:48,276][0m Trial 174 finished with value: 0.5 and parameters: {'loss': 'coxph', 'learning_rate': 0.0013566429300703785, 'n_estimators': 775, 'criterion': 'squared_error', 'min_samples_split': 7, 'min_samples_leaf': 1, 'min_weight_fraction_leaf': 0.045036225505277694, 'min_impurity_decrease': 0.7049967757532849, 'max_features': 0.793517561726974, 'subsample': 0.4360001044575249, 'dropout_rate': 0.09529154452025593, 'ccp_alpha': 0.0014350421001668445}. Best is trial 163 with value: 0.74089837306326.[0m
[32m[I 2022-04-14 06:36:15,273][0m Trial 175 finished with value: 0.6964895217972178 and parameters: {'loss': 'coxph', 'learning_rate': 0.000541815985340788, 'n_estimators': 938, 'criterion': 'squared_error', 'min_samples_split': 7, 'min_samples_leaf': 1, 'min_weight_fraction_leaf': 0.052278843795692254, 'min_impurity_decrease': 0.051283066767760274, 'max_features': 0.6921588226323386, 'subsample': 0.31633048275435116, 'dropout_rate': 0.17269046960097836, 'ccp_alpha': 0.31484876623475405}. Best is trial 163 with value: 0.74089837306326.[0m
[32m[I 2022-04-14 06:38:29,967][0m Trial 176 finished with value: 0.7307675185318336 and parameters: {'loss': 'coxph', 'learning_rate': 0.0009971630080870568, 'n_estimators': 859, 'criterion': 'squared_error', 'min_samples_split': 8, 'min_samples_leaf': 1, 'min_weight_fraction_leaf': 0.09520473338504247, 'min_impurity_decrease': 0.11041850026762046, 'max_features': 0.7419241155162789, 'subsample': 0.4875107801340027, 'dropout_rate': 0.20099153225991473, 'ccp_alpha': 0.09552745025600703}. Best is trial 163 with value: 0.74089837306326.[0m
[32m[I 2022-04-14 06:40:17,283][0m Trial 177 finished with value: 0.7199350606593435 and parameters: {'loss': 'coxph', 'learning_rate': 0.0017020766214753894, 'n_estimators': 739, 'criterion': 'squared_error', 'min_samples_split': 7, 'min_samples_leaf': 1, 'min_weight_fraction_leaf': 0.08413961447309536, 'min_impurity_decrease': 0.03954989723732938, 'max_features': 0.7660092526597734, 'subsample': 0.37196290393166925, 'dropout_rate': 0.1307691111299751, 'ccp_alpha': 0.254880757814405}. Best is trial 163 with value: 0.74089837306326.[0m
[32m[I 2022-04-14 06:42:14,795][0m Trial 178 finished with value: 0.6603272078211297 and parameters: {'loss': 'coxph', 'learning_rate': 0.0007371312698326926, 'n_estimators': 810, 'criterion': 'squared_error', 'min_samples_split': 7, 'min_samples_leaf': 2, 'min_weight_fraction_leaf': 0.4977890177171042, 'min_impurity_decrease': 0.08810313364094957, 'max_features': 0.7173138408622134, 'subsample': 0.4235673086190998, 'dropout_rate': 0.16175326403228357, 'ccp_alpha': 0.182441827696745}. Best is trial 163 with value: 0.74089837306326.[0m
[32m[I 2022-04-14 06:44:28,648][0m Trial 179 finished with value: 0.7246767139402037 and parameters: {'loss': 'coxph', 'learning_rate': 0.00047833979214446075, 'n_estimators': 892, 'criterion': 'absolute_error', 'min_samples_split': 7, 'min_samples_leaf': 1, 'min_weight_fraction_leaf': 0.06331575184480497, 'min_impurity_decrease': 0.0648014884449931, 'max_features': 0.7954910870078333, 'subsample': 0.47110459327574045, 'dropout_rate': 0.1924482166621621, 'ccp_alpha': 0.005005867790456753}. Best is trial 163 with value: 0.74089837306326.[0m
[32m[I 2022-04-14 06:47:27,610][0m Trial 180 finished with value: 0.5 and parameters: {'loss': 'coxph', 'learning_rate': 0.001071790145857659, 'n_estimators': 950, 'criterion': 'squared_error', 'min_samples_split': 7, 'min_samples_leaf': 2, 'min_weight_fraction_leaf': 0.04018746105175928, 'min_impurity_decrease': 0.11031386226928452, 'max_features': 0.6683230219641773, 'subsample': 0.9360129267044062, 'dropout_rate': 0.06339851236616145, 'ccp_alpha': 0.411067515064022}. Best is trial 163 with value: 0.74089837306326.[0m
[32m[I 2022-04-14 06:49:05,922][0m Trial 181 finished with value: 0.7268008801898762 and parameters: {'loss': 'coxph', 'learning_rate': 0.0006776479721461131, 'n_estimators': 758, 'criterion': 'squared_error', 'min_samples_split': 7, 'min_samples_leaf': 1, 'min_weight_fraction_leaf': 0.07644963414492034, 'min_impurity_decrease': 0.0775905204157209, 'max_features': 0.6784706281304325, 'subsample': 0.4985083983033488, 'dropout_rate': 0.20400626964901242, 'ccp_alpha': 0.19645110920365932}. Best is trial 163 with value: 0.74089837306326.[0m
[32m[I 2022-04-14 06:51:18,330][0m Trial 182 finished with value: 0.7258779148312795 and parameters: {'loss': 'coxph', 'learning_rate': 0.0009253457285638281, 'n_estimators': 844, 'criterion': 'squared_error', 'min_samples_split': 7, 'min_samples_leaf': 1, 'min_weight_fraction_leaf': 0.11085396566896445, 'min_impurity_decrease': 0.1471489930420205, 'max_features': 0.653990155401265, 'subsample': 0.44092535983300146, 'dropout_rate': 0.2138268039552224, 'ccp_alpha': 0.12749763874513872}. Best is trial 163 with value: 0.74089837306326.[0m
[32m[I 2022-04-14 06:54:15,310][0m Trial 183 finished with value: 0.71336867104313 and parameters: {'loss': 'coxph', 'learning_rate': 0.00028380694919283826, 'n_estimators': 1000, 'criterion': 'squared_error', 'min_samples_split': 7, 'min_samples_leaf': 1, 'min_weight_fraction_leaf': 0.0804529637413153, 'min_impurity_decrease': 0.018813561972513666, 'max_features': 0.7464926150618362, 'subsample': 0.39592362027214456, 'dropout_rate': 0.17267860882160646, 'ccp_alpha': 0.276344543450618}. Best is trial 163 with value: 0.74089837306326.[0m
[32m[I 2022-04-14 06:56:26,160][0m Trial 184 finished with value: 0.7294764992929856 and parameters: {'loss': 'coxph', 'learning_rate': 0.0005649827894164001, 'n_estimators': 873, 'criterion': 'squared_error', 'min_samples_split': 8, 'min_samples_leaf': 1, 'min_weight_fraction_leaf': 0.06628405564896869, 'min_impurity_decrease': 0.11861287770127371, 'max_features': 0.6969025887423229, 'subsample': 0.48126896797902274, 'dropout_rate': 0.149432281002898, 'ccp_alpha': 0.09118862814956577}. Best is trial 163 with value: 0.74089837306326.[0m
[32m[I 2022-04-14 06:58:52,912][0m Trial 185 finished with value: 0.7259537636272629 and parameters: {'loss': 'coxph', 'learning_rate': 0.0012745043424931286, 'n_estimators': 914, 'criterion': 'squared_error', 'min_samples_split': 7, 'min_samples_leaf': 1, 'min_weight_fraction_leaf': 0.09782181316889992, 'min_impurity_decrease': 0.052105707474275495, 'max_features': 0.6062586860206274, 'subsample': 0.44879094211419, 'dropout_rate': 0.1153230223099545, 'ccp_alpha': 0.2116263835304643}. Best is trial 163 with value: 0.74089837306326.[0m
[32m[I 2022-04-14 07:00:02,975][0m Trial 186 finished with value: 0.7210175781231613 and parameters: {'loss': 'coxph', 'learning_rate': 0.0018240648953710876, 'n_estimators': 693, 'criterion': 'squared_error', 'min_samples_split': 7, 'min_samples_leaf': 2, 'min_weight_fraction_leaf': 0.05491679201853878, 'min_impurity_decrease': 0.13021707138194666, 'max_features': 0.7701564565600154, 'subsample': 0.3692582190603648, 'dropout_rate': 0.24324833786242625, 'ccp_alpha': 0.0999823286342018}. Best is trial 163 with value: 0.74089837306326.[0m
[32m[I 2022-04-14 07:01:50,363][0m Trial 187 finished with value: 0.7036861990866067 and parameters: {'loss': 'coxph', 'learning_rate': 0.00044489114972367936, 'n_estimators': 804, 'criterion': 'squared_error', 'min_samples_split': 7, 'min_samples_leaf': 1, 'min_weight_fraction_leaf': 0.030644393362822934, 'min_impurity_decrease': 0.1477647361525986, 'max_features': 0.7161169072312843, 'subsample': 0.41653314707222505, 'dropout_rate': 0.18711422724792282, 'ccp_alpha': 0.3058607148628705}. Best is trial 163 with value: 0.74089837306326.[0m
[32m[I 2022-04-14 07:02:59,726][0m Trial 188 finished with value: 0.7278457731174826 and parameters: {'loss': 'coxph', 'learning_rate': 0.0008265851290819108, 'n_estimators': 647, 'criterion': 'squared_error', 'min_samples_split': 7, 'min_samples_leaf': 2, 'min_weight_fraction_leaf': 0.07963637872068183, 'min_impurity_decrease': 0.09685783464811322, 'max_features': 0.7308374584814767, 'subsample': 0.5030354206894007, 'dropout_rate': 0.08298790782548379, 'ccp_alpha': 0.21436271792201145}. Best is trial 163 with value: 0.74089837306326.[0m
[32m[I 2022-04-14 07:04:31,187][0m Trial 189 finished with value: 0.7306171495291103 and parameters: {'loss': 'coxph', 'learning_rate': 0.000691589636129941, 'n_estimators': 727, 'criterion': 'squared_error', 'min_samples_split': 8, 'min_samples_leaf': 1, 'min_weight_fraction_leaf': 0.069545436590809, 'min_impurity_decrease': 0.06719068092840737, 'max_features': 0.6802238448909701, 'subsample': 0.4712889696255207, 'dropout_rate': 0.13344267331126755, 'ccp_alpha': 0.09329549304007655}. Best is trial 163 with value: 0.74089837306326.[0m
[32m[I 2022-04-14 07:06:18,215][0m Trial 190 finished with value: 0.710125930462458 and parameters: {'loss': 'coxph', 'learning_rate': 0.0015482828295258085, 'n_estimators': 839, 'criterion': 'squared_error', 'min_samples_split': 7, 'min_samples_leaf': 2, 'min_weight_fraction_leaf': 0.08599276337073386, 'min_impurity_decrease': 0.033761761606995885, 'max_features': 0.7589136507770337, 'subsample': 0.39266398046324047, 'dropout_rate': 0.2191022503098048, 'ccp_alpha': 0.41396314584166627}. Best is trial 163 with value: 0.74089837306326.[0m
[32m[I 2022-04-14 07:08:45,328][0m Trial 191 finished with value: 0.7351948404447894 and parameters: {'loss': 'coxph', 'learning_rate': 0.0007569950860553382, 'n_estimators': 903, 'criterion': 'squared_error', 'min_samples_split': 7, 'min_samples_leaf': 1, 'min_weight_fraction_leaf': 0.058203937296820156, 'min_impurity_decrease': 0.0390993473633887, 'max_features': 0.7093806779007601, 'subsample': 0.40390557643886765, 'dropout_rate': 0.12153065177717223, 'ccp_alpha': 0.014611378687967478}. Best is trial 163 with value: 0.74089837306326.[0m
[32m[I 2022-04-14 07:11:23,642][0m Trial 192 finished with value: 0.7264780444566039 and parameters: {'loss': 'coxph', 'learning_rate': 0.0010182601659189403, 'n_estimators': 929, 'criterion': 'squared_error', 'min_samples_split': 7, 'min_samples_leaf': 1, 'min_weight_fraction_leaf': 0.05743106232095217, 'min_impurity_decrease': 0.016436465421006505, 'max_features': 0.7375535731640397, 'subsample': 0.43020122741015604, 'dropout_rate': 0.10564858100855645, 'ccp_alpha': 0.012496712845478937}. Best is trial 163 with value: 0.74089837306326.[0m
[32m[I 2022-04-14 07:13:43,377][0m Trial 193 finished with value: 0.5 and parameters: {'loss': 'coxph', 'learning_rate': 0.0005070145307924033, 'n_estimators': 894, 'criterion': 'squared_error', 'min_samples_split': 7, 'min_samples_leaf': 1, 'min_weight_fraction_leaf': 0.06703137381497146, 'min_impurity_decrease': 0.5782246771516215, 'max_features': 0.7818711889882589, 'subsample': 0.44904113106597543, 'dropout_rate': 0.14909180387530582, 'ccp_alpha': 0.16670519513148616}. Best is trial 163 with value: 0.74089837306326.[0m
[32m[I 2022-04-14 07:14:36,052][0m Trial 194 finished with value: 0.7274317850987913 and parameters: {'loss': 'coxph', 'learning_rate': 0.00036008112731443585, 'n_estimators': 552, 'criterion': 'squared_error', 'min_samples_split': 7, 'min_samples_leaf': 1, 'min_weight_fraction_leaf': 0.04101101588861816, 'min_impurity_decrease': 0.0774659977375371, 'max_features': 0.7045203919169764, 'subsample': 0.3400552982360269, 'dropout_rate': 0.18072463416843648, 'ccp_alpha': 0.002212166248567746}. Best is trial 163 with value: 0.74089837306326.[0m
[32m[I 2022-04-14 07:16:45,700][0m Trial 195 finished with value: 0.7204947157393985 and parameters: {'loss': 'coxph', 'learning_rate': 0.0007818885560892193, 'n_estimators': 868, 'criterion': 'squared_error', 'min_samples_split': 7, 'min_samples_leaf': 1, 'min_weight_fraction_leaf': 0.07622574900870609, 'min_impurity_decrease': 0.11174812253426095, 'max_features': 0.660910307018704, 'subsample': 0.3637770365537515, 'dropout_rate': 0.12813261092057202, 'ccp_alpha': 0.17609419179217742}. Best is trial 163 with value: 0.74089837306326.[0m
[32m[I 2022-04-14 07:19:38,263][0m Trial 196 finished with value: 0.7021434987851285 and parameters: {'loss': 'coxph', 'learning_rate': 0.0012239534101583804, 'n_estimators': 962, 'criterion': 'squared_error', 'min_samples_split': 7, 'min_samples_leaf': 2, 'min_weight_fraction_leaf': 0.05018711802572502, 'min_impurity_decrease': 0.18983639448933423, 'max_features': 0.6835947772429489, 'subsample': 0.4069995752437316, 'dropout_rate': 0.03296125640676975, 'ccp_alpha': 0.28505575600025723}. Best is trial 163 with value: 0.74089837306326.[0m
[32m[I 2022-04-14 07:21:26,859][0m Trial 197 finished with value: 0.7352353868497656 and parameters: {'loss': 'coxph', 'learning_rate': 0.0005566649644493833, 'n_estimators': 789, 'criterion': 'squared_error', 'min_samples_split': 7, 'min_samples_leaf': 1, 'min_weight_fraction_leaf': 0.09154450333252402, 'min_impurity_decrease': 0.045469026373182134, 'max_features': 0.7387490418276623, 'subsample': 0.4946410560492119, 'dropout_rate': 0.15950302514762743, 'ccp_alpha': 0.13153172516871892}. Best is trial 163 with value: 0.74089837306326.[0m
[32m[I 2022-04-14 07:23:14,015][0m Trial 198 finished with value: 0.7346218857195532 and parameters: {'loss': 'coxph', 'learning_rate': 0.0005670626802102622, 'n_estimators': 776, 'criterion': 'squared_error', 'min_samples_split': 7, 'min_samples_leaf': 1, 'min_weight_fraction_leaf': 0.10686425165823987, 'min_impurity_decrease': 0.002048658611522168, 'max_features': 0.7553736074574197, 'subsample': 0.4728609509145307, 'dropout_rate': 0.15801347317170783, 'ccp_alpha': 0.10383927631109187}. Best is trial 163 with value: 0.74089837306326.[0m
[32m[I 2022-04-14 07:24:50,918][0m Trial 199 finished with value: 0.7329672848805475 and parameters: {'loss': 'coxph', 'learning_rate': 0.0006085996909718176, 'n_estimators': 770, 'criterion': 'squared_error', 'min_samples_split': 7, 'min_samples_leaf': 1, 'min_weight_fraction_leaf': 0.11238050154297995, 'min_impurity_decrease': 0.002873336978394758, 'max_features': 0.7451834211760574, 'subsample': 0.4644481148609514, 'dropout_rate': 0.1488512418406423, 'ccp_alpha': 0.09116424837803394}. Best is trial 163 with value: 0.74089837306326.[0m
[32m[I 2022-04-14 07:26:42,299][0m Trial 200 finished with value: 0.2723568372170222 and parameters: {'loss': 'squared', 'learning_rate': 0.0005772933786260594, 'n_estimators': 779, 'criterion': 'squared_error', 'min_samples_split': 7, 'min_samples_leaf': 1, 'min_weight_fraction_leaf': 0.1321478268371697, 'min_impurity_decrease': 0.003255234129719696, 'max_features': 0.7446340249062909, 'subsample': 0.45971463475776203, 'dropout_rate': 0.15844310328191366, 'ccp_alpha': 0.009849111138121702}. Best is trial 163 with value: 0.74089837306326.[0m
[32m[I 2022-04-14 07:28:36,936][0m Trial 201 finished with value: 0.7320625346373175 and parameters: {'loss': 'coxph', 'learning_rate': 0.0006403898421577353, 'n_estimators': 799, 'criterion': 'squared_error', 'min_samples_split': 7, 'min_samples_leaf': 1, 'min_weight_fraction_leaf': 0.11309968141456227, 'min_impurity_decrease': 0.03264223822984261, 'max_features': 0.7386589973511718, 'subsample': 0.47033197667586696, 'dropout_rate': 0.11825840866572174, 'ccp_alpha': 0.0965147503924151}. Best is trial 163 with value: 0.74089837306326.[0m
[32m[I 2022-04-14 07:30:34,332][0m Trial 202 finished with value: 0.7300420255517353 and parameters: {'loss': 'coxph', 'learning_rate': 0.00046463190605856034, 'n_estimators': 767, 'criterion': 'squared_error', 'min_samples_split': 7, 'min_samples_leaf': 1, 'min_weight_fraction_leaf': 0.10044453209519999, 'min_impurity_decrease': 0.004167542327400971, 'max_features': 0.7190075361487437, 'subsample': 0.4980301922078509, 'dropout_rate': 0.09485826266565396, 'ccp_alpha': 0.12723695211697358}. Best is trial 163 with value: 0.74089837306326.[0m
