[32m[I 2022-04-13 11:43:57,890][0m Trial 189 finished with value: 0.8515949699867061 and parameters: {'splitter': 'random', 'min_samples_split': 0.3109242937560848, 'min_samples_leaf': 0.014110152067373205, 'min_weight_fraction_leaf': 0.07191247958367739, 'max_features': 0.5239835676392582}. Best is trial 156 with value: 0.860262530255716.[0m
[32m[I 2022-04-13 11:43:57,926][0m Trial 190 finished with value: 0.860262530255716 and parameters: {'splitter': 'random', 'min_samples_split': 0.26786413453493, 'min_samples_leaf': 0.02289178406754622, 'min_weight_fraction_leaf': 0.0451992650622891, 'max_features': 0.5538936012641845}. Best is trial 156 with value: 0.860262530255716.[0m
[32m[I 2022-04-13 11:43:57,961][0m Trial 191 finished with value: 0.860262530255716 and parameters: {'splitter': 'random', 'min_samples_split': 0.26663288057805246, 'min_samples_leaf': 0.022141940698889383, 'min_weight_fraction_leaf': 0.04635640636931714, 'max_features': 0.5524341675742858}. Best is trial 156 with value: 0.860262530255716.[0m
[32m[I 2022-04-13 11:43:57,997][0m Trial 192 finished with value: 0.7999200547726107 and parameters: {'splitter': 'random', 'min_samples_split': 0.26595603749160845, 'min_samples_leaf': 0.025312445868568963, 'min_weight_fraction_leaf': 0.04715635483638189, 'max_features': 0.4950719572275147}. Best is trial 156 with value: 0.860262530255716.[0m
[32m[I 2022-04-13 11:43:58,033][0m Trial 193 finished with value: 0.8537871744804019 and parameters: {'splitter': 'random', 'min_samples_split': 0.2801032028678981, 'min_samples_leaf': 0.015623594699985132, 'min_weight_fraction_leaf': 0.055791494474170554, 'max_features': 0.5434683032702569}. Best is trial 156 with value: 0.860262530255716.[0m
[32m[I 2022-04-13 11:43:58,068][0m Trial 194 finished with value: 0.855608859465337 and parameters: {'splitter': 'random', 'min_samples_split': 0.25503629249830245, 'min_samples_leaf': 0.03577576269627823, 'min_weight_fraction_leaf': 0.04560527154231934, 'max_features': 0.571537926809095}. Best is trial 156 with value: 0.860262530255716.[0m
[32m[I 2022-04-13 11:43:58,112][0m Trial 195 finished with value: 0.8495779719052834 and parameters: {'splitter': 'random', 'min_samples_split': 0.29550747721906007, 'min_samples_leaf': 0.0011093744357619111, 'min_weight_fraction_leaf': 0.07746392876643962, 'max_features': 0.5055702768807034}. Best is trial 156 with value: 0.860262530255716.[0m
[32m[I 2022-04-13 11:43:58,173][0m Trial 196 finished with value: 0.860262530255716 and parameters: {'splitter': 'random', 'min_samples_split': 0.2683196281811778, 'min_samples_leaf': 0.02445261462387293, 'min_weight_fraction_leaf': 0.0583682491476747, 'max_features': 0.527787127439918}. Best is trial 156 with value: 0.860262530255716.[0m
[32m[I 2022-04-13 11:43:58,237][0m Trial 197 finished with value: 0.860262530255716 and parameters: {'splitter': 'random', 'min_samples_split': 0.26519898979379114, 'min_samples_leaf': 0.024953964493792287, 'min_weight_fraction_leaf': 0.05910869626356019, 'max_features': 0.528178498173279}. Best is trial 156 with value: 0.860262530255716.[0m
[32m[I 2022-04-13 11:43:58,274][0m Trial 198 finished with value: 0.860262530255716 and parameters: {'splitter': 'random', 'min_samples_split': 0.2655314998231335, 'min_samples_leaf': 0.02524148341227729, 'min_weight_fraction_leaf': 0.04414027100378226, 'max_features': 0.5174428079047384}. Best is trial 156 with value: 0.860262530255716.[0m
[32m[I 2022-04-13 11:43:58,311][0m Trial 199 finished with value: 0.860262530255716 and parameters: {'splitter': 'random', 'min_samples_split': 0.26447053041939145, 'min_samples_leaf': 0.024725772779242677, 'min_weight_fraction_leaf': 0.04839140790359907, 'max_features': 0.5220082370163804}. Best is trial 156 with value: 0.860262530255716.[0m
[32m[I 2022-04-13 11:43:58,348][0m Trial 200 finished with value: 0.855608859465337 and parameters: {'splitter': 'random', 'min_samples_split': 0.25381502972051917, 'min_samples_leaf': 0.02525538172659171, 'min_weight_fraction_leaf': 0.044256586692977704, 'max_features': 0.5198647864262581}. Best is trial 156 with value: 0.860262530255716.[0m
[32m[I 2022-04-13 11:43:58,384][0m Trial 201 finished with value: 0.7999200547726107 and parameters: {'splitter': 'random', 'min_samples_split': 0.2662505760296099, 'min_samples_leaf': 0.021710650807667178, 'min_weight_fraction_leaf': 0.05437886103579953, 'max_features': 0.4681706773667419}. Best is trial 156 with value: 0.860262530255716.[0m
[32m[I 2022-04-13 11:43:58,419][0m Trial 202 finished with value: 0.8536735077998788 and parameters: {'splitter': 'random', 'min_samples_split': 0.26462318226501025, 'min_samples_leaf': 0.03500111569858061, 'min_weight_fraction_leaf': 0.08171118604137868, 'max_features': 0.5213010636131847}. Best is trial 156 with value: 0.860262530255716.[0m
[32m[I 2022-04-13 11:43:58,455][0m Trial 203 finished with value: 0.855608859465337 and parameters: {'splitter': 'random', 'min_samples_split': 0.2546362410913553, 'min_samples_leaf': 0.01231764281231222, 'min_weight_fraction_leaf': 0.04522292244379749, 'max_features': 0.5380106401627563}. Best is trial 156 with value: 0.860262530255716.[0m
[32m[I 2022-04-13 11:43:58,510][0m Trial 204 finished with value: 0.7999200547726107 and parameters: {'splitter': 'random', 'min_samples_split': 0.2715114841585269, 'min_samples_leaf': 0.02675131476246974, 'min_weight_fraction_leaf': 0.05791261797183541, 'max_features': 0.4982208442134165}. Best is trial 156 with value: 0.860262530255716.[0m
[32m[I 2022-04-13 11:43:58,570][0m Trial 205 finished with value: 0.860262530255716 and parameters: {'splitter': 'random', 'min_samples_split': 0.26413917026412936, 'min_samples_leaf': 0.011932687064600347, 'min_weight_fraction_leaf': 0.07469342045148926, 'max_features': 0.5382910315939936}. Best is trial 156 with value: 0.860262530255716.[0m
[32m[I 2022-04-13 11:43:58,608][0m Trial 206 finished with value: 0.7932323371363277 and parameters: {'splitter': 'random', 'min_samples_split': 0.25792202465811065, 'min_samples_leaf': 0.010935594220195587, 'min_weight_fraction_leaf': 0.07868890091643457, 'max_features': 0.4369621586555671}. Best is trial 156 with value: 0.860262530255716.[0m
[32m[I 2022-04-13 11:43:58,643][0m Trial 207 finished with value: 0.8507321463909226 and parameters: {'splitter': 'random', 'min_samples_split': 0.2514247405429898, 'min_samples_leaf': 0.04094467179894731, 'min_weight_fraction_leaf': 0.10266925876807656, 'max_features': 0.5360722232009288}. Best is trial 156 with value: 0.860262530255716.[0m
[32m[I 2022-04-13 11:43:58,679][0m Trial 208 finished with value: 0.7999200547726107 and parameters: {'splitter': 'random', 'min_samples_split': 0.27336249581270716, 'min_samples_leaf': 0.02900998115921978, 'min_weight_fraction_leaf': 0.0408993154306158, 'max_features': 0.49182077386189615}. Best is trial 156 with value: 0.860262530255716.[0m
[32m[I 2022-04-13 11:43:58,714][0m Trial 209 finished with value: 0.8495779719052834 and parameters: {'splitter': 'random', 'min_samples_split': 0.28982796991678467, 'min_samples_leaf': 0.021981337505427384, 'min_weight_fraction_leaf': 0.06993489105433476, 'max_features': 0.5135100094526723}. Best is trial 156 with value: 0.860262530255716.[0m
[32m[I 2022-04-13 11:43:58,750][0m Trial 210 finished with value: 0.678946779212211 and parameters: {'splitter': 'random', 'min_samples_split': 0.263296027177775, 'min_samples_leaf': 0.008214807537363613, 'min_weight_fraction_leaf': 0.0885745893468976, 'max_features': 0.4761746019619333}. Best is trial 156 with value: 0.860262530255716.[0m
[32m[I 2022-04-13 11:43:58,787][0m Trial 211 finished with value: 0.860262530255716 and parameters: {'splitter': 'random', 'min_samples_split': 0.26954446731024195, 'min_samples_leaf': 0.01750248147713728, 'min_weight_fraction_leaf': 0.0519860152227217, 'max_features': 0.5434898647039613}. Best is trial 156 with value: 0.860262530255716.[0m
[32m[I 2022-04-13 11:43:58,823][0m Trial 212 finished with value: 0.860262530255716 and parameters: {'splitter': 'random', 'min_samples_split': 0.264108749323744, 'min_samples_leaf': 0.022339780914769576, 'min_weight_fraction_leaf': 0.05417835787399875, 'max_features': 0.5358889999808137}. Best is trial 156 with value: 0.860262530255716.[0m
[32m[I 2022-04-13 11:43:58,859][0m Trial 213 finished with value: 0.8537871744804019 and parameters: {'splitter': 'random', 'min_samples_split': 0.2768778907617494, 'min_samples_leaf': 0.01837187716446488, 'min_weight_fraction_leaf': 0.051606572807272925, 'max_features': 0.5812058230410991}. Best is trial 156 with value: 0.860262530255716.[0m
[32m[I 2022-04-13 11:43:58,893][0m Trial 214 finished with value: 0.6332669867606551 and parameters: {'splitter': 'random', 'min_samples_split': 0.2510022342843087, 'min_samples_leaf': 0.31916854645041026, 'min_weight_fraction_leaf': 0.07208666699295785, 'max_features': 0.5477948058684933}. Best is trial 156 with value: 0.860262530255716.[0m
[32m[I 2022-04-13 11:43:58,936][0m Trial 215 finished with value: 0.860262530255716 and parameters: {'splitter': 'random', 'min_samples_split': 0.2734758162143754, 'min_samples_leaf': 0.010527819678380122, 'min_weight_fraction_leaf': 0.061316990064379885, 'max_features': 0.5555680109356169}. Best is trial 156 with value: 0.860262530255716.[0m
[32m[I 2022-04-13 11:43:58,971][0m Trial 216 finished with value: 0.8537871744804019 and parameters: {'splitter': 'random', 'min_samples_split': 0.2870761308851531, 'min_samples_leaf': 0.03508467249261505, 'min_weight_fraction_leaf': 0.06253273913186087, 'max_features': 0.585290314486735}. Best is trial 156 with value: 0.860262530255716.[0m
[32m[I 2022-04-13 11:43:59,029][0m Trial 217 finished with value: 0.855608859465337 and parameters: {'splitter': 'random', 'min_samples_split': 0.26012850362698964, 'min_samples_leaf': 0.0016795434095207788, 'min_weight_fraction_leaf': 0.07582758962930283, 'max_features': 0.5601750351308655}. Best is trial 156 with value: 0.860262530255716.[0m
[32m[I 2022-04-13 11:43:59,096][0m Trial 218 finished with value: 0.8547474595641333 and parameters: {'splitter': 'random', 'min_samples_split': 0.268830910899848, 'min_samples_leaf': 0.013031766581812937, 'min_weight_fraction_leaf': 0.09549091067030104, 'max_features': 0.5129998112883924}. Best is trial 156 with value: 0.860262530255716.[0m
[32m[I 2022-04-13 11:43:59,167][0m Trial 219 finished with value: 0.8537871744804019 and parameters: {'splitter': 'random', 'min_samples_split': 0.2774823863660464, 'min_samples_leaf': 0.04046350940465199, 'min_weight_fraction_leaf': 0.06055422809663777, 'max_features': 0.5624209009872861}. Best is trial 156 with value: 0.860262530255716.[0m
[32m[I 2022-04-13 11:43:59,250][0m Trial 220 finished with value: 0.855608859465337 and parameters: {'splitter': 'random', 'min_samples_split': 0.2523357841947959, 'min_samples_leaf': 0.0011223383924340215, 'min_weight_fraction_leaf': 0.04015233467414006, 'max_features': 0.5795530807903309}. Best is trial 156 with value: 0.860262530255716.[0m
[32m[I 2022-04-13 11:43:59,326][0m Trial 221 finished with value: 0.855608859465337 and parameters: {'splitter': 'random', 'min_samples_split': 0.26159042780795766, 'min_samples_leaf': 0.011576067227939869, 'min_weight_fraction_leaf': 0.06754149961948795, 'max_features': 0.5296753894483268}. Best is trial 156 with value: 0.860262530255716.[0m
[32m[I 2022-04-13 11:43:59,401][0m Trial 222 finished with value: 0.860262530255716 and parameters: {'splitter': 'random', 'min_samples_split': 0.2735645504387905, 'min_samples_leaf': 0.012657206002214393, 'min_weight_fraction_leaf': 0.04880327881083654, 'max_features': 0.5442057409173244}. Best is trial 156 with value: 0.860262530255716.[0m
[32m[I 2022-04-13 11:43:59,467][0m Trial 223 finished with value: 0.8537871744804019 and parameters: {'splitter': 'random', 'min_samples_split': 0.2856933866945478, 'min_samples_leaf': 0.028048822522475876, 'min_weight_fraction_leaf': 0.08382935774234096, 'max_features': 0.5244328439614443}. Best is trial 156 with value: 0.860262530255716.[0m
[32m[I 2022-04-13 11:43:59,538][0m Trial 224 finished with value: 0.860262530255716 and parameters: {'splitter': 'random', 'min_samples_split': 0.2645034384760822, 'min_samples_leaf': 0.019897512212890586, 'min_weight_fraction_leaf': 0.04908485381248552, 'max_features': 0.5398534894260901}. Best is trial 156 with value: 0.860262530255716.[0m
[32m[I 2022-04-13 11:43:59,621][0m Trial 225 finished with value: 0.860262530255716 and parameters: {'splitter': 'random', 'min_samples_split': 0.27417170894439774, 'min_samples_leaf': 0.02053214290423239, 'min_weight_fraction_leaf': 0.05424333334423587, 'max_features': 0.5483264478756923}. Best is trial 156 with value: 0.860262530255716.[0m
[32m[I 2022-04-13 11:43:59,691][0m Trial 226 finished with value: 0.8537871744804019 and parameters: {'splitter': 'random', 'min_samples_split': 0.27668802698776523, 'min_samples_leaf': 0.03343032018283912, 'min_weight_fraction_leaf': 0.0388904110023707, 'max_features': 0.5881603414720858}. Best is trial 156 with value: 0.860262530255716.[0m
[32m[I 2022-04-13 11:43:59,801][0m Trial 227 finished with value: 0.8073173815642989 and parameters: {'splitter': 'random', 'min_samples_split': 0.2503277277535702, 'min_samples_leaf': 0.02772869986552937, 'min_weight_fraction_leaf': 0.04755390841145897, 'max_features': 0.4992846684765425}. Best is trial 156 with value: 0.860262530255716.[0m
[32m[I 2022-04-13 11:43:59,891][0m Trial 228 finished with value: 0.7523633936553314 and parameters: {'splitter': 'random', 'min_samples_split': 0.2977579483150212, 'min_samples_leaf': 0.024168107440047104, 'min_weight_fraction_leaf': 0.05468092013600951, 'max_features': 0.013896000231734373}. Best is trial 156 with value: 0.860262530255716.[0m
[32m[I 2022-04-13 11:43:59,967][0m Trial 229 finished with value: 0.6188081862944745 and parameters: {'splitter': 'random', 'min_samples_split': 0.2643572085876672, 'min_samples_leaf': 0.38542633817258715, 'min_weight_fraction_leaf': 0.07299840631194816, 'max_features': 0.5101182911608704}. Best is trial 156 with value: 0.860262530255716.[0m
[32m[I 2022-04-13 11:44:00,037][0m Trial 230 finished with value: 0.8537871744804019 and parameters: {'splitter': 'random', 'min_samples_split': 0.2870446093901885, 'min_samples_leaf': 0.0439841481030811, 'min_weight_fraction_leaf': 0.04255587209190724, 'max_features': 0.5364356013957072}. Best is trial 156 with value: 0.860262530255716.[0m
[32m[I 2022-04-13 11:44:00,108][0m Trial 231 finished with value: 0.6213855651066278 and parameters: {'splitter': 'random', 'min_samples_split': 0.2731374628078379, 'min_samples_leaf': 0.017439784702027235, 'min_weight_fraction_leaf': 0.46289107256580436, 'max_features': 0.5391176620063819}. Best is trial 156 with value: 0.860262530255716.[0m
[32m[I 2022-04-13 11:44:00,182][0m Trial 232 finished with value: 0.855608859465337 and parameters: {'splitter': 'random', 'min_samples_split': 0.25809937196301036, 'min_samples_leaf': 0.009287144909268798, 'min_weight_fraction_leaf': 0.06377709186475422, 'max_features': 0.5649178712643985}. Best is trial 156 with value: 0.860262530255716.[0m
[32m[I 2022-04-13 11:44:00,258][0m Trial 233 finished with value: 0.860262530255716 and parameters: {'splitter': 'random', 'min_samples_split': 0.26850226029220137, 'min_samples_leaf': 0.019214485010274885, 'min_weight_fraction_leaf': 0.05730724033636018, 'max_features': 0.5249481579654449}. Best is trial 156 with value: 0.860262530255716.[0m
[32m[I 2022-04-13 11:44:00,293][0m Trial 234 finished with value: 0.8537871744804019 and parameters: {'splitter': 'random', 'min_samples_split': 0.28131811121391753, 'min_samples_leaf': 0.03172367966033412, 'min_weight_fraction_leaf': 0.05598991927580763, 'max_features': 0.5187264319074278}. Best is trial 156 with value: 0.860262530255716.[0m
[32m[I 2022-04-13 11:44:00,328][0m Trial 235 finished with value: 0.855608859465337 and parameters: {'splitter': 'random', 'min_samples_split': 0.2625888028457654, 'min_samples_leaf': 0.007423730237248561, 'min_weight_fraction_leaf': 0.07334310043745408, 'max_features': 0.5501682831948325}. Best is trial 156 with value: 0.860262530255716.[0m
[32m[I 2022-04-13 11:44:00,364][0m Trial 236 finished with value: 0.8490198370094999 and parameters: {'splitter': 'random', 'min_samples_split': 0.2501464774471388, 'min_samples_leaf': 0.02000321034987183, 'min_weight_fraction_leaf': 0.0836091070282462, 'max_features': 0.5756024356992608}. Best is trial 156 with value: 0.860262530255716.[0m
[32m[I 2022-04-13 11:44:00,398][0m Trial 237 finished with value: 0.860262530255716 and parameters: {'splitter': 'random', 'min_samples_split': 0.274596836613095, 'min_samples_leaf': 0.011321383051210528, 'min_weight_fraction_leaf': 0.05349236025401045, 'max_features': 0.5527039295381145}. Best is trial 156 with value: 0.860262530255716.[0m
[32m[I 2022-04-13 11:44:00,434][0m Trial 238 finished with value: 0.8537871744804019 and parameters: {'splitter': 'random', 'min_samples_split': 0.28395192723038676, 'min_samples_leaf': 0.00916050764626152, 'min_weight_fraction_leaf': 0.06905689171448207, 'max_features': 0.5906794865717138}. Best is trial 156 with value: 0.860262530255716.[0m
[32m[I 2022-04-13 11:44:00,468][0m Trial 239 finished with value: 0.855608859465337 and parameters: {'splitter': 'random', 'min_samples_split': 0.25853718739364956, 'min_samples_leaf': 0.0017118289596840634, 'min_weight_fraction_leaf': 0.03492857482765334, 'max_features': 0.5684708366876873}. Best is trial 156 with value: 0.860262530255716.[0m
[32m[I 2022-04-13 11:44:00,503][0m Trial 240 finished with value: 0.860262530255716 and parameters: {'splitter': 'random', 'min_samples_split': 0.2736810665761436, 'min_samples_leaf': 0.02248869195406645, 'min_weight_fraction_leaf': 0.0497289629857357, 'max_features': 0.5446977803509676}. Best is trial 156 with value: 0.860262530255716.[0m
[32m[I 2022-04-13 11:44:00,538][0m Trial 241 finished with value: 0.860262530255716 and parameters: {'splitter': 'random', 'min_samples_split': 0.26574503205095074, 'min_samples_leaf': 0.027993820379452666, 'min_weight_fraction_leaf': 0.06724561355944433, 'max_features': 0.5541899520010592}. Best is trial 156 with value: 0.860262530255716.[0m
[32m[I 2022-04-13 11:44:00,574][0m Trial 242 finished with value: 0.860262530255716 and parameters: {'splitter': 'random', 'min_samples_split': 0.264051443121015, 'min_samples_leaf': 0.030707980981066658, 'min_weight_fraction_leaf': 0.07066289057595182, 'max_features': 0.5498380299852188}. Best is trial 156 with value: 0.860262530255716.[0m
[32m[I 2022-04-13 11:44:00,609][0m Trial 243 finished with value: 0.860262530255716 and parameters: {'splitter': 'random', 'min_samples_split': 0.27504337804659196, 'min_samples_leaf': 0.033608821710240926, 'min_weight_fraction_leaf': 0.05888767568256604, 'max_features': 0.5342646841206259}. Best is trial 156 with value: 0.860262530255716.[0m
[32m[I 2022-04-13 11:44:00,645][0m Trial 244 finished with value: 0.678736275046821 and parameters: {'splitter': 'random', 'min_samples_split': 0.24869556908816498, 'min_samples_leaf': 0.03935787388866599, 'min_weight_fraction_leaf': 0.08037952926961928, 'max_features': 0.4871105575969893}. Best is trial 156 with value: 0.860262530255716.[0m
[32m[I 2022-04-13 11:44:00,681][0m Trial 245 finished with value: 0.860262530255716 and parameters: {'splitter': 'random', 'min_samples_split': 0.2733954990007627, 'min_samples_leaf': 0.016041951706357978, 'min_weight_fraction_leaf': 0.04490283935011867, 'max_features': 0.5138662281955027}. Best is trial 156 with value: 0.860262530255716.[0m
[32m[I 2022-04-13 11:44:00,716][0m Trial 246 finished with value: 0.855608859465337 and parameters: {'splitter': 'random', 'min_samples_split': 0.2575320994408548, 'min_samples_leaf': 0.015458192530307044, 'min_weight_fraction_leaf': 0.039969823853458944, 'max_features': 0.5049705217382697}. Best is trial 156 with value: 0.860262530255716.[0m
[32m[I 2022-04-13 11:44:00,751][0m Trial 247 finished with value: 0.8495779719052834 and parameters: {'splitter': 'random', 'min_samples_split': 0.2911013121376862, 'min_samples_leaf': 0.01940250791990208, 'min_weight_fraction_leaf': 0.05184222069979265, 'max_features': 0.5267141088225554}. Best is trial 156 with value: 0.860262530255716.[0m
[32m[I 2022-04-13 11:44:00,787][0m Trial 248 finished with value: 0.8537871744804019 and parameters: {'splitter': 'random', 'min_samples_split': 0.2769962303322643, 'min_samples_leaf': 0.029161629465020475, 'min_weight_fraction_leaf': 0.04668393179272444, 'max_features': 0.5386678503011985}. Best is trial 156 with value: 0.860262530255716.[0m
[32m[I 2022-04-13 11:44:00,823][0m Trial 249 finished with value: 0.860262530255716 and parameters: {'splitter': 'random', 'min_samples_split': 0.26571774126021236, 'min_samples_leaf': 0.0016501581581608964, 'min_weight_fraction_leaf': 0.06331818345993248, 'max_features': 0.5724808892634757}. Best is trial 156 with value: 0.860262530255716.[0m
[32m[I 2022-04-13 11:44:00,859][0m Trial 250 finished with value: 0.855608859465337 and parameters: {'splitter': 'random', 'min_samples_split': 0.2575938328308943, 'min_samples_leaf': 0.029764521018114998, 'min_weight_fraction_leaf': 0.0612050239655619, 'max_features': 0.5119615754576425}. Best is trial 156 with value: 0.860262530255716.[0m
[32m[I 2022-04-13 11:44:00,894][0m Trial 251 finished with value: 0.8537871744804019 and parameters: {'splitter': 'random', 'min_samples_split': 0.27924651787931193, 'min_samples_leaf': 0.03959209590461109, 'min_weight_fraction_leaf': 0.03280777404610412, 'max_features': 0.5309528515825758}. Best is trial 156 with value: 0.860262530255716.[0m
