[32m[I 2022-04-18 21:31:43,138][0m Trial 17 finished with value: 0.6420759615822602 and parameters: {'n_hidden': 1024, 'mixture_components': 4, 'use_sparse_layer': False, 'use_batchnorm': True, 'use_dropout': True, 'dropout': 0.00759117618107974, 'mlp_size_1': 5, 'mlp_size_2': 2, 'mlp_size_3': 0, 'kernel': 'LogNormal', 'loss_name': 'AlternativeNLLLoss'}. Best is trial 14 with value: 0.6871795832046489.[0m
[32m[I 2022-04-18 21:33:27,929][0m Trial 18 finished with value: 0.6892730042238017 and parameters: {'n_hidden': 1024, 'mixture_components': 6, 'use_sparse_layer': True, 'use_sparse_loss': True, 'lmbd': 1.8551083003249382e-06, 'use_batchnorm': False, 'use_dropout': True, 'dropout': 0.4901450987286652, 'mlp_size_1': 4, 'mlp_size_2': 3, 'mlp_size_3': 0, 'kernel': 'Gamma', 'loss_name': 'AlternativeNLLLoss'}. Best is trial 18 with value: 0.6892730042238017.[0m
[32m[I 2022-04-18 21:36:37,472][0m Trial 19 finished with value: 0.6244230929348062 and parameters: {'n_hidden': 32, 'mixture_components': 4, 'use_sparse_layer': True, 'use_sparse_loss': True, 'lmbd': 1.6978749255532204e-06, 'use_batchnorm': False, 'use_dropout': True, 'dropout': 0.5263895571093916, 'mlp_size_1': 0, 'mlp_size_2': 2, 'mlp_size_3': 0, 'kernel': 'Gamma', 'loss_name': 'AlternativeNLLLoss'}. Best is trial 18 with value: 0.6892730042238017.[0m
[32m[I 2022-04-18 21:39:19,218][0m Trial 20 finished with value: 0.6922560968622802 and parameters: {'n_hidden': 128, 'mixture_components': 6, 'use_sparse_layer': True, 'use_sparse_loss': True, 'lmbd': 1.4479761142855313e-06, 'use_batchnorm': False, 'use_dropout': True, 'dropout': 0.5113086377036946, 'mlp_size_1': 3, 'mlp_size_2': 1, 'mlp_size_3': 0, 'kernel': 'Gamma', 'loss_name': 'AlternativeNLLLoss'}. Best is trial 20 with value: 0.6922560968622802.[0m
[32m[I 2022-04-18 21:41:50,239][0m Trial 21 finished with value: 0.6543238814301148 and parameters: {'n_hidden': 128, 'mixture_components': 6, 'use_sparse_layer': True, 'use_sparse_loss': True, 'lmbd': 1.2545151769458478e-06, 'use_batchnorm': False, 'use_dropout': True, 'dropout': 0.5339775121821324, 'mlp_size_1': 3, 'mlp_size_2': 1, 'mlp_size_3': 0, 'kernel': 'Gamma', 'loss_name': 'AlternativeNLLLoss'}. Best is trial 20 with value: 0.6922560968622802.[0m
[32m[I 2022-04-18 21:44:08,459][0m Trial 22 finished with value: 0.6727892426981346 and parameters: {'n_hidden': 128, 'mixture_components': 6, 'use_sparse_layer': True, 'use_sparse_loss': True, 'lmbd': 3.4220851389831914e-05, 'use_batchnorm': False, 'use_dropout': True, 'dropout': 0.47342801257671363, 'mlp_size_1': 3, 'mlp_size_2': 1, 'mlp_size_3': 0, 'kernel': 'Gamma', 'loss_name': 'AlternativeNLLLoss'}. Best is trial 20 with value: 0.6922560968622802.[0m
[32m[I 2022-04-18 21:47:03,043][0m Trial 23 finished with value: 0.68067426252747 and parameters: {'n_hidden': 64, 'mixture_components': 8, 'use_sparse_layer': True, 'use_sparse_loss': True, 'lmbd': 6.176616045330828e-05, 'use_batchnorm': False, 'use_dropout': True, 'dropout': 0.568955159467251, 'mlp_size_1': 3, 'mlp_size_2': 0, 'mlp_size_3': 0, 'kernel': 'Gamma', 'loss_name': 'AlternativeNLLLoss'}. Best is trial 20 with value: 0.6922560968622802.[0m
[32m[I 2022-04-18 21:48:59,839][0m Trial 24 finished with value: 0.673049970166191 and parameters: {'n_hidden': 128, 'mixture_components': 5, 'use_sparse_layer': True, 'use_sparse_loss': True, 'lmbd': 1.22706017670749e-06, 'use_batchnorm': False, 'use_dropout': True, 'dropout': 0.15548528211114887, 'mlp_size_1': 3, 'mlp_size_2': 1, 'mlp_size_3': 0, 'kernel': 'Gamma', 'loss_name': 'AlternativeNLLLoss'}. Best is trial 20 with value: 0.6922560968622802.[0m
[32m[I 2022-04-18 21:50:22,171][0m Trial 25 finished with value: 0.6184392885075333 and parameters: {'n_hidden': 1024, 'mixture_components': 3, 'use_sparse_layer': True, 'use_sparse_loss': True, 'lmbd': 0.0021064495313729424, 'use_batchnorm': False, 'use_dropout': True, 'dropout': 0.4142500117806359, 'mlp_size_1': 4, 'mlp_size_2': 3, 'mlp_size_3': 0, 'kernel': 'Gumbel', 'loss_name': 'AlternativeNLLLoss'}. Best is trial 20 with value: 0.6922560968622802.[0m
[32m[I 2022-04-18 21:51:36,973][0m Trial 26 finished with value: 0.5401962523019535 and parameters: {'n_hidden': 1024, 'mixture_components': 8, 'use_sparse_layer': True, 'use_sparse_loss': True, 'lmbd': 1.7614099155795863e-05, 'use_batchnorm': False, 'use_dropout': True, 'dropout': 0.6309170699920311, 'mlp_size_1': 5, 'mlp_size_2': 1, 'mlp_size_3': 1, 'kernel': 'Exponential', 'loss_name': 'AlternativeNLLLoss'}. Best is trial 20 with value: 0.6922560968622802.[0m
[32m[I 2022-04-18 21:53:29,344][0m Trial 27 finished with value: 0.6314773758647186 and parameters: {'n_hidden': 128, 'mixture_components': 2, 'use_sparse_layer': True, 'use_sparse_loss': True, 'lmbd': 1.0716737848737364e-05, 'use_batchnorm': False, 'use_dropout': True, 'dropout': 0.21449335056757468, 'mlp_size_1': 2, 'mlp_size_2': 2, 'mlp_size_3': 0, 'kernel': 'Normal', 'loss_name': 'AlternativeNLLLoss'}. Best is trial 20 with value: 0.6922560968622802.[0m
[32m[I 2022-04-18 21:55:26,941][0m Trial 28 finished with value: 0.6899229926966516 and parameters: {'n_hidden': 1024, 'mixture_components': 6, 'use_sparse_layer': True, 'use_sparse_loss': True, 'lmbd': 0.0004226053157840916, 'use_batchnorm': False, 'use_dropout': True, 'dropout': 0.8138006758037793, 'mlp_size_1': 6, 'mlp_size_2': 1, 'mlp_size_3': 0, 'kernel': 'Gamma', 'loss_name': 'NLLLoss'}. Best is trial 20 with value: 0.6922560968622802.[0m
[32m[I 2022-04-18 21:59:20,975][0m Trial 29 finished with value: 0.6348559185924201 and parameters: {'n_hidden': 32, 'mixture_components': 7, 'use_sparse_layer': True, 'use_sparse_loss': True, 'lmbd': 0.0005658339851731548, 'use_batchnorm': False, 'use_dropout': True, 'dropout': 0.8308655417733366, 'mlp_size_1': 1, 'mlp_size_2': 0, 'mlp_size_3': 0, 'kernel': 'Gamma', 'loss_name': 'NLLLoss'}. Best is trial 20 with value: 0.6922560968622802.[0m
[32m[I 2022-04-18 22:02:07,401][0m Trial 30 finished with value: 0.6398514066975298 and parameters: {'n_hidden': 64, 'mixture_components': 6, 'use_sparse_layer': True, 'use_sparse_loss': True, 'lmbd': 0.00033657773601369196, 'use_batchnorm': False, 'use_dropout': True, 'dropout': 0.8417575405754949, 'mlp_size_1': 2, 'mlp_size_2': 1, 'mlp_size_3': 0, 'kernel': 'Gamma', 'loss_name': 'NLLLoss'}. Best is trial 20 with value: 0.6922560968622802.[0m
[32m[I 2022-04-18 22:03:21,032][0m Trial 31 finished with value: 0.49032173451753475 and parameters: {'n_hidden': 1024, 'mixture_components': 5, 'use_sparse_layer': True, 'use_sparse_loss': True, 'lmbd': 0.004584105273781143, 'use_batchnorm': False, 'use_dropout': True, 'dropout': 0.9886510347772945, 'mlp_size_1': 7, 'mlp_size_2': 0, 'mlp_size_3': 0, 'kernel': 'Gamma', 'loss_name': 'NLLLoss'}. Best is trial 20 with value: 0.6922560968622802.[0m
[32m[I 2022-04-18 22:05:51,959][0m Trial 32 finished with value: 0.6612510400670961 and parameters: {'n_hidden': 1024, 'mixture_components': 6, 'use_sparse_layer': True, 'use_sparse_loss': False, 'use_batchnorm': False, 'use_dropout': True, 'dropout': 0.45549498272654126, 'mlp_size_1': 6, 'mlp_size_2': 1, 'mlp_size_3': 0, 'kernel': 'Gamma', 'loss_name': 'AlternativeNLLLoss'}. Best is trial 20 with value: 0.6922560968622802.[0m
[32m[I 2022-04-18 22:07:19,086][0m Trial 33 finished with value: 0.5626095365978527 and parameters: {'n_hidden': 1024, 'mixture_components': 7, 'use_sparse_layer': True, 'use_sparse_loss': True, 'lmbd': 5.604272352170089e-06, 'use_batchnorm': False, 'use_dropout': True, 'dropout': 0.7801424686808596, 'mlp_size_1': 6, 'mlp_size_2': 1, 'mlp_size_3': 0, 'kernel': 'LogLogistic', 'loss_name': 'NLLLoss'}. Best is trial 20 with value: 0.6922560968622802.[0m
[32m[I 2022-04-18 22:09:32,101][0m Trial 34 finished with value: 0.6767873239114441 and parameters: {'n_hidden': 1024, 'mixture_components': 4, 'use_sparse_layer': True, 'use_sparse_loss': True, 'lmbd': 0.0001256280973950157, 'use_batchnorm': False, 'use_dropout': True, 'dropout': 0.5979589443057696, 'mlp_size_1': 4, 'mlp_size_2': 3, 'mlp_size_3': 0, 'kernel': 'Gamma', 'loss_name': 'AlternativeNLLLoss'}. Best is trial 20 with value: 0.6922560968622802.[0m
[32m[I 2022-04-18 22:12:54,142][0m Trial 35 finished with value: 0.6977951023710214 and parameters: {'n_hidden': 32, 'mixture_components': 5, 'use_sparse_layer': True, 'use_sparse_loss': True, 'lmbd': 7.319494878851764e-06, 'use_batchnorm': False, 'use_dropout': True, 'dropout': 0.3912329473216052, 'mlp_size_1': 2, 'mlp_size_2': 0, 'mlp_size_3': 0, 'kernel': 'Gamma', 'loss_name': 'NLLLoss'}. Best is trial 35 with value: 0.6977951023710214.[0m
[32m[I 2022-04-18 22:15:12,864][0m Trial 36 finished with value: 0.5845800779972588 and parameters: {'n_hidden': 32, 'mixture_components': 5, 'use_sparse_layer': True, 'use_sparse_loss': True, 'lmbd': 4.92856127904223e-06, 'use_batchnorm': False, 'use_dropout': False, 'mlp_size_1': 2, 'mlp_size_2': 0, 'mlp_size_3': 0, 'kernel': 'Weibull', 'loss_name': 'NLLLoss'}. Best is trial 35 with value: 0.6977951023710214.[0m
[32m[I 2022-04-18 22:16:32,996][0m Trial 37 finished with value: 0.5427862994704327 and parameters: {'n_hidden': 32, 'mixture_components': 9, 'use_sparse_layer': True, 'use_sparse_loss': True, 'lmbd': 3.3700843797617222e-06, 'use_batchnorm': False, 'use_dropout': True, 'dropout': 0.47328936596010684, 'mlp_size_1': 2, 'mlp_size_2': 0, 'mlp_size_3': 0, 'kernel': 'LogLogistic', 'loss_name': 'NLLLoss'}. Best is trial 35 with value: 0.6977951023710214.[0m
[32m[I 2022-04-18 22:17:57,795][0m Trial 38 finished with value: 0.5535580398226848 and parameters: {'n_hidden': 2048, 'mixture_components': 6, 'use_sparse_layer': True, 'use_sparse_loss': True, 'lmbd': 0.0013307650677753873, 'use_batchnorm': False, 'use_dropout': False, 'mlp_size_1': 8, 'mlp_size_2': 0, 'mlp_size_3': 0, 'kernel': 'Exponential', 'loss_name': 'NLLLoss'}. Best is trial 35 with value: 0.6977951023710214.[0m
[32m[I 2022-04-18 22:19:17,022][0m Trial 39 finished with value: 0.5508232253538029 and parameters: {'n_hidden': 512, 'mixture_components': 8, 'use_sparse_layer': True, 'use_sparse_loss': True, 'lmbd': 0.00011538261504991235, 'use_batchnorm': False, 'use_dropout': True, 'dropout': 0.728040122443702, 'mlp_size_1': 1, 'mlp_size_2': 4, 'mlp_size_3': 0, 'kernel': 'Logistic', 'loss_name': 'NLLLoss'}. Best is trial 35 with value: 0.6977951023710214.[0m
[32m[I 2022-04-18 22:21:32,075][0m Trial 40 finished with value: 0.5789887648726123 and parameters: {'n_hidden': 32, 'mixture_components': 6, 'use_sparse_layer': True, 'use_sparse_loss': True, 'lmbd': 1.3389190089972005e-05, 'use_batchnorm': False, 'use_dropout': False, 'mlp_size_1': 1, 'mlp_size_2': 0, 'mlp_size_3': 0, 'kernel': 'Normal', 'loss_name': 'NLLLoss'}. Best is trial 35 with value: 0.6977951023710214.[0m
[32m[I 2022-04-18 22:23:43,421][0m Trial 41 finished with value: 0.6846793161817668 and parameters: {'n_hidden': 256, 'mixture_components': 1, 'use_sparse_layer': True, 'use_sparse_loss': False, 'use_batchnorm': False, 'use_dropout': True, 'dropout': 0.3635665690384971, 'mlp_size_1': 4, 'mlp_size_2': 1, 'mlp_size_3': 0, 'kernel': 'Gamma', 'loss_name': 'AlternativeNLLLoss'}. Best is trial 35 with value: 0.6977951023710214.[0m
[32m[I 2022-04-18 22:27:05,999][0m Trial 42 finished with value: 0.6850966426757624 and parameters: {'n_hidden': 2048, 'mixture_components': 3, 'use_sparse_layer': True, 'use_sparse_loss': True, 'lmbd': 4.687105964179987e-06, 'use_batchnorm': True, 'use_dropout': True, 'dropout': 0.2681302463404748, 'mlp_size_1': 5, 'mlp_size_2': 3, 'mlp_size_3': 0, 'kernel': 'Gamma', 'loss_name': 'NLLLoss'}. Best is trial 35 with value: 0.6977951023710214.[0m
[32m[I 2022-04-18 22:29:27,454][0m Trial 43 finished with value: 0.6843673262887945 and parameters: {'n_hidden': 128, 'mixture_components': 2, 'use_sparse_layer': False, 'use_batchnorm': False, 'use_dropout': True, 'dropout': 0.42280406648952895, 'mlp_size_1': 3, 'mlp_size_2': 1, 'mlp_size_3': 0, 'kernel': 'Gamma', 'loss_name': 'AlternativeNLLLoss'}. Best is trial 35 with value: 0.6977951023710214.[0m
[32m[I 2022-04-18 22:33:09,202][0m Trial 44 finished with value: 0.6895969639613296 and parameters: {'n_hidden': 1024, 'mixture_components': 4, 'use_sparse_layer': True, 'use_sparse_loss': True, 'lmbd': 2.3633080761554453e-06, 'use_batchnorm': True, 'use_dropout': True, 'dropout': 0.5230251951081611, 'mlp_size_1': 4, 'mlp_size_2': 3, 'mlp_size_3': 0, 'kernel': 'Weibull', 'loss_name': 'NLLLoss'}. Best is trial 35 with value: 0.6977951023710214.[0m
[32m[I 2022-04-18 22:34:48,932][0m Trial 45 finished with value: 0.647547365780869 and parameters: {'n_hidden': 512, 'mixture_components': 4, 'use_sparse_layer': True, 'use_sparse_loss': True, 'lmbd': 2.3339287946412144e-06, 'use_batchnorm': False, 'use_dropout': True, 'dropout': 0.6500057358032215, 'mlp_size_1': 4, 'mlp_size_2': 1, 'mlp_size_3': 0, 'kernel': 'Weibull', 'loss_name': 'NLLLoss'}. Best is trial 35 with value: 0.6977951023710214.[0m
[32m[I 2022-04-18 22:40:33,583][0m Trial 46 finished with value: 0.6676016794808189 and parameters: {'n_hidden': 32, 'mixture_components': 5, 'use_sparse_layer': True, 'use_sparse_loss': True, 'lmbd': 1.0716314687576238e-06, 'use_batchnorm': True, 'use_dropout': True, 'dropout': 0.5726697238809522, 'mlp_size_1': 2, 'mlp_size_2': 0, 'mlp_size_3': 0, 'kernel': 'Weibull', 'loss_name': 'NLLLoss'}. Best is trial 35 with value: 0.6977951023710214.[0m
[32m[I 2022-04-18 22:42:00,480][0m Trial 47 finished with value: 0.589291868743483 and parameters: {'n_hidden': 1024, 'mixture_components': 5, 'use_sparse_layer': True, 'use_sparse_loss': True, 'lmbd': 7.03979873538675e-06, 'use_batchnorm': False, 'use_dropout': True, 'dropout': 0.7001768466776732, 'mlp_size_1': 5, 'mlp_size_2': 2, 'mlp_size_3': 0, 'kernel': 'Weibull', 'loss_name': 'NLLLoss'}. Best is trial 35 with value: 0.6977951023710214.[0m
[32m[I 2022-04-18 22:45:16,860][0m Trial 48 finished with value: 0.6302135485759778 and parameters: {'n_hidden': 256, 'mixture_components': 7, 'use_sparse_layer': True, 'use_sparse_loss': False, 'use_batchnorm': True, 'use_dropout': False, 'mlp_size_1': 3, 'mlp_size_2': 2, 'mlp_size_3': 0, 'kernel': 'Logistic', 'loss_name': 'NLLLoss'}. Best is trial 35 with value: 0.6977951023710214.[0m
[32m[I 2022-04-18 22:47:13,689][0m Trial 49 finished with value: 0.6829225763533464 and parameters: {'n_hidden': 1024, 'mixture_components': 4, 'use_sparse_layer': True, 'use_sparse_loss': True, 'lmbd': 2.92852120422669e-06, 'use_batchnorm': False, 'use_dropout': True, 'dropout': 0.525915744268684, 'mlp_size_1': 6, 'mlp_size_2': 1, 'mlp_size_3': 0, 'kernel': 'Weibull', 'loss_name': 'NLLLoss'}. Best is trial 35 with value: 0.6977951023710214.[0m
[32m[I 2022-04-18 22:50:24,014][0m Trial 50 finished with value: 0.582143461087824 and parameters: {'n_hidden': 128, 'mixture_components': 7, 'use_sparse_layer': True, 'use_sparse_loss': False, 'use_batchnorm': True, 'use_dropout': True, 'dropout': 0.27921768662264157, 'mlp_size_1': 3, 'mlp_size_2': 1, 'mlp_size_3': 0, 'kernel': 'Gumbel', 'loss_name': 'NLLLoss'}. Best is trial 35 with value: 0.6977951023710214.[0m
[32m[I 2022-04-18 22:54:19,498][0m Trial 51 finished with value: 0.6650092091506795 and parameters: {'n_hidden': 1024, 'mixture_components': 3, 'use_sparse_layer': False, 'use_batchnorm': True, 'use_dropout': True, 'dropout': 0.3630890648803339, 'mlp_size_1': 4, 'mlp_size_2': 3, 'mlp_size_3': 0, 'kernel': 'Gamma', 'loss_name': 'AlternativeNLLLoss'}. Best is trial 35 with value: 0.6977951023710214.[0m
[32m[I 2022-04-18 22:59:40,971][0m Trial 52 finished with value: 0.6703582773303145 and parameters: {'n_hidden': 1024, 'mixture_components': 6, 'use_sparse_layer': False, 'use_batchnorm': True, 'use_dropout': True, 'dropout': 0.43188669187087053, 'mlp_size_1': 5, 'mlp_size_2': 2, 'mlp_size_3': 0, 'kernel': 'Gamma', 'loss_name': 'AlternativeNLLLoss'}. Best is trial 35 with value: 0.6977951023710214.[0m
[32m[I 2022-04-18 23:04:26,877][0m Trial 53 finished with value: 0.6721420322576912 and parameters: {'n_hidden': 1024, 'mixture_components': 4, 'use_sparse_layer': False, 'use_batchnorm': True, 'use_dropout': True, 'dropout': 0.32257089784753645, 'mlp_size_1': 4, 'mlp_size_2': 3, 'mlp_size_3': 0, 'kernel': 'LogNormal', 'loss_name': 'CensoredNLLLoss'}. Best is trial 35 with value: 0.6977951023710214.[0m
[32m[I 2022-04-18 23:09:21,051][0m Trial 54 finished with value: 0.6441666014057784 and parameters: {'n_hidden': 1024, 'mixture_components': 2, 'use_sparse_layer': False, 'use_batchnorm': True, 'use_dropout': True, 'dropout': 0.3833134389631606, 'mlp_size_1': 5, 'mlp_size_2': 2, 'mlp_size_3': 0, 'kernel': 'Gamma', 'loss_name': 'AlternativeNLLLoss'}. Best is trial 35 with value: 0.6977951023710214.[0m
[32m[I 2022-04-18 23:14:10,671][0m Trial 55 finished with value: 0.6427699903418376 and parameters: {'n_hidden': 64, 'mixture_components': 5, 'use_sparse_layer': True, 'use_sparse_loss': True, 'lmbd': 2.259490270534143e-05, 'use_batchnorm': True, 'use_dropout': True, 'dropout': 0.47392128249885596, 'mlp_size_1': 3, 'mlp_size_2': 0, 'mlp_size_3': 0, 'kernel': 'LogLogistic', 'loss_name': 'AlternativeNLLLoss'}. Best is trial 35 with value: 0.6977951023710214.[0m
[32m[I 2022-04-18 23:17:26,858][0m Trial 56 finished with value: 0.6639509038080773 and parameters: {'n_hidden': 1024, 'mixture_components': 3, 'use_sparse_layer': True, 'use_sparse_loss': True, 'lmbd': 2.6171725079026314e-06, 'use_batchnorm': True, 'use_dropout': True, 'dropout': 0.5087275116171591, 'mlp_size_1': 4, 'mlp_size_2': 3, 'mlp_size_3': 0, 'kernel': 'Exponential', 'loss_name': 'NLLLoss'}. Best is trial 35 with value: 0.6977951023710214.[0m
[32m[I 2022-04-18 23:19:41,913][0m Trial 57 finished with value: 0.686439189459169 and parameters: {'n_hidden': 2048, 'mixture_components': 5, 'use_sparse_layer': False, 'use_batchnorm': False, 'use_dropout': True, 'dropout': 0.23695559976445835, 'mlp_size_1': 7, 'mlp_size_2': 1, 'mlp_size_3': 0, 'kernel': 'Gamma', 'loss_name': 'CensoredNLLLoss'}. Best is trial 35 with value: 0.6977951023710214.[0m
[32m[I 2022-04-18 23:20:54,997][0m Trial 58 finished with value: -0.390556549005357 and parameters: {'n_hidden': 128, 'mixture_components': 6, 'use_sparse_layer': True, 'use_sparse_loss': True, 'lmbd': 0.009240710783441708, 'use_batchnorm': True, 'use_dropout': True, 'dropout': 0.6321045549342801, 'mlp_size_1': 3, 'mlp_size_2': 1, 'mlp_size_3': 0, 'kernel': 'Gumbel', 'loss_name': 'AlternativeNLLLoss'}. Best is trial 35 with value: 0.6977951023710214.[0m
[32m[I 2022-04-18 23:23:42,191][0m Trial 59 finished with value: 0.6577865045541159 and parameters: {'n_hidden': 32, 'mixture_components': 4, 'use_sparse_layer': True, 'use_sparse_loss': False, 'use_batchnorm': False, 'use_dropout': False, 'mlp_size_1': 2, 'mlp_size_2': 0, 'mlp_size_3': 0, 'kernel': 'Gamma', 'loss_name': 'AlternativeNLLLoss'}. Best is trial 35 with value: 0.6977951023710214.[0m
[32m[I 2022-04-18 23:24:51,025][0m Trial 60 finished with value: 0.5421210491167501 and parameters: {'n_hidden': 1024, 'mixture_components': 5, 'use_sparse_layer': False, 'use_batchnorm': False, 'use_dropout': True, 'dropout': 0.9191561728474545, 'mlp_size_1': 5, 'mlp_size_2': 2, 'mlp_size_3': 0, 'kernel': 'Normal', 'loss_name': 'NLLLoss'}. Best is trial 35 with value: 0.6977951023710214.[0m
[32m[I 2022-04-18 23:27:14,646][0m Trial 61 finished with value: 0.673015146936429 and parameters: {'n_hidden': 2048, 'mixture_components': 5, 'use_sparse_layer': False, 'use_batchnorm': False, 'use_dropout': True, 'dropout': 0.11985306253560996, 'mlp_size_1': 6, 'mlp_size_2': 1, 'mlp_size_3': 1, 'kernel': 'Gamma', 'loss_name': 'CensoredNLLLoss'}. Best is trial 35 with value: 0.6977951023710214.[0m
[32m[I 2022-04-18 23:29:37,636][0m Trial 62 finished with value: 0.6941665482574736 and parameters: {'n_hidden': 2048, 'mixture_components': 6, 'use_sparse_layer': False, 'use_batchnorm': False, 'use_dropout': True, 'dropout': 0.17626273543602358, 'mlp_size_1': 7, 'mlp_size_2': 1, 'mlp_size_3': 0, 'kernel': 'Gamma', 'loss_name': 'CensoredNLLLoss'}. Best is trial 35 with value: 0.6977951023710214.[0m
[32m[I 2022-04-18 23:31:35,181][0m Trial 63 finished with value: 0.6152872143816555 and parameters: {'n_hidden': 2048, 'mixture_components': 6, 'use_sparse_layer': False, 'use_batchnorm': False, 'use_dropout': True, 'dropout': 0.06728274389635275, 'mlp_size_1': 8, 'mlp_size_2': 0, 'mlp_size_3': 0, 'kernel': 'Gamma', 'loss_name': 'CensoredNLLLoss'}. Best is trial 35 with value: 0.6977951023710214.[0m
[32m[I 2022-04-18 23:34:00,711][0m Trial 64 finished with value: 0.6700052354661163 and parameters: {'n_hidden': 2048, 'mixture_components': 6, 'use_sparse_layer': False, 'use_batchnorm': False, 'use_dropout': True, 'dropout': 0.20815288077938462, 'mlp_size_1': 7, 'mlp_size_2': 1, 'mlp_size_3': 0, 'kernel': 'Gamma', 'loss_name': 'CensoredNLLLoss'}. Best is trial 35 with value: 0.6977951023710214.[0m
[32m[I 2022-04-18 23:36:09,249][0m Trial 65 finished with value: 0.6804883761203884 and parameters: {'n_hidden': 512, 'mixture_components': 7, 'use_sparse_layer': False, 'use_batchnorm': False, 'use_dropout': True, 'dropout': 0.5495436904092137, 'mlp_size_1': 4, 'mlp_size_2': 2, 'mlp_size_3': 0, 'kernel': 'Gamma', 'loss_name': 'CensoredNLLLoss'}. Best is trial 35 with value: 0.6977951023710214.[0m
[32m[I 2022-04-18 23:38:25,498][0m Trial 66 finished with value: 0.5719116492002724 and parameters: {'n_hidden': 1024, 'mixture_components': 3, 'use_sparse_layer': True, 'use_sparse_loss': True, 'lmbd': 0.000760118993227805, 'use_batchnorm': False, 'use_dropout': True, 'dropout': 0.3077805280432413, 'mlp_size_1': 6, 'mlp_size_2': 1, 'mlp_size_3': 0, 'kernel': 'LogNormal', 'loss_name': 'AlternativeNLLLoss'}. Best is trial 35 with value: 0.6977951023710214.[0m
