[32m[I 2022-04-13 11:47:15,339][0m Trial 963 finished with value: 0.8648486321634327 and parameters: {'alpha': 2.4289049888298675, 'ties': 'breslow'}. Best is trial 99 with value: 0.8654869897806009.[0m
[32m[I 2022-04-13 11:47:15,577][0m Trial 964 finished with value: 0.8648486321634327 and parameters: {'alpha': 2.3703715691395013, 'ties': 'efron'}. Best is trial 99 with value: 0.8654869897806009.[0m
[32m[I 2022-04-13 11:47:15,892][0m Trial 965 finished with value: 0.8648218682663185 and parameters: {'alpha': 2.1841612332308444, 'ties': 'efron'}. Best is trial 99 with value: 0.8654869897806009.[0m
[32m[I 2022-04-13 11:47:16,154][0m Trial 966 finished with value: 0.86398623966525 and parameters: {'alpha': 1.8744910317922896, 'ties': 'efron'}. Best is trial 99 with value: 0.8654869897806009.[0m
[32m[I 2022-04-13 11:47:16,371][0m Trial 967 finished with value: 0.8639833328806962 and parameters: {'alpha': 2.5658031730827755, 'ties': 'breslow'}. Best is trial 99 with value: 0.8654869897806009.[0m
[32m[I 2022-04-13 11:47:16,770][0m Trial 968 finished with value: 0.8648486321634327 and parameters: {'alpha': 2.438668852567933, 'ties': 'breslow'}. Best is trial 99 with value: 0.8654869897806009.[0m
[32m[I 2022-04-13 11:47:16,992][0m Trial 969 finished with value: 0.8648486321634327 and parameters: {'alpha': 2.35244189114881, 'ties': 'breslow'}. Best is trial 99 with value: 0.8654869897806009.[0m
[32m[I 2022-04-13 11:47:17,265][0m Trial 970 finished with value: 0.8648486321634327 and parameters: {'alpha': 2.457634669713569, 'ties': 'breslow'}. Best is trial 99 with value: 0.8654869897806009.[0m
[32m[I 2022-04-13 11:47:17,600][0m Trial 971 finished with value: 0.8654085943201592 and parameters: {'alpha': 2.0484443183988312, 'ties': 'efron'}. Best is trial 99 with value: 0.8654869897806009.[0m
[32m[I 2022-04-13 11:47:17,895][0m Trial 972 finished with value: 0.8654869897806009 and parameters: {'alpha': 2.336389826524555, 'ties': 'breslow'}. Best is trial 99 with value: 0.8654869897806009.[0m
[32m[I 2022-04-13 11:47:18,268][0m Trial 973 finished with value: 0.8643129825609158 and parameters: {'alpha': 2.2252388405619796, 'ties': 'efron'}. Best is trial 99 with value: 0.8654869897806009.[0m
[32m[I 2022-04-13 11:47:18,498][0m Trial 974 finished with value: 0.8654869897806009 and parameters: {'alpha': 2.3445458380099122, 'ties': 'breslow'}. Best is trial 99 with value: 0.8654869897806009.[0m
[32m[I 2022-04-13 11:47:18,760][0m Trial 975 finished with value: 0.8639833328806962 and parameters: {'alpha': 2.550474434111331, 'ties': 'breslow'}. Best is trial 99 with value: 0.8654869897806009.[0m
[32m[I 2022-04-13 11:47:19,036][0m Trial 976 finished with value: 0.8648486321634327 and parameters: {'alpha': 2.482797306696978, 'ties': 'breslow'}. Best is trial 99 with value: 0.8654869897806009.[0m
[32m[I 2022-04-13 11:47:19,243][0m Trial 977 finished with value: 0.8643129825609158 and parameters: {'alpha': 2.2899852805522514, 'ties': 'breslow'}. Best is trial 99 with value: 0.8654869897806009.[0m
[32m[I 2022-04-13 11:47:19,638][0m Trial 978 finished with value: 0.8648218682663185 and parameters: {'alpha': 2.1518026267522017, 'ties': 'efron'}. Best is trial 99 with value: 0.8654869897806009.[0m
[32m[I 2022-04-13 11:47:19,943][0m Trial 979 finished with value: 0.8648486321634327 and parameters: {'alpha': 2.395973864132857, 'ties': 'breslow'}. Best is trial 99 with value: 0.8654869897806009.[0m
[32m[I 2022-04-13 11:47:20,148][0m Trial 980 finished with value: 0.8648486321634327 and parameters: {'alpha': 2.5115873612303012, 'ties': 'breslow'}. Best is trial 99 with value: 0.8654869897806009.[0m
[32m[I 2022-04-13 11:47:20,410][0m Trial 981 finished with value: 0.8606267289671725 and parameters: {'alpha': 0.2527396049782702, 'ties': 'breslow'}. Best is trial 99 with value: 0.8654869897806009.[0m
[32m[I 2022-04-13 11:47:20,960][0m Trial 982 finished with value: 0.8643129825609158 and parameters: {'alpha': 2.2603794487360727, 'ties': 'efron'}. Best is trial 99 with value: 0.8654869897806009.[0m
[32m[I 2022-04-13 11:47:21,313][0m Trial 983 finished with value: 0.8636746249437476 and parameters: {'alpha': 2.1981980994746833, 'ties': 'breslow'}. Best is trial 99 with value: 0.8654869897806009.[0m
[32m[I 2022-04-13 11:47:21,718][0m Trial 984 finished with value: 0.8654085943201592 and parameters: {'alpha': 2.0614601304111666, 'ties': 'efron'}. Best is trial 99 with value: 0.8654869897806009.[0m
[32m[I 2022-04-13 11:47:21,971][0m Trial 985 finished with value: 0.8643129825609158 and parameters: {'alpha': 2.2679787115200543, 'ties': 'breslow'}. Best is trial 99 with value: 0.8654869897806009.[0m
[32m[I 2022-04-13 11:47:22,231][0m Trial 986 finished with value: 0.8647928920287047 and parameters: {'alpha': 1.970834125126418, 'ties': 'efron'}. Best is trial 99 with value: 0.8654869897806009.[0m
[32m[I 2022-04-13 11:47:22,377][0m Trial 987 finished with value: 0.8641835106491502 and parameters: {'alpha': 2.1346927951522723, 'ties': 'breslow'}. Best is trial 99 with value: 0.8654869897806009.[0m
[32m[I 2022-04-13 11:47:22,769][0m Trial 988 finished with value: 0.8648486321634327 and parameters: {'alpha': 2.4079732587602405, 'ties': 'breslow'}. Best is trial 99 with value: 0.8654869897806009.[0m
[32m[I 2022-04-13 11:47:23,161][0m Trial 989 finished with value: 0.8643129825609158 and parameters: {'alpha': 2.2895474776559332, 'ties': 'breslow'}. Best is trial 99 with value: 0.8654869897806009.[0m
[32m[I 2022-04-13 11:47:23,515][0m Trial 990 finished with value: 0.8643129825609158 and parameters: {'alpha': 2.1969612084583203, 'ties': 'efron'}. Best is trial 99 with value: 0.8654869897806009.[0m
[32m[I 2022-04-13 11:47:23,848][0m Trial 991 finished with value: 0.8654085943201592 and parameters: {'alpha': 2.076794250594218, 'ties': 'efron'}. Best is trial 99 with value: 0.8654869897806009.[0m
[32m[I 2022-04-13 11:47:24,127][0m Trial 992 finished with value: 0.8643129825609158 and parameters: {'alpha': 2.2848268383763344, 'ties': 'breslow'}. Best is trial 99 with value: 0.8654869897806009.[0m
[32m[I 2022-04-13 11:47:24,376][0m Trial 993 finished with value: 0.8643129825609158 and parameters: {'alpha': 2.2662872946943886, 'ties': 'breslow'}. Best is trial 99 with value: 0.8654869897806009.[0m
[32m[I 2022-04-13 11:47:24,654][0m Trial 994 finished with value: 0.8648486321634327 and parameters: {'alpha': 2.36203025193932, 'ties': 'breslow'}. Best is trial 99 with value: 0.8654869897806009.[0m
[32m[I 2022-04-13 11:47:25,075][0m Trial 995 finished with value: 0.8648486321634327 and parameters: {'alpha': 2.473351757274004, 'ties': 'breslow'}. Best is trial 99 with value: 0.8654869897806009.[0m
[32m[I 2022-04-13 11:47:25,218][0m Trial 996 finished with value: 0.862248565592125 and parameters: {'alpha': 2.7013382176463185, 'ties': 'breslow'}. Best is trial 99 with value: 0.8654869897806009.[0m
[32m[I 2022-04-13 11:47:25,668][0m Trial 997 finished with value: 0.8648486321634327 and parameters: {'alpha': 2.3572471111219113, 'ties': 'efron'}. Best is trial 99 with value: 0.8654869897806009.[0m
[32m[I 2022-04-13 11:47:26,043][0m Trial 998 finished with value: 0.8648218682663185 and parameters: {'alpha': 2.127904088028199, 'ties': 'efron'}. Best is trial 99 with value: 0.8654869897806009.[0m
[32m[I 2022-04-13 11:47:26,458][0m Trial 999 finished with value: 0.8639833328806962 and parameters: {'alpha': 2.5926712717592344, 'ties': 'breslow'}. Best is trial 99 with value: 0.8654869897806009.[0m
[32m[I 2022-04-13 11:47:26,461][0m A new study created in memory with name: no-name-6a3f16c9-477f-4c09-adb5-60d6c820b643[0m
[32m[I 2022-04-13 11:47:26,919][0m Trial 0 finished with value: 0.7260307422860457 and parameters: {'alpha': 1.4336792582053142, 'ties': 'breslow'}. Best is trial 0 with value: 0.7260307422860457.[0m
[32m[I 2022-04-13 11:47:27,235][0m Trial 1 finished with value: 0.7279666657613922 and parameters: {'alpha': 2.5572199019645465, 'ties': 'breslow'}. Best is trial 1 with value: 0.7279666657613922.[0m
[32m[I 2022-04-13 11:47:27,380][0m Trial 2 finished with value: 0.7286259651218314 and parameters: {'alpha': 2.209047290243708, 'ties': 'breslow'}. Best is trial 2 with value: 0.7286259651218314.[0m
[32m[I 2022-04-13 11:47:27,476][0m Trial 3 finished with value: 0.7196965066983038 and parameters: {'alpha': 3.629804574431361, 'ties': 'efron'}. Best is trial 2 with value: 0.7286259651218314.[0m
[32m[I 2022-04-13 11:47:27,765][0m Trial 4 finished with value: 0.7196965066983038 and parameters: {'alpha': 3.6838784114699394, 'ties': 'breslow'}. Best is trial 2 with value: 0.7286259651218314.[0m
[32m[I 2022-04-13 11:47:28,125][0m Trial 5 finished with value: 0.7196362624063204 and parameters: {'alpha': 0.28587715262972724, 'ties': 'efron'}. Best is trial 2 with value: 0.7286259651218314.[0m
[32m[I 2022-04-13 11:47:28,336][0m Trial 6 finished with value: 0.718114847207829 and parameters: {'alpha': 4.300550382341892, 'ties': 'efron'}. Best is trial 2 with value: 0.7286259651218314.[0m
[32m[I 2022-04-13 11:47:28,562][0m Trial 7 finished with value: 0.7279724793304998 and parameters: {'alpha': 1.8670405259453053, 'ties': 'breslow'}. Best is trial 2 with value: 0.7286259651218314.[0m
[32m[I 2022-04-13 11:47:28,778][0m Trial 8 finished with value: 0.7218568649852278 and parameters: {'alpha': 0.5823076215854159, 'ties': 'efron'}. Best is trial 2 with value: 0.7286259651218314.[0m
[32m[I 2022-04-13 11:47:29,077][0m Trial 9 finished with value: 0.724432938951461 and parameters: {'alpha': 1.134381362973732, 'ties': 'efron'}. Best is trial 2 with value: 0.7286259651218314.[0m
[32m[I 2022-04-13 11:47:29,360][0m Trial 10 finished with value: 0.7257754422429054 and parameters: {'alpha': 2.7146104537720497, 'ties': 'breslow'}. Best is trial 2 with value: 0.7286259651218314.[0m
[32m[I 2022-04-13 11:47:29,595][0m Trial 11 finished with value: 0.7266489160330192 and parameters: {'alpha': 1.843268266750596, 'ties': 'breslow'}. Best is trial 2 with value: 0.7286259651218314.[0m
[32m[I 2022-04-13 11:47:29,882][0m Trial 12 finished with value: 0.7308171886403182 and parameters: {'alpha': 2.062836414553501, 'ties': 'breslow'}. Best is trial 12 with value: 0.7308171886403182.[0m
[32m[I 2022-04-13 11:47:30,108][0m Trial 13 finished with value: 0.7233217219723216 and parameters: {'alpha': 3.050849592863927, 'ties': 'breslow'}. Best is trial 12 with value: 0.7308171886403182.[0m
[32m[I 2022-04-13 11:47:30,428][0m Trial 14 finished with value: 0.7165703605721099 and parameters: {'alpha': 4.957735065572377, 'ties': 'breslow'}. Best is trial 12 with value: 0.7308171886403182.[0m
[32m[I 2022-04-13 11:47:30,706][0m Trial 15 finished with value: 0.7266957640961634 and parameters: {'alpha': 1.9147143788873393, 'ties': 'breslow'}. Best is trial 12 with value: 0.7308171886403182.[0m
[32m[I 2022-04-13 11:47:30,920][0m Trial 16 finished with value: 0.7224669942747324 and parameters: {'alpha': 0.9670483251688706, 'ties': 'breslow'}. Best is trial 12 with value: 0.7308171886403182.[0m
[32m[I 2022-04-13 11:47:31,103][0m Trial 17 finished with value: 0.7233217219723216 and parameters: {'alpha': 3.073331492466403, 'ties': 'breslow'}. Best is trial 12 with value: 0.7308171886403182.[0m
[32m[I 2022-04-13 11:47:31,332][0m Trial 18 finished with value: 0.7273492498874949 and parameters: {'alpha': 2.193654312732065, 'ties': 'breslow'}. Best is trial 12 with value: 0.7308171886403182.[0m
[32m[I 2022-04-13 11:47:31,558][0m Trial 19 finished with value: 0.72607759034919 and parameters: {'alpha': 1.5149497886528998, 'ties': 'breslow'}. Best is trial 12 with value: 0.7308171886403182.[0m
[32m[I 2022-04-13 11:47:31,685][0m Trial 20 finished with value: 0.720974817756959 and parameters: {'alpha': 3.50466196889312, 'ties': 'breslow'}. Best is trial 12 with value: 0.7308171886403182.[0m
[32m[I 2022-04-13 11:47:31,770][0m Trial 21 finished with value: 0.7273492498874949 and parameters: {'alpha': 2.2072580074860393, 'ties': 'breslow'}. Best is trial 12 with value: 0.7308171886403182.[0m
[32m[I 2022-04-13 11:47:31,844][0m Trial 22 finished with value: 0.7273847447125952 and parameters: {'alpha': 1.6824416006049125, 'ties': 'breslow'}. Best is trial 12 with value: 0.7308171886403182.[0m
[32m[I 2022-04-13 11:47:31,922][0m Trial 23 finished with value: 0.7286259651218314 and parameters: {'alpha': 2.241041603712202, 'ties': 'breslow'}. Best is trial 12 with value: 0.7308171886403182.[0m
[32m[I 2022-04-13 11:47:32,172][0m Trial 24 finished with value: 0.7257754422429054 and parameters: {'alpha': 2.8239973023595835, 'ties': 'breslow'}. Best is trial 12 with value: 0.7308171886403182.[0m
[32m[I 2022-04-13 11:47:32,341][0m Trial 25 finished with value: 0.7286259651218314 and parameters: {'alpha': 2.248155422266908, 'ties': 'breslow'}. Best is trial 12 with value: 0.7308171886403182.[0m
[32m[I 2022-04-13 11:47:32,488][0m Trial 26 finished with value: 0.7237905575722131 and parameters: {'alpha': 1.0217640388478695, 'ties': 'efron'}. Best is trial 12 with value: 0.7308171886403182.[0m
[32m[I 2022-04-13 11:47:32,567][0m Trial 27 finished with value: 0.7221482698646403 and parameters: {'alpha': 3.1915700524948263, 'ties': 'breslow'}. Best is trial 12 with value: 0.7308171886403182.[0m
[32m[I 2022-04-13 11:47:32,716][0m Trial 28 finished with value: 0.7286259651218314 and parameters: {'alpha': 2.243814328855749, 'ties': 'breslow'}. Best is trial 12 with value: 0.7308171886403182.[0m
[32m[I 2022-04-13 11:47:32,865][0m Trial 29 finished with value: 0.7247524896399925 and parameters: {'alpha': 1.3313353424758483, 'ties': 'breslow'}. Best is trial 12 with value: 0.7308171886403182.[0m
[32m[I 2022-04-13 11:47:33,035][0m Trial 30 finished with value: 0.7218568649852278 and parameters: {'alpha': 0.5992835247287409, 'ties': 'breslow'}. Best is trial 12 with value: 0.7308171886403182.[0m
[32m[I 2022-04-13 11:47:33,156][0m Trial 31 finished with value: 0.729697264326865 and parameters: {'alpha': 2.429829179364886, 'ties': 'breslow'}. Best is trial 12 with value: 0.7308171886403182.[0m
[32m[I 2022-04-13 11:47:33,230][0m Trial 32 finished with value: 0.729697264326865 and parameters: {'alpha': 2.4830910759955183, 'ties': 'breslow'}. Best is trial 12 with value: 0.7308171886403182.[0m
[32m[I 2022-04-13 11:47:33,500][0m Trial 33 finished with value: 0.7257754422429054 and parameters: {'alpha': 2.7336900803330235, 'ties': 'breslow'}. Best is trial 12 with value: 0.7308171886403182.[0m
[32m[I 2022-04-13 11:47:33,715][0m Trial 34 finished with value: 0.7279666657613922 and parameters: {'alpha': 2.610580644297647, 'ties': 'breslow'}. Best is trial 12 with value: 0.7308171886403182.[0m
[32m[I 2022-04-13 11:47:33,995][0m Trial 35 finished with value: 0.720974817756959 and parameters: {'alpha': 3.4155919957765373, 'ties': 'breslow'}. Best is trial 12 with value: 0.7308171886403182.[0m
[32m[I 2022-04-13 11:47:34,172][0m Trial 36 finished with value: 0.729697264326865 and parameters: {'alpha': 2.457363119446107, 'ties': 'efron'}. Best is trial 12 with value: 0.7308171886403182.[0m
[32m[I 2022-04-13 11:47:34,495][0m Trial 37 finished with value: 0.7193915624421655 and parameters: {'alpha': 4.008187616153666, 'ties': 'efron'}. Best is trial 12 with value: 0.7308171886403182.[0m
[32m[I 2022-04-13 11:47:34,635][0m Trial 38 finished with value: 0.729697264326865 and parameters: {'alpha': 2.4642289734247673, 'ties': 'efron'}. Best is trial 12 with value: 0.7308171886403182.[0m
[32m[I 2022-04-13 11:47:34,809][0m Trial 39 finished with value: 0.7220434109136662 and parameters: {'alpha': 2.9211427000955483, 'ties': 'efron'}. Best is trial 12 with value: 0.7308171886403182.[0m
[32m[I 2022-04-13 11:47:34,963][0m Trial 40 finished with value: 0.7308171886403182 and parameters: {'alpha': 1.9795141424090645, 'ties': 'efron'}. Best is trial 12 with value: 0.7308171886403182.[0m
[32m[I 2022-04-13 11:47:35,218][0m Trial 41 finished with value: 0.729697264326865 and parameters: {'alpha': 2.494489227707103, 'ties': 'efron'}. Best is trial 12 with value: 0.7308171886403182.[0m
[32m[I 2022-04-13 11:47:35,452][0m Trial 42 finished with value: 0.7266957640961634 and parameters: {'alpha': 1.9419067540926223, 'ties': 'efron'}. Best is trial 12 with value: 0.7308171886403182.[0m
[32m[I 2022-04-13 11:47:35,543][0m Trial 43 finished with value: 0.7286778688810072 and parameters: {'alpha': 1.568019893025566, 'ties': 'efron'}. Best is trial 12 with value: 0.7308171886403182.[0m
[32m[I 2022-04-13 11:47:35,665][0m Trial 44 finished with value: 0.7308171886403182 and parameters: {'alpha': 2.041998181494849, 'ties': 'efron'}. Best is trial 12 with value: 0.7308171886403182.[0m
[32m[I 2022-04-13 11:47:35,936][0m Trial 45 finished with value: 0.7235790375323112 and parameters: {'alpha': 1.348548556256191, 'ties': 'efron'}. Best is trial 12 with value: 0.7308171886403182.[0m
[32m[I 2022-04-13 11:47:36,096][0m Trial 46 finished with value: 0.7308171886403182 and parameters: {'alpha': 2.0042113808422357, 'ties': 'efron'}. Best is trial 12 with value: 0.7308171886403182.[0m
[32m[I 2022-04-13 11:47:36,186][0m Trial 47 finished with value: 0.7266489160330192 and parameters: {'alpha': 1.8565951398966147, 'ties': 'efron'}. Best is trial 12 with value: 0.7308171886403182.[0m
[32m[I 2022-04-13 11:47:36,370][0m Trial 48 finished with value: 0.7308171886403182 and parameters: {'alpha': 2.0101822853559104, 'ties': 'efron'}. Best is trial 12 with value: 0.7308171886403182.[0m
[32m[I 2022-04-13 11:47:36,462][0m Trial 49 finished with value: 0.7301184506101612 and parameters: {'alpha': 1.712259955142822, 'ties': 'efron'}. Best is trial 12 with value: 0.7308171886403182.[0m
[32m[I 2022-04-13 11:47:36,658][0m Trial 50 finished with value: 0.7308171886403182 and parameters: {'alpha': 2.0427130344714306, 'ties': 'efron'}. Best is trial 12 with value: 0.7308171886403182.[0m
[32m[I 2022-04-13 11:47:36,830][0m Trial 51 finished with value: 0.7308171886403182 and parameters: {'alpha': 1.9909146413751195, 'ties': 'efron'}. Best is trial 12 with value: 0.7308171886403182.[0m
[32m[I 2022-04-13 11:47:37,050][0m Trial 52 finished with value: 0.7308171886403182 and parameters: {'alpha': 2.0568591421467124, 'ties': 'efron'}. Best is trial 12 with value: 0.7308171886403182.[0m
[32m[I 2022-04-13 11:47:37,367][0m Trial 53 finished with value: 0.7285051458832521 and parameters: {'alpha': 1.6733507526682816, 'ties': 'efron'}. Best is trial 12 with value: 0.7308171886403182.[0m
[32m[I 2022-04-13 11:47:37,701][0m Trial 54 finished with value: 0.7261340054127009 and parameters: {'alpha': 1.3925502585347391, 'ties': 'efron'}. Best is trial 12 with value: 0.7308171886403182.[0m
[32m[I 2022-04-13 11:47:37,964][0m Trial 55 finished with value: 0.7247056415768482 and parameters: {'alpha': 1.1612485820381173, 'ties': 'efron'}. Best is trial 12 with value: 0.7308171886403182.[0m
[32m[I 2022-04-13 11:47:38,263][0m Trial 56 finished with value: 0.7295404734059817 and parameters: {'alpha': 2.102039645969231, 'ties': 'efron'}. Best is trial 12 with value: 0.7308171886403182.[0m
[32m[I 2022-04-13 11:47:38,568][0m Trial 57 finished with value: 0.7251863831021192 and parameters: {'alpha': 0.7541118536352223, 'ties': 'efron'}. Best is trial 12 with value: 0.7308171886403182.[0m
[32m[I 2022-04-13 11:47:38,781][0m Trial 58 finished with value: 0.7291006791993557 and parameters: {'alpha': 1.79093463378355, 'ties': 'efron'}. Best is trial 12 with value: 0.7308171886403182.[0m
[32m[I 2022-04-13 11:47:38,963][0m Trial 59 finished with value: 0.7308171886403182 and parameters: {'alpha': 2.0385181019630965, 'ties': 'efron'}. Best is trial 12 with value: 0.7308171886403182.[0m
[32m[I 2022-04-13 11:47:39,422][0m Trial 60 finished with value: 0.7286778688810072 and parameters: {'alpha': 1.5809964544369746, 'ties': 'efron'}. Best is trial 12 with value: 0.7308171886403182.[0m
[32m[I 2022-04-13 11:47:39,744][0m Trial 61 finished with value: 0.7308171886403182 and parameters: {'alpha': 2.072105955540552, 'ties': 'efron'}. Best is trial 12 with value: 0.7308171886403182.[0m
[32m[I 2022-04-13 11:47:40,025][0m Trial 62 finished with value: 0.7279724793304998 and parameters: {'alpha': 1.8681324431117372, 'ties': 'efron'}. Best is trial 12 with value: 0.7308171886403182.[0m
[32m[I 2022-04-13 11:47:40,341][0m Trial 63 finished with value: 0.7309739795612015 and parameters: {'alpha': 2.323999618444634, 'ties': 'efron'}. Best is trial 63 with value: 0.7309739795612015.[0m
[32m[I 2022-04-13 11:47:40,606][0m Trial 64 finished with value: 0.729697264326865 and parameters: {'alpha': 2.338218574239313, 'ties': 'efron'}. Best is trial 63 with value: 0.7309739795612015.[0m
[32m[I 2022-04-13 11:47:40,898][0m Trial 65 finished with value: 0.7146991733341366 and parameters: {'alpha': 0.13131917228200285, 'ties': 'efron'}. Best is trial 63 with value: 0.7309739795612015.[0m
[32m[I 2022-04-13 11:47:41,206][0m Trial 66 finished with value: 0.729697264326865 and parameters: {'alpha': 2.5980236648630117, 'ties': 'efron'}. Best is trial 63 with value: 0.7309739795612015.[0m
[32m[I 2022-04-13 11:47:41,444][0m Trial 67 finished with value: 0.7165703605721099 and parameters: {'alpha': 4.882563257194956, 'ties': 'efron'}. Best is trial 63 with value: 0.7309739795612015.[0m
[32m[I 2022-04-13 11:47:41,846][0m Trial 68 finished with value: 0.7309739795612015 and parameters: {'alpha': 2.283310121744897, 'ties': 'efron'}. Best is trial 63 with value: 0.7309739795612015.[0m
[32m[I 2022-04-13 11:47:42,171][0m Trial 69 finished with value: 0.7309739795612015 and parameters: {'alpha': 2.2816711175504936, 'ties': 'efron'}. Best is trial 63 with value: 0.7309739795612015.[0m
