[32m[I 2022-04-18 04:56:26,085][0m Trial 804 finished with value: 0.8535180627971812 and parameters: {'n_hidden': 2048, 'mixture_components': 2, 'use_sparse_layer': True, 'use_sparse_loss': False, 'use_batchnorm': True, 'use_dropout': True, 'dropout': 0.5884910783394649, 'mlp_size_1': 1, 'mlp_size_2': 3, 'mlp_size_3': 0, 'kernel': 'Exponential', 'loss_name': 'NLLLoss'}. Best is trial 367 with value: 0.8756446640888914.[0m
[32m[I 2022-04-18 05:02:21,758][0m Trial 805 finished with value: 0.8660419642752112 and parameters: {'n_hidden': 64, 'mixture_components': 3, 'use_sparse_layer': False, 'use_batchnorm': True, 'use_dropout': True, 'dropout': 0.829793531479678, 'mlp_size_1': 0, 'mlp_size_2': 2, 'mlp_size_3': 0, 'kernel': 'Exponential', 'loss_name': 'NLLLoss'}. Best is trial 367 with value: 0.8756446640888914.[0m
[32m[I 2022-04-18 05:07:25,501][0m Trial 806 finished with value: 0.8569324139920755 and parameters: {'n_hidden': 64, 'mixture_components': 4, 'use_sparse_layer': True, 'use_sparse_loss': False, 'use_batchnorm': True, 'use_dropout': True, 'dropout': 0.6233723258613578, 'mlp_size_1': 0, 'mlp_size_2': 2, 'mlp_size_3': 0, 'kernel': 'LogLogistic', 'loss_name': 'NLLLoss'}. Best is trial 367 with value: 0.8756446640888914.[0m
[32m[I 2022-04-18 05:13:39,875][0m Trial 807 finished with value: 0.8611298798870998 and parameters: {'n_hidden': 32, 'mixture_components': 5, 'use_sparse_layer': True, 'use_sparse_loss': False, 'use_batchnorm': True, 'use_dropout': True, 'dropout': 0.5544234015371676, 'mlp_size_1': 0, 'mlp_size_2': 2, 'mlp_size_3': 0, 'kernel': 'Exponential', 'loss_name': 'NLLLoss'}. Best is trial 367 with value: 0.8756446640888914.[0m
[32m[I 2022-04-18 05:18:39,482][0m Trial 808 finished with value: 0.8730957489422103 and parameters: {'n_hidden': 64, 'mixture_components': 7, 'use_sparse_layer': True, 'use_sparse_loss': False, 'use_batchnorm': True, 'use_dropout': True, 'dropout': 0.5860448853793427, 'mlp_size_1': 0, 'mlp_size_2': 2, 'mlp_size_3': 0, 'kernel': 'Exponential', 'loss_name': 'NLLLoss'}. Best is trial 367 with value: 0.8756446640888914.[0m
[32m[I 2022-04-18 05:24:05,127][0m Trial 809 finished with value: 0.8638238247969413 and parameters: {'n_hidden': 64, 'mixture_components': 7, 'use_sparse_layer': True, 'use_sparse_loss': False, 'use_batchnorm': True, 'use_dropout': True, 'dropout': 0.5791934311057884, 'mlp_size_1': 0, 'mlp_size_2': 2, 'mlp_size_3': 0, 'kernel': 'Exponential', 'loss_name': 'AlternativeNLLLoss'}. Best is trial 367 with value: 0.8756446640888914.[0m
[32m[I 2022-04-18 05:29:15,918][0m Trial 810 finished with value: 0.8692583341622706 and parameters: {'n_hidden': 64, 'mixture_components': 7, 'use_sparse_layer': True, 'use_sparse_loss': False, 'use_batchnorm': True, 'use_dropout': True, 'dropout': 0.6055179980055243, 'mlp_size_1': 0, 'mlp_size_2': 2, 'mlp_size_3': 0, 'kernel': 'Exponential', 'loss_name': 'NLLLoss'}. Best is trial 367 with value: 0.8756446640888914.[0m
[32m[I 2022-04-18 05:33:51,805][0m Trial 811 finished with value: 0.8391443930691139 and parameters: {'n_hidden': 64, 'mixture_components': 7, 'use_sparse_layer': True, 'use_sparse_loss': False, 'use_batchnorm': True, 'use_dropout': True, 'dropout': 0.6059485617137714, 'mlp_size_1': 0, 'mlp_size_2': 2, 'mlp_size_3': 0, 'kernel': 'Normal', 'loss_name': 'NLLLoss'}. Best is trial 367 with value: 0.8756446640888914.[0m
[32m[I 2022-04-18 05:39:24,348][0m Trial 812 finished with value: 0.8714951956732279 and parameters: {'n_hidden': 64, 'mixture_components': 7, 'use_sparse_layer': True, 'use_sparse_loss': False, 'use_batchnorm': True, 'use_dropout': True, 'dropout': 0.6080456610134971, 'mlp_size_1': 0, 'mlp_size_2': 2, 'mlp_size_3': 0, 'kernel': 'Exponential', 'loss_name': 'NLLLoss'}. Best is trial 367 with value: 0.8756446640888914.[0m
[32m[I 2022-04-18 05:44:55,933][0m Trial 813 finished with value: 0.8677722397415885 and parameters: {'n_hidden': 64, 'mixture_components': 7, 'use_sparse_layer': True, 'use_sparse_loss': False, 'use_batchnorm': True, 'use_dropout': True, 'dropout': 0.5895523970978536, 'mlp_size_1': 0, 'mlp_size_2': 2, 'mlp_size_3': 0, 'kernel': 'Exponential', 'loss_name': 'NLLLoss'}. Best is trial 367 with value: 0.8756446640888914.[0m
[32m[I 2022-04-18 05:49:41,863][0m Trial 814 finished with value: 0.8659252007887434 and parameters: {'n_hidden': 64, 'mixture_components': 7, 'use_sparse_layer': True, 'use_sparse_loss': False, 'use_batchnorm': True, 'use_dropout': True, 'dropout': 0.5781696617271078, 'mlp_size_1': 0, 'mlp_size_2': 2, 'mlp_size_3': 0, 'kernel': 'Exponential', 'loss_name': 'NLLLoss'}. Best is trial 367 with value: 0.8756446640888914.[0m
[32m[I 2022-04-18 05:55:37,556][0m Trial 815 finished with value: 0.8657123823171984 and parameters: {'n_hidden': 64, 'mixture_components': 7, 'use_sparse_layer': True, 'use_sparse_loss': False, 'use_batchnorm': True, 'use_dropout': True, 'dropout': 0.602309070547929, 'mlp_size_1': 0, 'mlp_size_2': 2, 'mlp_size_3': 0, 'kernel': 'Exponential', 'loss_name': 'NLLLoss'}. Best is trial 367 with value: 0.8756446640888914.[0m
[32m[I 2022-04-18 06:00:24,344][0m Trial 816 finished with value: 0.8628711101730815 and parameters: {'n_hidden': 64, 'mixture_components': 7, 'use_sparse_layer': True, 'use_sparse_loss': False, 'use_batchnorm': True, 'use_dropout': True, 'dropout': 0.5697871000220511, 'mlp_size_1': 0, 'mlp_size_2': 2, 'mlp_size_3': 0, 'kernel': 'Weibull', 'loss_name': 'NLLLoss'}. Best is trial 367 with value: 0.8756446640888914.[0m
[32m[I 2022-04-18 06:03:34,233][0m Trial 817 finished with value: 0.810237533805022 and parameters: {'n_hidden': 64, 'mixture_components': 7, 'use_sparse_layer': True, 'use_sparse_loss': False, 'use_batchnorm': False, 'use_dropout': True, 'dropout': 0.5606684405245964, 'mlp_size_1': 0, 'mlp_size_2': 2, 'mlp_size_3': 0, 'kernel': 'Exponential', 'loss_name': 'NLLLoss'}. Best is trial 367 with value: 0.8756446640888914.[0m
[32m[I 2022-04-18 06:08:32,276][0m Trial 818 finished with value: 0.8587534299756923 and parameters: {'n_hidden': 64, 'mixture_components': 7, 'use_sparse_layer': True, 'use_sparse_loss': False, 'use_batchnorm': True, 'use_dropout': True, 'dropout': 0.6217806669748553, 'mlp_size_1': 0, 'mlp_size_2': 2, 'mlp_size_3': 0, 'kernel': 'Exponential', 'loss_name': 'NLLLoss'}. Best is trial 367 with value: 0.8756446640888914.[0m
[32m[I 2022-04-18 06:11:34,668][0m Trial 819 finished with value: 0.8535789998971056 and parameters: {'n_hidden': 64, 'mixture_components': 7, 'use_sparse_layer': True, 'use_sparse_loss': False, 'use_batchnorm': True, 'use_dropout': False, 'mlp_size_1': 0, 'mlp_size_2': 2, 'mlp_size_3': 0, 'kernel': 'Gamma', 'loss_name': 'NLLLoss'}. Best is trial 367 with value: 0.8756446640888914.[0m
[32m[I 2022-04-18 06:16:49,710][0m Trial 820 finished with value: 0.8668369897804584 and parameters: {'n_hidden': 64, 'mixture_components': 7, 'use_sparse_layer': True, 'use_sparse_loss': False, 'use_batchnorm': True, 'use_dropout': True, 'dropout': 0.6049219435562311, 'mlp_size_1': 0, 'mlp_size_2': 2, 'mlp_size_3': 0, 'kernel': 'Exponential', 'loss_name': 'NLLLoss'}. Best is trial 367 with value: 0.8756446640888914.[0m
[32m[I 2022-04-18 06:21:22,824][0m Trial 821 finished with value: 0.8656847022891891 and parameters: {'n_hidden': 64, 'mixture_components': 7, 'use_sparse_layer': True, 'use_sparse_loss': False, 'use_batchnorm': True, 'use_dropout': True, 'dropout': 0.6094479215368933, 'mlp_size_1': 0, 'mlp_size_2': 2, 'mlp_size_3': 0, 'kernel': 'Exponential', 'loss_name': 'NLLLoss'}. Best is trial 367 with value: 0.8756446640888914.[0m
[32m[I 2022-04-18 06:25:42,096][0m Trial 822 finished with value: 0.8585925048429235 and parameters: {'n_hidden': 256, 'mixture_components': 7, 'use_sparse_layer': True, 'use_sparse_loss': False, 'use_batchnorm': True, 'use_dropout': True, 'dropout': 0.5888560335074519, 'mlp_size_1': 0, 'mlp_size_2': 2, 'mlp_size_3': 0, 'kernel': 'LogNormal', 'loss_name': 'NLLLoss'}. Best is trial 367 with value: 0.8756446640888914.[0m
[32m[I 2022-04-18 06:31:18,945][0m Trial 823 finished with value: 0.8584727369948941 and parameters: {'n_hidden': 64, 'mixture_components': 7, 'use_sparse_layer': True, 'use_sparse_loss': False, 'use_batchnorm': True, 'use_dropout': True, 'dropout': 0.624089269867921, 'mlp_size_1': 0, 'mlp_size_2': 2, 'mlp_size_3': 0, 'kernel': 'Exponential', 'loss_name': 'NLLLoss'}. Best is trial 367 with value: 0.8756446640888914.[0m
[32m[I 2022-04-18 06:34:37,901][0m Trial 824 finished with value: 0.843386219169185 and parameters: {'n_hidden': 512, 'mixture_components': 7, 'use_sparse_layer': True, 'use_sparse_loss': False, 'use_batchnorm': True, 'use_dropout': True, 'dropout': 0.640471048640304, 'mlp_size_1': 1, 'mlp_size_2': 2, 'mlp_size_3': 0, 'kernel': 'Exponential', 'loss_name': 'NLLLoss'}. Best is trial 367 with value: 0.8756446640888914.[0m
[32m[I 2022-04-18 06:40:37,052][0m Trial 825 finished with value: 0.8640011277164659 and parameters: {'n_hidden': 64, 'mixture_components': 7, 'use_sparse_layer': True, 'use_sparse_loss': False, 'use_batchnorm': True, 'use_dropout': True, 'dropout': 0.5525513464500493, 'mlp_size_1': 0, 'mlp_size_2': 2, 'mlp_size_3': 0, 'kernel': 'Exponential', 'loss_name': 'CensoredNLLLoss'}. Best is trial 367 with value: 0.8756446640888914.[0m
[32m[I 2022-04-18 06:45:21,548][0m Trial 826 finished with value: 0.8438496138626288 and parameters: {'n_hidden': 1024, 'mixture_components': 7, 'use_sparse_layer': True, 'use_sparse_loss': False, 'use_batchnorm': True, 'use_dropout': True, 'dropout': 0.5893024079017216, 'mlp_size_1': 0, 'mlp_size_2': 3, 'mlp_size_3': 0, 'kernel': 'Logistic', 'loss_name': 'NLLLoss'}. Best is trial 367 with value: 0.8756446640888914.[0m
[32m[I 2022-04-18 06:51:01,743][0m Trial 827 finished with value: 0.8691945077316653 and parameters: {'n_hidden': 64, 'mixture_components': 7, 'use_sparse_layer': True, 'use_sparse_loss': False, 'use_batchnorm': True, 'use_dropout': True, 'dropout': 0.6328296514100044, 'mlp_size_1': 0, 'mlp_size_2': 2, 'mlp_size_3': 0, 'kernel': 'Exponential', 'loss_name': 'NLLLoss'}. Best is trial 367 with value: 0.8756446640888914.[0m
[32m[I 2022-04-18 06:56:06,636][0m Trial 828 finished with value: 0.8657745737768169 and parameters: {'n_hidden': 64, 'mixture_components': 7, 'use_sparse_layer': True, 'use_sparse_loss': False, 'use_batchnorm': True, 'use_dropout': True, 'dropout': 0.6141947284250333, 'mlp_size_1': 0, 'mlp_size_2': 2, 'mlp_size_3': 0, 'kernel': 'Exponential', 'loss_name': 'NLLLoss'}. Best is trial 367 with value: 0.8756446640888914.[0m
[32m[I 2022-04-18 07:01:51,523][0m Trial 829 finished with value: 0.8622925760026614 and parameters: {'n_hidden': 64, 'mixture_components': 7, 'use_sparse_layer': True, 'use_sparse_loss': False, 'use_batchnorm': True, 'use_dropout': True, 'dropout': 0.6392454186335238, 'mlp_size_1': 0, 'mlp_size_2': 2, 'mlp_size_3': 0, 'kernel': 'Exponential', 'loss_name': 'NLLLoss'}. Best is trial 367 with value: 0.8756446640888914.[0m
[32m[I 2022-04-18 07:02:50,832][0m Trial 830 finished with value: -0.5 and parameters: {'n_hidden': 64, 'mixture_components': 7, 'use_sparse_layer': True, 'use_sparse_loss': False, 'use_batchnorm': True, 'use_dropout': True, 'dropout': 0.6179001592911613, 'mlp_size_1': 0, 'mlp_size_2': 2, 'mlp_size_3': 0, 'kernel': 'Gumbel', 'loss_name': 'NLLLoss'}. Best is trial 367 with value: 0.8756446640888914.[0m
[32m[I 2022-04-18 07:07:58,617][0m Trial 831 finished with value: 0.8644421782202704 and parameters: {'n_hidden': 64, 'mixture_components': 7, 'use_sparse_layer': True, 'use_sparse_loss': False, 'use_batchnorm': True, 'use_dropout': True, 'dropout': 0.5991723116830857, 'mlp_size_1': 0, 'mlp_size_2': 2, 'mlp_size_3': 0, 'kernel': 'Exponential', 'loss_name': 'NLLLoss'}. Best is trial 367 with value: 0.8756446640888914.[0m
[32m[I 2022-04-18 07:14:22,862][0m Trial 832 finished with value: 0.8597111211639896 and parameters: {'n_hidden': 32, 'mixture_components': 6, 'use_sparse_layer': True, 'use_sparse_loss': False, 'use_batchnorm': True, 'use_dropout': True, 'dropout': 0.5730912916556974, 'mlp_size_1': 0, 'mlp_size_2': 2, 'mlp_size_3': 0, 'kernel': 'Exponential', 'loss_name': 'AlternativeNLLLoss'}. Best is trial 367 with value: 0.8756446640888914.[0m
[32m[I 2022-04-18 07:19:50,959][0m Trial 833 finished with value: 0.8700173247176725 and parameters: {'n_hidden': 64, 'mixture_components': 7, 'use_sparse_layer': True, 'use_sparse_loss': False, 'use_batchnorm': True, 'use_dropout': True, 'dropout': 0.6451963967302692, 'mlp_size_1': 0, 'mlp_size_2': 2, 'mlp_size_3': 0, 'kernel': 'Exponential', 'loss_name': 'NLLLoss'}. Best is trial 367 with value: 0.8756446640888914.[0m
[32m[I 2022-04-18 07:25:34,005][0m Trial 834 finished with value: 0.8704633857057654 and parameters: {'n_hidden': 64, 'mixture_components': 10, 'use_sparse_layer': True, 'use_sparse_loss': False, 'use_batchnorm': True, 'use_dropout': True, 'dropout': 0.6323634947189877, 'mlp_size_1': 0, 'mlp_size_2': 2, 'mlp_size_3': 0, 'kernel': 'Exponential', 'loss_name': 'NLLLoss'}. Best is trial 367 with value: 0.8756446640888914.[0m
[32m[I 2022-04-18 07:31:34,226][0m Trial 835 finished with value: 0.8637401365016764 and parameters: {'n_hidden': 64, 'mixture_components': 7, 'use_sparse_layer': True, 'use_sparse_loss': False, 'use_batchnorm': True, 'use_dropout': True, 'dropout': 0.6137113778371048, 'mlp_size_1': 0, 'mlp_size_2': 2, 'mlp_size_3': 0, 'kernel': 'Exponential', 'loss_name': 'NLLLoss'}. Best is trial 367 with value: 0.8756446640888914.[0m
[32m[I 2022-04-18 07:37:10,809][0m Trial 836 finished with value: 0.863901017967739 and parameters: {'n_hidden': 64, 'mixture_components': 7, 'use_sparse_layer': True, 'use_sparse_loss': False, 'use_batchnorm': True, 'use_dropout': True, 'dropout': 0.6530494133574457, 'mlp_size_1': 0, 'mlp_size_2': 2, 'mlp_size_3': 0, 'kernel': 'Exponential', 'loss_name': 'NLLLoss'}. Best is trial 367 with value: 0.8756446640888914.[0m
[32m[I 2022-04-18 07:38:56,381][0m Trial 837 finished with value: 0.7891589925689749 and parameters: {'n_hidden': 256, 'mixture_components': 6, 'use_sparse_layer': True, 'use_sparse_loss': False, 'use_batchnorm': False, 'use_dropout': True, 'dropout': 0.5862065735410575, 'mlp_size_1': 0, 'mlp_size_2': 2, 'mlp_size_3': 0, 'kernel': 'Exponential', 'loss_name': 'NLLLoss'}. Best is trial 367 with value: 0.8756446640888914.[0m
[32m[I 2022-04-18 07:43:55,948][0m Trial 838 finished with value: 0.8718158549694272 and parameters: {'n_hidden': 64, 'mixture_components': 7, 'use_sparse_layer': True, 'use_sparse_loss': False, 'use_batchnorm': True, 'use_dropout': True, 'dropout': 0.6306056210581035, 'mlp_size_1': 0, 'mlp_size_2': 2, 'mlp_size_3': 0, 'kernel': 'Exponential', 'loss_name': 'NLLLoss'}. Best is trial 367 with value: 0.8756446640888914.[0m
[32m[I 2022-04-18 07:48:03,929][0m Trial 839 finished with value: 0.8561340913982078 and parameters: {'n_hidden': 64, 'mixture_components': 4, 'use_sparse_layer': True, 'use_sparse_loss': False, 'use_batchnorm': True, 'use_dropout': False, 'mlp_size_1': 0, 'mlp_size_2': 2, 'mlp_size_3': 0, 'kernel': 'Exponential', 'loss_name': 'NLLLoss'}. Best is trial 367 with value: 0.8756446640888914.[0m
[32m[I 2022-04-18 07:52:55,642][0m Trial 840 finished with value: 0.864994082387771 and parameters: {'n_hidden': 64, 'mixture_components': 3, 'use_sparse_layer': True, 'use_sparse_loss': False, 'use_batchnorm': True, 'use_dropout': True, 'dropout': 0.6483880229562227, 'mlp_size_1': 0, 'mlp_size_2': 2, 'mlp_size_3': 0, 'kernel': 'LogLogistic', 'loss_name': 'NLLLoss'}. Best is trial 367 with value: 0.8756446640888914.[0m
[32m[I 2022-04-18 07:59:40,805][0m Trial 841 finished with value: 0.8643370573227717 and parameters: {'n_hidden': 32, 'mixture_components': 8, 'use_sparse_layer': True, 'use_sparse_loss': False, 'use_batchnorm': True, 'use_dropout': True, 'dropout': 0.6341601945217729, 'mlp_size_1': 0, 'mlp_size_2': 2, 'mlp_size_3': 0, 'kernel': 'Exponential', 'loss_name': 'NLLLoss'}. Best is trial 367 with value: 0.8756446640888914.[0m
[32m[I 2022-04-18 08:05:06,103][0m Trial 842 finished with value: 0.8675770478915658 and parameters: {'n_hidden': 64, 'mixture_components': 6, 'use_sparse_layer': True, 'use_sparse_loss': False, 'use_batchnorm': True, 'use_dropout': True, 'dropout': 0.6605078480737672, 'mlp_size_1': 0, 'mlp_size_2': 2, 'mlp_size_3': 0, 'kernel': 'Exponential', 'loss_name': 'NLLLoss'}. Best is trial 367 with value: 0.8756446640888914.[0m
[32m[I 2022-04-18 08:10:14,101][0m Trial 843 finished with value: 0.8699851250944406 and parameters: {'n_hidden': 64, 'mixture_components': 7, 'use_sparse_layer': True, 'use_sparse_loss': True, 'lmbd': 1.401286953018682e-05, 'use_batchnorm': True, 'use_dropout': True, 'dropout': 0.6265878165074714, 'mlp_size_1': 0, 'mlp_size_2': 2, 'mlp_size_3': 0, 'kernel': 'Exponential', 'loss_name': 'NLLLoss'}. Best is trial 367 with value: 0.8756446640888914.[0m
[32m[I 2022-04-18 08:15:39,893][0m Trial 844 finished with value: 0.8016277339373936 and parameters: {'n_hidden': 2048, 'mixture_components': 4, 'use_sparse_layer': True, 'use_sparse_loss': False, 'use_batchnorm': True, 'use_dropout': True, 'dropout': 0.654162755796009, 'mlp_size_1': 5, 'mlp_size_2': 2, 'mlp_size_3': 0, 'kernel': 'Normal', 'loss_name': 'NLLLoss'}. Best is trial 367 with value: 0.8756446640888914.[0m
[32m[I 2022-04-18 08:21:05,889][0m Trial 845 finished with value: 0.8651132901422075 and parameters: {'n_hidden': 64, 'mixture_components': 3, 'use_sparse_layer': True, 'use_sparse_loss': False, 'use_batchnorm': True, 'use_dropout': True, 'dropout': 0.6412204519301187, 'mlp_size_1': 0, 'mlp_size_2': 2, 'mlp_size_3': 0, 'kernel': 'Exponential', 'loss_name': 'NLLLoss'}. Best is trial 367 with value: 0.8756446640888914.[0m
[32m[I 2022-04-18 08:26:16,637][0m Trial 846 finished with value: 0.8428272910154181 and parameters: {'n_hidden': 64, 'mixture_components': 4, 'use_sparse_layer': True, 'use_sparse_loss': True, 'lmbd': 2.826493923076821e-06, 'use_batchnorm': True, 'use_dropout': True, 'dropout': 0.6603942390259122, 'mlp_size_1': 0, 'mlp_size_2': 2, 'mlp_size_3': 0, 'kernel': 'Weibull', 'loss_name': 'NLLLoss'}. Best is trial 367 with value: 0.8756446640888914.[0m
[32m[I 2022-04-18 08:31:23,044][0m Trial 847 finished with value: 0.8674369476462169 and parameters: {'n_hidden': 64, 'mixture_components': 7, 'use_sparse_layer': True, 'use_sparse_loss': False, 'use_batchnorm': True, 'use_dropout': True, 'dropout': 0.6121132379519505, 'mlp_size_1': 0, 'mlp_size_2': 2, 'mlp_size_3': 0, 'kernel': 'Exponential', 'loss_name': 'NLLLoss'}. Best is trial 367 with value: 0.8756446640888914.[0m
[32m[I 2022-04-18 08:38:01,724][0m Trial 848 finished with value: 0.8653766244787585 and parameters: {'n_hidden': 64, 'mixture_components': 4, 'use_sparse_layer': True, 'use_sparse_loss': False, 'use_batchnorm': True, 'use_dropout': True, 'dropout': 0.6282619860580967, 'mlp_size_1': 0, 'mlp_size_2': 2, 'mlp_size_3': 0, 'kernel': 'Exponential', 'loss_name': 'CensoredNLLLoss'}. Best is trial 367 with value: 0.8756446640888914.[0m
[32m[I 2022-04-18 08:43:21,307][0m Trial 849 finished with value: 0.8712782342797475 and parameters: {'n_hidden': 64, 'mixture_components': 3, 'use_sparse_layer': True, 'use_sparse_loss': False, 'use_batchnorm': True, 'use_dropout': True, 'dropout': 0.595750068180807, 'mlp_size_1': 0, 'mlp_size_2': 2, 'mlp_size_3': 0, 'kernel': 'Exponential', 'loss_name': 'NLLLoss'}. Best is trial 367 with value: 0.8756446640888914.[0m
[32m[I 2022-04-18 08:48:29,974][0m Trial 850 finished with value: 0.8676858891731161 and parameters: {'n_hidden': 64, 'mixture_components': 7, 'use_sparse_layer': False, 'use_batchnorm': True, 'use_dropout': True, 'dropout': 0.6675327168465768, 'mlp_size_1': 0, 'mlp_size_2': 2, 'mlp_size_3': 0, 'kernel': 'Exponential', 'loss_name': 'NLLLoss'}. Best is trial 367 with value: 0.8756446640888914.[0m
[32m[I 2022-04-18 08:52:08,924][0m Trial 851 finished with value: 0.8402246937299577 and parameters: {'n_hidden': 512, 'mixture_components': 4, 'use_sparse_layer': True, 'use_sparse_loss': True, 'lmbd': 1.3912545172165325e-06, 'use_batchnorm': True, 'use_dropout': True, 'dropout': 0.637525068470983, 'mlp_size_1': 0, 'mlp_size_2': 0, 'mlp_size_3': 4, 'kernel': 'Gamma', 'loss_name': 'NLLLoss'}. Best is trial 367 with value: 0.8756446640888914.[0m
[32m[I 2022-04-18 08:57:48,285][0m Trial 852 finished with value: 0.858135880869486 and parameters: {'n_hidden': 32, 'mixture_components': 7, 'use_sparse_layer': False, 'use_batchnorm': True, 'use_dropout': True, 'dropout': 0.6687191996882995, 'mlp_size_1': 0, 'mlp_size_2': 2, 'mlp_size_3': 0, 'kernel': 'Exponential', 'loss_name': 'NLLLoss'}. Best is trial 367 with value: 0.8756446640888914.[0m
[32m[I 2022-04-18 09:02:51,670][0m Trial 853 finished with value: 0.8422922220799027 and parameters: {'n_hidden': 256, 'mixture_components': 4, 'use_sparse_layer': False, 'use_batchnorm': True, 'use_dropout': True, 'dropout': 0.6103587984970729, 'mlp_size_1': 4, 'mlp_size_2': 1, 'mlp_size_3': 0, 'kernel': 'Exponential', 'loss_name': 'AlternativeNLLLoss'}. Best is trial 367 with value: 0.8756446640888914.[0m
[32m[I 2022-04-18 09:06:20,929][0m Trial 854 finished with value: 0.8545358937610159 and parameters: {'n_hidden': 64, 'mixture_components': 8, 'use_sparse_layer': False, 'use_batchnorm': True, 'use_dropout': True, 'dropout': 0.6453881701534536, 'mlp_size_1': 0, 'mlp_size_2': 2, 'mlp_size_3': 0, 'kernel': 'LogNormal', 'loss_name': 'NLLLoss'}. Best is trial 367 with value: 0.8756446640888914.[0m
