[32m[I 2022-04-13 11:46:38,227][0m Trial 952 finished with value: 0.7166142182627449 and parameters: {'splitter': 'random', 'min_samples_split': 0.2793668618091372, 'min_samples_leaf': 0.11433505181930484, 'min_weight_fraction_leaf': 0.11364819460919191, 'max_features': 0.5984716911628484}. Best is trial 819 with value: 0.7205250605114317.[0m
[32m[I 2022-04-13 11:46:38,366][0m Trial 953 finished with value: 0.6995395546707612 and parameters: {'splitter': 'random', 'min_samples_split': 0.2788050901085758, 'min_samples_leaf': 0.10982094060593682, 'min_weight_fraction_leaf': 0.1330017563886305, 'max_features': 0.6056287023432718}. Best is trial 819 with value: 0.7205250605114317.[0m
[32m[I 2022-04-13 11:46:38,562][0m Trial 954 finished with value: 0.7077378843113455 and parameters: {'splitter': 'random', 'min_samples_split': 0.26650377929665287, 'min_samples_leaf': 0.11595221594872676, 'min_weight_fraction_leaf': 0.1219026646884603, 'max_features': 0.6143329162028266}. Best is trial 819 with value: 0.7205250605114317.[0m
[32m[I 2022-04-13 11:46:38,674][0m Trial 955 finished with value: 0.6995395546707612 and parameters: {'splitter': 'random', 'min_samples_split': 0.2794527211225952, 'min_samples_leaf': 0.09460321923064853, 'min_weight_fraction_leaf': 0.14268881502281006, 'max_features': 0.6221732383996822}. Best is trial 819 with value: 0.7205250605114317.[0m
[32m[I 2022-04-13 11:46:38,813][0m Trial 956 finished with value: 0.6995395546707612 and parameters: {'splitter': 'random', 'min_samples_split': 0.2562117447299086, 'min_samples_leaf': 0.1365881002363003, 'min_weight_fraction_leaf': 0.11986428787655991, 'max_features': 0.6035269469235938}. Best is trial 819 with value: 0.7205250605114317.[0m
[32m[I 2022-04-13 11:46:38,949][0m Trial 957 finished with value: 0.7077378843113455 and parameters: {'splitter': 'random', 'min_samples_split': 0.27057840557210855, 'min_samples_leaf': 0.10244306266113165, 'min_weight_fraction_leaf': 0.13078629403516737, 'max_features': 0.5986339763180891}. Best is trial 819 with value: 0.7205250605114317.[0m
[32m[I 2022-04-13 11:46:39,242][0m Trial 958 finished with value: 0.6365884699050991 and parameters: {'splitter': 'random', 'min_samples_split': 0.28313430063235234, 'min_samples_leaf': 0.08597980109388349, 'min_weight_fraction_leaf': 0.11244137453812879, 'max_features': 0.6991542546484948}. Best is trial 819 with value: 0.7205250605114317.[0m
[32m[I 2022-04-13 11:46:39,306][0m Trial 959 finished with value: 0.6365884699050991 and parameters: {'splitter': 'random', 'min_samples_split': 0.289833417985942, 'min_samples_leaf': 0.0969472388304227, 'min_weight_fraction_leaf': 0.1118511879131228, 'max_features': 0.6431406114810279}. Best is trial 819 with value: 0.7205250605114317.[0m
[32m[I 2022-04-13 11:46:39,429][0m Trial 960 finished with value: 0.6485886947469399 and parameters: {'splitter': 'random', 'min_samples_split': 0.24919942312214954, 'min_samples_leaf': 0.08459503415652983, 'min_weight_fraction_leaf': 0.1121473366516807, 'max_features': 0.6465072528779181}. Best is trial 819 with value: 0.7205250605114317.[0m
[32m[I 2022-04-13 11:46:39,522][0m Trial 961 finished with value: 0.7077378843113455 and parameters: {'splitter': 'random', 'min_samples_split': 0.2614274916719862, 'min_samples_leaf': 0.11384605881161575, 'min_weight_fraction_leaf': 0.12771165574233131, 'max_features': 0.6225560585134804}. Best is trial 819 with value: 0.7205250605114317.[0m
[32m[I 2022-04-13 11:46:39,675][0m Trial 962 finished with value: 0.6485886947469399 and parameters: {'splitter': 'random', 'min_samples_split': 0.2750610926815894, 'min_samples_leaf': 0.0752065976854516, 'min_weight_fraction_leaf': 0.1055496518642687, 'max_features': 0.6366692890304027}. Best is trial 819 with value: 0.7205250605114317.[0m
[32m[I 2022-04-13 11:46:39,872][0m Trial 963 finished with value: 0.7081958131125079 and parameters: {'splitter': 'random', 'min_samples_split': 0.2914433079634603, 'min_samples_leaf': 0.1087122036752255, 'min_weight_fraction_leaf': 0.009649067219620926, 'max_features': 0.6093288542694698}. Best is trial 819 with value: 0.7205250605114317.[0m
[32m[I 2022-04-13 11:46:40,173][0m Trial 964 finished with value: 0.6366711831550372 and parameters: {'splitter': 'random', 'min_samples_split': 0.2671117539091521, 'min_samples_leaf': 0.0951550927047602, 'min_weight_fraction_leaf': 0.11847103839453235, 'max_features': 0.6296746127835586}. Best is trial 819 with value: 0.7205250605114317.[0m
[32m[I 2022-04-13 11:46:40,443][0m Trial 965 finished with value: 0.696879951255881 and parameters: {'splitter': 'random', 'min_samples_split': 0.2417300748040974, 'min_samples_leaf': 0.08778401620050104, 'min_weight_fraction_leaf': 2.8507239790642735e-05, 'max_features': 0.5994625510187207}. Best is trial 819 with value: 0.7205250605114317.[0m
[32m[I 2022-04-13 11:46:40,697][0m Trial 966 finished with value: 0.6365884699050991 and parameters: {'splitter': 'random', 'min_samples_split': 0.2799732235112277, 'min_samples_leaf': 0.07612050007276232, 'min_weight_fraction_leaf': 0.10957105043177795, 'max_features': 0.6725931067528457}. Best is trial 819 with value: 0.7205250605114317.[0m
[32m[I 2022-04-13 11:46:40,884][0m Trial 967 finished with value: 0.7077378843113455 and parameters: {'splitter': 'random', 'min_samples_split': 0.25784915964182015, 'min_samples_leaf': 0.10012463158434085, 'min_weight_fraction_leaf': 0.1266667577733108, 'max_features': 0.5971247473203335}. Best is trial 819 with value: 0.7205250605114317.[0m
[32m[I 2022-04-13 11:46:41,101][0m Trial 968 finished with value: 0.628696384719799 and parameters: {'splitter': 'random', 'min_samples_split': 0.29118846556627326, 'min_samples_leaf': 0.12336212415948435, 'min_weight_fraction_leaf': 0.10073049322940725, 'max_features': 0.6540910555184716}. Best is trial 819 with value: 0.7205250605114317.[0m
[32m[I 2022-04-13 11:46:41,364][0m Trial 969 finished with value: 0.6995395546707612 and parameters: {'splitter': 'random', 'min_samples_split': 0.28034205471713697, 'min_samples_leaf': 0.07172312895740217, 'min_weight_fraction_leaf': 0.1362124900273253, 'max_features': 0.5990537525611324}. Best is trial 819 with value: 0.7205250605114317.[0m
[32m[I 2022-04-13 11:46:41,539][0m Trial 970 finished with value: 0.6995395546707612 and parameters: {'splitter': 'random', 'min_samples_split': 0.2706983382904616, 'min_samples_leaf': 0.134055229849612, 'min_weight_fraction_leaf': 0.12223752002423802, 'max_features': 0.6223160479884813}. Best is trial 819 with value: 0.7205250605114317.[0m
[32m[I 2022-04-13 11:46:41,673][0m Trial 971 finished with value: 0.4442889595627446 and parameters: {'splitter': 'random', 'min_samples_split': 0.28167453215288873, 'min_samples_leaf': 0.10976119239036657, 'min_weight_fraction_leaf': 0.45091153212616814, 'max_features': 0.7204351151970487}. Best is trial 819 with value: 0.7205250605114317.[0m
[32m[I 2022-04-13 11:46:41,840][0m Trial 972 finished with value: 0.7081958131125079 and parameters: {'splitter': 'random', 'min_samples_split': 0.2937940865472263, 'min_samples_leaf': 0.0874948888985442, 'min_weight_fraction_leaf': 0.11518833338248007, 'max_features': 0.6159626462277663}. Best is trial 819 with value: 0.7205250605114317.[0m
[32m[I 2022-04-13 11:46:42,023][0m Trial 973 finished with value: 0.6494272905439874 and parameters: {'splitter': 'random', 'min_samples_split': 0.26451782966667814, 'min_samples_leaf': 0.09928453613829771, 'min_weight_fraction_leaf': 0.10525812571678558, 'max_features': 0.6545246513346556}. Best is trial 819 with value: 0.7205250605114317.[0m
[32m[I 2022-04-13 11:46:42,152][0m Trial 974 finished with value: 0.6300184585256496 and parameters: {'splitter': 'random', 'min_samples_split': 0.2756909239984571, 'min_samples_leaf': 0.07747923978510016, 'min_weight_fraction_leaf': 0.1480272219649181, 'max_features': 0.6317221665790367}. Best is trial 819 with value: 0.7205250605114317.[0m
[32m[I 2022-04-13 11:46:42,259][0m Trial 975 finished with value: 0.7003045700187264 and parameters: {'splitter': 'random', 'min_samples_split': 0.2473184107980182, 'min_samples_leaf': 0.0948391421985933, 'min_weight_fraction_leaf': 0.10002518342414028, 'max_features': 0.5954863475854447}. Best is trial 819 with value: 0.7205250605114317.[0m
[32m[I 2022-04-13 11:46:42,347][0m Trial 976 finished with value: 0.7077378843113455 and parameters: {'splitter': 'random', 'min_samples_split': 0.2571901533692867, 'min_samples_leaf': 0.07466683845978825, 'min_weight_fraction_leaf': 0.12546325398417332, 'max_features': 0.5938841332342967}. Best is trial 819 with value: 0.7205250605114317.[0m
[32m[I 2022-04-13 11:46:42,445][0m Trial 977 finished with value: 0.7166142182627449 and parameters: {'splitter': 'random', 'min_samples_split': 0.28842890747062294, 'min_samples_leaf': 0.08513123983243547, 'min_weight_fraction_leaf': 0.11250133037777214, 'max_features': 0.616747665701052}. Best is trial 819 with value: 0.7205250605114317.[0m
[32m[I 2022-04-13 11:46:42,578][0m Trial 978 finished with value: 0.6098441900028305 and parameters: {'splitter': 'random', 'min_samples_split': 0.2840873218946357, 'min_samples_leaf': 0.08300858964380188, 'min_weight_fraction_leaf': 0.1990864173594734, 'max_features': 0.6402143363852754}. Best is trial 819 with value: 0.7205250605114317.[0m
[32m[I 2022-04-13 11:46:42,684][0m Trial 979 finished with value: 0.7138319698070605 and parameters: {'splitter': 'random', 'min_samples_split': 0.27159563552527927, 'min_samples_leaf': 0.1096414407222766, 'min_weight_fraction_leaf': 0.1145957190397604, 'max_features': 0.6242828136746965}. Best is trial 819 with value: 0.7205250605114317.[0m
[32m[I 2022-04-13 11:46:42,806][0m Trial 980 finished with value: 0.6282603442517164 and parameters: {'splitter': 'random', 'min_samples_split': 0.27146835427625055, 'min_samples_leaf': 0.12640054051490146, 'min_weight_fraction_leaf': 0.13438130004118137, 'max_features': 0.6887926790781262}. Best is trial 819 with value: 0.7205250605114317.[0m
[32m[I 2022-04-13 11:46:42,947][0m Trial 981 finished with value: 0.6300184585256496 and parameters: {'splitter': 'random', 'min_samples_split': 0.29181123627271205, 'min_samples_leaf': 0.11398988379655717, 'min_weight_fraction_leaf': 0.15151499737791363, 'max_features': 0.6676585647014447}. Best is trial 819 with value: 0.7205250605114317.[0m
[32m[I 2022-04-13 11:46:43,027][0m Trial 982 finished with value: 0.6282603442517164 and parameters: {'splitter': 'random', 'min_samples_split': 0.2814153239458198, 'min_samples_leaf': 0.10307412240410968, 'min_weight_fraction_leaf': 0.1389776064587327, 'max_features': 0.6471325496293497}. Best is trial 819 with value: 0.7205250605114317.[0m
[32m[I 2022-04-13 11:46:43,171][0m Trial 983 finished with value: 0.7077378843113455 and parameters: {'splitter': 'random', 'min_samples_split': 0.2699439567128238, 'min_samples_leaf': 0.1183939169573546, 'min_weight_fraction_leaf': 0.11877753984830014, 'max_features': 0.6148130808690074}. Best is trial 819 with value: 0.7205250605114317.[0m
[32m[I 2022-04-13 11:46:43,276][0m Trial 984 finished with value: 0.6365884699050991 and parameters: {'splitter': 'random', 'min_samples_split': 0.29011405225998904, 'min_samples_leaf': 0.09075180729761093, 'min_weight_fraction_leaf': 0.11770536627215337, 'max_features': 0.6298476866564255}. Best is trial 819 with value: 0.7205250605114317.[0m
[32m[I 2022-04-13 11:46:43,387][0m Trial 985 finished with value: 0.6366711831550372 and parameters: {'splitter': 'random', 'min_samples_split': 0.2739945892727536, 'min_samples_leaf': 0.10615778763108896, 'min_weight_fraction_leaf': 0.12817579887181402, 'max_features': 0.6554215043139759}. Best is trial 819 with value: 0.7205250605114317.[0m
[32m[I 2022-04-13 11:46:43,523][0m Trial 986 finished with value: 0.7058013434606394 and parameters: {'splitter': 'random', 'min_samples_split': 0.2631537940422873, 'min_samples_leaf': 0.09432281157899505, 'min_weight_fraction_leaf': 0.1125389211900588, 'max_features': 0.6202149669091361}. Best is trial 819 with value: 0.7205250605114317.[0m
[32m[I 2022-04-13 11:46:43,598][0m Trial 987 finished with value: 0.628696384719799 and parameters: {'splitter': 'random', 'min_samples_split': 0.2809013824641232, 'min_samples_leaf': 0.0839048544921992, 'min_weight_fraction_leaf': 0.12659409562091378, 'max_features': 0.636680112468498}. Best is trial 819 with value: 0.7205250605114317.[0m
[32m[I 2022-04-13 11:46:43,680][0m Trial 988 finished with value: 0.6365884699050991 and parameters: {'splitter': 'random', 'min_samples_split': 0.28925991073777363, 'min_samples_leaf': 0.10816412227204578, 'min_weight_fraction_leaf': 0.11122282578586519, 'max_features': 0.674053331579096}. Best is trial 819 with value: 0.7205250605114317.[0m
[32m[I 2022-04-13 11:46:43,728][0m Trial 989 finished with value: 0.6995395546707612 and parameters: {'splitter': 'random', 'min_samples_split': 0.25198780575215407, 'min_samples_leaf': 0.09853102051796882, 'min_weight_fraction_leaf': 0.13845029239310405, 'max_features': 0.6126100866360412}. Best is trial 819 with value: 0.7205250605114317.[0m
[32m[I 2022-04-13 11:46:43,772][0m Trial 990 finished with value: 0.7077378843113455 and parameters: {'splitter': 'random', 'min_samples_split': 0.26557557472275106, 'min_samples_leaf': 0.08595544801479779, 'min_weight_fraction_leaf': 0.11940341619864055, 'max_features': 0.618600120003279}. Best is trial 819 with value: 0.7205250605114317.[0m
[32m[I 2022-04-13 11:46:43,874][0m Trial 991 finished with value: 0.6485886947469399 and parameters: {'splitter': 'random', 'min_samples_split': 0.2757558422263742, 'min_samples_leaf': 0.0976586128663912, 'min_weight_fraction_leaf': 0.10941936658119397, 'max_features': 0.6502961533900825}. Best is trial 819 with value: 0.7205250605114317.[0m
[32m[I 2022-04-13 11:46:43,990][0m Trial 992 finished with value: 0.47927579092888584 and parameters: {'splitter': 'random', 'min_samples_split': 0.2900067162654472, 'min_samples_leaf': 0.07259967062181923, 'min_weight_fraction_leaf': 0.12695659355749417, 'max_features': 0.37664755302100705}. Best is trial 819 with value: 0.7205250605114317.[0m
[32m[I 2022-04-13 11:46:44,094][0m Trial 993 finished with value: 0.7166142182627449 and parameters: {'splitter': 'random', 'min_samples_split': 0.27918709430450955, 'min_samples_leaf': 0.11816238204851645, 'min_weight_fraction_leaf': 0.11033199243243376, 'max_features': 0.6025425235560414}. Best is trial 819 with value: 0.7205250605114317.[0m
[32m[I 2022-04-13 11:46:44,233][0m Trial 994 finished with value: 0.6407886163385511 and parameters: {'splitter': 'random', 'min_samples_split': 0.2832707092613706, 'min_samples_leaf': 0.13109492382957008, 'min_weight_fraction_leaf': 0.24150374486703305, 'max_features': 0.5987773554253336}. Best is trial 819 with value: 0.7205250605114317.[0m
[32m[I 2022-04-13 11:46:44,293][0m Trial 995 finished with value: 0.7081958131125079 and parameters: {'splitter': 'random', 'min_samples_split': 0.2911182002862344, 'min_samples_leaf': 0.10858588451255688, 'min_weight_fraction_leaf': 0.10221013877761187, 'max_features': 0.6004898594519384}. Best is trial 819 with value: 0.7205250605114317.[0m
[32m[I 2022-04-13 11:46:44,408][0m Trial 996 finished with value: 0.6300184585256496 and parameters: {'splitter': 'random', 'min_samples_split': 0.27754378066501095, 'min_samples_leaf': 0.14596379238072038, 'min_weight_fraction_leaf': 0.10875020444850346, 'max_features': 0.6307972379604635}. Best is trial 819 with value: 0.7205250605114317.[0m
[32m[I 2022-04-13 11:46:44,489][0m Trial 997 finished with value: 0.628696384719799 and parameters: {'splitter': 'random', 'min_samples_split': 0.2944031893525367, 'min_samples_leaf': 0.12202813635455584, 'min_weight_fraction_leaf': 0.10142427779361127, 'max_features': 0.6368149796971327}. Best is trial 819 with value: 0.7205250605114317.[0m
[32m[I 2022-04-13 11:46:44,588][0m Trial 998 finished with value: 0.7077378843113455 and parameters: {'splitter': 'random', 'min_samples_split': 0.2618316753051897, 'min_samples_leaf': 0.1178190274064811, 'min_weight_fraction_leaf': 0.12021143426424917, 'max_features': 0.6055426274650487}. Best is trial 819 with value: 0.7205250605114317.[0m
[32m[I 2022-04-13 11:46:44,705][0m Trial 999 finished with value: 0.6365884699050991 and parameters: {'splitter': 'random', 'min_samples_split': 0.28044019197604675, 'min_samples_leaf': 0.11565332443999798, 'min_weight_fraction_leaf': 0.10990187030299609, 'max_features': 0.6641455041763391}. Best is trial 819 with value: 0.7205250605114317.[0m
SurvivalTree
Running Optimizer with LogRank binary scoring
{'splitter': 'random', 'min_samples_split': 0.2634327795456142, 'min_samples_leaf': 0.0010397355641569754, 'min_weight_fraction_leaf': 0.06902031599129063, 'max_features': 0.5894070081890616, 'UnoC_LR': 0.860262530255716}
Running Optimizer normaly
{'splitter': 'random', 'min_samples_split': 0.26969799342025624, 'min_samples_leaf': 0.03400433689700358, 'min_weight_fraction_leaf': 0.04699760321144737, 'max_features': 0.6061175836251546, 'UnoC': 0.7205250605114317}
