[32m[I 2022-04-18 23:41:50,325][0m Trial 67 finished with value: 0.6106614104162192 and parameters: {'n_hidden': 128, 'mixture_components': 7, 'use_sparse_layer': True, 'use_sparse_loss': True, 'lmbd': 0.027943278979835087, 'use_batchnorm': True, 'use_dropout': True, 'dropout': 0.01120070764375286, 'mlp_size_1': 4, 'mlp_size_2': 0, 'mlp_size_3': 0, 'kernel': 'Gamma', 'loss_name': 'CensoredNLLLoss'}. Best is trial 35 with value: 0.6977951023710214.[0m
[32m[I 2022-04-18 23:43:45,010][0m Trial 68 finished with value: 0.6621056992556735 and parameters: {'n_hidden': 256, 'mixture_components': 6, 'use_sparse_layer': False, 'use_batchnorm': False, 'use_dropout': True, 'dropout': 0.49434561034355107, 'mlp_size_1': 4, 'mlp_size_2': 1, 'mlp_size_3': 0, 'kernel': 'Weibull', 'loss_name': 'AlternativeNLLLoss'}. Best is trial 35 with value: 0.6977951023710214.[0m
[32m[I 2022-04-18 23:45:19,577][0m Trial 69 finished with value: 0.626861535955649 and parameters: {'n_hidden': 64, 'mixture_components': 4, 'use_sparse_layer': True, 'use_sparse_loss': True, 'lmbd': 1.0307433748288568e-06, 'use_batchnorm': False, 'use_dropout': True, 'dropout': 0.17457611540782192, 'mlp_size_1': 3, 'mlp_size_2': 0, 'mlp_size_3': 0, 'kernel': 'Logistic', 'loss_name': 'NLLLoss'}. Best is trial 35 with value: 0.6977951023710214.[0m
[32m[I 2022-04-18 23:47:23,693][0m Trial 70 finished with value: 0.6908765795439503 and parameters: {'n_hidden': 1024, 'mixture_components': 5, 'use_sparse_layer': True, 'use_sparse_loss': True, 'lmbd': 0.0001911870140996547, 'use_batchnorm': False, 'use_dropout': True, 'dropout': 0.4387915726068553, 'mlp_size_1': 7, 'mlp_size_2': 0, 'mlp_size_3': 0, 'kernel': 'Gamma', 'loss_name': 'AlternativeNLLLoss'}. Best is trial 35 with value: 0.6977951023710214.[0m
[32m[I 2022-04-18 23:49:04,258][0m Trial 71 finished with value: 0.6003048748868721 and parameters: {'n_hidden': 1024, 'mixture_components': 5, 'use_sparse_layer': True, 'use_sparse_loss': True, 'lmbd': 0.00020582802163428372, 'use_batchnorm': False, 'use_dropout': True, 'dropout': 0.43960185562840237, 'mlp_size_1': 7, 'mlp_size_2': 0, 'mlp_size_3': 0, 'kernel': 'Gamma', 'loss_name': 'AlternativeNLLLoss'}. Best is trial 35 with value: 0.6977951023710214.[0m
[32m[I 2022-04-18 23:51:12,072][0m Trial 72 finished with value: 0.7067071906688679 and parameters: {'n_hidden': 1024, 'mixture_components': 6, 'use_sparse_layer': True, 'use_sparse_loss': True, 'lmbd': 2.2907936459327547e-06, 'use_batchnorm': False, 'use_dropout': True, 'dropout': 0.3820393641484335, 'mlp_size_1': 7, 'mlp_size_2': 0, 'mlp_size_3': 0, 'kernel': 'Gamma', 'loss_name': 'AlternativeNLLLoss'}. Best is trial 72 with value: 0.7067071906688679.[0m
[32m[I 2022-04-18 23:53:22,347][0m Trial 73 finished with value: 0.676877406501611 and parameters: {'n_hidden': 1024, 'mixture_components': 6, 'use_sparse_layer': True, 'use_sparse_loss': True, 'lmbd': 2.272691209738076e-06, 'use_batchnorm': False, 'use_dropout': True, 'dropout': 0.39543493498797483, 'mlp_size_1': 7, 'mlp_size_2': 0, 'mlp_size_3': 0, 'kernel': 'Gamma', 'loss_name': 'AlternativeNLLLoss'}. Best is trial 72 with value: 0.7067071906688679.[0m
[32m[I 2022-04-18 23:55:50,865][0m Trial 74 finished with value: 0.6542442810164661 and parameters: {'n_hidden': 1024, 'mixture_components': 7, 'use_sparse_layer': True, 'use_sparse_loss': True, 'lmbd': 1.6121190773491085e-06, 'use_batchnorm': False, 'use_dropout': True, 'dropout': 0.3419304082915594, 'mlp_size_1': 7, 'mlp_size_2': 0, 'mlp_size_3': 0, 'kernel': 'Gamma', 'loss_name': 'AlternativeNLLLoss'}. Best is trial 72 with value: 0.7067071906688679.[0m
[32m[I 2022-04-18 23:59:05,893][0m Trial 75 finished with value: 0.6645973394989622 and parameters: {'n_hidden': 32, 'mixture_components': 6, 'use_sparse_layer': True, 'use_sparse_loss': True, 'lmbd': 4.28748568521958e-05, 'use_batchnorm': False, 'use_dropout': True, 'dropout': 0.6063172460105012, 'mlp_size_1': 2, 'mlp_size_2': 0, 'mlp_size_3': 0, 'kernel': 'Gamma', 'loss_name': 'AlternativeNLLLoss'}. Best is trial 72 with value: 0.7067071906688679.[0m
[32m[I 2022-04-19 00:00:33,754][0m Trial 76 finished with value: 0.6673124328419535 and parameters: {'n_hidden': 1024, 'mixture_components': 5, 'use_sparse_layer': True, 'use_sparse_loss': True, 'lmbd': 8.75617472060417e-06, 'use_batchnorm': False, 'use_dropout': False, 'mlp_size_1': 7, 'mlp_size_2': 0, 'mlp_size_3': 0, 'kernel': 'Exponential', 'loss_name': 'AlternativeNLLLoss'}. Best is trial 72 with value: 0.7067071906688679.[0m
[32m[I 2022-04-19 00:03:14,055][0m Trial 77 finished with value: 0.6740297187478028 and parameters: {'n_hidden': 2048, 'mixture_components': 6, 'use_sparse_layer': True, 'use_sparse_loss': True, 'lmbd': 1.7599378217551114e-06, 'use_batchnorm': False, 'use_dropout': True, 'dropout': 0.5030448468233345, 'mlp_size_1': 8, 'mlp_size_2': 0, 'mlp_size_3': 0, 'kernel': 'Gamma', 'loss_name': 'NLLLoss'}. Best is trial 72 with value: 0.7067071906688679.[0m
[32m[I 2022-04-19 00:04:39,452][0m Trial 78 finished with value: 0.5719939264147453 and parameters: {'n_hidden': 1024, 'mixture_components': 8, 'use_sparse_layer': True, 'use_sparse_loss': True, 'lmbd': 3.6605144478177653e-06, 'use_batchnorm': False, 'use_dropout': True, 'dropout': 0.5603768164065265, 'mlp_size_1': 6, 'mlp_size_2': 0, 'mlp_size_3': 1, 'kernel': 'LogLogistic', 'loss_name': 'AlternativeNLLLoss'}. Best is trial 72 with value: 0.7067071906688679.[0m
[32m[I 2022-04-19 00:07:27,393][0m Trial 79 finished with value: 0.6631668943936418 and parameters: {'n_hidden': 128, 'mixture_components': 5, 'use_sparse_layer': True, 'use_sparse_loss': True, 'lmbd': 6.471260413970349e-05, 'use_batchnorm': False, 'use_dropout': True, 'dropout': 0.4534253689235306, 'mlp_size_1': 4, 'mlp_size_2': 0, 'mlp_size_3': 0, 'kernel': 'Gamma', 'loss_name': 'NLLLoss'}. Best is trial 72 with value: 0.7067071906688679.[0m
[32m[I 2022-04-19 00:10:16,245][0m Trial 80 finished with value: 0.6131421373622153 and parameters: {'n_hidden': 32, 'mixture_components': 7, 'use_sparse_layer': True, 'use_sparse_loss': True, 'lmbd': 1.8303644070437745e-06, 'use_batchnorm': False, 'use_dropout': True, 'dropout': 0.4093080217330365, 'mlp_size_1': 2, 'mlp_size_2': 0, 'mlp_size_3': 0, 'kernel': 'Weibull', 'loss_name': 'CensoredNLLLoss'}. Best is trial 72 with value: 0.7067071906688679.[0m
[32m[I 2022-04-19 00:12:51,797][0m Trial 81 finished with value: 0.6736358793706941 and parameters: {'n_hidden': 1024, 'mixture_components': 4, 'use_sparse_layer': True, 'use_sparse_loss': True, 'lmbd': 0.0003628701511778401, 'use_batchnorm': False, 'use_dropout': True, 'dropout': 0.3696128416033654, 'mlp_size_1': 6, 'mlp_size_2': 1, 'mlp_size_3': 0, 'kernel': 'Gamma', 'loss_name': 'AlternativeNLLLoss'}. Best is trial 72 with value: 0.7067071906688679.[0m
[32m[I 2022-04-19 00:14:53,089][0m Trial 82 finished with value: 0.6744130986296347 and parameters: {'n_hidden': 1024, 'mixture_components': 6, 'use_sparse_layer': True, 'use_sparse_loss': True, 'lmbd': 7.6955874388031e-06, 'use_batchnorm': False, 'use_dropout': True, 'dropout': 0.7453590595573181, 'mlp_size_1': 7, 'mlp_size_2': 0, 'mlp_size_3': 0, 'kernel': 'Gamma', 'loss_name': 'AlternativeNLLLoss'}. Best is trial 72 with value: 0.7067071906688679.[0m
[32m[I 2022-04-19 00:21:33,536][0m Trial 83 finished with value: 0.6926762480719094 and parameters: {'n_hidden': 1024, 'mixture_components': 5, 'use_sparse_layer': True, 'use_sparse_loss': True, 'lmbd': 0.0021727461085193508, 'use_batchnorm': True, 'use_dropout': True, 'dropout': 0.47224750905399104, 'mlp_size_1': 7, 'mlp_size_2': 0, 'mlp_size_3': 0, 'kernel': 'Gamma', 'loss_name': 'AlternativeNLLLoss'}. Best is trial 72 with value: 0.7067071906688679.[0m
[32m[I 2022-04-19 00:27:18,371][0m Trial 84 finished with value: 0.6460400837839158 and parameters: {'n_hidden': 1024, 'mixture_components': 5, 'use_sparse_layer': True, 'use_sparse_loss': True, 'lmbd': 0.004929351826256171, 'use_batchnorm': True, 'use_dropout': True, 'dropout': 0.480879911626864, 'mlp_size_1': 7, 'mlp_size_2': 0, 'mlp_size_3': 0, 'kernel': 'Normal', 'loss_name': 'AlternativeNLLLoss'}. Best is trial 72 with value: 0.7067071906688679.[0m
[32m[I 2022-04-19 00:29:34,879][0m Trial 85 finished with value: 0.6728234112723496 and parameters: {'n_hidden': 1024, 'mixture_components': 6, 'use_sparse_layer': True, 'use_sparse_loss': True, 'lmbd': 0.0017525442546542762, 'use_batchnorm': False, 'use_dropout': True, 'dropout': 0.5307864093708837, 'mlp_size_1': 6, 'mlp_size_2': 0, 'mlp_size_3': 0, 'kernel': 'Gamma', 'loss_name': 'AlternativeNLLLoss'}. Best is trial 72 with value: 0.7067071906688679.[0m
[32m[I 2022-04-19 00:31:58,223][0m Trial 86 finished with value: 0.6659783534161876 and parameters: {'n_hidden': 512, 'mixture_components': 5, 'use_sparse_layer': True, 'use_sparse_loss': True, 'lmbd': 0.0033046579789133223, 'use_batchnorm': False, 'use_dropout': True, 'dropout': 0.5845001582733437, 'mlp_size_1': 6, 'mlp_size_2': 0, 'mlp_size_3': 0, 'kernel': 'Gamma', 'loss_name': 'NLLLoss'}. Best is trial 72 with value: 0.7067071906688679.[0m
[32m[I 2022-04-19 00:33:44,245][0m Trial 87 finished with value: 0.5002381353274282 and parameters: {'n_hidden': 1024, 'mixture_components': 6, 'use_sparse_layer': True, 'use_sparse_loss': True, 'lmbd': 0.0009605981909474065, 'use_batchnorm': True, 'use_dropout': True, 'dropout': 0.44554661953070906, 'mlp_size_1': 7, 'mlp_size_2': 0, 'mlp_size_3': 0, 'kernel': 'Gumbel', 'loss_name': 'AlternativeNLLLoss'}. Best is trial 72 with value: 0.7067071906688679.[0m
[32m[I 2022-04-19 00:35:13,157][0m Trial 88 finished with value: 0.672928679936758 and parameters: {'n_hidden': 256, 'mixture_components': 5, 'use_sparse_layer': True, 'use_sparse_loss': True, 'lmbd': 1.9646591255710984e-05, 'use_batchnorm': False, 'use_dropout': False, 'mlp_size_1': 5, 'mlp_size_2': 0, 'mlp_size_3': 0, 'kernel': 'Gamma', 'loss_name': 'NLLLoss'}. Best is trial 72 with value: 0.7067071906688679.[0m
[32m[I 2022-04-19 00:36:49,306][0m Trial 89 finished with value: 0.559152497865676 and parameters: {'n_hidden': 1024, 'mixture_components': 6, 'use_sparse_layer': True, 'use_sparse_loss': True, 'lmbd': 0.016637681826804543, 'use_batchnorm': False, 'use_dropout': True, 'dropout': 0.6559255530693269, 'mlp_size_1': 0, 'mlp_size_2': 4, 'mlp_size_3': 3, 'kernel': 'Logistic', 'loss_name': 'AlternativeNLLLoss'}. Best is trial 72 with value: 0.7067071906688679.[0m
[32m[I 2022-04-19 00:40:35,025][0m Trial 90 finished with value: 0.6648120404235415 and parameters: {'n_hidden': 32, 'mixture_components': 7, 'use_sparse_layer': True, 'use_sparse_loss': False, 'use_batchnorm': True, 'use_dropout': True, 'dropout': 0.2949316344533633, 'mlp_size_1': 2, 'mlp_size_2': 0, 'mlp_size_3': 0, 'kernel': 'Weibull', 'loss_name': 'NLLLoss'}. Best is trial 72 with value: 0.7067071906688679.[0m
[32m[I 2022-04-19 00:45:57,388][0m Trial 91 finished with value: 0.622058672790068 and parameters: {'n_hidden': 1024, 'mixture_components': 4, 'use_sparse_layer': False, 'use_batchnorm': True, 'use_dropout': True, 'dropout': 0.4033823785602648, 'mlp_size_1': 7, 'mlp_size_2': 0, 'mlp_size_3': 0, 'kernel': 'Gamma', 'loss_name': 'AlternativeNLLLoss'}. Best is trial 72 with value: 0.7067071906688679.[0m
[32m[I 2022-04-19 00:49:18,403][0m Trial 92 finished with value: 0.6863434296070559 and parameters: {'n_hidden': 1024, 'mixture_components': 4, 'use_sparse_layer': True, 'use_sparse_loss': True, 'lmbd': 5.0231240905095015e-06, 'use_batchnorm': True, 'use_dropout': True, 'dropout': 0.4657447235423663, 'mlp_size_1': 1, 'mlp_size_2': 3, 'mlp_size_3': 1, 'kernel': 'Gamma', 'loss_name': 'AlternativeNLLLoss'}. Best is trial 72 with value: 0.7067071906688679.[0m
[32m[I 2022-04-19 00:54:35,565][0m Trial 93 finished with value: 0.6651211180468726 and parameters: {'n_hidden': 1024, 'mixture_components': 6, 'use_sparse_layer': False, 'use_batchnorm': True, 'use_dropout': True, 'dropout': 0.345468380680499, 'mlp_size_1': 7, 'mlp_size_2': 0, 'mlp_size_3': 0, 'kernel': 'Gamma', 'loss_name': 'AlternativeNLLLoss'}. Best is trial 72 with value: 0.7067071906688679.[0m
[32m[I 2022-04-19 00:59:49,003][0m Trial 94 finished with value: 0.6792333768127181 and parameters: {'n_hidden': 128, 'mixture_components': 5, 'use_sparse_layer': True, 'use_sparse_loss': True, 'lmbd': 1.6827262620517007e-06, 'use_batchnorm': True, 'use_dropout': True, 'dropout': 0.4255894747544054, 'mlp_size_1': 4, 'mlp_size_2': 0, 'mlp_size_3': 0, 'kernel': 'Gamma', 'loss_name': 'AlternativeNLLLoss'}. Best is trial 72 with value: 0.7067071906688679.[0m
[32m[I 2022-04-19 01:07:09,046][0m Trial 95 finished with value: 0.6551404560154739 and parameters: {'n_hidden': 1024, 'mixture_components': 6, 'use_sparse_layer': True, 'use_sparse_loss': True, 'lmbd': 0.00044229766572693335, 'use_batchnorm': True, 'use_dropout': True, 'dropout': 0.24451892219589338, 'mlp_size_1': 7, 'mlp_size_2': 0, 'mlp_size_3': 0, 'kernel': 'LogNormal', 'loss_name': 'AlternativeNLLLoss'}. Best is trial 72 with value: 0.7067071906688679.[0m
[32m[I 2022-04-19 01:08:44,794][0m Trial 96 finished with value: 0.5930253419707927 and parameters: {'n_hidden': 64, 'mixture_components': 2, 'use_sparse_layer': False, 'use_batchnorm': False, 'use_dropout': True, 'dropout': 0.8450779566980329, 'mlp_size_1': 3, 'mlp_size_2': 0, 'mlp_size_3': 0, 'kernel': 'Gamma', 'loss_name': 'AlternativeNLLLoss'}. Best is trial 72 with value: 0.7067071906688679.[0m
[32m[I 2022-04-19 01:11:16,935][0m Trial 97 finished with value: 0.6935192376119331 and parameters: {'n_hidden': 2048, 'mixture_components': 3, 'use_sparse_layer': True, 'use_sparse_loss': True, 'lmbd': 0.00022712355405511678, 'use_batchnorm': False, 'use_dropout': True, 'dropout': 0.5237573395440621, 'mlp_size_1': 8, 'mlp_size_2': 0, 'mlp_size_3': 0, 'kernel': 'Gamma', 'loss_name': 'CensoredNLLLoss'}. Best is trial 72 with value: 0.7067071906688679.[0m
[32m[I 2022-04-19 01:13:55,621][0m Trial 98 finished with value: 0.6736286825716763 and parameters: {'n_hidden': 2048, 'mixture_components': 10, 'use_sparse_layer': True, 'use_sparse_loss': True, 'lmbd': 0.00019222457155973816, 'use_batchnorm': False, 'use_dropout': True, 'dropout': 0.5173448472285443, 'mlp_size_1': 8, 'mlp_size_2': 0, 'mlp_size_3': 0, 'kernel': 'Gamma', 'loss_name': 'CensoredNLLLoss'}. Best is trial 72 with value: 0.7067071906688679.[0m
[32m[I 2022-04-19 01:15:17,122][0m Trial 99 finished with value: 0.5025171689068888 and parameters: {'n_hidden': 2048, 'mixture_components': 5, 'use_sparse_layer': True, 'use_sparse_loss': True, 'lmbd': 0.0002472191882348262, 'use_batchnorm': False, 'use_dropout': True, 'dropout': 0.5428400250234737, 'mlp_size_1': 8, 'mlp_size_2': 0, 'mlp_size_3': 0, 'kernel': 'Exponential', 'loss_name': 'CensoredNLLLoss'}. Best is trial 72 with value: 0.7067071906688679.[0m
[32m[I 2022-04-19 01:17:48,767][0m Trial 100 finished with value: 0.6932308507745364 and parameters: {'n_hidden': 2048, 'mixture_components': 3, 'use_sparse_layer': True, 'use_sparse_loss': True, 'lmbd': 7.755025226935016e-05, 'use_batchnorm': False, 'use_dropout': True, 'dropout': 0.48687115431612427, 'mlp_size_1': 8, 'mlp_size_2': 0, 'mlp_size_3': 0, 'kernel': 'Gamma', 'loss_name': 'CensoredNLLLoss'}. Best is trial 72 with value: 0.7067071906688679.[0m
[32m[I 2022-04-19 01:19:45,536][0m Trial 101 finished with value: 0.6843834445769634 and parameters: {'n_hidden': 2048, 'mixture_components': 3, 'use_sparse_layer': True, 'use_sparse_loss': True, 'lmbd': 9.771909305018952e-05, 'use_batchnorm': False, 'use_dropout': True, 'dropout': 0.49141065832953135, 'mlp_size_1': 8, 'mlp_size_2': 0, 'mlp_size_3': 0, 'kernel': 'Gamma', 'loss_name': 'CensoredNLLLoss'}. Best is trial 72 with value: 0.7067071906688679.[0m
[32m[I 2022-04-19 01:21:45,568][0m Trial 102 finished with value: 0.7060599997216743 and parameters: {'n_hidden': 2048, 'mixture_components': 3, 'use_sparse_layer': True, 'use_sparse_loss': True, 'lmbd': 3.0140302760176334e-05, 'use_batchnorm': False, 'use_dropout': True, 'dropout': 0.599340334702549, 'mlp_size_1': 7, 'mlp_size_2': 0, 'mlp_size_3': 0, 'kernel': 'Gamma', 'loss_name': 'CensoredNLLLoss'}. Best is trial 72 with value: 0.7067071906688679.[0m
[32m[I 2022-04-19 01:23:55,016][0m Trial 103 finished with value: 0.6996973058336342 and parameters: {'n_hidden': 2048, 'mixture_components': 3, 'use_sparse_layer': True, 'use_sparse_loss': True, 'lmbd': 6.884066235327406e-05, 'use_batchnorm': False, 'use_dropout': True, 'dropout': 0.6079251844567789, 'mlp_size_1': 8, 'mlp_size_2': 0, 'mlp_size_3': 0, 'kernel': 'Gamma', 'loss_name': 'CensoredNLLLoss'}. Best is trial 72 with value: 0.7067071906688679.[0m
[32m[I 2022-04-19 01:25:48,779][0m Trial 104 finished with value: 0.6474765994023775 and parameters: {'n_hidden': 2048, 'mixture_components': 3, 'use_sparse_layer': True, 'use_sparse_loss': True, 'lmbd': 3.3267250395617894e-05, 'use_batchnorm': False, 'use_dropout': True, 'dropout': 0.6760394899543962, 'mlp_size_1': 8, 'mlp_size_2': 0, 'mlp_size_3': 0, 'kernel': 'Gamma', 'loss_name': 'CensoredNLLLoss'}. Best is trial 72 with value: 0.7067071906688679.[0m
[32m[I 2022-04-19 01:27:51,960][0m Trial 105 finished with value: 0.6452434781393738 and parameters: {'n_hidden': 2048, 'mixture_components': 2, 'use_sparse_layer': True, 'use_sparse_loss': True, 'lmbd': 8.235295435851546e-05, 'use_batchnorm': False, 'use_dropout': True, 'dropout': 0.6076433200506985, 'mlp_size_1': 8, 'mlp_size_2': 0, 'mlp_size_3': 0, 'kernel': 'Gamma', 'loss_name': 'CensoredNLLLoss'}. Best is trial 72 with value: 0.7067071906688679.[0m
[32m[I 2022-04-19 01:29:50,367][0m Trial 106 finished with value: 0.6385875275908417 and parameters: {'n_hidden': 2048, 'mixture_components': 3, 'use_sparse_layer': True, 'use_sparse_loss': True, 'lmbd': 0.00014135223853926584, 'use_batchnorm': False, 'use_dropout': True, 'dropout': 0.9236235148945267, 'mlp_size_1': 8, 'mlp_size_2': 0, 'mlp_size_3': 0, 'kernel': 'Gamma', 'loss_name': 'CensoredNLLLoss'}. Best is trial 72 with value: 0.7067071906688679.[0m
[32m[I 2022-04-19 01:31:52,488][0m Trial 107 finished with value: 0.6955977377199969 and parameters: {'n_hidden': 2048, 'mixture_components': 2, 'use_sparse_layer': True, 'use_sparse_loss': True, 'lmbd': 4.776356538686867e-05, 'use_batchnorm': False, 'use_dropout': False, 'mlp_size_1': 8, 'mlp_size_2': 0, 'mlp_size_3': 0, 'kernel': 'Gamma', 'loss_name': 'CensoredNLLLoss'}. Best is trial 72 with value: 0.7067071906688679.[0m
[32m[I 2022-04-19 01:33:47,237][0m Trial 108 finished with value: 0.6708835039514118 and parameters: {'n_hidden': 2048, 'mixture_components': 2, 'use_sparse_layer': True, 'use_sparse_loss': True, 'lmbd': 4.589868584443757e-05, 'use_batchnorm': False, 'use_dropout': False, 'mlp_size_1': 8, 'mlp_size_2': 0, 'mlp_size_3': 0, 'kernel': 'Gamma', 'loss_name': 'CensoredNLLLoss'}. Best is trial 72 with value: 0.7067071906688679.[0m
[32m[I 2022-04-19 01:35:37,636][0m Trial 109 finished with value: 0.6811449476570994 and parameters: {'n_hidden': 2048, 'mixture_components': 1, 'use_sparse_layer': True, 'use_sparse_loss': False, 'use_batchnorm': False, 'use_dropout': False, 'mlp_size_1': 8, 'mlp_size_2': 0, 'mlp_size_3': 0, 'kernel': 'Gamma', 'loss_name': 'CensoredNLLLoss'}. Best is trial 72 with value: 0.7067071906688679.[0m
[32m[I 2022-04-19 01:37:37,866][0m Trial 110 finished with value: 0.6875917778292864 and parameters: {'n_hidden': 2048, 'mixture_components': 2, 'use_sparse_layer': True, 'use_sparse_loss': True, 'lmbd': 2.5374296118487246e-05, 'use_batchnorm': False, 'use_dropout': False, 'mlp_size_1': 8, 'mlp_size_2': 0, 'mlp_size_3': 0, 'kernel': 'LogLogistic', 'loss_name': 'CensoredNLLLoss'}. Best is trial 72 with value: 0.7067071906688679.[0m
[32m[I 2022-04-19 01:39:24,004][0m Trial 111 finished with value: 0.6792253304068837 and parameters: {'n_hidden': 2048, 'mixture_components': 3, 'use_sparse_layer': True, 'use_sparse_loss': True, 'lmbd': 6.702600144225227e-05, 'use_batchnorm': False, 'use_dropout': False, 'mlp_size_1': 8, 'mlp_size_2': 0, 'mlp_size_3': 0, 'kernel': 'Gamma', 'loss_name': 'CensoredNLLLoss'}. Best is trial 72 with value: 0.7067071906688679.[0m
[32m[I 2022-04-19 01:41:12,879][0m Trial 112 finished with value: 0.6484824862481371 and parameters: {'n_hidden': 2048, 'mixture_components': 1, 'use_sparse_layer': True, 'use_sparse_loss': True, 'lmbd': 0.00017049555982790756, 'use_batchnorm': False, 'use_dropout': False, 'mlp_size_1': 7, 'mlp_size_2': 0, 'mlp_size_3': 0, 'kernel': 'Gamma', 'loss_name': 'CensoredNLLLoss'}. Best is trial 72 with value: 0.7067071906688679.[0m
[32m[I 2022-04-19 01:43:17,022][0m Trial 113 finished with value: 0.6743600367438611 and parameters: {'n_hidden': 2048, 'mixture_components': 3, 'use_sparse_layer': True, 'use_sparse_loss': True, 'lmbd': 0.0005620445999392338, 'use_batchnorm': False, 'use_dropout': True, 'dropout': 0.5736956867652973, 'mlp_size_1': 8, 'mlp_size_2': 0, 'mlp_size_3': 0, 'kernel': 'Gamma', 'loss_name': 'CensoredNLLLoss'}. Best is trial 72 with value: 0.7067071906688679.[0m
[32m[I 2022-04-19 01:45:26,536][0m Trial 114 finished with value: 0.6984171543487572 and parameters: {'n_hidden': 2048, 'mixture_components': 2, 'use_sparse_layer': True, 'use_sparse_loss': True, 'lmbd': 0.0002781211957190614, 'use_batchnorm': False, 'use_dropout': True, 'dropout': 0.7622159271544158, 'mlp_size_1': 7, 'mlp_size_2': 0, 'mlp_size_3': 0, 'kernel': 'Gamma', 'loss_name': 'CensoredNLLLoss'}. Best is trial 72 with value: 0.7067071906688679.[0m
