[32m[I 2022-04-13 11:44:17,636][0m Trial 504 finished with value: 0.8136417764377363 and parameters: {'splitter': 'random', 'min_samples_split': 0.27023563338630296, 'min_samples_leaf': 0.02626386629055803, 'min_weight_fraction_leaf': 0.0207432816641102, 'max_features': 0.46627709916310217}. Best is trial 156 with value: 0.860262530255716.[0m
[32m[I 2022-04-13 11:44:17,677][0m Trial 505 finished with value: 0.8541689983710665 and parameters: {'splitter': 'random', 'min_samples_split': 0.23414875562714094, 'min_samples_leaf': 0.016853759745380774, 'min_weight_fraction_leaf': 0.07590377572848059, 'max_features': 0.5598704283263297}. Best is trial 156 with value: 0.860262530255716.[0m
[32m[I 2022-04-13 11:44:17,718][0m Trial 506 finished with value: 0.7865929809567938 and parameters: {'splitter': 'random', 'min_samples_split': 0.27156306695875787, 'min_samples_leaf': 0.054145933984071096, 'min_weight_fraction_leaf': 0.0665663899698048, 'max_features': 0.494951114923157}. Best is trial 156 with value: 0.860262530255716.[0m
[32m[I 2022-04-13 11:44:17,761][0m Trial 507 finished with value: 0.8393809361313925 and parameters: {'splitter': 'best', 'min_samples_split': 0.2562049624568515, 'min_samples_leaf': 0.025366299822815852, 'min_weight_fraction_leaf': 0.038839210486958806, 'max_features': 0.5355103126180228}. Best is trial 156 with value: 0.860262530255716.[0m
[32m[I 2022-04-13 11:44:17,804][0m Trial 508 finished with value: 0.8541689983710665 and parameters: {'splitter': 'random', 'min_samples_split': 0.2439367170041961, 'min_samples_leaf': 0.011272526932625343, 'min_weight_fraction_leaf': 0.06556150071109196, 'max_features': 0.5575999545962085}. Best is trial 156 with value: 0.860262530255716.[0m
[32m[I 2022-04-13 11:44:17,846][0m Trial 509 finished with value: 0.7999200547726107 and parameters: {'splitter': 'random', 'min_samples_split': 0.2853083421279444, 'min_samples_leaf': 0.025164886635281717, 'min_weight_fraction_leaf': 0.040729345727342145, 'max_features': 0.4762781033803324}. Best is trial 156 with value: 0.860262530255716.[0m
[32m[I 2022-04-13 11:44:17,888][0m Trial 510 finished with value: 0.8515949699867061 and parameters: {'splitter': 'random', 'min_samples_split': 0.3076324412194338, 'min_samples_leaf': 0.040027923737378936, 'min_weight_fraction_leaf': 0.026265013323489017, 'max_features': 0.5697640887172776}. Best is trial 156 with value: 0.860262530255716.[0m
[32m[I 2022-04-13 11:44:17,941][0m Trial 511 finished with value: 0.77756927813589 and parameters: {'splitter': 'random', 'min_samples_split': 0.2677992172035254, 'min_samples_leaf': 0.24709585926476696, 'min_weight_fraction_leaf': 0.04072031670411522, 'max_features': 0.6379766984631016}. Best is trial 156 with value: 0.860262530255716.[0m
[32m[I 2022-04-13 11:44:18,004][0m Trial 512 finished with value: 0.6188081862944745 and parameters: {'splitter': 'random', 'min_samples_split': 0.26875285349516725, 'min_samples_leaf': 0.018007452638791346, 'min_weight_fraction_leaf': 0.36610078392887974, 'max_features': 0.5380707737957172}. Best is trial 156 with value: 0.860262530255716.[0m
[32m[I 2022-04-13 11:44:18,066][0m Trial 513 finished with value: 0.8537871744804019 and parameters: {'splitter': 'random', 'min_samples_split': 0.2782792153226033, 'min_samples_leaf': 0.009563559726078641, 'min_weight_fraction_leaf': 0.05137006216793562, 'max_features': 0.5023920354998126}. Best is trial 156 with value: 0.860262530255716.[0m
[32m[I 2022-04-13 11:44:18,130][0m Trial 514 finished with value: 0.6334936025301521 and parameters: {'splitter': 'random', 'min_samples_split': 0.2529851833436974, 'min_samples_leaf': 0.009871539572141142, 'min_weight_fraction_leaf': 0.2940630872357612, 'max_features': 0.5233371182210034}. Best is trial 156 with value: 0.860262530255716.[0m
[32m[I 2022-04-13 11:44:18,196][0m Trial 515 finished with value: 0.7203943081692755 and parameters: {'splitter': 'random', 'min_samples_split': 0.2573796799213513, 'min_samples_leaf': 0.01972741958316922, 'min_weight_fraction_leaf': 0.23384009856180435, 'max_features': 0.5402928138264}. Best is trial 156 with value: 0.860262530255716.[0m
[32m[I 2022-04-13 11:44:18,266][0m Trial 516 finished with value: 0.8495779719052834 and parameters: {'splitter': 'random', 'min_samples_split': 0.29574148432451874, 'min_samples_leaf': 0.057272577502284, 'min_weight_fraction_leaf': 0.07136215669222, 'max_features': 0.6220716395224193}. Best is trial 156 with value: 0.860262530255716.[0m
[32m[I 2022-04-13 11:44:18,331][0m Trial 517 finished with value: 0.7445764336842451 and parameters: {'splitter': 'random', 'min_samples_split': 0.2644303822217411, 'min_samples_leaf': 0.17667588961353647, 'min_weight_fraction_leaf': 0.028425347846161016, 'max_features': 0.5510510763025785}. Best is trial 156 with value: 0.860262530255716.[0m
[32m[I 2022-04-13 11:44:18,396][0m Trial 518 finished with value: 0.8297576571464743 and parameters: {'splitter': 'random', 'min_samples_split': 0.1295445127692903, 'min_samples_leaf': 0.03004621813613091, 'min_weight_fraction_leaf': 0.04514568366320999, 'max_features': 0.5820271574803662}. Best is trial 156 with value: 0.860262530255716.[0m
[32m[I 2022-04-13 11:44:18,463][0m Trial 519 finished with value: 0.8537871744804019 and parameters: {'splitter': 'random', 'min_samples_split': 0.2827845929706289, 'min_samples_leaf': 0.022911648324870613, 'min_weight_fraction_leaf': 0.034476319467940345, 'max_features': 0.5174744846773971}. Best is trial 156 with value: 0.860262530255716.[0m
[32m[I 2022-04-13 11:44:18,530][0m Trial 520 finished with value: 0.8537871744804019 and parameters: {'splitter': 'random', 'min_samples_split': 0.27830508879418586, 'min_samples_leaf': 0.04916264594086184, 'min_weight_fraction_leaf': 0.06891532324970401, 'max_features': 0.5999562369170283}. Best is trial 156 with value: 0.860262530255716.[0m
[32m[I 2022-04-13 11:44:18,595][0m Trial 521 finished with value: 0.7999200547726107 and parameters: {'splitter': 'random', 'min_samples_split': 0.28956483143044764, 'min_samples_leaf': 0.04519230141169051, 'min_weight_fraction_leaf': 0.06152991571026212, 'max_features': 0.4303769106245174}. Best is trial 156 with value: 0.860262530255716.[0m
[32m[I 2022-04-13 11:44:18,659][0m Trial 522 finished with value: 0.8541689983710665 and parameters: {'splitter': 'random', 'min_samples_split': 0.24381787145395165, 'min_samples_leaf': 0.02596446103660345, 'min_weight_fraction_leaf': 0.055458356515657364, 'max_features': 0.5369846287175487}. Best is trial 156 with value: 0.860262530255716.[0m
[32m[I 2022-04-13 11:44:18,719][0m Trial 523 finished with value: 0.7865929809567938 and parameters: {'splitter': 'random', 'min_samples_split': 0.2718946182822308, 'min_samples_leaf': 0.04302412867598232, 'min_weight_fraction_leaf': 0.07860022826722596, 'max_features': 0.45810696587077426}. Best is trial 156 with value: 0.860262530255716.[0m
[32m[I 2022-04-13 11:44:18,781][0m Trial 524 finished with value: 0.7999200547726107 and parameters: {'splitter': 'random', 'min_samples_split': 0.30268312962628985, 'min_samples_leaf': 0.03954982970810465, 'min_weight_fraction_leaf': 0.059935182948438574, 'max_features': 0.49003926022631955}. Best is trial 156 with value: 0.860262530255716.[0m
[32m[I 2022-04-13 11:44:18,838][0m Trial 525 finished with value: 0.633883214711366 and parameters: {'splitter': 'random', 'min_samples_split': 0.2483542984653793, 'min_samples_leaf': 0.0022714025422125948, 'min_weight_fraction_leaf': 0.47731517771838283, 'max_features': 0.5924738117591738}. Best is trial 156 with value: 0.860262530255716.[0m
[32m[I 2022-04-13 11:44:18,902][0m Trial 526 finished with value: 0.8393809361313925 and parameters: {'splitter': 'best', 'min_samples_split': 0.25933839389947605, 'min_samples_leaf': 0.02224464607443743, 'min_weight_fraction_leaf': 0.02316231366233386, 'max_features': 0.5077475867021322}. Best is trial 156 with value: 0.860262530255716.[0m
[32m[I 2022-04-13 11:44:18,961][0m Trial 527 finished with value: 0.8495779719052834 and parameters: {'splitter': 'random', 'min_samples_split': 0.2968412850276976, 'min_samples_leaf': 0.0012675650528174908, 'min_weight_fraction_leaf': 0.0182243152217797, 'max_features': 0.5017239734914262}. Best is trial 156 with value: 0.860262530255716.[0m
[32m[I 2022-04-13 11:44:19,019][0m Trial 528 finished with value: 0.6188081862944745 and parameters: {'splitter': 'random', 'min_samples_split': 0.26586947035168296, 'min_samples_leaf': 0.4073142814147426, 'min_weight_fraction_leaf': 0.03748497940531231, 'max_features': 0.5163235456064449}. Best is trial 156 with value: 0.860262530255716.[0m
[32m[I 2022-04-13 11:44:19,079][0m Trial 529 finished with value: 0.8537871744804019 and parameters: {'splitter': 'random', 'min_samples_split': 0.2825243955949428, 'min_samples_leaf': 0.017139085529927857, 'min_weight_fraction_leaf': 0.05844470340347731, 'max_features': 0.5262449654645248}. Best is trial 156 with value: 0.860262530255716.[0m
[32m[I 2022-04-13 11:44:19,140][0m Trial 530 finished with value: 0.860262530255716 and parameters: {'splitter': 'random', 'min_samples_split': 0.27424496030444545, 'min_samples_leaf': 0.03240605769323861, 'min_weight_fraction_leaf': 0.06576441719664317, 'max_features': 0.6074667638552677}. Best is trial 156 with value: 0.860262530255716.[0m
[32m[I 2022-04-13 11:44:19,199][0m Trial 531 finished with value: 0.7084316769818084 and parameters: {'splitter': 'random', 'min_samples_split': 0.23633620394822738, 'min_samples_leaf': 0.4758793135546443, 'min_weight_fraction_leaf': 0.08452614156818185, 'max_features': 0.6570167508010261}. Best is trial 156 with value: 0.860262530255716.[0m
[32m[I 2022-04-13 11:44:19,259][0m Trial 532 finished with value: 0.7865929809567938 and parameters: {'splitter': 'random', 'min_samples_split': 0.27218880943636103, 'min_samples_leaf': 0.0018889598240338923, 'min_weight_fraction_leaf': 0.07615831872289423, 'max_features': 0.4799759813511825}. Best is trial 156 with value: 0.860262530255716.[0m
[32m[I 2022-04-13 11:44:19,321][0m Trial 533 finished with value: 0.8537871744804019 and parameters: {'splitter': 'random', 'min_samples_split': 0.28784867564798033, 'min_samples_leaf': 0.049973812994950545, 'min_weight_fraction_leaf': 0.043217306692415663, 'max_features': 0.5663737968329179}. Best is trial 156 with value: 0.860262530255716.[0m
[32m[I 2022-04-13 11:44:19,381][0m Trial 534 finished with value: 0.7203943081692755 and parameters: {'splitter': 'random', 'min_samples_split': 0.2727152796152484, 'min_samples_leaf': 0.0010633148687157086, 'min_weight_fraction_leaf': 0.212253248631623, 'max_features': 0.5947249638502359}. Best is trial 156 with value: 0.860262530255716.[0m
[32m[I 2022-04-13 11:44:19,440][0m Trial 535 finished with value: 0.8537871744804019 and parameters: {'splitter': 'random', 'min_samples_split': 0.2874103829734662, 'min_samples_leaf': 0.03836004616639328, 'min_weight_fraction_leaf': 0.0532305225690929, 'max_features': 0.5374395785678344}. Best is trial 156 with value: 0.860262530255716.[0m
[32m[I 2022-04-13 11:44:19,500][0m Trial 536 finished with value: 0.8505444862652425 and parameters: {'splitter': 'random', 'min_samples_split': 0.26040263540246966, 'min_samples_leaf': 0.14575359725534826, 'min_weight_fraction_leaf': 0.06846070224182299, 'max_features': 0.6131074368211201}. Best is trial 156 with value: 0.860262530255716.[0m
[32m[I 2022-04-13 11:44:19,567][0m Trial 537 finished with value: 0.8190093423410939 and parameters: {'splitter': 'random', 'min_samples_split': 0.2513183928071366, 'min_samples_leaf': 0.06249300055263208, 'min_weight_fraction_leaf': 0.0794358007101555, 'max_features': 0.6256889810434956}. Best is trial 156 with value: 0.860262530255716.[0m
[32m[I 2022-04-13 11:44:19,694][0m Trial 538 finished with value: 0.855608859465337 and parameters: {'splitter': 'random', 'min_samples_split': 0.25938312835640476, 'min_samples_leaf': 0.013719391192329816, 'min_weight_fraction_leaf': 0.04774271741020863, 'max_features': 0.5596970256834735}. Best is trial 156 with value: 0.860262530255716.[0m
[32m[I 2022-04-13 11:44:19,804][0m Trial 539 finished with value: 0.8537871744804019 and parameters: {'splitter': 'random', 'min_samples_split': 0.278132664460988, 'min_samples_leaf': 0.02591812966153708, 'min_weight_fraction_leaf': 0.05532671418665925, 'max_features': 0.5445887925991431}. Best is trial 156 with value: 0.860262530255716.[0m
[32m[I 2022-04-13 11:44:19,962][0m Trial 540 finished with value: 0.860262530255716 and parameters: {'splitter': 'random', 'min_samples_split': 0.26564472095137115, 'min_samples_leaf': 0.04657645666707336, 'min_weight_fraction_leaf': 0.06559817647941202, 'max_features': 0.5741827581750644}. Best is trial 156 with value: 0.860262530255716.[0m
[32m[I 2022-04-13 11:44:20,051][0m Trial 541 finished with value: 0.8537871744804019 and parameters: {'splitter': 'random', 'min_samples_split': 0.2818438674128426, 'min_samples_leaf': 0.0484967223197386, 'min_weight_fraction_leaf': 0.062016459212750126, 'max_features': 0.5808789206132562}. Best is trial 156 with value: 0.860262530255716.[0m
[32m[I 2022-04-13 11:44:20,138][0m Trial 542 finished with value: 0.8507321463909226 and parameters: {'splitter': 'random', 'min_samples_split': 0.25277850358767173, 'min_samples_leaf': 0.03214364865181748, 'min_weight_fraction_leaf': 0.09770504335171322, 'max_features': 0.597821119102848}. Best is trial 156 with value: 0.860262530255716.[0m
[32m[I 2022-04-13 11:44:20,227][0m Trial 543 finished with value: 0.8484399756279405 and parameters: {'splitter': 'random', 'min_samples_split': 0.24671939075357238, 'min_samples_leaf': 0.07962385192613439, 'min_weight_fraction_leaf': 0.09076636186606751, 'max_features': 0.5603442085650009}. Best is trial 156 with value: 0.860262530255716.[0m
[32m[I 2022-04-13 11:44:20,341][0m Trial 544 finished with value: 0.8527792561586942 and parameters: {'splitter': 'best', 'min_samples_split': 0.22865264528204454, 'min_samples_leaf': 0.011865770822120366, 'min_weight_fraction_leaf': 0.07439324019891252, 'max_features': 0.5289628458894456}. Best is trial 156 with value: 0.860262530255716.[0m
[32m[I 2022-04-13 11:44:20,432][0m Trial 545 finished with value: 0.8536735077998788 and parameters: {'splitter': 'random', 'min_samples_split': 0.263319150126542, 'min_samples_leaf': 0.01605757719040856, 'min_weight_fraction_leaf': 0.08733573153836648, 'max_features': 0.5752539817285192}. Best is trial 156 with value: 0.860262530255716.[0m
[32m[I 2022-04-13 11:44:20,519][0m Trial 546 finished with value: 0.8507321463909226 and parameters: {'splitter': 'random', 'min_samples_split': 0.2606582006889138, 'min_samples_leaf': 0.015685401630482876, 'min_weight_fraction_leaf': 0.10501253626431457, 'max_features': 0.6144112713879211}. Best is trial 156 with value: 0.860262530255716.[0m
[32m[I 2022-04-13 11:44:20,612][0m Trial 547 finished with value: 0.8555617056756446 and parameters: {'splitter': 'random', 'min_samples_split': 0.27103349326527476, 'min_samples_leaf': 0.009755000972337363, 'min_weight_fraction_leaf': 0.03710537041271857, 'max_features': 0.5221697586619533}. Best is trial 156 with value: 0.860262530255716.[0m
[32m[I 2022-04-13 11:44:20,704][0m Trial 548 finished with value: 0.8536735077998788 and parameters: {'splitter': 'random', 'min_samples_split': 0.27169439608048274, 'min_samples_leaf': 0.0014072123747896504, 'min_weight_fraction_leaf': 0.0816403296702117, 'max_features': 0.5885147221350274}. Best is trial 156 with value: 0.860262530255716.[0m
[32m[I 2022-04-13 11:44:20,790][0m Trial 549 finished with value: 0.8505561676607082 and parameters: {'splitter': 'random', 'min_samples_split': 0.2412507489108118, 'min_samples_leaf': 0.06925393320982577, 'min_weight_fraction_leaf': 0.11580141300207566, 'max_features': 0.5563470822986072}. Best is trial 156 with value: 0.860262530255716.[0m
[32m[I 2022-04-13 11:44:20,863][0m Trial 550 finished with value: 0.855608859465337 and parameters: {'splitter': 'random', 'min_samples_split': 0.2549936527980183, 'min_samples_leaf': 0.015259756332521753, 'min_weight_fraction_leaf': 0.07382691336117794, 'max_features': 0.561102850473348}. Best is trial 156 with value: 0.860262530255716.[0m
[32m[I 2022-04-13 11:44:21,066][0m Trial 551 finished with value: 0.8537871744804019 and parameters: {'splitter': 'random', 'min_samples_split': 0.27917797613790024, 'min_samples_leaf': 0.023802993158995485, 'min_weight_fraction_leaf': 0.012375421197997089, 'max_features': 0.548106859233178}. Best is trial 156 with value: 0.860262530255716.[0m
[32m[I 2022-04-13 11:44:21,177][0m Trial 552 finished with value: 0.860262530255716 and parameters: {'splitter': 'random', 'min_samples_split': 0.27023518867299096, 'min_samples_leaf': 0.02845461385940494, 'min_weight_fraction_leaf': 0.043728785649214265, 'max_features': 0.5802361524809756}. Best is trial 156 with value: 0.860262530255716.[0m
[32m[I 2022-04-13 11:44:21,241][0m Trial 553 finished with value: 0.7999200547726107 and parameters: {'splitter': 'random', 'min_samples_split': 0.29728888699293193, 'min_samples_leaf': 0.0363994401076166, 'min_weight_fraction_leaf': 0.057878766522930655, 'max_features': 0.49274927868716395}. Best is trial 156 with value: 0.860262530255716.[0m
[32m[I 2022-04-13 11:44:21,436][0m Trial 554 finished with value: 0.855608859465337 and parameters: {'splitter': 'random', 'min_samples_split': 0.26091833149233495, 'min_samples_leaf': 0.05975451092381112, 'min_weight_fraction_leaf': 0.05592357132469022, 'max_features': 0.5780677324093089}. Best is trial 156 with value: 0.860262530255716.[0m
[32m[I 2022-04-13 11:44:21,499][0m Trial 555 finished with value: 0.8537871744804019 and parameters: {'splitter': 'random', 'min_samples_split': 0.28485260909568855, 'min_samples_leaf': 0.020252148150892792, 'min_weight_fraction_leaf': 0.04792206988695109, 'max_features': 0.5146080586350218}. Best is trial 156 with value: 0.860262530255716.[0m
[32m[I 2022-04-13 11:44:21,561][0m Trial 556 finished with value: 0.8495779719052834 and parameters: {'splitter': 'random', 'min_samples_split': 0.29196729621974893, 'min_samples_leaf': 0.010272868755131507, 'min_weight_fraction_leaf': 0.07182610091827271, 'max_features': 0.5862230257730688}. Best is trial 156 with value: 0.860262530255716.[0m
[32m[I 2022-04-13 11:44:21,624][0m Trial 557 finished with value: 0.8537871744804019 and parameters: {'splitter': 'random', 'min_samples_split': 0.2781421833100906, 'min_samples_leaf': 0.043572066557364966, 'min_weight_fraction_leaf': 0.06159622661711138, 'max_features': 0.5719381035037606}. Best is trial 156 with value: 0.860262530255716.[0m
[32m[I 2022-04-13 11:44:21,761][0m Trial 558 finished with value: 0.7999200547726107 and parameters: {'splitter': 'random', 'min_samples_split': 0.30170043328793705, 'min_samples_leaf': 0.060385882783710765, 'min_weight_fraction_leaf': 0.050618785113095414, 'max_features': 0.4497785193719407}. Best is trial 156 with value: 0.860262530255716.[0m
[32m[I 2022-04-13 11:44:21,859][0m Trial 559 finished with value: 0.855608859465337 and parameters: {'splitter': 'random', 'min_samples_split': 0.2508207894359179, 'min_samples_leaf': 0.023639748609566347, 'min_weight_fraction_leaf': 0.05144777226116036, 'max_features': 0.5496769621322002}. Best is trial 156 with value: 0.860262530255716.[0m
[32m[I 2022-04-13 11:44:21,918][0m Trial 560 finished with value: 0.7999200547726107 and parameters: {'splitter': 'random', 'min_samples_split': 0.2898002858595678, 'min_samples_leaf': 0.03388834249243333, 'min_weight_fraction_leaf': 0.054829542435874186, 'max_features': 0.4783420275939103}. Best is trial 156 with value: 0.860262530255716.[0m
[32m[I 2022-04-13 11:44:21,977][0m Trial 561 finished with value: 0.8515949699867061 and parameters: {'splitter': 'random', 'min_samples_split': 0.3149297875642687, 'min_samples_leaf': 0.03025468716759218, 'min_weight_fraction_leaf': 0.03472150514477883, 'max_features': 0.5393493197224518}. Best is trial 156 with value: 0.860262530255716.[0m
[32m[I 2022-04-13 11:44:22,034][0m Trial 562 finished with value: 0.8190093423410939 and parameters: {'splitter': 'random', 'min_samples_split': 0.2666389859635012, 'min_samples_leaf': 0.007708810121459449, 'min_weight_fraction_leaf': 0.09127752251842289, 'max_features': 0.63138454538432}. Best is trial 156 with value: 0.860262530255716.[0m
[32m[I 2022-04-13 11:44:22,093][0m Trial 563 finished with value: 0.855608859465337 and parameters: {'splitter': 'random', 'min_samples_split': 0.26005413853609965, 'min_samples_leaf': 0.027683476728351423, 'min_weight_fraction_leaf': 0.03273484426815222, 'max_features': 0.5423972154346343}. Best is trial 156 with value: 0.860262530255716.[0m
[32m[I 2022-04-13 11:44:22,149][0m Trial 564 finished with value: 0.839996638422847 and parameters: {'splitter': 'best', 'min_samples_split': 0.2787388766803686, 'min_samples_leaf': 0.01039312405440533, 'min_weight_fraction_leaf': 0.04444899661012757, 'max_features': 0.5664218735646375}. Best is trial 156 with value: 0.860262530255716.[0m
[32m[I 2022-04-13 11:44:22,210][0m Trial 565 finished with value: 0.8544192216908126 and parameters: {'splitter': 'random', 'min_samples_split': 0.24892502133895283, 'min_samples_leaf': 0.023803357603455914, 'min_weight_fraction_leaf': 0.023241939245082714, 'max_features': 0.5106713820212827}. Best is trial 156 with value: 0.860262530255716.[0m
[32m[I 2022-04-13 11:44:22,257][0m Trial 566 finished with value: 0.8537871744804019 and parameters: {'splitter': 'random', 'min_samples_split': 0.28756064193353686, 'min_samples_leaf': 0.041341871567238675, 'min_weight_fraction_leaf': 0.05967255335210551, 'max_features': 0.5310475055669772}. Best is trial 156 with value: 0.860262530255716.[0m
