[32m[I 2022-04-14 04:18:44,782][0m Trial 43 finished with value: 0.7167147110453488 and parameters: {'loss': 'coxph', 'learning_rate': 0.0011371678658990303, 'n_estimators': 411, 'criterion': 'squared_error', 'min_samples_split': 4, 'min_samples_leaf': 5, 'min_weight_fraction_leaf': 0.17206077120426447, 'min_impurity_decrease': 0.0014977497518128546, 'max_features': 0.5918437698736699, 'subsample': 0.43916954697639826, 'dropout_rate': 0.7389839872950168, 'ccp_alpha': 0.22961868687465134}. Best is trial 16 with value: 0.7216438720331207.[0m
[32m[I 2022-04-14 04:19:08,123][0m Trial 44 finished with value: 0.7026823119124053 and parameters: {'loss': 'coxph', 'learning_rate': 0.00308118446422051, 'n_estimators': 395, 'criterion': 'squared_error', 'min_samples_split': 4, 'min_samples_leaf': 5, 'min_weight_fraction_leaf': 0.21371729120068125, 'min_impurity_decrease': 0.010579712916124029, 'max_features': 0.5786503271585383, 'subsample': 0.4614481706825528, 'dropout_rate': 0.4638229976882068, 'ccp_alpha': 0.28767556666123323}. Best is trial 16 with value: 0.7216438720331207.[0m
[32m[I 2022-04-14 04:19:28,242][0m Trial 45 finished with value: 0.5 and parameters: {'loss': 'coxph', 'learning_rate': 0.0024881053454162867, 'n_estimators': 409, 'criterion': 'squared_error', 'min_samples_split': 5, 'min_samples_leaf': 5, 'min_weight_fraction_leaf': 0.17759143958488965, 'min_impurity_decrease': 0.0311348225511327, 'max_features': 0.5906035407500022, 'subsample': 0.4508617709787358, 'dropout_rate': 0.4769301199316028, 'ccp_alpha': 1.034656930873028}. Best is trial 16 with value: 0.7216438720331207.[0m
[32m[I 2022-04-14 04:19:38,619][0m Trial 46 finished with value: 0.6968707519985013 and parameters: {'loss': 'coxph', 'learning_rate': 0.003950488015504113, 'n_estimators': 241, 'criterion': 'squared_error', 'min_samples_split': 6, 'min_samples_leaf': 6, 'min_weight_fraction_leaf': 0.24127855952369676, 'min_impurity_decrease': 0.06873560778714463, 'max_features': 0.41018325373194225, 'subsample': 0.5869503675191787, 'dropout_rate': 0.3946999148891104, 'ccp_alpha': 0.19241917764060962}. Best is trial 16 with value: 0.7216438720331207.[0m
[32m[I 2022-04-14 04:19:54,431][0m Trial 47 finished with value: 0.5 and parameters: {'loss': 'coxph', 'learning_rate': 0.0017172302959499192, 'n_estimators': 300, 'criterion': 'squared_error', 'min_samples_split': 4, 'min_samples_leaf': 7, 'min_weight_fraction_leaf': 0.21252353469229163, 'min_impurity_decrease': 0.2034351352076761, 'max_features': 0.4880581328595556, 'subsample': 0.7660195069583783, 'dropout_rate': 0.3135157516859258, 'ccp_alpha': 0.7595028567701068}. Best is trial 16 with value: 0.7216438720331207.[0m
[32m[I 2022-04-14 04:20:17,531][0m Trial 48 finished with value: 0.7186248803096354 and parameters: {'loss': 'coxph', 'learning_rate': 0.009179072693080352, 'n_estimators': 335, 'criterion': 'squared_error', 'min_samples_split': 6, 'min_samples_leaf': 5, 'min_weight_fraction_leaf': 0.2733432542210479, 'min_impurity_decrease': 0.029257061965905686, 'max_features': 0.621531027836183, 'subsample': 0.5416438000723196, 'dropout_rate': 0.124909930875031, 'ccp_alpha': 0.19989440505394157}. Best is trial 16 with value: 0.7216438720331207.[0m
[32m[I 2022-04-14 04:20:41,034][0m Trial 49 finished with value: 0.656928833725279 and parameters: {'loss': 'coxph', 'learning_rate': 1.4223582836175387e-05, 'n_estimators': 341, 'criterion': 'squared_error', 'min_samples_split': 8, 'min_samples_leaf': 6, 'min_weight_fraction_leaf': 0.3708415559009794, 'min_impurity_decrease': 0.013660268937979633, 'max_features': 0.6647185122440539, 'subsample': 0.6555908458723447, 'dropout_rate': 0.1247446300414808, 'ccp_alpha': 0.021917986292791628}. Best is trial 16 with value: 0.7216438720331207.[0m
[32m[I 2022-04-14 04:20:48,072][0m Trial 50 finished with value: 0.5 and parameters: {'loss': 'coxph', 'learning_rate': 0.00022147750129148354, 'n_estimators': 178, 'criterion': 'squared_error', 'min_samples_split': 6, 'min_samples_leaf': 5, 'min_weight_fraction_leaf': 0.2803520495150075, 'min_impurity_decrease': 0.09058931503203649, 'max_features': 0.7244750095926374, 'subsample': 0.5279228606089559, 'dropout_rate': 0.16395921875509056, 'ccp_alpha': 4.856456785363783}. Best is trial 16 with value: 0.7216438720331207.[0m
[32m[I 2022-04-14 04:21:30,266][0m Trial 51 finished with value: 0.7177288516690411 and parameters: {'loss': 'coxph', 'learning_rate': 0.008118753079965322, 'n_estimators': 399, 'criterion': 'squared_error', 'min_samples_split': 4, 'min_samples_leaf': 5, 'min_weight_fraction_leaf': 0.22164182090171788, 'min_impurity_decrease': 0.0010527260180800795, 'max_features': 0.6207910112101548, 'subsample': 0.4926220097895597, 'dropout_rate': 0.0032734634567654353, 'ccp_alpha': 0.24037803287795478}. Best is trial 16 with value: 0.7216438720331207.[0m
[32m[I 2022-04-14 04:22:21,795][0m Trial 52 finished with value: 0.6966841495733521 and parameters: {'loss': 'coxph', 'learning_rate': 0.007616377562856354, 'n_estimators': 459, 'criterion': 'squared_error', 'min_samples_split': 5, 'min_samples_leaf': 4, 'min_weight_fraction_leaf': 0.351751902161495, 'min_impurity_decrease': 0.053790058717276726, 'max_features': 0.6199230995390077, 'subsample': 0.5351798586798503, 'dropout_rate': 0.05495319017175816, 'ccp_alpha': 0.2166205239515645}. Best is trial 16 with value: 0.7216438720331207.[0m
[32m[I 2022-04-14 04:22:34,395][0m Trial 53 finished with value: 0.5384579110190233 and parameters: {'loss': 'coxph', 'learning_rate': 0.009302378926012267, 'n_estimators': 266, 'criterion': 'squared_error', 'min_samples_split': 9, 'min_samples_leaf': 4, 'min_weight_fraction_leaf': 0.2593640332850679, 'min_impurity_decrease': 0.16370810308059877, 'max_features': 0.5220071091035144, 'subsample': 0.39568845724360135, 'dropout_rate': 0.11660001735517558, 'ccp_alpha': 0.521413768870387}. Best is trial 16 with value: 0.7216438720331207.[0m
[32m[I 2022-04-14 04:23:02,202][0m Trial 54 finished with value: 0.5 and parameters: {'loss': 'coxph', 'learning_rate': 0.018440387407403565, 'n_estimators': 364, 'criterion': 'squared_error', 'min_samples_split': 4, 'min_samples_leaf': 6, 'min_weight_fraction_leaf': 0.16058155930813875, 'min_impurity_decrease': 0.006376092507702193, 'max_features': 0.6171560490032163, 'subsample': 0.49657746049119794, 'dropout_rate': 0.021383475359830647, 'ccp_alpha': 0.7211101747684681}. Best is trial 16 with value: 0.7216438720331207.[0m
[32m[I 2022-04-14 04:23:22,658][0m Trial 55 finished with value: 0.6916420584849601 and parameters: {'loss': 'coxph', 'learning_rate': 0.0443520118830228, 'n_estimators': 301, 'criterion': 'friedman_mse', 'min_samples_split': 7, 'min_samples_leaf': 5, 'min_weight_fraction_leaf': 0.19325929267938752, 'min_impurity_decrease': 0.10924342655516418, 'max_features': 0.44378621551950276, 'subsample': 0.6483589704048246, 'dropout_rate': 0.006552314410897153, 'ccp_alpha': 0.23475085758813907}. Best is trial 16 with value: 0.7216438720331207.[0m
[32m[I 2022-04-14 04:23:41,900][0m Trial 56 finished with value: 0.29091094280267454 and parameters: {'loss': 'squared', 'learning_rate': 0.004836061627065793, 'n_estimators': 244, 'criterion': 'squared_error', 'min_samples_split': 5, 'min_samples_leaf': 7, 'min_weight_fraction_leaf': 0.22984709669636494, 'min_impurity_decrease': 0.0011610462144456325, 'max_features': 0.5648288732622518, 'subsample': 0.33549308365896224, 'dropout_rate': 0.0740883920568117, 'ccp_alpha': 0.5062871453380157}. Best is trial 16 with value: 0.7216438720331207.[0m
[32m[I 2022-04-14 04:24:23,777][0m Trial 57 finished with value: 0.5 and parameters: {'loss': 'coxph', 'learning_rate': 0.0004423890500415044, 'n_estimators': 445, 'criterion': 'squared_error', 'min_samples_split': 4, 'min_samples_leaf': 5, 'min_weight_fraction_leaf': 0.29899946443911307, 'min_impurity_decrease': 0.1367135042344423, 'max_features': 0.37830368010216087, 'subsample': 0.5580443553100893, 'dropout_rate': 0.20774737060017637, 'ccp_alpha': 1.0978223730901875}. Best is trial 16 with value: 0.7216438720331207.[0m
[32m[I 2022-04-14 04:24:29,796][0m Trial 58 finished with value: 0.7229632476977819 and parameters: {'loss': 'coxph', 'learning_rate': 0.011932202922181629, 'n_estimators': 218, 'criterion': 'squared_error', 'min_samples_split': 4, 'min_samples_leaf': 4, 'min_weight_fraction_leaf': 0.14688328006861662, 'min_impurity_decrease': 0.0609367920717898, 'max_features': 0.8799984061454742, 'subsample': 0.4082256886825768, 'dropout_rate': 0.5574950868374631, 'ccp_alpha': 0.14230517638595405}. Best is trial 58 with value: 0.7229632476977819.[0m
[32m[I 2022-04-14 04:24:34,617][0m Trial 59 finished with value: 0.714907537240004 and parameters: {'loss': 'coxph', 'learning_rate': 5.2501997197345685e-05, 'n_estimators': 214, 'criterion': 'friedman_mse', 'min_samples_split': 8, 'min_samples_leaf': 6, 'min_weight_fraction_leaf': 0.1443181914661992, 'min_impurity_decrease': 0.06933143415039604, 'max_features': 0.9057395918156101, 'subsample': 0.4054438745050683, 'dropout_rate': 0.566238234286448, 'ccp_alpha': 0.13068929662737716}. Best is trial 58 with value: 0.7229632476977819.[0m
[32m[I 2022-04-14 04:24:38,389][0m Trial 60 finished with value: 0.7143656303192324 and parameters: {'loss': 'coxph', 'learning_rate': 1.2983053941833388e-06, 'n_estimators': 189, 'criterion': 'friedman_mse', 'min_samples_split': 8, 'min_samples_leaf': 7, 'min_weight_fraction_leaf': 0.14309071321723515, 'min_impurity_decrease': 0.05029868646481225, 'max_features': 0.8867224876675842, 'subsample': 0.40181365015663, 'dropout_rate': 0.612618374459015, 'ccp_alpha': 0.16882430498655038}. Best is trial 58 with value: 0.7229632476977819.[0m
[32m[I 2022-04-14 04:24:44,788][0m Trial 61 finished with value: 0.7129420081651492 and parameters: {'loss': 'coxph', 'learning_rate': 2.538683306696088e-06, 'n_estimators': 183, 'criterion': 'friedman_mse', 'min_samples_split': 8, 'min_samples_leaf': 7, 'min_weight_fraction_leaf': 0.1449404580790894, 'min_impurity_decrease': 0.056522164318229456, 'max_features': 0.8682849011561188, 'subsample': 0.41078578899602014, 'dropout_rate': 0.5371496702579901, 'ccp_alpha': 0.15365132924579925}. Best is trial 58 with value: 0.7229632476977819.[0m
[32m[I 2022-04-14 04:24:49,080][0m Trial 62 finished with value: 0.5 and parameters: {'loss': 'coxph', 'learning_rate': 2.1611862463318157e-05, 'n_estimators': 212, 'criterion': 'friedman_mse', 'min_samples_split': 9, 'min_samples_leaf': 8, 'min_weight_fraction_leaf': 0.13774016989863044, 'min_impurity_decrease': 0.09400367761485125, 'max_features': 0.9711836282762114, 'subsample': 0.4874796370136841, 'dropout_rate': 0.5811100740077682, 'ccp_alpha': 0.6231918839189687}. Best is trial 58 with value: 0.7229632476977819.[0m
[32m[I 2022-04-14 04:24:51,708][0m Trial 63 finished with value: 0.7143849238991493 and parameters: {'loss': 'coxph', 'learning_rate': 5.040633200375319e-06, 'n_estimators': 159, 'criterion': 'friedman_mse', 'min_samples_split': 8, 'min_samples_leaf': 6, 'min_weight_fraction_leaf': 0.15641998506768687, 'min_impurity_decrease': 0.04476323929745575, 'max_features': 0.8759254990440702, 'subsample': 0.355934202953145, 'dropout_rate': 0.6487915045295234, 'ccp_alpha': 0.18243520958138237}. Best is trial 58 with value: 0.7229632476977819.[0m
[32m[I 2022-04-14 04:24:54,122][0m Trial 64 finished with value: 0.6819975860808761 and parameters: {'loss': 'coxph', 'learning_rate': 2.8953741452346624e-06, 'n_estimators': 153, 'criterion': 'friedman_mse', 'min_samples_split': 8, 'min_samples_leaf': 6, 'min_weight_fraction_leaf': 0.1964881651884967, 'min_impurity_decrease': 0.18302539465309325, 'max_features': 0.9418828405316415, 'subsample': 0.3541474601833867, 'dropout_rate': 0.687224342555842, 'ccp_alpha': 0.45965727908136306}. Best is trial 58 with value: 0.7229632476977819.[0m
[32m[I 2022-04-14 04:24:55,896][0m Trial 65 finished with value: 0.5 and parameters: {'loss': 'coxph', 'learning_rate': 5.050817343186004e-05, 'n_estimators': 127, 'criterion': 'friedman_mse', 'min_samples_split': 10, 'min_samples_leaf': 6, 'min_weight_fraction_leaf': 0.2274828032215218, 'min_impurity_decrease': 0.03964012944316643, 'max_features': 0.9168092139585274, 'subsample': 0.43647286413773184, 'dropout_rate': 0.6484223223091333, 'ccp_alpha': 2.018412728444587}. Best is trial 58 with value: 0.7229632476977819.[0m
[32m[I 2022-04-14 04:24:58,977][0m Trial 66 finished with value: 0.5 and parameters: {'loss': 'coxph', 'learning_rate': 8.5810788567781e-06, 'n_estimators': 140, 'criterion': 'friedman_mse', 'min_samples_split': 7, 'min_samples_leaf': 5, 'min_weight_fraction_leaf': 0.25606079436136897, 'min_impurity_decrease': 0.08695561226666348, 'max_features': 0.8198796363714917, 'subsample': 0.48250890497564414, 'dropout_rate': 0.5439882406889152, 'ccp_alpha': 3.416463298830826}. Best is trial 58 with value: 0.7229632476977819.[0m
[32m[I 2022-04-14 04:25:02,290][0m Trial 67 finished with value: 0.5 and parameters: {'loss': 'coxph', 'learning_rate': 0.025156810776442214, 'n_estimators': 167, 'criterion': 'friedman_mse', 'min_samples_split': 9, 'min_samples_leaf': 6, 'min_weight_fraction_leaf': 0.1613185375989481, 'min_impurity_decrease': 0.8116796913484221, 'max_features': 0.8503673724735668, 'subsample': 0.4183851172715652, 'dropout_rate': 0.6884437030428951, 'ccp_alpha': 0.855902457902892}. Best is trial 58 with value: 0.7229632476977819.[0m
[32m[I 2022-04-14 04:25:08,605][0m Trial 68 finished with value: 0.7060818638845514 and parameters: {'loss': 'coxph', 'learning_rate': 4.9740507414502635e-06, 'n_estimators': 209, 'criterion': 'friedman_mse', 'min_samples_split': 7, 'min_samples_leaf': 8, 'min_weight_fraction_leaf': 0.18585083563360183, 'min_impurity_decrease': 0.031884896992877707, 'max_features': 0.7765885648290234, 'subsample': 0.36728284304340614, 'dropout_rate': 0.44051424346237605, 'ccp_alpha': 0.14405611176809907}. Best is trial 58 with value: 0.7229632476977819.[0m
[32m[I 2022-04-14 04:25:14,009][0m Trial 69 finished with value: 0.27629826033043664 and parameters: {'loss': 'squared', 'learning_rate': 8.757490660286274e-05, 'n_estimators': 220, 'criterion': 'squared_error', 'min_samples_split': 9, 'min_samples_leaf': 5, 'min_weight_fraction_leaf': 0.15865512338199025, 'min_impurity_decrease': 0.11426483183933776, 'max_features': 0.9029624401421942, 'subsample': 0.5620537927305128, 'dropout_rate': 0.6015006595785004, 'ccp_alpha': 0.0021134096540205427}. Best is trial 58 with value: 0.7229632476977819.[0m
[32m[I 2022-04-14 04:25:24,921][0m Trial 70 finished with value: 0.5049013916902899 and parameters: {'loss': 'coxph', 'learning_rate': 0.013271325167447008, 'n_estimators': 268, 'criterion': 'squared_error', 'min_samples_split': 8, 'min_samples_leaf': 6, 'min_weight_fraction_leaf': 0.09227874865931354, 'min_impurity_decrease': 0.07692891888331434, 'max_features': 0.07416305440615262, 'subsample': 0.3304569142603527, 'dropout_rate': 0.5221545146152735, 'ccp_alpha': 0.6206587417273035}. Best is trial 58 with value: 0.7229632476977819.[0m
[32m[I 2022-04-14 04:25:29,846][0m Trial 71 finished with value: 0.7026266698624434 and parameters: {'loss': 'coxph', 'learning_rate': 2.1306426462848274e-06, 'n_estimators': 191, 'criterion': 'friedman_mse', 'min_samples_split': 8, 'min_samples_leaf': 7, 'min_weight_fraction_leaf': 0.1345694070019552, 'min_impurity_decrease': 0.042107536320477645, 'max_features': 0.9000787501484799, 'subsample': 0.3844520626741752, 'dropout_rate': 0.6098368706560384, 'ccp_alpha': 0.21297891063706842}. Best is trial 58 with value: 0.7229632476977819.[0m
[32m[I 2022-04-14 04:25:34,341][0m Trial 72 finished with value: 0.6826998184559269 and parameters: {'loss': 'coxph', 'learning_rate': 4.082174322107425e-06, 'n_estimators': 178, 'criterion': 'friedman_mse', 'min_samples_split': 7, 'min_samples_leaf': 7, 'min_weight_fraction_leaf': 0.14740182153808562, 'min_impurity_decrease': 0.12911151780675076, 'max_features': 0.8781011730581797, 'subsample': 0.4214121101547637, 'dropout_rate': 0.6316743453594339, 'ccp_alpha': 0.3652026917903841}. Best is trial 58 with value: 0.7229632476977819.[0m
[32m[I 2022-04-14 04:25:41,231][0m Trial 73 finished with value: 0.7105842353489795 and parameters: {'loss': 'coxph', 'learning_rate': 3.0183332931618698e-05, 'n_estimators': 229, 'criterion': 'friedman_mse', 'min_samples_split': 9, 'min_samples_leaf': 6, 'min_weight_fraction_leaf': 0.1672888955711201, 'min_impurity_decrease': 0.06726692558858174, 'max_features': 0.9610572810993567, 'subsample': 0.27619663730899185, 'dropout_rate': 0.5636733024549265, 'ccp_alpha': 0.1430993590594516}. Best is trial 58 with value: 0.7229632476977819.[0m
[32m[I 2022-04-14 04:25:45,187][0m Trial 74 finished with value: 0.5440591793572269 and parameters: {'loss': 'coxph', 'learning_rate': 7.08195725875286e-06, 'n_estimators': 161, 'criterion': 'friedman_mse', 'min_samples_split': 8, 'min_samples_leaf': 8, 'min_weight_fraction_leaf': 0.12188517207958341, 'min_impurity_decrease': 0.0013170356248108778, 'max_features': 0.7902495809522732, 'subsample': 0.47114807976602596, 'dropout_rate': 0.505820031192302, 'ccp_alpha': 0.45342155443589044}. Best is trial 58 with value: 0.7229632476977819.[0m
[32m[I 2022-04-14 04:25:48,927][0m Trial 75 finished with value: 0.6741820647286891 and parameters: {'loss': 'coxph', 'learning_rate': 1.039442898983755e-06, 'n_estimators': 199, 'criterion': 'friedman_mse', 'min_samples_split': 10, 'min_samples_leaf': 7, 'min_weight_fraction_leaf': 0.20295703271192583, 'min_impurity_decrease': 0.03862386191900826, 'max_features': 0.7258095409178581, 'subsample': 0.5063082439757298, 'dropout_rate': 0.6622981683242368, 'ccp_alpha': 0.2834471210432086}. Best is trial 58 with value: 0.7229632476977819.[0m
[32m[I 2022-04-14 04:25:51,354][0m Trial 76 finished with value: 0.501432552284095 and parameters: {'loss': 'coxph', 'learning_rate': 1.570054067413663e-06, 'n_estimators': 130, 'criterion': 'friedman_mse', 'min_samples_split': 8, 'min_samples_leaf': 5, 'min_weight_fraction_leaf': 0.14896741508846473, 'min_impurity_decrease': 0.16109190155678296, 'max_features': 0.9833751140160131, 'subsample': 0.30147142582564196, 'dropout_rate': 0.5820027949039012, 'ccp_alpha': 0.8078632316873624}. Best is trial 58 with value: 0.7229632476977819.[0m
[32m[I 2022-04-14 04:25:52,880][0m Trial 77 finished with value: 0.5 and parameters: {'loss': 'coxph', 'learning_rate': 1.090479620760065e-06, 'n_estimators': 143, 'criterion': 'squared_error', 'min_samples_split': 7, 'min_samples_leaf': 4, 'min_weight_fraction_leaf': 0.18081812572079786, 'min_impurity_decrease': 0.09533157347803274, 'max_features': 0.938447223429649, 'subsample': 0.6312546800211888, 'dropout_rate': 0.6972903402776621, 'ccp_alpha': 0.6571621082940238}. Best is trial 58 with value: 0.7229632476977819.[0m
[32m[I 2022-04-14 04:26:13,638][0m Trial 78 finished with value: 0.7261309541084924 and parameters: {'loss': 'coxph', 'learning_rate': 0.0011675935335988834, 'n_estimators': 348, 'criterion': 'squared_error', 'min_samples_split': 6, 'min_samples_leaf': 5, 'min_weight_fraction_leaf': 0.06641432835364289, 'min_impurity_decrease': 0.033507388085061346, 'max_features': 0.8199941018702339, 'subsample': 0.3729049351145164, 'dropout_rate': 0.3926245750763886, 'ccp_alpha': 0.14043815075659138}. Best is trial 78 with value: 0.7261309541084924.[0m
[32m[I 2022-04-14 04:26:32,940][0m Trial 79 finished with value: 0.6919815107725096 and parameters: {'loss': 'coxph', 'learning_rate': 0.0018354602389590012, 'n_estimators': 348, 'criterion': 'squared_error', 'min_samples_split': 6, 'min_samples_leaf': 5, 'min_weight_fraction_leaf': 0.08133879401451816, 'min_impurity_decrease': 0.02192787092024503, 'max_features': 0.8581867620054001, 'subsample': 0.36394216042178557, 'dropout_rate': 0.32472018460304963, 'ccp_alpha': 0.46342784945512905}. Best is trial 78 with value: 0.7261309541084924.[0m
[32m[I 2022-04-14 04:26:59,147][0m Trial 80 finished with value: 0.34475993592683263 and parameters: {'loss': 'squared', 'learning_rate': 0.0009649183699311389, 'n_estimators': 387, 'criterion': 'squared_error', 'min_samples_split': 6, 'min_samples_leaf': 5, 'min_weight_fraction_leaf': 0.06331437553863635, 'min_impurity_decrease': 0.623009795196842, 'max_features': 0.8287469271319114, 'subsample': 0.5422008877258265, 'dropout_rate': 0.22792155534208416, 'ccp_alpha': 0.9673203348575545}. Best is trial 78 with value: 0.7261309541084924.[0m
[32m[I 2022-04-14 04:27:28,454][0m Trial 81 finished with value: 0.7271739296425965 and parameters: {'loss': 'coxph', 'learning_rate': 0.0033375719756472706, 'n_estimators': 509, 'criterion': 'squared_error', 'min_samples_split': 5, 'min_samples_leaf': 6, 'min_weight_fraction_leaf': 0.1280760415409238, 'min_impurity_decrease': 0.06375683492636017, 'max_features': 0.8096672331916136, 'subsample': 0.4000891182590253, 'dropout_rate': 0.629047601601643, 'ccp_alpha': 0.16008275245678727}. Best is trial 81 with value: 0.7271739296425965.[0m
[32m[I 2022-04-14 04:27:45,459][0m Trial 82 finished with value: 0.7163312408660969 and parameters: {'loss': 'coxph', 'learning_rate': 0.003671560317281568, 'n_estimators': 288, 'criterion': 'squared_error', 'min_samples_split': 5, 'min_samples_leaf': 6, 'min_weight_fraction_leaf': 0.10775363559305212, 'min_impurity_decrease': 0.06966369957429869, 'max_features': 0.6734867170346871, 'subsample': 0.431352110636389, 'dropout_rate': 0.0915666367119625, 'ccp_alpha': 0.09013063988486643}. Best is trial 81 with value: 0.7271739296425965.[0m
