[32m[I 2022-04-13 11:43:50,858][0m Trial 63 finished with value: 0.8225867166898739 and parameters: {'splitter': 'best', 'min_samples_split': 0.059208944787087714, 'min_samples_leaf': 0.18181733886465481, 'min_weight_fraction_leaf': 0.018539320182455157, 'max_features': 0.46312074035196904}. Best is trial 1 with value: 0.8509196259844106.[0m
[32m[I 2022-04-13 11:43:50,893][0m Trial 64 finished with value: 0.8457629256167987 and parameters: {'splitter': 'best', 'min_samples_split': 0.03442568575862939, 'min_samples_leaf': 0.11632119997973892, 'min_weight_fraction_leaf': 0.04359541501134778, 'max_features': 0.882801720174582}. Best is trial 1 with value: 0.8509196259844106.[0m
[32m[I 2022-04-13 11:43:50,927][0m Trial 65 finished with value: 0.8445264069148072 and parameters: {'splitter': 'best', 'min_samples_split': 0.23839279947088174, 'min_samples_leaf': 0.0780551941269341, 'min_weight_fraction_leaf': 0.0781325189968282, 'max_features': 0.8319709707330283}. Best is trial 1 with value: 0.8509196259844106.[0m
[32m[I 2022-04-13 11:43:50,963][0m Trial 66 finished with value: 0.8389560137675636 and parameters: {'splitter': 'best', 'min_samples_split': 0.0713233050080657, 'min_samples_leaf': 0.2091336385263638, 'min_weight_fraction_leaf': 0.1021773294660767, 'max_features': 0.5468803894198945}. Best is trial 1 with value: 0.8509196259844106.[0m
[32m[I 2022-04-13 11:43:51,010][0m Trial 67 finished with value: 0.8335269507360499 and parameters: {'splitter': 'best', 'min_samples_split': 0.10689923117439555, 'min_samples_leaf': 0.10318072949712774, 'min_weight_fraction_leaf': 0.00850870397889354, 'max_features': 0.729241589227437}. Best is trial 1 with value: 0.8509196259844106.[0m
[32m[I 2022-04-13 11:43:51,044][0m Trial 68 finished with value: 0.7022567187784604 and parameters: {'splitter': 'random', 'min_samples_split': 0.4447488456135623, 'min_samples_leaf': 0.16447886330881295, 'min_weight_fraction_leaf': 0.06055092972543968, 'max_features': 0.9657301348455242}. Best is trial 1 with value: 0.8509196259844106.[0m
[32m[I 2022-04-13 11:43:51,080][0m Trial 69 finished with value: 0.7272392355714593 and parameters: {'splitter': 'best', 'min_samples_split': 0.048993349062231926, 'min_samples_leaf': 0.0501027925108614, 'min_weight_fraction_leaf': 0.15796934296055648, 'max_features': 0.799565538115438}. Best is trial 1 with value: 0.8509196259844106.[0m
[32m[I 2022-04-13 11:43:51,131][0m Trial 70 finished with value: 0.8350841102962416 and parameters: {'splitter': 'best', 'min_samples_split': 0.023530490635392958, 'min_samples_leaf': 0.19487890457180584, 'min_weight_fraction_leaf': 0.12143376756935666, 'max_features': 0.8929710561265116}. Best is trial 1 with value: 0.8509196259844106.[0m
[32m[I 2022-04-13 11:43:51,166][0m Trial 71 finished with value: 0.8470575355951903 and parameters: {'splitter': 'best', 'min_samples_split': 0.42439502283921343, 'min_samples_leaf': 0.037103514759320465, 'min_weight_fraction_leaf': 0.10137423483434863, 'max_features': 0.6309609446774386}. Best is trial 1 with value: 0.8509196259844106.[0m
[32m[I 2022-04-13 11:43:51,198][0m Trial 72 finished with value: 0.6699895353692963 and parameters: {'splitter': 'best', 'min_samples_split': 0.4691375927930793, 'min_samples_leaf': 0.4216819919269068, 'min_weight_fraction_leaf': 0.0555865294625439, 'max_features': 0.5741337074099654}. Best is trial 1 with value: 0.8509196259844106.[0m
[32m[I 2022-04-13 11:43:51,233][0m Trial 73 finished with value: 0.7352881709585655 and parameters: {'splitter': 'best', 'min_samples_split': 0.4222124113480543, 'min_samples_leaf': 0.020698126620285334, 'min_weight_fraction_leaf': 0.0003600770053256361, 'max_features': 0.6180218725069543}. Best is trial 1 with value: 0.8509196259844106.[0m
[32m[I 2022-04-13 11:43:51,313][0m Trial 74 finished with value: 0.8323022611089037 and parameters: {'splitter': 'best', 'min_samples_split': 0.3637739671702234, 'min_samples_leaf': 0.06645901323027514, 'min_weight_fraction_leaf': 0.1832335092389301, 'max_features': 0.6454694559119336}. Best is trial 1 with value: 0.8509196259844106.[0m
[32m[I 2022-04-13 11:43:51,435][0m Trial 75 finished with value: 0.8391661035754385 and parameters: {'splitter': 'best', 'min_samples_split': 0.4776888794979436, 'min_samples_leaf': 0.08257845705329163, 'min_weight_fraction_leaf': 0.03291407259028103, 'max_features': 0.6979506315889135}. Best is trial 1 with value: 0.8509196259844106.[0m
[32m[I 2022-04-13 11:43:51,539][0m Trial 76 finished with value: 0.6418306196043408 and parameters: {'splitter': 'random', 'min_samples_split': 0.2867072379526769, 'min_samples_leaf': 0.12905082071019663, 'min_weight_fraction_leaf': 0.10174251713930675, 'max_features': 0.4028603290151435}. Best is trial 1 with value: 0.8509196259844106.[0m
[32m[I 2022-04-13 11:43:51,637][0m Trial 77 finished with value: 0.7107945590788864 and parameters: {'splitter': 'best', 'min_samples_split': 0.4282913906384058, 'min_samples_leaf': 0.04019261263289737, 'min_weight_fraction_leaf': 0.2505148723991706, 'max_features': 0.7621708627221989}. Best is trial 1 with value: 0.8509196259844106.[0m
[32m[I 2022-04-13 11:43:51,732][0m Trial 78 finished with value: 0.8403206429065978 and parameters: {'splitter': 'best', 'min_samples_split': 0.0759806277767194, 'min_samples_leaf': 0.09795826880628931, 'min_weight_fraction_leaf': 0.0699967848377458, 'max_features': 0.9235066696465649}. Best is trial 1 with value: 0.8509196259844106.[0m
[32m[I 2022-04-13 11:43:51,808][0m Trial 79 finished with value: 0.7126933834326028 and parameters: {'splitter': 'best', 'min_samples_split': 0.001554349025623715, 'min_samples_leaf': 0.14255728862721076, 'min_weight_fraction_leaf': 0.4928704232130074, 'max_features': 0.9728062816867953}. Best is trial 1 with value: 0.8509196259844106.[0m
[32m[I 2022-04-13 11:43:51,922][0m Trial 80 finished with value: 0.7871654781218904 and parameters: {'splitter': 'random', 'min_samples_split': 0.38131851838838865, 'min_samples_leaf': 0.22320766831548128, 'min_weight_fraction_leaf': 0.11711240918682447, 'max_features': 0.8487312282549315}. Best is trial 1 with value: 0.8509196259844106.[0m
[32m[I 2022-04-13 11:43:52,001][0m Trial 81 finished with value: 0.7114744839503694 and parameters: {'splitter': 'best', 'min_samples_split': 0.4996056673780508, 'min_samples_leaf': 0.0078086048756454765, 'min_weight_fraction_leaf': 0.20833441430987534, 'max_features': 0.49825321051656646}. Best is trial 1 with value: 0.8509196259844106.[0m
[32m[I 2022-04-13 11:43:52,092][0m Trial 82 finished with value: 0.8457321420794376 and parameters: {'splitter': 'best', 'min_samples_split': 0.09056270727802276, 'min_samples_leaf': 0.05475980181168495, 'min_weight_fraction_leaf': 0.14323372870609352, 'max_features': 0.6585492580733227}. Best is trial 1 with value: 0.8509196259844106.[0m
[32m[I 2022-04-13 11:43:52,172][0m Trial 83 finished with value: 0.8517351860111061 and parameters: {'splitter': 'best', 'min_samples_split': 0.21583438910764655, 'min_samples_leaf': 0.03298454205423658, 'min_weight_fraction_leaf': 0.08114363743090158, 'max_features': 0.5710469201863397}. Best is trial 83 with value: 0.8517351860111061.[0m
[32m[I 2022-04-13 11:43:52,257][0m Trial 84 finished with value: 0.8393781950493112 and parameters: {'splitter': 'best', 'min_samples_split': 0.21238448169314192, 'min_samples_leaf': 0.03277217288037167, 'min_weight_fraction_leaf': 0.044397373543691214, 'max_features': 0.5661382494659556}. Best is trial 83 with value: 0.8517351860111061.[0m
[32m[I 2022-04-13 11:43:52,360][0m Trial 85 finished with value: 0.8497174470872372 and parameters: {'splitter': 'best', 'min_samples_split': 0.17795719176293334, 'min_samples_leaf': 0.07113790312597663, 'min_weight_fraction_leaf': 0.07699543144565948, 'max_features': 0.6076793625024299}. Best is trial 83 with value: 0.8517351860111061.[0m
[32m[I 2022-04-13 11:43:52,444][0m Trial 86 finished with value: 0.8514607957112139 and parameters: {'splitter': 'best', 'min_samples_split': 0.17658640644377624, 'min_samples_leaf': 0.11256430110739857, 'min_weight_fraction_leaf': 0.08336437966945784, 'max_features': 0.5267650917090224}. Best is trial 83 with value: 0.8517351860111061.[0m
[32m[I 2022-04-13 11:43:52,539][0m Trial 87 finished with value: 0.8445960870660043 and parameters: {'splitter': 'best', 'min_samples_split': 0.1948272108527347, 'min_samples_leaf': 0.12102494259260373, 'min_weight_fraction_leaf': 0.07807350703995315, 'max_features': 0.514874362018573}. Best is trial 83 with value: 0.8517351860111061.[0m
[32m[I 2022-04-13 11:43:52,639][0m Trial 88 finished with value: 0.8130380088157715 and parameters: {'splitter': 'best', 'min_samples_split': 0.23904978188494214, 'min_samples_leaf': 0.07151515353499421, 'min_weight_fraction_leaf': 0.1333031099577608, 'max_features': 0.47708584275060983}. Best is trial 83 with value: 0.8517351860111061.[0m
[32m[I 2022-04-13 11:43:52,735][0m Trial 89 finished with value: 0.8515461582618833 and parameters: {'splitter': 'random', 'min_samples_split': 0.17824383431970658, 'min_samples_leaf': 0.10864152519553946, 'min_weight_fraction_leaf': 0.020810079965840958, 'max_features': 0.5999165723730989}. Best is trial 83 with value: 0.8517351860111061.[0m
[32m[I 2022-04-13 11:43:52,882][0m Trial 90 finished with value: 0.8515461582618833 and parameters: {'splitter': 'random', 'min_samples_split': 0.17636014783087325, 'min_samples_leaf': 0.10873254756416599, 'min_weight_fraction_leaf': 0.0838180816032758, 'max_features': 0.5751180760283648}. Best is trial 83 with value: 0.8517351860111061.[0m
[32m[I 2022-04-13 11:43:53,025][0m Trial 91 finished with value: 0.8515461582618833 and parameters: {'splitter': 'random', 'min_samples_split': 0.17655762622830667, 'min_samples_leaf': 0.10597919677335275, 'min_weight_fraction_leaf': 0.08609784116196441, 'max_features': 0.5457439143044572}. Best is trial 83 with value: 0.8517351860111061.[0m
[32m[I 2022-04-13 11:43:53,191][0m Trial 92 finished with value: 0.8515461582618833 and parameters: {'splitter': 'random', 'min_samples_split': 0.17344875790773312, 'min_samples_leaf': 0.11459079729025011, 'min_weight_fraction_leaf': 0.08229521635033525, 'max_features': 0.5977855167530952}. Best is trial 83 with value: 0.8517351860111061.[0m
[32m[I 2022-04-13 11:43:53,334][0m Trial 93 finished with value: 0.8325020874003526 and parameters: {'splitter': 'random', 'min_samples_split': 0.17567660765056203, 'min_samples_leaf': 0.08574896329830119, 'min_weight_fraction_leaf': 0.08278083462329427, 'max_features': 0.5829492141471947}. Best is trial 83 with value: 0.8517351860111061.[0m
[32m[I 2022-04-13 11:43:53,410][0m Trial 94 finished with value: 0.8515461582618833 and parameters: {'splitter': 'random', 'min_samples_split': 0.226492172835138, 'min_samples_leaf': 0.11247900438799109, 'min_weight_fraction_leaf': 0.09455643357368791, 'max_features': 0.5436557081744093}. Best is trial 83 with value: 0.8517351860111061.[0m
[32m[I 2022-04-13 11:43:53,481][0m Trial 95 finished with value: 0.8515461582618833 and parameters: {'splitter': 'random', 'min_samples_split': 0.22004894593974197, 'min_samples_leaf': 0.1080763003913435, 'min_weight_fraction_leaf': 0.0986981900515145, 'max_features': 0.5440628493007686}. Best is trial 83 with value: 0.8517351860111061.[0m
[32m[I 2022-04-13 11:43:53,542][0m Trial 96 finished with value: 0.8515461582618833 and parameters: {'splitter': 'random', 'min_samples_split': 0.2248816606360412, 'min_samples_leaf': 0.111633506875922, 'min_weight_fraction_leaf': 0.11315759790574864, 'max_features': 0.545853250394891}. Best is trial 83 with value: 0.8517351860111061.[0m
[32m[I 2022-04-13 11:43:53,595][0m Trial 97 finished with value: 0.8515461582618833 and parameters: {'splitter': 'random', 'min_samples_split': 0.22017221319268196, 'min_samples_leaf': 0.10545231724011263, 'min_weight_fraction_leaf': 0.11636802257380673, 'max_features': 0.5382221020647817}. Best is trial 83 with value: 0.8517351860111061.[0m
[32m[I 2022-04-13 11:43:53,652][0m Trial 98 finished with value: 0.8505444862652425 and parameters: {'splitter': 'random', 'min_samples_split': 0.22414739700752984, 'min_samples_leaf': 0.15156192804773835, 'min_weight_fraction_leaf': 0.11407763770165429, 'max_features': 0.5444750449647012}. Best is trial 83 with value: 0.8517351860111061.[0m
[32m[I 2022-04-13 11:43:53,721][0m Trial 99 finished with value: 0.6511804230036107 and parameters: {'splitter': 'random', 'min_samples_split': 0.20067644169792653, 'min_samples_leaf': 0.10871573460418348, 'min_weight_fraction_leaf': 0.10170417689733519, 'max_features': 0.49416648419550696}. Best is trial 83 with value: 0.8517351860111061.[0m
[32m[I 2022-04-13 11:43:53,783][0m Trial 100 finished with value: 0.6340895535515406 and parameters: {'splitter': 'random', 'min_samples_split': 0.22248510266918106, 'min_samples_leaf': 0.12227542590103664, 'min_weight_fraction_leaf': 0.0922399846932224, 'max_features': 0.42922846686592275}. Best is trial 83 with value: 0.8517351860111061.[0m
[32m[I 2022-04-13 11:43:53,841][0m Trial 101 finished with value: 0.8538689421556729 and parameters: {'splitter': 'random', 'min_samples_split': 0.26372765724863956, 'min_samples_leaf': 0.10633609082011496, 'min_weight_fraction_leaf': 0.12653067546121255, 'max_features': 0.5296662112087475}. Best is trial 101 with value: 0.8538689421556729.[0m
[32m[I 2022-04-13 11:43:53,900][0m Trial 102 finished with value: 0.7445764336842451 and parameters: {'splitter': 'random', 'min_samples_split': 0.25465512642030586, 'min_samples_leaf': 0.16974549492798108, 'min_weight_fraction_leaf': 0.12765078579140554, 'max_features': 0.5317809481076332}. Best is trial 101 with value: 0.8538689421556729.[0m
[32m[I 2022-04-13 11:43:53,978][0m Trial 103 finished with value: 0.8583071091313723 and parameters: {'splitter': 'random', 'min_samples_split': 0.2805577517785673, 'min_samples_leaf': 0.10769958041575604, 'min_weight_fraction_leaf': 0.06114101332842223, 'max_features': 0.562721718484691}. Best is trial 103 with value: 0.8583071091313723.[0m
[32m[I 2022-04-13 11:43:54,046][0m Trial 104 finished with value: 0.8569159849035302 and parameters: {'splitter': 'random', 'min_samples_split': 0.2721307335228955, 'min_samples_leaf': 0.10596074849409189, 'min_weight_fraction_leaf': 0.0664931400540977, 'max_features': 0.5614979729823718}. Best is trial 103 with value: 0.8583071091313723.[0m
[32m[I 2022-04-13 11:43:54,097][0m Trial 105 finished with value: 0.8574177483619669 and parameters: {'splitter': 'random', 'min_samples_split': 0.28030884599028744, 'min_samples_leaf': 0.09688961674772051, 'min_weight_fraction_leaf': 0.06421946700940968, 'max_features': 0.5660990259532005}. Best is trial 103 with value: 0.8583071091313723.[0m
[32m[I 2022-04-13 11:43:54,152][0m Trial 106 finished with value: 0.8532085457868485 and parameters: {'splitter': 'random', 'min_samples_split': 0.3016565125362225, 'min_samples_leaf': 0.09263448708196872, 'min_weight_fraction_leaf': 0.059692603836390176, 'max_features': 0.5667694294779815}. Best is trial 103 with value: 0.8583071091313723.[0m
[32m[I 2022-04-13 11:43:54,221][0m Trial 107 finished with value: 0.8547474595641333 and parameters: {'splitter': 'random', 'min_samples_split': 0.27345245835532445, 'min_samples_leaf': 0.09378939293928301, 'min_weight_fraction_leaf': 0.055800897297519546, 'max_features': 0.60435354407155}. Best is trial 103 with value: 0.8583071091313723.[0m
[32m[I 2022-04-13 11:43:54,282][0m Trial 108 finished with value: 0.8574177483619669 and parameters: {'splitter': 'random', 'min_samples_split': 0.27971312508471585, 'min_samples_leaf': 0.09381569637268913, 'min_weight_fraction_leaf': 0.06463913684617166, 'max_features': 0.5624399266530098}. Best is trial 103 with value: 0.8583071091313723.[0m
[32m[I 2022-04-13 11:43:54,362][0m Trial 109 finished with value: 0.8528897659343441 and parameters: {'splitter': 'random', 'min_samples_split': 0.3055389311135503, 'min_samples_leaf': 0.09463733352086662, 'min_weight_fraction_leaf': 0.054042127741385004, 'max_features': 0.5701535257249031}. Best is trial 103 with value: 0.8583071091313723.[0m
[32m[I 2022-04-13 11:43:54,410][0m Trial 110 finished with value: 0.8187135328510733 and parameters: {'splitter': 'random', 'min_samples_split': 0.3067761191663169, 'min_samples_leaf': 0.09213988727779743, 'min_weight_fraction_leaf': 0.06386386305090797, 'max_features': 0.6267152632833789}. Best is trial 103 with value: 0.8583071091313723.[0m
[32m[I 2022-04-13 11:43:54,495][0m Trial 111 finished with value: 0.8537871744804019 and parameters: {'splitter': 'random', 'min_samples_split': 0.27821884938438574, 'min_samples_leaf': 0.09176738150638504, 'min_weight_fraction_leaf': 0.05265878198352107, 'max_features': 0.5599989243348276}. Best is trial 103 with value: 0.8583071091313723.[0m
[32m[I 2022-04-13 11:43:54,528][0m Trial 112 finished with value: 0.8536735077998788 and parameters: {'splitter': 'random', 'min_samples_split': 0.27438455596434186, 'min_samples_leaf': 0.08347003300220818, 'min_weight_fraction_leaf': 0.05105961830429118, 'max_features': 0.5779992459564373}. Best is trial 103 with value: 0.8583071091313723.[0m
[32m[I 2022-04-13 11:43:54,560][0m Trial 113 finished with value: 0.8537871744804019 and parameters: {'splitter': 'random', 'min_samples_split': 0.27759092260536067, 'min_samples_leaf': 0.08013889427762086, 'min_weight_fraction_leaf': 0.05184295093213281, 'max_features': 0.5146296082493189}. Best is trial 103 with value: 0.8583071091313723.[0m
[32m[I 2022-04-13 11:43:54,604][0m Trial 114 finished with value: 0.7999200547726107 and parameters: {'splitter': 'random', 'min_samples_split': 0.2792337441785413, 'min_samples_leaf': 0.059047860642230915, 'min_weight_fraction_leaf': 0.0484185240478301, 'max_features': 0.4531940790132105}. Best is trial 103 with value: 0.8583071091313723.[0m
[32m[I 2022-04-13 11:43:54,637][0m Trial 115 finished with value: 0.8515949699867061 and parameters: {'splitter': 'random', 'min_samples_split': 0.30467372281058225, 'min_samples_leaf': 0.0794832745018645, 'min_weight_fraction_leaf': 0.055400095731032904, 'max_features': 0.5111679156039313}. Best is trial 103 with value: 0.8583071091313723.[0m
[32m[I 2022-04-13 11:43:54,670][0m Trial 116 finished with value: 0.8547474595641333 and parameters: {'splitter': 'random', 'min_samples_split': 0.2707692482568643, 'min_samples_leaf': 0.09448238919456406, 'min_weight_fraction_leaf': 0.03812999970085124, 'max_features': 0.5623782568552572}. Best is trial 103 with value: 0.8583071091313723.[0m
[32m[I 2022-04-13 11:43:54,702][0m Trial 117 finished with value: 0.8536735077998788 and parameters: {'splitter': 'random', 'min_samples_split': 0.27312660514115417, 'min_samples_leaf': 0.0910886666907112, 'min_weight_fraction_leaf': 0.035765130181946145, 'max_features': 0.506268848154941}. Best is trial 103 with value: 0.8583071091313723.[0m
[32m[I 2022-04-13 11:43:54,735][0m Trial 118 finished with value: 0.678946779212211 and parameters: {'splitter': 'random', 'min_samples_split': 0.2716289841512723, 'min_samples_leaf': 0.08499756503685998, 'min_weight_fraction_leaf': 0.0351420418955051, 'max_features': 0.48585399236200066}. Best is trial 103 with value: 0.8583071091313723.[0m
[32m[I 2022-04-13 11:43:54,769][0m Trial 119 finished with value: 0.8136683385674204 and parameters: {'splitter': 'random', 'min_samples_split': 0.32832279890405147, 'min_samples_leaf': 0.06308144408131021, 'min_weight_fraction_leaf': 0.028512149890612334, 'max_features': 0.6727804555842931}. Best is trial 103 with value: 0.8583071091313723.[0m
[32m[I 2022-04-13 11:43:54,804][0m Trial 120 finished with value: 0.7999200547726107 and parameters: {'splitter': 'random', 'min_samples_split': 0.2669024435375994, 'min_samples_leaf': 0.046099796862304684, 'min_weight_fraction_leaf': 0.0655892505883193, 'max_features': 0.4500643509254201}. Best is trial 103 with value: 0.8583071091313723.[0m
[32m[I 2022-04-13 11:43:54,846][0m Trial 121 finished with value: 0.8528897659343441 and parameters: {'splitter': 'random', 'min_samples_split': 0.30338974460911194, 'min_samples_leaf': 0.09646613049592559, 'min_weight_fraction_leaf': 0.05322605087859159, 'max_features': 0.5603564658605436}. Best is trial 103 with value: 0.8583071091313723.[0m
[32m[I 2022-04-13 11:43:54,891][0m Trial 122 finished with value: 0.8507321463909226 and parameters: {'splitter': 'random', 'min_samples_split': 0.2566759711860034, 'min_samples_leaf': 0.09385130326238, 'min_weight_fraction_leaf': 0.046836949849274195, 'max_features': 0.5098840478110666}. Best is trial 103 with value: 0.8583071091313723.[0m
[32m[I 2022-04-13 11:43:54,935][0m Trial 123 finished with value: 0.8537871744804019 and parameters: {'splitter': 'random', 'min_samples_split': 0.281775544205048, 'min_samples_leaf': 0.07852457526514271, 'min_weight_fraction_leaf': 0.03555190081907507, 'max_features': 0.5906371578232047}. Best is trial 103 with value: 0.8583071091313723.[0m
[32m[I 2022-04-13 11:43:54,969][0m Trial 124 finished with value: 0.8537871744804019 and parameters: {'splitter': 'random', 'min_samples_split': 0.2797968536118135, 'min_samples_leaf': 0.07922402541794418, 'min_weight_fraction_leaf': 0.038354298961354075, 'max_features': 0.5943427423557317}. Best is trial 103 with value: 0.8583071091313723.[0m
[32m[I 2022-04-13 11:43:55,003][0m Trial 125 finished with value: 0.8537871744804019 and parameters: {'splitter': 'random', 'min_samples_split': 0.27777290941900845, 'min_samples_leaf': 0.08125613968786098, 'min_weight_fraction_leaf': 0.009113343973989291, 'max_features': 0.5915068051875193}. Best is trial 103 with value: 0.8583071091313723.[0m
