[32m[I 2022-04-13 11:44:27,916][0m Trial 630 finished with value: 0.8130158757335355 and parameters: {'splitter': 'random', 'min_samples_split': 0.28189855668151514, 'min_samples_leaf': 0.029282847928726992, 'min_weight_fraction_leaf': 0.021197736317073494, 'max_features': 0.48629477471319943}. Best is trial 156 with value: 0.860262530255716.[0m
[32m[I 2022-04-13 11:44:27,979][0m Trial 631 finished with value: 0.8511422756105386 and parameters: {'splitter': 'random', 'min_samples_split': 0.23382640417270628, 'min_samples_leaf': 0.015391344946050163, 'min_weight_fraction_leaf': 0.10137747270490226, 'max_features': 0.5667926866013017}. Best is trial 156 with value: 0.860262530255716.[0m
[32m[I 2022-04-13 11:44:28,043][0m Trial 632 finished with value: 0.8484399756279405 and parameters: {'splitter': 'random', 'min_samples_split': 0.24533480759579213, 'min_samples_leaf': 0.012011166707813587, 'min_weight_fraction_leaf': 0.08283037911700901, 'max_features': 0.5548047914008347}. Best is trial 156 with value: 0.860262530255716.[0m
[32m[I 2022-04-13 11:44:28,136][0m Trial 633 finished with value: 0.855608859465337 and parameters: {'splitter': 'random', 'min_samples_split': 0.26128425778563014, 'min_samples_leaf': 0.028002072588975642, 'min_weight_fraction_leaf': 0.04232501401612724, 'max_features': 0.5407290065045476}. Best is trial 156 with value: 0.860262530255716.[0m
[32m[I 2022-04-13 11:44:28,223][0m Trial 634 finished with value: 0.7932323371363277 and parameters: {'splitter': 'random', 'min_samples_split': 0.2542375951925548, 'min_samples_leaf': 0.06982438913721971, 'min_weight_fraction_leaf': 0.0558017249301394, 'max_features': 0.48482351606008156}. Best is trial 156 with value: 0.860262530255716.[0m
[32m[I 2022-04-13 11:44:28,330][0m Trial 635 finished with value: 0.8555617056756446 and parameters: {'splitter': 'random', 'min_samples_split': 0.2663672141928831, 'min_samples_leaf': 0.03196585026299874, 'min_weight_fraction_leaf': 0.003998997273097334, 'max_features': 0.5053144935500145}. Best is trial 156 with value: 0.860262530255716.[0m
[32m[I 2022-04-13 11:44:28,428][0m Trial 636 finished with value: 0.8495779719052834 and parameters: {'splitter': 'random', 'min_samples_split': 0.29035548259487404, 'min_samples_leaf': 0.02060793893514213, 'min_weight_fraction_leaf': 0.04915628719887179, 'max_features': 0.5381456001536525}. Best is trial 156 with value: 0.860262530255716.[0m
[32m[I 2022-04-13 11:44:28,519][0m Trial 637 finished with value: 0.8555617056756446 and parameters: {'splitter': 'random', 'min_samples_split': 0.2641440625470169, 'min_samples_leaf': 0.0012256326046113687, 'min_weight_fraction_leaf': 0.03111936492068007, 'max_features': 0.5178385018903477}. Best is trial 156 with value: 0.860262530255716.[0m
[32m[I 2022-04-13 11:44:28,610][0m Trial 638 finished with value: 0.8537871744804019 and parameters: {'splitter': 'random', 'min_samples_split': 0.2784377450150156, 'min_samples_leaf': 0.032958838444887645, 'min_weight_fraction_leaf': 0.06011332400548304, 'max_features': 0.6042661712061006}. Best is trial 156 with value: 0.860262530255716.[0m
[32m[I 2022-04-13 11:44:28,697][0m Trial 639 finished with value: 0.678946779212211 and parameters: {'splitter': 'random', 'min_samples_split': 0.2941539414668281, 'min_samples_leaf': 0.08230316709931129, 'min_weight_fraction_leaf': 0.000506239858193579, 'max_features': 0.48264932487008405}. Best is trial 156 with value: 0.860262530255716.[0m
[32m[I 2022-04-13 11:44:28,779][0m Trial 640 finished with value: 0.8440870485198803 and parameters: {'splitter': 'best', 'min_samples_split': 0.2428821745877567, 'min_samples_leaf': 0.012234561130601791, 'min_weight_fraction_leaf': 0.0863424548091193, 'max_features': 0.5627110333278516}. Best is trial 156 with value: 0.860262530255716.[0m
[32m[I 2022-04-13 11:44:28,834][0m Trial 641 finished with value: 0.6334936025301521 and parameters: {'splitter': 'random', 'min_samples_split': 0.2748302606265261, 'min_samples_leaf': 0.2996176480751346, 'min_weight_fraction_leaf': 0.044670876481062896, 'max_features': 0.5730287394724932}. Best is trial 156 with value: 0.860262530255716.[0m
[32m[I 2022-04-13 11:44:28,879][0m Trial 642 finished with value: 0.7932323371363277 and parameters: {'splitter': 'random', 'min_samples_split': 0.25805736935725526, 'min_samples_leaf': 0.016392002102349604, 'min_weight_fraction_leaf': 0.07728800439520135, 'max_features': 0.4867998291588073}. Best is trial 156 with value: 0.860262530255716.[0m
[32m[I 2022-04-13 11:44:28,924][0m Trial 643 finished with value: 0.8537871744804019 and parameters: {'splitter': 'random', 'min_samples_split': 0.28679217599492696, 'min_samples_leaf': 0.01866163096367641, 'min_weight_fraction_leaf': 0.014911205993052262, 'max_features': 0.5095659401293215}. Best is trial 156 with value: 0.860262530255716.[0m
[32m[I 2022-04-13 11:44:28,967][0m Trial 644 finished with value: 0.8555617056756446 and parameters: {'splitter': 'random', 'min_samples_split': 0.27585767040023107, 'min_samples_leaf': 0.03834469084629835, 'min_weight_fraction_leaf': 0.028869293742014315, 'max_features': 0.5139512626894716}. Best is trial 156 with value: 0.860262530255716.[0m
[32m[I 2022-04-13 11:44:29,013][0m Trial 645 finished with value: 0.855608859465337 and parameters: {'splitter': 'random', 'min_samples_split': 0.2512927307755507, 'min_samples_leaf': 0.04257952375400073, 'min_weight_fraction_leaf': 0.07234616962890353, 'max_features': 0.5986034092897884}. Best is trial 156 with value: 0.860262530255716.[0m
[32m[I 2022-04-13 11:44:29,059][0m Trial 646 finished with value: 0.7203943081692755 and parameters: {'splitter': 'random', 'min_samples_split': 0.2719645219891855, 'min_samples_leaf': 0.029929910462510978, 'min_weight_fraction_leaf': 0.2499537123792423, 'max_features': 0.5024906684172304}. Best is trial 156 with value: 0.860262530255716.[0m
[32m[I 2022-04-13 11:44:29,106][0m Trial 647 finished with value: 0.7999200547726107 and parameters: {'splitter': 'random', 'min_samples_split': 0.28488930965198483, 'min_samples_leaf': 0.045234057889316316, 'min_weight_fraction_leaf': 0.054227202023139784, 'max_features': 0.4658697141367846}. Best is trial 156 with value: 0.860262530255716.[0m
[32m[I 2022-04-13 11:44:29,160][0m Trial 648 finished with value: 0.860262530255716 and parameters: {'splitter': 'random', 'min_samples_split': 0.27237544437202815, 'min_samples_leaf': 0.010571693330017475, 'min_weight_fraction_leaf': 0.06291880909964684, 'max_features': 0.5794625945524547}. Best is trial 156 with value: 0.860262530255716.[0m
[32m[I 2022-04-13 11:44:29,204][0m Trial 649 finished with value: 0.7445764336842451 and parameters: {'splitter': 'random', 'min_samples_split': 0.31429757929198704, 'min_samples_leaf': 0.012569877627364855, 'min_weight_fraction_leaf': 0.1636422898660818, 'max_features': 0.5534593839420767}. Best is trial 156 with value: 0.860262530255716.[0m
[32m[I 2022-04-13 11:44:29,252][0m Trial 650 finished with value: 0.7999200547726107 and parameters: {'splitter': 'random', 'min_samples_split': 0.2722008714007105, 'min_samples_leaf': 0.04509819539606457, 'min_weight_fraction_leaf': 0.012801462428160507, 'max_features': 0.49271517647479207}. Best is trial 156 with value: 0.860262530255716.[0m
[32m[I 2022-04-13 11:44:29,296][0m Trial 651 finished with value: 0.8541689983710665 and parameters: {'splitter': 'random', 'min_samples_split': 0.24992021796760963, 'min_samples_leaf': 0.02242835844800009, 'min_weight_fraction_leaf': 0.07485575395199687, 'max_features': 0.5361118612716456}. Best is trial 156 with value: 0.860262530255716.[0m
[32m[I 2022-04-13 11:44:29,355][0m Trial 652 finished with value: 0.8495779719052834 and parameters: {'splitter': 'random', 'min_samples_split': 0.2990209494426125, 'min_samples_leaf': 0.057265710321612956, 'min_weight_fraction_leaf': 0.06305608477785986, 'max_features': 0.528563259026034}. Best is trial 156 with value: 0.860262530255716.[0m
[32m[I 2022-04-13 11:44:29,479][0m Trial 653 finished with value: 0.8537871744804019 and parameters: {'splitter': 'random', 'min_samples_split': 0.2799278158256605, 'min_samples_leaf': 0.0013401011917863817, 'min_weight_fraction_leaf': 0.023190437229620532, 'max_features': 0.583783702640594}. Best is trial 156 with value: 0.860262530255716.[0m
[32m[I 2022-04-13 11:44:29,572][0m Trial 654 finished with value: 0.8537871744804019 and parameters: {'splitter': 'random', 'min_samples_split': 0.2881119439081989, 'min_samples_leaf': 0.00867863100336111, 'min_weight_fraction_leaf': 0.08187810092780828, 'max_features': 0.6059343575168552}. Best is trial 156 with value: 0.860262530255716.[0m
[32m[I 2022-04-13 11:44:29,635][0m Trial 655 finished with value: 0.8541689983710665 and parameters: {'splitter': 'random', 'min_samples_split': 0.23235755748519046, 'min_samples_leaf': 0.022781351214462987, 'min_weight_fraction_leaf': 0.0695971084376433, 'max_features': 0.6087277327532438}. Best is trial 156 with value: 0.860262530255716.[0m
[32m[I 2022-04-13 11:44:29,766][0m Trial 656 finished with value: 0.8537871744804019 and parameters: {'splitter': 'random', 'min_samples_split': 0.282503992026357, 'min_samples_leaf': 0.04965002584137792, 'min_weight_fraction_leaf': 0.045403792545699775, 'max_features': 0.5464318703810879}. Best is trial 156 with value: 0.860262530255716.[0m
[32m[I 2022-04-13 11:44:29,920][0m Trial 657 finished with value: 0.860262530255716 and parameters: {'splitter': 'random', 'min_samples_split': 0.2649223077840155, 'min_samples_leaf': 0.031031731606392873, 'min_weight_fraction_leaf': 0.04225639450956617, 'max_features': 0.534079406977711}. Best is trial 156 with value: 0.860262530255716.[0m
[32m[I 2022-04-13 11:44:30,078][0m Trial 658 finished with value: 0.855608859465337 and parameters: {'splitter': 'random', 'min_samples_split': 0.25416947700260967, 'min_samples_leaf': 0.01684371638439335, 'min_weight_fraction_leaf': 0.03484578836679992, 'max_features': 0.546478677990104}. Best is trial 156 with value: 0.860262530255716.[0m
[32m[I 2022-04-13 11:44:30,216][0m Trial 659 finished with value: 0.82936093790528 and parameters: {'splitter': 'best', 'min_samples_split': 0.2664008764831439, 'min_samples_leaf': 0.024378909893118278, 'min_weight_fraction_leaf': 0.03145548583367496, 'max_features': 0.678541453620671}. Best is trial 156 with value: 0.860262530255716.[0m
[32m[I 2022-04-13 11:44:30,359][0m Trial 660 finished with value: 0.8495779719052834 and parameters: {'splitter': 'random', 'min_samples_split': 0.30234379358125824, 'min_samples_leaf': 0.04893613204960182, 'min_weight_fraction_leaf': 0.06377990256672017, 'max_features': 0.6097761230746804}. Best is trial 156 with value: 0.860262530255716.[0m
[32m[I 2022-04-13 11:44:30,475][0m Trial 661 finished with value: 0.8495779719052834 and parameters: {'splitter': 'random', 'min_samples_split': 0.2919873263995102, 'min_samples_leaf': 0.0011768795849745797, 'min_weight_fraction_leaf': 0.07363752028155038, 'max_features': 0.6144523903196483}. Best is trial 156 with value: 0.860262530255716.[0m
[32m[I 2022-04-13 11:44:30,563][0m Trial 662 finished with value: 0.8109417480001758 and parameters: {'splitter': 'random', 'min_samples_split': 0.27766117107551896, 'min_samples_leaf': 0.03945915521768331, 'min_weight_fraction_leaf': 0.06986448552228201, 'max_features': 0.6352792994690524}. Best is trial 156 with value: 0.860262530255716.[0m
[32m[I 2022-04-13 11:44:30,658][0m Trial 663 finished with value: 0.8451129056516414 and parameters: {'splitter': 'random', 'min_samples_split': 0.01154528684514633, 'min_samples_leaf': 0.0010148112410485164, 'min_weight_fraction_leaf': 0.10428653039366852, 'max_features': 0.5686677612669253}. Best is trial 156 with value: 0.860262530255716.[0m
[32m[I 2022-04-13 11:44:30,745][0m Trial 664 finished with value: 0.855608859465337 and parameters: {'splitter': 'random', 'min_samples_split': 0.2619740843109442, 'min_samples_leaf': 0.02983682539269064, 'min_weight_fraction_leaf': 0.055259395941413415, 'max_features': 0.5883394812782661}. Best is trial 156 with value: 0.860262530255716.[0m
[32m[I 2022-04-13 11:44:30,840][0m Trial 665 finished with value: 0.8537871744804019 and parameters: {'splitter': 'random', 'min_samples_split': 0.2876628710482324, 'min_samples_leaf': 0.014324850645442292, 'min_weight_fraction_leaf': 0.04037996354975215, 'max_features': 0.5048447473289188}. Best is trial 156 with value: 0.860262530255716.[0m
[32m[I 2022-04-13 11:44:30,934][0m Trial 666 finished with value: 0.7999200547726107 and parameters: {'splitter': 'random', 'min_samples_split': 0.2751147708835993, 'min_samples_leaf': 0.052437318964223566, 'min_weight_fraction_leaf': 0.024103843623434075, 'max_features': 0.4056480349447253}. Best is trial 156 with value: 0.860262530255716.[0m
[32m[I 2022-04-13 11:44:31,027][0m Trial 667 finished with value: 0.8484399756279405 and parameters: {'splitter': 'random', 'min_samples_split': 0.24172963235465864, 'min_samples_leaf': 0.012513679912975948, 'min_weight_fraction_leaf': 0.08556137695509512, 'max_features': 0.5593452720713731}. Best is trial 156 with value: 0.860262530255716.[0m
[32m[I 2022-04-13 11:44:31,114][0m Trial 668 finished with value: 0.860262530255716 and parameters: {'splitter': 'random', 'min_samples_split': 0.26715502975452443, 'min_samples_leaf': 0.0013295791347436717, 'min_weight_fraction_leaf': 0.07894172419148873, 'max_features': 0.5839464431775864}. Best is trial 156 with value: 0.860262530255716.[0m
[32m[I 2022-04-13 11:44:31,256][0m Trial 669 finished with value: 0.8073173815642989 and parameters: {'splitter': 'random', 'min_samples_split': 0.25649487135790433, 'min_samples_leaf': 0.00939917845500346, 'min_weight_fraction_leaf': 0.04200229244685861, 'max_features': 0.49918700091812224}. Best is trial 156 with value: 0.860262530255716.[0m
[32m[I 2022-04-13 11:44:31,369][0m Trial 670 finished with value: 0.7999200547726107 and parameters: {'splitter': 'random', 'min_samples_split': 0.2670375602432768, 'min_samples_leaf': 0.050492797290864574, 'min_weight_fraction_leaf': 0.03786467877687644, 'max_features': 0.4564725853637849}. Best is trial 156 with value: 0.860262530255716.[0m
[32m[I 2022-04-13 11:44:31,510][0m Trial 671 finished with value: 0.8432776267867528 and parameters: {'splitter': 'random', 'min_samples_split': 0.05947171053852693, 'min_samples_leaf': 0.0693013129074733, 'min_weight_fraction_leaf': 0.07094867330025129, 'max_features': 0.5245510938322786}. Best is trial 156 with value: 0.860262530255716.[0m
[32m[I 2022-04-13 11:44:31,645][0m Trial 672 finished with value: 0.8547474595641333 and parameters: {'splitter': 'random', 'min_samples_split': 0.27512095581043877, 'min_samples_leaf': 0.06232938822666713, 'min_weight_fraction_leaf': 0.09223946347399005, 'max_features': 0.5926154832023574}. Best is trial 156 with value: 0.860262530255716.[0m
[32m[I 2022-04-13 11:44:31,781][0m Trial 673 finished with value: 0.855608859465337 and parameters: {'splitter': 'random', 'min_samples_split': 0.261583574907938, 'min_samples_leaf': 0.027261204961195343, 'min_weight_fraction_leaf': 0.038604149224956655, 'max_features': 0.552008975752553}. Best is trial 156 with value: 0.860262530255716.[0m
[32m[I 2022-04-13 11:44:31,885][0m Trial 674 finished with value: 0.855608859465337 and parameters: {'splitter': 'random', 'min_samples_split': 0.2526341322848655, 'min_samples_leaf': 0.023152384757953264, 'min_weight_fraction_leaf': 0.04847149008593383, 'max_features': 0.5229648177826145}. Best is trial 156 with value: 0.860262530255716.[0m
[32m[I 2022-04-13 11:44:32,025][0m Trial 675 finished with value: 0.8495779719052834 and parameters: {'splitter': 'random', 'min_samples_split': 0.2923892603954137, 'min_samples_leaf': 0.03805722874879914, 'min_weight_fraction_leaf': 0.05981735417769443, 'max_features': 0.5614905245113146}. Best is trial 156 with value: 0.860262530255716.[0m
[32m[I 2022-04-13 11:44:32,133][0m Trial 676 finished with value: 0.855608859465337 and parameters: {'splitter': 'random', 'min_samples_split': 0.26200989645958067, 'min_samples_leaf': 0.03447184802900599, 'min_weight_fraction_leaf': 0.06284990793331159, 'max_features': 0.6010659619380166}. Best is trial 156 with value: 0.860262530255716.[0m
[32m[I 2022-04-13 11:44:32,272][0m Trial 677 finished with value: 0.8555617056756446 and parameters: {'splitter': 'random', 'min_samples_split': 0.273165557926555, 'min_samples_leaf': 0.03312895977051961, 'min_weight_fraction_leaf': 0.03132896047148437, 'max_features': 0.5068151583834041}. Best is trial 156 with value: 0.860262530255716.[0m
[32m[I 2022-04-13 11:44:32,411][0m Trial 678 finished with value: 0.8073173815642989 and parameters: {'splitter': 'random', 'min_samples_split': 0.24773498260547455, 'min_samples_leaf': 0.030230311521829208, 'min_weight_fraction_leaf': 0.04832257131340914, 'max_features': 0.47727722228862773}. Best is trial 156 with value: 0.860262530255716.[0m
[32m[I 2022-04-13 11:44:32,567][0m Trial 679 finished with value: 0.8271489096162169 and parameters: {'splitter': 'best', 'min_samples_split': 0.26964967616402225, 'min_samples_leaf': 0.08485241927807766, 'min_weight_fraction_leaf': 0.07790494226580051, 'max_features': 0.6408135973449606}. Best is trial 156 with value: 0.860262530255716.[0m
[32m[I 2022-04-13 11:44:32,708][0m Trial 680 finished with value: 0.6689741786112992 and parameters: {'splitter': 'random', 'min_samples_split': 0.25860727307108805, 'min_samples_leaf': 0.017616423560439114, 'min_weight_fraction_leaf': 0.09337506051783936, 'max_features': 0.4962249089116569}. Best is trial 156 with value: 0.860262530255716.[0m
[32m[I 2022-04-13 11:44:32,841][0m Trial 681 finished with value: 0.718315820651561 and parameters: {'splitter': 'random', 'min_samples_split': 0.285520257988722, 'min_samples_leaf': 0.2578337618397726, 'min_weight_fraction_leaf': 0.05430103820593189, 'max_features': 0.5413006568654971}. Best is trial 156 with value: 0.860262530255716.[0m
[32m[I 2022-04-13 11:44:32,914][0m Trial 682 finished with value: 0.8530273199001748 and parameters: {'splitter': 'random', 'min_samples_split': 0.32964949928154663, 'min_samples_leaf': 0.05941414404905157, 'min_weight_fraction_leaf': 0.021063730625286686, 'max_features': 0.5829588329470256}. Best is trial 156 with value: 0.860262530255716.[0m
[32m[I 2022-04-13 11:44:32,958][0m Trial 683 finished with value: 0.8190093423410939 and parameters: {'splitter': 'random', 'min_samples_split': 0.2698693004656205, 'min_samples_leaf': 0.0010108771612669732, 'min_weight_fraction_leaf': 0.08336507293621867, 'max_features': 0.6359507108555301}. Best is trial 156 with value: 0.860262530255716.[0m
[32m[I 2022-04-13 11:44:33,002][0m Trial 684 finished with value: 0.8541689983710665 and parameters: {'splitter': 'random', 'min_samples_split': 0.24161899472801418, 'min_samples_leaf': 0.02516795779721725, 'min_weight_fraction_leaf': 0.044900551261015866, 'max_features': 0.5134239288910339}. Best is trial 156 with value: 0.860262530255716.[0m
[32m[I 2022-04-13 11:44:33,046][0m Trial 685 finished with value: 0.8537871744804019 and parameters: {'splitter': 'random', 'min_samples_split': 0.27830804818304816, 'min_samples_leaf': 0.04282313517894273, 'min_weight_fraction_leaf': 0.06978559710069959, 'max_features': 0.5339131124929524}. Best is trial 156 with value: 0.860262530255716.[0m
[32m[I 2022-04-13 11:44:33,095][0m Trial 686 finished with value: 0.860262530255716 and parameters: {'splitter': 'random', 'min_samples_split': 0.26857550807593483, 'min_samples_leaf': 0.05457259895170436, 'min_weight_fraction_leaf': 0.05918164252919141, 'max_features': 0.5237173773266331}. Best is trial 156 with value: 0.860262530255716.[0m
[32m[I 2022-04-13 11:44:33,138][0m Trial 687 finished with value: 0.855608859465337 and parameters: {'splitter': 'random', 'min_samples_split': 0.2535731085686075, 'min_samples_leaf': 0.02147066875012776, 'min_weight_fraction_leaf': 0.05256706414376724, 'max_features': 0.5296522764095651}. Best is trial 156 with value: 0.860262530255716.[0m
[32m[I 2022-04-13 11:44:33,183][0m Trial 688 finished with value: 0.8537871744804019 and parameters: {'splitter': 'random', 'min_samples_split': 0.2830659328922754, 'min_samples_leaf': 0.011706213544025405, 'min_weight_fraction_leaf': 0.060371119855898395, 'max_features': 0.5662998342706742}. Best is trial 156 with value: 0.860262530255716.[0m
[32m[I 2022-04-13 11:44:33,227][0m Trial 689 finished with value: 0.8130158757335355 and parameters: {'splitter': 'random', 'min_samples_split': 0.2634158695725937, 'min_samples_leaf': 0.034170193203964555, 'min_weight_fraction_leaf': 0.03674842726516949, 'max_features': 0.47578817720177285}. Best is trial 156 with value: 0.860262530255716.[0m
[32m[I 2022-04-13 11:44:33,277][0m Trial 690 finished with value: 0.860262530255716 and parameters: {'splitter': 'random', 'min_samples_split': 0.2709852948151768, 'min_samples_leaf': 0.019604101344245454, 'min_weight_fraction_leaf': 0.04522003177641849, 'max_features': 0.5776441238122652}. Best is trial 156 with value: 0.860262530255716.[0m
[32m[I 2022-04-13 11:44:33,321][0m Trial 691 finished with value: 0.8541097042232983 and parameters: {'splitter': 'random', 'min_samples_split': 0.2569971962178128, 'min_samples_leaf': 0.020469451858836245, 'min_weight_fraction_leaf': 0.014316465305282487, 'max_features': 0.5496955088181493}. Best is trial 156 with value: 0.860262530255716.[0m
[32m[I 2022-04-13 11:44:33,366][0m Trial 692 finished with value: 0.8402508942790945 and parameters: {'splitter': 'random', 'min_samples_split': 0.19307855367595322, 'min_samples_leaf': 0.03109702818208916, 'min_weight_fraction_leaf': 0.0670827668264318, 'max_features': 0.5741469701626353}. Best is trial 156 with value: 0.860262530255716.[0m
