[32m[I 2022-04-16 18:18:55,118][0m Trial 372 finished with value: 0.7726352192006303 and parameters: {'n_hidden': 64, 'mixture_components': 3, 'use_sparse_layer': False, 'use_batchnorm': False, 'use_dropout': True, 'dropout': 0.7222624567130475, 'mlp_size_1': 0, 'mlp_size_2': 2, 'mlp_size_3': 0, 'kernel': 'LogLogistic', 'loss_name': 'NLLLoss'}. Best is trial 367 with value: 0.8756446640888914.[0m
[32m[I 2022-04-16 18:24:14,853][0m Trial 373 finished with value: 0.86298261476665 and parameters: {'n_hidden': 64, 'mixture_components': 3, 'use_sparse_layer': False, 'use_batchnorm': True, 'use_dropout': True, 'dropout': 0.7305399121601662, 'mlp_size_1': 0, 'mlp_size_2': 2, 'mlp_size_3': 0, 'kernel': 'Exponential', 'loss_name': 'NLLLoss'}. Best is trial 367 with value: 0.8756446640888914.[0m
[32m[I 2022-04-16 18:29:34,472][0m Trial 374 finished with value: 0.8663638146187159 and parameters: {'n_hidden': 64, 'mixture_components': 3, 'use_sparse_layer': False, 'use_batchnorm': True, 'use_dropout': True, 'dropout': 0.7554328858070177, 'mlp_size_1': 0, 'mlp_size_2': 2, 'mlp_size_3': 0, 'kernel': 'Exponential', 'loss_name': 'NLLLoss'}. Best is trial 367 with value: 0.8756446640888914.[0m
[32m[I 2022-04-16 18:35:11,166][0m Trial 375 finished with value: 0.8700795054207795 and parameters: {'n_hidden': 64, 'mixture_components': 3, 'use_sparse_layer': False, 'use_batchnorm': True, 'use_dropout': True, 'dropout': 0.790822273304953, 'mlp_size_1': 0, 'mlp_size_2': 2, 'mlp_size_3': 0, 'kernel': 'Exponential', 'loss_name': 'NLLLoss'}. Best is trial 367 with value: 0.8756446640888914.[0m
[32m[I 2022-04-16 18:38:40,119][0m Trial 376 finished with value: 0.8505378683390891 and parameters: {'n_hidden': 64, 'mixture_components': 3, 'use_sparse_layer': False, 'use_batchnorm': True, 'use_dropout': False, 'mlp_size_1': 0, 'mlp_size_2': 2, 'mlp_size_3': 0, 'kernel': 'Exponential', 'loss_name': 'NLLLoss'}. Best is trial 367 with value: 0.8756446640888914.[0m
[32m[I 2022-04-16 18:44:09,045][0m Trial 377 finished with value: 0.8584797252064698 and parameters: {'n_hidden': 64, 'mixture_components': 3, 'use_sparse_layer': False, 'use_batchnorm': True, 'use_dropout': True, 'dropout': 0.8135450136646288, 'mlp_size_1': 0, 'mlp_size_2': 2, 'mlp_size_3': 0, 'kernel': 'Exponential', 'loss_name': 'NLLLoss'}. Best is trial 367 with value: 0.8756446640888914.[0m
[32m[I 2022-04-16 18:49:29,605][0m Trial 378 finished with value: 0.7308769435359548 and parameters: {'n_hidden': 64, 'mixture_components': 3, 'use_sparse_layer': False, 'use_batchnorm': True, 'use_dropout': True, 'dropout': 0.7787998464332646, 'mlp_size_1': 0, 'mlp_size_2': 2, 'mlp_size_3': 0, 'kernel': 'Normal', 'loss_name': 'NLLLoss'}. Best is trial 367 with value: 0.8756446640888914.[0m
[32m[I 2022-04-16 18:55:46,894][0m Trial 379 finished with value: 0.8680943425864903 and parameters: {'n_hidden': 64, 'mixture_components': 3, 'use_sparse_layer': False, 'use_batchnorm': True, 'use_dropout': True, 'dropout': 0.8310160038875966, 'mlp_size_1': 0, 'mlp_size_2': 2, 'mlp_size_3': 0, 'kernel': 'Exponential', 'loss_name': 'CensoredNLLLoss'}. Best is trial 367 with value: 0.8756446640888914.[0m
[32m[I 2022-04-16 19:01:52,431][0m Trial 380 finished with value: 0.8580146449257479 and parameters: {'n_hidden': 64, 'mixture_components': 3, 'use_sparse_layer': False, 'use_batchnorm': True, 'use_dropout': True, 'dropout': 0.7899407778206703, 'mlp_size_1': 0, 'mlp_size_2': 2, 'mlp_size_3': 0, 'kernel': 'Exponential', 'loss_name': 'NLLLoss'}. Best is trial 367 with value: 0.8756446640888914.[0m
[32m[I 2022-04-16 19:07:29,327][0m Trial 381 finished with value: 0.8709289730497943 and parameters: {'n_hidden': 64, 'mixture_components': 4, 'use_sparse_layer': False, 'use_batchnorm': True, 'use_dropout': True, 'dropout': 0.8475477369090314, 'mlp_size_1': 0, 'mlp_size_2': 2, 'mlp_size_3': 0, 'kernel': 'Exponential', 'loss_name': 'NLLLoss'}. Best is trial 367 with value: 0.8756446640888914.[0m
[32m[I 2022-04-16 19:13:56,406][0m Trial 382 finished with value: 0.8615252616813356 and parameters: {'n_hidden': 64, 'mixture_components': 4, 'use_sparse_layer': False, 'use_batchnorm': True, 'use_dropout': True, 'dropout': 0.8386354527443624, 'mlp_size_1': 0, 'mlp_size_2': 2, 'mlp_size_3': 0, 'kernel': 'Exponential', 'loss_name': 'AlternativeNLLLoss'}. Best is trial 367 with value: 0.8756446640888914.[0m
[32m[I 2022-04-16 19:14:57,022][0m Trial 383 finished with value: -0.26424657948559843 and parameters: {'n_hidden': 64, 'mixture_components': 4, 'use_sparse_layer': False, 'use_batchnorm': True, 'use_dropout': True, 'dropout': 0.9412022263973394, 'mlp_size_1': 0, 'mlp_size_2': 2, 'mlp_size_3': 0, 'kernel': 'Weibull', 'loss_name': 'NLLLoss'}. Best is trial 367 with value: 0.8756446640888914.[0m
[32m[I 2022-04-16 19:20:43,504][0m Trial 384 finished with value: 0.8647235793787191 and parameters: {'n_hidden': 64, 'mixture_components': 4, 'use_sparse_layer': False, 'use_batchnorm': True, 'use_dropout': True, 'dropout': 0.8630622002649712, 'mlp_size_1': 0, 'mlp_size_2': 2, 'mlp_size_3': 0, 'kernel': 'Exponential', 'loss_name': 'NLLLoss'}. Best is trial 367 with value: 0.8756446640888914.[0m
[32m[I 2022-04-16 19:25:21,075][0m Trial 385 finished with value: 0.8529805011708618 and parameters: {'n_hidden': 64, 'mixture_components': 3, 'use_sparse_layer': False, 'use_batchnorm': True, 'use_dropout': True, 'dropout': 0.7019754463023903, 'mlp_size_1': 0, 'mlp_size_2': 2, 'mlp_size_3': 0, 'kernel': 'Gamma', 'loss_name': 'NLLLoss'}. Best is trial 367 with value: 0.8756446640888914.[0m
[32m[I 2022-04-16 19:30:16,778][0m Trial 386 finished with value: 0.8732614814669954 and parameters: {'n_hidden': 256, 'mixture_components': 4, 'use_sparse_layer': False, 'use_batchnorm': True, 'use_dropout': True, 'dropout': 0.8428310537360084, 'mlp_size_1': 0, 'mlp_size_2': 2, 'mlp_size_3': 0, 'kernel': 'Exponential', 'loss_name': 'NLLLoss'}. Best is trial 367 with value: 0.8756446640888914.[0m
[32m[I 2022-04-16 19:33:29,234][0m Trial 387 finished with value: 0.8533956365456531 and parameters: {'n_hidden': 1024, 'mixture_components': 4, 'use_sparse_layer': False, 'use_batchnorm': True, 'use_dropout': True, 'dropout': 0.809543831407677, 'mlp_size_1': 1, 'mlp_size_2': 3, 'mlp_size_3': 0, 'kernel': 'Exponential', 'loss_name': 'NLLLoss'}. Best is trial 367 with value: 0.8756446640888914.[0m
[32m[I 2022-04-16 19:39:11,888][0m Trial 388 finished with value: 0.8630119691409579 and parameters: {'n_hidden': 256, 'mixture_components': 5, 'use_sparse_layer': True, 'use_sparse_loss': False, 'use_batchnorm': True, 'use_dropout': True, 'dropout': 0.8809571862970964, 'mlp_size_1': 0, 'mlp_size_2': 2, 'mlp_size_3': 0, 'kernel': 'Exponential', 'loss_name': 'NLLLoss'}. Best is trial 367 with value: 0.8756446640888914.[0m
[32m[I 2022-04-16 19:45:45,573][0m Trial 389 finished with value: 0.7103787396341328 and parameters: {'n_hidden': 256, 'mixture_components': 4, 'use_sparse_layer': False, 'use_batchnorm': True, 'use_dropout': True, 'dropout': 0.8488854976331495, 'mlp_size_1': 3, 'mlp_size_2': 2, 'mlp_size_3': 0, 'kernel': 'LogNormal', 'loss_name': 'NLLLoss'}. Best is trial 367 with value: 0.8756446640888914.[0m
[32m[I 2022-04-16 19:50:21,517][0m Trial 390 finished with value: 0.859513447806416 and parameters: {'n_hidden': 256, 'mixture_components': 3, 'use_sparse_layer': False, 'use_batchnorm': True, 'use_dropout': True, 'dropout': 0.7981688139117548, 'mlp_size_1': 0, 'mlp_size_2': 2, 'mlp_size_3': 0, 'kernel': 'Exponential', 'loss_name': 'NLLLoss'}. Best is trial 367 with value: 0.8756446640888914.[0m
[32m[I 2022-04-16 19:56:01,476][0m Trial 391 finished with value: 0.8665842887777322 and parameters: {'n_hidden': 256, 'mixture_components': 3, 'use_sparse_layer': False, 'use_batchnorm': True, 'use_dropout': True, 'dropout': 0.8983221442327549, 'mlp_size_1': 0, 'mlp_size_2': 2, 'mlp_size_3': 0, 'kernel': 'Exponential', 'loss_name': 'NLLLoss'}. Best is trial 367 with value: 0.8756446640888914.[0m
[32m[I 2022-04-16 19:57:52,024][0m Trial 392 finished with value: 0.651985377040063 and parameters: {'n_hidden': 256, 'mixture_components': 4, 'use_sparse_layer': False, 'use_batchnorm': False, 'use_dropout': True, 'dropout': 0.8575796903449243, 'mlp_size_1': 0, 'mlp_size_2': 2, 'mlp_size_3': 0, 'kernel': 'Logistic', 'loss_name': 'NLLLoss'}. Best is trial 367 with value: 0.8756446640888914.[0m
[32m[I 2022-04-16 20:03:08,034][0m Trial 393 finished with value: 0.8640427704089525 and parameters: {'n_hidden': 256, 'mixture_components': 3, 'use_sparse_layer': False, 'use_batchnorm': True, 'use_dropout': True, 'dropout': 0.8729256221179491, 'mlp_size_1': 0, 'mlp_size_2': 2, 'mlp_size_3': 0, 'kernel': 'Exponential', 'loss_name': 'NLLLoss'}. Best is trial 367 with value: 0.8756446640888914.[0m
[32m[I 2022-04-16 20:08:26,541][0m Trial 394 finished with value: 0.8522109669733237 and parameters: {'n_hidden': 2048, 'mixture_components': 4, 'use_sparse_layer': False, 'use_batchnorm': True, 'use_dropout': True, 'dropout': 0.8288391709025895, 'mlp_size_1': 1, 'mlp_size_2': 2, 'mlp_size_3': 3, 'kernel': 'Exponential', 'loss_name': 'NLLLoss'}. Best is trial 367 with value: 0.8756446640888914.[0m
[32m[I 2022-04-16 20:12:52,066][0m Trial 395 finished with value: 0.8601300626311756 and parameters: {'n_hidden': 512, 'mixture_components': 5, 'use_sparse_layer': False, 'use_batchnorm': True, 'use_dropout': True, 'dropout': 0.7610809441057604, 'mlp_size_1': 0, 'mlp_size_2': 3, 'mlp_size_3': 0, 'kernel': 'Exponential', 'loss_name': 'NLLLoss'}. Best is trial 367 with value: 0.8756446640888914.[0m
[32m[I 2022-04-16 20:18:17,188][0m Trial 396 finished with value: 0.8613755325714838 and parameters: {'n_hidden': 64, 'mixture_components': 3, 'use_sparse_layer': False, 'use_batchnorm': True, 'use_dropout': True, 'dropout': 0.7839142598682354, 'mlp_size_1': 0, 'mlp_size_2': 2, 'mlp_size_3': 0, 'kernel': 'Exponential', 'loss_name': 'NLLLoss'}. Best is trial 367 with value: 0.8756446640888914.[0m
[32m[I 2022-04-16 20:21:35,022][0m Trial 397 finished with value: 0.8384209668140071 and parameters: {'n_hidden': 256, 'mixture_components': 3, 'use_sparse_layer': False, 'use_batchnorm': True, 'use_dropout': False, 'mlp_size_1': 0, 'mlp_size_2': 2, 'mlp_size_3': 0, 'kernel': 'Exponential', 'loss_name': 'NLLLoss'}. Best is trial 367 with value: 0.8756446640888914.[0m
[32m[I 2022-04-16 20:27:02,231][0m Trial 398 finished with value: 0.8649034003934792 and parameters: {'n_hidden': 64, 'mixture_components': 5, 'use_sparse_layer': False, 'use_batchnorm': True, 'use_dropout': True, 'dropout': 0.8244365669469952, 'mlp_size_1': 0, 'mlp_size_2': 2, 'mlp_size_3': 0, 'kernel': 'Exponential', 'loss_name': 'NLLLoss'}. Best is trial 367 with value: 0.8756446640888914.[0m
[32m[I 2022-04-16 20:32:10,628][0m Trial 399 finished with value: 0.8643108698757791 and parameters: {'n_hidden': 64, 'mixture_components': 3, 'use_sparse_layer': False, 'use_batchnorm': True, 'use_dropout': True, 'dropout': 0.7456940198646368, 'mlp_size_1': 0, 'mlp_size_2': 2, 'mlp_size_3': 0, 'kernel': 'Exponential', 'loss_name': 'NLLLoss'}. Best is trial 367 with value: 0.8756446640888914.[0m
[32m[I 2022-04-16 20:33:10,790][0m Trial 400 finished with value: -0.5 and parameters: {'n_hidden': 64, 'mixture_components': 6, 'use_sparse_layer': False, 'use_batchnorm': True, 'use_dropout': True, 'dropout': 0.8472937977015614, 'mlp_size_1': 0, 'mlp_size_2': 2, 'mlp_size_3': 0, 'kernel': 'Gumbel', 'loss_name': 'CensoredNLLLoss'}. Best is trial 367 with value: 0.8756446640888914.[0m
[32m[I 2022-04-16 20:38:52,714][0m Trial 401 finished with value: 0.8554991867066588 and parameters: {'n_hidden': 64, 'mixture_components': 3, 'use_sparse_layer': False, 'use_batchnorm': True, 'use_dropout': True, 'dropout': 0.7186460740645418, 'mlp_size_1': 0, 'mlp_size_2': 2, 'mlp_size_3': 0, 'kernel': 'Exponential', 'loss_name': 'NLLLoss'}. Best is trial 367 with value: 0.8756446640888914.[0m
[32m[I 2022-04-16 20:43:55,678][0m Trial 402 finished with value: 0.8633809384640821 and parameters: {'n_hidden': 64, 'mixture_components': 3, 'use_sparse_layer': False, 'use_batchnorm': True, 'use_dropout': True, 'dropout': 0.6897924143994374, 'mlp_size_1': 0, 'mlp_size_2': 2, 'mlp_size_3': 0, 'kernel': 'Exponential', 'loss_name': 'NLLLoss'}. Best is trial 367 with value: 0.8756446640888914.[0m
[32m[I 2022-04-16 20:49:41,072][0m Trial 403 finished with value: 0.8639459757102719 and parameters: {'n_hidden': 64, 'mixture_components': 4, 'use_sparse_layer': False, 'use_batchnorm': True, 'use_dropout': True, 'dropout': 0.7138670578694136, 'mlp_size_1': 0, 'mlp_size_2': 2, 'mlp_size_3': 0, 'kernel': 'Exponential', 'loss_name': 'NLLLoss'}. Best is trial 367 with value: 0.8756446640888914.[0m
[32m[I 2022-04-16 20:55:26,177][0m Trial 404 finished with value: 0.8666686002470705 and parameters: {'n_hidden': 64, 'mixture_components': 3, 'use_sparse_layer': False, 'use_batchnorm': True, 'use_dropout': True, 'dropout': 0.6810832197418589, 'mlp_size_1': 0, 'mlp_size_2': 2, 'mlp_size_3': 0, 'kernel': 'Exponential', 'loss_name': 'NLLLoss'}. Best is trial 367 with value: 0.8756446640888914.[0m
[32m[I 2022-04-16 21:02:14,713][0m Trial 405 finished with value: 0.8555323174833674 and parameters: {'n_hidden': 64, 'mixture_components': 3, 'use_sparse_layer': False, 'use_batchnorm': True, 'use_dropout': True, 'dropout': 0.8985381185509529, 'mlp_size_1': 0, 'mlp_size_2': 2, 'mlp_size_3': 0, 'kernel': 'Exponential', 'loss_name': 'AlternativeNLLLoss'}. Best is trial 367 with value: 0.8756446640888914.[0m
[32m[I 2022-04-16 21:05:59,611][0m Trial 406 finished with value: 0.8635746978526857 and parameters: {'n_hidden': 256, 'mixture_components': 6, 'use_sparse_layer': False, 'use_batchnorm': True, 'use_dropout': True, 'dropout': 0.7044187508089155, 'mlp_size_1': 0, 'mlp_size_2': 2, 'mlp_size_3': 0, 'kernel': 'Exponential', 'loss_name': 'NLLLoss'}. Best is trial 367 with value: 0.8756446640888914.[0m
[32m[I 2022-04-16 21:11:42,979][0m Trial 407 finished with value: 0.8718428509523282 and parameters: {'n_hidden': 64, 'mixture_components': 5, 'use_sparse_layer': False, 'use_batchnorm': True, 'use_dropout': True, 'dropout': 0.7442227008772819, 'mlp_size_1': 0, 'mlp_size_2': 2, 'mlp_size_3': 0, 'kernel': 'Exponential', 'loss_name': 'NLLLoss'}. Best is trial 367 with value: 0.8756446640888914.[0m
[32m[I 2022-04-16 21:16:34,647][0m Trial 408 finished with value: 0.8494961939847727 and parameters: {'n_hidden': 64, 'mixture_components': 6, 'use_sparse_layer': True, 'use_sparse_loss': False, 'use_batchnorm': True, 'use_dropout': True, 'dropout': 0.7402530710582754, 'mlp_size_1': 0, 'mlp_size_2': 2, 'mlp_size_3': 0, 'kernel': 'LogLogistic', 'loss_name': 'NLLLoss'}. Best is trial 367 with value: 0.8756446640888914.[0m
[32m[I 2022-04-16 21:22:23,679][0m Trial 409 finished with value: 0.8643238624296286 and parameters: {'n_hidden': 64, 'mixture_components': 5, 'use_sparse_layer': False, 'use_batchnorm': True, 'use_dropout': True, 'dropout': 0.7589380315916365, 'mlp_size_1': 0, 'mlp_size_2': 2, 'mlp_size_3': 0, 'kernel': 'Exponential', 'loss_name': 'NLLLoss'}. Best is trial 367 with value: 0.8756446640888914.[0m
[32m[I 2022-04-16 21:28:12,776][0m Trial 410 finished with value: 0.6256988326186368 and parameters: {'n_hidden': 32, 'mixture_components': 4, 'use_sparse_layer': False, 'use_batchnorm': True, 'use_dropout': True, 'dropout': 0.7950266009752026, 'mlp_size_1': 0, 'mlp_size_2': 2, 'mlp_size_3': 0, 'kernel': 'Normal', 'loss_name': 'NLLLoss'}. Best is trial 367 with value: 0.8756446640888914.[0m
[32m[I 2022-04-16 21:33:20,377][0m Trial 411 finished with value: 0.8710242380703874 and parameters: {'n_hidden': 64, 'mixture_components': 5, 'use_sparse_layer': False, 'use_batchnorm': True, 'use_dropout': True, 'dropout': 0.7359566462680807, 'mlp_size_1': 0, 'mlp_size_2': 2, 'mlp_size_3': 0, 'kernel': 'Exponential', 'loss_name': 'NLLLoss'}. Best is trial 367 with value: 0.8756446640888914.[0m
[32m[I 2022-04-16 21:39:06,016][0m Trial 412 finished with value: 0.8716259189516787 and parameters: {'n_hidden': 64, 'mixture_components': 5, 'use_sparse_layer': False, 'use_batchnorm': True, 'use_dropout': True, 'dropout': 0.7672837217200309, 'mlp_size_1': 0, 'mlp_size_2': 2, 'mlp_size_3': 0, 'kernel': 'Exponential', 'loss_name': 'NLLLoss'}. Best is trial 367 with value: 0.8756446640888914.[0m
[32m[I 2022-04-16 21:45:08,243][0m Trial 413 finished with value: 0.8550116998818185 and parameters: {'n_hidden': 2048, 'mixture_components': 5, 'use_sparse_layer': False, 'use_batchnorm': True, 'use_dropout': True, 'dropout': 0.7689020969253932, 'mlp_size_1': 1, 'mlp_size_2': 3, 'mlp_size_3': 0, 'kernel': 'Weibull', 'loss_name': 'NLLLoss'}. Best is trial 367 with value: 0.8756446640888914.[0m
[32m[I 2022-04-16 21:51:14,973][0m Trial 414 finished with value: 0.8684813298493511 and parameters: {'n_hidden': 64, 'mixture_components': 5, 'use_sparse_layer': False, 'use_batchnorm': True, 'use_dropout': True, 'dropout': 0.7427212768276155, 'mlp_size_1': 0, 'mlp_size_2': 2, 'mlp_size_3': 0, 'kernel': 'Exponential', 'loss_name': 'NLLLoss'}. Best is trial 367 with value: 0.8756446640888914.[0m
[32m[I 2022-04-16 21:52:56,761][0m Trial 415 finished with value: 0.6507627019666653 and parameters: {'n_hidden': 64, 'mixture_components': 5, 'use_sparse_layer': False, 'use_batchnorm': False, 'use_dropout': True, 'dropout': 0.7749487874738138, 'mlp_size_1': 0, 'mlp_size_2': 2, 'mlp_size_3': 0, 'kernel': 'Exponential', 'loss_name': 'NLLLoss'}. Best is trial 367 with value: 0.8756446640888914.[0m
[32m[I 2022-04-16 21:58:52,174][0m Trial 416 finished with value: 0.8734486196770572 and parameters: {'n_hidden': 64, 'mixture_components': 5, 'use_sparse_layer': False, 'use_batchnorm': True, 'use_dropout': True, 'dropout': 0.8114063745896968, 'mlp_size_1': 0, 'mlp_size_2': 2, 'mlp_size_3': 0, 'kernel': 'Exponential', 'loss_name': 'NLLLoss'}. Best is trial 367 with value: 0.8756446640888914.[0m
[32m[I 2022-04-16 22:04:45,244][0m Trial 417 finished with value: 0.8516417038144842 and parameters: {'n_hidden': 32, 'mixture_components': 5, 'use_sparse_layer': False, 'use_batchnorm': True, 'use_dropout': False, 'mlp_size_1': 0, 'mlp_size_2': 2, 'mlp_size_3': 0, 'kernel': 'Exponential', 'loss_name': 'NLLLoss'}. Best is trial 367 with value: 0.8756446640888914.[0m
[32m[I 2022-04-16 22:10:14,923][0m Trial 418 finished with value: 0.8665642241852938 and parameters: {'n_hidden': 64, 'mixture_components': 5, 'use_sparse_layer': False, 'use_batchnorm': True, 'use_dropout': True, 'dropout': 0.8270158401911061, 'mlp_size_1': 0, 'mlp_size_2': 2, 'mlp_size_3': 0, 'kernel': 'Gamma', 'loss_name': 'NLLLoss'}. Best is trial 367 with value: 0.8756446640888914.[0m
[32m[I 2022-04-16 22:15:47,234][0m Trial 419 finished with value: 0.8730500051879672 and parameters: {'n_hidden': 64, 'mixture_components': 5, 'use_sparse_layer': False, 'use_batchnorm': True, 'use_dropout': True, 'dropout': 0.7841388882568994, 'mlp_size_1': 0, 'mlp_size_2': 2, 'mlp_size_3': 0, 'kernel': 'Exponential', 'loss_name': 'NLLLoss'}. Best is trial 367 with value: 0.8756446640888914.[0m
[32m[I 2022-04-16 22:20:14,407][0m Trial 420 finished with value: 0.8637093450498092 and parameters: {'n_hidden': 512, 'mixture_components': 5, 'use_sparse_layer': False, 'use_batchnorm': True, 'use_dropout': True, 'dropout': 0.7937517757992077, 'mlp_size_1': 0, 'mlp_size_2': 3, 'mlp_size_3': 0, 'kernel': 'Exponential', 'loss_name': 'NLLLoss'}. Best is trial 367 with value: 0.8756446640888914.[0m
[32m[I 2022-04-16 22:26:24,973][0m Trial 421 finished with value: 0.7290073684297894 and parameters: {'n_hidden': 64, 'mixture_components': 5, 'use_sparse_layer': False, 'use_batchnorm': True, 'use_dropout': True, 'dropout': 0.806503865883722, 'mlp_size_1': 2, 'mlp_size_2': 1, 'mlp_size_3': 0, 'kernel': 'Exponential', 'loss_name': 'NLLLoss'}. Best is trial 367 with value: 0.8756446640888914.[0m
[32m[I 2022-04-16 22:30:36,813][0m Trial 422 finished with value: 0.8571062658294917 and parameters: {'n_hidden': 1024, 'mixture_components': 5, 'use_sparse_layer': False, 'use_batchnorm': True, 'use_dropout': True, 'dropout': 0.774192217786062, 'mlp_size_1': 0, 'mlp_size_2': 4, 'mlp_size_3': 0, 'kernel': 'Exponential', 'loss_name': 'NLLLoss'}. Best is trial 367 with value: 0.8756446640888914.[0m
[32m[I 2022-04-16 22:35:35,308][0m Trial 423 finished with value: 0.8067470741030777 and parameters: {'n_hidden': 64, 'mixture_components': 5, 'use_sparse_layer': False, 'use_batchnorm': True, 'use_dropout': True, 'dropout': 0.7593137374186524, 'mlp_size_1': 0, 'mlp_size_2': 2, 'mlp_size_3': 0, 'kernel': 'LogNormal', 'loss_name': 'CensoredNLLLoss'}. Best is trial 367 with value: 0.8756446640888914.[0m
[32m[I 2022-04-16 22:41:13,267][0m Trial 424 finished with value: 0.8612240245089495 and parameters: {'n_hidden': 64, 'mixture_components': 5, 'use_sparse_layer': False, 'use_batchnorm': True, 'use_dropout': True, 'dropout': 0.8185580707682893, 'mlp_size_1': 0, 'mlp_size_2': 2, 'mlp_size_3': 0, 'kernel': 'Exponential', 'loss_name': 'NLLLoss'}. Best is trial 367 with value: 0.8756446640888914.[0m
[32m[I 2022-04-16 22:46:12,745][0m Trial 425 finished with value: 0.7283528673763616 and parameters: {'n_hidden': 64, 'mixture_components': 5, 'use_sparse_layer': False, 'use_batchnorm': True, 'use_dropout': True, 'dropout': 0.7831288478328815, 'mlp_size_1': 0, 'mlp_size_2': 2, 'mlp_size_3': 0, 'kernel': 'Logistic', 'loss_name': 'NLLLoss'}. Best is trial 367 with value: 0.8756446640888914.[0m
