[32m[I 2022-04-13 12:34:10,657][0m Trial 82 finished with value: 0.65 and parameters: {'loss': 'coxph', 'learning_rate': 0.09461005485810595, 'n_estimators': 122, 'criterion': 'squared_error', 'min_samples_split': 4, 'min_samples_leaf': 4, 'min_weight_fraction_leaf': 0.05174628332198061, 'min_impurity_decrease': 0.6011882859488351, 'max_features': 0.2504930949782472, 'subsample': 0.2186259272876262, 'dropout_rate': 0.3944892996021726, 'ccp_alpha': 1.9289337745278403}. Best is trial 20 with value: 0.6628528132859424.[0m
[32m[I 2022-04-13 12:34:14,512][0m Trial 83 finished with value: 0.65 and parameters: {'loss': 'coxph', 'learning_rate': 0.003459483803984067, 'n_estimators': 133, 'criterion': 'squared_error', 'min_samples_split': 5, 'min_samples_leaf': 9, 'min_weight_fraction_leaf': 0.03326570085212109, 'min_impurity_decrease': 0.9424671947238303, 'max_features': 0.2622821420986756, 'subsample': 0.7529222056541965, 'dropout_rate': 0.42354277553187764, 'ccp_alpha': 2.0387138140373735}. Best is trial 20 with value: 0.6628528132859424.[0m
[32m[I 2022-04-13 12:34:21,164][0m Trial 84 finished with value: 0.65 and parameters: {'loss': 'coxph', 'learning_rate': 0.03365570907311992, 'n_estimators': 148, 'criterion': 'squared_error', 'min_samples_split': 3, 'min_samples_leaf': 9, 'min_weight_fraction_leaf': 0.0594052978598358, 'min_impurity_decrease': 0.957548790524625, 'max_features': 0.7173526852329933, 'subsample': 0.8989412588926687, 'dropout_rate': 0.3321960892961371, 'ccp_alpha': 2.339836203996701}. Best is trial 20 with value: 0.6628528132859424.[0m
[32m[I 2022-04-13 12:34:27,282][0m Trial 85 finished with value: 0.65 and parameters: {'loss': 'coxph', 'learning_rate': 0.05568192879633876, 'n_estimators': 149, 'criterion': 'squared_error', 'min_samples_split': 4, 'min_samples_leaf': 10, 'min_weight_fraction_leaf': 0.10586288821950188, 'min_impurity_decrease': 0.8886451408908436, 'max_features': 0.9724201761318142, 'subsample': 0.1311554112905458, 'dropout_rate': 0.4892256916147025, 'ccp_alpha': 2.0660966491464277}. Best is trial 20 with value: 0.6628528132859424.[0m
[32m[I 2022-04-13 12:34:37,479][0m Trial 86 finished with value: 0.65 and parameters: {'loss': 'coxph', 'learning_rate': 0.01936197714537669, 'n_estimators': 221, 'criterion': 'absolute_error', 'min_samples_split': 9, 'min_samples_leaf': 1, 'min_weight_fraction_leaf': 0.4012415199433433, 'min_impurity_decrease': 0.8825361711002836, 'max_features': 0.6218113340613244, 'subsample': 0.24725499107873183, 'dropout_rate': 0.47427563705021675, 'ccp_alpha': 3.052133548763965}. Best is trial 20 with value: 0.6628528132859424.[0m
[32m[I 2022-04-13 12:34:41,285][0m Trial 87 finished with value: 0.65 and parameters: {'loss': 'coxph', 'learning_rate': 0.0510557724539043, 'n_estimators': 138, 'criterion': 'squared_error', 'min_samples_split': 5, 'min_samples_leaf': 2, 'min_weight_fraction_leaf': 0.4203928466525003, 'min_impurity_decrease': 0.7973282210341878, 'max_features': 0.7211781144161892, 'subsample': 0.2105830461042663, 'dropout_rate': 0.556354908054564, 'ccp_alpha': 2.6048131181080243}. Best is trial 20 with value: 0.6628528132859424.[0m
[32m[I 2022-04-13 12:35:21,676][0m Trial 88 finished with value: 0.65 and parameters: {'loss': 'coxph', 'learning_rate': 0.07384446924711924, 'n_estimators': 431, 'criterion': 'absolute_error', 'min_samples_split': 9, 'min_samples_leaf': 5, 'min_weight_fraction_leaf': 0.49093836995379014, 'min_impurity_decrease': 0.9824888910782424, 'max_features': 0.9326305491255544, 'subsample': 0.2572702567740561, 'dropout_rate': 0.44568249853853437, 'ccp_alpha': 2.736853129885311}. Best is trial 20 with value: 0.6628528132859424.[0m
[32m[I 2022-04-13 12:36:18,860][0m Trial 89 finished with value: 0.65 and parameters: {'loss': 'coxph', 'learning_rate': 5.33318269619712e-05, 'n_estimators': 540, 'criterion': 'absolute_error', 'min_samples_split': 9, 'min_samples_leaf': 8, 'min_weight_fraction_leaf': 0.44125291116576804, 'min_impurity_decrease': 0.8552740020787036, 'max_features': 0.6022678037979481, 'subsample': 0.1930413836178806, 'dropout_rate': 0.6411987701006563, 'ccp_alpha': 3.862750290515003}. Best is trial 20 with value: 0.6628528132859424.[0m
[32m[I 2022-04-13 12:36:55,679][0m Trial 90 finished with value: 0.65 and parameters: {'loss': 'coxph', 'learning_rate': 2.0308714542399194e-05, 'n_estimators': 418, 'criterion': 'absolute_error', 'min_samples_split': 9, 'min_samples_leaf': 9, 'min_weight_fraction_leaf': 0.4603956260430589, 'min_impurity_decrease': 0.6471609007841282, 'max_features': 0.8858278147593796, 'subsample': 0.44068026558695006, 'dropout_rate': 0.5207397602422191, 'ccp_alpha': 3.482303086896289}. Best is trial 20 with value: 0.6628528132859424.[0m
[32m[I 2022-04-13 12:37:12,658][0m Trial 91 finished with value: 0.65 and parameters: {'loss': 'coxph', 'learning_rate': 3.067988365891472e-05, 'n_estimators': 370, 'criterion': 'absolute_error', 'min_samples_split': 10, 'min_samples_leaf': 9, 'min_weight_fraction_leaf': 0.4296891572674136, 'min_impurity_decrease': 0.7267654324894083, 'max_features': 0.903758998090015, 'subsample': 0.5356977984952848, 'dropout_rate': 0.7901537853320106, 'ccp_alpha': 4.473854020480731}. Best is trial 20 with value: 0.6628528132859424.[0m
[32m[I 2022-04-13 12:37:31,975][0m Trial 92 finished with value: 0.65 and parameters: {'loss': 'coxph', 'learning_rate': 5.965705974966023e-06, 'n_estimators': 366, 'criterion': 'absolute_error', 'min_samples_split': 10, 'min_samples_leaf': 10, 'min_weight_fraction_leaf': 0.39066731388322806, 'min_impurity_decrease': 0.6828947973286621, 'max_features': 0.5708053064547014, 'subsample': 0.4185107915846427, 'dropout_rate': 0.7161686550516321, 'ccp_alpha': 4.1166715868045705}. Best is trial 20 with value: 0.6628528132859424.[0m
[32m[I 2022-04-13 12:38:00,724][0m Trial 93 finished with value: 0.65 and parameters: {'loss': 'coxph', 'learning_rate': 3.0711407680551416e-06, 'n_estimators': 394, 'criterion': 'absolute_error', 'min_samples_split': 10, 'min_samples_leaf': 9, 'min_weight_fraction_leaf': 0.4830897392312325, 'min_impurity_decrease': 0.7387745644953636, 'max_features': 0.48233841326090543, 'subsample': 0.5177738491361693, 'dropout_rate': 0.6305422175171106, 'ccp_alpha': 4.118776024150236}. Best is trial 20 with value: 0.6628528132859424.[0m
[32m[I 2022-04-13 12:38:17,560][0m Trial 94 finished with value: 0.65 and parameters: {'loss': 'coxph', 'learning_rate': 1.8140112168397253e-06, 'n_estimators': 299, 'criterion': 'absolute_error', 'min_samples_split': 9, 'min_samples_leaf': 10, 'min_weight_fraction_leaf': 0.3678800001162947, 'min_impurity_decrease': 0.9675284041351199, 'max_features': 0.6275435210459707, 'subsample': 0.41030756663855317, 'dropout_rate': 0.6781459581521783, 'ccp_alpha': 3.860512570659825}. Best is trial 20 with value: 0.6628528132859424.[0m
[32m[I 2022-04-13 12:38:26,291][0m Trial 95 finished with value: -0.25 and parameters: {'loss': 'squared', 'learning_rate': 1.2370835732204502e-05, 'n_estimators': 279, 'criterion': 'absolute_error', 'min_samples_split': 9, 'min_samples_leaf': 10, 'min_weight_fraction_leaf': 0.46277309751823203, 'min_impurity_decrease': 0.6932602153320961, 'max_features': 0.6499610350945202, 'subsample': 0.2912683615551588, 'dropout_rate': 0.8740048002518841, 'ccp_alpha': 4.07586681201795}. Best is trial 20 with value: 0.6628528132859424.[0m
[32m[I 2022-04-13 12:38:42,007][0m Trial 96 finished with value: 0.65 and parameters: {'loss': 'coxph', 'learning_rate': 7.5697956631836604e-06, 'n_estimators': 329, 'criterion': 'absolute_error', 'min_samples_split': 8, 'min_samples_leaf': 5, 'min_weight_fraction_leaf': 0.011219459614961033, 'min_impurity_decrease': 0.17193374258670294, 'max_features': 0.5094325313077455, 'subsample': 0.32592442573902225, 'dropout_rate': 0.7195971119749398, 'ccp_alpha': 4.312973009521826}. Best is trial 20 with value: 0.6628528132859424.[0m
[32m[I 2022-04-13 12:38:58,888][0m Trial 97 finished with value: 0.65 and parameters: {'loss': 'coxph', 'learning_rate': 1.0976129893174683e-05, 'n_estimators': 324, 'criterion': 'absolute_error', 'min_samples_split': 8, 'min_samples_leaf': 5, 'min_weight_fraction_leaf': 0.02066207659515716, 'min_impurity_decrease': 0.3580351524395565, 'max_features': 0.8416456486926094, 'subsample': 0.8469944007143173, 'dropout_rate': 0.7493121422018537, 'ccp_alpha': 4.3573546134265255}. Best is trial 20 with value: 0.6628528132859424.[0m
[32m[I 2022-04-13 12:39:06,927][0m Trial 98 finished with value: 0.65 and parameters: {'loss': 'coxph', 'learning_rate': 4.601261992953507e-06, 'n_estimators': 275, 'criterion': 'absolute_error', 'min_samples_split': 10, 'min_samples_leaf': 6, 'min_weight_fraction_leaf': 0.4470861692110705, 'min_impurity_decrease': 0.626083724681098, 'max_features': 0.5907871081145921, 'subsample': 0.9651116434110898, 'dropout_rate': 0.8890571421453033, 'ccp_alpha': 3.31603103420425}. Best is trial 20 with value: 0.6628528132859424.[0m
[32m[I 2022-04-13 12:40:11,984][0m Trial 99 finished with value: 0.65 and parameters: {'loss': 'coxph', 'learning_rate': 1.495940869208393e-05, 'n_estimators': 694, 'criterion': 'absolute_error', 'min_samples_split': 8, 'min_samples_leaf': 6, 'min_weight_fraction_leaf': 0.0027778938179474147, 'min_impurity_decrease': 0.15139324230562926, 'max_features': 0.6698417307869637, 'subsample': 0.4531685720536732, 'dropout_rate': 0.8068668391443231, 'ccp_alpha': 1.2166628422510282}. Best is trial 20 with value: 0.6628528132859424.[0m
[32m[I 2022-04-13 12:41:02,989][0m Trial 100 finished with value: 0.65 and parameters: {'loss': 'coxph', 'learning_rate': 0.00010690928522107502, 'n_estimators': 355, 'criterion': 'friedman_mse', 'min_samples_split': 8, 'min_samples_leaf': 6, 'min_weight_fraction_leaf': 0.01866439175800934, 'min_impurity_decrease': 0.04467654731931931, 'max_features': 0.5483940497460418, 'subsample': 0.6136866229733109, 'dropout_rate': 0.04450557879556598, 'ccp_alpha': 4.675974114138378}. Best is trial 20 with value: 0.6628528132859424.[0m
[32m[I 2022-04-13 12:41:27,793][0m Trial 101 finished with value: 0.65 and parameters: {'loss': 'coxph', 'learning_rate': 8.790567521798813e-06, 'n_estimators': 520, 'criterion': 'friedman_mse', 'min_samples_split': 8, 'min_samples_leaf': 6, 'min_weight_fraction_leaf': 0.06833282469282079, 'min_impurity_decrease': 0.05838315560286417, 'max_features': 0.6589580067504562, 'subsample': 0.519196226952403, 'dropout_rate': 0.9107474040184841, 'ccp_alpha': 4.509499729265589}. Best is trial 20 with value: 0.6628528132859424.[0m
[32m[I 2022-04-13 12:42:11,160][0m Trial 102 finished with value: 0.65 and parameters: {'loss': 'coxph', 'learning_rate': 0.0003424218158941533, 'n_estimators': 625, 'criterion': 'friedman_mse', 'min_samples_split': 2, 'min_samples_leaf': 4, 'min_weight_fraction_leaf': 0.02420267378392122, 'min_impurity_decrease': 0.1253038189128118, 'max_features': 0.4743574992765271, 'subsample': 0.5756717757688666, 'dropout_rate': 0.8494468821878286, 'ccp_alpha': 4.190687177360456}. Best is trial 20 with value: 0.6628528132859424.[0m
[32m[I 2022-04-13 12:44:11,858][0m Trial 103 finished with value: 0.65 and parameters: {'loss': 'coxph', 'learning_rate': 0.0007508415912978692, 'n_estimators': 986, 'criterion': 'friedman_mse', 'min_samples_split': 2, 'min_samples_leaf': 6, 'min_weight_fraction_leaf': 0.07006755972217474, 'min_impurity_decrease': 0.19554500026544655, 'max_features': 0.4978843517831476, 'subsample': 0.35403922899463, 'dropout_rate': 0.774749295732631, 'ccp_alpha': 4.7304655752125875}. Best is trial 20 with value: 0.6628528132859424.[0m
[32m[I 2022-04-13 12:46:55,897][0m Trial 104 finished with value: 0.65 and parameters: {'loss': 'coxph', 'learning_rate': 0.00023122058098770442, 'n_estimators': 683, 'criterion': 'friedman_mse', 'min_samples_split': 2, 'min_samples_leaf': 5, 'min_weight_fraction_leaf': 0.16802179369349082, 'min_impurity_decrease': 0.1975400498867679, 'max_features': 0.4573168339464758, 'subsample': 0.47193174281051353, 'dropout_rate': 0.21075741980923834, 'ccp_alpha': 4.863303497766854}. Best is trial 20 with value: 0.6628528132859424.[0m
[32m[I 2022-04-13 12:50:46,528][0m Trial 105 finished with value: 0.65 and parameters: {'loss': 'coxph', 'learning_rate': 0.0003755319983585774, 'n_estimators': 786, 'criterion': 'friedman_mse', 'min_samples_split': 2, 'min_samples_leaf': 4, 'min_weight_fraction_leaf': 0.11992956509884276, 'min_impurity_decrease': 0.07672203477907194, 'max_features': 0.3252853020981721, 'subsample': 0.9953532284650777, 'dropout_rate': 0.1583689337891673, 'ccp_alpha': 4.59053870788712}. Best is trial 20 with value: 0.6628528132859424.[0m
[32m[I 2022-04-13 12:51:11,115][0m Trial 106 finished with value: 0.65 and parameters: {'loss': 'coxph', 'learning_rate': 0.0001606155042952308, 'n_estimators': 239, 'criterion': 'friedman_mse', 'min_samples_split': 2, 'min_samples_leaf': 7, 'min_weight_fraction_leaf': 0.21492247764747455, 'min_impurity_decrease': 0.11205324513088405, 'max_features': 0.5238762531300053, 'subsample': 0.4961525731273628, 'dropout_rate': 0.033240110546752986, 'ccp_alpha': 1.5176825832368666}. Best is trial 20 with value: 0.6628528132859424.[0m
[32m[I 2022-04-13 12:55:48,668][0m Trial 107 finished with value: 0.6524506958451449 and parameters: {'loss': 'coxph', 'learning_rate': 0.0004357094762142708, 'n_estimators': 875, 'criterion': 'friedman_mse', 'min_samples_split': 2, 'min_samples_leaf': 8, 'min_weight_fraction_leaf': 0.15157850485680466, 'min_impurity_decrease': 0.023859975483155438, 'max_features': 0.808154209037158, 'subsample': 0.601643943545699, 'dropout_rate': 0.10777213266458108, 'ccp_alpha': 0.44626274271298744}. Best is trial 20 with value: 0.6628528132859424.[0m
[32m[I 2022-04-13 13:00:16,727][0m Trial 108 finished with value: 0.6524506958451449 and parameters: {'loss': 'coxph', 'learning_rate': 0.0002170785773804944, 'n_estimators': 856, 'criterion': 'friedman_mse', 'min_samples_split': 2, 'min_samples_leaf': 8, 'min_weight_fraction_leaf': 0.23736307474902865, 'min_impurity_decrease': 0.02567327055541524, 'max_features': 0.7780746171877314, 'subsample': 0.6713327418979623, 'dropout_rate': 0.1082823277522723, 'ccp_alpha': 0.44714887362883915}. Best is trial 20 with value: 0.6628528132859424.[0m
[32m[I 2022-04-13 13:00:22,008][0m Trial 109 finished with value: -0.25 and parameters: {'loss': 'squared', 'learning_rate': 0.0018215183855757378, 'n_estimators': 107, 'criterion': 'squared_error', 'min_samples_split': 3, 'min_samples_leaf': 8, 'min_weight_fraction_leaf': 0.24574754190294434, 'min_impurity_decrease': 0.4132638559793386, 'max_features': 0.06297659707262715, 'subsample': 0.08138873019523249, 'dropout_rate': 0.11650418204925621, 'ccp_alpha': 0.38498171591610336}. Best is trial 20 with value: 0.6628528132859424.[0m
[32m[I 2022-04-13 13:05:05,993][0m Trial 110 finished with value: 0.8504643626235593 and parameters: {'loss': 'coxph', 'learning_rate': 0.0014590680847034717, 'n_estimators': 892, 'criterion': 'friedman_mse', 'min_samples_split': 2, 'min_samples_leaf': 8, 'min_weight_fraction_leaf': 0.22792975969453932, 'min_impurity_decrease': 0.0077095322375623256, 'max_features': 0.8066678202256526, 'subsample': 0.6782572796039315, 'dropout_rate': 0.07483762630668492, 'ccp_alpha': 0.03150790470559764}. Best is trial 110 with value: 0.8504643626235593.[0m
[32m[I 2022-04-13 13:10:07,522][0m Trial 111 finished with value: 0.8557856586392495 and parameters: {'loss': 'coxph', 'learning_rate': 0.0013546237971351243, 'n_estimators': 926, 'criterion': 'friedman_mse', 'min_samples_split': 2, 'min_samples_leaf': 8, 'min_weight_fraction_leaf': 0.23233529749454707, 'min_impurity_decrease': 0.13653814397598651, 'max_features': 0.7962891515495618, 'subsample': 0.7002727182415223, 'dropout_rate': 0.08205669273817427, 'ccp_alpha': 0.04301865842981667}. Best is trial 111 with value: 0.8557856586392495.[0m
[32m[I 2022-04-13 13:14:53,348][0m Trial 112 finished with value: 0.8517923507101072 and parameters: {'loss': 'coxph', 'learning_rate': 0.0015334607959795288, 'n_estimators': 864, 'criterion': 'friedman_mse', 'min_samples_split': 2, 'min_samples_leaf': 8, 'min_weight_fraction_leaf': 0.2536382228282864, 'min_impurity_decrease': 0.028955619701138014, 'max_features': 0.8084940204811085, 'subsample': 0.6845900539228535, 'dropout_rate': 0.08784061983013725, 'ccp_alpha': 0.02903815035183624}. Best is trial 111 with value: 0.8557856586392495.[0m
[32m[I 2022-04-13 13:19:28,713][0m Trial 113 finished with value: 0.8456705242037584 and parameters: {'loss': 'coxph', 'learning_rate': 0.0013015888912964748, 'n_estimators': 862, 'criterion': 'friedman_mse', 'min_samples_split': 2, 'min_samples_leaf': 8, 'min_weight_fraction_leaf': 0.23528743791355455, 'min_impurity_decrease': 0.028955632251332124, 'max_features': 0.7945392768068775, 'subsample': 0.7005020779726876, 'dropout_rate': 0.10557696626306676, 'ccp_alpha': 0.01733900054616687}. Best is trial 111 with value: 0.8557856586392495.[0m
[32m[I 2022-04-13 13:23:42,818][0m Trial 114 finished with value: 0.8530532317218287 and parameters: {'loss': 'coxph', 'learning_rate': 0.0016322729489069464, 'n_estimators': 840, 'criterion': 'friedman_mse', 'min_samples_split': 2, 'min_samples_leaf': 8, 'min_weight_fraction_leaf': 0.2552404906474178, 'min_impurity_decrease': 0.023041880869368273, 'max_features': 0.8096702287380719, 'subsample': 0.6924861981979616, 'dropout_rate': 0.09270072177476572, 'ccp_alpha': 0.05575235755379862}. Best is trial 111 with value: 0.8557856586392495.[0m
[32m[I 2022-04-13 13:28:15,559][0m Trial 115 finished with value: 0.859066160325809 and parameters: {'loss': 'coxph', 'learning_rate': 0.0026743060215133727, 'n_estimators': 859, 'criterion': 'friedman_mse', 'min_samples_split': 2, 'min_samples_leaf': 8, 'min_weight_fraction_leaf': 0.22881548758654033, 'min_impurity_decrease': 0.004035725764827476, 'max_features': 0.816551114513284, 'subsample': 0.6935634964334584, 'dropout_rate': 0.07909496123615362, 'ccp_alpha': 0.05161711289233972}. Best is trial 115 with value: 0.859066160325809.[0m
[32m[I 2022-04-13 13:32:58,386][0m Trial 116 finished with value: 0.8477791879363752 and parameters: {'loss': 'coxph', 'learning_rate': 0.0016327681237404143, 'n_estimators': 884, 'criterion': 'friedman_mse', 'min_samples_split': 2, 'min_samples_leaf': 8, 'min_weight_fraction_leaf': 0.2349467031100845, 'min_impurity_decrease': 0.02213463350283491, 'max_features': 0.8134476185363622, 'subsample': 0.6886863906095438, 'dropout_rate': 0.05759568095611267, 'ccp_alpha': 0.010064822036239051}. Best is trial 115 with value: 0.859066160325809.[0m
[32m[I 2022-04-13 13:36:27,229][0m Trial 117 finished with value: 0.8464433799241624 and parameters: {'loss': 'coxph', 'learning_rate': 0.0030178853790401253, 'n_estimators': 862, 'criterion': 'friedman_mse', 'min_samples_split': 2, 'min_samples_leaf': 8, 'min_weight_fraction_leaf': 0.22871382149361455, 'min_impurity_decrease': 0.020373159471080385, 'max_features': 0.8169170666690856, 'subsample': 0.6906449508936267, 'dropout_rate': 0.08691397725405774, 'ccp_alpha': 0.01889029758031583}. Best is trial 115 with value: 0.859066160325809.[0m
[32m[I 2022-04-13 13:39:50,938][0m Trial 118 finished with value: 0.8476242460881078 and parameters: {'loss': 'coxph', 'learning_rate': 0.0026319010543806335, 'n_estimators': 880, 'criterion': 'friedman_mse', 'min_samples_split': 2, 'min_samples_leaf': 8, 'min_weight_fraction_leaf': 0.22818904885888344, 'min_impurity_decrease': 0.012054169515145926, 'max_features': 0.7600492588614105, 'subsample': 0.6818701289781093, 'dropout_rate': 0.06664347664404718, 'ccp_alpha': 0.02451963229712692}. Best is trial 115 with value: 0.859066160325809.[0m
[32m[I 2022-04-13 13:42:59,165][0m Trial 119 finished with value: 0.8451683984204459 and parameters: {'loss': 'coxph', 'learning_rate': 0.002258678737101984, 'n_estimators': 858, 'criterion': 'friedman_mse', 'min_samples_split': 2, 'min_samples_leaf': 8, 'min_weight_fraction_leaf': 0.23205173379151975, 'min_impurity_decrease': 0.020719152471132343, 'max_features': 0.8186614279837515, 'subsample': 0.6991845766880813, 'dropout_rate': 0.07511312586692359, 'ccp_alpha': 0.012303845388313502}. Best is trial 115 with value: 0.859066160325809.[0m
[32m[I 2022-04-13 13:46:54,493][0m Trial 120 finished with value: 0.8423698415446882 and parameters: {'loss': 'coxph', 'learning_rate': 0.0027878818930691333, 'n_estimators': 933, 'criterion': 'friedman_mse', 'min_samples_split': 2, 'min_samples_leaf': 8, 'min_weight_fraction_leaf': 0.22698018393586356, 'min_impurity_decrease': 0.02169866443959109, 'max_features': 0.8159361489693165, 'subsample': 0.7216146500742431, 'dropout_rate': 0.01804100435825376, 'ccp_alpha': 0.006165453336536779}. Best is trial 115 with value: 0.859066160325809.[0m
[32m[I 2022-04-13 13:50:43,392][0m Trial 121 finished with value: 0.8447123871598391 and parameters: {'loss': 'coxph', 'learning_rate': 0.0025748403207304735, 'n_estimators': 940, 'criterion': 'friedman_mse', 'min_samples_split': 2, 'min_samples_leaf': 8, 'min_weight_fraction_leaf': 0.22458185935079383, 'min_impurity_decrease': 0.018414805122134795, 'max_features': 0.8197423205844999, 'subsample': 0.7005173712135144, 'dropout_rate': 0.07200023949581102, 'ccp_alpha': 0.0029346729237126196}. Best is trial 115 with value: 0.859066160325809.[0m
