[32m[I 2022-04-14 03:07:42,832][0m Trial 602 finished with value: 0.8716459768180853 and parameters: {'loss': 'coxph', 'learning_rate': 0.0026837042826059546, 'n_estimators': 293, 'criterion': 'friedman_mse', 'min_samples_split': 7, 'min_samples_leaf': 2, 'min_weight_fraction_leaf': 0.06067108427531702, 'min_impurity_decrease': 0.35564227801682624, 'max_features': 0.9846385255393657, 'subsample': 0.7613979636334064, 'dropout_rate': 0.45962893654135, 'ccp_alpha': 0.0055535732460327706}. Best is trial 566 with value: 0.8788372413254446.[0m
[32m[I 2022-04-14 03:07:45,543][0m Trial 603 finished with value: 0.65 and parameters: {'loss': 'coxph', 'learning_rate': 0.0019220605183368586, 'n_estimators': 146, 'criterion': 'squared_error', 'min_samples_split': 4, 'min_samples_leaf': 2, 'min_weight_fraction_leaf': 0.07672250149973217, 'min_impurity_decrease': 0.3357850427005414, 'max_features': 0.9562779141457226, 'subsample': 0.7839879251447065, 'dropout_rate': 0.42977855061306386, 'ccp_alpha': 0.29755643768695916}. Best is trial 566 with value: 0.8788372413254446.[0m
[32m[I 2022-04-14 03:07:48,992][0m Trial 604 finished with value: 0.8475223043483119 and parameters: {'loss': 'coxph', 'learning_rate': 0.0016374632708547727, 'n_estimators': 153, 'criterion': 'friedman_mse', 'min_samples_split': 3, 'min_samples_leaf': 2, 'min_weight_fraction_leaf': 0.03723811827400551, 'min_impurity_decrease': 0.3586595195664426, 'max_features': 0.9472170557017414, 'subsample': 0.8037066766403796, 'dropout_rate': 0.38732604148968613, 'ccp_alpha': 0.17954505276577828}. Best is trial 566 with value: 0.8788372413254446.[0m
[32m[I 2022-04-14 03:07:52,395][0m Trial 605 finished with value: 0.8410626713111791 and parameters: {'loss': 'coxph', 'learning_rate': 0.0022050742139674666, 'n_estimators': 169, 'criterion': 'friedman_mse', 'min_samples_split': 4, 'min_samples_leaf': 1, 'min_weight_fraction_leaf': 0.33989345588687914, 'min_impurity_decrease': 0.33873290420669666, 'max_features': 0.9466043983090607, 'subsample': 0.7627671949076696, 'dropout_rate': 0.4738230401130599, 'ccp_alpha': 0.0054916241966922515}. Best is trial 566 with value: 0.8788372413254446.[0m
[32m[I 2022-04-14 03:07:59,456][0m Trial 606 finished with value: 0.870659670974173 and parameters: {'loss': 'coxph', 'learning_rate': 0.0015350123145292111, 'n_estimators': 221, 'criterion': 'friedman_mse', 'min_samples_split': 3, 'min_samples_leaf': 2, 'min_weight_fraction_leaf': 0.04906194292624237, 'min_impurity_decrease': 0.3629238740214666, 'max_features': 0.9768787709844641, 'subsample': 0.7815347390140506, 'dropout_rate': 0.443227744454198, 'ccp_alpha': 0.09239097723969542}. Best is trial 566 with value: 0.8788372413254446.[0m
[32m[I 2022-04-14 03:08:02,758][0m Trial 607 finished with value: 0.8516569750435646 and parameters: {'loss': 'coxph', 'learning_rate': 0.002868373316798086, 'n_estimators': 184, 'criterion': 'friedman_mse', 'min_samples_split': 4, 'min_samples_leaf': 2, 'min_weight_fraction_leaf': 0.03694441216176602, 'min_impurity_decrease': 0.32272374067068044, 'max_features': 0.9279891620922809, 'subsample': 0.7350745675331856, 'dropout_rate': 0.7606772273070933, 'ccp_alpha': 0.17285787959076063}. Best is trial 566 with value: 0.8788372413254446.[0m
[32m[I 2022-04-14 03:08:07,873][0m Trial 608 finished with value: 0.872923385212078 and parameters: {'loss': 'coxph', 'learning_rate': 0.003101768380707607, 'n_estimators': 179, 'criterion': 'friedman_mse', 'min_samples_split': 3, 'min_samples_leaf': 2, 'min_weight_fraction_leaf': 0.05196995021372581, 'min_impurity_decrease': 0.37851761916413806, 'max_features': 0.9432486873982414, 'subsample': 0.8041842096251388, 'dropout_rate': 0.4095949228319472, 'ccp_alpha': 0.08486270164960578}. Best is trial 566 with value: 0.8788372413254446.[0m
[32m[I 2022-04-14 03:08:10,394][0m Trial 609 finished with value: 0.8764663093583914 and parameters: {'loss': 'coxph', 'learning_rate': 0.0020164029504600527, 'n_estimators': 142, 'criterion': 'friedman_mse', 'min_samples_split': 4, 'min_samples_leaf': 1, 'min_weight_fraction_leaf': 0.06402659676709377, 'min_impurity_decrease': 0.38863130698410236, 'max_features': 0.9115813266042422, 'subsample': 0.7067579601629416, 'dropout_rate': 0.4641128819211867, 'ccp_alpha': 0.0018359582124102853}. Best is trial 566 with value: 0.8788372413254446.[0m
[32m[I 2022-04-14 03:08:12,458][0m Trial 610 finished with value: 0.660872981146427 and parameters: {'loss': 'coxph', 'learning_rate': 0.0023072008824747375, 'n_estimators': 163, 'criterion': 'friedman_mse', 'min_samples_split': 4, 'min_samples_leaf': 2, 'min_weight_fraction_leaf': 0.07273496935290123, 'min_impurity_decrease': 0.3578717255738553, 'max_features': 0.9346352675061887, 'subsample': 0.6942235922870159, 'dropout_rate': 0.7031107868753452, 'ccp_alpha': 0.35191872219136217}. Best is trial 566 with value: 0.8788372413254446.[0m
[32m[I 2022-04-14 03:08:14,292][0m Trial 611 finished with value: 0.8737862243836702 and parameters: {'loss': 'coxph', 'learning_rate': 0.0019858828907820363, 'n_estimators': 172, 'criterion': 'friedman_mse', 'min_samples_split': 4, 'min_samples_leaf': 2, 'min_weight_fraction_leaf': 0.07865367428257375, 'min_impurity_decrease': 0.3918134369432158, 'max_features': 0.993606376346579, 'subsample': 0.7115266260592346, 'dropout_rate': 0.8302200939581028, 'ccp_alpha': 0.0011924398527777772}. Best is trial 566 with value: 0.8788372413254446.[0m
[32m[I 2022-04-14 03:08:18,091][0m Trial 612 finished with value: 0.8399925401419214 and parameters: {'loss': 'coxph', 'learning_rate': 0.0032266999343434806, 'n_estimators': 161, 'criterion': 'friedman_mse', 'min_samples_split': 4, 'min_samples_leaf': 1, 'min_weight_fraction_leaf': 0.08842228901382411, 'min_impurity_decrease': 0.37619750246160977, 'max_features': 0.9109270787028003, 'subsample': 0.7104307258957532, 'dropout_rate': 0.4243494374745076, 'ccp_alpha': 0.24279402986593687}. Best is trial 566 with value: 0.8788372413254446.[0m
[32m[I 2022-04-14 03:08:21,938][0m Trial 613 finished with value: 0.8699504324450059 and parameters: {'loss': 'coxph', 'learning_rate': 0.002394206249725735, 'n_estimators': 180, 'criterion': 'friedman_mse', 'min_samples_split': 4, 'min_samples_leaf': 1, 'min_weight_fraction_leaf': 0.06328819897596569, 'min_impurity_decrease': 0.3438366595149213, 'max_features': 0.9909170898928187, 'subsample': 0.6984537053520287, 'dropout_rate': 0.4874257510089538, 'ccp_alpha': 0.09532950974817479}. Best is trial 566 with value: 0.8788372413254446.[0m
[32m[I 2022-04-14 03:08:26,594][0m Trial 614 finished with value: 0.8567549828778402 and parameters: {'loss': 'coxph', 'learning_rate': 0.0019112153248846242, 'n_estimators': 199, 'criterion': 'friedman_mse', 'min_samples_split': 4, 'min_samples_leaf': 2, 'min_weight_fraction_leaf': 0.0663717396934879, 'min_impurity_decrease': 0.3871849828848359, 'max_features': 0.9076895145207343, 'subsample': 0.720730671076183, 'dropout_rate': 0.45008373863961976, 'ccp_alpha': 0.1691095086256268}. Best is trial 566 with value: 0.8788372413254446.[0m
[32m[I 2022-04-14 03:08:29,857][0m Trial 615 finished with value: 0.8716929650931817 and parameters: {'loss': 'coxph', 'learning_rate': 0.0017038994933057127, 'n_estimators': 144, 'criterion': 'friedman_mse', 'min_samples_split': 4, 'min_samples_leaf': 1, 'min_weight_fraction_leaf': 0.0808623006698983, 'min_impurity_decrease': 0.5774790113419842, 'max_features': 0.9529918699511712, 'subsample': 0.7405296079941136, 'dropout_rate': 0.46793346806964964, 'ccp_alpha': 0.005310161146319543}. Best is trial 566 with value: 0.8788372413254446.[0m
[32m[I 2022-04-14 03:08:33,113][0m Trial 616 finished with value: 0.869743939677809 and parameters: {'loss': 'coxph', 'learning_rate': 0.0031986137200800246, 'n_estimators': 160, 'criterion': 'friedman_mse', 'min_samples_split': 5, 'min_samples_leaf': 1, 'min_weight_fraction_leaf': 0.05725676860585949, 'min_impurity_decrease': 0.5520957379556147, 'max_features': 0.9218423096542444, 'subsample': 0.7229583944520487, 'dropout_rate': 0.39641686066763215, 'ccp_alpha': 0.09157569745312998}. Best is trial 566 with value: 0.8788372413254446.[0m
[32m[I 2022-04-14 03:08:38,142][0m Trial 617 finished with value: 0.8770854922946398 and parameters: {'loss': 'coxph', 'learning_rate': 0.0025254122691693343, 'n_estimators': 191, 'criterion': 'friedman_mse', 'min_samples_split': 4, 'min_samples_leaf': 1, 'min_weight_fraction_leaf': 0.03475263392875254, 'min_impurity_decrease': 0.35807776571159783, 'max_features': 0.9947434647254717, 'subsample': 0.7655925045568862, 'dropout_rate': 0.4375322714252056, 'ccp_alpha': 0.0018734691492501459}. Best is trial 566 with value: 0.8788372413254446.[0m
[32m[I 2022-04-14 03:08:44,880][0m Trial 618 finished with value: -0.3676328936528449 and parameters: {'loss': 'squared', 'learning_rate': 0.0031092530933455324, 'n_estimators': 198, 'criterion': 'friedman_mse', 'min_samples_split': 4, 'min_samples_leaf': 1, 'min_weight_fraction_leaf': 0.041286589004848745, 'min_impurity_decrease': 0.32551852374005685, 'max_features': 0.9577587913905778, 'subsample': 0.7517973911552812, 'dropout_rate': 0.4224723799849482, 'ccp_alpha': 0.23623260926506529}. Best is trial 566 with value: 0.8788372413254446.[0m
[32m[I 2022-04-14 03:08:50,100][0m Trial 619 finished with value: 0.8791855251836523 and parameters: {'loss': 'coxph', 'learning_rate': 0.0025288239021494284, 'n_estimators': 138, 'criterion': 'friedman_mse', 'min_samples_split': 4, 'min_samples_leaf': 1, 'min_weight_fraction_leaf': 0.04720917845922775, 'min_impurity_decrease': 0.3598196840090379, 'max_features': 0.9931459189253459, 'subsample': 0.7598216487773936, 'dropout_rate': 0.3553812925950509, 'ccp_alpha': 0.002668200042085074}. Best is trial 619 with value: 0.8791855251836523.[0m
[32m[I 2022-04-14 03:08:55,537][0m Trial 620 finished with value: 0.8520503394133725 and parameters: {'loss': 'coxph', 'learning_rate': 0.0027322563373901572, 'n_estimators': 181, 'criterion': 'friedman_mse', 'min_samples_split': 4, 'min_samples_leaf': 1, 'min_weight_fraction_leaf': 0.04444239888119081, 'min_impurity_decrease': 0.3561462008530318, 'max_features': 0.9999223776684095, 'subsample': 0.7667921113797715, 'dropout_rate': 0.3355130904153072, 'ccp_alpha': 0.15922716860348282}. Best is trial 619 with value: 0.8791855251836523.[0m
[32m[I 2022-04-14 03:09:00,097][0m Trial 621 finished with value: 0.65 and parameters: {'loss': 'coxph', 'learning_rate': 0.0025652412429083104, 'n_estimators': 153, 'criterion': 'absolute_error', 'min_samples_split': 4, 'min_samples_leaf': 1, 'min_weight_fraction_leaf': 0.031975644126053734, 'min_impurity_decrease': 0.3301543320663723, 'max_features': 0.9823587282111416, 'subsample': 0.758288664676183, 'dropout_rate': 0.36142446416762686, 'ccp_alpha': 0.007374753581856443}. Best is trial 619 with value: 0.8791855251836523.[0m
[32m[I 2022-04-14 03:09:05,408][0m Trial 622 finished with value: 0.871925529094236 and parameters: {'loss': 'coxph', 'learning_rate': 0.0038437335597028147, 'n_estimators': 188, 'criterion': 'friedman_mse', 'min_samples_split': 4, 'min_samples_leaf': 1, 'min_weight_fraction_leaf': 0.05349027153582091, 'min_impurity_decrease': 0.34917563540232693, 'max_features': 0.9718759231893127, 'subsample': 0.7728250221361573, 'dropout_rate': 0.3754004171243705, 'ccp_alpha': 0.09943899177147393}. Best is trial 619 with value: 0.8791855251836523.[0m
[32m[I 2022-04-14 03:09:07,860][0m Trial 623 finished with value: 0.8671599006799099 and parameters: {'loss': 'coxph', 'learning_rate': 0.0039701047106283265, 'n_estimators': 128, 'criterion': 'friedman_mse', 'min_samples_split': 4, 'min_samples_leaf': 1, 'min_weight_fraction_leaf': 0.035797994378946735, 'min_impurity_decrease': 0.36478438670563146, 'max_features': 0.9786649181443772, 'subsample': 0.7494505743894139, 'dropout_rate': 0.3565124815258544, 'ccp_alpha': 0.09835866491542743}. Best is trial 619 with value: 0.8791855251836523.[0m
[32m[I 2022-04-14 03:09:11,890][0m Trial 624 finished with value: 0.8767322108373262 and parameters: {'loss': 'coxph', 'learning_rate': 0.0023392135818659267, 'n_estimators': 141, 'criterion': 'friedman_mse', 'min_samples_split': 4, 'min_samples_leaf': 1, 'min_weight_fraction_leaf': 0.043392233290359364, 'min_impurity_decrease': 0.320782381392301, 'max_features': 0.9937053868836998, 'subsample': 0.7718273832416747, 'dropout_rate': 0.3759639398552314, 'ccp_alpha': 0.0015023303103077782}. Best is trial 619 with value: 0.8791855251836523.[0m
[32m[I 2022-04-14 03:09:14,668][0m Trial 625 finished with value: 0.8329452670166226 and parameters: {'loss': 'coxph', 'learning_rate': 0.0023615863489848416, 'n_estimators': 138, 'criterion': 'friedman_mse', 'min_samples_split': 4, 'min_samples_leaf': 1, 'min_weight_fraction_leaf': 0.4092388310110928, 'min_impurity_decrease': 0.3252935566564512, 'max_features': 0.9851417578182909, 'subsample': 0.7425220447377273, 'dropout_rate': 0.3530467718569946, 'ccp_alpha': 0.1744801665164643}. Best is trial 619 with value: 0.8791855251836523.[0m
[32m[I 2022-04-14 03:09:20,213][0m Trial 626 finished with value: 0.8761300859805369 and parameters: {'loss': 'coxph', 'learning_rate': 0.0032948450822898765, 'n_estimators': 168, 'criterion': 'friedman_mse', 'min_samples_split': 4, 'min_samples_leaf': 1, 'min_weight_fraction_leaf': 0.0475514897655548, 'min_impurity_decrease': 0.3042984188565249, 'max_features': 0.984044608988419, 'subsample': 0.7645695135401155, 'dropout_rate': 0.34146512102265636, 'ccp_alpha': 0.005132864653504385}. Best is trial 619 with value: 0.8791855251836523.[0m
[32m[I 2022-04-14 03:09:22,593][0m Trial 627 finished with value: 0.8808013426064705 and parameters: {'loss': 'coxph', 'learning_rate': 0.004645967017840466, 'n_estimators': 134, 'criterion': 'friedman_mse', 'min_samples_split': 4, 'min_samples_leaf': 1, 'min_weight_fraction_leaf': 0.05159598866050061, 'min_impurity_decrease': 0.3211246858128828, 'max_features': 0.9800160158982418, 'subsample': 0.7618208024854627, 'dropout_rate': 0.36976872325477317, 'ccp_alpha': 0.002347135190183855}. Best is trial 627 with value: 0.8808013426064705.[0m
[32m[I 2022-04-14 03:09:25,094][0m Trial 628 finished with value: 0.8250183531916434 and parameters: {'loss': 'coxph', 'learning_rate': 0.005743448717176057, 'n_estimators': 137, 'criterion': 'friedman_mse', 'min_samples_split': 6, 'min_samples_leaf': 1, 'min_weight_fraction_leaf': 0.05586187835619302, 'min_impurity_decrease': 0.3145269187375047, 'max_features': 0.9978744792295089, 'subsample': 0.7233694112665048, 'dropout_rate': 0.3445722555863035, 'ccp_alpha': 0.2557749832749344}. Best is trial 627 with value: 0.8808013426064705.[0m
[32m[I 2022-04-14 03:09:28,292][0m Trial 629 finished with value: 0.6576302970240425 and parameters: {'loss': 'coxph', 'learning_rate': 0.0027663728730953543, 'n_estimators': 142, 'criterion': 'squared_error', 'min_samples_split': 4, 'min_samples_leaf': 1, 'min_weight_fraction_leaf': 0.061868643552216954, 'min_impurity_decrease': 0.3163599815321666, 'max_features': 0.9916574054554119, 'subsample': 0.7527611038832404, 'dropout_rate': 0.32046272754548444, 'ccp_alpha': 0.0980293649395194}. Best is trial 627 with value: 0.8808013426064705.[0m
[32m[I 2022-04-14 03:09:31,052][0m Trial 630 finished with value: 0.8585003712413377 and parameters: {'loss': 'coxph', 'learning_rate': 0.0047092711761509524, 'n_estimators': 135, 'criterion': 'friedman_mse', 'min_samples_split': 5, 'min_samples_leaf': 1, 'min_weight_fraction_leaf': 0.05101659365238679, 'min_impurity_decrease': 0.2871018083136539, 'max_features': 0.9989693963026058, 'subsample': 0.7033997992687355, 'dropout_rate': 0.34550388453549385, 'ccp_alpha': 0.15706396335985928}. Best is trial 627 with value: 0.8808013426064705.[0m
[32m[I 2022-04-14 03:09:35,074][0m Trial 631 finished with value: 0.6524506958451449 and parameters: {'loss': 'coxph', 'learning_rate': 0.0069584263382795695, 'n_estimators': 147, 'criterion': 'friedman_mse', 'min_samples_split': 4, 'min_samples_leaf': 1, 'min_weight_fraction_leaf': 0.04523915056291509, 'min_impurity_decrease': 0.30396808577064816, 'max_features': 0.9923563252996048, 'subsample': 0.733328679717561, 'dropout_rate': 0.37534782670854105, 'ccp_alpha': 0.35303211148841296}. Best is trial 627 with value: 0.8808013426064705.[0m
[32m[I 2022-04-14 03:09:37,762][0m Trial 632 finished with value: 0.8738379434016451 and parameters: {'loss': 'coxph', 'learning_rate': 0.00378650630762162, 'n_estimators': 129, 'criterion': 'friedman_mse', 'min_samples_split': 4, 'min_samples_leaf': 1, 'min_weight_fraction_leaf': 0.05665388386039759, 'min_impurity_decrease': 0.33168114317477937, 'max_features': 0.9798568019064899, 'subsample': 0.7635002301443061, 'dropout_rate': 0.36277432181437647, 'ccp_alpha': 0.0016235076862650263}. Best is trial 627 with value: 0.8808013426064705.[0m
[32m[I 2022-04-14 03:09:41,169][0m Trial 633 finished with value: 0.8582217980124419 and parameters: {'loss': 'coxph', 'learning_rate': 0.00497659429530675, 'n_estimators': 155, 'criterion': 'friedman_mse', 'min_samples_split': 4, 'min_samples_leaf': 1, 'min_weight_fraction_leaf': 0.06541900052310588, 'min_impurity_decrease': 0.29848928252668494, 'max_features': 0.9667016308666508, 'subsample': 0.7489557659128531, 'dropout_rate': 0.3339128819924928, 'ccp_alpha': 0.16387960364322032}. Best is trial 627 with value: 0.8808013426064705.[0m
[32m[I 2022-04-14 03:09:43,993][0m Trial 634 finished with value: 0.8242379408992543 and parameters: {'loss': 'coxph', 'learning_rate': 0.004446136698584135, 'n_estimators': 141, 'criterion': 'friedman_mse', 'min_samples_split': 4, 'min_samples_leaf': 1, 'min_weight_fraction_leaf': 0.36629887739054257, 'min_impurity_decrease': 0.3205662346687898, 'max_features': 0.9648628703812061, 'subsample': 0.775410695108598, 'dropout_rate': 0.363671704849659, 'ccp_alpha': 0.0031507945037652493}. Best is trial 627 with value: 0.8808013426064705.[0m
[32m[I 2022-04-14 03:09:47,622][0m Trial 635 finished with value: 0.8641158825242939 and parameters: {'loss': 'coxph', 'learning_rate': 0.0032642960959957264, 'n_estimators': 133, 'criterion': 'friedman_mse', 'min_samples_split': 4, 'min_samples_leaf': 1, 'min_weight_fraction_leaf': 0.0415560631471166, 'min_impurity_decrease': 0.34195666941790986, 'max_features': 0.9958048468543503, 'subsample': 0.712983441292445, 'dropout_rate': 0.31368314741947295, 'ccp_alpha': 0.09303031120873785}. Best is trial 627 with value: 0.8808013426064705.[0m
[32m[I 2022-04-14 03:09:50,730][0m Trial 636 finished with value: 0.8485991730177751 and parameters: {'loss': 'coxph', 'learning_rate': 0.003698525144217963, 'n_estimators': 151, 'criterion': 'friedman_mse', 'min_samples_split': 4, 'min_samples_leaf': 1, 'min_weight_fraction_leaf': 0.046308443263198704, 'min_impurity_decrease': 0.27479032551551374, 'max_features': 0.9977054588080067, 'subsample': 0.7293957684737664, 'dropout_rate': 0.3689371241309295, 'ccp_alpha': 0.21764624180880127}. Best is trial 627 with value: 0.8808013426064705.[0m
[32m[I 2022-04-14 03:09:52,892][0m Trial 637 finished with value: 0.871960109877455 and parameters: {'loss': 'coxph', 'learning_rate': 0.003064208924677614, 'n_estimators': 124, 'criterion': 'friedman_mse', 'min_samples_split': 4, 'min_samples_leaf': 1, 'min_weight_fraction_leaf': 0.0613345403695683, 'min_impurity_decrease': 0.3442777756127838, 'max_features': 0.9749729289569162, 'subsample': 0.7636088234624532, 'dropout_rate': 0.3405283702653049, 'ccp_alpha': 0.09180794621583374}. Best is trial 627 with value: 0.8808013426064705.[0m
[32m[I 2022-04-14 03:09:56,706][0m Trial 638 finished with value: -0.3690431949746365 and parameters: {'loss': 'squared', 'learning_rate': 0.004441582312155382, 'n_estimators': 169, 'criterion': 'friedman_mse', 'min_samples_split': 4, 'min_samples_leaf': 1, 'min_weight_fraction_leaf': 0.05137800722049877, 'min_impurity_decrease': 0.33638507092916786, 'max_features': 0.970479590862566, 'subsample': 0.7832621824935491, 'dropout_rate': 0.3814974716617604, 'ccp_alpha': 0.26926900928428055}. Best is trial 627 with value: 0.8808013426064705.[0m
[32m[I 2022-04-14 03:10:00,127][0m Trial 639 finished with value: 0.8808013426064705 and parameters: {'loss': 'coxph', 'learning_rate': 0.0034394699120506196, 'n_estimators': 139, 'criterion': 'friedman_mse', 'min_samples_split': 4, 'min_samples_leaf': 1, 'min_weight_fraction_leaf': 0.03912386939647078, 'min_impurity_decrease': 0.3104420276591326, 'max_features': 0.9620224228486979, 'subsample': 0.7501664640048039, 'dropout_rate': 0.3317061329931562, 'ccp_alpha': 0.001004584637885596}. Best is trial 627 with value: 0.8808013426064705.[0m
[32m[I 2022-04-14 03:10:03,299][0m Trial 640 finished with value: 0.765552213100388 and parameters: {'loss': 'coxph', 'learning_rate': 0.005318152269953349, 'n_estimators': 141, 'criterion': 'friedman_mse', 'min_samples_split': 4, 'min_samples_leaf': 1, 'min_weight_fraction_leaf': 0.49764466103175387, 'min_impurity_decrease': 0.2949318604986347, 'max_features': 0.9575894426048444, 'subsample': 0.697362108354958, 'dropout_rate': 0.32843559978486475, 'ccp_alpha': 0.001822758152596931}. Best is trial 627 with value: 0.8808013426064705.[0m
[32m[I 2022-04-14 03:10:07,784][0m Trial 641 finished with value: 0.8570483459047606 and parameters: {'loss': 'coxph', 'learning_rate': 0.003962441235821002, 'n_estimators': 149, 'criterion': 'friedman_mse', 'min_samples_split': 4, 'min_samples_leaf': 1, 'min_weight_fraction_leaf': 0.03870631563497352, 'min_impurity_decrease': 0.3061164850638909, 'max_features': 0.9578956365387246, 'subsample': 0.7420340559358303, 'dropout_rate': 0.32492996941389324, 'ccp_alpha': 0.16816008906292207}. Best is trial 627 with value: 0.8808013426064705.[0m
