[32m[I 2022-04-20 07:48:18,959][0m Trial 680 finished with value: 0.7253349817963732 and parameters: {'n_hidden': 32, 'mixture_components': 7, 'use_sparse_layer': True, 'use_sparse_loss': False, 'use_batchnorm': True, 'use_dropout': False, 'mlp_size_1': 0, 'mlp_size_2': 2, 'mlp_size_3': 0, 'kernel': 'Exponential', 'loss_name': 'NLLLoss'}. Best is trial 526 with value: 0.7438354099715846.[0m
[32m[I 2022-04-20 07:51:47,166][0m Trial 681 finished with value: 0.6796162550664926 and parameters: {'n_hidden': 32, 'mixture_components': 2, 'use_sparse_layer': True, 'use_sparse_loss': False, 'use_batchnorm': True, 'use_dropout': False, 'mlp_size_1': 0, 'mlp_size_2': 2, 'mlp_size_3': 0, 'kernel': 'LogLogistic', 'loss_name': 'NLLLoss'}. Best is trial 526 with value: 0.7438354099715846.[0m
[32m[I 2022-04-20 07:57:29,385][0m Trial 682 finished with value: 0.7364118301505188 and parameters: {'n_hidden': 32, 'mixture_components': 2, 'use_sparse_layer': True, 'use_sparse_loss': False, 'use_batchnorm': True, 'use_dropout': False, 'mlp_size_1': 0, 'mlp_size_2': 2, 'mlp_size_3': 0, 'kernel': 'Exponential', 'loss_name': 'NLLLoss'}. Best is trial 526 with value: 0.7438354099715846.[0m
[32m[I 2022-04-20 08:02:44,574][0m Trial 683 finished with value: 0.7213456403162224 and parameters: {'n_hidden': 32, 'mixture_components': 2, 'use_sparse_layer': True, 'use_sparse_loss': False, 'use_batchnorm': True, 'use_dropout': False, 'mlp_size_1': 0, 'mlp_size_2': 2, 'mlp_size_3': 0, 'kernel': 'Exponential', 'loss_name': 'NLLLoss'}. Best is trial 526 with value: 0.7438354099715846.[0m
[32m[I 2022-04-20 08:08:02,723][0m Trial 684 finished with value: 0.7262943601633142 and parameters: {'n_hidden': 32, 'mixture_components': 2, 'use_sparse_layer': False, 'use_batchnorm': True, 'use_dropout': False, 'mlp_size_1': 0, 'mlp_size_2': 2, 'mlp_size_3': 0, 'kernel': 'Exponential', 'loss_name': 'NLLLoss'}. Best is trial 526 with value: 0.7438354099715846.[0m
[32m[I 2022-04-20 08:10:57,853][0m Trial 685 finished with value: 0.6888905557482164 and parameters: {'n_hidden': 32, 'mixture_components': 3, 'use_sparse_layer': True, 'use_sparse_loss': False, 'use_batchnorm': True, 'use_dropout': False, 'mlp_size_1': 0, 'mlp_size_2': 2, 'mlp_size_3': 0, 'kernel': 'Normal', 'loss_name': 'NLLLoss'}. Best is trial 526 with value: 0.7438354099715846.[0m
[32m[I 2022-04-20 08:15:16,956][0m Trial 686 finished with value: 0.7155883322018066 and parameters: {'n_hidden': 32, 'mixture_components': 8, 'use_sparse_layer': True, 'use_sparse_loss': False, 'use_batchnorm': True, 'use_dropout': False, 'mlp_size_1': 0, 'mlp_size_2': 2, 'mlp_size_3': 0, 'kernel': 'Exponential', 'loss_name': 'NLLLoss'}. Best is trial 526 with value: 0.7438354099715846.[0m
[32m[I 2022-04-20 08:20:38,838][0m Trial 687 finished with value: 0.7201958713878074 and parameters: {'n_hidden': 32, 'mixture_components': 2, 'use_sparse_layer': True, 'use_sparse_loss': False, 'use_batchnorm': True, 'use_dropout': False, 'mlp_size_1': 0, 'mlp_size_2': 2, 'mlp_size_3': 0, 'kernel': 'Exponential', 'loss_name': 'NLLLoss'}. Best is trial 526 with value: 0.7438354099715846.[0m
[32m[I 2022-04-20 08:25:50,547][0m Trial 688 finished with value: 0.7211408207148985 and parameters: {'n_hidden': 32, 'mixture_components': 5, 'use_sparse_layer': True, 'use_sparse_loss': False, 'use_batchnorm': True, 'use_dropout': False, 'mlp_size_1': 0, 'mlp_size_2': 2, 'mlp_size_3': 0, 'kernel': 'Exponential', 'loss_name': 'NLLLoss'}. Best is trial 526 with value: 0.7438354099715846.[0m
[32m[I 2022-04-20 08:28:35,901][0m Trial 689 finished with value: 0.6186706448209647 and parameters: {'n_hidden': 32, 'mixture_components': 2, 'use_sparse_layer': True, 'use_sparse_loss': False, 'use_batchnorm': True, 'use_dropout': False, 'mlp_size_1': 0, 'mlp_size_2': 2, 'mlp_size_3': 0, 'kernel': 'Gumbel', 'loss_name': 'NLLLoss'}. Best is trial 526 with value: 0.7438354099715846.[0m
[32m[I 2022-04-20 08:33:22,729][0m Trial 690 finished with value: 0.7293397329597452 and parameters: {'n_hidden': 32, 'mixture_components': 2, 'use_sparse_layer': True, 'use_sparse_loss': False, 'use_batchnorm': True, 'use_dropout': False, 'mlp_size_1': 0, 'mlp_size_2': 2, 'mlp_size_3': 0, 'kernel': 'Exponential', 'loss_name': 'NLLLoss'}. Best is trial 526 with value: 0.7438354099715846.[0m
[32m[I 2022-04-20 08:38:19,437][0m Trial 691 finished with value: 0.7275437977014722 and parameters: {'n_hidden': 32, 'mixture_components': 2, 'use_sparse_layer': True, 'use_sparse_loss': False, 'use_batchnorm': True, 'use_dropout': False, 'mlp_size_1': 0, 'mlp_size_2': 2, 'mlp_size_3': 0, 'kernel': 'Exponential', 'loss_name': 'NLLLoss'}. Best is trial 526 with value: 0.7438354099715846.[0m
[32m[I 2022-04-20 08:41:32,896][0m Trial 692 finished with value: 0.672768841361413 and parameters: {'n_hidden': 32, 'mixture_components': 2, 'use_sparse_layer': False, 'use_batchnorm': True, 'use_dropout': False, 'mlp_size_1': 0, 'mlp_size_2': 2, 'mlp_size_3': 0, 'kernel': 'Weibull', 'loss_name': 'NLLLoss'}. Best is trial 526 with value: 0.7438354099715846.[0m
[32m[I 2022-04-20 08:46:15,416][0m Trial 693 finished with value: 0.725629024577409 and parameters: {'n_hidden': 32, 'mixture_components': 2, 'use_sparse_layer': True, 'use_sparse_loss': False, 'use_batchnorm': True, 'use_dropout': False, 'mlp_size_1': 0, 'mlp_size_2': 2, 'mlp_size_3': 0, 'kernel': 'Exponential', 'loss_name': 'NLLLoss'}. Best is trial 526 with value: 0.7438354099715846.[0m
[32m[I 2022-04-20 08:50:13,716][0m Trial 694 finished with value: 0.7069370421004184 and parameters: {'n_hidden': 128, 'mixture_components': 2, 'use_sparse_layer': True, 'use_sparse_loss': False, 'use_batchnorm': True, 'use_dropout': False, 'mlp_size_1': 0, 'mlp_size_2': 2, 'mlp_size_3': 0, 'kernel': 'Exponential', 'loss_name': 'AlternativeNLLLoss'}. Best is trial 526 with value: 0.7438354099715846.[0m
[32m[I 2022-04-20 08:53:04,704][0m Trial 695 finished with value: 0.660925323601948 and parameters: {'n_hidden': 32, 'mixture_components': 3, 'use_sparse_layer': True, 'use_sparse_loss': False, 'use_batchnorm': True, 'use_dropout': False, 'mlp_size_1': 0, 'mlp_size_2': 2, 'mlp_size_3': 0, 'kernel': 'Logistic', 'loss_name': 'NLLLoss'}. Best is trial 526 with value: 0.7438354099715846.[0m
[32m[I 2022-04-20 09:00:20,168][0m Trial 696 finished with value: 0.7058588680609323 and parameters: {'n_hidden': 32, 'mixture_components': 2, 'use_sparse_layer': True, 'use_sparse_loss': False, 'use_batchnorm': True, 'use_dropout': False, 'mlp_size_1': 0, 'mlp_size_2': 2, 'mlp_size_3': 0, 'kernel': 'LogNormal', 'loss_name': 'NLLLoss'}. Best is trial 526 with value: 0.7438354099715846.[0m
[32m[I 2022-04-20 09:05:09,414][0m Trial 697 finished with value: 0.7097512681565951 and parameters: {'n_hidden': 32, 'mixture_components': 2, 'use_sparse_layer': True, 'use_sparse_loss': False, 'use_batchnorm': True, 'use_dropout': False, 'mlp_size_1': 0, 'mlp_size_2': 2, 'mlp_size_3': 0, 'kernel': 'Exponential', 'loss_name': 'NLLLoss'}. Best is trial 526 with value: 0.7438354099715846.[0m
[32m[I 2022-04-20 09:09:17,782][0m Trial 698 finished with value: 0.6990614941779238 and parameters: {'n_hidden': 32, 'mixture_components': 9, 'use_sparse_layer': True, 'use_sparse_loss': False, 'use_batchnorm': True, 'use_dropout': False, 'mlp_size_1': 0, 'mlp_size_2': 2, 'mlp_size_3': 0, 'kernel': 'Exponential', 'loss_name': 'NLLLoss'}. Best is trial 526 with value: 0.7438354099715846.[0m
[32m[I 2022-04-20 09:14:16,511][0m Trial 699 finished with value: 0.7439838883648641 and parameters: {'n_hidden': 32, 'mixture_components': 2, 'use_sparse_layer': True, 'use_sparse_loss': False, 'use_batchnorm': True, 'use_dropout': False, 'mlp_size_1': 0, 'mlp_size_2': 2, 'mlp_size_3': 0, 'kernel': 'Exponential', 'loss_name': 'NLLLoss'}. Best is trial 699 with value: 0.7439838883648641.[0m
[32m[I 2022-04-20 09:19:57,297][0m Trial 700 finished with value: 0.7209492348581672 and parameters: {'n_hidden': 32, 'mixture_components': 2, 'use_sparse_layer': True, 'use_sparse_loss': False, 'use_batchnorm': True, 'use_dropout': False, 'mlp_size_1': 0, 'mlp_size_2': 2, 'mlp_size_3': 0, 'kernel': 'Exponential', 'loss_name': 'NLLLoss'}. Best is trial 699 with value: 0.7439838883648641.[0m
[32m[I 2022-04-20 09:25:33,386][0m Trial 701 finished with value: 0.705376674879796 and parameters: {'n_hidden': 32, 'mixture_components': 2, 'use_sparse_layer': False, 'use_batchnorm': True, 'use_dropout': False, 'mlp_size_1': 0, 'mlp_size_2': 2, 'mlp_size_3': 0, 'kernel': 'Exponential', 'loss_name': 'NLLLoss'}. Best is trial 699 with value: 0.7439838883648641.[0m
[32m[I 2022-04-20 09:31:28,422][0m Trial 702 finished with value: 0.7363545959486877 and parameters: {'n_hidden': 32, 'mixture_components': 2, 'use_sparse_layer': True, 'use_sparse_loss': False, 'use_batchnorm': True, 'use_dropout': False, 'mlp_size_1': 0, 'mlp_size_2': 2, 'mlp_size_3': 0, 'kernel': 'Exponential', 'loss_name': 'NLLLoss'}. Best is trial 699 with value: 0.7439838883648641.[0m
[32m[I 2022-04-20 09:36:33,816][0m Trial 703 finished with value: 0.7233167955470329 and parameters: {'n_hidden': 32, 'mixture_components': 2, 'use_sparse_layer': True, 'use_sparse_loss': False, 'use_batchnorm': True, 'use_dropout': False, 'mlp_size_1': 0, 'mlp_size_2': 2, 'mlp_size_3': 0, 'kernel': 'Exponential', 'loss_name': 'NLLLoss'}. Best is trial 699 with value: 0.7439838883648641.[0m
[32m[I 2022-04-20 09:41:29,486][0m Trial 704 finished with value: 0.7130121155957138 and parameters: {'n_hidden': 32, 'mixture_components': 2, 'use_sparse_layer': True, 'use_sparse_loss': False, 'use_batchnorm': True, 'use_dropout': False, 'mlp_size_1': 0, 'mlp_size_2': 2, 'mlp_size_3': 0, 'kernel': 'Exponential', 'loss_name': 'NLLLoss'}. Best is trial 699 with value: 0.7439838883648641.[0m
[32m[I 2022-04-20 09:46:35,598][0m Trial 705 finished with value: 0.7339826807672413 and parameters: {'n_hidden': 32, 'mixture_components': 2, 'use_sparse_layer': True, 'use_sparse_loss': False, 'use_batchnorm': True, 'use_dropout': False, 'mlp_size_1': 0, 'mlp_size_2': 2, 'mlp_size_3': 0, 'kernel': 'Exponential', 'loss_name': 'NLLLoss'}. Best is trial 699 with value: 0.7439838883648641.[0m
[32m[I 2022-04-20 09:51:42,296][0m Trial 706 finished with value: 0.717087658703537 and parameters: {'n_hidden': 32, 'mixture_components': 2, 'use_sparse_layer': True, 'use_sparse_loss': False, 'use_batchnorm': True, 'use_dropout': False, 'mlp_size_1': 0, 'mlp_size_2': 2, 'mlp_size_3': 0, 'kernel': 'Exponential', 'loss_name': 'NLLLoss'}. Best is trial 699 with value: 0.7439838883648641.[0m
[32m[I 2022-04-20 09:56:18,859][0m Trial 707 finished with value: 0.7322741240071664 and parameters: {'n_hidden': 32, 'mixture_components': 2, 'use_sparse_layer': True, 'use_sparse_loss': False, 'use_batchnorm': True, 'use_dropout': False, 'mlp_size_1': 0, 'mlp_size_2': 2, 'mlp_size_3': 0, 'kernel': 'Exponential', 'loss_name': 'NLLLoss'}. Best is trial 699 with value: 0.7439838883648641.[0m
[32m[I 2022-04-20 10:01:28,535][0m Trial 708 finished with value: 0.7355257344324287 and parameters: {'n_hidden': 32, 'mixture_components': 2, 'use_sparse_layer': True, 'use_sparse_loss': False, 'use_batchnorm': True, 'use_dropout': False, 'mlp_size_1': 0, 'mlp_size_2': 2, 'mlp_size_3': 0, 'kernel': 'Exponential', 'loss_name': 'NLLLoss'}. Best is trial 699 with value: 0.7439838883648641.[0m
[32m[I 2022-04-20 10:06:12,401][0m Trial 709 finished with value: 0.7019574422395318 and parameters: {'n_hidden': 32, 'mixture_components': 3, 'use_sparse_layer': True, 'use_sparse_loss': False, 'use_batchnorm': True, 'use_dropout': False, 'mlp_size_1': 0, 'mlp_size_2': 2, 'mlp_size_3': 0, 'kernel': 'Exponential', 'loss_name': 'NLLLoss'}. Best is trial 699 with value: 0.7439838883648641.[0m
[32m[I 2022-04-20 10:10:15,686][0m Trial 710 finished with value: 0.6930813275889095 and parameters: {'n_hidden': 64, 'mixture_components': 2, 'use_sparse_layer': False, 'use_batchnorm': True, 'use_dropout': False, 'mlp_size_1': 0, 'mlp_size_2': 2, 'mlp_size_3': 0, 'kernel': 'Exponential', 'loss_name': 'NLLLoss'}. Best is trial 699 with value: 0.7439838883648641.[0m
[32m[I 2022-04-20 10:13:54,808][0m Trial 711 finished with value: 0.6731700607784732 and parameters: {'n_hidden': 32, 'mixture_components': 2, 'use_sparse_layer': True, 'use_sparse_loss': False, 'use_batchnorm': True, 'use_dropout': False, 'mlp_size_1': 0, 'mlp_size_2': 2, 'mlp_size_3': 0, 'kernel': 'LogLogistic', 'loss_name': 'NLLLoss'}. Best is trial 699 with value: 0.7439838883648641.[0m
[32m[I 2022-04-20 10:19:18,159][0m Trial 712 finished with value: 0.7156981997073151 and parameters: {'n_hidden': 32, 'mixture_components': 5, 'use_sparse_layer': True, 'use_sparse_loss': False, 'use_batchnorm': True, 'use_dropout': False, 'mlp_size_1': 0, 'mlp_size_2': 2, 'mlp_size_3': 0, 'kernel': 'Exponential', 'loss_name': 'NLLLoss'}. Best is trial 699 with value: 0.7439838883648641.[0m
[32m[I 2022-04-20 10:24:50,611][0m Trial 713 finished with value: 0.7363730153432366 and parameters: {'n_hidden': 32, 'mixture_components': 2, 'use_sparse_layer': True, 'use_sparse_loss': False, 'use_batchnorm': True, 'use_dropout': False, 'mlp_size_1': 0, 'mlp_size_2': 2, 'mlp_size_3': 0, 'kernel': 'Exponential', 'loss_name': 'NLLLoss'}. Best is trial 699 with value: 0.7439838883648641.[0m
[32m[I 2022-04-20 10:27:33,422][0m Trial 714 finished with value: 0.638857518864126 and parameters: {'n_hidden': 256, 'mixture_components': 6, 'use_sparse_layer': True, 'use_sparse_loss': False, 'use_batchnorm': True, 'use_dropout': False, 'mlp_size_1': 0, 'mlp_size_2': 1, 'mlp_size_3': 0, 'kernel': 'Exponential', 'loss_name': 'NLLLoss'}. Best is trial 699 with value: 0.7439838883648641.[0m
[32m[I 2022-04-20 10:32:38,518][0m Trial 715 finished with value: 0.7386239922229606 and parameters: {'n_hidden': 32, 'mixture_components': 2, 'use_sparse_layer': True, 'use_sparse_loss': False, 'use_batchnorm': True, 'use_dropout': False, 'mlp_size_1': 0, 'mlp_size_2': 2, 'mlp_size_3': 0, 'kernel': 'Exponential', 'loss_name': 'NLLLoss'}. Best is trial 699 with value: 0.7439838883648641.[0m
[32m[I 2022-04-20 10:35:50,290][0m Trial 716 finished with value: 0.647008988452949 and parameters: {'n_hidden': 32, 'mixture_components': 2, 'use_sparse_layer': True, 'use_sparse_loss': False, 'use_batchnorm': True, 'use_dropout': False, 'mlp_size_1': 0, 'mlp_size_2': 2, 'mlp_size_3': 0, 'kernel': 'Normal', 'loss_name': 'NLLLoss'}. Best is trial 699 with value: 0.7439838883648641.[0m
[32m[I 2022-04-20 10:39:35,065][0m Trial 717 finished with value: 0.6183825176762924 and parameters: {'n_hidden': 1024, 'mixture_components': 2, 'use_sparse_layer': True, 'use_sparse_loss': False, 'use_batchnorm': True, 'use_dropout': False, 'mlp_size_1': 1, 'mlp_size_2': 1, 'mlp_size_3': 4, 'kernel': 'Exponential', 'loss_name': 'AlternativeNLLLoss'}. Best is trial 699 with value: 0.7439838883648641.[0m
[32m[I 2022-04-20 10:45:35,482][0m Trial 718 finished with value: 0.7058069317005077 and parameters: {'n_hidden': 32, 'mixture_components': 3, 'use_sparse_layer': True, 'use_sparse_loss': False, 'use_batchnorm': True, 'use_dropout': False, 'mlp_size_1': 0, 'mlp_size_2': 2, 'mlp_size_3': 0, 'kernel': 'Exponential', 'loss_name': 'NLLLoss'}. Best is trial 699 with value: 0.7439838883648641.[0m
[32m[I 2022-04-20 10:50:51,948][0m Trial 719 finished with value: 0.7234397271429649 and parameters: {'n_hidden': 32, 'mixture_components': 2, 'use_sparse_layer': True, 'use_sparse_loss': False, 'use_batchnorm': True, 'use_dropout': False, 'mlp_size_1': 0, 'mlp_size_2': 2, 'mlp_size_3': 0, 'kernel': 'Exponential', 'loss_name': 'NLLLoss'}. Best is trial 699 with value: 0.7439838883648641.[0m
[32m[I 2022-04-20 10:54:38,281][0m Trial 720 finished with value: 0.6821260258075699 and parameters: {'n_hidden': 32, 'mixture_components': 2, 'use_sparse_layer': True, 'use_sparse_loss': False, 'use_batchnorm': True, 'use_dropout': False, 'mlp_size_1': 0, 'mlp_size_2': 2, 'mlp_size_3': 0, 'kernel': 'Gumbel', 'loss_name': 'NLLLoss'}. Best is trial 699 with value: 0.7439838883648641.[0m
[32m[I 2022-04-20 11:00:20,375][0m Trial 721 finished with value: 0.7226317585176609 and parameters: {'n_hidden': 32, 'mixture_components': 3, 'use_sparse_layer': True, 'use_sparse_loss': False, 'use_batchnorm': True, 'use_dropout': False, 'mlp_size_1': 0, 'mlp_size_2': 2, 'mlp_size_3': 0, 'kernel': 'Exponential', 'loss_name': 'NLLLoss'}. Best is trial 699 with value: 0.7439838883648641.[0m
[32m[I 2022-04-20 11:03:48,546][0m Trial 722 finished with value: 0.7155034719468947 and parameters: {'n_hidden': 32, 'mixture_components': 2, 'use_sparse_layer': True, 'use_sparse_loss': False, 'use_batchnorm': True, 'use_dropout': False, 'mlp_size_1': 0, 'mlp_size_2': 2, 'mlp_size_3': 0, 'kernel': 'Weibull', 'loss_name': 'NLLLoss'}. Best is trial 699 with value: 0.7439838883648641.[0m
[32m[I 2022-04-20 11:09:02,467][0m Trial 723 finished with value: 0.740744819468016 and parameters: {'n_hidden': 32, 'mixture_components': 2, 'use_sparse_layer': True, 'use_sparse_loss': False, 'use_batchnorm': True, 'use_dropout': False, 'mlp_size_1': 0, 'mlp_size_2': 2, 'mlp_size_3': 0, 'kernel': 'Exponential', 'loss_name': 'NLLLoss'}. Best is trial 699 with value: 0.7439838883648641.[0m
[32m[I 2022-04-20 11:13:59,981][0m Trial 724 finished with value: 0.7181580674175635 and parameters: {'n_hidden': 32, 'mixture_components': 2, 'use_sparse_layer': True, 'use_sparse_loss': False, 'use_batchnorm': True, 'use_dropout': False, 'mlp_size_1': 0, 'mlp_size_2': 2, 'mlp_size_3': 0, 'kernel': 'Exponential', 'loss_name': 'NLLLoss'}. Best is trial 699 with value: 0.7439838883648641.[0m
[32m[I 2022-04-20 11:17:30,070][0m Trial 725 finished with value: 0.6860361768052631 and parameters: {'n_hidden': 128, 'mixture_components': 2, 'use_sparse_layer': True, 'use_sparse_loss': False, 'use_batchnorm': True, 'use_dropout': False, 'mlp_size_1': 0, 'mlp_size_2': 2, 'mlp_size_3': 0, 'kernel': 'Exponential', 'loss_name': 'NLLLoss'}. Best is trial 699 with value: 0.7439838883648641.[0m
[32m[I 2022-04-20 11:21:57,143][0m Trial 726 finished with value: 0.740249023532956 and parameters: {'n_hidden': 32, 'mixture_components': 2, 'use_sparse_layer': True, 'use_sparse_loss': False, 'use_batchnorm': True, 'use_dropout': False, 'mlp_size_1': 0, 'mlp_size_2': 2, 'mlp_size_3': 0, 'kernel': 'Exponential', 'loss_name': 'NLLLoss'}. Best is trial 699 with value: 0.7439838883648641.[0m
[32m[I 2022-04-20 11:24:28,438][0m Trial 727 finished with value: 0.6832568761417427 and parameters: {'n_hidden': 32, 'mixture_components': 2, 'use_sparse_layer': True, 'use_sparse_loss': False, 'use_batchnorm': True, 'use_dropout': False, 'mlp_size_1': 0, 'mlp_size_2': 2, 'mlp_size_3': 0, 'kernel': 'Logistic', 'loss_name': 'NLLLoss'}. Best is trial 699 with value: 0.7439838883648641.[0m
[32m[I 2022-04-20 11:29:24,247][0m Trial 728 finished with value: 0.7009562726678659 and parameters: {'n_hidden': 32, 'mixture_components': 2, 'use_sparse_layer': True, 'use_sparse_loss': False, 'use_batchnorm': True, 'use_dropout': False, 'mlp_size_1': 0, 'mlp_size_2': 2, 'mlp_size_3': 0, 'kernel': 'Exponential', 'loss_name': 'NLLLoss'}. Best is trial 699 with value: 0.7439838883648641.[0m
[32m[I 2022-04-20 11:35:02,815][0m Trial 729 finished with value: 0.7256311795036084 and parameters: {'n_hidden': 32, 'mixture_components': 2, 'use_sparse_layer': True, 'use_sparse_loss': False, 'use_batchnorm': True, 'use_dropout': False, 'mlp_size_1': 0, 'mlp_size_2': 2, 'mlp_size_3': 0, 'kernel': 'Exponential', 'loss_name': 'NLLLoss'}. Best is trial 699 with value: 0.7439838883648641.[0m
[32m[I 2022-04-20 11:39:18,179][0m Trial 730 finished with value: 0.6985819013330143 and parameters: {'n_hidden': 32, 'mixture_components': 2, 'use_sparse_layer': True, 'use_sparse_loss': False, 'use_batchnorm': True, 'use_dropout': False, 'mlp_size_1': 0, 'mlp_size_2': 2, 'mlp_size_3': 0, 'kernel': 'Exponential', 'loss_name': 'NLLLoss'}. Best is trial 699 with value: 0.7439838883648641.[0m
[32m[I 2022-04-20 11:46:23,075][0m Trial 731 finished with value: 0.6992671936531293 and parameters: {'n_hidden': 32, 'mixture_components': 2, 'use_sparse_layer': True, 'use_sparse_loss': False, 'use_batchnorm': True, 'use_dropout': False, 'mlp_size_1': 0, 'mlp_size_2': 2, 'mlp_size_3': 0, 'kernel': 'LogNormal', 'loss_name': 'NLLLoss'}. Best is trial 699 with value: 0.7439838883648641.[0m
[32m[I 2022-04-20 11:51:50,671][0m Trial 732 finished with value: 0.71538036539352 and parameters: {'n_hidden': 32, 'mixture_components': 2, 'use_sparse_layer': True, 'use_sparse_loss': False, 'use_batchnorm': True, 'use_dropout': False, 'mlp_size_1': 0, 'mlp_size_2': 2, 'mlp_size_3': 0, 'kernel': 'Exponential', 'loss_name': 'NLLLoss'}. Best is trial 699 with value: 0.7439838883648641.[0m
[32m[I 2022-04-20 11:58:04,262][0m Trial 733 finished with value: 0.7179553981282912 and parameters: {'n_hidden': 32, 'mixture_components': 2, 'use_sparse_layer': True, 'use_sparse_loss': False, 'use_batchnorm': True, 'use_dropout': False, 'mlp_size_1': 0, 'mlp_size_2': 2, 'mlp_size_3': 0, 'kernel': 'Exponential', 'loss_name': 'NLLLoss'}. Best is trial 699 with value: 0.7439838883648641.[0m
[32m[I 2022-04-20 12:02:05,094][0m Trial 734 finished with value: 0.7183532138265141 and parameters: {'n_hidden': 64, 'mixture_components': 2, 'use_sparse_layer': True, 'use_sparse_loss': False, 'use_batchnorm': True, 'use_dropout': False, 'mlp_size_1': 0, 'mlp_size_2': 2, 'mlp_size_3': 0, 'kernel': 'Exponential', 'loss_name': 'NLLLoss'}. Best is trial 699 with value: 0.7439838883648641.[0m
