[32m[I 2022-04-13 11:44:53,305][0m Trial 428 finished with value: 0.8643129825609158 and parameters: {'alpha': 2.22700797638026, 'ties': 'efron'}. Best is trial 99 with value: 0.8654869897806009.[0m
[32m[I 2022-04-13 11:44:53,389][0m Trial 429 finished with value: 0.8643129825609158 and parameters: {'alpha': 2.283066960443169, 'ties': 'breslow'}. Best is trial 99 with value: 0.8654869897806009.[0m
[32m[I 2022-04-13 11:44:53,525][0m Trial 430 finished with value: 0.8647702367029909 and parameters: {'alpha': 1.9573681894733852, 'ties': 'breslow'}. Best is trial 99 with value: 0.8654869897806009.[0m
[32m[I 2022-04-13 11:44:53,687][0m Trial 431 finished with value: 0.8648486321634327 and parameters: {'alpha': 2.4875203897678744, 'ties': 'efron'}. Best is trial 99 with value: 0.8654869897806009.[0m
[32m[I 2022-04-13 11:44:53,804][0m Trial 432 finished with value: 0.8648486321634327 and parameters: {'alpha': 2.3695660624870105, 'ties': 'efron'}. Best is trial 99 with value: 0.8654869897806009.[0m
[32m[I 2022-04-13 11:44:53,945][0m Trial 433 finished with value: 0.8643129825609158 and parameters: {'alpha': 2.269734162516826, 'ties': 'breslow'}. Best is trial 99 with value: 0.8654869897806009.[0m
[32m[I 2022-04-13 11:44:54,075][0m Trial 434 finished with value: 0.8648486321634327 and parameters: {'alpha': 2.395409315167977, 'ties': 'efron'}. Best is trial 99 with value: 0.8654869897806009.[0m
[32m[I 2022-04-13 11:44:54,220][0m Trial 435 finished with value: 0.8610217054568331 and parameters: {'alpha': 2.9553369523192776, 'ties': 'breslow'}. Best is trial 99 with value: 0.8654869897806009.[0m
[32m[I 2022-04-13 11:44:54,336][0m Trial 436 finished with value: 0.8648486321634327 and parameters: {'alpha': 2.345800211901534, 'ties': 'efron'}. Best is trial 99 with value: 0.8654869897806009.[0m
[32m[I 2022-04-13 11:44:54,514][0m Trial 437 finished with value: 0.8654085943201592 and parameters: {'alpha': 2.068505001386856, 'ties': 'breslow'}. Best is trial 99 with value: 0.8654869897806009.[0m
[32m[I 2022-04-13 11:44:54,614][0m Trial 438 finished with value: 0.8641835106491502 and parameters: {'alpha': 2.169693385511071, 'ties': 'breslow'}. Best is trial 99 with value: 0.8654869897806009.[0m
[32m[I 2022-04-13 11:44:54,742][0m Trial 439 finished with value: 0.8641835106491502 and parameters: {'alpha': 2.117792809479458, 'ties': 'efron'}. Best is trial 99 with value: 0.8654869897806009.[0m
[32m[I 2022-04-13 11:44:54,992][0m Trial 440 finished with value: 0.8643129825609158 and parameters: {'alpha': 2.2188133567842714, 'ties': 'efron'}. Best is trial 99 with value: 0.8654869897806009.[0m
[32m[I 2022-04-13 11:44:55,080][0m Trial 441 finished with value: 0.8633966068268555 and parameters: {'alpha': 2.6566410753489977, 'ties': 'breslow'}. Best is trial 99 with value: 0.8654869897806009.[0m
[32m[I 2022-04-13 11:44:55,212][0m Trial 442 finished with value: 0.8648486321634327 and parameters: {'alpha': 2.51684214202056, 'ties': 'breslow'}. Best is trial 99 with value: 0.8654869897806009.[0m
[32m[I 2022-04-13 11:44:55,331][0m Trial 443 finished with value: 0.8648486321634327 and parameters: {'alpha': 2.436568993377409, 'ties': 'breslow'}. Best is trial 99 with value: 0.8654869897806009.[0m
[32m[I 2022-04-13 11:44:55,433][0m Trial 444 finished with value: 0.8643129825609158 and parameters: {'alpha': 2.277578343368323, 'ties': 'efron'}. Best is trial 99 with value: 0.8654869897806009.[0m
[32m[I 2022-04-13 11:44:55,641][0m Trial 445 finished with value: 0.8648486321634327 and parameters: {'alpha': 2.372517423352578, 'ties': 'breslow'}. Best is trial 99 with value: 0.8654869897806009.[0m
[32m[I 2022-04-13 11:44:55,735][0m Trial 446 finished with value: 0.8648486321634327 and parameters: {'alpha': 2.352904780322302, 'ties': 'breslow'}. Best is trial 99 with value: 0.8654869897806009.[0m
[32m[I 2022-04-13 11:44:55,937][0m Trial 447 finished with value: 0.8647928920287047 and parameters: {'alpha': 1.9764777632314767, 'ties': 'efron'}. Best is trial 99 with value: 0.8654869897806009.[0m
[32m[I 2022-04-13 11:44:56,109][0m Trial 448 finished with value: 0.8648486321634327 and parameters: {'alpha': 2.514326862753164, 'ties': 'breslow'}. Best is trial 99 with value: 0.8654869897806009.[0m
[32m[I 2022-04-13 11:44:56,264][0m Trial 449 finished with value: 0.8648486321634327 and parameters: {'alpha': 2.4565783921990305, 'ties': 'breslow'}. Best is trial 99 with value: 0.8654869897806009.[0m
[32m[I 2022-04-13 11:44:56,368][0m Trial 450 finished with value: 0.8643129825609158 and parameters: {'alpha': 2.2176653654724814, 'ties': 'breslow'}. Best is trial 99 with value: 0.8654869897806009.[0m
[32m[I 2022-04-13 11:44:56,518][0m Trial 451 finished with value: 0.8654869897806009 and parameters: {'alpha': 2.3302598198325044, 'ties': 'breslow'}. Best is trial 99 with value: 0.8654869897806009.[0m
[32m[I 2022-04-13 11:44:56,660][0m Trial 452 finished with value: 0.8639833328806962 and parameters: {'alpha': 2.5620394273908715, 'ties': 'breslow'}. Best is trial 99 with value: 0.8654869897806009.[0m
[32m[I 2022-04-13 11:44:56,776][0m Trial 453 finished with value: 0.8648486321634327 and parameters: {'alpha': 2.430565468539236, 'ties': 'breslow'}. Best is trial 99 with value: 0.8654869897806009.[0m
[32m[I 2022-04-13 11:44:56,986][0m Trial 454 finished with value: 0.8624637196392941 and parameters: {'alpha': 0.6943405939152552, 'ties': 'breslow'}. Best is trial 99 with value: 0.8654869897806009.[0m
[32m[I 2022-04-13 11:44:57,175][0m Trial 455 finished with value: 0.8641835106491502 and parameters: {'alpha': 2.1448376426320346, 'ties': 'breslow'}. Best is trial 99 with value: 0.8654869897806009.[0m
[32m[I 2022-04-13 11:44:57,290][0m Trial 456 finished with value: 0.8643129825609158 and parameters: {'alpha': 2.2180523190881973, 'ties': 'breslow'}. Best is trial 99 with value: 0.8654869897806009.[0m
[32m[I 2022-04-13 11:44:57,468][0m Trial 457 finished with value: 0.8628877211214527 and parameters: {'alpha': 2.7540427241020846, 'ties': 'breslow'}. Best is trial 99 with value: 0.8654869897806009.[0m
[32m[I 2022-04-13 11:44:57,568][0m Trial 458 finished with value: 0.8598482533491518 and parameters: {'alpha': 3.7433031251211997, 'ties': 'efron'}. Best is trial 99 with value: 0.8654869897806009.[0m
[32m[I 2022-04-13 11:44:57,744][0m Trial 459 finished with value: 0.8648486321634327 and parameters: {'alpha': 2.4292488244952284, 'ties': 'breslow'}. Best is trial 99 with value: 0.8654869897806009.[0m
[32m[I 2022-04-13 11:44:57,847][0m Trial 460 finished with value: 0.8654085943201592 and parameters: {'alpha': 2.046720256901001, 'ties': 'efron'}. Best is trial 99 with value: 0.8654869897806009.[0m
[32m[I 2022-04-13 11:44:58,056][0m Trial 461 finished with value: 0.8654869897806009 and parameters: {'alpha': 2.2847307709067732, 'ties': 'efron'}. Best is trial 99 with value: 0.8654869897806009.[0m
[32m[I 2022-04-13 11:44:58,186][0m Trial 462 finished with value: 0.8641835106491502 and parameters: {'alpha': 2.1203978951299525, 'ties': 'efron'}. Best is trial 99 with value: 0.8654869897806009.[0m
[32m[I 2022-04-13 11:44:58,387][0m Trial 463 finished with value: 0.8643129825609158 and parameters: {'alpha': 2.2743459596915234, 'ties': 'efron'}. Best is trial 99 with value: 0.8654869897806009.[0m
[32m[I 2022-04-13 11:44:58,508][0m Trial 464 finished with value: 0.8648218682663185 and parameters: {'alpha': 2.1839732916134924, 'ties': 'efron'}. Best is trial 99 with value: 0.8654869897806009.[0m
[32m[I 2022-04-13 11:44:58,659][0m Trial 465 finished with value: 0.8639833328806962 and parameters: {'alpha': 2.6180079499050795, 'ties': 'breslow'}. Best is trial 99 with value: 0.8654869897806009.[0m
[32m[I 2022-04-13 11:44:58,799][0m Trial 466 finished with value: 0.8648486321634327 and parameters: {'alpha': 2.478394331339979, 'ties': 'breslow'}. Best is trial 99 with value: 0.8654869897806009.[0m
[32m[I 2022-04-13 11:44:58,931][0m Trial 467 finished with value: 0.8654869897806009 and parameters: {'alpha': 2.3348488208521423, 'ties': 'breslow'}. Best is trial 99 with value: 0.8654869897806009.[0m
[32m[I 2022-04-13 11:44:59,128][0m Trial 468 finished with value: 0.8654085943201592 and parameters: {'alpha': 2.019570153090907, 'ties': 'efron'}. Best is trial 99 with value: 0.8654869897806009.[0m
[32m[I 2022-04-13 11:44:59,249][0m Trial 469 finished with value: 0.8639833328806962 and parameters: {'alpha': 2.5344140626133234, 'ties': 'breslow'}. Best is trial 99 with value: 0.8654869897806009.[0m
[32m[I 2022-04-13 11:44:59,516][0m Trial 470 finished with value: 0.86398623966525 and parameters: {'alpha': 1.8691654676554386, 'ties': 'efron'}. Best is trial 99 with value: 0.8654869897806009.[0m
[32m[I 2022-04-13 11:44:59,769][0m Trial 471 finished with value: 0.8654869897806009 and parameters: {'alpha': 2.3372948999232617, 'ties': 'breslow'}. Best is trial 99 with value: 0.8654869897806009.[0m
[32m[I 2022-04-13 11:45:00,166][0m Trial 472 finished with value: 0.8643129825609158 and parameters: {'alpha': 2.197310323562139, 'ties': 'efron'}. Best is trial 99 with value: 0.8654869897806009.[0m
[32m[I 2022-04-13 11:45:00,457][0m Trial 473 finished with value: 0.8648486321634327 and parameters: {'alpha': 2.365827762042967, 'ties': 'breslow'}. Best is trial 99 with value: 0.8654869897806009.[0m
[32m[I 2022-04-13 11:45:00,764][0m Trial 474 finished with value: 0.8648486321634327 and parameters: {'alpha': 2.3957736334097754, 'ties': 'breslow'}. Best is trial 99 with value: 0.8654869897806009.[0m
[32m[I 2022-04-13 11:45:01,100][0m Trial 475 finished with value: 0.8654869897806009 and parameters: {'alpha': 2.2907222197153296, 'ties': 'efron'}. Best is trial 99 with value: 0.8654869897806009.[0m
[32m[I 2022-04-13 11:45:01,362][0m Trial 476 finished with value: 0.8641835106491502 and parameters: {'alpha': 2.1243640580643204, 'ties': 'efron'}. Best is trial 99 with value: 0.8654869897806009.[0m
[32m[I 2022-04-13 11:45:01,636][0m Trial 477 finished with value: 0.8643129825609158 and parameters: {'alpha': 2.232278239944019, 'ties': 'breslow'}. Best is trial 99 with value: 0.8654869897806009.[0m
[32m[I 2022-04-13 11:45:01,734][0m Trial 478 finished with value: 0.8648486321634327 and parameters: {'alpha': 2.471041939822344, 'ties': 'breslow'}. Best is trial 99 with value: 0.8654869897806009.[0m
[32m[I 2022-04-13 11:45:01,836][0m Trial 479 finished with value: 0.8643129825609158 and parameters: {'alpha': 2.284454456044689, 'ties': 'breslow'}. Best is trial 99 with value: 0.8654869897806009.[0m
[32m[I 2022-04-13 11:45:01,971][0m Trial 480 finished with value: 0.8648486321634327 and parameters: {'alpha': 2.422007827001198, 'ties': 'efron'}. Best is trial 99 with value: 0.8654869897806009.[0m
[32m[I 2022-04-13 11:45:02,158][0m Trial 481 finished with value: 0.8643129825609158 and parameters: {'alpha': 2.2565664867739916, 'ties': 'efron'}. Best is trial 99 with value: 0.8654869897806009.[0m
[32m[I 2022-04-13 11:45:02,349][0m Trial 482 finished with value: 0.8639833328806962 and parameters: {'alpha': 2.5828019310289854, 'ties': 'breslow'}. Best is trial 99 with value: 0.8654869897806009.[0m
[32m[I 2022-04-13 11:45:02,463][0m Trial 483 finished with value: 0.8648486321634327 and parameters: {'alpha': 2.38262729353375, 'ties': 'breslow'}. Best is trial 99 with value: 0.8654869897806009.[0m
[32m[I 2022-04-13 11:45:02,798][0m Trial 484 finished with value: 0.8610741349323201 and parameters: {'alpha': 3.196303425608338, 'ties': 'breslow'}. Best is trial 99 with value: 0.8654869897806009.[0m
[32m[I 2022-04-13 11:45:03,081][0m Trial 485 finished with value: 0.8648486321634327 and parameters: {'alpha': 2.5167146942192877, 'ties': 'breslow'}. Best is trial 99 with value: 0.8654869897806009.[0m
[32m[I 2022-04-13 11:45:03,334][0m Trial 486 finished with value: 0.8654869897806009 and parameters: {'alpha': 2.319364451540799, 'ties': 'breslow'}. Best is trial 99 with value: 0.8654869897806009.[0m
[32m[I 2022-04-13 11:45:03,582][0m Trial 487 finished with value: 0.8647702367029909 and parameters: {'alpha': 2.1049671608098253, 'ties': 'efron'}. Best is trial 99 with value: 0.8654869897806009.[0m
[32m[I 2022-04-13 11:45:03,760][0m Trial 488 finished with value: 0.8648486321634327 and parameters: {'alpha': 2.3730557153033853, 'ties': 'breslow'}. Best is trial 99 with value: 0.8654869897806009.[0m
[32m[I 2022-04-13 11:45:03,990][0m Trial 489 finished with value: 0.8643129825609158 and parameters: {'alpha': 2.1903749292669006, 'ties': 'efron'}. Best is trial 99 with value: 0.8654869897806009.[0m
[32m[I 2022-04-13 11:45:04,109][0m Trial 490 finished with value: 0.8654869897806009 and parameters: {'alpha': 2.2993245685691104, 'ties': 'breslow'}. Best is trial 99 with value: 0.8654869897806009.[0m
[32m[I 2022-04-13 11:45:04,197][0m Trial 491 finished with value: 0.8648486321634327 and parameters: {'alpha': 2.496271244183472, 'ties': 'breslow'}. Best is trial 99 with value: 0.8654869897806009.[0m
[32m[I 2022-04-13 11:45:04,299][0m Trial 492 finished with value: 0.8654085943201592 and parameters: {'alpha': 2.076074330099324, 'ties': 'efron'}. Best is trial 99 with value: 0.8654869897806009.[0m
[32m[I 2022-04-13 11:45:04,468][0m Trial 493 finished with value: 0.8643129825609158 and parameters: {'alpha': 2.2053190731367813, 'ties': 'efron'}. Best is trial 99 with value: 0.8654869897806009.[0m
[32m[I 2022-04-13 11:45:04,572][0m Trial 494 finished with value: 0.8590600131546348 and parameters: {'alpha': 0.30630071253540336, 'ties': 'breslow'}. Best is trial 99 with value: 0.8654869897806009.[0m
[32m[I 2022-04-13 11:45:04,664][0m Trial 495 finished with value: 0.8639833328806962 and parameters: {'alpha': 2.636790173996983, 'ties': 'breslow'}. Best is trial 99 with value: 0.8654869897806009.[0m
[32m[I 2022-04-13 11:45:04,794][0m Trial 496 finished with value: 0.8648486321634327 and parameters: {'alpha': 2.3777407262732377, 'ties': 'efron'}. Best is trial 99 with value: 0.8654869897806009.[0m
[32m[I 2022-04-13 11:45:05,000][0m Trial 497 finished with value: 0.8648486321634327 and parameters: {'alpha': 2.465588107163394, 'ties': 'efron'}. Best is trial 99 with value: 0.8654869897806009.[0m
[32m[I 2022-04-13 11:45:05,106][0m Trial 498 finished with value: 0.8643129825609158 and parameters: {'alpha': 2.1890424228250507, 'ties': 'efron'}. Best is trial 99 with value: 0.8654869897806009.[0m
[32m[I 2022-04-13 11:45:05,456][0m Trial 499 finished with value: 0.8654085943201592 and parameters: {'alpha': 2.0226692479320185, 'ties': 'efron'}. Best is trial 99 with value: 0.8654869897806009.[0m
[32m[I 2022-04-13 11:45:05,853][0m Trial 500 finished with value: 0.8639833328806962 and parameters: {'alpha': 2.5293885548216415, 'ties': 'breslow'}. Best is trial 99 with value: 0.8654869897806009.[0m
[32m[I 2022-04-13 11:45:06,216][0m Trial 501 finished with value: 0.8641835106491502 and parameters: {'alpha': 2.1479137658916945, 'ties': 'breslow'}. Best is trial 99 with value: 0.8654869897806009.[0m
[32m[I 2022-04-13 11:45:06,519][0m Trial 502 finished with value: 0.8648486321634327 and parameters: {'alpha': 2.3278833463932713, 'ties': 'efron'}. Best is trial 99 with value: 0.8654869897806009.[0m
[32m[I 2022-04-13 11:45:06,888][0m Trial 503 finished with value: 0.8643129825609158 and parameters: {'alpha': 2.2359263486061303, 'ties': 'efron'}. Best is trial 99 with value: 0.8654869897806009.[0m
[32m[I 2022-04-13 11:45:07,064][0m Trial 504 finished with value: 0.8648486321634327 and parameters: {'alpha': 2.4123668429208034, 'ties': 'breslow'}. Best is trial 99 with value: 0.8654869897806009.[0m
[32m[I 2022-04-13 11:45:07,262][0m Trial 505 finished with value: 0.8627574512975278 and parameters: {'alpha': 2.66081266567815, 'ties': 'breslow'}. Best is trial 99 with value: 0.8654869897806009.[0m
[32m[I 2022-04-13 11:45:07,430][0m Trial 506 finished with value: 0.8643129825609158 and parameters: {'alpha': 2.2802697413308235, 'ties': 'efron'}. Best is trial 99 with value: 0.8654869897806009.[0m
[32m[I 2022-04-13 11:45:07,562][0m Trial 507 finished with value: 0.8648218682663185 and parameters: {'alpha': 2.128263704106316, 'ties': 'efron'}. Best is trial 99 with value: 0.8654869897806009.[0m
[32m[I 2022-04-13 11:45:07,762][0m Trial 508 finished with value: 0.8648486321634327 and parameters: {'alpha': 2.4094177631458664, 'ties': 'efron'}. Best is trial 99 with value: 0.8654869897806009.[0m
[32m[I 2022-04-13 11:45:07,862][0m Trial 509 finished with value: 0.8643129825609158 and parameters: {'alpha': 2.2690351969255986, 'ties': 'efron'}. Best is trial 99 with value: 0.8654869897806009.[0m
[32m[I 2022-04-13 11:45:08,064][0m Trial 510 finished with value: 0.8654085943201592 and parameters: {'alpha': 1.9853833998684756, 'ties': 'efron'}. Best is trial 99 with value: 0.8654869897806009.[0m
[32m[I 2022-04-13 11:45:08,253][0m Trial 511 finished with value: 0.8654869897806009 and parameters: {'alpha': 2.2817105054208535, 'ties': 'efron'}. Best is trial 99 with value: 0.8654869897806009.[0m
[32m[I 2022-04-13 11:45:08,345][0m Trial 512 finished with value: 0.8643129825609158 and parameters: {'alpha': 2.2342479977164076, 'ties': 'breslow'}. Best is trial 99 with value: 0.8654869897806009.[0m
[32m[I 2022-04-13 11:45:08,483][0m Trial 513 finished with value: 0.8648486321634327 and parameters: {'alpha': 2.451633737427845, 'ties': 'efron'}. Best is trial 99 with value: 0.8654869897806009.[0m
[32m[I 2022-04-13 11:45:08,669][0m Trial 514 finished with value: 0.8648486321634327 and parameters: {'alpha': 2.365108353187595, 'ties': 'breslow'}. Best is trial 99 with value: 0.8654869897806009.[0m
[32m[I 2022-04-13 11:45:08,767][0m Trial 515 finished with value: 0.8639833328806962 and parameters: {'alpha': 2.5376106741616895, 'ties': 'breslow'}. Best is trial 99 with value: 0.8654869897806009.[0m
[32m[I 2022-04-13 11:45:08,943][0m Trial 516 finished with value: 0.8654869897806009 and parameters: {'alpha': 2.283830648474277, 'ties': 'efron'}. Best is trial 99 with value: 0.8654869897806009.[0m
[32m[I 2022-04-13 11:45:09,038][0m Trial 517 finished with value: 0.8648486321634327 and parameters: {'alpha': 2.440087025690305, 'ties': 'breslow'}. Best is trial 99 with value: 0.8654869897806009.[0m
[32m[I 2022-04-13 11:45:09,306][0m Trial 518 finished with value: 0.8654869897806009 and parameters: {'alpha': 2.334373319138845, 'ties': 'breslow'}. Best is trial 99 with value: 0.8654869897806009.[0m
[32m[I 2022-04-13 11:45:09,543][0m Trial 519 finished with value: 0.8641835106491502 and parameters: {'alpha': 2.1213222024880567, 'ties': 'breslow'}. Best is trial 99 with value: 0.8654869897806009.[0m
[32m[I 2022-04-13 11:45:09,768][0m Trial 520 finished with value: 0.8639833328806962 and parameters: {'alpha': 2.617854619214416, 'ties': 'breslow'}. Best is trial 99 with value: 0.8654869897806009.[0m
[32m[I 2022-04-13 11:45:10,036][0m Trial 521 finished with value: 0.8639833328806962 and parameters: {'alpha': 2.5379935376257787, 'ties': 'breslow'}. Best is trial 99 with value: 0.8654869897806009.[0m
[32m[I 2022-04-13 11:45:10,269][0m Trial 522 finished with value: 0.8648486321634327 and parameters: {'alpha': 2.4050109131358948, 'ties': 'breslow'}. Best is trial 99 with value: 0.8654869897806009.[0m
[32m[I 2022-04-13 11:45:10,493][0m Trial 523 finished with value: 0.8636746249437476 and parameters: {'alpha': 2.1825674612535355, 'ties': 'breslow'}. Best is trial 99 with value: 0.8654869897806009.[0m
[32m[I 2022-04-13 11:45:10,739][0m Trial 524 finished with value: 0.8654869897806009 and parameters: {'alpha': 2.3339719987162426, 'ties': 'breslow'}. Best is trial 99 with value: 0.8654869897806009.[0m
[32m[I 2022-04-13 11:45:11,099][0m Trial 525 finished with value: 0.8654085943201592 and parameters: {'alpha': 2.0628824282757314, 'ties': 'efron'}. Best is trial 99 with value: 0.8654869897806009.[0m
[32m[I 2022-04-13 11:45:11,375][0m Trial 526 finished with value: 0.8643129825609158 and parameters: {'alpha': 2.2143799988813453, 'ties': 'efron'}. Best is trial 99 with value: 0.8654869897806009.[0m
[32m[I 2022-04-13 11:45:11,691][0m Trial 527 finished with value: 0.8654869897806009 and parameters: {'alpha': 2.31752224474543, 'ties': 'breslow'}. Best is trial 99 with value: 0.8654869897806009.[0m
[32m[I 2022-04-13 11:45:12,111][0m Trial 528 finished with value: 0.860959442371129 and parameters: {'alpha': 1.1784440861027206, 'ties': 'breslow'}. Best is trial 99 with value: 0.8654869897806009.[0m
[32m[I 2022-04-13 11:45:12,447][0m Trial 529 finished with value: 0.8648486321634327 and parameters: {'alpha': 2.3785529992204655, 'ties': 'breslow'}. Best is trial 99 with value: 0.8654869897806009.[0m
[32m[I 2022-04-13 11:45:12,676][0m Trial 530 finished with value: 0.8628877211214527 and parameters: {'alpha': 2.779307363477003, 'ties': 'breslow'}. Best is trial 99 with value: 0.8654869897806009.[0m
[32m[I 2022-04-13 11:45:12,956][0m Trial 531 finished with value: 0.86398623966525 and parameters: {'alpha': 1.9026622393884283, 'ties': 'breslow'}. Best is trial 99 with value: 0.8654869897806009.[0m
[32m[I 2022-04-13 11:45:13,247][0m Trial 532 finished with value: 0.8654869897806009 and parameters: {'alpha': 2.3049848011204936, 'ties': 'breslow'}. Best is trial 99 with value: 0.8654869897806009.[0m
[32m[I 2022-04-13 11:45:13,714][0m Trial 533 finished with value: 0.8648218682663185 and parameters: {'alpha': 2.171030456605055, 'ties': 'efron'}. Best is trial 99 with value: 0.8654869897806009.[0m
[32m[I 2022-04-13 11:45:14,107][0m Trial 534 finished with value: 0.8648486321634327 and parameters: {'alpha': 2.4643581351153374, 'ties': 'breslow'}. Best is trial 99 with value: 0.8654869897806009.[0m
