[32m[I 2022-04-14 01:40:54,211][0m Trial 482 finished with value: -0.3539722499271923 and parameters: {'loss': 'squared', 'learning_rate': 0.00023796997188051724, 'n_estimators': 821, 'criterion': 'friedman_mse', 'min_samples_split': 4, 'min_samples_leaf': 3, 'min_weight_fraction_leaf': 0.026110838405124986, 'min_impurity_decrease': 0.34923199940489247, 'max_features': 0.8752543813074634, 'subsample': 0.3760363845173266, 'dropout_rate': 0.5043273756283081, 'ccp_alpha': 1.0706540494366574}. Best is trial 379 with value: 0.878361797817203.[0m
[32m[I 2022-04-14 01:42:46,043][0m Trial 483 finished with value: 0.65 and parameters: {'loss': 'coxph', 'learning_rate': 1.2276196491219909e-06, 'n_estimators': 893, 'criterion': 'absolute_error', 'min_samples_split': 4, 'min_samples_leaf': 2, 'min_weight_fraction_leaf': 0.03996751007627347, 'min_impurity_decrease': 0.5604275671704065, 'max_features': 0.8223996369109112, 'subsample': 0.8250260675232323, 'dropout_rate': 0.4739011817063677, 'ccp_alpha': 0.12642103433078433}. Best is trial 379 with value: 0.878361797817203.[0m
[32m[I 2022-04-14 01:43:13,850][0m Trial 484 finished with value: 0.8390625363348777 and parameters: {'loss': 'coxph', 'learning_rate': 2.48051734046524e-06, 'n_estimators': 470, 'criterion': 'friedman_mse', 'min_samples_split': 5, 'min_samples_leaf': 4, 'min_weight_fraction_leaf': 0.3065172841559146, 'min_impurity_decrease': 0.619927191790054, 'max_features': 0.8476456890325466, 'subsample': 0.8046425233498373, 'dropout_rate': 0.5359821107142732, 'ccp_alpha': 0.0010097220240039423}. Best is trial 379 with value: 0.878361797817203.[0m
[32m[I 2022-04-14 01:44:17,036][0m Trial 485 finished with value: 0.8739828298055901 and parameters: {'loss': 'coxph', 'learning_rate': 0.0004343654740466127, 'n_estimators': 634, 'criterion': 'friedman_mse', 'min_samples_split': 4, 'min_samples_leaf': 1, 'min_weight_fraction_leaf': 0.021536957811676583, 'min_impurity_decrease': 0.38700090789195374, 'max_features': 0.8923571238011718, 'subsample': 0.8663511260749337, 'dropout_rate': 0.4339333910708678, 'ccp_alpha': 0.10138573028528176}. Best is trial 379 with value: 0.878361797817203.[0m
[32m[I 2022-04-14 01:45:18,719][0m Trial 486 finished with value: 0.6580440744419354 and parameters: {'loss': 'coxph', 'learning_rate': 0.00035143451698363756, 'n_estimators': 676, 'criterion': 'friedman_mse', 'min_samples_split': 4, 'min_samples_leaf': 1, 'min_weight_fraction_leaf': 0.009132935818375282, 'min_impurity_decrease': 0.3784972703749271, 'max_features': 0.8929709724304394, 'subsample': 0.8930173987634069, 'dropout_rate': 0.43461728700457747, 'ccp_alpha': 0.3079902200724216}. Best is trial 379 with value: 0.878361797817203.[0m
[32m[I 2022-04-14 01:46:26,916][0m Trial 487 finished with value: 0.8497358670097952 and parameters: {'loss': 'coxph', 'learning_rate': 0.00047232751285108525, 'n_estimators': 646, 'criterion': 'friedman_mse', 'min_samples_split': 4, 'min_samples_leaf': 3, 'min_weight_fraction_leaf': 0.018657076432581972, 'min_impurity_decrease': 0.39048036619527043, 'max_features': 0.9010557103799354, 'subsample': 0.8935524782140097, 'dropout_rate': 0.42062688455550185, 'ccp_alpha': 0.1629415792115367}. Best is trial 379 with value: 0.878361797817203.[0m
[32m[I 2022-04-14 01:47:16,663][0m Trial 488 finished with value: 0.867505450271403 and parameters: {'loss': 'coxph', 'learning_rate': 0.0004899724400036334, 'n_estimators': 656, 'criterion': 'friedman_mse', 'min_samples_split': 4, 'min_samples_leaf': 1, 'min_weight_fraction_leaf': 0.023222711901979463, 'min_impurity_decrease': 0.5882950541415644, 'max_features': 0.8724142826136378, 'subsample': 0.8756676019254538, 'dropout_rate': 0.6480451111377112, 'ccp_alpha': 0.09944649347033442}. Best is trial 379 with value: 0.878361797817203.[0m
[32m[I 2022-04-14 01:48:03,715][0m Trial 489 finished with value: 0.8689159042631317 and parameters: {'loss': 'coxph', 'learning_rate': 1.6876386302249416e-06, 'n_estimators': 577, 'criterion': 'friedman_mse', 'min_samples_split': 4, 'min_samples_leaf': 2, 'min_weight_fraction_leaf': 0.011149000381005034, 'min_impurity_decrease': 0.34370946979302175, 'max_features': 0.8858254031524471, 'subsample': 0.8644752965265812, 'dropout_rate': 0.4400357180948971, 'ccp_alpha': 0.09705448023128213}. Best is trial 379 with value: 0.878361797817203.[0m
[32m[I 2022-04-14 01:49:00,126][0m Trial 490 finished with value: 0.65 and parameters: {'loss': 'coxph', 'learning_rate': 0.000254655716296603, 'n_estimators': 618, 'criterion': 'squared_error', 'min_samples_split': 4, 'min_samples_leaf': 2, 'min_weight_fraction_leaf': 0.033241786011932596, 'min_impurity_decrease': 0.3557502032997808, 'max_features': 0.866914289807936, 'subsample': 0.8542427147523752, 'dropout_rate': 0.40054690055057707, 'ccp_alpha': 0.24814071704337107}. Best is trial 379 with value: 0.878361797817203.[0m
[32m[I 2022-04-14 01:49:04,894][0m Trial 491 finished with value: 0.8110747310412678 and parameters: {'loss': 'coxph', 'learning_rate': 0.0005493329565025085, 'n_estimators': 185, 'criterion': 'friedman_mse', 'min_samples_split': 4, 'min_samples_leaf': 1, 'min_weight_fraction_leaf': 0.47654230857936913, 'min_impurity_decrease': 0.6696374431009855, 'max_features': 0.9133567346073124, 'subsample': 0.7708063285309328, 'dropout_rate': 0.4581751379186962, 'ccp_alpha': 0.10035138308260147}. Best is trial 379 with value: 0.878361797817203.[0m
[32m[I 2022-04-14 01:49:35,629][0m Trial 492 finished with value: 0.8531482259501436 and parameters: {'loss': 'coxph', 'learning_rate': 0.000390119543915956, 'n_estimators': 546, 'criterion': 'friedman_mse', 'min_samples_split': 3, 'min_samples_leaf': 1, 'min_weight_fraction_leaf': 0.022042451969923882, 'min_impurity_decrease': 0.4285524318020421, 'max_features': 0.8917977338077834, 'subsample': 0.7881264412355078, 'dropout_rate': 0.6964869110216156, 'ccp_alpha': 0.17455133449184282}. Best is trial 379 with value: 0.878361797817203.[0m
[32m[I 2022-04-14 01:50:37,610][0m Trial 493 finished with value: 0.65 and parameters: {'loss': 'coxph', 'learning_rate': 0.0006709824863284546, 'n_estimators': 631, 'criterion': 'friedman_mse', 'min_samples_split': 4, 'min_samples_leaf': 3, 'min_weight_fraction_leaf': 0.009437810177619339, 'min_impurity_decrease': 0.36534173048185914, 'max_features': 0.6110702970106199, 'subsample': 0.8263575739232006, 'dropout_rate': 0.42057725715484595, 'ccp_alpha': 3.2005765361934277}. Best is trial 379 with value: 0.878361797817203.[0m
[32m[I 2022-04-14 01:51:05,068][0m Trial 494 finished with value: 0.65 and parameters: {'loss': 'coxph', 'learning_rate': 1.2549174521067044e-06, 'n_estimators': 433, 'criterion': 'friedman_mse', 'min_samples_split': 4, 'min_samples_leaf': 3, 'min_weight_fraction_leaf': 0.030509509388419075, 'min_impurity_decrease': 0.3912849881761294, 'max_features': 0.8577583496718535, 'subsample': 0.7753158646056186, 'dropout_rate': 0.45490629117156, 'ccp_alpha': 0.3797349869983943}. Best is trial 379 with value: 0.878361797817203.[0m
[32m[I 2022-04-14 01:52:54,700][0m Trial 495 finished with value: 0.8740353696913175 and parameters: {'loss': 'coxph', 'learning_rate': 0.00029785913535181557, 'n_estimators': 854, 'criterion': 'friedman_mse', 'min_samples_split': 3, 'min_samples_leaf': 3, 'min_weight_fraction_leaf': 0.054549985357094544, 'min_impurity_decrease': 0.5271043480551869, 'max_features': 0.8070679891403469, 'subsample': 0.7345605872726229, 'dropout_rate': 0.40160416023840434, 'ccp_alpha': 0.0010404108513518032}. Best is trial 379 with value: 0.878361797817203.[0m
[32m[I 2022-04-14 01:54:09,629][0m Trial 496 finished with value: 0.8740916312393283 and parameters: {'loss': 'coxph', 'learning_rate': 1.7131761571601244e-06, 'n_estimators': 865, 'criterion': 'friedman_mse', 'min_samples_split': 3, 'min_samples_leaf': 3, 'min_weight_fraction_leaf': 0.06294051506806946, 'min_impurity_decrease': 0.5352727904560723, 'max_features': 0.7794126121567049, 'subsample': 0.7278674657877156, 'dropout_rate': 0.5781667474458113, 'ccp_alpha': 0.0011549394439664754}. Best is trial 379 with value: 0.878361797817203.[0m
[32m[I 2022-04-14 01:55:28,662][0m Trial 497 finished with value: 0.8622542774105998 and parameters: {'loss': 'coxph', 'learning_rate': 1.371950547970969e-06, 'n_estimators': 891, 'criterion': 'friedman_mse', 'min_samples_split': 3, 'min_samples_leaf': 3, 'min_weight_fraction_leaf': 0.04660718930027001, 'min_impurity_decrease': 0.5482084147431723, 'max_features': 0.20277573860328402, 'subsample': 0.7382932871001188, 'dropout_rate': 0.5748411768918285, 'ccp_alpha': 0.0013358667255805846}. Best is trial 379 with value: 0.878361797817203.[0m
[32m[I 2022-04-14 01:56:32,363][0m Trial 498 finished with value: 0.65 and parameters: {'loss': 'coxph', 'learning_rate': 1.310228804153623e-06, 'n_estimators': 850, 'criterion': 'friedman_mse', 'min_samples_split': 3, 'min_samples_leaf': 3, 'min_weight_fraction_leaf': 0.06811757171666728, 'min_impurity_decrease': 0.5771160652902151, 'max_features': 0.7875848127998912, 'subsample': 0.7570903356575086, 'dropout_rate': 0.600819296028682, 'ccp_alpha': 1.8954088867193484}. Best is trial 379 with value: 0.878361797817203.[0m
[32m[I 2022-04-14 01:57:52,051][0m Trial 499 finished with value: 0.8411636605019375 and parameters: {'loss': 'coxph', 'learning_rate': 1.0038479083249157e-06, 'n_estimators': 890, 'criterion': 'friedman_mse', 'min_samples_split': 3, 'min_samples_leaf': 3, 'min_weight_fraction_leaf': 0.058321236672814025, 'min_impurity_decrease': 0.5185963889173278, 'max_features': 0.8199143527289863, 'subsample': 0.7271642961639949, 'dropout_rate': 0.5892837350075939, 'ccp_alpha': 0.23610880158320868}. Best is trial 379 with value: 0.878361797817203.[0m
[32m[I 2022-04-14 01:58:59,530][0m Trial 500 finished with value: -0.37230168199002456 and parameters: {'loss': 'squared', 'learning_rate': 2.9850444052007335e-06, 'n_estimators': 825, 'criterion': 'friedman_mse', 'min_samples_split': 3, 'min_samples_leaf': 3, 'min_weight_fraction_leaf': 0.06300477609331954, 'min_impurity_decrease': 0.5606946598136524, 'max_features': 0.7748824549570558, 'subsample': 0.7917499892056933, 'dropout_rate': 0.6212443773370183, 'ccp_alpha': 0.09708730890387957}. Best is trial 379 with value: 0.878361797817203.[0m
[32m[I 2022-04-14 02:00:03,236][0m Trial 501 finished with value: 0.849177834672003 and parameters: {'loss': 'coxph', 'learning_rate': 1.7570333782736389e-06, 'n_estimators': 805, 'criterion': 'friedman_mse', 'min_samples_split': 3, 'min_samples_leaf': 3, 'min_weight_fraction_leaf': 0.05437916783045464, 'min_impurity_decrease': 0.4975753563434213, 'max_features': 0.7991107023898449, 'subsample': 0.7615478551739181, 'dropout_rate': 0.6379786799787245, 'ccp_alpha': 0.17035349484933768}. Best is trial 379 with value: 0.878361797817203.[0m
[32m[I 2022-04-14 02:01:33,043][0m Trial 502 finished with value: 0.8661963531109163 and parameters: {'loss': 'coxph', 'learning_rate': 1.339522598056522e-06, 'n_estimators': 882, 'criterion': 'friedman_mse', 'min_samples_split': 3, 'min_samples_leaf': 3, 'min_weight_fraction_leaf': 0.06926578961406628, 'min_impurity_decrease': 0.5354470611974386, 'max_features': 0.8488179502838235, 'subsample': 0.8009860548561338, 'dropout_rate': 0.544196332952652, 'ccp_alpha': 0.10553197659512159}. Best is trial 379 with value: 0.878361797817203.[0m
[32m[I 2022-04-14 02:02:53,591][0m Trial 503 finished with value: 0.8745417700795924 and parameters: {'loss': 'coxph', 'learning_rate': 1.8528175314318697e-06, 'n_estimators': 842, 'criterion': 'friedman_mse', 'min_samples_split': 3, 'min_samples_leaf': 3, 'min_weight_fraction_leaf': 0.03801937179187627, 'min_impurity_decrease': 0.6313078732879257, 'max_features': 0.8269489169473929, 'subsample': 0.7763911103614203, 'dropout_rate': 0.5560330569743774, 'ccp_alpha': 0.0010132807998140714}. Best is trial 379 with value: 0.878361797817203.[0m
[32m[I 2022-04-14 02:04:05,257][0m Trial 504 finished with value: 0.7934084775442232 and parameters: {'loss': 'coxph', 'learning_rate': 1.7388902407485037e-06, 'n_estimators': 785, 'criterion': 'friedman_mse', 'min_samples_split': 3, 'min_samples_leaf': 3, 'min_weight_fraction_leaf': 0.03361970432976031, 'min_impurity_decrease': 0.6268744221734199, 'max_features': 0.8350200636909553, 'subsample': 0.7790865275124865, 'dropout_rate': 0.5775565539560857, 'ccp_alpha': 0.2792199179600735}. Best is trial 379 with value: 0.878361797817203.[0m
[32m[I 2022-04-14 02:05:26,492][0m Trial 505 finished with value: 0.65 and parameters: {'loss': 'coxph', 'learning_rate': 2.134422005759159e-06, 'n_estimators': 860, 'criterion': 'absolute_error', 'min_samples_split': 3, 'min_samples_leaf': 3, 'min_weight_fraction_leaf': 0.05003009628193124, 'min_impurity_decrease': 0.6397423646863312, 'max_features': 0.8107584450354421, 'subsample': 0.8206325565292323, 'dropout_rate': 0.5752227119420177, 'ccp_alpha': 0.0011741319136347635}. Best is trial 379 with value: 0.878361797817203.[0m
[32m[I 2022-04-14 02:07:02,027][0m Trial 506 finished with value: 0.8506185769765204 and parameters: {'loss': 'coxph', 'learning_rate': 1.7171634005905711e-06, 'n_estimators': 906, 'criterion': 'friedman_mse', 'min_samples_split': 3, 'min_samples_leaf': 3, 'min_weight_fraction_leaf': 0.06562246505837474, 'min_impurity_decrease': 0.6767457689577173, 'max_features': 0.8477683462942871, 'subsample': 0.7947542231785886, 'dropout_rate': 0.5576723451488298, 'ccp_alpha': 0.17936858300408404}. Best is trial 379 with value: 0.878361797817203.[0m
[32m[I 2022-04-14 02:08:22,391][0m Trial 507 finished with value: 0.8676985727197574 and parameters: {'loss': 'coxph', 'learning_rate': 2.293451162323517e-06, 'n_estimators': 811, 'criterion': 'friedman_mse', 'min_samples_split': 3, 'min_samples_leaf': 3, 'min_weight_fraction_leaf': 0.03791758521475401, 'min_impurity_decrease': 0.608017787368863, 'max_features': 0.7679478765610929, 'subsample': 0.7361476815399611, 'dropout_rate': 0.5353161448980348, 'ccp_alpha': 0.09648478285262435}. Best is trial 379 with value: 0.878361797817203.[0m
[32m[I 2022-04-14 02:09:25,923][0m Trial 508 finished with value: 0.8698728910394495 and parameters: {'loss': 'coxph', 'learning_rate': 3.4136687213767242e-06, 'n_estimators': 757, 'criterion': 'friedman_mse', 'min_samples_split': 3, 'min_samples_leaf': 3, 'min_weight_fraction_leaf': 0.026781951086313645, 'min_impurity_decrease': 0.5852724426939656, 'max_features': 0.8274272907428301, 'subsample': 0.7723734475175359, 'dropout_rate': 0.6083313560480877, 'ccp_alpha': 0.08773451395810548}. Best is trial 379 with value: 0.878361797817203.[0m
[32m[I 2022-04-14 02:10:45,392][0m Trial 509 finished with value: 0.8123234667227133 and parameters: {'loss': 'coxph', 'learning_rate': 1.8432346490882191e-06, 'n_estimators': 829, 'criterion': 'friedman_mse', 'min_samples_split': 3, 'min_samples_leaf': 3, 'min_weight_fraction_leaf': 0.008296112665488497, 'min_impurity_decrease': 0.666064916885372, 'max_features': 0.8627205842801465, 'subsample': 0.8361775494146781, 'dropout_rate': 0.5554140850159495, 'ccp_alpha': 0.23512318728873477}. Best is trial 379 with value: 0.878361797817203.[0m
[32m[I 2022-04-14 02:10:55,757][0m Trial 510 finished with value: 0.8675173670725236 and parameters: {'loss': 'coxph', 'learning_rate': 2.492968131253585e-06, 'n_estimators': 253, 'criterion': 'friedman_mse', 'min_samples_split': 3, 'min_samples_leaf': 3, 'min_weight_fraction_leaf': 0.05617981095137506, 'min_impurity_decrease': 0.6535278361023129, 'max_features': 0.7994554375622476, 'subsample': 0.8070459074561969, 'dropout_rate': 0.5614749217447113, 'ccp_alpha': 0.09516443621075021}. Best is trial 379 with value: 0.878361797817203.[0m
[32m[I 2022-04-14 02:12:42,914][0m Trial 511 finished with value: 0.65 and parameters: {'loss': 'coxph', 'learning_rate': 1.6426916247035732e-06, 'n_estimators': 904, 'criterion': 'friedman_mse', 'min_samples_split': 3, 'min_samples_leaf': 3, 'min_weight_fraction_leaf': 0.016133302997129114, 'min_impurity_decrease': 0.6251673561161704, 'max_features': 0.8679866641670714, 'subsample': 0.756954569160318, 'dropout_rate': 0.5268132934953591, 'ccp_alpha': 0.45430966664115857}. Best is trial 379 with value: 0.878361797817203.[0m
[32m[I 2022-04-14 02:14:09,960][0m Trial 512 finished with value: 0.65 and parameters: {'loss': 'coxph', 'learning_rate': 1.350317059458083e-06, 'n_estimators': 784, 'criterion': 'squared_error', 'min_samples_split': 6, 'min_samples_leaf': 3, 'min_weight_fraction_leaf': 0.04463470435834378, 'min_impurity_decrease': 0.5675911065403715, 'max_features': 0.12314382162254811, 'subsample': 0.7838052833693473, 'dropout_rate': 0.5085459129473006, 'ccp_alpha': 4.000299097940894}. Best is trial 379 with value: 0.878361797817203.[0m
[32m[I 2022-04-14 02:15:09,702][0m Trial 513 finished with value: 0.8447059923759201 and parameters: {'loss': 'coxph', 'learning_rate': 1.0607393089316479e-06, 'n_estimators': 722, 'criterion': 'friedman_mse', 'min_samples_split': 3, 'min_samples_leaf': 3, 'min_weight_fraction_leaf': 0.03495513349880755, 'min_impurity_decrease': 0.7007869896344101, 'max_features': 0.8343423753565706, 'subsample': 0.8120799482789671, 'dropout_rate': 0.5146070958977386, 'ccp_alpha': 0.19194441110720126}. Best is trial 379 with value: 0.878361797817203.[0m
[32m[I 2022-04-14 02:16:26,397][0m Trial 514 finished with value: 0.8736016969360086 and parameters: {'loss': 'coxph', 'learning_rate': 1.2461220228737019e-06, 'n_estimators': 871, 'criterion': 'friedman_mse', 'min_samples_split': 4, 'min_samples_leaf': 2, 'min_weight_fraction_leaf': 0.00212011985811769, 'min_impurity_decrease': 0.5442557100456129, 'max_features': 0.849417882263735, 'subsample': 0.8419057453866723, 'dropout_rate': 0.5903432575182258, 'ccp_alpha': 0.003912408335738072}. Best is trial 379 with value: 0.878361797817203.[0m
[32m[I 2022-04-14 02:17:37,425][0m Trial 515 finished with value: 0.6524506958451449 and parameters: {'loss': 'coxph', 'learning_rate': 1.6485979463478923e-06, 'n_estimators': 821, 'criterion': 'friedman_mse', 'min_samples_split': 3, 'min_samples_leaf': 3, 'min_weight_fraction_leaf': 0.025246908422202397, 'min_impurity_decrease': 0.611211212548597, 'max_features': 0.8132554536807566, 'subsample': 0.7251472432155055, 'dropout_rate': 0.5481763021014726, 'ccp_alpha': 0.3407175817032296}. Best is trial 379 with value: 0.878361797817203.[0m
[32m[I 2022-04-14 02:17:51,528][0m Trial 516 finished with value: 0.8732248572954011 and parameters: {'loss': 'coxph', 'learning_rate': 0.0010493898710565149, 'n_estimators': 341, 'criterion': 'friedman_mse', 'min_samples_split': 5, 'min_samples_leaf': 5, 'min_weight_fraction_leaf': 0.0488926035595804, 'min_impurity_decrease': 0.46666813577607663, 'max_features': 0.8702891295162933, 'subsample': 0.7501235264376114, 'dropout_rate': 0.5214045159957371, 'ccp_alpha': 0.0021626951234173467}. Best is trial 379 with value: 0.878361797817203.[0m
[32m[I 2022-04-14 02:18:59,089][0m Trial 517 finished with value: 0.8560506679836278 and parameters: {'loss': 'coxph', 'learning_rate': 3.516609362160529e-05, 'n_estimators': 779, 'criterion': 'friedman_mse', 'min_samples_split': 4, 'min_samples_leaf': 3, 'min_weight_fraction_leaf': 0.01761655044469647, 'min_impurity_decrease': 0.6445617915871371, 'max_features': 0.7841980436924827, 'subsample': 0.7963628977263948, 'dropout_rate': 0.48845077860808134, 'ccp_alpha': 0.16856369042463554}. Best is trial 379 with value: 0.878361797817203.[0m
[32m[I 2022-04-14 02:20:31,616][0m Trial 518 finished with value: 0.8406576753457282 and parameters: {'loss': 'coxph', 'learning_rate': 1.0095086396948386e-06, 'n_estimators': 914, 'criterion': 'friedman_mse', 'min_samples_split': 3, 'min_samples_leaf': 3, 'min_weight_fraction_leaf': 0.395352081764414, 'min_impurity_decrease': 0.4984118548710866, 'max_features': 0.828112280241699, 'subsample': 0.7232261542853652, 'dropout_rate': 0.49644513883644337, 'ccp_alpha': 0.09938931075352417}. Best is trial 379 with value: 0.878361797817203.[0m
[32m[I 2022-04-14 02:21:56,407][0m Trial 519 finished with value: 0.7928144402893921 and parameters: {'loss': 'coxph', 'learning_rate': 2.085849766572888e-06, 'n_estimators': 853, 'criterion': 'friedman_mse', 'min_samples_split': 4, 'min_samples_leaf': 4, 'min_weight_fraction_leaf': 0.03128183933106325, 'min_impurity_decrease': 0.5300388482669303, 'max_features': 0.8847258789853543, 'subsample': 0.7717338906004588, 'dropout_rate': 0.4778521207228414, 'ccp_alpha': 0.2686368325497644}. Best is trial 379 with value: 0.878361797817203.[0m
[32m[I 2022-04-14 02:22:51,984][0m Trial 520 finished with value: 0.8757187800940083 and parameters: {'loss': 'coxph', 'learning_rate': 0.0014772771942107418, 'n_estimators': 737, 'criterion': 'friedman_mse', 'min_samples_split': 4, 'min_samples_leaf': 5, 'min_weight_fraction_leaf': 0.06789588588054278, 'min_impurity_decrease': 0.5936206156242194, 'max_features': 0.9123695177277951, 'subsample': 0.8229033041630972, 'dropout_rate': 0.532929020318122, 'ccp_alpha': 0.0018634743231793014}. Best is trial 379 with value: 0.878361797817203.[0m
[32m[I 2022-04-14 02:23:42,972][0m Trial 521 finished with value: -0.370829749467098 and parameters: {'loss': 'squared', 'learning_rate': 0.0014421248920540523, 'n_estimators': 709, 'criterion': 'friedman_mse', 'min_samples_split': 4, 'min_samples_leaf': 5, 'min_weight_fraction_leaf': 0.016284882014976666, 'min_impurity_decrease': 0.582068019755658, 'max_features': 0.9164929477664314, 'subsample': 0.8192315775649032, 'dropout_rate': 0.5082940551228532, 'ccp_alpha': 0.09857640048244251}. Best is trial 379 with value: 0.878361797817203.[0m
