[32m[I 2022-04-13 15:28:34,526][0m Trial 162 finished with value: 0.8639320594051405 and parameters: {'loss': 'coxph', 'learning_rate': 0.0004759146547045906, 'n_estimators': 682, 'criterion': 'friedman_mse', 'min_samples_split': 2, 'min_samples_leaf': 7, 'min_weight_fraction_leaf': 0.2160202293432449, 'min_impurity_decrease': 0.03625449946783398, 'max_features': 0.7845790298222239, 'subsample': 0.7930638831393296, 'dropout_rate': 0.023827238587678212, 'ccp_alpha': 0.11303610950299262}. Best is trial 161 with value: 0.8665031184376385.[0m
[32m[I 2022-04-13 15:30:23,186][0m Trial 163 finished with value: 0.8579989494096554 and parameters: {'loss': 'coxph', 'learning_rate': 0.0004607349877473689, 'n_estimators': 672, 'criterion': 'friedman_mse', 'min_samples_split': 2, 'min_samples_leaf': 7, 'min_weight_fraction_leaf': 0.2182014403767291, 'min_impurity_decrease': 0.0021698333964865757, 'max_features': 0.7752321639875246, 'subsample': 0.7943598155597518, 'dropout_rate': 0.019601216186153778, 'ccp_alpha': 0.12337480023957102}. Best is trial 161 with value: 0.8665031184376385.[0m
[32m[I 2022-04-13 15:32:18,516][0m Trial 164 finished with value: 0.793295902254885 and parameters: {'loss': 'coxph', 'learning_rate': 0.00041984401906168035, 'n_estimators': 675, 'criterion': 'friedman_mse', 'min_samples_split': 2, 'min_samples_leaf': 7, 'min_weight_fraction_leaf': 0.19232079501694985, 'min_impurity_decrease': 0.0034189887938756067, 'max_features': 0.7794438031691087, 'subsample': 0.7966293388705842, 'dropout_rate': 0.02117993376413562, 'ccp_alpha': 0.27247700771994665}. Best is trial 161 with value: 0.8665031184376385.[0m
[32m[I 2022-04-13 15:33:47,804][0m Trial 165 finished with value: 0.65 and parameters: {'loss': 'coxph', 'learning_rate': 0.0004973942725871692, 'n_estimators': 604, 'criterion': 'friedman_mse', 'min_samples_split': 2, 'min_samples_leaf': 7, 'min_weight_fraction_leaf': 0.20938563001735105, 'min_impurity_decrease': 0.034268606288050805, 'max_features': 0.8317292836460618, 'subsample': 0.8328632943652976, 'dropout_rate': 0.06213919778655816, 'ccp_alpha': 0.5022473375112906}. Best is trial 161 with value: 0.8665031184376385.[0m
[32m[I 2022-04-13 15:34:58,961][0m Trial 166 finished with value: 0.8610248620513896 and parameters: {'loss': 'coxph', 'learning_rate': 0.0002738366917486076, 'n_estimators': 549, 'criterion': 'friedman_mse', 'min_samples_split': 2, 'min_samples_leaf': 7, 'min_weight_fraction_leaf': 0.18297584008203976, 'min_impurity_decrease': 0.0022190221315097616, 'max_features': 0.8393946609746843, 'subsample': 0.7697358178939835, 'dropout_rate': 0.01629158939034963, 'ccp_alpha': 0.12909329758121454}. Best is trial 161 with value: 0.8665031184376385.[0m
[32m[I 2022-04-13 15:36:15,151][0m Trial 167 finished with value: 0.65 and parameters: {'loss': 'coxph', 'learning_rate': 0.00027341308447186713, 'n_estimators': 538, 'criterion': 'friedman_mse', 'min_samples_split': 2, 'min_samples_leaf': 6, 'min_weight_fraction_leaf': 0.18291765026290302, 'min_impurity_decrease': 0.06360242005238284, 'max_features': 0.8739903054185276, 'subsample': 0.7717036533690501, 'dropout_rate': 0.09888002619425695, 'ccp_alpha': 0.41949067542579777}. Best is trial 161 with value: 0.8665031184376385.[0m
[32m[I 2022-04-13 15:38:21,158][0m Trial 168 finished with value: 0.8470352224084474 and parameters: {'loss': 'coxph', 'learning_rate': 0.0006258723537953078, 'n_estimators': 735, 'criterion': 'friedman_mse', 'min_samples_split': 2, 'min_samples_leaf': 7, 'min_weight_fraction_leaf': 0.14178490161326043, 'min_impurity_decrease': 0.03717216495286228, 'max_features': 0.8418627796256293, 'subsample': 0.7686154572248257, 'dropout_rate': 0.035977296812886986, 'ccp_alpha': 0.21190680874665146}. Best is trial 161 with value: 0.8665031184376385.[0m
[32m[I 2022-04-13 15:39:36,782][0m Trial 169 finished with value: 0.6576302970240425 and parameters: {'loss': 'coxph', 'learning_rate': 0.004418887674622294, 'n_estimators': 574, 'criterion': 'friedman_mse', 'min_samples_split': 2, 'min_samples_leaf': 7, 'min_weight_fraction_leaf': 0.1637905610113824, 'min_impurity_decrease': 0.03307830685790859, 'max_features': 0.7915455516571438, 'subsample': 0.7283368398909177, 'dropout_rate': 0.056496149311916335, 'ccp_alpha': 0.32613864893162503}. Best is trial 161 with value: 0.8665031184376385.[0m
[32m[I 2022-04-13 15:42:00,077][0m Trial 170 finished with value: 0.863101021380487 and parameters: {'loss': 'coxph', 'learning_rate': 0.0032557405825949137, 'n_estimators': 792, 'criterion': 'friedman_mse', 'min_samples_split': 2, 'min_samples_leaf': 7, 'min_weight_fraction_leaf': 0.19137522272488242, 'min_impurity_decrease': 0.0011523394010048396, 'max_features': 0.8400486613535497, 'subsample': 0.8187012456481055, 'dropout_rate': 0.0010038074400894846, 'ccp_alpha': 0.12204982465760254}. Best is trial 161 with value: 0.8665031184376385.[0m
[32m[I 2022-04-13 15:44:33,708][0m Trial 171 finished with value: 0.8584003061364159 and parameters: {'loss': 'coxph', 'learning_rate': 0.003115781588203361, 'n_estimators': 793, 'criterion': 'friedman_mse', 'min_samples_split': 2, 'min_samples_leaf': 7, 'min_weight_fraction_leaf': 0.18915376075329704, 'min_impurity_decrease': 0.0012076579265488559, 'max_features': 0.836285522398673, 'subsample': 0.8104388827291132, 'dropout_rate': 0.0035152261870586288, 'ccp_alpha': 0.12402342087433334}. Best is trial 161 with value: 0.8665031184376385.[0m
[32m[I 2022-04-13 15:47:00,616][0m Trial 172 finished with value: 0.8232808499623522 and parameters: {'loss': 'coxph', 'learning_rate': 0.005236383399870331, 'n_estimators': 769, 'criterion': 'friedman_mse', 'min_samples_split': 2, 'min_samples_leaf': 7, 'min_weight_fraction_leaf': 0.18886389431584472, 'min_impurity_decrease': 0.004090612260379972, 'max_features': 0.8366864962006713, 'subsample': 0.8220799206768209, 'dropout_rate': 0.0006071206167054637, 'ccp_alpha': 0.22578982089443023}. Best is trial 161 with value: 0.8665031184376385.[0m
[32m[I 2022-04-13 15:49:32,324][0m Trial 173 finished with value: 0.8658148388234732 and parameters: {'loss': 'coxph', 'learning_rate': 0.003720780045545552, 'n_estimators': 789, 'criterion': 'friedman_mse', 'min_samples_split': 2, 'min_samples_leaf': 7, 'min_weight_fraction_leaf': 0.1959056800840814, 'min_impurity_decrease': 0.0011798947826537035, 'max_features': 0.7673776694648895, 'subsample': 0.7496289012625426, 'dropout_rate': 0.017988400362586435, 'ccp_alpha': 0.10694789092231541}. Best is trial 161 with value: 0.8665031184376385.[0m
[32m[I 2022-04-13 15:51:35,066][0m Trial 174 finished with value: 0.65 and parameters: {'loss': 'coxph', 'learning_rate': 0.0034552960388795437, 'n_estimators': 731, 'criterion': 'friedman_mse', 'min_samples_split': 2, 'min_samples_leaf': 7, 'min_weight_fraction_leaf': 0.20869535903721936, 'min_impurity_decrease': 0.027056103674880226, 'max_features': 0.761276066319733, 'subsample': 0.7538395852464849, 'dropout_rate': 0.0475036875224068, 'ccp_alpha': 0.36462452946445667}. Best is trial 161 with value: 0.8665031184376385.[0m
[32m[I 2022-04-13 15:53:25,415][0m Trial 175 finished with value: 0.8606578708447034 and parameters: {'loss': 'coxph', 'learning_rate': 0.0003707035511667038, 'n_estimators': 647, 'criterion': 'friedman_mse', 'min_samples_split': 2, 'min_samples_leaf': 6, 'min_weight_fraction_leaf': 0.19974298066514445, 'min_impurity_decrease': 0.031369768887517135, 'max_features': 0.7917267283304523, 'subsample': 0.7376623828857682, 'dropout_rate': 0.02104055113219766, 'ccp_alpha': 0.10786325717623724}. Best is trial 161 with value: 0.8665031184376385.[0m
[32m[I 2022-04-13 15:55:06,850][0m Trial 176 finished with value: 0.8410304691793338 and parameters: {'loss': 'coxph', 'learning_rate': 0.0003475101729121519, 'n_estimators': 652, 'criterion': 'friedman_mse', 'min_samples_split': 2, 'min_samples_leaf': 6, 'min_weight_fraction_leaf': 0.21317305450303642, 'min_impurity_decrease': 0.052628086996595616, 'max_features': 0.7871811571070945, 'subsample': 0.7236732615333636, 'dropout_rate': 0.01878752563843226, 'ccp_alpha': 0.22475402945748696}. Best is trial 161 with value: 0.8665031184376385.[0m
[32m[I 2022-04-13 15:56:17,747][0m Trial 177 finished with value: 0.6870217933187075 and parameters: {'loss': 'coxph', 'learning_rate': 0.0005502368979303612, 'n_estimators': 570, 'criterion': 'friedman_mse', 'min_samples_split': 2, 'min_samples_leaf': 6, 'min_weight_fraction_leaf': 0.17323633507855357, 'min_impurity_decrease': 0.029855943587362835, 'max_features': 0.7503334643521817, 'subsample': 0.7774463506364024, 'dropout_rate': 0.021271043159391823, 'ccp_alpha': 0.2962969129134647}. Best is trial 161 with value: 0.8665031184376385.[0m
[32m[I 2022-04-13 15:58:12,488][0m Trial 178 finished with value: 0.8523537542837285 and parameters: {'loss': 'coxph', 'learning_rate': 0.00035579916438551856, 'n_estimators': 685, 'criterion': 'friedman_mse', 'min_samples_split': 2, 'min_samples_leaf': 7, 'min_weight_fraction_leaf': 0.1960076321465616, 'min_impurity_decrease': 0.0880060782933208, 'max_features': 0.7911475778794707, 'subsample': 0.8357558884873127, 'dropout_rate': 0.05130876340434573, 'ccp_alpha': 0.12903646738472266}. Best is trial 161 with value: 0.8665031184376385.[0m
[32m[I 2022-04-13 15:59:39,921][0m Trial 179 finished with value: 0.65 and parameters: {'loss': 'coxph', 'learning_rate': 0.0002734555137171532, 'n_estimators': 625, 'criterion': 'friedman_mse', 'min_samples_split': 2, 'min_samples_leaf': 7, 'min_weight_fraction_leaf': 0.21975652120113243, 'min_impurity_decrease': 0.024874034765483916, 'max_features': 0.7358653128711129, 'subsample': 0.7363562043518851, 'dropout_rate': 0.10362266588107642, 'ccp_alpha': 0.4578405166963986}. Best is trial 161 with value: 0.8665031184376385.[0m
[32m[I 2022-04-13 16:02:06,758][0m Trial 180 finished with value: 0.8646401981896468 and parameters: {'loss': 'coxph', 'learning_rate': 0.0010066402373022935, 'n_estimators': 774, 'criterion': 'friedman_mse', 'min_samples_split': 3, 'min_samples_leaf': 7, 'min_weight_fraction_leaf': 0.20580704938887545, 'min_impurity_decrease': 0.05268075976042221, 'max_features': 0.8526665099693589, 'subsample': 0.7193598861122293, 'dropout_rate': 0.07086869404178592, 'ccp_alpha': 0.1021255019561522}. Best is trial 161 with value: 0.8665031184376385.[0m
[32m[I 2022-04-13 16:04:50,421][0m Trial 181 finished with value: 0.8624224244579419 and parameters: {'loss': 'coxph', 'learning_rate': 0.0007418491571008105, 'n_estimators': 823, 'criterion': 'friedman_mse', 'min_samples_split': 3, 'min_samples_leaf': 7, 'min_weight_fraction_leaf': 0.20592077635685876, 'min_impurity_decrease': 0.04829680529638034, 'max_features': 0.8558436294777811, 'subsample': 0.7637686269696389, 'dropout_rate': 0.06708462444756617, 'ccp_alpha': 0.1068743422213039}. Best is trial 161 with value: 0.8665031184376385.[0m
[32m[I 2022-04-13 16:07:04,672][0m Trial 182 finished with value: 0.865278555806815 and parameters: {'loss': 'coxph', 'learning_rate': 0.0010083078080534173, 'n_estimators': 771, 'criterion': 'friedman_mse', 'min_samples_split': 3, 'min_samples_leaf': 7, 'min_weight_fraction_leaf': 0.20677204261887827, 'min_impurity_decrease': 0.05561120779927642, 'max_features': 0.8572903779541614, 'subsample': 0.7156783253259783, 'dropout_rate': 0.07476607036253924, 'ccp_alpha': 0.10178246100850905}. Best is trial 161 with value: 0.8665031184376385.[0m
[32m[I 2022-04-13 16:09:23,747][0m Trial 183 finished with value: 0.8636650748849668 and parameters: {'loss': 'coxph', 'learning_rate': 0.0010267697158848753, 'n_estimators': 772, 'criterion': 'friedman_mse', 'min_samples_split': 3, 'min_samples_leaf': 7, 'min_weight_fraction_leaf': 0.18150532806595898, 'min_impurity_decrease': 0.0673644290840075, 'max_features': 0.8594736869645759, 'subsample': 0.6575811370761233, 'dropout_rate': 0.06441755206693377, 'ccp_alpha': 0.10431088095168568}. Best is trial 161 with value: 0.8665031184376385.[0m
[32m[I 2022-04-13 16:11:47,766][0m Trial 184 finished with value: 0.8516304310571741 and parameters: {'loss': 'coxph', 'learning_rate': 0.00077739826524227, 'n_estimators': 764, 'criterion': 'friedman_mse', 'min_samples_split': 3, 'min_samples_leaf': 7, 'min_weight_fraction_leaf': 0.18705005238140526, 'min_impurity_decrease': 0.075773403161251, 'max_features': 0.9107085441499672, 'subsample': 0.6549321553114092, 'dropout_rate': 0.06925457618265525, 'ccp_alpha': 0.2639821267982333}. Best is trial 161 with value: 0.8665031184376385.[0m
[32m[I 2022-04-13 16:13:46,665][0m Trial 185 finished with value: 0.8657721036675621 and parameters: {'loss': 'coxph', 'learning_rate': 0.000992254844611526, 'n_estimators': 701, 'criterion': 'friedman_mse', 'min_samples_split': 3, 'min_samples_leaf': 6, 'min_weight_fraction_leaf': 0.1610713213177182, 'min_impurity_decrease': 0.09969690128720378, 'max_features': 0.8629882912341129, 'subsample': 0.717036357154876, 'dropout_rate': 0.022938742665630396, 'ccp_alpha': 0.09485552185416898}. Best is trial 161 with value: 0.8665031184376385.[0m
[32m[I 2022-04-13 16:15:46,985][0m Trial 186 finished with value: 0.6524506958451449 and parameters: {'loss': 'coxph', 'learning_rate': 0.0010423941541283083, 'n_estimators': 696, 'criterion': 'friedman_mse', 'min_samples_split': 3, 'min_samples_leaf': 6, 'min_weight_fraction_leaf': 0.1597735457288772, 'min_impurity_decrease': 0.10325319131106962, 'max_features': 0.8590711051349759, 'subsample': 0.804356764885745, 'dropout_rate': 0.020092857178867447, 'ccp_alpha': 0.33195216553924894}. Best is trial 161 with value: 0.8665031184376385.[0m
[32m[I 2022-04-13 16:18:07,009][0m Trial 187 finished with value: 0.8675433419179592 and parameters: {'loss': 'coxph', 'learning_rate': 0.0005881562209136924, 'n_estimators': 787, 'criterion': 'friedman_mse', 'min_samples_split': 3, 'min_samples_leaf': 6, 'min_weight_fraction_leaf': 0.17239141359363075, 'min_impurity_decrease': 0.12000110667870954, 'max_features': 0.8897133943178603, 'subsample': 0.7145695954595922, 'dropout_rate': 0.11611585309286893, 'ccp_alpha': 0.08943707074517103}. Best is trial 187 with value: 0.8675433419179592.[0m
[32m[I 2022-04-13 16:20:30,728][0m Trial 188 finished with value: 0.8505555787314911 and parameters: {'loss': 'coxph', 'learning_rate': 0.000566601460869194, 'n_estimators': 785, 'criterion': 'friedman_mse', 'min_samples_split': 3, 'min_samples_leaf': 6, 'min_weight_fraction_leaf': 0.16970789182490167, 'min_impurity_decrease': 0.12349288916294504, 'max_features': 0.942898550508977, 'subsample': 0.7149904192589746, 'dropout_rate': 0.11490902302536338, 'ccp_alpha': 0.24443125949675223}. Best is trial 187 with value: 0.8675433419179592.[0m
[32m[I 2022-04-13 16:23:15,335][0m Trial 189 finished with value: 0.8667436686626211 and parameters: {'loss': 'coxph', 'learning_rate': 0.0014458653206466114, 'n_estimators': 831, 'criterion': 'friedman_mse', 'min_samples_split': 3, 'min_samples_leaf': 6, 'min_weight_fraction_leaf': 0.14494570340539262, 'min_impurity_decrease': 0.08789022877470264, 'max_features': 0.8794154410675266, 'subsample': 0.658069152299932, 'dropout_rate': 0.09548170762543808, 'ccp_alpha': 0.09689488190867729}. Best is trial 187 with value: 0.8675433419179592.[0m
[32m[I 2022-04-13 16:25:59,525][0m Trial 190 finished with value: 0.6653148490482874 and parameters: {'loss': 'coxph', 'learning_rate': 0.0015648537253760456, 'n_estimators': 821, 'criterion': 'friedman_mse', 'min_samples_split': 3, 'min_samples_leaf': 6, 'min_weight_fraction_leaf': 0.1409087058332458, 'min_impurity_decrease': 0.11265182799501686, 'max_features': 0.8891324559606568, 'subsample': 0.6349100920495241, 'dropout_rate': 0.09700281896705462, 'ccp_alpha': 0.4027026998838998}. Best is trial 187 with value: 0.8675433419179592.[0m
[32m[I 2022-04-13 16:28:09,602][0m Trial 191 finished with value: 0.8676536809266915 and parameters: {'loss': 'coxph', 'learning_rate': 0.0013288903508895911, 'n_estimators': 761, 'criterion': 'friedman_mse', 'min_samples_split': 3, 'min_samples_leaf': 6, 'min_weight_fraction_leaf': 0.15437712804445997, 'min_impurity_decrease': 0.08605865266885442, 'max_features': 0.8544329571517024, 'subsample': 0.6709897454248926, 'dropout_rate': 0.12336233664837723, 'ccp_alpha': 0.005315163544988594}. Best is trial 191 with value: 0.8676536809266915.[0m
[32m[I 2022-04-13 16:30:26,105][0m Trial 192 finished with value: 0.866840789098573 and parameters: {'loss': 'coxph', 'learning_rate': 0.0010352955604487318, 'n_estimators': 781, 'criterion': 'friedman_mse', 'min_samples_split': 3, 'min_samples_leaf': 6, 'min_weight_fraction_leaf': 0.15024753367258678, 'min_impurity_decrease': 0.09098091073059786, 'max_features': 0.9245063699807192, 'subsample': 0.6558604482015878, 'dropout_rate': 0.13618029453748315, 'ccp_alpha': 0.08309945633883029}. Best is trial 191 with value: 0.8676536809266915.[0m
[32m[I 2022-04-13 16:33:15,551][0m Trial 193 finished with value: 0.864466484667948 and parameters: {'loss': 'coxph', 'learning_rate': 0.0012998268768094339, 'n_estimators': 785, 'criterion': 'friedman_mse', 'min_samples_split': 3, 'min_samples_leaf': 6, 'min_weight_fraction_leaf': 0.15745651360786644, 'min_impurity_decrease': 0.08750940490558326, 'max_features': 0.8985350342276796, 'subsample': 0.6651924198882392, 'dropout_rate': 0.147380743512386, 'ccp_alpha': 0.06851053108916517}. Best is trial 191 with value: 0.8676536809266915.[0m
[32m[I 2022-04-13 16:36:57,394][0m Trial 194 finished with value: 0.8670309414136932 and parameters: {'loss': 'coxph', 'learning_rate': 0.0012777476538632562, 'n_estimators': 780, 'criterion': 'friedman_mse', 'min_samples_split': 3, 'min_samples_leaf': 6, 'min_weight_fraction_leaf': 0.1319801112022247, 'min_impurity_decrease': 0.0819949900978178, 'max_features': 0.9365078725776673, 'subsample': 0.6613757061342251, 'dropout_rate': 0.1610774794424765, 'ccp_alpha': 0.008019852698379265}. Best is trial 191 with value: 0.8676536809266915.[0m
[32m[I 2022-04-13 16:40:23,057][0m Trial 195 finished with value: 0.8677554679559382 and parameters: {'loss': 'coxph', 'learning_rate': 0.0013345241691055396, 'n_estimators': 782, 'criterion': 'friedman_mse', 'min_samples_split': 3, 'min_samples_leaf': 6, 'min_weight_fraction_leaf': 0.12963813614544736, 'min_impurity_decrease': 0.09319542947678154, 'max_features': 0.8931695976216332, 'subsample': 0.6700812198505102, 'dropout_rate': 0.16341653853909102, 'ccp_alpha': 0.01095909834839394}. Best is trial 195 with value: 0.8677554679559382.[0m
[32m[I 2022-04-13 16:44:14,992][0m Trial 196 finished with value: 0.8672731077190475 and parameters: {'loss': 'coxph', 'learning_rate': 0.0012701806922732364, 'n_estimators': 785, 'criterion': 'friedman_mse', 'min_samples_split': 3, 'min_samples_leaf': 6, 'min_weight_fraction_leaf': 0.13129141187879192, 'min_impurity_decrease': 0.08813508384323095, 'max_features': 0.947377103367811, 'subsample': 0.6647763830818758, 'dropout_rate': 0.13877586034633493, 'ccp_alpha': 0.016169454050653176}. Best is trial 195 with value: 0.8677554679559382.[0m
[32m[I 2022-04-13 16:47:46,851][0m Trial 197 finished with value: -0.3644430712625056 and parameters: {'loss': 'squared', 'learning_rate': 0.0012675866987899229, 'n_estimators': 792, 'criterion': 'friedman_mse', 'min_samples_split': 3, 'min_samples_leaf': 6, 'min_weight_fraction_leaf': 0.12608074571025096, 'min_impurity_decrease': 0.0960544894226494, 'max_features': 0.9566533120969601, 'subsample': 0.6624130714483293, 'dropout_rate': 0.17844880721366618, 'ccp_alpha': 0.007990853960834984}. Best is trial 195 with value: 0.8677554679559382.[0m
[32m[I 2022-04-13 16:50:05,526][0m Trial 198 finished with value: 0.8656739108449498 and parameters: {'loss': 'coxph', 'learning_rate': 0.0010655997780256968, 'n_estimators': 778, 'criterion': 'friedman_mse', 'min_samples_split': 3, 'min_samples_leaf': 6, 'min_weight_fraction_leaf': 0.13722879428301482, 'min_impurity_decrease': 0.13496948550983784, 'max_features': 0.9919902497050639, 'subsample': 0.621637001531964, 'dropout_rate': 0.1627670692285939, 'ccp_alpha': 0.006493797568508691}. Best is trial 195 with value: 0.8677554679559382.[0m
[32m[I 2022-04-13 16:52:55,131][0m Trial 199 finished with value: 0.8661409483052871 and parameters: {'loss': 'coxph', 'learning_rate': 0.001114658709250199, 'n_estimators': 835, 'criterion': 'friedman_mse', 'min_samples_split': 3, 'min_samples_leaf': 6, 'min_weight_fraction_leaf': 0.11565807934457664, 'min_impurity_decrease': 0.1472482370672859, 'max_features': 0.9869116066881464, 'subsample': 0.6325524400803239, 'dropout_rate': 0.15899455748226637, 'ccp_alpha': 0.05934767728992613}. Best is trial 195 with value: 0.8677554679559382.[0m
[32m[I 2022-04-13 16:55:55,846][0m Trial 200 finished with value: 0.8652257998413365 and parameters: {'loss': 'coxph', 'learning_rate': 0.0013143647338582486, 'n_estimators': 905, 'criterion': 'friedman_mse', 'min_samples_split': 3, 'min_samples_leaf': 6, 'min_weight_fraction_leaf': 0.13404448785797946, 'min_impurity_decrease': 0.15533565419353823, 'max_features': 0.9965251878697412, 'subsample': 0.6226192216557964, 'dropout_rate': 0.1624614660205528, 'ccp_alpha': 0.005534945689358222}. Best is trial 195 with value: 0.8677554679559382.[0m
[32m[I 2022-04-13 16:59:08,808][0m Trial 201 finished with value: 0.8636768040828164 and parameters: {'loss': 'coxph', 'learning_rate': 0.0014892331079920094, 'n_estimators': 909, 'criterion': 'friedman_mse', 'min_samples_split': 3, 'min_samples_leaf': 6, 'min_weight_fraction_leaf': 0.13615586855457096, 'min_impurity_decrease': 0.1307957489486864, 'max_features': 0.9231908475017033, 'subsample': 0.6240845819379197, 'dropout_rate': 0.1515599373759698, 'ccp_alpha': 0.024997800210809926}. Best is trial 195 with value: 0.8677554679559382.[0m
