[32m[I 2022-04-14 05:07:12,024][0m Trial 123 finished with value: 0.6025356995608583 and parameters: {'loss': 'coxph', 'learning_rate': 0.000469253795084102, 'n_estimators': 603, 'criterion': 'squared_error', 'min_samples_split': 7, 'min_samples_leaf': 3, 'min_weight_fraction_leaf': 0.04474212592938667, 'min_impurity_decrease': 0.1450523924797465, 'max_features': 0.8300671940921488, 'subsample': 0.5689645358089307, 'dropout_rate': 0.25409259917450405, 'ccp_alpha': 0.3870042629766298}. Best is trial 121 with value: 0.7390170571688387.[0m
[32m[I 2022-04-14 05:07:54,042][0m Trial 124 finished with value: 0.7209403738559873 and parameters: {'loss': 'coxph', 'learning_rate': 0.0003534324300961021, 'n_estimators': 577, 'criterion': 'squared_error', 'min_samples_split': 6, 'min_samples_leaf': 3, 'min_weight_fraction_leaf': 0.03481427811766604, 'min_impurity_decrease': 0.22284704899838634, 'max_features': 0.8555725799495266, 'subsample': 0.4888693524143536, 'dropout_rate': 0.4448448622094703, 'ccp_alpha': 0.009789551785547121}. Best is trial 121 with value: 0.7390170571688387.[0m
[32m[I 2022-04-14 05:08:49,617][0m Trial 125 finished with value: 0.7296094845698511 and parameters: {'loss': 'coxph', 'learning_rate': 0.0007609183249058982, 'n_estimators': 618, 'criterion': 'squared_error', 'min_samples_split': 6, 'min_samples_leaf': 2, 'min_weight_fraction_leaf': 0.059247684561735056, 'min_impurity_decrease': 0.1301820075194717, 'max_features': 0.7658100258465375, 'subsample': 0.5460153958659268, 'dropout_rate': 0.2960138404884003, 'ccp_alpha': 0.23032472289334344}. Best is trial 121 with value: 0.7390170571688387.[0m
[32m[I 2022-04-14 05:09:50,879][0m Trial 126 finished with value: 0.7285094225661964 and parameters: {'loss': 'coxph', 'learning_rate': 0.0006719622378406218, 'n_estimators': 610, 'criterion': 'squared_error', 'min_samples_split': 6, 'min_samples_leaf': 2, 'min_weight_fraction_leaf': 0.06527426172023908, 'min_impurity_decrease': 0.12319805381344179, 'max_features': 0.7642583380513297, 'subsample': 0.5441176398581045, 'dropout_rate': 0.3080046689281711, 'ccp_alpha': 0.22918361564422773}. Best is trial 121 with value: 0.7390170571688387.[0m
[32m[I 2022-04-14 05:10:49,615][0m Trial 127 finished with value: 0.5521240026945989 and parameters: {'loss': 'coxph', 'learning_rate': 0.00047300674215559034, 'n_estimators': 617, 'criterion': 'squared_error', 'min_samples_split': 6, 'min_samples_leaf': 2, 'min_weight_fraction_leaf': 0.05952237788418639, 'min_impurity_decrease': 0.13517706776902497, 'max_features': 0.7880508530276704, 'subsample': 0.5105521574915229, 'dropout_rate': 0.34075378410000257, 'ccp_alpha': 0.4809638027984149}. Best is trial 121 with value: 0.7390170571688387.[0m
[32m[I 2022-04-14 05:12:08,563][0m Trial 128 finished with value: 0.5 and parameters: {'loss': 'coxph', 'learning_rate': 0.0006674669863779732, 'n_estimators': 727, 'criterion': 'squared_error', 'min_samples_split': 7, 'min_samples_leaf': 2, 'min_weight_fraction_leaf': 0.06708520615090578, 'min_impurity_decrease': 0.11012888356351438, 'max_features': 0.8127446631052029, 'subsample': 0.4559040632960161, 'dropout_rate': 0.39285478389816864, 'ccp_alpha': 4.459334259677756}. Best is trial 121 with value: 0.7390170571688387.[0m
[32m[I 2022-04-14 05:13:08,979][0m Trial 129 finished with value: 0.7307170641187299 and parameters: {'loss': 'coxph', 'learning_rate': 0.000601953886883217, 'n_estimators': 583, 'criterion': 'squared_error', 'min_samples_split': 6, 'min_samples_leaf': 2, 'min_weight_fraction_leaf': 0.07486476396244512, 'min_impurity_decrease': 0.08323186267749881, 'max_features': 0.7642313261519038, 'subsample': 0.5243706154203942, 'dropout_rate': 0.288819269785594, 'ccp_alpha': 0.1440526968784357}. Best is trial 121 with value: 0.7390170571688387.[0m
[32m[I 2022-04-14 05:13:51,850][0m Trial 130 finished with value: 0.6833939625538352 and parameters: {'loss': 'coxph', 'learning_rate': 0.0005778700263443, 'n_estimators': 524, 'criterion': 'squared_error', 'min_samples_split': 6, 'min_samples_leaf': 2, 'min_weight_fraction_leaf': 0.40998805333087696, 'min_impurity_decrease': 0.09410650479083632, 'max_features': 0.7675539965265816, 'subsample': 0.5286795392776843, 'dropout_rate': 0.303043314089012, 'ccp_alpha': 0.13170588046093087}. Best is trial 121 with value: 0.7390170571688387.[0m
[32m[I 2022-04-14 05:14:54,975][0m Trial 131 finished with value: 0.7282548634833041 and parameters: {'loss': 'coxph', 'learning_rate': 0.0005940688103540653, 'n_estimators': 579, 'criterion': 'squared_error', 'min_samples_split': 6, 'min_samples_leaf': 2, 'min_weight_fraction_leaf': 0.07977993917898656, 'min_impurity_decrease': 0.1254757963861833, 'max_features': 0.7281950374859173, 'subsample': 0.47834775336514207, 'dropout_rate': 0.22840030126757588, 'ccp_alpha': 0.19460004357280944}. Best is trial 121 with value: 0.7390170571688387.[0m
[32m[I 2022-04-14 05:15:51,618][0m Trial 132 finished with value: 0.7351887645126676 and parameters: {'loss': 'coxph', 'learning_rate': 0.0009907067953957133, 'n_estimators': 553, 'criterion': 'squared_error', 'min_samples_split': 6, 'min_samples_leaf': 2, 'min_weight_fraction_leaf': 0.08591588107943292, 'min_impurity_decrease': 0.13276442731260157, 'max_features': 0.7381873710519532, 'subsample': 0.48222534937138106, 'dropout_rate': 0.22421886872000857, 'ccp_alpha': 0.1349839679081256}. Best is trial 121 with value: 0.7390170571688387.[0m
[32m[I 2022-04-14 05:17:14,812][0m Trial 133 finished with value: 0.7039670763728368 and parameters: {'loss': 'coxph', 'learning_rate': 0.00031364732030140553, 'n_estimators': 673, 'criterion': 'squared_error', 'min_samples_split': 6, 'min_samples_leaf': 1, 'min_weight_fraction_leaf': 0.0854948558540669, 'min_impurity_decrease': 0.12157919122579429, 'max_features': 0.7225680720952207, 'subsample': 0.46966740054579575, 'dropout_rate': 0.2311875254677101, 'ccp_alpha': 0.3484919033867284}. Best is trial 121 with value: 0.7390170571688387.[0m
[32m[I 2022-04-14 05:18:09,911][0m Trial 134 finished with value: 0.7276948618306355 and parameters: {'loss': 'coxph', 'learning_rate': 0.00017878601424646152, 'n_estimators': 578, 'criterion': 'squared_error', 'min_samples_split': 6, 'min_samples_leaf': 2, 'min_weight_fraction_leaf': 0.10311624309790755, 'min_impurity_decrease': 0.16880412830889324, 'max_features': 0.6394511265278817, 'subsample': 0.5518392328119448, 'dropout_rate': 0.2789224122554168, 'ccp_alpha': 0.20208553510126767}. Best is trial 121 with value: 0.7390170571688387.[0m
[32m[I 2022-04-14 05:19:00,490][0m Trial 135 finished with value: 0.726173921271595 and parameters: {'loss': 'coxph', 'learning_rate': 0.00015804328944512674, 'n_estimators': 560, 'criterion': 'squared_error', 'min_samples_split': 7, 'min_samples_leaf': 2, 'min_weight_fraction_leaf': 0.1079555740050733, 'min_impurity_decrease': 0.1445057980327311, 'max_features': 0.6049977660556582, 'subsample': 0.5628858348607294, 'dropout_rate': 0.28114145009065666, 'ccp_alpha': 0.16659805462837943}. Best is trial 121 with value: 0.7390170571688387.[0m
[32m[I 2022-04-14 05:19:36,690][0m Trial 136 finished with value: 0.5 and parameters: {'loss': 'coxph', 'learning_rate': 0.0006070732426015638, 'n_estimators': 476, 'criterion': 'squared_error', 'min_samples_split': 6, 'min_samples_leaf': 2, 'min_weight_fraction_leaf': 0.10147467224204003, 'min_impurity_decrease': 0.0856828665428287, 'max_features': 0.6384017940558786, 'subsample': 0.47869111388943547, 'dropout_rate': 0.31629906855429357, 'ccp_alpha': 0.5984314348115776}. Best is trial 121 with value: 0.7390170571688387.[0m
[32m[I 2022-04-14 05:20:31,077][0m Trial 137 finished with value: 0.7322570152249945 and parameters: {'loss': 'coxph', 'learning_rate': 0.0002295520382705662, 'n_estimators': 577, 'criterion': 'squared_error', 'min_samples_split': 6, 'min_samples_leaf': 1, 'min_weight_fraction_leaf': 0.07605801788768732, 'min_impurity_decrease': 0.159647013577371, 'max_features': 0.6787504340675211, 'subsample': 0.5465588973986039, 'dropout_rate': 0.22457183031179365, 'ccp_alpha': 0.20972379320495468}. Best is trial 121 with value: 0.7390170571688387.[0m
[32m[I 2022-04-14 05:21:25,761][0m Trial 138 finished with value: 0.5632066439407801 and parameters: {'loss': 'coxph', 'learning_rate': 0.0001722614356848182, 'n_estimators': 582, 'criterion': 'squared_error', 'min_samples_split': 6, 'min_samples_leaf': 1, 'min_weight_fraction_leaf': 0.07964683199709999, 'min_impurity_decrease': 0.16970170366234458, 'max_features': 0.6695126988143567, 'subsample': 0.5488634603165444, 'dropout_rate': 0.28552920749064387, 'ccp_alpha': 0.4214742464910491}. Best is trial 121 with value: 0.7390170571688387.[0m
[32m[I 2022-04-14 05:22:20,872][0m Trial 139 finished with value: 0.7250150864056857 and parameters: {'loss': 'coxph', 'learning_rate': 0.00023679982082048723, 'n_estimators': 548, 'criterion': 'squared_error', 'min_samples_split': 6, 'min_samples_leaf': 1, 'min_weight_fraction_leaf': 0.09003131683564086, 'min_impurity_decrease': 0.1237626491470614, 'max_features': 0.6298847247913776, 'subsample': 0.4926743712586138, 'dropout_rate': 0.22324114046866794, 'ccp_alpha': 0.10849352009344622}. Best is trial 121 with value: 0.7390170571688387.[0m
[32m[I 2022-04-14 05:23:07,509][0m Trial 140 finished with value: 0.27061110080632533 and parameters: {'loss': 'squared', 'learning_rate': 0.0002579782975605719, 'n_estimators': 513, 'criterion': 'squared_error', 'min_samples_split': 7, 'min_samples_leaf': 2, 'min_weight_fraction_leaf': 0.05763246043612646, 'min_impurity_decrease': 0.10855728702422644, 'max_features': 0.7245763059694994, 'subsample': 0.5744190503649764, 'dropout_rate': 0.24401617042635795, 'ccp_alpha': 0.3176258192160226}. Best is trial 121 with value: 0.7390170571688387.[0m
[32m[I 2022-04-14 05:24:12,010][0m Trial 141 finished with value: 0.7282828923543423 and parameters: {'loss': 'coxph', 'learning_rate': 0.00038051116808378684, 'n_estimators': 617, 'criterion': 'squared_error', 'min_samples_split': 6, 'min_samples_leaf': 2, 'min_weight_fraction_leaf': 0.11883674381160181, 'min_impurity_decrease': 0.15656066966111704, 'max_features': 0.6825362264881503, 'subsample': 0.5244126211823404, 'dropout_rate': 0.22052230809718631, 'ccp_alpha': 0.21687376470196945}. Best is trial 121 with value: 0.7390170571688387.[0m
[32m[I 2022-04-14 05:25:12,712][0m Trial 142 finished with value: 0.7325994983873161 and parameters: {'loss': 'coxph', 'learning_rate': 0.0003430853995032833, 'n_estimators': 614, 'criterion': 'squared_error', 'min_samples_split': 6, 'min_samples_leaf': 2, 'min_weight_fraction_leaf': 0.11538616953149657, 'min_impurity_decrease': 0.15350404642479623, 'max_features': 0.6773997516665287, 'subsample': 0.5445042907066553, 'dropout_rate': 0.21617766828933038, 'ccp_alpha': 0.1996211213428581}. Best is trial 121 with value: 0.7390170571688387.[0m
[32m[I 2022-04-14 05:26:17,639][0m Trial 143 finished with value: 0.5521240026945989 and parameters: {'loss': 'coxph', 'learning_rate': 0.00010053009935478162, 'n_estimators': 612, 'criterion': 'squared_error', 'min_samples_split': 6, 'min_samples_leaf': 2, 'min_weight_fraction_leaf': 0.12010971017620906, 'min_impurity_decrease': 0.16109088863727375, 'max_features': 0.6768937546519018, 'subsample': 0.5380648267823643, 'dropout_rate': 0.20527168020916148, 'ccp_alpha': 0.5043019558173183}. Best is trial 121 with value: 0.7390170571688387.[0m
[32m[I 2022-04-14 05:27:33,719][0m Trial 144 finished with value: 0.7266888558913568 and parameters: {'loss': 'coxph', 'learning_rate': 0.000334199383131626, 'n_estimators': 657, 'criterion': 'squared_error', 'min_samples_split': 6, 'min_samples_leaf': 2, 'min_weight_fraction_leaf': 0.10172419340171059, 'min_impurity_decrease': 0.14219769631699436, 'max_features': 0.7376130427680998, 'subsample': 0.5105068751643229, 'dropout_rate': 0.2581962850107283, 'ccp_alpha': 0.20424590923479233}. Best is trial 121 with value: 0.7390170571688387.[0m
[32m[I 2022-04-14 05:29:06,492][0m Trial 145 finished with value: 0.6472008845622279 and parameters: {'loss': 'coxph', 'learning_rate': 0.0004084278249243498, 'n_estimators': 703, 'criterion': 'squared_error', 'min_samples_split': 6, 'min_samples_leaf': 1, 'min_weight_fraction_leaf': 0.11290752458605445, 'min_impurity_decrease': 0.17905544837672396, 'max_features': 0.6537266318047334, 'subsample': 0.542420404200416, 'dropout_rate': 0.16016325002378978, 'ccp_alpha': 0.3722947410546922}. Best is trial 121 with value: 0.7390170571688387.[0m
[32m[I 2022-04-14 05:30:00,821][0m Trial 146 finished with value: 0.7334996603982328 and parameters: {'loss': 'coxph', 'learning_rate': 0.0005574345323535549, 'n_estimators': 572, 'criterion': 'squared_error', 'min_samples_split': 6, 'min_samples_leaf': 2, 'min_weight_fraction_leaf': 0.07394707239349518, 'min_impurity_decrease': 0.13599986289563387, 'max_features': 0.7594447388355072, 'subsample': 0.4882670464176032, 'dropout_rate': 0.21681529890571377, 'ccp_alpha': 0.09434842788945534}. Best is trial 121 with value: 0.7390170571688387.[0m
[32m[I 2022-04-14 05:31:01,635][0m Trial 147 finished with value: 0.7325077891610807 and parameters: {'loss': 'coxph', 'learning_rate': 0.0008636915100638067, 'n_estimators': 608, 'criterion': 'squared_error', 'min_samples_split': 7, 'min_samples_leaf': 2, 'min_weight_fraction_leaf': 0.08130909852125226, 'min_impurity_decrease': 0.1271932947969762, 'max_features': 0.7640148100765497, 'subsample': 0.48350083330295157, 'dropout_rate': 0.21747027681189052, 'ccp_alpha': 0.10729027496905275}. Best is trial 121 with value: 0.7390170571688387.[0m
[32m[I 2022-04-14 05:32:16,465][0m Trial 148 finished with value: 0.7342773066687582 and parameters: {'loss': 'coxph', 'learning_rate': 0.0009128343070018899, 'n_estimators': 626, 'criterion': 'squared_error', 'min_samples_split': 7, 'min_samples_leaf': 1, 'min_weight_fraction_leaf': 0.07416817391843875, 'min_impurity_decrease': 0.08675415179822349, 'max_features': 0.7533558419985691, 'subsample': 0.452943229469339, 'dropout_rate': 0.19145384615148114, 'ccp_alpha': 0.08529822897284338}. Best is trial 121 with value: 0.7390170571688387.[0m
[32m[I 2022-04-14 05:33:56,966][0m Trial 149 finished with value: 0.7335627977983079 and parameters: {'loss': 'coxph', 'learning_rate': 0.0007524762110517661, 'n_estimators': 749, 'criterion': 'squared_error', 'min_samples_split': 7, 'min_samples_leaf': 2, 'min_weight_fraction_leaf': 0.07569981052040449, 'min_impurity_decrease': 0.08319511263529003, 'max_features': 0.7614664186113481, 'subsample': 0.4493750113581942, 'dropout_rate': 0.19741245576998154, 'ccp_alpha': 0.09494772257408012}. Best is trial 121 with value: 0.7390170571688387.[0m
[32m[I 2022-04-14 05:35:52,321][0m Trial 150 finished with value: 0.7339413726970873 and parameters: {'loss': 'coxph', 'learning_rate': 0.0009013109814399311, 'n_estimators': 789, 'criterion': 'squared_error', 'min_samples_split': 7, 'min_samples_leaf': 1, 'min_weight_fraction_leaf': 0.07375839529920063, 'min_impurity_decrease': 0.08896637250807973, 'max_features': 0.7495972265496278, 'subsample': 0.4550948364435641, 'dropout_rate': 0.1640564656293311, 'ccp_alpha': 0.09143358882038141}. Best is trial 121 with value: 0.7390170571688387.[0m
[32m[I 2022-04-14 05:38:24,688][0m Trial 151 finished with value: 0.7326324304005409 and parameters: {'loss': 'coxph', 'learning_rate': 0.000752920334899381, 'n_estimators': 909, 'criterion': 'squared_error', 'min_samples_split': 7, 'min_samples_leaf': 1, 'min_weight_fraction_leaf': 0.07770713153928656, 'min_impurity_decrease': 0.08195021312157937, 'max_features': 0.7498371869562991, 'subsample': 0.4529571872250335, 'dropout_rate': 0.15283991822266166, 'ccp_alpha': 0.05390390460126022}. Best is trial 121 with value: 0.7390170571688387.[0m
[32m[I 2022-04-14 05:41:08,915][0m Trial 152 finished with value: 0.7310455931878772 and parameters: {'loss': 'coxph', 'learning_rate': 0.0008558889572426911, 'n_estimators': 918, 'criterion': 'squared_error', 'min_samples_split': 7, 'min_samples_leaf': 1, 'min_weight_fraction_leaf': 0.07284416645942762, 'min_impurity_decrease': 0.08336648810736873, 'max_features': 0.7471304643466612, 'subsample': 0.45503515704111314, 'dropout_rate': 0.11018899586200506, 'ccp_alpha': 0.09356235361535933}. Best is trial 121 with value: 0.7390170571688387.[0m
[32m[I 2022-04-14 05:43:41,166][0m Trial 153 finished with value: 0.7345479612302902 and parameters: {'loss': 'coxph', 'learning_rate': 0.0009324202968096583, 'n_estimators': 855, 'criterion': 'squared_error', 'min_samples_split': 7, 'min_samples_leaf': 1, 'min_weight_fraction_leaf': 0.07559632366105817, 'min_impurity_decrease': 0.08223841159215409, 'max_features': 0.777818493691465, 'subsample': 0.45780526609256056, 'dropout_rate': 0.10684415173323854, 'ccp_alpha': 0.08684640950263488}. Best is trial 121 with value: 0.7390170571688387.[0m
[32m[I 2022-04-14 05:46:22,444][0m Trial 154 finished with value: 0.7223549871421615 and parameters: {'loss': 'coxph', 'learning_rate': 0.0009264652720167706, 'n_estimators': 888, 'criterion': 'squared_error', 'min_samples_split': 7, 'min_samples_leaf': 1, 'min_weight_fraction_leaf': 0.07576370137691871, 'min_impurity_decrease': 0.07774067588047671, 'max_features': 0.7125812908462148, 'subsample': 0.45567842672240566, 'dropout_rate': 0.10618183829514233, 'ccp_alpha': 0.10153760373654903}. Best is trial 121 with value: 0.7390170571688387.[0m
[32m[I 2022-04-14 05:49:11,408][0m Trial 155 finished with value: 0.7296974787376339 and parameters: {'loss': 'coxph', 'learning_rate': 0.0010102541407228625, 'n_estimators': 962, 'criterion': 'squared_error', 'min_samples_split': 7, 'min_samples_leaf': 1, 'min_weight_fraction_leaf': 0.087285459705612, 'min_impurity_decrease': 0.09385791843455855, 'max_features': 0.7460053063492758, 'subsample': 0.43639687180191555, 'dropout_rate': 0.12648995489396803, 'ccp_alpha': 0.002319598931297427}. Best is trial 121 with value: 0.7390170571688387.[0m
[32m[I 2022-04-14 05:51:56,724][0m Trial 156 finished with value: 0.7243472321461396 and parameters: {'loss': 'coxph', 'learning_rate': 0.0014430551605444525, 'n_estimators': 913, 'criterion': 'squared_error', 'min_samples_split': 7, 'min_samples_leaf': 1, 'min_weight_fraction_leaf': 0.09005795998553104, 'min_impurity_decrease': 0.07818900448177811, 'max_features': 0.7303232468257045, 'subsample': 0.42637659768319214, 'dropout_rate': 0.06640721748037046, 'ccp_alpha': 0.09232573758966967}. Best is trial 121 with value: 0.7390170571688387.[0m
[32m[I 2022-04-14 05:54:08,959][0m Trial 157 finished with value: 0.7039229575410486 and parameters: {'loss': 'coxph', 'learning_rate': 0.0005254012066173198, 'n_estimators': 856, 'criterion': 'squared_error', 'min_samples_split': 7, 'min_samples_leaf': 1, 'min_weight_fraction_leaf': 0.0773986272356501, 'min_impurity_decrease': 0.053964845964987726, 'max_features': 0.7769219620579404, 'subsample': 0.45890580519680424, 'dropout_rate': 0.16176888300450626, 'ccp_alpha': 0.3583931656475216}. Best is trial 121 with value: 0.7390170571688387.[0m
[32m[I 2022-04-14 05:55:48,841][0m Trial 158 finished with value: 0.7305411625625486 and parameters: {'loss': 'coxph', 'learning_rate': 0.0008721335895550044, 'n_estimators': 763, 'criterion': 'squared_error', 'min_samples_split': 7, 'min_samples_leaf': 1, 'min_weight_fraction_leaf': 0.06929458810381567, 'min_impurity_decrease': 0.10168448457733298, 'max_features': 0.779707543854855, 'subsample': 0.4460214337440584, 'dropout_rate': 0.14165627184016719, 'ccp_alpha': 0.08251604275009687}. Best is trial 121 with value: 0.7390170571688387.[0m
[32m[I 2022-04-14 05:57:35,339][0m Trial 159 finished with value: 0.7096125756151076 and parameters: {'loss': 'coxph', 'learning_rate': 0.0011542422318438596, 'n_estimators': 793, 'criterion': 'squared_error', 'min_samples_split': 7, 'min_samples_leaf': 1, 'min_weight_fraction_leaf': 0.05476676681219515, 'min_impurity_decrease': 0.09893410322231384, 'max_features': 0.7528686025643464, 'subsample': 0.48485766383250484, 'dropout_rate': 0.1784333161790366, 'ccp_alpha': 0.31580266159868936}. Best is trial 121 with value: 0.7390170571688387.[0m
[32m[I 2022-04-14 06:00:28,270][0m Trial 160 finished with value: 0.5 and parameters: {'loss': 'coxph', 'learning_rate': 0.0015885050101535052, 'n_estimators': 953, 'criterion': 'squared_error', 'min_samples_split': 7, 'min_samples_leaf': 1, 'min_weight_fraction_leaf': 0.09428877355509953, 'min_impurity_decrease': 0.9009404788695484, 'max_features': 0.7052975245683992, 'subsample': 0.4163538487054508, 'dropout_rate': 0.08287279085471583, 'ccp_alpha': 0.09918374839501425}. Best is trial 121 with value: 0.7390170571688387.[0m
[32m[I 2022-04-14 06:02:42,340][0m Trial 161 finished with value: 0.7274305481196129 and parameters: {'loss': 'coxph', 'learning_rate': 0.0008527676614696503, 'n_estimators': 821, 'criterion': 'squared_error', 'min_samples_split': 7, 'min_samples_leaf': 1, 'min_weight_fraction_leaf': 0.07081635948053384, 'min_impurity_decrease': 0.09787940827317909, 'max_features': 0.7813357434147239, 'subsample': 0.45983237238867175, 'dropout_rate': 0.0461108684092531, 'ccp_alpha': 0.11031728917503376}. Best is trial 121 with value: 0.7390170571688387.[0m
[32m[I 2022-04-14 06:04:50,286][0m Trial 162 finished with value: 0.73710729089418 and parameters: {'loss': 'coxph', 'learning_rate': 0.00105282890776594, 'n_estimators': 884, 'criterion': 'squared_error', 'min_samples_split': 7, 'min_samples_leaf': 1, 'min_weight_fraction_leaf': 0.06648551590699284, 'min_impurity_decrease': 0.0759182177572697, 'max_features': 0.7525873245575582, 'subsample': 0.44003940223869864, 'dropout_rate': 0.1476760639472197, 'ccp_alpha': 0.008852483539499911}. Best is trial 121 with value: 0.7390170571688387.[0m
