[32m[I 2022-04-14 03:13:59,834][0m Trial 682 finished with value: 0.65 and parameters: {'loss': 'coxph', 'learning_rate': 0.0014575211910028384, 'n_estimators': 190, 'criterion': 'friedman_mse', 'min_samples_split': 5, 'min_samples_leaf': 1, 'min_weight_fraction_leaf': 0.039992353401120576, 'min_impurity_decrease': 0.32613915525363885, 'max_features': 0.9792090075322482, 'subsample': 0.7438778259274326, 'dropout_rate': 0.3766046529333122, 'ccp_alpha': 2.7313330482901987}. Best is trial 627 with value: 0.8808013426064705.[0m
[32m[I 2022-04-14 03:14:05,674][0m Trial 683 finished with value: 0.65 and parameters: {'loss': 'coxph', 'learning_rate': 0.002802689107977645, 'n_estimators': 192, 'criterion': 'friedman_mse', 'min_samples_split': 6, 'min_samples_leaf': 1, 'min_weight_fraction_leaf': 0.007261468403410984, 'min_impurity_decrease': 0.356243375878395, 'max_features': 0.9515941599457018, 'subsample': 0.7208797624554225, 'dropout_rate': 0.3529332449468087, 'ccp_alpha': 0.5365141855091449}. Best is trial 627 with value: 0.8808013426064705.[0m
[32m[I 2022-04-14 03:14:11,016][0m Trial 684 finished with value: 0.8710179857998945 and parameters: {'loss': 'coxph', 'learning_rate': 0.002107693073182469, 'n_estimators': 204, 'criterion': 'friedman_mse', 'min_samples_split': 6, 'min_samples_leaf': 1, 'min_weight_fraction_leaf': 0.04252993813736378, 'min_impurity_decrease': 0.2667459975143615, 'max_features': 0.9729220450866883, 'subsample': 0.6924967329644418, 'dropout_rate': 0.3904742086654381, 'ccp_alpha': 0.09754941234853501}. Best is trial 627 with value: 0.8808013426064705.[0m
[32m[I 2022-04-14 03:14:18,892][0m Trial 685 finished with value: 0.8671409436742575 and parameters: {'loss': 'coxph', 'learning_rate': 0.0016342693306400245, 'n_estimators': 222, 'criterion': 'friedman_mse', 'min_samples_split': 10, 'min_samples_leaf': 1, 'min_weight_fraction_leaf': 0.024084115694717308, 'min_impurity_decrease': 0.2873824416860492, 'max_features': 0.9812294179973198, 'subsample': 0.6725791204553564, 'dropout_rate': 0.36035711719173014, 'ccp_alpha': 0.08732619584576881}. Best is trial 627 with value: 0.8808013426064705.[0m
[32m[I 2022-04-14 03:14:28,279][0m Trial 686 finished with value: 0.8558258928517504 and parameters: {'loss': 'coxph', 'learning_rate': 0.00398728252769443, 'n_estimators': 213, 'criterion': 'friedman_mse', 'min_samples_split': 7, 'min_samples_leaf': 1, 'min_weight_fraction_leaf': 0.032724410271720863, 'min_impurity_decrease': 0.3369710219078583, 'max_features': 0.9445257904308747, 'subsample': 0.7487696550914247, 'dropout_rate': 0.3346147705480746, 'ccp_alpha': 0.1736081285334498}. Best is trial 627 with value: 0.8808013426064705.[0m
[32m[I 2022-04-14 03:14:32,874][0m Trial 687 finished with value: 0.65 and parameters: {'loss': 'coxph', 'learning_rate': 0.0022777498065838617, 'n_estimators': 140, 'criterion': 'absolute_error', 'min_samples_split': 5, 'min_samples_leaf': 1, 'min_weight_fraction_leaf': 0.017272609373956645, 'min_impurity_decrease': 0.3094363164287099, 'max_features': 0.9646069063604109, 'subsample': 0.7059795752415743, 'dropout_rate': 0.4015705531095733, 'ccp_alpha': 0.00248435569783244}. Best is trial 627 with value: 0.8808013426064705.[0m
[32m[I 2022-04-14 03:14:40,001][0m Trial 688 finished with value: 0.871268612543296 and parameters: {'loss': 'coxph', 'learning_rate': 0.001407366594816099, 'n_estimators': 198, 'criterion': 'friedman_mse', 'min_samples_split': 6, 'min_samples_leaf': 1, 'min_weight_fraction_leaf': 0.04449163163468096, 'min_impurity_decrease': 0.3605574679082335, 'max_features': 0.9455040538146793, 'subsample': 0.7301333318727811, 'dropout_rate': 0.3648946413879598, 'ccp_alpha': 0.0895618148598865}. Best is trial 627 with value: 0.8808013426064705.[0m
[32m[I 2022-04-14 03:14:46,185][0m Trial 689 finished with value: 0.8789139033738331 and parameters: {'loss': 'coxph', 'learning_rate': 0.003004579901391335, 'n_estimators': 165, 'criterion': 'friedman_mse', 'min_samples_split': 5, 'min_samples_leaf': 1, 'min_weight_fraction_leaf': 0.029816072436001134, 'min_impurity_decrease': 0.2425624944869213, 'max_features': 0.9977521326201145, 'subsample': 0.7602254698814083, 'dropout_rate': 0.3906952667624369, 'ccp_alpha': 0.004826113399270223}. Best is trial 627 with value: 0.8808013426064705.[0m
[32m[I 2022-04-14 03:14:51,570][0m Trial 690 finished with value: 0.8702400741696973 and parameters: {'loss': 'coxph', 'learning_rate': 0.004599503200911576, 'n_estimators': 163, 'criterion': 'friedman_mse', 'min_samples_split': 5, 'min_samples_leaf': 1, 'min_weight_fraction_leaf': 0.036084814799575315, 'min_impurity_decrease': 0.25766800306063414, 'max_features': 0.6651326809788918, 'subsample': 0.763365052708888, 'dropout_rate': 0.38606683129889935, 'ccp_alpha': 0.0024637116093230867}. Best is trial 627 with value: 0.8808013426064705.[0m
[32m[I 2022-04-14 03:14:56,059][0m Trial 691 finished with value: 0.7155084767559147 and parameters: {'loss': 'coxph', 'learning_rate': 0.003150635185049393, 'n_estimators': 167, 'criterion': 'friedman_mse', 'min_samples_split': 5, 'min_samples_leaf': 1, 'min_weight_fraction_leaf': 0.04657947193880035, 'min_impurity_decrease': 0.24772161336051712, 'max_features': 0.9997623878515803, 'subsample': 0.7688651458558698, 'dropout_rate': 0.39678785636136515, 'ccp_alpha': 0.25463787611579974}. Best is trial 627 with value: 0.8808013426064705.[0m
[32m[I 2022-04-14 03:15:01,399][0m Trial 692 finished with value: 0.8582217980124419 and parameters: {'loss': 'coxph', 'learning_rate': 0.005245077581855886, 'n_estimators': 159, 'criterion': 'friedman_mse', 'min_samples_split': 5, 'min_samples_leaf': 1, 'min_weight_fraction_leaf': 0.032058565026924835, 'min_impurity_decrease': 0.2673296956377663, 'max_features': 0.9810063527811569, 'subsample': 0.7468949983227362, 'dropout_rate': 0.3131849801984268, 'ccp_alpha': 0.16376846690544944}. Best is trial 627 with value: 0.8808013426064705.[0m
[32m[I 2022-04-14 03:15:05,894][0m Trial 693 finished with value: 0.8691292922337034 and parameters: {'loss': 'coxph', 'learning_rate': 0.0072081909775399775, 'n_estimators': 176, 'criterion': 'friedman_mse', 'min_samples_split': 5, 'min_samples_leaf': 1, 'min_weight_fraction_leaf': 0.04546399256994696, 'min_impurity_decrease': 0.2786365063028165, 'max_features': 0.9652901477793053, 'subsample': 0.7640136883982639, 'dropout_rate': 0.41154023992561095, 'ccp_alpha': 0.08853464285935643}. Best is trial 627 with value: 0.8808013426064705.[0m
[32m[I 2022-04-14 03:15:10,575][0m Trial 694 finished with value: 0.65 and parameters: {'loss': 'coxph', 'learning_rate': 0.0031865978670362134, 'n_estimators': 151, 'criterion': 'squared_error', 'min_samples_split': 5, 'min_samples_leaf': 1, 'min_weight_fraction_leaf': 0.0311633413530083, 'min_impurity_decrease': 0.8617315860619528, 'max_features': 0.9351493241550789, 'subsample': 0.7746668256636268, 'dropout_rate': 0.40257645346485804, 'ccp_alpha': 0.30898206188150995}. Best is trial 627 with value: 0.8808013426064705.[0m
[32m[I 2022-04-14 03:15:18,043][0m Trial 695 finished with value: 0.8533875736090376 and parameters: {'loss': 'coxph', 'learning_rate': 0.004207318229581442, 'n_estimators': 183, 'criterion': 'friedman_mse', 'min_samples_split': 7, 'min_samples_leaf': 1, 'min_weight_fraction_leaf': 0.012177841453199986, 'min_impurity_decrease': 0.24891448219056755, 'max_features': 0.9986148712419349, 'subsample': 0.751150800052908, 'dropout_rate': 0.33728172971948184, 'ccp_alpha': 0.16866768301862872}. Best is trial 627 with value: 0.8808013426064705.[0m
[32m[I 2022-04-14 03:15:24,230][0m Trial 696 finished with value: -0.35183533695101066 and parameters: {'loss': 'squared', 'learning_rate': 0.0026708621568264632, 'n_estimators': 167, 'criterion': 'friedman_mse', 'min_samples_split': 8, 'min_samples_leaf': 1, 'min_weight_fraction_leaf': 0.2945015681931614, 'min_impurity_decrease': 0.2258858119265169, 'max_features': 0.9982621881984897, 'subsample': 0.7802496644111163, 'dropout_rate': 0.3787426019752021, 'ccp_alpha': 0.1057280968957095}. Best is trial 627 with value: 0.8808013426064705.[0m
[32m[I 2022-04-14 03:15:26,278][0m Trial 697 finished with value: 0.8313646666078697 and parameters: {'loss': 'coxph', 'learning_rate': 0.003650382828177014, 'n_estimators': 138, 'criterion': 'friedman_mse', 'min_samples_split': 5, 'min_samples_leaf': 1, 'min_weight_fraction_leaf': 0.0482324394841088, 'min_impurity_decrease': 0.23187899334010792, 'max_features': 0.9571417007412624, 'subsample': 0.7479098582100349, 'dropout_rate': 0.7184173934659173, 'ccp_alpha': 0.23531626432172348}. Best is trial 627 with value: 0.8808013426064705.[0m
[32m[I 2022-04-14 03:15:31,079][0m Trial 698 finished with value: 0.870819830371409 and parameters: {'loss': 'coxph', 'learning_rate': 0.002638383556564035, 'n_estimators': 147, 'criterion': 'friedman_mse', 'min_samples_split': 8, 'min_samples_leaf': 1, 'min_weight_fraction_leaf': 0.03681601448047271, 'min_impurity_decrease': 0.3760070421533465, 'max_features': 0.9786955538895411, 'subsample': 0.7344555893467232, 'dropout_rate': 0.3513095025377936, 'ccp_alpha': 0.08401661689810581}. Best is trial 627 with value: 0.8808013426064705.[0m
[32m[I 2022-04-14 03:15:35,330][0m Trial 699 finished with value: 0.65 and parameters: {'loss': 'coxph', 'learning_rate': 0.0022528886112937402, 'n_estimators': 169, 'criterion': 'friedman_mse', 'min_samples_split': 5, 'min_samples_leaf': 1, 'min_weight_fraction_leaf': 0.026965454079232447, 'min_impurity_decrease': 0.2923629791129329, 'max_features': 0.9373670803344852, 'subsample': 0.7921124082624879, 'dropout_rate': 0.6404658347597606, 'ccp_alpha': 0.9436120926057463}. Best is trial 627 with value: 0.8808013426064705.[0m
[32m[I 2022-04-14 03:15:38,783][0m Trial 700 finished with value: 0.65 and parameters: {'loss': 'coxph', 'learning_rate': 0.002993674406770417, 'n_estimators': 158, 'criterion': 'friedman_mse', 'min_samples_split': 5, 'min_samples_leaf': 1, 'min_weight_fraction_leaf': 0.04945532605246762, 'min_impurity_decrease': 0.35786561262921646, 'max_features': 0.9586322258347798, 'subsample': 0.7669498177475469, 'dropout_rate': 0.32294240346067526, 'ccp_alpha': 2.308899028316196}. Best is trial 627 with value: 0.8808013426064705.[0m
[32m[I 2022-04-14 03:15:43,184][0m Trial 701 finished with value: 0.8750646481355705 and parameters: {'loss': 'coxph', 'learning_rate': 0.0021094241261851543, 'n_estimators': 181, 'criterion': 'friedman_mse', 'min_samples_split': 5, 'min_samples_leaf': 1, 'min_weight_fraction_leaf': 0.015587220431051782, 'min_impurity_decrease': 0.21085551110064327, 'max_features': 0.9997613705303005, 'subsample': 0.7565522433095389, 'dropout_rate': 0.38656312664027903, 'ccp_alpha': 0.006204566823740698}. Best is trial 627 with value: 0.8808013426064705.[0m
[32m[I 2022-04-14 03:15:45,538][0m Trial 702 finished with value: 0.8582217980124419 and parameters: {'loss': 'coxph', 'learning_rate': 0.003642841592665694, 'n_estimators': 136, 'criterion': 'friedman_mse', 'min_samples_split': 9, 'min_samples_leaf': 1, 'min_weight_fraction_leaf': 0.038450568524398626, 'min_impurity_decrease': 0.33850265976227495, 'max_features': 0.9788909470848787, 'subsample': 0.7258595521546638, 'dropout_rate': 0.3741872556077065, 'ccp_alpha': 0.1627681883011071}. Best is trial 627 with value: 0.8808013426064705.[0m
[32m[I 2022-04-14 03:15:47,640][0m Trial 703 finished with value: 0.65 and parameters: {'loss': 'coxph', 'learning_rate': 0.0025595855810323863, 'n_estimators': 128, 'criterion': 'friedman_mse', 'min_samples_split': 5, 'min_samples_leaf': 1, 'min_weight_fraction_leaf': 0.024954943918616294, 'min_impurity_decrease': 0.24256780526058977, 'max_features': 0.9411563017396873, 'subsample': 0.7847462667068852, 'dropout_rate': 0.39750102314030317, 'ccp_alpha': 0.4235210536482896}. Best is trial 627 with value: 0.8808013426064705.[0m
[32m[I 2022-04-14 03:15:51,771][0m Trial 704 finished with value: 0.8740424203286077 and parameters: {'loss': 'coxph', 'learning_rate': 0.0019420484212587074, 'n_estimators': 156, 'criterion': 'friedman_mse', 'min_samples_split': 5, 'min_samples_leaf': 1, 'min_weight_fraction_leaf': 0.0019542349179964835, 'min_impurity_decrease': 0.2663334295658017, 'max_features': 0.9596624478243255, 'subsample': 0.7412948698507573, 'dropout_rate': 0.30802118888041563, 'ccp_alpha': 0.0045617999790228585}. Best is trial 627 with value: 0.8808013426064705.[0m
[32m[I 2022-04-14 03:15:57,580][0m Trial 705 finished with value: 0.871925529094236 and parameters: {'loss': 'coxph', 'learning_rate': 0.001795348102886143, 'n_estimators': 191, 'criterion': 'friedman_mse', 'min_samples_split': 4, 'min_samples_leaf': 1, 'min_weight_fraction_leaf': 0.05537713329444237, 'min_impurity_decrease': 0.3748857571749573, 'max_features': 0.9823744965057287, 'subsample': 0.7733196252932962, 'dropout_rate': 0.3540481983933194, 'ccp_alpha': 0.1050449587332085}. Best is trial 627 with value: 0.8808013426064705.[0m
[32m[I 2022-04-14 03:16:00,073][0m Trial 706 finished with value: 0.8734221058129501 and parameters: {'loss': 'coxph', 'learning_rate': 0.0014081314725300942, 'n_estimators': 120, 'criterion': 'friedman_mse', 'min_samples_split': 7, 'min_samples_leaf': 1, 'min_weight_fraction_leaf': 0.041683072830607584, 'min_impurity_decrease': 0.2965521388920841, 'max_features': 0.930132370186061, 'subsample': 0.796803407287227, 'dropout_rate': 0.4067946029582634, 'ccp_alpha': 0.002035811133367588}. Best is trial 627 with value: 0.8808013426064705.[0m
[32m[I 2022-04-14 03:16:05,087][0m Trial 707 finished with value: 0.8462733040892457 and parameters: {'loss': 'coxph', 'learning_rate': 0.00531904117671886, 'n_estimators': 172, 'criterion': 'friedman_mse', 'min_samples_split': 5, 'min_samples_leaf': 1, 'min_weight_fraction_leaf': 0.03143483103156526, 'min_impurity_decrease': 0.32107872939505616, 'max_features': 0.958280407586187, 'subsample': 0.10211290926295108, 'dropout_rate': 0.3765769336362797, 'ccp_alpha': 0.24388020284961914}. Best is trial 627 with value: 0.8808013426064705.[0m
[32m[I 2022-04-14 03:16:08,779][0m Trial 708 finished with value: 0.8679580472470378 and parameters: {'loss': 'coxph', 'learning_rate': 0.003041478526230652, 'n_estimators': 147, 'criterion': 'friedman_mse', 'min_samples_split': 4, 'min_samples_leaf': 1, 'min_weight_fraction_leaf': 0.012764969835275189, 'min_impurity_decrease': 0.3454341419575274, 'max_features': 0.03474047451740958, 'subsample': 0.7557003690151342, 'dropout_rate': 0.3301070517942609, 'ccp_alpha': 0.0017864352070957224}. Best is trial 627 with value: 0.8808013426064705.[0m
[32m[I 2022-04-14 03:16:12,746][0m Trial 709 finished with value: 0.8610273599868243 and parameters: {'loss': 'coxph', 'learning_rate': 0.0025292199949490442, 'n_estimators': 183, 'criterion': 'friedman_mse', 'min_samples_split': 10, 'min_samples_leaf': 1, 'min_weight_fraction_leaf': 0.05294241412904712, 'min_impurity_decrease': 0.2767575270422453, 'max_features': 0.9993267866390129, 'subsample': 0.7200865815616523, 'dropout_rate': 0.40575260406227276, 'ccp_alpha': 0.162286499611291}. Best is trial 627 with value: 0.8808013426064705.[0m
[32m[I 2022-04-14 03:16:18,420][0m Trial 710 finished with value: 0.65 and parameters: {'loss': 'coxph', 'learning_rate': 0.004481450846809674, 'n_estimators': 154, 'criterion': 'absolute_error', 'min_samples_split': 8, 'min_samples_leaf': 1, 'min_weight_fraction_leaf': 0.02205587008310851, 'min_impurity_decrease': 0.3832298554979755, 'max_features': 0.9425641034072924, 'subsample': 0.7773662035342603, 'dropout_rate': 0.34688256395714584, 'ccp_alpha': 4.956881186708722}. Best is trial 627 with value: 0.8808013426064705.[0m
[32m[I 2022-04-14 03:16:21,471][0m Trial 711 finished with value: 0.8737025294984161 and parameters: {'loss': 'coxph', 'learning_rate': 0.0013301607930559752, 'n_estimators': 132, 'criterion': 'friedman_mse', 'min_samples_split': 7, 'min_samples_leaf': 1, 'min_weight_fraction_leaf': 0.041661035539995936, 'min_impurity_decrease': 0.302187642605758, 'max_features': 0.9731294127567436, 'subsample': 0.7306834016617898, 'dropout_rate': 0.36175226960413837, 'ccp_alpha': 0.1026037127182}. Best is trial 627 with value: 0.8808013426064705.[0m
[32m[I 2022-04-14 03:16:34,015][0m Trial 712 finished with value: 0.6576302970240425 and parameters: {'loss': 'coxph', 'learning_rate': 0.0020085039989403497, 'n_estimators': 267, 'criterion': 'friedman_mse', 'min_samples_split': 4, 'min_samples_leaf': 1, 'min_weight_fraction_leaf': 0.031715601222513747, 'min_impurity_decrease': 0.3604923029464653, 'max_features': 0.9229827880088127, 'subsample': 0.7551687654170085, 'dropout_rate': 0.3912515344082893, 'ccp_alpha': 0.3210262049623935}. Best is trial 627 with value: 0.8808013426064705.[0m
[32m[I 2022-04-14 03:16:37,406][0m Trial 713 finished with value: 0.8758815942514291 and parameters: {'loss': 'coxph', 'learning_rate': 0.0035843847660317774, 'n_estimators': 139, 'criterion': 'friedman_mse', 'min_samples_split': 5, 'min_samples_leaf': 1, 'min_weight_fraction_leaf': 0.05241613155381989, 'min_impurity_decrease': 0.5354366194004038, 'max_features': 0.9597846427199644, 'subsample': 0.6994839320255045, 'dropout_rate': 0.30817743936686925, 'ccp_alpha': 0.0018464175534078115}. Best is trial 627 with value: 0.8808013426064705.[0m
[32m[I 2022-04-14 03:16:40,535][0m Trial 714 finished with value: 0.8552391667979098 and parameters: {'loss': 'coxph', 'learning_rate': 0.006283146372674495, 'n_estimators': 127, 'criterion': 'friedman_mse', 'min_samples_split': 5, 'min_samples_leaf': 1, 'min_weight_fraction_leaf': 0.05718198741447619, 'min_impurity_decrease': 0.5363016391304961, 'max_features': 0.9586425362456873, 'subsample': 0.6702537604687291, 'dropout_rate': 0.2870263855266474, 'ccp_alpha': 0.1903809371886384}. Best is trial 627 with value: 0.8808013426064705.[0m
[32m[I 2022-04-14 03:16:44,648][0m Trial 715 finished with value: 0.8716058248884103 and parameters: {'loss': 'coxph', 'learning_rate': 0.004487075449209451, 'n_estimators': 146, 'criterion': 'friedman_mse', 'min_samples_split': 5, 'min_samples_leaf': 1, 'min_weight_fraction_leaf': 0.05095485686156857, 'min_impurity_decrease': 0.5304585029506241, 'max_features': 0.9774128429716422, 'subsample': 0.6648132761453207, 'dropout_rate': 0.3114478295819947, 'ccp_alpha': 0.09089326315960673}. Best is trial 627 with value: 0.8808013426064705.[0m
[32m[I 2022-04-14 03:16:48,042][0m Trial 716 finished with value: 0.8675598032760459 and parameters: {'loss': 'coxph', 'learning_rate': 0.003668159142032324, 'n_estimators': 142, 'criterion': 'friedman_mse', 'min_samples_split': 5, 'min_samples_leaf': 1, 'min_weight_fraction_leaf': 0.05861799873538808, 'min_impurity_decrease': 0.23413953728525286, 'max_features': 0.940717732045806, 'subsample': 0.6840455398722165, 'dropout_rate': 0.300937918141686, 'ccp_alpha': 0.09549239889476019}. Best is trial 627 with value: 0.8808013426064705.[0m
[32m[I 2022-04-14 03:16:51,357][0m Trial 717 finished with value: 0.65 and parameters: {'loss': 'coxph', 'learning_rate': 0.0034325159737295754, 'n_estimators': 141, 'criterion': 'squared_error', 'min_samples_split': 5, 'min_samples_leaf': 1, 'min_weight_fraction_leaf': 0.045565907491616514, 'min_impurity_decrease': 0.5442361141688111, 'max_features': 0.9575148775760616, 'subsample': 0.6993381794257919, 'dropout_rate': 0.3301245080037898, 'ccp_alpha': 0.221606688475889}. Best is trial 627 with value: 0.8808013426064705.[0m
[32m[I 2022-04-14 03:16:55,730][0m Trial 718 finished with value: 0.875544639719385 and parameters: {'loss': 'coxph', 'learning_rate': 0.00294883839155168, 'n_estimators': 138, 'criterion': 'friedman_mse', 'min_samples_split': 5, 'min_samples_leaf': 1, 'min_weight_fraction_leaf': 0.04981294467666886, 'min_impurity_decrease': 0.3248037610744729, 'max_features': 0.9328018187943797, 'subsample': 0.7087902440637858, 'dropout_rate': 0.2861729047883569, 'ccp_alpha': 0.001877832758194974}. Best is trial 627 with value: 0.8808013426064705.[0m
[32m[I 2022-04-14 03:16:59,049][0m Trial 719 finished with value: -0.3659681982917378 and parameters: {'loss': 'squared', 'learning_rate': 0.007853889900048741, 'n_estimators': 133, 'criterion': 'friedman_mse', 'min_samples_split': 5, 'min_samples_leaf': 1, 'min_weight_fraction_leaf': 0.042999279294008624, 'min_impurity_decrease': 0.27942886063669403, 'max_features': 0.980568635325324, 'subsample': 0.6936259104534358, 'dropout_rate': 0.31172147686944124, 'ccp_alpha': 0.16407441218980834}. Best is trial 627 with value: 0.8808013426064705.[0m
[32m[I 2022-04-14 03:17:04,571][0m Trial 720 finished with value: 0.86381582066319 and parameters: {'loss': 'coxph', 'learning_rate': 0.004108130312325216, 'n_estimators': 163, 'criterion': 'friedman_mse', 'min_samples_split': 5, 'min_samples_leaf': 1, 'min_weight_fraction_leaf': 0.057695290705674716, 'min_impurity_decrease': 0.3397928165906753, 'max_features': 0.5097539070865693, 'subsample': 0.7228997914905029, 'dropout_rate': 0.3599405242328058, 'ccp_alpha': 0.10236758758864199}. Best is trial 627 with value: 0.8808013426064705.[0m
[32m[I 2022-04-14 03:17:07,944][0m Trial 721 finished with value: 0.835849102109613 and parameters: {'loss': 'coxph', 'learning_rate': 0.002404325513827418, 'n_estimators': 151, 'criterion': 'friedman_mse', 'min_samples_split': 5, 'min_samples_leaf': 1, 'min_weight_fraction_leaf': 0.040076189337134874, 'min_impurity_decrease': 0.5143403649611717, 'max_features': 0.5853887956169372, 'subsample': 0.19118080508967245, 'dropout_rate': 0.3542773876323721, 'ccp_alpha': 0.3258364887685058}. Best is trial 627 with value: 0.8808013426064705.[0m
