[32m[I 2022-04-19 03:39:33,639][0m Trial 163 finished with value: 0.6497730940634838 and parameters: {'n_hidden': 2048, 'mixture_components': 2, 'use_sparse_layer': False, 'use_batchnorm': False, 'use_dropout': True, 'dropout': 0.8222203962567213, 'mlp_size_1': 7, 'mlp_size_2': 0, 'mlp_size_3': 0, 'kernel': 'Gamma', 'loss_name': 'CensoredNLLLoss'}. Best is trial 142 with value: 0.7103637692860825.[0m
[32m[I 2022-04-19 03:42:07,577][0m Trial 164 finished with value: 0.6491227030652691 and parameters: {'n_hidden': 2048, 'mixture_components': 3, 'use_sparse_layer': False, 'use_batchnorm': False, 'use_dropout': True, 'dropout': 0.5962382499596766, 'mlp_size_1': 8, 'mlp_size_2': 0, 'mlp_size_3': 0, 'kernel': 'Gamma', 'loss_name': 'CensoredNLLLoss'}. Best is trial 142 with value: 0.7103637692860825.[0m
[32m[I 2022-04-19 03:44:51,435][0m Trial 165 finished with value: 0.6863679348435421 and parameters: {'n_hidden': 64, 'mixture_components': 4, 'use_sparse_layer': True, 'use_sparse_loss': True, 'lmbd': 5.170811856253269e-05, 'use_batchnorm': False, 'use_dropout': True, 'dropout': 0.45350517386174277, 'mlp_size_1': 3, 'mlp_size_2': 0, 'mlp_size_3': 0, 'kernel': 'Gamma', 'loss_name': 'NLLLoss'}. Best is trial 142 with value: 0.7103637692860825.[0m
[32m[I 2022-04-19 03:47:12,434][0m Trial 166 finished with value: 0.675012026259353 and parameters: {'n_hidden': 2048, 'mixture_components': 7, 'use_sparse_layer': True, 'use_sparse_loss': True, 'lmbd': 8.840271067574445e-05, 'use_batchnorm': False, 'use_dropout': True, 'dropout': 0.6575946151924641, 'mlp_size_1': 7, 'mlp_size_2': 0, 'mlp_size_3': 0, 'kernel': 'Gamma', 'loss_name': 'AlternativeNLLLoss'}. Best is trial 142 with value: 0.7103637692860825.[0m
[32m[I 2022-04-19 03:49:21,735][0m Trial 167 finished with value: 0.6585862484226797 and parameters: {'n_hidden': 128, 'mixture_components': 6, 'use_sparse_layer': True, 'use_sparse_loss': True, 'lmbd': 1.3683330361360713e-06, 'use_batchnorm': False, 'use_dropout': True, 'dropout': 0.6951676419634122, 'mlp_size_1': 4, 'mlp_size_2': 0, 'mlp_size_3': 0, 'kernel': 'Gamma', 'loss_name': 'CensoredNLLLoss'}. Best is trial 142 with value: 0.7103637692860825.[0m
[32m[I 2022-04-19 03:50:55,910][0m Trial 168 finished with value: 0.6503379757245069 and parameters: {'n_hidden': 2048, 'mixture_components': 3, 'use_sparse_layer': False, 'use_batchnorm': False, 'use_dropout': False, 'mlp_size_1': 7, 'mlp_size_2': 1, 'mlp_size_3': 0, 'kernel': 'Gamma', 'loss_name': 'CensoredNLLLoss'}. Best is trial 142 with value: 0.7103637692860825.[0m
[32m[I 2022-04-19 03:52:53,896][0m Trial 169 finished with value: 0.5438191870360838 and parameters: {'n_hidden': 32, 'mixture_components': 2, 'use_sparse_layer': True, 'use_sparse_loss': True, 'lmbd': 0.00023438785080370263, 'use_batchnorm': False, 'use_dropout': True, 'dropout': 0.9792487351106476, 'mlp_size_1': 2, 'mlp_size_2': 0, 'mlp_size_3': 0, 'kernel': 'Exponential', 'loss_name': 'AlternativeNLLLoss'}. Best is trial 142 with value: 0.7103637692860825.[0m
[32m[I 2022-04-19 03:55:11,980][0m Trial 170 finished with value: 0.665633997078828 and parameters: {'n_hidden': 2048, 'mixture_components': 6, 'use_sparse_layer': True, 'use_sparse_loss': False, 'use_batchnorm': False, 'use_dropout': True, 'dropout': 0.5146167492766544, 'mlp_size_1': 8, 'mlp_size_2': 0, 'mlp_size_3': 0, 'kernel': 'Gamma', 'loss_name': 'CensoredNLLLoss'}. Best is trial 142 with value: 0.7103637692860825.[0m
[32m[I 2022-04-19 03:56:57,955][0m Trial 171 finished with value: 0.6886292562677764 and parameters: {'n_hidden': 1024, 'mixture_components': 6, 'use_sparse_layer': True, 'use_sparse_loss': True, 'lmbd': 0.00044934096696385535, 'use_batchnorm': False, 'use_dropout': True, 'dropout': 0.831925820366046, 'mlp_size_1': 6, 'mlp_size_2': 1, 'mlp_size_3': 0, 'kernel': 'Gamma', 'loss_name': 'NLLLoss'}. Best is trial 142 with value: 0.7103637692860825.[0m
[32m[I 2022-04-19 03:59:09,786][0m Trial 172 finished with value: 0.6879249376101572 and parameters: {'n_hidden': 1024, 'mixture_components': 6, 'use_sparse_layer': True, 'use_sparse_loss': True, 'lmbd': 0.00030403793467673803, 'use_batchnorm': False, 'use_dropout': True, 'dropout': 0.7608750773801336, 'mlp_size_1': 1, 'mlp_size_2': 4, 'mlp_size_3': 1, 'kernel': 'Gamma', 'loss_name': 'NLLLoss'}. Best is trial 142 with value: 0.7103637692860825.[0m
[32m[I 2022-04-19 04:01:43,027][0m Trial 173 finished with value: 0.680712295374916 and parameters: {'n_hidden': 1024, 'mixture_components': 5, 'use_sparse_layer': True, 'use_sparse_loss': True, 'lmbd': 0.001077906014562536, 'use_batchnorm': False, 'use_dropout': True, 'dropout': 0.7888042205001345, 'mlp_size_1': 6, 'mlp_size_2': 1, 'mlp_size_3': 0, 'kernel': 'Gamma', 'loss_name': 'NLLLoss'}. Best is trial 142 with value: 0.7103637692860825.[0m
[32m[I 2022-04-19 04:04:56,357][0m Trial 174 finished with value: 0.6684528697564622 and parameters: {'n_hidden': 2048, 'mixture_components': 6, 'use_sparse_layer': True, 'use_sparse_loss': True, 'lmbd': 0.00644314550330922, 'use_batchnorm': False, 'use_dropout': True, 'dropout': 0.8069618984340489, 'mlp_size_1': 7, 'mlp_size_2': 1, 'mlp_size_3': 0, 'kernel': 'Gamma', 'loss_name': 'NLLLoss'}. Best is trial 142 with value: 0.7103637692860825.[0m
[32m[I 2022-04-19 04:07:21,045][0m Trial 175 finished with value: 0.678766137937034 and parameters: {'n_hidden': 1024, 'mixture_components': 5, 'use_sparse_layer': True, 'use_sparse_loss': True, 'lmbd': 0.002285690636512647, 'use_batchnorm': False, 'use_dropout': True, 'dropout': 0.7358606464561603, 'mlp_size_1': 6, 'mlp_size_2': 1, 'mlp_size_3': 0, 'kernel': 'Gamma', 'loss_name': 'NLLLoss'}. Best is trial 142 with value: 0.7103637692860825.[0m
[32m[I 2022-04-19 04:09:24,548][0m Trial 176 finished with value: 0.652102920644976 and parameters: {'n_hidden': 2048, 'mixture_components': 3, 'use_sparse_layer': True, 'use_sparse_loss': True, 'lmbd': 2.256747700954811e-06, 'use_batchnorm': False, 'use_dropout': True, 'dropout': 0.42965615769802645, 'mlp_size_1': 7, 'mlp_size_2': 1, 'mlp_size_3': 0, 'kernel': 'LogLogistic', 'loss_name': 'CensoredNLLLoss'}. Best is trial 142 with value: 0.7103637692860825.[0m
[32m[I 2022-04-19 04:11:37,051][0m Trial 177 finished with value: 0.6789673693754528 and parameters: {'n_hidden': 2048, 'mixture_components': 6, 'use_sparse_layer': True, 'use_sparse_loss': True, 'lmbd': 0.0001657449116430685, 'use_batchnorm': False, 'use_dropout': True, 'dropout': 0.6295906513189423, 'mlp_size_1': 8, 'mlp_size_2': 0, 'mlp_size_3': 0, 'kernel': 'Gamma', 'loss_name': 'AlternativeNLLLoss'}. Best is trial 142 with value: 0.7103637692860825.[0m
[32m[I 2022-04-19 04:14:09,848][0m Trial 178 finished with value: 0.7002174213489066 and parameters: {'n_hidden': 2048, 'mixture_components': 2, 'use_sparse_layer': True, 'use_sparse_loss': True, 'lmbd': 0.00035698735592154984, 'use_batchnorm': False, 'use_dropout': True, 'dropout': 0.5713150870079761, 'mlp_size_1': 7, 'mlp_size_2': 1, 'mlp_size_3': 0, 'kernel': 'Gamma', 'loss_name': 'NLLLoss'}. Best is trial 142 with value: 0.7103637692860825.[0m
[32m[I 2022-04-19 04:16:10,693][0m Trial 179 finished with value: 0.6917884383808083 and parameters: {'n_hidden': 2048, 'mixture_components': 2, 'use_sparse_layer': True, 'use_sparse_loss': True, 'lmbd': 0.00013262882155160835, 'use_batchnorm': False, 'use_dropout': True, 'dropout': 0.5623958121209884, 'mlp_size_1': 7, 'mlp_size_2': 0, 'mlp_size_3': 0, 'kernel': 'Gamma', 'loss_name': 'CensoredNLLLoss'}. Best is trial 142 with value: 0.7103637692860825.[0m
[32m[I 2022-04-19 04:18:29,363][0m Trial 180 finished with value: 0.6745068616778099 and parameters: {'n_hidden': 2048, 'mixture_components': 2, 'use_sparse_layer': True, 'use_sparse_loss': True, 'lmbd': 2.689624158452376e-05, 'use_batchnorm': False, 'use_dropout': True, 'dropout': 0.5614876041381553, 'mlp_size_1': 7, 'mlp_size_2': 1, 'mlp_size_3': 0, 'kernel': 'Gamma', 'loss_name': 'CensoredNLLLoss'}. Best is trial 142 with value: 0.7103637692860825.[0m
[32m[I 2022-04-19 04:20:36,011][0m Trial 181 finished with value: 0.6679275819862782 and parameters: {'n_hidden': 2048, 'mixture_components': 2, 'use_sparse_layer': True, 'use_sparse_loss': True, 'lmbd': 0.00014044472215729115, 'use_batchnorm': False, 'use_dropout': True, 'dropout': 0.5820645258950742, 'mlp_size_1': 7, 'mlp_size_2': 0, 'mlp_size_3': 0, 'kernel': 'Gamma', 'loss_name': 'CensoredNLLLoss'}. Best is trial 142 with value: 0.7103637692860825.[0m
[32m[I 2022-04-19 04:22:47,576][0m Trial 182 finished with value: 0.6876952817038234 and parameters: {'n_hidden': 2048, 'mixture_components': 2, 'use_sparse_layer': True, 'use_sparse_loss': True, 'lmbd': 3.892891360141517e-05, 'use_batchnorm': False, 'use_dropout': True, 'dropout': 0.5459636667241413, 'mlp_size_1': 7, 'mlp_size_2': 0, 'mlp_size_3': 0, 'kernel': 'Gamma', 'loss_name': 'CensoredNLLLoss'}. Best is trial 142 with value: 0.7103637692860825.[0m
[32m[I 2022-04-19 04:25:09,558][0m Trial 183 finished with value: 0.6857185348370207 and parameters: {'n_hidden': 2048, 'mixture_components': 2, 'use_sparse_layer': True, 'use_sparse_loss': True, 'lmbd': 0.00019373822401255058, 'use_batchnorm': False, 'use_dropout': True, 'dropout': 0.5335203448264417, 'mlp_size_1': 7, 'mlp_size_2': 0, 'mlp_size_3': 0, 'kernel': 'Gamma', 'loss_name': 'CensoredNLLLoss'}. Best is trial 142 with value: 0.7103637692860825.[0m
[32m[I 2022-04-19 04:27:15,571][0m Trial 184 finished with value: 0.6341649234866427 and parameters: {'n_hidden': 2048, 'mixture_components': 2, 'use_sparse_layer': True, 'use_sparse_loss': True, 'lmbd': 7.914336175449464e-05, 'use_batchnorm': False, 'use_dropout': True, 'dropout': 0.6066667604478089, 'mlp_size_1': 7, 'mlp_size_2': 0, 'mlp_size_3': 0, 'kernel': 'Normal', 'loss_name': 'CensoredNLLLoss'}. Best is trial 142 with value: 0.7103637692860825.[0m
[32m[I 2022-04-19 04:29:55,795][0m Trial 185 finished with value: 0.7085346963863657 and parameters: {'n_hidden': 2048, 'mixture_components': 2, 'use_sparse_layer': True, 'use_sparse_loss': True, 'lmbd': 0.0003753828944033559, 'use_batchnorm': False, 'use_dropout': True, 'dropout': 0.47019781950212575, 'mlp_size_1': 7, 'mlp_size_2': 0, 'mlp_size_3': 0, 'kernel': 'Gamma', 'loss_name': 'NLLLoss'}. Best is trial 142 with value: 0.7103637692860825.[0m
[32m[I 2022-04-19 04:31:23,776][0m Trial 186 finished with value: 0.6605931108270158 and parameters: {'n_hidden': 2048, 'mixture_components': 1, 'use_sparse_layer': True, 'use_sparse_loss': True, 'lmbd': 0.00034010467259636416, 'use_batchnorm': False, 'use_dropout': False, 'mlp_size_1': 7, 'mlp_size_2': 0, 'mlp_size_3': 0, 'kernel': 'Gamma', 'loss_name': 'NLLLoss'}. Best is trial 142 with value: 0.7103637692860825.[0m
[32m[I 2022-04-19 04:33:15,940][0m Trial 187 finished with value: 0.5800093226794096 and parameters: {'n_hidden': 2048, 'mixture_components': 2, 'use_sparse_layer': False, 'use_batchnorm': False, 'use_dropout': True, 'dropout': 0.49010520488754616, 'mlp_size_1': 8, 'mlp_size_2': 0, 'mlp_size_3': 0, 'kernel': 'Gumbel', 'loss_name': 'NLLLoss'}. Best is trial 142 with value: 0.7103637692860825.[0m
[32m[I 2022-04-19 04:35:45,367][0m Trial 188 finished with value: 0.6589993284774555 and parameters: {'n_hidden': 2048, 'mixture_components': 2, 'use_sparse_layer': True, 'use_sparse_loss': True, 'lmbd': 0.000550773402014512, 'use_batchnorm': False, 'use_dropout': True, 'dropout': 0.5780220855637872, 'mlp_size_1': 7, 'mlp_size_2': 0, 'mlp_size_3': 0, 'kernel': 'Gamma', 'loss_name': 'NLLLoss'}. Best is trial 142 with value: 0.7103637692860825.[0m
[32m[I 2022-04-19 04:37:47,811][0m Trial 189 finished with value: 0.6907861069997319 and parameters: {'n_hidden': 2048, 'mixture_components': 2, 'use_sparse_layer': True, 'use_sparse_loss': True, 'lmbd': 7.209297226328647e-06, 'use_batchnorm': False, 'use_dropout': True, 'dropout': 0.515887683510948, 'mlp_size_1': 7, 'mlp_size_2': 0, 'mlp_size_3': 0, 'kernel': 'Gamma', 'loss_name': 'NLLLoss'}. Best is trial 142 with value: 0.7103637692860825.[0m
[32m[I 2022-04-19 04:44:35,305][0m Trial 190 finished with value: 0.6902877139457828 and parameters: {'n_hidden': 2048, 'mixture_components': 1, 'use_sparse_layer': True, 'use_sparse_loss': True, 'lmbd': 0.000257845122428368, 'use_batchnorm': True, 'use_dropout': True, 'dropout': 0.19128739213746565, 'mlp_size_1': 8, 'mlp_size_2': 0, 'mlp_size_3': 0, 'kernel': 'Gamma', 'loss_name': 'NLLLoss'}. Best is trial 142 with value: 0.7103637692860825.[0m
[32m[I 2022-04-19 04:46:41,132][0m Trial 191 finished with value: 0.6995380288051601 and parameters: {'n_hidden': 2048, 'mixture_components': 2, 'use_sparse_layer': True, 'use_sparse_loss': True, 'lmbd': 0.00011954854715777182, 'use_batchnorm': False, 'use_dropout': True, 'dropout': 0.4747612067590118, 'mlp_size_1': 7, 'mlp_size_2': 0, 'mlp_size_3': 0, 'kernel': 'Gamma', 'loss_name': 'CensoredNLLLoss'}. Best is trial 142 with value: 0.7103637692860825.[0m
[32m[I 2022-04-19 04:48:58,063][0m Trial 192 finished with value: 0.6688559387468493 and parameters: {'n_hidden': 2048, 'mixture_components': 2, 'use_sparse_layer': True, 'use_sparse_loss': True, 'lmbd': 0.00010395575785251092, 'use_batchnorm': False, 'use_dropout': True, 'dropout': 0.46633986663176397, 'mlp_size_1': 7, 'mlp_size_2': 0, 'mlp_size_3': 0, 'kernel': 'Gamma', 'loss_name': 'CensoredNLLLoss'}. Best is trial 142 with value: 0.7103637692860825.[0m
[32m[I 2022-04-19 04:51:26,566][0m Trial 193 finished with value: 0.6685655751779702 and parameters: {'n_hidden': 2048, 'mixture_components': 2, 'use_sparse_layer': True, 'use_sparse_loss': True, 'lmbd': 0.00012910459696584655, 'use_batchnorm': False, 'use_dropout': True, 'dropout': 0.5007625689729563, 'mlp_size_1': 7, 'mlp_size_2': 0, 'mlp_size_3': 0, 'kernel': 'Gamma', 'loss_name': 'CensoredNLLLoss'}. Best is trial 142 with value: 0.7103637692860825.[0m
[32m[I 2022-04-19 04:53:24,374][0m Trial 194 finished with value: 0.6840566223737563 and parameters: {'n_hidden': 2048, 'mixture_components': 3, 'use_sparse_layer': True, 'use_sparse_loss': True, 'lmbd': 0.0007455276321790788, 'use_batchnorm': False, 'use_dropout': True, 'dropout': 0.5650764447523561, 'mlp_size_1': 7, 'mlp_size_2': 0, 'mlp_size_3': 0, 'kernel': 'Gamma', 'loss_name': 'CensoredNLLLoss'}. Best is trial 142 with value: 0.7103637692860825.[0m
[32m[I 2022-04-19 04:56:25,031][0m Trial 195 finished with value: 0.6822481662087617 and parameters: {'n_hidden': 2048, 'mixture_components': 2, 'use_sparse_layer': True, 'use_sparse_loss': True, 'lmbd': 6.756323281843153e-05, 'use_batchnorm': False, 'use_dropout': True, 'dropout': 0.5331749358114869, 'mlp_size_1': 8, 'mlp_size_2': 0, 'mlp_size_3': 0, 'kernel': 'Gamma', 'loss_name': 'CensoredNLLLoss'}. Best is trial 142 with value: 0.7103637692860825.[0m
[32m[I 2022-04-19 04:58:26,760][0m Trial 196 finished with value: 0.6831191585991407 and parameters: {'n_hidden': 128, 'mixture_components': 3, 'use_sparse_layer': True, 'use_sparse_loss': True, 'lmbd': 0.0003724041149987136, 'use_batchnorm': False, 'use_dropout': True, 'dropout': 0.47786074781770627, 'mlp_size_1': 4, 'mlp_size_2': 0, 'mlp_size_3': 0, 'kernel': 'Gamma', 'loss_name': 'CensoredNLLLoss'}. Best is trial 142 with value: 0.7103637692860825.[0m
[32m[I 2022-04-19 05:01:04,441][0m Trial 197 finished with value: 0.6897020243399383 and parameters: {'n_hidden': 2048, 'mixture_components': 2, 'use_sparse_layer': True, 'use_sparse_loss': True, 'lmbd': 2.789374491346766e-06, 'use_batchnorm': False, 'use_dropout': True, 'dropout': 0.6460589518888409, 'mlp_size_1': 7, 'mlp_size_2': 0, 'mlp_size_3': 0, 'kernel': 'Gamma', 'loss_name': 'CensoredNLLLoss'}. Best is trial 142 with value: 0.7103637692860825.[0m
[32m[I 2022-04-19 05:02:47,951][0m Trial 198 finished with value: 0.5894750558766348 and parameters: {'n_hidden': 32, 'mixture_components': 2, 'use_sparse_layer': True, 'use_sparse_loss': True, 'lmbd': 1.8739660596039253e-05, 'use_batchnorm': False, 'use_dropout': True, 'dropout': 0.5903541605076856, 'mlp_size_1': 2, 'mlp_size_2': 0, 'mlp_size_3': 0, 'kernel': 'Weibull', 'loss_name': 'NLLLoss'}. Best is trial 142 with value: 0.7103637692860825.[0m
[32m[I 2022-04-19 05:04:30,415][0m Trial 199 finished with value: 0.5985925900967161 and parameters: {'n_hidden': 2048, 'mixture_components': 3, 'use_sparse_layer': False, 'use_batchnorm': False, 'use_dropout': True, 'dropout': 0.31698953582346756, 'mlp_size_1': 7, 'mlp_size_2': 1, 'mlp_size_3': 0, 'kernel': 'Logistic', 'loss_name': 'CensoredNLLLoss'}. Best is trial 142 with value: 0.7103637692860825.[0m
[32m[I 2022-04-19 05:06:02,148][0m Trial 200 finished with value: 0.67741005830753 and parameters: {'n_hidden': 512, 'mixture_components': 2, 'use_sparse_layer': True, 'use_sparse_loss': True, 'lmbd': 5.345563066829962e-05, 'use_batchnorm': False, 'use_dropout': False, 'mlp_size_1': 6, 'mlp_size_2': 0, 'mlp_size_3': 0, 'kernel': 'Gamma', 'loss_name': 'CensoredNLLLoss'}. Best is trial 142 with value: 0.7103637692860825.[0m
[32m[I 2022-04-19 05:08:19,068][0m Trial 201 finished with value: 0.686215960268529 and parameters: {'n_hidden': 2048, 'mixture_components': 3, 'use_sparse_layer': True, 'use_sparse_loss': True, 'lmbd': 0.0002041736393339318, 'use_batchnorm': False, 'use_dropout': True, 'dropout': 0.44067685130060924, 'mlp_size_1': 7, 'mlp_size_2': 0, 'mlp_size_3': 0, 'kernel': 'Gamma', 'loss_name': 'AlternativeNLLLoss'}. Best is trial 142 with value: 0.7103637692860825.[0m
[32m[I 2022-04-19 05:10:37,894][0m Trial 202 finished with value: 0.6691581722849047 and parameters: {'n_hidden': 2048, 'mixture_components': 2, 'use_sparse_layer': True, 'use_sparse_loss': True, 'lmbd': 0.00026140316795645306, 'use_batchnorm': False, 'use_dropout': True, 'dropout': 0.3960411660241686, 'mlp_size_1': 7, 'mlp_size_2': 0, 'mlp_size_3': 0, 'kernel': 'Gamma', 'loss_name': 'AlternativeNLLLoss'}. Best is trial 142 with value: 0.7103637692860825.[0m
[32m[I 2022-04-19 05:12:57,730][0m Trial 203 finished with value: 0.6964977481854069 and parameters: {'n_hidden': 2048, 'mixture_components': 3, 'use_sparse_layer': True, 'use_sparse_loss': True, 'lmbd': 0.00016116563111858776, 'use_batchnorm': False, 'use_dropout': True, 'dropout': 0.46079740751333886, 'mlp_size_1': 7, 'mlp_size_2': 0, 'mlp_size_3': 0, 'kernel': 'Gamma', 'loss_name': 'CensoredNLLLoss'}. Best is trial 142 with value: 0.7103637692860825.[0m
[32m[I 2022-04-19 05:15:57,680][0m Trial 204 finished with value: 0.6823990483968825 and parameters: {'n_hidden': 2048, 'mixture_components': 3, 'use_sparse_layer': True, 'use_sparse_loss': True, 'lmbd': 1.0211895690391615e-06, 'use_batchnorm': False, 'use_dropout': True, 'dropout': 0.46899056917163207, 'mlp_size_1': 7, 'mlp_size_2': 0, 'mlp_size_3': 0, 'kernel': 'Gamma', 'loss_name': 'CensoredNLLLoss'}. Best is trial 142 with value: 0.7103637692860825.[0m
[32m[I 2022-04-19 05:18:39,463][0m Trial 205 finished with value: 0.6375421994851088 and parameters: {'n_hidden': 2048, 'mixture_components': 3, 'use_sparse_layer': True, 'use_sparse_loss': False, 'use_batchnorm': False, 'use_dropout': True, 'dropout': 0.5074735724284254, 'mlp_size_1': 7, 'mlp_size_2': 0, 'mlp_size_3': 0, 'kernel': 'LogNormal', 'loss_name': 'CensoredNLLLoss'}. Best is trial 142 with value: 0.7103637692860825.[0m
[32m[I 2022-04-19 05:21:02,175][0m Trial 206 finished with value: 0.6929241422688369 and parameters: {'n_hidden': 2048, 'mixture_components': 3, 'use_sparse_layer': True, 'use_sparse_loss': True, 'lmbd': 9.673589656178643e-05, 'use_batchnorm': False, 'use_dropout': True, 'dropout': 0.48915897073059905, 'mlp_size_1': 7, 'mlp_size_2': 0, 'mlp_size_3': 0, 'kernel': 'Gamma', 'loss_name': 'CensoredNLLLoss'}. Best is trial 142 with value: 0.7103637692860825.[0m
[32m[I 2022-04-19 05:23:24,131][0m Trial 207 finished with value: 0.6878569802740981 and parameters: {'n_hidden': 2048, 'mixture_components': 3, 'use_sparse_layer': True, 'use_sparse_loss': True, 'lmbd': 8.095124734993641e-05, 'use_batchnorm': False, 'use_dropout': True, 'dropout': 0.5475327733433386, 'mlp_size_1': 7, 'mlp_size_2': 0, 'mlp_size_3': 0, 'kernel': 'Gamma', 'loss_name': 'CensoredNLLLoss'}. Best is trial 142 with value: 0.7103637692860825.[0m
[32m[I 2022-04-19 05:27:06,365][0m Trial 208 finished with value: 0.6453701596384918 and parameters: {'n_hidden': 2048, 'mixture_components': 2, 'use_sparse_layer': True, 'use_sparse_loss': True, 'lmbd': 0.00010483066540835496, 'use_batchnorm': True, 'use_dropout': True, 'dropout': 0.6099777891578433, 'mlp_size_1': 8, 'mlp_size_2': 0, 'mlp_size_3': 0, 'kernel': 'Gamma', 'loss_name': 'CensoredNLLLoss'}. Best is trial 142 with value: 0.7103637692860825.[0m
[32m[I 2022-04-19 05:29:31,622][0m Trial 209 finished with value: 0.6942859931687342 and parameters: {'n_hidden': 2048, 'mixture_components': 2, 'use_sparse_layer': True, 'use_sparse_loss': True, 'lmbd': 0.0005103849154219904, 'use_batchnorm': False, 'use_dropout': True, 'dropout': 0.48883054748146504, 'mlp_size_1': 7, 'mlp_size_2': 0, 'mlp_size_3': 0, 'kernel': 'Gamma', 'loss_name': 'NLLLoss'}. Best is trial 142 with value: 0.7103637692860825.[0m
[32m[I 2022-04-19 05:31:54,147][0m Trial 210 finished with value: 0.690867721095308 and parameters: {'n_hidden': 64, 'mixture_components': 3, 'use_sparse_layer': True, 'use_sparse_loss': True, 'lmbd': 0.0004822554238477704, 'use_batchnorm': False, 'use_dropout': True, 'dropout': 0.4890806732776164, 'mlp_size_1': 3, 'mlp_size_2': 0, 'mlp_size_3': 0, 'kernel': 'Gamma', 'loss_name': 'NLLLoss'}. Best is trial 142 with value: 0.7103637692860825.[0m
