[32m[I 2022-04-14 15:30:43,295][0m Trial 883 finished with value: 0.7419043254827317 and parameters: {'loss': 'coxph', 'learning_rate': 0.0027835924536121666, 'n_estimators': 341, 'criterion': 'friedman_mse', 'min_samples_split': 2, 'min_samples_leaf': 1, 'min_weight_fraction_leaf': 0.030067924754091282, 'min_impurity_decrease': 0.3637965064394906, 'max_features': 0.9805742357032471, 'subsample': 0.8241900326183238, 'dropout_rate': 0.47033249609172284, 'ccp_alpha': 0.09380007802983392}. Best is trial 677 with value: 0.7600100187343619.[0m
[32m[I 2022-04-14 15:30:57,465][0m Trial 884 finished with value: 0.7016026434695624 and parameters: {'loss': 'coxph', 'learning_rate': 1.001536340135165e-05, 'n_estimators': 370, 'criterion': 'friedman_mse', 'min_samples_split': 2, 'min_samples_leaf': 1, 'min_weight_fraction_leaf': 0.06417070455361297, 'min_impurity_decrease': 0.3840586444619729, 'max_features': 0.936286193517903, 'subsample': 0.7899823558583285, 'dropout_rate': 0.4249469543580015, 'ccp_alpha': 0.16844499338482433}. Best is trial 677 with value: 0.7600100187343619.[0m
[32m[I 2022-04-14 15:31:11,043][0m Trial 885 finished with value: 0.5 and parameters: {'loss': 'coxph', 'learning_rate': 0.006677611518113667, 'n_estimators': 392, 'criterion': 'friedman_mse', 'min_samples_split': 2, 'min_samples_leaf': 1, 'min_weight_fraction_leaf': 0.042887272594497296, 'min_impurity_decrease': 0.48328185703403964, 'max_features': 0.1738648467218052, 'subsample': 0.851352601026165, 'dropout_rate': 0.530512739073368, 'ccp_alpha': 0.7812194031504378}. Best is trial 677 with value: 0.7600100187343619.[0m
[32m[I 2022-04-14 15:31:25,432][0m Trial 886 finished with value: 0.7554143465402111 and parameters: {'loss': 'coxph', 'learning_rate': 0.004810636365005191, 'n_estimators': 342, 'criterion': 'friedman_mse', 'min_samples_split': 2, 'min_samples_leaf': 2, 'min_weight_fraction_leaf': 0.053948885934065376, 'min_impurity_decrease': 0.5171298480018269, 'max_features': 0.9046051155164723, 'subsample': 0.7217444233881528, 'dropout_rate': 0.38037384571891825, 'ccp_alpha': 0.0012893301333217746}. Best is trial 677 with value: 0.7600100187343619.[0m
[32m[I 2022-04-14 15:31:38,151][0m Trial 887 finished with value: 0.7482771549972483 and parameters: {'loss': 'coxph', 'learning_rate': 0.003824401780430944, 'n_estimators': 317, 'criterion': 'friedman_mse', 'min_samples_split': 2, 'min_samples_leaf': 2, 'min_weight_fraction_leaf': 0.07560541566782261, 'min_impurity_decrease': 0.5399659499202553, 'max_features': 0.9018111872642822, 'subsample': 0.6843258006451293, 'dropout_rate': 0.34978321642130117, 'ccp_alpha': 0.003266391867723863}. Best is trial 677 with value: 0.7600100187343619.[0m
[32m[I 2022-04-14 15:31:50,755][0m Trial 888 finished with value: 0.7340939438637284 and parameters: {'loss': 'coxph', 'learning_rate': 0.0029803383219799934, 'n_estimators': 328, 'criterion': 'friedman_mse', 'min_samples_split': 2, 'min_samples_leaf': 2, 'min_weight_fraction_leaf': 0.058134861617109276, 'min_impurity_decrease': 0.5158974561552918, 'max_features': 0.8648545719942798, 'subsample': 0.7074321441233987, 'dropout_rate': 0.35738951136246366, 'ccp_alpha': 0.08992935536187847}. Best is trial 677 with value: 0.7600100187343619.[0m
[32m[I 2022-04-14 15:32:05,065][0m Trial 889 finished with value: 0.7527880774811129 and parameters: {'loss': 'coxph', 'learning_rate': 0.004798879368677106, 'n_estimators': 337, 'criterion': 'friedman_mse', 'min_samples_split': 4, 'min_samples_leaf': 2, 'min_weight_fraction_leaf': 0.07254462260759499, 'min_impurity_decrease': 0.5306574402390768, 'max_features': 0.8871859208498197, 'subsample': 0.705128000417835, 'dropout_rate': 0.36827094415677625, 'ccp_alpha': 0.0020318318052224894}. Best is trial 677 with value: 0.7600100187343619.[0m
[32m[I 2022-04-14 15:32:18,767][0m Trial 890 finished with value: 0.66546537074478 and parameters: {'loss': 'coxph', 'learning_rate': 0.0036508674075576425, 'n_estimators': 345, 'criterion': 'friedman_mse', 'min_samples_split': 2, 'min_samples_leaf': 2, 'min_weight_fraction_leaf': 0.0666894095500515, 'min_impurity_decrease': 0.560429728229625, 'max_features': 0.9105494906723622, 'subsample': 0.7185029247556313, 'dropout_rate': 0.3781032671363033, 'ccp_alpha': 0.24792982493575066}. Best is trial 677 with value: 0.7600100187343619.[0m
[32m[I 2022-04-14 15:32:31,201][0m Trial 891 finished with value: 0.5 and parameters: {'loss': 'coxph', 'learning_rate': 0.0047904813717641005, 'n_estimators': 321, 'criterion': 'absolute_error', 'min_samples_split': 2, 'min_samples_leaf': 2, 'min_weight_fraction_leaf': 0.055490232810353146, 'min_impurity_decrease': 0.5093795858904924, 'max_features': 0.894360610825155, 'subsample': 0.7218929650910774, 'dropout_rate': 0.3823985710760663, 'ccp_alpha': 0.16742101057509381}. Best is trial 677 with value: 0.7600100187343619.[0m
[32m[I 2022-04-14 15:33:16,173][0m Trial 892 finished with value: 0.7409997819684786 and parameters: {'loss': 'coxph', 'learning_rate': 0.0035081802175761217, 'n_estimators': 592, 'criterion': 'friedman_mse', 'min_samples_split': 2, 'min_samples_leaf': 2, 'min_weight_fraction_leaf': 0.0770373578662483, 'min_impurity_decrease': 0.49550513548464864, 'max_features': 0.9615489046222518, 'subsample': 0.6736023587100195, 'dropout_rate': 0.3241575670330145, 'ccp_alpha': 0.11178698975491078}. Best is trial 677 with value: 0.7600100187343619.[0m
[32m[I 2022-04-14 15:33:20,569][0m Trial 893 finished with value: 0.26704850303213445 and parameters: {'loss': 'squared', 'learning_rate': 0.002761941354334885, 'n_estimators': 186, 'criterion': 'friedman_mse', 'min_samples_split': 2, 'min_samples_leaf': 2, 'min_weight_fraction_leaf': 0.029913271289338503, 'min_impurity_decrease': 0.5139953523298894, 'max_features': 0.980610053513583, 'subsample': 0.6882657554703591, 'dropout_rate': 0.3892512566567517, 'ccp_alpha': 0.09444431593170736}. Best is trial 677 with value: 0.7600100187343619.[0m
[32m[I 2022-04-14 15:33:35,067][0m Trial 894 finished with value: 0.5 and parameters: {'loss': 'coxph', 'learning_rate': 0.0001413030109214702, 'n_estimators': 344, 'criterion': 'friedman_mse', 'min_samples_split': 2, 'min_samples_leaf': 2, 'min_weight_fraction_leaf': 0.053166874507194754, 'min_impurity_decrease': 0.5341021447879519, 'max_features': 0.8607368789862538, 'subsample': 0.8670360733294015, 'dropout_rate': 0.339115447023599, 'ccp_alpha': 0.34920425365889424}. Best is trial 677 with value: 0.7600100187343619.[0m
[32m[I 2022-04-14 15:33:45,844][0m Trial 895 finished with value: 0.6542382318392501 and parameters: {'loss': 'coxph', 'learning_rate': 0.004854560544004212, 'n_estimators': 315, 'criterion': 'friedman_mse', 'min_samples_split': 3, 'min_samples_leaf': 2, 'min_weight_fraction_leaf': 0.37933623531516225, 'min_impurity_decrease': 0.49950338425262075, 'max_features': 0.9137862291200619, 'subsample': 0.7368880812803327, 'dropout_rate': 0.4078240256921146, 'ccp_alpha': 0.20774848113119027}. Best is trial 677 with value: 0.7600100187343619.[0m
[32m[I 2022-04-14 15:33:58,901][0m Trial 896 finished with value: 0.7511243456488913 and parameters: {'loss': 'coxph', 'learning_rate': 0.004246101567087939, 'n_estimators': 331, 'criterion': 'friedman_mse', 'min_samples_split': 2, 'min_samples_leaf': 2, 'min_weight_fraction_leaf': 0.06701135550471356, 'min_impurity_decrease': 0.5951693593436014, 'max_features': 0.9530726709679672, 'subsample': 0.8346217348346447, 'dropout_rate': 0.3586782218058784, 'ccp_alpha': 0.08904247746615465}. Best is trial 677 with value: 0.7600100187343619.[0m
[32m[I 2022-04-14 15:34:14,531][0m Trial 897 finished with value: 0.6824681710023001 and parameters: {'loss': 'coxph', 'learning_rate': 0.006101382824539807, 'n_estimators': 355, 'criterion': 'friedman_mse', 'min_samples_split': 2, 'min_samples_leaf': 10, 'min_weight_fraction_leaf': 0.041488325349175854, 'min_impurity_decrease': 0.49086365148154315, 'max_features': 0.9831168095705036, 'subsample': 0.8640420547331467, 'dropout_rate': 0.3892308647925334, 'ccp_alpha': 0.16423679288239215}. Best is trial 677 with value: 0.7600100187343619.[0m
[32m[I 2022-04-14 15:34:30,285][0m Trial 898 finished with value: 0.7317975480290635 and parameters: {'loss': 'coxph', 'learning_rate': 0.0034462029714352298, 'n_estimators': 373, 'criterion': 'friedman_mse', 'min_samples_split': 2, 'min_samples_leaf': 2, 'min_weight_fraction_leaf': 0.08017875381569887, 'min_impurity_decrease': 0.4637954245371153, 'max_features': 0.9302263201915414, 'subsample': 0.8881219745883481, 'dropout_rate': 0.4086644892935386, 'ccp_alpha': 0.09236083560680704}. Best is trial 677 with value: 0.7600100187343619.[0m
[32m[I 2022-04-14 15:34:38,628][0m Trial 899 finished with value: 0.5226740215903585 and parameters: {'loss': 'coxph', 'learning_rate': 0.005087823558547644, 'n_estimators': 313, 'criterion': 'friedman_mse', 'min_samples_split': 2, 'min_samples_leaf': 2, 'min_weight_fraction_leaf': 0.059451083124876423, 'min_impurity_decrease': 0.5648028575839227, 'max_features': 0.5573150001644664, 'subsample': 0.8122742095582597, 'dropout_rate': 0.6722396624530332, 'ccp_alpha': 0.2832015940374276}. Best is trial 677 with value: 0.7600100187343619.[0m
[32m[I 2022-04-14 15:34:57,014][0m Trial 900 finished with value: 0.7338752362956754 and parameters: {'loss': 'coxph', 'learning_rate': 0.0026169916468068034, 'n_estimators': 406, 'criterion': 'friedman_mse', 'min_samples_split': 3, 'min_samples_leaf': 2, 'min_weight_fraction_leaf': 0.032317985037602026, 'min_impurity_decrease': 0.697030686325157, 'max_features': 0.8939406468167553, 'subsample': 0.7417764728329711, 'dropout_rate': 0.38863377773405466, 'ccp_alpha': 0.09021655316067619}. Best is trial 677 with value: 0.7600100187343619.[0m
[32m[I 2022-04-14 15:35:02,316][0m Trial 901 finished with value: 0.7412556183056191 and parameters: {'loss': 'coxph', 'learning_rate': 0.0037238767525324666, 'n_estimators': 203, 'criterion': 'friedman_mse', 'min_samples_split': 2, 'min_samples_leaf': 2, 'min_weight_fraction_leaf': 0.04947216255083745, 'min_impurity_decrease': 0.4893845991945704, 'max_features': 0.9668005475702182, 'subsample': 0.8470668637604717, 'dropout_rate': 0.3677930458659206, 'ccp_alpha': 0.00129908526976402}. Best is trial 677 with value: 0.7600100187343619.[0m
[32m[I 2022-04-14 15:35:09,470][0m Trial 902 finished with value: 0.7475019586868614 and parameters: {'loss': 'coxph', 'learning_rate': 5.5188369910755295e-06, 'n_estimators': 339, 'criterion': 'friedman_mse', 'min_samples_split': 2, 'min_samples_leaf': 2, 'min_weight_fraction_leaf': 0.06630617530627908, 'min_impurity_decrease': 0.6701562646728522, 'max_features': 0.9437586946848092, 'subsample': 0.6966467552704865, 'dropout_rate': 0.7837396974115437, 'ccp_alpha': 0.0035717210431133028}. Best is trial 677 with value: 0.7600100187343619.[0m
[32m[I 2022-04-14 15:35:24,688][0m Trial 903 finished with value: 0.7494271130993156 and parameters: {'loss': 'coxph', 'learning_rate': 1.1246868764985792e-05, 'n_estimators': 355, 'criterion': 'friedman_mse', 'min_samples_split': 2, 'min_samples_leaf': 2, 'min_weight_fraction_leaf': 0.07650836668428354, 'min_impurity_decrease': 0.35617442234738844, 'max_features': 0.9149195495718947, 'subsample': 0.8260132223195958, 'dropout_rate': 0.40452662466388734, 'ccp_alpha': 0.003079954287109873}. Best is trial 677 with value: 0.7600100187343619.[0m
[32m[I 2022-04-14 15:35:39,313][0m Trial 904 finished with value: 0.7116517857035006 and parameters: {'loss': 'coxph', 'learning_rate': 0.005749008332262566, 'n_estimators': 386, 'criterion': 'friedman_mse', 'min_samples_split': 2, 'min_samples_leaf': 2, 'min_weight_fraction_leaf': 0.03067827441837522, 'min_impurity_decrease': 0.6229820684148231, 'max_features': 0.9996066110668138, 'subsample': 0.7200488995351324, 'dropout_rate': 0.49804166327613236, 'ccp_alpha': 0.1952160725102661}. Best is trial 677 with value: 0.7600100187343619.[0m
[32m[I 2022-04-14 15:35:51,608][0m Trial 905 finished with value: 0.708466903084988 and parameters: {'loss': 'coxph', 'learning_rate': 0.007780972720095725, 'n_estimators': 327, 'criterion': 'friedman_mse', 'min_samples_split': 2, 'min_samples_leaf': 2, 'min_weight_fraction_leaf': 0.04157624361158215, 'min_impurity_decrease': 0.5526064100627076, 'max_features': 0.9690460587285299, 'subsample': 0.8049635718703054, 'dropout_rate': 0.41978330433886185, 'ccp_alpha': 0.162067809876783}. Best is trial 677 with value: 0.7600100187343619.[0m
[32m[I 2022-04-14 15:36:05,453][0m Trial 906 finished with value: 0.5 and parameters: {'loss': 'coxph', 'learning_rate': 0.010631242255277291, 'n_estimators': 364, 'criterion': 'friedman_mse', 'min_samples_split': 4, 'min_samples_leaf': 6, 'min_weight_fraction_leaf': 0.05555212503131329, 'min_impurity_decrease': 0.3811959630896223, 'max_features': 0.8791121314607028, 'subsample': 0.8421980836241305, 'dropout_rate': 0.48335941299401275, 'ccp_alpha': 3.783368532678825}. Best is trial 677 with value: 0.7600100187343619.[0m
[32m[I 2022-04-14 15:36:13,468][0m Trial 907 finished with value: 0.7482510984423285 and parameters: {'loss': 'coxph', 'learning_rate': 0.004439891598736356, 'n_estimators': 250, 'criterion': 'friedman_mse', 'min_samples_split': 3, 'min_samples_leaf': 1, 'min_weight_fraction_leaf': 0.07836268603092376, 'min_impurity_decrease': 0.521972192722323, 'max_features': 0.9450619187481588, 'subsample': 0.7453955148172319, 'dropout_rate': 0.3774222492228386, 'ccp_alpha': 0.0021882806829984394}. Best is trial 677 with value: 0.7600100187343619.[0m
[32m[I 2022-04-14 15:36:19,821][0m Trial 908 finished with value: 0.5328286035390352 and parameters: {'loss': 'coxph', 'learning_rate': 0.0032880330758124684, 'n_estimators': 234, 'criterion': 'friedman_mse', 'min_samples_split': 2, 'min_samples_leaf': 1, 'min_weight_fraction_leaf': 0.06543213684363551, 'min_impurity_decrease': 0.7285396986949424, 'max_features': 0.983462691758006, 'subsample': 0.7827534929711082, 'dropout_rate': 0.4460390874870603, 'ccp_alpha': 0.3040253378092682}. Best is trial 677 with value: 0.7600100187343619.[0m
[32m[I 2022-04-14 15:36:33,176][0m Trial 909 finished with value: 0.7327332659618606 and parameters: {'loss': 'coxph', 'learning_rate': 8.36244144389458e-06, 'n_estimators': 342, 'criterion': 'friedman_mse', 'min_samples_split': 2, 'min_samples_leaf': 2, 'min_weight_fraction_leaf': 0.04823421265202531, 'min_impurity_decrease': 0.5858391903954704, 'max_features': 0.9205421564047933, 'subsample': 0.8867986025436891, 'dropout_rate': 0.4060877388512469, 'ccp_alpha': 0.0017204384065372573}. Best is trial 677 with value: 0.7600100187343619.[0m
[32m[I 2022-04-14 15:36:43,430][0m Trial 910 finished with value: 0.5 and parameters: {'loss': 'coxph', 'learning_rate': 0.006599118511858104, 'n_estimators': 305, 'criterion': 'absolute_error', 'min_samples_split': 8, 'min_samples_leaf': 1, 'min_weight_fraction_leaf': 0.018766150726395245, 'min_impurity_decrease': 0.6407904134972353, 'max_features': 0.9580061539612474, 'subsample': 0.9383372520767219, 'dropout_rate': 0.42547332220463463, 'ccp_alpha': 0.1675008850877008}. Best is trial 677 with value: 0.7600100187343619.[0m
[32m[I 2022-04-14 15:37:15,458][0m Trial 911 finished with value: 0.7290545543313274 and parameters: {'loss': 'coxph', 'learning_rate': 0.008803610007961322, 'n_estimators': 508, 'criterion': 'friedman_mse', 'min_samples_split': 2, 'min_samples_leaf': 1, 'min_weight_fraction_leaf': 0.16177638402161507, 'min_impurity_decrease': 0.6896483715896401, 'max_features': 0.9044772343172695, 'subsample': 0.8598737432070976, 'dropout_rate': 0.342156148771205, 'ccp_alpha': 0.09889248776596957}. Best is trial 677 with value: 0.7600100187343619.[0m
[32m[I 2022-04-14 15:37:31,898][0m Trial 912 finished with value: 0.6252901563715542 and parameters: {'loss': 'coxph', 'learning_rate': 0.005272116801936316, 'n_estimators': 391, 'criterion': 'friedman_mse', 'min_samples_split': 2, 'min_samples_leaf': 1, 'min_weight_fraction_leaf': 0.08068859595347999, 'min_impurity_decrease': 0.4838424010744162, 'max_features': 0.9301982660945689, 'subsample': 0.81361541652733, 'dropout_rate': 0.45226914321114353, 'ccp_alpha': 0.2431226073835264}. Best is trial 677 with value: 0.7600100187343619.[0m
[32m[I 2022-04-14 15:37:52,010][0m Trial 913 finished with value: 0.26680444281676663 and parameters: {'loss': 'squared', 'learning_rate': 0.04001852465095346, 'n_estimators': 471, 'criterion': 'friedman_mse', 'min_samples_split': 3, 'min_samples_leaf': 2, 'min_weight_fraction_leaf': 0.036368196809181984, 'min_impurity_decrease': 0.4010812623469029, 'max_features': 0.965129985728229, 'subsample': 0.7661233304469084, 'dropout_rate': 0.5164228044868482, 'ccp_alpha': 0.10285587390044294}. Best is trial 677 with value: 0.7600100187343619.[0m
[32m[I 2022-04-14 15:38:05,591][0m Trial 914 finished with value: 0.7077937240998424 and parameters: {'loss': 'coxph', 'learning_rate': 0.0027786602599062034, 'n_estimators': 428, 'criterion': 'friedman_mse', 'min_samples_split': 2, 'min_samples_leaf': 1, 'min_weight_fraction_leaf': 0.05941398383754415, 'min_impurity_decrease': 0.37081567191396136, 'max_features': 0.9828415341531199, 'subsample': 0.8301297985332616, 'dropout_rate': 0.6836289769550042, 'ccp_alpha': 0.16889603760113064}. Best is trial 677 with value: 0.7600100187343619.[0m
[32m[I 2022-04-14 15:38:12,901][0m Trial 915 finished with value: 0.5 and parameters: {'loss': 'coxph', 'learning_rate': 0.004106665877156397, 'n_estimators': 323, 'criterion': 'friedman_mse', 'min_samples_split': 2, 'min_samples_leaf': 1, 'min_weight_fraction_leaf': 0.07224958365338134, 'min_impurity_decrease': 0.5114693698442838, 'max_features': 0.9449006943922427, 'subsample': 0.8003136992680829, 'dropout_rate': 0.7027842347182747, 'ccp_alpha': 3.0773612309875134}. Best is trial 677 with value: 0.7600100187343619.[0m
[32m[I 2022-04-14 15:38:27,574][0m Trial 916 finished with value: 0.5 and parameters: {'loss': 'coxph', 'learning_rate': 0.006271337561294878, 'n_estimators': 355, 'criterion': 'friedman_mse', 'min_samples_split': 2, 'min_samples_leaf': 2, 'min_weight_fraction_leaf': 0.025889916875151967, 'min_impurity_decrease': 0.45266448539866544, 'max_features': 0.89939657980653, 'subsample': 0.7295229619638387, 'dropout_rate': 0.3826663014968805, 'ccp_alpha': 0.4292780660932567}. Best is trial 677 with value: 0.7600100187343619.[0m
[32m[I 2022-04-14 15:38:40,047][0m Trial 917 finished with value: 0.7519335518682514 and parameters: {'loss': 'coxph', 'learning_rate': 0.010302388144760635, 'n_estimators': 410, 'criterion': 'friedman_mse', 'min_samples_split': 2, 'min_samples_leaf': 1, 'min_weight_fraction_leaf': 0.047093479963709904, 'min_impurity_decrease': 0.47419598831724813, 'max_features': 0.9997459742383032, 'subsample': 0.8529784710191388, 'dropout_rate': 0.6474661270731792, 'ccp_alpha': 0.09052403955629322}. Best is trial 677 with value: 0.7600100187343619.[0m
[32m[I 2022-04-14 15:38:52,270][0m Trial 918 finished with value: 0.7141672351388355 and parameters: {'loss': 'coxph', 'learning_rate': 1.2567350833732098e-05, 'n_estimators': 374, 'criterion': 'friedman_mse', 'min_samples_split': 3, 'min_samples_leaf': 1, 'min_weight_fraction_leaf': 0.06663215522682636, 'min_impurity_decrease': 0.41075236901370377, 'max_features': 0.9321245151020622, 'subsample': 0.2115116236290162, 'dropout_rate': 0.555590852411967, 'ccp_alpha': 0.001961677533886902}. Best is trial 677 with value: 0.7600100187343619.[0m
[32m[I 2022-04-14 15:39:04,393][0m Trial 919 finished with value: 0.6714160814687328 and parameters: {'loss': 'coxph', 'learning_rate': 0.05589519679935482, 'n_estimators': 340, 'criterion': 'friedman_mse', 'min_samples_split': 2, 'min_samples_leaf': 1, 'min_weight_fraction_leaf': 0.2625475505265281, 'min_impurity_decrease': 0.38721412757178947, 'max_features': 0.9655249355783472, 'subsample': 0.781489654768172, 'dropout_rate': 0.4193210243218149, 'ccp_alpha': 0.2132457389776419}. Best is trial 677 with value: 0.7600100187343619.[0m
[32m[I 2022-04-14 15:39:14,566][0m Trial 920 finished with value: 0.7417116123763788 and parameters: {'loss': 'coxph', 'learning_rate': 0.004672867149868587, 'n_estimators': 317, 'criterion': 'friedman_mse', 'min_samples_split': 2, 'min_samples_leaf': 2, 'min_weight_fraction_leaf': 0.08225986606768439, 'min_impurity_decrease': 0.35242901766925994, 'max_features': 0.8691669353995751, 'subsample': 0.7507002101941945, 'dropout_rate': 0.46544241044526585, 'ccp_alpha': 0.0890064703293875}. Best is trial 677 with value: 0.7600100187343619.[0m
[32m[I 2022-04-14 15:39:18,022][0m Trial 921 finished with value: 0.5160881488838708 and parameters: {'loss': 'coxph', 'learning_rate': 1.973323379027722e-05, 'n_estimators': 176, 'criterion': 'friedman_mse', 'min_samples_split': 3, 'min_samples_leaf': 1, 'min_weight_fraction_leaf': 0.055498179335954356, 'min_impurity_decrease': 0.43949490087865134, 'max_features': 0.9471857828649083, 'subsample': 0.8727617243381355, 'dropout_rate': 0.4356685307676013, 'ccp_alpha': 0.2920322829388764}. Best is trial 677 with value: 0.7600100187343619.[0m
[32m[I 2022-04-14 15:39:33,542][0m Trial 922 finished with value: 0.7386195030422467 and parameters: {'loss': 'coxph', 'learning_rate': 0.00034061975756815064, 'n_estimators': 371, 'criterion': 'friedman_mse', 'min_samples_split': 4, 'min_samples_leaf': 1, 'min_weight_fraction_leaf': 0.035362307074756016, 'min_impurity_decrease': 0.5463954312021873, 'max_features': 0.9183414142145745, 'subsample': 0.8200170352142416, 'dropout_rate': 0.3950450682001301, 'ccp_alpha': 0.08050433796256916}. Best is trial 677 with value: 0.7600100187343619.[0m
