[32m[I 2022-04-14 15:39:45,516][0m Trial 923 finished with value: 0.7214362129253368 and parameters: {'loss': 'coxph', 'learning_rate': 0.008035007042938557, 'n_estimators': 348, 'criterion': 'friedman_mse', 'min_samples_split': 2, 'min_samples_leaf': 2, 'min_weight_fraction_leaf': 0.042603368383062945, 'min_impurity_decrease': 0.4712443951966944, 'max_features': 0.5153965305445422, 'subsample': 0.7107470510691344, 'dropout_rate': 0.4924881416343367, 'ccp_alpha': 0.1681985343309283}. Best is trial 677 with value: 0.7600100187343619.[0m
[32m[I 2022-04-14 15:39:57,710][0m Trial 924 finished with value: 0.7493927896680084 and parameters: {'loss': 'coxph', 'learning_rate': 0.0031240870350953036, 'n_estimators': 329, 'criterion': 'friedman_mse', 'min_samples_split': 10, 'min_samples_leaf': 1, 'min_weight_fraction_leaf': 0.06979469496256441, 'min_impurity_decrease': 0.42374664497080305, 'max_features': 0.9823644734528592, 'subsample': 0.8382860807268739, 'dropout_rate': 0.4096583483527637, 'ccp_alpha': 0.09406016778808489}. Best is trial 677 with value: 0.7600100187343619.[0m
[32m[I 2022-04-14 15:40:17,622][0m Trial 925 finished with value: 0.6748285843772316 and parameters: {'loss': 'coxph', 'learning_rate': 0.005418080002385065, 'n_estimators': 391, 'criterion': 'friedman_mse', 'min_samples_split': 2, 'min_samples_leaf': 1, 'min_weight_fraction_leaf': 0.30389192357087313, 'min_impurity_decrease': 0.5005299127686251, 'max_features': 0.882394976776333, 'subsample': 0.7990531607321356, 'dropout_rate': 0.35212576592185335, 'ccp_alpha': 0.004118686250788279}. Best is trial 677 with value: 0.7600100187343619.[0m
[32m[I 2022-04-14 15:40:21,095][0m Trial 926 finished with value: 0.7425053797041322 and parameters: {'loss': 'coxph', 'learning_rate': 0.06843627654324476, 'n_estimators': 157, 'criterion': 'friedman_mse', 'min_samples_split': 2, 'min_samples_leaf': 2, 'min_weight_fraction_leaf': 0.014844566891019442, 'min_impurity_decrease': 0.38531933262311746, 'max_features': 0.9664606595133878, 'subsample': 0.9081583277311699, 'dropout_rate': 0.44427982217537787, 'ccp_alpha': 0.0019946128389398366}. Best is trial 677 with value: 0.7600100187343619.[0m
[32m[I 2022-04-14 15:40:35,516][0m Trial 927 finished with value: 0.6915295079518577 and parameters: {'loss': 'coxph', 'learning_rate': 3.4454656968192587e-06, 'n_estimators': 357, 'criterion': 'friedman_mse', 'min_samples_split': 2, 'min_samples_leaf': 1, 'min_weight_fraction_leaf': 0.18524845157808734, 'min_impurity_decrease': 0.3601818107804503, 'max_features': 0.9392966126411777, 'subsample': 0.7653575724278237, 'dropout_rate': 0.466203714840801, 'ccp_alpha': 0.0011621918344641561}. Best is trial 677 with value: 0.7600100187343619.[0m
[32m[I 2022-04-14 15:40:39,138][0m Trial 928 finished with value: 0.5 and parameters: {'loss': 'coxph', 'learning_rate': 0.007342326613327955, 'n_estimators': 304, 'criterion': 'friedman_mse', 'min_samples_split': 2, 'min_samples_leaf': 1, 'min_weight_fraction_leaf': 0.05987279333097725, 'min_impurity_decrease': 0.05572887600619005, 'max_features': 0.9187805244023871, 'subsample': 0.8689504913992134, 'dropout_rate': 0.8946478979335837, 'ccp_alpha': 0.370278873170864}. Best is trial 677 with value: 0.7600100187343619.[0m
[32m[I 2022-04-14 15:40:41,537][0m Trial 929 finished with value: 0.6742142140658212 and parameters: {'loss': 'coxph', 'learning_rate': 0.0037181639262674174, 'n_estimators': 138, 'criterion': 'friedman_mse', 'min_samples_split': 3, 'min_samples_leaf': 1, 'min_weight_fraction_leaf': 0.0825940436826118, 'min_impurity_decrease': 0.6588433308968298, 'max_features': 0.9020696722282109, 'subsample': 0.730360981260185, 'dropout_rate': 0.4268634025069242, 'ccp_alpha': 0.24018820606816743}. Best is trial 677 with value: 0.7600100187343619.[0m
[32m[I 2022-04-14 15:40:48,631][0m Trial 930 finished with value: 0.7175190462419069 and parameters: {'loss': 'coxph', 'learning_rate': 0.0025654996993884002, 'n_estimators': 332, 'criterion': 'friedman_mse', 'min_samples_split': 2, 'min_samples_leaf': 2, 'min_weight_fraction_leaf': 0.049728687888915296, 'min_impurity_decrease': 0.39715296429404684, 'max_features': 0.9819535747848983, 'subsample': 0.8218559053821555, 'dropout_rate': 0.7274834525479853, 'ccp_alpha': 0.16249784142922927}. Best is trial 677 with value: 0.7600100187343619.[0m
[32m[I 2022-04-14 15:41:05,087][0m Trial 931 finished with value: 0.4458906902093019 and parameters: {'loss': 'squared', 'learning_rate': 2.631400577783217e-05, 'n_estimators': 376, 'criterion': 'absolute_error', 'min_samples_split': 2, 'min_samples_leaf': 1, 'min_weight_fraction_leaf': 0.027812198682506714, 'min_impurity_decrease': 0.45907653161294226, 'max_features': 0.9569670194382742, 'subsample': 0.7790085619530046, 'dropout_rate': 0.39473003143238145, 'ccp_alpha': 0.1175263672104038}. Best is trial 677 with value: 0.7600100187343619.[0m
[32m[I 2022-04-14 15:41:14,212][0m Trial 932 finished with value: 0.5530352851810367 and parameters: {'loss': 'coxph', 'learning_rate': 1.5843138890953884e-05, 'n_estimators': 359, 'criterion': 'friedman_mse', 'min_samples_split': 2, 'min_samples_leaf': 1, 'min_weight_fraction_leaf': 0.06767098327918712, 'min_impurity_decrease': 0.41583404958430886, 'max_features': 0.8506252568780798, 'subsample': 0.8471819456621376, 'dropout_rate': 0.6634552385728343, 'ccp_alpha': 0.2541138076122707}. Best is trial 677 with value: 0.7600100187343619.[0m
[32m[I 2022-04-14 15:41:26,191][0m Trial 933 finished with value: 0.7442159126476907 and parameters: {'loss': 'coxph', 'learning_rate': 7.23775684564868e-06, 'n_estimators': 317, 'criterion': 'friedman_mse', 'min_samples_split': 2, 'min_samples_leaf': 2, 'min_weight_fraction_leaf': 0.038611353254891324, 'min_impurity_decrease': 0.047238784936430835, 'max_features': 0.9474319955956787, 'subsample': 0.7513634099575242, 'dropout_rate': 0.3645749877809161, 'ccp_alpha': 0.08285093742661191}. Best is trial 677 with value: 0.7600100187343619.[0m
[32m[I 2022-04-14 15:41:43,481][0m Trial 934 finished with value: 0.6996672922348051 and parameters: {'loss': 'coxph', 'learning_rate': 0.009178960864048064, 'n_estimators': 402, 'criterion': 'friedman_mse', 'min_samples_split': 3, 'min_samples_leaf': 1, 'min_weight_fraction_leaf': 0.08223460812794037, 'min_impurity_decrease': 0.4278213479018242, 'max_features': 0.9995269636682005, 'subsample': 0.8102606326205931, 'dropout_rate': 0.4828125147026803, 'ccp_alpha': 0.17435373265477366}. Best is trial 677 with value: 0.7600100187343619.[0m
[32m[I 2022-04-14 15:41:56,253][0m Trial 935 finished with value: 0.7465463565936835 and parameters: {'loss': 'coxph', 'learning_rate': 1.0074080833446377e-05, 'n_estimators': 344, 'criterion': 'friedman_mse', 'min_samples_split': 2, 'min_samples_leaf': 1, 'min_weight_fraction_leaf': 0.05676667062145036, 'min_impurity_decrease': 0.029951257252330055, 'max_features': 0.9281772091741448, 'subsample': 0.7900484751886123, 'dropout_rate': 0.4533037426642931, 'ccp_alpha': 0.09284368845731504}. Best is trial 677 with value: 0.7600100187343619.[0m
[32m[I 2022-04-14 15:42:11,758][0m Trial 936 finished with value: 0.7192371391756393 and parameters: {'loss': 'coxph', 'learning_rate': 0.00025369223185368574, 'n_estimators': 379, 'criterion': 'friedman_mse', 'min_samples_split': 2, 'min_samples_leaf': 2, 'min_weight_fraction_leaf': 0.07048043102719435, 'min_impurity_decrease': 0.5147115571757276, 'max_features': 0.2174458104139751, 'subsample': 0.9747677046543762, 'dropout_rate': 0.42742571839011434, 'ccp_alpha': 0.0927583715938643}. Best is trial 677 with value: 0.7600100187343619.[0m
[32m[I 2022-04-14 15:42:23,828][0m Trial 937 finished with value: 0.7471721755062006 and parameters: {'loss': 'coxph', 'learning_rate': 0.006119723490109126, 'n_estimators': 335, 'criterion': 'friedman_mse', 'min_samples_split': 2, 'min_samples_leaf': 1, 'min_weight_fraction_leaf': 0.01004661183910683, 'min_impurity_decrease': 0.7586026935203356, 'max_features': 0.9674810120759337, 'subsample': 0.8849356497197277, 'dropout_rate': 0.407369028161239, 'ccp_alpha': 0.0018340141848258054}. Best is trial 677 with value: 0.7600100187343619.[0m
[32m[I 2022-04-14 15:42:30,006][0m Trial 938 finished with value: 0.7320704519737047 and parameters: {'loss': 'coxph', 'learning_rate': 0.011857923351766596, 'n_estimators': 192, 'criterion': 'friedman_mse', 'min_samples_split': 2, 'min_samples_leaf': 1, 'min_weight_fraction_leaf': 0.02401849702313453, 'min_impurity_decrease': 0.058792498022059936, 'max_features': 0.3333664063378249, 'subsample': 0.8348947186074495, 'dropout_rate': 0.04855420904689661, 'ccp_alpha': 0.0019214843733598294}. Best is trial 677 with value: 0.7600100187343619.[0m
[32m[I 2022-04-14 15:42:44,361][0m Trial 939 finished with value: 0.6753124372125856 and parameters: {'loss': 'coxph', 'learning_rate': 4.9426036719376276e-06, 'n_estimators': 363, 'criterion': 'friedman_mse', 'min_samples_split': 6, 'min_samples_leaf': 1, 'min_weight_fraction_leaf': 0.047390511656043924, 'min_impurity_decrease': 0.4787085872183561, 'max_features': 0.8871305791133025, 'subsample': 0.6945346737566617, 'dropout_rate': 0.37673037690601197, 'ccp_alpha': 0.2529952034828613}. Best is trial 677 with value: 0.7600100187343619.[0m
[32m[I 2022-04-14 15:43:03,494][0m Trial 940 finished with value: 0.7164140164288348 and parameters: {'loss': 'coxph', 'learning_rate': 0.0040367559157268845, 'n_estimators': 439, 'criterion': 'friedman_mse', 'min_samples_split': 3, 'min_samples_leaf': 2, 'min_weight_fraction_leaf': 0.05904003054875172, 'min_impurity_decrease': 0.806619346735614, 'max_features': 0.9814145625979981, 'subsample': 0.7736163104440259, 'dropout_rate': 0.4396983532971991, 'ccp_alpha': 0.16253995830917092}. Best is trial 677 with value: 0.7600100187343619.[0m
[32m[I 2022-04-14 15:43:12,515][0m Trial 941 finished with value: 0.5 and parameters: {'loss': 'coxph', 'learning_rate': 0.03220105147559407, 'n_estimators': 304, 'criterion': 'friedman_mse', 'min_samples_split': 2, 'min_samples_leaf': 1, 'min_weight_fraction_leaf': 0.07810891850292632, 'min_impurity_decrease': 0.9349152427023241, 'max_features': 0.9088842107306979, 'subsample': 0.8574399406456585, 'dropout_rate': 0.46950590988831453, 'ccp_alpha': 0.35509314357344185}. Best is trial 677 with value: 0.7600100187343619.[0m
[32m[I 2022-04-14 15:43:46,986][0m Trial 942 finished with value: 0.7408240168628064 and parameters: {'loss': 'coxph', 'learning_rate': 0.004944087689609544, 'n_estimators': 620, 'criterion': 'friedman_mse', 'min_samples_split': 2, 'min_samples_leaf': 1, 'min_weight_fraction_leaf': 0.043224943808253063, 'min_impurity_decrease': 0.3724184587012503, 'max_features': 0.9504735521429385, 'subsample': 0.8039115164254389, 'dropout_rate': 0.5226753508576603, 'ccp_alpha': 0.08689222838256602}. Best is trial 677 with value: 0.7600100187343619.[0m
[32m[I 2022-04-14 15:43:52,481][0m Trial 943 finished with value: 0.7116517857035006 and parameters: {'loss': 'coxph', 'learning_rate': 0.007216687259723589, 'n_estimators': 224, 'criterion': 'friedman_mse', 'min_samples_split': 2, 'min_samples_leaf': 2, 'min_weight_fraction_leaf': 0.03667054691493438, 'min_impurity_decrease': 0.20995683968278311, 'max_features': 0.928405563121188, 'subsample': 0.7420013401475194, 'dropout_rate': 0.41311989206453575, 'ccp_alpha': 0.1776781378933961}. Best is trial 677 with value: 0.7600100187343619.[0m
[32m[I 2022-04-14 15:44:04,037][0m Trial 944 finished with value: 0.7501494739848282 and parameters: {'loss': 'coxph', 'learning_rate': 0.003435000016725371, 'n_estimators': 348, 'criterion': 'friedman_mse', 'min_samples_split': 2, 'min_samples_leaf': 1, 'min_weight_fraction_leaf': 0.08570238688277813, 'min_impurity_decrease': 0.4551880310223867, 'max_features': 0.9692185703047426, 'subsample': 0.8285403600826026, 'dropout_rate': 0.4994510605805672, 'ccp_alpha': 0.0010171961522978273}. Best is trial 677 with value: 0.7600100187343619.[0m
[32m[I 2022-04-14 15:44:15,576][0m Trial 945 finished with value: 0.7428956520520072 and parameters: {'loss': 'coxph', 'learning_rate': 0.002548051298423705, 'n_estimators': 323, 'criterion': 'friedman_mse', 'min_samples_split': 8, 'min_samples_leaf': 1, 'min_weight_fraction_leaf': 0.06698059502646202, 'min_impurity_decrease': 0.03285748896088424, 'max_features': 0.9994821412528277, 'subsample': 0.7160885724479641, 'dropout_rate': 0.387592397172663, 'ccp_alpha': 0.08651411363173885}. Best is trial 677 with value: 0.7600100187343619.[0m
[32m[I 2022-04-14 15:44:31,857][0m Trial 946 finished with value: 0.6819372026220829 and parameters: {'loss': 'coxph', 'learning_rate': 0.0462837429139045, 'n_estimators': 407, 'criterion': 'friedman_mse', 'min_samples_split': 3, 'min_samples_leaf': 2, 'min_weight_fraction_leaf': 0.05271728637006991, 'min_impurity_decrease': 0.6160468961522446, 'max_features': 0.9436579899753783, 'subsample': 0.7634250716351769, 'dropout_rate': 0.4497338494421584, 'ccp_alpha': 0.2516308223547272}. Best is trial 677 with value: 0.7600100187343619.[0m
[32m[I 2022-04-14 15:44:49,151][0m Trial 947 finished with value: 0.749483842345869 and parameters: {'loss': 'coxph', 'learning_rate': 0.009746010577296552, 'n_estimators': 378, 'criterion': 'friedman_mse', 'min_samples_split': 2, 'min_samples_leaf': 1, 'min_weight_fraction_leaf': 0.028600441135356643, 'min_impurity_decrease': 0.4085217266404258, 'max_features': 0.9643933379138042, 'subsample': 0.7946197342530779, 'dropout_rate': 0.3248791723742281, 'ccp_alpha': 0.0017092239659286764}. Best is trial 677 with value: 0.7600100187343619.[0m
[32m[I 2022-04-14 15:44:58,464][0m Trial 948 finished with value: 0.7494664496563731 and parameters: {'loss': 'coxph', 'learning_rate': 0.004583592774965058, 'n_estimators': 353, 'criterion': 'friedman_mse', 'min_samples_split': 2, 'min_samples_leaf': 1, 'min_weight_fraction_leaf': 0.07246558389724808, 'min_impurity_decrease': 0.018141066532768677, 'max_features': 0.9115017684717405, 'subsample': 0.8467444115697547, 'dropout_rate': 0.6395888556125741, 'ccp_alpha': 0.0011125896056598424}. Best is trial 677 with value: 0.7600100187343619.[0m
[32m[I 2022-04-14 15:45:08,855][0m Trial 949 finished with value: 0.6984677214106415 and parameters: {'loss': 'coxph', 'learning_rate': 0.00567675746882271, 'n_estimators': 312, 'criterion': 'friedman_mse', 'min_samples_split': 2, 'min_samples_leaf': 1, 'min_weight_fraction_leaf': 0.06131489287339553, 'min_impurity_decrease': 0.5344567829145528, 'max_features': 0.8951662353361783, 'subsample': 0.871648355100776, 'dropout_rate': 0.42048989472038606, 'ccp_alpha': 0.15453172029014467}. Best is trial 677 with value: 0.7600100187343619.[0m
[32m[I 2022-04-14 15:45:16,607][0m Trial 950 finished with value: 0.26040404529315897 and parameters: {'loss': 'squared', 'learning_rate': 1.336367606233139e-05, 'n_estimators': 340, 'criterion': 'friedman_mse', 'min_samples_split': 3, 'min_samples_leaf': 2, 'min_weight_fraction_leaf': 0.08204732440630215, 'min_impurity_decrease': 0.4944070558799957, 'max_features': 0.9834898483930521, 'subsample': 0.8174878535973561, 'dropout_rate': 0.6906000348916067, 'ccp_alpha': 0.1747089009688182}. Best is trial 677 with value: 0.7600100187343619.[0m
[32m[I 2022-04-14 15:45:34,458][0m Trial 951 finished with value: 0.5 and parameters: {'loss': 'coxph', 'learning_rate': 0.0077669720265873135, 'n_estimators': 393, 'criterion': 'friedman_mse', 'min_samples_split': 2, 'min_samples_leaf': 1, 'min_weight_fraction_leaf': 0.018102126550200635, 'min_impurity_decrease': 0.04874876439629661, 'max_features': 0.9313370186361449, 'subsample': 0.7298441847637702, 'dropout_rate': 0.3944734248503543, 'ccp_alpha': 4.497709712382026}. Best is trial 677 with value: 0.7600100187343619.[0m
[32m[I 2022-04-14 15:45:45,537][0m Trial 952 finished with value: 0.5 and parameters: {'loss': 'coxph', 'learning_rate': 0.003210118120287101, 'n_estimators': 330, 'criterion': 'absolute_error', 'min_samples_split': 2, 'min_samples_leaf': 1, 'min_weight_fraction_leaf': 0.047604140104688254, 'min_impurity_decrease': 0.44328217518472246, 'max_features': 0.9563900977091864, 'subsample': 0.7814311039754904, 'dropout_rate': 0.478850209739643, 'ccp_alpha': 0.09316041847135371}. Best is trial 677 with value: 0.7600100187343619.[0m
[32m[I 2022-04-14 15:45:59,134][0m Trial 953 finished with value: 0.5160881488838708 and parameters: {'loss': 'coxph', 'learning_rate': 2.0150331423284743e-05, 'n_estimators': 365, 'criterion': 'friedman_mse', 'min_samples_split': 2, 'min_samples_leaf': 2, 'min_weight_fraction_leaf': 0.03847489794510106, 'min_impurity_decrease': 0.6819527538055766, 'max_features': 0.9821336525915202, 'subsample': 0.8983312411726054, 'dropout_rate': 0.4405215125726975, 'ccp_alpha': 0.27557223481809123}. Best is trial 677 with value: 0.7600100187343619.[0m
[32m[I 2022-04-14 15:46:13,458][0m Trial 954 finished with value: 0.7540555289470403 and parameters: {'loss': 'coxph', 'learning_rate': 0.01231901485305048, 'n_estimators': 352, 'criterion': 'friedman_mse', 'min_samples_split': 2, 'min_samples_leaf': 1, 'min_weight_fraction_leaf': 0.07372164448470889, 'min_impurity_decrease': 0.3857222163777898, 'max_features': 0.8768734722220948, 'subsample': 0.8393309018137431, 'dropout_rate': 0.3667300406823403, 'ccp_alpha': 0.0012532267660292713}. Best is trial 677 with value: 0.7600100187343619.[0m
[32m[I 2022-04-14 15:46:34,544][0m Trial 955 finished with value: 0.7351015259716936 and parameters: {'loss': 'coxph', 'learning_rate': 0.014246388335653955, 'n_estimators': 420, 'criterion': 'friedman_mse', 'min_samples_split': 2, 'min_samples_leaf': 1, 'min_weight_fraction_leaf': 0.059535973603131696, 'min_impurity_decrease': 0.387704788122087, 'max_features': 0.8518566055742628, 'subsample': 0.8059838117070471, 'dropout_rate': 0.36246448938984005, 'ccp_alpha': 0.09870503246843478}. Best is trial 677 with value: 0.7600100187343619.[0m
[32m[I 2022-04-14 15:46:53,899][0m Trial 956 finished with value: 0.7060921910335779 and parameters: {'loss': 'coxph', 'learning_rate': 0.014262360533681285, 'n_estimators': 386, 'criterion': 'friedman_mse', 'min_samples_split': 2, 'min_samples_leaf': 1, 'min_weight_fraction_leaf': 0.07063416504082363, 'min_impurity_decrease': 0.3639670695970064, 'max_features': 0.8677937959366033, 'subsample': 0.8282692633114977, 'dropout_rate': 0.32544780796563444, 'ccp_alpha': 0.18639357235360743}. Best is trial 677 with value: 0.7600100187343619.[0m
[32m[I 2022-04-14 15:47:11,067][0m Trial 957 finished with value: 0.7352444319903972 and parameters: {'loss': 'coxph', 'learning_rate': 0.01821583164287373, 'n_estimators': 368, 'criterion': 'friedman_mse', 'min_samples_split': 2, 'min_samples_leaf': 2, 'min_weight_fraction_leaf': 0.050409476455951154, 'min_impurity_decrease': 0.3491395570610336, 'max_features': 0.8729453547160055, 'subsample': 0.7498013630645721, 'dropout_rate': 0.3519308824290019, 'ccp_alpha': 0.08969797765903437}. Best is trial 677 with value: 0.7600100187343619.[0m
[32m[I 2022-04-14 15:47:26,817][0m Trial 958 finished with value: 0.5 and parameters: {'loss': 'coxph', 'learning_rate': 0.021566064481006383, 'n_estimators': 355, 'criterion': 'friedman_mse', 'min_samples_split': 2, 'min_samples_leaf': 1, 'min_weight_fraction_leaf': 0.06083141390947913, 'min_impurity_decrease': 0.395392290193659, 'max_features': 0.8945442537421932, 'subsample': 0.7930798697891192, 'dropout_rate': 0.3399672563368167, 'ccp_alpha': 0.41007627516884826}. Best is trial 677 with value: 0.7600100187343619.[0m
[32m[I 2022-04-14 15:47:45,210][0m Trial 959 finished with value: 0.750582178597639 and parameters: {'loss': 'coxph', 'learning_rate': 0.011837788994486826, 'n_estimators': 379, 'criterion': 'friedman_mse', 'min_samples_split': 2, 'min_samples_leaf': 2, 'min_weight_fraction_leaf': 0.07356201097586124, 'min_impurity_decrease': 0.37452176059217457, 'max_features': 0.8830556169328496, 'subsample': 0.7693451449129209, 'dropout_rate': 0.36959236440327503, 'ccp_alpha': 0.0023553664111768268}. Best is trial 677 with value: 0.7600100187343619.[0m
[32m[I 2022-04-14 15:48:04,477][0m Trial 960 finished with value: 0.5160881488838708 and parameters: {'loss': 'coxph', 'learning_rate': 0.018113808888930542, 'n_estimators': 399, 'criterion': 'friedman_mse', 'min_samples_split': 2, 'min_samples_leaf': 1, 'min_weight_fraction_leaf': 0.028901840383098197, 'min_impurity_decrease': 0.39691945172920173, 'max_features': 0.9055921426195955, 'subsample': 0.8353418825479453, 'dropout_rate': 0.37331563429948467, 'ccp_alpha': 0.3030593333333358}. Best is trial 677 with value: 0.7600100187343619.[0m
[32m[I 2022-04-14 15:48:19,300][0m Trial 961 finished with value: 0.7077937240998424 and parameters: {'loss': 'coxph', 'learning_rate': 0.08200346389829681, 'n_estimators': 350, 'criterion': 'friedman_mse', 'min_samples_split': 2, 'min_samples_leaf': 1, 'min_weight_fraction_leaf': 0.051996704933791354, 'min_impurity_decrease': 0.35335020878968393, 'max_features': 0.8895771336401792, 'subsample': 0.8147644198143467, 'dropout_rate': 0.33895170728769786, 'ccp_alpha': 0.16588650777719244}. Best is trial 677 with value: 0.7600100187343619.[0m
[32m[I 2022-04-14 15:48:35,879][0m Trial 962 finished with value: 0.7398498230321852 and parameters: {'loss': 'coxph', 'learning_rate': 0.016793565111608302, 'n_estimators': 364, 'criterion': 'friedman_mse', 'min_samples_split': 2, 'min_samples_leaf': 1, 'min_weight_fraction_leaf': 0.061172137063339654, 'min_impurity_decrease': 0.4238954794026796, 'max_features': 0.9173666847906401, 'subsample': 0.7012380689715265, 'dropout_rate': 0.3522308643872087, 'ccp_alpha': 0.09014987710416135}. Best is trial 677 with value: 0.7600100187343619.[0m
