[32m[I 2022-04-13 11:44:00,929][0m Trial 252 finished with value: 0.6905651483118933 and parameters: {'splitter': 'random', 'min_samples_split': 0.24603852472895704, 'min_samples_leaf': 0.010418679708241445, 'min_weight_fraction_leaf': 0.26892237798773694, 'max_features': 0.5917154957843956}. Best is trial 156 with value: 0.860262530255716.[0m
[32m[I 2022-04-13 11:44:00,965][0m Trial 253 finished with value: 0.860262530255716 and parameters: {'splitter': 'random', 'min_samples_split': 0.2662104111654118, 'min_samples_leaf': 0.04318968220546789, 'min_weight_fraction_leaf': 0.06177711608695566, 'max_features': 0.5706551511165809}. Best is trial 156 with value: 0.860262530255716.[0m
[32m[I 2022-04-13 11:44:01,002][0m Trial 254 finished with value: 0.7999200547726107 and parameters: {'splitter': 'random', 'min_samples_split': 0.28429200871367405, 'min_samples_leaf': 0.0014176800457722412, 'min_weight_fraction_leaf': 0.04803457035073998, 'max_features': 0.48836252686889803}. Best is trial 156 with value: 0.860262530255716.[0m
[32m[I 2022-04-13 11:44:01,038][0m Trial 255 finished with value: 0.7709175790403612 and parameters: {'splitter': 'random', 'min_samples_split': 0.25492198354868895, 'min_samples_leaf': 0.009053731988073362, 'min_weight_fraction_leaf': 0.07786304580730324, 'max_features': 0.24866243489540107}. Best is trial 156 with value: 0.860262530255716.[0m
[32m[I 2022-04-13 11:44:01,075][0m Trial 256 finished with value: 0.8495779719052834 and parameters: {'splitter': 'random', 'min_samples_split': 0.29527923260074607, 'min_samples_leaf': 0.017268099841079153, 'min_weight_fraction_leaf': 0.07327601740846079, 'max_features': 0.5357933138091572}. Best is trial 156 with value: 0.860262530255716.[0m
[32m[I 2022-04-13 11:44:01,111][0m Trial 257 finished with value: 0.855608859465337 and parameters: {'splitter': 'random', 'min_samples_split': 0.2618315667323454, 'min_samples_leaf': 0.02425429877801155, 'min_weight_fraction_leaf': 0.05282770840094232, 'max_features': 0.5764915346464872}. Best is trial 156 with value: 0.860262530255716.[0m
[32m[I 2022-04-13 11:44:01,148][0m Trial 258 finished with value: 0.8541689983710665 and parameters: {'splitter': 'random', 'min_samples_split': 0.24519282584968757, 'min_samples_leaf': 0.04301361716415571, 'min_weight_fraction_leaf': 0.03729121507512996, 'max_features': 0.5039003226398358}. Best is trial 156 with value: 0.860262530255716.[0m
[32m[I 2022-04-13 11:44:01,185][0m Trial 259 finished with value: 0.678946779212211 and parameters: {'splitter': 'random', 'min_samples_split': 0.26617523271511323, 'min_samples_leaf': 0.019652877752513544, 'min_weight_fraction_leaf': 0.09101969528126597, 'max_features': 0.4596593477977415}. Best is trial 156 with value: 0.860262530255716.[0m
[32m[I 2022-04-13 11:44:01,221][0m Trial 260 finished with value: 0.8541689983710665 and parameters: {'splitter': 'random', 'min_samples_split': 0.2323202790359518, 'min_samples_leaf': 0.0012610536563818914, 'min_weight_fraction_leaf': 0.06613565560750995, 'max_features': 0.5591578033978709}. Best is trial 156 with value: 0.860262530255716.[0m
[32m[I 2022-04-13 11:44:01,257][0m Trial 261 finished with value: 0.860262530255716 and parameters: {'splitter': 'random', 'min_samples_split': 0.2694730058487529, 'min_samples_leaf': 0.009306165878579534, 'min_weight_fraction_leaf': 0.05878210445487178, 'max_features': 0.5787939193589849}. Best is trial 156 with value: 0.860262530255716.[0m
[32m[I 2022-04-13 11:44:01,293][0m Trial 262 finished with value: 0.8490198370094999 and parameters: {'splitter': 'random', 'min_samples_split': 0.2517311521137653, 'min_samples_leaf': 0.01320606578070198, 'min_weight_fraction_leaf': 0.08254229033674099, 'max_features': 0.5968654365835528}. Best is trial 156 with value: 0.860262530255716.[0m
[32m[I 2022-04-13 11:44:01,329][0m Trial 263 finished with value: 0.860262530255716 and parameters: {'splitter': 'random', 'min_samples_split': 0.2753006885034355, 'min_samples_leaf': 0.025281234844081842, 'min_weight_fraction_leaf': 0.052772712552315824, 'max_features': 0.5490929050505411}. Best is trial 156 with value: 0.860262530255716.[0m
[32m[I 2022-04-13 11:44:01,365][0m Trial 264 finished with value: 0.8537871744804019 and parameters: {'splitter': 'random', 'min_samples_split': 0.2799012439422739, 'min_samples_leaf': 0.04595726949002811, 'min_weight_fraction_leaf': 0.053957404250212906, 'max_features': 0.5484317355467996}. Best is trial 156 with value: 0.860262530255716.[0m
[32m[I 2022-04-13 11:44:01,402][0m Trial 265 finished with value: 0.8495779719052834 and parameters: {'splitter': 'random', 'min_samples_split': 0.29131232587460376, 'min_samples_leaf': 0.01630632933613821, 'min_weight_fraction_leaf': 0.042601829337470795, 'max_features': 0.5273099982418028}. Best is trial 156 with value: 0.860262530255716.[0m
[32m[I 2022-04-13 11:44:01,453][0m Trial 266 finished with value: 0.855608859465337 and parameters: {'splitter': 'random', 'min_samples_split': 0.2599798518327288, 'min_samples_leaf': 0.02317740720577839, 'min_weight_fraction_leaf': 0.03305148125022075, 'max_features': 0.5591421158465361}. Best is trial 156 with value: 0.860262530255716.[0m
[32m[I 2022-04-13 11:44:01,537][0m Trial 267 finished with value: 0.8537871744804019 and parameters: {'splitter': 'random', 'min_samples_split': 0.2779698151134645, 'min_samples_leaf': 0.03398772294859963, 'min_weight_fraction_leaf': 0.046873586311057355, 'max_features': 0.539612115020893}. Best is trial 156 with value: 0.860262530255716.[0m
[32m[I 2022-04-13 11:44:01,610][0m Trial 268 finished with value: 0.8495779719052834 and parameters: {'splitter': 'random', 'min_samples_split': 0.3024889921670667, 'min_samples_leaf': 0.035194574287269895, 'min_weight_fraction_leaf': 0.05434711969394029, 'max_features': 0.5453954678102634}. Best is trial 156 with value: 0.860262530255716.[0m
[32m[I 2022-04-13 11:44:01,667][0m Trial 269 finished with value: 0.860262530255716 and parameters: {'splitter': 'random', 'min_samples_split': 0.2749433161649451, 'min_samples_leaf': 0.027890486123704004, 'min_weight_fraction_leaf': 0.060625595802168385, 'max_features': 0.5122080486532978}. Best is trial 156 with value: 0.860262530255716.[0m
[32m[I 2022-04-13 11:44:01,705][0m Trial 270 finished with value: 0.7865929809567938 and parameters: {'splitter': 'random', 'min_samples_split': 0.28643624763137127, 'min_samples_leaf': 0.008971961416416601, 'min_weight_fraction_leaf': 0.07449421658082162, 'max_features': 0.47970404539573847}. Best is trial 156 with value: 0.860262530255716.[0m
[32m[I 2022-04-13 11:44:01,742][0m Trial 271 finished with value: 0.860262530255716 and parameters: {'splitter': 'random', 'min_samples_split': 0.2729544510208893, 'min_samples_leaf': 0.013896010933764651, 'min_weight_fraction_leaf': 0.06748596944937409, 'max_features': 0.5581924310125211}. Best is trial 156 with value: 0.860262530255716.[0m
[32m[I 2022-04-13 11:44:01,795][0m Trial 272 finished with value: 0.860262530255716 and parameters: {'splitter': 'random', 'min_samples_split': 0.2756503553912908, 'min_samples_leaf': 0.017267838469645167, 'min_weight_fraction_leaf': 0.05044083727241544, 'max_features': 0.5281062565151645}. Best is trial 156 with value: 0.860262530255716.[0m
[32m[I 2022-04-13 11:44:01,864][0m Trial 273 finished with value: 0.8537871744804019 and parameters: {'splitter': 'random', 'min_samples_split': 0.28376752531376914, 'min_samples_leaf': 0.0238466783617364, 'min_weight_fraction_leaf': 0.033817375161862076, 'max_features': 0.5399193274031163}. Best is trial 156 with value: 0.860262530255716.[0m
[32m[I 2022-04-13 11:44:01,914][0m Trial 274 finished with value: 0.860262530255716 and parameters: {'splitter': 'random', 'min_samples_split': 0.2752791152113086, 'min_samples_leaf': 0.03160648151112687, 'min_weight_fraction_leaf': 0.04563196597443367, 'max_features': 0.5039481264542927}. Best is trial 156 with value: 0.860262530255716.[0m
[32m[I 2022-04-13 11:44:01,965][0m Trial 275 finished with value: 0.8490198370094999 and parameters: {'splitter': 'random', 'min_samples_split': 0.254941872038913, 'min_samples_leaf': 0.008065316494925107, 'min_weight_fraction_leaf': 0.08636888874437954, 'max_features': 0.5913637274311406}. Best is trial 156 with value: 0.860262530255716.[0m
[32m[I 2022-04-13 11:44:02,016][0m Trial 276 finished with value: 0.8541689983710665 and parameters: {'splitter': 'random', 'min_samples_split': 0.24259616032034062, 'min_samples_leaf': 0.031792538302414186, 'min_weight_fraction_leaf': 0.05855836880773614, 'max_features': 0.5465172676181687}. Best is trial 156 with value: 0.860262530255716.[0m
[32m[I 2022-04-13 11:44:02,068][0m Trial 277 finished with value: 0.8495779719052834 and parameters: {'splitter': 'random', 'min_samples_split': 0.29343678591698813, 'min_samples_leaf': 0.01677838811854394, 'min_weight_fraction_leaf': 0.0423469459626605, 'max_features': 0.5191132028922376}. Best is trial 156 with value: 0.860262530255716.[0m
[32m[I 2022-04-13 11:44:02,144][0m Trial 278 finished with value: 0.7999200547726107 and parameters: {'splitter': 'random', 'min_samples_split': 0.26975741447878265, 'min_samples_leaf': 0.021843683269750582, 'min_weight_fraction_leaf': 0.055195125203609474, 'max_features': 0.49020483433023304}. Best is trial 156 with value: 0.860262530255716.[0m
[32m[I 2022-04-13 11:44:02,240][0m Trial 279 finished with value: 0.855608859465337 and parameters: {'splitter': 'random', 'min_samples_split': 0.256759736714299, 'min_samples_leaf': 0.0010057108107552626, 'min_weight_fraction_leaf': 0.07234035372901024, 'max_features': 0.5773101760949596}. Best is trial 156 with value: 0.860262530255716.[0m
[32m[I 2022-04-13 11:44:02,347][0m Trial 280 finished with value: 0.6332669867606551 and parameters: {'splitter': 'random', 'min_samples_split': 0.2624341262798826, 'min_samples_leaf': 0.04668115621555774, 'min_weight_fraction_leaf': 0.31405220755918467, 'max_features': 0.5752602596842252}. Best is trial 156 with value: 0.860262530255716.[0m
[32m[I 2022-04-13 11:44:02,438][0m Trial 281 finished with value: 0.7203943081692755 and parameters: {'splitter': 'random', 'min_samples_split': 0.2856442652480344, 'min_samples_leaf': 0.025951944771749585, 'min_weight_fraction_leaf': 0.241865432296761, 'max_features': 0.5109384300496639}. Best is trial 156 with value: 0.860262530255716.[0m
[32m[I 2022-04-13 11:44:02,527][0m Trial 282 finished with value: 0.860262530255716 and parameters: {'splitter': 'random', 'min_samples_split': 0.2647279187387982, 'min_samples_leaf': 0.04549926310905729, 'min_weight_fraction_leaf': 0.06279728941746804, 'max_features': 0.5693416490591788}. Best is trial 156 with value: 0.860262530255716.[0m
[32m[I 2022-04-13 11:44:02,626][0m Trial 283 finished with value: 0.8501522850093632 and parameters: {'splitter': 'random', 'min_samples_split': 0.24375633140601483, 'min_samples_leaf': 0.001217416585608885, 'min_weight_fraction_leaf': 0.09531258464022865, 'max_features': 0.589451768277755}. Best is trial 156 with value: 0.860262530255716.[0m
[32m[I 2022-04-13 11:44:02,715][0m Trial 284 finished with value: 0.8537871744804019 and parameters: {'splitter': 'random', 'min_samples_split': 0.27641607583762545, 'min_samples_leaf': 0.03621829410823348, 'min_weight_fraction_leaf': 0.029741299955159284, 'max_features': 0.5469338034004857}. Best is trial 156 with value: 0.860262530255716.[0m
[32m[I 2022-04-13 11:44:02,818][0m Trial 285 finished with value: 0.8495779719052834 and parameters: {'splitter': 'random', 'min_samples_split': 0.2975454385089943, 'min_samples_leaf': 0.04953773558725315, 'min_weight_fraction_leaf': 0.04278899062858478, 'max_features': 0.526026377931325}. Best is trial 156 with value: 0.860262530255716.[0m
[32m[I 2022-04-13 11:44:02,965][0m Trial 286 finished with value: 0.860262530255716 and parameters: {'splitter': 'random', 'min_samples_split': 0.27517462771455264, 'min_samples_leaf': 0.012001685172668065, 'min_weight_fraction_leaf': 0.053938084241811124, 'max_features': 0.5387747585671667}. Best is trial 156 with value: 0.860262530255716.[0m
[32m[I 2022-04-13 11:44:03,083][0m Trial 287 finished with value: 0.8537871744804019 and parameters: {'splitter': 'random', 'min_samples_split': 0.28389680395660233, 'min_samples_leaf': 0.011451663155742234, 'min_weight_fraction_leaf': 0.06398276369023384, 'max_features': 0.5941170754481119}. Best is trial 156 with value: 0.860262530255716.[0m
[32m[I 2022-04-13 11:44:03,184][0m Trial 288 finished with value: 0.860262530255716 and parameters: {'splitter': 'random', 'min_samples_split': 0.27399096543968754, 'min_samples_leaf': 0.03868520341793258, 'min_weight_fraction_leaf': 0.06660786975912483, 'max_features': 0.5736437440619438}. Best is trial 156 with value: 0.860262530255716.[0m
[32m[I 2022-04-13 11:44:03,286][0m Trial 289 finished with value: 0.8490198370094999 and parameters: {'splitter': 'random', 'min_samples_split': 0.2511601090545353, 'min_samples_leaf': 0.039221024712010846, 'min_weight_fraction_leaf': 0.07905201841311901, 'max_features': 0.5745487575112957}. Best is trial 156 with value: 0.860262530255716.[0m
[32m[I 2022-04-13 11:44:03,342][0m Trial 290 finished with value: 0.860262530255716 and parameters: {'splitter': 'random', 'min_samples_split': 0.2657227275963681, 'min_samples_leaf': 0.037804697622584274, 'min_weight_fraction_leaf': 0.07288793884616492, 'max_features': 0.5685555000179394}. Best is trial 156 with value: 0.860262530255716.[0m
[32m[I 2022-04-13 11:44:03,380][0m Trial 291 finished with value: 0.8490198370094999 and parameters: {'splitter': 'random', 'min_samples_split': 0.25460018038580673, 'min_samples_leaf': 0.022754601485912348, 'min_weight_fraction_leaf': 0.08470961806646053, 'max_features': 0.5591377124261611}. Best is trial 156 with value: 0.860262530255716.[0m
[32m[I 2022-04-13 11:44:03,438][0m Trial 292 finished with value: 0.8541689983710665 and parameters: {'splitter': 'random', 'min_samples_split': 0.23097675942199822, 'min_samples_leaf': 0.02990269571585265, 'min_weight_fraction_leaf': 0.05407230425910625, 'max_features': 0.5442208843057953}. Best is trial 156 with value: 0.860262530255716.[0m
[32m[I 2022-04-13 11:44:03,564][0m Trial 293 finished with value: 0.6188081862944745 and parameters: {'splitter': 'random', 'min_samples_split': 0.2597947204209824, 'min_samples_leaf': 0.43442441419920014, 'min_weight_fraction_leaf': 0.04206388300493647, 'max_features': 0.4876014560314105}. Best is trial 156 with value: 0.860262530255716.[0m
[32m[I 2022-04-13 11:44:03,664][0m Trial 294 finished with value: 0.8544192216908126 and parameters: {'splitter': 'random', 'min_samples_split': 0.23793988739878666, 'min_samples_leaf': 0.024039364452633688, 'min_weight_fraction_leaf': 0.03357601333911297, 'max_features': 0.519697107471827}. Best is trial 156 with value: 0.860262530255716.[0m
[32m[I 2022-04-13 11:44:03,773][0m Trial 295 finished with value: 0.860262530255716 and parameters: {'splitter': 'random', 'min_samples_split': 0.2687672846189943, 'min_samples_leaf': 0.013053762948127445, 'min_weight_fraction_leaf': 0.05640595972106355, 'max_features': 0.5246513136342069}. Best is trial 156 with value: 0.860262530255716.[0m
[32m[I 2022-04-13 11:44:03,910][0m Trial 296 finished with value: 0.860262530255716 and parameters: {'splitter': 'random', 'min_samples_split': 0.2677018970507057, 'min_samples_leaf': 0.011667462094088072, 'min_weight_fraction_leaf': 0.06588360528047266, 'max_features': 0.504099331383029}. Best is trial 156 with value: 0.860262530255716.[0m
[32m[I 2022-04-13 11:44:04,011][0m Trial 297 finished with value: 0.8073173815642989 and parameters: {'splitter': 'random', 'min_samples_split': 0.24893080200627107, 'min_samples_leaf': 0.01908992341246625, 'min_weight_fraction_leaf': 0.06522743679627509, 'max_features': 0.46947265221187107}. Best is trial 156 with value: 0.860262530255716.[0m
[32m[I 2022-04-13 11:44:04,104][0m Trial 298 finished with value: 0.8537871744804019 and parameters: {'splitter': 'random', 'min_samples_split': 0.28709507457888217, 'min_samples_leaf': 0.0017746889377308148, 'min_weight_fraction_leaf': 0.0894864780494099, 'max_features': 0.6015337406885571}. Best is trial 156 with value: 0.860262530255716.[0m
[32m[I 2022-04-13 11:44:04,189][0m Trial 299 finished with value: 0.633883214711366 and parameters: {'splitter': 'random', 'min_samples_split': 0.3031381609334295, 'min_samples_leaf': 0.4995745014947417, 'min_weight_fraction_leaf': 0.05016779759571437, 'max_features': 0.5029388104801804}. Best is trial 156 with value: 0.860262530255716.[0m
[32m[I 2022-04-13 11:44:04,281][0m Trial 300 finished with value: 0.8536735077998788 and parameters: {'splitter': 'random', 'min_samples_split': 0.2631822425719777, 'min_samples_leaf': 0.011122585299418595, 'min_weight_fraction_leaf': 0.07948449516650052, 'max_features': 0.5603277474778302}. Best is trial 156 with value: 0.860262530255716.[0m
[32m[I 2022-04-13 11:44:04,366][0m Trial 301 finished with value: 0.8537871744804019 and parameters: {'splitter': 'random', 'min_samples_split': 0.2786800976292164, 'min_samples_leaf': 0.032436074583570944, 'min_weight_fraction_leaf': 0.06183416767278842, 'max_features': 0.5953768671226711}. Best is trial 156 with value: 0.860262530255716.[0m
[32m[I 2022-04-13 11:44:04,465][0m Trial 302 finished with value: 0.8537871744804019 and parameters: {'splitter': 'random', 'min_samples_split': 0.2772524883073486, 'min_samples_leaf': 0.02767339198500251, 'min_weight_fraction_leaf': 0.04138942524223331, 'max_features': 0.5183575505224469}. Best is trial 156 with value: 0.860262530255716.[0m
[32m[I 2022-04-13 11:44:04,565][0m Trial 303 finished with value: 0.8495779719052834 and parameters: {'splitter': 'random', 'min_samples_split': 0.29163636102214885, 'min_samples_leaf': 0.02404845784846383, 'min_weight_fraction_leaf': 0.033379487228655254, 'max_features': 0.5306475633537243}. Best is trial 156 with value: 0.860262530255716.[0m
[32m[I 2022-04-13 11:44:04,686][0m Trial 304 finished with value: 0.855608859465337 and parameters: {'splitter': 'random', 'min_samples_split': 0.25704845532886694, 'min_samples_leaf': 0.03139175717181587, 'min_weight_fraction_leaf': 0.054249363903419, 'max_features': 0.5367850051575074}. Best is trial 156 with value: 0.860262530255716.[0m
[32m[I 2022-04-13 11:44:04,799][0m Trial 305 finished with value: 0.860262530255716 and parameters: {'splitter': 'random', 'min_samples_split': 0.2695010996429141, 'min_samples_leaf': 0.025215651298274376, 'min_weight_fraction_leaf': 0.04645628595716721, 'max_features': 0.5420682618332575}. Best is trial 156 with value: 0.860262530255716.[0m
[32m[I 2022-04-13 11:44:04,970][0m Trial 306 finished with value: 0.8537871744804019 and parameters: {'splitter': 'random', 'min_samples_split': 0.28679042395673804, 'min_samples_leaf': 0.01892897517808341, 'min_weight_fraction_leaf': 0.04679060350058308, 'max_features': 0.5537515170431786}. Best is trial 156 with value: 0.860262530255716.[0m
[32m[I 2022-04-13 11:44:05,047][0m Trial 307 finished with value: 0.860262530255716 and parameters: {'splitter': 'random', 'min_samples_split': 0.2709540305706386, 'min_samples_leaf': 0.04749305588403554, 'min_weight_fraction_leaf': 0.06235976912726958, 'max_features': 0.5400487592886912}. Best is trial 156 with value: 0.860262530255716.[0m
[32m[I 2022-04-13 11:44:05,221][0m Trial 308 finished with value: 0.8073173815642989 and parameters: {'splitter': 'random', 'min_samples_split': 0.24842514928008283, 'min_samples_leaf': 0.008604346801884478, 'min_weight_fraction_leaf': 0.05350639643679932, 'max_features': 0.4838832495325437}. Best is trial 156 with value: 0.860262530255716.[0m
[32m[I 2022-04-13 11:44:05,341][0m Trial 309 finished with value: 0.6188081862944745 and parameters: {'splitter': 'random', 'min_samples_split': 0.2546951316096668, 'min_samples_leaf': 0.012140686235776818, 'min_weight_fraction_leaf': 0.3619430951818627, 'max_features': 0.44731795457214213}. Best is trial 156 with value: 0.860262530255716.[0m
[32m[I 2022-04-13 11:44:05,461][0m Trial 310 finished with value: 0.8574177483619669 and parameters: {'splitter': 'random', 'min_samples_split': 0.282422795320984, 'min_samples_leaf': 0.001990944375146242, 'min_weight_fraction_leaf': 0.10285186833992033, 'max_features': 0.5918505051561931}. Best is trial 156 with value: 0.860262530255716.[0m
[32m[I 2022-04-13 11:44:05,578][0m Trial 311 finished with value: 0.860262530255716 and parameters: {'splitter': 'random', 'min_samples_split': 0.27622310822767027, 'min_samples_leaf': 0.04195593757744194, 'min_weight_fraction_leaf': 0.055201342099965404, 'max_features': 0.5076533088473176}. Best is trial 156 with value: 0.860262530255716.[0m
[32m[I 2022-04-13 11:44:05,688][0m Trial 312 finished with value: 0.8495779719052834 and parameters: {'splitter': 'random', 'min_samples_split': 0.3017381747451512, 'min_samples_leaf': 0.053769585991657154, 'min_weight_fraction_leaf': 0.029531814116467735, 'max_features': 0.5030180711895104}. Best is trial 156 with value: 0.860262530255716.[0m
[32m[I 2022-04-13 11:44:05,809][0m Trial 313 finished with value: 0.6188081862944745 and parameters: {'splitter': 'random', 'min_samples_split': 0.2777875469467496, 'min_samples_leaf': 0.35378958366368213, 'min_weight_fraction_leaf': 0.056092421404481785, 'max_features': 0.5847326469195684}. Best is trial 156 with value: 0.860262530255716.[0m
[32m[I 2022-04-13 11:44:05,928][0m Trial 314 finished with value: 0.6213855651066278 and parameters: {'splitter': 'random', 'min_samples_split': 0.24120597585891695, 'min_samples_leaf': 0.4718743025824243, 'min_weight_fraction_leaf': 0.07884878098632257, 'max_features': 0.5278545707222057}. Best is trial 156 with value: 0.860262530255716.[0m
