[32m[I 2022-04-13 11:44:06,019][0m Trial 315 finished with value: 0.860262530255716 and parameters: {'splitter': 'random', 'min_samples_split': 0.26480009251067493, 'min_samples_leaf': 0.01870319748020426, 'min_weight_fraction_leaf': 0.07149802478256845, 'max_features': 0.5631281081405537}. Best is trial 156 with value: 0.860262530255716.[0m
[32m[I 2022-04-13 11:44:06,105][0m Trial 316 finished with value: 0.855608859465337 and parameters: {'splitter': 'random', 'min_samples_split': 0.25801673999987845, 'min_samples_leaf': 0.016398345631834926, 'min_weight_fraction_leaf': 0.07222437024348476, 'max_features': 0.5537697968112242}. Best is trial 156 with value: 0.860262530255716.[0m
[32m[I 2022-04-13 11:44:06,163][0m Trial 317 finished with value: 0.8490198370094999 and parameters: {'splitter': 'random', 'min_samples_split': 0.26257649192834365, 'min_samples_leaf': 0.02024693050810513, 'min_weight_fraction_leaf': 0.08799174930400203, 'max_features': 0.5217864149244098}. Best is trial 156 with value: 0.860262530255716.[0m
[32m[I 2022-04-13 11:44:06,230][0m Trial 318 finished with value: 0.8130158757335355 and parameters: {'splitter': 'random', 'min_samples_split': 0.2940344568156841, 'min_samples_leaf': 0.031146605630099595, 'min_weight_fraction_leaf': 0.037883981255650706, 'max_features': 0.4965669484319404}. Best is trial 156 with value: 0.860262530255716.[0m
[32m[I 2022-04-13 11:44:06,290][0m Trial 319 finished with value: 0.7999200547726107 and parameters: {'splitter': 'random', 'min_samples_split': 0.2821533889685759, 'min_samples_leaf': 0.03932024380737885, 'min_weight_fraction_leaf': 0.0422449316201159, 'max_features': 0.4943318337772783}. Best is trial 156 with value: 0.860262530255716.[0m
[32m[I 2022-04-13 11:44:06,362][0m Trial 320 finished with value: 0.7426175290362615 and parameters: {'splitter': 'random', 'min_samples_split': 0.27035997435191095, 'min_samples_leaf': 0.0018836949236290014, 'min_weight_fraction_leaf': 0.19944533538189596, 'max_features': 0.5777463845344275}. Best is trial 156 with value: 0.860262530255716.[0m
[32m[I 2022-04-13 11:44:06,422][0m Trial 321 finished with value: 0.8541689983710665 and parameters: {'splitter': 'random', 'min_samples_split': 0.24579095819052726, 'min_samples_leaf': 0.04272264536531447, 'min_weight_fraction_leaf': 0.07598038345022164, 'max_features': 0.564976921023108}. Best is trial 156 with value: 0.860262530255716.[0m
[32m[I 2022-04-13 11:44:06,496][0m Trial 322 finished with value: 0.8537871744804019 and parameters: {'splitter': 'random', 'min_samples_split': 0.2894388184037376, 'min_samples_leaf': 0.03044966107688487, 'min_weight_fraction_leaf': 0.04572543477915269, 'max_features': 0.5486400864410576}. Best is trial 156 with value: 0.860262530255716.[0m
[32m[I 2022-04-13 11:44:06,564][0m Trial 323 finished with value: 0.855608859465337 and parameters: {'splitter': 'random', 'min_samples_split': 0.25989726064966506, 'min_samples_leaf': 0.008910112439490938, 'min_weight_fraction_leaf': 0.02818125977277114, 'max_features': 0.556945343524962}. Best is trial 156 with value: 0.860262530255716.[0m
[32m[I 2022-04-13 11:44:06,632][0m Trial 324 finished with value: 0.855608859465337 and parameters: {'splitter': 'random', 'min_samples_split': 0.25215658201440655, 'min_samples_leaf': 0.01808171374576633, 'min_weight_fraction_leaf': 0.06644412968713273, 'max_features': 0.5269723474824409}. Best is trial 156 with value: 0.860262530255716.[0m
[32m[I 2022-04-13 11:44:06,708][0m Trial 325 finished with value: 0.860262530255716 and parameters: {'splitter': 'random', 'min_samples_split': 0.26795845942590163, 'min_samples_leaf': 0.019297686959644463, 'min_weight_fraction_leaf': 0.07580200048922259, 'max_features': 0.5191002269418635}. Best is trial 156 with value: 0.860262530255716.[0m
[32m[I 2022-04-13 11:44:06,791][0m Trial 326 finished with value: 0.8073173815642989 and parameters: {'splitter': 'random', 'min_samples_split': 0.2380122145557778, 'min_samples_leaf': 0.010805181197543434, 'min_weight_fraction_leaf': 0.06453980397846182, 'max_features': 0.47002564084392257}. Best is trial 156 with value: 0.860262530255716.[0m
[32m[I 2022-04-13 11:44:06,849][0m Trial 327 finished with value: 0.860262530255716 and parameters: {'splitter': 'random', 'min_samples_split': 0.2638662974939136, 'min_samples_leaf': 0.057292742231443754, 'min_weight_fraction_leaf': 0.06404737589963465, 'max_features': 0.5808747353122146}. Best is trial 156 with value: 0.860262530255716.[0m
[32m[I 2022-04-13 11:44:06,920][0m Trial 328 finished with value: 0.8490198370094999 and parameters: {'splitter': 'random', 'min_samples_split': 0.25143545334409256, 'min_samples_leaf': 0.011309315688291981, 'min_weight_fraction_leaf': 0.08892207829669853, 'max_features': 0.5355035730040538}. Best is trial 156 with value: 0.860262530255716.[0m
[32m[I 2022-04-13 11:44:06,993][0m Trial 329 finished with value: 0.8515949699867061 and parameters: {'splitter': 'random', 'min_samples_split': 0.31026516498620416, 'min_samples_leaf': 0.030022381344971788, 'min_weight_fraction_leaf': 0.052114574090422985, 'max_features': 0.5101205136187423}. Best is trial 156 with value: 0.860262530255716.[0m
[32m[I 2022-04-13 11:44:07,074][0m Trial 330 finished with value: 0.8537871744804019 and parameters: {'splitter': 'random', 'min_samples_split': 0.27738439001312665, 'min_samples_leaf': 0.002893483877962467, 'min_weight_fraction_leaf': 0.05900432049256381, 'max_features': 0.5682446472266165}. Best is trial 156 with value: 0.860262530255716.[0m
[32m[I 2022-04-13 11:44:07,158][0m Trial 331 finished with value: 0.8537871744804019 and parameters: {'splitter': 'random', 'min_samples_split': 0.2843105579129413, 'min_samples_leaf': 0.04061800558998847, 'min_weight_fraction_leaf': 0.06028090988855338, 'max_features': 0.6060633888074587}. Best is trial 156 with value: 0.860262530255716.[0m
[32m[I 2022-04-13 11:44:07,224][0m Trial 332 finished with value: 0.718315820651561 and parameters: {'splitter': 'random', 'min_samples_split': 0.27202176109334386, 'min_samples_leaf': 0.25646380884330405, 'min_weight_fraction_leaf': 0.0604977490852664, 'max_features': 0.5423182033869213}. Best is trial 156 with value: 0.860262530255716.[0m
[32m[I 2022-04-13 11:44:07,302][0m Trial 333 finished with value: 0.8169418604210963 and parameters: {'splitter': 'random', 'min_samples_split': 0.2689159933339448, 'min_samples_leaf': 0.009191283990585358, 'min_weight_fraction_leaf': 0.076690270245733, 'max_features': 0.6328915290344321}. Best is trial 156 with value: 0.860262530255716.[0m
[32m[I 2022-04-13 11:44:07,370][0m Trial 334 finished with value: 0.7865929809567938 and parameters: {'splitter': 'random', 'min_samples_split': 0.2954952019128305, 'min_samples_leaf': 0.03348859337520534, 'min_weight_fraction_leaf': 0.06689457882435162, 'max_features': 0.4848358343113882}. Best is trial 156 with value: 0.860262530255716.[0m
[32m[I 2022-04-13 11:44:07,452][0m Trial 335 finished with value: 0.7999200547726107 and parameters: {'splitter': 'random', 'min_samples_split': 0.27541225458440916, 'min_samples_leaf': 0.009421020541083508, 'min_weight_fraction_leaf': 0.04340168965076605, 'max_features': 0.4653574749597384}. Best is trial 156 with value: 0.860262530255716.[0m
[32m[I 2022-04-13 11:44:07,525][0m Trial 336 finished with value: 0.8536735077998788 and parameters: {'splitter': 'random', 'min_samples_split': 0.26896279272057233, 'min_samples_leaf': 0.022823446275624583, 'min_weight_fraction_leaf': 0.08447963938491088, 'max_features': 0.5063270798948419}. Best is trial 156 with value: 0.860262530255716.[0m
[32m[I 2022-04-13 11:44:07,608][0m Trial 337 finished with value: 0.855608859465337 and parameters: {'splitter': 'random', 'min_samples_split': 0.25729636879450873, 'min_samples_leaf': 0.05308608275491141, 'min_weight_fraction_leaf': 0.04155052413125668, 'max_features': 0.5021866306986659}. Best is trial 156 with value: 0.860262530255716.[0m
[32m[I 2022-04-13 11:44:07,689][0m Trial 338 finished with value: 0.8537871744804019 and parameters: {'splitter': 'random', 'min_samples_split': 0.28631511922293995, 'min_samples_leaf': 0.027309718816281508, 'min_weight_fraction_leaf': 0.027605226339194103, 'max_features': 0.5276787332015132}. Best is trial 156 with value: 0.860262530255716.[0m
[32m[I 2022-04-13 11:44:07,779][0m Trial 339 finished with value: 0.8537871744804019 and parameters: {'splitter': 'random', 'min_samples_split': 0.27691857766485917, 'min_samples_leaf': 0.04885303808819387, 'min_weight_fraction_leaf': 0.05183786481606158, 'max_features': 0.6222078739273549}. Best is trial 156 with value: 0.860262530255716.[0m
[32m[I 2022-04-13 11:44:07,908][0m Trial 340 finished with value: 0.8537871744804019 and parameters: {'splitter': 'random', 'min_samples_split': 0.27982554128299447, 'min_samples_leaf': 0.04541436917995802, 'min_weight_fraction_leaf': 0.03551653298903558, 'max_features': 0.6018596241579587}. Best is trial 156 with value: 0.860262530255716.[0m
[32m[I 2022-04-13 11:44:07,961][0m Trial 341 finished with value: 0.8541689983710665 and parameters: {'splitter': 'random', 'min_samples_split': 0.2305020263860009, 'min_samples_leaf': 0.04880856745495367, 'min_weight_fraction_leaf': 0.045460837225697076, 'max_features': 0.502655461095663}. Best is trial 156 with value: 0.860262530255716.[0m
[32m[I 2022-04-13 11:44:08,037][0m Trial 342 finished with value: 0.8073173815642989 and parameters: {'splitter': 'random', 'min_samples_split': 0.26052133732816246, 'min_samples_leaf': 0.018051387144061962, 'min_weight_fraction_leaf': 0.04434768396447469, 'max_features': 0.48473258396785396}. Best is trial 156 with value: 0.860262530255716.[0m
[32m[I 2022-04-13 11:44:08,115][0m Trial 343 finished with value: 0.778756818992745 and parameters: {'splitter': 'random', 'min_samples_split': 0.2969488440922434, 'min_samples_leaf': 0.03961154368728979, 'min_weight_fraction_leaf': 0.05690155388533032, 'max_features': 0.3286906613434854}. Best is trial 156 with value: 0.860262530255716.[0m
[32m[I 2022-04-13 11:44:08,198][0m Trial 344 finished with value: 0.8544192216908126 and parameters: {'splitter': 'random', 'min_samples_split': 0.2456950258320202, 'min_samples_leaf': 0.025593821048510906, 'min_weight_fraction_leaf': 0.03373496726714119, 'max_features': 0.5389425348324798}. Best is trial 156 with value: 0.860262530255716.[0m
[32m[I 2022-04-13 11:44:08,325][0m Trial 345 finished with value: 0.7445764336842451 and parameters: {'splitter': 'random', 'min_samples_split': 0.25104340720269147, 'min_samples_leaf': 0.022013718289131585, 'min_weight_fraction_leaf': 0.16855009017604927, 'max_features': 0.5497612817163539}. Best is trial 156 with value: 0.860262530255716.[0m
[32m[I 2022-04-13 11:44:08,429][0m Trial 346 finished with value: 0.7203943081692755 and parameters: {'splitter': 'random', 'min_samples_split': 0.26208386037910686, 'min_samples_leaf': 0.21783074740916197, 'min_weight_fraction_leaf': 0.21985985931192834, 'max_features': 0.5672768093873637}. Best is trial 156 with value: 0.860262530255716.[0m
[32m[I 2022-04-13 11:44:08,545][0m Trial 347 finished with value: 0.8547474595641333 and parameters: {'splitter': 'random', 'min_samples_split': 0.26358508043944523, 'min_samples_leaf': 0.032302727183335225, 'min_weight_fraction_leaf': 0.09460452190974991, 'max_features': 0.5163706535354029}. Best is trial 156 with value: 0.860262530255716.[0m
[32m[I 2022-04-13 11:44:08,639][0m Trial 348 finished with value: 0.8537871744804019 and parameters: {'splitter': 'random', 'min_samples_split': 0.2767186422780584, 'min_samples_leaf': 0.03610457422908858, 'min_weight_fraction_leaf': 0.05709258524793182, 'max_features': 0.5658258660277975}. Best is trial 156 with value: 0.860262530255716.[0m
[32m[I 2022-04-13 11:44:08,735][0m Trial 349 finished with value: 0.8495779719052834 and parameters: {'splitter': 'random', 'min_samples_split': 0.290657068760722, 'min_samples_leaf': 0.03175206967510677, 'min_weight_fraction_leaf': 0.05030255910206614, 'max_features': 0.5469072307725834}. Best is trial 156 with value: 0.860262530255716.[0m
[32m[I 2022-04-13 11:44:08,851][0m Trial 350 finished with value: 0.8515949699867061 and parameters: {'splitter': 'random', 'min_samples_split': 0.305865859002429, 'min_samples_leaf': 0.02960356532882894, 'min_weight_fraction_leaf': 0.03528147722643949, 'max_features': 0.5477077672765818}. Best is trial 156 with value: 0.860262530255716.[0m
[32m[I 2022-04-13 11:44:08,970][0m Trial 351 finished with value: 0.860262530255716 and parameters: {'splitter': 'random', 'min_samples_split': 0.27149160877903084, 'min_samples_leaf': 0.06205880933823592, 'min_weight_fraction_leaf': 0.06977927546884624, 'max_features': 0.5789076376984196}. Best is trial 156 with value: 0.860262530255716.[0m
[32m[I 2022-04-13 11:44:09,072][0m Trial 352 finished with value: 0.8547474595641333 and parameters: {'splitter': 'random', 'min_samples_split': 0.2686390761832551, 'min_samples_leaf': 0.008620607017736568, 'min_weight_fraction_leaf': 0.10154532021688203, 'max_features': 0.5994054702275506}. Best is trial 156 with value: 0.860262530255716.[0m
[32m[I 2022-04-13 11:44:09,168][0m Trial 353 finished with value: 0.855608859465337 and parameters: {'splitter': 'random', 'min_samples_split': 0.2539623139241512, 'min_samples_leaf': 0.02135651338522455, 'min_weight_fraction_leaf': 0.0476872644033681, 'max_features': 0.5533157450584918}. Best is trial 156 with value: 0.860262530255716.[0m
[32m[I 2022-04-13 11:44:09,274][0m Trial 354 finished with value: 0.8541689983710665 and parameters: {'splitter': 'random', 'min_samples_split': 0.24617841840541446, 'min_samples_leaf': 0.013437571319441658, 'min_weight_fraction_leaf': 0.07490429771564983, 'max_features': 0.529669120310161}. Best is trial 156 with value: 0.860262530255716.[0m
[32m[I 2022-04-13 11:44:09,382][0m Trial 355 finished with value: 0.7865929809567938 and parameters: {'splitter': 'random', 'min_samples_split': 0.2841230537848153, 'min_samples_leaf': 0.03965162140121003, 'min_weight_fraction_leaf': 0.07103074199018869, 'max_features': 0.4488756403909359}. Best is trial 156 with value: 0.860262530255716.[0m
[32m[I 2022-04-13 11:44:09,486][0m Trial 356 finished with value: 0.8490198370094999 and parameters: {'splitter': 'random', 'min_samples_split': 0.2609887437475167, 'min_samples_leaf': 0.048336988737001575, 'min_weight_fraction_leaf': 0.0830955082886464, 'max_features': 0.5822031120996789}. Best is trial 156 with value: 0.860262530255716.[0m
[32m[I 2022-04-13 11:44:09,525][0m Trial 357 finished with value: 0.8537871744804019 and parameters: {'splitter': 'random', 'min_samples_split': 0.27966218857924424, 'min_samples_leaf': 0.033312788059236875, 'min_weight_fraction_leaf': 0.05886207796064557, 'max_features': 0.5838495553918496}. Best is trial 156 with value: 0.860262530255716.[0m
[32m[I 2022-04-13 11:44:09,563][0m Trial 358 finished with value: 0.8545491549766135 and parameters: {'splitter': 'random', 'min_samples_split': 0.31943316640236397, 'min_samples_leaf': 0.0015943537660126437, 'min_weight_fraction_leaf': 0.06419280824801105, 'max_features': 0.5132643040674568}. Best is trial 156 with value: 0.860262530255716.[0m
[32m[I 2022-04-13 11:44:09,601][0m Trial 359 finished with value: 0.8484399756279405 and parameters: {'splitter': 'random', 'min_samples_split': 0.23553967187026276, 'min_samples_leaf': 0.019352539950163304, 'min_weight_fraction_leaf': 0.07928414483852105, 'max_features': 0.5219234747339094}. Best is trial 156 with value: 0.860262530255716.[0m
[32m[I 2022-04-13 11:44:09,657][0m Trial 360 finished with value: 0.8136417764377363 and parameters: {'splitter': 'random', 'min_samples_split': 0.2666972827499087, 'min_samples_leaf': 0.02207691954709297, 'min_weight_fraction_leaf': 0.023567586015651183, 'max_features': 0.3794516964375012}. Best is trial 156 with value: 0.860262530255716.[0m
[32m[I 2022-04-13 11:44:09,722][0m Trial 361 finished with value: 0.7865929809567938 and parameters: {'splitter': 'random', 'min_samples_split': 0.2676362753630698, 'min_samples_leaf': 0.06235851454353722, 'min_weight_fraction_leaf': 0.07662661562977624, 'max_features': 0.4694067085252838}. Best is trial 156 with value: 0.860262530255716.[0m
[32m[I 2022-04-13 11:44:09,763][0m Trial 362 finished with value: 0.7932323371363277 and parameters: {'splitter': 'random', 'min_samples_split': 0.2559422989225727, 'min_samples_leaf': 0.013222737267608236, 'min_weight_fraction_leaf': 0.07244346230403136, 'max_features': 0.48763758275086866}. Best is trial 156 with value: 0.860262530255716.[0m
[32m[I 2022-04-13 11:44:09,803][0m Trial 363 finished with value: 0.8529006717303197 and parameters: {'splitter': 'random', 'min_samples_split': 0.253348752376654, 'min_samples_leaf': 0.0010572284235521433, 'min_weight_fraction_leaf': 0.11194803338313156, 'max_features': 0.6248682935735008}. Best is trial 156 with value: 0.860262530255716.[0m
[32m[I 2022-04-13 11:44:09,842][0m Trial 364 finished with value: 0.8495779719052834 and parameters: {'splitter': 'random', 'min_samples_split': 0.2943266621037574, 'min_samples_leaf': 0.04108148674332718, 'min_weight_fraction_leaf': 0.056141295039903456, 'max_features': 0.5735644480410237}. Best is trial 156 with value: 0.860262530255716.[0m
[32m[I 2022-04-13 11:44:09,880][0m Trial 365 finished with value: 0.860262530255716 and parameters: {'splitter': 'random', 'min_samples_split': 0.27544752951290596, 'min_samples_leaf': 0.052930853514592285, 'min_weight_fraction_leaf': 0.053635799545483226, 'max_features': 0.5079831219222812}. Best is trial 156 with value: 0.860262530255716.[0m
[32m[I 2022-04-13 11:44:09,919][0m Trial 366 finished with value: 0.8484399756279405 and parameters: {'splitter': 'random', 'min_samples_split': 0.24399877830841515, 'min_samples_leaf': 0.016040350220638915, 'min_weight_fraction_leaf': 0.08803515841277147, 'max_features': 0.5355405903946309}. Best is trial 156 with value: 0.860262530255716.[0m
[32m[I 2022-04-13 11:44:09,958][0m Trial 367 finished with value: 0.8537871744804019 and parameters: {'splitter': 'random', 'min_samples_split': 0.2820470750978358, 'min_samples_leaf': 0.053410841572078885, 'min_weight_fraction_leaf': 0.04805220968090171, 'max_features': 0.5764065760136653}. Best is trial 156 with value: 0.860262530255716.[0m
[32m[I 2022-04-13 11:44:10,000][0m Trial 368 finished with value: 0.8537871744804019 and parameters: {'splitter': 'random', 'min_samples_split': 0.28693695595833246, 'min_samples_leaf': 0.0277795080164928, 'min_weight_fraction_leaf': 0.05882069742399817, 'max_features': 0.6079025838372064}. Best is trial 156 with value: 0.860262530255716.[0m
[32m[I 2022-04-13 11:44:10,039][0m Trial 369 finished with value: 0.8505444862652425 and parameters: {'splitter': 'random', 'min_samples_split': 0.2776643451900131, 'min_samples_leaf': 0.039838243312287656, 'min_weight_fraction_leaf': 0.15419418066394386, 'max_features': 0.5982997870934844}. Best is trial 156 with value: 0.860262530255716.[0m
[32m[I 2022-04-13 11:44:10,077][0m Trial 370 finished with value: 0.7445764336842451 and parameters: {'splitter': 'random', 'min_samples_split': 0.2778845096577605, 'min_samples_leaf': 0.03764660689287855, 'min_weight_fraction_leaf': 0.1809534278148735, 'max_features': 0.574648197914639}. Best is trial 156 with value: 0.860262530255716.[0m
[32m[I 2022-04-13 11:44:10,121][0m Trial 371 finished with value: 0.6332669867606551 and parameters: {'splitter': 'random', 'min_samples_split': 0.2621286320485219, 'min_samples_leaf': 0.28220100239195095, 'min_weight_fraction_leaf': 0.07058857618572978, 'max_features': 0.4964197939047541}. Best is trial 156 with value: 0.860262530255716.[0m
[32m[I 2022-04-13 11:44:10,199][0m Trial 372 finished with value: 0.6188081862944745 and parameters: {'splitter': 'random', 'min_samples_split': 0.2627939287862482, 'min_samples_leaf': 0.010555459102357933, 'min_weight_fraction_leaf': 0.40353010953136986, 'max_features': 0.5813700409737252}. Best is trial 156 with value: 0.860262530255716.[0m
[32m[I 2022-04-13 11:44:10,290][0m Trial 373 finished with value: 0.855608859465337 and parameters: {'splitter': 'random', 'min_samples_split': 0.2502895184382646, 'min_samples_leaf': 0.026532383117848987, 'min_weight_fraction_leaf': 0.03446292448863204, 'max_features': 0.5540426969188095}. Best is trial 156 with value: 0.860262530255716.[0m
[32m[I 2022-04-13 11:44:10,359][0m Trial 374 finished with value: 0.8530273199001748 and parameters: {'splitter': 'random', 'min_samples_split': 0.35586930950384804, 'min_samples_leaf': 0.0027372574999093, 'min_weight_fraction_leaf': 0.041179020791975676, 'max_features': 0.5489522939319205}. Best is trial 156 with value: 0.860262530255716.[0m
[32m[I 2022-04-13 11:44:10,441][0m Trial 375 finished with value: 0.8495779719052834 and parameters: {'splitter': 'random', 'min_samples_split': 0.29831610232557587, 'min_samples_leaf': 0.0504288026503766, 'min_weight_fraction_leaf': 0.05368785170619586, 'max_features': 0.536827659053702}. Best is trial 156 with value: 0.860262530255716.[0m
[32m[I 2022-04-13 11:44:10,519][0m Trial 376 finished with value: 0.6334936025301521 and parameters: {'splitter': 'random', 'min_samples_split': 0.2895728460108734, 'min_samples_leaf': 0.0472905893670316, 'min_weight_fraction_leaf': 0.2848519272811221, 'max_features': 0.5075770131215688}. Best is trial 156 with value: 0.860262530255716.[0m
[32m[I 2022-04-13 11:44:10,596][0m Trial 377 finished with value: 0.8537871744804019 and parameters: {'splitter': 'random', 'min_samples_split': 0.2780453748632735, 'min_samples_leaf': 0.03522435860916521, 'min_weight_fraction_leaf': 0.021799267568470573, 'max_features': 0.5599928064447945}. Best is trial 156 with value: 0.860262530255716.[0m
