[32m[I 2022-04-14 12:23:35,054][0m Trial 323 finished with value: 0.7417923719567379 and parameters: {'loss': 'coxph', 'learning_rate': 0.0017835697368506907, 'n_estimators': 869, 'criterion': 'friedman_mse', 'min_samples_split': 9, 'min_samples_leaf': 1, 'min_weight_fraction_leaf': 0.1442650490395759, 'min_impurity_decrease': 0.11320630515004254, 'max_features': 0.9258444873185558, 'subsample': 0.6713237804957358, 'dropout_rate': 0.32058303256789594, 'ccp_alpha': 0.08576225311715527}. Best is trial 296 with value: 0.7450864268862003.[0m
[32m[I 2022-04-14 12:25:33,864][0m Trial 324 finished with value: 0.5328286035390352 and parameters: {'loss': 'coxph', 'learning_rate': 0.0015655485352682106, 'n_estimators': 858, 'criterion': 'friedman_mse', 'min_samples_split': 9, 'min_samples_leaf': 1, 'min_weight_fraction_leaf': 0.1444805043179862, 'min_impurity_decrease': 0.10297696820556113, 'max_features': 0.9878350236425343, 'subsample': 0.7662913745893027, 'dropout_rate': 0.2991914774513823, 'ccp_alpha': 0.30219728964629433}. Best is trial 296 with value: 0.7450864268862003.[0m
[32m[I 2022-04-14 12:27:25,141][0m Trial 325 finished with value: 0.7376196341218763 and parameters: {'loss': 'coxph', 'learning_rate': 0.0011231952501508764, 'n_estimators': 838, 'criterion': 'friedman_mse', 'min_samples_split': 9, 'min_samples_leaf': 1, 'min_weight_fraction_leaf': 0.11188573034475285, 'min_impurity_decrease': 0.14683420284725957, 'max_features': 0.9714094803430726, 'subsample': 0.7940129092458945, 'dropout_rate': 0.3173492828341864, 'ccp_alpha': 0.07529993314805385}. Best is trial 296 with value: 0.7450864268862003.[0m
[32m[I 2022-04-14 12:29:37,662][0m Trial 326 finished with value: 0.2626559638955576 and parameters: {'loss': 'squared', 'learning_rate': 0.0013354233382360634, 'n_estimators': 885, 'criterion': 'friedman_mse', 'min_samples_split': 9, 'min_samples_leaf': 1, 'min_weight_fraction_leaf': 0.13596117520803838, 'min_impurity_decrease': 0.10613141157294324, 'max_features': 0.9382792901635713, 'subsample': 0.7607639831139559, 'dropout_rate': 0.3467478775218619, 'ccp_alpha': 0.20849609354177884}. Best is trial 296 with value: 0.7450864268862003.[0m
[32m[I 2022-04-14 12:31:56,498][0m Trial 327 finished with value: 0.7321349366174498 and parameters: {'loss': 'coxph', 'learning_rate': 0.0017808480421284353, 'n_estimators': 909, 'criterion': 'friedman_mse', 'min_samples_split': 9, 'min_samples_leaf': 1, 'min_weight_fraction_leaf': 0.12038159539945122, 'min_impurity_decrease': 0.09471708227265882, 'max_features': 0.9212003801117413, 'subsample': 0.6603576558736332, 'dropout_rate': 0.3111094923426113, 'ccp_alpha': 0.004570565732172363}. Best is trial 296 with value: 0.7450864268862003.[0m
[32m[I 2022-04-14 12:33:51,170][0m Trial 328 finished with value: 0.7376572408594848 and parameters: {'loss': 'coxph', 'learning_rate': 0.002480915056788056, 'n_estimators': 817, 'criterion': 'friedman_mse', 'min_samples_split': 9, 'min_samples_leaf': 1, 'min_weight_fraction_leaf': 0.1679019683066856, 'min_impurity_decrease': 0.08159666806127011, 'max_features': 0.9058850995602296, 'subsample': 0.7725117230442664, 'dropout_rate': 0.32818030711144575, 'ccp_alpha': 0.08926192160255665}. Best is trial 296 with value: 0.7450864268862003.[0m
[32m[I 2022-04-14 12:36:05,831][0m Trial 329 finished with value: 0.7383182638371736 and parameters: {'loss': 'coxph', 'learning_rate': 0.0010403056850202955, 'n_estimators': 878, 'criterion': 'friedman_mse', 'min_samples_split': 9, 'min_samples_leaf': 1, 'min_weight_fraction_leaf': 0.11169863656826304, 'min_impurity_decrease': 0.11125278974235256, 'max_features': 0.9306344424866989, 'subsample': 0.6859397810496134, 'dropout_rate': 0.28812775818727115, 'ccp_alpha': 0.001753040428026889}. Best is trial 296 with value: 0.7450864268862003.[0m
[32m[I 2022-04-14 12:38:12,958][0m Trial 330 finished with value: 0.721881424752247 and parameters: {'loss': 'coxph', 'learning_rate': 0.000998609805058982, 'n_estimators': 869, 'criterion': 'friedman_mse', 'min_samples_split': 9, 'min_samples_leaf': 1, 'min_weight_fraction_leaf': 0.11136112664792827, 'min_impurity_decrease': 0.12919803452345754, 'max_features': 0.9350844393854363, 'subsample': 0.709890410212507, 'dropout_rate': 0.32658361987814744, 'ccp_alpha': 0.175617712367508}. Best is trial 296 with value: 0.7450864268862003.[0m
[32m[I 2022-04-14 12:40:03,744][0m Trial 331 finished with value: 0.5688311314537235 and parameters: {'loss': 'coxph', 'learning_rate': 0.0010864677274400806, 'n_estimators': 816, 'criterion': 'friedman_mse', 'min_samples_split': 10, 'min_samples_leaf': 1, 'min_weight_fraction_leaf': 0.11226386020944303, 'min_impurity_decrease': 0.15411771520495754, 'max_features': 0.9570665255586809, 'subsample': 0.6744693274955491, 'dropout_rate': 0.293011693709217, 'ccp_alpha': 0.34054190803845946}. Best is trial 296 with value: 0.7450864268862003.[0m
[32m[I 2022-04-14 12:42:17,402][0m Trial 332 finished with value: 0.7401129252476759 and parameters: {'loss': 'coxph', 'learning_rate': 0.0017461468195807044, 'n_estimators': 862, 'criterion': 'friedman_mse', 'min_samples_split': 9, 'min_samples_leaf': 2, 'min_weight_fraction_leaf': 0.12263305407077665, 'min_impurity_decrease': 0.11857449497985517, 'max_features': 0.927570227115881, 'subsample': 0.7232049009006886, 'dropout_rate': 0.28946051045367943, 'ccp_alpha': 0.10463810952772573}. Best is trial 296 with value: 0.7450864268862003.[0m
[32m[I 2022-04-14 12:44:17,318][0m Trial 333 finished with value: 0.6850854883381585 and parameters: {'loss': 'coxph', 'learning_rate': 0.0023096870673529066, 'n_estimators': 841, 'criterion': 'friedman_mse', 'min_samples_split': 9, 'min_samples_leaf': 2, 'min_weight_fraction_leaf': 0.12493025897599383, 'min_impurity_decrease': 0.12487894216861802, 'max_features': 0.9177990297312095, 'subsample': 0.7329341446566658, 'dropout_rate': 0.3073262631681384, 'ccp_alpha': 0.260818810692283}. Best is trial 296 with value: 0.7450864268862003.[0m
[32m[I 2022-04-14 12:46:36,299][0m Trial 334 finished with value: 0.7178758058340473 and parameters: {'loss': 'coxph', 'learning_rate': 0.0018030572948608491, 'n_estimators': 911, 'criterion': 'friedman_mse', 'min_samples_split': 9, 'min_samples_leaf': 2, 'min_weight_fraction_leaf': 0.12271064633382117, 'min_impurity_decrease': 0.07389423192491916, 'max_features': 0.892312197828939, 'subsample': 0.6614603774573018, 'dropout_rate': 0.3294652229609685, 'ccp_alpha': 0.16830908127325694}. Best is trial 296 with value: 0.7450864268862003.[0m
[32m[I 2022-04-14 12:49:14,593][0m Trial 335 finished with value: 0.5 and parameters: {'loss': 'coxph', 'learning_rate': 0.06493367429349471, 'n_estimators': 912, 'criterion': 'friedman_mse', 'min_samples_split': 9, 'min_samples_leaf': 2, 'min_weight_fraction_leaf': 0.10635645968263834, 'min_impurity_decrease': 0.1501726438734517, 'max_features': 0.876578308220261, 'subsample': 0.7238106853920873, 'dropout_rate': 0.2839476512885837, 'ccp_alpha': 2.6050982815020225}. Best is trial 296 with value: 0.7450864268862003.[0m
[32m[I 2022-04-14 12:51:15,663][0m Trial 336 finished with value: 0.5 and parameters: {'loss': 'coxph', 'learning_rate': 0.0014069492304852847, 'n_estimators': 862, 'criterion': 'friedman_mse', 'min_samples_split': 10, 'min_samples_leaf': 1, 'min_weight_fraction_leaf': 0.1486998392545761, 'min_impurity_decrease': 0.07885787881311909, 'max_features': 0.9029466603297653, 'subsample': 0.7825365987638913, 'dropout_rate': 0.2596822314270218, 'ccp_alpha': 0.453436652714151}. Best is trial 296 with value: 0.7450864268862003.[0m
[32m[I 2022-04-14 12:53:20,369][0m Trial 337 finished with value: 0.7395228061379369 and parameters: {'loss': 'coxph', 'learning_rate': 0.0024671062215530365, 'n_estimators': 803, 'criterion': 'friedman_mse', 'min_samples_split': 9, 'min_samples_leaf': 2, 'min_weight_fraction_leaf': 0.11770225079389673, 'min_impurity_decrease': 0.11296387929292806, 'max_features': 0.8835279410536996, 'subsample': 0.6980887823775186, 'dropout_rate': 0.2249511836632333, 'ccp_alpha': 0.10925569771684046}. Best is trial 296 with value: 0.7450864268862003.[0m
[32m[I 2022-04-14 12:55:18,429][0m Trial 338 finished with value: 0.5328286035390352 and parameters: {'loss': 'coxph', 'learning_rate': 0.0016366790308159891, 'n_estimators': 788, 'criterion': 'friedman_mse', 'min_samples_split': 9, 'min_samples_leaf': 2, 'min_weight_fraction_leaf': 0.1308117288925306, 'min_impurity_decrease': 0.13061958752920216, 'max_features': 0.9568476998045328, 'subsample': 0.7081518892177733, 'dropout_rate': 0.22741843312633686, 'ccp_alpha': 0.3568165625174845}. Best is trial 296 with value: 0.7450864268862003.[0m
[32m[I 2022-04-14 12:57:18,737][0m Trial 339 finished with value: 0.6885141572663046 and parameters: {'loss': 'coxph', 'learning_rate': 0.0025153393069140308, 'n_estimators': 807, 'criterion': 'friedman_mse', 'min_samples_split': 9, 'min_samples_leaf': 2, 'min_weight_fraction_leaf': 0.14122808326696581, 'min_impurity_decrease': 0.11759526456118005, 'max_features': 0.9237421360630217, 'subsample': 0.7510607753712282, 'dropout_rate': 0.23498955223553003, 'ccp_alpha': 0.2361548085277125}. Best is trial 296 with value: 0.7450864268862003.[0m
[32m[I 2022-04-14 12:57:21,565][0m Trial 340 finished with value: 0.7288877771541669 and parameters: {'loss': 'coxph', 'learning_rate': 0.001849596157130909, 'n_estimators': 111, 'criterion': 'friedman_mse', 'min_samples_split': 9, 'min_samples_leaf': 2, 'min_weight_fraction_leaf': 0.11870827895777201, 'min_impurity_decrease': 0.1609071859159702, 'max_features': 0.88538367906205, 'subsample': 0.7004498516454772, 'dropout_rate': 0.2742113973284009, 'ccp_alpha': 0.12768586156220327}. Best is trial 296 with value: 0.7450864268862003.[0m
[32m[I 2022-04-14 12:59:23,403][0m Trial 341 finished with value: 0.7363472700980397 and parameters: {'loss': 'coxph', 'learning_rate': 0.0012506405472857262, 'n_estimators': 829, 'criterion': 'friedman_mse', 'min_samples_split': 9, 'min_samples_leaf': 1, 'min_weight_fraction_leaf': 0.1266084066889398, 'min_impurity_decrease': 0.10547398525682924, 'max_features': 0.9036479644751426, 'subsample': 0.6915063198806469, 'dropout_rate': 0.24601448900909093, 'ccp_alpha': 0.10093907276117763}. Best is trial 296 with value: 0.7450864268862003.[0m
[32m[I 2022-04-14 13:01:39,882][0m Trial 342 finished with value: 0.6972970542707132 and parameters: {'loss': 'coxph', 'learning_rate': 0.002097141725101678, 'n_estimators': 858, 'criterion': 'friedman_mse', 'min_samples_split': 9, 'min_samples_leaf': 1, 'min_weight_fraction_leaf': 0.11558101130516091, 'min_impurity_decrease': 0.6159372856281025, 'max_features': 0.9798795497840809, 'subsample': 0.6774449869379863, 'dropout_rate': 0.297706504453088, 'ccp_alpha': 0.2547351012110485}. Best is trial 296 with value: 0.7450864268862003.[0m
[32m[I 2022-04-14 13:03:39,439][0m Trial 343 finished with value: 0.7360596757219865 and parameters: {'loss': 'coxph', 'learning_rate': 0.0008882786736901297, 'n_estimators': 795, 'criterion': 'friedman_mse', 'min_samples_split': 9, 'min_samples_leaf': 1, 'min_weight_fraction_leaf': 0.10667271846160138, 'min_impurity_decrease': 0.141889105638941, 'max_features': 0.8675499989793238, 'subsample': 0.7239690885354569, 'dropout_rate': 0.2551703011473434, 'ccp_alpha': 0.0970628612201194}. Best is trial 296 with value: 0.7450864268862003.[0m
[32m[I 2022-04-14 13:05:53,142][0m Trial 344 finished with value: 0.7245827865157775 and parameters: {'loss': 'coxph', 'learning_rate': 0.0014193334888229299, 'n_estimators': 892, 'criterion': 'friedman_mse', 'min_samples_split': 9, 'min_samples_leaf': 1, 'min_weight_fraction_leaf': 0.13586983592121224, 'min_impurity_decrease': 0.09289021448207208, 'max_features': 0.9368608852540221, 'subsample': 0.629215992105985, 'dropout_rate': 0.2730836254087811, 'ccp_alpha': 0.18620129006549913}. Best is trial 296 with value: 0.7450864268862003.[0m
[32m[I 2022-04-14 13:08:25,570][0m Trial 345 finished with value: 0.7296128288832191 and parameters: {'loss': 'coxph', 'learning_rate': 0.0027808287713924876, 'n_estimators': 914, 'criterion': 'friedman_mse', 'min_samples_split': 9, 'min_samples_leaf': 2, 'min_weight_fraction_leaf': 0.12020474082974919, 'min_impurity_decrease': 0.11456431447739494, 'max_features': 0.38701396978464714, 'subsample': 0.6423487834821603, 'dropout_rate': 0.22928222196712938, 'ccp_alpha': 0.08640160400050109}. Best is trial 296 with value: 0.7450864268862003.[0m
[32m[I 2022-04-14 13:10:07,016][0m Trial 346 finished with value: 0.28018000456938463 and parameters: {'loss': 'squared', 'learning_rate': 0.0018372700576592368, 'n_estimators': 830, 'criterion': 'friedman_mse', 'min_samples_split': 9, 'min_samples_leaf': 2, 'min_weight_fraction_leaf': 0.12800884267938545, 'min_impurity_decrease': 0.08851753485476482, 'max_features': 0.8798957146014278, 'subsample': 0.5896119330520243, 'dropout_rate': 0.3699077071901702, 'ccp_alpha': 0.32266644766962926}. Best is trial 296 with value: 0.7450864268862003.[0m
[32m[I 2022-04-14 13:12:14,307][0m Trial 347 finished with value: 0.7245240735735731 and parameters: {'loss': 'coxph', 'learning_rate': 0.0011066477285254749, 'n_estimators': 869, 'criterion': 'friedman_mse', 'min_samples_split': 9, 'min_samples_leaf': 1, 'min_weight_fraction_leaf': 0.10696921520591712, 'min_impurity_decrease': 0.13130915205281726, 'max_features': 0.9126812523369086, 'subsample': 0.6673085517871137, 'dropout_rate': 0.3136054740336189, 'ccp_alpha': 0.18495763224968675}. Best is trial 296 with value: 0.7450864268862003.[0m
[32m[I 2022-04-14 13:14:40,319][0m Trial 348 finished with value: 0.5 and parameters: {'loss': 'coxph', 'learning_rate': 0.0015242941682397106, 'n_estimators': 919, 'criterion': 'friedman_mse', 'min_samples_split': 9, 'min_samples_leaf': 1, 'min_weight_fraction_leaf': 0.1524956184574534, 'min_impurity_decrease': 0.06456765981898958, 'max_features': 0.8462292969207663, 'subsample': 0.6558074193615167, 'dropout_rate': 0.255626243576854, 'ccp_alpha': 1.5789120519353022}. Best is trial 296 with value: 0.7450864268862003.[0m
[32m[I 2022-04-14 13:16:34,238][0m Trial 349 finished with value: 0.7411159506847447 and parameters: {'loss': 'coxph', 'learning_rate': 0.0008204718152936611, 'n_estimators': 776, 'criterion': 'friedman_mse', 'min_samples_split': 9, 'min_samples_leaf': 1, 'min_weight_fraction_leaf': 0.1143654798535597, 'min_impurity_decrease': 0.10768899859875566, 'max_features': 0.8927529456444361, 'subsample': 0.689006720251699, 'dropout_rate': 0.2215744221477403, 'ccp_alpha': 0.08524160201248569}. Best is trial 296 with value: 0.7450864268862003.[0m
[32m[I 2022-04-14 13:17:50,474][0m Trial 350 finished with value: 0.5 and parameters: {'loss': 'coxph', 'learning_rate': 0.0008212327200445496, 'n_estimators': 759, 'criterion': 'friedman_mse', 'min_samples_split': 9, 'min_samples_leaf': 1, 'min_weight_fraction_leaf': 0.1017153579526013, 'min_impurity_decrease': 0.0999138282970926, 'max_features': 0.892097902505502, 'subsample': 0.6968485103213078, 'dropout_rate': 0.2194953645945951, 'ccp_alpha': 0.4527067452864868}. Best is trial 296 with value: 0.7450864268862003.[0m
[32m[I 2022-04-14 13:18:59,826][0m Trial 351 finished with value: 0.5856288805787843 and parameters: {'loss': 'coxph', 'learning_rate': 0.0008362790813821508, 'n_estimators': 717, 'criterion': 'friedman_mse', 'min_samples_split': 9, 'min_samples_leaf': 1, 'min_weight_fraction_leaf': 0.11247650058618833, 'min_impurity_decrease': 0.07976000740143585, 'max_features': 0.9193259069667274, 'subsample': 0.8248491795379418, 'dropout_rate': 0.22551252959898976, 'ccp_alpha': 0.25787758124149274}. Best is trial 296 with value: 0.7450864268862003.[0m
[32m[I 2022-04-14 13:20:07,846][0m Trial 352 finished with value: 0.7192549704843918 and parameters: {'loss': 'coxph', 'learning_rate': 0.0011309815237877155, 'n_estimators': 779, 'criterion': 'friedman_mse', 'min_samples_split': 8, 'min_samples_leaf': 1, 'min_weight_fraction_leaf': 0.13860989387841177, 'min_impurity_decrease': 0.10729309076781272, 'max_features': 0.8582818647212326, 'subsample': 0.7189750146954419, 'dropout_rate': 0.34001668879054353, 'ccp_alpha': 0.17492709080542962}. Best is trial 296 with value: 0.7450864268862003.[0m
[32m[I 2022-04-14 13:21:29,470][0m Trial 353 finished with value: 0.735895710459354 and parameters: {'loss': 'coxph', 'learning_rate': 0.0009463203560275085, 'n_estimators': 825, 'criterion': 'friedman_mse', 'min_samples_split': 10, 'min_samples_leaf': 9, 'min_weight_fraction_leaf': 0.10011378677797214, 'min_impurity_decrease': 0.06683332211110628, 'max_features': 0.8916147497334923, 'subsample': 0.7465865432584862, 'dropout_rate': 0.2869078836155989, 'ccp_alpha': 0.09277385416043175}. Best is trial 296 with value: 0.7450864268862003.[0m
[32m[I 2022-04-14 13:22:52,889][0m Trial 354 finished with value: 0.5 and parameters: {'loss': 'coxph', 'learning_rate': 0.0013381262094389337, 'n_estimators': 793, 'criterion': 'friedman_mse', 'min_samples_split': 9, 'min_samples_leaf': 1, 'min_weight_fraction_leaf': 0.12834783010072157, 'min_impurity_decrease': 0.08869220122632425, 'max_features': 0.9402977776876664, 'subsample': 0.6822299944187356, 'dropout_rate': 0.21655641228942912, 'ccp_alpha': 1.1391987248040474}. Best is trial 296 with value: 0.7450864268862003.[0m
[32m[I 2022-04-14 13:24:18,333][0m Trial 355 finished with value: 0.5 and parameters: {'loss': 'coxph', 'learning_rate': 0.0007465788066244396, 'n_estimators': 850, 'criterion': 'absolute_error', 'min_samples_split': 9, 'min_samples_leaf': 1, 'min_weight_fraction_leaf': 0.11356851679014277, 'min_impurity_decrease': 0.47484012691920546, 'max_features': 0.8777274530908583, 'subsample': 0.785666641081811, 'dropout_rate': 0.2758666056454353, 'ccp_alpha': 0.08774256068200709}. Best is trial 296 with value: 0.7450864268862003.[0m
[32m[I 2022-04-14 13:26:01,291][0m Trial 356 finished with value: 0.6825599739716557 and parameters: {'loss': 'coxph', 'learning_rate': 0.0010626333159255597, 'n_estimators': 882, 'criterion': 'friedman_mse', 'min_samples_split': 8, 'min_samples_leaf': 2, 'min_weight_fraction_leaf': 0.11807967086595333, 'min_impurity_decrease': 0.062232037663183276, 'max_features': 0.8436493410976698, 'subsample': 0.5997944352475101, 'dropout_rate': 0.2410337849968661, 'ccp_alpha': 0.3081131464115655}. Best is trial 296 with value: 0.7450864268862003.[0m
[32m[I 2022-04-14 13:27:24,339][0m Trial 357 finished with value: 0.710283356301862 and parameters: {'loss': 'coxph', 'learning_rate': 0.0016269845913473415, 'n_estimators': 816, 'criterion': 'friedman_mse', 'min_samples_split': 9, 'min_samples_leaf': 1, 'min_weight_fraction_leaf': 0.10353597595463293, 'min_impurity_decrease': 0.1426682096537007, 'max_features': 0.9988604410285744, 'subsample': 0.7367003703102939, 'dropout_rate': 0.29702283921860606, 'ccp_alpha': 0.18287427148380556}. Best is trial 296 with value: 0.7450864268862003.[0m
[32m[I 2022-04-14 13:28:30,458][0m Trial 358 finished with value: 0.7343777850150027 and parameters: {'loss': 'coxph', 'learning_rate': 0.0006693769130358453, 'n_estimators': 748, 'criterion': 'friedman_mse', 'min_samples_split': 8, 'min_samples_leaf': 1, 'min_weight_fraction_leaf': 0.13192440645271264, 'min_impurity_decrease': 0.11259535025700389, 'max_features': 0.9037339408000288, 'subsample': 0.691730150623087, 'dropout_rate': 0.31503216441830617, 'ccp_alpha': 0.0019223734818050035}. Best is trial 296 with value: 0.7450864268862003.[0m
[32m[I 2022-04-14 13:30:26,212][0m Trial 359 finished with value: 0.7360735983845401 and parameters: {'loss': 'coxph', 'learning_rate': 0.0012031368989441301, 'n_estimators': 922, 'criterion': 'friedman_mse', 'min_samples_split': 9, 'min_samples_leaf': 1, 'min_weight_fraction_leaf': 0.11140170719501703, 'min_impurity_decrease': 0.08525284259433015, 'max_features': 0.865205812750109, 'subsample': 0.7144155730008052, 'dropout_rate': 0.26426017291857185, 'ccp_alpha': 0.09894321367882539}. Best is trial 296 with value: 0.7450864268862003.[0m
[32m[I 2022-04-14 13:30:34,976][0m Trial 360 finished with value: 0.5305843384277745 and parameters: {'loss': 'coxph', 'learning_rate': 0.0004271642549891857, 'n_estimators': 256, 'criterion': 'friedman_mse', 'min_samples_split': 9, 'min_samples_leaf': 1, 'min_weight_fraction_leaf': 0.14382357809184973, 'min_impurity_decrease': 0.10828643603105553, 'max_features': 0.8355825603008875, 'subsample': 0.6601501159912233, 'dropout_rate': 0.22669089081935545, 'ccp_alpha': 0.3844769092799398}. Best is trial 296 with value: 0.7450864268862003.[0m
[32m[I 2022-04-14 13:32:16,476][0m Trial 361 finished with value: 0.5769505987534648 and parameters: {'loss': 'coxph', 'learning_rate': 0.001824627720331541, 'n_estimators': 866, 'criterion': 'friedman_mse', 'min_samples_split': 9, 'min_samples_leaf': 1, 'min_weight_fraction_leaf': 0.12288854289791291, 'min_impurity_decrease': 0.1781661554262033, 'max_features': 0.8601502844706439, 'subsample': 0.8653180658964572, 'dropout_rate': 0.21177800207535896, 'ccp_alpha': 0.2299435078808328}. Best is trial 296 with value: 0.7450864268862003.[0m
[32m[I 2022-04-14 13:34:07,692][0m Trial 362 finished with value: 0.7406883806454327 and parameters: {'loss': 'coxph', 'learning_rate': 0.0009319768687991839, 'n_estimators': 897, 'criterion': 'friedman_mse', 'min_samples_split': 9, 'min_samples_leaf': 1, 'min_weight_fraction_leaf': 0.09704043557086645, 'min_impurity_decrease': 0.061157417935830724, 'max_features': 0.9622026085792462, 'subsample': 0.765160917903027, 'dropout_rate': 0.24231594895496633, 'ccp_alpha': 0.09029620967535647}. Best is trial 296 with value: 0.7450864268862003.[0m
