[32m[I 2022-04-15 23:40:24,810][0m Trial 156 finished with value: 0.7059970529104502 and parameters: {'n_hidden': 32, 'mixture_components': 3, 'use_sparse_layer': False, 'use_batchnorm': True, 'use_dropout': True, 'dropout': 0.7434454817767298, 'mlp_size_1': 0, 'mlp_size_2': 2, 'mlp_size_3': 0, 'kernel': 'Normal', 'loss_name': 'NLLLoss'}. Best is trial 155 with value: 0.8720634217556679.[0m
[32m[I 2022-04-15 23:47:30,829][0m Trial 157 finished with value: 0.8625466231740662 and parameters: {'n_hidden': 32, 'mixture_components': 2, 'use_sparse_layer': False, 'use_batchnorm': True, 'use_dropout': True, 'dropout': 0.6951580539650102, 'mlp_size_1': 0, 'mlp_size_2': 2, 'mlp_size_3': 0, 'kernel': 'Exponential', 'loss_name': 'NLLLoss'}. Best is trial 155 with value: 0.8720634217556679.[0m
[32m[I 2022-04-15 23:54:58,244][0m Trial 158 finished with value: 0.8679722260034948 and parameters: {'n_hidden': 32, 'mixture_components': 2, 'use_sparse_layer': False, 'use_batchnorm': True, 'use_dropout': True, 'dropout': 0.6111302418898957, 'mlp_size_1': 0, 'mlp_size_2': 2, 'mlp_size_3': 0, 'kernel': 'Exponential', 'loss_name': 'NLLLoss'}. Best is trial 155 with value: 0.8720634217556679.[0m
[32m[I 2022-04-16 00:00:27,930][0m Trial 159 finished with value: 0.8422327401290974 and parameters: {'n_hidden': 32, 'mixture_components': 2, 'use_sparse_layer': False, 'use_batchnorm': True, 'use_dropout': True, 'dropout': 0.6014504583142738, 'mlp_size_1': 0, 'mlp_size_2': 2, 'mlp_size_3': 0, 'kernel': 'Weibull', 'loss_name': 'NLLLoss'}. Best is trial 155 with value: 0.8720634217556679.[0m
[32m[I 2022-04-16 00:06:34,405][0m Trial 160 finished with value: 0.8624168329592639 and parameters: {'n_hidden': 32, 'mixture_components': 2, 'use_sparse_layer': False, 'use_batchnorm': True, 'use_dropout': True, 'dropout': 0.5449918517355814, 'mlp_size_1': 0, 'mlp_size_2': 2, 'mlp_size_3': 0, 'kernel': 'Exponential', 'loss_name': 'NLLLoss'}. Best is trial 155 with value: 0.8720634217556679.[0m
[32m[I 2022-04-16 00:13:23,175][0m Trial 161 finished with value: 0.8565835055641194 and parameters: {'n_hidden': 32, 'mixture_components': 2, 'use_sparse_layer': False, 'use_batchnorm': True, 'use_dropout': True, 'dropout': 0.624839589941014, 'mlp_size_1': 0, 'mlp_size_2': 2, 'mlp_size_3': 0, 'kernel': 'Exponential', 'loss_name': 'NLLLoss'}. Best is trial 155 with value: 0.8720634217556679.[0m
[32m[I 2022-04-16 00:20:01,535][0m Trial 162 finished with value: 0.8574077998550564 and parameters: {'n_hidden': 32, 'mixture_components': 2, 'use_sparse_layer': False, 'use_batchnorm': True, 'use_dropout': True, 'dropout': 0.5847130150392886, 'mlp_size_1': 0, 'mlp_size_2': 2, 'mlp_size_3': 0, 'kernel': 'Exponential', 'loss_name': 'NLLLoss'}. Best is trial 155 with value: 0.8720634217556679.[0m
[32m[I 2022-04-16 00:26:13,066][0m Trial 163 finished with value: 0.8540798401195211 and parameters: {'n_hidden': 32, 'mixture_components': 3, 'use_sparse_layer': False, 'use_batchnorm': True, 'use_dropout': True, 'dropout': 0.6801961278074531, 'mlp_size_1': 0, 'mlp_size_2': 2, 'mlp_size_3': 0, 'kernel': 'Exponential', 'loss_name': 'NLLLoss'}. Best is trial 155 with value: 0.8720634217556679.[0m
[32m[I 2022-04-16 00:32:09,400][0m Trial 164 finished with value: 0.8645597531667786 and parameters: {'n_hidden': 32, 'mixture_components': 1, 'use_sparse_layer': False, 'use_batchnorm': True, 'use_dropout': True, 'dropout': 0.6165210279642093, 'mlp_size_1': 0, 'mlp_size_2': 2, 'mlp_size_3': 0, 'kernel': 'Exponential', 'loss_name': 'NLLLoss'}. Best is trial 155 with value: 0.8720634217556679.[0m
[32m[I 2022-04-16 00:38:02,921][0m Trial 165 finished with value: 0.8390035579635535 and parameters: {'n_hidden': 32, 'mixture_components': 1, 'use_sparse_layer': False, 'use_batchnorm': True, 'use_dropout': True, 'dropout': 0.5675711818807109, 'mlp_size_1': 0, 'mlp_size_2': 2, 'mlp_size_3': 0, 'kernel': 'Gamma', 'loss_name': 'NLLLoss'}. Best is trial 155 with value: 0.8720634217556679.[0m
[32m[I 2022-04-16 00:44:45,534][0m Trial 166 finished with value: 0.8681153080503735 and parameters: {'n_hidden': 32, 'mixture_components': 2, 'use_sparse_layer': False, 'use_batchnorm': True, 'use_dropout': True, 'dropout': 0.6124076219066633, 'mlp_size_1': 0, 'mlp_size_2': 2, 'mlp_size_3': 0, 'kernel': 'Exponential', 'loss_name': 'NLLLoss'}. Best is trial 155 with value: 0.8720634217556679.[0m
[32m[I 2022-04-16 00:50:55,146][0m Trial 167 finished with value: 0.8659221811541045 and parameters: {'n_hidden': 32, 'mixture_components': 2, 'use_sparse_layer': False, 'use_batchnorm': True, 'use_dropout': True, 'dropout': 0.6504338462968631, 'mlp_size_1': 0, 'mlp_size_2': 2, 'mlp_size_3': 0, 'kernel': 'Exponential', 'loss_name': 'NLLLoss'}. Best is trial 155 with value: 0.8720634217556679.[0m
[32m[I 2022-04-16 00:56:52,609][0m Trial 168 finished with value: 0.8208717848161582 and parameters: {'n_hidden': 32, 'mixture_components': 2, 'use_sparse_layer': False, 'use_batchnorm': True, 'use_dropout': True, 'dropout': 0.6571899354574859, 'mlp_size_1': 0, 'mlp_size_2': 2, 'mlp_size_3': 0, 'kernel': 'LogNormal', 'loss_name': 'NLLLoss'}. Best is trial 155 with value: 0.8720634217556679.[0m
[32m[I 2022-04-16 01:03:25,291][0m Trial 169 finished with value: 0.8625517002854766 and parameters: {'n_hidden': 32, 'mixture_components': 2, 'use_sparse_layer': False, 'use_batchnorm': True, 'use_dropout': True, 'dropout': 0.7019031872762769, 'mlp_size_1': 0, 'mlp_size_2': 2, 'mlp_size_3': 0, 'kernel': 'Exponential', 'loss_name': 'NLLLoss'}. Best is trial 155 with value: 0.8720634217556679.[0m
[32m[I 2022-04-16 01:09:51,555][0m Trial 170 finished with value: 0.8617709775283492 and parameters: {'n_hidden': 32, 'mixture_components': 3, 'use_sparse_layer': False, 'use_batchnorm': True, 'use_dropout': True, 'dropout': 0.6360931278716744, 'mlp_size_1': 0, 'mlp_size_2': 2, 'mlp_size_3': 0, 'kernel': 'Exponential', 'loss_name': 'NLLLoss'}. Best is trial 155 with value: 0.8720634217556679.[0m
[32m[I 2022-04-16 01:16:32,612][0m Trial 171 finished with value: 0.8591176998474062 and parameters: {'n_hidden': 32, 'mixture_components': 2, 'use_sparse_layer': False, 'use_batchnorm': True, 'use_dropout': True, 'dropout': 0.611267474891144, 'mlp_size_1': 0, 'mlp_size_2': 2, 'mlp_size_3': 0, 'kernel': 'Exponential', 'loss_name': 'NLLLoss'}. Best is trial 155 with value: 0.8720634217556679.[0m
[32m[I 2022-04-16 01:23:11,630][0m Trial 172 finished with value: 0.8563791712091842 and parameters: {'n_hidden': 32, 'mixture_components': 2, 'use_sparse_layer': False, 'use_batchnorm': True, 'use_dropout': True, 'dropout': 0.6699738593613236, 'mlp_size_1': 0, 'mlp_size_2': 2, 'mlp_size_3': 0, 'kernel': 'Exponential', 'loss_name': 'NLLLoss'}. Best is trial 155 with value: 0.8720634217556679.[0m
[32m[I 2022-04-16 01:29:55,480][0m Trial 173 finished with value: 0.8721374613820508 and parameters: {'n_hidden': 32, 'mixture_components': 2, 'use_sparse_layer': False, 'use_batchnorm': True, 'use_dropout': True, 'dropout': 0.6097406524725479, 'mlp_size_1': 0, 'mlp_size_2': 2, 'mlp_size_3': 0, 'kernel': 'Exponential', 'loss_name': 'NLLLoss'}. Best is trial 173 with value: 0.8721374613820508.[0m
[32m[I 2022-04-16 01:36:29,792][0m Trial 174 finished with value: 0.7304443287280195 and parameters: {'n_hidden': 32, 'mixture_components': 2, 'use_sparse_layer': False, 'use_batchnorm': True, 'use_dropout': True, 'dropout': 0.6432235404288917, 'mlp_size_1': 0, 'mlp_size_2': 2, 'mlp_size_3': 0, 'kernel': 'Logistic', 'loss_name': 'NLLLoss'}. Best is trial 173 with value: 0.8721374613820508.[0m
[32m[I 2022-04-16 01:39:35,058][0m Trial 175 finished with value: 0.8272672657545115 and parameters: {'n_hidden': 512, 'mixture_components': 3, 'use_sparse_layer': False, 'use_batchnorm': True, 'use_dropout': True, 'dropout': 0.6007953089350073, 'mlp_size_1': 2, 'mlp_size_2': 2, 'mlp_size_3': 0, 'kernel': 'Exponential', 'loss_name': 'NLLLoss'}. Best is trial 173 with value: 0.8721374613820508.[0m
[32m[I 2022-04-16 01:43:05,854][0m Trial 176 finished with value: 0.8465358674266554 and parameters: {'n_hidden': 1024, 'mixture_components': 2, 'use_sparse_layer': False, 'use_batchnorm': True, 'use_dropout': True, 'dropout': 0.7161806845291088, 'mlp_size_1': 1, 'mlp_size_2': 3, 'mlp_size_3': 0, 'kernel': 'Exponential', 'loss_name': 'AlternativeNLLLoss'}. Best is trial 173 with value: 0.8721374613820508.[0m
[32m[I 2022-04-16 01:49:29,964][0m Trial 177 finished with value: 0.8572836571342645 and parameters: {'n_hidden': 32, 'mixture_components': 2, 'use_sparse_layer': False, 'use_batchnorm': True, 'use_dropout': True, 'dropout': 0.6894117248058046, 'mlp_size_1': 0, 'mlp_size_2': 2, 'mlp_size_3': 0, 'kernel': 'Exponential', 'loss_name': 'NLLLoss'}. Best is trial 173 with value: 0.8721374613820508.[0m
[32m[I 2022-04-16 01:52:22,641][0m Trial 178 finished with value: 0.6668318935439741 and parameters: {'n_hidden': 32, 'mixture_components': 2, 'use_sparse_layer': False, 'use_batchnorm': False, 'use_dropout': True, 'dropout': 0.6524432330466071, 'mlp_size_1': 0, 'mlp_size_2': 2, 'mlp_size_3': 0, 'kernel': 'Gumbel', 'loss_name': 'NLLLoss'}. Best is trial 173 with value: 0.8721374613820508.[0m
[32m[I 2022-04-16 01:58:20,571][0m Trial 179 finished with value: 0.8670084265944442 and parameters: {'n_hidden': 64, 'mixture_components': 2, 'use_sparse_layer': False, 'use_batchnorm': True, 'use_dropout': True, 'dropout': 0.6280349338132908, 'mlp_size_1': 0, 'mlp_size_2': 2, 'mlp_size_3': 0, 'kernel': 'Exponential', 'loss_name': 'NLLLoss'}. Best is trial 173 with value: 0.8721374613820508.[0m
[32m[I 2022-04-16 02:03:58,703][0m Trial 180 finished with value: 0.8689643562915166 and parameters: {'n_hidden': 64, 'mixture_components': 2, 'use_sparse_layer': False, 'use_batchnorm': True, 'use_dropout': True, 'dropout': 0.6291562860336295, 'mlp_size_1': 0, 'mlp_size_2': 2, 'mlp_size_3': 0, 'kernel': 'Exponential', 'loss_name': 'NLLLoss'}. Best is trial 173 with value: 0.8721374613820508.[0m
[32m[I 2022-04-16 02:09:38,595][0m Trial 181 finished with value: 0.8689516469307671 and parameters: {'n_hidden': 64, 'mixture_components': 2, 'use_sparse_layer': False, 'use_batchnorm': True, 'use_dropout': True, 'dropout': 0.627971825708903, 'mlp_size_1': 0, 'mlp_size_2': 2, 'mlp_size_3': 0, 'kernel': 'Exponential', 'loss_name': 'NLLLoss'}. Best is trial 173 with value: 0.8721374613820508.[0m
[32m[I 2022-04-16 02:15:20,453][0m Trial 182 finished with value: 0.8595834416277608 and parameters: {'n_hidden': 64, 'mixture_components': 2, 'use_sparse_layer': False, 'use_batchnorm': True, 'use_dropout': True, 'dropout': 0.6293197565743318, 'mlp_size_1': 0, 'mlp_size_2': 2, 'mlp_size_3': 0, 'kernel': 'Exponential', 'loss_name': 'NLLLoss'}. Best is trial 173 with value: 0.8721374613820508.[0m
[32m[I 2022-04-16 02:20:53,249][0m Trial 183 finished with value: 0.8650692681561069 and parameters: {'n_hidden': 64, 'mixture_components': 3, 'use_sparse_layer': False, 'use_batchnorm': True, 'use_dropout': True, 'dropout': 0.5983360545107611, 'mlp_size_1': 0, 'mlp_size_2': 2, 'mlp_size_3': 0, 'kernel': 'Exponential', 'loss_name': 'NLLLoss'}. Best is trial 173 with value: 0.8721374613820508.[0m
[32m[I 2022-04-16 02:25:52,874][0m Trial 184 finished with value: 0.8608478773976961 and parameters: {'n_hidden': 64, 'mixture_components': 2, 'use_sparse_layer': False, 'use_batchnorm': True, 'use_dropout': True, 'dropout': 0.5685638186380717, 'mlp_size_1': 0, 'mlp_size_2': 2, 'mlp_size_3': 0, 'kernel': 'Exponential', 'loss_name': 'NLLLoss'}. Best is trial 173 with value: 0.8721374613820508.[0m
[32m[I 2022-04-16 02:30:59,788][0m Trial 185 finished with value: 0.8665412438142646 and parameters: {'n_hidden': 64, 'mixture_components': 2, 'use_sparse_layer': False, 'use_batchnorm': True, 'use_dropout': True, 'dropout': 0.6154561407339204, 'mlp_size_1': 0, 'mlp_size_2': 2, 'mlp_size_3': 0, 'kernel': 'Exponential', 'loss_name': 'NLLLoss'}. Best is trial 173 with value: 0.8721374613820508.[0m
[32m[I 2022-04-16 02:37:36,120][0m Trial 186 finished with value: 0.8667156808325581 and parameters: {'n_hidden': 64, 'mixture_components': 2, 'use_sparse_layer': False, 'use_batchnorm': True, 'use_dropout': True, 'dropout': 0.6196978148488578, 'mlp_size_1': 0, 'mlp_size_2': 2, 'mlp_size_3': 0, 'kernel': 'Exponential', 'loss_name': 'NLLLoss'}. Best is trial 173 with value: 0.8721374613820508.[0m
[32m[I 2022-04-16 02:43:18,567][0m Trial 187 finished with value: 0.8678741667112069 and parameters: {'n_hidden': 64, 'mixture_components': 2, 'use_sparse_layer': False, 'use_batchnorm': True, 'use_dropout': True, 'dropout': 0.6122795991055754, 'mlp_size_1': 0, 'mlp_size_2': 2, 'mlp_size_3': 0, 'kernel': 'Exponential', 'loss_name': 'NLLLoss'}. Best is trial 173 with value: 0.8721374613820508.[0m
[32m[I 2022-04-16 02:49:31,841][0m Trial 188 finished with value: 0.860719559340734 and parameters: {'n_hidden': 64, 'mixture_components': 2, 'use_sparse_layer': False, 'use_batchnorm': True, 'use_dropout': True, 'dropout': 0.6134264191329937, 'mlp_size_1': 0, 'mlp_size_2': 2, 'mlp_size_3': 0, 'kernel': 'Exponential', 'loss_name': 'NLLLoss'}. Best is trial 173 with value: 0.8721374613820508.[0m
[32m[I 2022-04-16 02:55:29,606][0m Trial 189 finished with value: 0.8628439781955981 and parameters: {'n_hidden': 64, 'mixture_components': 2, 'use_sparse_layer': False, 'use_batchnorm': True, 'use_dropout': True, 'dropout': 0.5911190263793564, 'mlp_size_1': 0, 'mlp_size_2': 2, 'mlp_size_3': 0, 'kernel': 'Exponential', 'loss_name': 'NLLLoss'}. Best is trial 173 with value: 0.8721374613820508.[0m
[32m[I 2022-04-16 03:00:00,900][0m Trial 190 finished with value: 0.8544565606194716 and parameters: {'n_hidden': 64, 'mixture_components': 2, 'use_sparse_layer': False, 'use_batchnorm': True, 'use_dropout': True, 'dropout': 0.6193017600628113, 'mlp_size_1': 0, 'mlp_size_2': 2, 'mlp_size_3': 0, 'kernel': 'LogLogistic', 'loss_name': 'NLLLoss'}. Best is trial 173 with value: 0.8721374613820508.[0m
[32m[I 2022-04-16 03:04:53,734][0m Trial 191 finished with value: 0.8664438858607504 and parameters: {'n_hidden': 64, 'mixture_components': 2, 'use_sparse_layer': False, 'use_batchnorm': True, 'use_dropout': True, 'dropout': 0.6353524541665043, 'mlp_size_1': 0, 'mlp_size_2': 2, 'mlp_size_3': 0, 'kernel': 'Exponential', 'loss_name': 'NLLLoss'}. Best is trial 173 with value: 0.8721374613820508.[0m
[32m[I 2022-04-16 03:11:50,663][0m Trial 192 finished with value: 0.8630302766600237 and parameters: {'n_hidden': 64, 'mixture_components': 2, 'use_sparse_layer': False, 'use_batchnorm': True, 'use_dropout': True, 'dropout': 0.6698554678439161, 'mlp_size_1': 0, 'mlp_size_2': 2, 'mlp_size_3': 0, 'kernel': 'Exponential', 'loss_name': 'NLLLoss'}. Best is trial 173 with value: 0.8721374613820508.[0m
[32m[I 2022-04-16 03:18:08,646][0m Trial 193 finished with value: 0.8675384109298869 and parameters: {'n_hidden': 64, 'mixture_components': 2, 'use_sparse_layer': False, 'use_batchnorm': True, 'use_dropout': True, 'dropout': 0.6302586625507861, 'mlp_size_1': 0, 'mlp_size_2': 2, 'mlp_size_3': 0, 'kernel': 'Exponential', 'loss_name': 'NLLLoss'}. Best is trial 173 with value: 0.8721374613820508.[0m
[32m[I 2022-04-16 03:23:45,066][0m Trial 194 finished with value: 0.871631601640894 and parameters: {'n_hidden': 64, 'mixture_components': 2, 'use_sparse_layer': False, 'use_batchnorm': True, 'use_dropout': True, 'dropout': 0.6091600504000065, 'mlp_size_1': 0, 'mlp_size_2': 2, 'mlp_size_3': 0, 'kernel': 'Exponential', 'loss_name': 'NLLLoss'}. Best is trial 173 with value: 0.8721374613820508.[0m
[32m[I 2022-04-16 03:30:44,231][0m Trial 195 finished with value: 0.8685160850336361 and parameters: {'n_hidden': 64, 'mixture_components': 2, 'use_sparse_layer': False, 'use_batchnorm': True, 'use_dropout': True, 'dropout': 0.5873287773555286, 'mlp_size_1': 0, 'mlp_size_2': 2, 'mlp_size_3': 0, 'kernel': 'Exponential', 'loss_name': 'NLLLoss'}. Best is trial 173 with value: 0.8721374613820508.[0m
[32m[I 2022-04-16 03:37:37,921][0m Trial 196 finished with value: 0.8676767249998913 and parameters: {'n_hidden': 64, 'mixture_components': 2, 'use_sparse_layer': False, 'use_batchnorm': True, 'use_dropout': True, 'dropout': 0.5928265804333064, 'mlp_size_1': 0, 'mlp_size_2': 2, 'mlp_size_3': 0, 'kernel': 'Exponential', 'loss_name': 'NLLLoss'}. Best is trial 173 with value: 0.8721374613820508.[0m
[32m[I 2022-04-16 03:43:15,612][0m Trial 197 finished with value: 0.867027213537018 and parameters: {'n_hidden': 64, 'mixture_components': 3, 'use_sparse_layer': False, 'use_batchnorm': True, 'use_dropout': True, 'dropout': 0.539124745132716, 'mlp_size_1': 0, 'mlp_size_2': 2, 'mlp_size_3': 0, 'kernel': 'Exponential', 'loss_name': 'NLLLoss'}. Best is trial 173 with value: 0.8721374613820508.[0m
[32m[I 2022-04-16 03:48:54,491][0m Trial 198 finished with value: 0.865022459984449 and parameters: {'n_hidden': 64, 'mixture_components': 3, 'use_sparse_layer': False, 'use_batchnorm': True, 'use_dropout': True, 'dropout': 0.555868011265391, 'mlp_size_1': 0, 'mlp_size_2': 2, 'mlp_size_3': 0, 'kernel': 'Exponential', 'loss_name': 'NLLLoss'}. Best is trial 173 with value: 0.8721374613820508.[0m
[32m[I 2022-04-16 03:53:52,724][0m Trial 199 finished with value: 0.8395300189876529 and parameters: {'n_hidden': 64, 'mixture_components': 3, 'use_sparse_layer': False, 'use_batchnorm': True, 'use_dropout': True, 'dropout': 0.5327292256234845, 'mlp_size_1': 0, 'mlp_size_2': 2, 'mlp_size_3': 0, 'kernel': 'Normal', 'loss_name': 'NLLLoss'}. Best is trial 173 with value: 0.8721374613820508.[0m
[32m[I 2022-04-16 03:59:19,257][0m Trial 200 finished with value: 0.8621641436499298 and parameters: {'n_hidden': 64, 'mixture_components': 2, 'use_sparse_layer': False, 'use_batchnorm': True, 'use_dropout': True, 'dropout': 0.5822615992698846, 'mlp_size_1': 0, 'mlp_size_2': 2, 'mlp_size_3': 0, 'kernel': 'Exponential', 'loss_name': 'NLLLoss'}. Best is trial 173 with value: 0.8721374613820508.[0m
[32m[I 2022-04-16 04:05:00,361][0m Trial 201 finished with value: 0.8668250691213559 and parameters: {'n_hidden': 64, 'mixture_components': 2, 'use_sparse_layer': False, 'use_batchnorm': True, 'use_dropout': True, 'dropout': 0.5913189642302956, 'mlp_size_1': 0, 'mlp_size_2': 2, 'mlp_size_3': 0, 'kernel': 'Exponential', 'loss_name': 'NLLLoss'}. Best is trial 173 with value: 0.8721374613820508.[0m
[32m[I 2022-04-16 04:10:53,728][0m Trial 202 finished with value: 0.8665328399576726 and parameters: {'n_hidden': 64, 'mixture_components': 2, 'use_sparse_layer': False, 'use_batchnorm': True, 'use_dropout': True, 'dropout': 0.5887629578749105, 'mlp_size_1': 0, 'mlp_size_2': 2, 'mlp_size_3': 0, 'kernel': 'Exponential', 'loss_name': 'NLLLoss'}. Best is trial 173 with value: 0.8721374613820508.[0m
[32m[I 2022-04-16 04:16:58,256][0m Trial 203 finished with value: 0.8635166769087057 and parameters: {'n_hidden': 64, 'mixture_components': 2, 'use_sparse_layer': False, 'use_batchnorm': True, 'use_dropout': True, 'dropout': 0.562815378857546, 'mlp_size_1': 0, 'mlp_size_2': 2, 'mlp_size_3': 0, 'kernel': 'Exponential', 'loss_name': 'NLLLoss'}. Best is trial 173 with value: 0.8721374613820508.[0m
[32m[I 2022-04-16 04:22:44,007][0m Trial 204 finished with value: 0.8639088175930454 and parameters: {'n_hidden': 64, 'mixture_components': 2, 'use_sparse_layer': False, 'use_batchnorm': True, 'use_dropout': True, 'dropout': 0.600740409427627, 'mlp_size_1': 0, 'mlp_size_2': 2, 'mlp_size_3': 0, 'kernel': 'Exponential', 'loss_name': 'NLLLoss'}. Best is trial 173 with value: 0.8721374613820508.[0m
[32m[I 2022-04-16 04:28:47,670][0m Trial 205 finished with value: 0.8711436346336372 and parameters: {'n_hidden': 64, 'mixture_components': 2, 'use_sparse_layer': False, 'use_batchnorm': True, 'use_dropout': True, 'dropout': 0.5393543743079046, 'mlp_size_1': 0, 'mlp_size_2': 2, 'mlp_size_3': 0, 'kernel': 'Exponential', 'loss_name': 'NLLLoss'}. Best is trial 173 with value: 0.8721374613820508.[0m
[32m[I 2022-04-16 04:33:29,950][0m Trial 206 finished with value: 0.8602763042699548 and parameters: {'n_hidden': 64, 'mixture_components': 2, 'use_sparse_layer': False, 'use_batchnorm': True, 'use_dropout': True, 'dropout': 0.49909588567497276, 'mlp_size_1': 0, 'mlp_size_2': 2, 'mlp_size_3': 0, 'kernel': 'Weibull', 'loss_name': 'NLLLoss'}. Best is trial 173 with value: 0.8721374613820508.[0m
[32m[I 2022-04-16 04:39:38,743][0m Trial 207 finished with value: 0.8588270096839388 and parameters: {'n_hidden': 64, 'mixture_components': 3, 'use_sparse_layer': False, 'use_batchnorm': True, 'use_dropout': True, 'dropout': 0.46443091104256434, 'mlp_size_1': 0, 'mlp_size_2': 2, 'mlp_size_3': 0, 'kernel': 'Exponential', 'loss_name': 'AlternativeNLLLoss'}. Best is trial 173 with value: 0.8721374613820508.[0m
[32m[I 2022-04-16 04:46:02,975][0m Trial 208 finished with value: 0.8630077403711536 and parameters: {'n_hidden': 64, 'mixture_components': 2, 'use_sparse_layer': False, 'use_batchnorm': True, 'use_dropout': True, 'dropout': 0.514871591862718, 'mlp_size_1': 0, 'mlp_size_2': 2, 'mlp_size_3': 0, 'kernel': 'Exponential', 'loss_name': 'NLLLoss'}. Best is trial 173 with value: 0.8721374613820508.[0m
[32m[I 2022-04-16 04:51:25,054][0m Trial 209 finished with value: 0.8555957626790237 and parameters: {'n_hidden': 64, 'mixture_components': 2, 'use_sparse_layer': False, 'use_batchnorm': True, 'use_dropout': True, 'dropout': 0.5328442355094033, 'mlp_size_1': 0, 'mlp_size_2': 2, 'mlp_size_3': 0, 'kernel': 'Exponential', 'loss_name': 'NLLLoss'}. Best is trial 173 with value: 0.8721374613820508.[0m
