[32m[I 2022-04-14 15:48:38,268][0m Trial 963 finished with value: 0.6394254390993503 and parameters: {'loss': 'coxph', 'learning_rate': 0.013149833252851921, 'n_estimators': 212, 'criterion': 'friedman_mse', 'min_samples_split': 2, 'min_samples_leaf': 2, 'min_weight_fraction_leaf': 0.03973654502648537, 'min_impurity_decrease': 0.3818227401178937, 'max_features': 0.8677236065750116, 'subsample': 0.75580457714046, 'dropout_rate': 0.8284095936849352, 'ccp_alpha': 0.23544205350844805}. Best is trial 677 with value: 0.7600100187343619.[0m
[32m[I 2022-04-14 15:48:40,970][0m Trial 964 finished with value: 0.7430706044893245 and parameters: {'loss': 'coxph', 'learning_rate': 0.0024068117667763234, 'n_estimators': 384, 'criterion': 'friedman_mse', 'min_samples_split': 5, 'min_samples_leaf': 1, 'min_weight_fraction_leaf': 0.0751184105766383, 'min_impurity_decrease': 0.4202519780594066, 'max_features': 0.9043325439691965, 'subsample': 0.7914653227191634, 'dropout_rate': 0.9988778512914498, 'ccp_alpha': 0.09784081150752033}. Best is trial 677 with value: 0.7600100187343619.[0m
[32m[I 2022-04-14 15:48:54,376][0m Trial 965 finished with value: 0.7504611206843043 and parameters: {'loss': 'coxph', 'learning_rate': 0.012031815761311503, 'n_estimators': 345, 'criterion': 'friedman_mse', 'min_samples_split': 2, 'min_samples_leaf': 1, 'min_weight_fraction_leaf': 0.06669250473777498, 'min_impurity_decrease': 0.3992517884065547, 'max_features': 0.9206539832234013, 'subsample': 0.8427970293251094, 'dropout_rate': 0.390435874037908, 'ccp_alpha': 0.08464885051182393}. Best is trial 677 with value: 0.7600100187343619.[0m
[32m[I 2022-04-14 15:49:10,124][0m Trial 966 finished with value: 0.7507958516694598 and parameters: {'loss': 'coxph', 'learning_rate': 0.009459686768357027, 'n_estimators': 369, 'criterion': 'friedman_mse', 'min_samples_split': 2, 'min_samples_leaf': 2, 'min_weight_fraction_leaf': 0.010021134368690749, 'min_impurity_decrease': 0.3473635466691453, 'max_features': 0.8827579764421554, 'subsample': 0.676905944189522, 'dropout_rate': 0.38093824488691574, 'ccp_alpha': 0.0030133353946524694}. Best is trial 677 with value: 0.7600100187343619.[0m
[32m[I 2022-04-14 15:49:21,035][0m Trial 967 finished with value: 0.7052493197349101 and parameters: {'loss': 'coxph', 'learning_rate': 0.023999554438061857, 'n_estimators': 434, 'criterion': 'friedman_mse', 'min_samples_split': 3, 'min_samples_leaf': 1, 'min_weight_fraction_leaf': 0.05500835133745313, 'min_impurity_decrease': 0.3758173629374093, 'max_features': 0.468788820424608, 'subsample': 0.7299720478674848, 'dropout_rate': 0.7624269394514233, 'ccp_alpha': 0.17954000050039165}. Best is trial 677 with value: 0.7600100187343619.[0m
[32m[I 2022-04-14 15:49:38,686][0m Trial 968 finished with value: 0.7406234350092633 and parameters: {'loss': 'coxph', 'learning_rate': 2.3530664567119007e-05, 'n_estimators': 408, 'criterion': 'friedman_mse', 'min_samples_split': 2, 'min_samples_leaf': 1, 'min_weight_fraction_leaf': 0.03353060505221402, 'min_impurity_decrease': 0.4048307865015865, 'max_features': 0.9282296909915477, 'subsample': 0.820842600709318, 'dropout_rate': 0.41085057423121496, 'ccp_alpha': 0.10005407190982989}. Best is trial 677 with value: 0.7600100187343619.[0m
[32m[I 2022-04-14 15:49:44,793][0m Trial 969 finished with value: 0.25830329072350244 and parameters: {'loss': 'squared', 'learning_rate': 9.160786048089398e-06, 'n_estimators': 353, 'criterion': 'friedman_mse', 'min_samples_split': 2, 'min_samples_leaf': 1, 'min_weight_fraction_leaf': 0.07995784691794887, 'min_impurity_decrease': 0.43865433651073293, 'max_features': 0.9084657779025485, 'subsample': 0.7760699586254577, 'dropout_rate': 0.8119472477741388, 'ccp_alpha': 0.0015158428377496727}. Best is trial 677 with value: 0.7600100187343619.[0m
[32m[I 2022-04-14 15:49:51,845][0m Trial 970 finished with value: 0.5160881488838708 and parameters: {'loss': 'coxph', 'learning_rate': 3.148114926947618e-05, 'n_estimators': 336, 'criterion': 'friedman_mse', 'min_samples_split': 2, 'min_samples_leaf': 2, 'min_weight_fraction_leaf': 0.04450843348755786, 'min_impurity_decrease': 0.3610001863281235, 'max_features': 0.9324648333908334, 'subsample': 0.8605042848069989, 'dropout_rate': 0.7406383148649326, 'ccp_alpha': 0.3231005269112963}. Best is trial 677 with value: 0.7600100187343619.[0m
[32m[I 2022-04-14 15:50:29,183][0m Trial 971 finished with value: 0.6951084955638095 and parameters: {'loss': 'coxph', 'learning_rate': 1.68422294984065e-05, 'n_estimators': 571, 'criterion': 'friedman_mse', 'min_samples_split': 2, 'min_samples_leaf': 1, 'min_weight_fraction_leaf': 0.02613839772301375, 'min_impurity_decrease': 0.4039709043831102, 'max_features': 0.8934689779134165, 'subsample': 0.8055947641039335, 'dropout_rate': 0.3976025379148412, 'ccp_alpha': 0.21394951448879768}. Best is trial 677 with value: 0.7600100187343619.[0m
[32m[I 2022-04-14 15:50:45,588][0m Trial 972 finished with value: 0.7364809274097105 and parameters: {'loss': 'coxph', 'learning_rate': 5.331842855908044e-05, 'n_estimators': 368, 'criterion': 'friedman_mse', 'min_samples_split': 2, 'min_samples_leaf': 1, 'min_weight_fraction_leaf': 0.06401047407398831, 'min_impurity_decrease': 0.43098689471177015, 'max_features': 0.8615092972948728, 'subsample': 0.7503205969696429, 'dropout_rate': 0.36544954692607484, 'ccp_alpha': 0.09409256448829081}. Best is trial 677 with value: 0.7600100187343619.[0m
[32m[I 2022-04-14 15:50:58,971][0m Trial 973 finished with value: 0.5 and parameters: {'loss': 'coxph', 'learning_rate': 2.5622374049287733e-06, 'n_estimators': 340, 'criterion': 'absolute_error', 'min_samples_split': 3, 'min_samples_leaf': 2, 'min_weight_fraction_leaf': 0.05092605723166285, 'min_impurity_decrease': 0.7157998572261305, 'max_features': 0.9376538786693267, 'subsample': 0.8457193999561504, 'dropout_rate': 0.4215872024683485, 'ccp_alpha': 0.16646578386453692}. Best is trial 677 with value: 0.7600100187343619.[0m
[32m[I 2022-04-14 15:51:22,197][0m Trial 974 finished with value: 0.7307935129508369 and parameters: {'loss': 'coxph', 'learning_rate': 0.0037940014057186292, 'n_estimators': 455, 'criterion': 'friedman_mse', 'min_samples_split': 2, 'min_samples_leaf': 1, 'min_weight_fraction_leaf': 0.021012778073787687, 'min_impurity_decrease': 0.3801086512411758, 'max_features': 0.9167820003177383, 'subsample': 0.712183863684671, 'dropout_rate': 0.3955058622029506, 'ccp_alpha': 0.09347254202428351}. Best is trial 677 with value: 0.7600100187343619.[0m
[32m[I 2022-04-14 15:51:25,998][0m Trial 975 finished with value: 0.7585458717841159 and parameters: {'loss': 'coxph', 'learning_rate': 0.0029279810960280046, 'n_estimators': 181, 'criterion': 'friedman_mse', 'min_samples_split': 2, 'min_samples_leaf': 1, 'min_weight_fraction_leaf': 0.07761079167075924, 'min_impurity_decrease': 0.22686944372814663, 'max_features': 0.9430312916828855, 'subsample': 0.7919419036553074, 'dropout_rate': 0.45927598717366563, 'ccp_alpha': 0.002184866459441585}. Best is trial 677 with value: 0.7600100187343619.[0m
[32m[I 2022-04-14 15:51:28,997][0m Trial 976 finished with value: 0.6105527515502354 and parameters: {'loss': 'coxph', 'learning_rate': 0.0024805601478314855, 'n_estimators': 165, 'criterion': 'friedman_mse', 'min_samples_split': 2, 'min_samples_leaf': 1, 'min_weight_fraction_leaf': 0.08565507135464, 'min_impurity_decrease': 0.17256809756767874, 'max_features': 0.9458898231586618, 'subsample': 0.8271673710309103, 'dropout_rate': 0.4733795342597893, 'ccp_alpha': 0.24163431073223685}. Best is trial 677 with value: 0.7600100187343619.[0m
[32m[I 2022-04-14 15:51:33,551][0m Trial 977 finished with value: 0.7538462652788185 and parameters: {'loss': 'coxph', 'learning_rate': 0.003186794559684118, 'n_estimators': 196, 'criterion': 'friedman_mse', 'min_samples_split': 2, 'min_samples_leaf': 2, 'min_weight_fraction_leaf': 0.0773916475402715, 'min_impurity_decrease': 0.33500200514456163, 'max_features': 0.9550288724581805, 'subsample': 0.80092354892142, 'dropout_rate': 0.45501456007561875, 'ccp_alpha': 0.002385742458601877}. Best is trial 677 with value: 0.7600100187343619.[0m
[32m[I 2022-04-14 15:51:37,812][0m Trial 978 finished with value: 0.5 and parameters: {'loss': 'coxph', 'learning_rate': 0.0021781023529530256, 'n_estimators': 185, 'criterion': 'friedman_mse', 'min_samples_split': 2, 'min_samples_leaf': 1, 'min_weight_fraction_leaf': 0.08770658769544645, 'min_impurity_decrease': 0.23101329266969023, 'max_features': 0.9511306002703307, 'subsample': 0.8217183856735454, 'dropout_rate': 0.46068179806257187, 'ccp_alpha': 1.1707153175419638}. Best is trial 677 with value: 0.7600100187343619.[0m
[32m[I 2022-04-14 15:51:41,908][0m Trial 979 finished with value: 0.7010472705957966 and parameters: {'loss': 'coxph', 'learning_rate': 0.002983489106299728, 'n_estimators': 196, 'criterion': 'friedman_mse', 'min_samples_split': 3, 'min_samples_leaf': 1, 'min_weight_fraction_leaf': 0.0860725835454789, 'min_impurity_decrease': 0.33077795638814145, 'max_features': 0.9606845139591763, 'subsample': 0.8074093405537571, 'dropout_rate': 0.4909646493616678, 'ccp_alpha': 0.16509731990266854}. Best is trial 677 with value: 0.7600100187343619.[0m
[32m[I 2022-04-14 15:51:46,983][0m Trial 980 finished with value: 0.5 and parameters: {'loss': 'coxph', 'learning_rate': 0.0029660646389065943, 'n_estimators': 208, 'criterion': 'friedman_mse', 'min_samples_split': 2, 'min_samples_leaf': 2, 'min_weight_fraction_leaf': 0.08033893001352949, 'min_impurity_decrease': 0.18788706700729618, 'max_features': 0.9502612522129382, 'subsample': 0.8325208846035749, 'dropout_rate': 0.4684532821568474, 'ccp_alpha': 0.5110757164199191}. Best is trial 677 with value: 0.7600100187343619.[0m
[32m[I 2022-04-14 15:51:50,535][0m Trial 981 finished with value: 0.7411076638473288 and parameters: {'loss': 'coxph', 'learning_rate': 0.0026921967388609915, 'n_estimators': 177, 'criterion': 'friedman_mse', 'min_samples_split': 2, 'min_samples_leaf': 1, 'min_weight_fraction_leaf': 0.07557071269083375, 'min_impurity_decrease': 0.27726507391001026, 'max_features': 0.9645078782376588, 'subsample': 0.8617002882469347, 'dropout_rate': 0.5127819660909713, 'ccp_alpha': 0.0016716863724861367}. Best is trial 677 with value: 0.7600100187343619.[0m
[32m[I 2022-04-14 15:51:54,367][0m Trial 982 finished with value: 0.744928388761438 and parameters: {'loss': 'coxph', 'learning_rate': 0.0025099583746896834, 'n_estimators': 182, 'criterion': 'friedman_mse', 'min_samples_split': 2, 'min_samples_leaf': 1, 'min_weight_fraction_leaf': 0.09243654536367943, 'min_impurity_decrease': 0.2509655533460291, 'max_features': 0.9470333919816275, 'subsample': 0.805621111225578, 'dropout_rate': 0.4503004829617723, 'ccp_alpha': 0.09103570742264294}. Best is trial 677 with value: 0.7600100187343619.[0m
[32m[I 2022-04-14 15:51:58,830][0m Trial 983 finished with value: 0.5160881488838708 and parameters: {'loss': 'coxph', 'learning_rate': 0.0037782991359253406, 'n_estimators': 200, 'criterion': 'friedman_mse', 'min_samples_split': 2, 'min_samples_leaf': 1, 'min_weight_fraction_leaf': 0.07496020003052617, 'min_impurity_decrease': 0.35710216777198206, 'max_features': 0.9399807209705555, 'subsample': 0.8428237054708809, 'dropout_rate': 0.4863686253706, 'ccp_alpha': 0.3009740531923859}. Best is trial 677 with value: 0.7600100187343619.[0m
[32m[I 2022-04-14 15:52:03,868][0m Trial 984 finished with value: 0.7010211518793144 and parameters: {'loss': 'coxph', 'learning_rate': 0.0029082872834558663, 'n_estimators': 199, 'criterion': 'friedman_mse', 'min_samples_split': 3, 'min_samples_leaf': 2, 'min_weight_fraction_leaf': 0.07964052877602168, 'min_impurity_decrease': 0.33482707418695634, 'max_features': 0.9616489105436763, 'subsample': 0.8198629145125479, 'dropout_rate': 0.4609969793562748, 'ccp_alpha': 0.16804124572275167}. Best is trial 677 with value: 0.7600100187343619.[0m
[32m[I 2022-04-14 15:52:09,929][0m Trial 985 finished with value: 0.7512278675366829 and parameters: {'loss': 'coxph', 'learning_rate': 0.003609557024954923, 'n_estimators': 224, 'criterion': 'friedman_mse', 'min_samples_split': 4, 'min_samples_leaf': 1, 'min_weight_fraction_leaf': 0.09046763871397139, 'min_impurity_decrease': 0.3336489686394078, 'max_features': 0.9724769953706761, 'subsample': 0.8774623327695034, 'dropout_rate': 0.4454400654331396, 'ccp_alpha': 0.002024372810066051}. Best is trial 677 with value: 0.7600100187343619.[0m
[32m[I 2022-04-14 15:52:13,972][0m Trial 986 finished with value: 0.7342075142034057 and parameters: {'loss': 'coxph', 'learning_rate': 0.002350296353442039, 'n_estimators': 190, 'criterion': 'friedman_mse', 'min_samples_split': 2, 'min_samples_leaf': 1, 'min_weight_fraction_leaf': 0.07254329590810878, 'min_impurity_decrease': 0.33677145589058144, 'max_features': 0.9414879844422277, 'subsample': 0.7966777816497214, 'dropout_rate': 0.4950210495847974, 'ccp_alpha': 0.10348893883245444}. Best is trial 677 with value: 0.7600100187343619.[0m
[32m[I 2022-04-14 15:52:17,919][0m Trial 987 finished with value: 0.5798330495460544 and parameters: {'loss': 'coxph', 'learning_rate': 0.0032108835393592364, 'n_estimators': 182, 'criterion': 'friedman_mse', 'min_samples_split': 2, 'min_samples_leaf': 1, 'min_weight_fraction_leaf': 0.07956011487657302, 'min_impurity_decrease': 0.3515923658266539, 'max_features': 0.9671910130574827, 'subsample': 0.8490039681040152, 'dropout_rate': 0.4354118356924654, 'ccp_alpha': 0.22920578624035448}. Best is trial 677 with value: 0.7600100187343619.[0m
[32m[I 2022-04-14 15:52:19,910][0m Trial 988 finished with value: 0.2514800557831246 and parameters: {'loss': 'squared', 'learning_rate': 0.004167046994342215, 'n_estimators': 173, 'criterion': 'friedman_mse', 'min_samples_split': 5, 'min_samples_leaf': 2, 'min_weight_fraction_leaf': 0.06939673590052323, 'min_impurity_decrease': 0.32584498690220626, 'max_features': 0.934471401253598, 'subsample': 0.8188936726104046, 'dropout_rate': 0.7752370449695763, 'ccp_alpha': 0.09486370162209279}. Best is trial 677 with value: 0.7600100187343619.[0m
[32m[I 2022-04-14 15:52:23,711][0m Trial 989 finished with value: 0.5 and parameters: {'loss': 'coxph', 'learning_rate': 0.002213075070209321, 'n_estimators': 178, 'criterion': 'friedman_mse', 'min_samples_split': 2, 'min_samples_leaf': 1, 'min_weight_fraction_leaf': 0.09659898284320977, 'min_impurity_decrease': 0.282952623842594, 'max_features': 0.9553841396266904, 'subsample': 0.8360963284844426, 'dropout_rate': 0.4604909002295765, 'ccp_alpha': 0.4005512122390603}. Best is trial 677 with value: 0.7600100187343619.[0m
[32m[I 2022-04-14 15:52:26,467][0m Trial 990 finished with value: 0.7548283581240052 and parameters: {'loss': 'coxph', 'learning_rate': 0.003118984586301064, 'n_estimators': 198, 'criterion': 'friedman_mse', 'min_samples_split': 3, 'min_samples_leaf': 2, 'min_weight_fraction_leaf': 0.0873079301991936, 'min_impurity_decrease': 0.3113760267865315, 'max_features': 0.9794475106516969, 'subsample': 0.7964918038025699, 'dropout_rate': 0.8024490950950742, 'ccp_alpha': 0.0012454217454291334}. Best is trial 677 with value: 0.7600100187343619.[0m
[32m[I 2022-04-14 15:52:28,035][0m Trial 991 finished with value: 0.742610866144681 and parameters: {'loss': 'coxph', 'learning_rate': 0.0033484101505715656, 'n_estimators': 186, 'criterion': 'friedman_mse', 'min_samples_split': 3, 'min_samples_leaf': 2, 'min_weight_fraction_leaf': 0.10273999621838786, 'min_impurity_decrease': 0.2985185450872835, 'max_features': 0.9762695078295716, 'subsample': 0.7879781773915016, 'dropout_rate': 0.9168324057752638, 'ccp_alpha': 0.0017918417695761157}. Best is trial 677 with value: 0.7600100187343619.[0m
[32m[I 2022-04-14 15:52:30,255][0m Trial 992 finished with value: 0.7422123621360537 and parameters: {'loss': 'coxph', 'learning_rate': 0.004337818771555581, 'n_estimators': 207, 'criterion': 'friedman_mse', 'min_samples_split': 3, 'min_samples_leaf': 2, 'min_weight_fraction_leaf': 0.09229645416776855, 'min_impurity_decrease': 0.2956189045292845, 'max_features': 0.9871794384288459, 'subsample': 0.7958800828927926, 'dropout_rate': 0.8650063652757323, 'ccp_alpha': 0.09351155975979727}. Best is trial 677 with value: 0.7600100187343619.[0m
[32m[I 2022-04-14 15:52:32,202][0m Trial 993 finished with value: 0.7484531160069254 and parameters: {'loss': 'coxph', 'learning_rate': 0.0028484668313512643, 'n_estimators': 197, 'criterion': 'friedman_mse', 'min_samples_split': 3, 'min_samples_leaf': 2, 'min_weight_fraction_leaf': 0.08562677190385364, 'min_impurity_decrease': 0.3343749502351205, 'max_features': 0.9799722305507962, 'subsample': 0.7848537159112285, 'dropout_rate': 0.8671227721398279, 'ccp_alpha': 0.004915882830125704}. Best is trial 677 with value: 0.7600100187343619.[0m
[32m[I 2022-04-14 15:52:33,887][0m Trial 994 finished with value: 0.7423229557639734 and parameters: {'loss': 'coxph', 'learning_rate': 0.004445405164748943, 'n_estimators': 184, 'criterion': 'friedman_mse', 'min_samples_split': 3, 'min_samples_leaf': 2, 'min_weight_fraction_leaf': 0.0960424206149909, 'min_impurity_decrease': 0.3243738560492745, 'max_features': 0.9346926856452263, 'subsample': 0.7701246683262926, 'dropout_rate': 0.8866533915112531, 'ccp_alpha': 0.0911483881557381}. Best is trial 677 with value: 0.7600100187343619.[0m
[32m[I 2022-04-14 15:52:35,880][0m Trial 995 finished with value: 0.7518084484404535 and parameters: {'loss': 'coxph', 'learning_rate': 0.0035527402092692026, 'n_estimators': 192, 'criterion': 'friedman_mse', 'min_samples_split': 3, 'min_samples_leaf': 2, 'min_weight_fraction_leaf': 0.08581973786100054, 'min_impurity_decrease': 0.30122787696648406, 'max_features': 0.9645331145422995, 'subsample': 0.8025278575445687, 'dropout_rate': 0.8502240911469736, 'ccp_alpha': 0.0013337450700252624}. Best is trial 677 with value: 0.7600100187343619.[0m
[32m[I 2022-04-14 15:52:41,091][0m Trial 996 finished with value: 0.5 and parameters: {'loss': 'coxph', 'learning_rate': 0.0020457046729518103, 'n_estimators': 196, 'criterion': 'absolute_error', 'min_samples_split': 3, 'min_samples_leaf': 2, 'min_weight_fraction_leaf': 0.10442664837311094, 'min_impurity_decrease': 0.35867014702448335, 'max_features': 0.9828278693742634, 'subsample': 0.8057607085062939, 'dropout_rate': 0.4362326839999316, 'ccp_alpha': 0.16366621311900706}. Best is trial 677 with value: 0.7600100187343619.[0m
[32m[I 2022-04-14 15:52:45,570][0m Trial 997 finished with value: 0.7396475661432905 and parameters: {'loss': 'coxph', 'learning_rate': 0.005200580829721067, 'n_estimators': 194, 'criterion': 'friedman_mse', 'min_samples_split': 3, 'min_samples_leaf': 2, 'min_weight_fraction_leaf': 0.08829253563086989, 'min_impurity_decrease': 0.33987019983019856, 'max_features': 0.952809309620921, 'subsample': 0.7835755619335716, 'dropout_rate': 0.4303651686047999, 'ccp_alpha': 0.09816116729290887}. Best is trial 677 with value: 0.7600100187343619.[0m
[32m[I 2022-04-14 15:52:46,872][0m Trial 998 finished with value: 0.7546677918206153 and parameters: {'loss': 'coxph', 'learning_rate': 0.0038511423418361754, 'n_estimators': 174, 'criterion': 'friedman_mse', 'min_samples_split': 3, 'min_samples_leaf': 2, 'min_weight_fraction_leaf': 0.0823014578752946, 'min_impurity_decrease': 0.3568732430252742, 'max_features': 0.9240602987577542, 'subsample': 0.8101613090069695, 'dropout_rate': 0.9425607406651194, 'ccp_alpha': 0.0017963557853369681}. Best is trial 677 with value: 0.7600100187343619.[0m
[32m[I 2022-04-14 15:52:48,569][0m Trial 999 finished with value: 0.6991692844988704 and parameters: {'loss': 'coxph', 'learning_rate': 1.6661804743956092e-06, 'n_estimators': 169, 'criterion': 'friedman_mse', 'min_samples_split': 3, 'min_samples_leaf': 2, 'min_weight_fraction_leaf': 0.09694454879250873, 'min_impurity_decrease': 0.3258454799286452, 'max_features': 0.9224209559213419, 'subsample': 0.7603151211982505, 'dropout_rate': 0.823125133873167, 'ccp_alpha': 0.19716560598208305}. Best is trial 677 with value: 0.7600100187343619.[0m
BoostingSurvival
Running Optimizer with LogRank binary scoring
{'loss': 'coxph', 'learning_rate': 0.004645967017840466, 'n_estimators': 134, 'criterion': 'friedman_mse', 'min_samples_split': 4, 'min_samples_leaf': 1, 'min_weight_fraction_leaf': 0.05159598866050061, 'min_impurity_decrease': 0.3211246858128828, 'max_features': 0.9800160158982418, 'subsample': 0.7618208024854627, 'dropout_rate': 0.36976872325477317, 'ccp_alpha': 0.002347135190183855, 'UnoC_LR': 0.8808013426064705}
Running Optimizer normaly
{'loss': 'coxph', 'learning_rate': 0.0042641785443198865, 'n_estimators': 213, 'criterion': 'friedman_mse', 'min_samples_split': 2, 'min_samples_leaf': 2, 'min_weight_fraction_leaf': 0.07044458900638266, 'min_impurity_decrease': 0.34657322016898084, 'max_features': 0.9493715847660741, 'subsample': 0.8064275977878402, 'dropout_rate': 0.45823670487531626, 'ccp_alpha': 0.005126301893450966, 'UnoC': 0.7600100187343619}
