[32m[I 2022-04-13 11:50:54,082][0m Trial 934 finished with value: 0.7231620801843659 and parameters: {'alpha': 0.6865996227832716, 'ties': 'efron'}. Best is trial 63 with value: 0.7309739795612015.[0m
[32m[I 2022-04-13 11:50:54,453][0m Trial 935 finished with value: 0.7286259651218314 and parameters: {'alpha': 2.221700765616411, 'ties': 'efron'}. Best is trial 63 with value: 0.7309739795612015.[0m
[32m[I 2022-04-13 11:50:54,892][0m Trial 936 finished with value: 0.7308171886403182 and parameters: {'alpha': 2.0049536567006574, 'ties': 'efron'}. Best is trial 63 with value: 0.7309739795612015.[0m
[32m[I 2022-04-13 11:50:55,276][0m Trial 937 finished with value: 0.7308171886403182 and parameters: {'alpha': 2.086535197538945, 'ties': 'efron'}. Best is trial 63 with value: 0.7309739795612015.[0m
[32m[I 2022-04-13 11:50:55,401][0m Trial 938 finished with value: 0.7286259651218314 and parameters: {'alpha': 2.2200368692213863, 'ties': 'efron'}. Best is trial 63 with value: 0.7309739795612015.[0m
[32m[I 2022-04-13 11:50:55,655][0m Trial 939 finished with value: 0.7296437365326369 and parameters: {'alpha': 2.168979524334393, 'ties': 'efron'}. Best is trial 63 with value: 0.7309739795612015.[0m
[32m[I 2022-04-13 11:50:55,802][0m Trial 940 finished with value: 0.729697264326865 and parameters: {'alpha': 2.3619644086366205, 'ties': 'efron'}. Best is trial 63 with value: 0.7309739795612015.[0m
[32m[I 2022-04-13 11:50:56,071][0m Trial 941 finished with value: 0.7309739795612015 and parameters: {'alpha': 2.2849249504184876, 'ties': 'efron'}. Best is trial 63 with value: 0.7309739795612015.[0m
[32m[I 2022-04-13 11:50:56,300][0m Trial 942 finished with value: 0.7295404734059817 and parameters: {'alpha': 2.0923473621802002, 'ties': 'efron'}. Best is trial 63 with value: 0.7309739795612015.[0m
[32m[I 2022-04-13 11:50:56,582][0m Trial 943 finished with value: 0.729697264326865 and parameters: {'alpha': 2.5035041171961567, 'ties': 'efron'}. Best is trial 63 with value: 0.7309739795612015.[0m
[32m[I 2022-04-13 11:50:56,768][0m Trial 944 finished with value: 0.729697264326865 and parameters: {'alpha': 2.3835980319409593, 'ties': 'breslow'}. Best is trial 63 with value: 0.7309739795612015.[0m
[32m[I 2022-04-13 11:50:56,935][0m Trial 945 finished with value: 0.7286259651218314 and parameters: {'alpha': 2.2588377094464693, 'ties': 'efron'}. Best is trial 63 with value: 0.7309739795612015.[0m
[32m[I 2022-04-13 11:50:57,220][0m Trial 946 finished with value: 0.7286259651218314 and parameters: {'alpha': 2.2068972308871677, 'ties': 'efron'}. Best is trial 63 with value: 0.7309739795612015.[0m
[32m[I 2022-04-13 11:50:57,384][0m Trial 947 finished with value: 0.729697264326865 and parameters: {'alpha': 2.501280290246645, 'ties': 'efron'}. Best is trial 63 with value: 0.7309739795612015.[0m
[32m[I 2022-04-13 11:50:57,538][0m Trial 948 finished with value: 0.729697264326865 and parameters: {'alpha': 2.379233265950975, 'ties': 'efron'}. Best is trial 63 with value: 0.7309739795612015.[0m
[32m[I 2022-04-13 11:50:57,697][0m Trial 949 finished with value: 0.729697264326865 and parameters: {'alpha': 2.6256587728965313, 'ties': 'efron'}. Best is trial 63 with value: 0.7309739795612015.[0m
[32m[I 2022-04-13 11:50:58,064][0m Trial 950 finished with value: 0.729697264326865 and parameters: {'alpha': 2.4565774359063015, 'ties': 'efron'}. Best is trial 63 with value: 0.7309739795612015.[0m
[32m[I 2022-04-13 11:50:58,304][0m Trial 951 finished with value: 0.7309739795612015 and parameters: {'alpha': 2.2918091790277875, 'ties': 'efron'}. Best is trial 63 with value: 0.7309739795612015.[0m
[32m[I 2022-04-13 11:50:58,632][0m Trial 952 finished with value: 0.7308171886403182 and parameters: {'alpha': 2.0061435253305233, 'ties': 'efron'}. Best is trial 63 with value: 0.7309739795612015.[0m
[32m[I 2022-04-13 11:50:58,789][0m Trial 953 finished with value: 0.7286259651218314 and parameters: {'alpha': 2.289270418748441, 'ties': 'breslow'}. Best is trial 63 with value: 0.7309739795612015.[0m
[32m[I 2022-04-13 11:50:58,884][0m Trial 954 finished with value: 0.729697264326865 and parameters: {'alpha': 2.4207281089685218, 'ties': 'efron'}. Best is trial 63 with value: 0.7309739795612015.[0m
[32m[I 2022-04-13 11:50:59,164][0m Trial 955 finished with value: 0.7309739795612015 and parameters: {'alpha': 2.3253786879328966, 'ties': 'efron'}. Best is trial 63 with value: 0.7309739795612015.[0m
[32m[I 2022-04-13 11:50:59,258][0m Trial 956 finished with value: 0.7295404734059817 and parameters: {'alpha': 2.1042544150927833, 'ties': 'efron'}. Best is trial 63 with value: 0.7309739795612015.[0m
[32m[I 2022-04-13 11:50:59,464][0m Trial 957 finished with value: 0.729697264326865 and parameters: {'alpha': 2.508760937031672, 'ties': 'efron'}. Best is trial 63 with value: 0.7309739795612015.[0m
[32m[I 2022-04-13 11:50:59,567][0m Trial 958 finished with value: 0.7266957640961634 and parameters: {'alpha': 1.919253027095685, 'ties': 'efron'}. Best is trial 63 with value: 0.7309739795612015.[0m
[32m[I 2022-04-13 11:50:59,660][0m Trial 959 finished with value: 0.7296437365326369 and parameters: {'alpha': 2.165429785168887, 'ties': 'efron'}. Best is trial 63 with value: 0.7309739795612015.[0m
[32m[I 2022-04-13 11:51:00,084][0m Trial 960 finished with value: 0.729697264326865 and parameters: {'alpha': 2.389014368643415, 'ties': 'efron'}. Best is trial 63 with value: 0.7309739795612015.[0m
[32m[I 2022-04-13 11:51:00,620][0m Trial 961 finished with value: 0.7286259651218314 and parameters: {'alpha': 2.2292498736430977, 'ties': 'efron'}. Best is trial 63 with value: 0.7309739795612015.[0m
[32m[I 2022-04-13 11:51:00,998][0m Trial 962 finished with value: 0.729697264326865 and parameters: {'alpha': 2.353274482303438, 'ties': 'breslow'}. Best is trial 63 with value: 0.7309739795612015.[0m
[32m[I 2022-04-13 11:51:01,440][0m Trial 963 finished with value: 0.7286259651218314 and parameters: {'alpha': 2.2142976227077877, 'ties': 'efron'}. Best is trial 63 with value: 0.7309739795612015.[0m
[32m[I 2022-04-13 11:51:01,603][0m Trial 964 finished with value: 0.7296437365326369 and parameters: {'alpha': 2.1408936995618566, 'ties': 'efron'}. Best is trial 63 with value: 0.7309739795612015.[0m
[32m[I 2022-04-13 11:51:01,837][0m Trial 965 finished with value: 0.7286259651218314 and parameters: {'alpha': 2.274981920898993, 'ties': 'efron'}. Best is trial 63 with value: 0.7309739795612015.[0m
[32m[I 2022-04-13 11:51:01,969][0m Trial 966 finished with value: 0.729697264326865 and parameters: {'alpha': 2.4639176504880678, 'ties': 'efron'}. Best is trial 63 with value: 0.7309739795612015.[0m
[32m[I 2022-04-13 11:51:02,309][0m Trial 967 finished with value: 0.7308171886403182 and parameters: {'alpha': 2.0755185926787667, 'ties': 'efron'}. Best is trial 63 with value: 0.7309739795612015.[0m
[32m[I 2022-04-13 11:51:02,526][0m Trial 968 finished with value: 0.7279272270916745 and parameters: {'alpha': 1.7977173561130115, 'ties': 'efron'}. Best is trial 63 with value: 0.7309739795612015.[0m
[32m[I 2022-04-13 11:51:02,628][0m Trial 969 finished with value: 0.729697264326865 and parameters: {'alpha': 2.6078171446258627, 'ties': 'efron'}. Best is trial 63 with value: 0.7309739795612015.[0m
[32m[I 2022-04-13 11:51:02,723][0m Trial 970 finished with value: 0.7286259651218314 and parameters: {'alpha': 2.1973258492998253, 'ties': 'efron'}. Best is trial 63 with value: 0.7309739795612015.[0m
[32m[I 2022-04-13 11:51:02,991][0m Trial 971 finished with value: 0.729697264326865 and parameters: {'alpha': 2.333859773024947, 'ties': 'efron'}. Best is trial 63 with value: 0.7309739795612015.[0m
[32m[I 2022-04-13 11:51:03,139][0m Trial 972 finished with value: 0.7308171886403182 and parameters: {'alpha': 1.9870632538198287, 'ties': 'efron'}. Best is trial 63 with value: 0.7309739795612015.[0m
[32m[I 2022-04-13 11:51:03,292][0m Trial 973 finished with value: 0.7296437365326369 and parameters: {'alpha': 2.1831836002190794, 'ties': 'efron'}. Best is trial 63 with value: 0.7309739795612015.[0m
[32m[I 2022-04-13 11:51:03,463][0m Trial 974 finished with value: 0.729697264326865 and parameters: {'alpha': 2.3634594994051876, 'ties': 'efron'}. Best is trial 63 with value: 0.7309739795612015.[0m
[32m[I 2022-04-13 11:51:03,555][0m Trial 975 finished with value: 0.7309739795612015 and parameters: {'alpha': 2.3225899814272073, 'ties': 'efron'}. Best is trial 63 with value: 0.7309739795612015.[0m
[32m[I 2022-04-13 11:51:03,805][0m Trial 976 finished with value: 0.729697264326865 and parameters: {'alpha': 2.4648126879180934, 'ties': 'efron'}. Best is trial 63 with value: 0.7309739795612015.[0m
[32m[I 2022-04-13 11:51:03,966][0m Trial 977 finished with value: 0.729697264326865 and parameters: {'alpha': 2.565108358704719, 'ties': 'efron'}. Best is trial 63 with value: 0.7309739795612015.[0m
[32m[I 2022-04-13 11:51:04,092][0m Trial 978 finished with value: 0.7286259651218314 and parameters: {'alpha': 2.2241184065172526, 'ties': 'efron'}. Best is trial 63 with value: 0.7309739795612015.[0m
[32m[I 2022-04-13 11:51:04,194][0m Trial 979 finished with value: 0.7246019901352241 and parameters: {'alpha': 2.7360876225354005, 'ties': 'efron'}. Best is trial 63 with value: 0.7309739795612015.[0m
[32m[I 2022-04-13 11:51:04,388][0m Trial 980 finished with value: 0.7296437365326369 and parameters: {'alpha': 2.166730053638183, 'ties': 'efron'}. Best is trial 63 with value: 0.7309739795612015.[0m
[32m[I 2022-04-13 11:51:04,649][0m Trial 981 finished with value: 0.729697264326865 and parameters: {'alpha': 2.4303313062485445, 'ties': 'efron'}. Best is trial 63 with value: 0.7309739795612015.[0m
[32m[I 2022-04-13 11:51:04,767][0m Trial 982 finished with value: 0.729697264326865 and parameters: {'alpha': 2.333044166724288, 'ties': 'efron'}. Best is trial 63 with value: 0.7309739795612015.[0m
[32m[I 2022-04-13 11:51:04,896][0m Trial 983 finished with value: 0.7286259651218314 and parameters: {'alpha': 2.2752587450774837, 'ties': 'breslow'}. Best is trial 63 with value: 0.7309739795612015.[0m
[32m[I 2022-04-13 11:51:04,999][0m Trial 984 finished with value: 0.7308171886403182 and parameters: {'alpha': 2.0712812286420803, 'ties': 'efron'}. Best is trial 63 with value: 0.7309739795612015.[0m
[32m[I 2022-04-13 11:51:05,088][0m Trial 985 finished with value: 0.7309739795612015 and parameters: {'alpha': 2.2867855061229583, 'ties': 'efron'}. Best is trial 63 with value: 0.7309739795612015.[0m
[32m[I 2022-04-13 11:51:05,302][0m Trial 986 finished with value: 0.7295404734059817 and parameters: {'alpha': 2.1033041203265523, 'ties': 'efron'}. Best is trial 63 with value: 0.7309739795612015.[0m
[32m[I 2022-04-13 11:51:05,478][0m Trial 987 finished with value: 0.729697264326865 and parameters: {'alpha': 2.4448267326028383, 'ties': 'efron'}. Best is trial 63 with value: 0.7309739795612015.[0m
[32m[I 2022-04-13 11:51:05,570][0m Trial 988 finished with value: 0.729697264326865 and parameters: {'alpha': 2.3706720041983806, 'ties': 'breslow'}. Best is trial 63 with value: 0.7309739795612015.[0m
[32m[I 2022-04-13 11:51:05,659][0m Trial 989 finished with value: 0.7286259651218314 and parameters: {'alpha': 2.233004335147896, 'ties': 'efron'}. Best is trial 63 with value: 0.7309739795612015.[0m
[32m[I 2022-04-13 11:51:05,768][0m Trial 990 finished with value: 0.7309739795612015 and parameters: {'alpha': 2.3018278387708007, 'ties': 'efron'}. Best is trial 63 with value: 0.7309739795612015.[0m
[32m[I 2022-04-13 11:51:05,858][0m Trial 991 finished with value: 0.7186787352874983 and parameters: {'alpha': 3.874943438545389, 'ties': 'efron'}. Best is trial 63 with value: 0.7309739795612015.[0m
[32m[I 2022-04-13 11:51:06,024][0m Trial 992 finished with value: 0.729697264326865 and parameters: {'alpha': 2.54942901649867, 'ties': 'efron'}. Best is trial 63 with value: 0.7309739795612015.[0m
[32m[I 2022-04-13 11:51:06,210][0m Trial 993 finished with value: 0.729697264326865 and parameters: {'alpha': 2.442498293111532, 'ties': 'efron'}. Best is trial 63 with value: 0.7309739795612015.[0m
[32m[I 2022-04-13 11:51:06,422][0m Trial 994 finished with value: 0.729697264326865 and parameters: {'alpha': 2.5375605726921426, 'ties': 'efron'}. Best is trial 63 with value: 0.7309739795612015.[0m
[32m[I 2022-04-13 11:51:06,690][0m Trial 995 finished with value: 0.7296437365326369 and parameters: {'alpha': 2.1518767444414557, 'ties': 'efron'}. Best is trial 63 with value: 0.7309739795612015.[0m
[32m[I 2022-04-13 11:51:07,067][0m Trial 996 finished with value: 0.729697264326865 and parameters: {'alpha': 2.6401715425130714, 'ties': 'efron'}. Best is trial 63 with value: 0.7309739795612015.[0m
[32m[I 2022-04-13 11:51:07,361][0m Trial 997 finished with value: 0.729697264326865 and parameters: {'alpha': 2.3600472500844965, 'ties': 'efron'}. Best is trial 63 with value: 0.7309739795612015.[0m
[32m[I 2022-04-13 11:51:07,573][0m Trial 998 finished with value: 0.7309739795612015 and parameters: {'alpha': 2.282063052679427, 'ties': 'efron'}. Best is trial 63 with value: 0.7309739795612015.[0m
[32m[I 2022-04-13 11:51:07,977][0m Trial 999 finished with value: 0.7286259651218314 and parameters: {'alpha': 2.27213708168642, 'ties': 'efron'}. Best is trial 63 with value: 0.7309739795612015.[0m
CoxPH
Running Optimizer with LogRank binary scoring
{'alpha': 2.292208483223857, 'ties': 'efron', 'UnoC_LR': 0.8654869897806009}
Running Optimizer normaly
{'alpha': 2.323999618444634, 'ties': 'efron', 'UnoC': 0.7309739795612015}
