[32m[I 2022-04-19 09:44:28,260][0m Trial 356 finished with value: 0.725912280218941 and parameters: {'n_hidden': 2048, 'mixture_components': 1, 'use_sparse_layer': True, 'use_sparse_loss': False, 'use_batchnorm': False, 'use_dropout': True, 'dropout': 0.33893936480296893, 'mlp_size_1': 7, 'mlp_size_2': 0, 'mlp_size_3': 1, 'kernel': 'Exponential', 'loss_name': 'NLLLoss'}. Best is trial 237 with value: 0.7341952549033148.[0m
[32m[I 2022-04-19 09:48:28,601][0m Trial 357 finished with value: 0.6502416316827255 and parameters: {'n_hidden': 256, 'mixture_components': 1, 'use_sparse_layer': True, 'use_sparse_loss': False, 'use_batchnorm': True, 'use_dropout': True, 'dropout': 0.3409278728265736, 'mlp_size_1': 5, 'mlp_size_2': 0, 'mlp_size_3': 0, 'kernel': 'Gumbel', 'loss_name': 'NLLLoss'}. Best is trial 237 with value: 0.7341952549033148.[0m
[32m[I 2022-04-19 09:50:02,140][0m Trial 358 finished with value: 0.6642762783867152 and parameters: {'n_hidden': 2048, 'mixture_components': 1, 'use_sparse_layer': True, 'use_sparse_loss': False, 'use_batchnorm': False, 'use_dropout': True, 'dropout': 0.36963823236970467, 'mlp_size_1': 1, 'mlp_size_2': 0, 'mlp_size_3': 2, 'kernel': 'Weibull', 'loss_name': 'NLLLoss'}. Best is trial 237 with value: 0.7341952549033148.[0m
[32m[I 2022-04-19 09:51:52,649][0m Trial 359 finished with value: 0.7205172375432323 and parameters: {'n_hidden': 2048, 'mixture_components': 1, 'use_sparse_layer': True, 'use_sparse_loss': False, 'use_batchnorm': False, 'use_dropout': True, 'dropout': 0.3470249888903284, 'mlp_size_1': 0, 'mlp_size_2': 1, 'mlp_size_3': 4, 'kernel': 'Exponential', 'loss_name': 'NLLLoss'}. Best is trial 237 with value: 0.7341952549033148.[0m
[32m[I 2022-04-19 09:53:46,132][0m Trial 360 finished with value: 0.696734666221228 and parameters: {'n_hidden': 2048, 'mixture_components': 1, 'use_sparse_layer': True, 'use_sparse_loss': False, 'use_batchnorm': False, 'use_dropout': False, 'mlp_size_1': 7, 'mlp_size_2': 0, 'mlp_size_3': 1, 'kernel': 'Exponential', 'loss_name': 'NLLLoss'}. Best is trial 237 with value: 0.7341952549033148.[0m
[32m[I 2022-04-19 09:55:17,271][0m Trial 361 finished with value: 0.557129505404786 and parameters: {'n_hidden': 32, 'mixture_components': 1, 'use_sparse_layer': True, 'use_sparse_loss': False, 'use_batchnorm': False, 'use_dropout': True, 'dropout': 0.34768528744981103, 'mlp_size_1': 2, 'mlp_size_2': 0, 'mlp_size_3': 0, 'kernel': 'Logistic', 'loss_name': 'NLLLoss'}. Best is trial 237 with value: 0.7341952549033148.[0m
[32m[I 2022-04-19 09:57:32,372][0m Trial 362 finished with value: 0.6158665946209709 and parameters: {'n_hidden': 2048, 'mixture_components': 1, 'use_sparse_layer': True, 'use_sparse_loss': False, 'use_batchnorm': False, 'use_dropout': True, 'dropout': 0.3949368522978523, 'mlp_size_1': 0, 'mlp_size_2': 4, 'mlp_size_3': 4, 'kernel': 'LogNormal', 'loss_name': 'NLLLoss'}. Best is trial 237 with value: 0.7341952549033148.[0m
[32m[I 2022-04-19 09:59:15,905][0m Trial 363 finished with value: 0.7053056738681901 and parameters: {'n_hidden': 2048, 'mixture_components': 1, 'use_sparse_layer': True, 'use_sparse_loss': False, 'use_batchnorm': False, 'use_dropout': True, 'dropout': 0.372932935487412, 'mlp_size_1': 0, 'mlp_size_2': 1, 'mlp_size_3': 4, 'kernel': 'Exponential', 'loss_name': 'NLLLoss'}. Best is trial 237 with value: 0.7341952549033148.[0m
[32m[I 2022-04-19 10:01:04,013][0m Trial 364 finished with value: 0.658386833641303 and parameters: {'n_hidden': 64, 'mixture_components': 1, 'use_sparse_layer': True, 'use_sparse_loss': False, 'use_batchnorm': False, 'use_dropout': True, 'dropout': 0.3402480362841866, 'mlp_size_1': 3, 'mlp_size_2': 0, 'mlp_size_3': 0, 'kernel': 'Exponential', 'loss_name': 'NLLLoss'}. Best is trial 237 with value: 0.7341952549033148.[0m
[32m[I 2022-04-19 10:03:28,530][0m Trial 365 finished with value: 0.7170618158701456 and parameters: {'n_hidden': 2048, 'mixture_components': 1, 'use_sparse_layer': True, 'use_sparse_loss': False, 'use_batchnorm': False, 'use_dropout': True, 'dropout': 0.4030030954809408, 'mlp_size_1': 0, 'mlp_size_2': 3, 'mlp_size_3': 5, 'kernel': 'Exponential', 'loss_name': 'NLLLoss'}. Best is trial 237 with value: 0.7341952549033148.[0m
[32m[I 2022-04-19 10:05:31,118][0m Trial 366 finished with value: 0.7198330641139014 and parameters: {'n_hidden': 2048, 'mixture_components': 1, 'use_sparse_layer': True, 'use_sparse_loss': False, 'use_batchnorm': False, 'use_dropout': True, 'dropout': 0.4007154839147788, 'mlp_size_1': 0, 'mlp_size_2': 3, 'mlp_size_3': 5, 'kernel': 'Exponential', 'loss_name': 'NLLLoss'}. Best is trial 237 with value: 0.7341952549033148.[0m
[32m[I 2022-04-19 10:07:34,375][0m Trial 367 finished with value: 0.706766466375648 and parameters: {'n_hidden': 2048, 'mixture_components': 1, 'use_sparse_layer': True, 'use_sparse_loss': False, 'use_batchnorm': False, 'use_dropout': True, 'dropout': 0.39914734233738386, 'mlp_size_1': 0, 'mlp_size_2': 5, 'mlp_size_3': 3, 'kernel': 'Exponential', 'loss_name': 'NLLLoss'}. Best is trial 237 with value: 0.7341952549033148.[0m
[32m[I 2022-04-19 10:09:41,342][0m Trial 368 finished with value: 0.7199257183674056 and parameters: {'n_hidden': 2048, 'mixture_components': 1, 'use_sparse_layer': True, 'use_sparse_loss': False, 'use_batchnorm': False, 'use_dropout': True, 'dropout': 0.43003336561382105, 'mlp_size_1': 0, 'mlp_size_2': 3, 'mlp_size_3': 5, 'kernel': 'Exponential', 'loss_name': 'NLLLoss'}. Best is trial 237 with value: 0.7341952549033148.[0m
[32m[I 2022-04-19 10:11:35,102][0m Trial 369 finished with value: 0.6890166667888197 and parameters: {'n_hidden': 2048, 'mixture_components': 1, 'use_sparse_layer': True, 'use_sparse_loss': False, 'use_batchnorm': False, 'use_dropout': True, 'dropout': 0.42354143858773924, 'mlp_size_1': 0, 'mlp_size_2': 6, 'mlp_size_3': 2, 'kernel': 'Exponential', 'loss_name': 'NLLLoss'}. Best is trial 237 with value: 0.7341952549033148.[0m
[32m[I 2022-04-19 10:13:14,345][0m Trial 370 finished with value: 0.7182892704112602 and parameters: {'n_hidden': 256, 'mixture_components': 1, 'use_sparse_layer': False, 'use_batchnorm': False, 'use_dropout': True, 'dropout': 0.3843295661603282, 'mlp_size_1': 5, 'mlp_size_2': 0, 'mlp_size_3': 0, 'kernel': 'Exponential', 'loss_name': 'NLLLoss'}. Best is trial 237 with value: 0.7341952549033148.[0m
[32m[I 2022-04-19 10:16:38,203][0m Trial 371 finished with value: 0.6614179317920132 and parameters: {'n_hidden': 2048, 'mixture_components': 1, 'use_sparse_layer': False, 'use_batchnorm': False, 'use_dropout': True, 'dropout': 0.4407341628746468, 'mlp_size_1': 0, 'mlp_size_2': 8, 'mlp_size_3': 0, 'kernel': 'Exponential', 'loss_name': 'NLLLoss'}. Best is trial 237 with value: 0.7341952549033148.[0m
[32m[I 2022-04-19 10:18:37,590][0m Trial 372 finished with value: 0.7165374032370464 and parameters: {'n_hidden': 2048, 'mixture_components': 1, 'use_sparse_layer': False, 'use_batchnorm': False, 'use_dropout': True, 'dropout': 0.385527143332799, 'mlp_size_1': 0, 'mlp_size_2': 3, 'mlp_size_3': 5, 'kernel': 'Exponential', 'loss_name': 'NLLLoss'}. Best is trial 237 with value: 0.7341952549033148.[0m
[32m[I 2022-04-19 10:20:40,481][0m Trial 373 finished with value: 0.7247407209849256 and parameters: {'n_hidden': 2048, 'mixture_components': 1, 'use_sparse_layer': True, 'use_sparse_loss': False, 'use_batchnorm': False, 'use_dropout': True, 'dropout': 0.37522771176314096, 'mlp_size_1': 0, 'mlp_size_2': 2, 'mlp_size_3': 5, 'kernel': 'Exponential', 'loss_name': 'NLLLoss'}. Best is trial 237 with value: 0.7341952549033148.[0m
[32m[I 2022-04-19 10:22:31,670][0m Trial 374 finished with value: 0.6980292681743088 and parameters: {'n_hidden': 2048, 'mixture_components': 1, 'use_sparse_layer': False, 'use_batchnorm': False, 'use_dropout': True, 'dropout': 0.37990457515141646, 'mlp_size_1': 0, 'mlp_size_2': 2, 'mlp_size_3': 5, 'kernel': 'Exponential', 'loss_name': 'NLLLoss'}. Best is trial 237 with value: 0.7341952549033148.[0m
[32m[I 2022-04-19 10:24:23,400][0m Trial 375 finished with value: 0.7024018814906681 and parameters: {'n_hidden': 2048, 'mixture_components': 1, 'use_sparse_layer': False, 'use_batchnorm': False, 'use_dropout': True, 'dropout': 0.3684336063904037, 'mlp_size_1': 0, 'mlp_size_2': 2, 'mlp_size_3': 5, 'kernel': 'Exponential', 'loss_name': 'NLLLoss'}. Best is trial 237 with value: 0.7341952549033148.[0m
[32m[I 2022-04-19 10:26:15,157][0m Trial 376 finished with value: 0.7012612010883007 and parameters: {'n_hidden': 2048, 'mixture_components': 1, 'use_sparse_layer': False, 'use_batchnorm': False, 'use_dropout': True, 'dropout': 0.39411455187618305, 'mlp_size_1': 0, 'mlp_size_2': 2, 'mlp_size_3': 5, 'kernel': 'Exponential', 'loss_name': 'NLLLoss'}. Best is trial 237 with value: 0.7341952549033148.[0m
[32m[I 2022-04-19 10:32:34,889][0m Trial 377 finished with value: 0.6740763021510519 and parameters: {'n_hidden': 2048, 'mixture_components': 8, 'use_sparse_layer': False, 'use_batchnorm': True, 'use_dropout': True, 'dropout': 0.4050676730083022, 'mlp_size_1': 0, 'mlp_size_2': 3, 'mlp_size_3': 5, 'kernel': 'LogLogistic', 'loss_name': 'NLLLoss'}. Best is trial 237 with value: 0.7341952549033148.[0m
[32m[I 2022-04-19 10:34:25,231][0m Trial 378 finished with value: 0.7158363533978486 and parameters: {'n_hidden': 2048, 'mixture_components': 1, 'use_sparse_layer': False, 'use_batchnorm': False, 'use_dropout': True, 'dropout': 0.35387331669424166, 'mlp_size_1': 0, 'mlp_size_2': 2, 'mlp_size_3': 5, 'kernel': 'Exponential', 'loss_name': 'NLLLoss'}. Best is trial 237 with value: 0.7341952549033148.[0m
[32m[I 2022-04-19 10:35:46,067][0m Trial 379 finished with value: 0.6968586623827123 and parameters: {'n_hidden': 512, 'mixture_components': 1, 'use_sparse_layer': False, 'use_batchnorm': False, 'use_dropout': False, 'mlp_size_1': 6, 'mlp_size_2': 0, 'mlp_size_3': 0, 'kernel': 'Exponential', 'loss_name': 'NLLLoss'}. Best is trial 237 with value: 0.7341952549033148.[0m
[32m[I 2022-04-19 10:37:54,658][0m Trial 380 finished with value: 0.7108610980011376 and parameters: {'n_hidden': 2048, 'mixture_components': 1, 'use_sparse_layer': True, 'use_sparse_loss': False, 'use_batchnorm': False, 'use_dropout': True, 'dropout': 0.36259807470021094, 'mlp_size_1': 0, 'mlp_size_2': 3, 'mlp_size_3': 5, 'kernel': 'Exponential', 'loss_name': 'NLLLoss'}. Best is trial 237 with value: 0.7341952549033148.[0m
[32m[I 2022-04-19 10:39:08,628][0m Trial 381 finished with value: 0.5416226792275463 and parameters: {'n_hidden': 128, 'mixture_components': 1, 'use_sparse_layer': True, 'use_sparse_loss': False, 'use_batchnorm': False, 'use_dropout': True, 'dropout': 0.40826758884467496, 'mlp_size_1': 0, 'mlp_size_2': 3, 'mlp_size_3': 1, 'kernel': 'Normal', 'loss_name': 'NLLLoss'}. Best is trial 237 with value: 0.7341952549033148.[0m
[32m[I 2022-04-19 10:40:48,162][0m Trial 382 finished with value: 0.6520815518233469 and parameters: {'n_hidden': 256, 'mixture_components': 1, 'use_sparse_layer': True, 'use_sparse_loss': False, 'use_batchnorm': False, 'use_dropout': True, 'dropout': 0.37863810826624994, 'mlp_size_1': 5, 'mlp_size_2': 0, 'mlp_size_3': 0, 'kernel': 'Exponential', 'loss_name': 'NLLLoss'}. Best is trial 237 with value: 0.7341952549033148.[0m
[32m[I 2022-04-19 10:42:51,634][0m Trial 383 finished with value: 0.7233384484427219 and parameters: {'n_hidden': 2048, 'mixture_components': 1, 'use_sparse_layer': True, 'use_sparse_loss': False, 'use_batchnorm': False, 'use_dropout': True, 'dropout': 0.4206515343288471, 'mlp_size_1': 0, 'mlp_size_2': 4, 'mlp_size_3': 4, 'kernel': 'Exponential', 'loss_name': 'NLLLoss'}. Best is trial 237 with value: 0.7341952549033148.[0m
[32m[I 2022-04-19 10:46:01,533][0m Trial 384 finished with value: 0.6686540623339514 and parameters: {'n_hidden': 2048, 'mixture_components': 1, 'use_sparse_layer': True, 'use_sparse_loss': False, 'use_batchnorm': False, 'use_dropout': True, 'dropout': 0.43377719361883865, 'mlp_size_1': 0, 'mlp_size_2': 4, 'mlp_size_3': 4, 'kernel': 'Gumbel', 'loss_name': 'NLLLoss'}. Best is trial 237 with value: 0.7341952549033148.[0m
[32m[I 2022-04-19 10:48:01,323][0m Trial 385 finished with value: 0.7319863011215556 and parameters: {'n_hidden': 2048, 'mixture_components': 1, 'use_sparse_layer': True, 'use_sparse_loss': False, 'use_batchnorm': False, 'use_dropout': True, 'dropout': 0.41875846147907947, 'mlp_size_1': 0, 'mlp_size_2': 4, 'mlp_size_3': 4, 'kernel': 'Exponential', 'loss_name': 'NLLLoss'}. Best is trial 237 with value: 0.7341952549033148.[0m
[32m[I 2022-04-19 10:50:15,351][0m Trial 386 finished with value: 0.7375366593103335 and parameters: {'n_hidden': 2048, 'mixture_components': 1, 'use_sparse_layer': True, 'use_sparse_loss': False, 'use_batchnorm': False, 'use_dropout': True, 'dropout': 0.4309922079610645, 'mlp_size_1': 0, 'mlp_size_2': 4, 'mlp_size_3': 4, 'kernel': 'Exponential', 'loss_name': 'NLLLoss'}. Best is trial 386 with value: 0.7375366593103335.[0m
[32m[I 2022-04-19 10:52:07,285][0m Trial 387 finished with value: 0.7106298569786528 and parameters: {'n_hidden': 2048, 'mixture_components': 1, 'use_sparse_layer': True, 'use_sparse_loss': False, 'use_batchnorm': False, 'use_dropout': True, 'dropout': 0.45288473214815717, 'mlp_size_1': 0, 'mlp_size_2': 4, 'mlp_size_3': 4, 'kernel': 'Exponential', 'loss_name': 'NLLLoss'}. Best is trial 386 with value: 0.7375366593103335.[0m
[32m[I 2022-04-19 10:53:54,430][0m Trial 388 finished with value: 0.7194413357760513 and parameters: {'n_hidden': 2048, 'mixture_components': 1, 'use_sparse_layer': True, 'use_sparse_loss': False, 'use_batchnorm': False, 'use_dropout': True, 'dropout': 0.42917852577712945, 'mlp_size_1': 0, 'mlp_size_2': 4, 'mlp_size_3': 4, 'kernel': 'Exponential', 'loss_name': 'NLLLoss'}. Best is trial 386 with value: 0.7375366593103335.[0m
[32m[I 2022-04-19 10:55:48,391][0m Trial 389 finished with value: 0.6673874099630139 and parameters: {'n_hidden': 2048, 'mixture_components': 1, 'use_sparse_layer': True, 'use_sparse_loss': False, 'use_batchnorm': False, 'use_dropout': True, 'dropout': 0.41348862798225694, 'mlp_size_1': 0, 'mlp_size_2': 4, 'mlp_size_3': 4, 'kernel': 'Weibull', 'loss_name': 'NLLLoss'}. Best is trial 386 with value: 0.7375366593103335.[0m
[32m[I 2022-04-19 10:57:37,281][0m Trial 390 finished with value: 0.689027757333259 and parameters: {'n_hidden': 2048, 'mixture_components': 1, 'use_sparse_layer': True, 'use_sparse_loss': False, 'use_batchnorm': False, 'use_dropout': True, 'dropout': 0.4307052155667281, 'mlp_size_1': 0, 'mlp_size_2': 4, 'mlp_size_3': 4, 'kernel': 'Exponential', 'loss_name': 'NLLLoss'}. Best is trial 386 with value: 0.7375366593103335.[0m
[32m[I 2022-04-19 10:59:44,088][0m Trial 391 finished with value: 0.619633125662202 and parameters: {'n_hidden': 2048, 'mixture_components': 1, 'use_sparse_layer': True, 'use_sparse_loss': False, 'use_batchnorm': False, 'use_dropout': True, 'dropout': 0.4467764170054181, 'mlp_size_1': 0, 'mlp_size_2': 4, 'mlp_size_3': 4, 'kernel': 'Logistic', 'loss_name': 'NLLLoss'}. Best is trial 386 with value: 0.7375366593103335.[0m
[32m[I 2022-04-19 11:01:36,737][0m Trial 392 finished with value: 0.7125842412882533 and parameters: {'n_hidden': 2048, 'mixture_components': 1, 'use_sparse_layer': True, 'use_sparse_loss': False, 'use_batchnorm': False, 'use_dropout': True, 'dropout': 0.4050096589880392, 'mlp_size_1': 0, 'mlp_size_2': 5, 'mlp_size_3': 3, 'kernel': 'Exponential', 'loss_name': 'NLLLoss'}. Best is trial 386 with value: 0.7375366593103335.[0m
[32m[I 2022-04-19 11:03:35,353][0m Trial 393 finished with value: 0.6203031983149476 and parameters: {'n_hidden': 2048, 'mixture_components': 1, 'use_sparse_layer': True, 'use_sparse_loss': False, 'use_batchnorm': False, 'use_dropout': True, 'dropout': 0.4226415161494533, 'mlp_size_1': 1, 'mlp_size_2': 4, 'mlp_size_3': 3, 'kernel': 'LogNormal', 'loss_name': 'NLLLoss'}. Best is trial 386 with value: 0.7375366593103335.[0m
[32m[I 2022-04-19 11:05:36,404][0m Trial 394 finished with value: 0.7245423929557535 and parameters: {'n_hidden': 2048, 'mixture_components': 1, 'use_sparse_layer': True, 'use_sparse_loss': False, 'use_batchnorm': False, 'use_dropout': True, 'dropout': 0.394295971989722, 'mlp_size_1': 0, 'mlp_size_2': 5, 'mlp_size_3': 3, 'kernel': 'Exponential', 'loss_name': 'NLLLoss'}. Best is trial 386 with value: 0.7375366593103335.[0m
[32m[I 2022-04-19 11:07:42,561][0m Trial 395 finished with value: 0.7307230957150181 and parameters: {'n_hidden': 2048, 'mixture_components': 1, 'use_sparse_layer': True, 'use_sparse_loss': False, 'use_batchnorm': False, 'use_dropout': True, 'dropout': 0.3962045312025454, 'mlp_size_1': 0, 'mlp_size_2': 5, 'mlp_size_3': 3, 'kernel': 'Exponential', 'loss_name': 'NLLLoss'}. Best is trial 386 with value: 0.7375366593103335.[0m
[32m[I 2022-04-19 11:09:50,215][0m Trial 396 finished with value: 0.7258388609040766 and parameters: {'n_hidden': 2048, 'mixture_components': 1, 'use_sparse_layer': True, 'use_sparse_loss': False, 'use_batchnorm': False, 'use_dropout': True, 'dropout': 0.396173346689442, 'mlp_size_1': 0, 'mlp_size_2': 5, 'mlp_size_3': 3, 'kernel': 'Exponential', 'loss_name': 'NLLLoss'}. Best is trial 386 with value: 0.7375366593103335.[0m
[32m[I 2022-04-19 11:11:53,546][0m Trial 397 finished with value: 0.6981226174963379 and parameters: {'n_hidden': 2048, 'mixture_components': 1, 'use_sparse_layer': True, 'use_sparse_loss': False, 'use_batchnorm': False, 'use_dropout': True, 'dropout': 0.390472092482574, 'mlp_size_1': 0, 'mlp_size_2': 5, 'mlp_size_3': 3, 'kernel': 'Exponential', 'loss_name': 'NLLLoss'}. Best is trial 386 with value: 0.7375366593103335.[0m
[32m[I 2022-04-19 11:19:00,142][0m Trial 398 finished with value: 0.702883334614205 and parameters: {'n_hidden': 2048, 'mixture_components': 1, 'use_sparse_layer': True, 'use_sparse_loss': False, 'use_batchnorm': True, 'use_dropout': True, 'dropout': 0.3959707149518315, 'mlp_size_1': 0, 'mlp_size_2': 5, 'mlp_size_3': 3, 'kernel': 'Exponential', 'loss_name': 'NLLLoss'}. Best is trial 386 with value: 0.7375366593103335.[0m
[32m[I 2022-04-19 11:20:49,466][0m Trial 399 finished with value: 0.6848097910974487 and parameters: {'n_hidden': 2048, 'mixture_components': 1, 'use_sparse_layer': True, 'use_sparse_loss': False, 'use_batchnorm': False, 'use_dropout': False, 'mlp_size_1': 0, 'mlp_size_2': 5, 'mlp_size_3': 3, 'kernel': 'Exponential', 'loss_name': 'NLLLoss'}. Best is trial 386 with value: 0.7375366593103335.[0m
[32m[I 2022-04-19 11:22:56,955][0m Trial 400 finished with value: 0.6996908568982735 and parameters: {'n_hidden': 2048, 'mixture_components': 1, 'use_sparse_layer': True, 'use_sparse_loss': False, 'use_batchnorm': False, 'use_dropout': True, 'dropout': 0.4504579379819935, 'mlp_size_1': 0, 'mlp_size_2': 5, 'mlp_size_3': 3, 'kernel': 'Exponential', 'loss_name': 'NLLLoss'}. Best is trial 386 with value: 0.7375366593103335.[0m
[32m[I 2022-04-19 11:24:56,864][0m Trial 401 finished with value: 0.7197241938049849 and parameters: {'n_hidden': 2048, 'mixture_components': 1, 'use_sparse_layer': True, 'use_sparse_loss': False, 'use_batchnorm': False, 'use_dropout': True, 'dropout': 0.41851553564951754, 'mlp_size_1': 0, 'mlp_size_2': 5, 'mlp_size_3': 3, 'kernel': 'Exponential', 'loss_name': 'NLLLoss'}. Best is trial 386 with value: 0.7375366593103335.[0m
[32m[I 2022-04-19 11:26:35,335][0m Trial 402 finished with value: 0.6905437829350725 and parameters: {'n_hidden': 2048, 'mixture_components': 1, 'use_sparse_layer': True, 'use_sparse_loss': False, 'use_batchnorm': False, 'use_dropout': True, 'dropout': 0.3756540428472276, 'mlp_size_1': 1, 'mlp_size_2': 5, 'mlp_size_3': 2, 'kernel': 'Exponential', 'loss_name': 'NLLLoss'}. Best is trial 386 with value: 0.7375366593103335.[0m
[32m[I 2022-04-19 11:28:31,366][0m Trial 403 finished with value: 0.7164703374100961 and parameters: {'n_hidden': 2048, 'mixture_components': 1, 'use_sparse_layer': True, 'use_sparse_loss': False, 'use_batchnorm': False, 'use_dropout': True, 'dropout': 0.4086608652387597, 'mlp_size_1': 0, 'mlp_size_2': 4, 'mlp_size_3': 4, 'kernel': 'Exponential', 'loss_name': 'NLLLoss'}. Best is trial 386 with value: 0.7375366593103335.[0m
[32m[I 2022-04-19 11:30:26,235][0m Trial 404 finished with value: 0.7149781354842689 and parameters: {'n_hidden': 2048, 'mixture_components': 1, 'use_sparse_layer': True, 'use_sparse_loss': False, 'use_batchnorm': False, 'use_dropout': True, 'dropout': 0.3763157887734714, 'mlp_size_1': 0, 'mlp_size_2': 4, 'mlp_size_3': 4, 'kernel': 'Exponential', 'loss_name': 'NLLLoss'}. Best is trial 386 with value: 0.7375366593103335.[0m
[32m[I 2022-04-19 11:32:50,801][0m Trial 405 finished with value: 0.6998853569684507 and parameters: {'n_hidden': 2048, 'mixture_components': 1, 'use_sparse_layer': True, 'use_sparse_loss': False, 'use_batchnorm': False, 'use_dropout': True, 'dropout': 0.3984931636285242, 'mlp_size_1': 0, 'mlp_size_2': 6, 'mlp_size_3': 2, 'kernel': 'Exponential', 'loss_name': 'NLLLoss'}. Best is trial 386 with value: 0.7375366593103335.[0m
[32m[I 2022-04-19 11:35:41,777][0m Trial 406 finished with value: 0.5553246337763771 and parameters: {'n_hidden': 32, 'mixture_components': 10, 'use_sparse_layer': True, 'use_sparse_loss': False, 'use_batchnorm': False, 'use_dropout': True, 'dropout': 0.4304462360677472, 'mlp_size_1': 0, 'mlp_size_2': 2, 'mlp_size_3': 0, 'kernel': 'Exponential', 'loss_name': 'NLLLoss'}. Best is trial 386 with value: 0.7375366593103335.[0m
