[32m[I 2022-04-17 03:08:28,874][0m Trial 480 finished with value: 0.8145044311114479 and parameters: {'n_hidden': 64, 'mixture_components': 3, 'use_sparse_layer': False, 'use_batchnorm': True, 'use_dropout': True, 'dropout': 0.9164223293900764, 'mlp_size_1': 0, 'mlp_size_2': 2, 'mlp_size_3': 0, 'kernel': 'Exponential', 'loss_name': 'NLLLoss'}. Best is trial 367 with value: 0.8756446640888914.[0m
[32m[I 2022-04-17 03:13:07,191][0m Trial 481 finished with value: 0.8674302762437105 and parameters: {'n_hidden': 512, 'mixture_components': 5, 'use_sparse_layer': False, 'use_batchnorm': True, 'use_dropout': True, 'dropout': 0.7076074701279683, 'mlp_size_1': 0, 'mlp_size_2': 6, 'mlp_size_3': 0, 'kernel': 'Exponential', 'loss_name': 'NLLLoss'}. Best is trial 367 with value: 0.8756446640888914.[0m
[32m[I 2022-04-17 03:17:59,540][0m Trial 482 finished with value: 0.8680916121835793 and parameters: {'n_hidden': 64, 'mixture_components': 5, 'use_sparse_layer': False, 'use_batchnorm': True, 'use_dropout': True, 'dropout': 0.7634558751281352, 'mlp_size_1': 0, 'mlp_size_2': 2, 'mlp_size_3': 0, 'kernel': 'Exponential', 'loss_name': 'NLLLoss'}. Best is trial 367 with value: 0.8756446640888914.[0m
[32m[I 2022-04-17 03:20:59,234][0m Trial 483 finished with value: 0.8551842045629151 and parameters: {'n_hidden': 64, 'mixture_components': 3, 'use_sparse_layer': False, 'use_batchnorm': True, 'use_dropout': True, 'dropout': 0.06898573329369528, 'mlp_size_1': 0, 'mlp_size_2': 2, 'mlp_size_3': 0, 'kernel': 'Exponential', 'loss_name': 'NLLLoss'}. Best is trial 367 with value: 0.8756446640888914.[0m
[32m[I 2022-04-17 03:25:11,349][0m Trial 484 finished with value: 0.8518810528249692 and parameters: {'n_hidden': 64, 'mixture_components': 3, 'use_sparse_layer': False, 'use_batchnorm': True, 'use_dropout': True, 'dropout': 0.698828399252851, 'mlp_size_1': 0, 'mlp_size_2': 2, 'mlp_size_3': 0, 'kernel': 'LogNormal', 'loss_name': 'NLLLoss'}. Best is trial 367 with value: 0.8756446640888914.[0m
[32m[I 2022-04-17 03:28:12,316][0m Trial 485 finished with value: 0.8511415137359387 and parameters: {'n_hidden': 1024, 'mixture_components': 5, 'use_sparse_layer': False, 'use_batchnorm': True, 'use_dropout': True, 'dropout': 0.7318469937973557, 'mlp_size_1': 1, 'mlp_size_2': 3, 'mlp_size_3': 0, 'kernel': 'Exponential', 'loss_name': 'NLLLoss'}. Best is trial 367 with value: 0.8756446640888914.[0m
[32m[I 2022-04-17 03:32:42,911][0m Trial 486 finished with value: 0.8643087404675469 and parameters: {'n_hidden': 64, 'mixture_components': 3, 'use_sparse_layer': True, 'use_sparse_loss': False, 'use_batchnorm': True, 'use_dropout': True, 'dropout': 0.5984242599720856, 'mlp_size_1': 0, 'mlp_size_2': 2, 'mlp_size_3': 0, 'kernel': 'Logistic', 'loss_name': 'NLLLoss'}. Best is trial 367 with value: 0.8756446640888914.[0m
[32m[I 2022-04-17 03:38:24,083][0m Trial 487 finished with value: 0.8589211193850425 and parameters: {'n_hidden': 64, 'mixture_components': 4, 'use_sparse_layer': False, 'use_batchnorm': True, 'use_dropout': True, 'dropout': 0.7958305407185299, 'mlp_size_1': 0, 'mlp_size_2': 2, 'mlp_size_3': 0, 'kernel': 'Exponential', 'loss_name': 'NLLLoss'}. Best is trial 367 with value: 0.8756446640888914.[0m
[32m[I 2022-04-17 03:44:23,900][0m Trial 488 finished with value: 0.8645494808715499 and parameters: {'n_hidden': 64, 'mixture_components': 4, 'use_sparse_layer': False, 'use_batchnorm': True, 'use_dropout': True, 'dropout': 0.8624398807672793, 'mlp_size_1': 0, 'mlp_size_2': 2, 'mlp_size_3': 0, 'kernel': 'Exponential', 'loss_name': 'NLLLoss'}. Best is trial 367 with value: 0.8756446640888914.[0m
[32m[I 2022-04-17 03:51:45,002][0m Trial 489 finished with value: 0.8531318482278399 and parameters: {'n_hidden': 64, 'mixture_components': 5, 'use_sparse_layer': False, 'use_batchnorm': True, 'use_dropout': True, 'dropout': 0.7414871432554447, 'mlp_size_1': 0, 'mlp_size_2': 2, 'mlp_size_3': 0, 'kernel': 'Exponential', 'loss_name': 'CensoredNLLLoss'}. Best is trial 367 with value: 0.8756446640888914.[0m
[32m[I 2022-04-17 03:53:53,124][0m Trial 490 finished with value: 0.7740110190815457 and parameters: {'n_hidden': 64, 'mixture_components': 3, 'use_sparse_layer': False, 'use_batchnorm': False, 'use_dropout': True, 'dropout': 0.35409512558177114, 'mlp_size_1': 0, 'mlp_size_2': 2, 'mlp_size_3': 0, 'kernel': 'Gumbel', 'loss_name': 'NLLLoss'}. Best is trial 367 with value: 0.8756446640888914.[0m
[32m[I 2022-04-17 03:59:02,273][0m Trial 491 finished with value: 0.8642525981381262 and parameters: {'n_hidden': 64, 'mixture_components': 4, 'use_sparse_layer': False, 'use_batchnorm': True, 'use_dropout': True, 'dropout': 0.7167076946156702, 'mlp_size_1': 0, 'mlp_size_2': 2, 'mlp_size_3': 0, 'kernel': 'Exponential', 'loss_name': 'NLLLoss'}. Best is trial 367 with value: 0.8756446640888914.[0m
[32m[I 2022-04-17 04:01:49,569][0m Trial 492 finished with value: 0.8497305497120646 and parameters: {'n_hidden': 256, 'mixture_components': 5, 'use_sparse_layer': False, 'use_batchnorm': True, 'use_dropout': False, 'mlp_size_1': 0, 'mlp_size_2': 2, 'mlp_size_3': 0, 'kernel': 'Exponential', 'loss_name': 'NLLLoss'}. Best is trial 367 with value: 0.8756446640888914.[0m
[32m[I 2022-04-17 04:07:54,094][0m Trial 493 finished with value: 0.8651155469860692 and parameters: {'n_hidden': 64, 'mixture_components': 3, 'use_sparse_layer': False, 'use_batchnorm': True, 'use_dropout': True, 'dropout': 0.685314790119865, 'mlp_size_1': 0, 'mlp_size_2': 2, 'mlp_size_3': 0, 'kernel': 'Exponential', 'loss_name': 'NLLLoss'}. Best is trial 367 with value: 0.8756446640888914.[0m
[32m[I 2022-04-17 04:13:37,374][0m Trial 494 finished with value: 0.8674908006323481 and parameters: {'n_hidden': 64, 'mixture_components': 5, 'use_sparse_layer': False, 'use_batchnorm': True, 'use_dropout': True, 'dropout': 0.8232697149230231, 'mlp_size_1': 0, 'mlp_size_2': 2, 'mlp_size_3': 0, 'kernel': 'Exponential', 'loss_name': 'NLLLoss'}. Best is trial 367 with value: 0.8756446640888914.[0m
[32m[I 2022-04-17 04:19:08,496][0m Trial 495 finished with value: 0.8673606590520497 and parameters: {'n_hidden': 64, 'mixture_components': 3, 'use_sparse_layer': False, 'use_batchnorm': True, 'use_dropout': True, 'dropout': 0.7583697952655777, 'mlp_size_1': 0, 'mlp_size_2': 2, 'mlp_size_3': 0, 'kernel': 'Exponential', 'loss_name': 'NLLLoss'}. Best is trial 367 with value: 0.8756446640888914.[0m
[32m[I 2022-04-17 04:24:36,236][0m Trial 496 finished with value: 0.8589825097711614 and parameters: {'n_hidden': 64, 'mixture_components': 5, 'use_sparse_layer': False, 'use_batchnorm': True, 'use_dropout': True, 'dropout': 0.5527689532269386, 'mlp_size_1': 0, 'mlp_size_2': 2, 'mlp_size_3': 0, 'kernel': 'Exponential', 'loss_name': 'AlternativeNLLLoss'}. Best is trial 367 with value: 0.8756446640888914.[0m
[32m[I 2022-04-17 04:29:46,762][0m Trial 497 finished with value: 0.8675940269159493 and parameters: {'n_hidden': 64, 'mixture_components': 3, 'use_sparse_layer': False, 'use_batchnorm': True, 'use_dropout': True, 'dropout': 0.7027653161639887, 'mlp_size_1': 0, 'mlp_size_2': 2, 'mlp_size_3': 0, 'kernel': 'Exponential', 'loss_name': 'NLLLoss'}. Best is trial 367 with value: 0.8756446640888914.[0m
[32m[I 2022-04-17 04:35:42,310][0m Trial 498 finished with value: 0.8659065542904975 and parameters: {'n_hidden': 64, 'mixture_components': 4, 'use_sparse_layer': True, 'use_sparse_loss': False, 'use_batchnorm': True, 'use_dropout': True, 'dropout': 0.6660372651224992, 'mlp_size_1': 0, 'mlp_size_2': 2, 'mlp_size_3': 0, 'kernel': 'Exponential', 'loss_name': 'NLLLoss'}. Best is trial 367 with value: 0.8756446640888914.[0m
[32m[I 2022-04-17 04:41:30,678][0m Trial 499 finished with value: 0.8660748883114733 and parameters: {'n_hidden': 64, 'mixture_components': 9, 'use_sparse_layer': False, 'use_batchnorm': True, 'use_dropout': True, 'dropout': 0.7802434341410037, 'mlp_size_1': 0, 'mlp_size_2': 2, 'mlp_size_3': 0, 'kernel': 'Exponential', 'loss_name': 'NLLLoss'}. Best is trial 367 with value: 0.8756446640888914.[0m
[32m[I 2022-04-17 04:44:10,038][0m Trial 500 finished with value: 0.6772796873621907 and parameters: {'n_hidden': 2048, 'mixture_components': 5, 'use_sparse_layer': False, 'use_batchnorm': True, 'use_dropout': True, 'dropout': 0.7293907730324857, 'mlp_size_1': 7, 'mlp_size_2': 1, 'mlp_size_3': 0, 'kernel': 'LogLogistic', 'loss_name': 'NLLLoss'}. Best is trial 367 with value: 0.8756446640888914.[0m
[32m[I 2022-04-17 04:49:36,912][0m Trial 501 finished with value: 0.8667230983832088 and parameters: {'n_hidden': 64, 'mixture_components': 3, 'use_sparse_layer': False, 'use_batchnorm': True, 'use_dropout': True, 'dropout': 0.5957116317385476, 'mlp_size_1': 0, 'mlp_size_2': 2, 'mlp_size_3': 0, 'kernel': 'Exponential', 'loss_name': 'NLLLoss'}. Best is trial 367 with value: 0.8756446640888914.[0m
[32m[I 2022-04-17 04:55:42,764][0m Trial 502 finished with value: 0.8643933166270076 and parameters: {'n_hidden': 64, 'mixture_components': 4, 'use_sparse_layer': False, 'use_batchnorm': True, 'use_dropout': True, 'dropout': 0.8048033514414666, 'mlp_size_1': 0, 'mlp_size_2': 2, 'mlp_size_3': 0, 'kernel': 'Exponential', 'loss_name': 'NLLLoss'}. Best is trial 367 with value: 0.8756446640888914.[0m
[32m[I 2022-04-17 04:59:43,372][0m Trial 503 finished with value: 0.8487617274562668 and parameters: {'n_hidden': 256, 'mixture_components': 6, 'use_sparse_layer': False, 'use_batchnorm': True, 'use_dropout': True, 'dropout': 0.6872930675995401, 'mlp_size_1': 0, 'mlp_size_2': 2, 'mlp_size_3': 0, 'kernel': 'Normal', 'loss_name': 'NLLLoss'}. Best is trial 367 with value: 0.8756446640888914.[0m
[32m[I 2022-04-17 05:05:29,343][0m Trial 504 finished with value: 0.8592399998424642 and parameters: {'n_hidden': 64, 'mixture_components': 5, 'use_sparse_layer': False, 'use_batchnorm': True, 'use_dropout': True, 'dropout': 0.838722983672795, 'mlp_size_1': 0, 'mlp_size_2': 2, 'mlp_size_3': 0, 'kernel': 'Exponential', 'loss_name': 'NLLLoss'}. Best is trial 367 with value: 0.8756446640888914.[0m
[32m[I 2022-04-17 05:10:38,150][0m Trial 505 finished with value: 0.8702348858576674 and parameters: {'n_hidden': 64, 'mixture_components': 3, 'use_sparse_layer': False, 'use_batchnorm': True, 'use_dropout': True, 'dropout': 0.6149393592139256, 'mlp_size_1': 0, 'mlp_size_2': 2, 'mlp_size_3': 0, 'kernel': 'Exponential', 'loss_name': 'NLLLoss'}. Best is trial 367 with value: 0.8756446640888914.[0m
[32m[I 2022-04-17 05:16:05,837][0m Trial 506 finished with value: 0.8642458163619583 and parameters: {'n_hidden': 64, 'mixture_components': 3, 'use_sparse_layer': False, 'use_batchnorm': True, 'use_dropout': True, 'dropout': 0.6065665289534452, 'mlp_size_1': 0, 'mlp_size_2': 2, 'mlp_size_3': 0, 'kernel': 'Exponential', 'loss_name': 'NLLLoss'}. Best is trial 367 with value: 0.8756446640888914.[0m
[32m[I 2022-04-17 05:19:42,603][0m Trial 507 finished with value: 0.8559997241680343 and parameters: {'n_hidden': 512, 'mixture_components': 3, 'use_sparse_layer': False, 'use_batchnorm': True, 'use_dropout': True, 'dropout': 0.5812969201833086, 'mlp_size_1': 0, 'mlp_size_2': 3, 'mlp_size_3': 0, 'kernel': 'Exponential', 'loss_name': 'NLLLoss'}. Best is trial 367 with value: 0.8756446640888914.[0m
[32m[I 2022-04-17 05:22:58,931][0m Trial 508 finished with value: 0.8355810918602863 and parameters: {'n_hidden': 1024, 'mixture_components': 3, 'use_sparse_layer': False, 'use_batchnorm': True, 'use_dropout': True, 'dropout': 0.5701685098573851, 'mlp_size_1': 2, 'mlp_size_2': 2, 'mlp_size_3': 0, 'kernel': 'Exponential', 'loss_name': 'NLLLoss'}. Best is trial 367 with value: 0.8756446640888914.[0m
[32m[I 2022-04-17 05:25:31,878][0m Trial 509 finished with value: 0.6697101248430295 and parameters: {'n_hidden': 64, 'mixture_components': 3, 'use_sparse_layer': True, 'use_sparse_loss': False, 'use_batchnorm': False, 'use_dropout': True, 'dropout': 0.7643792152070381, 'mlp_size_1': 0, 'mlp_size_2': 2, 'mlp_size_3': 0, 'kernel': 'Weibull', 'loss_name': 'NLLLoss'}. Best is trial 367 with value: 0.8756446640888914.[0m
[32m[I 2022-04-17 05:30:18,382][0m Trial 510 finished with value: 0.8569649151865409 and parameters: {'n_hidden': 64, 'mixture_components': 7, 'use_sparse_layer': False, 'use_batchnorm': True, 'use_dropout': True, 'dropout': 0.6171527074368519, 'mlp_size_1': 0, 'mlp_size_2': 2, 'mlp_size_3': 0, 'kernel': 'Gamma', 'loss_name': 'NLLLoss'}. Best is trial 367 with value: 0.8756446640888914.[0m
[32m[I 2022-04-17 05:36:57,318][0m Trial 511 finished with value: 0.8674223056448506 and parameters: {'n_hidden': 64, 'mixture_components': 3, 'use_sparse_layer': False, 'use_batchnorm': True, 'use_dropout': True, 'dropout': 0.8617396844691511, 'mlp_size_1': 0, 'mlp_size_2': 2, 'mlp_size_3': 0, 'kernel': 'Exponential', 'loss_name': 'CensoredNLLLoss'}. Best is trial 367 with value: 0.8756446640888914.[0m
[32m[I 2022-04-17 05:40:49,526][0m Trial 512 finished with value: 0.8467608033169419 and parameters: {'n_hidden': 64, 'mixture_components': 3, 'use_sparse_layer': False, 'use_batchnorm': True, 'use_dropout': False, 'mlp_size_1': 0, 'mlp_size_2': 2, 'mlp_size_3': 0, 'kernel': 'Exponential', 'loss_name': 'NLLLoss'}. Best is trial 367 with value: 0.8756446640888914.[0m
[32m[I 2022-04-17 05:45:17,470][0m Trial 513 finished with value: 0.8460816956986994 and parameters: {'n_hidden': 64, 'mixture_components': 7, 'use_sparse_layer': False, 'use_batchnorm': True, 'use_dropout': True, 'dropout': 0.611596821758308, 'mlp_size_1': 0, 'mlp_size_2': 2, 'mlp_size_3': 0, 'kernel': 'LogNormal', 'loss_name': 'NLLLoss'}. Best is trial 367 with value: 0.8756446640888914.[0m
[32m[I 2022-04-17 05:50:57,711][0m Trial 514 finished with value: 0.8629394604877276 and parameters: {'n_hidden': 32, 'mixture_components': 3, 'use_sparse_layer': False, 'use_batchnorm': True, 'use_dropout': True, 'dropout': 0.7456151287525489, 'mlp_size_1': 0, 'mlp_size_2': 2, 'mlp_size_3': 0, 'kernel': 'Exponential', 'loss_name': 'NLLLoss'}. Best is trial 367 with value: 0.8756446640888914.[0m
[32m[I 2022-04-17 05:55:44,162][0m Trial 515 finished with value: 0.8678060024746899 and parameters: {'n_hidden': 64, 'mixture_components': 3, 'use_sparse_layer': False, 'use_batchnorm': True, 'use_dropout': True, 'dropout': 0.6388564399519345, 'mlp_size_1': 0, 'mlp_size_2': 2, 'mlp_size_3': 0, 'kernel': 'Exponential', 'loss_name': 'NLLLoss'}. Best is trial 367 with value: 0.8756446640888914.[0m
[32m[I 2022-04-17 06:01:21,210][0m Trial 516 finished with value: 0.8646298396830782 and parameters: {'n_hidden': 64, 'mixture_components': 4, 'use_sparse_layer': False, 'use_batchnorm': True, 'use_dropout': True, 'dropout': 0.7893984485743093, 'mlp_size_1': 0, 'mlp_size_2': 2, 'mlp_size_3': 0, 'kernel': 'Exponential', 'loss_name': 'NLLLoss'}. Best is trial 367 with value: 0.8756446640888914.[0m
[32m[I 2022-04-17 06:06:24,994][0m Trial 517 finished with value: 0.8540327389433834 and parameters: {'n_hidden': 64, 'mixture_components': 3, 'use_sparse_layer': False, 'use_batchnorm': True, 'use_dropout': True, 'dropout': 0.7164781001914065, 'mlp_size_1': 0, 'mlp_size_2': 2, 'mlp_size_3': 0, 'kernel': 'Exponential', 'loss_name': 'NLLLoss'}. Best is trial 367 with value: 0.8756446640888914.[0m
[32m[I 2022-04-17 06:11:01,529][0m Trial 518 finished with value: 0.7535864149051903 and parameters: {'n_hidden': 256, 'mixture_components': 4, 'use_sparse_layer': False, 'use_batchnorm': True, 'use_dropout': True, 'dropout': 0.5857839345996074, 'mlp_size_1': 0, 'mlp_size_2': 2, 'mlp_size_3': 2, 'kernel': 'Exponential', 'loss_name': 'NLLLoss'}. Best is trial 367 with value: 0.8756446640888914.[0m
[32m[I 2022-04-17 06:18:18,090][0m Trial 519 finished with value: 0.8586751576890833 and parameters: {'n_hidden': 64, 'mixture_components': 3, 'use_sparse_layer': False, 'use_batchnorm': True, 'use_dropout': True, 'dropout': 0.8295933557504634, 'mlp_size_1': 0, 'mlp_size_2': 2, 'mlp_size_3': 0, 'kernel': 'Exponential', 'loss_name': 'AlternativeNLLLoss'}. Best is trial 367 with value: 0.8756446640888914.[0m
[32m[I 2022-04-17 06:23:22,807][0m Trial 520 finished with value: 0.849289310538689 and parameters: {'n_hidden': 64, 'mixture_components': 5, 'use_sparse_layer': False, 'use_batchnorm': True, 'use_dropout': True, 'dropout': 0.7437248817287923, 'mlp_size_1': 0, 'mlp_size_2': 2, 'mlp_size_3': 0, 'kernel': 'Logistic', 'loss_name': 'NLLLoss'}. Best is trial 367 with value: 0.8756446640888914.[0m
[32m[I 2022-04-17 06:28:50,095][0m Trial 521 finished with value: 0.858559728687978 and parameters: {'n_hidden': 64, 'mixture_components': 3, 'use_sparse_layer': True, 'use_sparse_loss': False, 'use_batchnorm': True, 'use_dropout': True, 'dropout': 0.7004428688783206, 'mlp_size_1': 0, 'mlp_size_2': 2, 'mlp_size_3': 0, 'kernel': 'Exponential', 'loss_name': 'NLLLoss'}. Best is trial 367 with value: 0.8756446640888914.[0m
[32m[I 2022-04-17 06:29:44,075][0m Trial 522 finished with value: -0.5 and parameters: {'n_hidden': 64, 'mixture_components': 5, 'use_sparse_layer': False, 'use_batchnorm': True, 'use_dropout': True, 'dropout': 0.8145992394964463, 'mlp_size_1': 0, 'mlp_size_2': 2, 'mlp_size_3': 0, 'kernel': 'Gumbel', 'loss_name': 'NLLLoss'}. Best is trial 367 with value: 0.8756446640888914.[0m
[32m[I 2022-04-17 06:35:22,576][0m Trial 523 finished with value: 0.8700763985385231 and parameters: {'n_hidden': 64, 'mixture_components': 7, 'use_sparse_layer': False, 'use_batchnorm': True, 'use_dropout': True, 'dropout': 0.6466917965548583, 'mlp_size_1': 0, 'mlp_size_2': 2, 'mlp_size_3': 0, 'kernel': 'Exponential', 'loss_name': 'NLLLoss'}. Best is trial 367 with value: 0.8756446640888914.[0m
[32m[I 2022-04-17 06:41:06,476][0m Trial 524 finished with value: 0.86440126944092 and parameters: {'n_hidden': 32, 'mixture_components': 7, 'use_sparse_layer': False, 'use_batchnorm': True, 'use_dropout': True, 'dropout': 0.6304114310633159, 'mlp_size_1': 0, 'mlp_size_2': 2, 'mlp_size_3': 0, 'kernel': 'Exponential', 'loss_name': 'NLLLoss'}. Best is trial 367 with value: 0.8756446640888914.[0m
[32m[I 2022-04-17 06:41:58,580][0m Trial 525 finished with value: 0.3010336015458147 and parameters: {'n_hidden': 64, 'mixture_components': 7, 'use_sparse_layer': False, 'use_batchnorm': True, 'use_dropout': True, 'dropout': 0.9998354077929619, 'mlp_size_1': 0, 'mlp_size_2': 2, 'mlp_size_3': 0, 'kernel': 'Exponential', 'loss_name': 'NLLLoss'}. Best is trial 367 with value: 0.8756446640888914.[0m
[32m[I 2022-04-17 06:46:45,403][0m Trial 526 finished with value: 0.8632894056259677 and parameters: {'n_hidden': 64, 'mixture_components': 7, 'use_sparse_layer': False, 'use_batchnorm': True, 'use_dropout': True, 'dropout': 0.6423349712138899, 'mlp_size_1': 0, 'mlp_size_2': 2, 'mlp_size_3': 0, 'kernel': 'Exponential', 'loss_name': 'NLLLoss'}. Best is trial 367 with value: 0.8756446640888914.[0m
[32m[I 2022-04-17 06:51:35,615][0m Trial 527 finished with value: 0.8650505806729754 and parameters: {'n_hidden': 64, 'mixture_components': 7, 'use_sparse_layer': False, 'use_batchnorm': True, 'use_dropout': True, 'dropout': 0.6094328148855936, 'mlp_size_1': 0, 'mlp_size_2': 2, 'mlp_size_3': 0, 'kernel': 'Exponential', 'loss_name': 'NLLLoss'}. Best is trial 367 with value: 0.8756446640888914.[0m
[32m[I 2022-04-17 06:55:25,651][0m Trial 528 finished with value: 0.7492260746768633 and parameters: {'n_hidden': 64, 'mixture_components': 7, 'use_sparse_layer': False, 'use_batchnorm': True, 'use_dropout': True, 'dropout': 0.6520271502912285, 'mlp_size_1': 0, 'mlp_size_2': 2, 'mlp_size_3': 0, 'kernel': 'LogLogistic', 'loss_name': 'NLLLoss'}. Best is trial 367 with value: 0.8756446640888914.[0m
[32m[I 2022-04-17 06:56:26,728][0m Trial 529 finished with value: 0.7315444288230918 and parameters: {'n_hidden': 2048, 'mixture_components': 7, 'use_sparse_layer': False, 'use_batchnorm': False, 'use_dropout': True, 'dropout': 0.5976180460265513, 'mlp_size_1': 1, 'mlp_size_2': 2, 'mlp_size_3': 0, 'kernel': 'Exponential', 'loss_name': 'NLLLoss'}. Best is trial 367 with value: 0.8756446640888914.[0m
[32m[I 2022-04-17 07:01:59,541][0m Trial 530 finished with value: 0.8729782442692222 and parameters: {'n_hidden': 64, 'mixture_components': 7, 'use_sparse_layer': False, 'use_batchnorm': True, 'use_dropout': True, 'dropout': 0.673013238875797, 'mlp_size_1': 0, 'mlp_size_2': 2, 'mlp_size_3': 0, 'kernel': 'Exponential', 'loss_name': 'NLLLoss'}. Best is trial 367 with value: 0.8756446640888914.[0m
[32m[I 2022-04-17 07:05:22,064][0m Trial 531 finished with value: 0.8372096235398889 and parameters: {'n_hidden': 64, 'mixture_components': 7, 'use_sparse_layer': False, 'use_batchnorm': True, 'use_dropout': False, 'mlp_size_1': 0, 'mlp_size_2': 2, 'mlp_size_3': 0, 'kernel': 'Exponential', 'loss_name': 'NLLLoss'}. Best is trial 367 with value: 0.8756446640888914.[0m
[32m[I 2022-04-17 07:09:54,550][0m Trial 532 finished with value: 0.8578919219946514 and parameters: {'n_hidden': 256, 'mixture_components': 5, 'use_sparse_layer': False, 'use_batchnorm': True, 'use_dropout': True, 'dropout': 0.6699663399721805, 'mlp_size_1': 0, 'mlp_size_2': 2, 'mlp_size_3': 0, 'kernel': 'Exponential', 'loss_name': 'NLLLoss'}. Best is trial 367 with value: 0.8756446640888914.[0m
[32m[I 2022-04-17 07:17:00,483][0m Trial 533 finished with value: 0.8544794196885807 and parameters: {'n_hidden': 64, 'mixture_components': 5, 'use_sparse_layer': False, 'use_batchnorm': True, 'use_dropout': True, 'dropout': 0.677858767078746, 'mlp_size_1': 0, 'mlp_size_2': 2, 'mlp_size_3': 0, 'kernel': 'Exponential', 'loss_name': 'CensoredNLLLoss'}. Best is trial 367 with value: 0.8756446640888914.[0m
