[32m[I 2022-04-14 04:05:37,970][0m Trial 2 finished with value: 0.35256979699257607 and parameters: {'loss': 'squared', 'learning_rate': 5.066652266409493e-05, 'n_estimators': 227, 'criterion': 'squared_error', 'min_samples_split': 2, 'min_samples_leaf': 7, 'min_weight_fraction_leaf': 0.20493400684231777, 'min_impurity_decrease': 0.8590796436085029, 'max_features': 0.40742667684508727, 'subsample': 0.72590478669677, 'dropout_rate': 0.9537481445929359, 'ccp_alpha': 0.4276021547370386}. Best is trial 0 with value: 0.5.[0m
[32m[I 2022-04-14 04:05:39,452][0m Trial 3 finished with value: 0.5 and parameters: {'loss': 'squared', 'learning_rate': 0.040659651190061576, 'n_estimators': 111, 'criterion': 'friedman_mse', 'min_samples_split': 3, 'min_samples_leaf': 4, 'min_weight_fraction_leaf': 0.04006403339698281, 'min_impurity_decrease': 0.18550818500198735, 'max_features': 0.2603384860480357, 'subsample': 0.6056127593521913, 'dropout_rate': 0.4194144667616696, 'ccp_alpha': 3.061243457152674}. Best is trial 0 with value: 0.5.[0m
[32m[I 2022-04-14 04:05:41,796][0m Trial 4 finished with value: 0.5 and parameters: {'loss': 'coxph', 'learning_rate': 5.141851384222147e-06, 'n_estimators': 128, 'criterion': 'friedman_mse', 'min_samples_split': 9, 'min_samples_leaf': 10, 'min_weight_fraction_leaf': 0.0036768796862155116, 'min_impurity_decrease': 0.553192513687827, 'max_features': 0.6953627897225901, 'subsample': 0.5276397450909901, 'dropout_rate': 0.41484834773430823, 'ccp_alpha': 1.0095758922759386}. Best is trial 0 with value: 0.5.[0m
[32m[I 2022-04-14 04:08:44,121][0m Trial 5 finished with value: 0.5 and parameters: {'loss': 'squared', 'learning_rate': 0.00019988696320198863, 'n_estimators': 963, 'criterion': 'friedman_mse', 'min_samples_split': 10, 'min_samples_leaf': 10, 'min_weight_fraction_leaf': 0.010096935048911765, 'min_impurity_decrease': 0.9028948744530181, 'max_features': 0.5888897383114123, 'subsample': 0.24702179718138406, 'dropout_rate': 0.06145617846412332, 'ccp_alpha': 4.868389934444485}. Best is trial 0 with value: 0.5.[0m
[32m[I 2022-04-14 04:08:48,850][0m Trial 6 finished with value: 0.5 and parameters: {'loss': 'squared', 'learning_rate': 0.04345435005485212, 'n_estimators': 206, 'criterion': 'squared_error', 'min_samples_split': 8, 'min_samples_leaf': 3, 'min_weight_fraction_leaf': 0.06575696656770322, 'min_impurity_decrease': 0.6659086776741914, 'max_features': 0.473659388241696, 'subsample': 0.6928652707412669, 'dropout_rate': 0.536785799763325, 'ccp_alpha': 3.3624591428852937}. Best is trial 0 with value: 0.5.[0m
[32m[I 2022-04-14 04:08:53,156][0m Trial 7 finished with value: 0.5 and parameters: {'loss': 'coxph', 'learning_rate': 0.00034649270453091354, 'n_estimators': 161, 'criterion': 'squared_error', 'min_samples_split': 6, 'min_samples_leaf': 7, 'min_weight_fraction_leaf': 0.31727530071550525, 'min_impurity_decrease': 0.6632710763993946, 'max_features': 0.011036038244719805, 'subsample': 0.37761929621996776, 'dropout_rate': 0.36486408631598244, 'ccp_alpha': 1.0892760979065959}. Best is trial 0 with value: 0.5.[0m
[32m[I 2022-04-14 04:08:56,224][0m Trial 8 finished with value: 0.5 and parameters: {'loss': 'coxph', 'learning_rate': 4.2517292218763265e-05, 'n_estimators': 134, 'criterion': 'friedman_mse', 'min_samples_split': 7, 'min_samples_leaf': 4, 'min_weight_fraction_leaf': 0.06658904849751032, 'min_impurity_decrease': 0.41533249925269405, 'max_features': 0.8208776891273619, 'subsample': 0.846095512765777, 'dropout_rate': 0.0378960468331383, 'ccp_alpha': 2.8935934719327783}. Best is trial 0 with value: 0.5.[0m
[32m[I 2022-04-14 04:09:29,032][0m Trial 9 finished with value: 0.5 and parameters: {'loss': 'coxph', 'learning_rate': 1.2687331099017196e-05, 'n_estimators': 443, 'criterion': 'squared_error', 'min_samples_split': 7, 'min_samples_leaf': 6, 'min_weight_fraction_leaf': 0.008164289816795144, 'min_impurity_decrease': 0.7728564561849351, 'max_features': 0.9230813628130263, 'subsample': 0.5078540117508239, 'dropout_rate': 0.22512546347138296, 'ccp_alpha': 0.869366979877747}. Best is trial 0 with value: 0.5.[0m
[32m[I 2022-04-14 04:09:52,397][0m Trial 10 finished with value: 0.5 and parameters: {'loss': 'coxph', 'learning_rate': 0.0027895205483983395, 'n_estimators': 546, 'criterion': 'absolute_error', 'min_samples_split': 5, 'min_samples_leaf': 1, 'min_weight_fraction_leaf': 0.45453031291654344, 'min_impurity_decrease': 0.3131979484665562, 'max_features': 0.22366055246449287, 'subsample': 0.9505098900664064, 'dropout_rate': 0.6837449434851751, 'ccp_alpha': 2.030346992659431}. Best is trial 0 with value: 0.5.[0m
[32m[I 2022-04-14 04:09:57,254][0m Trial 11 finished with value: 0.5 and parameters: {'loss': 'coxph', 'learning_rate': 1.4267198708646825e-06, 'n_estimators': 376, 'criterion': 'absolute_error', 'min_samples_split': 4, 'min_samples_leaf': 1, 'min_weight_fraction_leaf': 0.22993231621392984, 'min_impurity_decrease': 0.03282325483268604, 'max_features': 0.6270223977831344, 'subsample': 0.03957231997878807, 'dropout_rate': 0.9919916807003767, 'ccp_alpha': 1.907301742586096}. Best is trial 0 with value: 0.5.[0m
[32m[I 2022-04-14 04:10:02,615][0m Trial 12 finished with value: 0.5 and parameters: {'loss': 'coxph', 'learning_rate': 0.0021959936802723725, 'n_estimators': 286, 'criterion': 'friedman_mse', 'min_samples_split': 2, 'min_samples_leaf': 2, 'min_weight_fraction_leaf': 0.15475465400402114, 'min_impurity_decrease': 0.017510316642752502, 'max_features': 0.33693447015433237, 'subsample': 0.039606258206966616, 'dropout_rate': 0.7858458907513197, 'ccp_alpha': 4.222741551234535}. Best is trial 0 with value: 0.5.[0m
[32m[I 2022-04-14 04:10:31,308][0m Trial 13 finished with value: 0.5 and parameters: {'loss': 'coxph', 'learning_rate': 0.0006809307120372111, 'n_estimators': 708, 'criterion': 'squared_error', 'min_samples_split': 10, 'min_samples_leaf': 4, 'min_weight_fraction_leaf': 0.33199430517796624, 'min_impurity_decrease': 0.1880585930385712, 'max_features': 0.7560323764340859, 'subsample': 0.3035080691927192, 'dropout_rate': 0.805928120883155, 'ccp_alpha': 1.765903695870994}. Best is trial 0 with value: 0.5.[0m
[32m[I 2022-04-14 04:10:36,602][0m Trial 14 finished with value: 0.6904646411948652 and parameters: {'loss': 'coxph', 'learning_rate': 3.016671507273745e-05, 'n_estimators': 280, 'criterion': 'absolute_error', 'min_samples_split': 4, 'min_samples_leaf': 2, 'min_weight_fraction_leaf': 0.14590016650282822, 'min_impurity_decrease': 0.1811424213139104, 'max_features': 0.5408201686047442, 'subsample': 0.20908116819154798, 'dropout_rate': 0.8362041390835108, 'ccp_alpha': 0.0853373830812948}. Best is trial 14 with value: 0.6904646411948652.[0m
[32m[I 2022-04-14 04:10:43,460][0m Trial 15 finished with value: 0.5 and parameters: {'loss': 'coxph', 'learning_rate': 8.198763627581864e-05, 'n_estimators': 265, 'criterion': 'absolute_error', 'min_samples_split': 5, 'min_samples_leaf': 2, 'min_weight_fraction_leaf': 0.320480371978873, 'min_impurity_decrease': 0.2770974971036081, 'max_features': 0.1330641400084247, 'subsample': 0.9933661473370655, 'dropout_rate': 0.6648491149065617, 'ccp_alpha': 0.17754365273936307}. Best is trial 14 with value: 0.6904646411948652.[0m
[32m[I 2022-04-14 04:10:44,679][0m Trial 16 finished with value: 0.7216438720331207 and parameters: {'loss': 'coxph', 'learning_rate': 0.007347618759965104, 'n_estimators': 180, 'criterion': 'absolute_error', 'min_samples_split': 4, 'min_samples_leaf': 1, 'min_weight_fraction_leaf': 0.1412657439898844, 'min_impurity_decrease': 0.13452091265036742, 'max_features': 0.44776430117849947, 'subsample': 0.3779358541516669, 'dropout_rate': 0.9400374995387906, 'ccp_alpha': 0.0659059106063129}. Best is trial 16 with value: 0.7216438720331207.[0m
[32m[I 2022-04-14 04:10:46,759][0m Trial 17 finished with value: 0.5 and parameters: {'loss': 'coxph', 'learning_rate': 0.0060051192250843025, 'n_estimators': 195, 'criterion': 'absolute_error', 'min_samples_split': 4, 'min_samples_leaf': 2, 'min_weight_fraction_leaf': 0.13828089492055323, 'min_impurity_decrease': 0.4105900081696934, 'max_features': 0.9967223240916643, 'subsample': 0.3844742806980051, 'dropout_rate': 0.8652602386434801, 'ccp_alpha': 0.10959443175582961}. Best is trial 16 with value: 0.7216438720331207.[0m
[32m[I 2022-04-14 04:10:50,025][0m Trial 18 finished with value: 0.5 and parameters: {'loss': 'squared', 'learning_rate': 0.012051044720407657, 'n_estimators': 170, 'criterion': 'absolute_error', 'min_samples_split': 4, 'min_samples_leaf': 3, 'min_weight_fraction_leaf': 0.14946550881308787, 'min_impurity_decrease': 0.16225506943376308, 'max_features': 0.3439982026368201, 'subsample': 0.15414265213413653, 'dropout_rate': 0.6345385894595498, 'ccp_alpha': 1.580646848130069}. Best is trial 16 with value: 0.7216438720331207.[0m
[32m[I 2022-04-14 04:10:53,224][0m Trial 19 finished with value: 0.5 and parameters: {'loss': 'coxph', 'learning_rate': 0.017165573011845913, 'n_estimators': 241, 'criterion': 'absolute_error', 'min_samples_split': 5, 'min_samples_leaf': 6, 'min_weight_fraction_leaf': 0.4957895563092108, 'min_impurity_decrease': 0.3071105629673465, 'max_features': 0.5952713641576362, 'subsample': 0.3850569282623055, 'dropout_rate': 0.8934317636715424, 'ccp_alpha': 0.003576563010997194}. Best is trial 16 with value: 0.7216438720331207.[0m
[32m[I 2022-04-14 04:11:10,240][0m Trial 20 finished with value: 0.6395310134632811 and parameters: {'loss': 'coxph', 'learning_rate': 0.001321070557456316, 'n_estimators': 485, 'criterion': 'absolute_error', 'min_samples_split': 3, 'min_samples_leaf': 3, 'min_weight_fraction_leaf': 0.11419488217515844, 'min_impurity_decrease': 0.41984395778741734, 'max_features': 0.6887238406076903, 'subsample': 0.1340289093225338, 'dropout_rate': 0.7354410982262338, 'ccp_alpha': 0.5854239375216457}. Best is trial 16 with value: 0.7216438720331207.[0m
[32m[I 2022-04-14 04:11:32,854][0m Trial 21 finished with value: 0.6917459202254415 and parameters: {'loss': 'coxph', 'learning_rate': 0.0010293314052344407, 'n_estimators': 528, 'criterion': 'absolute_error', 'min_samples_split': 3, 'min_samples_leaf': 3, 'min_weight_fraction_leaf': 0.12533813025095888, 'min_impurity_decrease': 0.4683919415343219, 'max_features': 0.6993063745376221, 'subsample': 0.11045649718203195, 'dropout_rate': 0.7273553221753715, 'ccp_alpha': 0.5299424117058136}. Best is trial 16 with value: 0.7216438720331207.[0m
[32m[I 2022-04-14 04:12:10,149][0m Trial 22 finished with value: 0.5 and parameters: {'loss': 'coxph', 'learning_rate': 0.005401726241118726, 'n_estimators': 561, 'criterion': 'absolute_error', 'min_samples_split': 3, 'min_samples_leaf': 2, 'min_weight_fraction_leaf': 0.19085428259715087, 'min_impurity_decrease': 0.563691250270368, 'max_features': 0.8317015951639579, 'subsample': 0.2908445886780153, 'dropout_rate': 0.5651098154809324, 'ccp_alpha': 1.4196999368548187}. Best is trial 16 with value: 0.7216438720331207.[0m
[32m[I 2022-04-14 04:12:35,613][0m Trial 23 finished with value: 0.6975421466619176 and parameters: {'loss': 'coxph', 'learning_rate': 0.09218837278690695, 'n_estimators': 773, 'criterion': 'absolute_error', 'min_samples_split': 4, 'min_samples_leaf': 1, 'min_weight_fraction_leaf': 0.10603920019006477, 'min_impurity_decrease': 0.12063954645327088, 'max_features': 0.5488449852446763, 'subsample': 0.10788959983211646, 'dropout_rate': 0.9122570924772683, 'ccp_alpha': 0.33195467361542164}. Best is trial 16 with value: 0.7216438720331207.[0m
[32m[I 2022-04-14 04:12:58,171][0m Trial 24 finished with value: 0.6361683247037391 and parameters: {'loss': 'coxph', 'learning_rate': 0.02224096582514641, 'n_estimators': 769, 'criterion': 'absolute_error', 'min_samples_split': 6, 'min_samples_leaf': 1, 'min_weight_fraction_leaf': 0.09943289988433994, 'min_impurity_decrease': 0.11256487204268907, 'max_features': 0.687145384318932, 'subsample': 0.07993728232038066, 'dropout_rate': 0.9225439151594117, 'ccp_alpha': 0.6085389858315055}. Best is trial 16 with value: 0.7216438720331207.[0m
[32m[I 2022-04-14 04:13:40,283][0m Trial 25 finished with value: 0.5 and parameters: {'loss': 'coxph', 'learning_rate': 0.08093307303540782, 'n_estimators': 731, 'criterion': 'absolute_error', 'min_samples_split': 3, 'min_samples_leaf': 5, 'min_weight_fraction_leaf': 0.2780724903510551, 'min_impurity_decrease': 0.26593344248789497, 'max_features': 0.3987550248308471, 'subsample': 0.11054312817476067, 'dropout_rate': 0.7270074967606551, 'ccp_alpha': 1.4289729124601547}. Best is trial 16 with value: 0.7216438720331207.[0m
[32m[I 2022-04-14 04:15:25,343][0m Trial 26 finished with value: 0.5 and parameters: {'loss': 'squared', 'learning_rate': 0.006400125226139192, 'n_estimators': 983, 'criterion': 'absolute_error', 'min_samples_split': 5, 'min_samples_leaf': 1, 'min_weight_fraction_leaf': 0.1915536993339922, 'min_impurity_decrease': 0.3354289203496692, 'max_features': 0.7991455539766786, 'subsample': 0.011596047159528208, 'dropout_rate': 0.607364393577959, 'ccp_alpha': 0.5118960793759816}. Best is trial 16 with value: 0.7216438720331207.[0m
[32m[I 2022-04-14 04:15:41,334][0m Trial 27 finished with value: 0.5 and parameters: {'loss': 'coxph', 'learning_rate': 0.0699805502117456, 'n_estimators': 564, 'criterion': 'absolute_error', 'min_samples_split': 6, 'min_samples_leaf': 3, 'min_weight_fraction_leaf': 0.10968984663138012, 'min_impurity_decrease': 0.4993341192298168, 'max_features': 0.49708591799025925, 'subsample': 0.447856903510676, 'dropout_rate': 0.8948088050965641, 'ccp_alpha': 1.225812596556858}. Best is trial 16 with value: 0.7216438720331207.[0m
[32m[I 2022-04-14 04:16:24,161][0m Trial 28 finished with value: 0.5 and parameters: {'loss': 'coxph', 'learning_rate': 0.0014716121724462127, 'n_estimators': 654, 'criterion': 'absolute_error', 'min_samples_split': 3, 'min_samples_leaf': 5, 'min_weight_fraction_leaf': 0.16902762468931135, 'min_impurity_decrease': 0.08588536822977277, 'max_features': 0.6414988388362173, 'subsample': 0.28812801953353184, 'dropout_rate': 0.7162933333752578, 'ccp_alpha': 0.698453535822113}. Best is trial 16 with value: 0.7216438720331207.[0m
[32m[I 2022-04-14 04:16:44,727][0m Trial 29 finished with value: 0.5 and parameters: {'loss': 'coxph', 'learning_rate': 0.0006808994232436771, 'n_estimators': 842, 'criterion': 'absolute_error', 'min_samples_split': 4, 'min_samples_leaf': 1, 'min_weight_fraction_leaf': 0.21278540255682277, 'min_impurity_decrease': 0.6722511056575817, 'max_features': 0.4485187795386342, 'subsample': 0.22623680333047497, 'dropout_rate': 0.9831853008018717, 'ccp_alpha': 0.3259587320972647}. Best is trial 16 with value: 0.7216438720331207.[0m
[32m[I 2022-04-14 04:16:59,115][0m Trial 30 finished with value: 0.5 and parameters: {'loss': 'coxph', 'learning_rate': 0.013729093170703147, 'n_estimators': 415, 'criterion': 'absolute_error', 'min_samples_split': 2, 'min_samples_leaf': 9, 'min_weight_fraction_leaf': 0.24428076512307526, 'min_impurity_decrease': 0.36846296284729835, 'max_features': 0.7565976593053433, 'subsample': 0.5844598897737262, 'dropout_rate': 0.7729175158891228, 'ccp_alpha': 0.9083514779492049}. Best is trial 16 with value: 0.7216438720331207.[0m
[32m[I 2022-04-14 04:17:06,428][0m Trial 31 finished with value: 0.7088273472842269 and parameters: {'loss': 'coxph', 'learning_rate': 0.00019900176759056763, 'n_estimators': 315, 'criterion': 'absolute_error', 'min_samples_split': 4, 'min_samples_leaf': 2, 'min_weight_fraction_leaf': 0.1184534762065393, 'min_impurity_decrease': 0.23068812991406784, 'max_features': 0.5715104002011229, 'subsample': 0.19990273309535633, 'dropout_rate': 0.8403036931959316, 'ccp_alpha': 0.007842082689094754}. Best is trial 16 with value: 0.7216438720331207.[0m
[32m[I 2022-04-14 04:17:11,787][0m Trial 32 finished with value: 0.6866385173440586 and parameters: {'loss': 'coxph', 'learning_rate': 0.00013131567284522887, 'n_estimators': 328, 'criterion': 'absolute_error', 'min_samples_split': 4, 'min_samples_leaf': 2, 'min_weight_fraction_leaf': 0.11601472701081887, 'min_impurity_decrease': 0.24928108925872114, 'max_features': 0.5407683657726101, 'subsample': 0.1518362290476924, 'dropout_rate': 0.9253062420559319, 'ccp_alpha': 0.33252002907832673}. Best is trial 16 with value: 0.7216438720331207.[0m
[32m[I 2022-04-14 04:17:19,039][0m Trial 33 finished with value: 0.6804358427399683 and parameters: {'loss': 'coxph', 'learning_rate': 0.00045382256981924864, 'n_estimators': 363, 'criterion': 'absolute_error', 'min_samples_split': 3, 'min_samples_leaf': 1, 'min_weight_fraction_leaf': 0.054084548383261336, 'min_impurity_decrease': 0.06884051701404187, 'max_features': 0.41045054128540154, 'subsample': 0.07326935401323068, 'dropout_rate': 0.8529646831954575, 'ccp_alpha': 0.014626584824067645}. Best is trial 16 with value: 0.7216438720331207.[0m
[32m[I 2022-04-14 04:17:24,488][0m Trial 34 finished with value: 0.5 and parameters: {'loss': 'coxph', 'learning_rate': 0.0038507670362962865, 'n_estimators': 481, 'criterion': 'absolute_error', 'min_samples_split': 2, 'min_samples_leaf': 3, 'min_weight_fraction_leaf': 0.09852812698301994, 'min_impurity_decrease': 0.9870093635122031, 'max_features': 0.5466397311197055, 'subsample': 0.1895835305761556, 'dropout_rate': 0.9941931768526628, 'ccp_alpha': 2.4482386107505816}. Best is trial 16 with value: 0.7216438720331207.[0m
[32m[I 2022-04-14 04:17:44,114][0m Trial 35 finished with value: 0.5 and parameters: {'loss': 'squared', 'learning_rate': 0.0007532479157398919, 'n_estimators': 605, 'criterion': 'absolute_error', 'min_samples_split': 5, 'min_samples_leaf': 2, 'min_weight_fraction_leaf': 0.04438325997275201, 'min_impurity_decrease': 0.11439050647608502, 'max_features': 0.3317920218750099, 'subsample': 0.3159394923580898, 'dropout_rate': 0.8269583871880475, 'ccp_alpha': 0.7475942498816786}. Best is trial 16 with value: 0.7216438720331207.[0m
[32m[I 2022-04-14 04:18:08,511][0m Trial 36 finished with value: 0.5 and parameters: {'loss': 'coxph', 'learning_rate': 0.00013379585975565987, 'n_estimators': 848, 'criterion': 'absolute_error', 'min_samples_split': 3, 'min_samples_leaf': 1, 'min_weight_fraction_leaf': 0.07942470584070208, 'min_impurity_decrease': 0.22612267288778082, 'max_features': 0.6440777575426582, 'subsample': 0.44510152111988693, 'dropout_rate': 0.9388923363271051, 'ccp_alpha': 0.4121400063897792}. Best is trial 16 with value: 0.7216438720331207.[0m
[32m[I 2022-04-14 04:18:10,056][0m Trial 37 finished with value: 0.32049055007955585 and parameters: {'loss': 'squared', 'learning_rate': 0.03534402294774546, 'n_estimators': 113, 'criterion': 'friedman_mse', 'min_samples_split': 2, 'min_samples_leaf': 3, 'min_weight_fraction_leaf': 0.27670964878193505, 'min_impurity_decrease': 0.14292824484975958, 'max_features': 0.4539148211100896, 'subsample': 0.11784715434955415, 'dropout_rate': 0.495237002317815, 'ccp_alpha': 1.2027539177264326}. Best is trial 16 with value: 0.7216438720331207.[0m
[32m[I 2022-04-14 04:18:17,427][0m Trial 38 finished with value: 0.7079985900999454 and parameters: {'loss': 'coxph', 'learning_rate': 0.009377819343150622, 'n_estimators': 323, 'criterion': 'squared_error', 'min_samples_split': 4, 'min_samples_leaf': 4, 'min_weight_fraction_leaf': 0.1782920344101518, 'min_impurity_decrease': 0.21687998870676017, 'max_features': 0.5813647512490814, 'subsample': 0.23358868536607238, 'dropout_rate': 0.7619939264967477, 'ccp_alpha': 0.357647694704615}. Best is trial 16 with value: 0.7216438720331207.[0m
[32m[I 2022-04-14 04:18:20,776][0m Trial 39 finished with value: 0.5 and parameters: {'loss': 'coxph', 'learning_rate': 0.03018467350176953, 'n_estimators': 149, 'criterion': 'squared_error', 'min_samples_split': 7, 'min_samples_leaf': 4, 'min_weight_fraction_leaf': 0.1726990188350953, 'min_impurity_decrease': 0.218899388132485, 'max_features': 0.2651129969558565, 'subsample': 0.24156890046569165, 'dropout_rate': 0.2861105032547153, 'ccp_alpha': 3.9284902777694417}. Best is trial 16 with value: 0.7216438720331207.[0m
[32m[I 2022-04-14 04:18:21,706][0m Trial 40 finished with value: 0.5 and parameters: {'loss': 'squared', 'learning_rate': 0.09621004032389668, 'n_estimators': 102, 'criterion': 'squared_error', 'min_samples_split': 5, 'min_samples_leaf': 8, 'min_weight_fraction_leaf': 0.0301320476778775, 'min_impurity_decrease': 0.05137343041284266, 'max_features': 0.5874523990677505, 'subsample': 0.3466274515974841, 'dropout_rate': 0.7770215465325965, 'ccp_alpha': 2.854694870737055}. Best is trial 16 with value: 0.7216438720331207.[0m
[32m[I 2022-04-14 04:18:27,712][0m Trial 41 finished with value: 0.6679357252468541 and parameters: {'loss': 'coxph', 'learning_rate': 0.000292474824631624, 'n_estimators': 322, 'criterion': 'squared_error', 'min_samples_split': 4, 'min_samples_leaf': 4, 'min_weight_fraction_leaf': 0.1293391098461832, 'min_impurity_decrease': 0.5213520899081476, 'max_features': 0.7520959650944457, 'subsample': 0.26157932046526, 'dropout_rate': 0.8678811103905347, 'ccp_alpha': 0.38989880606915733}. Best is trial 16 with value: 0.7216438720331207.[0m
[32m[I 2022-04-14 04:18:30,447][0m Trial 42 finished with value: 0.5928051828294632 and parameters: {'loss': 'coxph', 'learning_rate': 0.008510095145340549, 'n_estimators': 206, 'criterion': 'squared_error', 'min_samples_split': 3, 'min_samples_leaf': 2, 'min_weight_fraction_leaf': 0.08371821961143416, 'min_impurity_decrease': 0.14967139270552815, 'max_features': 0.5095440842241422, 'subsample': 0.18200492745375374, 'dropout_rate': 0.9500197437906567, 'ccp_alpha': 0.8886119794878605}. Best is trial 16 with value: 0.7216438720331207.[0m
