[32m[I 2022-04-13 11:45:33,144][0m Trial 322 finished with value: 0.6405572646788725 and parameters: {'splitter': 'best', 'min_samples_split': 0.328957456530152, 'min_samples_leaf': 0.017136076088591596, 'min_weight_fraction_leaf': 0.11134986465963967, 'max_features': 0.4363127844848544}. Best is trial 163 with value: 0.7137418010284807.[0m
[32m[I 2022-04-13 11:45:33,214][0m Trial 323 finished with value: 0.7030519614506526 and parameters: {'splitter': 'best', 'min_samples_split': 0.3050343048787683, 'min_samples_leaf': 0.002097781612231897, 'min_weight_fraction_leaf': 0.09929106488349061, 'max_features': 0.5167348146872154}. Best is trial 163 with value: 0.7137418010284807.[0m
[32m[I 2022-04-13 11:45:33,300][0m Trial 324 finished with value: 0.7137418010284807 and parameters: {'splitter': 'best', 'min_samples_split': 0.3248166407238751, 'min_samples_leaf': 0.017322143995097544, 'min_weight_fraction_leaf': 0.10137716194433209, 'max_features': 0.5523347141664731}. Best is trial 163 with value: 0.7137418010284807.[0m
[32m[I 2022-04-13 11:45:33,370][0m Trial 325 finished with value: 0.6989673695016856 and parameters: {'splitter': 'best', 'min_samples_split': 0.3460019500359162, 'min_samples_leaf': 0.020254766731111883, 'min_weight_fraction_leaf': 0.1009388268163691, 'max_features': 0.5526474252984249}. Best is trial 163 with value: 0.7137418010284807.[0m
[32m[I 2022-04-13 11:45:33,431][0m Trial 326 finished with value: 0.6920012331415456 and parameters: {'splitter': 'best', 'min_samples_split': 0.28988399719787594, 'min_samples_leaf': 0.0011157610347756952, 'min_weight_fraction_leaf': 0.10995940776415879, 'max_features': 0.5339601894288247}. Best is trial 163 with value: 0.7137418010284807.[0m
[32m[I 2022-04-13 11:45:33,489][0m Trial 327 finished with value: 0.7030519614506526 and parameters: {'splitter': 'best', 'min_samples_split': 0.3119506481656699, 'min_samples_leaf': 0.010655952599911912, 'min_weight_fraction_leaf': 0.06931803963986838, 'max_features': 0.5596411858462482}. Best is trial 163 with value: 0.7137418010284807.[0m
[32m[I 2022-04-13 11:45:33,557][0m Trial 328 finished with value: 0.6989673695016856 and parameters: {'splitter': 'best', 'min_samples_split': 0.3390368855372599, 'min_samples_leaf': 0.018437660360264844, 'min_weight_fraction_leaf': 0.11219153642169319, 'max_features': 0.5566132065060359}. Best is trial 163 with value: 0.7137418010284807.[0m
[32m[I 2022-04-13 11:45:33,618][0m Trial 329 finished with value: 0.6513176944526099 and parameters: {'splitter': 'best', 'min_samples_split': 0.3175252073020368, 'min_samples_leaf': 0.00648257711627343, 'min_weight_fraction_leaf': 0.08674603629206268, 'max_features': 0.4969122522536933}. Best is trial 163 with value: 0.7137418010284807.[0m
[32m[I 2022-04-13 11:45:33,673][0m Trial 330 finished with value: 0.6481259063667688 and parameters: {'splitter': 'best', 'min_samples_split': 0.3081070762621721, 'min_samples_leaf': 0.0011341714482217494, 'min_weight_fraction_leaf': 0.08794729323430744, 'max_features': 0.46451452928664966}. Best is trial 163 with value: 0.7137418010284807.[0m
[32m[I 2022-04-13 11:45:33,735][0m Trial 331 finished with value: 0.7137418010284807 and parameters: {'splitter': 'best', 'min_samples_split': 0.3247462647142704, 'min_samples_leaf': 0.011120133168078012, 'min_weight_fraction_leaf': 0.09633115225220915, 'max_features': 0.5248297781199437}. Best is trial 163 with value: 0.7137418010284807.[0m
[32m[I 2022-04-13 11:45:33,833][0m Trial 332 finished with value: 0.631953446187902 and parameters: {'splitter': 'best', 'min_samples_split': 0.3346848588608077, 'min_samples_leaf': 0.011413088642406172, 'min_weight_fraction_leaf': 0.07720460962327606, 'max_features': 0.4912583992752613}. Best is trial 163 with value: 0.7137418010284807.[0m
[32m[I 2022-04-13 11:45:33,921][0m Trial 333 finished with value: 0.7093409976331404 and parameters: {'splitter': 'random', 'min_samples_split': 0.3265905017223524, 'min_samples_leaf': 0.019982285638920218, 'min_weight_fraction_leaf': 0.09277566803788923, 'max_features': 0.5378217189698461}. Best is trial 163 with value: 0.7137418010284807.[0m
[32m[I 2022-04-13 11:45:33,989][0m Trial 334 finished with value: 0.6490641097840198 and parameters: {'splitter': 'best', 'min_samples_split': 0.3135446470041361, 'min_samples_leaf': 0.28762603923414165, 'min_weight_fraction_leaf': 0.30766483790734994, 'max_features': 0.5127918605828897}. Best is trial 163 with value: 0.7137418010284807.[0m
[32m[I 2022-04-13 11:45:34,098][0m Trial 335 finished with value: 0.6920012331415456 and parameters: {'splitter': 'best', 'min_samples_split': 0.2917694365098173, 'min_samples_leaf': 0.0089047144792629, 'min_weight_fraction_leaf': 0.09558875771164682, 'max_features': 0.5368789654450624}. Best is trial 163 with value: 0.7137418010284807.[0m
[32m[I 2022-04-13 11:45:34,193][0m Trial 336 finished with value: 0.7030519614506526 and parameters: {'splitter': 'best', 'min_samples_split': 0.3044628504901055, 'min_samples_leaf': 0.0012814945205188496, 'min_weight_fraction_leaf': 0.0564712150197285, 'max_features': 0.5188622084673378}. Best is trial 163 with value: 0.7137418010284807.[0m
[32m[I 2022-04-13 11:45:34,268][0m Trial 337 finished with value: 0.6989673695016856 and parameters: {'splitter': 'best', 'min_samples_split': 0.334623827382678, 'min_samples_leaf': 0.01859150558795865, 'min_weight_fraction_leaf': 0.11605342604957973, 'max_features': 0.538301323703389}. Best is trial 163 with value: 0.7137418010284807.[0m
[32m[I 2022-04-13 11:45:34,376][0m Trial 338 finished with value: 0.6436563808635396 and parameters: {'splitter': 'best', 'min_samples_split': 0.3537700507280658, 'min_samples_leaf': 0.0017606475545397411, 'min_weight_fraction_leaf': 0.08056790907821987, 'max_features': 0.4771036646224863}. Best is trial 163 with value: 0.7137418010284807.[0m
[32m[I 2022-04-13 11:45:34,471][0m Trial 339 finished with value: 0.7137418010284807 and parameters: {'splitter': 'best', 'min_samples_split': 0.31769030295499945, 'min_samples_leaf': 0.016006756161368152, 'min_weight_fraction_leaf': 0.09251326250598621, 'max_features': 0.553832138726127}. Best is trial 163 with value: 0.7137418010284807.[0m
[32m[I 2022-04-13 11:45:34,562][0m Trial 340 finished with value: 0.6440317768217898 and parameters: {'splitter': 'best', 'min_samples_split': 0.3154333165930965, 'min_samples_leaf': 0.019267403901898322, 'min_weight_fraction_leaf': 0.10349334621399062, 'max_features': 0.49984702273594717}. Best is trial 163 with value: 0.7137418010284807.[0m
[32m[I 2022-04-13 11:45:34,686][0m Trial 341 finished with value: 0.589064156645618 and parameters: {'splitter': 'best', 'min_samples_split': 0.34301164636936543, 'min_samples_leaf': 0.40910943566313734, 'min_weight_fraction_leaf': 0.09636346135917975, 'max_features': 0.5545658872831758}. Best is trial 163 with value: 0.7137418010284807.[0m
[32m[I 2022-04-13 11:45:34,788][0m Trial 342 finished with value: 0.7137418010284807 and parameters: {'splitter': 'best', 'min_samples_split': 0.32606658140596434, 'min_samples_leaf': 0.020514625910648645, 'min_weight_fraction_leaf': 0.11618132214552486, 'max_features': 0.5575089500190794}. Best is trial 163 with value: 0.7137418010284807.[0m
[32m[I 2022-04-13 11:45:34,878][0m Trial 343 finished with value: 0.6989673695016856 and parameters: {'splitter': 'best', 'min_samples_split': 0.3319880766401106, 'min_samples_leaf': 0.021463358289006435, 'min_weight_fraction_leaf': 0.1164070844374728, 'max_features': 0.5532534364784196}. Best is trial 163 with value: 0.7137418010284807.[0m
[32m[I 2022-04-13 11:45:34,983][0m Trial 344 finished with value: 0.6940367759631566 and parameters: {'splitter': 'best', 'min_samples_split': 0.29905513696888353, 'min_samples_leaf': 0.0014518215388244222, 'min_weight_fraction_leaf': 0.06905718631766519, 'max_features': 0.5223398430436136}. Best is trial 163 with value: 0.7137418010284807.[0m
[32m[I 2022-04-13 11:45:35,077][0m Trial 345 finished with value: 0.7137418010284807 and parameters: {'splitter': 'best', 'min_samples_split': 0.31888663893043884, 'min_samples_leaf': 0.002067886933747659, 'min_weight_fraction_leaf': 0.0811190875788385, 'max_features': 0.5089346361517882}. Best is trial 163 with value: 0.7137418010284807.[0m
[32m[I 2022-04-13 11:45:35,178][0m Trial 346 finished with value: 0.7137418010284807 and parameters: {'splitter': 'best', 'min_samples_split': 0.3279194134034271, 'min_samples_leaf': 0.019585737688776264, 'min_weight_fraction_leaf': 0.11417852797678149, 'max_features': 0.5622908894094922}. Best is trial 163 with value: 0.7137418010284807.[0m
[32m[I 2022-04-13 11:45:35,277][0m Trial 347 finished with value: 0.6989673695016856 and parameters: {'splitter': 'best', 'min_samples_split': 0.36989905972071435, 'min_samples_leaf': 0.021076343115925718, 'min_weight_fraction_leaf': 0.11750578984353846, 'max_features': 0.5648532661216695}. Best is trial 163 with value: 0.7137418010284807.[0m
[32m[I 2022-04-13 11:45:35,373][0m Trial 348 finished with value: 0.6440317768217898 and parameters: {'splitter': 'best', 'min_samples_split': 0.30757230222393217, 'min_samples_leaf': 0.010759432647180434, 'min_weight_fraction_leaf': 0.10314831257058443, 'max_features': 0.49055377836629144}. Best is trial 163 with value: 0.7137418010284807.[0m
[32m[I 2022-04-13 11:45:35,477][0m Trial 349 finished with value: 0.6841965543718843 and parameters: {'splitter': 'best', 'min_samples_split': 0.3397157276098647, 'min_samples_leaf': 0.018734787010488294, 'min_weight_fraction_leaf': 0.08979894977939656, 'max_features': 0.809968830077364}. Best is trial 163 with value: 0.7137418010284807.[0m
[32m[I 2022-04-13 11:45:35,566][0m Trial 350 finished with value: 0.7030519614506526 and parameters: {'splitter': 'best', 'min_samples_split': 0.3066973405470957, 'min_samples_leaf': 0.0012691706071044227, 'min_weight_fraction_leaf': 0.10351605836092484, 'max_features': 0.5286801342327304}. Best is trial 163 with value: 0.7137418010284807.[0m
[32m[I 2022-04-13 11:45:35,663][0m Trial 351 finished with value: 0.7137418010284807 and parameters: {'splitter': 'best', 'min_samples_split': 0.32283716857672745, 'min_samples_leaf': 0.011549460193741777, 'min_weight_fraction_leaf': 0.07560758371741094, 'max_features': 0.5080589661792588}. Best is trial 163 with value: 0.7137418010284807.[0m
[32m[I 2022-04-13 11:45:35,778][0m Trial 352 finished with value: 0.6201194930470164 and parameters: {'splitter': 'best', 'min_samples_split': 0.2882699378540279, 'min_samples_leaf': 0.009551439661875152, 'min_weight_fraction_leaf': 0.0721632995437836, 'max_features': 0.4708352674547286}. Best is trial 163 with value: 0.7137418010284807.[0m
[32m[I 2022-04-13 11:45:35,901][0m Trial 353 finished with value: 0.5683817767045116 and parameters: {'splitter': 'random', 'min_samples_split': 0.3106008680209157, 'min_samples_leaf': 0.011790086763996094, 'min_weight_fraction_leaf': 0.09019586285411813, 'max_features': 0.2965019476165227}. Best is trial 163 with value: 0.7137418010284807.[0m
[32m[I 2022-04-13 11:45:36,051][0m Trial 354 finished with value: 0.6436563808635396 and parameters: {'splitter': 'best', 'min_samples_split': 0.34877505625613014, 'min_samples_leaf': 0.023952917795948433, 'min_weight_fraction_leaf': 0.0829027705983327, 'max_features': 0.4472703639703548}. Best is trial 163 with value: 0.7137418010284807.[0m
[32m[I 2022-04-13 11:45:36,188][0m Trial 355 finished with value: 0.5274761494504403 and parameters: {'splitter': 'best', 'min_samples_split': 0.3286709758109584, 'min_samples_leaf': 0.02358430434128229, 'min_weight_fraction_leaf': 0.09504729348598771, 'max_features': 0.23786278960711}. Best is trial 163 with value: 0.7137418010284807.[0m
[32m[I 2022-04-13 11:45:36,328][0m Trial 356 finished with value: 0.6513176944526099 and parameters: {'splitter': 'best', 'min_samples_split': 0.31768855488367237, 'min_samples_leaf': 0.00150007205026699, 'min_weight_fraction_leaf': 0.08206133550922855, 'max_features': 0.4954291896880056}. Best is trial 163 with value: 0.7137418010284807.[0m
[32m[I 2022-04-13 11:45:36,469][0m Trial 357 finished with value: 0.6920012331415456 and parameters: {'splitter': 'best', 'min_samples_split': 0.299775379742046, 'min_samples_leaf': 0.01097888783662654, 'min_weight_fraction_leaf': 0.09829810788392075, 'max_features': 0.5300307660419503}. Best is trial 163 with value: 0.7137418010284807.[0m
[32m[I 2022-04-13 11:45:36,612][0m Trial 358 finished with value: 0.6989673695016856 and parameters: {'splitter': 'best', 'min_samples_split': 0.33696924432482545, 'min_samples_leaf': 0.008706255320968487, 'min_weight_fraction_leaf': 0.10691970641838858, 'max_features': 0.513902363102996}. Best is trial 163 with value: 0.7137418010284807.[0m
[32m[I 2022-04-13 11:45:36,731][0m Trial 359 finished with value: 0.6843470376003471 and parameters: {'splitter': 'best', 'min_samples_split': 0.4515427320665202, 'min_samples_leaf': 0.0013032823438034434, 'min_weight_fraction_leaf': 0.1068587359456551, 'max_features': 0.5194518866067113}. Best is trial 163 with value: 0.7137418010284807.[0m
[32m[I 2022-04-13 11:45:36,899][0m Trial 360 finished with value: 0.6356612618118771 and parameters: {'splitter': 'best', 'min_samples_split': 0.3212289511603645, 'min_samples_leaf': 0.010501338750135382, 'min_weight_fraction_leaf': 0.3843765051610416, 'max_features': 0.4784126133740554}. Best is trial 163 with value: 0.7137418010284807.[0m
[32m[I 2022-04-13 11:45:37,064][0m Trial 361 finished with value: 0.6989673695016856 and parameters: {'splitter': 'best', 'min_samples_split': 0.33591823232376083, 'min_samples_leaf': 0.025047293413390088, 'min_weight_fraction_leaf': 0.1193532634059478, 'max_features': 0.5440124383930505}. Best is trial 163 with value: 0.7137418010284807.[0m
[32m[I 2022-04-13 11:45:37,227][0m Trial 362 finished with value: 0.7137418010284807 and parameters: {'splitter': 'best', 'min_samples_split': 0.3227783848133107, 'min_samples_leaf': 0.001068887072018737, 'min_weight_fraction_leaf': 0.10630125750919293, 'max_features': 0.5319674036577207}. Best is trial 163 with value: 0.7137418010284807.[0m
[32m[I 2022-04-13 11:45:37,399][0m Trial 363 finished with value: 0.7030519614506526 and parameters: {'splitter': 'best', 'min_samples_split': 0.3088678403832232, 'min_samples_leaf': 0.008581416789617548, 'min_weight_fraction_leaf': 0.10507779324446956, 'max_features': 0.5007288907720545}. Best is trial 163 with value: 0.7137418010284807.[0m
[32m[I 2022-04-13 11:45:37,571][0m Trial 364 finished with value: 0.6920012331415456 and parameters: {'splitter': 'best', 'min_samples_split': 0.2960718328110985, 'min_samples_leaf': 0.0014716269053576974, 'min_weight_fraction_leaf': 0.10139287490022476, 'max_features': 0.5274245858792052}. Best is trial 163 with value: 0.7137418010284807.[0m
[32m[I 2022-04-13 11:45:37,687][0m Trial 365 finished with value: 0.7030519614506526 and parameters: {'splitter': 'best', 'min_samples_split': 0.31516503118671463, 'min_samples_leaf': 0.012964476915684222, 'min_weight_fraction_leaf': 0.09057132275217417, 'max_features': 0.5344810122854771}. Best is trial 163 with value: 0.7137418010284807.[0m
[32m[I 2022-04-13 11:45:37,831][0m Trial 366 finished with value: 0.6989673695016856 and parameters: {'splitter': 'best', 'min_samples_split': 0.3296871042517308, 'min_samples_leaf': 0.021255303305521715, 'min_weight_fraction_leaf': 0.1160577613213758, 'max_features': 0.5493299353120371}. Best is trial 163 with value: 0.7137418010284807.[0m
[32m[I 2022-04-13 11:45:37,970][0m Trial 367 finished with value: 0.6327929922187122 and parameters: {'splitter': 'best', 'min_samples_split': 0.3088502056467119, 'min_samples_leaf': 0.20279741518619882, 'min_weight_fraction_leaf': 0.2474504139887274, 'max_features': 0.5665556257458957}. Best is trial 163 with value: 0.7137418010284807.[0m
[32m[I 2022-04-13 11:45:38,102][0m Trial 368 finished with value: 0.6563260177885633 and parameters: {'splitter': 'best', 'min_samples_split': 0.34787020276073977, 'min_samples_leaf': 0.2567707595440916, 'min_weight_fraction_leaf': 0.06259013616071767, 'max_features': 0.4889237561483203}. Best is trial 163 with value: 0.7137418010284807.[0m
[32m[I 2022-04-13 11:45:38,224][0m Trial 369 finished with value: 0.4496098787702302 and parameters: {'splitter': 'best', 'min_samples_split': 0.3155853615728196, 'min_samples_leaf': 0.48204631534984294, 'min_weight_fraction_leaf': 0.11418390490844675, 'max_features': 0.07810739409545331}. Best is trial 163 with value: 0.7137418010284807.[0m
[32m[I 2022-04-13 11:45:38,416][0m Trial 370 finished with value: 0.6989673695016856 and parameters: {'splitter': 'best', 'min_samples_split': 0.33316219969002553, 'min_samples_leaf': 0.02724578347491316, 'min_weight_fraction_leaf': 0.11973238789519877, 'max_features': 0.5699277478948424}. Best is trial 163 with value: 0.7137418010284807.[0m
[32m[I 2022-04-13 11:45:38,549][0m Trial 371 finished with value: 0.6991559438105668 and parameters: {'splitter': 'random', 'min_samples_split': 0.2971174163749334, 'min_samples_leaf': 0.013300512690344692, 'min_weight_fraction_leaf': 0.09059489532450736, 'max_features': 0.5483234788591338}. Best is trial 163 with value: 0.7137418010284807.[0m
[32m[I 2022-04-13 11:45:38,718][0m Trial 372 finished with value: 0.7137418010284807 and parameters: {'splitter': 'best', 'min_samples_split': 0.3225552545166258, 'min_samples_leaf': 0.008778194405070185, 'min_weight_fraction_leaf': 0.10030761373823059, 'max_features': 0.5223163504855627}. Best is trial 163 with value: 0.7137418010284807.[0m
[32m[I 2022-04-13 11:45:38,861][0m Trial 373 finished with value: 0.7030519614506526 and parameters: {'splitter': 'best', 'min_samples_split': 0.305469252273142, 'min_samples_leaf': 0.015554521131867696, 'min_weight_fraction_leaf': 0.08086990963292899, 'max_features': 0.5413012473356321}. Best is trial 163 with value: 0.7137418010284807.[0m
[32m[I 2022-04-13 11:45:39,006][0m Trial 374 finished with value: 0.7137418010284807 and parameters: {'splitter': 'best', 'min_samples_split': 0.3242591932931354, 'min_samples_leaf': 0.017882483996456665, 'min_weight_fraction_leaf': 0.061044439209962116, 'max_features': 0.5032426250762697}. Best is trial 163 with value: 0.7137418010284807.[0m
[32m[I 2022-04-13 11:45:39,145][0m Trial 375 finished with value: 0.6705763419171312 and parameters: {'splitter': 'best', 'min_samples_split': 0.34212809540583417, 'min_samples_leaf': 0.026137092174841503, 'min_weight_fraction_leaf': 0.04688791250621531, 'max_features': 0.5667905862770617}. Best is trial 163 with value: 0.7137418010284807.[0m
[32m[I 2022-04-13 11:45:39,243][0m Trial 376 finished with value: 0.6393814860932593 and parameters: {'splitter': 'best', 'min_samples_split': 0.3653018453426377, 'min_samples_leaf': 0.01983844047536844, 'min_weight_fraction_leaf': 0.05637499673203002, 'max_features': 0.45733475398783796}. Best is trial 163 with value: 0.7137418010284807.[0m
[32m[I 2022-04-13 11:45:39,328][0m Trial 377 finished with value: 0.7030519614506526 and parameters: {'splitter': 'best', 'min_samples_split': 0.31237405394564444, 'min_samples_leaf': 0.012039152540623578, 'min_weight_fraction_leaf': 0.07196310821566372, 'max_features': 0.5566593245925079}. Best is trial 163 with value: 0.7137418010284807.[0m
[32m[I 2022-04-13 11:45:39,389][0m Trial 378 finished with value: 0.6989673695016856 and parameters: {'splitter': 'best', 'min_samples_split': 0.354075324215576, 'min_samples_leaf': 0.020554212192728776, 'min_weight_fraction_leaf': 0.07190406948617689, 'max_features': 0.5405067479160696}. Best is trial 163 with value: 0.7137418010284807.[0m
[32m[I 2022-04-13 11:45:39,451][0m Trial 379 finished with value: 0.6989673695016856 and parameters: {'splitter': 'best', 'min_samples_split': 0.3345452204269318, 'min_samples_leaf': 0.008454008137209111, 'min_weight_fraction_leaf': 0.09850036584693438, 'max_features': 0.5212199346870177}. Best is trial 163 with value: 0.7137418010284807.[0m
[32m[I 2022-04-13 11:45:39,549][0m Trial 380 finished with value: 0.6302384735606079 and parameters: {'splitter': 'best', 'min_samples_split': 0.2866885996309379, 'min_samples_leaf': 0.0019297797924940638, 'min_weight_fraction_leaf': 0.08906951302002049, 'max_features': 0.48908661857096986}. Best is trial 163 with value: 0.7137418010284807.[0m
[32m[I 2022-04-13 11:45:39,606][0m Trial 381 finished with value: 0.7137418010284807 and parameters: {'splitter': 'best', 'min_samples_split': 0.32011838791542635, 'min_samples_leaf': 0.0011050479176668974, 'min_weight_fraction_leaf': 0.07617578562744176, 'max_features': 0.5016457600955418}. Best is trial 163 with value: 0.7137418010284807.[0m
[32m[I 2022-04-13 11:45:39,647][0m Trial 382 finished with value: 0.6865730374003304 and parameters: {'splitter': 'best', 'min_samples_split': 0.2712310713887162, 'min_samples_leaf': 0.022661842872448552, 'min_weight_fraction_leaf': 0.11590346631891942, 'max_features': 0.5698328017314254}. Best is trial 163 with value: 0.7137418010284807.[0m
[32m[I 2022-04-13 11:45:39,707][0m Trial 383 finished with value: 0.6440317768217898 and parameters: {'splitter': 'best', 'min_samples_split': 0.3145145114602395, 'min_samples_leaf': 0.011348767552867263, 'min_weight_fraction_leaf': 0.09631178331006934, 'max_features': 0.4777764380043265}. Best is trial 163 with value: 0.7137418010284807.[0m
[32m[I 2022-04-13 11:45:39,766][0m Trial 384 finished with value: 0.7044783206942828 and parameters: {'splitter': 'best', 'min_samples_split': 0.3036587014740822, 'min_samples_leaf': 0.03111461543862423, 'min_weight_fraction_leaf': 0.11276437584400548, 'max_features': 0.5685907217833053}. Best is trial 163 with value: 0.7137418010284807.[0m
