[32m[I 2022-04-14 07:32:10,272][0m Trial 203 finished with value: 0.7348636401517904 and parameters: {'loss': 'coxph', 'learning_rate': 0.0007189323901847486, 'n_estimators': 745, 'criterion': 'squared_error', 'min_samples_split': 7, 'min_samples_leaf': 1, 'min_weight_fraction_leaf': 0.10884843273529055, 'min_impurity_decrease': 0.048953416276662845, 'max_features': 0.7846453840502198, 'subsample': 0.42873443295563707, 'dropout_rate': 0.14909562413888933, 'ccp_alpha': 0.005903233180750521}. Best is trial 163 with value: 0.74089837306326.[0m
[32m[I 2022-04-14 07:33:42,464][0m Trial 204 finished with value: 0.7416561567617531 and parameters: {'loss': 'coxph', 'learning_rate': 0.0006610837756605996, 'n_estimators': 740, 'criterion': 'squared_error', 'min_samples_split': 7, 'min_samples_leaf': 1, 'min_weight_fraction_leaf': 0.11655896212097983, 'min_impurity_decrease': 0.04417589298042, 'max_features': 0.8066962540882582, 'subsample': 0.42960085050312724, 'dropout_rate': 0.14779638196563594, 'ccp_alpha': 0.08212302575320385}. Best is trial 204 with value: 0.7416561567617531.[0m
[32m[I 2022-04-14 07:35:23,970][0m Trial 205 finished with value: 0.7277026984257898 and parameters: {'loss': 'coxph', 'learning_rate': 0.000682105409410325, 'n_estimators': 754, 'criterion': 'squared_error', 'min_samples_split': 7, 'min_samples_leaf': 1, 'min_weight_fraction_leaf': 0.12932119678199658, 'min_impurity_decrease': 0.04048299763385914, 'max_features': 0.8339360006447317, 'subsample': 0.4224571018348668, 'dropout_rate': 0.14364342773139807, 'ccp_alpha': 0.09282163540165314}. Best is trial 204 with value: 0.7416561567617531.[0m
[32m[I 2022-04-14 07:37:26,096][0m Trial 206 finished with value: 0.7339907584397285 and parameters: {'loss': 'coxph', 'learning_rate': 0.0009595500552187308, 'n_estimators': 826, 'criterion': 'squared_error', 'min_samples_split': 7, 'min_samples_leaf': 1, 'min_weight_fraction_leaf': 0.1053281287691814, 'min_impurity_decrease': 0.018629535033740388, 'max_features': 0.8031161799887708, 'subsample': 0.3920057523584623, 'dropout_rate': 0.16317381965551833, 'ccp_alpha': 0.010288277951917835}. Best is trial 204 with value: 0.7416561567617531.[0m
[32m[I 2022-04-14 07:39:21,440][0m Trial 207 finished with value: 0.7396314154426209 and parameters: {'loss': 'coxph', 'learning_rate': 0.0009775916082132021, 'n_estimators': 830, 'criterion': 'squared_error', 'min_samples_split': 7, 'min_samples_leaf': 1, 'min_weight_fraction_leaf': 0.10187168666668897, 'min_impurity_decrease': 0.022822889155409472, 'max_features': 0.8117995551820205, 'subsample': 0.39335448656661776, 'dropout_rate': 0.16786433174651264, 'ccp_alpha': 0.027938508915448773}. Best is trial 204 with value: 0.7416561567617531.[0m
[32m[I 2022-04-14 07:41:19,058][0m Trial 208 finished with value: 0.7321550575172967 and parameters: {'loss': 'coxph', 'learning_rate': 0.0008913427402229247, 'n_estimators': 820, 'criterion': 'squared_error', 'min_samples_split': 7, 'min_samples_leaf': 1, 'min_weight_fraction_leaf': 0.1252880393142818, 'min_impurity_decrease': 0.01924650198857776, 'max_features': 0.8055197367390703, 'subsample': 0.40517881370469355, 'dropout_rate': 0.16980314397962687, 'ccp_alpha': 0.14271508594333507}. Best is trial 204 with value: 0.7416561567617531.[0m
[32m[I 2022-04-14 07:42:45,950][0m Trial 209 finished with value: 0.7159595351965876 and parameters: {'loss': 'coxph', 'learning_rate': 0.0005757473563595522, 'n_estimators': 725, 'criterion': 'squared_error', 'min_samples_split': 7, 'min_samples_leaf': 1, 'min_weight_fraction_leaf': 0.1149042823605326, 'min_impurity_decrease': 0.0493431529567663, 'max_features': 0.8384846341258724, 'subsample': 0.4365611170492595, 'dropout_rate': 0.18419847715610443, 'ccp_alpha': 0.2958604929087538}. Best is trial 204 with value: 0.7416561567617531.[0m
[32m[I 2022-04-14 07:44:44,516][0m Trial 210 finished with value: 0.7225058372772857 and parameters: {'loss': 'coxph', 'learning_rate': 0.0013259717864081864, 'n_estimators': 790, 'criterion': 'absolute_error', 'min_samples_split': 8, 'min_samples_leaf': 1, 'min_weight_fraction_leaf': 0.10624504089088851, 'min_impurity_decrease': 0.003222190849534052, 'max_features': 0.81270261740672, 'subsample': 0.4163066432940439, 'dropout_rate': 0.12444282261301703, 'ccp_alpha': 0.0816362554855942}. Best is trial 204 with value: 0.7416561567617531.[0m
[32m[I 2022-04-14 07:47:00,794][0m Trial 211 finished with value: 0.7273616038008487 and parameters: {'loss': 'coxph', 'learning_rate': 0.001010368446919589, 'n_estimators': 843, 'criterion': 'squared_error', 'min_samples_split': 7, 'min_samples_leaf': 1, 'min_weight_fraction_leaf': 0.09882833871633741, 'min_impurity_decrease': 0.02329029499947392, 'max_features': 0.7823744361970641, 'subsample': 0.3807756811781948, 'dropout_rate': 0.13987137276186662, 'ccp_alpha': 0.0020985330398660493}. Best is trial 204 with value: 0.7416561567617531.[0m
[32m[I 2022-04-14 07:48:34,420][0m Trial 212 finished with value: 0.7417456897549946 and parameters: {'loss': 'coxph', 'learning_rate': 0.001129024906083879, 'n_estimators': 744, 'criterion': 'squared_error', 'min_samples_split': 7, 'min_samples_leaf': 1, 'min_weight_fraction_leaf': 0.0928932434441027, 'min_impurity_decrease': 0.04140689345526535, 'max_features': 0.795714440525271, 'subsample': 0.38487383695514016, 'dropout_rate': 0.16188152116483012, 'ccp_alpha': 0.0736073359527894}. Best is trial 212 with value: 0.7417456897549946.[0m
[32m[I 2022-04-14 07:49:56,408][0m Trial 213 finished with value: 0.7304812175810913 and parameters: {'loss': 'coxph', 'learning_rate': 0.002031384137626508, 'n_estimators': 693, 'criterion': 'squared_error', 'min_samples_split': 7, 'min_samples_leaf': 1, 'min_weight_fraction_leaf': 0.0913695338472376, 'min_impurity_decrease': 0.052653515093847345, 'max_features': 0.8047200254409731, 'subsample': 0.35973392867753573, 'dropout_rate': 0.16742724222843483, 'ccp_alpha': 0.0023535832522122435}. Best is trial 212 with value: 0.7417456897549946.[0m
[32m[I 2022-04-14 07:51:41,417][0m Trial 214 finished with value: 0.7113176039425555 and parameters: {'loss': 'coxph', 'learning_rate': 0.0007803896153058448, 'n_estimators': 763, 'criterion': 'squared_error', 'min_samples_split': 7, 'min_samples_leaf': 1, 'min_weight_fraction_leaf': 0.11005015920533007, 'min_impurity_decrease': 0.041086048657985284, 'max_features': 0.7887943836388074, 'subsample': 0.39236998409186197, 'dropout_rate': 0.10413326268463655, 'ccp_alpha': 0.18194259570131785}. Best is trial 212 with value: 0.7417456897549946.[0m
[32m[I 2022-04-14 07:53:19,634][0m Trial 215 finished with value: 0.6448043847737202 and parameters: {'loss': 'coxph', 'learning_rate': 0.0014920241484616193, 'n_estimators': 732, 'criterion': 'squared_error', 'min_samples_split': 7, 'min_samples_leaf': 1, 'min_weight_fraction_leaf': 0.47457481946900226, 'min_impurity_decrease': 0.06705283089134251, 'max_features': 0.8573637740335793, 'subsample': 0.4197654164190155, 'dropout_rate': 0.15960901865420424, 'ccp_alpha': 0.09761276517450769}. Best is trial 212 with value: 0.7417456897549946.[0m
[32m[I 2022-04-14 07:55:18,203][0m Trial 216 finished with value: 0.7259530734632815 and parameters: {'loss': 'coxph', 'learning_rate': 0.0005173575852356444, 'n_estimators': 811, 'criterion': 'squared_error', 'min_samples_split': 7, 'min_samples_leaf': 1, 'min_weight_fraction_leaf': 0.09064082355371324, 'min_impurity_decrease': 0.03267804645125598, 'max_features': 0.8295635735084093, 'subsample': 0.447665234140501, 'dropout_rate': 0.19291074570389488, 'ccp_alpha': 0.2154427393016427}. Best is trial 212 with value: 0.7417456897549946.[0m
[32m[I 2022-04-14 07:56:55,711][0m Trial 217 finished with value: 0.7005081765942123 and parameters: {'loss': 'coxph', 'learning_rate': 0.0011401905914307788, 'n_estimators': 694, 'criterion': 'squared_error', 'min_samples_split': 7, 'min_samples_leaf': 10, 'min_weight_fraction_leaf': 0.12059550371548068, 'min_impurity_decrease': 0.05574014286863475, 'max_features': 0.7727673724932712, 'subsample': 0.39611666110563454, 'dropout_rate': 0.1195896662176589, 'ccp_alpha': 0.0018772153023414312}. Best is trial 212 with value: 0.7417456897549946.[0m
[32m[I 2022-04-14 07:58:36,865][0m Trial 218 finished with value: 0.7171294776968551 and parameters: {'loss': 'coxph', 'learning_rate': 0.0006505431618661509, 'n_estimators': 741, 'criterion': 'squared_error', 'min_samples_split': 7, 'min_samples_leaf': 1, 'min_weight_fraction_leaf': 0.10437179473754145, 'min_impurity_decrease': 0.01964306853928123, 'max_features': 0.803419793040953, 'subsample': 0.4352841614848138, 'dropout_rate': 0.17586063170990368, 'ccp_alpha': 0.11910008044028804}. Best is trial 212 with value: 0.7417456897549946.[0m
[32m[I 2022-04-14 08:00:51,598][0m Trial 219 finished with value: 0.733880991398669 and parameters: {'loss': 'coxph', 'learning_rate': 0.0009015225108657752, 'n_estimators': 830, 'criterion': 'squared_error', 'min_samples_split': 7, 'min_samples_leaf': 1, 'min_weight_fraction_leaf': 0.09222247357721684, 'min_impurity_decrease': 0.04507853201803571, 'max_features': 0.7637809879324695, 'subsample': 0.47656987295036357, 'dropout_rate': 0.07871645786990819, 'ccp_alpha': 0.2625742484944189}. Best is trial 212 with value: 0.7417456897549946.[0m
[32m[I 2022-04-14 08:02:55,149][0m Trial 220 finished with value: 0.6792559408045982 and parameters: {'loss': 'coxph', 'learning_rate': 0.0008793472238344724, 'n_estimators': 798, 'criterion': 'squared_error', 'min_samples_split': 7, 'min_samples_leaf': 1, 'min_weight_fraction_leaf': 0.09164212529243296, 'min_impurity_decrease': 0.06853489809771672, 'max_features': 0.7837782471586046, 'subsample': 0.4811090001366566, 'dropout_rate': 0.08760711413102307, 'ccp_alpha': 0.32076344654660643}. Best is trial 212 with value: 0.7417456897549946.[0m
[32m[I 2022-04-14 08:04:51,416][0m Trial 221 finished with value: 0.7331368097897231 and parameters: {'loss': 'coxph', 'learning_rate': 0.0008998434182967915, 'n_estimators': 837, 'criterion': 'squared_error', 'min_samples_split': 7, 'min_samples_leaf': 1, 'min_weight_fraction_leaf': 0.08895065242480235, 'min_impurity_decrease': 0.0422805337751806, 'max_features': 0.7638098250769061, 'subsample': 0.46621310669326865, 'dropout_rate': 0.1531521012744138, 'ccp_alpha': 0.16755549265107383}. Best is trial 212 with value: 0.7417456897549946.[0m
[32m[I 2022-04-14 08:06:56,216][0m Trial 222 finished with value: 0.7300928252484544 and parameters: {'loss': 'coxph', 'learning_rate': 0.0011809994899628267, 'n_estimators': 836, 'criterion': 'squared_error', 'min_samples_split': 7, 'min_samples_leaf': 1, 'min_weight_fraction_leaf': 0.083163215661869, 'min_impurity_decrease': 0.045467461149688915, 'max_features': 0.7681886638662979, 'subsample': 0.49408569652420986, 'dropout_rate': 0.0698226331379527, 'ccp_alpha': 0.18778788744642214}. Best is trial 212 with value: 0.7417456897549946.[0m
[32m[I 2022-04-14 08:09:13,675][0m Trial 223 finished with value: 0.7222517066243771 and parameters: {'loss': 'coxph', 'learning_rate': 0.0009203847080357535, 'n_estimators': 840, 'criterion': 'squared_error', 'min_samples_split': 7, 'min_samples_leaf': 1, 'min_weight_fraction_leaf': 0.091391533106366, 'min_impurity_decrease': 0.057128261646384675, 'max_features': 0.7941805891914508, 'subsample': 0.4736820512345322, 'dropout_rate': 0.13137268863330054, 'ccp_alpha': 0.2771831463967749}. Best is trial 212 with value: 0.7417456897549946.[0m
[32m[I 2022-04-14 08:11:42,775][0m Trial 224 finished with value: 0.7290935645847452 and parameters: {'loss': 'coxph', 'learning_rate': 0.0014638799561671615, 'n_estimators': 867, 'criterion': 'squared_error', 'min_samples_split': 7, 'min_samples_leaf': 1, 'min_weight_fraction_leaf': 0.06917083598891219, 'min_impurity_decrease': 0.03592983138409818, 'max_features': 0.8162483780548622, 'subsample': 0.43787287978963124, 'dropout_rate': 0.15825173470538126, 'ccp_alpha': 0.16641582869052388}. Best is trial 212 with value: 0.7417456897549946.[0m
[32m[I 2022-04-14 08:14:06,786][0m Trial 225 finished with value: 0.725366638868701 and parameters: {'loss': 'coxph', 'learning_rate': 0.0007727085817052673, 'n_estimators': 812, 'criterion': 'squared_error', 'min_samples_split': 7, 'min_samples_leaf': 1, 'min_weight_fraction_leaf': 0.10019726895031993, 'min_impurity_decrease': 0.08440596454317618, 'max_features': 0.763603799293522, 'subsample': 0.4099620579139388, 'dropout_rate': 0.10715703080376496, 'ccp_alpha': 0.07840684349761616}. Best is trial 212 with value: 0.7417456897549946.[0m
[32m[I 2022-04-14 08:16:44,905][0m Trial 226 finished with value: 0.735203710442442 and parameters: {'loss': 'coxph', 'learning_rate': 0.0010119657907642248, 'n_estimators': 903, 'criterion': 'squared_error', 'min_samples_split': 7, 'min_samples_leaf': 1, 'min_weight_fraction_leaf': 0.08462175997674205, 'min_impurity_decrease': 0.06522337117273222, 'max_features': 0.7793754175185099, 'subsample': 0.512672446578928, 'dropout_rate': 0.18138283444045722, 'ccp_alpha': 0.234949825445406}. Best is trial 212 with value: 0.7417456897549946.[0m
[32m[I 2022-04-14 08:19:35,904][0m Trial 227 finished with value: 0.706924376141176 and parameters: {'loss': 'coxph', 'learning_rate': 0.001170242994828145, 'n_estimators': 918, 'criterion': 'squared_error', 'min_samples_split': 7, 'min_samples_leaf': 1, 'min_weight_fraction_leaf': 0.06345202789943077, 'min_impurity_decrease': 0.07011923208526054, 'max_features': 0.7865477716677907, 'subsample': 0.35521415182404553, 'dropout_rate': 0.19524603995924292, 'ccp_alpha': 0.2671221555663148}. Best is trial 212 with value: 0.7417456897549946.[0m
[32m[I 2022-04-14 08:22:22,547][0m Trial 228 finished with value: 0.739548384329358 and parameters: {'loss': 'coxph', 'learning_rate': 0.0007075110758114701, 'n_estimators': 889, 'criterion': 'squared_error', 'min_samples_split': 7, 'min_samples_leaf': 1, 'min_weight_fraction_leaf': 0.08256122835821623, 'min_impurity_decrease': 0.09759003489148638, 'max_features': 0.8438655008260435, 'subsample': 0.5177263931270119, 'dropout_rate': 0.17749215550685216, 'ccp_alpha': 0.07584912244748773}. Best is trial 212 with value: 0.7417456897549946.[0m
[32m[I 2022-04-14 08:25:17,640][0m Trial 229 finished with value: 0.7437241350191778 and parameters: {'loss': 'coxph', 'learning_rate': 0.001700702524128141, 'n_estimators': 950, 'criterion': 'squared_error', 'min_samples_split': 7, 'min_samples_leaf': 1, 'min_weight_fraction_leaf': 0.08309926393286508, 'min_impurity_decrease': 0.08435844209137519, 'max_features': 0.8233380731744323, 'subsample': 0.5237943067615547, 'dropout_rate': 0.178708770465488, 'ccp_alpha': 0.010006798331209155}. Best is trial 229 with value: 0.7437241350191778.[0m
[32m[I 2022-04-14 08:28:31,433][0m Trial 230 finished with value: 0.7344708981359422 and parameters: {'loss': 'coxph', 'learning_rate': 0.00232431914244507, 'n_estimators': 956, 'criterion': 'squared_error', 'min_samples_split': 7, 'min_samples_leaf': 1, 'min_weight_fraction_leaf': 0.1020072533049883, 'min_impurity_decrease': 0.060347732091567734, 'max_features': 0.8556572247799894, 'subsample': 0.5119410932175021, 'dropout_rate': 0.1625350709913602, 'ccp_alpha': 0.010895939471116457}. Best is trial 229 with value: 0.7437241350191778.[0m
[32m[I 2022-04-14 08:31:48,622][0m Trial 231 finished with value: 0.7344129456607145 and parameters: {'loss': 'coxph', 'learning_rate': 0.0024978330118277485, 'n_estimators': 964, 'criterion': 'squared_error', 'min_samples_split': 7, 'min_samples_leaf': 1, 'min_weight_fraction_leaf': 0.10078203216949416, 'min_impurity_decrease': 0.05819920617673578, 'max_features': 0.8292970846886395, 'subsample': 0.5152861451846021, 'dropout_rate': 0.1716777360883175, 'ccp_alpha': 0.005355985515182396}. Best is trial 229 with value: 0.7437241350191778.[0m
[32m[I 2022-04-14 08:34:29,955][0m Trial 232 finished with value: 0.7357756744172294 and parameters: {'loss': 'coxph', 'learning_rate': 0.0028634770898892385, 'n_estimators': 948, 'criterion': 'squared_error', 'min_samples_split': 7, 'min_samples_leaf': 1, 'min_weight_fraction_leaf': 0.10422886496830593, 'min_impurity_decrease': 0.09185209856698257, 'max_features': 0.8693884581963572, 'subsample': 0.5150837188347498, 'dropout_rate': 0.17226310036170392, 'ccp_alpha': 0.007682270804153938}. Best is trial 229 with value: 0.7437241350191778.[0m
[32m[I 2022-04-14 08:37:07,501][0m Trial 233 finished with value: 0.7433079492765213 and parameters: {'loss': 'coxph', 'learning_rate': 0.0021867487368393973, 'n_estimators': 951, 'criterion': 'squared_error', 'min_samples_split': 7, 'min_samples_leaf': 1, 'min_weight_fraction_leaf': 0.10131509116050375, 'min_impurity_decrease': 0.09729748859812665, 'max_features': 0.8822951626028517, 'subsample': 0.5175708001169667, 'dropout_rate': 0.17676919945345115, 'ccp_alpha': 0.015317586915551573}. Best is trial 229 with value: 0.7437241350191778.[0m
[32m[I 2022-04-14 08:39:35,521][0m Trial 234 finished with value: 0.7337092395047499 and parameters: {'loss': 'coxph', 'learning_rate': 0.0025050009285390033, 'n_estimators': 937, 'criterion': 'squared_error', 'min_samples_split': 7, 'min_samples_leaf': 1, 'min_weight_fraction_leaf': 0.10545609343658277, 'min_impurity_decrease': 0.09517114767069751, 'max_features': 0.914207852429181, 'subsample': 0.5162582885495424, 'dropout_rate': 0.17603080158240442, 'ccp_alpha': 0.011726493331683983}. Best is trial 229 with value: 0.7437241350191778.[0m
[32m[I 2022-04-14 08:42:17,240][0m Trial 235 finished with value: 0.7389162691441763 and parameters: {'loss': 'coxph', 'learning_rate': 0.0023071562834442844, 'n_estimators': 955, 'criterion': 'squared_error', 'min_samples_split': 7, 'min_samples_leaf': 1, 'min_weight_fraction_leaf': 0.10459110489720294, 'min_impurity_decrease': 0.06823228235459906, 'max_features': 0.8714069100282137, 'subsample': 0.5163308923392399, 'dropout_rate': 0.18085523241387805, 'ccp_alpha': 0.012659228459660313}. Best is trial 229 with value: 0.7437241350191778.[0m
[32m[I 2022-04-14 08:45:15,354][0m Trial 236 finished with value: 0.7331355558475099 and parameters: {'loss': 'coxph', 'learning_rate': 0.00303851137629657, 'n_estimators': 969, 'criterion': 'squared_error', 'min_samples_split': 7, 'min_samples_leaf': 1, 'min_weight_fraction_leaf': 0.11958702529481369, 'min_impurity_decrease': 0.07425177645462508, 'max_features': 0.8805195423444648, 'subsample': 0.5177253168605359, 'dropout_rate': 0.1839121602250296, 'ccp_alpha': 0.003655557562973928}. Best is trial 229 with value: 0.7437241350191778.[0m
[32m[I 2022-04-14 08:47:55,655][0m Trial 237 finished with value: 0.7264379325081893 and parameters: {'loss': 'coxph', 'learning_rate': 0.0021174829806449294, 'n_estimators': 960, 'criterion': 'squared_error', 'min_samples_split': 7, 'min_samples_leaf': 1, 'min_weight_fraction_leaf': 0.09761103701350426, 'min_impurity_decrease': 0.09660244880664007, 'max_features': 0.8685695105579164, 'subsample': 0.5232540972635716, 'dropout_rate': 0.20033146661359977, 'ccp_alpha': 0.15655521973699046}. Best is trial 229 with value: 0.7437241350191778.[0m
[32m[I 2022-04-14 08:50:38,919][0m Trial 238 finished with value: 0.7260326425600226 and parameters: {'loss': 'coxph', 'learning_rate': 0.002511187720859736, 'n_estimators': 914, 'criterion': 'squared_error', 'min_samples_split': 8, 'min_samples_leaf': 1, 'min_weight_fraction_leaf': 0.12290895227471085, 'min_impurity_decrease': 0.06609090112463306, 'max_features': 0.8943326558269368, 'subsample': 0.5015889472574614, 'dropout_rate': 0.17998017545870984, 'ccp_alpha': 0.10399758263098648}. Best is trial 229 with value: 0.7437241350191778.[0m
[32m[I 2022-04-14 08:53:12,938][0m Trial 239 finished with value: 0.7229670037306798 and parameters: {'loss': 'coxph', 'learning_rate': 0.003484021999162628, 'n_estimators': 895, 'criterion': 'squared_error', 'min_samples_split': 7, 'min_samples_leaf': 1, 'min_weight_fraction_leaf': 0.10830469007851064, 'min_impurity_decrease': 0.10617255360314902, 'max_features': 0.8467268881539082, 'subsample': 0.5124210534698324, 'dropout_rate': 0.1339568302910725, 'ccp_alpha': 0.19645149417069752}. Best is trial 229 with value: 0.7437241350191778.[0m
[32m[I 2022-04-14 08:56:03,525][0m Trial 240 finished with value: 0.7377432494887154 and parameters: {'loss': 'coxph', 'learning_rate': 0.0020505597778034124, 'n_estimators': 950, 'criterion': 'squared_error', 'min_samples_split': 7, 'min_samples_leaf': 1, 'min_weight_fraction_leaf': 0.09863735577858923, 'min_impurity_decrease': 0.07899645974633175, 'max_features': 0.8560474210395386, 'subsample': 0.524578481626064, 'dropout_rate': 0.17383191501963535, 'ccp_alpha': 0.09856030968129163}. Best is trial 229 with value: 0.7437241350191778.[0m
[32m[I 2022-04-14 08:58:40,090][0m Trial 241 finished with value: 0.7436788243677505 and parameters: {'loss': 'coxph', 'learning_rate': 0.0025076446659162387, 'n_estimators': 947, 'criterion': 'squared_error', 'min_samples_split': 7, 'min_samples_leaf': 1, 'min_weight_fraction_leaf': 0.09770631337153025, 'min_impurity_decrease': 0.07823129515326668, 'max_features': 0.8436817980678295, 'subsample': 0.5248650324784524, 'dropout_rate': 0.17272270841773837, 'ccp_alpha': 0.09297336642776803}. Best is trial 229 with value: 0.7437241350191778.[0m
[32m[I 2022-04-14 09:01:17,044][0m Trial 242 finished with value: 0.5 and parameters: {'loss': 'coxph', 'learning_rate': 0.002598971204971987, 'n_estimators': 961, 'criterion': 'squared_error', 'min_samples_split': 7, 'min_samples_leaf': 1, 'min_weight_fraction_leaf': 0.09873916943430781, 'min_impurity_decrease': 0.06110440482195646, 'max_features': 0.8615000118166175, 'subsample': 0.5141855290181745, 'dropout_rate': 0.17354770743656822, 'ccp_alpha': 2.2514239569033494}. Best is trial 229 with value: 0.7437241350191778.[0m
