[32m[I 2022-04-14 03:17:18,334][0m Trial 722 finished with value: 0.8769552148674767 and parameters: {'loss': 'coxph', 'learning_rate': 0.003109716623469837, 'n_estimators': 248, 'criterion': 'friedman_mse', 'min_samples_split': 5, 'min_samples_leaf': 1, 'min_weight_fraction_leaf': 0.06217398304523761, 'min_impurity_decrease': 0.2562397465709713, 'max_features': 0.9632305328263143, 'subsample': 0.6996873735681282, 'dropout_rate': 0.32211021650806426, 'ccp_alpha': 0.004458350699105727}. Best is trial 627 with value: 0.8808013426064705.[0m
[32m[I 2022-04-14 03:17:28,402][0m Trial 723 finished with value: 0.8744489146700843 and parameters: {'loss': 'coxph', 'learning_rate': 0.001830786428036073, 'n_estimators': 245, 'criterion': 'friedman_mse', 'min_samples_split': 5, 'min_samples_leaf': 1, 'min_weight_fraction_leaf': 0.05902484181361224, 'min_impurity_decrease': 0.2426362467747628, 'max_features': 0.9815169681447213, 'subsample': 0.7309884958993057, 'dropout_rate': 0.3331877437242412, 'ccp_alpha': 0.0024081019848689947}. Best is trial 627 with value: 0.8808013426064705.[0m
[32m[I 2022-04-14 03:17:36,938][0m Trial 724 finished with value: 0.8531745987138161 and parameters: {'loss': 'coxph', 'learning_rate': 0.0027004218539033614, 'n_estimators': 229, 'criterion': 'friedman_mse', 'min_samples_split': 5, 'min_samples_leaf': 1, 'min_weight_fraction_leaf': 0.06215159134278438, 'min_impurity_decrease': 0.2597258810705965, 'max_features': 0.9418497849123604, 'subsample': 0.6855988504081507, 'dropout_rate': 0.33537934792688584, 'ccp_alpha': 0.23946108585441706}. Best is trial 627 with value: 0.8808013426064705.[0m
[32m[I 2022-04-14 03:17:45,173][0m Trial 725 finished with value: 0.8681512056792743 and parameters: {'loss': 'coxph', 'learning_rate': 0.0022448419479685865, 'n_estimators': 249, 'criterion': 'friedman_mse', 'min_samples_split': 5, 'min_samples_leaf': 1, 'min_weight_fraction_leaf': 0.0347982084945239, 'min_impurity_decrease': 0.22284787426576608, 'max_features': 0.9988652519951846, 'subsample': 0.7435651056515299, 'dropout_rate': 0.3793825067928956, 'ccp_alpha': 0.10014009308366002}. Best is trial 627 with value: 0.8808013426064705.[0m
[32m[I 2022-04-14 03:17:55,211][0m Trial 726 finished with value: 0.8607684087626415 and parameters: {'loss': 'coxph', 'learning_rate': 0.0016611028325614452, 'n_estimators': 289, 'criterion': 'friedman_mse', 'min_samples_split': 5, 'min_samples_leaf': 1, 'min_weight_fraction_leaf': 0.043389817991188226, 'min_impurity_decrease': 0.2674951231061634, 'max_features': 0.9166576150315936, 'subsample': 0.6596697567537394, 'dropout_rate': 0.41021859105724895, 'ccp_alpha': 0.16657987314238493}. Best is trial 627 with value: 0.8808013426064705.[0m
[32m[I 2022-04-14 03:18:11,398][0m Trial 727 finished with value: 0.8717066814761243 and parameters: {'loss': 'coxph', 'learning_rate': 0.002949348522572663, 'n_estimators': 308, 'criterion': 'friedman_mse', 'min_samples_split': 4, 'min_samples_leaf': 1, 'min_weight_fraction_leaf': 0.06473131424610683, 'min_impurity_decrease': 0.24416774568469968, 'max_features': 0.9680069380469438, 'subsample': 0.710247656171584, 'dropout_rate': 0.34273959042640645, 'ccp_alpha': 0.093410161701673}. Best is trial 627 with value: 0.8808013426064705.[0m
[32m[I 2022-04-14 03:18:14,765][0m Trial 728 finished with value: 0.8752207755966313 and parameters: {'loss': 'coxph', 'learning_rate': 0.001288825866168023, 'n_estimators': 203, 'criterion': 'friedman_mse', 'min_samples_split': 4, 'min_samples_leaf': 1, 'min_weight_fraction_leaf': 0.03327975655893658, 'min_impurity_decrease': 0.2879477962477188, 'max_features': 0.979186729258119, 'subsample': 0.7308254195458245, 'dropout_rate': 0.6877486049908296, 'ccp_alpha': 0.002166526332329267}. Best is trial 627 with value: 0.8808013426064705.[0m
[32m[I 2022-04-14 03:18:30,457][0m Trial 729 finished with value: 0.8554411147974799 and parameters: {'loss': 'coxph', 'learning_rate': 0.0022069544912518804, 'n_estimators': 276, 'criterion': 'friedman_mse', 'min_samples_split': 4, 'min_samples_leaf': 1, 'min_weight_fraction_leaf': 0.049601735457784214, 'min_impurity_decrease': 0.3017478829730346, 'max_features': 0.9996253949936166, 'subsample': 0.7501450524594316, 'dropout_rate': 0.36623286114729114, 'ccp_alpha': 0.17520359123456009}. Best is trial 627 with value: 0.8808013426064705.[0m
[32m[I 2022-04-14 03:18:35,746][0m Trial 730 finished with value: 0.8371954287258833 and parameters: {'loss': 'coxph', 'learning_rate': 0.0017042153337888085, 'n_estimators': 194, 'criterion': 'friedman_mse', 'min_samples_split': 4, 'min_samples_leaf': 1, 'min_weight_fraction_leaf': 0.028622861446553044, 'min_impurity_decrease': 0.2745825160269875, 'max_features': 0.9483632036533206, 'subsample': 0.2359554699660616, 'dropout_rate': 0.4149484775599173, 'ccp_alpha': 0.2787446591287838}. Best is trial 627 with value: 0.8808013426064705.[0m
[32m[I 2022-04-14 03:18:46,397][0m Trial 731 finished with value: 0.8746388748877869 and parameters: {'loss': 'coxph', 'learning_rate': 0.0027263376255563985, 'n_estimators': 257, 'criterion': 'friedman_mse', 'min_samples_split': 7, 'min_samples_leaf': 2, 'min_weight_fraction_leaf': 0.0673491320946716, 'min_impurity_decrease': 0.21217414973204074, 'max_features': 0.9200701517089086, 'subsample': 0.7105139789062145, 'dropout_rate': 0.37929399793265944, 'ccp_alpha': 0.0013302462296005577}. Best is trial 627 with value: 0.8808013426064705.[0m
[32m[I 2022-04-14 03:18:50,467][0m Trial 732 finished with value: 0.8311670343594896 and parameters: {'loss': 'coxph', 'learning_rate': 0.0020729768661772374, 'n_estimators': 174, 'criterion': 'friedman_mse', 'min_samples_split': 5, 'min_samples_leaf': 1, 'min_weight_fraction_leaf': 0.42207268922769536, 'min_impurity_decrease': 0.31367376016548787, 'max_features': 0.9611092400641427, 'subsample': 0.2839217639136541, 'dropout_rate': 0.32939983626099784, 'ccp_alpha': 0.09555226442948635}. Best is trial 627 with value: 0.8808013426064705.[0m
[32m[I 2022-04-14 03:18:55,613][0m Trial 733 finished with value: 0.65 and parameters: {'loss': 'coxph', 'learning_rate': 0.0012901503651342977, 'n_estimators': 184, 'criterion': 'absolute_error', 'min_samples_split': 4, 'min_samples_leaf': 1, 'min_weight_fraction_leaf': 0.037852381922101865, 'min_impurity_decrease': 0.25577814503397733, 'max_features': 0.9312648929212264, 'subsample': 0.7637318441126836, 'dropout_rate': 0.34785265051696274, 'ccp_alpha': 0.17691644990725422}. Best is trial 627 with value: 0.8808013426064705.[0m
[32m[I 2022-04-14 03:19:00,179][0m Trial 734 finished with value: 0.8738160800526569 and parameters: {'loss': 'coxph', 'learning_rate': 0.004677098023781632, 'n_estimators': 176, 'criterion': 'friedman_mse', 'min_samples_split': 5, 'min_samples_leaf': 2, 'min_weight_fraction_leaf': 0.05374404974691072, 'min_impurity_decrease': 0.3730551395668973, 'max_features': 0.9080758435498635, 'subsample': 0.7422947220607489, 'dropout_rate': 0.391389739037604, 'ccp_alpha': 0.0014314357018361174}. Best is trial 627 with value: 0.8808013426064705.[0m
[32m[I 2022-04-14 03:19:05,925][0m Trial 735 finished with value: -0.36838197914419857 and parameters: {'loss': 'squared', 'learning_rate': 0.0034304259607106885, 'n_estimators': 165, 'criterion': 'friedman_mse', 'min_samples_split': 4, 'min_samples_leaf': 1, 'min_weight_fraction_leaf': 0.022617019414194597, 'min_impurity_decrease': 0.285094223054743, 'max_features': 0.639355055502902, 'subsample': 0.6869413356375959, 'dropout_rate': 0.322480190921985, 'ccp_alpha': 0.09310730466378166}. Best is trial 627 with value: 0.8808013426064705.[0m
[32m[I 2022-04-14 03:19:15,881][0m Trial 736 finished with value: 0.8298494818852354 and parameters: {'loss': 'coxph', 'learning_rate': 0.0017155100410798498, 'n_estimators': 224, 'criterion': 'friedman_mse', 'min_samples_split': 6, 'min_samples_leaf': 1, 'min_weight_fraction_leaf': 0.04624946415032408, 'min_impurity_decrease': 0.3555931314645069, 'max_features': 0.4713094749517475, 'subsample': 0.7217741154844833, 'dropout_rate': 0.4124042527969377, 'ccp_alpha': 0.24726837559284098}. Best is trial 627 with value: 0.8808013426064705.[0m
[32m[I 2022-04-14 03:19:22,157][0m Trial 737 finished with value: 0.65 and parameters: {'loss': 'coxph', 'learning_rate': 0.0025001668856454284, 'n_estimators': 175, 'criterion': 'friedman_mse', 'min_samples_split': 4, 'min_samples_leaf': 2, 'min_weight_fraction_leaf': 0.036346349335810116, 'min_impurity_decrease': 0.2432711843611816, 'max_features': 0.9999213372544157, 'subsample': 0.7718154322533481, 'dropout_rate': 0.35883025291788817, 'ccp_alpha': 3.390889516528147}. Best is trial 627 with value: 0.8808013426064705.[0m
[32m[I 2022-04-14 03:19:29,537][0m Trial 738 finished with value: 0.6524506958451449 and parameters: {'loss': 'coxph', 'learning_rate': 0.0015111084407896614, 'n_estimators': 208, 'criterion': 'friedman_mse', 'min_samples_split': 9, 'min_samples_leaf': 1, 'min_weight_fraction_leaf': 0.06519814301103069, 'min_impurity_decrease': 0.39014038157968434, 'max_features': 0.9773864181611168, 'subsample': 0.7447050666998299, 'dropout_rate': 0.38043814496223843, 'ccp_alpha': 0.3790225727690028}. Best is trial 627 with value: 0.8808013426064705.[0m
[32m[I 2022-04-14 03:19:36,931][0m Trial 739 finished with value: 0.6788295706342503 and parameters: {'loss': 'coxph', 'learning_rate': 0.0021435069732513245, 'n_estimators': 232, 'criterion': 'squared_error', 'min_samples_split': 4, 'min_samples_leaf': 1, 'min_weight_fraction_leaf': 0.026545970675706902, 'min_impurity_decrease': 0.3237368963598991, 'max_features': 0.9473015628371048, 'subsample': 0.7062457510124135, 'dropout_rate': 0.4174010247203745, 'ccp_alpha': 0.09047510450942944}. Best is trial 627 with value: 0.8808013426064705.[0m
[32m[I 2022-04-14 03:19:43,324][0m Trial 740 finished with value: 0.65 and parameters: {'loss': 'coxph', 'learning_rate': 0.003158845514881739, 'n_estimators': 191, 'criterion': 'friedman_mse', 'min_samples_split': 4, 'min_samples_leaf': 2, 'min_weight_fraction_leaf': 0.04641969689196742, 'min_impurity_decrease': 0.3033165500622928, 'max_features': 0.96247663412781, 'subsample': 0.7849914101866267, 'dropout_rate': 0.3169975599506213, 'ccp_alpha': 1.8029680114541862}. Best is trial 627 with value: 0.8808013426064705.[0m
[32m[I 2022-04-14 03:19:52,923][0m Trial 741 finished with value: 0.8590870972951784 and parameters: {'loss': 'coxph', 'learning_rate': 0.005705577029104699, 'n_estimators': 242, 'criterion': 'friedman_mse', 'min_samples_split': 4, 'min_samples_leaf': 1, 'min_weight_fraction_leaf': 0.056877524721844736, 'min_impurity_decrease': 0.34231429381690026, 'max_features': 0.9300374473059303, 'subsample': 0.7594079368355797, 'dropout_rate': 0.34736224998455595, 'ccp_alpha': 0.16477917933470246}. Best is trial 627 with value: 0.8808013426064705.[0m
[32m[I 2022-04-14 03:19:56,408][0m Trial 742 finished with value: 0.8684457722507591 and parameters: {'loss': 'coxph', 'learning_rate': 0.0011837571081884234, 'n_estimators': 159, 'criterion': 'friedman_mse', 'min_samples_split': 5, 'min_samples_leaf': 1, 'min_weight_fraction_leaf': 0.03319388728460904, 'min_impurity_decrease': 0.2614534783445011, 'max_features': 0.9051857055160176, 'subsample': 0.7259274133143467, 'dropout_rate': 0.39329290731429506, 'ccp_alpha': 0.09811707007463483}. Best is trial 627 with value: 0.8808013426064705.[0m
[32m[I 2022-04-14 03:20:02,284][0m Trial 743 finished with value: 0.8376122235338459 and parameters: {'loss': 'coxph', 'learning_rate': 0.0019974215780508195, 'n_estimators': 255, 'criterion': 'friedman_mse', 'min_samples_split': 4, 'min_samples_leaf': 2, 'min_weight_fraction_leaf': 0.021312363308174737, 'min_impurity_decrease': 0.2964586567591414, 'max_features': 0.9806589122628211, 'subsample': 0.6731116436263566, 'dropout_rate': 0.6587895080319031, 'ccp_alpha': 0.24454185629771785}. Best is trial 627 with value: 0.8808013426064705.[0m
[32m[I 2022-04-14 03:20:10,140][0m Trial 744 finished with value: 0.8699504184402956 and parameters: {'loss': 'coxph', 'learning_rate': 0.002603402467391641, 'n_estimators': 200, 'criterion': 'friedman_mse', 'min_samples_split': 4, 'min_samples_leaf': 1, 'min_weight_fraction_leaf': 0.04251147416262052, 'min_impurity_decrease': 0.37934553895140083, 'max_features': 0.9475857661233937, 'subsample': 0.7968903002214114, 'dropout_rate': 0.3693811760747947, 'ccp_alpha': 0.08561515569174691}. Best is trial 627 with value: 0.8808013426064705.[0m
[32m[I 2022-04-14 03:20:14,257][0m Trial 745 finished with value: 0.8574122325082378 and parameters: {'loss': 'coxph', 'learning_rate': 0.003983181821806715, 'n_estimators': 170, 'criterion': 'friedman_mse', 'min_samples_split': 4, 'min_samples_leaf': 1, 'min_weight_fraction_leaf': 0.2747812113460314, 'min_impurity_decrease': 0.3294091602802888, 'max_features': 0.9654796618761526, 'subsample': 0.7686260550283349, 'dropout_rate': 0.4216958054571225, 'ccp_alpha': 0.09539032929266028}. Best is trial 627 with value: 0.8808013426064705.[0m
[32m[I 2022-04-14 03:20:15,829][0m Trial 746 finished with value: 0.8724505595748677 and parameters: {'loss': 'coxph', 'learning_rate': 0.0016088947361057996, 'n_estimators': 125, 'criterion': 'friedman_mse', 'min_samples_split': 4, 'min_samples_leaf': 2, 'min_weight_fraction_leaf': 0.07070514426753059, 'min_impurity_decrease': 0.23576223190524195, 'max_features': 0.9257686485520028, 'subsample': 0.7397758015555074, 'dropout_rate': 0.6140647295632113, 'ccp_alpha': 0.004967054384423452}. Best is trial 627 with value: 0.8808013426064705.[0m
[32m[I 2022-04-14 03:20:21,871][0m Trial 747 finished with value: 0.8567549828778402 and parameters: {'loss': 'coxph', 'learning_rate': 0.003127580249082638, 'n_estimators': 183, 'criterion': 'friedman_mse', 'min_samples_split': 4, 'min_samples_leaf': 1, 'min_weight_fraction_leaf': 0.05349585767198705, 'min_impurity_decrease': 0.27115898642604175, 'max_features': 0.9773570748397302, 'subsample': 0.7004422246066083, 'dropout_rate': 0.29699242570503914, 'ccp_alpha': 0.1783959683173322}. Best is trial 627 with value: 0.8808013426064705.[0m
[32m[I 2022-04-14 03:20:23,672][0m Trial 748 finished with value: 0.65 and parameters: {'loss': 'coxph', 'learning_rate': 0.0012745292779099365, 'n_estimators': 150, 'criterion': 'friedman_mse', 'min_samples_split': 4, 'min_samples_leaf': 1, 'min_weight_fraction_leaf': 0.03546364930060174, 'min_impurity_decrease': 0.3497130053033712, 'max_features': 0.9053181885178909, 'subsample': 0.7572178590471529, 'dropout_rate': 0.8644048307851243, 'ccp_alpha': 4.439608161688846}. Best is trial 627 with value: 0.8808013426064705.[0m
[32m[I 2022-04-14 03:20:27,225][0m Trial 749 finished with value: 0.6843657885296233 and parameters: {'loss': 'coxph', 'learning_rate': 0.0022410195583277017, 'n_estimators': 160, 'criterion': 'friedman_mse', 'min_samples_split': 6, 'min_samples_leaf': 2, 'min_weight_fraction_leaf': 0.019172048097033677, 'min_impurity_decrease': 0.31060260258064104, 'max_features': 0.9485832195710349, 'subsample': 0.7290927454080123, 'dropout_rate': 0.4013748998928693, 'ccp_alpha': 0.2906572059168703}. Best is trial 627 with value: 0.8808013426064705.[0m
[32m[I 2022-04-14 03:20:34,972][0m Trial 750 finished with value: 0.8748449299253027 and parameters: {'loss': 'coxph', 'learning_rate': 0.0017231054875981359, 'n_estimators': 220, 'criterion': 'friedman_mse', 'min_samples_split': 5, 'min_samples_leaf': 1, 'min_weight_fraction_leaf': 0.06203374956571762, 'min_impurity_decrease': 0.36448660598551946, 'max_features': 0.9854026328101908, 'subsample': 0.7802870948236148, 'dropout_rate': 0.3640867766836176, 'ccp_alpha': 0.08364443086266987}. Best is trial 627 with value: 0.8808013426064705.[0m
[32m[I 2022-04-14 03:20:42,130][0m Trial 751 finished with value: 0.8730707941240385 and parameters: {'loss': 'coxph', 'learning_rate': 0.004008850818211508, 'n_estimators': 199, 'criterion': 'friedman_mse', 'min_samples_split': 4, 'min_samples_leaf': 1, 'min_weight_fraction_leaf': 0.04558937671500794, 'min_impurity_decrease': 0.393010271104549, 'max_features': 0.9315248033678702, 'subsample': 0.7969584502190271, 'dropout_rate': 0.3432935323305072, 'ccp_alpha': 0.004699755010955204}. Best is trial 627 with value: 0.8808013426064705.[0m
[32m[I 2022-04-14 03:20:47,650][0m Trial 752 finished with value: 0.8555325298248301 and parameters: {'loss': 'coxph', 'learning_rate': 0.002520878177984972, 'n_estimators': 190, 'criterion': 'friedman_mse', 'min_samples_split': 4, 'min_samples_leaf': 2, 'min_weight_fraction_leaf': 0.028018520891961118, 'min_impurity_decrease': 0.2813890016310707, 'max_features': 0.9627397574261247, 'subsample': 0.7155041082742495, 'dropout_rate': 0.3785837743632004, 'ccp_alpha': 0.177342967830938}. Best is trial 627 with value: 0.8808013426064705.[0m
[32m[I 2022-04-14 03:20:53,115][0m Trial 753 finished with value: 0.8732490513080226 and parameters: {'loss': 'coxph', 'learning_rate': 0.001395786847280623, 'n_estimators': 167, 'criterion': 'friedman_mse', 'min_samples_split': 5, 'min_samples_leaf': 1, 'min_weight_fraction_leaf': 0.07455563497585906, 'min_impurity_decrease': 0.32738649839129574, 'max_features': 0.902713101626367, 'subsample': 0.6872869041544625, 'dropout_rate': 0.42759182545832364, 'ccp_alpha': 0.09352944436117855}. Best is trial 627 with value: 0.8808013426064705.[0m
[32m[I 2022-04-14 03:20:54,526][0m Trial 754 finished with value: -0.33125510238164313 and parameters: {'loss': 'squared', 'learning_rate': 0.002011083678515196, 'n_estimators': 132, 'criterion': 'absolute_error', 'min_samples_split': 4, 'min_samples_leaf': 1, 'min_weight_fraction_leaf': 0.03941979016950569, 'min_impurity_decrease': 0.21134450650512307, 'max_features': 0.9803762508950665, 'subsample': 0.7521143429027894, 'dropout_rate': 0.7387225589687547, 'ccp_alpha': 0.20102130929739034}. Best is trial 627 with value: 0.8808013426064705.[0m
[32m[I 2022-04-14 03:21:06,466][0m Trial 755 finished with value: 0.8752111439022265 and parameters: {'loss': 'coxph', 'learning_rate': 0.002922580378333923, 'n_estimators': 270, 'criterion': 'friedman_mse', 'min_samples_split': 7, 'min_samples_leaf': 2, 'min_weight_fraction_leaf': 0.053789323000226874, 'min_impurity_decrease': 0.2539933361357324, 'max_features': 0.9445330249139952, 'subsample': 0.7756003797452977, 'dropout_rate': 0.3264149380068444, 'ccp_alpha': 0.001191513815362611}. Best is trial 627 with value: 0.8808013426064705.[0m
[32m[I 2022-04-14 03:21:09,469][0m Trial 756 finished with value: 0.8673122264290216 and parameters: {'loss': 'coxph', 'learning_rate': 0.0012455092430971718, 'n_estimators': 158, 'criterion': 'friedman_mse', 'min_samples_split': 4, 'min_samples_leaf': 1, 'min_weight_fraction_leaf': 0.02784514767547981, 'min_impurity_decrease': 0.3026205285647013, 'max_features': 0.9220800388791852, 'subsample': 0.737865777472798, 'dropout_rate': 0.4258259927892886, 'ccp_alpha': 0.0942540612528178}. Best is trial 627 with value: 0.8808013426064705.[0m
[32m[I 2022-04-14 03:21:29,917][0m Trial 757 finished with value: 0.65 and parameters: {'loss': 'coxph', 'learning_rate': 0.0016798283930759645, 'n_estimators': 350, 'criterion': 'friedman_mse', 'min_samples_split': 4, 'min_samples_leaf': 1, 'min_weight_fraction_leaf': 0.009621902540704115, 'min_impurity_decrease': 0.9154153020132332, 'max_features': 0.9996775042883945, 'subsample': 0.8038705367846221, 'dropout_rate': 0.38656482583818796, 'ccp_alpha': 0.43302438953363254}. Best is trial 627 with value: 0.8808013426064705.[0m
[32m[I 2022-04-14 03:21:38,027][0m Trial 758 finished with value: 0.8318836031227758 and parameters: {'loss': 'coxph', 'learning_rate': 0.00516690417581471, 'n_estimators': 209, 'criterion': 'friedman_mse', 'min_samples_split': 4, 'min_samples_leaf': 2, 'min_weight_fraction_leaf': 0.04508427678500965, 'min_impurity_decrease': 0.3727906860963998, 'max_features': 0.9663476177761352, 'subsample': 0.662492786199094, 'dropout_rate': 0.3481653803130326, 'ccp_alpha': 0.28908645403143396}. Best is trial 627 with value: 0.8808013426064705.[0m
[32m[I 2022-04-14 03:21:43,002][0m Trial 759 finished with value: 0.8533875736090376 and parameters: {'loss': 'coxph', 'learning_rate': 0.003332366838417055, 'n_estimators': 180, 'criterion': 'friedman_mse', 'min_samples_split': 5, 'min_samples_leaf': 1, 'min_weight_fraction_leaf': 0.062096718289180015, 'min_impurity_decrease': 0.28724697003104854, 'max_features': 0.9070001761761, 'subsample': 0.7595704907327324, 'dropout_rate': 0.4038761887013549, 'ccp_alpha': 0.17340207119570128}. Best is trial 627 with value: 0.8808013426064705.[0m
[32m[I 2022-04-14 03:21:59,377][0m Trial 760 finished with value: 0.8686984762619856 and parameters: {'loss': 'coxph', 'learning_rate': 0.002375624288217955, 'n_estimators': 316, 'criterion': 'friedman_mse', 'min_samples_split': 3, 'min_samples_leaf': 1, 'min_weight_fraction_leaf': 0.01876764255038596, 'min_impurity_decrease': 0.34728797175876647, 'max_features': 0.9431983923242278, 'subsample': 0.7169721961343251, 'dropout_rate': 0.2922753071881584, 'ccp_alpha': 0.08509721265417669}. Best is trial 627 with value: 0.8808013426064705.[0m
[32m[I 2022-04-14 03:22:02,268][0m Trial 761 finished with value: 0.65 and parameters: {'loss': 'coxph', 'learning_rate': 0.0018128197266903468, 'n_estimators': 146, 'criterion': 'squared_error', 'min_samples_split': 6, 'min_samples_leaf': 2, 'min_weight_fraction_leaf': 0.03497659562971591, 'min_impurity_decrease': 0.3882341883397059, 'max_features': 0.980570486721849, 'subsample': 0.7792361068145264, 'dropout_rate': 0.36578477875026494, 'ccp_alpha': 3.8765401405829016}. Best is trial 627 with value: 0.8808013426064705.[0m
