[32m[I 2022-04-20 03:28:57,646][0m Trial 624 finished with value: 0.7028706367203381 and parameters: {'n_hidden': 32, 'mixture_components': 2, 'use_sparse_layer': False, 'use_batchnorm': True, 'use_dropout': False, 'mlp_size_1': 0, 'mlp_size_2': 2, 'mlp_size_3': 0, 'kernel': 'Exponential', 'loss_name': 'NLLLoss'}. Best is trial 526 with value: 0.7438354099715846.[0m
[32m[I 2022-04-20 03:33:19,102][0m Trial 625 finished with value: 0.7085730935733223 and parameters: {'n_hidden': 32, 'mixture_components': 2, 'use_sparse_layer': False, 'use_batchnorm': True, 'use_dropout': False, 'mlp_size_1': 0, 'mlp_size_2': 2, 'mlp_size_3': 0, 'kernel': 'Exponential', 'loss_name': 'NLLLoss'}. Best is trial 526 with value: 0.7438354099715846.[0m
[32m[I 2022-04-20 03:36:40,720][0m Trial 626 finished with value: 0.6711104794398176 and parameters: {'n_hidden': 32, 'mixture_components': 2, 'use_sparse_layer': False, 'use_batchnorm': True, 'use_dropout': False, 'mlp_size_1': 0, 'mlp_size_2': 2, 'mlp_size_3': 0, 'kernel': 'Normal', 'loss_name': 'NLLLoss'}. Best is trial 526 with value: 0.7438354099715846.[0m
[32m[I 2022-04-20 03:40:57,252][0m Trial 627 finished with value: 0.7142876011970245 and parameters: {'n_hidden': 32, 'mixture_components': 5, 'use_sparse_layer': False, 'use_batchnorm': True, 'use_dropout': False, 'mlp_size_1': 0, 'mlp_size_2': 2, 'mlp_size_3': 0, 'kernel': 'Exponential', 'loss_name': 'NLLLoss'}. Best is trial 526 with value: 0.7438354099715846.[0m
[32m[I 2022-04-20 03:45:52,627][0m Trial 628 finished with value: 0.7044347387265203 and parameters: {'n_hidden': 32, 'mixture_components': 2, 'use_sparse_layer': False, 'use_batchnorm': True, 'use_dropout': False, 'mlp_size_1': 0, 'mlp_size_2': 2, 'mlp_size_3': 0, 'kernel': 'Exponential', 'loss_name': 'NLLLoss'}. Best is trial 526 with value: 0.7438354099715846.[0m
[32m[I 2022-04-20 03:50:14,080][0m Trial 629 finished with value: 0.7276525079826779 and parameters: {'n_hidden': 32, 'mixture_components': 2, 'use_sparse_layer': True, 'use_sparse_loss': False, 'use_batchnorm': True, 'use_dropout': False, 'mlp_size_1': 0, 'mlp_size_2': 2, 'mlp_size_3': 0, 'kernel': 'Exponential', 'loss_name': 'NLLLoss'}. Best is trial 526 with value: 0.7438354099715846.[0m
[32m[I 2022-04-20 03:52:50,683][0m Trial 630 finished with value: 0.6318948882022605 and parameters: {'n_hidden': 64, 'mixture_components': 2, 'use_sparse_layer': True, 'use_sparse_loss': False, 'use_batchnorm': True, 'use_dropout': False, 'mlp_size_1': 0, 'mlp_size_2': 2, 'mlp_size_3': 0, 'kernel': 'Gumbel', 'loss_name': 'NLLLoss'}. Best is trial 526 with value: 0.7438354099715846.[0m
[32m[I 2022-04-20 03:58:06,599][0m Trial 631 finished with value: 0.7166005694106089 and parameters: {'n_hidden': 32, 'mixture_components': 2, 'use_sparse_layer': True, 'use_sparse_loss': False, 'use_batchnorm': True, 'use_dropout': False, 'mlp_size_1': 0, 'mlp_size_2': 2, 'mlp_size_3': 0, 'kernel': 'Exponential', 'loss_name': 'NLLLoss'}. Best is trial 526 with value: 0.7438354099715846.[0m
[32m[I 2022-04-20 04:01:05,249][0m Trial 632 finished with value: 0.7094097202581328 and parameters: {'n_hidden': 1024, 'mixture_components': 2, 'use_sparse_layer': True, 'use_sparse_loss': False, 'use_batchnorm': True, 'use_dropout': False, 'mlp_size_1': 1, 'mlp_size_2': 3, 'mlp_size_3': 3, 'kernel': 'Weibull', 'loss_name': 'NLLLoss'}. Best is trial 526 with value: 0.7438354099715846.[0m
[32m[I 2022-04-20 04:05:34,898][0m Trial 633 finished with value: 0.6933671958019103 and parameters: {'n_hidden': 32, 'mixture_components': 7, 'use_sparse_layer': False, 'use_batchnorm': True, 'use_dropout': False, 'mlp_size_1': 0, 'mlp_size_2': 2, 'mlp_size_3': 0, 'kernel': 'Exponential', 'loss_name': 'AlternativeNLLLoss'}. Best is trial 526 with value: 0.7438354099715846.[0m
[32m[I 2022-04-20 04:10:47,997][0m Trial 634 finished with value: 0.7002648501973655 and parameters: {'n_hidden': 32, 'mixture_components': 2, 'use_sparse_layer': True, 'use_sparse_loss': False, 'use_batchnorm': True, 'use_dropout': False, 'mlp_size_1': 0, 'mlp_size_2': 2, 'mlp_size_3': 0, 'kernel': 'Exponential', 'loss_name': 'NLLLoss'}. Best is trial 526 with value: 0.7438354099715846.[0m
[32m[I 2022-04-20 04:14:25,360][0m Trial 635 finished with value: 0.6798365318185475 and parameters: {'n_hidden': 32, 'mixture_components': 2, 'use_sparse_layer': True, 'use_sparse_loss': False, 'use_batchnorm': True, 'use_dropout': False, 'mlp_size_1': 0, 'mlp_size_2': 2, 'mlp_size_3': 0, 'kernel': 'Logistic', 'loss_name': 'NLLLoss'}. Best is trial 526 with value: 0.7438354099715846.[0m
[32m[I 2022-04-20 04:18:38,496][0m Trial 636 finished with value: 0.7337074223982896 and parameters: {'n_hidden': 32, 'mixture_components': 9, 'use_sparse_layer': True, 'use_sparse_loss': False, 'use_batchnorm': True, 'use_dropout': False, 'mlp_size_1': 0, 'mlp_size_2': 2, 'mlp_size_3': 0, 'kernel': 'Exponential', 'loss_name': 'NLLLoss'}. Best is trial 526 with value: 0.7438354099715846.[0m
[32m[I 2022-04-20 04:24:11,337][0m Trial 637 finished with value: 0.7136895522613711 and parameters: {'n_hidden': 32, 'mixture_components': 7, 'use_sparse_layer': True, 'use_sparse_loss': False, 'use_batchnorm': True, 'use_dropout': False, 'mlp_size_1': 0, 'mlp_size_2': 2, 'mlp_size_3': 0, 'kernel': 'Exponential', 'loss_name': 'NLLLoss'}. Best is trial 526 with value: 0.7438354099715846.[0m
[32m[I 2022-04-20 04:28:44,206][0m Trial 638 finished with value: 0.7224365236288144 and parameters: {'n_hidden': 32, 'mixture_components': 8, 'use_sparse_layer': True, 'use_sparse_loss': False, 'use_batchnorm': True, 'use_dropout': False, 'mlp_size_1': 0, 'mlp_size_2': 2, 'mlp_size_3': 0, 'kernel': 'Exponential', 'loss_name': 'NLLLoss'}. Best is trial 526 with value: 0.7438354099715846.[0m
[32m[I 2022-04-20 04:34:40,555][0m Trial 639 finished with value: 0.7085207751967516 and parameters: {'n_hidden': 32, 'mixture_components': 10, 'use_sparse_layer': True, 'use_sparse_loss': False, 'use_batchnorm': True, 'use_dropout': False, 'mlp_size_1': 0, 'mlp_size_2': 2, 'mlp_size_3': 0, 'kernel': 'LogNormal', 'loss_name': 'NLLLoss'}. Best is trial 526 with value: 0.7438354099715846.[0m
[32m[I 2022-04-20 04:39:11,929][0m Trial 640 finished with value: 0.722750271552244 and parameters: {'n_hidden': 32, 'mixture_components': 10, 'use_sparse_layer': True, 'use_sparse_loss': False, 'use_batchnorm': True, 'use_dropout': False, 'mlp_size_1': 0, 'mlp_size_2': 2, 'mlp_size_3': 0, 'kernel': 'Exponential', 'loss_name': 'NLLLoss'}. Best is trial 526 with value: 0.7438354099715846.[0m
[32m[I 2022-04-20 04:44:45,173][0m Trial 641 finished with value: 0.6628173555748696 and parameters: {'n_hidden': 128, 'mixture_components': 2, 'use_sparse_layer': True, 'use_sparse_loss': False, 'use_batchnorm': True, 'use_dropout': False, 'mlp_size_1': 0, 'mlp_size_2': 2, 'mlp_size_3': 2, 'kernel': 'Exponential', 'loss_name': 'NLLLoss'}. Best is trial 526 with value: 0.7438354099715846.[0m
[32m[I 2022-04-20 04:49:18,720][0m Trial 642 finished with value: 0.7130237020675213 and parameters: {'n_hidden': 32, 'mixture_components': 9, 'use_sparse_layer': True, 'use_sparse_loss': False, 'use_batchnorm': True, 'use_dropout': False, 'mlp_size_1': 0, 'mlp_size_2': 2, 'mlp_size_3': 0, 'kernel': 'Exponential', 'loss_name': 'NLLLoss'}. Best is trial 526 with value: 0.7438354099715846.[0m
[32m[I 2022-04-20 04:54:56,670][0m Trial 643 finished with value: 0.7217005844875184 and parameters: {'n_hidden': 32, 'mixture_components': 8, 'use_sparse_layer': False, 'use_batchnorm': True, 'use_dropout': False, 'mlp_size_1': 0, 'mlp_size_2': 2, 'mlp_size_3': 0, 'kernel': 'Exponential', 'loss_name': 'NLLLoss'}. Best is trial 526 with value: 0.7438354099715846.[0m
[32m[I 2022-04-20 05:00:28,454][0m Trial 644 finished with value: 0.7234071172086299 and parameters: {'n_hidden': 32, 'mixture_components': 2, 'use_sparse_layer': True, 'use_sparse_loss': False, 'use_batchnorm': True, 'use_dropout': False, 'mlp_size_1': 0, 'mlp_size_2': 2, 'mlp_size_3': 0, 'kernel': 'Exponential', 'loss_name': 'NLLLoss'}. Best is trial 526 with value: 0.7438354099715846.[0m
[32m[I 2022-04-20 05:06:05,089][0m Trial 645 finished with value: 0.7077124918898648 and parameters: {'n_hidden': 32, 'mixture_components': 5, 'use_sparse_layer': True, 'use_sparse_loss': False, 'use_batchnorm': True, 'use_dropout': False, 'mlp_size_1': 0, 'mlp_size_2': 2, 'mlp_size_3': 0, 'kernel': 'Exponential', 'loss_name': 'NLLLoss'}. Best is trial 526 with value: 0.7438354099715846.[0m
[32m[I 2022-04-20 05:10:59,844][0m Trial 646 finished with value: 0.7180522853190615 and parameters: {'n_hidden': 32, 'mixture_components': 9, 'use_sparse_layer': True, 'use_sparse_loss': False, 'use_batchnorm': True, 'use_dropout': False, 'mlp_size_1': 0, 'mlp_size_2': 2, 'mlp_size_3': 0, 'kernel': 'Exponential', 'loss_name': 'NLLLoss'}. Best is trial 526 with value: 0.7438354099715846.[0m
[32m[I 2022-04-20 05:14:55,461][0m Trial 647 finished with value: 0.6981010524563589 and parameters: {'n_hidden': 64, 'mixture_components': 2, 'use_sparse_layer': True, 'use_sparse_loss': False, 'use_batchnorm': True, 'use_dropout': False, 'mlp_size_1': 0, 'mlp_size_2': 2, 'mlp_size_3': 0, 'kernel': 'Exponential', 'loss_name': 'NLLLoss'}. Best is trial 526 with value: 0.7438354099715846.[0m
[32m[I 2022-04-20 05:19:58,809][0m Trial 648 finished with value: 0.7275090401836537 and parameters: {'n_hidden': 32, 'mixture_components': 2, 'use_sparse_layer': True, 'use_sparse_loss': False, 'use_batchnorm': True, 'use_dropout': False, 'mlp_size_1': 0, 'mlp_size_2': 2, 'mlp_size_3': 0, 'kernel': 'Exponential', 'loss_name': 'NLLLoss'}. Best is trial 526 with value: 0.7438354099715846.[0m
[32m[I 2022-04-20 05:25:06,484][0m Trial 649 finished with value: 0.723368195684422 and parameters: {'n_hidden': 32, 'mixture_components': 2, 'use_sparse_layer': True, 'use_sparse_loss': False, 'use_batchnorm': True, 'use_dropout': False, 'mlp_size_1': 0, 'mlp_size_2': 2, 'mlp_size_3': 0, 'kernel': 'Exponential', 'loss_name': 'NLLLoss'}. Best is trial 526 with value: 0.7438354099715846.[0m
[32m[I 2022-04-20 05:29:58,696][0m Trial 650 finished with value: 0.7203885161268115 and parameters: {'n_hidden': 32, 'mixture_components': 7, 'use_sparse_layer': True, 'use_sparse_loss': False, 'use_batchnorm': True, 'use_dropout': False, 'mlp_size_1': 0, 'mlp_size_2': 2, 'mlp_size_3': 0, 'kernel': 'Exponential', 'loss_name': 'NLLLoss'}. Best is trial 526 with value: 0.7438354099715846.[0m
[32m[I 2022-04-20 05:34:52,209][0m Trial 651 finished with value: 0.7316319504144714 and parameters: {'n_hidden': 32, 'mixture_components': 2, 'use_sparse_layer': False, 'use_batchnorm': True, 'use_dropout': False, 'mlp_size_1': 0, 'mlp_size_2': 2, 'mlp_size_3': 0, 'kernel': 'Exponential', 'loss_name': 'NLLLoss'}. Best is trial 526 with value: 0.7438354099715846.[0m
[32m[I 2022-04-20 05:39:30,233][0m Trial 652 finished with value: 0.6739586914495262 and parameters: {'n_hidden': 256, 'mixture_components': 2, 'use_sparse_layer': True, 'use_sparse_loss': False, 'use_batchnorm': True, 'use_dropout': False, 'mlp_size_1': 0, 'mlp_size_2': 4, 'mlp_size_3': 1, 'kernel': 'Exponential', 'loss_name': 'AlternativeNLLLoss'}. Best is trial 526 with value: 0.7438354099715846.[0m
[32m[I 2022-04-20 05:42:22,585][0m Trial 653 finished with value: 0.6774279935171784 and parameters: {'n_hidden': 32, 'mixture_components': 2, 'use_sparse_layer': True, 'use_sparse_loss': False, 'use_batchnorm': True, 'use_dropout': False, 'mlp_size_1': 0, 'mlp_size_2': 2, 'mlp_size_3': 0, 'kernel': 'LogLogistic', 'loss_name': 'NLLLoss'}. Best is trial 526 with value: 0.7438354099715846.[0m
[32m[I 2022-04-20 05:47:47,482][0m Trial 654 finished with value: 0.7297794150447754 and parameters: {'n_hidden': 32, 'mixture_components': 2, 'use_sparse_layer': True, 'use_sparse_loss': False, 'use_batchnorm': True, 'use_dropout': False, 'mlp_size_1': 0, 'mlp_size_2': 2, 'mlp_size_3': 0, 'kernel': 'Exponential', 'loss_name': 'NLLLoss'}. Best is trial 526 with value: 0.7438354099715846.[0m
[32m[I 2022-04-20 05:51:41,289][0m Trial 655 finished with value: 0.659929642446454 and parameters: {'n_hidden': 1024, 'mixture_components': 2, 'use_sparse_layer': True, 'use_sparse_loss': False, 'use_batchnorm': True, 'use_dropout': False, 'mlp_size_1': 1, 'mlp_size_2': 3, 'mlp_size_3': 3, 'kernel': 'Exponential', 'loss_name': 'NLLLoss'}. Best is trial 526 with value: 0.7438354099715846.[0m
[32m[I 2022-04-20 05:54:49,704][0m Trial 656 finished with value: 0.6967484016293912 and parameters: {'n_hidden': 32, 'mixture_components': 2, 'use_sparse_layer': True, 'use_sparse_loss': False, 'use_batchnorm': True, 'use_dropout': False, 'mlp_size_1': 0, 'mlp_size_2': 2, 'mlp_size_3': 0, 'kernel': 'Normal', 'loss_name': 'NLLLoss'}. Best is trial 526 with value: 0.7438354099715846.[0m
[32m[I 2022-04-20 05:59:17,999][0m Trial 657 finished with value: 0.7301381028900946 and parameters: {'n_hidden': 32, 'mixture_components': 5, 'use_sparse_layer': True, 'use_sparse_loss': False, 'use_batchnorm': True, 'use_dropout': False, 'mlp_size_1': 0, 'mlp_size_2': 2, 'mlp_size_3': 0, 'kernel': 'Exponential', 'loss_name': 'NLLLoss'}. Best is trial 526 with value: 0.7438354099715846.[0m
[32m[I 2022-04-20 06:02:09,753][0m Trial 658 finished with value: 0.6937795894913015 and parameters: {'n_hidden': 32, 'mixture_components': 2, 'use_sparse_layer': True, 'use_sparse_loss': False, 'use_batchnorm': True, 'use_dropout': False, 'mlp_size_1': 0, 'mlp_size_2': 2, 'mlp_size_3': 0, 'kernel': 'Gumbel', 'loss_name': 'NLLLoss'}. Best is trial 526 with value: 0.7438354099715846.[0m
[32m[I 2022-04-20 06:06:28,969][0m Trial 659 finished with value: 0.7255093980628817 and parameters: {'n_hidden': 32, 'mixture_components': 2, 'use_sparse_layer': True, 'use_sparse_loss': False, 'use_batchnorm': True, 'use_dropout': False, 'mlp_size_1': 0, 'mlp_size_2': 2, 'mlp_size_3': 0, 'kernel': 'Exponential', 'loss_name': 'NLLLoss'}. Best is trial 526 with value: 0.7438354099715846.[0m
[32m[I 2022-04-20 06:12:14,808][0m Trial 660 finished with value: 0.7247354850357566 and parameters: {'n_hidden': 32, 'mixture_components': 2, 'use_sparse_layer': False, 'use_batchnorm': True, 'use_dropout': False, 'mlp_size_1': 0, 'mlp_size_2': 2, 'mlp_size_3': 0, 'kernel': 'Exponential', 'loss_name': 'NLLLoss'}. Best is trial 526 with value: 0.7438354099715846.[0m
[32m[I 2022-04-20 06:15:30,123][0m Trial 661 finished with value: 0.6892911836967792 and parameters: {'n_hidden': 128, 'mixture_components': 2, 'use_sparse_layer': True, 'use_sparse_loss': False, 'use_batchnorm': True, 'use_dropout': False, 'mlp_size_1': 0, 'mlp_size_2': 2, 'mlp_size_3': 1, 'kernel': 'Exponential', 'loss_name': 'NLLLoss'}. Best is trial 526 with value: 0.7438354099715846.[0m
[32m[I 2022-04-20 06:18:46,647][0m Trial 662 finished with value: 0.6846670491152175 and parameters: {'n_hidden': 32, 'mixture_components': 2, 'use_sparse_layer': True, 'use_sparse_loss': False, 'use_batchnorm': True, 'use_dropout': False, 'mlp_size_1': 0, 'mlp_size_2': 2, 'mlp_size_3': 0, 'kernel': 'Weibull', 'loss_name': 'NLLLoss'}. Best is trial 526 with value: 0.7438354099715846.[0m
[32m[I 2022-04-20 06:24:35,382][0m Trial 663 finished with value: 0.71168563897435 and parameters: {'n_hidden': 32, 'mixture_components': 2, 'use_sparse_layer': True, 'use_sparse_loss': False, 'use_batchnorm': True, 'use_dropout': False, 'mlp_size_1': 0, 'mlp_size_2': 2, 'mlp_size_3': 0, 'kernel': 'Exponential', 'loss_name': 'NLLLoss'}. Best is trial 526 with value: 0.7438354099715846.[0m
[32m[I 2022-04-20 06:29:14,446][0m Trial 664 finished with value: 0.7056409025832638 and parameters: {'n_hidden': 32, 'mixture_components': 3, 'use_sparse_layer': True, 'use_sparse_loss': False, 'use_batchnorm': True, 'use_dropout': False, 'mlp_size_1': 0, 'mlp_size_2': 2, 'mlp_size_3': 0, 'kernel': 'Exponential', 'loss_name': 'NLLLoss'}. Best is trial 526 with value: 0.7438354099715846.[0m
[32m[I 2022-04-20 06:35:13,960][0m Trial 665 finished with value: 0.7139383901680039 and parameters: {'n_hidden': 32, 'mixture_components': 2, 'use_sparse_layer': True, 'use_sparse_loss': False, 'use_batchnorm': True, 'use_dropout': False, 'mlp_size_1': 0, 'mlp_size_2': 2, 'mlp_size_3': 0, 'kernel': 'Exponential', 'loss_name': 'NLLLoss'}. Best is trial 526 with value: 0.7438354099715846.[0m
[32m[I 2022-04-20 06:38:46,194][0m Trial 666 finished with value: 0.6693051078429026 and parameters: {'n_hidden': 32, 'mixture_components': 9, 'use_sparse_layer': True, 'use_sparse_loss': False, 'use_batchnorm': True, 'use_dropout': False, 'mlp_size_1': 0, 'mlp_size_2': 2, 'mlp_size_3': 0, 'kernel': 'Logistic', 'loss_name': 'NLLLoss'}. Best is trial 526 with value: 0.7438354099715846.[0m
[32m[I 2022-04-20 06:43:33,757][0m Trial 667 finished with value: 0.7019591273680793 and parameters: {'n_hidden': 32, 'mixture_components': 6, 'use_sparse_layer': True, 'use_sparse_loss': False, 'use_batchnorm': True, 'use_dropout': False, 'mlp_size_1': 0, 'mlp_size_2': 2, 'mlp_size_3': 0, 'kernel': 'LogNormal', 'loss_name': 'NLLLoss'}. Best is trial 526 with value: 0.7438354099715846.[0m
[32m[I 2022-04-20 06:49:21,235][0m Trial 668 finished with value: 0.7147136260786576 and parameters: {'n_hidden': 32, 'mixture_components': 2, 'use_sparse_layer': True, 'use_sparse_loss': False, 'use_batchnorm': True, 'use_dropout': False, 'mlp_size_1': 0, 'mlp_size_2': 2, 'mlp_size_3': 0, 'kernel': 'Exponential', 'loss_name': 'NLLLoss'}. Best is trial 526 with value: 0.7438354099715846.[0m
[32m[I 2022-04-20 06:53:18,601][0m Trial 669 finished with value: 0.7097412483092329 and parameters: {'n_hidden': 64, 'mixture_components': 2, 'use_sparse_layer': False, 'use_batchnorm': True, 'use_dropout': False, 'mlp_size_1': 0, 'mlp_size_2': 3, 'mlp_size_3': 0, 'kernel': 'Exponential', 'loss_name': 'NLLLoss'}. Best is trial 526 with value: 0.7438354099715846.[0m
[32m[I 2022-04-20 06:59:27,152][0m Trial 670 finished with value: 0.7201521873269761 and parameters: {'n_hidden': 32, 'mixture_components': 2, 'use_sparse_layer': True, 'use_sparse_loss': False, 'use_batchnorm': True, 'use_dropout': False, 'mlp_size_1': 0, 'mlp_size_2': 2, 'mlp_size_3': 0, 'kernel': 'Exponential', 'loss_name': 'NLLLoss'}. Best is trial 526 with value: 0.7438354099715846.[0m
[32m[I 2022-04-20 07:04:41,027][0m Trial 671 finished with value: 0.7237320820102371 and parameters: {'n_hidden': 32, 'mixture_components': 2, 'use_sparse_layer': True, 'use_sparse_loss': False, 'use_batchnorm': True, 'use_dropout': False, 'mlp_size_1': 0, 'mlp_size_2': 2, 'mlp_size_3': 0, 'kernel': 'Exponential', 'loss_name': 'NLLLoss'}. Best is trial 526 with value: 0.7438354099715846.[0m
[32m[I 2022-04-20 07:10:03,329][0m Trial 672 finished with value: 0.7236902255904136 and parameters: {'n_hidden': 32, 'mixture_components': 2, 'use_sparse_layer': True, 'use_sparse_loss': False, 'use_batchnorm': True, 'use_dropout': False, 'mlp_size_1': 0, 'mlp_size_2': 2, 'mlp_size_3': 0, 'kernel': 'Exponential', 'loss_name': 'NLLLoss'}. Best is trial 526 with value: 0.7438354099715846.[0m
[32m[I 2022-04-20 07:15:24,137][0m Trial 673 finished with value: 0.7231311130916069 and parameters: {'n_hidden': 32, 'mixture_components': 3, 'use_sparse_layer': True, 'use_sparse_loss': False, 'use_batchnorm': True, 'use_dropout': False, 'mlp_size_1': 0, 'mlp_size_2': 2, 'mlp_size_3': 0, 'kernel': 'Exponential', 'loss_name': 'AlternativeNLLLoss'}. Best is trial 526 with value: 0.7438354099715846.[0m
[32m[I 2022-04-20 07:18:53,717][0m Trial 674 finished with value: 0.684791862439569 and parameters: {'n_hidden': 256, 'mixture_components': 2, 'use_sparse_layer': True, 'use_sparse_loss': False, 'use_batchnorm': True, 'use_dropout': False, 'mlp_size_1': 0, 'mlp_size_2': 4, 'mlp_size_3': 1, 'kernel': 'Exponential', 'loss_name': 'NLLLoss'}. Best is trial 526 with value: 0.7438354099715846.[0m
[32m[I 2022-04-20 07:23:15,249][0m Trial 675 finished with value: 0.7098646967378428 and parameters: {'n_hidden': 32, 'mixture_components': 10, 'use_sparse_layer': True, 'use_sparse_loss': False, 'use_batchnorm': True, 'use_dropout': False, 'mlp_size_1': 0, 'mlp_size_2': 2, 'mlp_size_3': 0, 'kernel': 'Exponential', 'loss_name': 'NLLLoss'}. Best is trial 526 with value: 0.7438354099715846.[0m
[32m[I 2022-04-20 07:26:37,531][0m Trial 676 finished with value: 0.6959526674945637 and parameters: {'n_hidden': 1024, 'mixture_components': 2, 'use_sparse_layer': False, 'use_batchnorm': True, 'use_dropout': False, 'mlp_size_1': 1, 'mlp_size_2': 3, 'mlp_size_3': 3, 'kernel': 'Exponential', 'loss_name': 'NLLLoss'}. Best is trial 526 with value: 0.7438354099715846.[0m
[32m[I 2022-04-20 07:32:25,979][0m Trial 677 finished with value: 0.7239807898750741 and parameters: {'n_hidden': 32, 'mixture_components': 2, 'use_sparse_layer': True, 'use_sparse_loss': False, 'use_batchnorm': True, 'use_dropout': False, 'mlp_size_1': 0, 'mlp_size_2': 2, 'mlp_size_3': 0, 'kernel': 'Exponential', 'loss_name': 'NLLLoss'}. Best is trial 526 with value: 0.7438354099715846.[0m
[32m[I 2022-04-20 07:37:52,043][0m Trial 678 finished with value: 0.7130590305492692 and parameters: {'n_hidden': 32, 'mixture_components': 2, 'use_sparse_layer': True, 'use_sparse_loss': False, 'use_batchnorm': True, 'use_dropout': False, 'mlp_size_1': 0, 'mlp_size_2': 2, 'mlp_size_3': 0, 'kernel': 'Exponential', 'loss_name': 'NLLLoss'}. Best is trial 526 with value: 0.7438354099715846.[0m
[32m[I 2022-04-20 07:43:49,843][0m Trial 679 finished with value: 0.6964980731070725 and parameters: {'n_hidden': 32, 'mixture_components': 2, 'use_sparse_layer': True, 'use_sparse_loss': False, 'use_batchnorm': True, 'use_dropout': False, 'mlp_size_1': 0, 'mlp_size_2': 2, 'mlp_size_3': 0, 'kernel': 'Exponential', 'loss_name': 'NLLLoss'}. Best is trial 526 with value: 0.7438354099715846.[0m
