[32m[I 2022-04-14 03:41:08,594][0m Trial 882 finished with value: 0.8539742996628782 and parameters: {'loss': 'coxph', 'learning_rate': 0.006562608362063775, 'n_estimators': 135, 'criterion': 'friedman_mse', 'min_samples_split': 4, 'min_samples_leaf': 3, 'min_weight_fraction_leaf': 0.044859511532723995, 'min_impurity_decrease': 0.2706976086695769, 'max_features': 0.9227650943200452, 'subsample': 0.7573914748722577, 'dropout_rate': 0.5966149393058918, 'ccp_alpha': 0.1654093347812799}. Best is trial 627 with value: 0.8808013426064705.[0m
[32m[I 2022-04-14 03:41:28,109][0m Trial 883 finished with value: 0.8610052945469192 and parameters: {'loss': 'coxph', 'learning_rate': 0.005384125378537765, 'n_estimators': 563, 'criterion': 'friedman_mse', 'min_samples_split': 4, 'min_samples_leaf': 3, 'min_weight_fraction_leaf': 0.028570847552599126, 'min_impurity_decrease': 0.2981145995163864, 'max_features': 0.9700386040081105, 'subsample': 0.7016366326942001, 'dropout_rate': 0.8015752811965078, 'ccp_alpha': 0.1538897357966124}. Best is trial 627 with value: 0.8808013426064705.[0m
[32m[I 2022-04-14 03:41:31,910][0m Trial 884 finished with value: 0.6524506958451449 and parameters: {'loss': 'coxph', 'learning_rate': 0.003522858812132916, 'n_estimators': 141, 'criterion': 'friedman_mse', 'min_samples_split': 4, 'min_samples_leaf': 3, 'min_weight_fraction_leaf': 0.08466152373998784, 'min_impurity_decrease': 0.2288884421991457, 'max_features': 0.9432632692365438, 'subsample': 0.732269822936675, 'dropout_rate': 0.3314854469340394, 'ccp_alpha': 0.40244725552534416}. Best is trial 627 with value: 0.8808013426064705.[0m
[32m[I 2022-04-14 03:41:34,859][0m Trial 885 finished with value: 0.857030046240002 and parameters: {'loss': 'coxph', 'learning_rate': 0.0030218726589107277, 'n_estimators': 152, 'criterion': 'friedman_mse', 'min_samples_split': 4, 'min_samples_leaf': 1, 'min_weight_fraction_leaf': 0.07300225595135958, 'min_impurity_decrease': 0.516867676425665, 'max_features': 0.23551155480484864, 'subsample': 0.6707198465008894, 'dropout_rate': 0.5226356009183697, 'ccp_alpha': 0.09556657343585867}. Best is trial 627 with value: 0.8808013426064705.[0m
[32m[I 2022-04-14 03:41:36,782][0m Trial 886 finished with value: -0.25 and parameters: {'loss': 'squared', 'learning_rate': 0.003929834764353284, 'n_estimators': 123, 'criterion': 'absolute_error', 'min_samples_split': 5, 'min_samples_leaf': 3, 'min_weight_fraction_leaf': 0.05701082573315508, 'min_impurity_decrease': 0.2825753975100633, 'max_features': 0.9844182536389731, 'subsample': 0.7710237922090724, 'dropout_rate': 0.4925015403707313, 'ccp_alpha': 4.147244261029857}. Best is trial 627 with value: 0.8808013426064705.[0m
[32m[I 2022-04-14 03:41:46,712][0m Trial 887 finished with value: 0.8723512176472663 and parameters: {'loss': 'coxph', 'learning_rate': 0.0046914079766197355, 'n_estimators': 277, 'criterion': 'friedman_mse', 'min_samples_split': 4, 'min_samples_leaf': 5, 'min_weight_fraction_leaf': 0.016088590206104852, 'min_impurity_decrease': 0.25488922728380814, 'max_features': 0.9561119683466681, 'subsample': 0.7520956278509257, 'dropout_rate': 0.3536310083613199, 'ccp_alpha': 0.10830476199778492}. Best is trial 627 with value: 0.8808013426064705.[0m
[32m[I 2022-04-14 03:41:49,391][0m Trial 888 finished with value: 0.8691034325653832 and parameters: {'loss': 'coxph', 'learning_rate': 0.0028938537489765384, 'n_estimators': 140, 'criterion': 'friedman_mse', 'min_samples_split': 4, 'min_samples_leaf': 1, 'min_weight_fraction_leaf': 0.04086628531325349, 'min_impurity_decrease': 0.3029892064163054, 'max_features': 0.912938041038114, 'subsample': 0.716633198234944, 'dropout_rate': 0.4880472830591779, 'ccp_alpha': 0.09040458637558457}. Best is trial 627 with value: 0.8808013426064705.[0m
[32m[I 2022-04-14 03:41:53,133][0m Trial 889 finished with value: 0.8372976315774965 and parameters: {'loss': 'coxph', 'learning_rate': 0.0033032161373846903, 'n_estimators': 132, 'criterion': 'friedman_mse', 'min_samples_split': 4, 'min_samples_leaf': 3, 'min_weight_fraction_leaf': 0.030626552045272235, 'min_impurity_decrease': 0.5793035456147394, 'max_features': 0.8931266392896726, 'subsample': 0.6922390156361129, 'dropout_rate': 0.31614917566053824, 'ccp_alpha': 0.24721812206248744}. Best is trial 627 with value: 0.8808013426064705.[0m
[32m[I 2022-04-14 03:43:58,687][0m Trial 890 finished with value: 0.8622256181117235 and parameters: {'loss': 'coxph', 'learning_rate': 0.0027640749284380296, 'n_estimators': 890, 'criterion': 'friedman_mse', 'min_samples_split': 4, 'min_samples_leaf': 1, 'min_weight_fraction_leaf': 0.04984758848503202, 'min_impurity_decrease': 0.26469479356373365, 'max_features': 0.8685603761849036, 'subsample': 0.7905389777097103, 'dropout_rate': 0.28955224669678437, 'ccp_alpha': 0.08487803581499086}. Best is trial 627 with value: 0.8808013426064705.[0m
[32m[I 2022-04-14 03:44:07,197][0m Trial 891 finished with value: 0.8533472888421046 and parameters: {'loss': 'coxph', 'learning_rate': 0.0072846591976272025, 'n_estimators': 236, 'criterion': 'friedman_mse', 'min_samples_split': 5, 'min_samples_leaf': 1, 'min_weight_fraction_leaf': 0.06202733866011662, 'min_impurity_decrease': 0.2855617506024917, 'max_features': 0.9320241973806392, 'subsample': 0.7405310684718424, 'dropout_rate': 0.4541217899849161, 'ccp_alpha': 0.18345811871271822}. Best is trial 627 with value: 0.8808013426064705.[0m
[32m[I 2022-04-14 03:46:19,315][0m Trial 892 finished with value: 0.6576302970240425 and parameters: {'loss': 'coxph', 'learning_rate': 0.0007898640621176736, 'n_estimators': 936, 'criterion': 'friedman_mse', 'min_samples_split': 4, 'min_samples_leaf': 3, 'min_weight_fraction_leaf': 0.022275096181874558, 'min_impurity_decrease': 0.31353431539602994, 'max_features': 0.9679675274348105, 'subsample': 0.7679639994819137, 'dropout_rate': 0.3482626168218226, 'ccp_alpha': 0.33076328100028757}. Best is trial 627 with value: 0.8808013426064705.[0m
[32m[I 2022-04-14 03:46:22,178][0m Trial 893 finished with value: 0.8547704927567367 and parameters: {'loss': 'coxph', 'learning_rate': 0.01216478666561422, 'n_estimators': 148, 'criterion': 'squared_error', 'min_samples_split': 4, 'min_samples_leaf': 5, 'min_weight_fraction_leaf': 0.03910566397788742, 'min_impurity_decrease': 0.24525753694083396, 'max_features': 0.9848623850887793, 'subsample': 0.6372154907599439, 'dropout_rate': 0.6709417683090689, 'ccp_alpha': 0.001156906226831345}. Best is trial 627 with value: 0.8808013426064705.[0m
[32m[I 2022-04-14 03:46:25,137][0m Trial 894 finished with value: 0.8688830202399178 and parameters: {'loss': 'coxph', 'learning_rate': 0.0024482382533979993, 'n_estimators': 135, 'criterion': 'friedman_mse', 'min_samples_split': 4, 'min_samples_leaf': 1, 'min_weight_fraction_leaf': 0.05098025473382341, 'min_impurity_decrease': 0.27903091304916705, 'max_features': 0.9522147462398236, 'subsample': 0.8126267922573703, 'dropout_rate': 0.47605537571502415, 'ccp_alpha': 0.09506184354331623}. Best is trial 627 with value: 0.8808013426064705.[0m
[32m[I 2022-04-14 03:46:35,193][0m Trial 895 finished with value: 0.8546672305420936 and parameters: {'loss': 'coxph', 'learning_rate': 0.00452946940563861, 'n_estimators': 223, 'criterion': 'friedman_mse', 'min_samples_split': 4, 'min_samples_leaf': 1, 'min_weight_fraction_leaf': 0.03234996505739099, 'min_impurity_decrease': 0.21356471397262453, 'max_features': 0.916759165398851, 'subsample': 0.7201587999944042, 'dropout_rate': 0.25766702431650734, 'ccp_alpha': 0.182840972177845}. Best is trial 627 with value: 0.8808013426064705.[0m
[32m[I 2022-04-14 03:46:40,013][0m Trial 896 finished with value: 0.8700298328254995 and parameters: {'loss': 'coxph', 'learning_rate': 0.0036999375023426483, 'n_estimators': 155, 'criterion': 'friedman_mse', 'min_samples_split': 5, 'min_samples_leaf': 3, 'min_weight_fraction_leaf': 0.009639496151380812, 'min_impurity_decrease': 0.31949348420213, 'max_features': 0.6119108191682333, 'subsample': 0.7803496991308737, 'dropout_rate': 0.334357405421402, 'ccp_alpha': 0.0038024444756554537}. Best is trial 627 with value: 0.8808013426064705.[0m
[32m[I 2022-04-14 03:46:45,948][0m Trial 897 finished with value: 0.8742366512799877 and parameters: {'loss': 'coxph', 'learning_rate': 0.0010233297028272258, 'n_estimators': 211, 'criterion': 'friedman_mse', 'min_samples_split': 4, 'min_samples_leaf': 1, 'min_weight_fraction_leaf': 0.07247478518504614, 'min_impurity_decrease': 0.4324495138318965, 'max_features': 0.8842412898493085, 'subsample': 0.7455570137136364, 'dropout_rate': 0.3580985449869556, 'ccp_alpha': 0.001538116718102833}. Best is trial 627 with value: 0.8808013426064705.[0m
[32m[I 2022-04-14 03:46:48,247][0m Trial 898 finished with value: 0.8347288914416456 and parameters: {'loss': 'coxph', 'learning_rate': 0.002067557069447562, 'n_estimators': 129, 'criterion': 'friedman_mse', 'min_samples_split': 4, 'min_samples_leaf': 1, 'min_weight_fraction_leaf': 0.34335336993845045, 'min_impurity_decrease': 0.5661639471557098, 'max_features': 0.9821380704894952, 'subsample': 0.6956393243027678, 'dropout_rate': 0.31023055499683094, 'ccp_alpha': 0.1851260228414031}. Best is trial 627 with value: 0.8808013426064705.[0m
[32m[I 2022-04-14 03:46:57,275][0m Trial 899 finished with value: 0.8562027655303677 and parameters: {'loss': 'coxph', 'learning_rate': 0.002435598611863551, 'n_estimators': 307, 'criterion': 'friedman_mse', 'min_samples_split': 4, 'min_samples_leaf': 1, 'min_weight_fraction_leaf': 0.022177263276692533, 'min_impurity_decrease': 0.2983799673064191, 'max_features': 0.9985023313683103, 'subsample': 0.2576599663261318, 'dropout_rate': 0.7223619949308878, 'ccp_alpha': 0.09218740442284268}. Best is trial 627 with value: 0.8808013426064705.[0m
[32m[I 2022-04-14 03:47:00,283][0m Trial 900 finished with value: 0.6803957274209078 and parameters: {'loss': 'coxph', 'learning_rate': 0.00311503590533338, 'n_estimators': 142, 'criterion': 'friedman_mse', 'min_samples_split': 4, 'min_samples_leaf': 1, 'min_weight_fraction_leaf': 0.25888311659830177, 'min_impurity_decrease': 0.5892818613728656, 'max_features': 0.9433078405718172, 'subsample': 0.7963361170147609, 'dropout_rate': 0.5843904790430379, 'ccp_alpha': 0.28044556998805403}. Best is trial 627 with value: 0.8808013426064705.[0m
[32m[I 2022-04-14 03:48:07,063][0m Trial 901 finished with value: 0.8621483067718074 and parameters: {'loss': 'coxph', 'learning_rate': 0.0012635414617399488, 'n_estimators': 878, 'criterion': 'friedman_mse', 'min_samples_split': 4, 'min_samples_leaf': 3, 'min_weight_fraction_leaf': 0.06169695983296407, 'min_impurity_decrease': 0.2349420338381183, 'max_features': 0.4875619459957311, 'subsample': 0.7579392504807012, 'dropout_rate': 0.6984980694848238, 'ccp_alpha': 0.09204498884106817}. Best is trial 627 with value: 0.8808013426064705.[0m
[32m[I 2022-04-14 03:50:31,371][0m Trial 902 finished with value: 0.8616887178202963 and parameters: {'loss': 'coxph', 'learning_rate': 0.005781930537581028, 'n_estimators': 951, 'criterion': 'friedman_mse', 'min_samples_split': 5, 'min_samples_leaf': 5, 'min_weight_fraction_leaf': 0.043952668978912424, 'min_impurity_decrease': 0.2667305739507073, 'max_features': 0.904033538585771, 'subsample': 0.718656435088337, 'dropout_rate': 0.37505105365623015, 'ccp_alpha': 0.175241880720705}. Best is trial 627 with value: 0.8808013426064705.[0m
[32m[I 2022-04-14 03:50:34,174][0m Trial 903 finished with value: 0.65 and parameters: {'loss': 'coxph', 'learning_rate': 0.0019400359310135127, 'n_estimators': 136, 'criterion': 'friedman_mse', 'min_samples_split': 4, 'min_samples_leaf': 1, 'min_weight_fraction_leaf': 0.032472354099180416, 'min_impurity_decrease': 0.27986178818424046, 'max_features': 0.9653770396057636, 'subsample': 0.674097926883902, 'dropout_rate': 0.45451248556156454, 'ccp_alpha': 0.9838723246044051}. Best is trial 627 with value: 0.8808013426064705.[0m
[32m[I 2022-04-14 03:50:38,646][0m Trial 904 finished with value: 0.8638037490582482 and parameters: {'loss': 'coxph', 'learning_rate': 0.004209134831537939, 'n_estimators': 158, 'criterion': 'friedman_mse', 'min_samples_split': 4, 'min_samples_leaf': 3, 'min_weight_fraction_leaf': 0.052302232681696564, 'min_impurity_decrease': 0.32255079393944636, 'max_features': 0.9296483084690614, 'subsample': 0.7331194456124217, 'dropout_rate': 0.5113946994611489, 'ccp_alpha': 0.09399368653809913}. Best is trial 627 with value: 0.8808013426064705.[0m
[32m[I 2022-04-14 03:50:40,759][0m Trial 905 finished with value: 0.6913639994589337 and parameters: {'loss': 'coxph', 'learning_rate': 0.000641717395817362, 'n_estimators': 123, 'criterion': 'friedman_mse', 'min_samples_split': 4, 'min_samples_leaf': 1, 'min_weight_fraction_leaf': 0.015170265399022848, 'min_impurity_decrease': 0.29937756472862315, 'max_features': 0.868480319508818, 'subsample': 0.7795535689287463, 'dropout_rate': 0.33459759700631175, 'ccp_alpha': 0.25738056413585775}. Best is trial 627 with value: 0.8808013426064705.[0m
[32m[I 2022-04-14 03:50:48,523][0m Trial 906 finished with value: -0.34550923931759325 and parameters: {'loss': 'squared', 'learning_rate': 0.0028862368354422305, 'n_estimators': 250, 'criterion': 'friedman_mse', 'min_samples_split': 5, 'min_samples_leaf': 1, 'min_weight_fraction_leaf': 0.03983065466646757, 'min_impurity_decrease': 0.25987692188512435, 'max_features': 0.9588316799005716, 'subsample': 0.7596624456981381, 'dropout_rate': 0.4761943431918508, 'ccp_alpha': 0.45886721127722724}. Best is trial 627 with value: 0.8808013426064705.[0m
[32m[I 2022-04-14 03:50:50,233][0m Trial 907 finished with value: 0.8666972885599261 and parameters: {'loss': 'coxph', 'learning_rate': 0.0009280643673022078, 'n_estimators': 145, 'criterion': 'friedman_mse', 'min_samples_split': 4, 'min_samples_leaf': 3, 'min_weight_fraction_leaf': 0.024189337620968497, 'min_impurity_decrease': 0.19902374766503356, 'max_features': 0.9990130226236752, 'subsample': 0.6911066558630268, 'dropout_rate': 0.7486326807191234, 'ccp_alpha': 0.10821301910971537}. Best is trial 627 with value: 0.8808013426064705.[0m
[32m[I 2022-04-14 03:51:34,403][0m Trial 908 finished with value: 0.65 and parameters: {'loss': 'coxph', 'learning_rate': 0.0015507451544404661, 'n_estimators': 484, 'criterion': 'absolute_error', 'min_samples_split': 4, 'min_samples_leaf': 1, 'min_weight_fraction_leaf': 0.08862524669010385, 'min_impurity_decrease': 0.4194773537084559, 'max_features': 0.939762220720239, 'subsample': 0.8115146613384544, 'dropout_rate': 0.2977344511679292, 'ccp_alpha': 0.0838599335599752}. Best is trial 627 with value: 0.8808013426064705.[0m
[32m[I 2022-04-14 03:53:32,021][0m Trial 909 finished with value: 0.8636666259319974 and parameters: {'loss': 'coxph', 'learning_rate': 0.0022328269466708526, 'n_estimators': 885, 'criterion': 'friedman_mse', 'min_samples_split': 4, 'min_samples_leaf': 1, 'min_weight_fraction_leaf': 0.061605366314332846, 'min_impurity_decrease': 0.3386915442537147, 'max_features': 0.3230793414282177, 'subsample': 0.7453361160969868, 'dropout_rate': 0.4392044484014059, 'ccp_alpha': 0.0030955205617625827}. Best is trial 627 with value: 0.8808013426064705.[0m
[32m[I 2022-04-14 03:57:00,417][0m Trial 910 finished with value: 0.8737050099649066 and parameters: {'loss': 'coxph', 'learning_rate': 0.0036011582941105715, 'n_estimators': 1000, 'criterion': 'friedman_mse', 'min_samples_split': 8, 'min_samples_leaf': 5, 'min_weight_fraction_leaf': 0.048468176378189454, 'min_impurity_decrease': 0.5342940239030947, 'max_features': 0.8870830095625313, 'subsample': 0.7101862020101619, 'dropout_rate': 0.12317735362999369, 'ccp_alpha': 0.004007357872598773}. Best is trial 627 with value: 0.8808013426064705.[0m
[32m[I 2022-04-14 03:57:02,685][0m Trial 911 finished with value: 0.8475223043483119 and parameters: {'loss': 'coxph', 'learning_rate': 0.0012243599489994736, 'n_estimators': 132, 'criterion': 'friedman_mse', 'min_samples_split': 4, 'min_samples_leaf': 1, 'min_weight_fraction_leaf': 0.035479180901118554, 'min_impurity_decrease': 0.4565683484076466, 'max_features': 0.9129206144546584, 'subsample': 0.7911415374001675, 'dropout_rate': 0.3678654797132965, 'ccp_alpha': 0.19046486481423305}. Best is trial 627 with value: 0.8808013426064705.[0m
[32m[I 2022-04-14 03:57:06,075][0m Trial 912 finished with value: 0.8720574173821491 and parameters: {'loss': 'coxph', 'learning_rate': 0.0017774296442897729, 'n_estimators': 153, 'criterion': 'friedman_mse', 'min_samples_split': 4, 'min_samples_leaf': 3, 'min_weight_fraction_leaf': 0.0745373115473, 'min_impurity_decrease': 0.49245614406193405, 'max_features': 0.9709722846390778, 'subsample': 0.6574126027582766, 'dropout_rate': 0.4922925554168954, 'ccp_alpha': 0.001456368136227161}. Best is trial 627 with value: 0.8808013426064705.[0m
[32m[I 2022-04-14 03:57:13,809][0m Trial 913 finished with value: 0.65 and parameters: {'loss': 'coxph', 'learning_rate': 0.002698361767968714, 'n_estimators': 219, 'criterion': 'friedman_mse', 'min_samples_split': 4, 'min_samples_leaf': 1, 'min_weight_fraction_leaf': 0.009148039009112055, 'min_impurity_decrease': 0.2340918730557672, 'max_features': 0.9446886783531896, 'subsample': 0.7290674786320174, 'dropout_rate': 0.3942407067807469, 'ccp_alpha': 3.510004450998255}. Best is trial 627 with value: 0.8808013426064705.[0m
[32m[I 2022-04-14 03:59:44,357][0m Trial 914 finished with value: 0.65 and parameters: {'loss': 'coxph', 'learning_rate': 0.002011302397711312, 'n_estimators': 921, 'criterion': 'friedman_mse', 'min_samples_split': 4, 'min_samples_leaf': 1, 'min_weight_fraction_leaf': 0.026623671602127898, 'min_impurity_decrease': 0.3085840267912463, 'max_features': 0.8671353024520915, 'subsample': 0.8254193957233577, 'dropout_rate': 0.2750762384996618, 'ccp_alpha': 0.33761809378718777}. Best is trial 627 with value: 0.8808013426064705.[0m
[32m[I 2022-04-14 04:00:28,753][0m Trial 915 finished with value: 0.8528156373532214 and parameters: {'loss': 'coxph', 'learning_rate': 0.001519027182553586, 'n_estimators': 537, 'criterion': 'friedman_mse', 'min_samples_split': 4, 'min_samples_leaf': 3, 'min_weight_fraction_leaf': 0.05606474439008235, 'min_impurity_decrease': 0.5566758813783942, 'max_features': 0.9997344391061396, 'subsample': 0.7760792347160814, 'dropout_rate': 0.34650073120750885, 'ccp_alpha': 0.16637374815352668}. Best is trial 627 with value: 0.8808013426064705.[0m
[32m[I 2022-04-14 04:00:31,586][0m Trial 916 finished with value: 0.6744126853845854 and parameters: {'loss': 'coxph', 'learning_rate': 0.0060336493895315575, 'n_estimators': 138, 'criterion': 'squared_error', 'min_samples_split': 5, 'min_samples_leaf': 5, 'min_weight_fraction_leaf': 0.04260525665951575, 'min_impurity_decrease': 0.28123898121116064, 'max_features': 0.8995083156605378, 'subsample': 0.7598207101000375, 'dropout_rate': 0.46089193061576844, 'ccp_alpha': 0.09717420447571229}. Best is trial 627 with value: 0.8808013426064705.[0m
[32m[I 2022-04-14 04:00:32,489][0m Trial 917 finished with value: 0.8509825901004486 and parameters: {'loss': 'coxph', 'learning_rate': 0.0026831493695800867, 'n_estimators': 112, 'criterion': 'friedman_mse', 'min_samples_split': 4, 'min_samples_leaf': 1, 'min_weight_fraction_leaf': 0.06598629518320116, 'min_impurity_decrease': 0.24798150083504863, 'max_features': 0.9733030164048031, 'subsample': 0.7083289473182899, 'dropout_rate': 0.9776057488066909, 'ccp_alpha': 0.20391327610633012}. Best is trial 627 with value: 0.8808013426064705.[0m
[32m[I 2022-04-14 04:00:39,590][0m Trial 918 finished with value: 0.8713237594017095 and parameters: {'loss': 'coxph', 'learning_rate': 0.001037579721696491, 'n_estimators': 202, 'criterion': 'friedman_mse', 'min_samples_split': 4, 'min_samples_leaf': 1, 'min_weight_fraction_leaf': 0.018839678176837606, 'min_impurity_decrease': 0.33921447532851423, 'max_features': 0.9264043008881232, 'subsample': 0.7366585994173385, 'dropout_rate': 0.32232690691031973, 'ccp_alpha': 0.09076663378642996}. Best is trial 627 with value: 0.8808013426064705.[0m
[32m[I 2022-04-14 04:02:25,599][0m Trial 919 finished with value: 0.65 and parameters: {'loss': 'coxph', 'learning_rate': 0.004111506708010998, 'n_estimators': 850, 'criterion': 'friedman_mse', 'min_samples_split': 4, 'min_samples_leaf': 1, 'min_weight_fraction_leaf': 0.3295273819356294, 'min_impurity_decrease': 0.32132950928203563, 'max_features': 0.9527707232480642, 'subsample': 0.7630200804406809, 'dropout_rate': 0.37181939582782064, 'ccp_alpha': 3.0052216948238395}. Best is trial 627 with value: 0.8808013426064705.[0m
[32m[I 2022-04-14 04:02:30,046][0m Trial 920 finished with value: 0.6664143017695177 and parameters: {'loss': 'coxph', 'learning_rate': 0.003465073734561375, 'n_estimators': 148, 'criterion': 'friedman_mse', 'min_samples_split': 5, 'min_samples_leaf': 5, 'min_weight_fraction_leaf': 0.03432653212319971, 'min_impurity_decrease': 0.3816524790759806, 'max_features': 0.9829574273605105, 'subsample': 0.8031009453897575, 'dropout_rate': 0.40843010087985593, 'ccp_alpha': 0.26906315308850803}. Best is trial 627 with value: 0.8808013426064705.[0m
[32m[I 2022-04-14 04:02:34,341][0m Trial 921 finished with value: 0.8765665197879111 and parameters: {'loss': 'coxph', 'learning_rate': 0.0007172069905190994, 'n_estimators': 144, 'criterion': 'friedman_mse', 'min_samples_split': 4, 'min_samples_leaf': 3, 'min_weight_fraction_leaf': 0.04709008673831056, 'min_impurity_decrease': 0.4101400267522222, 'max_features': 0.9258066953567539, 'subsample': 0.6801035398017783, 'dropout_rate': 0.4302712842254024, 'ccp_alpha': 0.0021233025471200733}. Best is trial 627 with value: 0.8808013426064705.[0m
