[32m[I 2022-04-13 11:45:13,246][0m Trial 7 finished with value: 0.437616372588949 and parameters: {'splitter': 'random', 'min_samples_split': 0.0377300150247167, 'min_samples_leaf': 0.3155418376581948, 'min_weight_fraction_leaf': 0.216478560976204, 'max_features': 0.05840130353699502}. Best is trial 1 with value: 0.6544784711429183.[0m
[32m[I 2022-04-13 11:45:13,287][0m Trial 8 finished with value: 0.437616372588949 and parameters: {'splitter': 'random', 'min_samples_split': 0.37208188019987387, 'min_samples_leaf': 0.22508647641380733, 'min_weight_fraction_leaf': 0.4026747046027283, 'max_features': 0.20725672356933977}. Best is trial 1 with value: 0.6544784711429183.[0m
[32m[I 2022-04-13 11:45:13,324][0m Trial 9 finished with value: 0.6494336255137935 and parameters: {'splitter': 'best', 'min_samples_split': 0.29118111912808975, 'min_samples_leaf': 0.0057216704487885565, 'min_weight_fraction_leaf': 0.3608079050897541, 'max_features': 0.7885491756400749}. Best is trial 1 with value: 0.6544784711429183.[0m
[32m[I 2022-04-13 11:45:13,393][0m Trial 10 finished with value: 0.636506546834346 and parameters: {'splitter': 'best', 'min_samples_split': 0.12296711556992576, 'min_samples_leaf': 0.17206378069519174, 'min_weight_fraction_leaf': 0.054000042145113336, 'max_features': 0.966040154560829}. Best is trial 1 with value: 0.6544784711429183.[0m
[32m[I 2022-04-13 11:45:13,459][0m Trial 11 finished with value: 0.6811836141969312 and parameters: {'splitter': 'best', 'min_samples_split': 0.3273837103061846, 'min_samples_leaf': 0.007806426791674962, 'min_weight_fraction_leaf': 0.11668778578465541, 'max_features': 0.6913299001549865}. Best is trial 11 with value: 0.6811836141969312.[0m
[32m[I 2022-04-13 11:45:13,530][0m Trial 12 finished with value: 0.7029215914224277 and parameters: {'splitter': 'best', 'min_samples_split': 0.11443111555425627, 'min_samples_leaf': 0.1049000381707037, 'min_weight_fraction_leaf': 0.10907028219608438, 'max_features': 0.5787431943391786}. Best is trial 12 with value: 0.7029215914224277.[0m
[32m[I 2022-04-13 11:45:13,613][0m Trial 13 finished with value: 0.7029215914224277 and parameters: {'splitter': 'best', 'min_samples_split': 0.13462946700401462, 'min_samples_leaf': 0.1112685554088202, 'min_weight_fraction_leaf': 0.07205866345128108, 'max_features': 0.5598024469761396}. Best is trial 12 with value: 0.7029215914224277.[0m
[32m[I 2022-04-13 11:45:13,655][0m Trial 14 finished with value: 0.6891921741320086 and parameters: {'splitter': 'best', 'min_samples_split': 0.1331763872501215, 'min_samples_leaf': 0.12410119815908895, 'min_weight_fraction_leaf': 0.01920370431730141, 'max_features': 0.5107867484485179}. Best is trial 12 with value: 0.7029215914224277.[0m
[32m[I 2022-04-13 11:45:13,793][0m Trial 15 finished with value: 0.6265972550908505 and parameters: {'splitter': 'best', 'min_samples_split': 0.12797726073423235, 'min_samples_leaf': 0.13388599157040207, 'min_weight_fraction_leaf': 0.09903485575553544, 'max_features': 0.4723575185259524}. Best is trial 12 with value: 0.7029215914224277.[0m
[32m[I 2022-04-13 11:45:13,915][0m Trial 16 finished with value: 0.6778130748182665 and parameters: {'splitter': 'best', 'min_samples_split': 0.17980888109971743, 'min_samples_leaf': 0.21644265793619794, 'min_weight_fraction_leaf': 0.1376854146576767, 'max_features': 0.595717100291225}. Best is trial 12 with value: 0.7029215914224277.[0m
[32m[I 2022-04-13 11:45:13,988][0m Trial 17 finished with value: 0.626869301463351 and parameters: {'splitter': 'best', 'min_samples_split': 0.08197272922060811, 'min_samples_leaf': 0.06420736011438707, 'min_weight_fraction_leaf': 0.0022167864725649022, 'max_features': 0.35746985804469655}. Best is trial 12 with value: 0.7029215914224277.[0m
[32m[I 2022-04-13 11:45:14,100][0m Trial 18 finished with value: 0.6891528673684901 and parameters: {'splitter': 'random', 'min_samples_split': 0.08530122931564166, 'min_samples_leaf': 0.1699519472571237, 'min_weight_fraction_leaf': 0.07823174431230948, 'max_features': 0.5534121215985871}. Best is trial 12 with value: 0.7029215914224277.[0m
[32m[I 2022-04-13 11:45:14,176][0m Trial 19 finished with value: 0.622711510747372 and parameters: {'splitter': 'best', 'min_samples_split': 0.1831880545859378, 'min_samples_leaf': 0.0922788573814636, 'min_weight_fraction_leaf': 0.2415043892071278, 'max_features': 0.7106641909179546}. Best is trial 12 with value: 0.7029215914224277.[0m
[32m[I 2022-04-13 11:45:14,275][0m Trial 20 finished with value: 0.6791716749612114 and parameters: {'splitter': 'best', 'min_samples_split': 0.07845522054682141, 'min_samples_leaf': 0.1769733555748676, 'min_weight_fraction_leaf': 0.17122993201170492, 'max_features': 0.3436432262779894}. Best is trial 12 with value: 0.7029215914224277.[0m
[32m[I 2022-04-13 11:45:14,381][0m Trial 21 finished with value: 0.646198624362591 and parameters: {'splitter': 'best', 'min_samples_split': 0.13362866100433674, 'min_samples_leaf': 0.1292409657253625, 'min_weight_fraction_leaf': 0.0014416078887620302, 'max_features': 0.490537454427698}. Best is trial 12 with value: 0.7029215914224277.[0m
[32m[I 2022-04-13 11:45:14,482][0m Trial 22 finished with value: 0.691311450270035 and parameters: {'splitter': 'best', 'min_samples_split': 0.15372741534395903, 'min_samples_leaf': 0.07008531889273892, 'min_weight_fraction_leaf': 0.04863594307785582, 'max_features': 0.5767513850860753}. Best is trial 12 with value: 0.7029215914224277.[0m
[32m[I 2022-04-13 11:45:14,593][0m Trial 23 finished with value: 0.6845759455010915 and parameters: {'splitter': 'best', 'min_samples_split': 0.20186725570847336, 'min_samples_leaf': 0.08361449190731725, 'min_weight_fraction_leaf': 0.04835387433136848, 'max_features': 0.6175872425224945}. Best is trial 12 with value: 0.7029215914224277.[0m
[32m[I 2022-04-13 11:45:14,660][0m Trial 24 finished with value: 0.6159506042087513 and parameters: {'splitter': 'best', 'min_samples_split': 0.15475985477281934, 'min_samples_leaf': 0.26865926891062447, 'min_weight_fraction_leaf': 0.07647877403462626, 'max_features': 0.7341671849547338}. Best is trial 12 with value: 0.7029215914224277.[0m
[32m[I 2022-04-13 11:45:14,699][0m Trial 25 finished with value: 0.6260780820313097 and parameters: {'splitter': 'best', 'min_samples_split': 0.2450677243134805, 'min_samples_leaf': 0.06531831326584038, 'min_weight_fraction_leaf': 0.14548724076954112, 'max_features': 0.43245409286546116}. Best is trial 12 with value: 0.7029215914224277.[0m
[32m[I 2022-04-13 11:45:14,751][0m Trial 26 finished with value: 0.701088972530485 and parameters: {'splitter': 'random', 'min_samples_split': 0.06376777913678325, 'min_samples_leaf': 0.1520805456327451, 'min_weight_fraction_leaf': 0.0341977387405825, 'max_features': 0.5693945025924344}. Best is trial 12 with value: 0.7029215914224277.[0m
[32m[I 2022-04-13 11:45:14,796][0m Trial 27 finished with value: 0.5368250577376974 and parameters: {'splitter': 'random', 'min_samples_split': 0.05963275649064021, 'min_samples_leaf': 0.20266703805573877, 'min_weight_fraction_leaf': 0.09822647761070245, 'max_features': 0.34232535107922546}. Best is trial 12 with value: 0.7029215914224277.[0m
[32m[I 2022-04-13 11:45:14,829][0m Trial 28 finished with value: 0.6366316413031219 and parameters: {'splitter': 'random', 'min_samples_split': 0.007846834082310461, 'min_samples_leaf': 0.26088794666335047, 'min_weight_fraction_leaf': 0.02967278355397296, 'max_features': 0.5328669363309254}. Best is trial 12 with value: 0.7029215914224277.[0m
[32m[I 2022-04-13 11:45:14,878][0m Trial 29 finished with value: 0.5398597233207362 and parameters: {'splitter': 'random', 'min_samples_split': 0.08424147036593016, 'min_samples_leaf': 0.14905787828824207, 'min_weight_fraction_leaf': 0.1876698592127809, 'max_features': 0.43496317628437015}. Best is trial 12 with value: 0.7029215914224277.[0m
[32m[I 2022-04-13 11:45:14,917][0m Trial 30 finished with value: 0.6282603442517164 and parameters: {'splitter': 'random', 'min_samples_split': 0.10604370667513358, 'min_samples_leaf': 0.10599213839681994, 'min_weight_fraction_leaf': 0.13186835511813721, 'max_features': 0.6385189767246406}. Best is trial 12 with value: 0.7029215914224277.[0m
[32m[I 2022-04-13 11:45:14,991][0m Trial 31 finished with value: 0.6704470133623914 and parameters: {'splitter': 'random', 'min_samples_split': 0.1601485289669537, 'min_samples_leaf': 0.05054539085679208, 'min_weight_fraction_leaf': 0.05557611543804268, 'max_features': 0.5983438969589701}. Best is trial 12 with value: 0.7029215914224277.[0m
[32m[I 2022-04-13 11:45:15,054][0m Trial 32 finished with value: 0.7033663713577949 and parameters: {'splitter': 'random', 'min_samples_split': 0.21715270947429652, 'min_samples_leaf': 0.07798268087935238, 'min_weight_fraction_leaf': 0.07800374060599947, 'max_features': 0.5752605263790851}. Best is trial 32 with value: 0.7033663713577949.[0m
[32m[I 2022-04-13 11:45:15,119][0m Trial 33 finished with value: 0.6698873364552701 and parameters: {'splitter': 'random', 'min_samples_split': 0.043465520363984975, 'min_samples_leaf': 0.034384863238445106, 'min_weight_fraction_leaf': 0.09105597901722923, 'max_features': 0.7958212883235833}. Best is trial 32 with value: 0.7033663713577949.[0m
[32m[I 2022-04-13 11:45:15,187][0m Trial 34 finished with value: 0.6222709416010329 and parameters: {'splitter': 'random', 'min_samples_split': 0.21401799572290203, 'min_samples_leaf': 0.1529251639796328, 'min_weight_fraction_leaf': 0.11650923255143901, 'max_features': 0.866885265141512}. Best is trial 32 with value: 0.7033663713577949.[0m
[32m[I 2022-04-13 11:45:15,271][0m Trial 35 finished with value: 0.4673478461694133 and parameters: {'splitter': 'random', 'min_samples_split': 0.28042894693151604, 'min_samples_leaf': 0.19500060400586303, 'min_weight_fraction_leaf': 0.29104325312235585, 'max_features': 0.7562961675017754}. Best is trial 32 with value: 0.7033663713577949.[0m
[32m[I 2022-04-13 11:45:15,338][0m Trial 36 finished with value: 0.5121008313364271 and parameters: {'splitter': 'random', 'min_samples_split': 0.2217688980049747, 'min_samples_leaf': 0.10050570825103561, 'min_weight_fraction_leaf': 0.1683390167812225, 'max_features': 0.39604825611835576}. Best is trial 32 with value: 0.7033663713577949.[0m
[32m[I 2022-04-13 11:45:15,445][0m Trial 37 finished with value: 0.6295866706365987 and parameters: {'splitter': 'random', 'min_samples_split': 0.4885694476345346, 'min_samples_leaf': 0.029086327678160988, 'min_weight_fraction_leaf': 0.06892887844363609, 'max_features': 0.6619487220713464}. Best is trial 32 with value: 0.7033663713577949.[0m
[32m[I 2022-04-13 11:45:15,505][0m Trial 38 finished with value: 0.437616372588949 and parameters: {'splitter': 'random', 'min_samples_split': 0.05866116028148431, 'min_samples_leaf': 0.3783988887851292, 'min_weight_fraction_leaf': 0.268490463796859, 'max_features': 0.47340229204316076}. Best is trial 32 with value: 0.7033663713577949.[0m
[32m[I 2022-04-13 11:45:15,575][0m Trial 39 finished with value: 0.467766429422732 and parameters: {'splitter': 'random', 'min_samples_split': 0.10356007655944494, 'min_samples_leaf': 0.49063753061366944, 'min_weight_fraction_leaf': 0.02019349890567669, 'max_features': 0.2763616438260883}. Best is trial 32 with value: 0.7033663713577949.[0m
[32m[I 2022-04-13 11:45:15,623][0m Trial 40 finished with value: 0.6407886163385511 and parameters: {'splitter': 'random', 'min_samples_split': 0.27905283030176503, 'min_samples_leaf': 0.23945621360794828, 'min_weight_fraction_leaf': 0.03403898969652214, 'max_features': 0.5563796152704898}. Best is trial 32 with value: 0.7033663713577949.[0m
[32m[I 2022-04-13 11:45:15,672][0m Trial 41 finished with value: 0.6824466690958634 and parameters: {'splitter': 'best', 'min_samples_split': 0.16314193469797858, 'min_samples_leaf': 0.0793345775738673, 'min_weight_fraction_leaf': 0.04217383034014531, 'max_features': 0.5727765144608874}. Best is trial 32 with value: 0.7033663713577949.[0m
[32m[I 2022-04-13 11:45:15,721][0m Trial 42 finished with value: 0.6698092846019142 and parameters: {'splitter': 'best', 'min_samples_split': 0.18446773588396226, 'min_samples_leaf': 0.06647059409489739, 'min_weight_fraction_leaf': 0.11488554310857965, 'max_features': 0.6542075745299093}. Best is trial 32 with value: 0.7033663713577949.[0m
[32m[I 2022-04-13 11:45:15,770][0m Trial 43 finished with value: 0.7029215914224277 and parameters: {'splitter': 'best', 'min_samples_split': 0.15215117145339535, 'min_samples_leaf': 0.1096700900013173, 'min_weight_fraction_leaf': 0.07108560424105757, 'max_features': 0.5269544009675096}. Best is trial 32 with value: 0.7033663713577949.[0m
[32m[I 2022-04-13 11:45:15,821][0m Trial 44 finished with value: 0.4113731167222882 and parameters: {'splitter': 'best', 'min_samples_split': 0.10850294247681862, 'min_samples_leaf': 0.14859397488962728, 'min_weight_fraction_leaf': 0.47990894787372324, 'max_features': 0.5112155973007648}. Best is trial 32 with value: 0.7033663713577949.[0m
[32m[I 2022-04-13 11:45:15,871][0m Trial 45 finished with value: 0.6431621494219514 and parameters: {'splitter': 'best', 'min_samples_split': 0.02528400132993036, 'min_samples_leaf': 0.09584955971932013, 'min_weight_fraction_leaf': 0.20664956491046643, 'max_features': 0.40223686300099337}. Best is trial 32 with value: 0.7033663713577949.[0m
[32m[I 2022-04-13 11:45:15,925][0m Trial 46 finished with value: 0.6706932697334469 and parameters: {'splitter': 'best', 'min_samples_split': 0.32250620953079273, 'min_samples_leaf': 0.11928224120642422, 'min_weight_fraction_leaf': 0.14839000656387413, 'max_features': 0.6871868298102415}. Best is trial 32 with value: 0.7033663713577949.[0m
[32m[I 2022-04-13 11:45:15,980][0m Trial 47 finished with value: 0.4352343226670869 and parameters: {'splitter': 'best', 'min_samples_split': 0.2307992551816619, 'min_samples_leaf': 0.43795427992523417, 'min_weight_fraction_leaf': 0.06711544193196681, 'max_features': 0.9956978090950054}. Best is trial 32 with value: 0.7033663713577949.[0m
[32m[I 2022-04-13 11:45:16,031][0m Trial 48 finished with value: 0.6301180979801357 and parameters: {'splitter': 'best', 'min_samples_split': 0.13640083015538162, 'min_samples_leaf': 0.3034491594241093, 'min_weight_fraction_leaf': 0.08567171884067776, 'max_features': 0.4529876611989916}. Best is trial 32 with value: 0.7033663713577949.[0m
[32m[I 2022-04-13 11:45:16,075][0m Trial 49 finished with value: 0.437616372588949 and parameters: {'splitter': 'random', 'min_samples_split': 0.06040807405439287, 'min_samples_leaf': 0.022487979722251458, 'min_weight_fraction_leaf': 0.3589799487996713, 'max_features': 0.5102380552966415}. Best is trial 32 with value: 0.7033663713577949.[0m
[32m[I 2022-04-13 11:45:16,120][0m Trial 50 finished with value: 0.5280405117974414 and parameters: {'splitter': 'best', 'min_samples_split': 0.20706327919552925, 'min_samples_leaf': 0.18372077882418336, 'min_weight_fraction_leaf': 0.10554302692126488, 'max_features': 0.17468509252163306}. Best is trial 32 with value: 0.7033663713577949.[0m
[32m[I 2022-04-13 11:45:16,167][0m Trial 51 finished with value: 0.682164326932234 and parameters: {'splitter': 'best', 'min_samples_split': 0.1508336676072424, 'min_samples_leaf': 0.04788688870992751, 'min_weight_fraction_leaf': 0.056706350773807396, 'max_features': 0.5912145293787571}. Best is trial 32 with value: 0.7033663713577949.[0m
[32m[I 2022-04-13 11:45:16,214][0m Trial 52 finished with value: 0.7102488705631708 and parameters: {'splitter': 'best', 'min_samples_split': 0.17787290635676276, 'min_samples_leaf': 0.0010261825756863463, 'min_weight_fraction_leaf': 0.015028829337258812, 'max_features': 0.5596198581988827}. Best is trial 52 with value: 0.7102488705631708.[0m
[32m[I 2022-04-13 11:45:16,270][0m Trial 53 finished with value: 0.7102488705631708 and parameters: {'splitter': 'best', 'min_samples_split': 0.17576780358178712, 'min_samples_leaf': 0.004431684196760266, 'min_weight_fraction_leaf': 0.015193153401027998, 'max_features': 0.5296976679467664}. Best is trial 52 with value: 0.7102488705631708.[0m
[32m[I 2022-04-13 11:45:16,347][0m Trial 54 finished with value: 0.6851241492724246 and parameters: {'splitter': 'best', 'min_samples_split': 0.18217797145298514, 'min_samples_leaf': 0.009138162352604628, 'min_weight_fraction_leaf': 0.001517839519789111, 'max_features': 0.6257897776896361}. Best is trial 52 with value: 0.7102488705631708.[0m
[32m[I 2022-04-13 11:45:16,401][0m Trial 55 finished with value: 0.6787618722627851 and parameters: {'splitter': 'best', 'min_samples_split': 0.24980643960883359, 'min_samples_leaf': 0.004885619177469436, 'min_weight_fraction_leaf': 0.02311587552469166, 'max_features': 0.5270872914399465}. Best is trial 52 with value: 0.7102488705631708.[0m
[32m[I 2022-04-13 11:45:16,455][0m Trial 56 finished with value: 0.6553558002087415 and parameters: {'splitter': 'best', 'min_samples_split': 0.17414000424417336, 'min_samples_leaf': 0.049034474697389537, 'min_weight_fraction_leaf': 0.07939006310909821, 'max_features': 0.48224842851249483}. Best is trial 52 with value: 0.7102488705631708.[0m
[32m[I 2022-04-13 11:45:16,546][0m Trial 57 finished with value: 0.6655599618130894 and parameters: {'splitter': 'best', 'min_samples_split': 0.11717596610898512, 'min_samples_leaf': 0.02937564758128825, 'min_weight_fraction_leaf': 0.014098237295881652, 'max_features': 0.6887549697026356}. Best is trial 52 with value: 0.7102488705631708.[0m
[32m[I 2022-04-13 11:45:16,616][0m Trial 58 finished with value: 0.5954414569283625 and parameters: {'splitter': 'best', 'min_samples_split': 0.259414398867637, 'min_samples_leaf': 0.11559755221453855, 'min_weight_fraction_leaf': 0.0613876195503889, 'max_features': 0.020321840844194805}. Best is trial 52 with value: 0.7102488705631708.[0m
[32m[I 2022-04-13 11:45:16,680][0m Trial 59 finished with value: 0.589064156645618 and parameters: {'splitter': 'best', 'min_samples_split': 0.19859428013298863, 'min_samples_leaf': 0.34109375127837704, 'min_weight_fraction_leaf': 0.4090362170349541, 'max_features': 0.37840974665478744}. Best is trial 52 with value: 0.7102488705631708.[0m
[32m[I 2022-04-13 11:45:16,775][0m Trial 60 finished with value: 0.6606169606401819 and parameters: {'splitter': 'best', 'min_samples_split': 0.13441857946408362, 'min_samples_leaf': 0.01715144770049228, 'min_weight_fraction_leaf': 0.12663376316497787, 'max_features': 0.3027963705970905}. Best is trial 52 with value: 0.7102488705631708.[0m
[32m[I 2022-04-13 11:45:16,852][0m Trial 61 finished with value: 0.6891921741320086 and parameters: {'splitter': 'best', 'min_samples_split': 0.10213703252412472, 'min_samples_leaf': 0.1307807044320802, 'min_weight_fraction_leaf': 0.04231902412396483, 'max_features': 0.5517673979534808}. Best is trial 52 with value: 0.7102488705631708.[0m
[32m[I 2022-04-13 11:45:16,932][0m Trial 62 finished with value: 0.6824466690958634 and parameters: {'splitter': 'best', 'min_samples_split': 0.14183198453760676, 'min_samples_leaf': 0.09125742438300392, 'min_weight_fraction_leaf': 0.03457415855994534, 'max_features': 0.617988816700214}. Best is trial 52 with value: 0.7102488705631708.[0m
[32m[I 2022-04-13 11:45:17,012][0m Trial 63 finished with value: 0.6727701215232552 and parameters: {'splitter': 'best', 'min_samples_split': 0.16668155196145767, 'min_samples_leaf': 0.16089741695697668, 'min_weight_fraction_leaf': 0.0952142894420936, 'max_features': 0.5395787525933613}. Best is trial 52 with value: 0.7102488705631708.[0m
[32m[I 2022-04-13 11:45:17,094][0m Trial 64 finished with value: 0.6823405205867574 and parameters: {'splitter': 'best', 'min_samples_split': 0.0751372198509061, 'min_samples_leaf': 0.05527873231713264, 'min_weight_fraction_leaf': 0.010702627056959173, 'max_features': 0.5868587061397768}. Best is trial 52 with value: 0.7102488705631708.[0m
[32m[I 2022-04-13 11:45:17,198][0m Trial 65 finished with value: 0.4667260506642073 and parameters: {'splitter': 'random', 'min_samples_split': 0.12711062657124172, 'min_samples_leaf': 0.14082053193504762, 'min_weight_fraction_leaf': 0.0738869646581613, 'max_features': 0.44102219255885816}. Best is trial 52 with value: 0.7102488705631708.[0m
[32m[I 2022-04-13 11:45:17,296][0m Trial 66 finished with value: 0.6706932697334469 and parameters: {'splitter': 'best', 'min_samples_split': 0.19122533528986912, 'min_samples_leaf': 0.07512489630072057, 'min_weight_fraction_leaf': 0.15350468030481143, 'max_features': 0.7374857944565526}. Best is trial 52 with value: 0.7102488705631708.[0m
[32m[I 2022-04-13 11:45:17,452][0m Trial 67 finished with value: 0.5023608460072212 and parameters: {'splitter': 'random', 'min_samples_split': 0.09677206175514844, 'min_samples_leaf': 0.10686149075912091, 'min_weight_fraction_leaf': 0.028026129343456628, 'max_features': 0.4868191333778942}. Best is trial 52 with value: 0.7102488705631708.[0m
[32m[I 2022-04-13 11:45:17,580][0m Trial 68 finished with value: 0.663387022060955 and parameters: {'splitter': 'best', 'min_samples_split': 0.22170589155448986, 'min_samples_leaf': 0.041769097746778436, 'min_weight_fraction_leaf': 0.05299726724882885, 'max_features': 0.6482805373032684}. Best is trial 52 with value: 0.7102488705631708.[0m
[32m[I 2022-04-13 11:45:17,668][0m Trial 69 finished with value: 0.7030923165237667 and parameters: {'splitter': 'random', 'min_samples_split': 0.0450138480351612, 'min_samples_leaf': 0.07943461565462956, 'min_weight_fraction_leaf': 0.10685319937886036, 'max_features': 0.567156669306722}. Best is trial 52 with value: 0.7102488705631708.[0m
