[32m[I 2022-04-19 01:47:48,448][0m Trial 115 finished with value: 0.7000124312279882 and parameters: {'n_hidden': 2048, 'mixture_components': 2, 'use_sparse_layer': True, 'use_sparse_loss': True, 'lmbd': 1.44593666352155e-05, 'use_batchnorm': False, 'use_dropout': True, 'dropout': 0.6232528952028599, 'mlp_size_1': 7, 'mlp_size_2': 0, 'mlp_size_3': 0, 'kernel': 'Gamma', 'loss_name': 'CensoredNLLLoss'}. Best is trial 72 with value: 0.7067071906688679.[0m
[32m[I 2022-04-19 01:50:27,559][0m Trial 116 finished with value: 0.6868548172838982 and parameters: {'n_hidden': 2048, 'mixture_components': 2, 'use_sparse_layer': True, 'use_sparse_loss': True, 'lmbd': 1.280214710879295e-05, 'use_batchnorm': False, 'use_dropout': True, 'dropout': 0.6176793558118366, 'mlp_size_1': 7, 'mlp_size_2': 0, 'mlp_size_3': 0, 'kernel': 'Gamma', 'loss_name': 'CensoredNLLLoss'}. Best is trial 72 with value: 0.7067071906688679.[0m
[32m[I 2022-04-19 01:52:33,890][0m Trial 117 finished with value: 0.46503058995182434 and parameters: {'n_hidden': 2048, 'mixture_components': 2, 'use_sparse_layer': True, 'use_sparse_loss': True, 'lmbd': 3.0233873161705276e-05, 'use_batchnorm': False, 'use_dropout': True, 'dropout': 0.7520805020963698, 'mlp_size_1': 8, 'mlp_size_2': 0, 'mlp_size_3': 0, 'kernel': 'Normal', 'loss_name': 'CensoredNLLLoss'}. Best is trial 72 with value: 0.7067071906688679.[0m
[32m[I 2022-04-19 01:54:11,920][0m Trial 118 finished with value: 0.6743430491717042 and parameters: {'n_hidden': 2048, 'mixture_components': 1, 'use_sparse_layer': True, 'use_sparse_loss': True, 'lmbd': 4.8545861598419594e-05, 'use_batchnorm': False, 'use_dropout': False, 'mlp_size_1': 7, 'mlp_size_2': 0, 'mlp_size_3': 0, 'kernel': 'Gamma', 'loss_name': 'CensoredNLLLoss'}. Best is trial 72 with value: 0.7067071906688679.[0m
[32m[I 2022-04-19 01:56:44,088][0m Trial 119 finished with value: 0.5799160356708744 and parameters: {'n_hidden': 2048, 'mixture_components': 2, 'use_sparse_layer': True, 'use_sparse_loss': True, 'lmbd': 0.00027855272886849366, 'use_batchnorm': False, 'use_dropout': True, 'dropout': 0.645814821458468, 'mlp_size_1': 8, 'mlp_size_2': 0, 'mlp_size_3': 0, 'kernel': 'Gumbel', 'loss_name': 'CensoredNLLLoss'}. Best is trial 72 with value: 0.7067071906688679.[0m
[32m[I 2022-04-19 01:59:09,270][0m Trial 120 finished with value: 0.6546960207795058 and parameters: {'n_hidden': 2048, 'mixture_components': 1, 'use_sparse_layer': True, 'use_sparse_loss': True, 'lmbd': 1.8185862914893833e-05, 'use_batchnorm': False, 'use_dropout': True, 'dropout': 0.687278787868403, 'mlp_size_1': 7, 'mlp_size_2': 0, 'mlp_size_3': 0, 'kernel': 'Gamma', 'loss_name': 'CensoredNLLLoss'}. Best is trial 72 with value: 0.7067071906688679.[0m
[32m[I 2022-04-19 02:01:36,599][0m Trial 121 finished with value: 0.6704183680388286 and parameters: {'n_hidden': 2048, 'mixture_components': 3, 'use_sparse_layer': True, 'use_sparse_loss': True, 'lmbd': 0.00010986532378042189, 'use_batchnorm': False, 'use_dropout': True, 'dropout': 0.5940245210320576, 'mlp_size_1': 7, 'mlp_size_2': 0, 'mlp_size_3': 0, 'kernel': 'Gamma', 'loss_name': 'CensoredNLLLoss'}. Best is trial 72 with value: 0.7067071906688679.[0m
[32m[I 2022-04-19 02:04:08,179][0m Trial 122 finished with value: 0.6810145623641773 and parameters: {'n_hidden': 2048, 'mixture_components': 2, 'use_sparse_layer': True, 'use_sparse_loss': True, 'lmbd': 1.1786293521423411e-05, 'use_batchnorm': False, 'use_dropout': True, 'dropout': 0.7080616242862022, 'mlp_size_1': 7, 'mlp_size_2': 0, 'mlp_size_3': 0, 'kernel': 'Gamma', 'loss_name': 'CensoredNLLLoss'}. Best is trial 72 with value: 0.7067071906688679.[0m
[32m[I 2022-04-19 02:06:08,468][0m Trial 123 finished with value: 0.6740695539449687 and parameters: {'n_hidden': 2048, 'mixture_components': 3, 'use_sparse_layer': True, 'use_sparse_loss': True, 'lmbd': 8.70191414240144e-05, 'use_batchnorm': False, 'use_dropout': True, 'dropout': 0.5653034941618161, 'mlp_size_1': 8, 'mlp_size_2': 0, 'mlp_size_3': 0, 'kernel': 'Gamma', 'loss_name': 'CensoredNLLLoss'}. Best is trial 72 with value: 0.7067071906688679.[0m
[32m[I 2022-04-19 02:08:43,924][0m Trial 124 finished with value: 0.66706376034369 and parameters: {'n_hidden': 2048, 'mixture_components': 2, 'use_sparse_layer': True, 'use_sparse_loss': True, 'lmbd': 5.622016613675396e-05, 'use_batchnorm': False, 'use_dropout': True, 'dropout': 0.5457383336736027, 'mlp_size_1': 7, 'mlp_size_2': 0, 'mlp_size_3': 0, 'kernel': 'Gamma', 'loss_name': 'CensoredNLLLoss'}. Best is trial 72 with value: 0.7067071906688679.[0m
[32m[I 2022-04-19 02:11:30,084][0m Trial 125 finished with value: 0.6911332103991692 and parameters: {'n_hidden': 2048, 'mixture_components': 3, 'use_sparse_layer': True, 'use_sparse_loss': True, 'lmbd': 0.0001344709611052985, 'use_batchnorm': False, 'use_dropout': True, 'dropout': 0.4559156385317331, 'mlp_size_1': 7, 'mlp_size_2': 0, 'mlp_size_3': 0, 'kernel': 'Gamma', 'loss_name': 'CensoredNLLLoss'}. Best is trial 72 with value: 0.7067071906688679.[0m
[32m[I 2022-04-19 02:13:50,076][0m Trial 126 finished with value: 0.6652226448766226 and parameters: {'n_hidden': 2048, 'mixture_components': 3, 'use_sparse_layer': True, 'use_sparse_loss': True, 'lmbd': 0.00013721576903991716, 'use_batchnorm': False, 'use_dropout': True, 'dropout': 0.464604214140009, 'mlp_size_1': 8, 'mlp_size_2': 0, 'mlp_size_3': 0, 'kernel': 'Gamma', 'loss_name': 'CensoredNLLLoss'}. Best is trial 72 with value: 0.7067071906688679.[0m
[32m[I 2022-04-19 02:15:59,455][0m Trial 127 finished with value: 0.6803885414109387 and parameters: {'n_hidden': 2048, 'mixture_components': 3, 'use_sparse_layer': True, 'use_sparse_loss': False, 'use_batchnorm': False, 'use_dropout': True, 'dropout': 0.4987147750464908, 'mlp_size_1': 7, 'mlp_size_2': 0, 'mlp_size_3': 0, 'kernel': 'Gamma', 'loss_name': 'CensoredNLLLoss'}. Best is trial 72 with value: 0.7067071906688679.[0m
[32m[I 2022-04-19 02:18:09,627][0m Trial 128 finished with value: 0.5930869223171256 and parameters: {'n_hidden': 2048, 'mixture_components': 2, 'use_sparse_layer': True, 'use_sparse_loss': True, 'lmbd': 3.204838171965391e-05, 'use_batchnorm': False, 'use_dropout': True, 'dropout': 0.8129047310053163, 'mlp_size_1': 8, 'mlp_size_2': 0, 'mlp_size_3': 0, 'kernel': 'Logistic', 'loss_name': 'CensoredNLLLoss'}. Best is trial 72 with value: 0.7067071906688679.[0m
[32m[I 2022-04-19 02:20:03,385][0m Trial 129 finished with value: 0.6396424285614382 and parameters: {'n_hidden': 128, 'mixture_components': 2, 'use_sparse_layer': True, 'use_sparse_loss': True, 'lmbd': 3.4215329646270724e-06, 'use_batchnorm': False, 'use_dropout': True, 'dropout': 0.6336348665020846, 'mlp_size_1': 4, 'mlp_size_2': 0, 'mlp_size_3': 0, 'kernel': 'Gamma', 'loss_name': 'CensoredNLLLoss'}. Best is trial 72 with value: 0.7067071906688679.[0m
[32m[I 2022-04-19 02:25:05,199][0m Trial 130 finished with value: 0.5198418263211082 and parameters: {'n_hidden': 32, 'mixture_components': 3, 'use_sparse_layer': True, 'use_sparse_loss': True, 'lmbd': 6.085503467534802e-06, 'use_batchnorm': False, 'use_dropout': True, 'dropout': 0.6696203425868702, 'mlp_size_1': 2, 'mlp_size_2': 0, 'mlp_size_3': 0, 'kernel': 'LogNormal', 'loss_name': 'CensoredNLLLoss'}. Best is trial 72 with value: 0.7067071906688679.[0m
[32m[I 2022-04-19 02:27:26,920][0m Trial 131 finished with value: 0.6649597423477278 and parameters: {'n_hidden': 2048, 'mixture_components': 4, 'use_sparse_layer': True, 'use_sparse_loss': True, 'lmbd': 0.07129241759474615, 'use_batchnorm': False, 'use_dropout': True, 'dropout': 0.3842159299539047, 'mlp_size_1': 7, 'mlp_size_2': 0, 'mlp_size_3': 0, 'kernel': 'Gamma', 'loss_name': 'CensoredNLLLoss'}. Best is trial 72 with value: 0.7067071906688679.[0m
[32m[I 2022-04-19 02:29:58,232][0m Trial 132 finished with value: 0.6668369725662625 and parameters: {'n_hidden': 2048, 'mixture_components': 3, 'use_sparse_layer': True, 'use_sparse_loss': True, 'lmbd': 7.35215400618051e-05, 'use_batchnorm': False, 'use_dropout': True, 'dropout': 0.4423861787748538, 'mlp_size_1': 7, 'mlp_size_2': 0, 'mlp_size_3': 0, 'kernel': 'Gamma', 'loss_name': 'CensoredNLLLoss'}. Best is trial 72 with value: 0.7067071906688679.[0m
[32m[I 2022-04-19 02:32:04,515][0m Trial 133 finished with value: 0.6855645875773793 and parameters: {'n_hidden': 512, 'mixture_components': 3, 'use_sparse_layer': True, 'use_sparse_loss': True, 'lmbd': 0.00022219602328448756, 'use_batchnorm': False, 'use_dropout': True, 'dropout': 0.4264582272936249, 'mlp_size_1': 6, 'mlp_size_2': 0, 'mlp_size_3': 0, 'kernel': 'Gamma', 'loss_name': 'CensoredNLLLoss'}. Best is trial 72 with value: 0.7067071906688679.[0m
[32m[I 2022-04-19 02:34:20,295][0m Trial 134 finished with value: 0.6641396273721927 and parameters: {'n_hidden': 2048, 'mixture_components': 4, 'use_sparse_layer': True, 'use_sparse_loss': True, 'lmbd': 0.00015593888850684373, 'use_batchnorm': False, 'use_dropout': True, 'dropout': 0.514525432245669, 'mlp_size_1': 7, 'mlp_size_2': 0, 'mlp_size_3': 0, 'kernel': 'Gamma', 'loss_name': 'CensoredNLLLoss'}. Best is trial 72 with value: 0.7067071906688679.[0m
[32m[I 2022-04-19 02:36:34,987][0m Trial 135 finished with value: 0.6664701148641946 and parameters: {'n_hidden': 2048, 'mixture_components': 9, 'use_sparse_layer': True, 'use_sparse_loss': True, 'lmbd': 1.3233301693211589e-06, 'use_batchnorm': False, 'use_dropout': True, 'dropout': 0.4528565034599059, 'mlp_size_1': 7, 'mlp_size_2': 0, 'mlp_size_3': 0, 'kernel': 'Gamma', 'loss_name': 'CensoredNLLLoss'}. Best is trial 72 with value: 0.7067071906688679.[0m
[32m[I 2022-04-19 02:38:33,475][0m Trial 136 finished with value: 0.6896804935019653 and parameters: {'n_hidden': 256, 'mixture_components': 2, 'use_sparse_layer': True, 'use_sparse_loss': True, 'lmbd': 9.572992224577114e-06, 'use_batchnorm': False, 'use_dropout': True, 'dropout': 0.47690185293523896, 'mlp_size_1': 5, 'mlp_size_2': 0, 'mlp_size_3': 0, 'kernel': 'Gamma', 'loss_name': 'CensoredNLLLoss'}. Best is trial 72 with value: 0.7067071906688679.[0m
[32m[I 2022-04-19 02:39:57,654][0m Trial 137 finished with value: 0.6377577719002534 and parameters: {'n_hidden': 128, 'mixture_components': 3, 'use_sparse_layer': True, 'use_sparse_loss': True, 'lmbd': 3.98738022047694e-05, 'use_batchnorm': False, 'use_dropout': True, 'dropout': 0.5291735697402217, 'mlp_size_1': 2, 'mlp_size_2': 0, 'mlp_size_3': 2, 'kernel': 'Exponential', 'loss_name': 'CensoredNLLLoss'}. Best is trial 72 with value: 0.7067071906688679.[0m
[32m[I 2022-04-19 02:41:49,424][0m Trial 138 finished with value: 0.6751058844466901 and parameters: {'n_hidden': 64, 'mixture_components': 1, 'use_sparse_layer': True, 'use_sparse_loss': True, 'lmbd': 0.0003241514337387202, 'use_batchnorm': False, 'use_dropout': False, 'mlp_size_1': 3, 'mlp_size_2': 0, 'mlp_size_3': 0, 'kernel': 'Gamma', 'loss_name': 'CensoredNLLLoss'}. Best is trial 72 with value: 0.7067071906688679.[0m
[32m[I 2022-04-19 02:45:24,050][0m Trial 139 finished with value: 0.6682731885090185 and parameters: {'n_hidden': 32, 'mixture_components': 3, 'use_sparse_layer': True, 'use_sparse_loss': True, 'lmbd': 1.540697201782147e-05, 'use_batchnorm': False, 'use_dropout': True, 'dropout': 0.41177847801204465, 'mlp_size_1': 2, 'mlp_size_2': 0, 'mlp_size_3': 0, 'kernel': 'Gamma', 'loss_name': 'CensoredNLLLoss'}. Best is trial 72 with value: 0.7067071906688679.[0m
[32m[I 2022-04-19 02:47:24,219][0m Trial 140 finished with value: 0.626008065471721 and parameters: {'n_hidden': 2048, 'mixture_components': 5, 'use_sparse_layer': True, 'use_sparse_loss': True, 'lmbd': 0.00010551765418980397, 'use_batchnorm': False, 'use_dropout': True, 'dropout': 0.5825918471970049, 'mlp_size_1': 7, 'mlp_size_2': 0, 'mlp_size_3': 0, 'kernel': 'LogLogistic', 'loss_name': 'CensoredNLLLoss'}. Best is trial 72 with value: 0.7067071906688679.[0m
[32m[I 2022-04-19 02:50:27,880][0m Trial 141 finished with value: 0.6952667241857854 and parameters: {'n_hidden': 2048, 'mixture_components': 6, 'use_sparse_layer': True, 'use_sparse_loss': True, 'lmbd': 0.000675908071366358, 'use_batchnorm': False, 'use_dropout': True, 'dropout': 0.79153124444615, 'mlp_size_1': 6, 'mlp_size_2': 1, 'mlp_size_3': 0, 'kernel': 'Gamma', 'loss_name': 'NLLLoss'}. Best is trial 72 with value: 0.7067071906688679.[0m
[32m[I 2022-04-19 02:53:13,025][0m Trial 142 finished with value: 0.7103637692860825 and parameters: {'n_hidden': 2048, 'mixture_components': 6, 'use_sparse_layer': True, 'use_sparse_loss': True, 'lmbd': 0.00045318574443841845, 'use_batchnorm': False, 'use_dropout': True, 'dropout': 0.807978406659477, 'mlp_size_1': 7, 'mlp_size_2': 0, 'mlp_size_3': 0, 'kernel': 'Gamma', 'loss_name': 'NLLLoss'}. Best is trial 142 with value: 0.7103637692860825.[0m
[32m[I 2022-04-19 02:55:47,737][0m Trial 143 finished with value: 0.6798541978546215 and parameters: {'n_hidden': 2048, 'mixture_components': 6, 'use_sparse_layer': True, 'use_sparse_loss': True, 'lmbd': 0.0009328444104513773, 'use_batchnorm': False, 'use_dropout': True, 'dropout': 0.7813495388172389, 'mlp_size_1': 6, 'mlp_size_2': 1, 'mlp_size_3': 0, 'kernel': 'Gamma', 'loss_name': 'NLLLoss'}. Best is trial 142 with value: 0.7103637692860825.[0m
[32m[I 2022-04-19 02:58:08,018][0m Trial 144 finished with value: 0.6497148403459096 and parameters: {'n_hidden': 2048, 'mixture_components': 6, 'use_sparse_layer': True, 'use_sparse_loss': True, 'lmbd': 0.000529141036009443, 'use_batchnorm': False, 'use_dropout': True, 'dropout': 0.7915799172561924, 'mlp_size_1': 7, 'mlp_size_2': 0, 'mlp_size_3': 0, 'kernel': 'Gamma', 'loss_name': 'NLLLoss'}. Best is trial 142 with value: 0.7103637692860825.[0m
[32m[I 2022-04-19 03:00:03,878][0m Trial 145 finished with value: 0.655015129054697 and parameters: {'n_hidden': 2048, 'mixture_components': 6, 'use_sparse_layer': True, 'use_sparse_loss': True, 'lmbd': 0.0007796467771122951, 'use_batchnorm': False, 'use_dropout': True, 'dropout': 0.8541440708970777, 'mlp_size_1': 8, 'mlp_size_2': 0, 'mlp_size_3': 0, 'kernel': 'Gamma', 'loss_name': 'NLLLoss'}. Best is trial 142 with value: 0.7103637692860825.[0m
[32m[I 2022-04-19 03:02:16,082][0m Trial 146 finished with value: 0.6786226344234958 and parameters: {'n_hidden': 2048, 'mixture_components': 6, 'use_sparse_layer': True, 'use_sparse_loss': True, 'lmbd': 0.0003832943837140043, 'use_batchnorm': False, 'use_dropout': True, 'dropout': 0.11981580788022972, 'mlp_size_1': 8, 'mlp_size_2': 0, 'mlp_size_3': 0, 'kernel': 'Gamma', 'loss_name': 'NLLLoss'}. Best is trial 142 with value: 0.7103637692860825.[0m
[32m[I 2022-04-19 03:04:00,303][0m Trial 147 finished with value: 0.48271457072105506 and parameters: {'n_hidden': 2048, 'mixture_components': 7, 'use_sparse_layer': True, 'use_sparse_loss': False, 'use_batchnorm': False, 'use_dropout': True, 'dropout': 0.8748360123285737, 'mlp_size_1': 7, 'mlp_size_2': 1, 'mlp_size_3': 0, 'kernel': 'Normal', 'loss_name': 'NLLLoss'}. Best is trial 142 with value: 0.7103637692860825.[0m
[32m[I 2022-04-19 03:06:26,155][0m Trial 148 finished with value: 0.6494508700546364 and parameters: {'n_hidden': 2048, 'mixture_components': 6, 'use_sparse_layer': False, 'use_batchnorm': False, 'use_dropout': True, 'dropout': 0.7696853742268898, 'mlp_size_1': 8, 'mlp_size_2': 0, 'mlp_size_3': 0, 'kernel': 'Gamma', 'loss_name': 'CensoredNLLLoss'}. Best is trial 142 with value: 0.7103637692860825.[0m
[32m[I 2022-04-19 03:07:58,761][0m Trial 149 finished with value: 0.4309825535974097 and parameters: {'n_hidden': 2048, 'mixture_components': 6, 'use_sparse_layer': True, 'use_sparse_loss': True, 'lmbd': 0.0014601304701468468, 'use_batchnorm': False, 'use_dropout': True, 'dropout': 0.5528472528080317, 'mlp_size_1': 6, 'mlp_size_2': 1, 'mlp_size_3': 0, 'kernel': 'Gumbel', 'loss_name': 'CensoredNLLLoss'}. Best is trial 142 with value: 0.7103637692860825.[0m
[32m[I 2022-04-19 03:09:30,455][0m Trial 150 finished with value: 0.6763255763902608 and parameters: {'n_hidden': 2048, 'mixture_components': 3, 'use_sparse_layer': True, 'use_sparse_loss': True, 'lmbd': 0.00043398922986733846, 'use_batchnorm': False, 'use_dropout': False, 'mlp_size_1': 7, 'mlp_size_2': 0, 'mlp_size_3': 0, 'kernel': 'Gamma', 'loss_name': 'NLLLoss'}. Best is trial 142 with value: 0.7103637692860825.[0m
[32m[I 2022-04-19 03:12:07,284][0m Trial 151 finished with value: 0.6729506823368107 and parameters: {'n_hidden': 2048, 'mixture_components': 5, 'use_sparse_layer': True, 'use_sparse_loss': True, 'lmbd': 0.0002700033559165448, 'use_batchnorm': False, 'use_dropout': True, 'dropout': 0.7502174102075847, 'mlp_size_1': 7, 'mlp_size_2': 0, 'mlp_size_3': 0, 'kernel': 'Gamma', 'loss_name': 'AlternativeNLLLoss'}. Best is trial 142 with value: 0.7103637692860825.[0m
[32m[I 2022-04-19 03:13:56,877][0m Trial 152 finished with value: 0.6215185473818409 and parameters: {'n_hidden': 128, 'mixture_components': 5, 'use_sparse_layer': True, 'use_sparse_loss': True, 'lmbd': 0.00019204120652432545, 'use_batchnorm': False, 'use_dropout': True, 'dropout': 0.8071008302429277, 'mlp_size_1': 4, 'mlp_size_2': 0, 'mlp_size_3': 0, 'kernel': 'Gamma', 'loss_name': 'CensoredNLLLoss'}. Best is trial 142 with value: 0.7103637692860825.[0m
[32m[I 2022-04-19 03:16:16,114][0m Trial 153 finished with value: 0.6865731548953719 and parameters: {'n_hidden': 2048, 'mixture_components': 2, 'use_sparse_layer': True, 'use_sparse_loss': True, 'lmbd': 0.003061621205346878, 'use_batchnorm': False, 'use_dropout': True, 'dropout': 0.4985177348372096, 'mlp_size_1': 7, 'mlp_size_2': 0, 'mlp_size_3': 0, 'kernel': 'Gamma', 'loss_name': 'CensoredNLLLoss'}. Best is trial 142 with value: 0.7103637692860825.[0m
[32m[I 2022-04-19 03:19:22,998][0m Trial 154 finished with value: 0.6530749844481685 and parameters: {'n_hidden': 32, 'mixture_components': 6, 'use_sparse_layer': True, 'use_sparse_loss': True, 'lmbd': 2.3566670778073983e-05, 'use_batchnorm': False, 'use_dropout': True, 'dropout': 0.7233994109005633, 'mlp_size_1': 2, 'mlp_size_2': 0, 'mlp_size_3': 0, 'kernel': 'Gamma', 'loss_name': 'AlternativeNLLLoss'}. Best is trial 142 with value: 0.7103637692860825.[0m
[32m[I 2022-04-19 03:21:23,310][0m Trial 155 finished with value: 0.6482112890459716 and parameters: {'n_hidden': 512, 'mixture_components': 2, 'use_sparse_layer': True, 'use_sparse_loss': True, 'lmbd': 0.00012149669991440092, 'use_batchnorm': False, 'use_dropout': True, 'dropout': 0.3510993109787246, 'mlp_size_1': 6, 'mlp_size_2': 0, 'mlp_size_3': 0, 'kernel': 'Gamma', 'loss_name': 'NLLLoss'}. Best is trial 142 with value: 0.7103637692860825.[0m
[32m[I 2022-04-19 03:24:05,475][0m Trial 156 finished with value: 0.6611433056355366 and parameters: {'n_hidden': 2048, 'mixture_components': 4, 'use_sparse_layer': True, 'use_sparse_loss': True, 'lmbd': 4.078232609254314e-06, 'use_batchnorm': False, 'use_dropout': True, 'dropout': 0.48064407350724114, 'mlp_size_1': 7, 'mlp_size_2': 0, 'mlp_size_3': 0, 'kernel': 'Gamma', 'loss_name': 'CensoredNLLLoss'}. Best is trial 142 with value: 0.7103637692860825.[0m
[32m[I 2022-04-19 03:25:50,817][0m Trial 157 finished with value: 0.6449679029467666 and parameters: {'n_hidden': 2048, 'mixture_components': 5, 'use_sparse_layer': True, 'use_sparse_loss': True, 'lmbd': 6.248944354393632e-05, 'use_batchnorm': False, 'use_dropout': True, 'dropout': 0.8636238657411488, 'mlp_size_1': 8, 'mlp_size_2': 0, 'mlp_size_3': 0, 'kernel': 'Gamma', 'loss_name': 'AlternativeNLLLoss'}. Best is trial 142 with value: 0.7103637692860825.[0m
[32m[I 2022-04-19 03:27:31,074][0m Trial 158 finished with value: 0.6507734864423503 and parameters: {'n_hidden': 256, 'mixture_components': 6, 'use_sparse_layer': True, 'use_sparse_loss': True, 'lmbd': 0.0006552817255874711, 'use_batchnorm': False, 'use_dropout': True, 'dropout': 0.3848896607389536, 'mlp_size_1': 5, 'mlp_size_2': 0, 'mlp_size_3': 0, 'kernel': 'Logistic', 'loss_name': 'CensoredNLLLoss'}. Best is trial 142 with value: 0.7103637692860825.[0m
[32m[I 2022-04-19 03:29:41,012][0m Trial 159 finished with value: 0.6926452120950399 and parameters: {'n_hidden': 2048, 'mixture_components': 3, 'use_sparse_layer': False, 'use_batchnorm': False, 'use_dropout': True, 'dropout': 0.619486756986313, 'mlp_size_1': 7, 'mlp_size_2': 0, 'mlp_size_3': 0, 'kernel': 'Gamma', 'loss_name': 'CensoredNLLLoss'}. Best is trial 142 with value: 0.7103637692860825.[0m
[32m[I 2022-04-19 03:32:42,735][0m Trial 160 finished with value: 0.6669073322747453 and parameters: {'n_hidden': 2048, 'mixture_components': 3, 'use_sparse_layer': False, 'use_batchnorm': False, 'use_dropout': True, 'dropout': 0.6197927758017676, 'mlp_size_1': 7, 'mlp_size_2': 0, 'mlp_size_3': 0, 'kernel': 'LogNormal', 'loss_name': 'CensoredNLLLoss'}. Best is trial 142 with value: 0.7103637692860825.[0m
[32m[I 2022-04-19 03:34:52,983][0m Trial 161 finished with value: 0.6704760709717388 and parameters: {'n_hidden': 2048, 'mixture_components': 3, 'use_sparse_layer': False, 'use_batchnorm': False, 'use_dropout': True, 'dropout': 0.08251644282764364, 'mlp_size_1': 7, 'mlp_size_2': 0, 'mlp_size_3': 0, 'kernel': 'Gamma', 'loss_name': 'CensoredNLLLoss'}. Best is trial 142 with value: 0.7103637692860825.[0m
[32m[I 2022-04-19 03:37:05,077][0m Trial 162 finished with value: 0.6559623459371428 and parameters: {'n_hidden': 2048, 'mixture_components': 3, 'use_sparse_layer': False, 'use_batchnorm': False, 'use_dropout': True, 'dropout': 0.8923093243658551, 'mlp_size_1': 7, 'mlp_size_2': 0, 'mlp_size_3': 0, 'kernel': 'Gamma', 'loss_name': 'CensoredNLLLoss'}. Best is trial 142 with value: 0.7103637692860825.[0m
