[32m[I 2022-04-14 03:29:05,298][0m Trial 802 finished with value: 0.8555706957364162 and parameters: {'loss': 'coxph', 'learning_rate': 0.002763916298720746, 'n_estimators': 147, 'criterion': 'friedman_mse', 'min_samples_split': 3, 'min_samples_leaf': 2, 'min_weight_fraction_leaf': 0.041547895121971434, 'min_impurity_decrease': 0.3540951988739432, 'max_features': 0.9439574673028333, 'subsample': 0.7653479122173336, 'dropout_rate': 0.7733714887678533, 'ccp_alpha': 0.15534073314822888}. Best is trial 627 with value: 0.8808013426064705.[0m
[32m[I 2022-04-14 03:29:09,327][0m Trial 803 finished with value: 0.8710777278743956 and parameters: {'loss': 'coxph', 'learning_rate': 0.0018548094051452678, 'n_estimators': 130, 'criterion': 'friedman_mse', 'min_samples_split': 4, 'min_samples_leaf': 1, 'min_weight_fraction_leaf': 0.0642350190227316, 'min_impurity_decrease': 0.25733606753084015, 'max_features': 0.890560875253627, 'subsample': 0.6647856236087851, 'dropout_rate': 0.3158451761062979, 'ccp_alpha': 0.002606618508505713}. Best is trial 627 with value: 0.8808013426064705.[0m
[32m[I 2022-04-14 03:29:12,687][0m Trial 804 finished with value: 0.65 and parameters: {'loss': 'coxph', 'learning_rate': 0.0034252664935500074, 'n_estimators': 137, 'criterion': 'friedman_mse', 'min_samples_split': 5, 'min_samples_leaf': 2, 'min_weight_fraction_leaf': 0.02782028760027709, 'min_impurity_decrease': 0.31466132516969475, 'max_features': 0.9682103470576308, 'subsample': 0.7427962302834885, 'dropout_rate': 0.4590489607024287, 'ccp_alpha': 1.634746652623464}. Best is trial 627 with value: 0.8808013426064705.[0m
[32m[I 2022-04-14 03:29:16,488][0m Trial 805 finished with value: 0.65 and parameters: {'loss': 'coxph', 'learning_rate': 0.0010845467860544453, 'n_estimators': 141, 'criterion': 'friedman_mse', 'min_samples_split': 4, 'min_samples_leaf': 1, 'min_weight_fraction_leaf': 0.04531408136772183, 'min_impurity_decrease': 0.27661890980163006, 'max_features': 0.9145448865151448, 'subsample': 0.7025635473553649, 'dropout_rate': 0.3483300073833772, 'ccp_alpha': 1.9814070657559504}. Best is trial 627 with value: 0.8808013426064705.[0m
[32m[I 2022-04-14 03:29:30,173][0m Trial 806 finished with value: 0.65 and parameters: {'loss': 'coxph', 'learning_rate': 0.0023037509239435057, 'n_estimators': 299, 'criterion': 'squared_error', 'min_samples_split': 4, 'min_samples_leaf': 1, 'min_weight_fraction_leaf': 0.03434948422029065, 'min_impurity_decrease': 0.5577430520655474, 'max_features': 0.9788455549996248, 'subsample': 0.7693145249722009, 'dropout_rate': 0.3903653669640176, 'ccp_alpha': 0.26879807630789565}. Best is trial 627 with value: 0.8808013426064705.[0m
[32m[I 2022-04-14 03:29:34,396][0m Trial 807 finished with value: 0.8694288693405234 and parameters: {'loss': 'coxph', 'learning_rate': 0.0014035845605218137, 'n_estimators': 174, 'criterion': 'friedman_mse', 'min_samples_split': 3, 'min_samples_leaf': 2, 'min_weight_fraction_leaf': 0.019231050436195118, 'min_impurity_decrease': 0.9646596047591478, 'max_features': 0.9291079100077991, 'subsample': 0.7209148373477079, 'dropout_rate': 0.42031589643032, 'ccp_alpha': 0.10135502304415232}. Best is trial 627 with value: 0.8808013426064705.[0m
[32m[I 2022-04-14 03:29:38,686][0m Trial 808 finished with value: 0.8507839110507925 and parameters: {'loss': 'coxph', 'learning_rate': 0.004034134402769084, 'n_estimators': 163, 'criterion': 'friedman_mse', 'min_samples_split': 4, 'min_samples_leaf': 1, 'min_weight_fraction_leaf': 0.07469276245590656, 'min_impurity_decrease': 0.39440029211039984, 'max_features': 0.9536549766123306, 'subsample': 0.8025770150645255, 'dropout_rate': 0.30102479787352643, 'ccp_alpha': 0.16886151776057456}. Best is trial 627 with value: 0.8808013426064705.[0m
[32m[I 2022-04-14 03:29:41,557][0m Trial 809 finished with value: 0.8489850313751731 and parameters: {'loss': 'coxph', 'learning_rate': 0.0018137000046351249, 'n_estimators': 178, 'criterion': 'friedman_mse', 'min_samples_split': 4, 'min_samples_leaf': 1, 'min_weight_fraction_leaf': 0.31871710781232876, 'min_impurity_decrease': 0.22626608019886196, 'max_features': 0.8935465294896315, 'subsample': 0.7856837223181353, 'dropout_rate': 0.7181184822550007, 'ccp_alpha': 0.09415698190852696}. Best is trial 627 with value: 0.8808013426064705.[0m
[32m[I 2022-04-14 03:30:02,725][0m Trial 810 finished with value: 0.6524506958451449 and parameters: {'loss': 'coxph', 'learning_rate': 0.0025637477231782585, 'n_estimators': 374, 'criterion': 'friedman_mse', 'min_samples_split': 3, 'min_samples_leaf': 2, 'min_weight_fraction_leaf': 0.009926257899197571, 'min_impurity_decrease': 0.3311893521582258, 'max_features': 0.9788990036081988, 'subsample': 0.7496242116709528, 'dropout_rate': 0.36982597357604685, 'ccp_alpha': 0.3823504864562792}. Best is trial 627 with value: 0.8808013426064705.[0m
[32m[I 2022-04-14 03:30:07,053][0m Trial 811 finished with value: -0.3656981539888867 and parameters: {'loss': 'squared', 'learning_rate': 0.0031310527023556303, 'n_estimators': 189, 'criterion': 'friedman_mse', 'min_samples_split': 4, 'min_samples_leaf': 1, 'min_weight_fraction_leaf': 0.05689570440594714, 'min_impurity_decrease': 0.28345200995722114, 'max_features': 0.9231033109681414, 'subsample': 0.6831671068010993, 'dropout_rate': 0.44678073321253114, 'ccp_alpha': 0.22491571743640154}. Best is trial 627 with value: 0.8808013426064705.[0m
[32m[I 2022-04-14 03:30:12,495][0m Trial 812 finished with value: 0.8621830667904785 and parameters: {'loss': 'coxph', 'learning_rate': 0.0021097406559771143, 'n_estimators': 136, 'criterion': 'friedman_mse', 'min_samples_split': 5, 'min_samples_leaf': 2, 'min_weight_fraction_leaf': 0.028549359832200298, 'min_impurity_decrease': 0.20937972480289835, 'max_features': 0.9608586468315568, 'subsample': 0.49552028539503906, 'dropout_rate': 0.2759742012198479, 'ccp_alpha': 0.09913212562404733}. Best is trial 627 with value: 0.8808013426064705.[0m
[32m[I 2022-04-14 03:30:17,706][0m Trial 813 finished with value: 0.8708615006101061 and parameters: {'loss': 'coxph', 'learning_rate': 0.0014047125715194735, 'n_estimators': 147, 'criterion': 'friedman_mse', 'min_samples_split': 4, 'min_samples_leaf': 1, 'min_weight_fraction_leaf': 0.049198618788526605, 'min_impurity_decrease': 0.3755431400024491, 'max_features': 0.9427154823194954, 'subsample': 0.7357028855599036, 'dropout_rate': 0.3367935821573158, 'ccp_alpha': 0.09030653937586894}. Best is trial 627 with value: 0.8808013426064705.[0m
[32m[I 2022-04-14 03:30:21,675][0m Trial 814 finished with value: 0.660872981146427 and parameters: {'loss': 'coxph', 'learning_rate': 0.000978451600324814, 'n_estimators': 167, 'criterion': 'friedman_mse', 'min_samples_split': 3, 'min_samples_leaf': 1, 'min_weight_fraction_leaf': 0.03896484067174383, 'min_impurity_decrease': 0.25125048165319386, 'max_features': 0.9813142550384724, 'subsample': 0.7140337860633394, 'dropout_rate': 0.4037191810160521, 'ccp_alpha': 0.3389597944857935}. Best is trial 627 with value: 0.8808013426064705.[0m
[32m[I 2022-04-14 03:30:25,030][0m Trial 815 finished with value: 0.8503811466012413 and parameters: {'loss': 'coxph', 'learning_rate': 0.0016865724511127196, 'n_estimators': 155, 'criterion': 'friedman_mse', 'min_samples_split': 4, 'min_samples_leaf': 2, 'min_weight_fraction_leaf': 0.09035116795755237, 'min_impurity_decrease': 0.3045794134976303, 'max_features': 0.8954241586964867, 'subsample': 0.7591984202731644, 'dropout_rate': 0.35935497616354706, 'ccp_alpha': 0.16653783745278394}. Best is trial 627 with value: 0.8808013426064705.[0m
[32m[I 2022-04-14 03:30:32,999][0m Trial 816 finished with value: 0.858352996042559 and parameters: {'loss': 'coxph', 'learning_rate': 0.006076867283771506, 'n_estimators': 248, 'criterion': 'friedman_mse', 'min_samples_split': 4, 'min_samples_leaf': 1, 'min_weight_fraction_leaf': 0.06731729029016523, 'min_impurity_decrease': 0.3538353415405236, 'max_features': 0.36094194608137264, 'subsample': 0.7831112976214502, 'dropout_rate': 0.4694992560984226, 'ccp_alpha': 0.07571479499189795}. Best is trial 627 with value: 0.8808013426064705.[0m
[32m[I 2022-04-14 03:30:42,272][0m Trial 817 finished with value: 0.8706687895212244 and parameters: {'loss': 'coxph', 'learning_rate': 0.002264549471590907, 'n_estimators': 277, 'criterion': 'friedman_mse', 'min_samples_split': 3, 'min_samples_leaf': 1, 'min_weight_fraction_leaf': 0.024974491137045186, 'min_impurity_decrease': 0.2693322837908926, 'max_features': 0.9178405729373305, 'subsample': 0.8120197331290591, 'dropout_rate': 0.4340834735110283, 'ccp_alpha': 0.0030953814468071537}. Best is trial 627 with value: 0.8808013426064705.[0m
[32m[I 2022-04-14 03:30:49,214][0m Trial 818 finished with value: 0.7629678265941304 and parameters: {'loss': 'coxph', 'learning_rate': 0.003544882438928643, 'n_estimators': 198, 'criterion': 'friedman_mse', 'min_samples_split': 4, 'min_samples_leaf': 2, 'min_weight_fraction_leaf': 0.4810844746533655, 'min_impurity_decrease': 0.5721780202559458, 'max_features': 0.9625793062688482, 'subsample': 0.7293458395770094, 'dropout_rate': 0.3839576995747872, 'ccp_alpha': 0.005155585801527128}. Best is trial 627 with value: 0.8808013426064705.[0m
[32m[I 2022-04-14 03:30:54,376][0m Trial 819 finished with value: 0.7133741303117678 and parameters: {'loss': 'coxph', 'learning_rate': 0.0011331178199378504, 'n_estimators': 143, 'criterion': 'friedman_mse', 'min_samples_split': 5, 'min_samples_leaf': 1, 'min_weight_fraction_leaf': 0.05883140486012822, 'min_impurity_decrease': 0.30222839134384677, 'max_features': 0.9998681196112771, 'subsample': 0.7674092127235402, 'dropout_rate': 0.32794595401726556, 'ccp_alpha': 0.25696716151564575}. Best is trial 627 with value: 0.8808013426064705.[0m
[32m[I 2022-04-14 03:30:57,330][0m Trial 820 finished with value: 0.65 and parameters: {'loss': 'coxph', 'learning_rate': 0.004980030281477911, 'n_estimators': 117, 'criterion': 'absolute_error', 'min_samples_split': 4, 'min_samples_leaf': 2, 'min_weight_fraction_leaf': 0.008798377165857674, 'min_impurity_decrease': 0.32992729119947284, 'max_features': 0.9414996555422448, 'subsample': 0.6914179825964648, 'dropout_rate': 0.4144452989355875, 'ccp_alpha': 0.17017014248814666}. Best is trial 627 with value: 0.8808013426064705.[0m
[32m[I 2022-04-14 03:31:01,358][0m Trial 821 finished with value: 0.853803129652049 and parameters: {'loss': 'coxph', 'learning_rate': 0.0007879015824634127, 'n_estimators': 124, 'criterion': 'friedman_mse', 'min_samples_split': 3, 'min_samples_leaf': 1, 'min_weight_fraction_leaf': 0.039916466854826166, 'min_impurity_decrease': 0.39668362299150073, 'max_features': 0.8873346368321443, 'subsample': 0.3084788336068535, 'dropout_rate': 0.315223645418538, 'ccp_alpha': 0.004924771585923403}. Best is trial 627 with value: 0.8808013426064705.[0m
[32m[I 2022-04-14 03:31:06,835][0m Trial 822 finished with value: 0.65 and parameters: {'loss': 'coxph', 'learning_rate': 0.0024983785746936966, 'n_estimators': 183, 'criterion': 'friedman_mse', 'min_samples_split': 4, 'min_samples_leaf': 1, 'min_weight_fraction_leaf': 0.04912870025863585, 'min_impurity_decrease': 0.4100505849658802, 'max_features': 0.9639651544126311, 'subsample': 0.7439964553510275, 'dropout_rate': 0.35438273980283747, 'ccp_alpha': 0.5832234139095764}. Best is trial 627 with value: 0.8808013426064705.[0m
[32m[I 2022-04-14 03:31:16,183][0m Trial 823 finished with value: 0.871200345308031 and parameters: {'loss': 'coxph', 'learning_rate': 0.001564773993006269, 'n_estimators': 264, 'criterion': 'friedman_mse', 'min_samples_split': 4, 'min_samples_leaf': 2, 'min_weight_fraction_leaf': 0.017170490509168655, 'min_impurity_decrease': 0.3560980313582426, 'max_features': 0.980214559610861, 'subsample': 0.6593817172250291, 'dropout_rate': 0.44875149021912386, 'ccp_alpha': 0.09630660524531674}. Best is trial 627 with value: 0.8808013426064705.[0m
[32m[I 2022-04-14 03:31:18,869][0m Trial 824 finished with value: 0.8576927868735916 and parameters: {'loss': 'coxph', 'learning_rate': 0.0018713709573774213, 'n_estimators': 151, 'criterion': 'friedman_mse', 'min_samples_split': 3, 'min_samples_leaf': 1, 'min_weight_fraction_leaf': 0.030725659342901536, 'min_impurity_decrease': 0.3146715285445719, 'max_features': 0.9139032784226905, 'subsample': 0.7918604514742681, 'dropout_rate': 0.39855567899049765, 'ccp_alpha': 0.17313590939292678}. Best is trial 627 with value: 0.8808013426064705.[0m
[32m[I 2022-04-14 03:31:20,987][0m Trial 825 finished with value: 0.8756367065481877 and parameters: {'loss': 'coxph', 'learning_rate': 0.003034632391445547, 'n_estimators': 132, 'criterion': 'friedman_mse', 'min_samples_split': 5, 'min_samples_leaf': 1, 'min_weight_fraction_leaf': 0.037254846707989654, 'min_impurity_decrease': 0.24316506604061358, 'max_features': 0.9389979024396357, 'subsample': 0.7121388319827702, 'dropout_rate': 0.4669007919569205, 'ccp_alpha': 0.00203920329292426}. Best is trial 627 with value: 0.8808013426064705.[0m
[32m[I 2022-04-14 03:31:26,264][0m Trial 826 finished with value: 0.8304629281427836 and parameters: {'loss': 'coxph', 'learning_rate': 0.03646803907445604, 'n_estimators': 208, 'criterion': 'friedman_mse', 'min_samples_split': 4, 'min_samples_leaf': 1, 'min_weight_fraction_leaf': 0.07795237341351009, 'min_impurity_decrease': 0.37510371619275473, 'max_features': 0.9522221614003765, 'subsample': 0.7701454358440138, 'dropout_rate': 0.38471904914427396, 'ccp_alpha': 0.23935866778402054}. Best is trial 627 with value: 0.8808013426064705.[0m
[32m[I 2022-04-14 03:31:30,505][0m Trial 827 finished with value: 0.7068678388473756 and parameters: {'loss': 'coxph', 'learning_rate': 0.0012281274939669787, 'n_estimators': 170, 'criterion': 'squared_error', 'min_samples_split': 4, 'min_samples_leaf': 2, 'min_weight_fraction_leaf': 0.06124550537745489, 'min_impurity_decrease': 0.2630763674333326, 'max_features': 0.9998495305565844, 'subsample': 0.7475817321971514, 'dropout_rate': 0.2906102698495412, 'ccp_alpha': 0.09492973084368643}. Best is trial 627 with value: 0.8808013426064705.[0m
[32m[I 2022-04-14 03:31:33,269][0m Trial 828 finished with value: 0.8730680416968685 and parameters: {'loss': 'coxph', 'learning_rate': 0.002625613386315049, 'n_estimators': 139, 'criterion': 'friedman_mse', 'min_samples_split': 3, 'min_samples_leaf': 1, 'min_weight_fraction_leaf': 0.04762359118190349, 'min_impurity_decrease': 0.29429569807502526, 'max_features': 0.9057250216471091, 'subsample': 0.8120953592099934, 'dropout_rate': 0.3705573760660593, 'ccp_alpha': 0.0016061928743644096}. Best is trial 627 with value: 0.8808013426064705.[0m
[32m[I 2022-04-14 03:31:40,578][0m Trial 829 finished with value: 0.8687482781880373 and parameters: {'loss': 'coxph', 'learning_rate': 0.003794061559917311, 'n_estimators': 233, 'criterion': 'friedman_mse', 'min_samples_split': 4, 'min_samples_leaf': 2, 'min_weight_fraction_leaf': 0.024700650833041862, 'min_impurity_decrease': 0.3444289054082552, 'max_features': 0.9290337968576876, 'subsample': 0.7270858257445516, 'dropout_rate': 0.6568340139731152, 'ccp_alpha': 0.11005881434201659}. Best is trial 627 with value: 0.8808013426064705.[0m
[32m[I 2022-04-14 03:31:45,863][0m Trial 830 finished with value: -0.3700167556001195 and parameters: {'loss': 'squared', 'learning_rate': 0.0019843174185041022, 'n_estimators': 189, 'criterion': 'friedman_mse', 'min_samples_split': 4, 'min_samples_leaf': 1, 'min_weight_fraction_leaf': 0.06803465409256457, 'min_impurity_decrease': 0.4164700251281093, 'max_features': 0.9807719837656683, 'subsample': 0.642831826681947, 'dropout_rate': 0.41904388241105317, 'ccp_alpha': 0.001160295566702261}. Best is trial 627 with value: 0.8808013426064705.[0m
[32m[I 2022-04-14 03:31:49,959][0m Trial 831 finished with value: 0.6656286806391103 and parameters: {'loss': 'coxph', 'learning_rate': 0.0014100458308976235, 'n_estimators': 163, 'criterion': 'friedman_mse', 'min_samples_split': 3, 'min_samples_leaf': 2, 'min_weight_fraction_leaf': 0.051377943159809515, 'min_impurity_decrease': 0.23380200184447997, 'max_features': 0.8903276475201555, 'subsample': 0.6973192119379212, 'dropout_rate': 0.3438290527936124, 'ccp_alpha': 0.3160026606771216}. Best is trial 627 with value: 0.8808013426064705.[0m
[32m[I 2022-04-14 03:31:54,479][0m Trial 832 finished with value: 0.65 and parameters: {'loss': 'coxph', 'learning_rate': 0.0008989081428706265, 'n_estimators': 176, 'criterion': 'friedman_mse', 'min_samples_split': 4, 'min_samples_leaf': 1, 'min_weight_fraction_leaf': 0.034529250293154026, 'min_impurity_decrease': 0.2830662649882006, 'max_features': 0.9649677980785483, 'subsample': 0.7831174469656959, 'dropout_rate': 0.43639078523685443, 'ccp_alpha': 4.593991580192856}. Best is trial 627 with value: 0.8808013426064705.[0m
[32m[I 2022-04-14 03:31:58,875][0m Trial 833 finished with value: 0.8614340015105407 and parameters: {'loss': 'coxph', 'learning_rate': 0.0022136600544012566, 'n_estimators': 201, 'criterion': 'friedman_mse', 'min_samples_split': 5, 'min_samples_leaf': 1, 'min_weight_fraction_leaf': 0.008446084040387589, 'min_impurity_decrease': 0.5002388933653181, 'max_features': 0.9459529465249954, 'subsample': 0.7566895540198647, 'dropout_rate': 0.48827166724548476, 'ccp_alpha': 0.16312448742012842}. Best is trial 627 with value: 0.8808013426064705.[0m
[32m[I 2022-04-14 03:32:02,573][0m Trial 834 finished with value: 0.8451382829886971 and parameters: {'loss': 'coxph', 'learning_rate': 0.004660096311192493, 'n_estimators': 151, 'criterion': 'friedman_mse', 'min_samples_split': 4, 'min_samples_leaf': 2, 'min_weight_fraction_leaf': 0.019624795165719848, 'min_impurity_decrease': 0.3209903211884573, 'max_features': 0.9821821773452442, 'subsample': 0.677787394493941, 'dropout_rate': 0.30454222012393656, 'ccp_alpha': 0.24040689444239913}. Best is trial 627 with value: 0.8808013426064705.[0m
[32m[I 2022-04-14 03:32:14,790][0m Trial 835 finished with value: 0.8699657691520283 and parameters: {'loss': 'coxph', 'learning_rate': 0.0029131397284345257, 'n_estimators': 220, 'criterion': 'friedman_mse', 'min_samples_split': 3, 'min_samples_leaf': 1, 'min_weight_fraction_leaf': 0.042775087333077035, 'min_impurity_decrease': 0.37957898010607327, 'max_features': 0.9258459187876035, 'subsample': 0.7374997722660679, 'dropout_rate': 0.3273612753915959, 'ccp_alpha': 0.08500964021299143}. Best is trial 627 with value: 0.8808013426064705.[0m
[32m[I 2022-04-14 03:32:16,480][0m Trial 836 finished with value: 0.8714288712783927 and parameters: {'loss': 'coxph', 'learning_rate': 0.0017898725524797688, 'n_estimators': 127, 'criterion': 'friedman_mse', 'min_samples_split': 4, 'min_samples_leaf': 1, 'min_weight_fraction_leaf': 0.05720145585751649, 'min_impurity_decrease': 0.5680634449552819, 'max_features': 0.8836213219374557, 'subsample': 0.7136634591052242, 'dropout_rate': 0.6839728928944463, 'ccp_alpha': 0.0014125795722630882}. Best is trial 627 with value: 0.8808013426064705.[0m
[32m[I 2022-04-14 03:32:19,494][0m Trial 837 finished with value: 0.8677084351601307 and parameters: {'loss': 'coxph', 'learning_rate': 0.0011006434599936008, 'n_estimators': 143, 'criterion': 'friedman_mse', 'min_samples_split': 4, 'min_samples_leaf': 3, 'min_weight_fraction_leaf': 0.027907175884199463, 'min_impurity_decrease': 0.33646480598690953, 'max_features': 0.9533394248963829, 'subsample': 0.36465366721242903, 'dropout_rate': 0.37629010504850946, 'ccp_alpha': 0.15158438648671846}. Best is trial 627 with value: 0.8808013426064705.[0m
[32m[I 2022-04-14 03:32:52,989][0m Trial 838 finished with value: 0.8718806003162651 and parameters: {'loss': 'coxph', 'learning_rate': 0.0014734853509046077, 'n_estimators': 453, 'criterion': 'friedman_mse', 'min_samples_split': 3, 'min_samples_leaf': 2, 'min_weight_fraction_leaf': 0.07298782770474208, 'min_impurity_decrease': 0.36431349795414497, 'max_features': 0.9059243506422043, 'subsample': 0.7674286258551736, 'dropout_rate': 0.2556450809821959, 'ccp_alpha': 0.08962809764180706}. Best is trial 627 with value: 0.8808013426064705.[0m
[32m[I 2022-04-14 03:32:57,585][0m Trial 839 finished with value: 0.7156139374637411 and parameters: {'loss': 'coxph', 'learning_rate': 0.0036259634768072155, 'n_estimators': 173, 'criterion': 'friedman_mse', 'min_samples_split': 5, 'min_samples_leaf': 5, 'min_weight_fraction_leaf': 0.03622909660646157, 'min_impurity_decrease': 0.2589732712175614, 'max_features': 0.9823651607935086, 'subsample': 0.8073274746439895, 'dropout_rate': 0.40325748377067394, 'ccp_alpha': 0.23179495734148745}. Best is trial 627 with value: 0.8808013426064705.[0m
[32m[I 2022-04-14 03:33:00,003][0m Trial 840 finished with value: 0.65 and parameters: {'loss': 'coxph', 'learning_rate': 0.0025645869816940613, 'n_estimators': 134, 'criterion': 'friedman_mse', 'min_samples_split': 4, 'min_samples_leaf': 1, 'min_weight_fraction_leaf': 0.04651301385078236, 'min_impurity_decrease': 0.2984638749220322, 'max_features': 0.9647606061139239, 'subsample': 0.785396392301528, 'dropout_rate': 0.46754280509556734, 'ccp_alpha': 0.4979981310670791}. Best is trial 627 with value: 0.8808013426064705.[0m
[32m[I 2022-04-14 03:33:04,639][0m Trial 841 finished with value: 0.8686395781178904 and parameters: {'loss': 'coxph', 'learning_rate': 0.0020563029403597188, 'n_estimators': 158, 'criterion': 'friedman_mse', 'min_samples_split': 8, 'min_samples_leaf': 2, 'min_weight_fraction_leaf': 0.018558124774171795, 'min_impurity_decrease': 0.39443949883259344, 'max_features': 0.9314037908043347, 'subsample': 0.7484818442352775, 'dropout_rate': 0.35847369708329135, 'ccp_alpha': 0.09762608495648369}. Best is trial 627 with value: 0.8808013426064705.[0m
