[32m[I 2022-04-13 11:46:21,032][0m Trial 826 finished with value: 0.6494272905439874 and parameters: {'splitter': 'random', 'min_samples_split': 0.26898303511905025, 'min_samples_leaf': 0.012835564897469141, 'min_weight_fraction_leaf': 0.10236172119704288, 'max_features': 0.6490675349115762}. Best is trial 819 with value: 0.7205250605114317.[0m
[32m[I 2022-04-13 11:46:21,074][0m Trial 827 finished with value: 0.7138319698070605 and parameters: {'splitter': 'random', 'min_samples_split': 0.2706679651056248, 'min_samples_leaf': 0.0021382721998446184, 'min_weight_fraction_leaf': 0.10611674039799092, 'max_features': 0.6193778262953966}. Best is trial 819 with value: 0.7205250605114317.[0m
[32m[I 2022-04-13 11:46:21,116][0m Trial 828 finished with value: 0.7058013434606394 and parameters: {'splitter': 'random', 'min_samples_split': 0.25618187419247007, 'min_samples_leaf': 0.0332646193411676, 'min_weight_fraction_leaf': 0.1094554169123693, 'max_features': 0.6236324108939139}. Best is trial 819 with value: 0.7205250605114317.[0m
[32m[I 2022-04-13 11:46:21,164][0m Trial 829 finished with value: 0.6485886947469399 and parameters: {'splitter': 'random', 'min_samples_split': 0.2689210767708247, 'min_samples_leaf': 0.043466638146128375, 'min_weight_fraction_leaf': 0.11472169576221082, 'max_features': 0.6925884827765474}. Best is trial 819 with value: 0.7205250605114317.[0m
[32m[I 2022-04-13 11:46:21,214][0m Trial 830 finished with value: 0.7138319698070605 and parameters: {'splitter': 'random', 'min_samples_split': 0.27085825364980004, 'min_samples_leaf': 0.039308043521432835, 'min_weight_fraction_leaf': 0.11241065958350578, 'max_features': 0.6196007944316393}. Best is trial 819 with value: 0.7205250605114317.[0m
[32m[I 2022-04-13 11:46:21,265][0m Trial 831 finished with value: 0.6494272905439874 and parameters: {'splitter': 'random', 'min_samples_split': 0.27285601563581585, 'min_samples_leaf': 0.013751995967610967, 'min_weight_fraction_leaf': 0.09945580052681591, 'max_features': 0.6734129689079748}. Best is trial 819 with value: 0.7205250605114317.[0m
[32m[I 2022-04-13 11:46:21,318][0m Trial 832 finished with value: 0.6494272905439874 and parameters: {'splitter': 'random', 'min_samples_split': 0.2675974652579008, 'min_samples_leaf': 0.06510932299342645, 'min_weight_fraction_leaf': 0.09836443915375438, 'max_features': 0.6300976094663951}. Best is trial 819 with value: 0.7205250605114317.[0m
[32m[I 2022-04-13 11:46:21,403][0m Trial 833 finished with value: 0.6485886947469399 and parameters: {'splitter': 'random', 'min_samples_split': 0.2636915463895929, 'min_samples_leaf': 0.039097885081547455, 'min_weight_fraction_leaf': 0.11522942734767952, 'max_features': 0.6535595929398521}. Best is trial 819 with value: 0.7205250605114317.[0m
[32m[I 2022-04-13 11:46:21,582][0m Trial 834 finished with value: 0.6485886947469399 and parameters: {'splitter': 'random', 'min_samples_split': 0.2449826343229461, 'min_samples_leaf': 0.038595596589709576, 'min_weight_fraction_leaf': 0.11328540669645648, 'max_features': 0.6426900153786244}. Best is trial 819 with value: 0.7205250605114317.[0m
[32m[I 2022-04-13 11:46:21,665][0m Trial 835 finished with value: 0.6485886947469399 and parameters: {'splitter': 'random', 'min_samples_split': 0.2645279456439454, 'min_samples_leaf': 0.01966410692769402, 'min_weight_fraction_leaf': 0.10569756826210243, 'max_features': 0.6647356337664304}. Best is trial 819 with value: 0.7205250605114317.[0m
[32m[I 2022-04-13 11:46:21,813][0m Trial 836 finished with value: 0.7138319698070605 and parameters: {'splitter': 'random', 'min_samples_split': 0.2653942081277483, 'min_samples_leaf': 0.012644415088069247, 'min_weight_fraction_leaf': 0.10724894663947282, 'max_features': 0.6228622498522148}. Best is trial 819 with value: 0.7205250605114317.[0m
[32m[I 2022-04-13 11:46:22,017][0m Trial 837 finished with value: 0.6365884699050991 and parameters: {'splitter': 'random', 'min_samples_split': 0.2764512784337662, 'min_samples_leaf': 0.02020162572077075, 'min_weight_fraction_leaf': 0.10688684512127372, 'max_features': 0.6622450102501364}. Best is trial 819 with value: 0.7205250605114317.[0m
[32m[I 2022-04-13 11:46:22,073][0m Trial 838 finished with value: 0.6494272905439874 and parameters: {'splitter': 'random', 'min_samples_split': 0.25023494828026777, 'min_samples_leaf': 0.021311802555618764, 'min_weight_fraction_leaf': 0.09387096369805534, 'max_features': 0.6381104844530961}. Best is trial 819 with value: 0.7205250605114317.[0m
[32m[I 2022-04-13 11:46:22,243][0m Trial 839 finished with value: 0.7058013434606394 and parameters: {'splitter': 'random', 'min_samples_split': 0.26234556871569703, 'min_samples_leaf': 0.017262128734766437, 'min_weight_fraction_leaf': 0.10820869101561757, 'max_features': 0.6195908565290268}. Best is trial 819 with value: 0.7205250605114317.[0m
[32m[I 2022-04-13 11:46:22,309][0m Trial 840 finished with value: 0.6380186846821877 and parameters: {'splitter': 'random', 'min_samples_split': 0.26069053261755576, 'min_samples_leaf': 0.0016507515427100538, 'min_weight_fraction_leaf': 0.08721687131852064, 'max_features': 0.6347241114053608}. Best is trial 819 with value: 0.7205250605114317.[0m
[32m[I 2022-04-13 11:46:22,456][0m Trial 841 finished with value: 0.46653397352131 and parameters: {'splitter': 'random', 'min_samples_split': 0.2809139994897926, 'min_samples_leaf': 0.3109330418536065, 'min_weight_fraction_leaf': 0.1228316485165009, 'max_features': 0.606851906177905}. Best is trial 819 with value: 0.7205250605114317.[0m
[32m[I 2022-04-13 11:46:22,635][0m Trial 842 finished with value: 0.7077378843113455 and parameters: {'splitter': 'random', 'min_samples_split': 0.27005494526552476, 'min_samples_leaf': 0.034702086963936916, 'min_weight_fraction_leaf': 0.12964791147141158, 'max_features': 0.6194413448060708}. Best is trial 819 with value: 0.7205250605114317.[0m
[32m[I 2022-04-13 11:46:22,786][0m Trial 843 finished with value: 0.6300184585256496 and parameters: {'splitter': 'random', 'min_samples_split': 0.2764256878710022, 'min_samples_leaf': 0.04419039636996098, 'min_weight_fraction_leaf': 0.1507509432854365, 'max_features': 0.6864791139829257}. Best is trial 819 with value: 0.7205250605114317.[0m
[32m[I 2022-04-13 11:46:23,025][0m Trial 844 finished with value: 0.6667201630589786 and parameters: {'splitter': 'random', 'min_samples_split': 0.2456380670563824, 'min_samples_leaf': 0.0012592616202160858, 'min_weight_fraction_leaf': 0.10445184053968697, 'max_features': 0.6295739370174005}. Best is trial 819 with value: 0.7205250605114317.[0m
[32m[I 2022-04-13 11:46:23,244][0m Trial 845 finished with value: 0.6486288625324488 and parameters: {'splitter': 'random', 'min_samples_split': 0.23240375439402386, 'min_samples_leaf': 0.030563651989678507, 'min_weight_fraction_leaf': 0.047336345628269896, 'max_features': 0.6541161172247257}. Best is trial 819 with value: 0.7205250605114317.[0m
[32m[I 2022-04-13 11:46:23,492][0m Trial 846 finished with value: 0.6785403529763662 and parameters: {'splitter': 'random', 'min_samples_split': 0.2598812002220295, 'min_samples_leaf': 0.026755858014197168, 'min_weight_fraction_leaf': 0.03525366392735885, 'max_features': 0.6712200498870842}. Best is trial 819 with value: 0.7205250605114317.[0m
[32m[I 2022-04-13 11:46:23,621][0m Trial 847 finished with value: 0.7112177189306742 and parameters: {'splitter': 'random', 'min_samples_split': 0.2559359734689987, 'min_samples_leaf': 0.027485920369416036, 'min_weight_fraction_leaf': 0.06915437809973957, 'max_features': 0.6165783534338498}. Best is trial 819 with value: 0.7205250605114317.[0m
[32m[I 2022-04-13 11:46:23,779][0m Trial 848 finished with value: 0.4646561110644756 and parameters: {'splitter': 'random', 'min_samples_split': 0.2747997529215281, 'min_samples_leaf': 0.2822382485240229, 'min_weight_fraction_leaf': 0.09891669018534663, 'max_features': 0.6610855586081033}. Best is trial 819 with value: 0.7205250605114317.[0m
[32m[I 2022-04-13 11:46:23,865][0m Trial 849 finished with value: 0.6494272905439874 and parameters: {'splitter': 'random', 'min_samples_split': 0.2739596540547369, 'min_samples_leaf': 0.010652701771262669, 'min_weight_fraction_leaf': 0.09449859719604002, 'max_features': 0.6347055113866266}. Best is trial 819 with value: 0.7205250605114317.[0m
[32m[I 2022-04-13 11:46:23,976][0m Trial 850 finished with value: 0.6380186846821877 and parameters: {'splitter': 'random', 'min_samples_split': 0.2576084157220065, 'min_samples_leaf': 0.011064080375070411, 'min_weight_fraction_leaf': 0.09099203157147205, 'max_features': 0.6422525422011097}. Best is trial 819 with value: 0.7205250605114317.[0m
[32m[I 2022-04-13 11:46:24,119][0m Trial 851 finished with value: 0.7205250605114317 and parameters: {'splitter': 'random', 'min_samples_split': 0.26717310593641813, 'min_samples_leaf': 0.05405690744649584, 'min_weight_fraction_leaf': 0.02838536246721588, 'max_features': 0.6097708974598924}. Best is trial 819 with value: 0.7205250605114317.[0m
[32m[I 2022-04-13 11:46:24,259][0m Trial 852 finished with value: 0.7081251008672119 and parameters: {'splitter': 'random', 'min_samples_split': 0.27533524225729755, 'min_samples_leaf': 0.0011645356733502726, 'min_weight_fraction_leaf': 0.019084258448486643, 'max_features': 0.6115197925475335}. Best is trial 819 with value: 0.7205250605114317.[0m
[32m[I 2022-04-13 11:46:24,390][0m Trial 853 finished with value: 0.7077378843113455 and parameters: {'splitter': 'random', 'min_samples_split': 0.24309993061698318, 'min_samples_leaf': 0.05686358213235884, 'min_weight_fraction_leaf': 0.12183842459267809, 'max_features': 0.6178306994912961}. Best is trial 819 with value: 0.7205250605114317.[0m
[32m[I 2022-04-13 11:46:24,516][0m Trial 854 finished with value: 0.6810986821163494 and parameters: {'splitter': 'random', 'min_samples_split': 0.25875018000020206, 'min_samples_leaf': 0.017988015549117064, 'min_weight_fraction_leaf': 0.01208984344972125, 'max_features': 0.6445996186527209}. Best is trial 819 with value: 0.7205250605114317.[0m
[32m[I 2022-04-13 11:46:24,659][0m Trial 855 finished with value: 0.7111234113512894 and parameters: {'splitter': 'random', 'min_samples_split': 0.2694239213603298, 'min_samples_leaf': 0.03761982813944823, 'min_weight_fraction_leaf': 0.02115366829086337, 'max_features': 0.6094383481163879}. Best is trial 819 with value: 0.7205250605114317.[0m
[32m[I 2022-04-13 11:46:24,757][0m Trial 856 finished with value: 0.7075743489608037 and parameters: {'splitter': 'random', 'min_samples_split': 0.2821657348369885, 'min_samples_leaf': 0.025459351422489743, 'min_weight_fraction_leaf': 0.033287037146834945, 'max_features': 0.6096165364690633}. Best is trial 819 with value: 0.7205250605114317.[0m
[32m[I 2022-04-13 11:46:24,847][0m Trial 857 finished with value: 0.6780383816127342 and parameters: {'splitter': 'random', 'min_samples_split': 0.2799094496986584, 'min_samples_leaf': 0.0012376988132708506, 'min_weight_fraction_leaf': 0.010383889507711304, 'max_features': 0.674106747391265}. Best is trial 819 with value: 0.7205250605114317.[0m
[32m[I 2022-04-13 11:46:24,905][0m Trial 858 finished with value: 0.6494272905439874 and parameters: {'splitter': 'random', 'min_samples_split': 0.25388551486374084, 'min_samples_leaf': 0.0012208073314680695, 'min_weight_fraction_leaf': 0.10353559062597945, 'max_features': 0.6419158507280762}. Best is trial 819 with value: 0.7205250605114317.[0m
[32m[I 2022-04-13 11:46:25,003][0m Trial 859 finished with value: 0.6380186846821877 and parameters: {'splitter': 'random', 'min_samples_split': 0.26586318134702264, 'min_samples_leaf': 0.01745771013331842, 'min_weight_fraction_leaf': 0.08632982501769126, 'max_features': 0.6547048494511252}. Best is trial 819 with value: 0.7205250605114317.[0m
[32m[I 2022-04-13 11:46:25,082][0m Trial 860 finished with value: 0.6794927099948953 and parameters: {'splitter': 'random', 'min_samples_split': 0.28403449024672084, 'min_samples_leaf': 0.011011898038505826, 'min_weight_fraction_leaf': 0.025422718522000457, 'max_features': 0.6251137101066144}. Best is trial 819 with value: 0.7205250605114317.[0m
[32m[I 2022-04-13 11:46:25,176][0m Trial 861 finished with value: 0.7081251008672119 and parameters: {'splitter': 'random', 'min_samples_split': 0.267702048311046, 'min_samples_leaf': 0.010360865052198404, 'min_weight_fraction_leaf': 0.002504557319096691, 'max_features': 0.6246441904368596}. Best is trial 819 with value: 0.7205250605114317.[0m
[32m[I 2022-04-13 11:46:25,346][0m Trial 862 finished with value: 0.708337996742133 and parameters: {'splitter': 'random', 'min_samples_split': 0.23814919174530552, 'min_samples_leaf': 0.03254455294357421, 'min_weight_fraction_leaf': 0.05204610436551209, 'max_features': 0.5991401305123832}. Best is trial 819 with value: 0.7205250605114317.[0m
[32m[I 2022-04-13 11:46:25,505][0m Trial 863 finished with value: 0.46698720506030406 and parameters: {'splitter': 'random', 'min_samples_split': 0.27304322084838123, 'min_samples_leaf': 0.0016011911284989104, 'min_weight_fraction_leaf': 0.2907431527120466, 'max_features': 0.6196660676483979}. Best is trial 819 with value: 0.7205250605114317.[0m
[32m[I 2022-04-13 11:46:25,598][0m Trial 864 finished with value: 0.7112177189306742 and parameters: {'splitter': 'random', 'min_samples_split': 0.25502566416711847, 'min_samples_leaf': 0.07851662965926651, 'min_weight_fraction_leaf': 0.038212386004196436, 'max_features': 0.6042096606377321}. Best is trial 819 with value: 0.7205250605114317.[0m
[32m[I 2022-04-13 11:46:26,775][0m Trial 865 finished with value: 0.6374270657021465 and parameters: {'splitter': 'random', 'min_samples_split': 0.27796764171646765, 'min_samples_leaf': 0.0021382366521953047, 'min_weight_fraction_leaf': 0.1044276581599405, 'max_features': 0.6504959804790884}. Best is trial 819 with value: 0.7205250605114317.[0m
[32m[I 2022-04-13 11:46:26,870][0m Trial 866 finished with value: 0.7075743489608037 and parameters: {'splitter': 'random', 'min_samples_split': 0.2812867949651192, 'min_samples_leaf': 0.0701918172171697, 'min_weight_fraction_leaf': 0.033869256106660695, 'max_features': 0.6056696502881539}. Best is trial 819 with value: 0.7205250605114317.[0m
[32m[I 2022-04-13 11:46:26,944][0m Trial 867 finished with value: 0.5551385562717799 and parameters: {'splitter': 'random', 'min_samples_split': 0.2642865662600577, 'min_samples_leaf': 0.21931761234718805, 'min_weight_fraction_leaf': 0.04378518763403674, 'max_features': 0.6280133418436323}. Best is trial 819 with value: 0.7205250605114317.[0m
[32m[I 2022-04-13 11:46:27,082][0m Trial 868 finished with value: 0.7075743489608037 and parameters: {'splitter': 'random', 'min_samples_split': 0.2830517020727272, 'min_samples_leaf': 0.05140953314190361, 'min_weight_fraction_leaf': 0.029782578858003127, 'max_features': 0.5960014457027817}. Best is trial 819 with value: 0.7205250605114317.[0m
[32m[I 2022-04-13 11:46:27,135][0m Trial 869 finished with value: 0.7112177189306742 and parameters: {'splitter': 'random', 'min_samples_split': 0.2611129610635224, 'min_samples_leaf': 0.030570296414024662, 'min_weight_fraction_leaf': 0.046660877361268685, 'max_features': 0.5963589729604005}. Best is trial 819 with value: 0.7205250605114317.[0m
[32m[I 2022-04-13 11:46:27,279][0m Trial 870 finished with value: 0.437616372588949 and parameters: {'splitter': 'random', 'min_samples_split': 0.2659219727128797, 'min_samples_leaf': 0.026798533179708428, 'min_weight_fraction_leaf': 0.33819125283016593, 'max_features': 0.587767875214267}. Best is trial 819 with value: 0.7205250605114317.[0m
[32m[I 2022-04-13 11:46:27,401][0m Trial 871 finished with value: 0.6260184598403468 and parameters: {'splitter': 'random', 'min_samples_split': 0.2863999703184016, 'min_samples_leaf': 0.010816517399662058, 'min_weight_fraction_leaf': 0.08756054399547261, 'max_features': 0.6258122047815182}. Best is trial 819 with value: 0.7205250605114317.[0m
[32m[I 2022-04-13 11:46:27,530][0m Trial 872 finished with value: 0.6891528673684901 and parameters: {'splitter': 'random', 'min_samples_split': 0.24059590496916258, 'min_samples_leaf': 0.1706356182294708, 'min_weight_fraction_leaf': 0.11853915136853013, 'max_features': 0.6112021758346596}. Best is trial 819 with value: 0.7205250605114317.[0m
[32m[I 2022-04-13 11:46:27,639][0m Trial 873 finished with value: 0.6321106989473192 and parameters: {'splitter': 'random', 'min_samples_split': 0.25069208255906894, 'min_samples_leaf': 0.012787079817987953, 'min_weight_fraction_leaf': 0.044024752345465504, 'max_features': 0.6417300233930211}. Best is trial 819 with value: 0.7205250605114317.[0m
[32m[I 2022-04-13 11:46:27,793][0m Trial 874 finished with value: 0.7077378843113455 and parameters: {'splitter': 'random', 'min_samples_split': 0.27310395033200885, 'min_samples_leaf': 0.06258975543232924, 'min_weight_fraction_leaf': 0.12910611971943267, 'max_features': 0.5918180319612218}. Best is trial 819 with value: 0.7205250605114317.[0m
[32m[I 2022-04-13 11:46:27,996][0m Trial 875 finished with value: 0.7075743489608037 and parameters: {'splitter': 'random', 'min_samples_split': 0.28209133451368806, 'min_samples_leaf': 0.02123727829990055, 'min_weight_fraction_leaf': 0.06441005263073654, 'max_features': 0.6129716611869545}. Best is trial 819 with value: 0.7205250605114317.[0m
[32m[I 2022-04-13 11:46:28,155][0m Trial 876 finished with value: 0.6321106989473192 and parameters: {'splitter': 'random', 'min_samples_split': 0.26876549860930743, 'min_samples_leaf': 0.02003105177060432, 'min_weight_fraction_leaf': 0.05875435891128762, 'max_features': 0.6608476243579561}. Best is trial 819 with value: 0.7205250605114317.[0m
[32m[I 2022-04-13 11:46:28,308][0m Trial 877 finished with value: 0.7166142182627449 and parameters: {'splitter': 'random', 'min_samples_split': 0.2868576951906103, 'min_samples_leaf': 0.08703871517385184, 'min_weight_fraction_leaf': 0.11290004647689182, 'max_features': 0.5937804602733856}. Best is trial 819 with value: 0.7205250605114317.[0m
[32m[I 2022-04-13 11:46:28,399][0m Trial 878 finished with value: 0.7075743489608037 and parameters: {'splitter': 'random', 'min_samples_split': 0.2869176015328141, 'min_samples_leaf': 0.07641416696985268, 'min_weight_fraction_leaf': 0.025315088674158347, 'max_features': 0.5931150219214073}. Best is trial 819 with value: 0.7205250605114317.[0m
[32m[I 2022-04-13 11:46:28,530][0m Trial 879 finished with value: 0.7094949191282665 and parameters: {'splitter': 'random', 'min_samples_split': 0.274946604340969, 'min_samples_leaf': 0.010449202096818547, 'min_weight_fraction_leaf': 0.09512214393792899, 'max_features': 0.6168268006484671}. Best is trial 819 with value: 0.7205250605114317.[0m
[32m[I 2022-04-13 11:46:28,678][0m Trial 880 finished with value: 0.6794927099948953 and parameters: {'splitter': 'random', 'min_samples_split': 0.28613580010043244, 'min_samples_leaf': 0.01197754539109518, 'min_weight_fraction_leaf': 0.021731037968889866, 'max_features': 0.6890014676513996}. Best is trial 819 with value: 0.7205250605114317.[0m
[32m[I 2022-04-13 11:46:28,843][0m Trial 881 finished with value: 0.7112177189306742 and parameters: {'splitter': 'random', 'min_samples_split': 0.259289254522968, 'min_samples_leaf': 0.04314349203303216, 'min_weight_fraction_leaf': 0.05376148390626789, 'max_features': 0.5912836883456267}. Best is trial 819 with value: 0.7205250605114317.[0m
[32m[I 2022-04-13 11:46:29,010][0m Trial 882 finished with value: 0.6881219004371563 and parameters: {'splitter': 'random', 'min_samples_split': 0.2729216376135951, 'min_samples_leaf': 0.11179179746697054, 'min_weight_fraction_leaf': 0.059671410075366, 'max_features': 0.9008178375107828}. Best is trial 819 with value: 0.7205250605114317.[0m
[32m[I 2022-04-13 11:46:29,069][0m Trial 883 finished with value: 0.7134232280890631 and parameters: {'splitter': 'random', 'min_samples_split': 0.2858773884249584, 'min_samples_leaf': 0.061840792074876944, 'min_weight_fraction_leaf': 0.12448796855025411, 'max_features': 0.5945348517557937}. Best is trial 819 with value: 0.7205250605114317.[0m
[32m[I 2022-04-13 11:46:29,140][0m Trial 884 finished with value: 0.6485886947469399 and parameters: {'splitter': 'random', 'min_samples_split': 0.24874658368340705, 'min_samples_leaf': 0.020957595189649604, 'min_weight_fraction_leaf': 0.11778144946367043, 'max_features': 0.7113235596316938}. Best is trial 819 with value: 0.7205250605114317.[0m
[32m[I 2022-04-13 11:46:29,297][0m Trial 885 finished with value: 0.7138319698070605 and parameters: {'splitter': 'random', 'min_samples_split': 0.2664515316819786, 'min_samples_leaf': 0.056934718186074526, 'min_weight_fraction_leaf': 0.11516377831965742, 'max_features': 0.605897805298814}. Best is trial 819 with value: 0.7205250605114317.[0m
[32m[I 2022-04-13 11:46:29,448][0m Trial 886 finished with value: 0.6485886947469399 and parameters: {'splitter': 'random', 'min_samples_split': 0.2537692359590459, 'min_samples_leaf': 0.017755063341437224, 'min_weight_fraction_leaf': 0.11485790082077071, 'max_features': 0.6559713290457672}. Best is trial 819 with value: 0.7205250605114317.[0m
[32m[I 2022-04-13 11:46:29,506][0m Trial 887 finished with value: 0.6494272905439874 and parameters: {'splitter': 'random', 'min_samples_split': 0.26943868815792715, 'min_samples_leaf': 0.09567249935453048, 'min_weight_fraction_leaf': 0.08320496925440438, 'max_features': 0.6558747699255086}. Best is trial 819 with value: 0.7205250605114317.[0m
[32m[I 2022-04-13 11:46:29,567][0m Trial 888 finished with value: 0.6485886947469399 and parameters: {'splitter': 'random', 'min_samples_split': 0.2628315510555943, 'min_samples_leaf': 0.06833738722641676, 'min_weight_fraction_leaf': 0.11634549876129402, 'max_features': 0.6287620504381763}. Best is trial 819 with value: 0.7205250605114317.[0m
