[32m[I 2022-04-13 11:44:10,682][0m Trial 378 finished with value: 0.860262530255716 and parameters: {'splitter': 'random', 'min_samples_split': 0.27606880316865023, 'min_samples_leaf': 0.01029827724834868, 'min_weight_fraction_leaf': 0.04882016468223633, 'max_features': 0.5705044203943828}. Best is trial 156 with value: 0.860262530255716.[0m
[32m[I 2022-04-13 11:44:10,752][0m Trial 379 finished with value: 0.8537871744804019 and parameters: {'splitter': 'random', 'min_samples_split': 0.2885875129946291, 'min_samples_leaf': 0.01377428713642994, 'min_weight_fraction_leaf': 0.04976086498398419, 'max_features': 0.5414543683009012}. Best is trial 156 with value: 0.860262530255716.[0m
[32m[I 2022-04-13 11:44:10,845][0m Trial 380 finished with value: 0.8555617056756446 and parameters: {'splitter': 'random', 'min_samples_split': 0.2719658370821564, 'min_samples_leaf': 0.030667202125263117, 'min_weight_fraction_leaf': 0.03371889826007403, 'max_features': 0.571944698053509}. Best is trial 156 with value: 0.860262530255716.[0m
[32m[I 2022-04-13 11:44:10,901][0m Trial 381 finished with value: 0.8541689983710665 and parameters: {'splitter': 'random', 'min_samples_split': 0.22578303178705078, 'min_samples_leaf': 0.022869582726272538, 'min_weight_fraction_leaf': 0.041352090258949245, 'max_features': 0.5348061730327663}. Best is trial 156 with value: 0.860262530255716.[0m
[32m[I 2022-04-13 11:44:10,939][0m Trial 382 finished with value: 0.855608859465337 and parameters: {'splitter': 'random', 'min_samples_split': 0.2580484813375295, 'min_samples_leaf': 0.02625594187807221, 'min_weight_fraction_leaf': 0.06295782995894654, 'max_features': 0.5567053014951081}. Best is trial 156 with value: 0.860262530255716.[0m
[32m[I 2022-04-13 11:44:10,978][0m Trial 383 finished with value: 0.8544192216908126 and parameters: {'splitter': 'random', 'min_samples_split': 0.23948125490064157, 'min_samples_leaf': 0.023614636187111005, 'min_weight_fraction_leaf': 0.03843376152225407, 'max_features': 0.5285463323553734}. Best is trial 156 with value: 0.860262530255716.[0m
[32m[I 2022-04-13 11:44:11,018][0m Trial 384 finished with value: 0.855608859465337 and parameters: {'splitter': 'random', 'min_samples_split': 0.25741266878900204, 'min_samples_leaf': 0.02057152543453087, 'min_weight_fraction_leaf': 0.06471109303428992, 'max_features': 0.5983964959496073}. Best is trial 156 with value: 0.860262530255716.[0m
[32m[I 2022-04-13 11:44:11,058][0m Trial 385 finished with value: 0.8547474595641333 and parameters: {'splitter': 'random', 'min_samples_split': 0.2694610149818114, 'min_samples_leaf': 0.04306307489280387, 'min_weight_fraction_leaf': 0.09364125117521847, 'max_features': 0.5254054937781988}. Best is trial 156 with value: 0.860262530255716.[0m
[32m[I 2022-04-13 11:44:11,097][0m Trial 386 finished with value: 0.8536735077998788 and parameters: {'splitter': 'random', 'min_samples_split': 0.2701169236543914, 'min_samples_leaf': 0.06210397062524779, 'min_weight_fraction_leaf': 0.08177349959304256, 'max_features': 0.5580565319376225}. Best is trial 156 with value: 0.860262530255716.[0m
[32m[I 2022-04-13 11:44:11,137][0m Trial 387 finished with value: 0.7999200547726107 and parameters: {'splitter': 'random', 'min_samples_split': 0.3060333623106259, 'min_samples_leaf': 0.041849499450399855, 'min_weight_fraction_leaf': 0.055545596137638945, 'max_features': 0.49256849300945643}. Best is trial 156 with value: 0.860262530255716.[0m
[32m[I 2022-04-13 11:44:11,177][0m Trial 388 finished with value: 0.8255882966785919 and parameters: {'splitter': 'random', 'min_samples_split': 0.2472207541861447, 'min_samples_leaf': 0.056034300749782544, 'min_weight_fraction_leaf': 0.07101701311108202, 'max_features': 0.6383141277010689}. Best is trial 156 with value: 0.860262530255716.[0m
[32m[I 2022-04-13 11:44:11,215][0m Trial 389 finished with value: 0.6188081862944745 and parameters: {'splitter': 'random', 'min_samples_split': 0.26537561553528677, 'min_samples_leaf': 0.3958955407276633, 'min_weight_fraction_leaf': 0.0963051495206993, 'max_features': 0.5686489586415158}. Best is trial 156 with value: 0.860262530255716.[0m
[32m[I 2022-04-13 11:44:11,290][0m Trial 390 finished with value: 0.8537871744804019 and parameters: {'splitter': 'random', 'min_samples_split': 0.28682782916837674, 'min_samples_leaf': 0.011416566507425951, 'min_weight_fraction_leaf': 0.0482131865348565, 'max_features': 0.5543313708017793}. Best is trial 156 with value: 0.860262530255716.[0m
[32m[I 2022-04-13 11:44:11,409][0m Trial 391 finished with value: 0.6737348638740248 and parameters: {'splitter': 'random', 'min_samples_split': 0.39902656327263075, 'min_samples_leaf': 0.002473565265919783, 'min_weight_fraction_leaf': 0.06026194358366116, 'max_features': 0.4785360289755047}. Best is trial 156 with value: 0.860262530255716.[0m
[32m[I 2022-04-13 11:44:11,502][0m Trial 392 finished with value: 0.7865929809567938 and parameters: {'splitter': 'random', 'min_samples_split': 0.2769554665797213, 'min_samples_leaf': 0.06820385405525996, 'min_weight_fraction_leaf': 0.051693116335288336, 'max_features': 0.4359960498726706}. Best is trial 156 with value: 0.860262530255716.[0m
[32m[I 2022-04-13 11:44:11,569][0m Trial 393 finished with value: 0.855608859465337 and parameters: {'splitter': 'random', 'min_samples_split': 0.2571309720461186, 'min_samples_leaf': 0.07021788184366953, 'min_weight_fraction_leaf': 0.07526546626606728, 'max_features': 0.6118889324532715}. Best is trial 156 with value: 0.860262530255716.[0m
[32m[I 2022-04-13 11:44:11,608][0m Trial 394 finished with value: 0.839996638422847 and parameters: {'splitter': 'best', 'min_samples_split': 0.26960747230425886, 'min_samples_leaf': 0.02557061505098008, 'min_weight_fraction_leaf': 0.02366565487177607, 'max_features': 0.5246532387182204}. Best is trial 156 with value: 0.860262530255716.[0m
[32m[I 2022-04-13 11:44:11,646][0m Trial 395 finished with value: 0.8537871744804019 and parameters: {'splitter': 'random', 'min_samples_split': 0.2851865579883049, 'min_samples_leaf': 0.028720199071432022, 'min_weight_fraction_leaf': 0.06380739885430146, 'max_features': 0.5082327054617178}. Best is trial 156 with value: 0.860262530255716.[0m
[32m[I 2022-04-13 11:44:11,685][0m Trial 396 finished with value: 0.8495779719052834 and parameters: {'splitter': 'random', 'min_samples_split': 0.2965839496718833, 'min_samples_leaf': 0.03794010265831618, 'min_weight_fraction_leaf': 0.06315437271991359, 'max_features': 0.5894987947465129}. Best is trial 156 with value: 0.860262530255716.[0m
[32m[I 2022-04-13 11:44:11,724][0m Trial 397 finished with value: 0.860262530255716 and parameters: {'splitter': 'random', 'min_samples_split': 0.27471511502812584, 'min_samples_leaf': 0.051549957882408355, 'min_weight_fraction_leaf': 0.065007681202507, 'max_features': 0.5929748904994725}. Best is trial 156 with value: 0.860262530255716.[0m
[32m[I 2022-04-13 11:44:11,779][0m Trial 398 finished with value: 0.8490198370094999 and parameters: {'splitter': 'random', 'min_samples_split': 0.2508649112043449, 'min_samples_leaf': 0.014486231461957122, 'min_weight_fraction_leaf': 0.0853200684866966, 'max_features': 0.5314750122386332}. Best is trial 156 with value: 0.860262530255716.[0m
[32m[I 2022-04-13 11:44:11,849][0m Trial 399 finished with value: 0.8536735077998788 and parameters: {'splitter': 'random', 'min_samples_split': 0.26325771646490737, 'min_samples_leaf': 0.0015874486749757125, 'min_weight_fraction_leaf': 0.08103042629890249, 'max_features': 0.6249612848181398}. Best is trial 156 with value: 0.860262530255716.[0m
[32m[I 2022-04-13 11:44:11,908][0m Trial 400 finished with value: 0.8537871744804019 and parameters: {'splitter': 'random', 'min_samples_split': 0.2825711135523359, 'min_samples_leaf': 0.034846416839270346, 'min_weight_fraction_leaf': 0.05058288599885773, 'max_features': 0.5727799076385595}. Best is trial 156 with value: 0.860262530255716.[0m
[32m[I 2022-04-13 11:44:11,948][0m Trial 401 finished with value: 0.8495779719052834 and parameters: {'splitter': 'random', 'min_samples_split': 0.29393607305533637, 'min_samples_leaf': 0.04489666580737161, 'min_weight_fraction_leaf': 0.06834581267959182, 'max_features': 0.5051050176028138}. Best is trial 156 with value: 0.860262530255716.[0m
[32m[I 2022-04-13 11:44:11,988][0m Trial 402 finished with value: 0.855608859465337 and parameters: {'splitter': 'random', 'min_samples_split': 0.2603200068562789, 'min_samples_leaf': 0.05560408429124312, 'min_weight_fraction_leaf': 0.07321978223716911, 'max_features': 0.5916562270922313}. Best is trial 156 with value: 0.860262530255716.[0m
[32m[I 2022-04-13 11:44:12,028][0m Trial 403 finished with value: 0.860262530255716 and parameters: {'splitter': 'random', 'min_samples_split': 0.27227651018570864, 'min_samples_leaf': 0.0015625749746505898, 'min_weight_fraction_leaf': 0.07864115388254131, 'max_features': 0.5164523283926953}. Best is trial 156 with value: 0.860262530255716.[0m
[32m[I 2022-04-13 11:44:12,067][0m Trial 404 finished with value: 0.860262530255716 and parameters: {'splitter': 'random', 'min_samples_split': 0.27285807890578834, 'min_samples_leaf': 0.009106247784607363, 'min_weight_fraction_leaf': 0.04012880863792811, 'max_features': 0.5484148083627146}. Best is trial 156 with value: 0.860262530255716.[0m
[32m[I 2022-04-13 11:44:12,105][0m Trial 405 finished with value: 0.778756818992745 and parameters: {'splitter': 'random', 'min_samples_split': 0.29924065534181243, 'min_samples_leaf': 0.03451960346226916, 'min_weight_fraction_leaf': 0.0606293308295439, 'max_features': 0.2502398326014508}. Best is trial 156 with value: 0.860262530255716.[0m
[32m[I 2022-04-13 11:44:12,143][0m Trial 406 finished with value: 0.8537871744804019 and parameters: {'splitter': 'random', 'min_samples_split': 0.2843889210415882, 'min_samples_leaf': 0.013408036767720318, 'min_weight_fraction_leaf': 0.03478515629249771, 'max_features': 0.5455998754635584}. Best is trial 156 with value: 0.860262530255716.[0m
[32m[I 2022-04-13 11:44:12,182][0m Trial 407 finished with value: 0.7999200547726107 and parameters: {'splitter': 'random', 'min_samples_split': 0.27643681955555593, 'min_samples_leaf': 0.04937572801235554, 'min_weight_fraction_leaf': 0.06226165726089088, 'max_features': 0.47099298278184987}. Best is trial 156 with value: 0.860262530255716.[0m
[32m[I 2022-04-13 11:44:12,224][0m Trial 408 finished with value: 0.855608859465337 and parameters: {'splitter': 'random', 'min_samples_split': 0.2537620042318262, 'min_samples_leaf': 0.020569419257922404, 'min_weight_fraction_leaf': 0.041775239215252155, 'max_features': 0.5222582425264308}. Best is trial 156 with value: 0.860262530255716.[0m
[32m[I 2022-04-13 11:44:12,268][0m Trial 409 finished with value: 0.8541689983710665 and parameters: {'splitter': 'random', 'min_samples_split': 0.23833466382810473, 'min_samples_leaf': 0.06370456892289247, 'min_weight_fraction_leaf': 0.04895452842845623, 'max_features': 0.5823493060402865}. Best is trial 156 with value: 0.860262530255716.[0m
[32m[I 2022-04-13 11:44:12,309][0m Trial 410 finished with value: 0.8555617056756446 and parameters: {'splitter': 'random', 'min_samples_split': 0.2703952428102285, 'min_samples_leaf': 0.0014481676469795433, 'min_weight_fraction_leaf': 0.028483236538370076, 'max_features': 0.5116663063249417}. Best is trial 156 with value: 0.860262530255716.[0m
[32m[I 2022-04-13 11:44:12,350][0m Trial 411 finished with value: 0.8393809361313925 and parameters: {'splitter': 'best', 'min_samples_split': 0.24776353511387567, 'min_samples_leaf': 0.02474201031621319, 'min_weight_fraction_leaf': 0.05193305230500557, 'max_features': 0.5426388179658803}. Best is trial 156 with value: 0.860262530255716.[0m
[32m[I 2022-04-13 11:44:12,389][0m Trial 412 finished with value: 0.6673725019145691 and parameters: {'splitter': 'random', 'min_samples_split': 0.3321386636801544, 'min_samples_leaf': 0.05977785177691687, 'min_weight_fraction_leaf': 0.10442725885489226, 'max_features': 0.488904222136597}. Best is trial 156 with value: 0.860262530255716.[0m
[32m[I 2022-04-13 11:44:12,429][0m Trial 413 finished with value: 0.8537871744804019 and parameters: {'splitter': 'random', 'min_samples_split': 0.28838970823565413, 'min_samples_leaf': 0.00915808136749035, 'min_weight_fraction_leaf': 0.040169156902463414, 'max_features': 0.5649061189297008}. Best is trial 156 with value: 0.860262530255716.[0m
[32m[I 2022-04-13 11:44:12,468][0m Trial 414 finished with value: 0.855608859465337 and parameters: {'splitter': 'random', 'min_samples_split': 0.2594512813054934, 'min_samples_leaf': 0.019597745725721035, 'min_weight_fraction_leaf': 0.05212785055839382, 'max_features': 0.5492633170747592}. Best is trial 156 with value: 0.860262530255716.[0m
[32m[I 2022-04-13 11:44:12,508][0m Trial 415 finished with value: 0.8537871744804019 and parameters: {'splitter': 'random', 'min_samples_split': 0.2787700857194703, 'min_samples_leaf': 0.04200521597454723, 'min_weight_fraction_leaf': 0.06295635539672213, 'max_features': 0.5773199607054631}. Best is trial 156 with value: 0.860262530255716.[0m
[32m[I 2022-04-13 11:44:12,546][0m Trial 416 finished with value: 0.8515949699867061 and parameters: {'splitter': 'random', 'min_samples_split': 0.30802040386298596, 'min_samples_leaf': 0.03778925015345605, 'min_weight_fraction_leaf': 0.06728578952595791, 'max_features': 0.6155843058986038}. Best is trial 156 with value: 0.860262530255716.[0m
[32m[I 2022-04-13 11:44:12,586][0m Trial 417 finished with value: 0.8484399756279405 and parameters: {'splitter': 'random', 'min_samples_split': 0.23931220453921673, 'min_samples_leaf': 0.0117272635983343, 'min_weight_fraction_leaf': 0.08434309304206927, 'max_features': 0.5603500389915479}. Best is trial 156 with value: 0.860262530255716.[0m
[32m[I 2022-04-13 11:44:12,626][0m Trial 418 finished with value: 0.855608859465337 and parameters: {'splitter': 'random', 'min_samples_split': 0.2609380198013232, 'min_samples_leaf': 0.01787535688027358, 'min_weight_fraction_leaf': 0.029074165150242602, 'max_features': 0.5361677237464547}. Best is trial 156 with value: 0.860262530255716.[0m
[32m[I 2022-04-13 11:44:12,667][0m Trial 419 finished with value: 0.8536735077998788 and parameters: {'splitter': 'random', 'min_samples_split': 0.26984111799765936, 'min_samples_leaf': 0.055471880684945594, 'min_weight_fraction_leaf': 0.0913616993959345, 'max_features': 0.605982588736482}. Best is trial 156 with value: 0.860262530255716.[0m
[32m[I 2022-04-13 11:44:12,706][0m Trial 420 finished with value: 0.855608859465337 and parameters: {'splitter': 'random', 'min_samples_split': 0.25228848066407, 'min_samples_leaf': 0.006066040073673741, 'min_weight_fraction_leaf': 0.07134828336768315, 'max_features': 0.5827554074628127}. Best is trial 156 with value: 0.860262530255716.[0m
[32m[I 2022-04-13 11:44:12,745][0m Trial 421 finished with value: 0.855608859465337 and parameters: {'splitter': 'random', 'min_samples_split': 0.2610753139352814, 'min_samples_leaf': 0.026508012013906315, 'min_weight_fraction_leaf': 0.047824456582159586, 'max_features': 0.5337878682762497}. Best is trial 156 with value: 0.860262530255716.[0m
[32m[I 2022-04-13 11:44:12,784][0m Trial 422 finished with value: 0.8537871744804019 and parameters: {'splitter': 'random', 'min_samples_split': 0.28366512036321684, 'min_samples_leaf': 0.014279164443288429, 'min_weight_fraction_leaf': 0.08008752825752864, 'max_features': 0.5432563721307739}. Best is trial 156 with value: 0.860262530255716.[0m
[32m[I 2022-04-13 11:44:12,824][0m Trial 423 finished with value: 0.7999200547726107 and parameters: {'splitter': 'random', 'min_samples_split': 0.2951445443831581, 'min_samples_leaf': 0.03567841365408084, 'min_weight_fraction_leaf': 0.05601149254546517, 'max_features': 0.49978776509546896}. Best is trial 156 with value: 0.860262530255716.[0m
[32m[I 2022-04-13 11:44:12,863][0m Trial 424 finished with value: 0.8541689983710665 and parameters: {'splitter': 'random', 'min_samples_split': 0.24424822787519865, 'min_samples_leaf': 0.01795115699240765, 'min_weight_fraction_leaf': 0.07629159350167952, 'max_features': 0.5594332810036254}. Best is trial 156 with value: 0.860262530255716.[0m
[32m[I 2022-04-13 11:44:12,902][0m Trial 425 finished with value: 0.7999200547726107 and parameters: {'splitter': 'random', 'min_samples_split': 0.2739266829581613, 'min_samples_leaf': 0.04243484842656586, 'min_weight_fraction_leaf': 0.05672615867165225, 'max_features': 0.4510533504761626}. Best is trial 156 with value: 0.860262530255716.[0m
[32m[I 2022-04-13 11:44:12,940][0m Trial 426 finished with value: 0.6332669867606551 and parameters: {'splitter': 'random', 'min_samples_split': 0.25239159380951703, 'min_samples_leaf': 0.307218442594136, 'min_weight_fraction_leaf': 0.07196272869509299, 'max_features': 0.5222943122197427}. Best is trial 156 with value: 0.860262530255716.[0m
[32m[I 2022-04-13 11:44:12,980][0m Trial 427 finished with value: 0.7999200547726107 and parameters: {'splitter': 'random', 'min_samples_split': 0.2784639921692758, 'min_samples_leaf': 0.031909102682159546, 'min_weight_fraction_leaf': 0.05857857156951894, 'max_features': 0.48746863274378727}. Best is trial 156 with value: 0.860262530255716.[0m
[32m[I 2022-04-13 11:44:13,019][0m Trial 428 finished with value: 0.8555617056756446 and parameters: {'splitter': 'random', 'min_samples_split': 0.2651507259977229, 'min_samples_leaf': 0.0219446339862795, 'min_weight_fraction_leaf': 0.03899914672429233, 'max_features': 0.5625888451681804}. Best is trial 156 with value: 0.860262530255716.[0m
[32m[I 2022-04-13 11:44:13,058][0m Trial 429 finished with value: 0.8537871744804019 and parameters: {'splitter': 'random', 'min_samples_split': 0.2860313522900003, 'min_samples_leaf': 0.031319632386409446, 'min_weight_fraction_leaf': 0.022719140255693406, 'max_features': 0.5155567707776225}. Best is trial 156 with value: 0.860262530255716.[0m
[32m[I 2022-04-13 11:44:13,098][0m Trial 430 finished with value: 0.7536992590093268 and parameters: {'splitter': 'best', 'min_samples_split': 0.2694894758291493, 'min_samples_leaf': 0.04400030385642005, 'min_weight_fraction_leaf': 0.06390116193314584, 'max_features': 0.1144451403013359}. Best is trial 156 with value: 0.860262530255716.[0m
[32m[I 2022-04-13 11:44:13,138][0m Trial 431 finished with value: 0.8325020874003526 and parameters: {'splitter': 'random', 'min_samples_split': 0.14655948348149825, 'min_samples_leaf': 0.010244775155563957, 'min_weight_fraction_leaf': 0.0898750153861426, 'max_features': 0.554959629959792}. Best is trial 156 with value: 0.860262530255716.[0m
[32m[I 2022-04-13 11:44:13,177][0m Trial 432 finished with value: 0.6188081862944745 and parameters: {'splitter': 'random', 'min_samples_split': 0.23422648336597982, 'min_samples_leaf': 0.009045978635512718, 'min_weight_fraction_leaf': 0.4451284982462482, 'max_features': 0.5954879613408489}. Best is trial 156 with value: 0.860262530255716.[0m
[32m[I 2022-04-13 11:44:13,216][0m Trial 433 finished with value: 0.8495779719052834 and parameters: {'splitter': 'random', 'min_samples_split': 0.29575515704044075, 'min_samples_leaf': 0.01715145615831247, 'min_weight_fraction_leaf': 0.054658104337162484, 'max_features': 0.5730722103092469}. Best is trial 156 with value: 0.860262530255716.[0m
[32m[I 2022-04-13 11:44:13,255][0m Trial 434 finished with value: 0.860262530255716 and parameters: {'splitter': 'random', 'min_samples_split': 0.272668527254532, 'min_samples_leaf': 0.02805248377239715, 'min_weight_fraction_leaf': 0.041650344684469966, 'max_features': 0.506221563483738}. Best is trial 156 with value: 0.860262530255716.[0m
[32m[I 2022-04-13 11:44:13,294][0m Trial 435 finished with value: 0.855608859465337 and parameters: {'splitter': 'random', 'min_samples_split': 0.2615641585688992, 'min_samples_leaf': 0.03076771315810694, 'min_weight_fraction_leaf': 0.03506997782619455, 'max_features': 0.5381865759044131}. Best is trial 156 with value: 0.860262530255716.[0m
[32m[I 2022-04-13 11:44:13,333][0m Trial 436 finished with value: 0.669929861660368 and parameters: {'splitter': 'random', 'min_samples_split': 0.28342489294463585, 'min_samples_leaf': 0.18662207696325156, 'min_weight_fraction_leaf': 0.04903525882429592, 'max_features': 0.41553988075933596}. Best is trial 156 with value: 0.860262530255716.[0m
[32m[I 2022-04-13 11:44:13,372][0m Trial 437 finished with value: 0.855608859465337 and parameters: {'splitter': 'random', 'min_samples_split': 0.2570019527067803, 'min_samples_leaf': 0.0035463546139211585, 'min_weight_fraction_leaf': 0.03734737110475421, 'max_features': 0.5375420678654442}. Best is trial 156 with value: 0.860262530255716.[0m
[32m[I 2022-04-13 11:44:13,414][0m Trial 438 finished with value: 0.7999200547726107 and parameters: {'splitter': 'random', 'min_samples_split': 0.27178121365500435, 'min_samples_leaf': 0.02520991284830911, 'min_weight_fraction_leaf': 0.05704648992183205, 'max_features': 0.4788720715692257}. Best is trial 156 with value: 0.860262530255716.[0m
[32m[I 2022-04-13 11:44:13,456][0m Trial 439 finished with value: 0.8537871744804019 and parameters: {'splitter': 'random', 'min_samples_split': 0.2775098468243365, 'min_samples_leaf': 0.0012758582715922326, 'min_weight_fraction_leaf': 0.06797326085092274, 'max_features': 0.6094677445175563}. Best is trial 156 with value: 0.860262530255716.[0m
[32m[I 2022-04-13 11:44:13,497][0m Trial 440 finished with value: 0.7999200547726107 and parameters: {'splitter': 'random', 'min_samples_split': 0.2894216214458478, 'min_samples_leaf': 0.05501206956398064, 'min_weight_fraction_leaf': 0.06354519234975028, 'max_features': 0.45970893870274143}. Best is trial 156 with value: 0.860262530255716.[0m
