[32m[I 2022-04-13 11:44:22,301][0m Trial 567 finished with value: 0.7203943081692755 and parameters: {'splitter': 'random', 'min_samples_split': 0.2749878782954772, 'min_samples_leaf': 0.21166091186461808, 'min_weight_fraction_leaf': 0.03773585951404932, 'max_features': 0.5093092978393833}. Best is trial 156 with value: 0.860262530255716.[0m
[32m[I 2022-04-13 11:44:22,344][0m Trial 568 finished with value: 0.860262530255716 and parameters: {'splitter': 'random', 'min_samples_split': 0.2664120635095991, 'min_samples_leaf': 0.07344155779302938, 'min_weight_fraction_leaf': 0.07025577825300497, 'max_features': 0.5120819501206139}. Best is trial 156 with value: 0.860262530255716.[0m
[32m[I 2022-04-13 11:44:22,390][0m Trial 569 finished with value: 0.678736275046821 and parameters: {'splitter': 'random', 'min_samples_split': 0.2386953061484089, 'min_samples_leaf': 0.07485725710121854, 'min_weight_fraction_leaf': 0.08354710102513996, 'max_features': 0.37519681083149853}. Best is trial 156 with value: 0.860262530255716.[0m
[32m[I 2022-04-13 11:44:22,474][0m Trial 570 finished with value: 0.7865929809567938 and parameters: {'splitter': 'random', 'min_samples_split': 0.30165881703375547, 'min_samples_leaf': 0.055658276710401536, 'min_weight_fraction_leaf': 0.0660237297540389, 'max_features': 0.4661641549181953}. Best is trial 156 with value: 0.860262530255716.[0m
[32m[I 2022-04-13 11:44:22,533][0m Trial 571 finished with value: 0.8537871744804019 and parameters: {'splitter': 'random', 'min_samples_split': 0.27935590753674205, 'min_samples_leaf': 0.010650482870913185, 'min_weight_fraction_leaf': 0.06468663132799664, 'max_features': 0.6107674741318903}. Best is trial 156 with value: 0.860262530255716.[0m
[32m[I 2022-04-13 11:44:22,615][0m Trial 572 finished with value: 0.8160553494736597 and parameters: {'splitter': 'random', 'min_samples_split': 0.2742126990912907, 'min_samples_leaf': 0.03695936255000679, 'min_weight_fraction_leaf': 0.04587451588661565, 'max_features': 0.632077115898081}. Best is trial 156 with value: 0.860262530255716.[0m
[32m[I 2022-04-13 11:44:22,692][0m Trial 573 finished with value: 0.855608859465337 and parameters: {'splitter': 'random', 'min_samples_split': 0.2572587565530487, 'min_samples_leaf': 0.022587716637677144, 'min_weight_fraction_leaf': 0.050237984557905145, 'max_features': 0.5475298854287571}. Best is trial 156 with value: 0.860262530255716.[0m
[32m[I 2022-04-13 11:44:22,818][0m Trial 574 finished with value: 0.6188081862944745 and parameters: {'splitter': 'random', 'min_samples_split': 0.2881749621919554, 'min_samples_leaf': 0.3671601914097491, 'min_weight_fraction_leaf': 0.05861523686881464, 'max_features': 0.5556875277776314}. Best is trial 156 with value: 0.860262530255716.[0m
[32m[I 2022-04-13 11:44:22,946][0m Trial 575 finished with value: 0.6188081862944745 and parameters: {'splitter': 'random', 'min_samples_split': 0.2662248176787745, 'min_samples_leaf': 0.05748537162819866, 'min_weight_fraction_leaf': 0.38126304968095553, 'max_features': 0.4894893396847294}. Best is trial 156 with value: 0.860262530255716.[0m
[32m[I 2022-04-13 11:44:23,085][0m Trial 576 finished with value: 0.860262530255716 and parameters: {'splitter': 'random', 'min_samples_split': 0.26750057640967057, 'min_samples_leaf': 0.048907465213359536, 'min_weight_fraction_leaf': 0.07604887958087879, 'max_features': 0.601246347099486}. Best is trial 156 with value: 0.860262530255716.[0m
[32m[I 2022-04-13 11:44:23,242][0m Trial 577 finished with value: 0.8541689983710665 and parameters: {'splitter': 'random', 'min_samples_split': 0.2472743120682682, 'min_samples_leaf': 0.019082306324264848, 'min_weight_fraction_leaf': 0.06743342643263814, 'max_features': 0.5353676118181634}. Best is trial 156 with value: 0.860262530255716.[0m
[32m[I 2022-04-13 11:44:23,371][0m Trial 578 finished with value: 0.7865929809567938 and parameters: {'splitter': 'random', 'min_samples_split': 0.2796863908944783, 'min_samples_leaf': 0.03688025939841953, 'min_weight_fraction_leaf': 0.06778695916394764, 'max_features': 0.49206499310760854}. Best is trial 156 with value: 0.860262530255716.[0m
[32m[I 2022-04-13 11:44:23,494][0m Trial 579 finished with value: 0.7426175290362615 and parameters: {'splitter': 'random', 'min_samples_split': 0.2561347567735721, 'min_samples_leaf': 0.009301184073665855, 'min_weight_fraction_leaf': 0.18615571249660767, 'max_features': 0.5259490052060373}. Best is trial 156 with value: 0.860262530255716.[0m
[32m[I 2022-04-13 11:44:23,627][0m Trial 580 finished with value: 0.8536735077998788 and parameters: {'splitter': 'random', 'min_samples_split': 0.27517773978169563, 'min_samples_leaf': 0.03223190274527016, 'min_weight_fraction_leaf': 0.08182041879460922, 'max_features': 0.583957783375987}. Best is trial 156 with value: 0.860262530255716.[0m
[32m[I 2022-04-13 11:44:23,770][0m Trial 581 finished with value: 0.8507321463909226 and parameters: {'splitter': 'random', 'min_samples_split': 0.25446203859041355, 'min_samples_leaf': 0.0010840406627636578, 'min_weight_fraction_leaf': 0.09316790640349992, 'max_features': 0.5655710181567917}. Best is trial 156 with value: 0.860262530255716.[0m
[32m[I 2022-04-13 11:44:23,891][0m Trial 582 finished with value: 0.8479544019395597 and parameters: {'splitter': 'best', 'min_samples_split': 0.24021135994097823, 'min_samples_leaf': 0.013496898762798363, 'min_weight_fraction_leaf': 0.0761597134377367, 'max_features': 0.5542652115315794}. Best is trial 156 with value: 0.860262530255716.[0m
[32m[I 2022-04-13 11:44:23,973][0m Trial 583 finished with value: 0.860262530255716 and parameters: {'splitter': 'random', 'min_samples_split': 0.264437145997711, 'min_samples_leaf': 0.029341783971305765, 'min_weight_fraction_leaf': 0.07313770953253722, 'max_features': 0.5852479672208131}. Best is trial 156 with value: 0.860262530255716.[0m
[32m[I 2022-04-13 11:44:24,060][0m Trial 584 finished with value: 0.8484399756279405 and parameters: {'splitter': 'random', 'min_samples_split': 0.24780812759671275, 'min_samples_leaf': 0.009716265980148422, 'min_weight_fraction_leaf': 0.08286655391059781, 'max_features': 0.5249500129359242}. Best is trial 156 with value: 0.860262530255716.[0m
[32m[I 2022-04-13 11:44:24,154][0m Trial 585 finished with value: 0.8536735077998788 and parameters: {'splitter': 'random', 'min_samples_split': 0.26439080844773677, 'min_samples_leaf': 0.01648325050565353, 'min_weight_fraction_leaf': 0.09090434394229488, 'max_features': 0.6088268690495586}. Best is trial 156 with value: 0.860262530255716.[0m
[32m[I 2022-04-13 11:44:24,239][0m Trial 586 finished with value: 0.8130158757335355 and parameters: {'splitter': 'random', 'min_samples_split': 0.29068974283801496, 'min_samples_leaf': 0.03343999492857101, 'min_weight_fraction_leaf': 0.028853471615965697, 'max_features': 0.47174205150909}. Best is trial 156 with value: 0.860262530255716.[0m
[32m[I 2022-04-13 11:44:24,330][0m Trial 587 finished with value: 0.8169418604210963 and parameters: {'splitter': 'random', 'min_samples_split': 0.2651646946572842, 'min_samples_leaf': 0.0496675274782445, 'min_weight_fraction_leaf': 0.07693108318930186, 'max_features': 0.6618377457496217}. Best is trial 156 with value: 0.860262530255716.[0m
[32m[I 2022-04-13 11:44:24,416][0m Trial 588 finished with value: 0.8495779719052834 and parameters: {'splitter': 'random', 'min_samples_split': 0.29514125642006034, 'min_samples_leaf': 0.0227442695958759, 'min_weight_fraction_leaf': 0.05432480313358601, 'max_features': 0.5270288175900537}. Best is trial 156 with value: 0.860262530255716.[0m
[32m[I 2022-04-13 11:44:24,488][0m Trial 589 finished with value: 0.855608859465337 and parameters: {'splitter': 'random', 'min_samples_split': 0.2545746688097986, 'min_samples_leaf': 0.010934880953045942, 'min_weight_fraction_leaf': 0.07084458840259494, 'max_features': 0.5513848810671714}. Best is trial 156 with value: 0.860262530255716.[0m
[32m[I 2022-04-13 11:44:24,576][0m Trial 590 finished with value: 0.8530273199001748 and parameters: {'splitter': 'random', 'min_samples_split': 0.38414117785672547, 'min_samples_leaf': 0.0620388981905706, 'min_weight_fraction_leaf': 0.05329183901251509, 'max_features': 0.5370322894396666}. Best is trial 156 with value: 0.860262530255716.[0m
[32m[I 2022-04-13 11:44:24,646][0m Trial 591 finished with value: 0.8490198370094999 and parameters: {'splitter': 'random', 'min_samples_split': 0.2574048068675438, 'min_samples_leaf': 0.0175820578106523, 'min_weight_fraction_leaf': 0.08626035748221558, 'max_features': 0.5617923538607349}. Best is trial 156 with value: 0.860262530255716.[0m
[32m[I 2022-04-13 11:44:24,696][0m Trial 592 finished with value: 0.8537871744804019 and parameters: {'splitter': 'random', 'min_samples_split': 0.2818378554707539, 'min_samples_leaf': 0.03329832026469862, 'min_weight_fraction_leaf': 0.05146962439110714, 'max_features': 0.5760721422874466}. Best is trial 156 with value: 0.860262530255716.[0m
[32m[I 2022-04-13 11:44:24,738][0m Trial 593 finished with value: 0.8216008577791938 and parameters: {'splitter': 'random', 'min_samples_split': 0.27456015902594655, 'min_samples_leaf': 0.045145586849973995, 'min_weight_fraction_leaf': 0.04079043335999493, 'max_features': 0.7703321470820698}. Best is trial 156 with value: 0.860262530255716.[0m
[32m[I 2022-04-13 11:44:24,779][0m Trial 594 finished with value: 0.8515949699867061 and parameters: {'splitter': 'random', 'min_samples_split': 0.3046254299291299, 'min_samples_leaf': 0.04057278196243812, 'min_weight_fraction_leaf': 0.06026663167692443, 'max_features': 0.541840758185133}. Best is trial 156 with value: 0.860262530255716.[0m
[32m[I 2022-04-13 11:44:24,822][0m Trial 595 finished with value: 0.8547474595641333 and parameters: {'splitter': 'random', 'min_samples_split': 0.2671180682179689, 'min_samples_leaf': 0.0012449231584819177, 'min_weight_fraction_leaf': 0.09906176473422082, 'max_features': 0.6034852527984974}. Best is trial 156 with value: 0.860262530255716.[0m
[32m[I 2022-04-13 11:44:24,863][0m Trial 596 finished with value: 0.8537871744804019 and parameters: {'splitter': 'random', 'min_samples_split': 0.28529011597317455, 'min_samples_leaf': 0.04053504482219279, 'min_weight_fraction_leaf': 0.061444022007494874, 'max_features': 0.5664773092708112}. Best is trial 156 with value: 0.860262530255716.[0m
[32m[I 2022-04-13 11:44:24,904][0m Trial 597 finished with value: 0.6418306196043408 and parameters: {'splitter': 'random', 'min_samples_split': 0.2694647979293719, 'min_samples_leaf': 0.12793143436470883, 'min_weight_fraction_leaf': 0.03144983140396665, 'max_features': 0.49947737011265536}. Best is trial 156 with value: 0.860262530255716.[0m
[32m[I 2022-04-13 11:44:24,948][0m Trial 598 finished with value: 0.8147933353182992 and parameters: {'splitter': 'random', 'min_samples_split': 0.48421326434418355, 'min_samples_leaf': 0.04685256651054704, 'min_weight_fraction_leaf': 0.06758631869362487, 'max_features': 0.7449483164567287}. Best is trial 156 with value: 0.860262530255716.[0m
[32m[I 2022-04-13 11:44:24,989][0m Trial 599 finished with value: 0.6188081862944745 and parameters: {'splitter': 'random', 'min_samples_split': 0.22608126502419265, 'min_samples_leaf': 0.017948314140904188, 'min_weight_fraction_leaf': 0.43491553170663494, 'max_features': 0.5237614700594118}. Best is trial 156 with value: 0.860262530255716.[0m
[32m[I 2022-04-13 11:44:25,030][0m Trial 600 finished with value: 0.8537871744804019 and parameters: {'splitter': 'random', 'min_samples_split': 0.2808759452066608, 'min_samples_leaf': 0.024875856390235686, 'min_weight_fraction_leaf': 0.04431403760719361, 'max_features': 0.5417044869402966}. Best is trial 156 with value: 0.860262530255716.[0m
[32m[I 2022-04-13 11:44:25,072][0m Trial 601 finished with value: 0.860262530255716 and parameters: {'splitter': 'random', 'min_samples_split': 0.27581454212349293, 'min_samples_leaf': 0.055248720481370354, 'min_weight_fraction_leaf': 0.015441358530128953, 'max_features': 0.5028286961905826}. Best is trial 156 with value: 0.860262530255716.[0m
[32m[I 2022-04-13 11:44:25,115][0m Trial 602 finished with value: 0.8179338462259811 and parameters: {'splitter': 'best', 'min_samples_split': 0.27184664669080816, 'min_samples_leaf': 0.06201345825810663, 'min_weight_fraction_leaf': 0.017176885154167452, 'max_features': 0.4971955937819985}. Best is trial 156 with value: 0.860262530255716.[0m
[32m[I 2022-04-13 11:44:25,155][0m Trial 603 finished with value: 0.6332669867606551 and parameters: {'splitter': 'random', 'min_samples_split': 0.25717922143917227, 'min_samples_leaf': 0.007934571190609082, 'min_weight_fraction_leaf': 0.31352042646891104, 'max_features': 0.5903382004912359}. Best is trial 156 with value: 0.860262530255716.[0m
[32m[I 2022-04-13 11:44:25,221][0m Trial 604 finished with value: 0.8169418604210963 and parameters: {'splitter': 'random', 'min_samples_split': 0.26297838379421995, 'min_samples_leaf': 0.032462354105816264, 'min_weight_fraction_leaf': 0.06717877176519928, 'max_features': 0.6260298822004804}. Best is trial 156 with value: 0.860262530255716.[0m
[32m[I 2022-04-13 11:44:25,304][0m Trial 605 finished with value: 0.8537871744804019 and parameters: {'splitter': 'random', 'min_samples_split': 0.28547772446492004, 'min_samples_leaf': 0.0457180968541116, 'min_weight_fraction_leaf': 0.0614211425744145, 'max_features': 0.5484662517387814}. Best is trial 156 with value: 0.860262530255716.[0m
[32m[I 2022-04-13 11:44:25,415][0m Trial 606 finished with value: 0.8541689983710665 and parameters: {'splitter': 'random', 'min_samples_split': 0.2440795724466725, 'min_samples_leaf': 0.026747417047835446, 'min_weight_fraction_leaf': 0.03996442817226499, 'max_features': 0.5889953441894595}. Best is trial 156 with value: 0.860262530255716.[0m
[32m[I 2022-04-13 11:44:25,505][0m Trial 607 finished with value: 0.8325020874003526 and parameters: {'splitter': 'random', 'min_samples_split': 0.16200175358290542, 'min_samples_leaf': 0.001981581780183363, 'min_weight_fraction_leaf': 0.07974193320203893, 'max_features': 0.5251746419640211}. Best is trial 156 with value: 0.860262530255716.[0m
[32m[I 2022-04-13 11:44:25,606][0m Trial 608 finished with value: 0.8538689421556729 and parameters: {'splitter': 'random', 'min_samples_split': 0.269502413965987, 'min_samples_leaf': 0.03383659180990631, 'min_weight_fraction_leaf': 0.12680427485838097, 'max_features': 0.6050384798871922}. Best is trial 156 with value: 0.860262530255716.[0m
[32m[I 2022-04-13 11:44:25,679][0m Trial 609 finished with value: 0.8495779719052834 and parameters: {'splitter': 'random', 'min_samples_split': 0.29725343234296875, 'min_samples_leaf': 0.044186127010545896, 'min_weight_fraction_leaf': 0.061481391492979647, 'max_features': 0.5101995965958458}. Best is trial 156 with value: 0.860262530255716.[0m
[32m[I 2022-04-13 11:44:25,803][0m Trial 610 finished with value: 0.8484399756279405 and parameters: {'splitter': 'random', 'min_samples_split': 0.24779724454779262, 'min_samples_leaf': 0.009830445487702455, 'min_weight_fraction_leaf': 0.08033903166065148, 'max_features': 0.525635679160257}. Best is trial 156 with value: 0.860262530255716.[0m
[32m[I 2022-04-13 11:44:25,948][0m Trial 611 finished with value: 0.855608859465337 and parameters: {'splitter': 'random', 'min_samples_split': 0.2573489578536098, 'min_samples_leaf': 0.023073584810304533, 'min_weight_fraction_leaf': 0.03547431150719743, 'max_features': 0.5509668677382116}. Best is trial 156 with value: 0.860262530255716.[0m
[32m[I 2022-04-13 11:44:26,041][0m Trial 612 finished with value: 0.8495779719052834 and parameters: {'splitter': 'random', 'min_samples_split': 0.2922460816827343, 'min_samples_leaf': 0.02074493813876912, 'min_weight_fraction_leaf': 0.04983189561059696, 'max_features': 0.5687169856328224}. Best is trial 156 with value: 0.860262530255716.[0m
[32m[I 2022-04-13 11:44:26,139][0m Trial 613 finished with value: 0.8537871744804019 and parameters: {'splitter': 'random', 'min_samples_split': 0.2768841176641952, 'min_samples_leaf': 0.0359619537968503, 'min_weight_fraction_leaf': 0.07057453931405322, 'max_features': 0.6168444745323279}. Best is trial 156 with value: 0.860262530255716.[0m
[32m[I 2022-04-13 11:44:26,270][0m Trial 614 finished with value: 0.6188081862944745 and parameters: {'splitter': 'random', 'min_samples_split': 0.2729171772011807, 'min_samples_leaf': 0.32792975277772984, 'min_weight_fraction_leaf': 0.34863870627305504, 'max_features': 0.4800450353385766}. Best is trial 156 with value: 0.860262530255716.[0m
[32m[I 2022-04-13 11:44:26,357][0m Trial 615 finished with value: 0.6334936025301521 and parameters: {'splitter': 'random', 'min_samples_split': 0.284075810174359, 'min_samples_leaf': 0.2811432308969256, 'min_weight_fraction_leaf': 0.07132341702251842, 'max_features': 0.565441170813602}. Best is trial 156 with value: 0.860262530255716.[0m
[32m[I 2022-04-13 11:44:26,471][0m Trial 616 finished with value: 0.8495779719052834 and parameters: {'splitter': 'random', 'min_samples_split': 0.2950414310200357, 'min_samples_leaf': 0.038428510225100895, 'min_weight_fraction_leaf': 0.05850634844475948, 'max_features': 0.5799358337866282}. Best is trial 156 with value: 0.860262530255716.[0m
[32m[I 2022-04-13 11:44:26,599][0m Trial 617 finished with value: 0.8537871744804019 and parameters: {'splitter': 'random', 'min_samples_split': 0.2828772509228826, 'min_samples_leaf': 0.0010524832421380387, 'min_weight_fraction_leaf': 0.05372550562670379, 'max_features': 0.5129322650886371}. Best is trial 156 with value: 0.860262530255716.[0m
[32m[I 2022-04-13 11:44:26,731][0m Trial 618 finished with value: 0.8541689983710665 and parameters: {'splitter': 'random', 'min_samples_split': 0.2371100275792074, 'min_samples_leaf': 0.014346583087972608, 'min_weight_fraction_leaf': 0.04706775724676755, 'max_features': 0.5274957828627096}. Best is trial 156 with value: 0.860262530255716.[0m
[32m[I 2022-04-13 11:44:26,854][0m Trial 619 finished with value: 0.7865929809567938 and parameters: {'splitter': 'random', 'min_samples_split': 0.27691988280890517, 'min_samples_leaf': 0.06789209102024901, 'min_weight_fraction_leaf': 0.06490530333791135, 'max_features': 0.44497962300057925}. Best is trial 156 with value: 0.860262530255716.[0m
[32m[I 2022-04-13 11:44:26,988][0m Trial 620 finished with value: 0.8515949699867061 and parameters: {'splitter': 'random', 'min_samples_split': 0.30835154178359664, 'min_samples_leaf': 0.03129226370660501, 'min_weight_fraction_leaf': 0.05794068424797523, 'max_features': 0.5865814889236961}. Best is trial 156 with value: 0.860262530255716.[0m
[32m[I 2022-04-13 11:44:27,083][0m Trial 621 finished with value: 0.8289576117235526 and parameters: {'splitter': 'best', 'min_samples_split': 0.26226752066579073, 'min_samples_leaf': 0.007979398151829006, 'min_weight_fraction_leaf': 0.027434860882722616, 'max_features': 0.6524173399304313}. Best is trial 156 with value: 0.860262530255716.[0m
[32m[I 2022-04-13 11:44:27,177][0m Trial 622 finished with value: 0.860262530255716 and parameters: {'splitter': 'random', 'min_samples_split': 0.2684576955281386, 'min_samples_leaf': 0.048001218020658876, 'min_weight_fraction_leaf': 0.04261993093506819, 'max_features': 0.5005529144265444}. Best is trial 156 with value: 0.860262530255716.[0m
[32m[I 2022-04-13 11:44:27,265][0m Trial 623 finished with value: 0.8292381625112597 and parameters: {'splitter': 'random', 'min_samples_split': 0.1104158695053811, 'min_samples_leaf': 0.02101658975260503, 'min_weight_fraction_leaf': 0.05205781407744611, 'max_features': 0.53259475486079}. Best is trial 156 with value: 0.860262530255716.[0m
[32m[I 2022-04-13 11:44:27,357][0m Trial 624 finished with value: 0.860262530255716 and parameters: {'splitter': 'random', 'min_samples_split': 0.2692136343030321, 'min_samples_leaf': 0.02610953076171643, 'min_weight_fraction_leaf': 0.04289431609847355, 'max_features': 0.5086197971479984}. Best is trial 156 with value: 0.860262530255716.[0m
[32m[I 2022-04-13 11:44:27,459][0m Trial 625 finished with value: 0.855608859465337 and parameters: {'splitter': 'random', 'min_samples_split': 0.2595261312706035, 'min_samples_leaf': 0.02482652200829288, 'min_weight_fraction_leaf': 0.03298084625912291, 'max_features': 0.5166968179544973}. Best is trial 156 with value: 0.860262530255716.[0m
[32m[I 2022-04-13 11:44:27,549][0m Trial 626 finished with value: 0.8541689983710665 and parameters: {'splitter': 'random', 'min_samples_split': 0.24896426651391085, 'min_samples_leaf': 0.019809801008588927, 'min_weight_fraction_leaf': 0.06885905160014301, 'max_features': 0.5476047404916909}. Best is trial 156 with value: 0.860262530255716.[0m
[32m[I 2022-04-13 11:44:27,637][0m Trial 627 finished with value: 0.6712772497628071 and parameters: {'splitter': 'random', 'min_samples_split': 0.43994842086837826, 'min_samples_leaf': 0.03934139382240983, 'min_weight_fraction_leaf': 0.04670462089615508, 'max_features': 0.45761708016717284}. Best is trial 156 with value: 0.860262530255716.[0m
[32m[I 2022-04-13 11:44:27,728][0m Trial 628 finished with value: 0.6188081862944745 and parameters: {'splitter': 'random', 'min_samples_split': 0.2553286862845448, 'min_samples_leaf': 0.4369201861202684, 'min_weight_fraction_leaf': 0.09212828385549288, 'max_features': 0.561551358789968}. Best is trial 156 with value: 0.860262530255716.[0m
[32m[I 2022-04-13 11:44:27,821][0m Trial 629 finished with value: 0.7999200547726107 and parameters: {'splitter': 'random', 'min_samples_split': 0.2682898786637293, 'min_samples_leaf': 0.05852510828261734, 'min_weight_fraction_leaf': 0.007137825752570617, 'max_features': 0.467256292956805}. Best is trial 156 with value: 0.860262530255716.[0m
