[32m[I 2022-04-13 22:29:55,133][0m Trial 322 finished with value: -0.3658356129656569 and parameters: {'loss': 'squared', 'learning_rate': 0.0015241258455725945, 'n_estimators': 864, 'criterion': 'friedman_mse', 'min_samples_split': 3, 'min_samples_leaf': 4, 'min_weight_fraction_leaf': 0.049196883219230686, 'min_impurity_decrease': 0.3059485716081795, 'max_features': 0.8533953333135522, 'subsample': 0.7348017960255852, 'dropout_rate': 0.32328624550972757, 'ccp_alpha': 0.16572221854217298}. Best is trial 320 with value: 0.8779201817156906.[0m
[32m[I 2022-04-13 22:31:52,333][0m Trial 323 finished with value: 0.8711926585422283 and parameters: {'loss': 'coxph', 'learning_rate': 0.0034335139080250987, 'n_estimators': 907, 'criterion': 'friedman_mse', 'min_samples_split': 3, 'min_samples_leaf': 4, 'min_weight_fraction_leaf': 0.05051880657847421, 'min_impurity_decrease': 0.3309334975911497, 'max_features': 0.8933032697315251, 'subsample': 0.7499090519015328, 'dropout_rate': 0.40395231834711726, 'ccp_alpha': 0.10520000197986341}. Best is trial 320 with value: 0.8779201817156906.[0m
[32m[I 2022-04-13 22:33:24,110][0m Trial 324 finished with value: 0.65 and parameters: {'loss': 'coxph', 'learning_rate': 0.003697759704846974, 'n_estimators': 840, 'criterion': 'absolute_error', 'min_samples_split': 3, 'min_samples_leaf': 4, 'min_weight_fraction_leaf': 0.019725349551866597, 'min_impurity_decrease': 0.3442660496929312, 'max_features': 0.8690661761849694, 'subsample': 0.7177786547232168, 'dropout_rate': 0.39489672123067593, 'ccp_alpha': 0.3956308115875187}. Best is trial 320 with value: 0.8779201817156906.[0m
[32m[I 2022-04-13 22:35:10,643][0m Trial 325 finished with value: 0.8728907050875779 and parameters: {'loss': 'coxph', 'learning_rate': 0.002795285528162083, 'n_estimators': 896, 'criterion': 'friedman_mse', 'min_samples_split': 4, 'min_samples_leaf': 4, 'min_weight_fraction_leaf': 0.05318134023033524, 'min_impurity_decrease': 0.31790731541215056, 'max_features': 0.8396354259907703, 'subsample': 0.7502652899272103, 'dropout_rate': 0.4184758656842454, 'ccp_alpha': 0.0031062254242998494}. Best is trial 320 with value: 0.8779201817156906.[0m
[32m[I 2022-04-13 22:37:10,689][0m Trial 326 finished with value: 0.855286283871832 and parameters: {'loss': 'coxph', 'learning_rate': 0.0028312706826125003, 'n_estimators': 895, 'criterion': 'friedman_mse', 'min_samples_split': 3, 'min_samples_leaf': 4, 'min_weight_fraction_leaf': 0.055273945395886925, 'min_impurity_decrease': 0.3278017714179299, 'max_features': 0.8402237723733516, 'subsample': 0.7499442558811867, 'dropout_rate': 0.3666563450871916, 'ccp_alpha': 0.20558377369766528}. Best is trial 320 with value: 0.8779201817156906.[0m
[32m[I 2022-04-13 22:38:49,901][0m Trial 327 finished with value: 0.8707348369922346 and parameters: {'loss': 'coxph', 'learning_rate': 0.0034143975175027082, 'n_estimators': 831, 'criterion': 'friedman_mse', 'min_samples_split': 3, 'min_samples_leaf': 4, 'min_weight_fraction_leaf': 0.04779809015797873, 'min_impurity_decrease': 0.30741769436215494, 'max_features': 0.8854902801663697, 'subsample': 0.7505183501072402, 'dropout_rate': 0.37765292879519907, 'ccp_alpha': 0.10909227350438239}. Best is trial 320 with value: 0.8779201817156906.[0m
[32m[I 2022-04-13 22:40:22,523][0m Trial 328 finished with value: 0.874061372441721 and parameters: {'loss': 'coxph', 'learning_rate': 0.0036165642395757313, 'n_estimators': 841, 'criterion': 'friedman_mse', 'min_samples_split': 3, 'min_samples_leaf': 4, 'min_weight_fraction_leaf': 0.04109563783872088, 'min_impurity_decrease': 0.3969627347677737, 'max_features': 0.8287470760078152, 'subsample': 0.7589531439674955, 'dropout_rate': 0.41537701481663425, 'ccp_alpha': 0.002078579613815995}. Best is trial 320 with value: 0.8779201817156906.[0m
[32m[I 2022-04-13 22:41:56,242][0m Trial 329 finished with value: 0.8356185949223681 and parameters: {'loss': 'coxph', 'learning_rate': 0.004487041387886876, 'n_estimators': 821, 'criterion': 'friedman_mse', 'min_samples_split': 3, 'min_samples_leaf': 4, 'min_weight_fraction_leaf': 0.04063920091389981, 'min_impurity_decrease': 0.3497575630696983, 'max_features': 0.8296762822253204, 'subsample': 0.758174953943244, 'dropout_rate': 0.3795029620250427, 'ccp_alpha': 0.2631727680384549}. Best is trial 320 with value: 0.8779201817156906.[0m
[32m[I 2022-04-13 22:43:24,765][0m Trial 330 finished with value: 0.8692024177410694 and parameters: {'loss': 'coxph', 'learning_rate': 0.0038328405321683048, 'n_estimators': 840, 'criterion': 'friedman_mse', 'min_samples_split': 3, 'min_samples_leaf': 4, 'min_weight_fraction_leaf': 0.04806509115309815, 'min_impurity_decrease': 0.3808233685867647, 'max_features': 0.8581191203431402, 'subsample': 0.7595518380907061, 'dropout_rate': 0.46097128159276946, 'ccp_alpha': 0.10890425885062104}. Best is trial 320 with value: 0.8779201817156906.[0m
[32m[I 2022-04-13 22:45:02,241][0m Trial 331 finished with value: 0.874201711290089 and parameters: {'loss': 'coxph', 'learning_rate': 0.003009603423118991, 'n_estimators': 848, 'criterion': 'friedman_mse', 'min_samples_split': 3, 'min_samples_leaf': 4, 'min_weight_fraction_leaf': 0.02935387290760983, 'min_impurity_decrease': 0.3166556701025863, 'max_features': 0.8364804752563585, 'subsample': 0.777778125924109, 'dropout_rate': 0.4015021956533431, 'ccp_alpha': 0.0024173689009059285}. Best is trial 320 with value: 0.8779201817156906.[0m
[32m[I 2022-04-13 22:46:30,515][0m Trial 332 finished with value: 0.8537088791739 and parameters: {'loss': 'coxph', 'learning_rate': 0.003472905403630163, 'n_estimators': 815, 'criterion': 'friedman_mse', 'min_samples_split': 3, 'min_samples_leaf': 4, 'min_weight_fraction_leaf': 0.02725905534629461, 'min_impurity_decrease': 0.3175506803683967, 'max_features': 0.837189106982698, 'subsample': 0.7784897428666183, 'dropout_rate': 0.4275181668557874, 'ccp_alpha': 0.19713076597883095}. Best is trial 320 with value: 0.8779201817156906.[0m
[32m[I 2022-04-13 22:48:03,984][0m Trial 333 finished with value: 0.65 and parameters: {'loss': 'coxph', 'learning_rate': 0.0048890348725358435, 'n_estimators': 846, 'criterion': 'squared_error', 'min_samples_split': 3, 'min_samples_leaf': 4, 'min_weight_fraction_leaf': 0.0329763161463231, 'min_impurity_decrease': 0.39259186064993074, 'max_features': 0.845772593591386, 'subsample': 0.7501352900874662, 'dropout_rate': 0.4129099504767517, 'ccp_alpha': 0.09260643623346895}. Best is trial 320 with value: 0.8779201817156906.[0m
[32m[I 2022-04-13 22:49:37,844][0m Trial 334 finished with value: 0.8561515831545684 and parameters: {'loss': 'coxph', 'learning_rate': 0.003289073148563901, 'n_estimators': 859, 'criterion': 'friedman_mse', 'min_samples_split': 4, 'min_samples_leaf': 4, 'min_weight_fraction_leaf': 0.05110083979211645, 'min_impurity_decrease': 0.3009458866828889, 'max_features': 0.8670314439637024, 'subsample': 0.7497941444839197, 'dropout_rate': 0.42079906123189437, 'ccp_alpha': 0.2008718203933593}. Best is trial 320 with value: 0.8779201817156906.[0m
[32m[I 2022-04-13 22:51:08,537][0m Trial 335 finished with value: 0.6664143017695177 and parameters: {'loss': 'coxph', 'learning_rate': 0.004255368848363178, 'n_estimators': 827, 'criterion': 'friedman_mse', 'min_samples_split': 3, 'min_samples_leaf': 4, 'min_weight_fraction_leaf': 0.021299574932135936, 'min_impurity_decrease': 0.3310334423179706, 'max_features': 0.8824059275681082, 'subsample': 0.7782879744533593, 'dropout_rate': 0.3855228912999877, 'ccp_alpha': 0.29791504296334265}. Best is trial 320 with value: 0.8779201817156906.[0m
[32m[I 2022-04-13 22:53:06,112][0m Trial 336 finished with value: 0.8644525990162174 and parameters: {'loss': 'coxph', 'learning_rate': 0.0032684297392989226, 'n_estimators': 886, 'criterion': 'friedman_mse', 'min_samples_split': 3, 'min_samples_leaf': 3, 'min_weight_fraction_leaf': 0.040524709448510526, 'min_impurity_decrease': 0.3086289389253754, 'max_features': 0.8338356181454228, 'subsample': 0.7351440178597493, 'dropout_rate': 0.37273297729563226, 'ccp_alpha': 0.09369699317755548}. Best is trial 320 with value: 0.8779201817156906.[0m
[32m[I 2022-04-13 22:54:53,760][0m Trial 337 finished with value: 0.8739311318240972 and parameters: {'loss': 'coxph', 'learning_rate': 0.0020142804306333886, 'n_estimators': 815, 'criterion': 'friedman_mse', 'min_samples_split': 3, 'min_samples_leaf': 4, 'min_weight_fraction_leaf': 0.05195012964415766, 'min_impurity_decrease': 0.43602559237056654, 'max_features': 0.8653630567390375, 'subsample': 0.7468876975896334, 'dropout_rate': 0.3653035154143648, 'ccp_alpha': 0.001054505374752587}. Best is trial 320 with value: 0.8779201817156906.[0m
[32m[I 2022-04-13 22:55:26,424][0m Trial 338 finished with value: 0.8701142059805917 and parameters: {'loss': 'coxph', 'learning_rate': 0.0021691948704550983, 'n_estimators': 458, 'criterion': 'friedman_mse', 'min_samples_split': 3, 'min_samples_leaf': 4, 'min_weight_fraction_leaf': 0.031020250215925256, 'min_impurity_decrease': 0.4219789141253786, 'max_features': 0.8603982167662705, 'subsample': 0.76309582887988, 'dropout_rate': 0.40824015280021414, 'ccp_alpha': 0.08520881796368839}. Best is trial 320 with value: 0.8779201817156906.[0m
[32m[I 2022-04-13 22:57:12,208][0m Trial 339 finished with value: 0.8768099712505283 and parameters: {'loss': 'coxph', 'learning_rate': 0.0020391259675013023, 'n_estimators': 843, 'criterion': 'friedman_mse', 'min_samples_split': 3, 'min_samples_leaf': 3, 'min_weight_fraction_leaf': 0.029737207938278696, 'min_impurity_decrease': 0.4188980047636158, 'max_features': 0.8214059910112277, 'subsample': 0.7685756131098221, 'dropout_rate': 0.4084853730933662, 'ccp_alpha': 0.004295302152767175}. Best is trial 320 with value: 0.8779201817156906.[0m
[32m[I 2022-04-13 22:58:34,234][0m Trial 340 finished with value: 0.8536182888210254 and parameters: {'loss': 'coxph', 'learning_rate': 0.001909342077553814, 'n_estimators': 800, 'criterion': 'friedman_mse', 'min_samples_split': 3, 'min_samples_leaf': 3, 'min_weight_fraction_leaf': 0.019285690642997413, 'min_impurity_decrease': 0.47881378368877314, 'max_features': 0.8318151973910253, 'subsample': 0.7930557673647459, 'dropout_rate': 0.4053944609997267, 'ccp_alpha': 0.18328665279681675}. Best is trial 320 with value: 0.8779201817156906.[0m
[32m[I 2022-04-13 23:00:11,648][0m Trial 341 finished with value: 0.8703710369080054 and parameters: {'loss': 'coxph', 'learning_rate': 0.0013182268825856786, 'n_estimators': 825, 'criterion': 'friedman_mse', 'min_samples_split': 3, 'min_samples_leaf': 4, 'min_weight_fraction_leaf': 0.04068644273291874, 'min_impurity_decrease': 0.4449933217358768, 'max_features': 0.8251009499845394, 'subsample': 0.781702657630893, 'dropout_rate': 0.3744165334299834, 'ccp_alpha': 0.08322994488773906}. Best is trial 320 with value: 0.8779201817156906.[0m
[32m[I 2022-04-13 23:01:34,420][0m Trial 342 finished with value: 0.8515668646568273 and parameters: {'loss': 'coxph', 'learning_rate': 0.001392028539544196, 'n_estimators': 812, 'criterion': 'friedman_mse', 'min_samples_split': 3, 'min_samples_leaf': 3, 'min_weight_fraction_leaf': 0.05177375412226819, 'min_impurity_decrease': 0.4367984831114867, 'max_features': 0.8164414739915608, 'subsample': 0.7827947858353738, 'dropout_rate': 0.4346196095606288, 'ccp_alpha': 0.18222475497040808}. Best is trial 320 with value: 0.8779201817156906.[0m
[32m[I 2022-04-13 23:03:09,029][0m Trial 343 finished with value: -0.37353447673043627 and parameters: {'loss': 'squared', 'learning_rate': 0.0020535674488836317, 'n_estimators': 810, 'criterion': 'friedman_mse', 'min_samples_split': 4, 'min_samples_leaf': 4, 'min_weight_fraction_leaf': 0.006832799423449314, 'min_impurity_decrease': 0.4465764172649423, 'max_features': 0.8248824772583181, 'subsample': 0.7735211886243921, 'dropout_rate': 0.365902340942788, 'ccp_alpha': 0.084534999470866}. Best is trial 320 with value: 0.8779201817156906.[0m
[32m[I 2022-04-13 23:04:44,609][0m Trial 344 finished with value: 0.8729367844448637 and parameters: {'loss': 'coxph', 'learning_rate': 0.0013476686554047726, 'n_estimators': 846, 'criterion': 'friedman_mse', 'min_samples_split': 3, 'min_samples_leaf': 4, 'min_weight_fraction_leaf': 0.04375036869985778, 'min_impurity_decrease': 0.40453803160988755, 'max_features': 0.8507925468114126, 'subsample': 0.7543053157282452, 'dropout_rate': 0.3937637805702903, 'ccp_alpha': 0.005739275874340543}. Best is trial 320 with value: 0.8779201817156906.[0m
[32m[I 2022-04-13 23:06:27,138][0m Trial 345 finished with value: 0.8745531550274517 and parameters: {'loss': 'coxph', 'learning_rate': 0.0011776458840504806, 'n_estimators': 847, 'criterion': 'friedman_mse', 'min_samples_split': 3, 'min_samples_leaf': 4, 'min_weight_fraction_leaf': 0.04512853300406627, 'min_impurity_decrease': 0.4136586216217214, 'max_features': 0.8170476092994183, 'subsample': 0.7482853291695984, 'dropout_rate': 0.3948512471614676, 'ccp_alpha': 0.015808151398020394}. Best is trial 320 with value: 0.8779201817156906.[0m
[32m[I 2022-04-13 23:07:56,407][0m Trial 346 finished with value: 0.65 and parameters: {'loss': 'coxph', 'learning_rate': 0.001162427124951099, 'n_estimators': 840, 'criterion': 'absolute_error', 'min_samples_split': 3, 'min_samples_leaf': 4, 'min_weight_fraction_leaf': 0.04070979374854716, 'min_impurity_decrease': 0.4096653148895232, 'max_features': 0.8095536502327096, 'subsample': 0.7519607997682483, 'dropout_rate': 0.3935515469488177, 'ccp_alpha': 0.009011345816299851}. Best is trial 320 with value: 0.8779201817156906.[0m
[32m[I 2022-04-13 23:09:32,698][0m Trial 347 finished with value: 0.8742478198536757 and parameters: {'loss': 'coxph', 'learning_rate': 0.0012244141198940169, 'n_estimators': 812, 'criterion': 'friedman_mse', 'min_samples_split': 3, 'min_samples_leaf': 4, 'min_weight_fraction_leaf': 0.028785636491572446, 'min_impurity_decrease': 0.4649140737785122, 'max_features': 0.8285153769705947, 'subsample': 0.7664957062641429, 'dropout_rate': 0.3968520477547425, 'ccp_alpha': 0.004211150262816058}. Best is trial 320 with value: 0.8779201817156906.[0m
[32m[I 2022-04-13 23:10:52,134][0m Trial 348 finished with value: 0.8524321639395636 and parameters: {'loss': 'coxph', 'learning_rate': 0.0013673876381602246, 'n_estimators': 805, 'criterion': 'friedman_mse', 'min_samples_split': 3, 'min_samples_leaf': 4, 'min_weight_fraction_leaf': 0.02750070091944661, 'min_impurity_decrease': 0.46766986546897077, 'max_features': 0.8490441651510365, 'subsample': 0.7532861087995752, 'dropout_rate': 0.3877398409769501, 'ccp_alpha': 0.2012044446860445}. Best is trial 320 with value: 0.8779201817156906.[0m
[32m[I 2022-04-13 23:12:23,869][0m Trial 349 finished with value: 0.6631716176471331 and parameters: {'loss': 'coxph', 'learning_rate': 0.00131138838402686, 'n_estimators': 854, 'criterion': 'friedman_mse', 'min_samples_split': 3, 'min_samples_leaf': 4, 'min_weight_fraction_leaf': 0.012015148156914901, 'min_impurity_decrease': 0.4859409418841981, 'max_features': 0.8077561738328705, 'subsample': 0.7411660811518921, 'dropout_rate': 0.43678605637412193, 'ccp_alpha': 0.31957902418280065}. Best is trial 320 with value: 0.8779201817156906.[0m
[32m[I 2022-04-13 23:14:02,121][0m Trial 350 finished with value: 0.8721410282243125 and parameters: {'loss': 'coxph', 'learning_rate': 0.001076164115784184, 'n_estimators': 852, 'criterion': 'friedman_mse', 'min_samples_split': 3, 'min_samples_leaf': 4, 'min_weight_fraction_leaf': 0.05432598282025278, 'min_impurity_decrease': 0.38774833760204225, 'max_features': 0.8420078619177601, 'subsample': 0.7660405904819177, 'dropout_rate': 0.4213693237863527, 'ccp_alpha': 0.005039995101537353}. Best is trial 320 with value: 0.8779201817156906.[0m
[32m[I 2022-04-13 23:15:21,863][0m Trial 351 finished with value: 0.875372407850533 and parameters: {'loss': 'coxph', 'learning_rate': 0.0011044011130498413, 'n_estimators': 811, 'criterion': 'friedman_mse', 'min_samples_split': 3, 'min_samples_leaf': 4, 'min_weight_fraction_leaf': 0.04744355153523342, 'min_impurity_decrease': 0.41147948404847445, 'max_features': 0.8319086960382427, 'subsample': 0.7660586868352123, 'dropout_rate': 0.4541649742174614, 'ccp_alpha': 0.011544802475638256}. Best is trial 320 with value: 0.8779201817156906.[0m
[32m[I 2022-04-13 23:16:40,106][0m Trial 352 finished with value: 0.874672513245241 and parameters: {'loss': 'coxph', 'learning_rate': 0.0010365631578248549, 'n_estimators': 803, 'criterion': 'friedman_mse', 'min_samples_split': 3, 'min_samples_leaf': 4, 'min_weight_fraction_leaf': 0.050140159258005114, 'min_impurity_decrease': 0.4226062147171889, 'max_features': 0.8217049031073317, 'subsample': 0.788896878506244, 'dropout_rate': 0.46585659867958196, 'ccp_alpha': 0.01731415275983797}. Best is trial 320 with value: 0.8779201817156906.[0m
[32m[I 2022-04-13 23:17:56,733][0m Trial 353 finished with value: 0.65 and parameters: {'loss': 'coxph', 'learning_rate': 0.0010366817580836688, 'n_estimators': 798, 'criterion': 'squared_error', 'min_samples_split': 5, 'min_samples_leaf': 4, 'min_weight_fraction_leaf': 0.05395523049034651, 'min_impurity_decrease': 0.42137293316945446, 'max_features': 0.8220851822184478, 'subsample': 0.7984159347803752, 'dropout_rate': 0.44533628708395867, 'ccp_alpha': 0.1766245659073859}. Best is trial 320 with value: 0.8779201817156906.[0m
[32m[I 2022-04-13 23:19:04,683][0m Trial 354 finished with value: 0.8707643077168399 and parameters: {'loss': 'coxph', 'learning_rate': 0.0010390076923208584, 'n_estimators': 760, 'criterion': 'friedman_mse', 'min_samples_split': 3, 'min_samples_leaf': 4, 'min_weight_fraction_leaf': 0.05753701951474294, 'min_impurity_decrease': 0.3976191867758573, 'max_features': 0.8022257950947931, 'subsample': 0.7814505891346456, 'dropout_rate': 0.4756774319834898, 'ccp_alpha': 0.08876408319300005}. Best is trial 320 with value: 0.8779201817156906.[0m
[32m[I 2022-04-13 23:20:20,551][0m Trial 355 finished with value: 0.8726499139297152 and parameters: {'loss': 'coxph', 'learning_rate': 0.0008455262000925294, 'n_estimators': 801, 'criterion': 'friedman_mse', 'min_samples_split': 3, 'min_samples_leaf': 4, 'min_weight_fraction_leaf': 0.03314161171639657, 'min_impurity_decrease': 0.37874318281781655, 'max_features': 0.8399969279568783, 'subsample': 0.7699061210439673, 'dropout_rate': 0.4706018763108866, 'ccp_alpha': 0.003036925034887626}. Best is trial 320 with value: 0.8779201817156906.[0m
[32m[I 2022-04-13 23:21:25,269][0m Trial 356 finished with value: 0.8733567512987971 and parameters: {'loss': 'coxph', 'learning_rate': 0.0007579289637249764, 'n_estimators': 756, 'criterion': 'friedman_mse', 'min_samples_split': 3, 'min_samples_leaf': 4, 'min_weight_fraction_leaf': 0.03156524929443946, 'min_impurity_decrease': 0.3959984248470419, 'max_features': 0.8333804499237646, 'subsample': 0.8064131936950534, 'dropout_rate': 0.4878031117292963, 'ccp_alpha': 0.004481461068512897}. Best is trial 320 with value: 0.8779201817156906.[0m
[32m[I 2022-04-13 23:22:40,054][0m Trial 357 finished with value: 0.858955397500895 and parameters: {'loss': 'coxph', 'learning_rate': 0.0007016107292191744, 'n_estimators': 791, 'criterion': 'friedman_mse', 'min_samples_split': 3, 'min_samples_leaf': 4, 'min_weight_fraction_leaf': 0.03333408171392467, 'min_impurity_decrease': 0.3790588498865307, 'max_features': 0.8243029525651058, 'subsample': 0.806485261028623, 'dropout_rate': 0.4534423921575978, 'ccp_alpha': 0.17389714711298498}. Best is trial 320 with value: 0.8779201817156906.[0m
[32m[I 2022-04-13 23:23:45,638][0m Trial 358 finished with value: 0.8739724535902516 and parameters: {'loss': 'coxph', 'learning_rate': 0.0009892749898273482, 'n_estimators': 753, 'criterion': 'friedman_mse', 'min_samples_split': 4, 'min_samples_leaf': 4, 'min_weight_fraction_leaf': 0.042871091625774245, 'min_impurity_decrease': 0.41091450383879813, 'max_features': 0.8384965048412483, 'subsample': 0.8145708640719456, 'dropout_rate': 0.48868181225823615, 'ccp_alpha': 0.0010582116468338008}. Best is trial 320 with value: 0.8779201817156906.[0m
[32m[I 2022-04-13 23:24:43,927][0m Trial 359 finished with value: 0.8731300427813015 and parameters: {'loss': 'coxph', 'learning_rate': 0.0008887305255506239, 'n_estimators': 747, 'criterion': 'friedman_mse', 'min_samples_split': 4, 'min_samples_leaf': 3, 'min_weight_fraction_leaf': 0.03241488313733396, 'min_impurity_decrease': 0.4054269952562051, 'max_features': 0.8365754232211625, 'subsample': 0.8362044190203262, 'dropout_rate': 0.5071115386078565, 'ccp_alpha': 0.010423894722406431}. Best is trial 320 with value: 0.8779201817156906.[0m
[32m[I 2022-04-13 23:25:44,957][0m Trial 360 finished with value: 0.8620674649245703 and parameters: {'loss': 'coxph', 'learning_rate': 0.0009726904365775866, 'n_estimators': 760, 'criterion': 'friedman_mse', 'min_samples_split': 4, 'min_samples_leaf': 3, 'min_weight_fraction_leaf': 0.01778844043446326, 'min_impurity_decrease': 0.4029029288562035, 'max_features': 0.8031535270732967, 'subsample': 0.8230118925299145, 'dropout_rate': 0.49953410413255417, 'ccp_alpha': 0.08109821956348101}. Best is trial 320 with value: 0.8779201817156906.[0m
[32m[I 2022-04-13 23:26:42,005][0m Trial 361 finished with value: 0.8712358487912274 and parameters: {'loss': 'coxph', 'learning_rate': 0.0009127831603615874, 'n_estimators': 730, 'criterion': 'friedman_mse', 'min_samples_split': 4, 'min_samples_leaf': 3, 'min_weight_fraction_leaf': 0.03394510671618731, 'min_impurity_decrease': 0.4281726663801188, 'max_features': 0.8398309516601551, 'subsample': 0.8574089738827384, 'dropout_rate': 0.5532930340376511, 'ccp_alpha': 0.005185355365302488}. Best is trial 320 with value: 0.8779201817156906.[0m
