[32m[I 2022-04-13 11:46:29,701][0m Trial 889 finished with value: 0.7166142182627449 and parameters: {'splitter': 'random', 'min_samples_split': 0.28306196789940163, 'min_samples_leaf': 0.07678155846047818, 'min_weight_fraction_leaf': 0.1142863631808641, 'max_features': 0.6102704046162521}. Best is trial 819 with value: 0.7205250605114317.[0m
[32m[I 2022-04-13 11:46:29,782][0m Trial 890 finished with value: 0.6995395546707612 and parameters: {'splitter': 'random', 'min_samples_split': 0.27943958311498035, 'min_samples_leaf': 0.07138722233699937, 'min_weight_fraction_leaf': 0.13246872903393014, 'max_features': 0.6126641266486169}. Best is trial 819 with value: 0.7205250605114317.[0m
[32m[I 2022-04-13 11:46:29,839][0m Trial 891 finished with value: 0.7073470155997574 and parameters: {'splitter': 'random', 'min_samples_split': 0.27399319410943596, 'min_samples_leaf': 0.0876451491946629, 'min_weight_fraction_leaf': 0.014293036502111348, 'max_features': 0.6205261944964335}. Best is trial 819 with value: 0.7205250605114317.[0m
[32m[I 2022-04-13 11:46:29,958][0m Trial 892 finished with value: 0.6365884699050991 and parameters: {'splitter': 'random', 'min_samples_split': 0.28781144382855445, 'min_samples_leaf': 0.0927108415899546, 'min_weight_fraction_leaf': 0.10886268190820206, 'max_features': 0.6312892224239787}. Best is trial 819 with value: 0.7205250605114317.[0m
[32m[I 2022-04-13 11:46:30,057][0m Trial 893 finished with value: 0.6366711831550372 and parameters: {'splitter': 'random', 'min_samples_split': 0.2581814880615267, 'min_samples_leaf': 0.09006786756550589, 'min_weight_fraction_leaf': 0.12340958950712423, 'max_features': 0.6386271695063173}. Best is trial 819 with value: 0.7205250605114317.[0m
[32m[I 2022-04-13 11:46:30,191][0m Trial 894 finished with value: 0.6485886947469399 and parameters: {'splitter': 'random', 'min_samples_split': 0.2678158005318369, 'min_samples_leaf': 0.08889107024724947, 'min_weight_fraction_leaf': 0.11592016739742984, 'max_features': 0.6376473911760635}. Best is trial 819 with value: 0.7205250605114317.[0m
[32m[I 2022-04-13 11:46:30,353][0m Trial 895 finished with value: 0.7011123353214161 and parameters: {'splitter': 'random', 'min_samples_split': 0.244824105646429, 'min_samples_leaf': 0.06377398601249369, 'min_weight_fraction_leaf': 0.11239997605249528, 'max_features': 0.6122634906286799}. Best is trial 819 with value: 0.7205250605114317.[0m
[32m[I 2022-04-13 11:46:30,546][0m Trial 896 finished with value: 0.6995395546707612 and parameters: {'splitter': 'random', 'min_samples_split': 0.27766447413747464, 'min_samples_leaf': 0.07435627410460034, 'min_weight_fraction_leaf': 0.1368426649550376, 'max_features': 0.6065003105699213}. Best is trial 819 with value: 0.7205250605114317.[0m
[32m[I 2022-04-13 11:46:30,815][0m Trial 897 finished with value: 0.6321106989473192 and parameters: {'splitter': 'random', 'min_samples_split': 0.26625327166959695, 'min_samples_leaf': 0.05737173793040945, 'min_weight_fraction_leaf': 0.02817493178297127, 'max_features': 0.6711252739714169}. Best is trial 819 with value: 0.7205250605114317.[0m
[32m[I 2022-04-13 11:46:31,066][0m Trial 898 finished with value: 0.6282603442517164 and parameters: {'splitter': 'random', 'min_samples_split': 0.2867162742431485, 'min_samples_leaf': 0.07576196863556386, 'min_weight_fraction_leaf': 0.13497642724283182, 'max_features': 0.6293600232068431}. Best is trial 819 with value: 0.7205250605114317.[0m
[32m[I 2022-04-13 11:46:31,345][0m Trial 899 finished with value: 0.7077378843113455 and parameters: {'splitter': 'random', 'min_samples_split': 0.2719506767611858, 'min_samples_leaf': 0.08095457554683715, 'min_weight_fraction_leaf': 0.12615533916726596, 'max_features': 0.6007591342368899}. Best is trial 819 with value: 0.7205250605114317.[0m
[32m[I 2022-04-13 11:46:31,607][0m Trial 900 finished with value: 0.6380186846821877 and parameters: {'splitter': 'random', 'min_samples_split': 0.2554606423443725, 'min_samples_leaf': 0.08444101978235631, 'min_weight_fraction_leaf': 0.04268135930151379, 'max_features': 0.6434497287699148}. Best is trial 819 with value: 0.7205250605114317.[0m
[32m[I 2022-04-13 11:46:31,836][0m Trial 901 finished with value: 0.7148354967239336 and parameters: {'splitter': 'random', 'min_samples_split': 0.28716264991917695, 'min_samples_leaf': 0.08862499316192532, 'min_weight_fraction_leaf': 0.09911817305569363, 'max_features': 0.5886362282953556}. Best is trial 819 with value: 0.7205250605114317.[0m
[32m[I 2022-04-13 11:46:32,062][0m Trial 902 finished with value: 0.7148354967239336 and parameters: {'splitter': 'random', 'min_samples_split': 0.2873259966534213, 'min_samples_leaf': 0.09282905014053687, 'min_weight_fraction_leaf': 0.1006024244538432, 'max_features': 0.6185034781094094}. Best is trial 819 with value: 0.7205250605114317.[0m
[32m[I 2022-04-13 11:46:32,192][0m Trial 903 finished with value: 0.7148354967239336 and parameters: {'splitter': 'random', 'min_samples_split': 0.28267615647045247, 'min_samples_leaf': 0.09417198563374199, 'min_weight_fraction_leaf': 0.10039060923857392, 'max_features': 0.6150425911299898}. Best is trial 819 with value: 0.7205250605114317.[0m
[32m[I 2022-04-13 11:46:32,323][0m Trial 904 finished with value: 0.437616372588949 and parameters: {'splitter': 'random', 'min_samples_split': 0.2785444057996838, 'min_samples_leaf': 0.10935766351163403, 'min_weight_fraction_leaf': 0.3730922326638839, 'max_features': 0.6203554075624709}. Best is trial 819 with value: 0.7205250605114317.[0m
[32m[I 2022-04-13 11:46:32,458][0m Trial 905 finished with value: 0.4590832554477756 and parameters: {'splitter': 'random', 'min_samples_split': 0.28674232433256575, 'min_samples_leaf': 0.07791310001934199, 'min_weight_fraction_leaf': 0.3247243822494505, 'max_features': 0.6631404508908992}. Best is trial 819 with value: 0.7205250605114317.[0m
[32m[I 2022-04-13 11:46:32,580][0m Trial 906 finished with value: 0.6374270657021465 and parameters: {'splitter': 'random', 'min_samples_split': 0.2873883336647068, 'min_samples_leaf': 0.10078077129352307, 'min_weight_fraction_leaf': 0.09903628737612857, 'max_features': 0.64329593994945}. Best is trial 819 with value: 0.7205250605114317.[0m
[32m[I 2022-04-13 11:46:32,709][0m Trial 907 finished with value: 0.7166142182627449 and parameters: {'splitter': 'random', 'min_samples_split': 0.2777935726968684, 'min_samples_leaf': 0.09466271145903361, 'min_weight_fraction_leaf': 0.11651693038818255, 'max_features': 0.6182147955407833}. Best is trial 819 with value: 0.7205250605114317.[0m
[32m[I 2022-04-13 11:46:32,825][0m Trial 908 finished with value: 0.7166142182627449 and parameters: {'splitter': 'random', 'min_samples_split': 0.2775852072278411, 'min_samples_leaf': 0.10039600642624763, 'min_weight_fraction_leaf': 0.11502659791253737, 'max_features': 0.6229952562505494}. Best is trial 819 with value: 0.7205250605114317.[0m
[32m[I 2022-04-13 11:46:32,944][0m Trial 909 finished with value: 0.6485886947469399 and parameters: {'splitter': 'random', 'min_samples_split': 0.2762238676911563, 'min_samples_leaf': 0.10329921403089064, 'min_weight_fraction_leaf': 0.11026415806602802, 'max_features': 0.6950792631593572}. Best is trial 819 with value: 0.7205250605114317.[0m
[32m[I 2022-04-13 11:46:32,985][0m Trial 910 finished with value: 0.6365884699050991 and parameters: {'splitter': 'random', 'min_samples_split': 0.2778589822054139, 'min_samples_leaf': 0.09655733535520619, 'min_weight_fraction_leaf': 0.10645818997996878, 'max_features': 0.6441811792088383}. Best is trial 819 with value: 0.7205250605114317.[0m
[32m[I 2022-04-13 11:46:33,028][0m Trial 911 finished with value: 0.628696384719799 and parameters: {'splitter': 'random', 'min_samples_split': 0.2842101970307658, 'min_samples_leaf': 0.10813964080604045, 'min_weight_fraction_leaf': 0.12492071765969279, 'max_features': 0.6756452776917031}. Best is trial 819 with value: 0.7205250605114317.[0m
[32m[I 2022-04-13 11:46:33,088][0m Trial 912 finished with value: 0.6485886947469399 and parameters: {'splitter': 'random', 'min_samples_split': 0.26359637813268133, 'min_samples_leaf': 0.1076781930714598, 'min_weight_fraction_leaf': 0.1095073923262454, 'max_features': 0.6275296640164355}. Best is trial 819 with value: 0.7205250605114317.[0m
[32m[I 2022-04-13 11:46:33,144][0m Trial 913 finished with value: 0.6366711831550372 and parameters: {'splitter': 'random', 'min_samples_split': 0.2713098250308804, 'min_samples_leaf': 0.11820666700546024, 'min_weight_fraction_leaf': 0.12851823558591433, 'max_features': 0.6642697451103081}. Best is trial 819 with value: 0.7205250605114317.[0m
[32m[I 2022-04-13 11:46:33,196][0m Trial 914 finished with value: 0.628696384719799 and parameters: {'splitter': 'random', 'min_samples_split': 0.288930428314977, 'min_samples_leaf': 0.09090112295013755, 'min_weight_fraction_leaf': 0.12322753998956501, 'max_features': 0.6264602921706389}. Best is trial 819 with value: 0.7205250605114317.[0m
[32m[I 2022-04-13 11:46:33,280][0m Trial 915 finished with value: 0.701088972530485 and parameters: {'splitter': 'random', 'min_samples_split': 0.2786131549375574, 'min_samples_leaf': 0.09919614261547219, 'min_weight_fraction_leaf': 0.145354614240191, 'max_features': 0.6100708071460799}. Best is trial 819 with value: 0.7205250605114317.[0m
[32m[I 2022-04-13 11:46:33,390][0m Trial 916 finished with value: 0.6485886947469399 and parameters: {'splitter': 'random', 'min_samples_split': 0.26126375895838466, 'min_samples_leaf': 0.08598714079998074, 'min_weight_fraction_leaf': 0.11658940598872271, 'max_features': 0.6557023983479217}. Best is trial 819 with value: 0.7205250605114317.[0m
[32m[I 2022-04-13 11:46:33,451][0m Trial 917 finished with value: 0.6485886947469399 and parameters: {'splitter': 'random', 'min_samples_split': 0.2694465312989378, 'min_samples_leaf': 0.09500307911493884, 'min_weight_fraction_leaf': 0.11487577916704453, 'max_features': 0.6256814012542223}. Best is trial 819 with value: 0.7205250605114317.[0m
[32m[I 2022-04-13 11:46:33,511][0m Trial 918 finished with value: 0.7075743489608037 and parameters: {'splitter': 'random', 'min_samples_split': 0.277770387560301, 'min_samples_leaf': 0.08779371837153896, 'min_weight_fraction_leaf': 0.026183844672704203, 'max_features': 0.6061373277689731}. Best is trial 819 with value: 0.7205250605114317.[0m
[32m[I 2022-04-13 11:46:33,572][0m Trial 919 finished with value: 0.5551385562717799 and parameters: {'splitter': 'random', 'min_samples_split': 0.25924670489119206, 'min_samples_leaf': 0.12561868996328684, 'min_weight_fraction_leaf': 0.2255218448101822, 'max_features': 0.6435283618646728}. Best is trial 819 with value: 0.7205250605114317.[0m
[32m[I 2022-04-13 11:46:33,631][0m Trial 920 finished with value: 0.6374270657021465 and parameters: {'splitter': 'random', 'min_samples_split': 0.2888375605512915, 'min_samples_leaf': 0.08366144480196068, 'min_weight_fraction_leaf': 0.10320609639667075, 'max_features': 0.6427844347846381}. Best is trial 819 with value: 0.7205250605114317.[0m
[32m[I 2022-04-13 11:46:33,705][0m Trial 921 finished with value: 0.7148354967239336 and parameters: {'splitter': 'random', 'min_samples_split': 0.2861550903713043, 'min_samples_leaf': 0.10079887047459662, 'min_weight_fraction_leaf': 0.09961166695009671, 'max_features': 0.6206024219289465}. Best is trial 819 with value: 0.7205250605114317.[0m
[32m[I 2022-04-13 11:46:33,796][0m Trial 922 finished with value: 0.6365884699050991 and parameters: {'splitter': 'random', 'min_samples_split': 0.285998501399096, 'min_samples_leaf': 0.115005523017123, 'min_weight_fraction_leaf': 0.09957492793998393, 'max_features': 0.6769538213450496}. Best is trial 819 with value: 0.7205250605114317.[0m
[32m[I 2022-04-13 11:46:33,894][0m Trial 923 finished with value: 0.7166142182627449 and parameters: {'splitter': 'random', 'min_samples_split': 0.27657641562322843, 'min_samples_leaf': 0.10327130793552078, 'min_weight_fraction_leaf': 0.11796139557257805, 'max_features': 0.6205753580597841}. Best is trial 819 with value: 0.7205250605114317.[0m
[32m[I 2022-04-13 11:46:34,091][0m Trial 924 finished with value: 0.6494272905439874 and parameters: {'splitter': 'random', 'min_samples_split': 0.27434587539191846, 'min_samples_leaf': 0.10346600454503463, 'min_weight_fraction_leaf': 0.10343702268468175, 'max_features': 0.6562025490827821}. Best is trial 819 with value: 0.7205250605114317.[0m
[32m[I 2022-04-13 11:46:34,309][0m Trial 925 finished with value: 0.6485886947469399 and parameters: {'splitter': 'random', 'min_samples_split': 0.26864155270284595, 'min_samples_leaf': 0.11208355354398367, 'min_weight_fraction_leaf': 0.11063911533463966, 'max_features': 0.629331717919824}. Best is trial 819 with value: 0.7205250605114317.[0m
[32m[I 2022-04-13 11:46:34,515][0m Trial 926 finished with value: 0.628696384719799 and parameters: {'splitter': 'random', 'min_samples_split': 0.28330275356312085, 'min_samples_leaf': 0.10175945292775417, 'min_weight_fraction_leaf': 0.11994872352119132, 'max_features': 0.64685100377716}. Best is trial 819 with value: 0.7205250605114317.[0m
[32m[I 2022-04-13 11:46:34,632][0m Trial 927 finished with value: 0.6891528673684901 and parameters: {'splitter': 'random', 'min_samples_split': 0.2888328712389212, 'min_samples_leaf': 0.09322414639536375, 'min_weight_fraction_leaf': 0.1820427211688044, 'max_features': 0.619336654905701}. Best is trial 819 with value: 0.7205250605114317.[0m
[32m[I 2022-04-13 11:46:34,763][0m Trial 928 finished with value: 0.7014642927818453 and parameters: {'splitter': 'random', 'min_samples_split': 0.254411183466735, 'min_samples_leaf': 0.09344673197399518, 'min_weight_fraction_leaf': 0.09000659112371709, 'max_features': 0.6249180454333627}. Best is trial 819 with value: 0.7205250605114317.[0m
[32m[I 2022-04-13 11:46:34,929][0m Trial 929 finished with value: 0.6366711831550372 and parameters: {'splitter': 'random', 'min_samples_split': 0.27129200886866456, 'min_samples_leaf': 0.12771263440405187, 'min_weight_fraction_leaf': 0.12942889315579736, 'max_features': 0.6260185828520748}. Best is trial 819 with value: 0.7205250605114317.[0m
[32m[I 2022-04-13 11:46:35,135][0m Trial 930 finished with value: 0.6485886947469399 and parameters: {'splitter': 'random', 'min_samples_split': 0.263320764638874, 'min_samples_leaf': 0.10253227949698833, 'min_weight_fraction_leaf': 0.11610396202259991, 'max_features': 0.6468628456267557}. Best is trial 819 with value: 0.7205250605114317.[0m
[32m[I 2022-04-13 11:46:35,292][0m Trial 931 finished with value: 0.7134232280890631 and parameters: {'splitter': 'random', 'min_samples_split': 0.2797053543719447, 'min_samples_leaf': 0.08334566201923646, 'min_weight_fraction_leaf': 0.13099182651919708, 'max_features': 0.6102763224230975}. Best is trial 819 with value: 0.7205250605114317.[0m
[32m[I 2022-04-13 11:46:35,487][0m Trial 932 finished with value: 0.6995395546707612 and parameters: {'splitter': 'random', 'min_samples_split': 0.24844070401677334, 'min_samples_leaf': 0.11648241542139508, 'min_weight_fraction_leaf': 0.1356615394580749, 'max_features': 0.6031486956311582}. Best is trial 819 with value: 0.7205250605114317.[0m
[32m[I 2022-04-13 11:46:35,669][0m Trial 933 finished with value: 0.7148354967239336 and parameters: {'splitter': 'random', 'min_samples_split': 0.2894470871430692, 'min_samples_leaf': 0.0814480705541467, 'min_weight_fraction_leaf': 0.1000585832175386, 'max_features': 0.6049173778335872}. Best is trial 819 with value: 0.7205250605114317.[0m
[32m[I 2022-04-13 11:46:35,870][0m Trial 934 finished with value: 0.7166142182627449 and parameters: {'splitter': 'random', 'min_samples_split': 0.28045138212797194, 'min_samples_leaf': 0.09012613724399936, 'min_weight_fraction_leaf': 0.11167532445099905, 'max_features': 0.6131165412368828}. Best is trial 819 with value: 0.7205250605114317.[0m
[32m[I 2022-04-13 11:46:36,059][0m Trial 935 finished with value: 0.6365884699050991 and parameters: {'splitter': 'random', 'min_samples_split': 0.2790034712004571, 'min_samples_leaf': 0.08911624200353396, 'min_weight_fraction_leaf': 0.11405156194251821, 'max_features': 0.6361013423309531}. Best is trial 819 with value: 0.7205250605114317.[0m
[32m[I 2022-04-13 11:46:36,218][0m Trial 936 finished with value: 0.6291159758614167 and parameters: {'splitter': 'random', 'min_samples_split': 0.28437810588948, 'min_samples_leaf': 0.08137050695405335, 'min_weight_fraction_leaf': 0.16716897764415772, 'max_features': 0.6610118727347497}. Best is trial 819 with value: 0.7205250605114317.[0m
[32m[I 2022-04-13 11:46:36,392][0m Trial 937 finished with value: 0.7077378843113455 and parameters: {'splitter': 'random', 'min_samples_split': 0.27102850850793747, 'min_samples_leaf': 0.09792926508990694, 'min_weight_fraction_leaf': 0.12870920968011884, 'max_features': 0.6142233839665296}. Best is trial 819 with value: 0.7205250605114317.[0m
[32m[I 2022-04-13 11:46:36,618][0m Trial 938 finished with value: 0.6374270657021465 and parameters: {'splitter': 'random', 'min_samples_split': 0.29053118852164755, 'min_samples_leaf': 0.10316335097362028, 'min_weight_fraction_leaf': 0.10123297701880675, 'max_features': 0.6753869004669736}. Best is trial 819 with value: 0.7205250605114317.[0m
[32m[I 2022-04-13 11:46:36,825][0m Trial 939 finished with value: 0.6366711831550372 and parameters: {'splitter': 'random', 'min_samples_split': 0.2751787363551895, 'min_samples_leaf': 0.08164628950499266, 'min_weight_fraction_leaf': 0.12598365360346736, 'max_features': 0.634506936197062}. Best is trial 819 with value: 0.7205250605114317.[0m
[32m[I 2022-04-13 11:46:36,877][0m Trial 940 finished with value: 0.6995395546707612 and parameters: {'splitter': 'random', 'min_samples_split': 0.263304003439538, 'min_samples_leaf': 0.09241255958674216, 'min_weight_fraction_leaf': 0.14060698024483312, 'max_features': 0.6074506063022578}. Best is trial 819 with value: 0.7205250605114317.[0m
[32m[I 2022-04-13 11:46:36,918][0m Trial 941 finished with value: 0.7166142182627449 and parameters: {'splitter': 'random', 'min_samples_split': 0.2890174457100893, 'min_samples_leaf': 0.10310513059500076, 'min_weight_fraction_leaf': 0.11746538130516919, 'max_features': 0.6141923453914369}. Best is trial 819 with value: 0.7205250605114317.[0m
[32m[I 2022-04-13 11:46:36,959][0m Trial 942 finished with value: 0.628696384719799 and parameters: {'splitter': 'random', 'min_samples_split': 0.2870611660740155, 'min_samples_leaf': 0.12222329707178696, 'min_weight_fraction_leaf': 0.11329409120761792, 'max_features': 0.6559440438703614}. Best is trial 819 with value: 0.7205250605114317.[0m
[32m[I 2022-04-13 11:46:37,029][0m Trial 943 finished with value: 0.7050048229388263 and parameters: {'splitter': 'random', 'min_samples_split': 0.289877596917828, 'min_samples_leaf': 0.10513451528642404, 'min_weight_fraction_leaf': 0.12010014192740084, 'max_features': 0.6164764070248733}. Best is trial 819 with value: 0.7205250605114317.[0m
[32m[I 2022-04-13 11:46:37,101][0m Trial 944 finished with value: 0.6365884699050991 and parameters: {'splitter': 'random', 'min_samples_split': 0.27837911290934536, 'min_samples_leaf': 0.10750727886810153, 'min_weight_fraction_leaf': 0.1072684998657652, 'max_features': 0.6386151097173458}. Best is trial 819 with value: 0.7205250605114317.[0m
[32m[I 2022-04-13 11:46:37,191][0m Trial 945 finished with value: 0.7166142182627449 and parameters: {'splitter': 'random', 'min_samples_split': 0.2803237633556014, 'min_samples_leaf': 0.09145768989149679, 'min_weight_fraction_leaf': 0.11139250871805123, 'max_features': 0.6248758797591151}. Best is trial 819 with value: 0.7205250605114317.[0m
[32m[I 2022-04-13 11:46:37,263][0m Trial 946 finished with value: 0.6485886947469399 and parameters: {'splitter': 'random', 'min_samples_split': 0.2690396290939995, 'min_samples_leaf': 0.09270689652332037, 'min_weight_fraction_leaf': 0.11581160473851357, 'max_features': 0.6855343888544122}. Best is trial 819 with value: 0.7205250605114317.[0m
[32m[I 2022-04-13 11:46:37,456][0m Trial 947 finished with value: 0.7134232280890631 and parameters: {'splitter': 'random', 'min_samples_split': 0.28045113915097303, 'min_samples_leaf': 0.08122439935705872, 'min_weight_fraction_leaf': 0.12019459299170358, 'max_features': 0.6237657875449246}. Best is trial 819 with value: 0.7205250605114317.[0m
[32m[I 2022-04-13 11:46:37,641][0m Trial 948 finished with value: 0.6485886947469399 and parameters: {'splitter': 'random', 'min_samples_split': 0.25961047699255696, 'min_samples_leaf': 0.09225550468165418, 'min_weight_fraction_leaf': 0.10995406354021389, 'max_features': 0.6606104700277156}. Best is trial 819 with value: 0.7205250605114317.[0m
[32m[I 2022-04-13 11:46:37,819][0m Trial 949 finished with value: 0.6282603442517164 and parameters: {'splitter': 'random', 'min_samples_split': 0.2903271548812701, 'min_samples_leaf': 0.1213307790553945, 'min_weight_fraction_leaf': 0.13534386577733654, 'max_features': 0.6434770189106759}. Best is trial 819 with value: 0.7205250605114317.[0m
[32m[I 2022-04-13 11:46:37,968][0m Trial 950 finished with value: 0.6366711831550372 and parameters: {'splitter': 'random', 'min_samples_split': 0.2709876519329644, 'min_samples_leaf': 0.10321378986861593, 'min_weight_fraction_leaf': 0.12347494130428388, 'max_features': 0.6311625455614913}. Best is trial 819 with value: 0.7205250605114317.[0m
[32m[I 2022-04-13 11:46:38,067][0m Trial 951 finished with value: 0.6374270657021465 and parameters: {'splitter': 'random', 'min_samples_split': 0.28998083250288254, 'min_samples_leaf': 0.08318024255591994, 'min_weight_fraction_leaf': 0.10222803565942035, 'max_features': 0.6650728750758793}. Best is trial 819 with value: 0.7205250605114317.[0m
