[32m[I 2022-04-13 11:43:55,037][0m Trial 126 finished with value: 0.8537871744804019 and parameters: {'splitter': 'random', 'min_samples_split': 0.2842604006237863, 'min_samples_leaf': 0.07570918828184899, 'min_weight_fraction_leaf': 0.016334391119163745, 'max_features': 0.6188318401433953}. Best is trial 103 with value: 0.8583071091313723.[0m
[32m[I 2022-04-13 11:43:55,071][0m Trial 127 finished with value: 0.8109417480001758 and parameters: {'splitter': 'random', 'min_samples_split': 0.2822276568306931, 'min_samples_leaf': 0.07514039268794856, 'min_weight_fraction_leaf': 0.013141552226512788, 'max_features': 0.631065643126724}. Best is trial 103 with value: 0.8583071091313723.[0m
[32m[I 2022-04-13 11:43:55,104][0m Trial 128 finished with value: 0.8541689983710665 and parameters: {'splitter': 'random', 'min_samples_split': 0.24247798855238223, 'min_samples_leaf': 0.06418239684146466, 'min_weight_fraction_leaf': 0.009960986276590325, 'max_features': 0.6124993527004936}. Best is trial 103 with value: 0.8583071091313723.[0m
[32m[I 2022-04-13 11:43:55,138][0m Trial 129 finished with value: 0.8541689983710665 and parameters: {'splitter': 'random', 'min_samples_split': 0.24608522060289112, 'min_samples_leaf': 0.051271026559504454, 'min_weight_fraction_leaf': 0.010234390939846686, 'max_features': 0.6163771495156587}. Best is trial 103 with value: 0.8583071091313723.[0m
[32m[I 2022-04-13 11:43:55,172][0m Trial 130 finished with value: 0.8541689983710665 and parameters: {'splitter': 'random', 'min_samples_split': 0.2427306681419095, 'min_samples_leaf': 0.05480788698952669, 'min_weight_fraction_leaf': 0.008868228193636678, 'max_features': 0.6168869685126979}. Best is trial 103 with value: 0.8583071091313723.[0m
[32m[I 2022-04-13 11:43:55,207][0m Trial 131 finished with value: 0.855608859465337 and parameters: {'splitter': 'random', 'min_samples_split': 0.25768435611752044, 'min_samples_leaf': 0.05222673161733066, 'min_weight_fraction_leaf': 0.0011178087865950162, 'max_features': 0.6122086866686047}. Best is trial 103 with value: 0.8583071091313723.[0m
[32m[I 2022-04-13 11:43:55,241][0m Trial 132 finished with value: 0.8541689983710665 and parameters: {'splitter': 'random', 'min_samples_split': 0.2401054394254994, 'min_samples_leaf': 0.0567057502153914, 'min_weight_fraction_leaf': 0.024976976110649623, 'max_features': 0.6206521985322964}. Best is trial 103 with value: 0.8583071091313723.[0m
[32m[I 2022-04-13 11:43:55,276][0m Trial 133 finished with value: 0.8243144312662244 and parameters: {'splitter': 'random', 'min_samples_split': 0.24355258204336838, 'min_samples_leaf': 0.04862949097234856, 'min_weight_fraction_leaf': 0.0001848835987086888, 'max_features': 0.6459015600802333}. Best is trial 103 with value: 0.8583071091313723.[0m
[32m[I 2022-04-13 11:43:55,323][0m Trial 134 finished with value: 0.8541097042232983 and parameters: {'splitter': 'random', 'min_samples_split': 0.25977854316243354, 'min_samples_leaf': 0.019642002836014166, 'min_weight_fraction_leaf': 0.025958848777827316, 'max_features': 0.615317532007922}. Best is trial 103 with value: 0.8583071091313723.[0m
[32m[I 2022-04-13 11:43:55,380][0m Trial 135 finished with value: 0.8405493410581748 and parameters: {'splitter': 'random', 'min_samples_split': 0.25818826443552473, 'min_samples_leaf': 0.019467989339546667, 'min_weight_fraction_leaf': 0.021292606976496167, 'max_features': 0.6770663453667302}. Best is trial 103 with value: 0.8583071091313723.[0m
[32m[I 2022-04-13 11:43:55,428][0m Trial 136 finished with value: 0.8392701764881831 and parameters: {'splitter': 'random', 'min_samples_split': 0.26145697334821977, 'min_samples_leaf': 0.021766605677486037, 'min_weight_fraction_leaf': 0.02691871651131011, 'max_features': 0.7157614036834097}. Best is trial 103 with value: 0.8583071091313723.[0m
[32m[I 2022-04-13 11:43:55,462][0m Trial 137 finished with value: 0.8541689983710665 and parameters: {'splitter': 'random', 'min_samples_split': 0.24742288802927873, 'min_samples_leaf': 0.044976430673036916, 'min_weight_fraction_leaf': 0.009984519853538676, 'max_features': 0.6128650371591174}. Best is trial 103 with value: 0.8583071091313723.[0m
[32m[I 2022-04-13 11:43:55,496][0m Trial 138 finished with value: 0.8541689983710665 and parameters: {'splitter': 'random', 'min_samples_split': 0.2478976127474572, 'min_samples_leaf': 0.057343704181748244, 'min_weight_fraction_leaf': 0.005920902542981722, 'max_features': 0.6142296693794275}. Best is trial 103 with value: 0.8583071091313723.[0m
[32m[I 2022-04-13 11:43:55,531][0m Trial 139 finished with value: 0.8243144312662244 and parameters: {'splitter': 'random', 'min_samples_split': 0.24597557015117952, 'min_samples_leaf': 0.058321816870741075, 'min_weight_fraction_leaf': 0.008445356394223412, 'max_features': 0.6644524136537486}. Best is trial 103 with value: 0.8583071091313723.[0m
[32m[I 2022-04-13 11:43:55,565][0m Trial 140 finished with value: 0.8243144312662244 and parameters: {'splitter': 'random', 'min_samples_split': 0.23141899859659354, 'min_samples_leaf': 0.04624991910873756, 'min_weight_fraction_leaf': 0.0017520873798180026, 'max_features': 0.6293311278657862}. Best is trial 103 with value: 0.8583071091313723.[0m
[32m[I 2022-04-13 11:43:55,599][0m Trial 141 finished with value: 0.8541689983710665 and parameters: {'splitter': 'random', 'min_samples_split': 0.24998848339563934, 'min_samples_leaf': 0.0648519382151479, 'min_weight_fraction_leaf': 0.02286684163114512, 'max_features': 0.6062647678932984}. Best is trial 103 with value: 0.8583071091313723.[0m
[32m[I 2022-04-13 11:43:55,644][0m Trial 142 finished with value: 0.8544192216908126 and parameters: {'splitter': 'random', 'min_samples_split': 0.23758345614106657, 'min_samples_leaf': 0.02726143744063672, 'min_weight_fraction_leaf': 0.026253420759928182, 'max_features': 0.6114556840073295}. Best is trial 103 with value: 0.8583071091313723.[0m
[32m[I 2022-04-13 11:43:55,703][0m Trial 143 finished with value: 0.8243144312662244 and parameters: {'splitter': 'random', 'min_samples_split': 0.24980647579961068, 'min_samples_leaf': 0.0630445739936528, 'min_weight_fraction_leaf': 0.013435429560723681, 'max_features': 0.6394375547577452}. Best is trial 103 with value: 0.8583071091313723.[0m
[32m[I 2022-04-13 11:43:55,765][0m Trial 144 finished with value: 0.8243144312662244 and parameters: {'splitter': 'random', 'min_samples_split': 0.2350731262056215, 'min_samples_leaf': 0.05297377283585637, 'min_weight_fraction_leaf': 0.028070884338519408, 'max_features': 0.6942144207024405}. Best is trial 103 with value: 0.8583071091313723.[0m
[32m[I 2022-04-13 11:43:55,799][0m Trial 145 finished with value: 0.8544192216908126 and parameters: {'splitter': 'random', 'min_samples_split': 0.24742951880983022, 'min_samples_leaf': 0.038424582773979914, 'min_weight_fraction_leaf': 0.016278597188997015, 'max_features': 0.6106765279540052}. Best is trial 103 with value: 0.8583071091313723.[0m
[32m[I 2022-04-13 11:43:55,834][0m Trial 146 finished with value: 0.8495779719052834 and parameters: {'splitter': 'random', 'min_samples_split': 0.29198767460787783, 'min_samples_leaf': 0.04052488863834683, 'min_weight_fraction_leaf': 0.04182094592362083, 'max_features': 0.6048395050000657}. Best is trial 103 with value: 0.8583071091313723.[0m
[32m[I 2022-04-13 11:43:55,884][0m Trial 147 finished with value: 0.8544192216908126 and parameters: {'splitter': 'random', 'min_samples_split': 0.24152785596941764, 'min_samples_leaf': 0.029526891479469707, 'min_weight_fraction_leaf': 0.016345655136116855, 'max_features': 0.6055431903518426}. Best is trial 103 with value: 0.8583071091313723.[0m
[32m[I 2022-04-13 11:43:55,944][0m Trial 148 finished with value: 0.8544192216908126 and parameters: {'splitter': 'random', 'min_samples_split': 0.2376220029564936, 'min_samples_leaf': 0.028788452242032293, 'min_weight_fraction_leaf': 0.023120380341192657, 'max_features': 0.5858251941281502}. Best is trial 103 with value: 0.8583071091313723.[0m
[32m[I 2022-04-13 11:43:55,997][0m Trial 149 finished with value: 0.8342980224286782 and parameters: {'splitter': 'random', 'min_samples_split': 0.2078915614568244, 'min_samples_leaf': 0.009796075048604493, 'min_weight_fraction_leaf': 0.022476603404331667, 'max_features': 0.6519532253496213}. Best is trial 103 with value: 0.8583071091313723.[0m
[32m[I 2022-04-13 11:43:56,032][0m Trial 150 finished with value: 0.8441814084911472 and parameters: {'splitter': 'random', 'min_samples_split': 0.23552214895152157, 'min_samples_leaf': 0.02562269759764387, 'min_weight_fraction_leaf': 0.036505443507000385, 'max_features': 0.6545453308846715}. Best is trial 103 with value: 0.8583071091313723.[0m
[32m[I 2022-04-13 11:43:56,065][0m Trial 151 finished with value: 0.8544192216908126 and parameters: {'splitter': 'random', 'min_samples_split': 0.24031779230486539, 'min_samples_leaf': 0.005127585453475275, 'min_weight_fraction_leaf': 0.008674107278625281, 'max_features': 0.5843507393458608}. Best is trial 103 with value: 0.8583071091313723.[0m
[32m[I 2022-04-13 11:43:56,098][0m Trial 152 finished with value: 0.8541097042232983 and parameters: {'splitter': 'random', 'min_samples_split': 0.25492456313723244, 'min_samples_leaf': 0.007555733026779254, 'min_weight_fraction_leaf': 0.01839276849525496, 'max_features': 0.5896446774793975}. Best is trial 103 with value: 0.8583071091313723.[0m
[32m[I 2022-04-13 11:43:56,133][0m Trial 153 finished with value: 0.8555617056756446 and parameters: {'splitter': 'random', 'min_samples_split': 0.26611958549783654, 'min_samples_leaf': 0.02908669143168946, 'min_weight_fraction_leaf': 0.012065859462800872, 'max_features': 0.5772926176033267}. Best is trial 103 with value: 0.8583071091313723.[0m
[32m[I 2022-04-13 11:43:56,166][0m Trial 154 finished with value: 0.6188081862944745 and parameters: {'splitter': 'random', 'min_samples_split': 0.3175568771596843, 'min_samples_leaf': 0.030686504290988282, 'min_weight_fraction_leaf': 0.41826198438653356, 'max_features': 0.560665728806458}. Best is trial 103 with value: 0.8583071091313723.[0m
[32m[I 2022-04-13 11:43:56,201][0m Trial 155 finished with value: 0.8495779719052834 and parameters: {'splitter': 'random', 'min_samples_split': 0.294286277435856, 'min_samples_leaf': 0.004350357760076272, 'min_weight_fraction_leaf': 0.03137330118835213, 'max_features': 0.5785417181794881}. Best is trial 103 with value: 0.8583071091313723.[0m
[32m[I 2022-04-13 11:43:56,237][0m Trial 156 finished with value: 0.860262530255716 and parameters: {'splitter': 'random', 'min_samples_split': 0.2634327795456142, 'min_samples_leaf': 0.0010397355641569754, 'min_weight_fraction_leaf': 0.06902031599129063, 'max_features': 0.5894070081890616}. Best is trial 156 with value: 0.860262530255716.[0m
[32m[I 2022-04-13 11:43:56,271][0m Trial 157 finished with value: 0.860262530255716 and parameters: {'splitter': 'random', 'min_samples_split': 0.26706024321740995, 'min_samples_leaf': 0.035379311781886795, 'min_weight_fraction_leaf': 0.07039696553435959, 'max_features': 0.5607279436764057}. Best is trial 156 with value: 0.860262530255716.[0m
[32m[I 2022-04-13 11:43:56,305][0m Trial 158 finished with value: 0.860262530255716 and parameters: {'splitter': 'random', 'min_samples_split': 0.2670482081574172, 'min_samples_leaf': 0.013756563471355815, 'min_weight_fraction_leaf': 0.061488870606835264, 'max_features': 0.5868347188109078}. Best is trial 156 with value: 0.860262530255716.[0m
[32m[I 2022-04-13 11:43:56,338][0m Trial 159 finished with value: 0.860262530255716 and parameters: {'splitter': 'random', 'min_samples_split': 0.26770607091948884, 'min_samples_leaf': 0.021271751970965588, 'min_weight_fraction_leaf': 0.0699688701236734, 'max_features': 0.55852367193444}. Best is trial 156 with value: 0.860262530255716.[0m
[32m[I 2022-04-13 11:43:56,372][0m Trial 160 finished with value: 0.860262530255716 and parameters: {'splitter': 'random', 'min_samples_split': 0.26728132616020245, 'min_samples_leaf': 0.01390583974376813, 'min_weight_fraction_leaf': 0.06865507486858487, 'max_features': 0.5528036888290305}. Best is trial 156 with value: 0.860262530255716.[0m
[32m[I 2022-04-13 11:43:56,407][0m Trial 161 finished with value: 0.860262530255716 and parameters: {'splitter': 'random', 'min_samples_split': 0.26464085505963303, 'min_samples_leaf': 0.018494911430087236, 'min_weight_fraction_leaf': 0.06821790547418448, 'max_features': 0.5569019662966105}. Best is trial 156 with value: 0.860262530255716.[0m
[32m[I 2022-04-13 11:43:56,441][0m Trial 162 finished with value: 0.860262530255716 and parameters: {'splitter': 'random', 'min_samples_split': 0.2665258512323119, 'min_samples_leaf': 0.018198146365199903, 'min_weight_fraction_leaf': 0.07092123172388258, 'max_features': 0.5582861822106244}. Best is trial 156 with value: 0.860262530255716.[0m
[32m[I 2022-04-13 11:43:56,475][0m Trial 163 finished with value: 0.860262530255716 and parameters: {'splitter': 'random', 'min_samples_split': 0.2687520306843887, 'min_samples_leaf': 0.014334333568349296, 'min_weight_fraction_leaf': 0.0652445145164063, 'max_features': 0.5264427524862273}. Best is trial 156 with value: 0.860262530255716.[0m
[32m[I 2022-04-13 11:43:56,511][0m Trial 164 finished with value: 0.860262530255716 and parameters: {'splitter': 'random', 'min_samples_split': 0.26755470490130545, 'min_samples_leaf': 0.015422731940888421, 'min_weight_fraction_leaf': 0.07344484753921389, 'max_features': 0.5236174660142755}. Best is trial 156 with value: 0.860262530255716.[0m
[32m[I 2022-04-13 11:43:56,546][0m Trial 165 finished with value: 0.860262530255716 and parameters: {'splitter': 'random', 'min_samples_split': 0.2682947200863475, 'min_samples_leaf': 0.015034699090495644, 'min_weight_fraction_leaf': 0.07018332779989013, 'max_features': 0.5240784051155314}. Best is trial 156 with value: 0.860262530255716.[0m
[32m[I 2022-04-13 11:43:56,585][0m Trial 166 finished with value: 0.8495779719052834 and parameters: {'splitter': 'random', 'min_samples_split': 0.29031459890548056, 'min_samples_leaf': 0.015532703268500161, 'min_weight_fraction_leaf': 0.06750024604219007, 'max_features': 0.5207460635189739}. Best is trial 156 with value: 0.860262530255716.[0m
[32m[I 2022-04-13 11:43:56,619][0m Trial 167 finished with value: 0.860262530255716 and parameters: {'splitter': 'random', 'min_samples_split': 0.2665754858441491, 'min_samples_leaf': 0.0022069258809214887, 'min_weight_fraction_leaf': 0.06834236373275092, 'max_features': 0.5571085209368744}. Best is trial 156 with value: 0.860262530255716.[0m
[32m[I 2022-04-13 11:43:56,653][0m Trial 168 finished with value: 0.7865929809567938 and parameters: {'splitter': 'random', 'min_samples_split': 0.2668367809397225, 'min_samples_leaf': 0.0010321426971515934, 'min_weight_fraction_leaf': 0.07389982141575427, 'max_features': 0.4702362441799773}. Best is trial 156 with value: 0.860262530255716.[0m
[32m[I 2022-04-13 11:43:56,687][0m Trial 169 finished with value: 0.8495779719052834 and parameters: {'splitter': 'random', 'min_samples_split': 0.2976977868790747, 'min_samples_leaf': 0.01978177932356566, 'min_weight_fraction_leaf': 0.06873279749587387, 'max_features': 0.5337635869900925}. Best is trial 156 with value: 0.860262530255716.[0m
[32m[I 2022-04-13 11:43:56,721][0m Trial 170 finished with value: 0.7865929809567938 and parameters: {'splitter': 'random', 'min_samples_split': 0.264900014975578, 'min_samples_leaf': 0.001451404253964684, 'min_weight_fraction_leaf': 0.06973800045803057, 'max_features': 0.4893147549305603}. Best is trial 156 with value: 0.860262530255716.[0m
[32m[I 2022-04-13 11:43:56,755][0m Trial 171 finished with value: 0.8515949699867061 and parameters: {'splitter': 'random', 'min_samples_split': 0.3147873649871587, 'min_samples_leaf': 0.014944684021008795, 'min_weight_fraction_leaf': 0.06171220398158347, 'max_features': 0.553433010173125}. Best is trial 156 with value: 0.860262530255716.[0m
[32m[I 2022-04-13 11:43:56,789][0m Trial 172 finished with value: 0.860262530255716 and parameters: {'splitter': 'random', 'min_samples_split': 0.27011373291618224, 'min_samples_leaf': 0.01299017189361908, 'min_weight_fraction_leaf': 0.07303312678677457, 'max_features': 0.5552843023053801}. Best is trial 156 with value: 0.860262530255716.[0m
[32m[I 2022-04-13 11:43:56,823][0m Trial 173 finished with value: 0.8537871744804019 and parameters: {'splitter': 'random', 'min_samples_split': 0.2890013374708027, 'min_samples_leaf': 0.012660274067721695, 'min_weight_fraction_leaf': 0.07711665402827349, 'max_features': 0.5220643690530203}. Best is trial 156 with value: 0.860262530255716.[0m
[32m[I 2022-04-13 11:43:56,857][0m Trial 174 finished with value: 0.8536735077998788 and parameters: {'splitter': 'random', 'min_samples_split': 0.2665554924235109, 'min_samples_leaf': 0.012503339129496978, 'min_weight_fraction_leaf': 0.09095639569095963, 'max_features': 0.546085524148563}. Best is trial 156 with value: 0.860262530255716.[0m
[32m[I 2022-04-13 11:43:56,893][0m Trial 175 finished with value: 0.7932323371363277 and parameters: {'splitter': 'random', 'min_samples_split': 0.2572759322973715, 'min_samples_leaf': 0.035640393527234825, 'min_weight_fraction_leaf': 0.07444796906318524, 'max_features': 0.4985662422575028}. Best is trial 156 with value: 0.860262530255716.[0m
[32m[I 2022-04-13 11:43:56,929][0m Trial 176 finished with value: 0.860262530255716 and parameters: {'splitter': 'random', 'min_samples_split': 0.2696234072777008, 'min_samples_leaf': 0.017558652674769068, 'min_weight_fraction_leaf': 0.0615384615254193, 'max_features': 0.527071077516635}. Best is trial 156 with value: 0.860262530255716.[0m
[32m[I 2022-04-13 11:43:56,965][0m Trial 177 finished with value: 0.8495779719052834 and parameters: {'splitter': 'random', 'min_samples_split': 0.29003567292045884, 'min_samples_leaf': 0.01687816172289838, 'min_weight_fraction_leaf': 0.06474129029417287, 'max_features': 0.5232233307180901}. Best is trial 156 with value: 0.860262530255716.[0m
[32m[I 2022-04-13 11:43:57,056][0m Trial 178 finished with value: 0.8536735077998788 and parameters: {'splitter': 'random', 'min_samples_split': 0.27306905578798657, 'min_samples_leaf': 0.012692909087247666, 'min_weight_fraction_leaf': 0.08721703431682046, 'max_features': 0.5469672118250097}. Best is trial 156 with value: 0.860262530255716.[0m
[32m[I 2022-04-13 11:43:57,211][0m Trial 179 finished with value: 0.7865929809567938 and parameters: {'splitter': 'random', 'min_samples_split': 0.28508524503280236, 'min_samples_leaf': 0.022782936899309707, 'min_weight_fraction_leaf': 0.07228345363709746, 'max_features': 0.48105606767085296}. Best is trial 156 with value: 0.860262530255716.[0m
[32m[I 2022-04-13 11:43:57,304][0m Trial 180 finished with value: 0.855608859465337 and parameters: {'splitter': 'random', 'min_samples_split': 0.2597654548850529, 'min_samples_leaf': 0.004899957947788082, 'min_weight_fraction_leaf': 0.06088048621711385, 'max_features': 0.5597944750977261}. Best is trial 156 with value: 0.860262530255716.[0m
[32m[I 2022-04-13 11:43:57,382][0m Trial 181 finished with value: 0.855608859465337 and parameters: {'splitter': 'random', 'min_samples_split': 0.2584451499659822, 'min_samples_leaf': 0.0016271570480655122, 'min_weight_fraction_leaf': 0.0638557460020974, 'max_features': 0.5576766346927876}. Best is trial 156 with value: 0.860262530255716.[0m
[32m[I 2022-04-13 11:43:57,462][0m Trial 182 finished with value: 0.860262530255716 and parameters: {'splitter': 'random', 'min_samples_split': 0.270720061673996, 'min_samples_leaf': 0.0029096089670204352, 'min_weight_fraction_leaf': 0.05869676458006827, 'max_features': 0.5602044502327055}. Best is trial 156 with value: 0.860262530255716.[0m
[32m[I 2022-04-13 11:43:57,555][0m Trial 183 finished with value: 0.8536735077998788 and parameters: {'splitter': 'random', 'min_samples_split': 0.27059009181453375, 'min_samples_leaf': 0.0017463020561646614, 'min_weight_fraction_leaf': 0.0804429109402643, 'max_features': 0.5320176521932696}. Best is trial 156 with value: 0.860262530255716.[0m
[32m[I 2022-04-13 11:43:57,648][0m Trial 184 finished with value: 0.8495779719052834 and parameters: {'splitter': 'random', 'min_samples_split': 0.29758325252361856, 'min_samples_leaf': 0.012231453226258224, 'min_weight_fraction_leaf': 0.06106595431586232, 'max_features': 0.5074284325967361}. Best is trial 156 with value: 0.860262530255716.[0m
[32m[I 2022-04-13 11:43:57,717][0m Trial 185 finished with value: 0.6785236221529576 and parameters: {'splitter': 'random', 'min_samples_split': 0.2808417564679713, 'min_samples_leaf': 0.022108804440202436, 'min_weight_fraction_leaf': 0.09249632994671847, 'max_features': 0.12740773437533875}. Best is trial 156 with value: 0.860262530255716.[0m
[32m[I 2022-04-13 11:43:57,774][0m Trial 186 finished with value: 0.860262530255716 and parameters: {'splitter': 'random', 'min_samples_split': 0.2680087301919851, 'min_samples_leaf': 0.010670030588360574, 'min_weight_fraction_leaf': 0.04820728783960358, 'max_features': 0.561422128372779}. Best is trial 156 with value: 0.860262530255716.[0m
[32m[I 2022-04-13 11:43:57,817][0m Trial 187 finished with value: 0.6188081862944745 and parameters: {'splitter': 'random', 'min_samples_split': 0.273683898028078, 'min_samples_leaf': 0.2701935153479742, 'min_weight_fraction_leaf': 0.334250407974145, 'max_features': 0.5378706136418727}. Best is trial 156 with value: 0.860262530255716.[0m
[32m[I 2022-04-13 11:43:57,854][0m Trial 188 finished with value: 0.8537871744804019 and parameters: {'splitter': 'random', 'min_samples_split': 0.28520689313535674, 'min_samples_leaf': 0.037351782744416334, 'min_weight_fraction_leaf': 0.0502437015361833, 'max_features': 0.5680237322477012}. Best is trial 156 with value: 0.860262530255716.[0m
