No protocol specified
[32m[I 2022-04-15 11:10:35,692][0m A new study created in memory with name: no-name-b9f94a40-7fe1-4c77-8cb5-5c4aa2a43483[0m
2022-04-15 11:10:35.724916: E tensorflow/stream_executor/cuda/cuda_driver.cc:271] failed call to cuInit: CUDA_ERROR_NO_DEVICE: no CUDA-capable device is detected
2022-04-15 11:10:35.725004: I tensorflow/stream_executor/cuda/cuda_diagnostics.cc:156] kernel driver does not appear to be running on this host (nbcwdc01): /proc/driver/nvidia/version does not exist
2022-04-15 11:10:35.725569: I tensorflow/core/platform/cpu_feature_guard.cc:151] This TensorFlow binary is optimized with oneAPI Deep Neural Network Library (oneDNN) to use the following CPU instructions in performance-critical operations:  AVX2 AVX512F FMA
To enable them in other operations, rebuild TensorFlow with the appropriate compiler flags.
WARNING:tensorflow:Setting parallel_iterations > 1 has no effect when executing eagerly. Consider calling map_fn with tf.function to execute fn in parallel.
[32m[I 2022-04-15 11:15:37,007][0m Trial 0 finished with value: 0.5738555404343868 and parameters: {'n_hidden': 256, 'mixture_components': 2, 'use_sparse_layer': True, 'use_sparse_loss': False, 'use_batchnorm': True, 'use_dropout': True, 'dropout': 0.8169916476234615, 'mlp_size_1': 5, 'mlp_size_2': 0, 'mlp_size_3': 0, 'kernel': 'Normal', 'loss_name': 'NLLLoss'}. Best is trial 0 with value: 0.5738555404343868.[0m
[32m[I 2022-04-15 11:16:53,369][0m Trial 1 finished with value: -0.1985988039355128 and parameters: {'n_hidden': 128, 'mixture_components': 2, 'use_sparse_layer': False, 'use_batchnorm': True, 'use_dropout': True, 'dropout': 0.9636450721813801, 'mlp_size_1': 3, 'mlp_size_2': 0, 'mlp_size_3': 1, 'kernel': 'Weibull', 'loss_name': 'AlternativeNLLLoss'}. Best is trial 0 with value: 0.5738555404343868.[0m
[32m[I 2022-04-15 11:18:40,093][0m Trial 2 finished with value: 0.8417056585827607 and parameters: {'n_hidden': 128, 'mixture_components': 10, 'use_sparse_layer': True, 'use_sparse_loss': True, 'lmbd': 6.984979578445652e-05, 'use_batchnorm': False, 'use_dropout': False, 'mlp_size_1': 1, 'mlp_size_2': 1, 'mlp_size_3': 0, 'kernel': 'Gamma', 'loss_name': 'AlternativeNLLLoss'}. Best is trial 2 with value: 0.8417056585827607.[0m
[32m[I 2022-04-15 11:22:38,263][0m Trial 3 finished with value: 0.8400011541324173 and parameters: {'n_hidden': 512, 'mixture_components': 2, 'use_sparse_layer': False, 'use_batchnorm': True, 'use_dropout': True, 'dropout': 0.5166455259733161, 'mlp_size_1': 4, 'mlp_size_2': 2, 'mlp_size_3': 0, 'kernel': 'Logistic', 'loss_name': 'NLLLoss'}. Best is trial 2 with value: 0.8417056585827607.[0m
[32m[I 2022-04-15 11:23:54,263][0m Trial 4 finished with value: 0.8414693940307085 and parameters: {'n_hidden': 1024, 'mixture_components': 10, 'use_sparse_layer': False, 'use_batchnorm': False, 'use_dropout': False, 'mlp_size_1': 1, 'mlp_size_2': 3, 'mlp_size_3': 1, 'kernel': 'Gamma', 'loss_name': 'CensoredNLLLoss'}. Best is trial 2 with value: 0.8417056585827607.[0m
[32m[I 2022-04-15 11:28:56,726][0m Trial 5 finished with value: 0.8515619558556097 and parameters: {'n_hidden': 32, 'mixture_components': 4, 'use_sparse_layer': True, 'use_sparse_loss': True, 'lmbd': 0.0007187769271237957, 'use_batchnorm': True, 'use_dropout': False, 'mlp_size_1': 0, 'mlp_size_2': 2, 'mlp_size_3': 0, 'kernel': 'Exponential', 'loss_name': 'CensoredNLLLoss'}. Best is trial 5 with value: 0.8515619558556097.[0m
[32m[I 2022-04-15 11:31:11,092][0m Trial 6 finished with value: 0.4382952254290478 and parameters: {'n_hidden': 32, 'mixture_components': 6, 'use_sparse_layer': False, 'use_batchnorm': True, 'use_dropout': False, 'mlp_size_1': 1, 'mlp_size_2': 1, 'mlp_size_3': 0, 'kernel': 'Gumbel', 'loss_name': 'AlternativeNLLLoss'}. Best is trial 5 with value: 0.8515619558556097.[0m
[32m[I 2022-04-15 11:34:56,666][0m Trial 7 finished with value: 0.736078363580274 and parameters: {'n_hidden': 2048, 'mixture_components': 8, 'use_sparse_layer': True, 'use_sparse_loss': True, 'lmbd': 0.01253514905625624, 'use_batchnorm': True, 'use_dropout': True, 'dropout': 0.04232801487138649, 'mlp_size_1': 1, 'mlp_size_2': 3, 'mlp_size_3': 1, 'kernel': 'LogNormal', 'loss_name': 'NLLLoss'}. Best is trial 5 with value: 0.8515619558556097.[0m
[32m[I 2022-04-15 11:36:41,859][0m Trial 8 finished with value: 0.8396218628444834 and parameters: {'n_hidden': 64, 'mixture_components': 1, 'use_sparse_layer': True, 'use_sparse_loss': False, 'use_batchnorm': False, 'use_dropout': False, 'mlp_size_1': 2, 'mlp_size_2': 1, 'mlp_size_3': 0, 'kernel': 'Gamma', 'loss_name': 'NLLLoss'}. Best is trial 5 with value: 0.8515619558556097.[0m
[32m[I 2022-04-15 11:38:32,645][0m Trial 9 finished with value: 0.6539142669626625 and parameters: {'n_hidden': 2048, 'mixture_components': 9, 'use_sparse_layer': True, 'use_sparse_loss': False, 'use_batchnorm': False, 'use_dropout': True, 'dropout': 0.5859478826174317, 'mlp_size_1': 6, 'mlp_size_2': 0, 'mlp_size_3': 0, 'kernel': 'LogNormal', 'loss_name': 'CensoredNLLLoss'}. Best is trial 5 with value: 0.8515619558556097.[0m
[32m[I 2022-04-15 11:43:29,261][0m Trial 10 finished with value: 0.8560639978419834 and parameters: {'n_hidden': 32, 'mixture_components': 5, 'use_sparse_layer': True, 'use_sparse_loss': True, 'lmbd': 3.4707643841168506e-06, 'use_batchnorm': True, 'use_dropout': False, 'mlp_size_1': 0, 'mlp_size_2': 2, 'mlp_size_3': 0, 'kernel': 'Exponential', 'loss_name': 'CensoredNLLLoss'}. Best is trial 10 with value: 0.8560639978419834.[0m
[32m[I 2022-04-15 11:49:14,102][0m Trial 11 finished with value: 0.8514454832724144 and parameters: {'n_hidden': 32, 'mixture_components': 5, 'use_sparse_layer': True, 'use_sparse_loss': True, 'lmbd': 1.515747057568643e-06, 'use_batchnorm': True, 'use_dropout': False, 'mlp_size_1': 0, 'mlp_size_2': 2, 'mlp_size_3': 0, 'kernel': 'Exponential', 'loss_name': 'CensoredNLLLoss'}. Best is trial 10 with value: 0.8560639978419834.[0m
[32m[I 2022-04-15 11:54:34,004][0m Trial 12 finished with value: 0.859384652803959 and parameters: {'n_hidden': 32, 'mixture_components': 5, 'use_sparse_layer': True, 'use_sparse_loss': True, 'lmbd': 0.0004811981994918106, 'use_batchnorm': True, 'use_dropout': False, 'mlp_size_1': 0, 'mlp_size_2': 2, 'mlp_size_3': 0, 'kernel': 'Exponential', 'loss_name': 'CensoredNLLLoss'}. Best is trial 12 with value: 0.859384652803959.[0m
[32m[I 2022-04-15 11:59:23,994][0m Trial 13 finished with value: 0.8504382397664877 and parameters: {'n_hidden': 32, 'mixture_components': 7, 'use_sparse_layer': True, 'use_sparse_loss': True, 'lmbd': 2.649761404092958e-05, 'use_batchnorm': True, 'use_dropout': False, 'mlp_size_1': 0, 'mlp_size_2': 2, 'mlp_size_3': 0, 'kernel': 'Exponential', 'loss_name': 'CensoredNLLLoss'}. Best is trial 12 with value: 0.859384652803959.[0m
[32m[I 2022-04-15 12:02:23,920][0m Trial 14 finished with value: 0.8369931206528787 and parameters: {'n_hidden': 32, 'mixture_components': 4, 'use_sparse_layer': True, 'use_sparse_loss': True, 'lmbd': 0.002381833993516663, 'use_batchnorm': True, 'use_dropout': False, 'mlp_size_1': 0, 'mlp_size_2': 2, 'mlp_size_3': 0, 'kernel': 'LogLogistic', 'loss_name': 'CensoredNLLLoss'}. Best is trial 12 with value: 0.859384652803959.[0m
[32m[I 2022-04-15 12:05:43,862][0m Trial 15 finished with value: 0.8448777382176555 and parameters: {'n_hidden': 64, 'mixture_components': 5, 'use_sparse_layer': True, 'use_sparse_loss': True, 'lmbd': 1.012560302818929e-06, 'use_batchnorm': True, 'use_dropout': False, 'mlp_size_1': 0, 'mlp_size_2': 3, 'mlp_size_3': 0, 'kernel': 'Exponential', 'loss_name': 'CensoredNLLLoss'}. Best is trial 12 with value: 0.859384652803959.[0m
[32m[I 2022-04-15 12:09:44,056][0m Trial 16 finished with value: 0.8185566190343462 and parameters: {'n_hidden': 256, 'mixture_components': 7, 'use_sparse_layer': True, 'use_sparse_loss': True, 'lmbd': 3.5476153826118534e-05, 'use_batchnorm': True, 'use_dropout': False, 'mlp_size_1': 2, 'mlp_size_2': 1, 'mlp_size_3': 2, 'kernel': 'Exponential', 'loss_name': 'CensoredNLLLoss'}. Best is trial 12 with value: 0.859384652803959.[0m
[32m[I 2022-04-15 12:14:14,730][0m Trial 17 finished with value: 0.8233878039620963 and parameters: {'n_hidden': 512, 'mixture_components': 4, 'use_sparse_layer': True, 'use_sparse_loss': True, 'lmbd': 0.059612466905330175, 'use_batchnorm': True, 'use_dropout': False, 'mlp_size_1': 3, 'mlp_size_2': 3, 'mlp_size_3': 0, 'kernel': 'Normal', 'loss_name': 'CensoredNLLLoss'}. Best is trial 12 with value: 0.859384652803959.[0m
[32m[I 2022-04-15 12:15:38,649][0m Trial 18 finished with value: 0.8207985666604829 and parameters: {'n_hidden': 1024, 'mixture_components': 6, 'use_sparse_layer': False, 'use_batchnorm': False, 'use_dropout': False, 'mlp_size_1': 2, 'mlp_size_2': 5, 'mlp_size_3': 0, 'kernel': 'LogLogistic', 'loss_name': 'CensoredNLLLoss'}. Best is trial 12 with value: 0.859384652803959.[0m
[32m[I 2022-04-15 12:18:26,698][0m Trial 19 finished with value: 0.6456055513000868 and parameters: {'n_hidden': 32, 'mixture_components': 3, 'use_sparse_layer': True, 'use_sparse_loss': True, 'lmbd': 0.0002486053219296325, 'use_batchnorm': True, 'use_dropout': False, 'mlp_size_1': 0, 'mlp_size_2': 1, 'mlp_size_3': 1, 'kernel': 'Gumbel', 'loss_name': 'AlternativeNLLLoss'}. Best is trial 12 with value: 0.859384652803959.[0m
[32m[I 2022-04-15 12:22:05,987][0m Trial 20 finished with value: 0.853320752202397 and parameters: {'n_hidden': 32, 'mixture_components': 7, 'use_sparse_layer': True, 'use_sparse_loss': False, 'use_batchnorm': True, 'use_dropout': False, 'mlp_size_1': 0, 'mlp_size_2': 2, 'mlp_size_3': 0, 'kernel': 'Weibull', 'loss_name': 'CensoredNLLLoss'}. Best is trial 12 with value: 0.859384652803959.[0m
[32m[I 2022-04-15 12:26:14,755][0m Trial 21 finished with value: 0.843800910064261 and parameters: {'n_hidden': 32, 'mixture_components': 7, 'use_sparse_layer': True, 'use_sparse_loss': False, 'use_batchnorm': True, 'use_dropout': False, 'mlp_size_1': 0, 'mlp_size_2': 2, 'mlp_size_3': 0, 'kernel': 'Weibull', 'loss_name': 'CensoredNLLLoss'}. Best is trial 12 with value: 0.859384652803959.[0m
[32m[I 2022-04-15 12:29:58,324][0m Trial 22 finished with value: 0.8452917169021683 and parameters: {'n_hidden': 32, 'mixture_components': 6, 'use_sparse_layer': True, 'use_sparse_loss': False, 'use_batchnorm': True, 'use_dropout': False, 'mlp_size_1': 0, 'mlp_size_2': 2, 'mlp_size_3': 0, 'kernel': 'Weibull', 'loss_name': 'CensoredNLLLoss'}. Best is trial 12 with value: 0.859384652803959.[0m
[32m[I 2022-04-15 12:32:50,871][0m Trial 23 finished with value: 0.8410654377095211 and parameters: {'n_hidden': 32, 'mixture_components': 8, 'use_sparse_layer': True, 'use_sparse_loss': False, 'use_batchnorm': True, 'use_dropout': False, 'mlp_size_1': 0, 'mlp_size_2': 2, 'mlp_size_3': 0, 'kernel': 'Logistic', 'loss_name': 'CensoredNLLLoss'}. Best is trial 12 with value: 0.859384652803959.[0m
[32m[I 2022-04-15 12:36:30,065][0m Trial 24 finished with value: 0.8469244398485051 and parameters: {'n_hidden': 32, 'mixture_components': 5, 'use_sparse_layer': True, 'use_sparse_loss': False, 'use_batchnorm': True, 'use_dropout': False, 'mlp_size_1': 0, 'mlp_size_2': 2, 'mlp_size_3': 0, 'kernel': 'Weibull', 'loss_name': 'CensoredNLLLoss'}. Best is trial 12 with value: 0.859384652803959.[0m
[32m[I 2022-04-15 12:41:25,013][0m Trial 25 finished with value: 0.8465653536853479 and parameters: {'n_hidden': 32, 'mixture_components': 8, 'use_sparse_layer': True, 'use_sparse_loss': True, 'lmbd': 1.0804044180434656e-05, 'use_batchnorm': True, 'use_dropout': False, 'mlp_size_1': 0, 'mlp_size_2': 1, 'mlp_size_3': 1, 'kernel': 'Exponential', 'loss_name': 'CensoredNLLLoss'}. Best is trial 12 with value: 0.859384652803959.[0m
[32m[I 2022-04-15 12:43:22,750][0m Trial 26 finished with value: 0.8212042792799286 and parameters: {'n_hidden': 128, 'mixture_components': 4, 'use_sparse_layer': False, 'use_batchnorm': False, 'use_dropout': True, 'dropout': 0.052924536235652964, 'mlp_size_1': 1, 'mlp_size_2': 3, 'mlp_size_3': 0, 'kernel': 'Exponential', 'loss_name': 'CensoredNLLLoss'}. Best is trial 12 with value: 0.859384652803959.[0m
[32m[I 2022-04-15 12:46:34,605][0m Trial 27 finished with value: 0.8142162221581574 and parameters: {'n_hidden': 1024, 'mixture_components': 3, 'use_sparse_layer': True, 'use_sparse_loss': False, 'use_batchnorm': True, 'use_dropout': False, 'mlp_size_1': 7, 'mlp_size_2': 0, 'mlp_size_3': 0, 'kernel': 'Weibull', 'loss_name': 'CensoredNLLLoss'}. Best is trial 12 with value: 0.859384652803959.[0m
[32m[I 2022-04-15 12:50:02,179][0m Trial 28 finished with value: 0.8344439381859322 and parameters: {'n_hidden': 64, 'mixture_components': 6, 'use_sparse_layer': True, 'use_sparse_loss': True, 'lmbd': 0.002792270326451285, 'use_batchnorm': True, 'use_dropout': False, 'mlp_size_1': 1, 'mlp_size_2': 2, 'mlp_size_3': 0, 'kernel': 'Exponential', 'loss_name': 'NLLLoss'}. Best is trial 12 with value: 0.859384652803959.[0m
[32m[I 2022-04-15 12:55:15,276][0m Trial 29 finished with value: 0.8352923957936724 and parameters: {'n_hidden': 256, 'mixture_components': 7, 'use_sparse_layer': True, 'use_sparse_loss': False, 'use_batchnorm': True, 'use_dropout': True, 'dropout': 0.2191080562537775, 'mlp_size_1': 1, 'mlp_size_2': 4, 'mlp_size_3': 0, 'kernel': 'Normal', 'loss_name': 'AlternativeNLLLoss'}. Best is trial 12 with value: 0.859384652803959.[0m
[32m[I 2022-04-15 13:00:51,920][0m Trial 30 finished with value: 0.8393837893540542 and parameters: {'n_hidden': 2048, 'mixture_components': 3, 'use_sparse_layer': True, 'use_sparse_loss': True, 'lmbd': 4.6031628304679386e-06, 'use_batchnorm': True, 'use_dropout': False, 'mlp_size_1': 8, 'mlp_size_2': 0, 'mlp_size_3': 0, 'kernel': 'Logistic', 'loss_name': 'NLLLoss'}. Best is trial 12 with value: 0.859384652803959.[0m
[32m[I 2022-04-15 13:07:45,370][0m Trial 31 finished with value: 0.8566085653455277 and parameters: {'n_hidden': 32, 'mixture_components': 4, 'use_sparse_layer': True, 'use_sparse_loss': True, 'lmbd': 0.0005343053870985149, 'use_batchnorm': True, 'use_dropout': False, 'mlp_size_1': 0, 'mlp_size_2': 2, 'mlp_size_3': 0, 'kernel': 'Exponential', 'loss_name': 'CensoredNLLLoss'}. Best is trial 12 with value: 0.859384652803959.[0m
[32m[I 2022-04-15 13:12:49,500][0m Trial 32 finished with value: 0.8598946548158141 and parameters: {'n_hidden': 32, 'mixture_components': 5, 'use_sparse_layer': True, 'use_sparse_loss': True, 'lmbd': 0.0002320812793313708, 'use_batchnorm': True, 'use_dropout': False, 'mlp_size_1': 0, 'mlp_size_2': 2, 'mlp_size_3': 0, 'kernel': 'Exponential', 'loss_name': 'CensoredNLLLoss'}. Best is trial 32 with value: 0.8598946548158141.[0m
[32m[I 2022-04-15 13:17:53,684][0m Trial 33 finished with value: 0.849780519081435 and parameters: {'n_hidden': 32, 'mixture_components': 5, 'use_sparse_layer': True, 'use_sparse_loss': True, 'lmbd': 0.0002680113360164384, 'use_batchnorm': True, 'use_dropout': False, 'mlp_size_1': 0, 'mlp_size_2': 2, 'mlp_size_3': 0, 'kernel': 'Exponential', 'loss_name': 'CensoredNLLLoss'}. Best is trial 32 with value: 0.8598946548158141.[0m
[32m[I 2022-04-15 13:20:35,798][0m Trial 34 finished with value: 0.8290733748653605 and parameters: {'n_hidden': 512, 'mixture_components': 4, 'use_sparse_layer': False, 'use_batchnorm': True, 'use_dropout': True, 'dropout': 0.3075609085490951, 'mlp_size_1': 3, 'mlp_size_2': 2, 'mlp_size_3': 0, 'kernel': 'Exponential', 'loss_name': 'AlternativeNLLLoss'}. Best is trial 32 with value: 0.8598946548158141.[0m
[32m[I 2022-04-15 13:23:53,710][0m Trial 35 finished with value: 0.8270187309837935 and parameters: {'n_hidden': 128, 'mixture_components': 3, 'use_sparse_layer': True, 'use_sparse_loss': True, 'lmbd': 0.0009908760711980252, 'use_batchnorm': True, 'use_dropout': False, 'mlp_size_1': 1, 'mlp_size_2': 2, 'mlp_size_3': 1, 'kernel': 'Exponential', 'loss_name': 'CensoredNLLLoss'}. Best is trial 32 with value: 0.8598946548158141.[0m
[32m[I 2022-04-15 13:25:34,652][0m Trial 36 finished with value: 0.8381859320668532 and parameters: {'n_hidden': 256, 'mixture_components': 2, 'use_sparse_layer': True, 'use_sparse_loss': True, 'lmbd': 9.456017359561415e-05, 'use_batchnorm': False, 'use_dropout': False, 'mlp_size_1': 4, 'mlp_size_2': 1, 'mlp_size_3': 0, 'kernel': 'Exponential', 'loss_name': 'CensoredNLLLoss'}. Best is trial 32 with value: 0.8598946548158141.[0m
[32m[I 2022-04-15 13:30:07,707][0m Trial 37 finished with value: 0.8494241050628297 and parameters: {'n_hidden': 32, 'mixture_components': 5, 'use_sparse_layer': False, 'use_batchnorm': True, 'use_dropout': False, 'mlp_size_1': 0, 'mlp_size_2': 1, 'mlp_size_3': 0, 'kernel': 'Exponential', 'loss_name': 'CensoredNLLLoss'}. Best is trial 32 with value: 0.8598946548158141.[0m
[32m[I 2022-04-15 13:31:16,784][0m Trial 38 finished with value: -0.5 and parameters: {'n_hidden': 32, 'mixture_components': 4, 'use_sparse_layer': True, 'use_sparse_loss': True, 'lmbd': 0.0006996355433496754, 'use_batchnorm': True, 'use_dropout': True, 'dropout': 0.7354897792583555, 'mlp_size_1': 0, 'mlp_size_2': 2, 'mlp_size_3': 0, 'kernel': 'Gumbel', 'loss_name': 'AlternativeNLLLoss'}. Best is trial 32 with value: 0.8598946548158141.[0m
[32m[I 2022-04-15 13:32:33,219][0m Trial 39 finished with value: 0.8403263863424788 and parameters: {'n_hidden': 512, 'mixture_components': 6, 'use_sparse_layer': False, 'use_batchnorm': False, 'use_dropout': False, 'mlp_size_1': 2, 'mlp_size_2': 3, 'mlp_size_3': 1, 'kernel': 'Gamma', 'loss_name': 'NLLLoss'}. Best is trial 32 with value: 0.8598946548158141.[0m
[32m[I 2022-04-15 13:38:31,519][0m Trial 40 finished with value: 0.7077439944099584 and parameters: {'n_hidden': 128, 'mixture_components': 2, 'use_sparse_layer': True, 'use_sparse_loss': True, 'lmbd': 0.0029460588468104266, 'use_batchnorm': True, 'use_dropout': False, 'mlp_size_1': 1, 'mlp_size_2': 2, 'mlp_size_3': 0, 'kernel': 'LogNormal', 'loss_name': 'CensoredNLLLoss'}. Best is trial 32 with value: 0.8598946548158141.[0m
[32m[I 2022-04-15 13:41:48,544][0m Trial 41 finished with value: 0.8463998535543041 and parameters: {'n_hidden': 32, 'mixture_components': 5, 'use_sparse_layer': True, 'use_sparse_loss': True, 'lmbd': 0.00012207297498064896, 'use_batchnorm': True, 'use_dropout': False, 'mlp_size_1': 0, 'mlp_size_2': 2, 'mlp_size_3': 0, 'kernel': 'Weibull', 'loss_name': 'CensoredNLLLoss'}. Best is trial 32 with value: 0.8598946548158141.[0m
[32m[I 2022-04-15 13:47:22,796][0m Trial 42 finished with value: 0.860422919988593 and parameters: {'n_hidden': 32, 'mixture_components': 6, 'use_sparse_layer': True, 'use_sparse_loss': True, 'lmbd': 0.011079801161801319, 'use_batchnorm': True, 'use_dropout': False, 'mlp_size_1': 0, 'mlp_size_2': 2, 'mlp_size_3': 0, 'kernel': 'Exponential', 'loss_name': 'CensoredNLLLoss'}. Best is trial 42 with value: 0.860422919988593.[0m
[32m[I 2022-04-15 13:53:39,537][0m Trial 43 finished with value: 0.856138938843111 and parameters: {'n_hidden': 32, 'mixture_components': 6, 'use_sparse_layer': True, 'use_sparse_loss': True, 'lmbd': 0.013124276328546325, 'use_batchnorm': True, 'use_dropout': False, 'mlp_size_1': 0, 'mlp_size_2': 2, 'mlp_size_3': 0, 'kernel': 'Exponential', 'loss_name': 'CensoredNLLLoss'}. Best is trial 42 with value: 0.860422919988593.[0m
[32m[I 2022-04-15 13:59:23,351][0m Trial 44 finished with value: 0.8508707138939346 and parameters: {'n_hidden': 32, 'mixture_components': 6, 'use_sparse_layer': True, 'use_sparse_loss': True, 'lmbd': 0.03176936891777446, 'use_batchnorm': True, 'use_dropout': False, 'mlp_size_1': 0, 'mlp_size_2': 2, 'mlp_size_3': 0, 'kernel': 'Exponential', 'loss_name': 'CensoredNLLLoss'}. Best is trial 42 with value: 0.860422919988593.[0m
[32m[I 2022-04-15 14:05:21,160][0m Trial 45 finished with value: 0.8524554491833737 and parameters: {'n_hidden': 32, 'mixture_components': 6, 'use_sparse_layer': True, 'use_sparse_loss': True, 'lmbd': 0.009459143416891337, 'use_batchnorm': True, 'use_dropout': False, 'mlp_size_1': 0, 'mlp_size_2': 2, 'mlp_size_3': 0, 'kernel': 'Exponential', 'loss_name': 'CensoredNLLLoss'}. Best is trial 42 with value: 0.860422919988593.[0m
[32m[I 2022-04-15 14:09:37,140][0m Trial 46 finished with value: 0.8034688297859569 and parameters: {'n_hidden': 2048, 'mixture_components': 5, 'use_sparse_layer': True, 'use_sparse_loss': True, 'lmbd': 0.00910358509567979, 'use_batchnorm': True, 'use_dropout': False, 'mlp_size_1': 1, 'mlp_size_2': 7, 'mlp_size_3': 0, 'kernel': 'LogLogistic', 'loss_name': 'CensoredNLLLoss'}. Best is trial 42 with value: 0.860422919988593.[0m
[32m[I 2022-04-15 14:11:03,809][0m Trial 47 finished with value: 0.8159643065799159 and parameters: {'n_hidden': 1024, 'mixture_components': 4, 'use_sparse_layer': True, 'use_sparse_loss': True, 'lmbd': 0.022356911128397983, 'use_batchnorm': False, 'use_dropout': True, 'dropout': 0.2907136702517814, 'mlp_size_1': 5, 'mlp_size_2': 2, 'mlp_size_3': 0, 'kernel': 'Exponential', 'loss_name': 'NLLLoss'}. Best is trial 42 with value: 0.860422919988593.[0m
[32m[I 2022-04-15 14:15:47,082][0m Trial 48 finished with value: 0.8497244529927144 and parameters: {'n_hidden': 32, 'mixture_components': 8, 'use_sparse_layer': True, 'use_sparse_loss': True, 'lmbd': 0.001417153009238178, 'use_batchnorm': True, 'use_dropout': False, 'mlp_size_1': 0, 'mlp_size_2': 2, 'mlp_size_3': 0, 'kernel': 'Normal', 'loss_name': 'CensoredNLLLoss'}. Best is trial 42 with value: 0.860422919988593.[0m
[32m[I 2022-04-15 14:19:55,729][0m Trial 49 finished with value: 0.7456547948454059 and parameters: {'n_hidden': 64, 'mixture_components': 7, 'use_sparse_layer': True, 'use_sparse_loss': True, 'lmbd': 0.005117637456168207, 'use_batchnorm': True, 'use_dropout': False, 'mlp_size_1': 0, 'mlp_size_2': 3, 'mlp_size_3': 0, 'kernel': 'Gamma', 'loss_name': 'CensoredNLLLoss'}. Best is trial 42 with value: 0.860422919988593.[0m
