[32m[I 2022-04-14 14:59:02,256][0m Trial 763 finished with value: 0.5 and parameters: {'loss': 'coxph', 'learning_rate': 0.004736985155616071, 'n_estimators': 404, 'criterion': 'absolute_error', 'min_samples_split': 2, 'min_samples_leaf': 1, 'min_weight_fraction_leaf': 0.0493073261646062, 'min_impurity_decrease': 0.39671831850970996, 'max_features': 0.9001602923711121, 'subsample': 0.7845925835047345, 'dropout_rate': 0.4714523311338101, 'ccp_alpha': 0.08668411667090878}. Best is trial 677 with value: 0.7600100187343619.[0m
[32m[I 2022-04-14 14:59:13,418][0m Trial 764 finished with value: 0.5 and parameters: {'loss': 'coxph', 'learning_rate': 0.006840002353903689, 'n_estimators': 332, 'criterion': 'friedman_mse', 'min_samples_split': 2, 'min_samples_leaf': 1, 'min_weight_fraction_leaf': 0.393084428866981, 'min_impurity_decrease': 0.4649854953760931, 'max_features': 0.9440934917575035, 'subsample': 0.899469799697361, 'dropout_rate': 0.4454471257792562, 'ccp_alpha': 0.3245614822252324}. Best is trial 677 with value: 0.7600100187343619.[0m
[32m[I 2022-04-14 14:59:26,215][0m Trial 765 finished with value: 0.6952257894023731 and parameters: {'loss': 'coxph', 'learning_rate': 0.003574279883615969, 'n_estimators': 360, 'criterion': 'friedman_mse', 'min_samples_split': 2, 'min_samples_leaf': 2, 'min_weight_fraction_leaf': 0.03377661439538704, 'min_impurity_decrease': 0.4226624101529953, 'max_features': 0.9674111793364473, 'subsample': 0.854675050412279, 'dropout_rate': 0.4900961205176525, 'ccp_alpha': 0.18919147654190663}. Best is trial 677 with value: 0.7600100187343619.[0m
[32m[I 2022-04-14 14:59:43,996][0m Trial 766 finished with value: 0.7444244175143415 and parameters: {'loss': 'coxph', 'learning_rate': 0.005142304487702202, 'n_estimators': 443, 'criterion': 'friedman_mse', 'min_samples_split': 2, 'min_samples_leaf': 1, 'min_weight_fraction_leaf': 0.05457435122095959, 'min_impurity_decrease': 0.4474741979916337, 'max_features': 0.9354291762168256, 'subsample': 0.8349181061383226, 'dropout_rate': 0.5180973260176494, 'ccp_alpha': 0.08234689730395044}. Best is trial 677 with value: 0.7600100187343619.[0m
[32m[I 2022-04-14 14:59:55,557][0m Trial 767 finished with value: 0.7044578225987618 and parameters: {'loss': 'coxph', 'learning_rate': 0.006389310923694897, 'n_estimators': 314, 'criterion': 'friedman_mse', 'min_samples_split': 2, 'min_samples_leaf': 1, 'min_weight_fraction_leaf': 0.01750280156470757, 'min_impurity_decrease': 0.47468485515657055, 'max_features': 0.9658782249708404, 'subsample': 0.7252803780412133, 'dropout_rate': 0.42036807320055064, 'ccp_alpha': 0.17289586509188976}. Best is trial 677 with value: 0.7600100187343619.[0m
[32m[I 2022-04-14 15:00:26,357][0m Trial 768 finished with value: 0.7541498750085622 and parameters: {'loss': 'coxph', 'learning_rate': 0.0099294282011993, 'n_estimators': 532, 'criterion': 'friedman_mse', 'min_samples_split': 2, 'min_samples_leaf': 1, 'min_weight_fraction_leaf': 0.048045824697552884, 'min_impurity_decrease': 0.5026970081975949, 'max_features': 0.9318662654091077, 'subsample': 0.7682104002174416, 'dropout_rate': 0.4381599936521123, 'ccp_alpha': 0.0023629184326672955}. Best is trial 677 with value: 0.7600100187343619.[0m
[32m[I 2022-04-14 15:00:37,304][0m Trial 769 finished with value: 0.5 and parameters: {'loss': 'coxph', 'learning_rate': 0.01358345313933269, 'n_estimators': 328, 'criterion': 'friedman_mse', 'min_samples_split': 2, 'min_samples_leaf': 1, 'min_weight_fraction_leaf': 0.0512423430580054, 'min_impurity_decrease': 0.75764604645738, 'max_features': 0.9423028604886639, 'subsample': 0.7909912708573672, 'dropout_rate': 0.47396713608090846, 'ccp_alpha': 4.3119896288881865}. Best is trial 677 with value: 0.7600100187343619.[0m
[32m[I 2022-04-14 15:01:20,853][0m Trial 770 finished with value: 0.7205494892915866 and parameters: {'loss': 'coxph', 'learning_rate': 0.011398739552134357, 'n_estimators': 663, 'criterion': 'friedman_mse', 'min_samples_split': 2, 'min_samples_leaf': 1, 'min_weight_fraction_leaf': 0.04753040665495195, 'min_impurity_decrease': 0.331809816029387, 'max_features': 0.45701834542962955, 'subsample': 0.7662326684596777, 'dropout_rate': 0.45808389835268676, 'ccp_alpha': 0.09214251037270116}. Best is trial 677 with value: 0.7600100187343619.[0m
[32m[I 2022-04-14 15:01:33,528][0m Trial 771 finished with value: 0.7487209540342744 and parameters: {'loss': 'coxph', 'learning_rate': 0.04387515680895603, 'n_estimators': 314, 'criterion': 'friedman_mse', 'min_samples_split': 2, 'min_samples_leaf': 2, 'min_weight_fraction_leaf': 0.05696025424406575, 'min_impurity_decrease': 0.5736074073409926, 'max_features': 0.9592998524944351, 'subsample': 0.8147389931651435, 'dropout_rate': 0.39794184819414724, 'ccp_alpha': 0.002290044674710925}. Best is trial 677 with value: 0.7600100187343619.[0m
[32m[I 2022-04-14 15:01:46,307][0m Trial 772 finished with value: 0.6475926723754103 and parameters: {'loss': 'coxph', 'learning_rate': 0.011896797863170617, 'n_estimators': 330, 'criterion': 'friedman_mse', 'min_samples_split': 2, 'min_samples_leaf': 1, 'min_weight_fraction_leaf': 0.04256752326737888, 'min_impurity_decrease': 0.3983686090777087, 'max_features': 0.9744277936580091, 'subsample': 0.7880077172022553, 'dropout_rate': 0.4444349967601164, 'ccp_alpha': 0.250886255745388}. Best is trial 677 with value: 0.7600100187343619.[0m
[32m[I 2022-04-14 15:01:58,682][0m Trial 773 finished with value: 0.6858707212139639 and parameters: {'loss': 'coxph', 'learning_rate': 0.02378381414863576, 'n_estimators': 346, 'criterion': 'friedman_mse', 'min_samples_split': 2, 'min_samples_leaf': 1, 'min_weight_fraction_leaf': 0.06139559635809619, 'min_impurity_decrease': 0.6240072675569232, 'max_features': 0.9378803730592795, 'subsample': 0.8773822157361989, 'dropout_rate': 0.4797776385838762, 'ccp_alpha': 0.1666593354482428}. Best is trial 677 with value: 0.7600100187343619.[0m
[32m[I 2022-04-14 15:02:31,272][0m Trial 774 finished with value: 0.7478487683582549 and parameters: {'loss': 'coxph', 'learning_rate': 0.008143181714188591, 'n_estimators': 555, 'criterion': 'friedman_mse', 'min_samples_split': 2, 'min_samples_leaf': 1, 'min_weight_fraction_leaf': 0.060267067730846564, 'min_impurity_decrease': 0.7139726142041604, 'max_features': 0.9754951235915318, 'subsample': 0.8074392697301833, 'dropout_rate': 0.4192763790668189, 'ccp_alpha': 0.0013478095841525607}. Best is trial 677 with value: 0.7600100187343619.[0m
[32m[I 2022-04-14 15:02:42,523][0m Trial 775 finished with value: 0.7104269590180242 and parameters: {'loss': 'coxph', 'learning_rate': 0.007991653307208973, 'n_estimators': 306, 'criterion': 'friedman_mse', 'min_samples_split': 2, 'min_samples_leaf': 1, 'min_weight_fraction_leaf': 0.2710114797265881, 'min_impurity_decrease': 0.5289460035863711, 'max_features': 0.9261761737927784, 'subsample': 0.8395489799047581, 'dropout_rate': 0.37912136114616857, 'ccp_alpha': 0.09904475182559584}. Best is trial 677 with value: 0.7600100187343619.[0m
[32m[I 2022-04-14 15:02:54,869][0m Trial 776 finished with value: 0.7521325579847884 and parameters: {'loss': 'coxph', 'learning_rate': 0.009466214103628152, 'n_estimators': 347, 'criterion': 'friedman_mse', 'min_samples_split': 2, 'min_samples_leaf': 3, 'min_weight_fraction_leaf': 0.041381642559907825, 'min_impurity_decrease': 0.36071305598003794, 'max_features': 0.9510423269149123, 'subsample': 0.7718116711963601, 'dropout_rate': 0.4576366804162439, 'ccp_alpha': 0.001391502896839926}. Best is trial 677 with value: 0.7600100187343619.[0m
[32m[I 2022-04-14 15:03:22,248][0m Trial 777 finished with value: 0.7302688847274176 and parameters: {'loss': 'coxph', 'learning_rate': 0.011811431642974454, 'n_estimators': 522, 'criterion': 'friedman_mse', 'min_samples_split': 2, 'min_samples_leaf': 4, 'min_weight_fraction_leaf': 0.03858876017909317, 'min_impurity_decrease': 0.31115003748081627, 'max_features': 0.9248532553847667, 'subsample': 0.7617930096882051, 'dropout_rate': 0.5074251201001228, 'ccp_alpha': 0.15788419333842796}. Best is trial 677 with value: 0.7600100187343619.[0m
[32m[I 2022-04-14 15:03:36,517][0m Trial 778 finished with value: 0.5 and parameters: {'loss': 'squared', 'learning_rate': 0.009395574113866278, 'n_estimators': 361, 'criterion': 'friedman_mse', 'min_samples_split': 2, 'min_samples_leaf': 3, 'min_weight_fraction_leaf': 0.04546210765977778, 'min_impurity_decrease': 0.37803365093773444, 'max_features': 0.8975901289079535, 'subsample': 0.7723117902645523, 'dropout_rate': 0.45922618623845846, 'ccp_alpha': 1.5286032485519905}. Best is trial 677 with value: 0.7600100187343619.[0m
[32m[I 2022-04-14 15:03:50,830][0m Trial 779 finished with value: 0.5152605940480851 and parameters: {'loss': 'coxph', 'learning_rate': 0.008357398829827136, 'n_estimators': 348, 'criterion': 'friedman_mse', 'min_samples_split': 2, 'min_samples_leaf': 3, 'min_weight_fraction_leaf': 0.040073286887742254, 'min_impurity_decrease': 0.34564098058370474, 'max_features': 0.9498504416160363, 'subsample': 0.7491964116298842, 'dropout_rate': 0.4319565035077712, 'ccp_alpha': 0.3144403475130006}. Best is trial 677 with value: 0.7600100187343619.[0m
[32m[I 2022-04-14 15:04:04,178][0m Trial 780 finished with value: 0.7399532152416874 and parameters: {'loss': 'coxph', 'learning_rate': 0.010538854138657275, 'n_estimators': 374, 'criterion': 'friedman_mse', 'min_samples_split': 2, 'min_samples_leaf': 3, 'min_weight_fraction_leaf': 0.049825023156004164, 'min_impurity_decrease': 0.36353915038407525, 'max_features': 0.9343228856195861, 'subsample': 0.7716228847970902, 'dropout_rate': 0.4878649552779659, 'ccp_alpha': 0.09468598090425338}. Best is trial 677 with value: 0.7600100187343619.[0m
[32m[I 2022-04-14 15:04:16,513][0m Trial 781 finished with value: 0.6736091269020086 and parameters: {'loss': 'coxph', 'learning_rate': 0.008707134237996933, 'n_estimators': 340, 'criterion': 'friedman_mse', 'min_samples_split': 2, 'min_samples_leaf': 3, 'min_weight_fraction_leaf': 0.03656708433629269, 'min_impurity_decrease': 0.34397431576523224, 'max_features': 0.950825339640292, 'subsample': 0.7867390792543757, 'dropout_rate': 0.4061149203617242, 'ccp_alpha': 0.2195602747964964}. Best is trial 677 with value: 0.7600100187343619.[0m
[32m[I 2022-04-14 15:04:30,832][0m Trial 782 finished with value: 0.7523252307843585 and parameters: {'loss': 'coxph', 'learning_rate': 0.015851404985995392, 'n_estimators': 356, 'criterion': 'friedman_mse', 'min_samples_split': 2, 'min_samples_leaf': 3, 'min_weight_fraction_leaf': 0.029288376938195183, 'min_impurity_decrease': 0.32947703946596496, 'max_features': 0.9120251607476122, 'subsample': 0.7525344766670897, 'dropout_rate': 0.4390077463697264, 'ccp_alpha': 0.0012382574511841517}. Best is trial 677 with value: 0.7600100187343619.[0m
[32m[I 2022-04-14 15:04:47,265][0m Trial 783 finished with value: 0.5 and parameters: {'loss': 'coxph', 'learning_rate': 0.016562688380230152, 'n_estimators': 373, 'criterion': 'absolute_error', 'min_samples_split': 2, 'min_samples_leaf': 3, 'min_weight_fraction_leaf': 0.032520766710980004, 'min_impurity_decrease': 0.34007260263266853, 'max_features': 0.8911744850764877, 'subsample': 0.7528119729154923, 'dropout_rate': 0.41257235901539485, 'ccp_alpha': 2.2767359694903444}. Best is trial 677 with value: 0.7600100187343619.[0m
[32m[I 2022-04-14 15:05:03,496][0m Trial 784 finished with value: 0.7524710038885433 and parameters: {'loss': 'coxph', 'learning_rate': 0.014252753973082007, 'n_estimators': 361, 'criterion': 'friedman_mse', 'min_samples_split': 2, 'min_samples_leaf': 3, 'min_weight_fraction_leaf': 0.02297145583904058, 'min_impurity_decrease': 0.3070985808955988, 'max_features': 0.8796214938385555, 'subsample': 0.7307180365044986, 'dropout_rate': 0.3714437154233983, 'ccp_alpha': 0.0018811133575538563}. Best is trial 677 with value: 0.7600100187343619.[0m
[32m[I 2022-04-14 15:05:18,708][0m Trial 785 finished with value: 0.5 and parameters: {'loss': 'coxph', 'learning_rate': 0.01927185632029851, 'n_estimators': 363, 'criterion': 'friedman_mse', 'min_samples_split': 2, 'min_samples_leaf': 3, 'min_weight_fraction_leaf': 0.025164137824326773, 'min_impurity_decrease': 0.29725662984976337, 'max_features': 0.8717166621914418, 'subsample': 0.2915258126929664, 'dropout_rate': 0.35607451992415073, 'ccp_alpha': 1.9636106803396007}. Best is trial 677 with value: 0.7600100187343619.[0m
[32m[I 2022-04-14 15:05:35,520][0m Trial 786 finished with value: 0.7432813768775693 and parameters: {'loss': 'coxph', 'learning_rate': 0.017485794639410863, 'n_estimators': 384, 'criterion': 'friedman_mse', 'min_samples_split': 2, 'min_samples_leaf': 4, 'min_weight_fraction_leaf': 0.0327649035292849, 'min_impurity_decrease': 0.32047296610210363, 'max_features': 0.8882346683665037, 'subsample': 0.6995884580443104, 'dropout_rate': 0.3740435679772063, 'ccp_alpha': 0.09900840113399469}. Best is trial 677 with value: 0.7600100187343619.[0m
[32m[I 2022-04-14 15:05:51,808][0m Trial 787 finished with value: 0.748311935443579 and parameters: {'loss': 'coxph', 'learning_rate': 0.01869897800930468, 'n_estimators': 358, 'criterion': 'friedman_mse', 'min_samples_split': 2, 'min_samples_leaf': 3, 'min_weight_fraction_leaf': 0.024298243562709283, 'min_impurity_decrease': 0.3297232153712721, 'max_features': 0.8723407210689154, 'subsample': 0.734992260442115, 'dropout_rate': 0.3806749694944939, 'ccp_alpha': 0.0010519239682580256}. Best is trial 677 with value: 0.7600100187343619.[0m
[32m[I 2022-04-14 15:06:09,863][0m Trial 788 finished with value: 0.7201965399214689 and parameters: {'loss': 'coxph', 'learning_rate': 0.024258302473485534, 'n_estimators': 389, 'criterion': 'friedman_mse', 'min_samples_split': 2, 'min_samples_leaf': 3, 'min_weight_fraction_leaf': 0.027158903385400595, 'min_impurity_decrease': 0.3515333039193881, 'max_features': 0.90630676117938, 'subsample': 0.7143653128632997, 'dropout_rate': 0.34347500362966443, 'ccp_alpha': 0.18786817955237967}. Best is trial 677 with value: 0.7600100187343619.[0m
[32m[I 2022-04-14 15:06:25,602][0m Trial 789 finished with value: 0.7419019312612891 and parameters: {'loss': 'coxph', 'learning_rate': 0.015325327614602221, 'n_estimators': 374, 'criterion': 'friedman_mse', 'min_samples_split': 2, 'min_samples_leaf': 3, 'min_weight_fraction_leaf': 0.01681566007496412, 'min_impurity_decrease': 0.35440123224447256, 'max_features': 0.8978811777987071, 'subsample': 0.7438715385123004, 'dropout_rate': 0.3955280201284743, 'ccp_alpha': 0.10154571398660085}. Best is trial 677 with value: 0.7600100187343619.[0m
[32m[I 2022-04-14 15:06:42,241][0m Trial 790 finished with value: 0.5049013916902899 and parameters: {'loss': 'coxph', 'learning_rate': 0.011860044404482808, 'n_estimators': 357, 'criterion': 'friedman_mse', 'min_samples_split': 2, 'min_samples_leaf': 3, 'min_weight_fraction_leaf': 0.028443842655169502, 'min_impurity_decrease': 0.3192889609194876, 'max_features': 0.9158133318979752, 'subsample': 0.7254259274735161, 'dropout_rate': 0.37212536554739467, 'ccp_alpha': 0.3895018342050792}. Best is trial 677 with value: 0.7600100187343619.[0m
[32m[I 2022-04-14 15:06:55,921][0m Trial 791 finished with value: 0.6529891877404521 and parameters: {'loss': 'coxph', 'learning_rate': 0.029886172437399463, 'n_estimators': 344, 'criterion': 'friedman_mse', 'min_samples_split': 2, 'min_samples_leaf': 3, 'min_weight_fraction_leaf': 0.02833358342308464, 'min_impurity_decrease': 0.2832531641246208, 'max_features': 0.8751858483996082, 'subsample': 0.7415382710323576, 'dropout_rate': 0.42364443134394164, 'ccp_alpha': 0.2556674308064014}. Best is trial 677 with value: 0.7600100187343619.[0m
[32m[I 2022-04-14 15:07:14,187][0m Trial 792 finished with value: 0.7419019312612891 and parameters: {'loss': 'coxph', 'learning_rate': 0.014832232885720996, 'n_estimators': 387, 'criterion': 'friedman_mse', 'min_samples_split': 2, 'min_samples_leaf': 3, 'min_weight_fraction_leaf': 0.051576389275450024, 'min_impurity_decrease': 0.285148128044792, 'max_features': 0.9100565092604894, 'subsample': 0.7456069139683384, 'dropout_rate': 0.40313000591877446, 'ccp_alpha': 0.10232933532880076}. Best is trial 677 with value: 0.7600100187343619.[0m
[32m[I 2022-04-14 15:07:29,396][0m Trial 793 finished with value: 0.7232281720813303 and parameters: {'loss': 'coxph', 'learning_rate': 0.013826581430129423, 'n_estimators': 368, 'criterion': 'friedman_mse', 'min_samples_split': 2, 'min_samples_leaf': 3, 'min_weight_fraction_leaf': 0.035333785925869374, 'min_impurity_decrease': 0.9517309178893525, 'max_features': 0.8994388984507119, 'subsample': 0.6974636167649205, 'dropout_rate': 0.4388298835925134, 'ccp_alpha': 0.1755777416434436}. Best is trial 677 with value: 0.7600100187343619.[0m
[32m[I 2022-04-14 15:07:48,947][0m Trial 794 finished with value: 0.7417298770513965 and parameters: {'loss': 'coxph', 'learning_rate': 0.01491602770656439, 'n_estimators': 425, 'criterion': 'friedman_mse', 'min_samples_split': 2, 'min_samples_leaf': 3, 'min_weight_fraction_leaf': 0.020719438353849845, 'min_impurity_decrease': 0.3881881222817516, 'max_features': 0.9147058468706946, 'subsample': 0.7583042110918548, 'dropout_rate': 0.3931089454578182, 'ccp_alpha': 0.08951305113877712}. Best is trial 677 with value: 0.7600100187343619.[0m
[32m[I 2022-04-14 15:08:02,521][0m Trial 795 finished with value: 0.5 and parameters: {'loss': 'coxph', 'learning_rate': 0.011410252553816603, 'n_estimators': 350, 'criterion': 'friedman_mse', 'min_samples_split': 2, 'min_samples_leaf': 3, 'min_weight_fraction_leaf': 0.04428979521026006, 'min_impurity_decrease': 0.3814889902971934, 'max_features': 0.8817649082012464, 'subsample': 0.7129783760592424, 'dropout_rate': 0.4198331787893296, 'ccp_alpha': 2.679303430572893}. Best is trial 677 with value: 0.7600100187343619.[0m
[32m[I 2022-04-14 15:08:07,410][0m Trial 796 finished with value: 0.5 and parameters: {'loss': 'coxph', 'learning_rate': 0.009483986561539133, 'n_estimators': 203, 'criterion': 'friedman_mse', 'min_samples_split': 2, 'min_samples_leaf': 3, 'min_weight_fraction_leaf': 0.05354214424819664, 'min_impurity_decrease': 0.3571053883040688, 'max_features': 0.9171630813445254, 'subsample': 0.7584792139683603, 'dropout_rate': 0.3692728898513628, 'ccp_alpha': 1.4373036856451131}. Best is trial 677 with value: 0.7600100187343619.[0m
[32m[I 2022-04-14 15:08:31,378][0m Trial 797 finished with value: 0.24689912294571975 and parameters: {'loss': 'squared', 'learning_rate': 0.006772882862897264, 'n_estimators': 471, 'criterion': 'friedman_mse', 'min_samples_split': 2, 'min_samples_leaf': 3, 'min_weight_fraction_leaf': 0.033689127343350944, 'min_impurity_decrease': 0.32718261394178316, 'max_features': 0.9305147297936688, 'subsample': 0.7848327682300889, 'dropout_rate': 0.4363118830521799, 'ccp_alpha': 0.10236535102891978}. Best is trial 677 with value: 0.7600100187343619.[0m
[32m[I 2022-04-14 15:08:43,863][0m Trial 798 finished with value: 0.57083307992825 and parameters: {'loss': 'coxph', 'learning_rate': 0.021535216664266187, 'n_estimators': 336, 'criterion': 'friedman_mse', 'min_samples_split': 2, 'min_samples_leaf': 3, 'min_weight_fraction_leaf': 0.056925285196807555, 'min_impurity_decrease': 0.3204978412067156, 'max_features': 0.8894575937120371, 'subsample': 0.7257780302266118, 'dropout_rate': 0.3979687028042066, 'ccp_alpha': 0.3089268015835235}. Best is trial 677 with value: 0.7600100187343619.[0m
[32m[I 2022-04-14 15:08:57,906][0m Trial 799 finished with value: 0.7092549136202108 and parameters: {'loss': 'coxph', 'learning_rate': 0.01489949235339172, 'n_estimators': 362, 'criterion': 'friedman_mse', 'min_samples_split': 2, 'min_samples_leaf': 3, 'min_weight_fraction_leaf': 0.02302572783888514, 'min_impurity_decrease': 0.29859660329212884, 'max_features': 0.9213670650285128, 'subsample': 0.7698723050759372, 'dropout_rate': 0.4424526572870854, 'ccp_alpha': 0.2128225618447662}. Best is trial 677 with value: 0.7600100187343619.[0m
[32m[I 2022-04-14 15:09:01,706][0m Trial 800 finished with value: 0.7486369072514224 and parameters: {'loss': 'coxph', 'learning_rate': 0.031290185511465424, 'n_estimators': 172, 'criterion': 'friedman_mse', 'min_samples_split': 2, 'min_samples_leaf': 3, 'min_weight_fraction_leaf': 0.043648449764364494, 'min_impurity_decrease': 0.37552350860739825, 'max_features': 0.9300986651516605, 'subsample': 0.79593992521966, 'dropout_rate': 0.40762380388470815, 'ccp_alpha': 0.08165911996816885}. Best is trial 677 with value: 0.7600100187343619.[0m
[32m[I 2022-04-14 15:09:16,542][0m Trial 801 finished with value: 0.5 and parameters: {'loss': 'coxph', 'learning_rate': 0.03761902805689015, 'n_estimators': 379, 'criterion': 'friedman_mse', 'min_samples_split': 2, 'min_samples_leaf': 2, 'min_weight_fraction_leaf': 0.05663391016415435, 'min_impurity_decrease': 0.304221113172464, 'max_features': 0.9021417306169113, 'subsample': 0.7446799661812081, 'dropout_rate': 0.47299691445974135, 'ccp_alpha': 4.056025459530086}. Best is trial 677 with value: 0.7600100187343619.[0m
[32m[I 2022-04-14 15:09:34,163][0m Trial 802 finished with value: 0.743006592285733 and parameters: {'loss': 'coxph', 'learning_rate': 0.011844609679722751, 'n_estimators': 397, 'criterion': 'friedman_mse', 'min_samples_split': 2, 'min_samples_leaf': 3, 'min_weight_fraction_leaf': 0.019291276262849433, 'min_impurity_decrease': 0.41033391225420435, 'max_features': 0.9347936984066899, 'subsample': 0.7705089441018785, 'dropout_rate': 0.4203957054796137, 'ccp_alpha': 0.08918981333988683}. Best is trial 677 with value: 0.7600100187343619.[0m
