[32m[I 2022-04-14 00:58:38,778][0m Trial 442 finished with value: -0.3693864890656467 and parameters: {'loss': 'squared', 'learning_rate': 0.0006238278464409541, 'n_estimators': 785, 'criterion': 'friedman_mse', 'min_samples_split': 4, 'min_samples_leaf': 3, 'min_weight_fraction_leaf': 0.024945402820857845, 'min_impurity_decrease': 0.5525179435104511, 'max_features': 0.8290568404747213, 'subsample': 0.7421767949089528, 'dropout_rate': 0.5175108312105424, 'ccp_alpha': 0.08480960149430773}. Best is trial 379 with value: 0.878361797817203.[0m
[32m[I 2022-04-14 01:00:05,053][0m Trial 443 finished with value: 0.65 and parameters: {'loss': 'coxph', 'learning_rate': 0.0012918245136918425, 'n_estimators': 865, 'criterion': 'friedman_mse', 'min_samples_split': 5, 'min_samples_leaf': 3, 'min_weight_fraction_leaf': 0.32146235415998237, 'min_impurity_decrease': 0.5937770312469207, 'max_features': 0.8459299145393855, 'subsample': 0.7639656684630707, 'dropout_rate': 0.48740340389368797, 'ccp_alpha': 2.490842222688186}. Best is trial 379 with value: 0.878361797817203.[0m
[32m[I 2022-04-14 01:01:23,479][0m Trial 444 finished with value: 0.8752273114110338 and parameters: {'loss': 'coxph', 'learning_rate': 0.0010043087271713342, 'n_estimators': 743, 'criterion': 'friedman_mse', 'min_samples_split': 4, 'min_samples_leaf': 4, 'min_weight_fraction_leaf': 0.031730154482689114, 'min_impurity_decrease': 0.6467518622557707, 'max_features': 0.8673813999387219, 'subsample': 0.8133962081167945, 'dropout_rate': 0.44424228717285835, 'ccp_alpha': 0.0012419835621680399}. Best is trial 379 with value: 0.878361797817203.[0m
[32m[I 2022-04-14 01:02:32,674][0m Trial 445 finished with value: 0.65 and parameters: {'loss': 'coxph', 'learning_rate': 0.0009893520697652294, 'n_estimators': 706, 'criterion': 'squared_error', 'min_samples_split': 4, 'min_samples_leaf': 4, 'min_weight_fraction_leaf': 0.031187936859635862, 'min_impurity_decrease': 0.639981180693688, 'max_features': 0.856749574371976, 'subsample': 0.8190977048927977, 'dropout_rate': 0.4435558624487733, 'ccp_alpha': 0.011800480613864782}. Best is trial 379 with value: 0.878361797817203.[0m
[32m[I 2022-04-14 01:03:41,156][0m Trial 446 finished with value: 0.8530460955167889 and parameters: {'loss': 'coxph', 'learning_rate': 0.0006611215388065002, 'n_estimators': 730, 'criterion': 'friedman_mse', 'min_samples_split': 4, 'min_samples_leaf': 4, 'min_weight_fraction_leaf': 0.013792554530124674, 'min_impurity_decrease': 0.6097503656443025, 'max_features': 0.806385642912911, 'subsample': 0.8347987635212264, 'dropout_rate': 0.4588645319254174, 'ccp_alpha': 0.18618821820953532}. Best is trial 379 with value: 0.878361797817203.[0m
[32m[I 2022-04-14 01:05:00,201][0m Trial 447 finished with value: 0.8735905534462514 and parameters: {'loss': 'coxph', 'learning_rate': 0.000819344389794267, 'n_estimators': 748, 'criterion': 'friedman_mse', 'min_samples_split': 4, 'min_samples_leaf': 4, 'min_weight_fraction_leaf': 0.02662596651142688, 'min_impurity_decrease': 0.6548301934868289, 'max_features': 0.8252589092144215, 'subsample': 0.800954526239992, 'dropout_rate': 0.42750371557878075, 'ccp_alpha': 0.008180158727773487}. Best is trial 379 with value: 0.878361797817203.[0m
[32m[I 2022-04-14 01:05:19,180][0m Trial 448 finished with value: 0.8736620726173738 and parameters: {'loss': 'coxph', 'learning_rate': 2.112043542793836e-06, 'n_estimators': 384, 'criterion': 'friedman_mse', 'min_samples_split': 4, 'min_samples_leaf': 4, 'min_weight_fraction_leaf': 0.01140962394697534, 'min_impurity_decrease': 0.6781731436416191, 'max_features': 0.8654911708332802, 'subsample': 0.7859204721351368, 'dropout_rate': 0.47980479809380405, 'ccp_alpha': 0.0056825427051554545}. Best is trial 379 with value: 0.878361797817203.[0m
[32m[I 2022-04-14 01:05:24,937][0m Trial 449 finished with value: 0.65 and parameters: {'loss': 'coxph', 'learning_rate': 2.18919431379912e-06, 'n_estimators': 207, 'criterion': 'friedman_mse', 'min_samples_split': 4, 'min_samples_leaf': 4, 'min_weight_fraction_leaf': 0.03821837089413777, 'min_impurity_decrease': 0.67762774840662, 'max_features': 0.8421817744883925, 'subsample': 0.7863721873445223, 'dropout_rate': 0.47370926812197695, 'ccp_alpha': 0.3507342083171147}. Best is trial 379 with value: 0.878361797817203.[0m
[32m[I 2022-04-14 01:06:27,277][0m Trial 450 finished with value: 0.8751947893831697 and parameters: {'loss': 'coxph', 'learning_rate': 1.3314524301999948e-06, 'n_estimators': 666, 'criterion': 'friedman_mse', 'min_samples_split': 4, 'min_samples_leaf': 4, 'min_weight_fraction_leaf': 0.018803024826622092, 'min_impurity_decrease': 0.6753795853204747, 'max_features': 0.867427098391739, 'subsample': 0.7818905082222901, 'dropout_rate': 0.4488568851463136, 'ccp_alpha': 0.003557316430019799}. Best is trial 379 with value: 0.878361797817203.[0m
[32m[I 2022-04-14 01:07:39,868][0m Trial 451 finished with value: 0.8584809498920576 and parameters: {'loss': 'coxph', 'learning_rate': 0.0011520660779288454, 'n_estimators': 705, 'criterion': 'friedman_mse', 'min_samples_split': 5, 'min_samples_leaf': 4, 'min_weight_fraction_leaf': 0.06077844444814818, 'min_impurity_decrease': 0.4539948086019574, 'max_features': 0.8833517437153353, 'subsample': 0.7627152092572087, 'dropout_rate': 0.4101421783531242, 'ccp_alpha': 0.1837290391129686}. Best is trial 379 with value: 0.878361797817203.[0m
[32m[I 2022-04-14 01:08:37,371][0m Trial 452 finished with value: 0.8600298245478889 and parameters: {'loss': 'coxph', 'learning_rate': 1.2741812147812639e-06, 'n_estimators': 664, 'criterion': 'friedman_mse', 'min_samples_split': 4, 'min_samples_leaf': 4, 'min_weight_fraction_leaf': 0.03102040352031895, 'min_impurity_decrease': 0.7126173269084367, 'max_features': 0.8196460403182767, 'subsample': 0.7803189885004079, 'dropout_rate': 0.4407577254852576, 'ccp_alpha': 0.14983155946941812}. Best is trial 379 with value: 0.878361797817203.[0m
[32m[I 2022-04-14 01:09:30,682][0m Trial 453 finished with value: 0.65 and parameters: {'loss': 'coxph', 'learning_rate': 1.7618763811676383e-05, 'n_estimators': 639, 'criterion': 'friedman_mse', 'min_samples_split': 4, 'min_samples_leaf': 4, 'min_weight_fraction_leaf': 0.017860595295120876, 'min_impurity_decrease': 0.6934970227584629, 'max_features': 0.7787722645219867, 'subsample': 0.9977635002923566, 'dropout_rate': 0.4530934344111575, 'ccp_alpha': 0.27086786558000847}. Best is trial 379 with value: 0.878361797817203.[0m
[32m[I 2022-04-14 01:10:36,110][0m Trial 454 finished with value: 0.8678848623467912 and parameters: {'loss': 'coxph', 'learning_rate': 0.001581616019958387, 'n_estimators': 670, 'criterion': 'friedman_mse', 'min_samples_split': 4, 'min_samples_leaf': 4, 'min_weight_fraction_leaf': 0.046444509704596904, 'min_impurity_decrease': 0.6322966528307066, 'max_features': 0.8388122064260073, 'subsample': 0.8097311834658676, 'dropout_rate': 0.4227969661067002, 'ccp_alpha': 0.09145184620067372}. Best is trial 379 with value: 0.878361797817203.[0m
[32m[I 2022-04-14 01:11:53,955][0m Trial 455 finished with value: 0.8661690583710605 and parameters: {'loss': 'coxph', 'learning_rate': 6.238248755718193e-06, 'n_estimators': 737, 'criterion': 'friedman_mse', 'min_samples_split': 4, 'min_samples_leaf': 4, 'min_weight_fraction_leaf': 0.035083123681295736, 'min_impurity_decrease': 0.6544604183769531, 'max_features': 0.7987070628125413, 'subsample': 0.7416491891488198, 'dropout_rate': 0.40045964310629456, 'ccp_alpha': 0.16250382509822955}. Best is trial 379 with value: 0.878361797817203.[0m
[32m[I 2022-04-14 01:12:56,533][0m Trial 456 finished with value: 0.8708427911113157 and parameters: {'loss': 'coxph', 'learning_rate': 2.656955346530348e-06, 'n_estimators': 682, 'criterion': 'friedman_mse', 'min_samples_split': 4, 'min_samples_leaf': 4, 'min_weight_fraction_leaf': 0.02345706130115127, 'min_impurity_decrease': 0.35829175512431993, 'max_features': 0.8810825004586015, 'subsample': 0.8103928838890018, 'dropout_rate': 0.4395153774337699, 'ccp_alpha': 0.11292272567012411}. Best is trial 379 with value: 0.878361797817203.[0m
[32m[I 2022-04-14 01:13:58,880][0m Trial 457 finished with value: 0.866290273959752 and parameters: {'loss': 'coxph', 'learning_rate': 0.0012078884579518152, 'n_estimators': 698, 'criterion': 'friedman_mse', 'min_samples_split': 4, 'min_samples_leaf': 4, 'min_weight_fraction_leaf': 0.04106340477587132, 'min_impurity_decrease': 0.4836935313960291, 'max_features': 0.8491667149905214, 'subsample': 0.7615783836410646, 'dropout_rate': 0.4542365607222855, 'ccp_alpha': 0.09470894264523538}. Best is trial 379 with value: 0.878361797817203.[0m
[32m[I 2022-04-14 01:15:15,844][0m Trial 458 finished with value: 0.8302277134406907 and parameters: {'loss': 'coxph', 'learning_rate': 1.560870544522988e-06, 'n_estimators': 738, 'criterion': 'friedman_mse', 'min_samples_split': 4, 'min_samples_leaf': 4, 'min_weight_fraction_leaf': 0.05383107656653287, 'min_impurity_decrease': 0.4323700431766693, 'max_features': 0.8292377689803627, 'subsample': 0.7890657143696967, 'dropout_rate': 0.3873430711779959, 'ccp_alpha': 0.2412910256780089}. Best is trial 379 with value: 0.878361797817203.[0m
[32m[I 2022-04-14 01:16:08,026][0m Trial 459 finished with value: 0.65 and parameters: {'loss': 'coxph', 'learning_rate': 1.0628781668557144e-06, 'n_estimators': 615, 'criterion': 'friedman_mse', 'min_samples_split': 4, 'min_samples_leaf': 4, 'min_weight_fraction_leaf': 0.02035485392125443, 'min_impurity_decrease': 0.4758488965886427, 'max_features': 0.8619149234535883, 'subsample': 0.7394774411298554, 'dropout_rate': 0.41731080192398734, 'ccp_alpha': 2.2164151523071194}. Best is trial 379 with value: 0.878361797817203.[0m
[32m[I 2022-04-14 01:17:24,614][0m Trial 460 finished with value: 0.65 and parameters: {'loss': 'coxph', 'learning_rate': 1.4113302025319981e-06, 'n_estimators': 768, 'criterion': 'friedman_mse', 'min_samples_split': 4, 'min_samples_leaf': 4, 'min_weight_fraction_leaf': 0.02926909400104929, 'min_impurity_decrease': 0.7074225810111011, 'max_features': 0.8114028764898247, 'subsample': 0.7714288511379696, 'dropout_rate': 0.4730878297142066, 'ccp_alpha': 0.41113196362052096}. Best is trial 379 with value: 0.878361797817203.[0m
[32m[I 2022-04-14 01:18:40,105][0m Trial 461 finished with value: 0.65 and parameters: {'loss': 'coxph', 'learning_rate': 1.0219435400131903e-06, 'n_estimators': 779, 'criterion': 'absolute_error', 'min_samples_split': 4, 'min_samples_leaf': 2, 'min_weight_fraction_leaf': 0.04037771630185483, 'min_impurity_decrease': 0.5225827908847427, 'max_features': 0.880332297224334, 'subsample': 0.8081115281201445, 'dropout_rate': 0.4312253836374369, 'ccp_alpha': 0.004695772570746127}. Best is trial 379 with value: 0.878361797817203.[0m
[32m[I 2022-04-14 01:19:17,508][0m Trial 462 finished with value: -0.3694329735772833 and parameters: {'loss': 'squared', 'learning_rate': 2.7373376700067278e-05, 'n_estimators': 602, 'criterion': 'friedman_mse', 'min_samples_split': 7, 'min_samples_leaf': 4, 'min_weight_fraction_leaf': 0.05955318804159465, 'min_impurity_decrease': 0.4218546450324129, 'max_features': 0.84408937434241, 'subsample': 0.7918018119510198, 'dropout_rate': 0.5991749448784098, 'ccp_alpha': 0.0051762552945233}. Best is trial 379 with value: 0.878361797817203.[0m
[32m[I 2022-04-14 01:20:00,673][0m Trial 463 finished with value: 0.8742613352927691 and parameters: {'loss': 'coxph', 'learning_rate': 1.1739310821314269e-06, 'n_estimators': 646, 'criterion': 'friedman_mse', 'min_samples_split': 4, 'min_samples_leaf': 3, 'min_weight_fraction_leaf': 0.014841040097750186, 'min_impurity_decrease': 0.3860411898769083, 'max_features': 0.8659765050838512, 'subsample': 0.8516270624483488, 'dropout_rate': 0.5263527750288086, 'ccp_alpha': 0.004576082608051953}. Best is trial 379 with value: 0.878361797817203.[0m
[32m[I 2022-04-14 01:21:00,029][0m Trial 464 finished with value: 0.8517792014041209 and parameters: {'loss': 'coxph', 'learning_rate': 1.099587516264991e-06, 'n_estimators': 666, 'criterion': 'friedman_mse', 'min_samples_split': 4, 'min_samples_leaf': 3, 'min_weight_fraction_leaf': 0.028745618812149806, 'min_impurity_decrease': 0.373092673582888, 'max_features': 0.8871579726318566, 'subsample': 0.8813506110868701, 'dropout_rate': 0.40686861961412363, 'ccp_alpha': 0.1619002646220379}. Best is trial 379 with value: 0.878361797817203.[0m
[32m[I 2022-04-14 01:21:51,248][0m Trial 465 finished with value: 0.660872981146427 and parameters: {'loss': 'coxph', 'learning_rate': 1.5733677137177494e-06, 'n_estimators': 630, 'criterion': 'friedman_mse', 'min_samples_split': 4, 'min_samples_leaf': 3, 'min_weight_fraction_leaf': 0.045647047817406826, 'min_impurity_decrease': 0.3924443361022421, 'max_features': 0.8652481139103957, 'subsample': 0.8591792303405686, 'dropout_rate': 0.4599138392830434, 'ccp_alpha': 0.2664100078554121}. Best is trial 379 with value: 0.878361797817203.[0m
[32m[I 2022-04-14 01:22:45,539][0m Trial 466 finished with value: 0.65 and parameters: {'loss': 'coxph', 'learning_rate': 1.2754045286868425e-06, 'n_estimators': 655, 'criterion': 'friedman_mse', 'min_samples_split': 4, 'min_samples_leaf': 3, 'min_weight_fraction_leaf': 0.018408537596505865, 'min_impurity_decrease': 0.38817034478922857, 'max_features': 0.87827441710289, 'subsample': 0.7573990026003257, 'dropout_rate': 0.5212712337137156, 'ccp_alpha': 1.6883941804585803}. Best is trial 379 with value: 0.878361797817203.[0m
[32m[I 2022-04-14 01:23:44,875][0m Trial 467 finished with value: 0.8739278251050774 and parameters: {'loss': 'coxph', 'learning_rate': 1.9207559931080317e-06, 'n_estimators': 700, 'criterion': 'friedman_mse', 'min_samples_split': 5, 'min_samples_leaf': 3, 'min_weight_fraction_leaf': 0.03586049320666318, 'min_impurity_decrease': 0.44751396434324847, 'max_features': 0.8541565694863827, 'subsample': 0.7326505013741702, 'dropout_rate': 0.48985565087919314, 'ccp_alpha': 0.0011353075960885515}. Best is trial 379 with value: 0.878361797817203.[0m
[32m[I 2022-04-14 01:24:30,187][0m Trial 468 finished with value: 0.65 and parameters: {'loss': 'coxph', 'learning_rate': 1.5148097311543007e-06, 'n_estimators': 601, 'criterion': 'squared_error', 'min_samples_split': 4, 'min_samples_leaf': 3, 'min_weight_fraction_leaf': 0.027329034951411216, 'min_impurity_decrease': 0.41849544175059267, 'max_features': 0.8879883697060766, 'subsample': 0.9092677211534888, 'dropout_rate': 0.43990535463418634, 'ccp_alpha': 0.09470913147584077}. Best is trial 379 with value: 0.878361797817203.[0m
[32m[I 2022-04-14 01:25:38,976][0m Trial 469 finished with value: 0.8492684250248776 and parameters: {'loss': 'coxph', 'learning_rate': 1.0683526958589304e-06, 'n_estimators': 691, 'criterion': 'friedman_mse', 'min_samples_split': 4, 'min_samples_leaf': 3, 'min_weight_fraction_leaf': 0.0652178388823444, 'min_impurity_decrease': 0.3512764645275162, 'max_features': 0.8367175914333417, 'subsample': 0.7742691899565819, 'dropout_rate': 0.38587368388099674, 'ccp_alpha': 0.17497985619027093}. Best is trial 379 with value: 0.878361797817203.[0m
[32m[I 2022-04-14 01:26:43,178][0m Trial 470 finished with value: 0.8651232071911805 and parameters: {'loss': 'coxph', 'learning_rate': 1.0186533635621775e-06, 'n_estimators': 716, 'criterion': 'friedman_mse', 'min_samples_split': 4, 'min_samples_leaf': 3, 'min_weight_fraction_leaf': 0.04956621841079078, 'min_impurity_decrease': 0.38345938981301475, 'max_features': 0.8624145987640279, 'subsample': 0.9362154749561221, 'dropout_rate': 0.4702462698246362, 'ccp_alpha': 0.09131574914500519}. Best is trial 379 with value: 0.878361797817203.[0m
[32m[I 2022-04-14 01:27:26,038][0m Trial 471 finished with value: 0.8711483682905706 and parameters: {'loss': 'coxph', 'learning_rate': 2.673267792778042e-06, 'n_estimators': 575, 'criterion': 'friedman_mse', 'min_samples_split': 4, 'min_samples_leaf': 3, 'min_weight_fraction_leaf': 0.016669461651892994, 'min_impurity_decrease': 0.6413095345887097, 'max_features': 0.8441701036247873, 'subsample': 0.8519040209862591, 'dropout_rate': 0.4995171479098742, 'ccp_alpha': 0.09383181975226236}. Best is trial 379 with value: 0.878361797817203.[0m
[32m[I 2022-04-14 01:29:10,046][0m Trial 472 finished with value: 0.6580440744419354 and parameters: {'loss': 'coxph', 'learning_rate': 0.002057993760767169, 'n_estimators': 875, 'criterion': 'friedman_mse', 'min_samples_split': 4, 'min_samples_leaf': 3, 'min_weight_fraction_leaf': 0.039091544528709346, 'min_impurity_decrease': 0.6865831360790327, 'max_features': 0.8814483339347894, 'subsample': 0.8099175321739382, 'dropout_rate': 0.4160572565323358, 'ccp_alpha': 0.3341850535809967}. Best is trial 379 with value: 0.878361797817203.[0m
[32m[I 2022-04-14 01:30:06,706][0m Trial 473 finished with value: 0.8515668646568273 and parameters: {'loss': 'coxph', 'learning_rate': 9.957274596154894e-06, 'n_estimators': 644, 'criterion': 'friedman_mse', 'min_samples_split': 3, 'min_samples_leaf': 3, 'min_weight_fraction_leaf': 0.01249138790609973, 'min_impurity_decrease': 0.4092864884037657, 'max_features': 0.8633565007336019, 'subsample': 0.7507047181734537, 'dropout_rate': 0.45000861345002147, 'ccp_alpha': 0.20213029788269543}. Best is trial 379 with value: 0.878361797817203.[0m
[32m[I 2022-04-14 01:31:22,129][0m Trial 474 finished with value: 0.8693311827819261 and parameters: {'loss': 'coxph', 'learning_rate': 7.767574205420694e-05, 'n_estimators': 743, 'criterion': 'friedman_mse', 'min_samples_split': 4, 'min_samples_leaf': 4, 'min_weight_fraction_leaf': 0.028994483947130185, 'min_impurity_decrease': 0.3673516307333117, 'max_features': 0.836094117370706, 'subsample': 0.7878366838097733, 'dropout_rate': 0.3736790641725334, 'ccp_alpha': 0.0904911572705831}. Best is trial 379 with value: 0.878361797817203.[0m
[32m[I 2022-04-14 01:32:45,391][0m Trial 475 finished with value: 0.8755860069586093 and parameters: {'loss': 'coxph', 'learning_rate': 1.3869445654199627e-06, 'n_estimators': 813, 'criterion': 'friedman_mse', 'min_samples_split': 4, 'min_samples_leaf': 2, 'min_weight_fraction_leaf': 0.0500089308474451, 'min_impurity_decrease': 0.4380861423855831, 'max_features': 0.8917922679562699, 'subsample': 0.8270946652279234, 'dropout_rate': 0.5155424895832207, 'ccp_alpha': 0.006084871499225278}. Best is trial 379 with value: 0.878361797817203.[0m
[32m[I 2022-04-14 01:32:55,647][0m Trial 476 finished with value: 0.8710728623707086 and parameters: {'loss': 'coxph', 'learning_rate': 2.022160158746276e-06, 'n_estimators': 288, 'criterion': 'friedman_mse', 'min_samples_split': 4, 'min_samples_leaf': 1, 'min_weight_fraction_leaf': 0.01875481314621986, 'min_impurity_decrease': 0.6535283835503958, 'max_features': 0.8847472692697298, 'subsample': 0.8408542099002877, 'dropout_rate': 0.5284502115721394, 'ccp_alpha': 0.0037311596315829417}. Best is trial 379 with value: 0.878361797817203.[0m
[32m[I 2022-04-14 01:34:36,639][0m Trial 477 finished with value: 0.8699856422498653 and parameters: {'loss': 'coxph', 'learning_rate': 1.4865226741347557e-06, 'n_estimators': 883, 'criterion': 'friedman_mse', 'min_samples_split': 4, 'min_samples_leaf': 2, 'min_weight_fraction_leaf': 0.034635119877323664, 'min_impurity_decrease': 0.4504064351596772, 'max_features': 0.8949983386568416, 'subsample': 0.8731057654099358, 'dropout_rate': 0.481722945276388, 'ccp_alpha': 0.0015158078487512074}. Best is trial 379 with value: 0.878361797817203.[0m
[32m[I 2022-04-14 01:35:54,715][0m Trial 478 finished with value: 0.8509751690146181 and parameters: {'loss': 'coxph', 'learning_rate': 1.1175946727802447e-06, 'n_estimators': 839, 'criterion': 'friedman_mse', 'min_samples_split': 4, 'min_samples_leaf': 2, 'min_weight_fraction_leaf': 0.06296259829791326, 'min_impurity_decrease': 0.4016987863453539, 'max_features': 0.8246646160824896, 'subsample': 0.8229569017589131, 'dropout_rate': 0.5165849084474134, 'ccp_alpha': 0.17663124143712305}. Best is trial 379 with value: 0.878361797817203.[0m
[32m[I 2022-04-14 01:37:12,161][0m Trial 479 finished with value: 0.65 and parameters: {'loss': 'coxph', 'learning_rate': 1.3013328335823088e-06, 'n_estimators': 757, 'criterion': 'friedman_mse', 'min_samples_split': 4, 'min_samples_leaf': 2, 'min_weight_fraction_leaf': 0.2869332014200028, 'min_impurity_decrease': 0.7498730079514233, 'max_features': 0.7963909666903793, 'subsample': 0.8489512409692385, 'dropout_rate': 0.4978918131165819, 'ccp_alpha': 1.3525229565413093}. Best is trial 379 with value: 0.878361797817203.[0m
[32m[I 2022-04-14 01:38:09,057][0m Trial 480 finished with value: 0.65 and parameters: {'loss': 'coxph', 'learning_rate': 1.6732764529505097e-06, 'n_estimators': 688, 'criterion': 'friedman_mse', 'min_samples_split': 5, 'min_samples_leaf': 2, 'min_weight_fraction_leaf': 0.046520398807173076, 'min_impurity_decrease': 0.4317902509360201, 'max_features': 0.8553376023700416, 'subsample': 0.8370751387472697, 'dropout_rate': 0.5579855831995315, 'ccp_alpha': 0.7585405316156104}. Best is trial 379 with value: 0.878361797817203.[0m
[32m[I 2022-04-14 01:39:19,654][0m Trial 481 finished with value: 0.8054266134510806 and parameters: {'loss': 'coxph', 'learning_rate': 1.976892114203224e-06, 'n_estimators': 718, 'criterion': 'friedman_mse', 'min_samples_split': 4, 'min_samples_leaf': 1, 'min_weight_fraction_leaf': 0.009705873278398017, 'min_impurity_decrease': 0.46534333761974983, 'max_features': 0.899683159007863, 'subsample': 0.8056397356184425, 'dropout_rate': 0.46379343112596016, 'ccp_alpha': 0.23807083068250767}. Best is trial 379 with value: 0.878361797817203.[0m
