[32m[I 2022-04-13 11:45:05,046][0m Trial 944 finished with value: 0.8537871744804019 and parameters: {'splitter': 'random', 'min_samples_split': 0.2825178294646151, 'min_samples_leaf': 0.032247091614114425, 'min_weight_fraction_leaf': 0.03141999505157424, 'max_features': 0.5146319245227544}. Best is trial 156 with value: 0.860262530255716.[0m
[32m[I 2022-04-13 11:45:05,152][0m Trial 945 finished with value: 0.8160553494736597 and parameters: {'splitter': 'random', 'min_samples_split': 0.27396272817653605, 'min_samples_leaf': 0.05571181852516986, 'min_weight_fraction_leaf': 0.01894014522168401, 'max_features': 0.6366506987132303}. Best is trial 156 with value: 0.860262530255716.[0m
[32m[I 2022-04-13 11:45:05,223][0m Trial 946 finished with value: 0.8272976824097471 and parameters: {'splitter': 'best', 'min_samples_split': 0.26272848499063933, 'min_samples_leaf': 0.0406684989917992, 'min_weight_fraction_leaf': 0.04301932799534905, 'max_features': 0.6567153703636172}. Best is trial 156 with value: 0.860262530255716.[0m
[32m[I 2022-04-13 11:45:05,346][0m Trial 947 finished with value: 0.8495779719052834 and parameters: {'splitter': 'random', 'min_samples_split': 0.29488076838146066, 'min_samples_leaf': 0.022572613664625547, 'min_weight_fraction_leaf': 0.056272205982803275, 'max_features': 0.5650522374296024}. Best is trial 156 with value: 0.860262530255716.[0m
[32m[I 2022-04-13 11:45:05,460][0m Trial 948 finished with value: 0.855608859465337 and parameters: {'splitter': 'random', 'min_samples_split': 0.26129205064652034, 'min_samples_leaf': 0.017967322160975022, 'min_weight_fraction_leaf': 0.047884471281727285, 'max_features': 0.5372120233957739}. Best is trial 156 with value: 0.860262530255716.[0m
[32m[I 2022-04-13 11:45:05,542][0m Trial 949 finished with value: 0.7865929809567938 and parameters: {'splitter': 'random', 'min_samples_split': 0.27321720695473406, 'min_samples_leaf': 0.07289901843617921, 'min_weight_fraction_leaf': 0.013524198383612018, 'max_features': 0.47790040060750877}. Best is trial 156 with value: 0.860262530255716.[0m
[32m[I 2022-04-13 11:45:05,651][0m Trial 950 finished with value: 0.8544192216908126 and parameters: {'splitter': 'random', 'min_samples_split': 0.24837023535152294, 'min_samples_leaf': 0.01717736329795445, 'min_weight_fraction_leaf': 0.03472236761567042, 'max_features': 0.5436381858070218}. Best is trial 156 with value: 0.860262530255716.[0m
[32m[I 2022-04-13 11:45:05,734][0m Trial 951 finished with value: 0.8490198370094999 and parameters: {'splitter': 'random', 'min_samples_split': 0.2530066248600785, 'min_samples_leaf': 0.001055330653887212, 'min_weight_fraction_leaf': 0.0896039557229682, 'max_features': 0.5052026049020485}. Best is trial 156 with value: 0.860262530255716.[0m
[32m[I 2022-04-13 11:45:05,899][0m Trial 952 finished with value: 0.8490198370094999 and parameters: {'splitter': 'random', 'min_samples_split': 0.25900573761458506, 'min_samples_leaf': 0.001042812592464984, 'min_weight_fraction_leaf': 0.09096694933447512, 'max_features': 0.5556048496320091}. Best is trial 156 with value: 0.860262530255716.[0m
[32m[I 2022-04-13 11:45:06,107][0m Trial 953 finished with value: 0.8537871744804019 and parameters: {'splitter': 'random', 'min_samples_split': 0.28240572939801417, 'min_samples_leaf': 0.009439308563182612, 'min_weight_fraction_leaf': 0.028958282186260474, 'max_features': 0.5132133695384585}. Best is trial 156 with value: 0.860262530255716.[0m
[32m[I 2022-04-13 11:45:06,296][0m Trial 954 finished with value: 0.8100552370527392 and parameters: {'splitter': 'random', 'min_samples_split': 0.27663699636656597, 'min_samples_leaf': 0.04249657259249744, 'min_weight_fraction_leaf': 0.05585727358932152, 'max_features': 0.6414459893627533}. Best is trial 156 with value: 0.860262530255716.[0m
[32m[I 2022-04-13 11:45:06,480][0m Trial 955 finished with value: 0.8544192216908126 and parameters: {'splitter': 'random', 'min_samples_split': 0.233400700935618, 'min_samples_leaf': 0.027978302532699856, 'min_weight_fraction_leaf': 0.036877487153496785, 'max_features': 0.5182344792783897}. Best is trial 156 with value: 0.860262530255716.[0m
[32m[I 2022-04-13 11:45:06,652][0m Trial 956 finished with value: 0.8074348446604583 and parameters: {'splitter': 'random', 'min_samples_split': 0.2152568050909292, 'min_samples_leaf': 0.03208271596871023, 'min_weight_fraction_leaf': 0.04704439097281002, 'max_features': 0.4844236606117544}. Best is trial 156 with value: 0.860262530255716.[0m
[32m[I 2022-04-13 11:45:06,872][0m Trial 957 finished with value: 0.8537871744804019 and parameters: {'splitter': 'random', 'min_samples_split': 0.28901187328858197, 'min_samples_leaf': 0.05575173756565842, 'min_weight_fraction_leaf': 0.061158347935557536, 'max_features': 0.615502627473321}. Best is trial 156 with value: 0.860262530255716.[0m
[32m[I 2022-04-13 11:45:07,078][0m Trial 958 finished with value: 0.8516831856788973 and parameters: {'splitter': 'random', 'min_samples_split': 0.2215970364694829, 'min_samples_leaf': 0.022698607515249804, 'min_weight_fraction_leaf': 0.05409156426432432, 'max_features': 0.5282179536093801}. Best is trial 156 with value: 0.860262530255716.[0m
[32m[I 2022-04-13 11:45:07,280][0m Trial 959 finished with value: 0.8484399756279405 and parameters: {'splitter': 'random', 'min_samples_split': 0.24917486958535168, 'min_samples_leaf': 0.033591746862314115, 'min_weight_fraction_leaf': 0.07924295320429886, 'max_features': 0.5894696332322187}. Best is trial 156 with value: 0.860262530255716.[0m
[32m[I 2022-04-13 11:45:07,476][0m Trial 960 finished with value: 0.8529006717303197 and parameters: {'splitter': 'random', 'min_samples_split': 0.2625952841109156, 'min_samples_leaf': 0.00999296745140928, 'min_weight_fraction_leaf': 0.10773680218323789, 'max_features': 0.5693149552491925}. Best is trial 156 with value: 0.860262530255716.[0m
[32m[I 2022-04-13 11:45:07,632][0m Trial 961 finished with value: 0.8484399756279405 and parameters: {'splitter': 'random', 'min_samples_split': 0.2364813581693391, 'min_samples_leaf': 0.07284053372311383, 'min_weight_fraction_leaf': 0.08257452424549609, 'max_features': 0.6240139030076315}. Best is trial 156 with value: 0.860262530255716.[0m
[32m[I 2022-04-13 11:45:07,747][0m Trial 962 finished with value: 0.855608859465337 and parameters: {'splitter': 'random', 'min_samples_split': 0.25347395330384, 'min_samples_leaf': 0.01923692380640785, 'min_weight_fraction_leaf': 0.03338924549810063, 'max_features': 0.5143666948502934}. Best is trial 156 with value: 0.860262530255716.[0m
[32m[I 2022-04-13 11:45:07,860][0m Trial 963 finished with value: 0.7198229604370424 and parameters: {'splitter': 'best', 'min_samples_split': 0.3018424381049667, 'min_samples_leaf': 0.2197320446785221, 'min_weight_fraction_leaf': 0.06953941146429912, 'max_features': 0.4935631004581681}. Best is trial 156 with value: 0.860262530255716.[0m
[32m[I 2022-04-13 11:45:07,968][0m Trial 964 finished with value: 0.860262530255716 and parameters: {'splitter': 'random', 'min_samples_split': 0.26938258299933, 'min_samples_leaf': 0.036649030371840426, 'min_weight_fraction_leaf': 0.07379631421211298, 'max_features': 0.5877238014903448}. Best is trial 156 with value: 0.860262530255716.[0m
[32m[I 2022-04-13 11:45:08,094][0m Trial 965 finished with value: 0.8495779719052834 and parameters: {'splitter': 'random', 'min_samples_split': 0.29194573793210987, 'min_samples_leaf': 0.039206454855121975, 'min_weight_fraction_leaf': 0.06883863702903507, 'max_features': 0.580166089288193}. Best is trial 156 with value: 0.860262530255716.[0m
[32m[I 2022-04-13 11:45:08,206][0m Trial 966 finished with value: 0.8537871744804019 and parameters: {'splitter': 'random', 'min_samples_split': 0.2804190537655671, 'min_samples_leaf': 0.06614022018325004, 'min_weight_fraction_leaf': 0.06673426678730261, 'max_features': 0.5766440303676834}. Best is trial 156 with value: 0.860262530255716.[0m
[32m[I 2022-04-13 11:45:08,303][0m Trial 967 finished with value: 0.7429976200043187 and parameters: {'splitter': 'random', 'min_samples_split': 0.43311689025554334, 'min_samples_leaf': 0.05169900052141081, 'min_weight_fraction_leaf': 0.043922367948084, 'max_features': 0.5479844694337028}. Best is trial 156 with value: 0.860262530255716.[0m
[32m[I 2022-04-13 11:45:08,405][0m Trial 968 finished with value: 0.8537871744804019 and parameters: {'splitter': 'random', 'min_samples_split': 0.27735477401250525, 'min_samples_leaf': 0.052931675130492475, 'min_weight_fraction_leaf': 0.05546228370166468, 'max_features': 0.5716677353847797}. Best is trial 156 with value: 0.860262530255716.[0m
[32m[I 2022-04-13 11:45:08,487][0m Trial 969 finished with value: 0.7917045353064339 and parameters: {'splitter': 'random', 'min_samples_split': 0.27073552327187494, 'min_samples_leaf': 0.05233615862921236, 'min_weight_fraction_leaf': 0.02222148130987718, 'max_features': 0.08116134180617374}. Best is trial 156 with value: 0.860262530255716.[0m
[32m[I 2022-04-13 11:45:08,597][0m Trial 970 finished with value: 0.8495779719052834 and parameters: {'splitter': 'random', 'min_samples_split': 0.2942571160720894, 'min_samples_leaf': 0.06166902130643459, 'min_weight_fraction_leaf': 0.055661769544666284, 'max_features': 0.5827077535812858}. Best is trial 156 with value: 0.860262530255716.[0m
[32m[I 2022-04-13 11:45:08,648][0m Trial 971 finished with value: 0.8136417764377363 and parameters: {'splitter': 'random', 'min_samples_split': 0.2703543620558879, 'min_samples_leaf': 0.02484818042950371, 'min_weight_fraction_leaf': 0.01663432388510109, 'max_features': 0.4873696528888574}. Best is trial 156 with value: 0.860262530255716.[0m
[32m[I 2022-04-13 11:45:08,750][0m Trial 972 finished with value: 0.8569159849035302 and parameters: {'splitter': 'random', 'min_samples_split': 0.2653169313663422, 'min_samples_leaf': 0.10704076617648794, 'min_weight_fraction_leaf': 0.04949241060561801, 'max_features': 0.5581105540763098}. Best is trial 156 with value: 0.860262530255716.[0m
[32m[I 2022-04-13 11:45:08,830][0m Trial 973 finished with value: 0.8537871744804019 and parameters: {'splitter': 'random', 'min_samples_split': 0.2804053188394069, 'min_samples_leaf': 0.03545799556525694, 'min_weight_fraction_leaf': 0.040379670742704966, 'max_features': 0.5453520081657299}. Best is trial 156 with value: 0.860262530255716.[0m
[32m[I 2022-04-13 11:45:08,917][0m Trial 974 finished with value: 0.8537871744804019 and parameters: {'splitter': 'random', 'min_samples_split': 0.2869349906327755, 'min_samples_leaf': 0.04855896454710765, 'min_weight_fraction_leaf': 0.05038338785108528, 'max_features': 0.6004341227686807}. Best is trial 156 with value: 0.860262530255716.[0m
[32m[I 2022-04-13 11:45:09,010][0m Trial 975 finished with value: 0.8507321463909226 and parameters: {'splitter': 'random', 'min_samples_split': 0.25646694181457214, 'min_samples_leaf': 0.017161626464408893, 'min_weight_fraction_leaf': 0.09639139851799326, 'max_features': 0.5343849922202344}. Best is trial 156 with value: 0.860262530255716.[0m
[32m[I 2022-04-13 11:45:09,063][0m Trial 976 finished with value: 0.855608859465337 and parameters: {'splitter': 'random', 'min_samples_split': 0.2571665983422706, 'min_samples_leaf': 0.011174554532736854, 'min_weight_fraction_leaf': 0.045475178764173, 'max_features': 0.5324851341766224}. Best is trial 156 with value: 0.860262530255716.[0m
[32m[I 2022-04-13 11:45:09,235][0m Trial 977 finished with value: 0.8536735077998788 and parameters: {'splitter': 'random', 'min_samples_split': 0.26499613720424, 'min_samples_leaf': 0.015411378110846172, 'min_weight_fraction_leaf': 0.07896848641895633, 'max_features': 0.5553126875095622}. Best is trial 156 with value: 0.860262530255716.[0m
[32m[I 2022-04-13 11:45:09,405][0m Trial 978 finished with value: 0.6332669867606551 and parameters: {'splitter': 'random', 'min_samples_split': 0.26535861251926657, 'min_samples_leaf': 0.07999561329468566, 'min_weight_fraction_leaf': 0.3066630457639893, 'max_features': 0.6123536577187251}. Best is trial 156 with value: 0.860262530255716.[0m
[32m[I 2022-04-13 11:45:09,661][0m Trial 979 finished with value: 0.8109417480001758 and parameters: {'splitter': 'random', 'min_samples_split': 0.2775812325077455, 'min_samples_leaf': 0.03068747323291291, 'min_weight_fraction_leaf': 0.07631670462645569, 'max_features': 0.6342871142458343}. Best is trial 156 with value: 0.860262530255716.[0m
[32m[I 2022-04-13 11:45:09,779][0m Trial 980 finished with value: 0.6188081862944745 and parameters: {'splitter': 'random', 'min_samples_split': 0.26962607945729333, 'min_samples_leaf': 0.04563987636625487, 'min_weight_fraction_leaf': 0.3479581018817542, 'max_features': 0.49708615825593955}. Best is trial 156 with value: 0.860262530255716.[0m
[32m[I 2022-04-13 11:45:09,912][0m Trial 981 finished with value: 0.6728429814727136 and parameters: {'splitter': 'random', 'min_samples_split': 0.3539564729307393, 'min_samples_leaf': 0.05903933564569511, 'min_weight_fraction_leaf': 0.027196341094112262, 'max_features': 0.4561526982171805}. Best is trial 156 with value: 0.860262530255716.[0m
[32m[I 2022-04-13 11:45:10,224][0m Trial 982 finished with value: 0.7445764336842451 and parameters: {'splitter': 'random', 'min_samples_split': 0.24356680193547262, 'min_samples_leaf': 0.1812915312390732, 'min_weight_fraction_leaf': 0.03370799896105542, 'max_features': 0.5120887359890076}. Best is trial 156 with value: 0.860262530255716.[0m
[32m[I 2022-04-13 11:45:10,439][0m Trial 983 finished with value: 0.860262530255716 and parameters: {'splitter': 'random', 'min_samples_split': 0.27057284698648654, 'min_samples_leaf': 0.03615617959710397, 'min_weight_fraction_leaf': 0.07383067185977733, 'max_features': 0.6062425459178225}. Best is trial 156 with value: 0.860262530255716.[0m
[32m[I 2022-04-13 11:45:10,625][0m Trial 984 finished with value: 0.8501522850093632 and parameters: {'splitter': 'random', 'min_samples_split': 0.24984732190243764, 'min_samples_leaf': 0.00921384027779821, 'min_weight_fraction_leaf': 0.09744309983828713, 'max_features': 0.5903410800315745}. Best is trial 156 with value: 0.860262530255716.[0m
[32m[I 2022-04-13 11:45:10,820][0m Trial 985 finished with value: 0.7099663963089992 and parameters: {'splitter': 'best', 'min_samples_split': 0.4999939640347476, 'min_samples_leaf': 0.40312523229859293, 'min_weight_fraction_leaf': 0.006051016332895233, 'max_features': 0.4323928645715523}. Best is trial 156 with value: 0.860262530255716.[0m
[32m[I 2022-04-13 11:45:11,054][0m Trial 986 finished with value: 0.8169418604210963 and parameters: {'splitter': 'random', 'min_samples_split': 0.2703652048701851, 'min_samples_leaf': 0.07569103317270032, 'min_weight_fraction_leaf': 0.06097896814692101, 'max_features': 0.7075472957647504}. Best is trial 156 with value: 0.860262530255716.[0m
[32m[I 2022-04-13 11:45:11,274][0m Trial 987 finished with value: 0.8130092299201734 and parameters: {'splitter': 'random', 'min_samples_split': 0.2789824718614538, 'min_samples_leaf': 0.04242196302897105, 'min_weight_fraction_leaf': 0.08510259088481, 'max_features': 0.6633556681091024}. Best is trial 156 with value: 0.860262530255716.[0m
[32m[I 2022-04-13 11:45:11,346][0m Trial 988 finished with value: 0.8049220950014153 and parameters: {'splitter': 'random', 'min_samples_split': 0.2891229713406155, 'min_samples_leaf': 0.06258367786827757, 'min_weight_fraction_leaf': 0.21009133903377547, 'max_features': 0.6345189158293071}. Best is trial 156 with value: 0.860262530255716.[0m
[32m[I 2022-04-13 11:45:11,417][0m Trial 989 finished with value: 0.7926302513631336 and parameters: {'splitter': 'random', 'min_samples_split': 0.3209389937111641, 'min_samples_leaf': 0.05060303379898563, 'min_weight_fraction_leaf': 0.05261457053089066, 'max_features': 0.47075504802209944}. Best is trial 156 with value: 0.860262530255716.[0m
[32m[I 2022-04-13 11:45:11,489][0m Trial 990 finished with value: 0.855608859465337 and parameters: {'splitter': 'random', 'min_samples_split': 0.2571260815146734, 'min_samples_leaf': 0.02177103528803825, 'min_weight_fraction_leaf': 0.040848597259489264, 'max_features': 0.525921816171376}. Best is trial 156 with value: 0.860262530255716.[0m
[32m[I 2022-04-13 11:45:11,560][0m Trial 991 finished with value: 0.8537871744804019 and parameters: {'splitter': 'random', 'min_samples_split': 0.2786663480730043, 'min_samples_leaf': 0.03840910226879515, 'min_weight_fraction_leaf': 0.037235747245430204, 'max_features': 0.5681754800895495}. Best is trial 156 with value: 0.860262530255716.[0m
[32m[I 2022-04-13 11:45:11,630][0m Trial 992 finished with value: 0.8432776267867528 and parameters: {'splitter': 'random', 'min_samples_split': 0.13588537407466383, 'min_samples_leaf': 0.04485760943627997, 'min_weight_fraction_leaf': 0.07771554720188761, 'max_features': 0.5990098648596608}. Best is trial 156 with value: 0.860262530255716.[0m
[32m[I 2022-04-13 11:45:11,700][0m Trial 993 finished with value: 0.860262530255716 and parameters: {'splitter': 'random', 'min_samples_split': 0.26346815178438143, 'min_samples_leaf': 0.029368608216684598, 'min_weight_fraction_leaf': 0.04385258157911523, 'max_features': 0.5376636383284746}. Best is trial 156 with value: 0.860262530255716.[0m
[32m[I 2022-04-13 11:45:11,771][0m Trial 994 finished with value: 0.8541689983710665 and parameters: {'splitter': 'random', 'min_samples_split': 0.24577734011305638, 'min_samples_leaf': 0.024335051418501594, 'min_weight_fraction_leaf': 0.04571922643879022, 'max_features': 0.5407742892492751}. Best is trial 156 with value: 0.860262530255716.[0m
[32m[I 2022-04-13 11:45:11,841][0m Trial 995 finished with value: 0.678946779212211 and parameters: {'splitter': 'random', 'min_samples_split': 0.2593711863986952, 'min_samples_leaf': 0.08913601272116398, 'min_weight_fraction_leaf': 0.02312298542734087, 'max_features': 0.4568284156836412}. Best is trial 156 with value: 0.860262530255716.[0m
[32m[I 2022-04-13 11:45:11,911][0m Trial 996 finished with value: 0.8169418604210963 and parameters: {'splitter': 'random', 'min_samples_split': 0.2749239296842919, 'min_samples_leaf': 0.06497086116002479, 'min_weight_fraction_leaf': 0.06873660358902807, 'max_features': 0.7294020466246939}. Best is trial 156 with value: 0.860262530255716.[0m
[32m[I 2022-04-13 11:45:12,575][0m Trial 997 finished with value: 0.8484399756279405 and parameters: {'splitter': 'random', 'min_samples_split': 0.23925843244517545, 'min_samples_leaf': 0.08081136703965969, 'min_weight_fraction_leaf': 0.06554028458296056, 'max_features': 0.587567284070398}. Best is trial 156 with value: 0.860262530255716.[0m
[32m[I 2022-04-13 11:45:12,772][0m Trial 998 finished with value: 0.8537871744804019 and parameters: {'splitter': 'random', 'min_samples_split': 0.2832496070159894, 'min_samples_leaf': 0.009603715389180026, 'min_weight_fraction_leaf': 0.08160652603341498, 'max_features': 0.574672061406341}. Best is trial 156 with value: 0.860262530255716.[0m
[32m[I 2022-04-13 11:45:12,959][0m Trial 999 finished with value: 0.855608859465337 and parameters: {'splitter': 'random', 'min_samples_split': 0.25130248752268636, 'min_samples_leaf': 0.024229292330217086, 'min_weight_fraction_leaf': 0.0338500854922972, 'max_features': 0.5504052712456743}. Best is trial 156 with value: 0.860262530255716.[0m
[32m[I 2022-04-13 11:45:12,967][0m A new study created in memory with name: no-name-4bd437d3-9c65-45a5-8aa8-88faab0c0954[0m
[32m[I 2022-04-13 11:45:12,999][0m Trial 0 finished with value: 0.437616372588949 and parameters: {'splitter': 'random', 'min_samples_split': 0.4104103354377313, 'min_samples_leaf': 0.3576517017523483, 'min_weight_fraction_leaf': 0.33254806601960435, 'max_features': 0.40885840663541506}. Best is trial 0 with value: 0.437616372588949.[0m
[32m[I 2022-04-13 11:45:13,054][0m Trial 1 finished with value: 0.6544784711429183 and parameters: {'splitter': 'best', 'min_samples_split': 0.027442575506539696, 'min_samples_leaf': 0.04121637188279841, 'min_weight_fraction_leaf': 0.16699681179440873, 'max_features': 0.8710250215115762}. Best is trial 1 with value: 0.6544784711429183.[0m
[32m[I 2022-04-13 11:45:13,076][0m Trial 2 finished with value: 0.4590832554477756 and parameters: {'splitter': 'random', 'min_samples_split': 0.19807243324998586, 'min_samples_leaf': 0.299732214093996, 'min_weight_fraction_leaf': 0.3060852552060923, 'max_features': 0.8227521109290813}. Best is trial 1 with value: 0.6544784711429183.[0m
[32m[I 2022-04-13 11:45:13,121][0m Trial 3 finished with value: 0.4461871534019564 and parameters: {'splitter': 'best', 'min_samples_split': 0.23457985066216158, 'min_samples_leaf': 0.03546788273684211, 'min_weight_fraction_leaf': 0.30179293034645194, 'max_features': 0.08591657992929591}. Best is trial 1 with value: 0.6544784711429183.[0m
[32m[I 2022-04-13 11:45:13,146][0m Trial 4 finished with value: 0.4496098787702302 and parameters: {'splitter': 'best', 'min_samples_split': 0.48964169775502336, 'min_samples_leaf': 0.474601410890287, 'min_weight_fraction_leaf': 0.3956323872956516, 'max_features': 0.11918361664902666}. Best is trial 1 with value: 0.6544784711429183.[0m
[32m[I 2022-04-13 11:45:13,182][0m Trial 5 finished with value: 0.6356612618118771 and parameters: {'splitter': 'best', 'min_samples_split': 0.25371382540977666, 'min_samples_leaf': 0.3841669499839097, 'min_weight_fraction_leaf': 0.21011200443317357, 'max_features': 0.2525130174423168}. Best is trial 1 with value: 0.6544784711429183.[0m
[32m[I 2022-04-13 11:45:13,208][0m Trial 6 finished with value: 0.4364514609854459 and parameters: {'splitter': 'best', 'min_samples_split': 0.016721064857079162, 'min_samples_leaf': 0.11356949923775045, 'min_weight_fraction_leaf': 0.4583020457049168, 'max_features': 0.6579151226980529}. Best is trial 1 with value: 0.6544784711429183.[0m
