[32m[I 2022-04-13 13:54:13,831][0m Trial 122 finished with value: 0.8511780341064272 and parameters: {'loss': 'coxph', 'learning_rate': 0.0026095966709610927, 'n_estimators': 940, 'criterion': 'friedman_mse', 'min_samples_split': 2, 'min_samples_leaf': 8, 'min_weight_fraction_leaf': 0.2258119518521174, 'min_impurity_decrease': 0.010733309524608516, 'max_features': 0.7658990716916526, 'subsample': 0.7076606607899983, 'dropout_rate': 0.08120722755354054, 'ccp_alpha': 0.03609683718918305}. Best is trial 115 with value: 0.859066160325809.[0m
[32m[I 2022-04-13 13:58:00,352][0m Trial 123 finished with value: 0.8493578876341354 and parameters: {'loss': 'coxph', 'learning_rate': 0.0025371275511937626, 'n_estimators': 941, 'criterion': 'friedman_mse', 'min_samples_split': 2, 'min_samples_leaf': 8, 'min_weight_fraction_leaf': 0.22746470156271553, 'min_impurity_decrease': 0.0013919043555943589, 'max_features': 0.8261834376960726, 'subsample': 0.7117211688444395, 'dropout_rate': 0.07742417644333878, 'ccp_alpha': 0.034477638246989864}. Best is trial 115 with value: 0.859066160325809.[0m
[32m[I 2022-04-13 14:00:12,923][0m Trial 124 finished with value: 0.8653554334683442 and parameters: {'loss': 'coxph', 'learning_rate': 0.00300888352432341, 'n_estimators': 739, 'criterion': 'friedman_mse', 'min_samples_split': 2, 'min_samples_leaf': 8, 'min_weight_fraction_leaf': 0.1966155533998687, 'min_impurity_decrease': 0.008715835746140571, 'max_features': 0.7563019362242587, 'subsample': 0.6914215498695131, 'dropout_rate': 0.07990792814402001, 'ccp_alpha': 0.1128627858820795}. Best is trial 124 with value: 0.8653554334683442.[0m
[32m[I 2022-04-13 14:02:31,630][0m Trial 125 finished with value: 0.8584417138870757 and parameters: {'loss': 'coxph', 'learning_rate': 0.001321313445295239, 'n_estimators': 727, 'criterion': 'friedman_mse', 'min_samples_split': 2, 'min_samples_leaf': 8, 'min_weight_fraction_leaf': 0.1992157059918663, 'min_impurity_decrease': 0.005881072136783895, 'max_features': 0.7654817292505802, 'subsample': 0.7527828152141384, 'dropout_rate': 0.07445520890346242, 'ccp_alpha': 0.1522610905942453}. Best is trial 124 with value: 0.8653554334683442.[0m
[32m[I 2022-04-13 14:04:36,327][0m Trial 126 finished with value: 0.8505984961598733 and parameters: {'loss': 'coxph', 'learning_rate': 0.0015865149657623354, 'n_estimators': 741, 'criterion': 'friedman_mse', 'min_samples_split': 2, 'min_samples_leaf': 8, 'min_weight_fraction_leaf': 0.19524523872048885, 'min_impurity_decrease': 0.00578051179134743, 'max_features': 0.7618738202373416, 'subsample': 0.7835526631003914, 'dropout_rate': 0.08810200883973793, 'ccp_alpha': 0.16314189909650942}. Best is trial 124 with value: 0.8653554334683442.[0m
[32m[I 2022-04-13 14:06:58,023][0m Trial 127 finished with value: 0.8627944954904517 and parameters: {'loss': 'coxph', 'learning_rate': 0.0038587639655725593, 'n_estimators': 736, 'criterion': 'friedman_mse', 'min_samples_split': 2, 'min_samples_leaf': 8, 'min_weight_fraction_leaf': 0.2005026409874185, 'min_impurity_decrease': 0.0017939569106001987, 'max_features': 0.7598705789472469, 'subsample': 0.7519729089387495, 'dropout_rate': 0.05614025227409527, 'ccp_alpha': 0.13770383322102875}. Best is trial 124 with value: 0.8653554334683442.[0m
[32m[I 2022-04-13 14:09:19,947][0m Trial 128 finished with value: 0.8604611607076261 and parameters: {'loss': 'coxph', 'learning_rate': 0.0008390948477309575, 'n_estimators': 749, 'criterion': 'friedman_mse', 'min_samples_split': 2, 'min_samples_leaf': 7, 'min_weight_fraction_leaf': 0.19870794897929098, 'min_impurity_decrease': 0.004619051058274794, 'max_features': 0.7607848874711466, 'subsample': 0.7565369876058345, 'dropout_rate': 0.05261538610036694, 'ccp_alpha': 0.15504655452074034}. Best is trial 124 with value: 0.8653554334683442.[0m
[32m[I 2022-04-13 14:11:39,596][0m Trial 129 finished with value: 0.8627944954904517 and parameters: {'loss': 'coxph', 'learning_rate': 0.0016050827817623596, 'n_estimators': 745, 'criterion': 'friedman_mse', 'min_samples_split': 2, 'min_samples_leaf': 7, 'min_weight_fraction_leaf': 0.19368444873457322, 'min_impurity_decrease': 0.045144893081666845, 'max_features': 0.7544160122734999, 'subsample': 0.7616279261561171, 'dropout_rate': 0.04858575225063022, 'ccp_alpha': 0.14451112016809697}. Best is trial 124 with value: 0.8653554334683442.[0m
[32m[I 2022-04-13 14:13:40,565][0m Trial 130 finished with value: 0.865261092759677 and parameters: {'loss': 'coxph', 'learning_rate': 0.0009106379047223303, 'n_estimators': 729, 'criterion': 'friedman_mse', 'min_samples_split': 2, 'min_samples_leaf': 7, 'min_weight_fraction_leaf': 0.20414934257869782, 'min_impurity_decrease': 0.0031990192538494102, 'max_features': 0.7543438166672835, 'subsample': 0.7656837483418004, 'dropout_rate': 0.13893395942098558, 'ccp_alpha': 0.13579047153773802}. Best is trial 124 with value: 0.8653554334683442.[0m
[32m[I 2022-04-13 14:15:39,583][0m Trial 131 finished with value: 0.8536656751235816 and parameters: {'loss': 'coxph', 'learning_rate': 0.0008810774350111551, 'n_estimators': 710, 'criterion': 'friedman_mse', 'min_samples_split': 2, 'min_samples_leaf': 7, 'min_weight_fraction_leaf': 0.1988023586327411, 'min_impurity_decrease': 0.00432545167079439, 'max_features': 0.7510521087654842, 'subsample': 0.760967338082073, 'dropout_rate': 0.13553841060907498, 'ccp_alpha': 0.16629620094134798}. Best is trial 124 with value: 0.8653554334683442.[0m
[32m[I 2022-04-13 14:17:41,014][0m Trial 132 finished with value: 0.8620997550002001 and parameters: {'loss': 'coxph', 'learning_rate': 0.0008412002481520277, 'n_estimators': 726, 'criterion': 'friedman_mse', 'min_samples_split': 2, 'min_samples_leaf': 7, 'min_weight_fraction_leaf': 0.1968353706442053, 'min_impurity_decrease': 0.04556615700912864, 'max_features': 0.6983052364990978, 'subsample': 0.7610387012027703, 'dropout_rate': 0.023363369601363412, 'ccp_alpha': 0.1357927326932887}. Best is trial 124 with value: 0.8653554334683442.[0m
[32m[I 2022-04-13 14:20:03,272][0m Trial 133 finished with value: 0.8518739773801698 and parameters: {'loss': 'coxph', 'learning_rate': 0.0008363096876045871, 'n_estimators': 736, 'criterion': 'friedman_mse', 'min_samples_split': 2, 'min_samples_leaf': 7, 'min_weight_fraction_leaf': 0.1970650958570052, 'min_impurity_decrease': 0.0748084366113835, 'max_features': 0.7057530459396645, 'subsample': 0.7857041661604048, 'dropout_rate': 0.020463850958529588, 'ccp_alpha': 0.16533761357112886}. Best is trial 124 with value: 0.8653554334683442.[0m
[32m[I 2022-04-13 14:22:27,914][0m Trial 134 finished with value: 0.8063949632423946 and parameters: {'loss': 'coxph', 'learning_rate': 0.0008608709120870601, 'n_estimators': 741, 'criterion': 'friedman_mse', 'min_samples_split': 2, 'min_samples_leaf': 7, 'min_weight_fraction_leaf': 0.2004632492124134, 'min_impurity_decrease': 0.04997108320456418, 'max_features': 0.701188304414265, 'subsample': 0.7542016987236096, 'dropout_rate': 0.00550402565614763, 'ccp_alpha': 0.2673046092787724}. Best is trial 124 with value: 0.8653554334683442.[0m
[32m[I 2022-04-13 14:24:39,001][0m Trial 135 finished with value: 0.6524506958451449 and parameters: {'loss': 'coxph', 'learning_rate': 0.004104023153114745, 'n_estimators': 738, 'criterion': 'friedman_mse', 'min_samples_split': 2, 'min_samples_leaf': 7, 'min_weight_fraction_leaf': 0.19076301638875443, 'min_impurity_decrease': 0.0683451020542126, 'max_features': 0.7416397594610376, 'subsample': 0.7500773589141004, 'dropout_rate': 0.033075658464180195, 'ccp_alpha': 0.33470921994696545}. Best is trial 124 with value: 0.8653554334683442.[0m
[32m[I 2022-04-13 14:27:03,949][0m Trial 136 finished with value: 0.8648018433318064 and parameters: {'loss': 'coxph', 'learning_rate': 0.0009410536357982463, 'n_estimators': 817, 'criterion': 'friedman_mse', 'min_samples_split': 2, 'min_samples_leaf': 7, 'min_weight_fraction_leaf': 0.17835236855260336, 'min_impurity_decrease': 0.040619668544811235, 'max_features': 0.771730764704548, 'subsample': 0.8251040494410503, 'dropout_rate': 0.13558225085576445, 'ccp_alpha': 0.1368639463178726}. Best is trial 124 with value: 0.8653554334683442.[0m
[32m[I 2022-04-13 14:28:58,210][0m Trial 137 finished with value: 0.8497489263680365 and parameters: {'loss': 'coxph', 'learning_rate': 0.0009589599621334382, 'n_estimators': 674, 'criterion': 'friedman_mse', 'min_samples_split': 2, 'min_samples_leaf': 7, 'min_weight_fraction_leaf': 0.17949897854743882, 'min_impurity_decrease': 0.04785562394633441, 'max_features': 0.7347859287766899, 'subsample': 0.8258425441940962, 'dropout_rate': 0.13471729906711732, 'ccp_alpha': 0.1784915310983192}. Best is trial 124 with value: 0.8653554334683442.[0m
[32m[I 2022-04-13 14:31:39,383][0m Trial 138 finished with value: -0.3657614023388189 and parameters: {'loss': 'squared', 'learning_rate': 0.0011523820427584094, 'n_estimators': 800, 'criterion': 'friedman_mse', 'min_samples_split': 2, 'min_samples_leaf': 7, 'min_weight_fraction_leaf': 0.21262107953989035, 'min_impurity_decrease': 0.07933373441296374, 'max_features': 0.8511300242784723, 'subsample': 0.8013555443747542, 'dropout_rate': 0.04906183483797843, 'ccp_alpha': 0.337204073370026}. Best is trial 124 with value: 0.8653554334683442.[0m
[32m[I 2022-04-13 14:34:01,485][0m Trial 139 finished with value: 0.8620997550002001 and parameters: {'loss': 'coxph', 'learning_rate': 0.0008431348996482087, 'n_estimators': 712, 'criterion': 'friedman_mse', 'min_samples_split': 2, 'min_samples_leaf': 7, 'min_weight_fraction_leaf': 0.20188495844336252, 'min_impurity_decrease': 0.041237965137919844, 'max_features': 0.7090487214692555, 'subsample': 0.7707464245927744, 'dropout_rate': 0.025332433270446125, 'ccp_alpha': 0.13890299999490094}. Best is trial 124 with value: 0.8653554334683442.[0m
[32m[I 2022-04-13 14:36:23,508][0m Trial 140 finished with value: 0.8544710929894116 and parameters: {'loss': 'coxph', 'learning_rate': 0.0008081673432414123, 'n_estimators': 707, 'criterion': 'friedman_mse', 'min_samples_split': 3, 'min_samples_leaf': 7, 'min_weight_fraction_leaf': 0.20270157188144178, 'min_impurity_decrease': 0.047098929610837524, 'max_features': 0.7084577747543309, 'subsample': 0.8592652432175589, 'dropout_rate': 0.015864018130426753, 'ccp_alpha': 0.13229417390600254}. Best is trial 124 with value: 0.8653554334683442.[0m
[32m[I 2022-04-13 14:38:11,578][0m Trial 141 finished with value: 0.854735140244012 and parameters: {'loss': 'coxph', 'learning_rate': 0.0008721596439398686, 'n_estimators': 649, 'criterion': 'friedman_mse', 'min_samples_split': 2, 'min_samples_leaf': 7, 'min_weight_fraction_leaf': 0.20271114279163951, 'min_impurity_decrease': 0.06698209044838677, 'max_features': 0.701539706315106, 'subsample': 0.8779761491043608, 'dropout_rate': 0.00012099828946134789, 'ccp_alpha': 0.1436969582986076}. Best is trial 124 with value: 0.8653554334683442.[0m
[32m[I 2022-04-13 14:40:27,079][0m Trial 142 finished with value: 0.65 and parameters: {'loss': 'coxph', 'learning_rate': 0.0005650157311082917, 'n_estimators': 712, 'criterion': 'friedman_mse', 'min_samples_split': 2, 'min_samples_leaf': 7, 'min_weight_fraction_leaf': 0.17765844702172096, 'min_impurity_decrease': 0.03899640471882023, 'max_features': 0.7481049571264322, 'subsample': 0.8731608376779766, 'dropout_rate': 0.002492977167469195, 'ccp_alpha': 0.5940128927372209}. Best is trial 124 with value: 0.8653554334683442.[0m
[32m[I 2022-04-13 14:42:13,515][0m Trial 143 finished with value: 0.8601597546204035 and parameters: {'loss': 'coxph', 'learning_rate': 0.0010936766377903026, 'n_estimators': 623, 'criterion': 'friedman_mse', 'min_samples_split': 3, 'min_samples_leaf': 7, 'min_weight_fraction_leaf': 0.2064427597900286, 'min_impurity_decrease': 0.058310406825131736, 'max_features': 0.7783432805984418, 'subsample': 0.740156014358161, 'dropout_rate': 0.041089184528265155, 'ccp_alpha': 0.15045372502291846}. Best is trial 124 with value: 0.8653554334683442.[0m
[32m[I 2022-04-13 14:44:17,991][0m Trial 144 finished with value: 0.6708260842914648 and parameters: {'loss': 'coxph', 'learning_rate': 0.0007073721881422016, 'n_estimators': 647, 'criterion': 'friedman_mse', 'min_samples_split': 3, 'min_samples_leaf': 7, 'min_weight_fraction_leaf': 0.20305449245461196, 'min_impurity_decrease': 0.06149132641517102, 'max_features': 0.6889072935563686, 'subsample': 0.7675037996700836, 'dropout_rate': 0.03236541954125299, 'ccp_alpha': 0.28955854960680527}. Best is trial 124 with value: 0.8653554334683442.[0m
[32m[I 2022-04-13 14:46:09,639][0m Trial 145 finished with value: 0.8465489062388001 and parameters: {'loss': 'coxph', 'learning_rate': 0.0010516035540597017, 'n_estimators': 636, 'criterion': 'friedman_mse', 'min_samples_split': 3, 'min_samples_leaf': 7, 'min_weight_fraction_leaf': 0.18660517077317143, 'min_impurity_decrease': 0.0971297817718768, 'max_features': 0.7789967549172092, 'subsample': 0.8491284387260998, 'dropout_rate': 0.05026667367220365, 'ccp_alpha': 0.14977955554983294}. Best is trial 124 with value: 0.8653554334683442.[0m
[32m[I 2022-04-13 14:48:42,537][0m Trial 146 finished with value: 0.65 and parameters: {'loss': 'coxph', 'learning_rate': 0.0020803886630253727, 'n_estimators': 770, 'criterion': 'friedman_mse', 'min_samples_split': 3, 'min_samples_leaf': 7, 'min_weight_fraction_leaf': 0.20742651786649277, 'min_impurity_decrease': 0.049579735892644, 'max_features': 0.7221768239228675, 'subsample': 0.7339420073210997, 'dropout_rate': 0.02316115647030776, 'ccp_alpha': 0.39974266376506795}. Best is trial 124 with value: 0.8653554334683442.[0m
[32m[I 2022-04-13 14:50:39,778][0m Trial 147 finished with value: 0.6959744311204228 and parameters: {'loss': 'coxph', 'learning_rate': 0.0012518244419289066, 'n_estimators': 667, 'criterion': 'friedman_mse', 'min_samples_split': 2, 'min_samples_leaf': 7, 'min_weight_fraction_leaf': 0.1717561428845668, 'min_impurity_decrease': 0.10926442898271473, 'max_features': 0.7035383550905757, 'subsample': 0.8026250447121871, 'dropout_rate': 0.0007181212199227766, 'ccp_alpha': 0.26764846769635686}. Best is trial 124 with value: 0.8653554334683442.[0m
[32m[I 2022-04-13 14:52:36,791][0m Trial 148 finished with value: 0.8453991228575287 and parameters: {'loss': 'coxph', 'learning_rate': 0.0008985013676369666, 'n_estimators': 709, 'criterion': 'friedman_mse', 'min_samples_split': 2, 'min_samples_leaf': 7, 'min_weight_fraction_leaf': 0.21411067245638654, 'min_impurity_decrease': 0.03964959994942098, 'max_features': 0.7727353378799833, 'subsample': 0.8718801914901813, 'dropout_rate': 0.12601653331628138, 'ccp_alpha': 0.1567939605628924}. Best is trial 124 with value: 0.8653554334683442.[0m
[32m[I 2022-04-13 14:55:20,633][0m Trial 149 finished with value: 0.65 and parameters: {'loss': 'coxph', 'learning_rate': 0.0005423885698213156, 'n_estimators': 814, 'criterion': 'friedman_mse', 'min_samples_split': 2, 'min_samples_leaf': 7, 'min_weight_fraction_leaf': 0.2014131106812217, 'min_impurity_decrease': 0.07000657883196586, 'max_features': 0.7414224636016917, 'subsample': 0.7701676889266557, 'dropout_rate': 0.05525878845609092, 'ccp_alpha': 0.3488015240351897}. Best is trial 124 with value: 0.8653554334683442.[0m
[32m[I 2022-04-13 14:57:29,644][0m Trial 150 finished with value: 0.65 and parameters: {'loss': 'coxph', 'learning_rate': 0.003826773429668037, 'n_estimators': 758, 'criterion': 'friedman_mse', 'min_samples_split': 3, 'min_samples_leaf': 7, 'min_weight_fraction_leaf': 0.1871179545075665, 'min_impurity_decrease': 0.13249257676120127, 'max_features': 0.7546428218502518, 'subsample': 0.8185499831659917, 'dropout_rate': 0.1515806440986785, 'ccp_alpha': 0.5467980757513935}. Best is trial 124 with value: 0.8653554334683442.[0m
[32m[I 2022-04-13 15:00:21,127][0m Trial 151 finished with value: 0.85880560177311 and parameters: {'loss': 'coxph', 'learning_rate': 0.000695985616575962, 'n_estimators': 819, 'criterion': 'friedman_mse', 'min_samples_split': 2, 'min_samples_leaf': 7, 'min_weight_fraction_leaf': 0.21813444125786796, 'min_impurity_decrease': 0.0020636553065682423, 'max_features': 0.7837578892821695, 'subsample': 0.7380834032267485, 'dropout_rate': 0.044982956238957914, 'ccp_alpha': 0.16761593673126168}. Best is trial 124 with value: 0.8653554334683442.[0m
[32m[I 2022-04-13 15:02:25,745][0m Trial 152 finished with value: 0.8572242404797935 and parameters: {'loss': 'coxph', 'learning_rate': 0.0006705363942301902, 'n_estimators': 710, 'criterion': 'friedman_mse', 'min_samples_split': 2, 'min_samples_leaf': 7, 'min_weight_fraction_leaf': 0.21826250763480623, 'min_impurity_decrease': 0.042649653701930176, 'max_features': 0.7247869057598499, 'subsample': 0.7472667172070178, 'dropout_rate': 0.03893946822035658, 'ccp_alpha': 0.14847420293670074}. Best is trial 124 with value: 0.8653554334683442.[0m
[32m[I 2022-04-13 15:03:57,608][0m Trial 153 finished with value: 0.7893459627330899 and parameters: {'loss': 'coxph', 'learning_rate': 0.0006732664658722031, 'n_estimators': 615, 'criterion': 'friedman_mse', 'min_samples_split': 2, 'min_samples_leaf': 7, 'min_weight_fraction_leaf': 0.2166499755387918, 'min_impurity_decrease': 0.041206482895058995, 'max_features': 0.7861517055039019, 'subsample': 0.7307684945443987, 'dropout_rate': 0.03892374793668457, 'ccp_alpha': 0.29630724452397295}. Best is trial 124 with value: 0.8653554334683442.[0m
[32m[I 2022-04-13 15:07:54,949][0m Trial 154 finished with value: 0.8643619009808127 and parameters: {'loss': 'coxph', 'learning_rate': 0.0012571755756046494, 'n_estimators': 995, 'criterion': 'friedman_mse', 'min_samples_split': 2, 'min_samples_leaf': 7, 'min_weight_fraction_leaf': 0.1906233995323449, 'min_impurity_decrease': 0.08945212920807799, 'max_features': 0.8573276133326352, 'subsample': 0.7322280936962907, 'dropout_rate': 0.05250302741952141, 'ccp_alpha': 0.12206486878038957}. Best is trial 124 with value: 0.8653554334683442.[0m
[32m[I 2022-04-13 15:11:44,448][0m Trial 155 finished with value: 0.65 and parameters: {'loss': 'coxph', 'learning_rate': 0.0012745165008755319, 'n_estimators': 985, 'criterion': 'friedman_mse', 'min_samples_split': 2, 'min_samples_leaf': 7, 'min_weight_fraction_leaf': 0.1888874232392667, 'min_impurity_decrease': 0.08875520374292385, 'max_features': 0.8549852061415627, 'subsample': 0.7349531341009656, 'dropout_rate': 0.0487652565470063, 'ccp_alpha': 0.4620702510127024}. Best is trial 124 with value: 0.8653554334683442.[0m
[32m[I 2022-04-13 15:14:19,059][0m Trial 156 finished with value: 0.8583429540513532 and parameters: {'loss': 'coxph', 'learning_rate': 0.0019751627626998693, 'n_estimators': 812, 'criterion': 'friedman_mse', 'min_samples_split': 2, 'min_samples_leaf': 7, 'min_weight_fraction_leaf': 0.17747889349945253, 'min_impurity_decrease': 0.06436152734781868, 'max_features': 0.8759160101311406, 'subsample': 0.7862185716506334, 'dropout_rate': 0.031534662162321356, 'ccp_alpha': 0.13620669592620235}. Best is trial 124 with value: 0.8653554334683442.[0m
[32m[I 2022-04-13 15:16:53,065][0m Trial 157 finished with value: 0.83314044252478 and parameters: {'loss': 'coxph', 'learning_rate': 0.0019970197365544147, 'n_estimators': 813, 'criterion': 'friedman_mse', 'min_samples_split': 2, 'min_samples_leaf': 7, 'min_weight_fraction_leaf': 0.1540908010731562, 'min_impurity_decrease': 0.10689497063442105, 'max_features': 0.8851907907025348, 'subsample': 0.7803697354659231, 'dropout_rate': 0.058383710724454294, 'ccp_alpha': 0.25097458920129645}. Best is trial 124 with value: 0.8653554334683442.[0m
[32m[I 2022-04-13 15:19:19,714][0m Trial 158 finished with value: 0.8462285700449927 and parameters: {'loss': 'coxph', 'learning_rate': 0.006378586851635664, 'n_estimators': 773, 'criterion': 'friedman_mse', 'min_samples_split': 2, 'min_samples_leaf': 7, 'min_weight_fraction_leaf': 0.17640174448084847, 'min_impurity_decrease': 0.14491393900586902, 'max_features': 0.9163149602420937, 'subsample': 0.7439370207828114, 'dropout_rate': 0.029480195190226544, 'ccp_alpha': 0.23878037916171616}. Best is trial 124 with value: 0.8653554334683442.[0m
[32m[I 2022-04-13 15:22:08,599][0m Trial 159 finished with value: 0.6837465533715443 and parameters: {'loss': 'coxph', 'learning_rate': 0.0010958014971208959, 'n_estimators': 821, 'criterion': 'friedman_mse', 'min_samples_split': 2, 'min_samples_leaf': 7, 'min_weight_fraction_leaf': 0.16769786296416445, 'min_impurity_decrease': 0.08347970877269156, 'max_features': 0.8661604984714956, 'subsample': 0.6433944650167163, 'dropout_rate': 0.06455178924476226, 'ccp_alpha': 0.3751191395353028}. Best is trial 124 with value: 0.8653554334683442.[0m
[32m[I 2022-04-13 15:24:31,483][0m Trial 160 finished with value: -0.3216620233493111 and parameters: {'loss': 'squared', 'learning_rate': 0.0019177500057943994, 'n_estimators': 771, 'criterion': 'friedman_mse', 'min_samples_split': 2, 'min_samples_leaf': 7, 'min_weight_fraction_leaf': 0.2430562067154555, 'min_impurity_decrease': 0.056931527175629895, 'max_features': 0.7299495251158348, 'subsample': 0.8119385221238868, 'dropout_rate': 0.03776713073204, 'ccp_alpha': 0.6494279602572264}. Best is trial 124 with value: 0.8653554334683442.[0m
[32m[I 2022-04-13 15:26:36,286][0m Trial 161 finished with value: 0.8665031184376385 and parameters: {'loss': 'coxph', 'learning_rate': 0.000509887166199421, 'n_estimators': 679, 'criterion': 'friedman_mse', 'min_samples_split': 2, 'min_samples_leaf': 7, 'min_weight_fraction_leaf': 0.2122345646171353, 'min_impurity_decrease': 0.06594496498258778, 'max_features': 0.7841067984292428, 'subsample': 0.7977182361723163, 'dropout_rate': 0.0004664532025957513, 'ccp_alpha': 0.1222703555499785}. Best is trial 161 with value: 0.8665031184376385.[0m
