[32m[I 2022-04-13 11:45:48,090][0m Trial 642 finished with value: 0.8643129825609158 and parameters: {'alpha': 2.251768622234926, 'ties': 'breslow'}. Best is trial 99 with value: 0.8654869897806009.[0m
[32m[I 2022-04-13 11:45:48,335][0m Trial 643 finished with value: 0.8648486321634327 and parameters: {'alpha': 2.420418913971461, 'ties': 'breslow'}. Best is trial 99 with value: 0.8654869897806009.[0m
[32m[I 2022-04-13 11:45:48,691][0m Trial 644 finished with value: 0.8648486321634327 and parameters: {'alpha': 2.389724844599884, 'ties': 'breslow'}. Best is trial 99 with value: 0.8654869897806009.[0m
[32m[I 2022-04-13 11:45:49,045][0m Trial 645 finished with value: 0.8639833328806962 and parameters: {'alpha': 2.5955597646100843, 'ties': 'breslow'}. Best is trial 99 with value: 0.8654869897806009.[0m
[32m[I 2022-04-13 11:45:49,423][0m Trial 646 finished with value: 0.8654869897806009 and parameters: {'alpha': 2.3170243973543734, 'ties': 'breslow'}. Best is trial 99 with value: 0.8654869897806009.[0m
[32m[I 2022-04-13 11:45:49,864][0m Trial 647 finished with value: 0.8604874088784795 and parameters: {'alpha': 3.462578206323867, 'ties': 'breslow'}. Best is trial 99 with value: 0.8654869897806009.[0m
[32m[I 2022-04-13 11:45:50,169][0m Trial 648 finished with value: 0.8654085943201592 and parameters: {'alpha': 2.024040083356479, 'ties': 'breslow'}. Best is trial 99 with value: 0.8654869897806009.[0m
[32m[I 2022-04-13 11:45:50,482][0m Trial 649 finished with value: 0.8639833328806962 and parameters: {'alpha': 2.5692448075924754, 'ties': 'breslow'}. Best is trial 99 with value: 0.8654869897806009.[0m
[32m[I 2022-04-13 11:45:50,890][0m Trial 650 finished with value: 0.8643129825609158 and parameters: {'alpha': 2.293303418951816, 'ties': 'breslow'}. Best is trial 99 with value: 0.8654869897806009.[0m
[32m[I 2022-04-13 11:45:51,476][0m Trial 651 finished with value: 0.8648486321634327 and parameters: {'alpha': 2.430032581585354, 'ties': 'breslow'}. Best is trial 99 with value: 0.8654869897806009.[0m
[32m[I 2022-04-13 11:45:51,687][0m Trial 652 finished with value: 0.8648218682663185 and parameters: {'alpha': 2.1410860721020923, 'ties': 'efron'}. Best is trial 99 with value: 0.8654869897806009.[0m
[32m[I 2022-04-13 11:45:52,001][0m Trial 653 finished with value: 0.8639833328806962 and parameters: {'alpha': 2.645145395330336, 'ties': 'breslow'}. Best is trial 99 with value: 0.8654869897806009.[0m
[32m[I 2022-04-13 11:45:52,417][0m Trial 654 finished with value: 0.8648486321634327 and parameters: {'alpha': 2.4382746036837566, 'ties': 'breslow'}. Best is trial 99 with value: 0.8654869897806009.[0m
[32m[I 2022-04-13 11:45:52,884][0m Trial 655 finished with value: 0.8648486321634327 and parameters: {'alpha': 2.3664387018428625, 'ties': 'breslow'}. Best is trial 99 with value: 0.8654869897806009.[0m
[32m[I 2022-04-13 11:45:53,463][0m Trial 656 finished with value: 0.8641835106491502 and parameters: {'alpha': 2.1192005291547584, 'ties': 'efron'}. Best is trial 99 with value: 0.8654869897806009.[0m
[32m[I 2022-04-13 11:45:53,840][0m Trial 657 finished with value: 0.8643129825609158 and parameters: {'alpha': 2.2195146620864956, 'ties': 'efron'}. Best is trial 99 with value: 0.8654869897806009.[0m
[32m[I 2022-04-13 11:45:54,158][0m Trial 658 finished with value: 0.8654869897806009 and parameters: {'alpha': 2.3317143740996085, 'ties': 'breslow'}. Best is trial 99 with value: 0.8654869897806009.[0m
[32m[I 2022-04-13 11:45:54,500][0m Trial 659 finished with value: 0.8648486321634327 and parameters: {'alpha': 2.515551056850867, 'ties': 'breslow'}. Best is trial 99 with value: 0.8654869897806009.[0m
[32m[I 2022-04-13 11:45:54,820][0m Trial 660 finished with value: 0.8648486321634327 and parameters: {'alpha': 2.4067727962290935, 'ties': 'breslow'}. Best is trial 99 with value: 0.8654869897806009.[0m
[32m[I 2022-04-13 11:45:55,301][0m Trial 661 finished with value: 0.8648486321634327 and parameters: {'alpha': 2.4640900922514217, 'ties': 'breslow'}. Best is trial 99 with value: 0.8654869897806009.[0m
[32m[I 2022-04-13 11:45:55,781][0m Trial 662 finished with value: 0.8555764272407727 and parameters: {'alpha': 0.04929262802421697, 'ties': 'breslow'}. Best is trial 99 with value: 0.8654869897806009.[0m
[32m[I 2022-04-13 11:45:56,191][0m Trial 663 finished with value: 0.8641835106491502 and parameters: {'alpha': 2.1784094778626364, 'ties': 'breslow'}. Best is trial 99 with value: 0.8654869897806009.[0m
[32m[I 2022-04-13 11:45:56,554][0m Trial 664 finished with value: 0.8654869897806009 and parameters: {'alpha': 2.338270856440282, 'ties': 'breslow'}. Best is trial 99 with value: 0.8654869897806009.[0m
[32m[I 2022-04-13 11:45:57,112][0m Trial 665 finished with value: 0.8643129825609158 and parameters: {'alpha': 2.2725546588101397, 'ties': 'breslow'}. Best is trial 99 with value: 0.8654869897806009.[0m
[32m[I 2022-04-13 11:45:57,905][0m Trial 666 finished with value: 0.862300995067612 and parameters: {'alpha': 2.827671729927478, 'ties': 'breslow'}. Best is trial 99 with value: 0.8654869897806009.[0m
[32m[I 2022-04-13 11:45:58,163][0m Trial 667 finished with value: 0.8654085943201592 and parameters: {'alpha': 2.077279048637062, 'ties': 'breslow'}. Best is trial 99 with value: 0.8654869897806009.[0m
[32m[I 2022-04-13 11:45:58,380][0m Trial 668 finished with value: 0.8643129825609158 and parameters: {'alpha': 2.241313857513523, 'ties': 'breslow'}. Best is trial 99 with value: 0.8654869897806009.[0m
[32m[I 2022-04-13 11:45:58,545][0m Trial 669 finished with value: 0.8648486321634327 and parameters: {'alpha': 2.517671983343942, 'ties': 'breslow'}. Best is trial 99 with value: 0.8654869897806009.[0m
[32m[I 2022-04-13 11:45:58,809][0m Trial 670 finished with value: 0.8627574512975278 and parameters: {'alpha': 2.659359134754777, 'ties': 'breslow'}. Best is trial 99 with value: 0.8654869897806009.[0m
[32m[I 2022-04-13 11:45:59,162][0m Trial 671 finished with value: 0.8641835106491502 and parameters: {'alpha': 2.1545001256929, 'ties': 'breslow'}. Best is trial 99 with value: 0.8654869897806009.[0m
[32m[I 2022-04-13 11:45:59,458][0m Trial 672 finished with value: 0.8648486321634327 and parameters: {'alpha': 2.4237931985676755, 'ties': 'breslow'}. Best is trial 99 with value: 0.8654869897806009.[0m
[32m[I 2022-04-13 11:45:59,709][0m Trial 673 finished with value: 0.8647928920287047 and parameters: {'alpha': 1.9498536304988312, 'ties': 'efron'}. Best is trial 99 with value: 0.8654869897806009.[0m
[32m[I 2022-04-13 11:46:00,121][0m Trial 674 finished with value: 0.8648486321634327 and parameters: {'alpha': 2.3482790341743343, 'ties': 'breslow'}. Best is trial 99 with value: 0.8654869897806009.[0m
[32m[I 2022-04-13 11:46:00,415][0m Trial 675 finished with value: 0.8639833328806962 and parameters: {'alpha': 2.5807040617185133, 'ties': 'breslow'}. Best is trial 99 with value: 0.8654869897806009.[0m
[32m[I 2022-04-13 11:46:01,001][0m Trial 676 finished with value: 0.8648486321634327 and parameters: {'alpha': 2.3802792086217455, 'ties': 'breslow'}. Best is trial 99 with value: 0.8654869897806009.[0m
[32m[I 2022-04-13 11:46:01,416][0m Trial 677 finished with value: 0.8643129825609158 and parameters: {'alpha': 2.22047426353869, 'ties': 'breslow'}. Best is trial 99 with value: 0.8654869897806009.[0m
[32m[I 2022-04-13 11:46:01,630][0m Trial 678 finished with value: 0.8643129825609158 and parameters: {'alpha': 2.256101022289767, 'ties': 'efron'}. Best is trial 99 with value: 0.8654869897806009.[0m
[32m[I 2022-04-13 11:46:01,965][0m Trial 679 finished with value: 0.8648486321634327 and parameters: {'alpha': 2.452618499958021, 'ties': 'breslow'}. Best is trial 99 with value: 0.8654869897806009.[0m
[32m[I 2022-04-13 11:46:02,257][0m Trial 680 finished with value: 0.8654085943201592 and parameters: {'alpha': 2.039442248207139, 'ties': 'efron'}. Best is trial 99 with value: 0.8654869897806009.[0m
[32m[I 2022-04-13 11:46:02,467][0m Trial 681 finished with value: 0.8648486321634327 and parameters: {'alpha': 2.520585418013624, 'ties': 'breslow'}. Best is trial 99 with value: 0.8654869897806009.[0m
[32m[I 2022-04-13 11:46:02,678][0m Trial 682 finished with value: 0.8648486321634327 and parameters: {'alpha': 2.3836838947069885, 'ties': 'breslow'}. Best is trial 99 with value: 0.8654869897806009.[0m
[32m[I 2022-04-13 11:46:02,857][0m Trial 683 finished with value: 0.8654869897806009 and parameters: {'alpha': 2.2977896259404895, 'ties': 'breslow'}. Best is trial 99 with value: 0.8654869897806009.[0m
[32m[I 2022-04-13 11:46:03,088][0m Trial 684 finished with value: 0.8636746249437476 and parameters: {'alpha': 2.1937139916964297, 'ties': 'breslow'}. Best is trial 99 with value: 0.8654869897806009.[0m
[32m[I 2022-04-13 11:46:03,266][0m Trial 685 finished with value: 0.8648486321634327 and parameters: {'alpha': 2.367385598974743, 'ties': 'breslow'}. Best is trial 99 with value: 0.8654869897806009.[0m
[32m[I 2022-04-13 11:46:03,465][0m Trial 686 finished with value: 0.8648486321634327 and parameters: {'alpha': 2.4695441027396803, 'ties': 'breslow'}. Best is trial 99 with value: 0.8654869897806009.[0m
[32m[I 2022-04-13 11:46:03,703][0m Trial 687 finished with value: 0.8643129825609158 and parameters: {'alpha': 2.278646784619416, 'ties': 'breslow'}. Best is trial 99 with value: 0.8654869897806009.[0m
[32m[I 2022-04-13 11:46:03,867][0m Trial 688 finished with value: 0.8647702367029909 and parameters: {'alpha': 2.0978908644275776, 'ties': 'efron'}. Best is trial 99 with value: 0.8654869897806009.[0m
[32m[I 2022-04-13 11:46:04,009][0m Trial 689 finished with value: 0.8654869897806009 and parameters: {'alpha': 2.32841297227204, 'ties': 'breslow'}. Best is trial 99 with value: 0.8654869897806009.[0m
[32m[I 2022-04-13 11:46:04,185][0m Trial 690 finished with value: 0.8641835106491502 and parameters: {'alpha': 2.1713915997535977, 'ties': 'breslow'}. Best is trial 99 with value: 0.8654869897806009.[0m
[32m[I 2022-04-13 11:46:04,455][0m Trial 691 finished with value: 0.8654869897806009 and parameters: {'alpha': 2.2829155276523654, 'ties': 'efron'}. Best is trial 99 with value: 0.8654869897806009.[0m
[32m[I 2022-04-13 11:46:04,804][0m Trial 692 finished with value: 0.8633478820480818 and parameters: {'alpha': 1.9116451822310272, 'ties': 'efron'}. Best is trial 99 with value: 0.8654869897806009.[0m
[32m[I 2022-04-13 11:46:05,009][0m Trial 693 finished with value: 0.8648218682663185 and parameters: {'alpha': 2.1725160990107293, 'ties': 'efron'}. Best is trial 99 with value: 0.8654869897806009.[0m
[32m[I 2022-04-13 11:46:05,173][0m Trial 694 finished with value: 0.8639833328806962 and parameters: {'alpha': 2.5868252348223444, 'ties': 'breslow'}. Best is trial 99 with value: 0.8654869897806009.[0m
[32m[I 2022-04-13 11:46:05,486][0m Trial 695 finished with value: 0.8654085943201592 and parameters: {'alpha': 2.04854971242743, 'ties': 'efron'}. Best is trial 99 with value: 0.8654869897806009.[0m
[32m[I 2022-04-13 11:46:05,874][0m Trial 696 finished with value: 0.862248565592125 and parameters: {'alpha': 2.7040327512737488, 'ties': 'breslow'}. Best is trial 99 with value: 0.8654869897806009.[0m
[32m[I 2022-04-13 11:46:06,053][0m Trial 697 finished with value: 0.8648486321634327 and parameters: {'alpha': 2.458416895823467, 'ties': 'breslow'}. Best is trial 99 with value: 0.8654869897806009.[0m
[32m[I 2022-04-13 11:46:06,231][0m Trial 698 finished with value: 0.8654869897806009 and parameters: {'alpha': 2.3150705347125444, 'ties': 'breslow'}. Best is trial 99 with value: 0.8654869897806009.[0m
[32m[I 2022-04-13 11:46:06,437][0m Trial 699 finished with value: 0.8629919471114509 and parameters: {'alpha': 1.365718141737226, 'ties': 'breslow'}. Best is trial 99 with value: 0.8654869897806009.[0m
[32m[I 2022-04-13 11:46:06,601][0m Trial 700 finished with value: 0.8648218682663185 and parameters: {'alpha': 2.1849429415223542, 'ties': 'efron'}. Best is trial 99 with value: 0.8654869897806009.[0m
[32m[I 2022-04-13 11:46:06,806][0m Trial 701 finished with value: 0.8648486321634327 and parameters: {'alpha': 2.404625190166798, 'ties': 'breslow'}. Best is trial 99 with value: 0.8654869897806009.[0m
[32m[I 2022-04-13 11:46:06,983][0m Trial 702 finished with value: 0.8615151585464546 and parameters: {'alpha': 0.550416133861712, 'ties': 'efron'}. Best is trial 99 with value: 0.8654869897806009.[0m
[32m[I 2022-04-13 11:46:07,179][0m Trial 703 finished with value: 0.8648486321634327 and parameters: {'alpha': 2.4684280543705874, 'ties': 'breslow'}. Best is trial 99 with value: 0.8654869897806009.[0m
[32m[I 2022-04-13 11:46:07,342][0m Trial 704 finished with value: 0.8643129825609158 and parameters: {'alpha': 2.252976611993228, 'ties': 'efron'}. Best is trial 99 with value: 0.8654869897806009.[0m
[32m[I 2022-04-13 11:46:07,526][0m Trial 705 finished with value: 0.8639833328806962 and parameters: {'alpha': 2.5708955542547427, 'ties': 'breslow'}. Best is trial 99 with value: 0.8654869897806009.[0m
[32m[I 2022-04-13 11:46:07,680][0m Trial 706 finished with value: 0.8648486321634327 and parameters: {'alpha': 2.4163301855327584, 'ties': 'breslow'}. Best is trial 99 with value: 0.8654869897806009.[0m
[32m[I 2022-04-13 11:46:07,798][0m Trial 707 finished with value: 0.8654869897806009 and parameters: {'alpha': 2.3093647967668263, 'ties': 'breslow'}. Best is trial 99 with value: 0.8654869897806009.[0m
[32m[I 2022-04-13 11:46:07,932][0m Trial 708 finished with value: 0.8648486321634327 and parameters: {'alpha': 2.3760489915831915, 'ties': 'breslow'}. Best is trial 99 with value: 0.8654869897806009.[0m
[32m[I 2022-04-13 11:46:08,175][0m Trial 709 finished with value: 0.8641835106491502 and parameters: {'alpha': 2.1366392897044726, 'ties': 'breslow'}. Best is trial 99 with value: 0.8654869897806009.[0m
[32m[I 2022-04-13 11:46:08,391][0m Trial 710 finished with value: 0.8648486321634327 and parameters: {'alpha': 2.5207197449850947, 'ties': 'breslow'}. Best is trial 99 with value: 0.8654869897806009.[0m
[32m[I 2022-04-13 11:46:08,610][0m Trial 711 finished with value: 0.8643129825609158 and parameters: {'alpha': 2.251705789825826, 'ties': 'efron'}. Best is trial 99 with value: 0.8654869897806009.[0m
[32m[I 2022-04-13 11:46:08,764][0m Trial 712 finished with value: 0.8643129825609158 and parameters: {'alpha': 2.2198830342992277, 'ties': 'breslow'}. Best is trial 99 with value: 0.8654869897806009.[0m
[32m[I 2022-04-13 11:46:08,918][0m Trial 713 finished with value: 0.8648486321634327 and parameters: {'alpha': 2.3935008992705358, 'ties': 'breslow'}. Best is trial 99 with value: 0.8654869897806009.[0m
[32m[I 2022-04-13 11:46:09,128][0m Trial 714 finished with value: 0.8654869897806009 and parameters: {'alpha': 2.3124433839464396, 'ties': 'breslow'}. Best is trial 99 with value: 0.8654869897806009.[0m
[32m[I 2022-04-13 11:46:09,335][0m Trial 715 finished with value: 0.8641835106491502 and parameters: {'alpha': 2.1178085149783947, 'ties': 'breslow'}. Best is trial 99 with value: 0.8654869897806009.[0m
[32m[I 2022-04-13 11:46:09,553][0m Trial 716 finished with value: 0.8648486321634327 and parameters: {'alpha': 2.5075804211470127, 'ties': 'breslow'}. Best is trial 99 with value: 0.8654869897806009.[0m
[32m[I 2022-04-13 11:46:09,774][0m Trial 717 finished with value: 0.8647702367029909 and parameters: {'alpha': 2.0930153189071112, 'ties': 'efron'}. Best is trial 99 with value: 0.8654869897806009.[0m
[32m[I 2022-04-13 11:46:09,958][0m Trial 718 finished with value: 0.8643129825609158 and parameters: {'alpha': 2.227656815356688, 'ties': 'efron'}. Best is trial 99 with value: 0.8654869897806009.[0m
[32m[I 2022-04-13 11:46:10,113][0m Trial 719 finished with value: 0.8581921243211781 and parameters: {'alpha': 4.204827536970891, 'ties': 'breslow'}. Best is trial 99 with value: 0.8654869897806009.[0m
[32m[I 2022-04-13 11:46:10,310][0m Trial 720 finished with value: 0.8598482533491518 and parameters: {'alpha': 3.5844902322795926, 'ties': 'efron'}. Best is trial 99 with value: 0.8654869897806009.[0m
[32m[I 2022-04-13 11:46:10,495][0m Trial 721 finished with value: 0.8648486321634327 and parameters: {'alpha': 2.370198712904013, 'ties': 'breslow'}. Best is trial 99 with value: 0.8654869897806009.[0m
[32m[I 2022-04-13 11:46:10,685][0m Trial 722 finished with value: 0.8654085943201592 and parameters: {'alpha': 2.0390469808490708, 'ties': 'breslow'}. Best is trial 99 with value: 0.8654869897806009.[0m
[32m[I 2022-04-13 11:46:10,832][0m Trial 723 finished with value: 0.8639833328806962 and parameters: {'alpha': 2.637132141057721, 'ties': 'breslow'}. Best is trial 99 with value: 0.8654869897806009.[0m
[32m[I 2022-04-13 11:46:10,936][0m Trial 724 finished with value: 0.8654869897806009 and parameters: {'alpha': 2.344911103873622, 'ties': 'breslow'}. Best is trial 99 with value: 0.8654869897806009.[0m
[32m[I 2022-04-13 11:46:11,141][0m Trial 725 finished with value: 0.8648486321634327 and parameters: {'alpha': 2.4916599370181363, 'ties': 'breslow'}. Best is trial 99 with value: 0.8654869897806009.[0m
[32m[I 2022-04-13 11:46:11,287][0m Trial 726 finished with value: 0.8643129825609158 and parameters: {'alpha': 2.208356147645917, 'ties': 'breslow'}. Best is trial 99 with value: 0.8654869897806009.[0m
[32m[I 2022-04-13 11:46:11,853][0m Trial 727 finished with value: 0.8643129825609158 and parameters: {'alpha': 2.290691230810746, 'ties': 'breslow'}. Best is trial 99 with value: 0.8654869897806009.[0m
[32m[I 2022-04-13 11:46:12,565][0m Trial 728 finished with value: 0.8633244580165096 and parameters: {'alpha': 1.8564667856897055, 'ties': 'efron'}. Best is trial 99 with value: 0.8654869897806009.[0m
[32m[I 2022-04-13 11:46:13,426][0m Trial 729 finished with value: 0.8648486321634327 and parameters: {'alpha': 2.4295756870584615, 'ties': 'breslow'}. Best is trial 99 with value: 0.8654869897806009.[0m
[32m[I 2022-04-13 11:46:13,701][0m Trial 730 finished with value: 0.8643129825609158 and parameters: {'alpha': 2.2923575575317017, 'ties': 'breslow'}. Best is trial 99 with value: 0.8654869897806009.[0m
[32m[I 2022-04-13 11:46:14,280][0m Trial 731 finished with value: 0.8648486321634327 and parameters: {'alpha': 2.397156178157202, 'ties': 'breslow'}. Best is trial 99 with value: 0.8654869897806009.[0m
[32m[I 2022-04-13 11:46:14,590][0m Trial 732 finished with value: 0.8643129825609158 and parameters: {'alpha': 2.2878246319775277, 'ties': 'breslow'}. Best is trial 99 with value: 0.8654869897806009.[0m
[32m[I 2022-04-13 11:46:14,736][0m Trial 733 finished with value: 0.8648486321634327 and parameters: {'alpha': 2.4861801904577967, 'ties': 'breslow'}. Best is trial 99 with value: 0.8654869897806009.[0m
[32m[I 2022-04-13 11:46:14,868][0m Trial 734 finished with value: 0.8641835106491502 and parameters: {'alpha': 2.164415528422265, 'ties': 'breslow'}. Best is trial 99 with value: 0.8654869897806009.[0m
[32m[I 2022-04-13 11:46:15,072][0m Trial 735 finished with value: 0.8654085943201592 and parameters: {'alpha': 2.0083716833698713, 'ties': 'efron'}. Best is trial 99 with value: 0.8654869897806009.[0m
[32m[I 2022-04-13 11:46:15,364][0m Trial 736 finished with value: 0.8648486321634327 and parameters: {'alpha': 2.3514801160901926, 'ties': 'breslow'}. Best is trial 99 with value: 0.8654869897806009.[0m
[32m[I 2022-04-13 11:46:15,725][0m Trial 737 finished with value: 0.8643129825609158 and parameters: {'alpha': 2.2386898361507623, 'ties': 'breslow'}. Best is trial 99 with value: 0.8654869897806009.[0m
[32m[I 2022-04-13 11:46:16,019][0m Trial 738 finished with value: 0.8639833328806962 and parameters: {'alpha': 2.529456681294466, 'ties': 'breslow'}. Best is trial 99 with value: 0.8654869897806009.[0m
[32m[I 2022-04-13 11:46:16,369][0m Trial 739 finished with value: 0.8641835106491502 and parameters: {'alpha': 2.141315642405518, 'ties': 'breslow'}. Best is trial 99 with value: 0.8654869897806009.[0m
[32m[I 2022-04-13 11:46:16,742][0m Trial 740 finished with value: 0.8648486321634327 and parameters: {'alpha': 2.3525943766309134, 'ties': 'breslow'}. Best is trial 99 with value: 0.8654869897806009.[0m
[32m[I 2022-04-13 11:46:17,160][0m Trial 741 finished with value: 0.8639833328806962 and parameters: {'alpha': 2.598788216236352, 'ties': 'breslow'}. Best is trial 99 with value: 0.8654869897806009.[0m
[32m[I 2022-04-13 11:46:17,490][0m Trial 742 finished with value: 0.8648486321634327 and parameters: {'alpha': 2.34816997941567, 'ties': 'breslow'}. Best is trial 99 with value: 0.8654869897806009.[0m
[32m[I 2022-04-13 11:46:17,827][0m Trial 743 finished with value: 0.8636746249437476 and parameters: {'alpha': 2.181040559074048, 'ties': 'breslow'}. Best is trial 99 with value: 0.8654869897806009.[0m
[32m[I 2022-04-13 11:46:18,311][0m Trial 744 finished with value: 0.8654085943201592 and parameters: {'alpha': 2.056570091270465, 'ties': 'efron'}. Best is trial 99 with value: 0.8654869897806009.[0m
[32m[I 2022-04-13 11:46:18,698][0m Trial 745 finished with value: 0.8648486321634327 and parameters: {'alpha': 2.4473363496617297, 'ties': 'breslow'}. Best is trial 99 with value: 0.8654869897806009.[0m
[32m[I 2022-04-13 11:46:19,069][0m Trial 746 finished with value: 0.8648486321634327 and parameters: {'alpha': 2.3821571711586276, 'ties': 'breslow'}. Best is trial 99 with value: 0.8654869897806009.[0m
[32m[I 2022-04-13 11:46:19,572][0m Trial 747 finished with value: 0.8648486321634327 and parameters: {'alpha': 2.3479466213889784, 'ties': 'breslow'}. Best is trial 99 with value: 0.8654869897806009.[0m
[32m[I 2022-04-13 11:46:19,907][0m Trial 748 finished with value: 0.8639833328806962 and parameters: {'alpha': 2.5623599761573685, 'ties': 'breslow'}. Best is trial 99 with value: 0.8654869897806009.[0m
