[32m[I 2022-04-17 20:19:12,463][0m Trial 696 finished with value: 0.8599179941882295 and parameters: {'n_hidden': 64, 'mixture_components': 5, 'use_sparse_layer': False, 'use_batchnorm': True, 'use_dropout': True, 'dropout': 0.724765122997961, 'mlp_size_1': 0, 'mlp_size_2': 2, 'mlp_size_3': 0, 'kernel': 'Exponential', 'loss_name': 'AlternativeNLLLoss'}. Best is trial 367 with value: 0.8756446640888914.[0m
[32m[I 2022-04-17 20:23:56,642][0m Trial 697 finished with value: 0.8624718864896902 and parameters: {'n_hidden': 64, 'mixture_components': 2, 'use_sparse_layer': False, 'use_batchnorm': True, 'use_dropout': True, 'dropout': 0.40180271658663247, 'mlp_size_1': 0, 'mlp_size_2': 2, 'mlp_size_3': 0, 'kernel': 'Exponential', 'loss_name': 'NLLLoss'}. Best is trial 367 with value: 0.8756446640888914.[0m
[32m[I 2022-04-17 20:29:03,823][0m Trial 698 finished with value: 0.865787897180302 and parameters: {'n_hidden': 64, 'mixture_components': 4, 'use_sparse_layer': False, 'use_batchnorm': True, 'use_dropout': True, 'dropout': 0.8191871319238277, 'mlp_size_1': 0, 'mlp_size_2': 2, 'mlp_size_3': 0, 'kernel': 'Exponential', 'loss_name': 'NLLLoss'}. Best is trial 367 with value: 0.8756446640888914.[0m
[32m[I 2022-04-17 20:34:32,599][0m Trial 699 finished with value: 0.8591961709979365 and parameters: {'n_hidden': 64, 'mixture_components': 7, 'use_sparse_layer': False, 'use_batchnorm': True, 'use_dropout': True, 'dropout': 0.863677176927779, 'mlp_size_1': 0, 'mlp_size_2': 2, 'mlp_size_3': 0, 'kernel': 'Exponential', 'loss_name': 'NLLLoss'}. Best is trial 367 with value: 0.8756446640888914.[0m
[32m[I 2022-04-17 20:39:55,714][0m Trial 700 finished with value: 0.8632923589584696 and parameters: {'n_hidden': 128, 'mixture_components': 6, 'use_sparse_layer': True, 'use_sparse_loss': False, 'use_batchnorm': True, 'use_dropout': True, 'dropout': 0.6540149898393892, 'mlp_size_1': 0, 'mlp_size_2': 2, 'mlp_size_3': 0, 'kernel': 'Exponential', 'loss_name': 'NLLLoss'}. Best is trial 367 with value: 0.8756446640888914.[0m
[32m[I 2022-04-17 20:42:43,977][0m Trial 701 finished with value: 0.7466031485279823 and parameters: {'n_hidden': 64, 'mixture_components': 1, 'use_sparse_layer': False, 'use_batchnorm': False, 'use_dropout': True, 'dropout': 0.7015640160756315, 'mlp_size_1': 0, 'mlp_size_2': 2, 'mlp_size_3': 0, 'kernel': 'LogNormal', 'loss_name': 'NLLLoss'}. Best is trial 367 with value: 0.8756446640888914.[0m
[32m[I 2022-04-17 20:47:14,211][0m Trial 702 finished with value: 0.8653463359072291 and parameters: {'n_hidden': 64, 'mixture_components': 5, 'use_sparse_layer': False, 'use_batchnorm': True, 'use_dropout': True, 'dropout': 0.599270734246239, 'mlp_size_1': 0, 'mlp_size_2': 2, 'mlp_size_3': 0, 'kernel': 'Exponential', 'loss_name': 'NLLLoss'}. Best is trial 367 with value: 0.8756446640888914.[0m
[32m[I 2022-04-17 20:52:28,062][0m Trial 703 finished with value: 0.8649086270488539 and parameters: {'n_hidden': 32, 'mixture_components': 4, 'use_sparse_layer': False, 'use_batchnorm': True, 'use_dropout': True, 'dropout': 0.5774082159374638, 'mlp_size_1': 0, 'mlp_size_2': 2, 'mlp_size_3': 0, 'kernel': 'Exponential', 'loss_name': 'NLLLoss'}. Best is trial 367 with value: 0.8756446640888914.[0m
[32m[I 2022-04-17 20:56:01,781][0m Trial 704 finished with value: 0.8657988929832632 and parameters: {'n_hidden': 64, 'mixture_components': 2, 'use_sparse_layer': False, 'use_batchnorm': True, 'use_dropout': False, 'mlp_size_1': 0, 'mlp_size_2': 2, 'mlp_size_3': 0, 'kernel': 'Exponential', 'loss_name': 'NLLLoss'}. Best is trial 367 with value: 0.8756446640888914.[0m
[32m[I 2022-04-17 20:57:06,985][0m Trial 705 finished with value: 0.300236207182342 and parameters: {'n_hidden': 256, 'mixture_components': 5, 'use_sparse_layer': False, 'use_batchnorm': True, 'use_dropout': True, 'dropout': 0.5357494927413754, 'mlp_size_1': 0, 'mlp_size_2': 2, 'mlp_size_3': 0, 'kernel': 'Gumbel', 'loss_name': 'NLLLoss'}. Best is trial 367 with value: 0.8756446640888914.[0m
[32m[I 2022-04-17 21:01:38,389][0m Trial 706 finished with value: 0.8526186403277485 and parameters: {'n_hidden': 64, 'mixture_components': 4, 'use_sparse_layer': False, 'use_batchnorm': True, 'use_dropout': True, 'dropout': 0.6300999966927189, 'mlp_size_1': 0, 'mlp_size_2': 2, 'mlp_size_3': 0, 'kernel': 'Logistic', 'loss_name': 'NLLLoss'}. Best is trial 367 with value: 0.8756446640888914.[0m
[32m[I 2022-04-17 21:07:25,500][0m Trial 707 finished with value: 0.8477403841225003 and parameters: {'n_hidden': 2048, 'mixture_components': 2, 'use_sparse_layer': False, 'use_batchnorm': True, 'use_dropout': True, 'dropout': 0.6778361820475564, 'mlp_size_1': 1, 'mlp_size_2': 3, 'mlp_size_3': 4, 'kernel': 'Exponential', 'loss_name': 'NLLLoss'}. Best is trial 367 with value: 0.8756446640888914.[0m
[32m[I 2022-04-17 21:12:56,544][0m Trial 708 finished with value: 0.8660606006769853 and parameters: {'n_hidden': 64, 'mixture_components': 4, 'use_sparse_layer': False, 'use_batchnorm': True, 'use_dropout': True, 'dropout': 0.7878160997271024, 'mlp_size_1': 0, 'mlp_size_2': 2, 'mlp_size_3': 0, 'kernel': 'Exponential', 'loss_name': 'NLLLoss'}. Best is trial 367 with value: 0.8756446640888914.[0m
[32m[I 2022-04-17 21:18:11,857][0m Trial 709 finished with value: 0.8688022653440113 and parameters: {'n_hidden': 64, 'mixture_components': 5, 'use_sparse_layer': False, 'use_batchnorm': True, 'use_dropout': True, 'dropout': 0.742780266171588, 'mlp_size_1': 0, 'mlp_size_2': 2, 'mlp_size_3': 0, 'kernel': 'Exponential', 'loss_name': 'NLLLoss'}. Best is trial 367 with value: 0.8756446640888914.[0m
[32m[I 2022-04-17 21:22:15,028][0m Trial 710 finished with value: 0.8665154805732058 and parameters: {'n_hidden': 128, 'mixture_components': 6, 'use_sparse_layer': False, 'use_batchnorm': True, 'use_dropout': True, 'dropout': 0.711154692962502, 'mlp_size_1': 0, 'mlp_size_2': 2, 'mlp_size_3': 0, 'kernel': 'Exponential', 'loss_name': 'NLLLoss'}. Best is trial 367 with value: 0.8756446640888914.[0m
[32m[I 2022-04-17 21:27:21,008][0m Trial 711 finished with value: 0.8718905539115565 and parameters: {'n_hidden': 64, 'mixture_components': 7, 'use_sparse_layer': False, 'use_batchnorm': True, 'use_dropout': True, 'dropout': 0.6590675826009104, 'mlp_size_1': 0, 'mlp_size_2': 2, 'mlp_size_3': 0, 'kernel': 'Exponential', 'loss_name': 'NLLLoss'}. Best is trial 367 with value: 0.8756446640888914.[0m
[32m[I 2022-04-17 21:32:52,082][0m Trial 712 finished with value: 0.866065547344868 and parameters: {'n_hidden': 64, 'mixture_components': 7, 'use_sparse_layer': False, 'use_batchnorm': True, 'use_dropout': True, 'dropout': 0.660458795776325, 'mlp_size_1': 0, 'mlp_size_2': 2, 'mlp_size_3': 0, 'kernel': 'Exponential', 'loss_name': 'CensoredNLLLoss'}. Best is trial 367 with value: 0.8756446640888914.[0m
[32m[I 2022-04-17 21:37:26,210][0m Trial 713 finished with value: 0.8346120087236637 and parameters: {'n_hidden': 64, 'mixture_components': 7, 'use_sparse_layer': False, 'use_batchnorm': True, 'use_dropout': True, 'dropout': 0.6877139964721376, 'mlp_size_1': 0, 'mlp_size_2': 2, 'mlp_size_3': 0, 'kernel': 'LogLogistic', 'loss_name': 'NLLLoss'}. Best is trial 367 with value: 0.8756446640888914.[0m
[32m[I 2022-04-17 21:42:55,477][0m Trial 714 finished with value: 0.8696022022115553 and parameters: {'n_hidden': 32, 'mixture_components': 7, 'use_sparse_layer': False, 'use_batchnorm': True, 'use_dropout': True, 'dropout': 0.6522705727068402, 'mlp_size_1': 0, 'mlp_size_2': 2, 'mlp_size_3': 0, 'kernel': 'Exponential', 'loss_name': 'NLLLoss'}. Best is trial 367 with value: 0.8756446640888914.[0m
[32m[I 2022-04-17 21:46:23,794][0m Trial 715 finished with value: 0.8565789258282539 and parameters: {'n_hidden': 512, 'mixture_components': 7, 'use_sparse_layer': False, 'use_batchnorm': True, 'use_dropout': True, 'dropout': 0.6965752150813355, 'mlp_size_1': 0, 'mlp_size_2': 0, 'mlp_size_3': 1, 'kernel': 'Exponential', 'loss_name': 'NLLLoss'}. Best is trial 367 with value: 0.8756446640888914.[0m
[32m[I 2022-04-17 21:51:17,186][0m Trial 716 finished with value: 0.8662048583411049 and parameters: {'n_hidden': 1024, 'mixture_components': 7, 'use_sparse_layer': False, 'use_batchnorm': True, 'use_dropout': True, 'dropout': 0.6643529664479835, 'mlp_size_1': 0, 'mlp_size_2': 7, 'mlp_size_3': 0, 'kernel': 'Exponential', 'loss_name': 'NLLLoss'}. Best is trial 367 with value: 0.8756446640888914.[0m
[32m[I 2022-04-17 21:56:11,928][0m Trial 717 finished with value: 0.8632436446316778 and parameters: {'n_hidden': 64, 'mixture_components': 7, 'use_sparse_layer': False, 'use_batchnorm': True, 'use_dropout': True, 'dropout': 0.6332457003757016, 'mlp_size_1': 0, 'mlp_size_2': 2, 'mlp_size_3': 0, 'kernel': 'Exponential', 'loss_name': 'NLLLoss'}. Best is trial 367 with value: 0.8756446640888914.[0m
[32m[I 2022-04-17 22:01:13,441][0m Trial 718 finished with value: 0.8676957769514179 and parameters: {'n_hidden': 64, 'mixture_components': 7, 'use_sparse_layer': False, 'use_batchnorm': True, 'use_dropout': True, 'dropout': 0.6761800994594261, 'mlp_size_1': 0, 'mlp_size_2': 2, 'mlp_size_3': 0, 'kernel': 'Exponential', 'loss_name': 'NLLLoss'}. Best is trial 367 with value: 0.8756446640888914.[0m
[32m[I 2022-04-17 22:07:30,489][0m Trial 719 finished with value: 0.8312815324863564 and parameters: {'n_hidden': 64, 'mixture_components': 7, 'use_sparse_layer': False, 'use_batchnorm': True, 'use_dropout': True, 'dropout': 0.7316008414135682, 'mlp_size_1': 0, 'mlp_size_2': 2, 'mlp_size_3': 0, 'kernel': 'Normal', 'loss_name': 'AlternativeNLLLoss'}. Best is trial 367 with value: 0.8756446640888914.[0m
[32m[I 2022-04-17 22:12:39,296][0m Trial 720 finished with value: 0.8633760656895848 and parameters: {'n_hidden': 64, 'mixture_components': 7, 'use_sparse_layer': True, 'use_sparse_loss': False, 'use_batchnorm': True, 'use_dropout': True, 'dropout': 0.8100770418352214, 'mlp_size_1': 0, 'mlp_size_2': 2, 'mlp_size_3': 0, 'kernel': 'Exponential', 'loss_name': 'NLLLoss'}. Best is trial 367 with value: 0.8756446640888914.[0m
[32m[I 2022-04-17 22:14:23,194][0m Trial 721 finished with value: 0.643686285038298 and parameters: {'n_hidden': 64, 'mixture_components': 7, 'use_sparse_layer': False, 'use_batchnorm': False, 'use_dropout': True, 'dropout': 0.7682847810355136, 'mlp_size_1': 0, 'mlp_size_2': 2, 'mlp_size_3': 0, 'kernel': 'Exponential', 'loss_name': 'NLLLoss'}. Best is trial 367 with value: 0.8756446640888914.[0m
[32m[I 2022-04-17 22:19:40,039][0m Trial 722 finished with value: 0.8644798085384634 and parameters: {'n_hidden': 128, 'mixture_components': 7, 'use_sparse_layer': False, 'use_batchnorm': True, 'use_dropout': True, 'dropout': 0.7102410727803502, 'mlp_size_1': 0, 'mlp_size_2': 2, 'mlp_size_3': 0, 'kernel': 'Exponential', 'loss_name': 'NLLLoss'}. Best is trial 367 with value: 0.8756446640888914.[0m
[32m[I 2022-04-17 22:22:50,040][0m Trial 723 finished with value: 0.8321132337426341 and parameters: {'n_hidden': 256, 'mixture_components': 6, 'use_sparse_layer': False, 'use_batchnorm': True, 'use_dropout': False, 'mlp_size_1': 0, 'mlp_size_2': 2, 'mlp_size_3': 0, 'kernel': 'Exponential', 'loss_name': 'NLLLoss'}. Best is trial 367 with value: 0.8756446640888914.[0m
[32m[I 2022-04-17 22:28:30,102][0m Trial 724 finished with value: 0.6146684776339156 and parameters: {'n_hidden': 64, 'mixture_components': 5, 'use_sparse_layer': False, 'use_batchnorm': True, 'use_dropout': True, 'dropout': 0.8372420733823284, 'mlp_size_1': 0, 'mlp_size_2': 2, 'mlp_size_3': 0, 'kernel': 'Weibull', 'loss_name': 'NLLLoss'}. Best is trial 367 with value: 0.8756446640888914.[0m
[32m[I 2022-04-17 22:33:51,938][0m Trial 725 finished with value: 0.8677081691791841 and parameters: {'n_hidden': 64, 'mixture_components': 4, 'use_sparse_layer': False, 'use_batchnorm': True, 'use_dropout': True, 'dropout': 0.6522028723538909, 'mlp_size_1': 0, 'mlp_size_2': 2, 'mlp_size_3': 0, 'kernel': 'Exponential', 'loss_name': 'NLLLoss'}. Best is trial 367 with value: 0.8756446640888914.[0m
[32m[I 2022-04-17 22:39:14,038][0m Trial 726 finished with value: 0.865216160632483 and parameters: {'n_hidden': 32, 'mixture_components': 5, 'use_sparse_layer': False, 'use_batchnorm': True, 'use_dropout': True, 'dropout': 0.6917882315728251, 'mlp_size_1': 0, 'mlp_size_2': 2, 'mlp_size_3': 0, 'kernel': 'Exponential', 'loss_name': 'NLLLoss'}. Best is trial 367 with value: 0.8756446640888914.[0m
[32m[I 2022-04-17 22:43:54,416][0m Trial 727 finished with value: 0.8599073536078023 and parameters: {'n_hidden': 64, 'mixture_components': 4, 'use_sparse_layer': False, 'use_batchnorm': True, 'use_dropout': True, 'dropout': 0.620439652640153, 'mlp_size_1': 0, 'mlp_size_2': 2, 'mlp_size_3': 0, 'kernel': 'Gamma', 'loss_name': 'NLLLoss'}. Best is trial 367 with value: 0.8756446640888914.[0m
[32m[I 2022-04-17 22:48:54,716][0m Trial 728 finished with value: 0.869239529148739 and parameters: {'n_hidden': 64, 'mixture_components': 7, 'use_sparse_layer': False, 'use_batchnorm': True, 'use_dropout': True, 'dropout': 0.729096716872308, 'mlp_size_1': 0, 'mlp_size_2': 2, 'mlp_size_3': 0, 'kernel': 'Exponential', 'loss_name': 'NLLLoss'}. Best is trial 367 with value: 0.8756446640888914.[0m
[32m[I 2022-04-17 22:54:15,729][0m Trial 729 finished with value: 0.8708424800592335 and parameters: {'n_hidden': 64, 'mixture_components': 5, 'use_sparse_layer': False, 'use_batchnorm': True, 'use_dropout': True, 'dropout': 0.6693769735529913, 'mlp_size_1': 0, 'mlp_size_2': 2, 'mlp_size_3': 0, 'kernel': 'Exponential', 'loss_name': 'NLLLoss'}. Best is trial 367 with value: 0.8756446640888914.[0m
[32m[I 2022-04-17 22:58:05,305][0m Trial 730 finished with value: 0.8248533649084369 and parameters: {'n_hidden': 64, 'mixture_components': 4, 'use_sparse_layer': False, 'use_batchnorm': True, 'use_dropout': True, 'dropout': 0.7498016613767455, 'mlp_size_1': 0, 'mlp_size_2': 2, 'mlp_size_3': 0, 'kernel': 'LogNormal', 'loss_name': 'NLLLoss'}. Best is trial 367 with value: 0.8756446640888914.[0m
[32m[I 2022-04-17 23:03:30,000][0m Trial 731 finished with value: 0.8679160282471983 and parameters: {'n_hidden': 128, 'mixture_components': 7, 'use_sparse_layer': False, 'use_batchnorm': True, 'use_dropout': True, 'dropout': 0.7835960082002869, 'mlp_size_1': 0, 'mlp_size_2': 2, 'mlp_size_3': 0, 'kernel': 'Exponential', 'loss_name': 'NLLLoss'}. Best is trial 367 with value: 0.8756446640888914.[0m
[32m[I 2022-04-17 23:08:57,307][0m Trial 732 finished with value: 0.8648405087206015 and parameters: {'n_hidden': 64, 'mixture_components': 5, 'use_sparse_layer': False, 'use_batchnorm': True, 'use_dropout': True, 'dropout': 0.7103551966498816, 'mlp_size_1': 0, 'mlp_size_2': 2, 'mlp_size_3': 0, 'kernel': 'Exponential', 'loss_name': 'NLLLoss'}. Best is trial 367 with value: 0.8756446640888914.[0m
[32m[I 2022-04-17 23:14:48,144][0m Trial 733 finished with value: 0.8628824102494942 and parameters: {'n_hidden': 64, 'mixture_components': 6, 'use_sparse_layer': False, 'use_batchnorm': True, 'use_dropout': True, 'dropout': 0.6405904349015669, 'mlp_size_1': 0, 'mlp_size_2': 2, 'mlp_size_3': 0, 'kernel': 'Exponential', 'loss_name': 'CensoredNLLLoss'}. Best is trial 367 with value: 0.8756446640888914.[0m
[32m[I 2022-04-17 23:19:53,223][0m Trial 734 finished with value: 0.8641236244742906 and parameters: {'n_hidden': 64, 'mixture_components': 4, 'use_sparse_layer': False, 'use_batchnorm': True, 'use_dropout': True, 'dropout': 0.8128092042449983, 'mlp_size_1': 0, 'mlp_size_2': 2, 'mlp_size_3': 0, 'kernel': 'Exponential', 'loss_name': 'NLLLoss'}. Best is trial 367 with value: 0.8756446640888914.[0m
[32m[I 2022-04-17 23:25:15,621][0m Trial 735 finished with value: 0.5752431800427888 and parameters: {'n_hidden': 2048, 'mixture_components': 4, 'use_sparse_layer': False, 'use_batchnorm': True, 'use_dropout': True, 'dropout': 0.6773837175723626, 'mlp_size_1': 7, 'mlp_size_2': 1, 'mlp_size_3': 0, 'kernel': 'Logistic', 'loss_name': 'NLLLoss'}. Best is trial 367 with value: 0.8756446640888914.[0m
[32m[I 2022-04-17 23:30:34,244][0m Trial 736 finished with value: 0.8649499053774015 and parameters: {'n_hidden': 64, 'mixture_components': 5, 'use_sparse_layer': False, 'use_batchnorm': True, 'use_dropout': True, 'dropout': 0.7932646021330483, 'mlp_size_1': 0, 'mlp_size_2': 2, 'mlp_size_3': 0, 'kernel': 'Exponential', 'loss_name': 'NLLLoss'}. Best is trial 367 with value: 0.8756446640888914.[0m
[32m[I 2022-04-17 23:36:48,935][0m Trial 737 finished with value: 0.8617343357863743 and parameters: {'n_hidden': 32, 'mixture_components': 5, 'use_sparse_layer': False, 'use_batchnorm': True, 'use_dropout': True, 'dropout': 0.7663537494877551, 'mlp_size_1': 0, 'mlp_size_2': 2, 'mlp_size_3': 0, 'kernel': 'Exponential', 'loss_name': 'NLLLoss'}. Best is trial 367 with value: 0.8756446640888914.[0m
[32m[I 2022-04-17 23:37:45,924][0m Trial 738 finished with value: -0.5 and parameters: {'n_hidden': 256, 'mixture_components': 7, 'use_sparse_layer': True, 'use_sparse_loss': False, 'use_batchnorm': True, 'use_dropout': True, 'dropout': 0.6929546190965933, 'mlp_size_1': 0, 'mlp_size_2': 2, 'mlp_size_3': 0, 'kernel': 'Gumbel', 'loss_name': 'NLLLoss'}. Best is trial 367 with value: 0.8756446640888914.[0m
[32m[I 2022-04-17 23:43:05,860][0m Trial 739 finished with value: 0.8727912425728197 and parameters: {'n_hidden': 64, 'mixture_components': 4, 'use_sparse_layer': False, 'use_batchnorm': True, 'use_dropout': True, 'dropout': 0.646195698053677, 'mlp_size_1': 0, 'mlp_size_2': 2, 'mlp_size_3': 0, 'kernel': 'Exponential', 'loss_name': 'NLLLoss'}. Best is trial 367 with value: 0.8756446640888914.[0m
[32m[I 2022-04-17 23:44:36,348][0m Trial 740 finished with value: 0.672214187870855 and parameters: {'n_hidden': 64, 'mixture_components': 4, 'use_sparse_layer': False, 'use_batchnorm': False, 'use_dropout': True, 'dropout': 0.6376927460424049, 'mlp_size_1': 0, 'mlp_size_2': 2, 'mlp_size_3': 0, 'kernel': 'Exponential', 'loss_name': 'NLLLoss'}. Best is trial 367 with value: 0.8756446640888914.[0m
[32m[I 2022-04-17 23:50:36,485][0m Trial 741 finished with value: 0.8662489656688157 and parameters: {'n_hidden': 64, 'mixture_components': 4, 'use_sparse_layer': False, 'use_batchnorm': True, 'use_dropout': True, 'dropout': 0.6208999411991636, 'mlp_size_1': 0, 'mlp_size_2': 2, 'mlp_size_3': 0, 'kernel': 'Exponential', 'loss_name': 'AlternativeNLLLoss'}. Best is trial 367 with value: 0.8756446640888914.[0m
[32m[I 2022-04-17 23:54:26,152][0m Trial 742 finished with value: 0.8605293119549298 and parameters: {'n_hidden': 512, 'mixture_components': 4, 'use_sparse_layer': False, 'use_batchnorm': True, 'use_dropout': True, 'dropout': 0.6537727766342079, 'mlp_size_1': 0, 'mlp_size_2': 3, 'mlp_size_3': 0, 'kernel': 'Exponential', 'loss_name': 'NLLLoss'}. Best is trial 367 with value: 0.8756446640888914.[0m
[32m[I 2022-04-17 23:57:41,685][0m Trial 743 finished with value: 0.8432196663230656 and parameters: {'n_hidden': 64, 'mixture_components': 4, 'use_sparse_layer': False, 'use_batchnorm': True, 'use_dropout': False, 'mlp_size_1': 0, 'mlp_size_2': 2, 'mlp_size_3': 0, 'kernel': 'Exponential', 'loss_name': 'NLLLoss'}. Best is trial 367 with value: 0.8756446640888914.[0m
[32m[I 2022-04-18 00:01:21,044][0m Trial 744 finished with value: 0.85843940980539 and parameters: {'n_hidden': 128, 'mixture_components': 4, 'use_sparse_layer': False, 'use_batchnorm': True, 'use_dropout': True, 'dropout': 0.6082705132504638, 'mlp_size_1': 0, 'mlp_size_2': 2, 'mlp_size_3': 0, 'kernel': 'LogLogistic', 'loss_name': 'NLLLoss'}. Best is trial 367 with value: 0.8756446640888914.[0m
[32m[I 2022-04-18 00:04:52,552][0m Trial 745 finished with value: 0.8531594878470876 and parameters: {'n_hidden': 1024, 'mixture_components': 4, 'use_sparse_layer': False, 'use_batchnorm': True, 'use_dropout': True, 'dropout': 0.6454170529572774, 'mlp_size_1': 0, 'mlp_size_2': 4, 'mlp_size_3': 0, 'kernel': 'Exponential', 'loss_name': 'NLLLoss'}. Best is trial 367 with value: 0.8756446640888914.[0m
[32m[I 2022-04-18 00:10:10,080][0m Trial 746 finished with value: 0.8605669106558043 and parameters: {'n_hidden': 64, 'mixture_components': 4, 'use_sparse_layer': False, 'use_batchnorm': True, 'use_dropout': True, 'dropout': 0.6666707188427166, 'mlp_size_1': 0, 'mlp_size_2': 2, 'mlp_size_3': 0, 'kernel': 'Exponential', 'loss_name': 'NLLLoss'}. Best is trial 367 with value: 0.8756446640888914.[0m
[32m[I 2022-04-18 00:15:24,440][0m Trial 747 finished with value: 0.870320248731335 and parameters: {'n_hidden': 64, 'mixture_components': 4, 'use_sparse_layer': False, 'use_batchnorm': True, 'use_dropout': True, 'dropout': 0.5956580857782475, 'mlp_size_1': 0, 'mlp_size_2': 2, 'mlp_size_3': 0, 'kernel': 'Exponential', 'loss_name': 'NLLLoss'}. Best is trial 367 with value: 0.8756446640888914.[0m
[32m[I 2022-04-18 00:21:16,738][0m Trial 748 finished with value: 0.86342374312764 and parameters: {'n_hidden': 32, 'mixture_components': 4, 'use_sparse_layer': False, 'use_batchnorm': True, 'use_dropout': True, 'dropout': 0.6251117507691877, 'mlp_size_1': 0, 'mlp_size_2': 2, 'mlp_size_3': 0, 'kernel': 'Exponential', 'loss_name': 'NLLLoss'}. Best is trial 367 with value: 0.8756446640888914.[0m
[32m[I 2022-04-18 00:26:21,478][0m Trial 749 finished with value: 0.8663000974733439 and parameters: {'n_hidden': 64, 'mixture_components': 4, 'use_sparse_layer': False, 'use_batchnorm': True, 'use_dropout': True, 'dropout': 0.6619394271799559, 'mlp_size_1': 0, 'mlp_size_2': 2, 'mlp_size_3': 0, 'kernel': 'Exponential', 'loss_name': 'NLLLoss'}. Best is trial 367 with value: 0.8756446640888914.[0m
