[32m[I 2022-04-14 04:28:44,747][0m Trial 83 finished with value: 0.717382257632068 and parameters: {'loss': 'coxph', 'learning_rate': 0.003633167179875547, 'n_estimators': 504, 'criterion': 'squared_error', 'min_samples_split': 5, 'min_samples_leaf': 6, 'min_weight_fraction_leaf': 0.03262398582295606, 'min_impurity_decrease': 0.1288207800028448, 'max_features': 0.6711841830481106, 'subsample': 0.4392968740480922, 'dropout_rate': 0.1023912411836932, 'ccp_alpha': 0.0646140300620826}. Best is trial 81 with value: 0.7271739296425965.[0m
[32m[I 2022-04-14 04:29:39,760][0m Trial 84 finished with value: 0.6829653234559423 and parameters: {'loss': 'coxph', 'learning_rate': 0.0035926070277334412, 'n_estimators': 511, 'criterion': 'squared_error', 'min_samples_split': 5, 'min_samples_leaf': 5, 'min_weight_fraction_leaf': 0.021912411544189984, 'min_impurity_decrease': 0.12372863520983808, 'max_features': 0.716860554016084, 'subsample': 0.43324305878287817, 'dropout_rate': 0.08857441773152136, 'ccp_alpha': 0.2895016802392991}. Best is trial 81 with value: 0.7271739296425965.[0m
[32m[I 2022-04-14 04:30:12,124][0m Trial 85 finished with value: 0.7225872551263102 and parameters: {'loss': 'coxph', 'learning_rate': 0.005365980892473656, 'n_estimators': 414, 'criterion': 'squared_error', 'min_samples_split': 5, 'min_samples_leaf': 4, 'min_weight_fraction_leaf': 0.003002439710753757, 'min_impurity_decrease': 0.18110433736368658, 'max_features': 0.6601530914622441, 'subsample': 0.4746078651452759, 'dropout_rate': 0.17002731532154053, 'ccp_alpha': 0.07584651336589611}. Best is trial 81 with value: 0.7271739296425965.[0m
[32m[I 2022-04-14 04:30:40,766][0m Trial 86 finished with value: 0.7375113280143543 and parameters: {'loss': 'coxph', 'learning_rate': 0.005344051721532442, 'n_estimators': 422, 'criterion': 'squared_error', 'min_samples_split': 5, 'min_samples_leaf': 4, 'min_weight_fraction_leaf': 0.016648765962748696, 'min_impurity_decrease': 0.19772829820561005, 'max_features': 0.6424210653035719, 'subsample': 0.5100190128716009, 'dropout_rate': 0.1754201801885866, 'ccp_alpha': 0.0011028281483383695}. Best is trial 86 with value: 0.7375113280143543.[0m
[32m[I 2022-04-14 04:31:47,836][0m Trial 87 finished with value: 0.728865791247485 and parameters: {'loss': 'coxph', 'learning_rate': 0.006781384637131593, 'n_estimators': 598, 'criterion': 'squared_error', 'min_samples_split': 5, 'min_samples_leaf': 4, 'min_weight_fraction_leaf': 0.023050586420720706, 'min_impurity_decrease': 0.1727116070631266, 'max_features': 0.7526682356134335, 'subsample': 0.5088179217003647, 'dropout_rate': 0.19136067563001935, 'ccp_alpha': 0.007886642500569172}. Best is trial 86 with value: 0.7375113280143543.[0m
[32m[I 2022-04-14 04:32:52,089][0m Trial 88 finished with value: 0.679787417019732 and parameters: {'loss': 'coxph', 'learning_rate': 0.005651338881094873, 'n_estimators': 582, 'criterion': 'squared_error', 'min_samples_split': 6, 'min_samples_leaf': 4, 'min_weight_fraction_leaf': 0.009130990849603423, 'min_impurity_decrease': 0.2950059345343408, 'max_features': 0.7599857760010187, 'subsample': 0.5143016666802942, 'dropout_rate': 0.1532935585706538, 'ccp_alpha': 0.3687410730579717}. Best is trial 86 with value: 0.7375113280143543.[0m
[32m[I 2022-04-14 04:33:20,113][0m Trial 89 finished with value: 0.5 and parameters: {'loss': 'coxph', 'learning_rate': 0.01220011953480777, 'n_estimators': 427, 'criterion': 'squared_error', 'min_samples_split': 5, 'min_samples_leaf': 3, 'min_weight_fraction_leaf': 0.0012138021274384417, 'min_impurity_decrease': 0.24569681376229155, 'max_features': 0.647600007074262, 'subsample': 0.5685234777656843, 'dropout_rate': 0.2474724649156101, 'ccp_alpha': 0.5844376098493713}. Best is trial 86 with value: 0.7375113280143543.[0m
[32m[I 2022-04-14 04:34:27,325][0m Trial 90 finished with value: 0.7263254799462906 and parameters: {'loss': 'coxph', 'learning_rate': 0.0066877886581971245, 'n_estimators': 641, 'criterion': 'squared_error', 'min_samples_split': 6, 'min_samples_leaf': 4, 'min_weight_fraction_leaf': 0.046673849430842046, 'min_impurity_decrease': 0.18770655325946045, 'max_features': 0.8020127707519731, 'subsample': 0.6153309527376019, 'dropout_rate': 0.19580709778671201, 'ccp_alpha': 0.01636591792336209}. Best is trial 86 with value: 0.7375113280143543.[0m
[32m[I 2022-04-14 04:35:35,327][0m Trial 91 finished with value: 0.7232403297072242 and parameters: {'loss': 'coxph', 'learning_rate': 0.006934064947716606, 'n_estimators': 641, 'criterion': 'squared_error', 'min_samples_split': 6, 'min_samples_leaf': 4, 'min_weight_fraction_leaf': 0.047726582775917195, 'min_impurity_decrease': 0.20093812375965941, 'max_features': 0.7020649247399332, 'subsample': 0.593428358778304, 'dropout_rate': 0.1785857194631654, 'ccp_alpha': 0.006708807610624479}. Best is trial 86 with value: 0.7375113280143543.[0m
[32m[I 2022-04-14 04:36:55,542][0m Trial 92 finished with value: 0.7066945776842093 and parameters: {'loss': 'coxph', 'learning_rate': 0.0178189513714776, 'n_estimators': 657, 'criterion': 'squared_error', 'min_samples_split': 6, 'min_samples_leaf': 4, 'min_weight_fraction_leaf': 0.05484228245903075, 'min_impurity_decrease': 0.18181571884500586, 'max_features': 0.8035410166479635, 'subsample': 0.7446194484845075, 'dropout_rate': 0.18541921311479237, 'ccp_alpha': 0.054269229222871015}. Best is trial 86 with value: 0.7375113280143543.[0m
[32m[I 2022-04-14 04:37:44,017][0m Trial 93 finished with value: 0.5049013916902899 and parameters: {'loss': 'coxph', 'learning_rate': 0.002522092888344353, 'n_estimators': 534, 'criterion': 'squared_error', 'min_samples_split': 6, 'min_samples_leaf': 4, 'min_weight_fraction_leaf': 0.042409947415671764, 'min_impurity_decrease': 0.19263025597730576, 'max_features': 0.7391085623911005, 'subsample': 0.6785416130574531, 'dropout_rate': 0.14997540289914624, 'ccp_alpha': 0.3810538272763361}. Best is trial 86 with value: 0.7375113280143543.[0m
[32m[I 2022-04-14 04:38:51,651][0m Trial 94 finished with value: 0.703464318777854 and parameters: {'loss': 'coxph', 'learning_rate': 0.006408273059939281, 'n_estimators': 637, 'criterion': 'squared_error', 'min_samples_split': 6, 'min_samples_leaf': 3, 'min_weight_fraction_leaf': 0.02624961759237574, 'min_impurity_decrease': 0.26858009034990044, 'max_features': 0.7802667569706732, 'subsample': 0.6026518375106473, 'dropout_rate': 0.2013747897259093, 'ccp_alpha': 0.06692714828824217}. Best is trial 86 with value: 0.7375113280143543.[0m
[32m[I 2022-04-14 04:40:16,078][0m Trial 95 finished with value: 0.570839277021393 and parameters: {'loss': 'coxph', 'learning_rate': 0.004768824941707526, 'n_estimators': 706, 'criterion': 'squared_error', 'min_samples_split': 5, 'min_samples_leaf': 3, 'min_weight_fraction_leaf': 0.01796719264366204, 'min_impurity_decrease': 0.3605437453513418, 'max_features': 0.6911161178181926, 'subsample': 0.6251791749207554, 'dropout_rate': 0.26913759643805135, 'ccp_alpha': 0.012289280205781392}. Best is trial 86 with value: 0.7375113280143543.[0m
[32m[I 2022-04-14 04:40:55,442][0m Trial 96 finished with value: 0.6761199546326679 and parameters: {'loss': 'coxph', 'learning_rate': 0.011169117135313206, 'n_estimators': 473, 'criterion': 'squared_error', 'min_samples_split': 6, 'min_samples_leaf': 4, 'min_weight_fraction_leaf': 0.07231672306138587, 'min_impurity_decrease': 0.16291622727144478, 'max_features': 0.7123144172533878, 'subsample': 0.6011284453746831, 'dropout_rate': 0.13308439239654762, 'ccp_alpha': 0.3203911854196456}. Best is trial 86 with value: 0.7375113280143543.[0m
[32m[I 2022-04-14 04:42:11,965][0m Trial 97 finished with value: 0.5049013916902899 and parameters: {'loss': 'coxph', 'learning_rate': 0.006427800029688075, 'n_estimators': 629, 'criterion': 'squared_error', 'min_samples_split': 5, 'min_samples_leaf': 4, 'min_weight_fraction_leaf': 0.05019404792760542, 'min_impurity_decrease': 0.2025580202768805, 'max_features': 0.8115466361638207, 'subsample': 0.558780220652113, 'dropout_rate': 0.1828229316980278, 'ccp_alpha': 0.5405155059247518}. Best is trial 86 with value: 0.7375113280143543.[0m
[32m[I 2022-04-14 04:42:56,264][0m Trial 98 finished with value: 0.5 and parameters: {'loss': 'squared', 'learning_rate': 0.0018505723464836727, 'n_estimators': 567, 'criterion': 'squared_error', 'min_samples_split': 5, 'min_samples_leaf': 4, 'min_weight_fraction_leaf': 0.03671429706368847, 'min_impurity_decrease': 0.2938086869802236, 'max_features': 0.7682168616242729, 'subsample': 0.7125331699908841, 'dropout_rate': 0.37692741609606417, 'ccp_alpha': 1.6994505842207115}. Best is trial 86 with value: 0.7375113280143543.[0m
[32m[I 2022-04-14 04:44:32,672][0m Trial 99 finished with value: 0.5 and parameters: {'loss': 'coxph', 'learning_rate': 0.01545055677107001, 'n_estimators': 827, 'criterion': 'squared_error', 'min_samples_split': 6, 'min_samples_leaf': 3, 'min_weight_fraction_leaf': 0.016310632811154288, 'min_impurity_decrease': 0.14874534507391912, 'max_features': 0.8465035788622424, 'subsample': 0.4678596317879501, 'dropout_rate': 0.3283664036249311, 'ccp_alpha': 2.6865007513395724}. Best is trial 86 with value: 0.7375113280143543.[0m
[32m[I 2022-04-14 04:45:01,345][0m Trial 100 finished with value: 0.7264053045651325 and parameters: {'loss': 'coxph', 'learning_rate': 0.009960377193208815, 'n_estimators': 435, 'criterion': 'squared_error', 'min_samples_split': 6, 'min_samples_leaf': 4, 'min_weight_fraction_leaf': 0.07045370032874725, 'min_impurity_decrease': 0.23376263363117988, 'max_features': 0.6989955338691459, 'subsample': 0.5224136235372353, 'dropout_rate': 0.2312084208639921, 'ccp_alpha': 0.24312023999155088}. Best is trial 86 with value: 0.7375113280143543.[0m
[32m[I 2022-04-14 04:45:32,439][0m Trial 101 finished with value: 0.5 and parameters: {'loss': 'coxph', 'learning_rate': 0.010405530198738, 'n_estimators': 434, 'criterion': 'squared_error', 'min_samples_split': 6, 'min_samples_leaf': 4, 'min_weight_fraction_leaf': 0.06326079761375188, 'min_impurity_decrease': 0.23664842841411146, 'max_features': 0.7342238173911991, 'subsample': 0.5205859283309333, 'dropout_rate': 0.24102948833466264, 'ccp_alpha': 2.2318846161233403}. Best is trial 86 with value: 0.7375113280143543.[0m
[32m[I 2022-04-14 04:45:58,116][0m Trial 102 finished with value: 0.6345137397202582 and parameters: {'loss': 'coxph', 'learning_rate': 0.021575457277459215, 'n_estimators': 377, 'criterion': 'squared_error', 'min_samples_split': 6, 'min_samples_leaf': 4, 'min_weight_fraction_leaf': 0.09220175505564285, 'min_impurity_decrease': 0.3281986521093392, 'max_features': 0.6949254978747785, 'subsample': 0.5858574331670638, 'dropout_rate': 0.17709753828427094, 'ccp_alpha': 0.0023591846331645766}. Best is trial 86 with value: 0.7375113280143543.[0m
[32m[I 2022-04-14 04:46:58,406][0m Trial 103 finished with value: 0.7325871053320692 and parameters: {'loss': 'coxph', 'learning_rate': 0.007250025205933008, 'n_estimators': 601, 'criterion': 'squared_error', 'min_samples_split': 5, 'min_samples_leaf': 3, 'min_weight_fraction_leaf': 0.052983549492742796, 'min_impurity_decrease': 0.16851136188643345, 'max_features': 0.6404050503768037, 'subsample': 0.5425771141699116, 'dropout_rate': 0.2853077443721819, 'ccp_alpha': 0.2272084349719346}. Best is trial 86 with value: 0.7375113280143543.[0m
[32m[I 2022-04-14 04:48:16,342][0m Trial 104 finished with value: 0.7146506124637088 and parameters: {'loss': 'coxph', 'learning_rate': 0.00478715734853367, 'n_estimators': 698, 'criterion': 'squared_error', 'min_samples_split': 5, 'min_samples_leaf': 3, 'min_weight_fraction_leaf': 0.07289688462949348, 'min_impurity_decrease': 0.2639358124099099, 'max_features': 0.6578354809426403, 'subsample': 0.4596029015882541, 'dropout_rate': 0.2892015933175567, 'ccp_alpha': 0.27292239312781447}. Best is trial 86 with value: 0.7375113280143543.[0m
[32m[I 2022-04-14 04:48:59,190][0m Trial 105 finished with value: 0.5 and parameters: {'loss': 'coxph', 'learning_rate': 0.007527347906042404, 'n_estimators': 501, 'criterion': 'squared_error', 'min_samples_split': 5, 'min_samples_leaf': 4, 'min_weight_fraction_leaf': 0.05224582242503108, 'min_impurity_decrease': 0.20801355977483493, 'max_features': 0.8388325785733463, 'subsample': 0.8130412073214608, 'dropout_rate': 0.261842968517847, 'ccp_alpha': 0.4236220408167091}. Best is trial 86 with value: 0.7375113280143543.[0m
[32m[I 2022-04-14 04:50:04,073][0m Trial 106 finished with value: 0.7366011149437085 and parameters: {'loss': 'coxph', 'learning_rate': 0.0022802195890599176, 'n_estimators': 599, 'criterion': 'squared_error', 'min_samples_split': 5, 'min_samples_leaf': 3, 'min_weight_fraction_leaf': 0.03826755276774785, 'min_impurity_decrease': 0.17270428533354168, 'max_features': 0.7552901903656772, 'subsample': 0.5002828082745349, 'dropout_rate': 0.2049994135336458, 'ccp_alpha': 0.14327986356459824}. Best is trial 86 with value: 0.7375113280143543.[0m
[32m[I 2022-04-14 04:51:05,688][0m Trial 107 finished with value: 0.7224427122166597 and parameters: {'loss': 'coxph', 'learning_rate': 0.0021718329048841857, 'n_estimators': 604, 'criterion': 'squared_error', 'min_samples_split': 5, 'min_samples_leaf': 3, 'min_weight_fraction_leaf': 0.03728451148921016, 'min_impurity_decrease': 0.17443929809762235, 'max_features': 0.7818176081469811, 'subsample': 0.6302759935538608, 'dropout_rate': 0.21177904432767236, 'ccp_alpha': 0.1276962060610146}. Best is trial 86 with value: 0.7375113280143543.[0m
[32m[I 2022-04-14 04:51:53,695][0m Trial 108 finished with value: 0.7238140367973425 and parameters: {'loss': 'coxph', 'learning_rate': 0.002689326543492964, 'n_estimators': 541, 'criterion': 'squared_error', 'min_samples_split': 5, 'min_samples_leaf': 3, 'min_weight_fraction_leaf': 0.00507761646008135, 'min_impurity_decrease': 0.23609402619143668, 'max_features': 0.7485169945114625, 'subsample': 0.5419347429568766, 'dropout_rate': 0.3060572632551537, 'ccp_alpha': 0.268535171556251}. Best is trial 86 with value: 0.7375113280143543.[0m
[32m[I 2022-04-14 04:52:45,070][0m Trial 109 finished with value: 0.5 and parameters: {'loss': 'coxph', 'learning_rate': 0.00292878499137171, 'n_estimators': 547, 'criterion': 'squared_error', 'min_samples_split': 6, 'min_samples_leaf': 3, 'min_weight_fraction_leaf': 0.060270444757156844, 'min_impurity_decrease': 0.2846608375105939, 'max_features': 0.7562445743084193, 'subsample': 0.6689553591075437, 'dropout_rate': 0.30225960312993483, 'ccp_alpha': 3.3973479752172144}. Best is trial 86 with value: 0.7375113280143543.[0m
[32m[I 2022-04-14 04:54:18,803][0m Trial 110 finished with value: 0.5 and parameters: {'loss': 'coxph', 'learning_rate': 0.0012423540483841489, 'n_estimators': 734, 'criterion': 'squared_error', 'min_samples_split': 5, 'min_samples_leaf': 2, 'min_weight_fraction_leaf': 0.025509082685126278, 'min_impurity_decrease': 0.24959654225864922, 'max_features': 0.7411544100640488, 'subsample': 0.5403461441503568, 'dropout_rate': 0.2360460364971159, 'ccp_alpha': 3.213838078336922}. Best is trial 86 with value: 0.7375113280143543.[0m
[32m[I 2022-04-14 04:55:11,243][0m Trial 111 finished with value: 0.7252813050547429 and parameters: {'loss': 'coxph', 'learning_rate': 0.0046332103446014815, 'n_estimators': 591, 'criterion': 'squared_error', 'min_samples_split': 5, 'min_samples_leaf': 3, 'min_weight_fraction_leaf': 0.012222226988330436, 'min_impurity_decrease': 0.20875414687564087, 'max_features': 0.7941154640732148, 'subsample': 0.5064354792103217, 'dropout_rate': 0.26636298515890905, 'ccp_alpha': 0.2597298424789962}. Best is trial 86 with value: 0.7375113280143543.[0m
[32m[I 2022-04-14 04:55:57,952][0m Trial 112 finished with value: 0.7066909282316723 and parameters: {'loss': 'coxph', 'learning_rate': 0.0014713446774377917, 'n_estimators': 593, 'criterion': 'squared_error', 'min_samples_split': 5, 'min_samples_leaf': 3, 'min_weight_fraction_leaf': 0.01475748866893734, 'min_impurity_decrease': 0.22691620649658692, 'max_features': 0.7983518204495603, 'subsample': 0.5741045952297488, 'dropout_rate': 0.367335894955023, 'ccp_alpha': 0.2767941390298322}. Best is trial 86 with value: 0.7375113280143543.[0m
[32m[I 2022-04-14 04:56:43,521][0m Trial 113 finished with value: 0.5521240026945989 and parameters: {'loss': 'coxph', 'learning_rate': 0.00422639265822621, 'n_estimators': 523, 'criterion': 'squared_error', 'min_samples_split': 5, 'min_samples_leaf': 3, 'min_weight_fraction_leaf': 0.04926701581688008, 'min_impurity_decrease': 0.21176953760234005, 'max_features': 0.7078445913781174, 'subsample': 0.5036396058982959, 'dropout_rate': 0.26110100508305895, 'ccp_alpha': 0.45173504208250614}. Best is trial 86 with value: 0.7375113280143543.[0m
[32m[I 2022-04-14 04:57:20,642][0m Trial 114 finished with value: 0.7226918201646572 and parameters: {'loss': 'coxph', 'learning_rate': 0.0024793341121174526, 'n_estimators': 461, 'criterion': 'squared_error', 'min_samples_split': 6, 'min_samples_leaf': 3, 'min_weight_fraction_leaf': 0.0410041569980888, 'min_impurity_decrease': 0.15121514379470674, 'max_features': 0.8082849924209118, 'subsample': 0.5202261874858511, 'dropout_rate': 0.35376642492821103, 'ccp_alpha': 0.20216687490332552}. Best is trial 86 with value: 0.7375113280143543.[0m
[32m[I 2022-04-14 04:58:36,798][0m Trial 115 finished with value: 0.660447354461762 and parameters: {'loss': 'coxph', 'learning_rate': 0.0030371764964030185, 'n_estimators': 675, 'criterion': 'squared_error', 'min_samples_split': 4, 'min_samples_leaf': 2, 'min_weight_fraction_leaf': 0.029590294022718653, 'min_impurity_decrease': 0.10543886827711807, 'max_features': 0.8243390066793037, 'subsample': 0.5496621579122061, 'dropout_rate': 0.21516355590756, 'ccp_alpha': 0.3538110388376509}. Best is trial 86 with value: 0.7375113280143543.[0m
[32m[I 2022-04-14 04:59:41,490][0m Trial 116 finished with value: 0.5 and parameters: {'loss': 'coxph', 'learning_rate': 0.0070626477741283335, 'n_estimators': 627, 'criterion': 'squared_error', 'min_samples_split': 5, 'min_samples_leaf': 4, 'min_weight_fraction_leaf': 0.07267139166656011, 'min_impurity_decrease': 0.19619426472750381, 'max_features': 0.746648694151062, 'subsample': 0.6149280761074664, 'dropout_rate': 0.19591975399997352, 'ccp_alpha': 0.6933147398958315}. Best is trial 86 with value: 0.7375113280143543.[0m
[32m[I 2022-04-14 05:00:28,202][0m Trial 117 finished with value: 0.5049013916902899 and parameters: {'loss': 'coxph', 'learning_rate': 0.009370870754249088, 'n_estimators': 559, 'criterion': 'squared_error', 'min_samples_split': 6, 'min_samples_leaf': 3, 'min_weight_fraction_leaf': 0.011078542617977085, 'min_impurity_decrease': 0.2461588733348179, 'max_features': 0.7716189409641198, 'subsample': 0.5877395146294311, 'dropout_rate': 0.33884223882400566, 'ccp_alpha': 0.5432089623219428}. Best is trial 86 with value: 0.7375113280143543.[0m
[32m[I 2022-04-14 05:02:16,216][0m Trial 118 finished with value: 0.69637016857135 and parameters: {'loss': 'coxph', 'learning_rate': 0.012844250789454534, 'n_estimators': 783, 'criterion': 'squared_error', 'min_samples_split': 5, 'min_samples_leaf': 4, 'min_weight_fraction_leaf': 0.09412918656680763, 'min_impurity_decrease': 0.32568925912495783, 'max_features': 0.704358189883896, 'subsample': 0.4965748075828419, 'dropout_rate': 0.28239002697354565, 'ccp_alpha': 0.1496126008704793}. Best is trial 86 with value: 0.7375113280143543.[0m
[32m[I 2022-04-14 05:02:48,428][0m Trial 119 finished with value: 0.2689064831801232 and parameters: {'loss': 'squared', 'learning_rate': 0.0021439640221968506, 'n_estimators': 491, 'criterion': 'squared_error', 'min_samples_split': 4, 'min_samples_leaf': 3, 'min_weight_fraction_leaf': 0.08323753478021897, 'min_impurity_decrease': 0.16580385864855562, 'max_features': 0.791447037881542, 'subsample': 0.6462312266139011, 'dropout_rate': 0.41736457820604805, 'ccp_alpha': 0.25993925179205213}. Best is trial 86 with value: 0.7375113280143543.[0m
[32m[I 2022-04-14 05:04:21,785][0m Trial 120 finished with value: 0.5 and parameters: {'loss': 'coxph', 'learning_rate': 0.0008435365568503206, 'n_estimators': 670, 'criterion': 'squared_error', 'min_samples_split': 5, 'min_samples_leaf': 2, 'min_weight_fraction_leaf': 0.022375469436027518, 'min_impurity_decrease': 0.45918753806875723, 'max_features': 0.6874813997075053, 'subsample': 0.527750008157759, 'dropout_rate': 0.1401394505760904, 'ccp_alpha': 3.730506467080779}. Best is trial 86 with value: 0.7375113280143543.[0m
[32m[I 2022-04-14 05:05:20,792][0m Trial 121 finished with value: 0.7390170571688387 and parameters: {'loss': 'coxph', 'learning_rate': 0.0005441919914750202, 'n_estimators': 587, 'criterion': 'squared_error', 'min_samples_split': 6, 'min_samples_leaf': 3, 'min_weight_fraction_leaf': 0.04172523106904389, 'min_impurity_decrease': 0.1415057338643762, 'max_features': 0.8192248769494006, 'subsample': 0.5107489387540801, 'dropout_rate': 0.30436484889487186, 'ccp_alpha': 0.1873598535105574}. Best is trial 121 with value: 0.7390170571688387.[0m
[32m[I 2022-04-14 05:06:10,107][0m Trial 122 finished with value: 0.7288607853616333 and parameters: {'loss': 'coxph', 'learning_rate': 0.0004034765097909409, 'n_estimators': 616, 'criterion': 'squared_error', 'min_samples_split': 6, 'min_samples_leaf': 3, 'min_weight_fraction_leaf': 0.036527876463865884, 'min_impurity_decrease': 0.13672362783205105, 'max_features': 0.8193626518123214, 'subsample': 0.5484815684477049, 'dropout_rate': 0.3958472914538072, 'ccp_alpha': 0.1248225465040721}. Best is trial 121 with value: 0.7390170571688387.[0m
