[32m[I 2022-04-13 11:46:06,064][0m Trial 700 finished with value: 0.6881740970397604 and parameters: {'splitter': 'best', 'min_samples_split': 0.2804250830602476, 'min_samples_leaf': 0.01062038469168934, 'min_weight_fraction_leaf': 0.09133163095078436, 'max_features': 0.5443841219643142}. Best is trial 163 with value: 0.7137418010284807.[0m
[32m[I 2022-04-13 11:46:06,134][0m Trial 701 finished with value: 0.6925091183676373 and parameters: {'splitter': 'best', 'min_samples_split': 0.2414032737731433, 'min_samples_leaf': 0.07383280161424084, 'min_weight_fraction_leaf': 0.10582991446974581, 'max_features': 0.5638549694711583}. Best is trial 163 with value: 0.7137418010284807.[0m
[32m[I 2022-04-13 11:46:06,186][0m Trial 702 finished with value: 0.7044783206942828 and parameters: {'splitter': 'best', 'min_samples_split': 0.311672444518162, 'min_samples_leaf': 0.05408284402174354, 'min_weight_fraction_leaf': 0.12538649342486208, 'max_features': 0.5463027308499635}. Best is trial 163 with value: 0.7137418010284807.[0m
[32m[I 2022-04-13 11:46:06,224][0m Trial 703 finished with value: 0.6313956127109936 and parameters: {'splitter': 'best', 'min_samples_split': 0.3373220206457263, 'min_samples_leaf': 0.021455942063954958, 'min_weight_fraction_leaf': 0.13346572206651064, 'max_features': 0.4802703684396858}. Best is trial 163 with value: 0.7137418010284807.[0m
[32m[I 2022-04-13 11:46:06,269][0m Trial 704 finished with value: 0.6393814860932593 and parameters: {'splitter': 'best', 'min_samples_split': 0.35802597335534037, 'min_samples_leaf': 0.029314357011750915, 'min_weight_fraction_leaf': 0.04686239100596303, 'max_features': 0.4948255247996599}. Best is trial 163 with value: 0.7137418010284807.[0m
[32m[I 2022-04-13 11:46:06,331][0m Trial 705 finished with value: 0.7137418010284807 and parameters: {'splitter': 'best', 'min_samples_split': 0.3172316597655988, 'min_samples_leaf': 0.010096872636973703, 'min_weight_fraction_leaf': 0.07826606676387565, 'max_features': 0.5123529273765627}. Best is trial 163 with value: 0.7137418010284807.[0m
[32m[I 2022-04-13 11:46:06,392][0m Trial 706 finished with value: 0.640273960732414 and parameters: {'splitter': 'best', 'min_samples_split': 0.3309718260670948, 'min_samples_leaf': 0.03151896578487408, 'min_weight_fraction_leaf': 0.059840340035462423, 'max_features': 0.4954103849960347}. Best is trial 163 with value: 0.7137418010284807.[0m
[32m[I 2022-04-13 11:46:06,451][0m Trial 707 finished with value: 0.6989673695016856 and parameters: {'splitter': 'best', 'min_samples_split': 0.3513310830647102, 'min_samples_leaf': 0.025202152348811038, 'min_weight_fraction_leaf': 0.12459256448329872, 'max_features': 0.527022418787751}. Best is trial 163 with value: 0.7137418010284807.[0m
[32m[I 2022-04-13 11:46:06,542][0m Trial 708 finished with value: 0.7137418010284807 and parameters: {'splitter': 'best', 'min_samples_split': 0.3247613772261428, 'min_samples_leaf': 0.02055205346247208, 'min_weight_fraction_leaf': 0.07333413109627991, 'max_features': 0.5272168084718765}. Best is trial 163 with value: 0.7137418010284807.[0m
[32m[I 2022-04-13 11:46:06,646][0m Trial 709 finished with value: 0.6150737283379903 and parameters: {'splitter': 'best', 'min_samples_split': 0.2998564652864994, 'min_samples_leaf': 0.010132108080633329, 'min_weight_fraction_leaf': 0.2742315668113559, 'max_features': 0.512640043698291}. Best is trial 163 with value: 0.7137418010284807.[0m
[32m[I 2022-04-13 11:46:06,745][0m Trial 710 finished with value: 0.7044783206942828 and parameters: {'splitter': 'best', 'min_samples_split': 0.3112289362149325, 'min_samples_leaf': 0.06782874582276363, 'min_weight_fraction_leaf': 0.11550820021943028, 'max_features': 0.5406710925158221}. Best is trial 163 with value: 0.7137418010284807.[0m
[32m[I 2022-04-13 11:46:06,814][0m Trial 711 finished with value: 0.6513176944526099 and parameters: {'splitter': 'best', 'min_samples_split': 0.3228066831943858, 'min_samples_leaf': 0.012088875863321257, 'min_weight_fraction_leaf': 0.08840872771768002, 'max_features': 0.4641238794391292}. Best is trial 163 with value: 0.7137418010284807.[0m
[32m[I 2022-04-13 11:46:06,911][0m Trial 712 finished with value: 0.684611897101941 and parameters: {'splitter': 'best', 'min_samples_split': 0.28787360613521557, 'min_samples_leaf': 0.00135143171888291, 'min_weight_fraction_leaf': 0.09937808633037597, 'max_features': 0.5309424071398391}. Best is trial 163 with value: 0.7137418010284807.[0m
[32m[I 2022-04-13 11:46:06,985][0m Trial 713 finished with value: 0.7044783206942828 and parameters: {'splitter': 'best', 'min_samples_split': 0.3152665753289793, 'min_samples_leaf': 0.023697788198285108, 'min_weight_fraction_leaf': 0.10879528127503812, 'max_features': 0.5051229629556404}. Best is trial 163 with value: 0.7137418010284807.[0m
[32m[I 2022-04-13 11:46:07,049][0m Trial 714 finished with value: 0.694086407378037 and parameters: {'splitter': 'best', 'min_samples_split': 0.33817610607620613, 'min_samples_leaf': 0.035389976189823605, 'min_weight_fraction_leaf': 0.18773609475740494, 'max_features': 0.5628138764482802}. Best is trial 163 with value: 0.7137418010284807.[0m
[32m[I 2022-04-13 11:46:07,182][0m Trial 715 finished with value: 0.695563433079365 and parameters: {'splitter': 'best', 'min_samples_split': 0.30053906037082406, 'min_samples_leaf': 0.012342964563744237, 'min_weight_fraction_leaf': 0.08878720669681725, 'max_features': 0.5200480484491697}. Best is trial 163 with value: 0.7137418010284807.[0m
[32m[I 2022-04-13 11:46:07,247][0m Trial 716 finished with value: 0.6698667293903124 and parameters: {'splitter': 'best', 'min_samples_split': 0.3335876849114273, 'min_samples_leaf': 0.05528195158035725, 'min_weight_fraction_leaf': 0.13500339184488913, 'max_features': 0.6276401230170381}. Best is trial 163 with value: 0.7137418010284807.[0m
[32m[I 2022-04-13 11:46:07,285][0m Trial 717 finished with value: 0.7137418010284807 and parameters: {'splitter': 'best', 'min_samples_split': 0.325797235071978, 'min_samples_leaf': 0.027468502081761804, 'min_weight_fraction_leaf': 0.07305038483113178, 'max_features': 0.562707014023554}. Best is trial 163 with value: 0.7137418010284807.[0m
[32m[I 2022-04-13 11:46:07,323][0m Trial 718 finished with value: 0.6955563537988494 and parameters: {'splitter': 'best', 'min_samples_split': 0.3465442182438449, 'min_samples_leaf': 0.05849742134935909, 'min_weight_fraction_leaf': 0.05232729236130951, 'max_features': 0.676319041222219}. Best is trial 163 with value: 0.7137418010284807.[0m
[32m[I 2022-04-13 11:46:07,359][0m Trial 719 finished with value: 0.7093409976331404 and parameters: {'splitter': 'random', 'min_samples_split': 0.33167009666051034, 'min_samples_leaf': 0.01838463141782503, 'min_weight_fraction_leaf': 0.11111590383372136, 'max_features': 0.5801501647385604}. Best is trial 163 with value: 0.7137418010284807.[0m
[32m[I 2022-04-13 11:46:07,452][0m Trial 720 finished with value: 0.7137418010284807 and parameters: {'splitter': 'best', 'min_samples_split': 0.32251350205227153, 'min_samples_leaf': 0.025023000664293544, 'min_weight_fraction_leaf': 0.08919453764916824, 'max_features': 0.5497323358281613}. Best is trial 163 with value: 0.7137418010284807.[0m
[32m[I 2022-04-13 11:46:07,569][0m Trial 721 finished with value: 0.5452756149154562 and parameters: {'splitter': 'best', 'min_samples_split': 0.34165536129578894, 'min_samples_leaf': 0.01778744835645006, 'min_weight_fraction_leaf': 0.09377400839381088, 'max_features': 0.1840749927606133}. Best is trial 163 with value: 0.7137418010284807.[0m
[32m[I 2022-04-13 11:46:07,675][0m Trial 722 finished with value: 0.7030519614506526 and parameters: {'splitter': 'best', 'min_samples_split': 0.3041210025765033, 'min_samples_leaf': 0.0014751324969971375, 'min_weight_fraction_leaf': 0.09879146281387809, 'max_features': 0.5216257506005435}. Best is trial 163 with value: 0.7137418010284807.[0m
[32m[I 2022-04-13 11:46:07,794][0m Trial 723 finished with value: 0.7137418010284807 and parameters: {'splitter': 'best', 'min_samples_split': 0.32248140548746124, 'min_samples_leaf': 0.01917029272675475, 'min_weight_fraction_leaf': 0.06988026056181922, 'max_features': 0.534804959380894}. Best is trial 163 with value: 0.7137418010284807.[0m
[32m[I 2022-04-13 11:46:07,862][0m Trial 724 finished with value: 0.6853507734439263 and parameters: {'splitter': 'best', 'min_samples_split': 0.3284869644316763, 'min_samples_leaf': 0.0315370746750982, 'min_weight_fraction_leaf': 0.03867532322262947, 'max_features': 0.5390204003850967}. Best is trial 163 with value: 0.7137418010284807.[0m
[32m[I 2022-04-13 11:46:07,929][0m Trial 725 finished with value: 0.7137418010284807 and parameters: {'splitter': 'best', 'min_samples_split': 0.3180667399423814, 'min_samples_leaf': 0.010607774626361841, 'min_weight_fraction_leaf': 0.08476443468828804, 'max_features': 0.5183397323568584}. Best is trial 163 with value: 0.7137418010284807.[0m
[32m[I 2022-04-13 11:46:08,001][0m Trial 726 finished with value: 0.6440317768217898 and parameters: {'splitter': 'best', 'min_samples_split': 0.3090151605853404, 'min_samples_leaf': 0.00985155906305671, 'min_weight_fraction_leaf': 0.10325753518147734, 'max_features': 0.47843156749667176}. Best is trial 163 with value: 0.7137418010284807.[0m
[32m[I 2022-04-13 11:46:08,055][0m Trial 727 finished with value: 0.6815535256784726 and parameters: {'splitter': 'best', 'min_samples_split': 0.3537641774993615, 'min_samples_leaf': 0.04729351293104127, 'min_weight_fraction_leaf': 0.1426711967028769, 'max_features': 0.595243048962021}. Best is trial 163 with value: 0.7137418010284807.[0m
[32m[I 2022-04-13 11:46:08,094][0m Trial 728 finished with value: 0.7137418010284807 and parameters: {'splitter': 'best', 'min_samples_split': 0.32232846355036854, 'min_samples_leaf': 0.01788374234034633, 'min_weight_fraction_leaf': 0.07901030487526475, 'max_features': 0.5280879721431841}. Best is trial 163 with value: 0.7137418010284807.[0m
[32m[I 2022-04-13 11:46:08,132][0m Trial 729 finished with value: 0.7137418010284807 and parameters: {'splitter': 'best', 'min_samples_split': 0.3213022974817819, 'min_samples_leaf': 0.013455144877243452, 'min_weight_fraction_leaf': 0.0822094216625465, 'max_features': 0.5000467347253271}. Best is trial 163 with value: 0.7137418010284807.[0m
[32m[I 2022-04-13 11:46:08,191][0m Trial 730 finished with value: 0.6989673695016856 and parameters: {'splitter': 'best', 'min_samples_split': 0.33901025583489136, 'min_samples_leaf': 0.04687889079770424, 'min_weight_fraction_leaf': 0.11920029816755054, 'max_features': 0.5810537013367449}. Best is trial 163 with value: 0.7137418010284807.[0m
[32m[I 2022-04-13 11:46:08,262][0m Trial 731 finished with value: 0.4113731167222882 and parameters: {'splitter': 'best', 'min_samples_split': 0.32996387142794587, 'min_samples_leaf': 0.4678996991511294, 'min_weight_fraction_leaf': 0.07582995703211567, 'max_features': 0.5568307724458259}. Best is trial 163 with value: 0.7137418010284807.[0m
[32m[I 2022-04-13 11:46:08,342][0m Trial 732 finished with value: 0.6199327926179983 and parameters: {'splitter': 'best', 'min_samples_split': 0.29685268024576816, 'min_samples_leaf': 0.04019862237512512, 'min_weight_fraction_leaf': 0.40052785760794474, 'max_features': 0.6098706946864232}. Best is trial 163 with value: 0.7137418010284807.[0m
[32m[I 2022-04-13 11:46:08,457][0m Trial 733 finished with value: 0.6481259063667688 and parameters: {'splitter': 'best', 'min_samples_split': 0.3066067596479504, 'min_samples_leaf': 0.002921921519419261, 'min_weight_fraction_leaf': 0.08682866113467885, 'max_features': 0.4887857336996364}. Best is trial 163 with value: 0.7137418010284807.[0m
[32m[I 2022-04-13 11:46:08,616][0m Trial 734 finished with value: 0.6815535256784726 and parameters: {'splitter': 'best', 'min_samples_split': 0.33773363331042583, 'min_samples_leaf': 0.07061202533116645, 'min_weight_fraction_leaf': 0.13389637723649245, 'max_features': 0.577560002375977}. Best is trial 163 with value: 0.7137418010284807.[0m
[32m[I 2022-04-13 11:46:08,772][0m Trial 735 finished with value: 0.7044783206942828 and parameters: {'splitter': 'best', 'min_samples_split': 0.3131935764960163, 'min_samples_leaf': 0.012189679356776222, 'min_weight_fraction_leaf': 0.11123226484432275, 'max_features': 0.552499281401442}. Best is trial 163 with value: 0.7137418010284807.[0m
[32m[I 2022-04-13 11:46:08,865][0m Trial 736 finished with value: 0.6989673695016856 and parameters: {'splitter': 'best', 'min_samples_split': 0.3469528629491435, 'min_samples_leaf': 0.06328824806088254, 'min_weight_fraction_leaf': 0.05509978738264759, 'max_features': 0.5825985049262601}. Best is trial 163 with value: 0.7137418010284807.[0m
[32m[I 2022-04-13 11:46:08,923][0m Trial 737 finished with value: 0.7044783206942828 and parameters: {'splitter': 'best', 'min_samples_split': 0.31330919953484154, 'min_samples_leaf': 0.027479447500500912, 'min_weight_fraction_leaf': 0.11637365306988638, 'max_features': 0.5554362901704873}. Best is trial 163 with value: 0.7137418010284807.[0m
[32m[I 2022-04-13 11:46:08,974][0m Trial 738 finished with value: 0.573562376193501 and parameters: {'splitter': 'random', 'min_samples_split': 0.3180048064633674, 'min_samples_leaf': 0.012558602294479271, 'min_weight_fraction_leaf': 0.07085697126178671, 'max_features': 0.44119184207531187}. Best is trial 163 with value: 0.7137418010284807.[0m
[32m[I 2022-04-13 11:46:09,030][0m Trial 739 finished with value: 0.6989673695016856 and parameters: {'splitter': 'best', 'min_samples_split': 0.33270996112183937, 'min_samples_leaf': 0.03818840063963164, 'min_weight_fraction_leaf': 0.06027174846858539, 'max_features': 0.5027280499084489}. Best is trial 163 with value: 0.7137418010284807.[0m
[32m[I 2022-04-13 11:46:09,116][0m Trial 740 finished with value: 0.7137418010284807 and parameters: {'splitter': 'best', 'min_samples_split': 0.3265680468544598, 'min_samples_leaf': 0.056601388701973475, 'min_weight_fraction_leaf': 0.09638317722674068, 'max_features': 0.5688274847135686}. Best is trial 163 with value: 0.7137418010284807.[0m
[32m[I 2022-04-13 11:46:09,208][0m Trial 741 finished with value: 0.6989673695016856 and parameters: {'splitter': 'best', 'min_samples_split': 0.35749685884889143, 'min_samples_leaf': 0.036923259001137784, 'min_weight_fraction_leaf': 0.13056560312789917, 'max_features': 0.5663138195274537}. Best is trial 163 with value: 0.7137418010284807.[0m
[32m[I 2022-04-13 11:46:09,315][0m Trial 742 finished with value: 0.7044783206942828 and parameters: {'splitter': 'best', 'min_samples_split': 0.30626803245131967, 'min_samples_leaf': 0.04963026160048374, 'min_weight_fraction_leaf': 0.10551975431699917, 'max_features': 0.5692965849323862}. Best is trial 163 with value: 0.7137418010284807.[0m
[32m[I 2022-04-13 11:46:09,411][0m Trial 743 finished with value: 0.6920012331415456 and parameters: {'splitter': 'best', 'min_samples_split': 0.29102839351245235, 'min_samples_leaf': 0.009084564260830685, 'min_weight_fraction_leaf': 0.0969110808968953, 'max_features': 0.5443244963590342}. Best is trial 163 with value: 0.7137418010284807.[0m
[32m[I 2022-04-13 11:46:09,518][0m Trial 744 finished with value: 0.6920012331415456 and parameters: {'splitter': 'best', 'min_samples_split': 0.29628569859263737, 'min_samples_leaf': 0.0023609886403141737, 'min_weight_fraction_leaf': 0.09864214420194481, 'max_features': 0.5214734650812163}. Best is trial 163 with value: 0.7137418010284807.[0m
[32m[I 2022-04-13 11:46:09,620][0m Trial 745 finished with value: 0.7030519614506526 and parameters: {'splitter': 'best', 'min_samples_split': 0.30430544551999056, 'min_samples_leaf': 0.007542434393598793, 'min_weight_fraction_leaf': 0.10264772782931043, 'max_features': 0.5130267068233529}. Best is trial 163 with value: 0.7137418010284807.[0m
[32m[I 2022-04-13 11:46:09,790][0m Trial 746 finished with value: 0.622948967900739 and parameters: {'splitter': 'best', 'min_samples_split': 0.3423861628309675, 'min_samples_leaf': 0.24888376660866185, 'min_weight_fraction_leaf': 0.05685490709884533, 'max_features': 0.45943291420339955}. Best is trial 163 with value: 0.7137418010284807.[0m
[32m[I 2022-04-13 11:46:10,024][0m Trial 747 finished with value: 0.631953446187902 and parameters: {'splitter': 'best', 'min_samples_split': 0.33459680588614316, 'min_samples_leaf': 0.02711388507466595, 'min_weight_fraction_leaf': 0.07619157302689475, 'max_features': 0.4863052306747284}. Best is trial 163 with value: 0.7137418010284807.[0m
[32m[I 2022-04-13 11:46:10,279][0m Trial 748 finished with value: 0.7030519614506526 and parameters: {'splitter': 'best', 'min_samples_split': 0.31503292954332446, 'min_samples_leaf': 0.0019179086359485246, 'min_weight_fraction_leaf': 0.07103418068577766, 'max_features': 0.611368014179233}. Best is trial 163 with value: 0.7137418010284807.[0m
[32m[I 2022-04-13 11:46:10,542][0m Trial 749 finished with value: 0.7030519614506526 and parameters: {'splitter': 'best', 'min_samples_split': 0.30683422055061393, 'min_samples_leaf': 0.001121466024519557, 'min_weight_fraction_leaf': 0.09882791148681076, 'max_features': 0.5426050449167797}. Best is trial 163 with value: 0.7137418010284807.[0m
[32m[I 2022-04-13 11:46:10,705][0m Trial 750 finished with value: 0.7137418010284807 and parameters: {'splitter': 'best', 'min_samples_split': 0.32731571362537804, 'min_samples_leaf': 0.02840519319127665, 'min_weight_fraction_leaf': 0.062108496474196945, 'max_features': 0.5990219782586993}. Best is trial 163 with value: 0.7137418010284807.[0m
[32m[I 2022-04-13 11:46:10,839][0m Trial 751 finished with value: 0.6865730374003304 and parameters: {'splitter': 'best', 'min_samples_split': 0.28619935676556507, 'min_samples_leaf': 0.1004755976320387, 'min_weight_fraction_leaf': 0.11089138625024583, 'max_features': 0.5096817839952017}. Best is trial 163 with value: 0.7137418010284807.[0m
[32m[I 2022-04-13 11:46:10,929][0m Trial 752 finished with value: 0.6481259063667688 and parameters: {'splitter': 'best', 'min_samples_split': 0.3140812790117796, 'min_samples_leaf': 0.001039832587297602, 'min_weight_fraction_leaf': 0.08650036547106343, 'max_features': 0.48456184047205775}. Best is trial 163 with value: 0.7137418010284807.[0m
[32m[I 2022-04-13 11:46:11,080][0m Trial 753 finished with value: 0.7137418010284807 and parameters: {'splitter': 'best', 'min_samples_split': 0.3281384065190294, 'min_samples_leaf': 0.039362978740190256, 'min_weight_fraction_leaf': 0.06535125118744496, 'max_features': 0.5843134629186898}. Best is trial 163 with value: 0.7137418010284807.[0m
[32m[I 2022-04-13 11:46:11,247][0m Trial 754 finished with value: 0.6955563537988494 and parameters: {'splitter': 'best', 'min_samples_split': 0.3500422486824994, 'min_samples_leaf': 0.048690649815432564, 'min_weight_fraction_leaf': 0.03713189537374475, 'max_features': 0.6369307442861423}. Best is trial 163 with value: 0.7137418010284807.[0m
[32m[I 2022-04-13 11:46:11,369][0m Trial 755 finished with value: 0.6989673695016856 and parameters: {'splitter': 'best', 'min_samples_split': 0.3436629819515527, 'min_samples_leaf': 0.04606769549742755, 'min_weight_fraction_leaf': 0.1248784127212068, 'max_features': 0.5941258768417167}. Best is trial 163 with value: 0.7137418010284807.[0m
[32m[I 2022-04-13 11:46:11,567][0m Trial 756 finished with value: 0.7137418010284807 and parameters: {'splitter': 'best', 'min_samples_split': 0.326118263393281, 'min_samples_leaf': 0.024352719694879246, 'min_weight_fraction_leaf': 0.1120690083738787, 'max_features': 0.5617986666963125}. Best is trial 163 with value: 0.7137418010284807.[0m
[32m[I 2022-04-13 11:46:11,612][0m Trial 757 finished with value: 0.6705763419171312 and parameters: {'splitter': 'best', 'min_samples_split': 0.33696322303364745, 'min_samples_leaf': 0.03881156017763595, 'min_weight_fraction_leaf': 0.022681613041012856, 'max_features': 0.60915198433148}. Best is trial 163 with value: 0.7137418010284807.[0m
[32m[I 2022-04-13 11:46:11,731][0m Trial 758 finished with value: 0.709098309953227 and parameters: {'splitter': 'random', 'min_samples_split': 0.3171138377340015, 'min_samples_leaf': 0.016732485248949974, 'min_weight_fraction_leaf': 0.07898795197591953, 'max_features': 0.5284311875245076}. Best is trial 163 with value: 0.7137418010284807.[0m
[32m[I 2022-04-13 11:46:11,799][0m Trial 759 finished with value: 0.6989673695016856 and parameters: {'splitter': 'best', 'min_samples_split': 0.33115258070255593, 'min_samples_leaf': 0.043053197100170415, 'min_weight_fraction_leaf': 0.058118942251482876, 'max_features': 0.583938652246034}. Best is trial 163 with value: 0.7137418010284807.[0m
[32m[I 2022-04-13 11:46:11,930][0m Trial 760 finished with value: 0.7137418010284807 and parameters: {'splitter': 'best', 'min_samples_split': 0.3176031780519063, 'min_samples_leaf': 0.011000528924029102, 'min_weight_fraction_leaf': 0.10668595882587978, 'max_features': 0.5525959810542936}. Best is trial 163 with value: 0.7137418010284807.[0m
[32m[I 2022-04-13 11:46:12,035][0m Trial 761 finished with value: 0.7137418010284807 and parameters: {'splitter': 'best', 'min_samples_split': 0.31840539124006856, 'min_samples_leaf': 0.019410155908955437, 'min_weight_fraction_leaf': 0.08541231714422345, 'max_features': 0.5320920649560612}. Best is trial 163 with value: 0.7137418010284807.[0m
[32m[I 2022-04-13 11:46:12,174][0m Trial 762 finished with value: 0.695563433079365 and parameters: {'splitter': 'best', 'min_samples_split': 0.29525104168656263, 'min_samples_leaf': 0.013139297194726526, 'min_weight_fraction_leaf': 0.08706063848910807, 'max_features': 0.5328486728422357}. Best is trial 163 with value: 0.7137418010284807.[0m
