[32m[I 2022-04-13 11:45:28,741][0m Trial 259 finished with value: 0.6989673695016856 and parameters: {'splitter': 'best', 'min_samples_split': 0.33413600711898606, 'min_samples_leaf': 0.024085215928051577, 'min_weight_fraction_leaf': 0.12702920509767834, 'max_features': 0.5182100113278666}. Best is trial 163 with value: 0.7137418010284807.[0m
[32m[I 2022-04-13 11:45:28,807][0m Trial 260 finished with value: 0.7029215914224277 and parameters: {'splitter': 'best', 'min_samples_split': 0.012705429601786005, 'min_samples_leaf': 0.09705702139111988, 'min_weight_fraction_leaf': 0.11523660194796663, 'max_features': 0.5025431852583125}. Best is trial 163 with value: 0.7137418010284807.[0m
[32m[I 2022-04-13 11:45:28,871][0m Trial 261 finished with value: 0.6815535256784726 and parameters: {'splitter': 'best', 'min_samples_split': 0.35950438712321076, 'min_samples_leaf': 0.0511420073343858, 'min_weight_fraction_leaf': 0.1387956666201953, 'max_features': 0.6200157906338559}. Best is trial 163 with value: 0.7137418010284807.[0m
[32m[I 2022-04-13 11:45:28,914][0m Trial 262 finished with value: 0.7044783206942828 and parameters: {'splitter': 'best', 'min_samples_split': 0.3097875090608864, 'min_samples_leaf': 0.015489607440303673, 'min_weight_fraction_leaf': 0.13139722598632997, 'max_features': 0.5295766578398079}. Best is trial 163 with value: 0.7137418010284807.[0m
[32m[I 2022-04-13 11:45:28,944][0m Trial 263 finished with value: 0.6809325111928844 and parameters: {'splitter': 'best', 'min_samples_split': 0.12129810069505127, 'min_samples_leaf': 0.06825331558372832, 'min_weight_fraction_leaf': 0.1735448754473829, 'max_features': 0.566260213301919}. Best is trial 163 with value: 0.7137418010284807.[0m
[32m[I 2022-04-13 11:45:29,004][0m Trial 264 finished with value: 0.6832725645429367 and parameters: {'splitter': 'best', 'min_samples_split': 0.025401126989582253, 'min_samples_leaf': 0.02758725720178957, 'min_weight_fraction_leaf': 0.15112021641440315, 'max_features': 0.5812803157717054}. Best is trial 163 with value: 0.7137418010284807.[0m
[32m[I 2022-04-13 11:45:29,057][0m Trial 265 finished with value: 0.7131405564108027 and parameters: {'splitter': 'best', 'min_samples_split': 0.11396998086096206, 'min_samples_leaf': 0.02904685457527445, 'min_weight_fraction_leaf': 0.14152332807857798, 'max_features': 0.5770677037253803}. Best is trial 163 with value: 0.7137418010284807.[0m
[32m[I 2022-04-13 11:45:29,091][0m Trial 266 finished with value: 0.43238661979902976 and parameters: {'splitter': 'best', 'min_samples_split': 0.047477659870196025, 'min_samples_leaf': 0.371859704382606, 'min_weight_fraction_leaf': 0.49333916522670174, 'max_features': 0.6528092824625477}. Best is trial 163 with value: 0.7137418010284807.[0m
[32m[I 2022-04-13 11:45:29,128][0m Trial 267 finished with value: 0.7137418010284807 and parameters: {'splitter': 'best', 'min_samples_split': 0.3165151845538398, 'min_samples_leaf': 0.04292443775411253, 'min_weight_fraction_leaf': 0.12085199314167558, 'max_features': 0.5495844859251021}. Best is trial 163 with value: 0.7137418010284807.[0m
[32m[I 2022-04-13 11:45:29,192][0m Trial 268 finished with value: 0.7137418010284807 and parameters: {'splitter': 'best', 'min_samples_split': 0.3236355018300307, 'min_samples_leaf': 0.01861585440456949, 'min_weight_fraction_leaf': 0.11082433159745667, 'max_features': 0.5536205084418764}. Best is trial 163 with value: 0.7137418010284807.[0m
[32m[I 2022-04-13 11:45:29,234][0m Trial 269 finished with value: 0.7137418010284807 and parameters: {'splitter': 'best', 'min_samples_split': 0.3265768476311622, 'min_samples_leaf': 0.036052211385504095, 'min_weight_fraction_leaf': 0.10730770085293197, 'max_features': 0.5876817422457123}. Best is trial 163 with value: 0.7137418010284807.[0m
[32m[I 2022-04-13 11:45:29,271][0m Trial 270 finished with value: 0.7044783206942828 and parameters: {'splitter': 'best', 'min_samples_split': 0.31417980837908394, 'min_samples_leaf': 0.03875505794403566, 'min_weight_fraction_leaf': 0.11566915559003155, 'max_features': 0.595262476311181}. Best is trial 163 with value: 0.7137418010284807.[0m
[32m[I 2022-04-13 11:45:29,327][0m Trial 271 finished with value: 0.7137418010284807 and parameters: {'splitter': 'best', 'min_samples_split': 0.3209562549340335, 'min_samples_leaf': 0.0522688682004252, 'min_weight_fraction_leaf': 0.10822632821214098, 'max_features': 0.5556289421353036}. Best is trial 163 with value: 0.7137418010284807.[0m
[32m[I 2022-04-13 11:45:29,380][0m Trial 272 finished with value: 0.6989673695016856 and parameters: {'splitter': 'best', 'min_samples_split': 0.3402291791625662, 'min_samples_leaf': 0.022124153020954797, 'min_weight_fraction_leaf': 0.10309793985977522, 'max_features': 0.5434742388213758}. Best is trial 163 with value: 0.7137418010284807.[0m
[32m[I 2022-04-13 11:45:29,426][0m Trial 273 finished with value: 0.7137418010284807 and parameters: {'splitter': 'best', 'min_samples_split': 0.3224707495815854, 'min_samples_leaf': 0.037969641690695374, 'min_weight_fraction_leaf': 0.1029995121266021, 'max_features': 0.5714672635714745}. Best is trial 163 with value: 0.7137418010284807.[0m
[32m[I 2022-04-13 11:45:29,484][0m Trial 274 finished with value: 0.7137418010284807 and parameters: {'splitter': 'best', 'min_samples_split': 0.32747449499972336, 'min_samples_leaf': 0.0023648689325782065, 'min_weight_fraction_leaf': 0.10700574967366723, 'max_features': 0.5215797462197851}. Best is trial 163 with value: 0.7137418010284807.[0m
[32m[I 2022-04-13 11:45:29,530][0m Trial 275 finished with value: 0.7137418010284807 and parameters: {'splitter': 'best', 'min_samples_split': 0.32465863218090124, 'min_samples_leaf': 0.005864929994291733, 'min_weight_fraction_leaf': 0.10402321676734277, 'max_features': 0.5211352470504574}. Best is trial 163 with value: 0.7137418010284807.[0m
[32m[I 2022-04-13 11:45:29,573][0m Trial 276 finished with value: 0.6440317768217898 and parameters: {'splitter': 'best', 'min_samples_split': 0.32838852426737514, 'min_samples_leaf': 0.010781607078141322, 'min_weight_fraction_leaf': 0.10252853836075332, 'max_features': 0.48580665500609876}. Best is trial 163 with value: 0.7137418010284807.[0m
[32m[I 2022-04-13 11:45:29,632][0m Trial 277 finished with value: 0.7137418010284807 and parameters: {'splitter': 'best', 'min_samples_split': 0.3196029549020568, 'min_samples_leaf': 0.0031844632655314113, 'min_weight_fraction_leaf': 0.10631160436613393, 'max_features': 0.5153470749140451}. Best is trial 163 with value: 0.7137418010284807.[0m
[32m[I 2022-04-13 11:45:29,685][0m Trial 278 finished with value: 0.7137418010284807 and parameters: {'splitter': 'best', 'min_samples_split': 0.3163227541188613, 'min_samples_leaf': 0.0038198944265303916, 'min_weight_fraction_leaf': 0.10502702141253814, 'max_features': 0.5154762421649918}. Best is trial 163 with value: 0.7137418010284807.[0m
[32m[I 2022-04-13 11:45:29,748][0m Trial 279 finished with value: 0.7137418010284807 and parameters: {'splitter': 'best', 'min_samples_split': 0.3193014896919181, 'min_samples_leaf': 0.004443445376200665, 'min_weight_fraction_leaf': 0.10865260661816886, 'max_features': 0.5517614004388975}. Best is trial 163 with value: 0.7137418010284807.[0m
[32m[I 2022-04-13 11:45:29,824][0m Trial 280 finished with value: 0.7137418010284807 and parameters: {'splitter': 'best', 'min_samples_split': 0.31756092864847635, 'min_samples_leaf': 0.0040448618803914345, 'min_weight_fraction_leaf': 0.10581510563752844, 'max_features': 0.5526467052195085}. Best is trial 163 with value: 0.7137418010284807.[0m
[32m[I 2022-04-13 11:45:29,908][0m Trial 281 finished with value: 0.6920012331415456 and parameters: {'splitter': 'best', 'min_samples_split': 0.29280242954291136, 'min_samples_leaf': 0.001158333322391798, 'min_weight_fraction_leaf': 0.1075004138599341, 'max_features': 0.5288143932500843}. Best is trial 163 with value: 0.7137418010284807.[0m
[32m[I 2022-04-13 11:45:29,996][0m Trial 282 finished with value: 0.7137418010284807 and parameters: {'splitter': 'best', 'min_samples_split': 0.3171365564471846, 'min_samples_leaf': 0.0014268823161504365, 'min_weight_fraction_leaf': 0.10484449995607792, 'max_features': 0.5426225593915828}. Best is trial 163 with value: 0.7137418010284807.[0m
[32m[I 2022-04-13 11:45:30,100][0m Trial 283 finished with value: 0.7137418010284807 and parameters: {'splitter': 'best', 'min_samples_split': 0.3218543906491972, 'min_samples_leaf': 0.0020877389770974095, 'min_weight_fraction_leaf': 0.10316946773850393, 'max_features': 0.5574966039335691}. Best is trial 163 with value: 0.7137418010284807.[0m
[32m[I 2022-04-13 11:45:30,160][0m Trial 284 finished with value: 0.7137418010284807 and parameters: {'splitter': 'best', 'min_samples_split': 0.3178867040720375, 'min_samples_leaf': 0.004184172036104075, 'min_weight_fraction_leaf': 0.10494448188003427, 'max_features': 0.522609771036423}. Best is trial 163 with value: 0.7137418010284807.[0m
[32m[I 2022-04-13 11:45:30,243][0m Trial 285 finished with value: 0.7137418010284807 and parameters: {'splitter': 'best', 'min_samples_split': 0.32279931064743916, 'min_samples_leaf': 0.004951701899520334, 'min_weight_fraction_leaf': 0.10410947486555709, 'max_features': 0.5559925588515263}. Best is trial 163 with value: 0.7137418010284807.[0m
[32m[I 2022-04-13 11:45:30,334][0m Trial 286 finished with value: 0.7137418010284807 and parameters: {'splitter': 'best', 'min_samples_split': 0.32105325717080224, 'min_samples_leaf': 0.0026284359714517165, 'min_weight_fraction_leaf': 0.08624397414300801, 'max_features': 0.5556427894579774}. Best is trial 163 with value: 0.7137418010284807.[0m
[32m[I 2022-04-13 11:45:30,414][0m Trial 287 finished with value: 0.7137418010284807 and parameters: {'splitter': 'best', 'min_samples_split': 0.31963831362069695, 'min_samples_leaf': 0.001174240544895266, 'min_weight_fraction_leaf': 0.08547364694480776, 'max_features': 0.5145714291315636}. Best is trial 163 with value: 0.7137418010284807.[0m
[32m[I 2022-04-13 11:45:30,529][0m Trial 288 finished with value: 0.7137418010284807 and parameters: {'splitter': 'best', 'min_samples_split': 0.3179580097657423, 'min_samples_leaf': 0.0025913515290776, 'min_weight_fraction_leaf': 0.10548351315828805, 'max_features': 0.5239868940788314}. Best is trial 163 with value: 0.7137418010284807.[0m
[32m[I 2022-04-13 11:45:30,603][0m Trial 289 finished with value: 0.7137418010284807 and parameters: {'splitter': 'best', 'min_samples_split': 0.3174226526381505, 'min_samples_leaf': 0.00416613328683477, 'min_weight_fraction_leaf': 0.08620198019883854, 'max_features': 0.5095180724977751}. Best is trial 163 with value: 0.7137418010284807.[0m
[32m[I 2022-04-13 11:45:30,712][0m Trial 290 finished with value: 0.6513176944526099 and parameters: {'splitter': 'best', 'min_samples_split': 0.3189368548065962, 'min_samples_leaf': 0.005398580288209914, 'min_weight_fraction_leaf': 0.08243787582130559, 'max_features': 0.4984571226331928}. Best is trial 163 with value: 0.7137418010284807.[0m
[32m[I 2022-04-13 11:45:30,809][0m Trial 291 finished with value: 0.6511000764864828 and parameters: {'splitter': 'best', 'min_samples_split': 0.2951186346626716, 'min_samples_leaf': 0.005529673807606551, 'min_weight_fraction_leaf': 0.08492006220037611, 'max_features': 0.48490409577843807}. Best is trial 163 with value: 0.7137418010284807.[0m
[32m[I 2022-04-13 11:45:30,872][0m Trial 292 finished with value: 0.7137418010284807 and parameters: {'splitter': 'best', 'min_samples_split': 0.3235113768472464, 'min_samples_leaf': 0.0024877727053595235, 'min_weight_fraction_leaf': 0.10381525657668528, 'max_features': 0.5145297254298227}. Best is trial 163 with value: 0.7137418010284807.[0m
[32m[I 2022-04-13 11:45:30,969][0m Trial 293 finished with value: 0.7137418010284807 and parameters: {'splitter': 'best', 'min_samples_split': 0.3203509288829258, 'min_samples_leaf': 0.001518525880435528, 'min_weight_fraction_leaf': 0.10290112232529998, 'max_features': 0.5222870075749023}. Best is trial 163 with value: 0.7137418010284807.[0m
[32m[I 2022-04-13 11:45:31,093][0m Trial 294 finished with value: 0.7137418010284807 and parameters: {'splitter': 'best', 'min_samples_split': 0.32303894389543625, 'min_samples_leaf': 0.002769318956484037, 'min_weight_fraction_leaf': 0.1046942955267583, 'max_features': 0.5150782761737145}. Best is trial 163 with value: 0.7137418010284807.[0m
[32m[I 2022-04-13 11:45:31,175][0m Trial 295 finished with value: 0.5382664128304093 and parameters: {'splitter': 'random', 'min_samples_split': 0.32080298369742544, 'min_samples_leaf': 0.0011203852915844595, 'min_weight_fraction_leaf': 0.09961754998916113, 'max_features': 0.4686930006773637}. Best is trial 163 with value: 0.7137418010284807.[0m
[32m[I 2022-04-13 11:45:31,233][0m Trial 296 finished with value: 0.7137418010284807 and parameters: {'splitter': 'best', 'min_samples_split': 0.3224809258148063, 'min_samples_leaf': 0.001749589043279026, 'min_weight_fraction_leaf': 0.08868556626597908, 'max_features': 0.5138917297899077}. Best is trial 163 with value: 0.7137418010284807.[0m
[32m[I 2022-04-13 11:45:31,291][0m Trial 297 finished with value: 0.7137418010284807 and parameters: {'splitter': 'best', 'min_samples_split': 0.3237667232725307, 'min_samples_leaf': 0.002850995159560713, 'min_weight_fraction_leaf': 0.08655906484898787, 'max_features': 0.5155176885038268}. Best is trial 163 with value: 0.7137418010284807.[0m
[32m[I 2022-04-13 11:45:31,353][0m Trial 298 finished with value: 0.6989673695016856 and parameters: {'splitter': 'best', 'min_samples_split': 0.34067515329516934, 'min_samples_leaf': 0.0012965422677779915, 'min_weight_fraction_leaf': 0.0761306372610322, 'max_features': 0.5064747848391786}. Best is trial 163 with value: 0.7137418010284807.[0m
[32m[I 2022-04-13 11:45:31,418][0m Trial 299 finished with value: 0.7030519614506526 and parameters: {'splitter': 'best', 'min_samples_split': 0.3131941755659998, 'min_samples_leaf': 0.0013020268341835885, 'min_weight_fraction_leaf': 0.08774711137817486, 'max_features': 0.5214986392948657}. Best is trial 163 with value: 0.7137418010284807.[0m
[32m[I 2022-04-13 11:45:31,475][0m Trial 300 finished with value: 0.6440317768217898 and parameters: {'splitter': 'best', 'min_samples_split': 0.32769967772166975, 'min_samples_leaf': 0.0017212515666229521, 'min_weight_fraction_leaf': 0.10351514802303302, 'max_features': 0.4806010211460538}. Best is trial 163 with value: 0.7137418010284807.[0m
[32m[I 2022-04-13 11:45:31,534][0m Trial 301 finished with value: 0.6436563808635396 and parameters: {'splitter': 'best', 'min_samples_split': 0.3542340419838727, 'min_samples_leaf': 0.010543904185753598, 'min_weight_fraction_leaf': 0.08804807313556608, 'max_features': 0.4969046494401544}. Best is trial 163 with value: 0.7137418010284807.[0m
[32m[I 2022-04-13 11:45:31,603][0m Trial 302 finished with value: 0.7137418010284807 and parameters: {'splitter': 'best', 'min_samples_split': 0.3172938589190872, 'min_samples_leaf': 0.001352840931549538, 'min_weight_fraction_leaf': 0.10225219307801735, 'max_features': 0.5174380570273577}. Best is trial 163 with value: 0.7137418010284807.[0m
[32m[I 2022-04-13 11:45:31,748][0m Trial 303 finished with value: 0.6940367759631566 and parameters: {'splitter': 'best', 'min_samples_split': 0.3015461234647634, 'min_samples_leaf': 0.011936187086773364, 'min_weight_fraction_leaf': 0.07298942768107636, 'max_features': 0.5004462215265417}. Best is trial 163 with value: 0.7137418010284807.[0m
[32m[I 2022-04-13 11:45:31,882][0m Trial 304 finished with value: 0.6989673695016856 and parameters: {'splitter': 'best', 'min_samples_split': 0.33232730826764, 'min_samples_leaf': 0.010390243830856558, 'min_weight_fraction_leaf': 0.09862774394255615, 'max_features': 0.5139414022487615}. Best is trial 163 with value: 0.7137418010284807.[0m
[32m[I 2022-04-13 11:45:31,972][0m Trial 305 finished with value: 0.7137418010284807 and parameters: {'splitter': 'best', 'min_samples_split': 0.32469563491105813, 'min_samples_leaf': 0.0016487199085742452, 'min_weight_fraction_leaf': 0.10633298823063594, 'max_features': 0.5283801558826655}. Best is trial 163 with value: 0.7137418010284807.[0m
[32m[I 2022-04-13 11:45:32,028][0m Trial 306 finished with value: 0.6989673695016856 and parameters: {'splitter': 'best', 'min_samples_split': 0.34509221150120656, 'min_samples_leaf': 0.01287648304252665, 'min_weight_fraction_leaf': 0.08934072591293696, 'max_features': 0.5332318924713211}. Best is trial 163 with value: 0.7137418010284807.[0m
[32m[I 2022-04-13 11:45:32,077][0m Trial 307 finished with value: 0.6481259063667688 and parameters: {'splitter': 'best', 'min_samples_split': 0.31055982252239234, 'min_samples_leaf': 0.002880809232783799, 'min_weight_fraction_leaf': 0.07965621792863901, 'max_features': 0.4800361601023107}. Best is trial 163 with value: 0.7137418010284807.[0m
[32m[I 2022-04-13 11:45:32,272][0m Trial 308 finished with value: 0.6989673695016856 and parameters: {'splitter': 'best', 'min_samples_split': 0.33094489092380786, 'min_samples_leaf': 0.0010356147787420299, 'min_weight_fraction_leaf': 0.10426643813076042, 'max_features': 0.5223433608077301}. Best is trial 163 with value: 0.7137418010284807.[0m
[32m[I 2022-04-13 11:45:32,336][0m Trial 309 finished with value: 0.7137418010284807 and parameters: {'splitter': 'best', 'min_samples_split': 0.320156897148523, 'min_samples_leaf': 0.01311137802291428, 'min_weight_fraction_leaf': 0.1086524596854314, 'max_features': 0.5326670402932199}. Best is trial 163 with value: 0.7137418010284807.[0m
[32m[I 2022-04-13 11:45:32,404][0m Trial 310 finished with value: 0.7030519614506526 and parameters: {'splitter': 'best', 'min_samples_split': 0.3156565152228708, 'min_samples_leaf': 0.013191127161199105, 'min_weight_fraction_leaf': 0.09477745724292802, 'max_features': 0.5411195243640254}. Best is trial 163 with value: 0.7137418010284807.[0m
[32m[I 2022-04-13 11:45:32,451][0m Trial 311 finished with value: 0.6920012331415456 and parameters: {'splitter': 'best', 'min_samples_split': 0.2988812104130446, 'min_samples_leaf': 0.013373384485969508, 'min_weight_fraction_leaf': 0.10783183290313818, 'max_features': 0.5413512719164035}. Best is trial 163 with value: 0.7137418010284807.[0m
[32m[I 2022-04-13 11:45:32,517][0m Trial 312 finished with value: 0.6989673695016856 and parameters: {'splitter': 'best', 'min_samples_split': 0.33430214164379596, 'min_samples_leaf': 0.015390675031515762, 'min_weight_fraction_leaf': 0.10960523023177925, 'max_features': 0.5295674130683932}. Best is trial 163 with value: 0.7137418010284807.[0m
[32m[I 2022-04-13 11:45:32,574][0m Trial 313 finished with value: 0.5852605027262672 and parameters: {'splitter': 'random', 'min_samples_split': 0.3176874751184766, 'min_samples_leaf': 0.0010540516784831064, 'min_weight_fraction_leaf': 0.0646077869396794, 'max_features': 0.4572794777348842}. Best is trial 163 with value: 0.7137418010284807.[0m
[32m[I 2022-04-13 11:45:32,644][0m Trial 314 finished with value: 0.7030519614506526 and parameters: {'splitter': 'best', 'min_samples_split': 0.31124855067505297, 'min_samples_leaf': 0.01298934819135823, 'min_weight_fraction_leaf': 0.08590773168810201, 'max_features': 0.5027491502544335}. Best is trial 163 with value: 0.7137418010284807.[0m
[32m[I 2022-04-13 11:45:32,708][0m Trial 315 finished with value: 0.6440317768217898 and parameters: {'splitter': 'best', 'min_samples_split': 0.3219394141447528, 'min_samples_leaf': 0.009929929571376658, 'min_weight_fraction_leaf': 0.09831298218573009, 'max_features': 0.48682699363051674}. Best is trial 163 with value: 0.7137418010284807.[0m
[32m[I 2022-04-13 11:45:32,770][0m Trial 316 finished with value: 0.6989673695016856 and parameters: {'splitter': 'best', 'min_samples_split': 0.34579043937099924, 'min_samples_leaf': 0.003076526341140147, 'min_weight_fraction_leaf': 0.07657733442938709, 'max_features': 0.5112993932990374}. Best is trial 163 with value: 0.7137418010284807.[0m
[32m[I 2022-04-13 11:45:32,831][0m Trial 317 finished with value: 0.684611897101941 and parameters: {'splitter': 'best', 'min_samples_split': 0.28153399549576363, 'min_samples_leaf': 0.016049989013112626, 'min_weight_fraction_leaf': 0.10296077174230382, 'max_features': 0.5292930608496452}. Best is trial 163 with value: 0.7137418010284807.[0m
[32m[I 2022-04-13 11:45:32,895][0m Trial 318 finished with value: 0.6513176944526099 and parameters: {'splitter': 'best', 'min_samples_split': 0.32807025987667215, 'min_samples_leaf': 0.011785308520680198, 'min_weight_fraction_leaf': 0.09114785117767067, 'max_features': 0.49459946646803804}. Best is trial 163 with value: 0.7137418010284807.[0m
[32m[I 2022-04-13 11:45:32,947][0m Trial 319 finished with value: 0.6436563808635396 and parameters: {'splitter': 'best', 'min_samples_split': 0.3610775397912215, 'min_samples_leaf': 0.009292144995999393, 'min_weight_fraction_leaf': 0.0901810298676527, 'max_features': 0.4721479668381137}. Best is trial 163 with value: 0.7137418010284807.[0m
[32m[I 2022-04-13 11:45:33,017][0m Trial 320 finished with value: 0.695563433079365 and parameters: {'splitter': 'best', 'min_samples_split': 0.30098382434523735, 'min_samples_leaf': 0.004136119933963522, 'min_weight_fraction_leaf': 0.08139788378744481, 'max_features': 0.5105821197601724}. Best is trial 163 with value: 0.7137418010284807.[0m
[32m[I 2022-04-13 11:45:33,082][0m Trial 321 finished with value: 0.6989673695016856 and parameters: {'splitter': 'best', 'min_samples_split': 0.3362700373745578, 'min_samples_leaf': 0.016065051141240197, 'min_weight_fraction_leaf': 0.1098393270666263, 'max_features': 0.5142416364064736}. Best is trial 163 with value: 0.7137418010284807.[0m
