[32m[I 2022-04-19 08:16:47,601][0m Trial 308 finished with value: 0.6775555174046027 and parameters: {'n_hidden': 2048, 'mixture_components': 1, 'use_sparse_layer': True, 'use_sparse_loss': True, 'lmbd': 0.00073745281919955, 'use_batchnorm': False, 'use_dropout': True, 'dropout': 0.2862221714274804, 'mlp_size_1': 7, 'mlp_size_2': 0, 'mlp_size_3': 0, 'kernel': 'Exponential', 'loss_name': 'NLLLoss'}. Best is trial 237 with value: 0.7341952549033148.[0m
[32m[I 2022-04-19 08:18:21,104][0m Trial 309 finished with value: 0.6831274209067677 and parameters: {'n_hidden': 2048, 'mixture_components': 1, 'use_sparse_layer': True, 'use_sparse_loss': True, 'lmbd': 0.0002943185810258067, 'use_batchnorm': False, 'use_dropout': True, 'dropout': 0.2088431030900577, 'mlp_size_1': 7, 'mlp_size_2': 0, 'mlp_size_3': 0, 'kernel': 'Exponential', 'loss_name': 'NLLLoss'}. Best is trial 237 with value: 0.7341952549033148.[0m
[32m[I 2022-04-19 08:19:55,038][0m Trial 310 finished with value: 0.7079196720658583 and parameters: {'n_hidden': 2048, 'mixture_components': 1, 'use_sparse_layer': True, 'use_sparse_loss': True, 'lmbd': 0.00040929192817087734, 'use_batchnorm': False, 'use_dropout': True, 'dropout': 0.3136146589186523, 'mlp_size_1': 7, 'mlp_size_2': 0, 'mlp_size_3': 0, 'kernel': 'Exponential', 'loss_name': 'NLLLoss'}. Best is trial 237 with value: 0.7341952549033148.[0m
[32m[I 2022-04-19 08:21:49,783][0m Trial 311 finished with value: 0.7245743076891334 and parameters: {'n_hidden': 512, 'mixture_components': 1, 'use_sparse_layer': True, 'use_sparse_loss': True, 'lmbd': 0.00014490670658239978, 'use_batchnorm': False, 'use_dropout': True, 'dropout': 0.3488933911328237, 'mlp_size_1': 6, 'mlp_size_2': 0, 'mlp_size_3': 0, 'kernel': 'Exponential', 'loss_name': 'NLLLoss'}. Best is trial 237 with value: 0.7341952549033148.[0m
[32m[I 2022-04-19 08:23:05,793][0m Trial 312 finished with value: 0.649763522998345 and parameters: {'n_hidden': 512, 'mixture_components': 1, 'use_sparse_layer': True, 'use_sparse_loss': False, 'use_batchnorm': False, 'use_dropout': True, 'dropout': 0.33838206229137147, 'mlp_size_1': 6, 'mlp_size_2': 0, 'mlp_size_3': 0, 'kernel': 'Exponential', 'loss_name': 'NLLLoss'}. Best is trial 237 with value: 0.7341952549033148.[0m
[32m[I 2022-04-19 08:24:20,441][0m Trial 313 finished with value: 0.6970844886441571 and parameters: {'n_hidden': 512, 'mixture_components': 1, 'use_sparse_layer': True, 'use_sparse_loss': True, 'lmbd': 0.00012399512289815954, 'use_batchnorm': False, 'use_dropout': True, 'dropout': 0.3324703493314395, 'mlp_size_1': 6, 'mlp_size_2': 0, 'mlp_size_3': 0, 'kernel': 'Exponential', 'loss_name': 'NLLLoss'}. Best is trial 237 with value: 0.7341952549033148.[0m
[32m[I 2022-04-19 08:25:49,750][0m Trial 314 finished with value: 0.7029220143470374 and parameters: {'n_hidden': 512, 'mixture_components': 1, 'use_sparse_layer': True, 'use_sparse_loss': True, 'lmbd': 0.00031372916613433736, 'use_batchnorm': False, 'use_dropout': True, 'dropout': 0.35622254004285114, 'mlp_size_1': 6, 'mlp_size_2': 0, 'mlp_size_3': 0, 'kernel': 'Exponential', 'loss_name': 'NLLLoss'}. Best is trial 237 with value: 0.7341952549033148.[0m
[32m[I 2022-04-19 08:27:36,307][0m Trial 315 finished with value: 0.71946362639131 and parameters: {'n_hidden': 512, 'mixture_components': 1, 'use_sparse_layer': True, 'use_sparse_loss': True, 'lmbd': 0.0004664194442836698, 'use_batchnorm': False, 'use_dropout': True, 'dropout': 0.3126754011943083, 'mlp_size_1': 6, 'mlp_size_2': 0, 'mlp_size_3': 0, 'kernel': 'Exponential', 'loss_name': 'NLLLoss'}. Best is trial 237 with value: 0.7341952549033148.[0m
[32m[I 2022-04-19 08:29:13,810][0m Trial 316 finished with value: 0.6854862765207227 and parameters: {'n_hidden': 512, 'mixture_components': 1, 'use_sparse_layer': True, 'use_sparse_loss': True, 'lmbd': 0.0006339745031342534, 'use_batchnorm': False, 'use_dropout': True, 'dropout': 0.3132368818205991, 'mlp_size_1': 6, 'mlp_size_2': 0, 'mlp_size_3': 0, 'kernel': 'Exponential', 'loss_name': 'NLLLoss'}. Best is trial 237 with value: 0.7341952549033148.[0m
[32m[I 2022-04-19 08:30:48,539][0m Trial 317 finished with value: 0.6732068140348036 and parameters: {'n_hidden': 512, 'mixture_components': 1, 'use_sparse_layer': True, 'use_sparse_loss': True, 'lmbd': 0.00046296896081135573, 'use_batchnorm': False, 'use_dropout': True, 'dropout': 0.35518334957356323, 'mlp_size_1': 6, 'mlp_size_2': 0, 'mlp_size_3': 0, 'kernel': 'LogLogistic', 'loss_name': 'NLLLoss'}. Best is trial 237 with value: 0.7341952549033148.[0m
[32m[I 2022-04-19 08:32:11,833][0m Trial 318 finished with value: 0.6690569139136627 and parameters: {'n_hidden': 512, 'mixture_components': 1, 'use_sparse_layer': True, 'use_sparse_loss': False, 'use_batchnorm': False, 'use_dropout': True, 'dropout': 0.29186873370988053, 'mlp_size_1': 6, 'mlp_size_2': 0, 'mlp_size_3': 0, 'kernel': 'Exponential', 'loss_name': 'NLLLoss'}. Best is trial 237 with value: 0.7341952549033148.[0m
[32m[I 2022-04-19 08:36:32,649][0m Trial 319 finished with value: 0.6151269896809992 and parameters: {'n_hidden': 512, 'mixture_components': 1, 'use_sparse_layer': True, 'use_sparse_loss': True, 'lmbd': 0.0008742229881010979, 'use_batchnorm': True, 'use_dropout': True, 'dropout': 0.32573852497668043, 'mlp_size_1': 6, 'mlp_size_2': 0, 'mlp_size_3': 0, 'kernel': 'Exponential', 'loss_name': 'NLLLoss'}. Best is trial 237 with value: 0.7341952549033148.[0m
[32m[I 2022-04-19 08:37:51,903][0m Trial 320 finished with value: 0.6826728089346228 and parameters: {'n_hidden': 512, 'mixture_components': 1, 'use_sparse_layer': True, 'use_sparse_loss': True, 'lmbd': 0.0005573493380189039, 'use_batchnorm': False, 'use_dropout': False, 'mlp_size_1': 6, 'mlp_size_2': 0, 'mlp_size_3': 0, 'kernel': 'Exponential', 'loss_name': 'NLLLoss'}. Best is trial 237 with value: 0.7341952549033148.[0m
[32m[I 2022-04-19 08:39:20,927][0m Trial 321 finished with value: 0.6670266058791615 and parameters: {'n_hidden': 512, 'mixture_components': 1, 'use_sparse_layer': True, 'use_sparse_loss': True, 'lmbd': 0.00014232685885821303, 'use_batchnorm': False, 'use_dropout': True, 'dropout': 0.17192142667367272, 'mlp_size_1': 6, 'mlp_size_2': 0, 'mlp_size_3': 0, 'kernel': 'Exponential', 'loss_name': 'NLLLoss'}. Best is trial 237 with value: 0.7341952549033148.[0m
[32m[I 2022-04-19 08:40:32,809][0m Trial 322 finished with value: 0.665067638361593 and parameters: {'n_hidden': 512, 'mixture_components': 1, 'use_sparse_layer': True, 'use_sparse_loss': True, 'lmbd': 0.00041123075298766967, 'use_batchnorm': False, 'use_dropout': True, 'dropout': 0.35373096163579204, 'mlp_size_1': 6, 'mlp_size_2': 0, 'mlp_size_3': 0, 'kernel': 'Exponential', 'loss_name': 'NLLLoss'}. Best is trial 237 with value: 0.7341952549033148.[0m
[32m[I 2022-04-19 08:42:14,036][0m Trial 323 finished with value: 0.6537757762283526 and parameters: {'n_hidden': 512, 'mixture_components': 1, 'use_sparse_layer': True, 'use_sparse_loss': True, 'lmbd': 0.0007964822793134797, 'use_batchnorm': False, 'use_dropout': True, 'dropout': 0.30124353278374333, 'mlp_size_1': 6, 'mlp_size_2': 0, 'mlp_size_3': 0, 'kernel': 'Gumbel', 'loss_name': 'NLLLoss'}. Best is trial 237 with value: 0.7341952549033148.[0m
[32m[I 2022-04-19 08:43:51,284][0m Trial 324 finished with value: 0.6797027021606813 and parameters: {'n_hidden': 256, 'mixture_components': 1, 'use_sparse_layer': True, 'use_sparse_loss': True, 'lmbd': 0.00025451054149030106, 'use_batchnorm': False, 'use_dropout': True, 'dropout': 0.3229066269223684, 'mlp_size_1': 5, 'mlp_size_2': 0, 'mlp_size_3': 0, 'kernel': 'Exponential', 'loss_name': 'NLLLoss'}. Best is trial 237 with value: 0.7341952549033148.[0m
[32m[I 2022-04-19 08:46:20,481][0m Trial 325 finished with value: 0.6289761541790418 and parameters: {'n_hidden': 128, 'mixture_components': 1, 'use_sparse_layer': True, 'use_sparse_loss': False, 'use_batchnorm': False, 'use_dropout': True, 'dropout': 0.36849016932231515, 'mlp_size_1': 4, 'mlp_size_2': 0, 'mlp_size_3': 0, 'kernel': 'Normal', 'loss_name': 'NLLLoss'}. Best is trial 237 with value: 0.7341952549033148.[0m
[32m[I 2022-04-19 08:47:47,207][0m Trial 326 finished with value: 0.6917949918006813 and parameters: {'n_hidden': 512, 'mixture_components': 1, 'use_sparse_layer': True, 'use_sparse_loss': True, 'lmbd': 0.00010301829129540885, 'use_batchnorm': False, 'use_dropout': True, 'dropout': 0.23283612080328964, 'mlp_size_1': 6, 'mlp_size_2': 0, 'mlp_size_3': 0, 'kernel': 'Exponential', 'loss_name': 'NLLLoss'}. Best is trial 237 with value: 0.7341952549033148.[0m
[32m[I 2022-04-19 08:49:31,388][0m Trial 327 finished with value: 0.6598079540481784 and parameters: {'n_hidden': 64, 'mixture_components': 1, 'use_sparse_layer': True, 'use_sparse_loss': True, 'lmbd': 0.00013377364977181413, 'use_batchnorm': False, 'use_dropout': True, 'dropout': 0.33378969391565444, 'mlp_size_1': 3, 'mlp_size_2': 0, 'mlp_size_3': 0, 'kernel': 'Exponential', 'loss_name': 'NLLLoss'}. Best is trial 237 with value: 0.7341952549033148.[0m
[32m[I 2022-04-19 08:51:07,736][0m Trial 328 finished with value: 0.7025987818764916 and parameters: {'n_hidden': 2048, 'mixture_components': 1, 'use_sparse_layer': True, 'use_sparse_loss': True, 'lmbd': 0.0004258822037841646, 'use_batchnorm': False, 'use_dropout': True, 'dropout': 0.30856933465269787, 'mlp_size_1': 7, 'mlp_size_2': 0, 'mlp_size_3': 0, 'kernel': 'Weibull', 'loss_name': 'NLLLoss'}. Best is trial 237 with value: 0.7341952549033148.[0m
[32m[I 2022-04-19 08:52:41,628][0m Trial 329 finished with value: 0.7278411985246804 and parameters: {'n_hidden': 2048, 'mixture_components': 1, 'use_sparse_layer': True, 'use_sparse_loss': True, 'lmbd': 0.00026182448835111033, 'use_batchnorm': False, 'use_dropout': True, 'dropout': 0.2740783535476453, 'mlp_size_1': 7, 'mlp_size_2': 0, 'mlp_size_3': 0, 'kernel': 'Exponential', 'loss_name': 'NLLLoss'}. Best is trial 237 with value: 0.7341952549033148.[0m
[32m[I 2022-04-19 08:54:48,241][0m Trial 330 finished with value: 0.6797361417549641 and parameters: {'n_hidden': 2048, 'mixture_components': 1, 'use_sparse_layer': True, 'use_sparse_loss': True, 'lmbd': 0.0002657373099601093, 'use_batchnorm': False, 'use_dropout': True, 'dropout': 0.2768157934181377, 'mlp_size_1': 7, 'mlp_size_2': 0, 'mlp_size_3': 0, 'kernel': 'Logistic', 'loss_name': 'NLLLoss'}. Best is trial 237 with value: 0.7341952549033148.[0m
[32m[I 2022-04-19 08:56:06,753][0m Trial 331 finished with value: 0.5348659061083108 and parameters: {'n_hidden': 2048, 'mixture_components': 9, 'use_sparse_layer': True, 'use_sparse_loss': False, 'use_batchnorm': False, 'use_dropout': True, 'dropout': 0.24858804607474055, 'mlp_size_1': 7, 'mlp_size_2': 0, 'mlp_size_3': 0, 'kernel': 'Exponential', 'loss_name': 'NLLLoss'}. Best is trial 237 with value: 0.7341952549033148.[0m
[32m[I 2022-04-19 08:57:45,422][0m Trial 332 finished with value: 0.7229016851423473 and parameters: {'n_hidden': 2048, 'mixture_components': 1, 'use_sparse_layer': True, 'use_sparse_loss': True, 'lmbd': 0.0002583838952170706, 'use_batchnorm': False, 'use_dropout': True, 'dropout': 0.29035056762818473, 'mlp_size_1': 7, 'mlp_size_2': 0, 'mlp_size_3': 0, 'kernel': 'Exponential', 'loss_name': 'NLLLoss'}. Best is trial 237 with value: 0.7341952549033148.[0m
[32m[I 2022-04-19 08:59:42,550][0m Trial 333 finished with value: 0.6529542359976883 and parameters: {'n_hidden': 2048, 'mixture_components': 1, 'use_sparse_layer': True, 'use_sparse_loss': True, 'lmbd': 0.0002454471518069924, 'use_batchnorm': False, 'use_dropout': True, 'dropout': 0.1955636433400769, 'mlp_size_1': 7, 'mlp_size_2': 0, 'mlp_size_3': 0, 'kernel': 'LogNormal', 'loss_name': 'NLLLoss'}. Best is trial 237 with value: 0.7341952549033148.[0m
[32m[I 2022-04-19 09:01:27,476][0m Trial 334 finished with value: 0.7120327904846075 and parameters: {'n_hidden': 2048, 'mixture_components': 1, 'use_sparse_layer': True, 'use_sparse_loss': True, 'lmbd': 0.00014175494704416112, 'use_batchnorm': False, 'use_dropout': True, 'dropout': 0.44054417453118155, 'mlp_size_1': 7, 'mlp_size_2': 0, 'mlp_size_3': 0, 'kernel': 'Exponential', 'loss_name': 'NLLLoss'}. Best is trial 237 with value: 0.7341952549033148.[0m
[32m[I 2022-04-19 09:03:01,770][0m Trial 335 finished with value: 0.7011292976483634 and parameters: {'n_hidden': 2048, 'mixture_components': 1, 'use_sparse_layer': True, 'use_sparse_loss': True, 'lmbd': 0.00032254070953661193, 'use_batchnorm': False, 'use_dropout': True, 'dropout': 0.22549761103655167, 'mlp_size_1': 7, 'mlp_size_2': 0, 'mlp_size_3': 0, 'kernel': 'Exponential', 'loss_name': 'NLLLoss'}. Best is trial 237 with value: 0.7341952549033148.[0m
[32m[I 2022-04-19 09:05:16,619][0m Trial 336 finished with value: 0.6478234457905871 and parameters: {'n_hidden': 32, 'mixture_components': 1, 'use_sparse_layer': True, 'use_sparse_loss': True, 'lmbd': 0.0002363086835662543, 'use_batchnorm': False, 'use_dropout': True, 'dropout': 0.28249881592616527, 'mlp_size_1': 2, 'mlp_size_2': 0, 'mlp_size_3': 0, 'kernel': 'Exponential', 'loss_name': 'NLLLoss'}. Best is trial 237 with value: 0.7341952549033148.[0m
[32m[I 2022-04-19 09:06:53,791][0m Trial 337 finished with value: 0.6950277738637684 and parameters: {'n_hidden': 2048, 'mixture_components': 1, 'use_sparse_layer': True, 'use_sparse_loss': True, 'lmbd': 0.00014480009356480193, 'use_batchnorm': False, 'use_dropout': True, 'dropout': 0.2589917823641303, 'mlp_size_1': 7, 'mlp_size_2': 0, 'mlp_size_3': 0, 'kernel': 'Exponential', 'loss_name': 'NLLLoss'}. Best is trial 237 with value: 0.7341952549033148.[0m
[32m[I 2022-04-19 09:08:24,900][0m Trial 338 finished with value: 0.705548823990301 and parameters: {'n_hidden': 2048, 'mixture_components': 1, 'use_sparse_layer': True, 'use_sparse_loss': False, 'use_batchnorm': False, 'use_dropout': True, 'dropout': 0.36304378698654033, 'mlp_size_1': 7, 'mlp_size_2': 0, 'mlp_size_3': 0, 'kernel': 'Exponential', 'loss_name': 'NLLLoss'}. Best is trial 237 with value: 0.7341952549033148.[0m
[32m[I 2022-04-19 09:10:02,609][0m Trial 339 finished with value: 0.7153441573097569 and parameters: {'n_hidden': 2048, 'mixture_components': 1, 'use_sparse_layer': True, 'use_sparse_loss': True, 'lmbd': 0.0003224830751022207, 'use_batchnorm': False, 'use_dropout': True, 'dropout': 0.3059946658684341, 'mlp_size_1': 7, 'mlp_size_2': 0, 'mlp_size_3': 0, 'kernel': 'Exponential', 'loss_name': 'NLLLoss'}. Best is trial 237 with value: 0.7341952549033148.[0m
[32m[I 2022-04-19 09:15:27,638][0m Trial 340 finished with value: 0.6052054425929816 and parameters: {'n_hidden': 2048, 'mixture_components': 1, 'use_sparse_layer': True, 'use_sparse_loss': True, 'lmbd': 0.00031728991670621837, 'use_batchnorm': True, 'use_dropout': False, 'mlp_size_1': 7, 'mlp_size_2': 0, 'mlp_size_3': 0, 'kernel': 'Exponential', 'loss_name': 'NLLLoss'}. Best is trial 237 with value: 0.7341952549033148.[0m
[32m[I 2022-04-19 09:17:05,174][0m Trial 341 finished with value: 0.7002526096381075 and parameters: {'n_hidden': 2048, 'mixture_components': 1, 'use_sparse_layer': True, 'use_sparse_loss': True, 'lmbd': 0.0003745626488009229, 'use_batchnorm': False, 'use_dropout': True, 'dropout': 0.30565646436128663, 'mlp_size_1': 7, 'mlp_size_2': 0, 'mlp_size_3': 0, 'kernel': 'Exponential', 'loss_name': 'NLLLoss'}. Best is trial 237 with value: 0.7341952549033148.[0m
[32m[I 2022-04-19 09:18:42,284][0m Trial 342 finished with value: 0.7271906751584353 and parameters: {'n_hidden': 2048, 'mixture_components': 1, 'use_sparse_layer': True, 'use_sparse_loss': True, 'lmbd': 0.0002297259543686566, 'use_batchnorm': False, 'use_dropout': True, 'dropout': 0.2778468842431457, 'mlp_size_1': 7, 'mlp_size_2': 0, 'mlp_size_3': 0, 'kernel': 'Exponential', 'loss_name': 'NLLLoss'}. Best is trial 237 with value: 0.7341952549033148.[0m
[32m[I 2022-04-19 09:20:18,549][0m Trial 343 finished with value: 0.7052102707992842 and parameters: {'n_hidden': 2048, 'mixture_components': 1, 'use_sparse_layer': True, 'use_sparse_loss': True, 'lmbd': 0.00027711202734928846, 'use_batchnorm': False, 'use_dropout': True, 'dropout': 0.28005717495001886, 'mlp_size_1': 7, 'mlp_size_2': 0, 'mlp_size_3': 0, 'kernel': 'Exponential', 'loss_name': 'NLLLoss'}. Best is trial 237 with value: 0.7341952549033148.[0m
[32m[I 2022-04-19 09:21:42,035][0m Trial 344 finished with value: 0.6498585518369537 and parameters: {'n_hidden': 256, 'mixture_components': 1, 'use_sparse_layer': True, 'use_sparse_loss': True, 'lmbd': 0.00033639444885844895, 'use_batchnorm': False, 'use_dropout': True, 'dropout': 0.2546496601542504, 'mlp_size_1': 5, 'mlp_size_2': 0, 'mlp_size_3': 0, 'kernel': 'Exponential', 'loss_name': 'NLLLoss'}. Best is trial 237 with value: 0.7341952549033148.[0m
[32m[I 2022-04-19 09:23:23,074][0m Trial 345 finished with value: 0.7020070069241862 and parameters: {'n_hidden': 2048, 'mixture_components': 1, 'use_sparse_layer': True, 'use_sparse_loss': False, 'use_batchnorm': False, 'use_dropout': True, 'dropout': 0.2099150784019825, 'mlp_size_1': 7, 'mlp_size_2': 0, 'mlp_size_3': 0, 'kernel': 'Exponential', 'loss_name': 'NLLLoss'}. Best is trial 237 with value: 0.7341952549033148.[0m
[32m[I 2022-04-19 09:24:58,040][0m Trial 346 finished with value: 0.7032819769668139 and parameters: {'n_hidden': 2048, 'mixture_components': 1, 'use_sparse_layer': True, 'use_sparse_loss': True, 'lmbd': 0.00026718807173734335, 'use_batchnorm': False, 'use_dropout': True, 'dropout': 0.28124487712113466, 'mlp_size_1': 7, 'mlp_size_2': 0, 'mlp_size_3': 0, 'kernel': 'Exponential', 'loss_name': 'NLLLoss'}. Best is trial 237 with value: 0.7341952549033148.[0m
[32m[I 2022-04-19 09:26:29,365][0m Trial 347 finished with value: 0.679157291295653 and parameters: {'n_hidden': 2048, 'mixture_components': 1, 'use_sparse_layer': True, 'use_sparse_loss': True, 'lmbd': 0.00037753260068270955, 'use_batchnorm': False, 'use_dropout': True, 'dropout': 0.23533552103294028, 'mlp_size_1': 7, 'mlp_size_2': 0, 'mlp_size_3': 0, 'kernel': 'Exponential', 'loss_name': 'NLLLoss'}. Best is trial 237 with value: 0.7341952549033148.[0m
[32m[I 2022-04-19 09:28:10,380][0m Trial 348 finished with value: 0.7034090969967423 and parameters: {'n_hidden': 2048, 'mixture_components': 1, 'use_sparse_layer': True, 'use_sparse_loss': True, 'lmbd': 0.00046988669899520355, 'use_batchnorm': False, 'use_dropout': True, 'dropout': 0.30340605197640025, 'mlp_size_1': 7, 'mlp_size_2': 0, 'mlp_size_3': 0, 'kernel': 'Exponential', 'loss_name': 'NLLLoss'}. Best is trial 237 with value: 0.7341952549033148.[0m
[32m[I 2022-04-19 09:29:46,242][0m Trial 349 finished with value: 0.7003916355587664 and parameters: {'n_hidden': 2048, 'mixture_components': 1, 'use_sparse_layer': True, 'use_sparse_loss': True, 'lmbd': 0.00024033435749042572, 'use_batchnorm': False, 'use_dropout': True, 'dropout': 0.26714548371007946, 'mlp_size_1': 7, 'mlp_size_2': 0, 'mlp_size_3': 0, 'kernel': 'Exponential', 'loss_name': 'NLLLoss'}. Best is trial 237 with value: 0.7341952549033148.[0m
[32m[I 2022-04-19 09:31:34,016][0m Trial 350 finished with value: 0.5326966872600282 and parameters: {'n_hidden': 2048, 'mixture_components': 1, 'use_sparse_layer': True, 'use_sparse_loss': True, 'lmbd': 0.00017680654887067902, 'use_batchnorm': False, 'use_dropout': True, 'dropout': 0.32177024086460015, 'mlp_size_1': 7, 'mlp_size_2': 0, 'mlp_size_3': 1, 'kernel': 'LogLogistic', 'loss_name': 'NLLLoss'}. Best is trial 237 with value: 0.7341952549033148.[0m
[32m[I 2022-04-19 09:33:07,973][0m Trial 351 finished with value: 0.7217721598119419 and parameters: {'n_hidden': 2048, 'mixture_components': 1, 'use_sparse_layer': True, 'use_sparse_loss': False, 'use_batchnorm': False, 'use_dropout': True, 'dropout': 0.2927174236985203, 'mlp_size_1': 0, 'mlp_size_2': 0, 'mlp_size_3': 5, 'kernel': 'Exponential', 'loss_name': 'NLLLoss'}. Best is trial 237 with value: 0.7341952549033148.[0m
[32m[I 2022-04-19 09:36:51,693][0m Trial 352 finished with value: 0.5642601494172762 and parameters: {'n_hidden': 2048, 'mixture_components': 1, 'use_sparse_layer': True, 'use_sparse_loss': False, 'use_batchnorm': False, 'use_dropout': True, 'dropout': 0.2943373517140867, 'mlp_size_1': 0, 'mlp_size_2': 1, 'mlp_size_3': 6, 'kernel': 'Normal', 'loss_name': 'NLLLoss'}. Best is trial 237 with value: 0.7341952549033148.[0m
[32m[I 2022-04-19 09:38:21,253][0m Trial 353 finished with value: 0.6895673480902534 and parameters: {'n_hidden': 2048, 'mixture_components': 1, 'use_sparse_layer': True, 'use_sparse_loss': False, 'use_batchnorm': False, 'use_dropout': True, 'dropout': 0.31285451154989585, 'mlp_size_1': 7, 'mlp_size_2': 0, 'mlp_size_3': 0, 'kernel': 'Exponential', 'loss_name': 'NLLLoss'}. Best is trial 237 with value: 0.7341952549033148.[0m
[32m[I 2022-04-19 09:39:57,029][0m Trial 354 finished with value: 0.6640182714740508 and parameters: {'n_hidden': 128, 'mixture_components': 1, 'use_sparse_layer': True, 'use_sparse_loss': True, 'lmbd': 0.00010754066456699635, 'use_batchnorm': False, 'use_dropout': True, 'dropout': 0.2727008885744677, 'mlp_size_1': 4, 'mlp_size_2': 0, 'mlp_size_3': 0, 'kernel': 'Exponential', 'loss_name': 'NLLLoss'}. Best is trial 237 with value: 0.7341952549033148.[0m
[32m[I 2022-04-19 09:42:32,948][0m Trial 355 finished with value: 0.7162814029770148 and parameters: {'n_hidden': 2048, 'mixture_components': 1, 'use_sparse_layer': True, 'use_sparse_loss': False, 'use_batchnorm': False, 'use_dropout': True, 'dropout': 0.3446750364600111, 'mlp_size_1': 7, 'mlp_size_2': 0, 'mlp_size_3': 1, 'kernel': 'Exponential', 'loss_name': 'NLLLoss'}. Best is trial 237 with value: 0.7341952549033148.[0m
