[32m[I 2022-04-19 11:37:43,618][0m Trial 407 finished with value: 0.7113120021124854 and parameters: {'n_hidden': 2048, 'mixture_components': 1, 'use_sparse_layer': True, 'use_sparse_loss': False, 'use_batchnorm': False, 'use_dropout': True, 'dropout': 0.36021690107605137, 'mlp_size_1': 0, 'mlp_size_2': 5, 'mlp_size_3': 3, 'kernel': 'Exponential', 'loss_name': 'NLLLoss'}. Best is trial 386 with value: 0.7375366593103335.[0m
[32m[I 2022-04-19 11:39:58,642][0m Trial 408 finished with value: 0.6669814538538015 and parameters: {'n_hidden': 2048, 'mixture_components': 1, 'use_sparse_layer': True, 'use_sparse_loss': False, 'use_batchnorm': False, 'use_dropout': True, 'dropout': 0.4493848314054702, 'mlp_size_1': 0, 'mlp_size_2': 5, 'mlp_size_3': 3, 'kernel': 'LogLogistic', 'loss_name': 'NLLLoss'}. Best is trial 386 with value: 0.7375366593103335.[0m
[32m[I 2022-04-19 11:44:22,295][0m Trial 409 finished with value: 0.6270616243093319 and parameters: {'n_hidden': 64, 'mixture_components': 1, 'use_sparse_layer': True, 'use_sparse_loss': False, 'use_batchnorm': False, 'use_dropout': True, 'dropout': 0.393931740824789, 'mlp_size_1': 0, 'mlp_size_2': 3, 'mlp_size_3': 0, 'kernel': 'Exponential', 'loss_name': 'NLLLoss'}. Best is trial 386 with value: 0.7375366593103335.[0m
[32m[I 2022-04-19 11:46:29,785][0m Trial 410 finished with value: 0.7217447435920632 and parameters: {'n_hidden': 2048, 'mixture_components': 1, 'use_sparse_layer': True, 'use_sparse_loss': False, 'use_batchnorm': False, 'use_dropout': True, 'dropout': 0.42645721904456796, 'mlp_size_1': 0, 'mlp_size_2': 4, 'mlp_size_3': 4, 'kernel': 'Exponential', 'loss_name': 'NLLLoss'}. Best is trial 386 with value: 0.7375366593103335.[0m
[32m[I 2022-04-19 11:48:39,561][0m Trial 411 finished with value: 0.7215810898104595 and parameters: {'n_hidden': 2048, 'mixture_components': 1, 'use_sparse_layer': True, 'use_sparse_loss': False, 'use_batchnorm': False, 'use_dropout': True, 'dropout': 0.4282588687746847, 'mlp_size_1': 0, 'mlp_size_2': 4, 'mlp_size_3': 4, 'kernel': 'Exponential', 'loss_name': 'NLLLoss'}. Best is trial 386 with value: 0.7375366593103335.[0m
[32m[I 2022-04-19 11:50:36,249][0m Trial 412 finished with value: 0.7187843093676478 and parameters: {'n_hidden': 2048, 'mixture_components': 1, 'use_sparse_layer': True, 'use_sparse_loss': False, 'use_batchnorm': False, 'use_dropout': True, 'dropout': 0.4297387357468326, 'mlp_size_1': 0, 'mlp_size_2': 4, 'mlp_size_3': 4, 'kernel': 'Exponential', 'loss_name': 'NLLLoss'}. Best is trial 386 with value: 0.7375366593103335.[0m
[32m[I 2022-04-19 11:52:42,895][0m Trial 413 finished with value: 0.709509383709697 and parameters: {'n_hidden': 2048, 'mixture_components': 1, 'use_sparse_layer': True, 'use_sparse_loss': False, 'use_batchnorm': False, 'use_dropout': True, 'dropout': 0.4640444142636165, 'mlp_size_1': 0, 'mlp_size_2': 4, 'mlp_size_3': 4, 'kernel': 'Exponential', 'loss_name': 'NLLLoss'}. Best is trial 386 with value: 0.7375366593103335.[0m
[32m[I 2022-04-19 11:54:39,096][0m Trial 414 finished with value: 0.5822716765004633 and parameters: {'n_hidden': 2048, 'mixture_components': 1, 'use_sparse_layer': True, 'use_sparse_loss': False, 'use_batchnorm': False, 'use_dropout': True, 'dropout': 0.4287729161399421, 'mlp_size_1': 0, 'mlp_size_2': 4, 'mlp_size_3': 4, 'kernel': 'Normal', 'loss_name': 'NLLLoss'}. Best is trial 386 with value: 0.7375366593103335.[0m
[32m[I 2022-04-19 11:57:32,859][0m Trial 415 finished with value: 0.6995601955497625 and parameters: {'n_hidden': 2048, 'mixture_components': 1, 'use_sparse_layer': True, 'use_sparse_loss': False, 'use_batchnorm': False, 'use_dropout': True, 'dropout': 0.4397131742396202, 'mlp_size_1': 0, 'mlp_size_2': 4, 'mlp_size_3': 4, 'kernel': 'Gumbel', 'loss_name': 'NLLLoss'}. Best is trial 386 with value: 0.7375366593103335.[0m
[32m[I 2022-04-19 11:59:32,631][0m Trial 416 finished with value: 0.7204307641872607 and parameters: {'n_hidden': 2048, 'mixture_components': 1, 'use_sparse_layer': True, 'use_sparse_loss': False, 'use_batchnorm': False, 'use_dropout': True, 'dropout': 0.41703031419321895, 'mlp_size_1': 0, 'mlp_size_2': 4, 'mlp_size_3': 4, 'kernel': 'Exponential', 'loss_name': 'NLLLoss'}. Best is trial 386 with value: 0.7375366593103335.[0m
[32m[I 2022-04-19 12:05:01,634][0m Trial 417 finished with value: 0.6814216913290752 and parameters: {'n_hidden': 2048, 'mixture_components': 1, 'use_sparse_layer': True, 'use_sparse_loss': False, 'use_batchnorm': True, 'use_dropout': True, 'dropout': 0.41529303460233863, 'mlp_size_1': 0, 'mlp_size_2': 4, 'mlp_size_3': 4, 'kernel': 'Exponential', 'loss_name': 'NLLLoss'}. Best is trial 386 with value: 0.7375366593103335.[0m
[32m[I 2022-04-19 12:06:56,243][0m Trial 418 finished with value: 0.6838589821298757 and parameters: {'n_hidden': 2048, 'mixture_components': 1, 'use_sparse_layer': True, 'use_sparse_loss': False, 'use_batchnorm': False, 'use_dropout': True, 'dropout': 0.4582864882308874, 'mlp_size_1': 1, 'mlp_size_2': 4, 'mlp_size_3': 3, 'kernel': 'Weibull', 'loss_name': 'NLLLoss'}. Best is trial 386 with value: 0.7375366593103335.[0m
[32m[I 2022-04-19 12:08:42,836][0m Trial 419 finished with value: 0.6918744405971671 and parameters: {'n_hidden': 2048, 'mixture_components': 1, 'use_sparse_layer': True, 'use_sparse_loss': False, 'use_batchnorm': False, 'use_dropout': False, 'mlp_size_1': 0, 'mlp_size_2': 4, 'mlp_size_3': 4, 'kernel': 'Exponential', 'loss_name': 'NLLLoss'}. Best is trial 386 with value: 0.7375366593103335.[0m
[32m[I 2022-04-19 12:10:39,835][0m Trial 420 finished with value: 0.7127227729725446 and parameters: {'n_hidden': 2048, 'mixture_components': 1, 'use_sparse_layer': True, 'use_sparse_loss': False, 'use_batchnorm': False, 'use_dropout': True, 'dropout': 0.44707745411879996, 'mlp_size_1': 0, 'mlp_size_2': 4, 'mlp_size_3': 4, 'kernel': 'Exponential', 'loss_name': 'NLLLoss'}. Best is trial 386 with value: 0.7375366593103335.[0m
[32m[I 2022-04-19 12:12:42,547][0m Trial 421 finished with value: 0.6579699892886809 and parameters: {'n_hidden': 2048, 'mixture_components': 1, 'use_sparse_layer': True, 'use_sparse_loss': False, 'use_batchnorm': False, 'use_dropout': True, 'dropout': 0.4210499912372808, 'mlp_size_1': 0, 'mlp_size_2': 5, 'mlp_size_3': 3, 'kernel': 'Logistic', 'loss_name': 'NLLLoss'}. Best is trial 386 with value: 0.7375366593103335.[0m
[32m[I 2022-04-19 12:14:36,358][0m Trial 422 finished with value: 0.6851396292705668 and parameters: {'n_hidden': 2048, 'mixture_components': 1, 'use_sparse_layer': True, 'use_sparse_loss': False, 'use_batchnorm': False, 'use_dropout': True, 'dropout': 0.4113155499183816, 'mlp_size_1': 0, 'mlp_size_2': 4, 'mlp_size_3': 4, 'kernel': 'Exponential', 'loss_name': 'NLLLoss'}. Best is trial 386 with value: 0.7375366593103335.[0m
[32m[I 2022-04-19 12:16:50,141][0m Trial 423 finished with value: 0.6414782098696501 and parameters: {'n_hidden': 2048, 'mixture_components': 1, 'use_sparse_layer': True, 'use_sparse_loss': False, 'use_batchnorm': False, 'use_dropout': True, 'dropout': 0.43843048936369033, 'mlp_size_1': 0, 'mlp_size_2': 4, 'mlp_size_3': 4, 'kernel': 'LogNormal', 'loss_name': 'NLLLoss'}. Best is trial 386 with value: 0.7375366593103335.[0m
[32m[I 2022-04-19 12:18:30,650][0m Trial 424 finished with value: 0.7162096994227776 and parameters: {'n_hidden': 2048, 'mixture_components': 1, 'use_sparse_layer': True, 'use_sparse_loss': False, 'use_batchnorm': False, 'use_dropout': True, 'dropout': 0.45638357503876986, 'mlp_size_1': 1, 'mlp_size_2': 5, 'mlp_size_3': 2, 'kernel': 'Exponential', 'loss_name': 'NLLLoss'}. Best is trial 386 with value: 0.7375366593103335.[0m
[32m[I 2022-04-19 12:20:47,620][0m Trial 425 finished with value: 0.7401473255243529 and parameters: {'n_hidden': 2048, 'mixture_components': 1, 'use_sparse_layer': True, 'use_sparse_loss': False, 'use_batchnorm': False, 'use_dropout': True, 'dropout': 0.3916567522679316, 'mlp_size_1': 0, 'mlp_size_2': 4, 'mlp_size_3': 4, 'kernel': 'Exponential', 'loss_name': 'NLLLoss'}. Best is trial 425 with value: 0.7401473255243529.[0m
[32m[I 2022-04-19 12:23:06,463][0m Trial 426 finished with value: 0.6958804904111882 and parameters: {'n_hidden': 2048, 'mixture_components': 1, 'use_sparse_layer': True, 'use_sparse_loss': False, 'use_batchnorm': False, 'use_dropout': True, 'dropout': 0.38732144716568556, 'mlp_size_1': 0, 'mlp_size_2': 7, 'mlp_size_3': 1, 'kernel': 'Exponential', 'loss_name': 'NLLLoss'}. Best is trial 425 with value: 0.7401473255243529.[0m
[32m[I 2022-04-19 12:27:15,862][0m Trial 427 finished with value: 0.6412631727463277 and parameters: {'n_hidden': 128, 'mixture_components': 1, 'use_sparse_layer': True, 'use_sparse_loss': False, 'use_batchnorm': False, 'use_dropout': True, 'dropout': 0.3685913665305411, 'mlp_size_1': 0, 'mlp_size_2': 4, 'mlp_size_3': 0, 'kernel': 'Exponential', 'loss_name': 'NLLLoss'}. Best is trial 425 with value: 0.7401473255243529.[0m
[32m[I 2022-04-19 12:29:38,936][0m Trial 428 finished with value: 0.7319754663468016 and parameters: {'n_hidden': 2048, 'mixture_components': 1, 'use_sparse_layer': True, 'use_sparse_loss': False, 'use_batchnorm': False, 'use_dropout': True, 'dropout': 0.392936087697871, 'mlp_size_1': 0, 'mlp_size_2': 4, 'mlp_size_3': 4, 'kernel': 'Exponential', 'loss_name': 'NLLLoss'}. Best is trial 425 with value: 0.7401473255243529.[0m
[32m[I 2022-04-19 12:31:42,839][0m Trial 429 finished with value: 0.713014692163359 and parameters: {'n_hidden': 2048, 'mixture_components': 1, 'use_sparse_layer': True, 'use_sparse_loss': False, 'use_batchnorm': False, 'use_dropout': True, 'dropout': 0.36060333215136925, 'mlp_size_1': 0, 'mlp_size_2': 4, 'mlp_size_3': 4, 'kernel': 'Exponential', 'loss_name': 'NLLLoss'}. Best is trial 425 with value: 0.7401473255243529.[0m
[32m[I 2022-04-19 12:33:56,290][0m Trial 430 finished with value: 0.695623219059064 and parameters: {'n_hidden': 2048, 'mixture_components': 1, 'use_sparse_layer': True, 'use_sparse_loss': False, 'use_batchnorm': False, 'use_dropout': True, 'dropout': 0.38472519751052314, 'mlp_size_1': 0, 'mlp_size_2': 6, 'mlp_size_3': 2, 'kernel': 'Exponential', 'loss_name': 'NLLLoss'}. Best is trial 425 with value: 0.7401473255243529.[0m
[32m[I 2022-04-19 12:36:18,079][0m Trial 431 finished with value: 0.7343632840212171 and parameters: {'n_hidden': 2048, 'mixture_components': 1, 'use_sparse_layer': True, 'use_sparse_loss': False, 'use_batchnorm': False, 'use_dropout': True, 'dropout': 0.3994421999037208, 'mlp_size_1': 0, 'mlp_size_2': 4, 'mlp_size_3': 4, 'kernel': 'Exponential', 'loss_name': 'NLLLoss'}. Best is trial 425 with value: 0.7401473255243529.[0m
[32m[I 2022-04-19 12:40:18,692][0m Trial 432 finished with value: 0.6010978132670152 and parameters: {'n_hidden': 32, 'mixture_components': 1, 'use_sparse_layer': True, 'use_sparse_loss': False, 'use_batchnorm': False, 'use_dropout': True, 'dropout': 0.4016956725988597, 'mlp_size_1': 0, 'mlp_size_2': 2, 'mlp_size_3': 0, 'kernel': 'Exponential', 'loss_name': 'NLLLoss'}. Best is trial 425 with value: 0.7401473255243529.[0m
[32m[I 2022-04-19 12:42:23,324][0m Trial 433 finished with value: 0.7059992217393247 and parameters: {'n_hidden': 2048, 'mixture_components': 1, 'use_sparse_layer': True, 'use_sparse_loss': False, 'use_batchnorm': False, 'use_dropout': True, 'dropout': 0.39514708092256434, 'mlp_size_1': 0, 'mlp_size_2': 4, 'mlp_size_3': 4, 'kernel': 'Exponential', 'loss_name': 'NLLLoss'}. Best is trial 425 with value: 0.7401473255243529.[0m
[32m[I 2022-04-19 12:44:24,732][0m Trial 434 finished with value: 0.7091783987314901 and parameters: {'n_hidden': 2048, 'mixture_components': 1, 'use_sparse_layer': True, 'use_sparse_loss': False, 'use_batchnorm': False, 'use_dropout': True, 'dropout': 0.4069714269168623, 'mlp_size_1': 0, 'mlp_size_2': 4, 'mlp_size_3': 4, 'kernel': 'Exponential', 'loss_name': 'NLLLoss'}. Best is trial 425 with value: 0.7401473255243529.[0m
[32m[I 2022-04-19 12:46:37,447][0m Trial 435 finished with value: 0.7211684261951288 and parameters: {'n_hidden': 2048, 'mixture_components': 1, 'use_sparse_layer': True, 'use_sparse_loss': False, 'use_batchnorm': False, 'use_dropout': True, 'dropout': 0.38371389763537117, 'mlp_size_1': 0, 'mlp_size_2': 4, 'mlp_size_3': 4, 'kernel': 'Exponential', 'loss_name': 'NLLLoss'}. Best is trial 425 with value: 0.7401473255243529.[0m
[32m[I 2022-04-19 12:50:39,730][0m Trial 436 finished with value: 0.640010295800537 and parameters: {'n_hidden': 64, 'mixture_components': 1, 'use_sparse_layer': True, 'use_sparse_loss': False, 'use_batchnorm': False, 'use_dropout': True, 'dropout': 0.395922572229698, 'mlp_size_1': 0, 'mlp_size_2': 3, 'mlp_size_3': 0, 'kernel': 'Exponential', 'loss_name': 'NLLLoss'}. Best is trial 425 with value: 0.7401473255243529.[0m
[32m[I 2022-04-19 12:58:32,082][0m Trial 437 finished with value: 0.7028539781999151 and parameters: {'n_hidden': 2048, 'mixture_components': 1, 'use_sparse_layer': True, 'use_sparse_loss': False, 'use_batchnorm': True, 'use_dropout': True, 'dropout': 0.3750097820938899, 'mlp_size_1': 0, 'mlp_size_2': 4, 'mlp_size_3': 4, 'kernel': 'Exponential', 'loss_name': 'NLLLoss'}. Best is trial 425 with value: 0.7401473255243529.[0m
[32m[I 2022-04-19 13:00:22,734][0m Trial 438 finished with value: 0.6952371486354245 and parameters: {'n_hidden': 2048, 'mixture_components': 2, 'use_sparse_layer': True, 'use_sparse_loss': False, 'use_batchnorm': False, 'use_dropout': False, 'mlp_size_1': 0, 'mlp_size_2': 4, 'mlp_size_3': 4, 'kernel': 'Exponential', 'loss_name': 'NLLLoss'}. Best is trial 425 with value: 0.7401473255243529.[0m
[32m[I 2022-04-19 13:02:35,256][0m Trial 439 finished with value: 0.6628975559936675 and parameters: {'n_hidden': 2048, 'mixture_components': 1, 'use_sparse_layer': True, 'use_sparse_loss': False, 'use_batchnorm': False, 'use_dropout': True, 'dropout': 0.37213065518935184, 'mlp_size_1': 0, 'mlp_size_2': 4, 'mlp_size_3': 4, 'kernel': 'LogLogistic', 'loss_name': 'NLLLoss'}. Best is trial 425 with value: 0.7401473255243529.[0m
[32m[I 2022-04-19 13:04:35,920][0m Trial 440 finished with value: 0.7289189952743543 and parameters: {'n_hidden': 2048, 'mixture_components': 1, 'use_sparse_layer': True, 'use_sparse_loss': False, 'use_batchnorm': False, 'use_dropout': True, 'dropout': 0.41546637826436145, 'mlp_size_1': 0, 'mlp_size_2': 4, 'mlp_size_3': 4, 'kernel': 'Exponential', 'loss_name': 'NLLLoss'}. Best is trial 425 with value: 0.7401473255243529.[0m
[32m[I 2022-04-19 13:06:40,806][0m Trial 441 finished with value: 0.6920529840076719 and parameters: {'n_hidden': 2048, 'mixture_components': 1, 'use_sparse_layer': True, 'use_sparse_loss': False, 'use_batchnorm': False, 'use_dropout': True, 'dropout': 0.42878766557815595, 'mlp_size_1': 0, 'mlp_size_2': 4, 'mlp_size_3': 4, 'kernel': 'Exponential', 'loss_name': 'NLLLoss'}. Best is trial 425 with value: 0.7401473255243529.[0m
[32m[I 2022-04-19 13:08:42,091][0m Trial 442 finished with value: 0.7099140490089916 and parameters: {'n_hidden': 2048, 'mixture_components': 1, 'use_sparse_layer': True, 'use_sparse_loss': False, 'use_batchnorm': False, 'use_dropout': True, 'dropout': 0.4111452445661792, 'mlp_size_1': 0, 'mlp_size_2': 5, 'mlp_size_3': 3, 'kernel': 'Exponential', 'loss_name': 'NLLLoss'}. Best is trial 425 with value: 0.7401473255243529.[0m
[32m[I 2022-04-19 13:10:38,978][0m Trial 443 finished with value: 0.7093716134282994 and parameters: {'n_hidden': 2048, 'mixture_components': 2, 'use_sparse_layer': True, 'use_sparse_loss': False, 'use_batchnorm': False, 'use_dropout': True, 'dropout': 0.44982389082526947, 'mlp_size_1': 0, 'mlp_size_2': 4, 'mlp_size_3': 4, 'kernel': 'Exponential', 'loss_name': 'NLLLoss'}. Best is trial 425 with value: 0.7401473255243529.[0m
[32m[I 2022-04-19 13:12:47,126][0m Trial 444 finished with value: 0.6254662483316576 and parameters: {'n_hidden': 2048, 'mixture_components': 1, 'use_sparse_layer': True, 'use_sparse_loss': False, 'use_batchnorm': False, 'use_dropout': True, 'dropout': 0.418157138192976, 'mlp_size_1': 0, 'mlp_size_2': 4, 'mlp_size_3': 4, 'kernel': 'Normal', 'loss_name': 'NLLLoss'}. Best is trial 425 with value: 0.7401473255243529.[0m
[32m[I 2022-04-19 13:14:57,906][0m Trial 445 finished with value: 0.7174902027282292 and parameters: {'n_hidden': 2048, 'mixture_components': 1, 'use_sparse_layer': True, 'use_sparse_loss': False, 'use_batchnorm': False, 'use_dropout': True, 'dropout': 0.39891496228524925, 'mlp_size_1': 0, 'mlp_size_2': 4, 'mlp_size_3': 4, 'kernel': 'Exponential', 'loss_name': 'NLLLoss'}. Best is trial 425 with value: 0.7401473255243529.[0m
[32m[I 2022-04-19 13:16:59,677][0m Trial 446 finished with value: 0.7213131690531518 and parameters: {'n_hidden': 2048, 'mixture_components': 1, 'use_sparse_layer': True, 'use_sparse_loss': False, 'use_batchnorm': False, 'use_dropout': True, 'dropout': 0.4406120316349057, 'mlp_size_1': 0, 'mlp_size_2': 5, 'mlp_size_3': 3, 'kernel': 'Exponential', 'loss_name': 'NLLLoss'}. Best is trial 425 with value: 0.7401473255243529.[0m
[32m[I 2022-04-19 13:18:40,343][0m Trial 447 finished with value: 0.705635334800415 and parameters: {'n_hidden': 2048, 'mixture_components': 1, 'use_sparse_layer': True, 'use_sparse_loss': False, 'use_batchnorm': False, 'use_dropout': True, 'dropout': 0.47088414879174345, 'mlp_size_1': 1, 'mlp_size_2': 4, 'mlp_size_3': 3, 'kernel': 'Exponential', 'loss_name': 'NLLLoss'}. Best is trial 425 with value: 0.7401473255243529.[0m
[32m[I 2022-04-19 13:21:11,051][0m Trial 448 finished with value: 0.6676674428460136 and parameters: {'n_hidden': 2048, 'mixture_components': 1, 'use_sparse_layer': True, 'use_sparse_loss': False, 'use_batchnorm': False, 'use_dropout': True, 'dropout': 0.424814421714925, 'mlp_size_1': 0, 'mlp_size_2': 4, 'mlp_size_3': 4, 'kernel': 'Gumbel', 'loss_name': 'NLLLoss'}. Best is trial 425 with value: 0.7401473255243529.[0m
[32m[I 2022-04-19 13:23:14,616][0m Trial 449 finished with value: 0.6545349467342773 and parameters: {'n_hidden': 2048, 'mixture_components': 1, 'use_sparse_layer': True, 'use_sparse_loss': False, 'use_batchnorm': False, 'use_dropout': True, 'dropout': 0.36121792646559336, 'mlp_size_1': 0, 'mlp_size_2': 4, 'mlp_size_3': 4, 'kernel': 'Weibull', 'loss_name': 'NLLLoss'}. Best is trial 425 with value: 0.7401473255243529.[0m
[32m[I 2022-04-19 13:25:14,739][0m Trial 450 finished with value: 0.7099753772067455 and parameters: {'n_hidden': 2048, 'mixture_components': 1, 'use_sparse_layer': True, 'use_sparse_loss': False, 'use_batchnorm': False, 'use_dropout': True, 'dropout': 0.38619654317792773, 'mlp_size_1': 1, 'mlp_size_2': 5, 'mlp_size_3': 2, 'kernel': 'Exponential', 'loss_name': 'NLLLoss'}. Best is trial 425 with value: 0.7401473255243529.[0m
[32m[I 2022-04-19 13:27:15,033][0m Trial 451 finished with value: 0.7229347506673609 and parameters: {'n_hidden': 2048, 'mixture_components': 2, 'use_sparse_layer': True, 'use_sparse_loss': False, 'use_batchnorm': False, 'use_dropout': True, 'dropout': 0.41094309748205937, 'mlp_size_1': 0, 'mlp_size_2': 4, 'mlp_size_3': 4, 'kernel': 'Exponential', 'loss_name': 'NLLLoss'}. Best is trial 425 with value: 0.7401473255243529.[0m
[32m[I 2022-04-19 13:29:55,089][0m Trial 452 finished with value: 0.6999698223365824 and parameters: {'n_hidden': 2048, 'mixture_components': 2, 'use_sparse_layer': True, 'use_sparse_loss': False, 'use_batchnorm': False, 'use_dropout': True, 'dropout': 0.4022820401502203, 'mlp_size_1': 0, 'mlp_size_2': 4, 'mlp_size_3': 4, 'kernel': 'Logistic', 'loss_name': 'NLLLoss'}. Best is trial 425 with value: 0.7401473255243529.[0m
[32m[I 2022-04-19 13:32:25,849][0m Trial 453 finished with value: 0.6141699697104677 and parameters: {'n_hidden': 128, 'mixture_components': 2, 'use_sparse_layer': True, 'use_sparse_loss': False, 'use_batchnorm': False, 'use_dropout': True, 'dropout': 0.4218147676365169, 'mlp_size_1': 0, 'mlp_size_2': 4, 'mlp_size_3': 0, 'kernel': 'Exponential', 'loss_name': 'NLLLoss'}. Best is trial 425 with value: 0.7401473255243529.[0m
[32m[I 2022-04-19 13:34:26,887][0m Trial 454 finished with value: 0.626218289286101 and parameters: {'n_hidden': 2048, 'mixture_components': 2, 'use_sparse_layer': True, 'use_sparse_loss': False, 'use_batchnorm': False, 'use_dropout': True, 'dropout': 0.44682444284550993, 'mlp_size_1': 0, 'mlp_size_2': 6, 'mlp_size_3': 2, 'kernel': 'LogNormal', 'loss_name': 'NLLLoss'}. Best is trial 425 with value: 0.7401473255243529.[0m
[32m[I 2022-04-19 13:36:24,960][0m Trial 455 finished with value: 0.7018445083793027 and parameters: {'n_hidden': 2048, 'mixture_components': 1, 'use_sparse_layer': True, 'use_sparse_loss': False, 'use_batchnorm': False, 'use_dropout': True, 'dropout': 0.4113012847338499, 'mlp_size_1': 0, 'mlp_size_2': 4, 'mlp_size_3': 4, 'kernel': 'Exponential', 'loss_name': 'NLLLoss'}. Best is trial 425 with value: 0.7401473255243529.[0m
[32m[I 2022-04-19 13:44:13,062][0m Trial 456 finished with value: 0.7288217764187996 and parameters: {'n_hidden': 2048, 'mixture_components': 1, 'use_sparse_layer': True, 'use_sparse_loss': False, 'use_batchnorm': True, 'use_dropout': True, 'dropout': 0.3891516836144522, 'mlp_size_1': 0, 'mlp_size_2': 4, 'mlp_size_3': 4, 'kernel': 'Exponential', 'loss_name': 'NLLLoss'}. Best is trial 425 with value: 0.7401473255243529.[0m
[32m[I 2022-04-19 13:50:45,366][0m Trial 457 finished with value: 0.7170516471826758 and parameters: {'n_hidden': 2048, 'mixture_components': 1, 'use_sparse_layer': True, 'use_sparse_loss': False, 'use_batchnorm': True, 'use_dropout': True, 'dropout': 0.3761902554695285, 'mlp_size_1': 0, 'mlp_size_2': 4, 'mlp_size_3': 4, 'kernel': 'Exponential', 'loss_name': 'NLLLoss'}. Best is trial 425 with value: 0.7401473255243529.[0m
