[32m[I 2022-04-13 11:50:07,081][0m Trial 718 finished with value: 0.7309739795612015 and parameters: {'alpha': 2.3255062610477544, 'ties': 'efron'}. Best is trial 63 with value: 0.7309739795612015.[0m
[32m[I 2022-04-13 11:50:07,309][0m Trial 719 finished with value: 0.729697264326865 and parameters: {'alpha': 2.401901358008327, 'ties': 'breslow'}. Best is trial 63 with value: 0.7309739795612015.[0m
[32m[I 2022-04-13 11:50:07,664][0m Trial 720 finished with value: 0.718603491067715 and parameters: {'alpha': 4.466092098872032, 'ties': 'efron'}. Best is trial 63 with value: 0.7309739795612015.[0m
[32m[I 2022-04-13 11:50:08,483][0m Trial 721 finished with value: 0.7266489160330192 and parameters: {'alpha': 1.8411099131017588, 'ties': 'efron'}. Best is trial 63 with value: 0.7309739795612015.[0m
[32m[I 2022-04-13 11:50:08,748][0m Trial 722 finished with value: 0.7308171886403182 and parameters: {'alpha': 2.087986102931979, 'ties': 'efron'}. Best is trial 63 with value: 0.7309739795612015.[0m
[32m[I 2022-04-13 11:50:09,083][0m Trial 723 finished with value: 0.7296437365326369 and parameters: {'alpha': 2.1769292147586063, 'ties': 'efron'}. Best is trial 63 with value: 0.7309739795612015.[0m
[32m[I 2022-04-13 11:50:09,360][0m Trial 724 finished with value: 0.729697264326865 and parameters: {'alpha': 2.4595786906327737, 'ties': 'efron'}. Best is trial 63 with value: 0.7309739795612015.[0m
[32m[I 2022-04-13 11:50:09,531][0m Trial 725 finished with value: 0.729697264326865 and parameters: {'alpha': 2.5544422816890706, 'ties': 'efron'}. Best is trial 63 with value: 0.7309739795612015.[0m
[32m[I 2022-04-13 11:50:09,748][0m Trial 726 finished with value: 0.729697264326865 and parameters: {'alpha': 2.3904478925101733, 'ties': 'efron'}. Best is trial 63 with value: 0.7309739795612015.[0m
[32m[I 2022-04-13 11:50:09,967][0m Trial 727 finished with value: 0.729697264326865 and parameters: {'alpha': 2.3596412668064333, 'ties': 'efron'}. Best is trial 63 with value: 0.7309739795612015.[0m
[32m[I 2022-04-13 11:50:10,227][0m Trial 728 finished with value: 0.7286259651218314 and parameters: {'alpha': 2.202329338448648, 'ties': 'efron'}. Best is trial 63 with value: 0.7309739795612015.[0m
[32m[I 2022-04-13 11:50:10,602][0m Trial 729 finished with value: 0.7309739795612015 and parameters: {'alpha': 2.283636174122185, 'ties': 'efron'}. Best is trial 63 with value: 0.7309739795612015.[0m
[32m[I 2022-04-13 11:50:10,974][0m Trial 730 finished with value: 0.7308171886403182 and parameters: {'alpha': 2.0571327968846083, 'ties': 'efron'}. Best is trial 63 with value: 0.7309739795612015.[0m
[32m[I 2022-04-13 11:50:11,082][0m Trial 731 finished with value: 0.729697264326865 and parameters: {'alpha': 2.3321271742171272, 'ties': 'efron'}. Best is trial 63 with value: 0.7309739795612015.[0m
[32m[I 2022-04-13 11:50:11,355][0m Trial 732 finished with value: 0.7273847447125952 and parameters: {'alpha': 1.667015192930514, 'ties': 'efron'}. Best is trial 63 with value: 0.7309739795612015.[0m
[32m[I 2022-04-13 11:50:11,612][0m Trial 733 finished with value: 0.7286259651218314 and parameters: {'alpha': 2.1942774690799505, 'ties': 'efron'}. Best is trial 63 with value: 0.7309739795612015.[0m
[32m[I 2022-04-13 11:50:11,824][0m Trial 734 finished with value: 0.729697264326865 and parameters: {'alpha': 2.492530421055304, 'ties': 'efron'}. Best is trial 63 with value: 0.7309739795612015.[0m
[32m[I 2022-04-13 11:50:12,128][0m Trial 735 finished with value: 0.7309739795612015 and parameters: {'alpha': 2.28728917290483, 'ties': 'efron'}. Best is trial 63 with value: 0.7309739795612015.[0m
[32m[I 2022-04-13 11:50:12,540][0m Trial 736 finished with value: 0.729697264326865 and parameters: {'alpha': 2.4191813448490063, 'ties': 'efron'}. Best is trial 63 with value: 0.7309739795612015.[0m
[32m[I 2022-04-13 11:50:13,065][0m Trial 737 finished with value: 0.7295404734059817 and parameters: {'alpha': 2.1068581491819, 'ties': 'efron'}. Best is trial 63 with value: 0.7309739795612015.[0m
[32m[I 2022-04-13 11:50:13,615][0m Trial 738 finished with value: 0.7309739795612015 and parameters: {'alpha': 2.3339378417286047, 'ties': 'breslow'}. Best is trial 63 with value: 0.7309739795612015.[0m
[32m[I 2022-04-13 11:50:13,960][0m Trial 739 finished with value: 0.7244971311842501 and parameters: {'alpha': 2.7013273402502507, 'ties': 'breslow'}. Best is trial 63 with value: 0.7309739795612015.[0m
[32m[I 2022-04-13 11:50:14,210][0m Trial 740 finished with value: 0.7286259651218314 and parameters: {'alpha': 2.2372997059945177, 'ties': 'efron'}. Best is trial 63 with value: 0.7309739795612015.[0m
[32m[I 2022-04-13 11:50:14,493][0m Trial 741 finished with value: 0.7260307422860457 and parameters: {'alpha': 1.4628722223770265, 'ties': 'efron'}. Best is trial 63 with value: 0.7309739795612015.[0m
[32m[I 2022-04-13 11:50:14,691][0m Trial 742 finished with value: 0.7295857840574091 and parameters: {'alpha': 1.9693969637821063, 'ties': 'efron'}. Best is trial 63 with value: 0.7309739795612015.[0m
[32m[I 2022-04-13 11:50:14,919][0m Trial 743 finished with value: 0.7286259651218314 and parameters: {'alpha': 2.246660417165471, 'ties': 'efron'}. Best is trial 63 with value: 0.7309739795612015.[0m
[32m[I 2022-04-13 11:50:15,126][0m Trial 744 finished with value: 0.729697264326865 and parameters: {'alpha': 2.531572100199148, 'ties': 'efron'}. Best is trial 63 with value: 0.7309739795612015.[0m
[32m[I 2022-04-13 11:50:15,315][0m Trial 745 finished with value: 0.7283670212983004 and parameters: {'alpha': 2.1215093561420613, 'ties': 'efron'}. Best is trial 63 with value: 0.7309739795612015.[0m
[32m[I 2022-04-13 11:50:15,546][0m Trial 746 finished with value: 0.729697264326865 and parameters: {'alpha': 2.342625167076062, 'ties': 'efron'}. Best is trial 63 with value: 0.7309739795612015.[0m
[32m[I 2022-04-13 11:50:15,796][0m Trial 747 finished with value: 0.729697264326865 and parameters: {'alpha': 2.3884468225194735, 'ties': 'efron'}. Best is trial 63 with value: 0.7309739795612015.[0m
[32m[I 2022-04-13 11:50:16,026][0m Trial 748 finished with value: 0.7286259651218314 and parameters: {'alpha': 2.241546558843336, 'ties': 'efron'}. Best is trial 63 with value: 0.7309739795612015.[0m
[32m[I 2022-04-13 11:50:16,259][0m Trial 749 finished with value: 0.7309739795612015 and parameters: {'alpha': 2.298458300438914, 'ties': 'efron'}. Best is trial 63 with value: 0.7309739795612015.[0m
[32m[I 2022-04-13 11:50:16,588][0m Trial 750 finished with value: 0.7296437365326369 and parameters: {'alpha': 2.147563864259078, 'ties': 'efron'}. Best is trial 63 with value: 0.7309739795612015.[0m
[32m[I 2022-04-13 11:50:16,875][0m Trial 751 finished with value: 0.729697264326865 and parameters: {'alpha': 2.46660360845868, 'ties': 'efron'}. Best is trial 63 with value: 0.7309739795612015.[0m
[32m[I 2022-04-13 11:50:17,173][0m Trial 752 finished with value: 0.7308171886403182 and parameters: {'alpha': 2.0190933201662884, 'ties': 'efron'}. Best is trial 63 with value: 0.7309739795612015.[0m
[32m[I 2022-04-13 11:50:17,464][0m Trial 753 finished with value: 0.729697264326865 and parameters: {'alpha': 2.4391049313251867, 'ties': 'efron'}. Best is trial 63 with value: 0.7309739795612015.[0m
[32m[I 2022-04-13 11:50:17,558][0m Trial 754 finished with value: 0.7309739795612015 and parameters: {'alpha': 2.29970177826148, 'ties': 'efron'}. Best is trial 63 with value: 0.7309739795612015.[0m
[32m[I 2022-04-13 11:50:17,710][0m Trial 755 finished with value: 0.7296437365326369 and parameters: {'alpha': 2.137478108258717, 'ties': 'efron'}. Best is trial 63 with value: 0.7309739795612015.[0m
[32m[I 2022-04-13 11:50:17,902][0m Trial 756 finished with value: 0.7286259651218314 and parameters: {'alpha': 2.190461156074765, 'ties': 'efron'}. Best is trial 63 with value: 0.7309739795612015.[0m
[32m[I 2022-04-13 11:50:18,025][0m Trial 757 finished with value: 0.729697264326865 and parameters: {'alpha': 2.625193667136897, 'ties': 'efron'}. Best is trial 63 with value: 0.7309739795612015.[0m
[32m[I 2022-04-13 11:50:18,130][0m Trial 758 finished with value: 0.7286259651218314 and parameters: {'alpha': 2.2246606536843037, 'ties': 'efron'}. Best is trial 63 with value: 0.7309739795612015.[0m
[32m[I 2022-04-13 11:50:18,241][0m Trial 759 finished with value: 0.7308171886403182 and parameters: {'alpha': 2.0625299822470553, 'ties': 'efron'}. Best is trial 63 with value: 0.7309739795612015.[0m
[32m[I 2022-04-13 11:50:18,379][0m Trial 760 finished with value: 0.729697264326865 and parameters: {'alpha': 2.40392919653321, 'ties': 'efron'}. Best is trial 63 with value: 0.7309739795612015.[0m
[32m[I 2022-04-13 11:50:18,545][0m Trial 761 finished with value: 0.7286259651218314 and parameters: {'alpha': 2.2723740626274718, 'ties': 'efron'}. Best is trial 63 with value: 0.7309739795612015.[0m
[32m[I 2022-04-13 11:50:18,696][0m Trial 762 finished with value: 0.729697264326865 and parameters: {'alpha': 2.5290792353330596, 'ties': 'efron'}. Best is trial 63 with value: 0.7309739795612015.[0m
[32m[I 2022-04-13 11:50:18,783][0m Trial 763 finished with value: 0.729697264326865 and parameters: {'alpha': 2.4664614746755062, 'ties': 'efron'}. Best is trial 63 with value: 0.7309739795612015.[0m
[32m[I 2022-04-13 11:50:18,951][0m Trial 764 finished with value: 0.729697264326865 and parameters: {'alpha': 2.375508701914222, 'ties': 'efron'}. Best is trial 63 with value: 0.7309739795612015.[0m
[32m[I 2022-04-13 11:50:19,113][0m Trial 765 finished with value: 0.729697264326865 and parameters: {'alpha': 2.593486477609007, 'ties': 'efron'}. Best is trial 63 with value: 0.7309739795612015.[0m
[32m[I 2022-04-13 11:50:19,208][0m Trial 766 finished with value: 0.729697264326865 and parameters: {'alpha': 2.4027075412416705, 'ties': 'efron'}. Best is trial 63 with value: 0.7309739795612015.[0m
[32m[I 2022-04-13 11:50:19,294][0m Trial 767 finished with value: 0.7309739795612015 and parameters: {'alpha': 2.313001788014893, 'ties': 'efron'}. Best is trial 63 with value: 0.7309739795612015.[0m
[32m[I 2022-04-13 11:50:19,414][0m Trial 768 finished with value: 0.729697264326865 and parameters: {'alpha': 2.502910431451012, 'ties': 'efron'}. Best is trial 63 with value: 0.7309739795612015.[0m
[32m[I 2022-04-13 11:50:19,605][0m Trial 769 finished with value: 0.7286259651218314 and parameters: {'alpha': 2.26357685258662, 'ties': 'breslow'}. Best is trial 63 with value: 0.7309739795612015.[0m
[32m[I 2022-04-13 11:50:19,750][0m Trial 770 finished with value: 0.729697264326865 and parameters: {'alpha': 2.3733147924218376, 'ties': 'breslow'}. Best is trial 63 with value: 0.7309739795612015.[0m
[32m[I 2022-04-13 11:50:19,931][0m Trial 771 finished with value: 0.7296437365326369 and parameters: {'alpha': 2.1674561506680377, 'ties': 'efron'}. Best is trial 63 with value: 0.7309739795612015.[0m
[32m[I 2022-04-13 11:50:20,273][0m Trial 772 finished with value: 0.7266957640961634 and parameters: {'alpha': 1.9419251505204915, 'ties': 'efron'}. Best is trial 63 with value: 0.7309739795612015.[0m
[32m[I 2022-04-13 11:50:20,517][0m Trial 773 finished with value: 0.729697264326865 and parameters: {'alpha': 2.35125946436567, 'ties': 'breslow'}. Best is trial 63 with value: 0.7309739795612015.[0m
[32m[I 2022-04-13 11:50:20,816][0m Trial 774 finished with value: 0.7286259651218314 and parameters: {'alpha': 2.250259963678136, 'ties': 'efron'}. Best is trial 63 with value: 0.7309739795612015.[0m
[32m[I 2022-04-13 11:50:21,010][0m Trial 775 finished with value: 0.7309739795612015 and parameters: {'alpha': 2.3008882923547445, 'ties': 'efron'}. Best is trial 63 with value: 0.7309739795612015.[0m
[32m[I 2022-04-13 11:50:21,143][0m Trial 776 finished with value: 0.729697264326865 and parameters: {'alpha': 2.518641801189964, 'ties': 'efron'}. Best is trial 63 with value: 0.7309739795612015.[0m
[32m[I 2022-04-13 11:50:21,239][0m Trial 777 finished with value: 0.7296437365326369 and parameters: {'alpha': 2.1765484778258606, 'ties': 'efron'}. Best is trial 63 with value: 0.7309739795612015.[0m
[32m[I 2022-04-13 11:50:21,418][0m Trial 778 finished with value: 0.729697264326865 and parameters: {'alpha': 2.3326869330967157, 'ties': 'efron'}. Best is trial 63 with value: 0.7309739795612015.[0m
[32m[I 2022-04-13 11:50:21,533][0m Trial 779 finished with value: 0.729697264326865 and parameters: {'alpha': 2.4434667072241454, 'ties': 'efron'}. Best is trial 63 with value: 0.7309739795612015.[0m
[32m[I 2022-04-13 11:50:21,629][0m Trial 780 finished with value: 0.7295404734059817 and parameters: {'alpha': 2.108158326178252, 'ties': 'efron'}. Best is trial 63 with value: 0.7309739795612015.[0m
[32m[I 2022-04-13 11:50:21,861][0m Trial 781 finished with value: 0.729697264326865 and parameters: {'alpha': 2.4437082820703337, 'ties': 'efron'}. Best is trial 63 with value: 0.7309739795612015.[0m
[32m[I 2022-04-13 11:50:22,012][0m Trial 782 finished with value: 0.7286259651218314 and parameters: {'alpha': 2.20423350193126, 'ties': 'efron'}. Best is trial 63 with value: 0.7309739795612015.[0m
[32m[I 2022-04-13 11:50:22,107][0m Trial 783 finished with value: 0.7308171886403182 and parameters: {'alpha': 2.029078341712281, 'ties': 'efron'}. Best is trial 63 with value: 0.7309739795612015.[0m
[32m[I 2022-04-13 11:50:22,277][0m Trial 784 finished with value: 0.7295404734059817 and parameters: {'alpha': 2.1009388444153094, 'ties': 'efron'}. Best is trial 63 with value: 0.7309739795612015.[0m
[32m[I 2022-04-13 11:50:22,517][0m Trial 785 finished with value: 0.7286259651218314 and parameters: {'alpha': 2.2774937627016145, 'ties': 'efron'}. Best is trial 63 with value: 0.7309739795612015.[0m
[32m[I 2022-04-13 11:50:22,720][0m Trial 786 finished with value: 0.726793213653711 and parameters: {'alpha': 2.6560629730713976, 'ties': 'breslow'}. Best is trial 63 with value: 0.7309739795612015.[0m
[32m[I 2022-04-13 11:50:23,016][0m Trial 787 finished with value: 0.7286259651218314 and parameters: {'alpha': 2.2678833941113385, 'ties': 'efron'}. Best is trial 63 with value: 0.7309739795612015.[0m
[32m[I 2022-04-13 11:50:23,235][0m Trial 788 finished with value: 0.729697264326865 and parameters: {'alpha': 2.3809888732996103, 'ties': 'efron'}. Best is trial 63 with value: 0.7309739795612015.[0m
[32m[I 2022-04-13 11:50:23,518][0m Trial 789 finished with value: 0.729697264326865 and parameters: {'alpha': 2.5409836339541805, 'ties': 'efron'}. Best is trial 63 with value: 0.7309739795612015.[0m
[32m[I 2022-04-13 11:50:23,868][0m Trial 790 finished with value: 0.7309739795612015 and parameters: {'alpha': 2.321381401961392, 'ties': 'efron'}. Best is trial 63 with value: 0.7309739795612015.[0m
[32m[I 2022-04-13 11:50:24,188][0m Trial 791 finished with value: 0.729697264326865 and parameters: {'alpha': 2.3577049089864333, 'ties': 'efron'}. Best is trial 63 with value: 0.7309739795612015.[0m
[32m[I 2022-04-13 11:50:24,469][0m Trial 792 finished with value: 0.729697264326865 and parameters: {'alpha': 2.479899262418172, 'ties': 'efron'}. Best is trial 63 with value: 0.7309739795612015.[0m
[32m[I 2022-04-13 11:50:24,563][0m Trial 793 finished with value: 0.7286259651218314 and parameters: {'alpha': 2.1900941820102666, 'ties': 'efron'}. Best is trial 63 with value: 0.7309739795612015.[0m
[32m[I 2022-04-13 11:50:24,911][0m Trial 794 finished with value: 0.729697264326865 and parameters: {'alpha': 2.5879127552085315, 'ties': 'efron'}. Best is trial 63 with value: 0.7309739795612015.[0m
[32m[I 2022-04-13 11:50:25,172][0m Trial 795 finished with value: 0.7296437365326369 and parameters: {'alpha': 2.169037122147042, 'ties': 'efron'}. Best is trial 63 with value: 0.7309739795612015.[0m
[32m[I 2022-04-13 11:50:25,429][0m Trial 796 finished with value: 0.7308171886403182 and parameters: {'alpha': 2.0068610861230343, 'ties': 'efron'}. Best is trial 63 with value: 0.7309739795612015.[0m
[32m[I 2022-04-13 11:50:25,687][0m Trial 797 finished with value: 0.7308171886403182 and parameters: {'alpha': 2.065620445120527, 'ties': 'breslow'}. Best is trial 63 with value: 0.7309739795612015.[0m
[32m[I 2022-04-13 11:50:25,997][0m Trial 798 finished with value: 0.7286259651218314 and parameters: {'alpha': 2.2428447270033707, 'ties': 'efron'}. Best is trial 63 with value: 0.7309739795612015.[0m
[32m[I 2022-04-13 11:50:26,156][0m Trial 799 finished with value: 0.729697264326865 and parameters: {'alpha': 2.357348661349588, 'ties': 'breslow'}. Best is trial 63 with value: 0.7309739795612015.[0m
[32m[I 2022-04-13 11:50:26,248][0m Trial 800 finished with value: 0.729697264326865 and parameters: {'alpha': 2.4030038037738404, 'ties': 'efron'}. Best is trial 63 with value: 0.7309739795612015.[0m
[32m[I 2022-04-13 11:50:26,359][0m Trial 801 finished with value: 0.729697264326865 and parameters: {'alpha': 2.4768958945075017, 'ties': 'efron'}. Best is trial 63 with value: 0.7309739795612015.[0m
[32m[I 2022-04-13 11:50:26,452][0m Trial 802 finished with value: 0.7246019901352241 and parameters: {'alpha': 2.732741535010619, 'ties': 'efron'}. Best is trial 63 with value: 0.7309739795612015.[0m
[32m[I 2022-04-13 11:50:26,563][0m Trial 803 finished with value: 0.729697264326865 and parameters: {'alpha': 2.3431003465717755, 'ties': 'efron'}. Best is trial 63 with value: 0.7309739795612015.[0m
[32m[I 2022-04-13 11:50:26,651][0m Trial 804 finished with value: 0.7309739795612015 and parameters: {'alpha': 2.282926946639253, 'ties': 'efron'}. Best is trial 63 with value: 0.7309739795612015.[0m
[32m[I 2022-04-13 11:50:26,745][0m Trial 805 finished with value: 0.7266489160330192 and parameters: {'alpha': 1.8601571954597753, 'ties': 'efron'}. Best is trial 63 with value: 0.7309739795612015.[0m
[32m[I 2022-04-13 11:50:26,931][0m Trial 806 finished with value: 0.7283670212983004 and parameters: {'alpha': 2.1424925463993114, 'ties': 'breslow'}. Best is trial 63 with value: 0.7309739795612015.[0m
[32m[I 2022-04-13 11:50:27,205][0m Trial 807 finished with value: 0.718114847207829 and parameters: {'alpha': 4.159548826862952, 'ties': 'efron'}. Best is trial 63 with value: 0.7309739795612015.[0m
[32m[I 2022-04-13 11:50:27,420][0m Trial 808 finished with value: 0.7186666226443832 and parameters: {'alpha': 0.3859187104202717, 'ties': 'breslow'}. Best is trial 63 with value: 0.7309739795612015.[0m
[32m[I 2022-04-13 11:50:27,637][0m Trial 809 finished with value: 0.7273492498874949 and parameters: {'alpha': 2.183847638147834, 'ties': 'breslow'}. Best is trial 63 with value: 0.7309739795612015.[0m
[32m[I 2022-04-13 11:50:27,867][0m Trial 810 finished with value: 0.7308171886403182 and parameters: {'alpha': 2.093462440388392, 'ties': 'breslow'}. Best is trial 63 with value: 0.7309739795612015.[0m
[32m[I 2022-04-13 11:50:28,063][0m Trial 811 finished with value: 0.729697264326865 and parameters: {'alpha': 2.4285513846327125, 'ties': 'efron'}. Best is trial 63 with value: 0.7309739795612015.[0m
[32m[I 2022-04-13 11:50:28,151][0m Trial 812 finished with value: 0.7309739795612015 and parameters: {'alpha': 2.3217634472797446, 'ties': 'efron'}. Best is trial 63 with value: 0.7309739795612015.[0m
[32m[I 2022-04-13 11:50:28,265][0m Trial 813 finished with value: 0.729697264326865 and parameters: {'alpha': 2.4877210581536984, 'ties': 'efron'}. Best is trial 63 with value: 0.7309739795612015.[0m
[32m[I 2022-04-13 11:50:28,359][0m Trial 814 finished with value: 0.7309739795612015 and parameters: {'alpha': 2.285192961317193, 'ties': 'efron'}. Best is trial 63 with value: 0.7309739795612015.[0m
[32m[I 2022-04-13 11:50:28,458][0m Trial 815 finished with value: 0.7286259651218314 and parameters: {'alpha': 2.203681105618992, 'ties': 'efron'}. Best is trial 63 with value: 0.7309739795612015.[0m
[32m[I 2022-04-13 11:50:28,550][0m Trial 816 finished with value: 0.7286259651218314 and parameters: {'alpha': 2.2497228443777395, 'ties': 'efron'}. Best is trial 63 with value: 0.7309739795612015.[0m
[32m[I 2022-04-13 11:50:28,652][0m Trial 817 finished with value: 0.7308171886403182 and parameters: {'alpha': 1.9808678152051198, 'ties': 'efron'}. Best is trial 63 with value: 0.7309739795612015.[0m
[32m[I 2022-04-13 11:50:28,867][0m Trial 818 finished with value: 0.729697264326865 and parameters: {'alpha': 2.388643760741199, 'ties': 'breslow'}. Best is trial 63 with value: 0.7309739795612015.[0m
[32m[I 2022-04-13 11:50:29,156][0m Trial 819 finished with value: 0.729697264326865 and parameters: {'alpha': 2.5672761290743566, 'ties': 'efron'}. Best is trial 63 with value: 0.7309739795612015.[0m
[32m[I 2022-04-13 11:50:29,386][0m Trial 820 finished with value: 0.7309739795612015 and parameters: {'alpha': 2.283132300419817, 'ties': 'efron'}. Best is trial 63 with value: 0.7309739795612015.[0m
[32m[I 2022-04-13 11:50:29,561][0m Trial 821 finished with value: 0.7295404734059817 and parameters: {'alpha': 2.1041002809762483, 'ties': 'efron'}. Best is trial 63 with value: 0.7309739795612015.[0m
[32m[I 2022-04-13 11:50:29,732][0m Trial 822 finished with value: 0.729697264326865 and parameters: {'alpha': 2.4326130434673288, 'ties': 'breslow'}. Best is trial 63 with value: 0.7309739795612015.[0m
[32m[I 2022-04-13 11:50:29,873][0m Trial 823 finished with value: 0.729697264326865 and parameters: {'alpha': 2.3744953188351574, 'ties': 'breslow'}. Best is trial 63 with value: 0.7309739795612015.[0m
[32m[I 2022-04-13 11:50:30,343][0m Trial 824 finished with value: 0.729697264326865 and parameters: {'alpha': 2.62045797007212, 'ties': 'efron'}. Best is trial 63 with value: 0.7309739795612015.[0m
[32m[I 2022-04-13 11:50:30,707][0m Trial 825 finished with value: 0.7286259651218314 and parameters: {'alpha': 2.2130542878773536, 'ties': 'efron'}. Best is trial 63 with value: 0.7309739795612015.[0m
