[32m[I 2022-04-13 11:46:47,563][0m Trial 856 finished with value: 0.8654085943201592 and parameters: {'alpha': 2.034419400224956, 'ties': 'efron'}. Best is trial 99 with value: 0.8654869897806009.[0m
[32m[I 2022-04-13 11:46:47,800][0m Trial 857 finished with value: 0.8648486321634327 and parameters: {'alpha': 2.3516709423466384, 'ties': 'breslow'}. Best is trial 99 with value: 0.8654869897806009.[0m
[32m[I 2022-04-13 11:46:48,158][0m Trial 858 finished with value: 0.8636746249437476 and parameters: {'alpha': 2.207087311314613, 'ties': 'breslow'}. Best is trial 99 with value: 0.8654869897806009.[0m
[32m[I 2022-04-13 11:46:48,542][0m Trial 859 finished with value: 0.8643129825609158 and parameters: {'alpha': 2.2409580319056874, 'ties': 'breslow'}. Best is trial 99 with value: 0.8654869897806009.[0m
[32m[I 2022-04-13 11:46:48,739][0m Trial 860 finished with value: 0.8648218682663185 and parameters: {'alpha': 2.1402020552439454, 'ties': 'efron'}. Best is trial 99 with value: 0.8654869897806009.[0m
[32m[I 2022-04-13 11:46:48,931][0m Trial 861 finished with value: 0.8654085943201592 and parameters: {'alpha': 1.9894044774794455, 'ties': 'efron'}. Best is trial 99 with value: 0.8654869897806009.[0m
[32m[I 2022-04-13 11:46:49,073][0m Trial 862 finished with value: 0.8643129825609158 and parameters: {'alpha': 2.2444296091641376, 'ties': 'efron'}. Best is trial 99 with value: 0.8654869897806009.[0m
[32m[I 2022-04-13 11:46:49,173][0m Trial 863 finished with value: 0.8643129825609158 and parameters: {'alpha': 2.2187257993274656, 'ties': 'breslow'}. Best is trial 99 with value: 0.8654869897806009.[0m
[32m[I 2022-04-13 11:46:49,271][0m Trial 864 finished with value: 0.8641835106491502 and parameters: {'alpha': 2.11006547869844, 'ties': 'breslow'}. Best is trial 99 with value: 0.8654869897806009.[0m
[32m[I 2022-04-13 11:46:49,360][0m Trial 865 finished with value: 0.8648486321634327 and parameters: {'alpha': 2.430881539988624, 'ties': 'breslow'}. Best is trial 99 with value: 0.8654869897806009.[0m
[32m[I 2022-04-13 11:46:49,573][0m Trial 866 finished with value: 0.8639833328806962 and parameters: {'alpha': 2.6385713666499515, 'ties': 'breslow'}. Best is trial 99 with value: 0.8654869897806009.[0m
[32m[I 2022-04-13 11:46:49,698][0m Trial 867 finished with value: 0.8654869897806009 and parameters: {'alpha': 2.2867739786340606, 'ties': 'efron'}. Best is trial 99 with value: 0.8654869897806009.[0m
[32m[I 2022-04-13 11:46:49,800][0m Trial 868 finished with value: 0.8648486321634327 and parameters: {'alpha': 2.5208244246018365, 'ties': 'breslow'}. Best is trial 99 with value: 0.8654869897806009.[0m
[32m[I 2022-04-13 11:46:50,002][0m Trial 869 finished with value: 0.8654869897806009 and parameters: {'alpha': 2.3238942917763654, 'ties': 'breslow'}. Best is trial 99 with value: 0.8654869897806009.[0m
[32m[I 2022-04-13 11:46:50,225][0m Trial 870 finished with value: 0.8648486321634327 and parameters: {'alpha': 2.407055282986791, 'ties': 'breslow'}. Best is trial 99 with value: 0.8654869897806009.[0m
[32m[I 2022-04-13 11:46:50,466][0m Trial 871 finished with value: 0.8639111840703502 and parameters: {'alpha': 1.7812237348841231, 'ties': 'breslow'}. Best is trial 99 with value: 0.8654869897806009.[0m
[32m[I 2022-04-13 11:46:50,672][0m Trial 872 finished with value: 0.8648218682663185 and parameters: {'alpha': 2.1806091454756538, 'ties': 'efron'}. Best is trial 99 with value: 0.8654869897806009.[0m
[32m[I 2022-04-13 11:46:50,970][0m Trial 873 finished with value: 0.8654869897806009 and parameters: {'alpha': 2.3171170243093018, 'ties': 'breslow'}. Best is trial 99 with value: 0.8654869897806009.[0m
[32m[I 2022-04-13 11:46:51,163][0m Trial 874 finished with value: 0.8648486321634327 and parameters: {'alpha': 2.5115559229113678, 'ties': 'breslow'}. Best is trial 99 with value: 0.8654869897806009.[0m
[32m[I 2022-04-13 11:46:51,341][0m Trial 875 finished with value: 0.8648486321634327 and parameters: {'alpha': 2.424498448833432, 'ties': 'breslow'}. Best is trial 99 with value: 0.8654869897806009.[0m
[32m[I 2022-04-13 11:46:51,518][0m Trial 876 finished with value: 0.8648486321634327 and parameters: {'alpha': 2.3767682586297076, 'ties': 'breslow'}. Best is trial 99 with value: 0.8654869897806009.[0m
[32m[I 2022-04-13 11:46:51,805][0m Trial 877 finished with value: 0.8654085943201592 and parameters: {'alpha': 2.0528997526939334, 'ties': 'efron'}. Best is trial 99 with value: 0.8654869897806009.[0m
[32m[I 2022-04-13 11:46:51,976][0m Trial 878 finished with value: 0.8643129825609158 and parameters: {'alpha': 2.2257015898391805, 'ties': 'breslow'}. Best is trial 99 with value: 0.8654869897806009.[0m
[32m[I 2022-04-13 11:46:52,072][0m Trial 879 finished with value: 0.8641835106491502 and parameters: {'alpha': 2.1785626694432696, 'ties': 'breslow'}. Best is trial 99 with value: 0.8654869897806009.[0m
[32m[I 2022-04-13 11:46:52,164][0m Trial 880 finished with value: 0.8639833328806962 and parameters: {'alpha': 2.5991958098322696, 'ties': 'breslow'}. Best is trial 99 with value: 0.8654869897806009.[0m
[32m[I 2022-04-13 11:46:52,263][0m Trial 881 finished with value: 0.8643129825609158 and parameters: {'alpha': 2.274862318049199, 'ties': 'breslow'}. Best is trial 99 with value: 0.8654869897806009.[0m
[32m[I 2022-04-13 11:46:52,559][0m Trial 882 finished with value: 0.8648486321634327 and parameters: {'alpha': 2.387706606341892, 'ties': 'breslow'}. Best is trial 99 with value: 0.8654869897806009.[0m
[32m[I 2022-04-13 11:46:53,003][0m Trial 883 finished with value: 0.8654869897806009 and parameters: {'alpha': 2.34192294604477, 'ties': 'breslow'}. Best is trial 99 with value: 0.8654869897806009.[0m
[32m[I 2022-04-13 11:46:53,463][0m Trial 884 finished with value: 0.8639833328806962 and parameters: {'alpha': 2.5294786066542145, 'ties': 'breslow'}. Best is trial 99 with value: 0.8654869897806009.[0m
[32m[I 2022-04-13 11:46:53,610][0m Trial 885 finished with value: 0.8641835106491502 and parameters: {'alpha': 2.121041426987063, 'ties': 'breslow'}. Best is trial 99 with value: 0.8654869897806009.[0m
[32m[I 2022-04-13 11:46:53,749][0m Trial 886 finished with value: 0.8654085943201592 and parameters: {'alpha': 1.9810666601707316, 'ties': 'efron'}. Best is trial 99 with value: 0.8654869897806009.[0m
[32m[I 2022-04-13 11:46:54,048][0m Trial 887 finished with value: 0.8648486321634327 and parameters: {'alpha': 2.45973870966653, 'ties': 'breslow'}. Best is trial 99 with value: 0.8654869897806009.[0m
[32m[I 2022-04-13 11:46:54,259][0m Trial 888 finished with value: 0.8643129825609158 and parameters: {'alpha': 2.2479088580367277, 'ties': 'breslow'}. Best is trial 99 with value: 0.8654869897806009.[0m
[32m[I 2022-04-13 11:46:54,536][0m Trial 889 finished with value: 0.8654869897806009 and parameters: {'alpha': 2.3312134926073558, 'ties': 'breslow'}. Best is trial 99 with value: 0.8654869897806009.[0m
[32m[I 2022-04-13 11:46:54,750][0m Trial 890 finished with value: 0.8648486321634327 and parameters: {'alpha': 2.390388969409556, 'ties': 'breslow'}. Best is trial 99 with value: 0.8654869897806009.[0m
[32m[I 2022-04-13 11:46:54,940][0m Trial 891 finished with value: 0.8641835106491502 and parameters: {'alpha': 2.1659378394429996, 'ties': 'breslow'}. Best is trial 99 with value: 0.8654869897806009.[0m
[32m[I 2022-04-13 11:46:55,304][0m Trial 892 finished with value: 0.862248565592125 and parameters: {'alpha': 2.6999421132908146, 'ties': 'breslow'}. Best is trial 99 with value: 0.8654869897806009.[0m
[32m[I 2022-04-13 11:46:55,633][0m Trial 893 finished with value: 0.8648486321634327 and parameters: {'alpha': 2.514183116262224, 'ties': 'breslow'}. Best is trial 99 with value: 0.8654869897806009.[0m
[32m[I 2022-04-13 11:46:56,052][0m Trial 894 finished with value: 0.8643129825609158 and parameters: {'alpha': 2.2456757117549864, 'ties': 'efron'}. Best is trial 99 with value: 0.8654869897806009.[0m
[32m[I 2022-04-13 11:46:56,340][0m Trial 895 finished with value: 0.8654869897806009 and parameters: {'alpha': 2.3171346633231362, 'ties': 'breslow'}. Best is trial 99 with value: 0.8654869897806009.[0m
[32m[I 2022-04-13 11:46:56,724][0m Trial 896 finished with value: 0.8648486321634327 and parameters: {'alpha': 2.4411968042988987, 'ties': 'breslow'}. Best is trial 99 with value: 0.8654869897806009.[0m
[32m[I 2022-04-13 11:46:57,007][0m Trial 897 finished with value: 0.8654085943201592 and parameters: {'alpha': 2.0891500487122876, 'ties': 'efron'}. Best is trial 99 with value: 0.8654869897806009.[0m
[32m[I 2022-04-13 11:46:57,121][0m Trial 898 finished with value: 0.8654869897806009 and parameters: {'alpha': 2.320811709501282, 'ties': 'efron'}. Best is trial 99 with value: 0.8654869897806009.[0m
[32m[I 2022-04-13 11:46:57,460][0m Trial 899 finished with value: 0.8648218682663185 and parameters: {'alpha': 2.186339457814977, 'ties': 'efron'}. Best is trial 99 with value: 0.8654869897806009.[0m
[32m[I 2022-04-13 11:46:57,779][0m Trial 900 finished with value: 0.8639833328806962 and parameters: {'alpha': 2.5859547549006328, 'ties': 'breslow'}. Best is trial 99 with value: 0.8654869897806009.[0m
[32m[I 2022-04-13 11:46:58,146][0m Trial 901 finished with value: 0.8654869897806009 and parameters: {'alpha': 2.3301608595532715, 'ties': 'breslow'}. Best is trial 99 with value: 0.8654869897806009.[0m
[32m[I 2022-04-13 11:46:58,462][0m Trial 902 finished with value: 0.8648486321634327 and parameters: {'alpha': 2.3845068820276034, 'ties': 'breslow'}. Best is trial 99 with value: 0.8654869897806009.[0m
[32m[I 2022-04-13 11:46:58,722][0m Trial 903 finished with value: 0.8648486321634327 and parameters: {'alpha': 2.4628039080734543, 'ties': 'breslow'}. Best is trial 99 with value: 0.8654869897806009.[0m
[32m[I 2022-04-13 11:46:59,093][0m Trial 904 finished with value: 0.8648486321634327 and parameters: {'alpha': 2.4944976248190605, 'ties': 'breslow'}. Best is trial 99 with value: 0.8654869897806009.[0m
[32m[I 2022-04-13 11:46:59,373][0m Trial 905 finished with value: 0.8643129825609158 and parameters: {'alpha': 2.257483491187161, 'ties': 'breslow'}. Best is trial 99 with value: 0.8654869897806009.[0m
[32m[I 2022-04-13 11:46:59,678][0m Trial 906 finished with value: 0.8648218682663185 and parameters: {'alpha': 2.1518178504821934, 'ties': 'efron'}. Best is trial 99 with value: 0.8654869897806009.[0m
[32m[I 2022-04-13 11:46:59,787][0m Trial 907 finished with value: 0.8643129825609158 and parameters: {'alpha': 2.27834692951603, 'ties': 'breslow'}. Best is trial 99 with value: 0.8654869897806009.[0m
[32m[I 2022-04-13 11:46:59,930][0m Trial 908 finished with value: 0.863038795174595 and parameters: {'alpha': 1.4988667257862744, 'ties': 'efron'}. Best is trial 99 with value: 0.8654869897806009.[0m
[32m[I 2022-04-13 11:47:00,281][0m Trial 909 finished with value: 0.8648486321634327 and parameters: {'alpha': 2.335112206582735, 'ties': 'efron'}. Best is trial 99 with value: 0.8654869897806009.[0m
[32m[I 2022-04-13 11:47:00,430][0m Trial 910 finished with value: 0.8627574512975278 and parameters: {'alpha': 2.6640694554340887, 'ties': 'breslow'}. Best is trial 99 with value: 0.8654869897806009.[0m
[32m[I 2022-04-13 11:47:00,555][0m Trial 911 finished with value: 0.8643129825609158 and parameters: {'alpha': 2.235642243023098, 'ties': 'breslow'}. Best is trial 99 with value: 0.8654869897806009.[0m
[32m[I 2022-04-13 11:47:00,732][0m Trial 912 finished with value: 0.8633478820480818 and parameters: {'alpha': 1.9186160846973594, 'ties': 'efron'}. Best is trial 99 with value: 0.8654869897806009.[0m
[32m[I 2022-04-13 11:47:01,021][0m Trial 913 finished with value: 0.8648486321634327 and parameters: {'alpha': 2.408209725186765, 'ties': 'breslow'}. Best is trial 99 with value: 0.8654869897806009.[0m
[32m[I 2022-04-13 11:47:01,266][0m Trial 914 finished with value: 0.8641835106491502 and parameters: {'alpha': 2.1077023954578307, 'ties': 'breslow'}. Best is trial 99 with value: 0.8654869897806009.[0m
[32m[I 2022-04-13 11:47:01,597][0m Trial 915 finished with value: 0.8654869897806009 and parameters: {'alpha': 2.3142178625729954, 'ties': 'breslow'}. Best is trial 99 with value: 0.8654869897806009.[0m
[32m[I 2022-04-13 11:47:01,797][0m Trial 916 finished with value: 0.8639833328806962 and parameters: {'alpha': 2.52897774287998, 'ties': 'breslow'}. Best is trial 99 with value: 0.8654869897806009.[0m
[32m[I 2022-04-13 11:47:02,005][0m Trial 917 finished with value: 0.8643129825609158 and parameters: {'alpha': 2.2378463038851417, 'ties': 'breslow'}. Best is trial 99 with value: 0.8654869897806009.[0m
[32m[I 2022-04-13 11:47:02,290][0m Trial 918 finished with value: 0.8654085943201592 and parameters: {'alpha': 2.034906021585836, 'ties': 'efron'}. Best is trial 99 with value: 0.8654869897806009.[0m
[32m[I 2022-04-13 11:47:02,547][0m Trial 919 finished with value: 0.8648486321634327 and parameters: {'alpha': 2.405151142313779, 'ties': 'breslow'}. Best is trial 99 with value: 0.8654869897806009.[0m
[32m[I 2022-04-13 11:47:02,698][0m Trial 920 finished with value: 0.8654085943201592 and parameters: {'alpha': 2.089350595254867, 'ties': 'breslow'}. Best is trial 99 with value: 0.8654869897806009.[0m
[32m[I 2022-04-13 11:47:02,801][0m Trial 921 finished with value: 0.8648486321634327 and parameters: {'alpha': 2.4382528141996347, 'ties': 'breslow'}. Best is trial 99 with value: 0.8654869897806009.[0m
[32m[I 2022-04-13 11:47:03,282][0m Trial 922 finished with value: 0.8636746249437476 and parameters: {'alpha': 2.1901059432080863, 'ties': 'breslow'}. Best is trial 99 with value: 0.8654869897806009.[0m
[32m[I 2022-04-13 11:47:03,458][0m Trial 923 finished with value: 0.8643129825609158 and parameters: {'alpha': 2.2768416481482183, 'ties': 'efron'}. Best is trial 99 with value: 0.8654869897806009.[0m
[32m[I 2022-04-13 11:47:03,884][0m Trial 924 finished with value: 0.858436446251121 and parameters: {'alpha': 4.398841558715318, 'ties': 'breslow'}. Best is trial 99 with value: 0.8654869897806009.[0m
[32m[I 2022-04-13 11:47:04,097][0m Trial 925 finished with value: 0.8648486321634327 and parameters: {'alpha': 2.4689821045089655, 'ties': 'breslow'}. Best is trial 99 with value: 0.8654869897806009.[0m
[32m[I 2022-04-13 11:47:04,285][0m Trial 926 finished with value: 0.8648218682663185 and parameters: {'alpha': 2.160689847760506, 'ties': 'efron'}. Best is trial 99 with value: 0.8654869897806009.[0m
[32m[I 2022-04-13 11:47:04,431][0m Trial 927 finished with value: 0.8639833328806962 and parameters: {'alpha': 2.593183921620473, 'ties': 'breslow'}. Best is trial 99 with value: 0.8654869897806009.[0m
[32m[I 2022-04-13 11:47:04,755][0m Trial 928 finished with value: 0.8648486321634327 and parameters: {'alpha': 2.3773302172138426, 'ties': 'breslow'}. Best is trial 99 with value: 0.8654869897806009.[0m
[32m[I 2022-04-13 11:47:04,986][0m Trial 929 finished with value: 0.8648486321634327 and parameters: {'alpha': 2.3953613925677826, 'ties': 'breslow'}. Best is trial 99 with value: 0.8654869897806009.[0m
[32m[I 2022-04-13 11:47:05,447][0m Trial 930 finished with value: 0.8643129825609158 and parameters: {'alpha': 2.230078383706861, 'ties': 'breslow'}. Best is trial 99 with value: 0.8654869897806009.[0m
[32m[I 2022-04-13 11:47:05,654][0m Trial 931 finished with value: 0.8643129825609158 and parameters: {'alpha': 2.2708993259104213, 'ties': 'breslow'}. Best is trial 99 with value: 0.8654869897806009.[0m
[32m[I 2022-04-13 11:47:06,044][0m Trial 932 finished with value: 0.8654085943201592 and parameters: {'alpha': 1.9985337020240403, 'ties': 'efron'}. Best is trial 99 with value: 0.8654869897806009.[0m
[32m[I 2022-04-13 11:47:06,347][0m Trial 933 finished with value: 0.8654869897806009 and parameters: {'alpha': 2.331379125553554, 'ties': 'breslow'}. Best is trial 99 with value: 0.8654869897806009.[0m
[32m[I 2022-04-13 11:47:06,588][0m Trial 934 finished with value: 0.8639833328806962 and parameters: {'alpha': 2.5412336172929937, 'ties': 'breslow'}. Best is trial 99 with value: 0.8654869897806009.[0m
[32m[I 2022-04-13 11:47:06,877][0m Trial 935 finished with value: 0.8647702367029909 and parameters: {'alpha': 2.0962179248686055, 'ties': 'efron'}. Best is trial 99 with value: 0.8654869897806009.[0m
[32m[I 2022-04-13 11:47:07,118][0m Trial 936 finished with value: 0.8648486321634327 and parameters: {'alpha': 2.4332895843705944, 'ties': 'breslow'}. Best is trial 99 with value: 0.8654869897806009.[0m
[32m[I 2022-04-13 11:47:07,233][0m Trial 937 finished with value: 0.8628877211214527 and parameters: {'alpha': 2.7704850913056545, 'ties': 'breslow'}. Best is trial 99 with value: 0.8654869897806009.[0m
[32m[I 2022-04-13 11:47:07,354][0m Trial 938 finished with value: 0.8654869897806009 and parameters: {'alpha': 2.3438090138825505, 'ties': 'breslow'}. Best is trial 99 with value: 0.8654869897806009.[0m
[32m[I 2022-04-13 11:47:07,661][0m Trial 939 finished with value: 0.8639833328806962 and parameters: {'alpha': 2.6065319664943893, 'ties': 'breslow'}. Best is trial 99 with value: 0.8654869897806009.[0m
[32m[I 2022-04-13 11:47:07,943][0m Trial 940 finished with value: 0.8648486321634327 and parameters: {'alpha': 2.4966394688942257, 'ties': 'breslow'}. Best is trial 99 with value: 0.8654869897806009.[0m
[32m[I 2022-04-13 11:47:08,352][0m Trial 941 finished with value: 0.8636746249437476 and parameters: {'alpha': 2.193130585860437, 'ties': 'breslow'}. Best is trial 99 with value: 0.8654869897806009.[0m
[32m[I 2022-04-13 11:47:08,504][0m Trial 942 finished with value: 0.8648486321634327 and parameters: {'alpha': 2.3502903160538064, 'ties': 'breslow'}. Best is trial 99 with value: 0.8654869897806009.[0m
[32m[I 2022-04-13 11:47:08,678][0m Trial 943 finished with value: 0.8648486321634327 and parameters: {'alpha': 2.4718623481900037, 'ties': 'breslow'}. Best is trial 99 with value: 0.8654869897806009.[0m
[32m[I 2022-04-13 11:47:08,916][0m Trial 944 finished with value: 0.8643129825609158 and parameters: {'alpha': 2.2713620820245737, 'ties': 'breslow'}. Best is trial 99 with value: 0.8654869897806009.[0m
[32m[I 2022-04-13 11:47:09,302][0m Trial 945 finished with value: 0.8648486321634327 and parameters: {'alpha': 2.3647305674830412, 'ties': 'efron'}. Best is trial 99 with value: 0.8654869897806009.[0m
[32m[I 2022-04-13 11:47:09,609][0m Trial 946 finished with value: 0.8639833328806962 and parameters: {'alpha': 2.5269636819220467, 'ties': 'breslow'}. Best is trial 99 with value: 0.8654869897806009.[0m
[32m[I 2022-04-13 11:47:09,973][0m Trial 947 finished with value: 0.8654869897806009 and parameters: {'alpha': 2.305855296927005, 'ties': 'breslow'}. Best is trial 99 with value: 0.8654869897806009.[0m
[32m[I 2022-04-13 11:47:10,198][0m Trial 948 finished with value: 0.8643129825609158 and parameters: {'alpha': 2.2931621861502864, 'ties': 'breslow'}. Best is trial 99 with value: 0.8654869897806009.[0m
[32m[I 2022-04-13 11:47:10,474][0m Trial 949 finished with value: 0.8625931915510595 and parameters: {'alpha': 0.7595715979337694, 'ties': 'efron'}. Best is trial 99 with value: 0.8654869897806009.[0m
[32m[I 2022-04-13 11:47:10,769][0m Trial 950 finished with value: 0.8648218682663185 and parameters: {'alpha': 2.1067184134945163, 'ties': 'breslow'}. Best is trial 99 with value: 0.8654869897806009.[0m
[32m[I 2022-04-13 11:47:11,071][0m Trial 951 finished with value: 0.8648486321634327 and parameters: {'alpha': 2.4348469031655675, 'ties': 'breslow'}. Best is trial 99 with value: 0.8654869897806009.[0m
[32m[I 2022-04-13 11:47:11,388][0m Trial 952 finished with value: 0.8648218682663185 and parameters: {'alpha': 2.1828657155612436, 'ties': 'efron'}. Best is trial 99 with value: 0.8654869897806009.[0m
[32m[I 2022-04-13 11:47:11,664][0m Trial 953 finished with value: 0.8643129825609158 and parameters: {'alpha': 2.198382357871243, 'ties': 'efron'}. Best is trial 99 with value: 0.8654869897806009.[0m
[32m[I 2022-04-13 11:47:11,882][0m Trial 954 finished with value: 0.8654085943201592 and parameters: {'alpha': 1.9917917381402455, 'ties': 'efron'}. Best is trial 99 with value: 0.8654869897806009.[0m
[32m[I 2022-04-13 11:47:12,056][0m Trial 955 finished with value: 0.8643129825609158 and parameters: {'alpha': 2.2882404060632533, 'ties': 'breslow'}. Best is trial 99 with value: 0.8654869897806009.[0m
[32m[I 2022-04-13 11:47:12,485][0m Trial 956 finished with value: 0.8648486321634327 and parameters: {'alpha': 2.36954256236525, 'ties': 'breslow'}. Best is trial 99 with value: 0.8654869897806009.[0m
[32m[I 2022-04-13 11:47:12,986][0m Trial 957 finished with value: 0.8643129825609158 and parameters: {'alpha': 2.228149254823247, 'ties': 'breslow'}. Best is trial 99 with value: 0.8654869897806009.[0m
[32m[I 2022-04-13 11:47:13,700][0m Trial 958 finished with value: 0.8581921243211781 and parameters: {'alpha': 4.0948552092555355, 'ties': 'breslow'}. Best is trial 99 with value: 0.8654869897806009.[0m
[32m[I 2022-04-13 11:47:14,064][0m Trial 959 finished with value: 0.8654085943201592 and parameters: {'alpha': 2.096536904389996, 'ties': 'breslow'}. Best is trial 99 with value: 0.8654869897806009.[0m
[32m[I 2022-04-13 11:47:14,369][0m Trial 960 finished with value: 0.8633966068268555 and parameters: {'alpha': 2.653201450139965, 'ties': 'breslow'}. Best is trial 99 with value: 0.8654869897806009.[0m
[32m[I 2022-04-13 11:47:14,767][0m Trial 961 finished with value: 0.8654869897806009 and parameters: {'alpha': 2.306227646074038, 'ties': 'breslow'}. Best is trial 99 with value: 0.8654869897806009.[0m
[32m[I 2022-04-13 11:47:15,103][0m Trial 962 finished with value: 0.8641835106491502 and parameters: {'alpha': 2.167972321087795, 'ties': 'breslow'}. Best is trial 99 with value: 0.8654869897806009.[0m
