[32m[I 2022-04-13 18:56:25,845][0m Trial 242 finished with value: 0.872665510637933 and parameters: {'loss': 'coxph', 'learning_rate': 0.003788325446981748, 'n_estimators': 1000, 'criterion': 'friedman_mse', 'min_samples_split': 3, 'min_samples_leaf': 6, 'min_weight_fraction_leaf': 0.10995790040218917, 'min_impurity_decrease': 0.30994000516279185, 'max_features': 0.9042132377421754, 'subsample': 0.7003609618362795, 'dropout_rate': 0.2558296218936118, 'ccp_alpha': 0.08742102600465297}. Best is trial 238 with value: 0.8755892337410869.[0m
[32m[I 2022-04-13 18:58:45,047][0m Trial 243 finished with value: 0.86992976020613 and parameters: {'loss': 'coxph', 'learning_rate': 0.004197253219554891, 'n_estimators': 923, 'criterion': 'friedman_mse', 'min_samples_split': 3, 'min_samples_leaf': 6, 'min_weight_fraction_leaf': 0.07365490146300714, 'min_impurity_decrease': 0.29933738539563287, 'max_features': 0.9029562915550439, 'subsample': 0.7003285449061057, 'dropout_rate': 0.27595885699027056, 'ccp_alpha': 0.0015566636609882472}. Best is trial 238 with value: 0.8755892337410869.[0m
[32m[I 2022-04-13 19:01:27,525][0m Trial 244 finished with value: 0.8666353933363904 and parameters: {'loss': 'coxph', 'learning_rate': 0.004718673077973861, 'n_estimators': 995, 'criterion': 'friedman_mse', 'min_samples_split': 3, 'min_samples_leaf': 6, 'min_weight_fraction_leaf': 0.07306879685857605, 'min_impurity_decrease': 0.3164405194869219, 'max_features': 0.9096026135530737, 'subsample': 0.6997522561220988, 'dropout_rate': 0.246215544414349, 'ccp_alpha': 0.09925151248395865}. Best is trial 238 with value: 0.8755892337410869.[0m
[32m[I 2022-04-13 19:03:53,156][0m Trial 245 finished with value: 0.867274548865718 and parameters: {'loss': 'coxph', 'learning_rate': 0.003503341363264863, 'n_estimators': 934, 'criterion': 'friedman_mse', 'min_samples_split': 3, 'min_samples_leaf': 6, 'min_weight_fraction_leaf': 0.05656487400835752, 'min_impurity_decrease': 0.2693406084037821, 'max_features': 0.9250119778685787, 'subsample': 0.7013937902337399, 'dropout_rate': 0.2739428929866862, 'ccp_alpha': 0.09917514781311063}. Best is trial 238 with value: 0.8755892337410869.[0m
[32m[I 2022-04-13 19:06:19,756][0m Trial 246 finished with value: 0.8513526507093525 and parameters: {'loss': 'coxph', 'learning_rate': 0.0041146410086106535, 'n_estimators': 919, 'criterion': 'friedman_mse', 'min_samples_split': 3, 'min_samples_leaf': 6, 'min_weight_fraction_leaf': 0.10533773306964933, 'min_impurity_decrease': 0.3055681131307789, 'max_features': 0.9639805883415732, 'subsample': 0.7086492114612646, 'dropout_rate': 0.24684748574457674, 'ccp_alpha': 0.19751325326596472}. Best is trial 238 with value: 0.8755892337410869.[0m
[32m[I 2022-04-13 19:09:32,217][0m Trial 247 finished with value: 0.870219695404983 and parameters: {'loss': 'coxph', 'learning_rate': 0.002686944483565218, 'n_estimators': 959, 'criterion': 'friedman_mse', 'min_samples_split': 3, 'min_samples_leaf': 6, 'min_weight_fraction_leaf': 0.08546301421699591, 'min_impurity_decrease': 0.2302480442142882, 'max_features': 0.9290671900556337, 'subsample': 0.6491271490773252, 'dropout_rate': 0.19659046471877117, 'ccp_alpha': 0.09170892116092805}. Best is trial 238 with value: 0.8755892337410869.[0m
[32m[I 2022-04-13 19:12:17,561][0m Trial 248 finished with value: 0.8688002757207773 and parameters: {'loss': 'coxph', 'learning_rate': 0.0031371652948708876, 'n_estimators': 899, 'criterion': 'friedman_mse', 'min_samples_split': 3, 'min_samples_leaf': 6, 'min_weight_fraction_leaf': 0.08673451811098343, 'min_impurity_decrease': 0.2317430402821449, 'max_features': 0.9345436003459361, 'subsample': 0.6475191701985822, 'dropout_rate': 0.19171845660218345, 'ccp_alpha': 0.10089272352184084}. Best is trial 238 with value: 0.8755892337410869.[0m
[32m[I 2022-04-13 19:15:34,366][0m Trial 249 finished with value: 0.8588421190040991 and parameters: {'loss': 'coxph', 'learning_rate': 0.0028544631559837544, 'n_estimators': 997, 'criterion': 'friedman_mse', 'min_samples_split': 3, 'min_samples_leaf': 5, 'min_weight_fraction_leaf': 0.06543388612813081, 'min_impurity_decrease': 0.34908832626882424, 'max_features': 0.9322387528425968, 'subsample': 0.6487302331250151, 'dropout_rate': 0.23524454803362707, 'ccp_alpha': 0.20251051730234398}. Best is trial 238 with value: 0.8755892337410869.[0m
[32m[I 2022-04-13 19:18:22,081][0m Trial 250 finished with value: 0.8691609353355174 and parameters: {'loss': 'coxph', 'learning_rate': 0.005700258420418845, 'n_estimators': 937, 'criterion': 'friedman_mse', 'min_samples_split': 3, 'min_samples_leaf': 6, 'min_weight_fraction_leaf': 0.1098906905892451, 'min_impurity_decrease': 0.22774096155980092, 'max_features': 0.897890972873154, 'subsample': 0.6451625092369114, 'dropout_rate': 0.1942829068775382, 'ccp_alpha': 0.10937396987356919}. Best is trial 238 with value: 0.8755892337410869.[0m
[32m[I 2022-04-13 19:20:55,288][0m Trial 251 finished with value: 0.8376562186062928 and parameters: {'loss': 'coxph', 'learning_rate': 0.0063434930461275275, 'n_estimators': 929, 'criterion': 'friedman_mse', 'min_samples_split': 3, 'min_samples_leaf': 6, 'min_weight_fraction_leaf': 0.10070378695430754, 'min_impurity_decrease': 0.22524630561508419, 'max_features': 0.901122412430447, 'subsample': 0.6432930688476381, 'dropout_rate': 0.32267321925998976, 'ccp_alpha': 0.2886210667495712}. Best is trial 238 with value: 0.8755892337410869.[0m
[32m[I 2022-04-13 19:23:24,432][0m Trial 252 finished with value: 0.65 and parameters: {'loss': 'coxph', 'learning_rate': 0.00551774342179453, 'n_estimators': 887, 'criterion': 'friedman_mse', 'min_samples_split': 3, 'min_samples_leaf': 6, 'min_weight_fraction_leaf': 0.11253110992127338, 'min_impurity_decrease': 0.29624518505184283, 'max_features': 0.9071373443590383, 'subsample': 0.7037221143096615, 'dropout_rate': 0.1961599705498505, 'ccp_alpha': 0.9194171387936272}. Best is trial 238 with value: 0.8755892337410869.[0m
[32m[I 2022-04-13 19:26:24,875][0m Trial 253 finished with value: 0.8682189278332928 and parameters: {'loss': 'coxph', 'learning_rate': 0.0036369726012355874, 'n_estimators': 938, 'criterion': 'friedman_mse', 'min_samples_split': 3, 'min_samples_leaf': 6, 'min_weight_fraction_leaf': 0.09063319234250958, 'min_impurity_decrease': 0.21020640642511132, 'max_features': 0.8921182247903507, 'subsample': 0.5951847580415217, 'dropout_rate': 0.19125686462449054, 'ccp_alpha': 0.12119610890512578}. Best is trial 238 with value: 0.8755892337410869.[0m
[32m[I 2022-04-13 19:29:19,375][0m Trial 254 finished with value: 0.8607466678710958 and parameters: {'loss': 'coxph', 'learning_rate': 0.003782241455280027, 'n_estimators': 920, 'criterion': 'friedman_mse', 'min_samples_split': 3, 'min_samples_leaf': 6, 'min_weight_fraction_leaf': 0.09966641291126536, 'min_impurity_decrease': 0.20664526725230936, 'max_features': 0.8895563741237396, 'subsample': 0.6501573384097789, 'dropout_rate': 0.19096708328608694, 'ccp_alpha': 0.18805622525255147}. Best is trial 238 with value: 0.8755892337410869.[0m
[32m[I 2022-04-13 19:32:07,766][0m Trial 255 finished with value: 0.8680713013909227 and parameters: {'loss': 'coxph', 'learning_rate': 0.004939959461310073, 'n_estimators': 958, 'criterion': 'friedman_mse', 'min_samples_split': 3, 'min_samples_leaf': 6, 'min_weight_fraction_leaf': 0.08636219474620349, 'min_impurity_decrease': 0.2732052563826926, 'max_features': 0.9063693253120403, 'subsample': 0.7040371209488054, 'dropout_rate': 0.27023511449508353, 'ccp_alpha': 0.11850479959470836}. Best is trial 238 with value: 0.8755892337410869.[0m
[32m[I 2022-04-13 19:34:50,476][0m Trial 256 finished with value: 0.8458127886333257 and parameters: {'loss': 'coxph', 'learning_rate': 0.007845020896865472, 'n_estimators': 958, 'criterion': 'friedman_mse', 'min_samples_split': 4, 'min_samples_leaf': 6, 'min_weight_fraction_leaf': 0.0708022731875129, 'min_impurity_decrease': 0.2735576582220976, 'max_features': 0.8988164187981054, 'subsample': 0.6048859836124346, 'dropout_rate': 0.28332698292145353, 'ccp_alpha': 0.3015355526337078}. Best is trial 238 with value: 0.8755892337410869.[0m
[32m[I 2022-04-13 19:37:14,573][0m Trial 257 finished with value: 0.8660599292400507 and parameters: {'loss': 'coxph', 'learning_rate': 0.004781853796618249, 'n_estimators': 889, 'criterion': 'friedman_mse', 'min_samples_split': 3, 'min_samples_leaf': 5, 'min_weight_fraction_leaf': 0.10383528786315836, 'min_impurity_decrease': 0.34258477018764066, 'max_features': 0.976014456625124, 'subsample': 0.7112527003244067, 'dropout_rate': 0.1962422522631915, 'ccp_alpha': 0.12491696476518148}. Best is trial 238 with value: 0.8755892337410869.[0m
[32m[I 2022-04-13 19:39:55,215][0m Trial 258 finished with value: 0.867807173610126 and parameters: {'loss': 'coxph', 'learning_rate': 0.0034610160968035664, 'n_estimators': 953, 'criterion': 'friedman_mse', 'min_samples_split': 3, 'min_samples_leaf': 6, 'min_weight_fraction_leaf': 0.08762731864442248, 'min_impurity_decrease': 0.26572696450580435, 'max_features': 0.8815153915597673, 'subsample': 0.6365612050425461, 'dropout_rate': 0.26607534006625455, 'ccp_alpha': 0.10758017255846629}. Best is trial 238 with value: 0.8755892337410869.[0m
[32m[I 2022-04-13 19:42:14,654][0m Trial 259 finished with value: 0.8513526507093525 and parameters: {'loss': 'coxph', 'learning_rate': 0.00564290155806962, 'n_estimators': 914, 'criterion': 'friedman_mse', 'min_samples_split': 3, 'min_samples_leaf': 6, 'min_weight_fraction_leaf': 0.11227876735399239, 'min_impurity_decrease': 0.28870107950642626, 'max_features': 0.924503299334934, 'subsample': 0.6997425571767317, 'dropout_rate': 0.3014282744581576, 'ccp_alpha': 0.1994035072654372}. Best is trial 238 with value: 0.8755892337410869.[0m
[32m[I 2022-04-13 19:44:35,585][0m Trial 260 finished with value: 0.8654612584098169 and parameters: {'loss': 'coxph', 'learning_rate': 0.004497036296767578, 'n_estimators': 874, 'criterion': 'friedman_mse', 'min_samples_split': 3, 'min_samples_leaf': 6, 'min_weight_fraction_leaf': 0.07328913451054558, 'min_impurity_decrease': 0.2555007030332413, 'max_features': 0.9113157980128346, 'subsample': 0.5836182944708822, 'dropout_rate': 0.24302061507821174, 'ccp_alpha': 0.12082859160974382}. Best is trial 238 with value: 0.8755892337410869.[0m
[32m[I 2022-04-13 19:47:36,298][0m Trial 261 finished with value: 0.8367532767450552 and parameters: {'loss': 'coxph', 'learning_rate': 0.0032874498468996607, 'n_estimators': 1000, 'criterion': 'friedman_mse', 'min_samples_split': 3, 'min_samples_leaf': 6, 'min_weight_fraction_leaf': 0.060746311509806805, 'min_impurity_decrease': 0.20729944141532822, 'max_features': 0.9250178615354536, 'subsample': 0.6523645494429883, 'dropout_rate': 0.18687380479018703, 'ccp_alpha': 0.302204293068474}. Best is trial 238 with value: 0.8755892337410869.[0m
[32m[I 2022-04-13 19:50:30,839][0m Trial 262 finished with value: 0.8664933658386695 and parameters: {'loss': 'coxph', 'learning_rate': 0.003909195554436212, 'n_estimators': 953, 'criterion': 'friedman_mse', 'min_samples_split': 3, 'min_samples_leaf': 6, 'min_weight_fraction_leaf': 0.08643905667625894, 'min_impurity_decrease': 0.26171633959033874, 'max_features': 0.8936637238989393, 'subsample': 0.6962438447772289, 'dropout_rate': 0.20472182657911978, 'ccp_alpha': 0.1098976452181688}. Best is trial 238 with value: 0.8755892337410869.[0m
[32m[I 2022-04-13 19:52:52,041][0m Trial 263 finished with value: -0.37215368889717826 and parameters: {'loss': 'squared', 'learning_rate': 0.0027008096312574345, 'n_estimators': 880, 'criterion': 'friedman_mse', 'min_samples_split': 3, 'min_samples_leaf': 6, 'min_weight_fraction_leaf': 0.09892775093083449, 'min_impurity_decrease': 0.23004366820570554, 'max_features': 0.976462161679611, 'subsample': 0.7174172183780166, 'dropout_rate': 0.24849831370602538, 'ccp_alpha': 0.19708904901920032}. Best is trial 238 with value: 0.8755892337410869.[0m
[32m[I 2022-04-13 19:55:27,589][0m Trial 264 finished with value: 0.868848405346772 and parameters: {'loss': 'coxph', 'learning_rate': 0.0102765340391378, 'n_estimators': 912, 'criterion': 'friedman_mse', 'min_samples_split': 3, 'min_samples_leaf': 6, 'min_weight_fraction_leaf': 0.1129740320214741, 'min_impurity_decrease': 0.23566328462627067, 'max_features': 0.9086396370638521, 'subsample': 0.6101281762087967, 'dropout_rate': 0.1895995906719249, 'ccp_alpha': 0.10093824351644141}. Best is trial 238 with value: 0.8755892337410869.[0m
[32m[I 2022-04-13 19:58:00,612][0m Trial 265 finished with value: 0.8388786876559013 and parameters: {'loss': 'coxph', 'learning_rate': 0.011478223467444364, 'n_estimators': 908, 'criterion': 'friedman_mse', 'min_samples_split': 3, 'min_samples_leaf': 5, 'min_weight_fraction_leaf': 0.11518485456594098, 'min_impurity_decrease': 0.32485946592244436, 'max_features': 0.8835024183938751, 'subsample': 0.6019769255358315, 'dropout_rate': 0.18397483314584673, 'ccp_alpha': 0.3299987153359682}. Best is trial 238 with value: 0.8755892337410869.[0m
[32m[I 2022-04-13 20:00:18,882][0m Trial 266 finished with value: 0.8676639670576167 and parameters: {'loss': 'coxph', 'learning_rate': 0.007140554244674609, 'n_estimators': 910, 'criterion': 'friedman_mse', 'min_samples_split': 3, 'min_samples_leaf': 6, 'min_weight_fraction_leaf': 0.051993835427872434, 'min_impurity_decrease': 0.30062999110982747, 'max_features': 0.9052074584403166, 'subsample': 0.6258502435245417, 'dropout_rate': 0.2810838111574831, 'ccp_alpha': 0.11090255402884427}. Best is trial 238 with value: 0.8755892337410869.[0m
[32m[I 2022-04-13 20:03:19,112][0m Trial 267 finished with value: 0.8616119671538323 and parameters: {'loss': 'coxph', 'learning_rate': 0.009113128415313181, 'n_estimators': 962, 'criterion': 'friedman_mse', 'min_samples_split': 4, 'min_samples_leaf': 6, 'min_weight_fraction_leaf': 0.07652377644388982, 'min_impurity_decrease': 0.27337223410260625, 'max_features': 0.9323154971434437, 'subsample': 0.6540629811688242, 'dropout_rate': 0.19317558271825075, 'ccp_alpha': 0.18965274621497577}. Best is trial 238 with value: 0.8755892337410869.[0m
[32m[I 2022-04-13 20:05:34,263][0m Trial 268 finished with value: 0.8682796693490712 and parameters: {'loss': 'coxph', 'learning_rate': 0.0031276009683913423, 'n_estimators': 874, 'criterion': 'friedman_mse', 'min_samples_split': 3, 'min_samples_leaf': 6, 'min_weight_fraction_leaf': 0.110813697912195, 'min_impurity_decrease': 0.24161087945120635, 'max_features': 0.9031654974943567, 'subsample': 0.6305090622763616, 'dropout_rate': 0.26294708220475893, 'ccp_alpha': 0.10175740069812737}. Best is trial 238 with value: 0.8755892337410869.[0m
[32m[I 2022-04-13 20:07:59,227][0m Trial 269 finished with value: 0.855164545333048 and parameters: {'loss': 'coxph', 'learning_rate': 0.0029608427661203807, 'n_estimators': 873, 'criterion': 'friedman_mse', 'min_samples_split': 4, 'min_samples_leaf': 6, 'min_weight_fraction_leaf': 0.10979367381199989, 'min_impurity_decrease': 0.19989542040823144, 'max_features': 0.8769222877978724, 'subsample': 0.611053032169933, 'dropout_rate': 0.20631145495220152, 'ccp_alpha': 0.2746739910861035}. Best is trial 238 with value: 0.8755892337410869.[0m
[32m[I 2022-04-13 20:10:19,511][0m Trial 270 finished with value: 0.8682864859887669 and parameters: {'loss': 'coxph', 'learning_rate': 0.0035524160478097766, 'n_estimators': 873, 'criterion': 'friedman_mse', 'min_samples_split': 3, 'min_samples_leaf': 6, 'min_weight_fraction_leaf': 0.10737818697357752, 'min_impurity_decrease': 0.2403004453735197, 'max_features': 0.937551133286357, 'subsample': 0.5542181014285052, 'dropout_rate': 0.23703864293326665, 'ccp_alpha': 0.09862410050021189}. Best is trial 238 with value: 0.8755892337410869.[0m
[32m[I 2022-04-13 20:12:38,273][0m Trial 271 finished with value: 0.865744000361811 and parameters: {'loss': 'coxph', 'learning_rate': 0.003113340668881686, 'n_estimators': 878, 'criterion': 'friedman_mse', 'min_samples_split': 3, 'min_samples_leaf': 6, 'min_weight_fraction_leaf': 0.11652427513763941, 'min_impurity_decrease': 0.24398622997911673, 'max_features': 0.9163875121550943, 'subsample': 0.5910206879703012, 'dropout_rate': 0.2514086481161754, 'ccp_alpha': 0.11792742930147167}. Best is trial 238 with value: 0.8755892337410869.[0m
[32m[I 2022-04-13 20:15:07,887][0m Trial 272 finished with value: 0.8592394372702916 and parameters: {'loss': 'coxph', 'learning_rate': 0.004021950881037712, 'n_estimators': 912, 'criterion': 'friedman_mse', 'min_samples_split': 3, 'min_samples_leaf': 6, 'min_weight_fraction_leaf': 0.10650410716704786, 'min_impurity_decrease': 0.21386911480691512, 'max_features': 0.8938047982546703, 'subsample': 0.6319303659612221, 'dropout_rate': 0.23015104917212426, 'ccp_alpha': 0.20984759851257112}. Best is trial 238 with value: 0.8755892337410869.[0m
[32m[I 2022-04-13 20:17:44,865][0m Trial 273 finished with value: 0.8689413369338418 and parameters: {'loss': 'coxph', 'learning_rate': 0.0026477891677197415, 'n_estimators': 923, 'criterion': 'friedman_mse', 'min_samples_split': 3, 'min_samples_leaf': 5, 'min_weight_fraction_leaf': 0.06698761883442741, 'min_impurity_decrease': 0.25909096475840265, 'max_features': 0.937508303134202, 'subsample': 0.6138131712478496, 'dropout_rate': 0.23645361175273397, 'ccp_alpha': 0.09899373539104699}. Best is trial 238 with value: 0.8755892337410869.[0m
[32m[I 2022-04-13 20:19:55,292][0m Trial 274 finished with value: 0.8328735505844829 and parameters: {'loss': 'coxph', 'learning_rate': 0.0025943709955411286, 'n_estimators': 872, 'criterion': 'friedman_mse', 'min_samples_split': 3, 'min_samples_leaf': 5, 'min_weight_fraction_leaf': 0.06488916785824814, 'min_impurity_decrease': 0.2570562944351231, 'max_features': 0.9363083435758036, 'subsample': 0.5577436426183499, 'dropout_rate': 0.2565437240162535, 'ccp_alpha': 0.347632315982527}. Best is trial 238 with value: 0.8755892337410869.[0m
[32m[I 2022-04-13 20:22:42,024][0m Trial 275 finished with value: 0.8699992711372058 and parameters: {'loss': 'coxph', 'learning_rate': 0.0025865170488484344, 'n_estimators': 993, 'criterion': 'friedman_mse', 'min_samples_split': 3, 'min_samples_leaf': 5, 'min_weight_fraction_leaf': 0.0737078942970671, 'min_impurity_decrease': 0.29179868818522137, 'max_features': 0.9254634419380361, 'subsample': 0.6404826849530075, 'dropout_rate': 0.23620372027117648, 'ccp_alpha': 0.09810610469081446}. Best is trial 238 with value: 0.8755892337410869.[0m
[32m[I 2022-04-13 20:25:37,704][0m Trial 276 finished with value: 0.8596807148011465 and parameters: {'loss': 'coxph', 'learning_rate': 0.002529511568076724, 'n_estimators': 982, 'criterion': 'friedman_mse', 'min_samples_split': 3, 'min_samples_leaf': 5, 'min_weight_fraction_leaf': 0.06856724281443052, 'min_impurity_decrease': 0.3229591979759752, 'max_features': 0.9646252119021801, 'subsample': 0.6424540152350483, 'dropout_rate': 0.2170245916711031, 'ccp_alpha': 0.22761961796558133}. Best is trial 238 with value: 0.8755892337410869.[0m
[32m[I 2022-04-13 20:28:00,212][0m Trial 277 finished with value: 0.8683145752899126 and parameters: {'loss': 'coxph', 'learning_rate': 0.0017007071812026717, 'n_estimators': 928, 'criterion': 'friedman_mse', 'min_samples_split': 3, 'min_samples_leaf': 5, 'min_weight_fraction_leaf': 0.07627797853805947, 'min_impurity_decrease': 0.2936930544267422, 'max_features': 0.935586894567508, 'subsample': 0.5762879574794482, 'dropout_rate': 0.31381253827675565, 'ccp_alpha': 0.10138360981899473}. Best is trial 238 with value: 0.8755892337410869.[0m
[32m[I 2022-04-13 20:30:43,263][0m Trial 278 finished with value: 0.8611167856048679 and parameters: {'loss': 'coxph', 'learning_rate': 0.0017473001857533745, 'n_estimators': 999, 'criterion': 'friedman_mse', 'min_samples_split': 3, 'min_samples_leaf': 5, 'min_weight_fraction_leaf': 0.0724096283421045, 'min_impurity_decrease': 0.29381156731096425, 'max_features': 0.9211621834192976, 'subsample': 0.6119255143954263, 'dropout_rate': 0.2890649348259929, 'ccp_alpha': 0.21085280542093007}. Best is trial 238 with value: 0.8755892337410869.[0m
[32m[I 2022-04-13 20:33:13,370][0m Trial 279 finished with value: 0.8673812145097586 and parameters: {'loss': 'coxph', 'learning_rate': 0.0016741346148384728, 'n_estimators': 924, 'criterion': 'friedman_mse', 'min_samples_split': 3, 'min_samples_leaf': 5, 'min_weight_fraction_leaf': 0.04676001012348161, 'min_impurity_decrease': 0.28534345846265513, 'max_features': 0.968789321060837, 'subsample': 0.5728891743763792, 'dropout_rate': 0.3128447625347598, 'ccp_alpha': 0.08899322722201682}. Best is trial 238 with value: 0.8755892337410869.[0m
[32m[I 2022-04-13 20:35:58,742][0m Trial 280 finished with value: 0.8685713329029093 and parameters: {'loss': 'coxph', 'learning_rate': 0.001855172581466632, 'n_estimators': 926, 'criterion': 'friedman_mse', 'min_samples_split': 3, 'min_samples_leaf': 5, 'min_weight_fraction_leaf': 0.05595049885555789, 'min_impurity_decrease': 0.30968705844647304, 'max_features': 0.9347775215560294, 'subsample': 0.6570246302895963, 'dropout_rate': 0.24068215549420313, 'ccp_alpha': 0.005050122136024137}. Best is trial 238 with value: 0.8755892337410869.[0m
[32m[I 2022-04-13 20:39:01,684][0m Trial 281 finished with value: -0.3699350873258849 and parameters: {'loss': 'squared', 'learning_rate': 0.0024667427760962234, 'n_estimators': 998, 'criterion': 'friedman_mse', 'min_samples_split': 3, 'min_samples_leaf': 5, 'min_weight_fraction_leaf': 0.08176396597709232, 'min_impurity_decrease': 0.33523212008419867, 'max_features': 0.9193439458444603, 'subsample': 0.6567346606878776, 'dropout_rate': 0.23911912466357743, 'ccp_alpha': 0.0894593420259106}. Best is trial 238 with value: 0.8755892337410869.[0m
