[32m[I 2022-04-13 11:48:54,421][0m Trial 394 finished with value: 0.7296437365326369 and parameters: {'alpha': 2.1586990684129015, 'ties': 'efron'}. Best is trial 63 with value: 0.7309739795612015.[0m
[32m[I 2022-04-13 11:48:54,650][0m Trial 395 finished with value: 0.7296437365326369 and parameters: {'alpha': 2.165969062090294, 'ties': 'efron'}. Best is trial 63 with value: 0.7309739795612015.[0m
[32m[I 2022-04-13 11:48:54,751][0m Trial 396 finished with value: 0.729697264326865 and parameters: {'alpha': 2.3303394070329166, 'ties': 'efron'}. Best is trial 63 with value: 0.7309739795612015.[0m
[32m[I 2022-04-13 11:48:54,841][0m Trial 397 finished with value: 0.729697264326865 and parameters: {'alpha': 2.451664033165725, 'ties': 'efron'}. Best is trial 63 with value: 0.7309739795612015.[0m
[32m[I 2022-04-13 11:48:54,948][0m Trial 398 finished with value: 0.7286259651218314 and parameters: {'alpha': 2.2290519250951757, 'ties': 'efron'}. Best is trial 63 with value: 0.7309739795612015.[0m
[32m[I 2022-04-13 11:48:55,121][0m Trial 399 finished with value: 0.729697264326865 and parameters: {'alpha': 2.513291101312274, 'ties': 'efron'}. Best is trial 63 with value: 0.7309739795612015.[0m
[32m[I 2022-04-13 11:48:55,327][0m Trial 400 finished with value: 0.729697264326865 and parameters: {'alpha': 2.379119209855813, 'ties': 'efron'}. Best is trial 63 with value: 0.7309739795612015.[0m
[32m[I 2022-04-13 11:48:55,467][0m Trial 401 finished with value: 0.7296437365326369 and parameters: {'alpha': 2.1297029989472454, 'ties': 'efron'}. Best is trial 63 with value: 0.7309739795612015.[0m
[32m[I 2022-04-13 11:48:55,658][0m Trial 402 finished with value: 0.7309739795612015 and parameters: {'alpha': 2.2844233618213217, 'ties': 'efron'}. Best is trial 63 with value: 0.7309739795612015.[0m
[32m[I 2022-04-13 11:48:55,856][0m Trial 403 finished with value: 0.729697264326865 and parameters: {'alpha': 2.476651286222706, 'ties': 'efron'}. Best is trial 63 with value: 0.7309739795612015.[0m
[32m[I 2022-04-13 11:48:56,024][0m Trial 404 finished with value: 0.7308171886403182 and parameters: {'alpha': 2.05096892855143, 'ties': 'efron'}. Best is trial 63 with value: 0.7309739795612015.[0m
[32m[I 2022-04-13 11:48:56,219][0m Trial 405 finished with value: 0.729697264326865 and parameters: {'alpha': 2.341322618433892, 'ties': 'efron'}. Best is trial 63 with value: 0.7309739795612015.[0m
[32m[I 2022-04-13 11:48:56,394][0m Trial 406 finished with value: 0.729697264326865 and parameters: {'alpha': 2.5548023535643622, 'ties': 'efron'}. Best is trial 63 with value: 0.7309739795612015.[0m
[32m[I 2022-04-13 11:48:56,743][0m Trial 407 finished with value: 0.7286259651218314 and parameters: {'alpha': 2.225245238132985, 'ties': 'efron'}. Best is trial 63 with value: 0.7309739795612015.[0m
[32m[I 2022-04-13 11:48:56,942][0m Trial 408 finished with value: 0.729697264326865 and parameters: {'alpha': 2.426764387982724, 'ties': 'efron'}. Best is trial 63 with value: 0.7309739795612015.[0m
[32m[I 2022-04-13 11:48:57,249][0m Trial 409 finished with value: 0.729697264326865 and parameters: {'alpha': 2.340903912846588, 'ties': 'efron'}. Best is trial 63 with value: 0.7309739795612015.[0m
[32m[I 2022-04-13 11:48:57,453][0m Trial 410 finished with value: 0.7286259651218314 and parameters: {'alpha': 2.224763572934886, 'ties': 'efron'}. Best is trial 63 with value: 0.7309739795612015.[0m
[32m[I 2022-04-13 11:48:57,600][0m Trial 411 finished with value: 0.7283670212983004 and parameters: {'alpha': 2.141999828112952, 'ties': 'breslow'}. Best is trial 63 with value: 0.7309739795612015.[0m
[32m[I 2022-04-13 11:48:57,864][0m Trial 412 finished with value: 0.7308171886403182 and parameters: {'alpha': 2.0000022088449976, 'ties': 'efron'}. Best is trial 63 with value: 0.7309739795612015.[0m
[32m[I 2022-04-13 11:48:58,106][0m Trial 413 finished with value: 0.7286259651218314 and parameters: {'alpha': 2.259259652671702, 'ties': 'efron'}. Best is trial 63 with value: 0.7309739795612015.[0m
[32m[I 2022-04-13 11:48:58,283][0m Trial 414 finished with value: 0.7266489160330192 and parameters: {'alpha': 1.8522533073482141, 'ties': 'efron'}. Best is trial 63 with value: 0.7309739795612015.[0m
[32m[I 2022-04-13 11:48:58,479][0m Trial 415 finished with value: 0.729697264326865 and parameters: {'alpha': 2.603622195211339, 'ties': 'efron'}. Best is trial 63 with value: 0.7309739795612015.[0m
[32m[I 2022-04-13 11:48:58,866][0m Trial 416 finished with value: 0.7309739795612015 and parameters: {'alpha': 2.2918640126155765, 'ties': 'efron'}. Best is trial 63 with value: 0.7309739795612015.[0m
[32m[I 2022-04-13 11:48:59,099][0m Trial 417 finished with value: 0.7295404734059817 and parameters: {'alpha': 2.101994428414883, 'ties': 'efron'}. Best is trial 63 with value: 0.7309739795612015.[0m
[32m[I 2022-04-13 11:48:59,303][0m Trial 418 finished with value: 0.729697264326865 and parameters: {'alpha': 2.4019365865926243, 'ties': 'efron'}. Best is trial 63 with value: 0.7309739795612015.[0m
[32m[I 2022-04-13 11:48:59,505][0m Trial 419 finished with value: 0.7309739795612015 and parameters: {'alpha': 2.313202450769168, 'ties': 'efron'}. Best is trial 63 with value: 0.7309739795612015.[0m
[32m[I 2022-04-13 11:48:59,694][0m Trial 420 finished with value: 0.729697264326865 and parameters: {'alpha': 2.4714922730497753, 'ties': 'efron'}. Best is trial 63 with value: 0.7309739795612015.[0m
[32m[I 2022-04-13 11:48:59,910][0m Trial 421 finished with value: 0.7286259651218314 and parameters: {'alpha': 2.1891437669187366, 'ties': 'efron'}. Best is trial 63 with value: 0.7309739795612015.[0m
[32m[I 2022-04-13 11:49:00,123][0m Trial 422 finished with value: 0.729697264326865 and parameters: {'alpha': 2.4165485673380784, 'ties': 'efron'}. Best is trial 63 with value: 0.7309739795612015.[0m
[32m[I 2022-04-13 11:49:00,418][0m Trial 423 finished with value: 0.7286259651218314 and parameters: {'alpha': 2.2085759592274945, 'ties': 'efron'}. Best is trial 63 with value: 0.7309739795612015.[0m
[32m[I 2022-04-13 11:49:00,603][0m Trial 424 finished with value: 0.7308171886403182 and parameters: {'alpha': 2.071824478730523, 'ties': 'efron'}. Best is trial 63 with value: 0.7309739795612015.[0m
[32m[I 2022-04-13 11:49:00,793][0m Trial 425 finished with value: 0.729697264326865 and parameters: {'alpha': 2.395961124399628, 'ties': 'efron'}. Best is trial 63 with value: 0.7309739795612015.[0m
[32m[I 2022-04-13 11:49:00,989][0m Trial 426 finished with value: 0.7309739795612015 and parameters: {'alpha': 2.3059720656288962, 'ties': 'efron'}. Best is trial 63 with value: 0.7309739795612015.[0m
[32m[I 2022-04-13 11:49:01,178][0m Trial 427 finished with value: 0.729697264326865 and parameters: {'alpha': 2.468502137682041, 'ties': 'efron'}. Best is trial 63 with value: 0.7309739795612015.[0m
[32m[I 2022-04-13 11:49:01,371][0m Trial 428 finished with value: 0.7296437365326369 and parameters: {'alpha': 2.1770308691880813, 'ties': 'efron'}. Best is trial 63 with value: 0.7309739795612015.[0m
[32m[I 2022-04-13 11:49:01,540][0m Trial 429 finished with value: 0.7279666657613922 and parameters: {'alpha': 2.545051291372192, 'ties': 'breslow'}. Best is trial 63 with value: 0.7309739795612015.[0m
[32m[I 2022-04-13 11:49:01,714][0m Trial 430 finished with value: 0.729697264326865 and parameters: {'alpha': 2.6423023056148294, 'ties': 'efron'}. Best is trial 63 with value: 0.7309739795612015.[0m
[32m[I 2022-04-13 11:49:01,920][0m Trial 431 finished with value: 0.7286259651218314 and parameters: {'alpha': 2.276361178903516, 'ties': 'efron'}. Best is trial 63 with value: 0.7309739795612015.[0m
[32m[I 2022-04-13 11:49:02,149][0m Trial 432 finished with value: 0.7295857840574091 and parameters: {'alpha': 1.9706773270763696, 'ties': 'efron'}. Best is trial 63 with value: 0.7309739795612015.[0m
[32m[I 2022-04-13 11:49:02,461][0m Trial 433 finished with value: 0.729697264326865 and parameters: {'alpha': 2.3696503679026026, 'ties': 'efron'}. Best is trial 63 with value: 0.7309739795612015.[0m
[32m[I 2022-04-13 11:49:02,659][0m Trial 434 finished with value: 0.7309739795612015 and parameters: {'alpha': 2.3109975772302365, 'ties': 'efron'}. Best is trial 63 with value: 0.7309739795612015.[0m
[32m[I 2022-04-13 11:49:02,745][0m Trial 435 finished with value: 0.7296437365326369 and parameters: {'alpha': 2.1700957456964485, 'ties': 'efron'}. Best is trial 63 with value: 0.7309739795612015.[0m
[32m[I 2022-04-13 11:49:02,976][0m Trial 436 finished with value: 0.7308171886403182 and parameters: {'alpha': 2.060022273780512, 'ties': 'efron'}. Best is trial 63 with value: 0.7309739795612015.[0m
[32m[I 2022-04-13 11:49:03,150][0m Trial 437 finished with value: 0.729697264326865 and parameters: {'alpha': 2.4993437318261185, 'ties': 'efron'}. Best is trial 63 with value: 0.7309739795612015.[0m
[32m[I 2022-04-13 11:49:03,235][0m Trial 438 finished with value: 0.7270537533015606 and parameters: {'alpha': 2.709811875417515, 'ties': 'efron'}. Best is trial 63 with value: 0.7309739795612015.[0m
[32m[I 2022-04-13 11:49:03,431][0m Trial 439 finished with value: 0.729697264326865 and parameters: {'alpha': 2.3477480080926827, 'ties': 'efron'}. Best is trial 63 with value: 0.7309739795612015.[0m
[32m[I 2022-04-13 11:49:03,628][0m Trial 440 finished with value: 0.7286259651218314 and parameters: {'alpha': 2.2308034022476733, 'ties': 'efron'}. Best is trial 63 with value: 0.7309739795612015.[0m
[32m[I 2022-04-13 11:49:03,983][0m Trial 441 finished with value: 0.729697264326865 and parameters: {'alpha': 2.413248648883386, 'ties': 'efron'}. Best is trial 63 with value: 0.7309739795612015.[0m
[32m[I 2022-04-13 11:49:04,283][0m Trial 442 finished with value: 0.7283670212983004 and parameters: {'alpha': 2.1259355902817045, 'ties': 'efron'}. Best is trial 63 with value: 0.7309739795612015.[0m
[32m[I 2022-04-13 11:49:04,553][0m Trial 443 finished with value: 0.7309739795612015 and parameters: {'alpha': 2.3250927346479284, 'ties': 'efron'}. Best is trial 63 with value: 0.7309739795612015.[0m
[32m[I 2022-04-13 11:49:05,013][0m Trial 444 finished with value: 0.729697264326865 and parameters: {'alpha': 2.484440401113234, 'ties': 'efron'}. Best is trial 63 with value: 0.7309739795612015.[0m
[32m[I 2022-04-13 11:49:05,334][0m Trial 445 finished with value: 0.729697264326865 and parameters: {'alpha': 2.3774226611789766, 'ties': 'efron'}. Best is trial 63 with value: 0.7309739795612015.[0m
[32m[I 2022-04-13 11:49:05,699][0m Trial 446 finished with value: 0.729697264326865 and parameters: {'alpha': 2.558777820115007, 'ties': 'efron'}. Best is trial 63 with value: 0.7309739795612015.[0m
[32m[I 2022-04-13 11:49:05,913][0m Trial 447 finished with value: 0.7286259651218314 and parameters: {'alpha': 2.243572762105418, 'ties': 'efron'}. Best is trial 63 with value: 0.7309739795612015.[0m
[32m[I 2022-04-13 11:49:06,259][0m Trial 448 finished with value: 0.7286259651218314 and parameters: {'alpha': 2.2336919849253745, 'ties': 'efron'}. Best is trial 63 with value: 0.7309739795612015.[0m
[32m[I 2022-04-13 11:49:06,502][0m Trial 449 finished with value: 0.7283670212983004 and parameters: {'alpha': 2.123447792837007, 'ties': 'breslow'}. Best is trial 63 with value: 0.7309739795612015.[0m
[32m[I 2022-04-13 11:49:06,830][0m Trial 450 finished with value: 0.7309739795612015 and parameters: {'alpha': 2.313173594118949, 'ties': 'efron'}. Best is trial 63 with value: 0.7309739795612015.[0m
[32m[I 2022-04-13 11:49:07,165][0m Trial 451 finished with value: 0.7286259651218314 and parameters: {'alpha': 2.263030776530925, 'ties': 'efron'}. Best is trial 63 with value: 0.7309739795612015.[0m
[32m[I 2022-04-13 11:49:07,327][0m Trial 452 finished with value: 0.7308171886403182 and parameters: {'alpha': 2.0276638638694093, 'ties': 'efron'}. Best is trial 63 with value: 0.7309739795612015.[0m
[32m[I 2022-04-13 11:49:07,554][0m Trial 453 finished with value: 0.7296437365326369 and parameters: {'alpha': 2.1625121749601677, 'ties': 'efron'}. Best is trial 63 with value: 0.7309739795612015.[0m
[32m[I 2022-04-13 11:49:08,012][0m Trial 454 finished with value: 0.729697264326865 and parameters: {'alpha': 2.425598116525393, 'ties': 'efron'}. Best is trial 63 with value: 0.7309739795612015.[0m
[32m[I 2022-04-13 11:49:08,350][0m Trial 455 finished with value: 0.7214960709270711 and parameters: {'alpha': 1.0815859261686922, 'ties': 'efron'}. Best is trial 63 with value: 0.7309739795612015.[0m
[32m[I 2022-04-13 11:49:08,702][0m Trial 456 finished with value: 0.7309739795612015 and parameters: {'alpha': 2.307187287921714, 'ties': 'efron'}. Best is trial 63 with value: 0.7309739795612015.[0m
[32m[I 2022-04-13 11:49:08,943][0m Trial 457 finished with value: 0.729697264326865 and parameters: {'alpha': 2.466101508239719, 'ties': 'efron'}. Best is trial 63 with value: 0.7309739795612015.[0m
[32m[I 2022-04-13 11:49:09,186][0m Trial 458 finished with value: 0.7286259651218314 and parameters: {'alpha': 2.224158681276819, 'ties': 'efron'}. Best is trial 63 with value: 0.7309739795612015.[0m
[32m[I 2022-04-13 11:49:09,364][0m Trial 459 finished with value: 0.729697264326865 and parameters: {'alpha': 2.363647503109034, 'ties': 'efron'}. Best is trial 63 with value: 0.7309739795612015.[0m
[32m[I 2022-04-13 11:49:09,613][0m Trial 460 finished with value: 0.729697264326865 and parameters: {'alpha': 2.603215920406843, 'ties': 'efron'}. Best is trial 63 with value: 0.7309739795612015.[0m
[32m[I 2022-04-13 11:49:09,851][0m Trial 461 finished with value: 0.7283670212983004 and parameters: {'alpha': 2.1116488777349036, 'ties': 'efron'}. Best is trial 63 with value: 0.7309739795612015.[0m
[32m[I 2022-04-13 11:49:10,202][0m Trial 462 finished with value: 0.7111528544815454 and parameters: {'alpha': 0.05127931903787841, 'ties': 'efron'}. Best is trial 63 with value: 0.7309739795612015.[0m
[32m[I 2022-04-13 11:49:10,680][0m Trial 463 finished with value: 0.729697264326865 and parameters: {'alpha': 2.4193340019182537, 'ties': 'efron'}. Best is trial 63 with value: 0.7309739795612015.[0m
[32m[I 2022-04-13 11:49:11,184][0m Trial 464 finished with value: 0.7309739795612015 and parameters: {'alpha': 2.308736558003644, 'ties': 'efron'}. Best is trial 63 with value: 0.7309739795612015.[0m
[32m[I 2022-04-13 11:49:11,501][0m Trial 465 finished with value: 0.729697264326865 and parameters: {'alpha': 2.35266130254209, 'ties': 'efron'}. Best is trial 63 with value: 0.7309739795612015.[0m
[32m[I 2022-04-13 11:49:11,792][0m Trial 466 finished with value: 0.729697264326865 and parameters: {'alpha': 2.5216330052780127, 'ties': 'efron'}. Best is trial 63 with value: 0.7309739795612015.[0m
[32m[I 2022-04-13 11:49:12,063][0m Trial 467 finished with value: 0.7286259651218314 and parameters: {'alpha': 2.196939178590699, 'ties': 'efron'}. Best is trial 63 with value: 0.7309739795612015.[0m
[32m[I 2022-04-13 11:49:12,285][0m Trial 468 finished with value: 0.7286259651218314 and parameters: {'alpha': 2.2699178185451943, 'ties': 'efron'}. Best is trial 63 with value: 0.7309739795612015.[0m
[32m[I 2022-04-13 11:49:12,420][0m Trial 469 finished with value: 0.7279271686790725 and parameters: {'alpha': 1.9388102042351083, 'ties': 'breslow'}. Best is trial 63 with value: 0.7309739795612015.[0m
[32m[I 2022-04-13 11:49:12,519][0m Trial 470 finished with value: 0.7309739795612015 and parameters: {'alpha': 2.2847324761192773, 'ties': 'efron'}. Best is trial 63 with value: 0.7309739795612015.[0m
[32m[I 2022-04-13 11:49:12,643][0m Trial 471 finished with value: 0.729697264326865 and parameters: {'alpha': 2.5237767363550327, 'ties': 'efron'}. Best is trial 63 with value: 0.7309739795612015.[0m
[32m[I 2022-04-13 11:49:12,781][0m Trial 472 finished with value: 0.729697264326865 and parameters: {'alpha': 2.406755062865293, 'ties': 'efron'}. Best is trial 63 with value: 0.7309739795612015.[0m
[32m[I 2022-04-13 11:49:12,914][0m Trial 473 finished with value: 0.729697264326865 and parameters: {'alpha': 2.4471546866704488, 'ties': 'efron'}. Best is trial 63 with value: 0.7309739795612015.[0m
[32m[I 2022-04-13 11:49:13,065][0m Trial 474 finished with value: 0.7295404734059817 and parameters: {'alpha': 2.104873849386174, 'ties': 'efron'}. Best is trial 63 with value: 0.7309739795612015.[0m
[32m[I 2022-04-13 11:49:13,170][0m Trial 475 finished with value: 0.729697264326865 and parameters: {'alpha': 2.3759030632356377, 'ties': 'efron'}. Best is trial 63 with value: 0.7309739795612015.[0m
[32m[I 2022-04-13 11:49:13,261][0m Trial 476 finished with value: 0.7286259651218314 and parameters: {'alpha': 2.1890993864826274, 'ties': 'efron'}. Best is trial 63 with value: 0.7309739795612015.[0m
[32m[I 2022-04-13 11:49:13,376][0m Trial 477 finished with value: 0.7286259651218314 and parameters: {'alpha': 2.237064359336534, 'ties': 'efron'}. Best is trial 63 with value: 0.7309739795612015.[0m
[32m[I 2022-04-13 11:49:13,478][0m Trial 478 finished with value: 0.7308171886403182 and parameters: {'alpha': 2.047850501098617, 'ties': 'efron'}. Best is trial 63 with value: 0.7309739795612015.[0m
[32m[I 2022-04-13 11:49:13,570][0m Trial 479 finished with value: 0.7286259651218314 and parameters: {'alpha': 2.2640748854400474, 'ties': 'efron'}. Best is trial 63 with value: 0.7309739795612015.[0m
[32m[I 2022-04-13 11:49:13,659][0m Trial 480 finished with value: 0.7296437365326369 and parameters: {'alpha': 2.137551147208384, 'ties': 'efron'}. Best is trial 63 with value: 0.7309739795612015.[0m
[32m[I 2022-04-13 11:49:13,777][0m Trial 481 finished with value: 0.7308171886403182 and parameters: {'alpha': 2.0188011199914704, 'ties': 'efron'}. Best is trial 63 with value: 0.7309739795612015.[0m
[32m[I 2022-04-13 11:49:13,945][0m Trial 482 finished with value: 0.7231351760438831 and parameters: {'alpha': 0.6131425344189736, 'ties': 'efron'}. Best is trial 63 with value: 0.7309739795612015.[0m
[32m[I 2022-04-13 11:49:14,202][0m Trial 483 finished with value: 0.729697264326865 and parameters: {'alpha': 2.5766480039209583, 'ties': 'efron'}. Best is trial 63 with value: 0.7309739795612015.[0m
[32m[I 2022-04-13 11:49:14,298][0m Trial 484 finished with value: 0.729697264326865 and parameters: {'alpha': 2.3360815549052454, 'ties': 'efron'}. Best is trial 63 with value: 0.7309739795612015.[0m
[32m[I 2022-04-13 11:49:14,543][0m Trial 485 finished with value: 0.729697264326865 and parameters: {'alpha': 2.4641139237725356, 'ties': 'efron'}. Best is trial 63 with value: 0.7309739795612015.[0m
[32m[I 2022-04-13 11:49:14,883][0m Trial 486 finished with value: 0.729697264326865 and parameters: {'alpha': 2.3575031418725927, 'ties': 'efron'}. Best is trial 63 with value: 0.7309739795612015.[0m
[32m[I 2022-04-13 11:49:15,163][0m Trial 487 finished with value: 0.7286259651218314 and parameters: {'alpha': 2.253233747868483, 'ties': 'efron'}. Best is trial 63 with value: 0.7309739795612015.[0m
[32m[I 2022-04-13 11:49:15,403][0m Trial 488 finished with value: 0.7283670212983004 and parameters: {'alpha': 2.1431062891259143, 'ties': 'breslow'}. Best is trial 63 with value: 0.7309739795612015.[0m
[32m[I 2022-04-13 11:49:15,597][0m Trial 489 finished with value: 0.7309739795612015 and parameters: {'alpha': 2.3205557287779386, 'ties': 'efron'}. Best is trial 63 with value: 0.7309739795612015.[0m
[32m[I 2022-04-13 11:49:15,727][0m Trial 490 finished with value: 0.7211132067092793 and parameters: {'alpha': 4.636378519465575, 'ties': 'efron'}. Best is trial 63 with value: 0.7309739795612015.[0m
[32m[I 2022-04-13 11:49:15,905][0m Trial 491 finished with value: 0.7285238122191837 and parameters: {'alpha': 2.670316156202749, 'ties': 'efron'}. Best is trial 63 with value: 0.7309739795612015.[0m
[32m[I 2022-04-13 11:49:16,122][0m Trial 492 finished with value: 0.7286259651218314 and parameters: {'alpha': 2.1925967589129063, 'ties': 'efron'}. Best is trial 63 with value: 0.7309739795612015.[0m
[32m[I 2022-04-13 11:49:16,343][0m Trial 493 finished with value: 0.729697264326865 and parameters: {'alpha': 2.4692779301086487, 'ties': 'efron'}. Best is trial 63 with value: 0.7309739795612015.[0m
[32m[I 2022-04-13 11:49:16,547][0m Trial 494 finished with value: 0.729697264326865 and parameters: {'alpha': 2.357588703009088, 'ties': 'efron'}. Best is trial 63 with value: 0.7309739795612015.[0m
[32m[I 2022-04-13 11:49:16,741][0m Trial 495 finished with value: 0.729697264326865 and parameters: {'alpha': 2.554513063742729, 'ties': 'efron'}. Best is trial 63 with value: 0.7309739795612015.[0m
[32m[I 2022-04-13 11:49:16,996][0m Trial 496 finished with value: 0.729697264326865 and parameters: {'alpha': 2.3287494079936213, 'ties': 'efron'}. Best is trial 63 with value: 0.7309739795612015.[0m
[32m[I 2022-04-13 11:49:17,325][0m Trial 497 finished with value: 0.729697264326865 and parameters: {'alpha': 2.4329056916081315, 'ties': 'efron'}. Best is trial 63 with value: 0.7309739795612015.[0m
[32m[I 2022-04-13 11:49:17,549][0m Trial 498 finished with value: 0.7246019901352241 and parameters: {'alpha': 2.759463024244158, 'ties': 'efron'}. Best is trial 63 with value: 0.7309739795612015.[0m
[32m[I 2022-04-13 11:49:17,755][0m Trial 499 finished with value: 0.7286259651218314 and parameters: {'alpha': 2.2523268090337236, 'ties': 'efron'}. Best is trial 63 with value: 0.7309739795612015.[0m
[32m[I 2022-04-13 11:49:18,007][0m Trial 500 finished with value: 0.729697264326865 and parameters: {'alpha': 2.3361620822445417, 'ties': 'efron'}. Best is trial 63 with value: 0.7309739795612015.[0m
[32m[I 2022-04-13 11:49:18,225][0m Trial 501 finished with value: 0.729697264326865 and parameters: {'alpha': 2.4164181747474323, 'ties': 'efron'}. Best is trial 63 with value: 0.7309739795612015.[0m
